sentence_good,sentence_bad,field,linguistics_term,UID,simple_LM_method,one_prefix_method,two_prefix_method,lexically_identical,pair_id,good_prob,bad_prob,correct
A lot of dancers cured this boy.,A lot of dancers cured this boys.,morphology,determiner_noun_agreement,determiner_noun_agreement_1,True,True,False,True,256,-59.62792205810547,-59.76566696166992,1
Tiffany hadn't distracted this patient.,Tiffany hadn't distracted this patients.,morphology,determiner_noun_agreement,determiner_noun_agreement_1,True,True,False,True,257,-67.30526733398438,-68.24609375,1
Students sell that rug.,Students sell that rugs.,morphology,determiner_noun_agreement,determiner_noun_agreement_1,True,True,False,True,258,-27.076751708984375,-31.511539459228516,1
Christopher concealed this art gallery.,Christopher concealed this art galleries.,morphology,determiner_noun_agreement,determiner_noun_agreement_1,True,True,False,True,259,-45.367469787597656,-44.575599670410156,0
These guys admired that school.,These guys admired that schools.,morphology,determiner_noun_agreement,determiner_noun_agreement_1,True,True,False,True,260,-32.7094841003418,-34.40559387207031,1
Rugs astound that association.,Rugs astound that associations.,morphology,determiner_noun_agreement,determiner_noun_agreement_1,True,True,False,True,261,-57.50876235961914,-58.15744400024414,1
Robert wasn't scaring these museums.,Robert wasn't scaring these museum.,morphology,determiner_noun_agreement,determiner_noun_agreement_1,True,True,False,True,262,-41.38966751098633,-41.49553680419922,1
Kendra investigates these ladies.,Kendra investigates these lady.,morphology,determiner_noun_agreement,determiner_noun_agreement_1,True,True,False,True,263,-59.14914321899414,-59.01685333251953,0
A lot of ladies arrive at that museum.,A lot of ladies arrive at that museums.,morphology,determiner_noun_agreement,determiner_noun_agreement_1,True,True,False,True,264,-53.32074737548828,-58.274696350097656,1
Some pedestrians drive to this movie theater.,Some pedestrians drive to this movie theaters.,morphology,determiner_noun_agreement,determiner_noun_agreement_1,True,True,False,True,265,-46.85668182373047,-48.397544860839844,1
Tonya hasn't remembered that brochure.,Tonya hasn't remembered that brochures.,morphology,determiner_noun_agreement,determiner_noun_agreement_1,True,True,False,True,266,-52.243404388427734,-51.66124725341797,0
Museums hadn't disturbed that patient.,Museums hadn't disturbed that patients.,morphology,determiner_noun_agreement,determiner_noun_agreement_1,True,True,False,True,267,-63.79124450683594,-63.73289108276367,0
Every person left that actress.,Every person left that actresses.,morphology,determiner_noun_agreement,determiner_noun_agreement_1,True,True,False,True,268,-29.791107177734375,-30.12005615234375,1
Sandra should disgust that actor.,Sandra should disgust that actors.,morphology,determiner_noun_agreement,determiner_noun_agreement_1,True,True,False,True,269,-59.660560607910156,-60.850616455078125,1
Amelia is disgusting these ladies.,Amelia is disgusting these lady.,morphology,determiner_noun_agreement,determiner_noun_agreement_1,True,True,False,True,270,-49.71098327636719,-50.25721740722656,1
Carla isn't taking those sketches.,Carla isn't taking those sketch.,morphology,determiner_noun_agreement,determiner_noun_agreement_1,True,True,False,True,271,-40.60654067993164,-41.558998107910156,1
Florence was investigating these actors.,Florence was investigating these actor.,morphology,determiner_noun_agreement,determiner_noun_agreement_1,True,True,False,True,272,-45.865234375,-46.44856262207031,1
Many cashiers disagree with those cashiers.,Many cashiers disagree with those cashier.,morphology,determiner_noun_agreement,determiner_noun_agreement_1,True,True,False,True,273,-61.98638916015625,-61.926422119140625,0
These committees argue about this commentary.,These committees argue about this commentaries.,morphology,determiner_noun_agreement,determiner_noun_agreement_1,True,True,False,True,274,-41.47563552856445,-48.17103576660156,1
Brian sees those horses.,Brian sees those horse.,morphology,determiner_noun_agreement,determiner_noun_agreement_1,True,True,False,True,275,-24.688697814941406,-27.55260467529297,1
Candice hasn't explored this art gallery.,Candice hasn't explored this art galleries.,morphology,determiner_noun_agreement,determiner_noun_agreement_1,True,True,False,True,276,-54.93428039550781,-54.696533203125,0
Aaron walks through those art galleries.,Aaron walks through those art gallery.,morphology,determiner_noun_agreement,determiner_noun_agreement_1,True,True,False,True,277,-40.7421875,-43.030696868896484,1
Some books alarm that cashier.,Some books alarm that cashiers.,morphology,determiner_noun_agreement,determiner_noun_agreement_1,True,True,False,True,278,-51.0640869140625,-51.168548583984375,1
Raymond wasn't kissing that guest.,Raymond wasn't kissing that guests.,morphology,determiner_noun_agreement,determiner_noun_agreement_1,True,True,False,True,279,-47.883087158203125,-48.11076354980469,1
Some cashier might boycott that art gallery.,Some cashier might boycott that art galleries.,morphology,determiner_noun_agreement,determiner_noun_agreement_1,True,True,False,True,280,-72.54421997070312,-72.47303771972656,0
Winston Churchill hadn't hidden this adult.,Winston Churchill hadn't hidden this adults.,morphology,determiner_noun_agreement,determiner_noun_agreement_1,True,True,False,True,281,-61.471473693847656,-59.838218688964844,0
Jennifer skates around this public park.,Jennifer skates around this public parks.,morphology,determiner_noun_agreement,determiner_noun_agreement_1,True,True,False,True,282,-46.82406997680664,-45.77216339111328,0
Ruth doesn't flee from those malls.,Ruth doesn't flee from those mall.,morphology,determiner_noun_agreement,determiner_noun_agreement_1,True,True,False,True,283,-58.98793029785156,-54.27004623413086,0
Some waiters have known those guests.,Some waiters have known those guest.,morphology,determiner_noun_agreement,determiner_noun_agreement_1,True,True,False,True,284,-50.86796569824219,-55.13594055175781,1
Patricia thinks about that legislature.,Patricia thinks about that legislatures.,morphology,determiner_noun_agreement,determiner_noun_agreement_1,True,True,False,True,285,-41.26817321777344,-42.033729553222656,1
Every patient shouldn't drive to these schools.,Every patient shouldn't drive to these school.,morphology,determiner_noun_agreement,determiner_noun_agreement_1,True,True,False,True,286,-42.99275207519531,-44.676429748535156,1
Most boys hadn't disagreed with those books.,Most boys hadn't disagreed with those book.,morphology,determiner_noun_agreement,determiner_noun_agreement_1,True,True,False,True,287,-47.452064514160156,-51.262508392333984,1
Mark fled from those guys.,Mark fled from those guy.,morphology,determiner_noun_agreement,determiner_noun_agreement_1,True,True,False,True,288,-27.225814819335938,-30.046001434326172,1
Grace should break these cups.,Grace should break these cup.,morphology,determiner_noun_agreement,determiner_noun_agreement_1,True,True,False,True,289,-37.57246017456055,-37.4952392578125,0
Carrie passes those restaurants.,Carrie passes those restaurant.,morphology,determiner_noun_agreement,determiner_noun_agreement_1,True,True,False,True,290,-37.591060638427734,-40.27510452270508,1
Anne was returning to these guys.,Anne was returning to these guy.,morphology,determiner_noun_agreement,determiner_noun_agreement_1,True,True,False,True,291,-26.765695571899414,-29.104564666748047,1
Craig could disturb those teenagers.,Craig could disturb those teenager.,morphology,determiner_noun_agreement,determiner_noun_agreement_1,True,True,False,True,292,-33.630916595458984,-38.16725540161133,1
Linda has this rabbit.,Linda has this rabbits.,morphology,determiner_noun_agreement,determiner_noun_agreement_1,True,True,False,True,293,-36.090370178222656,-37.4719123840332,1
Christopher does pass this hospital.,Christopher does pass this hospitals.,morphology,determiner_noun_agreement,determiner_noun_agreement_1,True,True,False,True,294,-33.63591766357422,-35.33946990966797,1
Mitchell wasn't embarrassing these adults.,Mitchell wasn't embarrassing these adult.,morphology,determiner_noun_agreement,determiner_noun_agreement_1,True,True,False,True,295,-52.00214385986328,-54.098148345947266,1
These senators clean these grocery stores.,These senators clean these grocery store.,morphology,determiner_noun_agreement,determiner_noun_agreement_1,True,True,False,True,296,-50.69316101074219,-52.28301239013672,1
Cynthia should complain about those actresses.,Cynthia should complain about those actress.,morphology,determiner_noun_agreement,determiner_noun_agreement_1,True,True,False,True,297,-65.8270263671875,-66.74173736572266,1
Curtis hasn't praised these boys.,Curtis hasn't praised these boy.,morphology,determiner_noun_agreement,determiner_noun_agreement_1,True,True,False,True,298,-58.97406005859375,-62.33628463745117,1
Florence listened to that patient.,Florence listened to that patients.,morphology,determiner_noun_agreement,determiner_noun_agreement_1,True,True,False,True,299,-41.29375457763672,-42.03403091430664,1
Jodi might break these chairs.,Jodi might break these chair.,morphology,determiner_noun_agreement,determiner_noun_agreement_1,True,True,False,True,300,-50.6011962890625,-51.859336853027344,1
Sherry forgot that play.,Sherry forgot that plays.,morphology,determiner_noun_agreement,determiner_noun_agreement_1,True,True,False,True,301,-45.69490051269531,-45.75770568847656,1
Clyde hasn't loved these boys.,Clyde hasn't loved these boy.,morphology,determiner_noun_agreement,determiner_noun_agreement_1,True,True,False,True,302,-59.71603012084961,-62.610267639160156,1
A lot of hats aggravate that legislature.,A lot of hats aggravate that legislatures.,morphology,determiner_noun_agreement,determiner_noun_agreement_1,True,True,False,True,303,-67.58714294433594,-67.58399963378906,0
Ellen will look like those prints.,Ellen will look like those print.,morphology,determiner_noun_agreement,determiner_noun_agreement_1,True,True,False,True,304,-39.91419982910156,-41.58850860595703,1
April wasn't examining those reports.,April wasn't examining those report.,morphology,determiner_noun_agreement,determiner_noun_agreement_1,True,True,False,True,305,-37.18913650512695,-39.959922790527344,1
Diana isn't selling that car.,Diana isn't selling that cars.,morphology,determiner_noun_agreement,determiner_noun_agreement_1,True,True,False,True,306,-44.754486083984375,-47.26649475097656,1
Christina knew this doctor.,Christina knew this doctors.,morphology,determiner_noun_agreement,determiner_noun_agreement_1,True,True,False,True,307,-31.389476776123047,-31.98857307434082,1
Catherine wouldn't research these universities.,Catherine wouldn't research these university.,morphology,determiner_noun_agreement,determiner_noun_agreement_1,True,True,False,True,308,-52.07762145996094,-54.442413330078125,1
Those customers weren't researching this government.,Those customers weren't researching this governments.,morphology,determiner_noun_agreement,determiner_noun_agreement_1,True,True,False,True,309,-43.12702941894531,-47.52979278564453,1
All doctors know that student.,All doctors know that students.,morphology,determiner_noun_agreement,determiner_noun_agreement_1,True,True,False,True,310,-31.746484756469727,-32.02995300292969,1
Tonya has insulted that play.,Tonya has insulted that plays.,morphology,determiner_noun_agreement,determiner_noun_agreement_1,True,True,False,True,311,-37.053096771240234,-36.97386169433594,0
Those documentaries were disagreeing with that lady.,Those documentaries were disagreeing with that ladies.,morphology,determiner_noun_agreement,determiner_noun_agreement_1,True,True,False,True,312,-53.10161590576172,-56.42833709716797,1
An organization had respected that doctor.,An organization had respected that doctors.,morphology,determiner_noun_agreement,determiner_noun_agreement_1,True,True,False,True,313,-43.23876953125,-42.951324462890625,0
Timothy explores this restaurant.,Timothy explores this restaurants.,morphology,determiner_noun_agreement,determiner_noun_agreement_1,True,True,False,True,314,-33.9316291809082,-38.139793395996094,1
Sarah hires this waiter.,Sarah hires this waiters.,morphology,determiner_noun_agreement,determiner_noun_agreement_1,True,True,False,True,315,-32.42826461791992,-40.97288131713867,1
Kendra exits this art gallery.,Kendra exits this art galleries.,morphology,determiner_noun_agreement,determiner_noun_agreement_1,True,True,False,True,316,-67.29722595214844,-67.07485961914062,0
Natalie concealed this hospital.,Natalie concealed this hospitals.,morphology,determiner_noun_agreement,determiner_noun_agreement_1,True,True,False,True,317,-44.57945251464844,-48.26697540283203,1
Amelia was impressing this company.,Amelia was impressing this companies.,morphology,determiner_noun_agreement,determiner_noun_agreement_1,True,True,False,True,318,-49.676780700683594,-52.516422271728516,1
Wendy hadn't scared that bank.,Wendy hadn't scared that banks.,morphology,determiner_noun_agreement,determiner_noun_agreement_1,True,True,False,True,319,-53.267845153808594,-54.82563018798828,1
Mark will cure those guys.,Mark will cure those guy.,morphology,determiner_noun_agreement,determiner_noun_agreement_1,True,True,False,True,320,-28.931779861450195,-31.56209373474121,1
Spain was describing those actors.,Spain was describing those actor.,morphology,determiner_noun_agreement,determiner_noun_agreement_1,True,True,False,True,321,-35.388267517089844,-35.738792419433594,1
Allison talked about those schools.,Allison talked about those school.,morphology,determiner_noun_agreement,determiner_noun_agreement_1,True,True,False,True,322,-33.20183563232422,-35.27717208862305,1
William buys those jackets.,William buys those jacket.,morphology,determiner_noun_agreement,determiner_noun_agreement_1,True,True,False,True,323,-31.6555233001709,-30.034412384033203,0
Timothy escaped from that cashier.,Timothy escaped from that cashiers.,morphology,determiner_noun_agreement,determiner_noun_agreement_1,True,True,False,True,324,-45.60661315917969,-45.49303436279297,0
Susan isn't fixing those couches.,Susan isn't fixing those couch.,morphology,determiner_noun_agreement,determiner_noun_agreement_1,True,True,False,True,325,-44.19526672363281,-35.713340759277344,0
Tonya boasts about this patient.,Tonya boasts about this patients.,morphology,determiner_noun_agreement,determiner_noun_agreement_1,True,True,False,True,326,-42.19211959838867,-42.91024398803711,1
Stephanie talked to those cashiers.,Stephanie talked to those cashier.,morphology,determiner_noun_agreement,determiner_noun_agreement_1,True,True,False,True,327,-50.856021881103516,-50.792720794677734,0
Those children describe those pedestrians.,Those children describe those pedestrian.,morphology,determiner_noun_agreement,determiner_noun_agreement_1,True,True,False,True,328,-36.81544876098633,-37.30890655517578,1
Sara would embarrass that guest.,Sara would embarrass that guests.,morphology,determiner_noun_agreement,determiner_noun_agreement_1,True,True,False,True,329,-51.135467529296875,-50.578208923339844,0
Rebecca complained about that brochure.,Rebecca complained about that brochures.,morphology,determiner_noun_agreement,determiner_noun_agreement_1,True,True,False,True,330,-47.13799285888672,-46.394561767578125,0
Amelia has thought about those horses.,Amelia has thought about those horse.,morphology,determiner_noun_agreement,determiner_noun_agreement_1,True,True,False,True,331,-44.393917083740234,-46.79048156738281,1
Those books were astounding that government.,Those books were astounding that governments.,morphology,determiner_noun_agreement,determiner_noun_agreement_1,True,True,False,True,332,-42.808685302734375,-46.10639190673828,1
Most waiters weren't watching that lady.,Most waiters weren't watching that ladies.,morphology,determiner_noun_agreement,determiner_noun_agreement_1,True,True,False,True,333,-49.811424255371094,-53.471473693847656,1
Alan had cleaned that plate.,Alan had cleaned that plates.,morphology,determiner_noun_agreement,determiner_noun_agreement_1,True,True,False,True,334,-31.304431915283203,-34.88837432861328,1
Benjamin cured that turtle.,Benjamin cured that turtles.,morphology,determiner_noun_agreement,determiner_noun_agreement_1,True,True,False,True,335,-41.534305572509766,-42.22046661376953,1
Melanie isn't scanning those reports.,Melanie isn't scanning those report.,morphology,determiner_noun_agreement,determiner_noun_agreement_1,True,True,False,True,336,-46.72820281982422,-49.41368865966797,1
Beverly is hiding this skirt.,Beverly is hiding this skirts.,morphology,determiner_noun_agreement,determiner_noun_agreement_1,True,True,False,True,337,-54.81621170043945,-58.278541564941406,1
Some waiter should praise that newspaper article.,Some waiter should praise that newspaper articles.,morphology,determiner_noun_agreement,determiner_noun_agreement_1,True,True,False,True,338,-58.901058197021484,-60.64805221557617,1
Janet helped these doctors.,Janet helped these doctor.,morphology,determiner_noun_agreement,determiner_noun_agreement_1,True,True,False,True,339,-37.60399627685547,-40.286720275878906,1
Judy impressed these universities.,Judy impressed these university.,morphology,determiner_noun_agreement,determiner_noun_agreement_1,True,True,False,True,340,-34.337074279785156,-35.83082580566406,1
The Impressionists complain about those children.,The Impressionists complain about those child.,morphology,determiner_noun_agreement,determiner_noun_agreement_1,True,True,False,True,341,-56.2536735534668,-60.0281982421875,1
The Clintons help these guys.,The Clintons help these guy.,morphology,determiner_noun_agreement,determiner_noun_agreement_1,True,True,False,True,342,-41.35911178588867,-44.040321350097656,1
These prints look like those art galleries.,These prints look like those art gallery.,morphology,determiner_noun_agreement,determiner_noun_agreement_1,True,True,False,True,343,-48.165985107421875,-50.201393127441406,1
Every picture looks like those scarves.,Every picture looks like those scarf.,morphology,determiner_noun_agreement,determiner_noun_agreement_1,True,True,False,True,344,-45.22028732299805,-40.323604583740234,0
Claire has researched that print.,Claire has researched that prints.,morphology,determiner_noun_agreement,determiner_noun_agreement_1,True,True,False,True,345,-45.07676696777344,-44.926475524902344,0
Roger isn't watching these teachers.,Roger isn't watching these teacher.,morphology,determiner_noun_agreement,determiner_noun_agreement_1,True,True,False,True,346,-31.923803329467773,-34.84088134765625,1
These patients exit these restaurants.,These patients exit these restaurant.,morphology,determiner_noun_agreement,determiner_noun_agreement_1,True,True,False,True,347,-36.55882263183594,-39.89934539794922,1
Stephanie wasn't talking to these cashiers.,Stephanie wasn't talking to these cashier.,morphology,determiner_noun_agreement,determiner_noun_agreement_1,True,True,False,True,348,-57.19590759277344,-56.785667419433594,0
Amelia was scanning those stories.,Amelia was scanning those story.,morphology,determiner_noun_agreement,determiner_noun_agreement_1,True,True,False,True,349,-44.50229263305664,-47.86625671386719,1
Some actor shouldn't care for those senators.,Some actor shouldn't care for those senator.,morphology,determiner_noun_agreement,determiner_noun_agreement_1,True,True,False,True,350,-50.00115203857422,-47.85243225097656,0
Kristin was embarrassing these waitresses.,Kristin was embarrassing these waitress.,morphology,determiner_noun_agreement,determiner_noun_agreement_1,True,True,False,True,351,-59.71381759643555,-48.73121643066406,0
Every committee should dislike those banks.,Every committee should dislike those bank.,morphology,determiner_noun_agreement,determiner_noun_agreement_1,True,True,False,True,352,-45.19936752319336,-46.22905349731445,1
Ruth couldn't scare these patients.,Ruth couldn't scare these patient.,morphology,determiner_noun_agreement,determiner_noun_agreement_1,True,True,False,True,353,-49.90381622314453,-51.90439987182617,1
Jerry isn't fixing these glasses.,Jerry isn't fixing these glass.,morphology,determiner_noun_agreement,determiner_noun_agreement_1,True,True,False,True,354,-35.653770446777344,-35.31793212890625,0
Katherine hasn't gone to these banks.,Katherine hasn't gone to these bank.,morphology,determiner_noun_agreement,determiner_noun_agreement_1,True,True,False,True,355,-47.68804168701172,-46.890602111816406,0
That report stuns this organization.,That report stuns this organizations.,morphology,determiner_noun_agreement,determiner_noun_agreement_1,True,True,False,True,356,-51.542564392089844,-54.25493621826172,1
Daniel conceals these waitresses.,Daniel conceals these waitress.,morphology,determiner_noun_agreement,determiner_noun_agreement_1,True,True,False,True,357,-53.27206039428711,-44.91537094116211,0
Stacey disturbed these doctors.,Stacey disturbed these doctor.,morphology,determiner_noun_agreement,determiner_noun_agreement_1,True,True,False,True,358,-47.82715606689453,-51.00344467163086,1
Some teenagers arrived at that bank.,Some teenagers arrived at that banks.,morphology,determiner_noun_agreement,determiner_noun_agreement_1,True,True,False,True,359,-35.86648178100586,-38.66780471801758,1
Jessica has this glove.,Jessica has this gloves.,morphology,determiner_noun_agreement,determiner_noun_agreement_1,True,True,False,True,360,-23.518138885498047,-23.35702896118164,0
Gerald researches that hospital.,Gerald researches that hospitals.,morphology,determiner_noun_agreement,determiner_noun_agreement_1,True,True,False,True,361,-55.90658950805664,-56.54827117919922,1
Julia might think about this waitress.,Julia might think about this waitresses.,morphology,determiner_noun_agreement,determiner_noun_agreement_1,True,True,False,True,362,-38.66712188720703,-48.24696731567383,1
Some pedestrian had worried that guest.,Some pedestrian had worried that guests.,morphology,determiner_noun_agreement,determiner_noun_agreement_1,True,True,False,True,363,-51.48834991455078,-51.578269958496094,1
Colleen did reveal those skirts.,Colleen did reveal those skirt.,morphology,determiner_noun_agreement,determiner_noun_agreement_1,True,True,False,True,364,-49.53323745727539,-49.49268341064453,0
All cashiers clean that snake.,All cashiers clean that snakes.,morphology,determiner_noun_agreement,determiner_noun_agreement_1,True,True,False,True,365,-51.17512130737305,-52.22597122192383,1
Those companies praise that actress.,Those companies praise that actresses.,morphology,determiner_noun_agreement,determiner_noun_agreement_1,True,True,False,True,366,-36.370033264160156,-36.254859924316406,0
Natalie isn't selling this nose.,Natalie isn't selling this noses.,morphology,determiner_noun_agreement,determiner_noun_agreement_1,True,True,False,True,367,-45.7335205078125,-48.81146240234375,1
Samuel will hurt that actor.,Samuel will hurt that actors.,morphology,determiner_noun_agreement,determiner_noun_agreement_1,True,True,False,True,368,-34.52803421020508,-36.02569580078125,1
Thomas has disturbed this boy.,Thomas has disturbed this boys.,morphology,determiner_noun_agreement,determiner_noun_agreement_1,True,True,False,True,369,-32.84864807128906,-34.95555114746094,1
Sally will pass these grocery stores.,Sally will pass these grocery store.,morphology,determiner_noun_agreement,determiner_noun_agreement_1,True,True,False,True,370,-57.46068572998047,-58.612762451171875,1
That convertible annoyed that company.,That convertible annoyed that companies.,morphology,determiner_noun_agreement,determiner_noun_agreement_1,True,True,False,True,371,-48.68452072143555,-48.73889923095703,1
Most guys see those dresses.,Most guys see those dress.,morphology,determiner_noun_agreement,determiner_noun_agreement_1,True,True,False,True,372,-31.792339324951172,-32.341949462890625,1
Most patients had forgotten those actors.,Most patients had forgotten those actor.,morphology,determiner_noun_agreement,determiner_noun_agreement_1,True,True,False,True,373,-42.40962219238281,-43.20326232910156,1
Most vases alarm that driver.,Most vases alarm that drivers.,morphology,determiner_noun_agreement,determiner_noun_agreement_1,True,True,False,True,374,-54.33110046386719,-53.27032470703125,0
This shirt astounded those senators.,This shirt astounded those senator.,morphology,determiner_noun_agreement,determiner_noun_agreement_1,True,True,False,True,375,-52.451229095458984,-51.68106460571289,0
Laura has attacked this teenager.,Laura has attacked this teenagers.,morphology,determiner_noun_agreement,determiner_noun_agreement_1,True,True,False,True,376,-31.69104766845703,-32.19398498535156,1
This senator might boycott that restaurant.,This senator might boycott that restaurants.,morphology,determiner_noun_agreement,determiner_noun_agreement_1,True,True,False,True,377,-56.160484313964844,-56.45061492919922,1
A lot of actors bother those teachers.,A lot of actors bother those teacher.,morphology,determiner_noun_agreement,determiner_noun_agreement_1,True,True,False,True,378,-53.34088134765625,-55.22151565551758,1
A banana embarrassed those actresses.,A banana embarrassed those actress.,morphology,determiner_noun_agreement,determiner_noun_agreement_1,True,True,False,True,379,-52.90851593017578,-54.016448974609375,1
That cucumber did confuse that boy.,That cucumber did confuse that boys.,morphology,determiner_noun_agreement,determiner_noun_agreement_1,True,True,False,True,380,-55.66508483886719,-57.20219802856445,1
Joseph isn't concealing these students.,Joseph isn't concealing these student.,morphology,determiner_noun_agreement,determiner_noun_agreement_1,True,True,False,True,381,-49.461387634277344,-52.407188415527344,1
Linda isn't discussing those waitresses.,Linda isn't discussing those waitress.,morphology,determiner_noun_agreement,determiner_noun_agreement_1,True,True,False,True,382,-61.46636962890625,-51.612213134765625,0
