sentence_good,sentence_bad,field,linguistics_term,UID,simple_LM_method,one_prefix_method,two_prefix_method,lexically_identical,pair_id,good_prob,bad_prob,correct
George climbed down many mountains.,George struggles many mountains.,syntax,argument_structure,transitive,True,False,True,False,574,-36.764469146728516,-36.5408821105957,0
Angela's grandfather found Steve.,Angela's grandfather shrugged Steve.,syntax,argument_structure,transitive,True,False,True,False,575,-40.118751525878906,-50.5213623046875,1
Becky's grandfather could lift cilantro.,Becky's grandfather could grin cilantro.,syntax,argument_structure,transitive,True,False,True,False,576,-60.453392028808594,-65.6284408569336,1
Kevin sounds like Katherine.,Kevin fell asleep Katherine.,syntax,argument_structure,transitive,True,False,True,False,577,-24.854061126708984,-29.564071655273438,1
The student's contractor was cleaning all spotlights.,The student's contractor was laughing all spotlights.,syntax,argument_structure,transitive,True,False,True,False,578,-71.25457763671875,-70.1119384765625,0
These sons of Danielle worry Adam.,These sons of Danielle fall asleep Adam.,syntax,argument_structure,transitive,True,False,True,False,579,-53.89501953125,-56.938236236572266,1
Jacqueline was astounding some boys.,Jacqueline was escaping some boys.,syntax,argument_structure,transitive,True,False,True,False,580,-52.219940185546875,-48.319740295410156,0
Alicia heals Jessica's mentors.,Alicia complained Jessica's mentors.,syntax,argument_structure,transitive,True,False,True,False,581,-73.21347045898438,-72.25784301757812,0
Judy loves all customers.,Judy shouts all customers.,syntax,argument_structure,transitive,True,False,True,False,582,-35.41835021972656,-39.808502197265625,1
Michelle fixes the glasses.,Michelle murmurs the glasses.,syntax,argument_structure,transitive,True,False,True,False,583,-32.98055648803711,-41.93616485595703,1
Kristen talks to the actresses' mentees.,Kristen waved the actresses' mentees.,syntax,argument_structure,transitive,True,False,True,False,584,-66.02055358886719,-65.69161987304688,0
Jacqueline did know Donna's daughters.,Jacqueline did fall asleep Donna's daughters.,syntax,argument_structure,transitive,True,False,True,False,585,-59.77638244628906,-68.27884674072266,1
James's nephew insults every documentary.,James's nephew weeps every documentary.,syntax,argument_structure,transitive,True,False,True,False,586,-48.73954772949219,-50.6778564453125,1
Ruth brought cafes.,Ruth concurred cafes.,syntax,argument_structure,transitive,True,False,True,False,587,-45.02259826660156,-57.353729248046875,1
Tina's teacher talks about Deanna.,Tina's teacher suffered Deanna.,syntax,argument_structure,transitive,True,False,True,False,588,-62.45857238769531,-65.91368103027344,1
This lady exited a hill.,This lady blinked a hill.,syntax,argument_structure,transitive,True,False,True,False,589,-35.86958312988281,-43.282283782958984,1
Sharon's oncologists have boasted about Sara's son.,Sharon's oncologists have coped Sara's son.,syntax,argument_structure,transitive,True,False,True,False,590,-86.68473815917969,-86.69149017333984,1
Donald has remembered the hospital.,Donald has wept the hospital.,syntax,argument_structure,transitive,True,False,True,False,591,-30.16508674621582,-40.13552474975586,1
Wendy can fix some forks.,Wendy can shrug some forks.,syntax,argument_structure,transitive,True,False,True,False,592,-43.01200866699219,-54.95530319213867,1
The daughter of Rachelle discovered these windows.,The daughter of Rachelle slumps over these windows.,syntax,argument_structure,transitive,True,False,True,False,593,-56.82762908935547,-70.4920654296875,1
Walter's grandsons skate around some glacier.,Walter's grandsons react some glacier.,syntax,argument_structure,transitive,True,False,True,False,594,-76.33026885986328,-69.98063659667969,0
Sandra is attacking those daughters of Gregory.,Sandra is smiling those daughters of Gregory.,syntax,argument_structure,transitive,True,False,True,False,595,-63.42486572265625,-65.82744598388672,1
A face stunned this cashier.,A face fell this cashier.,syntax,argument_structure,transitive,True,False,True,False,596,-63.067237854003906,-61.78034591674805,0
The Impressionists conceal all essays about the Balkans.,The Impressionists coped all essays about the Balkans.,syntax,argument_structure,transitive,True,False,True,False,597,-86.64437866210938,-93.54388427734375,1
These nephews of Donald skate around all museums.,These nephews of Donald shrug all museums.,syntax,argument_structure,transitive,True,False,True,False,598,-65.44541931152344,-66.59606170654297,1
Michael is finding some cup.,Michael is sighing some cup.,syntax,argument_structure,transitive,True,False,True,False,599,-31.66827964782715,-41.90135192871094,1
Karen's friends could complain about Jane's partner.,Karen's friends could cope Jane's partner.,syntax,argument_structure,transitive,True,False,True,False,600,-68.58702850341797,-71.33206176757812,1
John approached Randolf's oncologist.,John grinned Randolf's oncologist.,syntax,argument_structure,transitive,True,False,True,False,601,-67.62464904785156,-68.1939468383789,1
The grandmothers of Beverly boycott a grocery store.,The grandmothers of Beverly muttered a grocery store.,syntax,argument_structure,transitive,True,False,True,False,602,-75.30278778076172,-77.39359283447266,1
Peter hasn't worn a lot of skirts.,Peter hasn't complained a lot of skirts.,syntax,argument_structure,transitive,True,False,True,False,603,-37.90199279785156,-45.22802734375,1
The students boycott movie theaters.,The students come here movie theaters.,syntax,argument_structure,transitive,True,False,True,False,604,-51.045108795166016,-46.11911392211914,0
All dancers did bike to the rivers.,All dancers did nod the rivers.,syntax,argument_structure,transitive,True,False,True,False,605,-46.50550842285156,-48.34016036987305,1
Some guys love Clyde.,Some guys come here Clyde.,syntax,argument_structure,transitive,True,False,True,False,606,-31.915176391601562,-36.90846633911133,1
Samuel would escape from a waitress.,Samuel would escape a waitress.,syntax,argument_structure,transitive,True,False,True,False,607,-42.37126922607422,-40.61369323730469,0
Alan had returned to Joel.,Alan had shrugged Joel.,syntax,argument_structure,transitive,True,False,True,False,608,-29.738567352294922,-40.94012451171875,1
Kevin had talked about this public park.,Kevin had screamed this public park.,syntax,argument_structure,transitive,True,False,True,False,609,-38.50642776489258,-45.1865234375,1
The beef isn't annoying Teresa.,The beef isn't falling Teresa.,syntax,argument_structure,transitive,True,False,True,False,610,-42.06669616699219,-41.603004455566406,0
All fathers of Dawn investigate the senator.,All fathers of Dawn lied the senator.,syntax,argument_structure,transitive,True,False,True,False,611,-54.710182189941406,-58.250823974609375,1
Rachel's tutors worry children.,Rachel's tutors sighed children.,syntax,argument_structure,transitive,True,False,True,False,612,-49.39463806152344,-51.59421920776367,1
Lawrence sounds like those nieces of Winston Churchill.,Lawrence slumped over those nieces of Winston Churchill.,syntax,argument_structure,transitive,True,False,True,False,613,-74.9871597290039,-87.23165893554688,1
Rachel saw Jill's tutor.,Rachel lied Jill's tutor.,syntax,argument_structure,transitive,True,False,True,False,614,-36.36213684082031,-41.5797119140625,1
Renee's lawyer fires Benjamin.,Renee's lawyer suffers Benjamin.,syntax,argument_structure,transitive,True,False,True,False,615,-50.50975799560547,-50.65753173828125,1
Marla thought about Walter.,Marla blinks Walter.,syntax,argument_structure,transitive,True,False,True,False,616,-33.28193283081055,-45.86903381347656,1
Every bank concealed those sons of Andrea.,Every bank joked around those sons of Andrea.,syntax,argument_structure,transitive,True,False,True,False,617,-60.61125946044922,-70.6743392944336,1
This guest had referenced some sister of Irene.,This guest had smiled some sister of Irene.,syntax,argument_structure,transitive,True,False,True,False,618,-71.2601547241211,-74.33885192871094,1
Craig's piano teachers shouldn't have ladders.,Craig's piano teachers shouldn't talk ladders.,syntax,argument_structure,transitive,True,False,True,False,619,-55.31491470336914,-61.54951477050781,1
The pedestrians' boss kisses Rhonda's associate.,The pedestrians' boss negotiates Rhonda's associate.,syntax,argument_structure,transitive,True,False,True,False,620,-85.64608764648438,-98.30493927001953,1
Linda wouldn't boycott every organization.,Linda wouldn't slump over every organization.,syntax,argument_structure,transitive,True,False,True,False,621,-58.956878662109375,-65.29730224609375,1
Jessica's guests hide the waiter.,Jessica's guests die the waiter.,syntax,argument_structure,transitive,True,False,True,False,622,-40.5916748046875,-45.20271682739258,1
That granddaughter of Rachel couldn't exit those public parks.,That granddaughter of Rachel couldn't chuckle those public parks.,syntax,argument_structure,transitive,True,False,True,False,623,-74.17219543457031,-79.33529663085938,1
Regina's nephew had exited some libraries.,Regina's nephew had screamed some libraries.,syntax,argument_structure,transitive,True,False,True,False,624,-63.06370162963867,-62.27534866333008,0
This child's father hasn't cared for these teachers.,This child's father hasn't died these teachers.,syntax,argument_structure,transitive,True,False,True,False,625,-49.15842056274414,-53.15797424316406,1
Tiffany shouldn't bother Bethany's electricians.,Tiffany shouldn't die Bethany's electricians.,syntax,argument_structure,transitive,True,False,True,False,626,-91.17073059082031,-92.77680206298828,1
Donna hasn't questioned Theresa.,Donna hasn't died Theresa.,syntax,argument_structure,transitive,True,False,True,False,627,-44.826229095458984,-42.46601104736328,0
A lot of blouses weren't distracting Galileo.,A lot of blouses weren't falling Galileo.,syntax,argument_structure,transitive,True,False,True,False,628,-77.3759765625,-70.82720184326172,0
Those dancers haven't looked like those pictures.,Those dancers haven't come here those pictures.,syntax,argument_structure,transitive,True,False,True,False,629,-44.25688934326172,-47.69445037841797,1
Tonya loved Joel's daughter.,Tonya speaks up Joel's daughter.,syntax,argument_structure,transitive,True,False,True,False,630,-41.35563659667969,-51.63779067993164,1
Scott hadn't ascended this ladder.,Scott hadn't boasted this ladder.,syntax,argument_structure,transitive,True,False,True,False,631,-42.594635009765625,-45.180419921875,1
Nina talks to Melissa's student.,Nina mutters Melissa's student.,syntax,argument_structure,transitive,True,False,True,False,632,-51.192054748535156,-61.931739807128906,1
Elaine hasn't noticed Paula's contractors.,Elaine hasn't concurred Paula's contractors.,syntax,argument_structure,transitive,True,False,True,False,633,-59.395782470703125,-78.77992248535156,1
The mirror alarmed that university.,The mirror falls that university.,syntax,argument_structure,transitive,True,False,True,False,634,-43.415443420410156,-40.515167236328125,0
Connie won't exit these college campuses.,Connie won't speak up these college campuses.,syntax,argument_structure,transitive,True,False,True,False,635,-52.583980560302734,-55.38532257080078,1
Randolf didn't research the pictures of Wendy.,Randolf didn't talk the pictures of Wendy.,syntax,argument_structure,transitive,True,False,True,False,636,-58.25948715209961,-54.97002410888672,0
This sister of Paul has all schools.,This sister of Paul compromises all schools.,syntax,argument_structure,transitive,True,False,True,False,637,-44.69426345825195,-55.41482925415039,1
The granddaughter of Kevin noticed Sheila.,The granddaughter of Kevin concurs Sheila.,syntax,argument_structure,transitive,True,False,True,False,638,-50.03837585449219,-59.978782653808594,1
The Borgias sound like this hospital.,The Borgias go fishing this hospital.,syntax,argument_structure,transitive,True,False,True,False,639,-56.93810272216797,-59.58586883544922,1
Sharon won't discover many people.,Sharon won't escape many people.,syntax,argument_structure,transitive,True,False,True,False,640,-37.04078674316406,-36.51914978027344,0
Teresa couldn't wear this shoe.,Teresa couldn't fall asleep this shoe.,syntax,argument_structure,transitive,True,False,True,False,641,-43.78608703613281,-53.49553680419922,1
Lucille had healed Donna.,Lucille had gone fishing Donna.,syntax,argument_structure,transitive,True,False,True,False,642,-46.13013458251953,-45.19050598144531,0
Sally had worked with a teacher.,Sally had shrugged a teacher.,syntax,argument_structure,transitive,True,False,True,False,643,-43.02165985107422,-53.77595520019531,1
Eva might boycott every art gallery.,Eva might concur every art gallery.,syntax,argument_structure,transitive,True,False,True,False,644,-58.216373443603516,-61.31678009033203,1
Aaron hugged many customers' boss.,Aaron copes many customers' boss.,syntax,argument_structure,transitive,True,False,True,False,645,-51.60791015625,-57.700843811035156,1
Jacqueline's French teacher had hated Cheryl's mother.,Jacqueline's French teacher had disagreed Cheryl's mother.,syntax,argument_structure,transitive,True,False,True,False,646,-77.33676147460938,-82.17668151855469,1
Donald's sisters didn't fix most computers.,Donald's sisters didn't confer most computers.,syntax,argument_structure,transitive,True,False,True,False,647,-46.090904235839844,-55.76097106933594,1
All guys buy that box.,All guys testify that box.,syntax,argument_structure,transitive,True,False,True,False,648,-30.413196563720703,-38.864315032958984,1
Curtis wasn't climbing up most mountains.,Curtis wasn't screaming most mountains.,syntax,argument_structure,transitive,True,False,True,False,649,-63.88182067871094,-62.965415954589844,0
Most cashiers resemble every sketch of Helen.,Most cashiers grin every sketch of Helen.,syntax,argument_structure,transitive,True,False,True,False,650,-72.51847839355469,-79.77924346923828,1
Jessica appreciates science.,Jessica came here science.,syntax,argument_structure,transitive,True,False,True,False,651,-28.65951919555664,-25.37909507751465,0
Ann's senators discuss Judy.,Ann's senators boast Judy.,syntax,argument_structure,transitive,True,False,True,False,652,-54.01398849487305,-57.435813903808594,1
Many waitresses skate around some mountain.,Many waitresses suffer some mountain.,syntax,argument_structure,transitive,True,False,True,False,653,-56.93558120727539,-54.19502258300781,0
Alicia's piano teachers could conceal this fish.,Alicia's piano teachers could concur this fish.,syntax,argument_structure,transitive,True,False,True,False,654,-83.59291076660156,-91.62899780273438,1
Renee's lawyers sell many hospitals.,Renee's lawyers struggle many hospitals.,syntax,argument_structure,transitive,True,False,True,False,655,-52.32000732421875,-56.82435607910156,1
Melissa couldn't buy that shawl.,Melissa couldn't mutter that shawl.,syntax,argument_structure,transitive,True,False,True,False,656,-49.254425048828125,-64.91204833984375,1
Diane has questioned a lot of boys.,Diane has died a lot of boys.,syntax,argument_structure,transitive,True,False,True,False,657,-48.59727478027344,-46.86505126953125,0
A lot of pictures looked like that bicycle.,A lot of pictures fell that bicycle.,syntax,argument_structure,transitive,True,False,True,False,658,-55.4007568359375,-57.00376892089844,1
Erin hadn't cleaned some couch.,Erin hadn't compromised some couch.,syntax,argument_structure,transitive,True,False,True,False,659,-41.314605712890625,-48.56488037109375,1
Some boy was concealing Heidi.,Some boy was chuckling Heidi.,syntax,argument_structure,transitive,True,False,True,False,660,-51.43421173095703,-46.31435775756836,0
Chad's son knows Guy's best friends.,Chad's son nodded Guy's best friends.,syntax,argument_structure,transitive,True,False,True,False,661,-59.54936981201172,-65.57066345214844,1
Those newspaper articles about science look like that picture of Frank.,Those newspaper articles about science fall that picture of Frank.,syntax,argument_structure,transitive,True,False,True,False,662,-76.98710632324219,-77.06027221679688,1
Colleen's associate was concealing every print of that person.,Colleen's associate was disagreeing every print of that person.,syntax,argument_structure,transitive,True,False,True,False,663,-89.77783203125,-88.28487396240234,0
Tanya's bosses clean the cafes.,Tanya's bosses complain the cafes.,syntax,argument_structure,transitive,True,False,True,False,664,-61.66419982910156,-70.38389587402344,1
The boys embarrasses Paula.,The boys concur Paula.,syntax,argument_structure,transitive,True,False,True,False,665,-45.87353515625,-40.95293426513672,0
Ella could buy some car.,Ella could talk some car.,syntax,argument_structure,transitive,True,False,True,False,666,-35.71696472167969,-42.4240608215332,1
Regina hadn't approached Rhonda's handyman.,Regina hadn't wept Rhonda's handyman.,syntax,argument_structure,transitive,True,False,True,False,667,-79.37393188476562,-84.97908020019531,1
Danielle had disliked Andrew.,Danielle had blinked Andrew.,syntax,argument_structure,transitive,True,False,True,False,668,-47.797550201416016,-49.61344528198242,1
Renee's friend investigated Jill.,Renee's friend boasts Jill.,syntax,argument_structure,transitive,True,False,True,False,669,-48.957969665527344,-52.780601501464844,1
Some pedestrians disagree with Irene.,Some pedestrians flirt Irene.,syntax,argument_structure,transitive,True,False,True,False,670,-50.79611587524414,-51.00699996948242,1
Tina won't remember Bill.,Tina won't smile Bill.,syntax,argument_structure,transitive,True,False,True,False,671,-47.49690628051758,-49.81452941894531,1
Every son of Sheila is questioning Kirsten.,Every son of Sheila is falling asleep Kirsten.,syntax,argument_structure,transitive,True,False,True,False,672,-54.65121841430664,-58.41830062866211,1
Vanessa's lawyers hurt Jessica's grandfathers.,Vanessa's lawyers muttered Jessica's grandfathers.,syntax,argument_structure,transitive,True,False,True,False,673,-68.0090103149414,-78.05646514892578,1
Tiffany isn't appreciating Stacey.,Tiffany isn't grinning Stacey.,syntax,argument_structure,transitive,True,False,True,False,674,-76.29727172851562,-75.41903686523438,0
Matt's dermatologists boycott some hospital.,Matt's dermatologists react some hospital.,syntax,argument_structure,transitive,True,False,True,False,675,-70.69071197509766,-61.67679214477539,0
Naomi didn't conceal Candice.,Naomi didn't speak up Candice.,syntax,argument_structure,transitive,True,False,True,False,676,-53.92325210571289,-54.13275909423828,1
Timothy's ex-wives questioned Rose.,Timothy's ex-wives retaliated Rose.,syntax,argument_structure,transitive,True,False,True,False,677,-56.588768005371094,-67.78553771972656,1
Ruth returned to Marie.,Ruth fell Marie.,syntax,argument_structure,transitive,True,False,True,False,678,-43.599830627441406,-42.426734924316406,0
Colleen leaves Larry.,Colleen laughed Larry.,syntax,argument_structure,transitive,True,False,True,False,679,-36.24272155761719,-37.77833557128906,1
Some government couldn't conceal Charles.,Some government couldn't conspire Charles.,syntax,argument_structure,transitive,True,False,True,False,680,-41.868247985839844,-54.2515869140625,1
Those senators' tutors stun all sisters of all boys.,Those senators' tutors shrugged all sisters of all boys.,syntax,argument_structure,transitive,True,False,True,False,681,-92.99578857421875,-97.95281982421875,1
This projector alarms all waiters' husband.,This projector falls all waiters' husband.,syntax,argument_structure,transitive,True,False,True,False,682,-72.05180358886719,-71.09866333007812,0
Veronica's associates hadn't run around that river.,Veronica's associates hadn't muttered that river.,syntax,argument_structure,transitive,True,False,True,False,683,-62.71359634399414,-71.68043518066406,1
That grandmother of Wayne can't return to a lot of sisters of Bill.,That grandmother of Wayne can't talk a lot of sisters of Bill.,syntax,argument_structure,transitive,True,False,True,False,684,-85.67379760742188,-84.8011245727539,0
Meredith had irritated Tonya.,Meredith had fallen Tonya.,syntax,argument_structure,transitive,True,False,True,False,685,-60.75364303588867,-55.56612777709961,0
This shoe scared Vincent's handymen.,This shoe fell Vincent's handymen.,syntax,argument_structure,transitive,True,False,True,False,686,-60.51835632324219,-58.18836975097656,0
Many companies hate Galileo.,Many companies negotiate Galileo.,syntax,argument_structure,transitive,True,False,True,False,687,-30.800548553466797,-35.87974166870117,1
Some fathers of Carolyn described Eric.,Some fathers of Carolyn reply Eric.,syntax,argument_structure,transitive,True,False,True,False,688,-53.163936614990234,-57.56053924560547,1
Some ladies reveal Colleen's mentee.,Some ladies struggled Colleen's mentee.,syntax,argument_structure,transitive,True,False,True,False,689,-76.27831268310547,-78.62833404541016,1
That pedestrian hadn't cured Brian.,That pedestrian hadn't murmured Brian.,syntax,argument_structure,transitive,True,False,True,False,690,-55.093650817871094,-63.305362701416016,1
Some prints have annoyed Scott.,Some prints have fallen Scott.,syntax,argument_structure,transitive,True,False,True,False,691,-43.24374771118164,-37.846885681152344,0
That apple hasn't disgusted Natalie.,That apple hasn't rotted Natalie.,syntax,argument_structure,transitive,True,False,True,False,692,-50.23392105102539,-56.472381591796875,1
Tina has broken a bicycle.,Tina has grinned a bicycle.,syntax,argument_structure,transitive,True,False,True,False,693,-46.27717208862305,-57.355018615722656,1
The organization aggravates Carrie's mother.,The organization replies Carrie's mother.,syntax,argument_structure,transitive,True,False,True,False,694,-53.21832275390625,-51.69978332519531,0
Russell's mentees wouldn't drop by restaurants.,Russell's mentees wouldn't weep restaurants.,syntax,argument_structure,transitive,True,False,True,False,695,-60.91718292236328,-58.969810485839844,0
Nicole's French teachers notice that drawing.,Nicole's French teachers cooperated that drawing.,syntax,argument_structure,transitive,True,False,True,False,696,-60.65673828125,-70.28437805175781,1
Donald's plumbers discover Diane.,Donald's plumbers go fishing Diane.,syntax,argument_structure,transitive,True,False,True,False,697,-53.150630950927734,-53.34221649169922,1
Joseph knew Cynthia's grandmothers.,Joseph concurs Cynthia's grandmothers.,syntax,argument_structure,transitive,True,False,True,False,698,-45.31315994262695,-59.13552474975586,1
Chad's niece isn't cleaning some hat.,Chad's niece isn't littering some hat.,syntax,argument_structure,transitive,True,False,True,False,699,-66.71756744384766,-76.56965637207031,1
Nicole cured Jacqueline's brother.,Nicole shrugs Jacqueline's brother.,syntax,argument_structure,transitive,True,False,True,False,700,-54.717918395996094,-67.68693542480469,1
Apples disgust Tiffany.,Apples fell Tiffany.,syntax,argument_structure,transitive,True,False,True,False,701,-33.60881042480469,-34.898521423339844,1
A son of this guest couldn't examine Kenneth's niece.,A son of this guest couldn't joke around Kenneth's niece.,syntax,argument_structure,transitive,True,False,True,False,702,-83.39244079589844,-87.3421859741211,1
The children hadn't sounded like Teresa.,The children hadn't cooperated Teresa.,syntax,argument_structure,transitive,True,False,True,False,703,-43.6484375,-50.58035659790039,1
Tiffany has returned to Guy.,Tiffany has complained Guy.,syntax,argument_structure,transitive,True,False,True,False,704,-57.067962646484375,-62.140621185302734,1
Vincent argued about the cousin of James.,Vincent testifies the cousin of James.,syntax,argument_structure,transitive,True,False,True,False,705,-61.70207977294922,-69.03508758544922,1
Elaine won't walk through every closet.,Elaine won't lie every closet.,syntax,argument_structure,transitive,True,False,True,False,706,-47.34034729003906,-46.22593688964844,0
Lisa wasn't returning to Diana.,Lisa wasn't dying Diana.,syntax,argument_structure,transitive,True,False,True,False,707,-31.238882064819336,-30.971179962158203,0
Liam was finding malls.,Liam was murmuring malls.,syntax,argument_structure,transitive,True,False,True,False,708,-47.60646057128906,-56.730621337890625,1
Some hamsters embarrass most actors.,Some hamsters came here most actors.,syntax,argument_structure,transitive,True,False,True,False,709,-49.57050323486328,-50.28078079223633,1
Sonia skated around those malls.,Sonia compromises those malls.,syntax,argument_structure,transitive,True,False,True,False,710,-62.70793533325195,-56.72398376464844,0
That ice cream has resembled all pictures of Heather.,That ice cream has fallen all pictures of Heather.,syntax,argument_structure,transitive,True,False,True,False,711,-66.18052673339844,-58.57181167602539,0
These grandsons of Michelle biked to most schools.,These grandsons of Michelle chuckle most schools.,syntax,argument_structure,transitive,True,False,True,False,712,-82.3654556274414,-70.81696319580078,0
Emily likes that painting.,Emily wept that painting.,syntax,argument_structure,transitive,True,False,True,False,713,-21.199710845947266,-32.63995361328125,1
Gregory cleaned cups.,Gregory littered cups.,syntax,argument_structure,transitive,True,False,True,False,714,-31.632753372192383,-35.02122497558594,1
Every customer researches all stories about literature.,Every customer screamed all stories about literature.,syntax,argument_structure,transitive,True,False,True,False,715,-63.53129577636719,-55.271385192871094,0
Most hospitals hire the dancers.,Most hospitals lied the dancers.,syntax,argument_structure,transitive,True,False,True,False,716,-36.02505874633789,-39.7042236328125,1
