sentence_good,sentence_bad,field,linguistics_term,UID,simple_LM_method,one_prefix_method,two_prefix_method,lexically_identical,pair_id,good_prob,bad_prob,correct
Amanda was respected by some waitresses.,Amanda was respected by some picture.,syntax,s-selection,animate_subject_passive,True,True,False,False,0,-57.900909423828125,-43.66987991333008,0
Some lake was passed by some cashiers.,Some lake was passed by some phenomena.,syntax,s-selection,animate_subject_passive,True,True,False,False,1,-55.73181915283203,-49.720577239990234,0
Lisa was kissed by the boys.,Lisa was kissed by the blouses.,syntax,s-selection,animate_subject_passive,True,True,False,False,2,-26.997026443481445,-38.1100959777832,1
Amanda isn't respected by the children.,Amanda isn't respected by the cups.,syntax,s-selection,animate_subject_passive,True,True,False,False,3,-41.94547653198242,-48.877445220947266,1
The glove was noticed by some woman.,The glove was noticed by some mouse.,syntax,s-selection,animate_subject_passive,True,True,False,False,4,-42.437843322753906,-45.64646530151367,1
Gerald is hated by the teachers.,Gerald is hated by the pie.,syntax,s-selection,animate_subject_passive,True,True,False,False,5,-48.67756652832031,-49.56548309326172,1
Most actresses weren't discussed by some offspring.,Most actresses weren't discussed by some ladder.,syntax,s-selection,animate_subject_passive,True,True,False,False,6,-52.33139419555664,-52.95311737060547,1
These students were talked about by the teacher.,These students were talked about by the books.,syntax,s-selection,animate_subject_passive,True,True,False,False,7,-40.139949798583984,-37.80046844482422,0
Deborah was talked to by the teacher.,Deborah was talked to by the ellipses.,syntax,s-selection,animate_subject_passive,True,True,False,False,8,-48.48623275756836,-70.50880432128906,1
Cafes were cleaned by some lady.,Cafes were cleaned by some hat.,syntax,s-selection,animate_subject_passive,True,True,False,False,9,-58.263004302978516,-59.23684310913086,1
Patricia is referenced by some offspring.,Patricia is referenced by some shawl.,syntax,s-selection,animate_subject_passive,True,True,False,False,10,-48.967926025390625,-60.67771530151367,1
Galileo is concealed by the woman.,Galileo is concealed by the horse.,syntax,s-selection,animate_subject_passive,True,True,False,False,11,-51.70185089111328,-52.20258331298828,1
A lot of high schools aren't visited by some teachers.,A lot of high schools aren't visited by some socks.,syntax,s-selection,animate_subject_passive,True,True,False,False,12,-67.53717803955078,-69.9217300415039,1
Andrew was questioned by some pedestrian.,Andrew was questioned by some apple.,syntax,s-selection,animate_subject_passive,True,True,False,False,13,-42.4080924987793,-40.12615203857422,0
A lot of computers aren't bought by the senators.,A lot of computers aren't bought by the gate.,syntax,s-selection,animate_subject_passive,True,True,False,False,14,-63.27317810058594,-59.01420211791992,0
Those schools are cleaned by the customers.,Those schools are cleaned by the socks.,syntax,s-selection,animate_subject_passive,True,True,False,False,15,-36.22682189941406,-38.16347885131836,1
Chad wasn't forgotten by the teacher.,Chad wasn't forgotten by the brochure.,syntax,s-selection,animate_subject_passive,True,True,False,False,16,-44.46540832519531,-55.949222564697266,1
Deanna was hired by the offspring.,Deanna was hired by the candles.,syntax,s-selection,animate_subject_passive,True,True,False,False,17,-45.48346710205078,-44.6954345703125,0
Lisa wasn't cured by the ladies.,Lisa wasn't cured by the deer.,syntax,s-selection,animate_subject_passive,True,True,False,False,18,-36.47044372558594,-38.63191223144531,1
Valerie was hugged by the pedestrian.,Valerie was hugged by the diagnoses.,syntax,s-selection,animate_subject_passive,True,True,False,False,19,-55.72908020019531,-57.79627227783203,1
Nina isn't escaped from by some customer.,Nina isn't escaped from by some movies.,syntax,s-selection,animate_subject_passive,True,True,False,False,20,-67.43131256103516,-61.72148132324219,0
A lot of mountains were ascended by the customer.,A lot of mountains were ascended by the dog.,syntax,s-selection,animate_subject_passive,True,True,False,False,21,-62.014259338378906,-59.23514938354492,0
Tamara was praised by some waitress.,Tamara was praised by some cups.,syntax,s-selection,animate_subject_passive,True,True,False,False,22,-49.89641571044922,-48.52680969238281,0
William is discovered by some students.,William is discovered by some pie.,syntax,s-selection,animate_subject_passive,True,True,False,False,23,-36.03651428222656,-40.09654235839844,1
Mitchell was remembered by some men.,Mitchell was remembered by some jacket.,syntax,s-selection,animate_subject_passive,True,True,False,False,24,-48.37969970703125,-52.127403259277344,1
Rachel isn't investigated by the dancer.,Rachel isn't investigated by the books.,syntax,s-selection,animate_subject_passive,True,True,False,False,25,-38.178062438964844,-35.05918884277344,0
Grace was returned to by some cashiers.,Grace was returned to by some theses.,syntax,s-selection,animate_subject_passive,True,True,False,False,26,-58.89229965209961,-60.67131042480469,1
Michael is loved by some offspring.,Michael is loved by some bicycle.,syntax,s-selection,animate_subject_passive,True,True,False,False,27,-41.397865295410156,-40.055423736572266,0
Nancy wasn't attacked by some actor.,Nancy wasn't attacked by some screens.,syntax,s-selection,animate_subject_passive,True,True,False,False,28,-55.251792907714844,-55.36534118652344,1
That company wasn't questioned by the customer.,That company wasn't questioned by the face.,syntax,s-selection,animate_subject_passive,True,True,False,False,29,-47.654457092285156,-46.29862976074219,0
Jill isn't returned to by the doctors.,Jill isn't returned to by the sock.,syntax,s-selection,animate_subject_passive,True,True,False,False,30,-58.21682357788086,-62.0484504699707,1
Ruth was listened to by the senator.,Ruth was listened to by the phenomena.,syntax,s-selection,animate_subject_passive,True,True,False,False,31,-58.95777130126953,-60.46315383911133,1
Sabrina was listened to by some adult.,Sabrina was listened to by some organization.,syntax,s-selection,animate_subject_passive,True,True,False,False,32,-52.821651458740234,-49.852500915527344,0
That library was toured by the dancers.,That library was toured by the apples.,syntax,s-selection,animate_subject_passive,True,True,False,False,33,-47.99237823486328,-48.79523468017578,1
Rose isn't seen by the waiters.,Rose isn't seen by the spotlights.,syntax,s-selection,animate_subject_passive,True,True,False,False,34,-45.08430099487305,-46.233070373535156,1
All closets were bought by the patient.,All closets were bought by the peppers.,syntax,s-selection,animate_subject_passive,True,True,False,False,35,-47.75672149658203,-49.01604080200195,1
Randolf was cared for by the waiter.,Randolf was cared for by the drawing.,syntax,s-selection,animate_subject_passive,True,True,False,False,36,-53.52211380004883,-55.18832778930664,1
Janet was fired by some offspring.,Janet was fired by some scarves.,syntax,s-selection,animate_subject_passive,True,True,False,False,37,-49.620582580566406,-56.676361083984375,1
Russell wasn't referenced by some girl.,Russell wasn't referenced by some hat.,syntax,s-selection,animate_subject_passive,True,True,False,False,38,-42.233055114746094,-45.959407806396484,1
Carmen is talked about by the waiters.,Carmen is talked about by the essay.,syntax,s-selection,animate_subject_passive,True,True,False,False,39,-63.3324089050293,-56.777099609375,0
A story wasn't scanned by the doctor.,A story wasn't scanned by the newspaper article.,syntax,s-selection,animate_subject_passive,True,True,False,False,40,-59.288055419921875,-66.83824920654297,1
Sherry wasn't criticized by some customers.,Sherry wasn't criticized by some casseroles.,syntax,s-selection,animate_subject_passive,True,True,False,False,41,-56.48601531982422,-75.80413818359375,1
Joseph isn't praised by the pedestrians.,Joseph isn't praised by the hypothesis.,syntax,s-selection,animate_subject_passive,True,True,False,False,42,-41.753700256347656,-41.513954162597656,0
Gregory wasn't helped by some teenager.,Gregory wasn't helped by some legislature.,syntax,s-selection,animate_subject_passive,True,True,False,False,43,-51.20899963378906,-52.914520263671875,1
Every student was listened to by some guys.,Every student was listened to by some rabbit.,syntax,s-selection,animate_subject_passive,True,True,False,False,44,-45.37237548828125,-51.054931640625,1
Mitchell isn't hated by some man.,Mitchell isn't hated by some brochures.,syntax,s-selection,animate_subject_passive,True,True,False,False,45,-52.89604187011719,-65.32746124267578,1
Those stairs aren't climbed down by the cashiers.,Those stairs aren't climbed down by the dress.,syntax,s-selection,animate_subject_passive,True,True,False,False,46,-60.57589340209961,-51.302391052246094,0
Some mushrooms were brought by the actors.,Some mushrooms were brought by the carts.,syntax,s-selection,animate_subject_passive,True,True,False,False,47,-44.17947769165039,-48.64897537231445,1
Most children aren't listened to by some girls.,Most children aren't listened to by some fungus.,syntax,s-selection,animate_subject_passive,True,True,False,False,48,-46.52741241455078,-52.283042907714844,1
Teresa is attacked by some child.,Teresa is attacked by some cacti.,syntax,s-selection,animate_subject_passive,True,True,False,False,49,-41.13138961791992,-57.8397331237793,1
A hospital is exited by some adults.,A hospital is exited by some coats.,syntax,s-selection,animate_subject_passive,True,True,False,False,50,-60.21885681152344,-63.277992248535156,1
These actresses were referenced by some lady.,These actresses were referenced by some box.,syntax,s-selection,animate_subject_passive,True,True,False,False,51,-45.410797119140625,-45.98188781738281,1
Stacey wasn't fired by some guest.,Stacey wasn't fired by some geese.,syntax,s-selection,animate_subject_passive,True,True,False,False,52,-59.02255630493164,-65.29365539550781,1
A mall is explored by the people.,A mall is explored by the beef.,syntax,s-selection,animate_subject_passive,True,True,False,False,53,-47.87437438964844,-50.95611572265625,1
The women were kissed by some teenagers.,The women were kissed by some glasses.,syntax,s-selection,animate_subject_passive,True,True,False,False,54,-40.045677185058594,-40.909488677978516,1
The commentaries weren't examined by some lady.,The commentaries weren't examined by some bike.,syntax,s-selection,animate_subject_passive,True,True,False,False,55,-64.41378784179688,-64.86346435546875,1
Homer isn't described by the boys.,Homer isn't described by the snake.,syntax,s-selection,animate_subject_passive,True,True,False,False,56,-47.481590270996094,-50.40443420410156,1
Spain is toured by the actress.,Spain is toured by the turtle.,syntax,s-selection,animate_subject_passive,True,True,False,False,57,-35.40340805053711,-35.239105224609375,0
Some hills aren't climbed down by some drivers.,Some hills aren't climbed down by some government.,syntax,s-selection,animate_subject_passive,True,True,False,False,58,-57.389102935791016,-53.485984802246094,0
Aaron isn't referenced by the teacher.,Aaron isn't referenced by the picture.,syntax,s-selection,animate_subject_passive,True,True,False,False,59,-39.513370513916016,-39.06058120727539,0
Carolyn is referenced by some adults.,Carolyn is referenced by some book.,syntax,s-selection,animate_subject_passive,True,True,False,False,60,-43.08897399902344,-43.54463195800781,1
Donna wasn't disliked by the patients.,Donna wasn't disliked by the apple.,syntax,s-selection,animate_subject_passive,True,True,False,False,61,-47.459415435791016,-49.473793029785156,1
The commentaries weren't scanned by the patient.,The commentaries weren't scanned by the snake.,syntax,s-selection,animate_subject_passive,True,True,False,False,62,-62.08160400390625,-63.279640197753906,1
Many grocery stores are passed by the children.,Many grocery stores are passed by the trucks.,syntax,s-selection,animate_subject_passive,True,True,False,False,63,-43.021331787109375,-46.02881622314453,1
Some book isn't scanned by some dancer.,Some book isn't scanned by some reports.,syntax,s-selection,animate_subject_passive,True,True,False,False,64,-59.5056037902832,-56.13549041748047,0
Julia was talked to by the lady.,Julia was talked to by the sheep.,syntax,s-selection,animate_subject_passive,True,True,False,False,65,-45.67404556274414,-48.17945861816406,1
A lot of malls are exited by some children.,A lot of malls are exited by some screens.,syntax,s-selection,animate_subject_passive,True,True,False,False,66,-69.64703369140625,-74.9246826171875,1
Mitchell was discussed by some boy.,Mitchell was discussed by some pork.,syntax,s-selection,animate_subject_passive,True,True,False,False,67,-48.703041076660156,-52.139739990234375,1
Kevin was loved by the teenagers.,Kevin was loved by the broccoli.,syntax,s-selection,animate_subject_passive,True,True,False,False,68,-32.49019241333008,-34.25667190551758,1
The cafes aren't appreciated by some driver.,The cafes aren't appreciated by some ellipsis.,syntax,s-selection,animate_subject_passive,True,True,False,False,69,-56.936553955078125,-77.61824035644531,1
Many glasses aren't cleaned by the men.,Many glasses aren't cleaned by the committees.,syntax,s-selection,animate_subject_passive,True,True,False,False,70,-45.27051544189453,-48.02674865722656,1
Cilantro wasn't hidden by some teacher.,Cilantro wasn't hidden by some fish.,syntax,s-selection,animate_subject_passive,True,True,False,False,71,-64.60987091064453,-61.476375579833984,0
That hill is seen by the children.,That hill is seen by the rabbits.,syntax,s-selection,animate_subject_passive,True,True,False,False,72,-40.04704284667969,-44.912933349609375,1
Debra wasn't admired by the drivers.,Debra wasn't admired by the geese.,syntax,s-selection,animate_subject_passive,True,True,False,False,73,-55.74768829345703,-61.45935821533203,1
These sketches were researched by some girls.,These sketches were researched by some axes.,syntax,s-selection,animate_subject_passive,True,True,False,False,74,-48.305686950683594,-55.017398834228516,1
Bethany isn't thought about by the ladies.,Bethany isn't thought about by the windows.,syntax,s-selection,animate_subject_passive,True,True,False,False,75,-72.99275207519531,-73.01936340332031,1
A grocery store is researched by the actor.,A grocery store is researched by the ellipsis.,syntax,s-selection,animate_subject_passive,True,True,False,False,76,-61.88300704956055,-83.11393737792969,1
That cafe isn't driven to by some teachers.,That cafe isn't driven to by some documentary.,syntax,s-selection,animate_subject_passive,True,True,False,False,77,-61.00788879394531,-63.534339904785156,1
Spain wasn't toured by some customer.,Spain wasn't toured by some company.,syntax,s-selection,animate_subject_passive,True,True,False,False,78,-46.47502136230469,-42.91175842285156,0
That ladder wasn't descended by the cashier.,That ladder wasn't descended by the convertibles.,syntax,s-selection,animate_subject_passive,True,True,False,False,79,-60.89808654785156,-67.30752563476562,1
Thomas wasn't hugged by some guest.,Thomas wasn't hugged by some projectors.,syntax,s-selection,animate_subject_passive,True,True,False,False,80,-49.26353454589844,-58.98542022705078,1
That fish is taken by the teacher.,That fish is taken by the series.,syntax,s-selection,animate_subject_passive,True,True,False,False,81,-43.44302749633789,-41.12306213378906,0
This art gallery wasn't passed by some woman.,This art gallery wasn't passed by some teeth.,syntax,s-selection,animate_subject_passive,True,True,False,False,82,-63.257301330566406,-66.32814025878906,1
These unicycles are seen by the guests.,These unicycles are seen by the deer.,syntax,s-selection,animate_subject_passive,True,True,False,False,83,-62.83087921142578,-64.74443054199219,1
Timothy was praised by the waitresses.,Timothy was praised by the geese.,syntax,s-selection,animate_subject_passive,True,True,False,False,84,-56.04583740234375,-50.83901596069336,0
Curtis is concealed by some teenager.,Curtis is concealed by some paralysis.,syntax,s-selection,animate_subject_passive,True,True,False,False,85,-60.207252502441406,-60.96908187866211,1
These universities were boycotted by some lady.,These universities were boycotted by some mirrors.,syntax,s-selection,animate_subject_passive,True,True,False,False,86,-65.21342468261719,-67.37142944335938,1
Many malls aren't messed up by some actresses.,Many malls aren't messed up by some skateboards.,syntax,s-selection,animate_subject_passive,True,True,False,False,87,-57.077423095703125,-66.35940551757812,1
Deanna isn't boasted about by some waiters.,Deanna isn't boasted about by some wheelbarrows.,syntax,s-selection,animate_subject_passive,True,True,False,False,88,-77.49918365478516,-91.77774047851562,1
Jacqueline was talked to by the cashiers.,Jacqueline was talked to by the feet.,syntax,s-selection,animate_subject_passive,True,True,False,False,89,-59.30824661254883,-50.64683532714844,0
That patient wasn't helped by the boy.,That patient wasn't helped by the reports.,syntax,s-selection,animate_subject_passive,True,True,False,False,90,-47.31043243408203,-48.689109802246094,1
Deborah isn't watched by some children.,Deborah isn't watched by some fish.,syntax,s-selection,animate_subject_passive,True,True,False,False,91,-51.096290588378906,-53.64155578613281,1
Some hill was escaped from by the actresses.,Some hill was escaped from by the fungus.,syntax,s-selection,animate_subject_passive,True,True,False,False,92,-55.97174072265625,-57.30354309082031,1
Theodore is referenced by some driver.,Theodore is referenced by some muffins.,syntax,s-selection,animate_subject_passive,True,True,False,False,93,-52.41473388671875,-57.15514373779297,1
Every skateboard isn't lifted by the man.,Every skateboard isn't lifted by the oxen.,syntax,s-selection,animate_subject_passive,True,True,False,False,94,-52.44269561767578,-59.88706970214844,1
All public parks were explored by some teenager.,All public parks were explored by some screen.,syntax,s-selection,animate_subject_passive,True,True,False,False,95,-55.75447082519531,-56.50089645385742,1
This cake is seen by the pedestrians.,This cake is seen by the parentheses.,syntax,s-selection,animate_subject_passive,True,True,False,False,96,-40.64455032348633,-40.89995574951172,1
Every person wasn't cared for by the offspring.,Every person wasn't cared for by the fungus.,syntax,s-selection,animate_subject_passive,True,True,False,False,97,-48.07261657714844,-49.03413391113281,1
Edward wasn't insulted by some alumni.,Edward wasn't insulted by some oxen.,syntax,s-selection,animate_subject_passive,True,True,False,False,98,-46.796295166015625,-49.104042053222656,1
Brad was investigated by the actresses.,Brad was investigated by the rabbits.,syntax,s-selection,animate_subject_passive,True,True,False,False,99,-36.21862030029297,-38.0124397277832,1
Many glaciers weren't researched by the woman.,Many glaciers weren't researched by the muffin.,syntax,s-selection,animate_subject_passive,True,True,False,False,100,-54.96116256713867,-60.44205856323242,1
This pedestrian isn't thought about by the senators.,This pedestrian isn't thought about by the pamphlet.,syntax,s-selection,animate_subject_passive,True,True,False,False,101,-59.80427551269531,-58.448360443115234,0
This art gallery was driven to by some alumni.,This art gallery was driven to by some skateboard.,syntax,s-selection,animate_subject_passive,True,True,False,False,102,-68.30357360839844,-72.65222930908203,1
The banks weren't arrived at by the adult.,The banks weren't arrived at by the gloves.,syntax,s-selection,animate_subject_passive,True,True,False,False,103,-56.27153015136719,-57.212791442871094,1
Kevin isn't hidden by the cashiers.,Kevin isn't hidden by the jacket.,syntax,s-selection,animate_subject_passive,True,True,False,False,104,-48.485355377197266,-40.58348846435547,0
These grocery stores were concealed by some teenagers.,These grocery stores were concealed by some tomatoes.,syntax,s-selection,animate_subject_passive,True,True,False,False,105,-54.66267776489258,-56.77298355102539,1
Holly is seen by some girls.,Holly is seen by some glasses.,syntax,s-selection,animate_subject_passive,True,True,False,False,106,-41.81894302368164,-44.217411041259766,1
Some drawing was discovered by the waitress.,Some drawing was discovered by the paralysis.,syntax,s-selection,animate_subject_passive,True,True,False,False,107,-48.39101791381836,-48.91050720214844,1
Most gates are bought by the children.,Most gates are bought by the turtle.,syntax,s-selection,animate_subject_passive,True,True,False,False,108,-37.708778381347656,-43.28990173339844,1
A lot of libraries are sold by the guys.,A lot of libraries are sold by the reports.,syntax,s-selection,animate_subject_passive,True,True,False,False,109,-59.604820251464844,-60.66706848144531,1
Rebecca wasn't cared for by some teenager.,Rebecca wasn't cared for by some diagnosis.,syntax,s-selection,animate_subject_passive,True,True,False,False,110,-52.037452697753906,-52.311031341552734,1
The hills were dropped by by some senator.,The hills were dropped by by some ice.,syntax,s-selection,animate_subject_passive,True,True,False,False,111,-54.46947479248047,-51.41789627075195,0
Debra was described by some waiters.,Debra was described by some documentaries.,syntax,s-selection,animate_subject_passive,True,True,False,False,112,-60.488311767578125,-53.568145751953125,0
Michelle was praised by some waiter.,Michelle was praised by some jackets.,syntax,s-selection,animate_subject_passive,True,True,False,False,113,-37.18363571166992,-38.43003845214844,1
Monica was hated by the guy.,Monica was hated by the windows.,syntax,s-selection,animate_subject_passive,True,True,False,False,114,-36.9207878112793,-38.95382308959961,1
The school was run around by some cashier.,The school was run around by some muffin.,syntax,s-selection,animate_subject_passive,True,True,False,False,115,-54.156803131103516,-51.945091247558594,0
Waitresses are argued about by the alumni.,Waitresses are argued about by the window.,syntax,s-selection,animate_subject_passive,True,True,False,False,116,-57.040306091308594,-55.05656814575195,0
The high schools are toured by some men.,The high schools are toured by some broccoli.,syntax,s-selection,animate_subject_passive,True,True,False,False,117,-48.097679138183594,-51.732215881347656,1
This mountain wasn't biked to by some children.,This mountain wasn't biked to by some drawings.,syntax,s-selection,animate_subject_passive,True,True,False,False,118,-62.867156982421875,-69.7021484375,1
That book isn't argued about by the alumnus.,That book isn't argued about by the muffins.,syntax,s-selection,animate_subject_passive,True,True,False,False,119,-74.34538269042969,-63.84502410888672,0
A convertible wasn't broken by some man.,A convertible wasn't broken by some windows.,syntax,s-selection,animate_subject_passive,True,True,False,False,120,-62.33214569091797,-62.84549331665039,1
That child wasn't complained about by the student.,That child wasn't complained about by the wheelbarrows.,syntax,s-selection,animate_subject_passive,True,True,False,False,121,-51.647216796875,-76.1464614868164,1
George was helped by the pedestrians.,George was helped by the committees.,syntax,s-selection,animate_subject_passive,True,True,False,False,122,-35.0455322265625,-34.10408020019531,0
Chairs are messed up by some pedestrians.,Chairs are messed up by some pamphlet.,syntax,s-selection,animate_subject_passive,True,True,False,False,123,-48.44412612915039,-48.726280212402344,1
Becky wasn't described by the driver.,Becky wasn't described by the cups.,syntax,s-selection,animate_subject_passive,True,True,False,False,124,-42.026493072509766,-43.45976257324219,1
Every unicycle was brought by some lady.,Every unicycle was brought by some cucumber.,syntax,s-selection,animate_subject_passive,True,True,False,False,125,-55.477508544921875,-62.85368347167969,1
Some mountain was left by some man.,Some mountain was left by some parenthesis.,syntax,s-selection,animate_subject_passive,True,True,False,False,126,-43.72984313964844,-56.171653747558594,1
The Impressionists aren't admired by the waiters.,The Impressionists aren't admired by the university.,syntax,s-selection,animate_subject_passive,True,True,False,False,127,-74.97099304199219,-64.26810455322266,0
The eyes are discovered by the actress.,The eyes are discovered by the sweaters.,syntax,s-selection,animate_subject_passive,True,True,False,False,128,-40.917884826660156,-45.01081848144531,1
The screens are broken by the cashiers.,The screens are broken by the candles.,syntax,s-selection,animate_subject_passive,True,True,False,False,129,-47.3466911315918,-39.29869842529297,0
Allison wasn't questioned by the man.,Allison wasn't questioned by the parenthesis.,syntax,s-selection,animate_subject_passive,True,True,False,False,130,-45.38622283935547,-59.61808776855469,1
These skateboards weren't broken by the children.,These skateboards weren't broken by the analyses.,syntax,s-selection,animate_subject_passive,True,True,False,False,131,-53.03539276123047,-62.2586669921875,1
Omar wasn't questioned by some ladies.,Omar wasn't questioned by some light.,syntax,s-selection,animate_subject_passive,True,True,False,False,132,-53.29921340942383,-51.85499572753906,0
The pedestrian is revealed by the pedestrians.,The pedestrian is revealed by the book.,syntax,s-selection,animate_subject_passive,True,True,False,False,133,-46.885711669921875,-42.740760803222656,0
Holly isn't hired by some driver.,Holly isn't hired by some dish.,syntax,s-selection,animate_subject_passive,True,True,False,False,134,-53.00382614135742,-51.13533020019531,0
