sentence_good,sentence_bad,field,linguistics_term,UID,simple_LM_method,one_prefix_method,two_prefix_method,lexically_identical,pair_id,good_prob,bad_prob,correct
Raymond is selling this sketch.,Raymond is selling this sketches.,morphology,determiner_noun_agreement,determiner_noun_agreement_1,True,True,False,True,0,-38.68879318237305,-41.539546966552734,1
Craig explored that grocery store.,Craig explored that grocery stores.,morphology,determiner_noun_agreement,determiner_noun_agreement_1,True,True,False,True,1,-35.89325714111328,-36.016292572021484,1
Eva has scared these children.,Eva has scared these child.,morphology,determiner_noun_agreement,determiner_noun_agreement_1,True,True,False,True,2,-27.002052307128906,-30.929555892944336,1
Marcus would conceal that pamphlet.,Marcus would conceal that pamphlets.,morphology,determiner_noun_agreement,determiner_noun_agreement_1,True,True,False,True,3,-41.808387756347656,-47.17559814453125,1
Carmen hadn't shocked these customers.,Carmen hadn't shocked these customer.,morphology,determiner_noun_agreement,determiner_noun_agreement_1,True,True,False,True,4,-55.86001205444336,-58.38361358642578,1
The Impressionists were walking through this library.,The Impressionists were walking through this libraries.,morphology,determiner_noun_agreement,determiner_noun_agreement_1,True,True,False,True,5,-56.63050079345703,-61.39268112182617,1
Some men weren't touring those cafes.,Some men weren't touring those cafe.,morphology,determiner_noun_agreement,determiner_noun_agreement_1,True,True,False,True,6,-47.783546447753906,-46.66917419433594,0
Leslie isn't firing that actress.,Leslie isn't firing that actresses.,morphology,determiner_noun_agreement,determiner_noun_agreement_1,True,True,False,True,7,-46.11194610595703,-49.02631378173828,1
Jennifer concealed those cups.,Jennifer concealed those cup.,morphology,determiner_noun_agreement,determiner_noun_agreement_1,True,True,False,True,8,-35.16101837158203,-36.64809799194336,1
A waitress does take those hospitals.,A waitress does take those hospital.,morphology,determiner_noun_agreement,determiner_noun_agreement_1,True,True,False,True,9,-50.41311264038086,-52.75153732299805,1
The man walks through those hospitals.,The man walks through those hospital.,morphology,determiner_noun_agreement,determiner_noun_agreement_1,True,True,False,True,10,-38.18968963623047,-39.148414611816406,1
Winston Churchill boycotts these public parks.,Winston Churchill boycotts these public park.,morphology,determiner_noun_agreement,determiner_noun_agreement_1,True,True,False,True,11,-69.93582153320312,-70.373046875,1
This sock disturbs that customer.,This sock disturbs that customers.,morphology,determiner_noun_agreement,determiner_noun_agreement_1,True,True,False,True,12,-50.386314392089844,-50.37779235839844,0
William described this movie.,William described this movies.,morphology,determiner_noun_agreement,determiner_noun_agreement_1,True,True,False,True,13,-23.516613006591797,-27.07733154296875,1
Monet dropped by those libraries.,Monet dropped by those library.,morphology,determiner_noun_agreement,determiner_noun_agreement_1,True,True,False,True,14,-41.59883117675781,-39.44169616699219,0
Elaine was biking to this bank.,Elaine was biking to this banks.,morphology,determiner_noun_agreement,determiner_noun_agreement_1,True,True,False,True,15,-46.956871032714844,-49.47578430175781,1
These senators wear that jacket.,These senators wear that jackets.,morphology,determiner_noun_agreement,determiner_noun_agreement_1,True,True,False,True,16,-40.10436248779297,-41.5573844909668,1
The Lutherans notice that drawing.,The Lutherans notice that drawings.,morphology,determiner_noun_agreement,determiner_noun_agreement_1,True,True,False,True,17,-50.27903747558594,-52.57120132446289,1
Cheryl is hurting that teacher.,Cheryl is hurting that teachers.,morphology,determiner_noun_agreement,determiner_noun_agreement_1,True,True,False,True,18,-49.796104431152344,-51.73899841308594,1
Russell might break those cups.,Russell might break those cup.,morphology,determiner_noun_agreement,determiner_noun_agreement_1,True,True,False,True,19,-33.39656448364258,-33.9523811340332,1
A lot of patients resemble these pictures.,A lot of patients resemble these picture.,morphology,determiner_noun_agreement,determiner_noun_agreement_1,True,True,False,True,20,-53.19673538208008,-55.728538513183594,1
Vanessa can talk to these doctors.,Vanessa can talk to these doctor.,morphology,determiner_noun_agreement,determiner_noun_agreement_1,True,True,False,True,21,-38.85950469970703,-41.52540588378906,1
Janice had worn this shawl.,Janice had worn this shawls.,morphology,determiner_noun_agreement,determiner_noun_agreement_1,True,True,False,True,22,-53.26744842529297,-54.903907775878906,1
A lot of waitresses find those jackets.,A lot of waitresses find those jacket.,morphology,determiner_noun_agreement,determiner_noun_agreement_1,True,True,False,True,23,-68.25541687011719,-68.85680389404297,1
Every dancer hasn't admired this skirt.,Every dancer hasn't admired this skirts.,morphology,determiner_noun_agreement,determiner_noun_agreement_1,True,True,False,True,24,-51.48805236816406,-52.94569396972656,1
The adult doesn't hide those malls.,The adult doesn't hide those mall.,morphology,determiner_noun_agreement,determiner_noun_agreement_1,True,True,False,True,25,-45.575660705566406,-42.788734436035156,0
Samuel criticizes that art gallery.,Samuel criticizes that art galleries.,morphology,determiner_noun_agreement,determiner_noun_agreement_1,True,True,False,True,26,-53.748619079589844,-53.01911163330078,0
A teacher annoyed those senators.,A teacher annoyed those senator.,morphology,determiner_noun_agreement,determiner_noun_agreement_1,True,True,False,True,27,-55.57459259033203,-53.27939987182617,0
A teacher talked to that customer.,A teacher talked to that customers.,morphology,determiner_noun_agreement,determiner_noun_agreement_1,True,True,False,True,28,-44.41139221191406,-44.61164855957031,1
Mark discovered this face.,Mark discovered this faces.,morphology,determiner_noun_agreement,determiner_noun_agreement_1,True,True,False,True,29,-26.620882034301758,-29.679122924804688,1
Carmen toured these restaurants.,Carmen toured these restaurant.,morphology,determiner_noun_agreement,determiner_noun_agreement_1,True,True,False,True,30,-42.10284423828125,-44.9820556640625,1
Eva toured this school.,Eva toured this schools.,morphology,determiner_noun_agreement,determiner_noun_agreement_1,True,True,False,True,31,-24.12737274169922,-26.21929931640625,1
Travis would tour that hospital.,Travis would tour that hospitals.,morphology,determiner_noun_agreement,determiner_noun_agreement_1,True,True,False,True,32,-51.278194427490234,-52.35797119140625,1
Some stories aggravated those libraries.,Some stories aggravated those library.,morphology,determiner_noun_agreement,determiner_noun_agreement_1,True,True,False,True,33,-50.6459846496582,-48.87177276611328,0
These cashiers hate that guest.,These cashiers hate that guests.,morphology,determiner_noun_agreement,determiner_noun_agreement_1,True,True,False,True,34,-48.02017593383789,-48.855018615722656,1
Heather messed up this dish.,Heather messed up this dishs.,morphology,determiner_noun_agreement,determiner_noun_agreement_1,True,True,False,True,35,-35.48642349243164,-43.436546325683594,1
Alan listened to these guests.,Alan listened to these guest.,morphology,determiner_noun_agreement,determiner_noun_agreement_1,True,True,False,True,36,-28.636329650878906,-32.25767517089844,1
Most children examine this pamphlet.,Most children examine this pamphlets.,morphology,determiner_noun_agreement,determiner_noun_agreement_1,True,True,False,True,37,-39.26937484741211,-46.06117248535156,1
Stacey will know these patients.,Stacey will know these patient.,morphology,determiner_noun_agreement,determiner_noun_agreement_1,True,True,False,True,38,-47.13746643066406,-49.457969665527344,1
Jessica sold this rabbit.,Jessica sold this rabbits.,morphology,determiner_noun_agreement,determiner_noun_agreement_1,True,True,False,True,39,-26.976547241210938,-28.739662170410156,1
Daniel couldn't hate those cashiers.,Daniel couldn't hate those cashier.,morphology,determiner_noun_agreement,determiner_noun_agreement_1,True,True,False,True,40,-45.43122100830078,-45.37749099731445,0
Those ladies kiss those adults.,Those ladies kiss those adult.,morphology,determiner_noun_agreement,determiner_noun_agreement_1,True,True,False,True,41,-36.06581497192383,-38.64274215698242,1
Diane works with these waiters.,Diane works with these waiter.,morphology,determiner_noun_agreement,determiner_noun_agreement_1,True,True,False,True,42,-53.68299102783203,-46.75910186767578,0
Most women conceal that blouse.,Most women conceal that blouses.,morphology,determiner_noun_agreement,determiner_noun_agreement_1,True,True,False,True,43,-42.39703369140625,-43.944740295410156,1
Senators can't disagree with that newspaper article.,Senators can't disagree with that newspaper articles.,morphology,determiner_noun_agreement,determiner_noun_agreement_1,True,True,False,True,44,-49.06005859375,-51.17451477050781,1
Jane has concealed this book.,Jane has concealed this books.,morphology,determiner_noun_agreement,determiner_noun_agreement_1,True,True,False,True,45,-33.37672805786133,-35.96632766723633,1
Marla took this pamphlet.,Marla took this pamphlets.,morphology,determiner_noun_agreement,determiner_noun_agreement_1,True,True,False,True,46,-33.770896911621094,-41.13121795654297,1
The skirt wasn't annoying those dancers.,The skirt wasn't annoying those dancer.,morphology,determiner_noun_agreement,determiner_noun_agreement_1,True,True,False,True,47,-50.123600006103516,-50.35364532470703,1
Most guys conceal this driver.,Most guys conceal this drivers.,morphology,determiner_noun_agreement,determiner_noun_agreement_1,True,True,False,True,48,-39.50943374633789,-39.24052047729492,0
David wasn't lifting those hats.,David wasn't lifting those hat.,morphology,determiner_noun_agreement,determiner_noun_agreement_1,True,True,False,True,49,-37.045936584472656,-36.47030258178711,0
The dancers are driving to those art galleries.,The dancers are driving to those art gallery.,morphology,determiner_noun_agreement,determiner_noun_agreement_1,True,True,False,True,50,-52.865318298339844,-54.76502990722656,1
Tracy might cure those patients.,Tracy might cure those patient.,morphology,determiner_noun_agreement,determiner_noun_agreement_1,True,True,False,True,51,-40.39238739013672,-41.455055236816406,1
Heather cleans that print.,Heather cleans that prints.,morphology,determiner_noun_agreement,determiner_noun_agreement_1,True,True,False,True,52,-38.84080505371094,-39.47673797607422,1
Rose won't reference these movies.,Rose won't reference these movie.,morphology,determiner_noun_agreement,determiner_noun_agreement_1,True,True,False,True,53,-35.58820724487305,-38.814491271972656,1
Many reports irritate these senators.,Many reports irritate these senator.,morphology,determiner_noun_agreement,determiner_noun_agreement_1,True,True,False,True,54,-49.918434143066406,-49.01958465576172,0
Dan couldn't walk through this public park.,Dan couldn't walk through this public parks.,morphology,determiner_noun_agreement,determiner_noun_agreement_1,True,True,False,True,55,-44.272762298583984,-44.90365982055664,1
Rose hated this girl.,Rose hated this girls.,morphology,determiner_noun_agreement,determiner_noun_agreement_1,True,True,False,True,56,-24.168296813964844,-27.25470733642578,1
Melinda hires that teacher.,Melinda hires that teachers.,morphology,determiner_noun_agreement,determiner_noun_agreement_1,True,True,False,True,57,-40.685462951660156,-40.232566833496094,0
Joseph healed these customers.,Joseph healed these customer.,morphology,determiner_noun_agreement,determiner_noun_agreement_1,True,True,False,True,58,-31.377208709716797,-33.72334289550781,1
A door doesn't distract those students.,A door doesn't distract those student.,morphology,determiner_noun_agreement,determiner_noun_agreement_1,True,True,False,True,59,-52.82128143310547,-55.184783935546875,1
Theodore skated around that art gallery.,Theodore skated around that art galleries.,morphology,determiner_noun_agreement,determiner_noun_agreement_1,True,True,False,True,60,-64.35499572753906,-63.14629364013672,0
These tomatoes shock these dancers.,These tomatoes shock these dancer.,morphology,determiner_noun_agreement,determiner_noun_agreement_1,True,True,False,True,61,-44.05918884277344,-45.45862579345703,1
Guys observe these children.,Guys observe these child.,morphology,determiner_noun_agreement,determiner_noun_agreement_1,True,True,False,True,62,-29.821821212768555,-32.735652923583984,1
Some guests flee from those dancers.,Some guests flee from those dancer.,morphology,determiner_noun_agreement,determiner_noun_agreement_1,True,True,False,True,63,-48.052791595458984,-49.645938873291016,1
Linda isn't embarrassing these waitresses.,Linda isn't embarrassing these waitress.,morphology,determiner_noun_agreement,determiner_noun_agreement_1,True,True,False,True,64,-61.73384094238281,-52.0340576171875,0
Walter hides these dancers.,Walter hides these dancer.,morphology,determiner_noun_agreement,determiner_noun_agreement_1,True,True,False,True,65,-36.49296188354492,-37.7916259765625,1
Sharon investigated those waiters.,Sharon investigated those waiter.,morphology,determiner_noun_agreement,determiner_noun_agreement_1,True,True,False,True,66,-46.936336517333984,-39.34940719604492,0
Bradley should explore this high school.,Bradley should explore this high schools.,morphology,determiner_noun_agreement,determiner_noun_agreement_1,True,True,False,True,67,-38.931007385253906,-43.56983947753906,1
Tanya wears these socks.,Tanya wears these sock.,morphology,determiner_noun_agreement,determiner_noun_agreement_1,True,True,False,True,68,-41.32231140136719,-44.662513732910156,1
That cat had bored those ladies.,That cat had bored those lady.,morphology,determiner_noun_agreement,determiner_noun_agreement_1,True,True,False,True,69,-45.51509475708008,-46.38114547729492,1
Stephen had cleaned this bank.,Stephen had cleaned this banks.,morphology,determiner_noun_agreement,determiner_noun_agreement_1,True,True,False,True,70,-28.54401206970215,-32.117027282714844,1
Waiters have left that driver.,Waiters have left that drivers.,morphology,determiner_noun_agreement,determiner_noun_agreement_1,True,True,False,True,71,-38.65239715576172,-39.47015380859375,1
Heather wasn't criticizing these teachers.,Heather wasn't criticizing these teacher.,morphology,determiner_noun_agreement,determiner_noun_agreement_1,True,True,False,True,72,-51.36853790283203,-53.96797561645508,1
Brian wasn't concealing those cafes.,Brian wasn't concealing those cafe.,morphology,determiner_noun_agreement,determiner_noun_agreement_1,True,True,False,True,73,-54.731956481933594,-53.20041275024414,0
Some trucks weren't boring that cashier.,Some trucks weren't boring that cashiers.,morphology,determiner_noun_agreement,determiner_noun_agreement_1,True,True,False,True,74,-54.38420486450195,-54.77680587768555,1
Many eggplants aren't scaring this teacher.,Many eggplants aren't scaring this teachers.,morphology,determiner_noun_agreement,determiner_noun_agreement_1,True,True,False,True,75,-64.10707092285156,-64.98838806152344,1
Children aren't boring this lady.,Children aren't boring this ladies.,morphology,determiner_noun_agreement,determiner_noun_agreement_1,True,True,False,True,76,-31.02771759033203,-34.51105499267578,1
Karla hadn't brought these pictures.,Karla hadn't brought these picture.,morphology,determiner_noun_agreement,determiner_noun_agreement_1,True,True,False,True,77,-38.92007064819336,-41.28156661987305,1
Janice hasn't cared for that waitress.,Janice hasn't cared for that waitresses.,morphology,determiner_noun_agreement,determiner_noun_agreement_1,True,True,False,True,78,-46.132110595703125,-56.93516540527344,1
A lot of doctors exit those art galleries.,A lot of doctors exit those art gallery.,morphology,determiner_noun_agreement,determiner_noun_agreement_1,True,True,False,True,79,-63.592960357666016,-65.05241394042969,1
Thomas should hug this waiter.,Thomas should hug this waiters.,morphology,determiner_noun_agreement,determiner_noun_agreement_1,True,True,False,True,80,-37.13862228393555,-46.20452117919922,1
Candice hasn't attacked that boy.,Candice hasn't attacked that boys.,morphology,determiner_noun_agreement,determiner_noun_agreement_1,True,True,False,True,81,-41.054588317871094,-43.671627044677734,1
Katherine wasn't taking that public park.,Katherine wasn't taking that public parks.,morphology,determiner_noun_agreement,determiner_noun_agreement_1,True,True,False,True,82,-50.323848724365234,-50.64183807373047,1
The Clintons watch those drivers.,The Clintons watch those driver.,morphology,determiner_noun_agreement,determiner_noun_agreement_1,True,True,False,True,83,-45.371826171875,-47.49419403076172,1
Amelia loves this waiter.,Amelia loves this waiters.,morphology,determiner_noun_agreement,determiner_noun_agreement_1,True,True,False,True,84,-34.88243103027344,-45.49760437011719,1
Caroline hasn't known this boy.,Caroline hasn't known this boys.,morphology,determiner_noun_agreement,determiner_noun_agreement_1,True,True,False,True,85,-40.72333908081055,-44.553306579589844,1
Sheila isn't passing that cafe.,Sheila isn't passing that cafes.,morphology,determiner_noun_agreement,determiner_noun_agreement_1,True,True,False,True,86,-44.41511154174805,-46.92133331298828,1
Claire had cleaned that picture.,Claire had cleaned that pictures.,morphology,determiner_noun_agreement,determiner_noun_agreement_1,True,True,False,True,87,-34.271568298339844,-37.25843048095703,1
The people exit these movie theaters.,The people exit these movie theater.,morphology,determiner_noun_agreement,determiner_noun_agreement_1,True,True,False,True,88,-45.84412384033203,-45.311805725097656,0
Bruce won't mess up that restaurant.,Bruce won't mess up that restaurants.,morphology,determiner_noun_agreement,determiner_noun_agreement_1,True,True,False,True,89,-35.473838806152344,-38.35220718383789,1
Margaret hasn't bought that blouse.,Margaret hasn't bought that blouses.,morphology,determiner_noun_agreement,determiner_noun_agreement_1,True,True,False,True,90,-40.30280303955078,-42.04962158203125,1
Some waitresses remember that driver.,Some waitresses remember that drivers.,morphology,determiner_noun_agreement,determiner_noun_agreement_1,True,True,False,True,91,-49.80873489379883,-50.00455093383789,1
Timothy loved this boy.,Timothy loved this boys.,morphology,determiner_noun_agreement,determiner_noun_agreement_1,True,True,False,True,92,-27.863460540771484,-31.36065673828125,1
A lot of adults help that guy.,A lot of adults help that guys.,morphology,determiner_noun_agreement,determiner_noun_agreement_1,True,True,False,True,93,-45.29811096191406,-46.17681884765625,1
Steven has broken that cup.,Steven has broken that cups.,morphology,determiner_noun_agreement,determiner_noun_agreement_1,True,True,False,True,94,-27.84900665283203,-29.981876373291016,1
Patricia loved those cashiers.,Patricia loved those cashier.,morphology,determiner_noun_agreement,determiner_noun_agreement_1,True,True,False,True,95,-45.37388610839844,-45.85028076171875,1
Many drivers fix that glass.,Many drivers fix that glasses.,morphology,determiner_noun_agreement,determiner_noun_agreement_1,True,True,False,True,96,-34.191619873046875,-37.34550094604492,1
A lot of cashiers mess up that library.,A lot of cashiers mess up that libraries.,morphology,determiner_noun_agreement,determiner_noun_agreement_1,True,True,False,True,97,-68.81767272949219,-72.68688201904297,1
Waitresses drive to that school.,Waitresses drive to that schools.,morphology,determiner_noun_agreement,determiner_noun_agreement_1,True,True,False,True,98,-37.344139099121094,-39.63848114013672,1
Roger should sound like that waitress.,Roger should sound like that waitresses.,morphology,determiner_noun_agreement,determiner_noun_agreement_1,True,True,False,True,99,-37.07075500488281,-47.56090545654297,1
The Impressionists do listen to this waitress.,The Impressionists do listen to this waitresses.,morphology,determiner_noun_agreement,determiner_noun_agreement_1,True,True,False,True,100,-59.95973205566406,-70.82756042480469,1
Theresa bought this drawing.,Theresa bought this drawings.,morphology,determiner_noun_agreement,determiner_noun_agreement_1,True,True,False,True,101,-39.81228256225586,-38.86532211303711,0
The Impressionists walk through this cafe.,The Impressionists walk through this cafes.,morphology,determiner_noun_agreement,determiner_noun_agreement_1,True,True,False,True,102,-56.816993713378906,-60.40153503417969,1
Thomas can boycott these committees.,Thomas can boycott these committee.,morphology,determiner_noun_agreement,determiner_noun_agreement_1,True,True,False,True,103,-47.0256462097168,-47.91020202636719,1
Alan had boasted about those girls.,Alan had boasted about those girl.,morphology,determiner_noun_agreement,determiner_noun_agreement_1,True,True,False,True,104,-39.67949676513672,-42.420143127441406,1
Sally isn't escaping from these boys.,Sally isn't escaping from these boy.,morphology,determiner_noun_agreement,determiner_noun_agreement_1,True,True,False,True,105,-50.785865783691406,-54.814117431640625,1
Jesus can run around this high school.,Jesus can run around this high schools.,morphology,determiner_noun_agreement,determiner_noun_agreement_1,True,True,False,True,106,-34.889556884765625,-40.7620849609375,1
Amy wasn't confusing those companies.,Amy wasn't confusing those company.,morphology,determiner_noun_agreement,determiner_noun_agreement_1,True,True,False,True,107,-36.00234603881836,-37.851112365722656,1
Tanya boycotts that university.,Tanya boycotts that universities.,morphology,determiner_noun_agreement,determiner_noun_agreement_1,True,True,False,True,108,-53.887542724609375,-55.90813064575195,1
Roger ran around this school.,Roger ran around this schools.,morphology,determiner_noun_agreement,determiner_noun_agreement_1,True,True,False,True,109,-26.84712791442871,-30.610271453857422,1
These teachers escape from those restaurants.,These teachers escape from those restaurant.,morphology,determiner_noun_agreement,determiner_noun_agreement_1,True,True,False,True,110,-41.42864990234375,-42.840187072753906,1
Maria was talking to this guest.,Maria was talking to this guests.,morphology,determiner_noun_agreement,determiner_noun_agreement_1,True,True,False,True,111,-28.16778564453125,-28.932086944580078,1
Rachel has hugged those boys.,Rachel has hugged those boy.,morphology,determiner_noun_agreement,determiner_noun_agreement_1,True,True,False,True,112,-31.166000366210938,-33.89377975463867,1
The students fire this patient.,The students fire this patients.,morphology,determiner_noun_agreement,determiner_noun_agreement_1,True,True,False,True,113,-38.07359313964844,-38.946495056152344,1
Jennifer helped those guests.,Jennifer helped those guest.,morphology,determiner_noun_agreement,determiner_noun_agreement_1,True,True,False,True,114,-25.55301284790039,-29.343238830566406,1
Some plays disgust this legislature.,Some plays disgust this legislatures.,morphology,determiner_noun_agreement,determiner_noun_agreement_1,True,True,False,True,115,-47.114654541015625,-48.41471862792969,1
Jerry had hidden these cups.,Jerry had hidden these cup.,morphology,determiner_noun_agreement,determiner_noun_agreement_1,True,True,False,True,116,-35.045997619628906,-36.70503234863281,1
Martin has concealed this boy.,Martin has concealed this boys.,morphology,determiner_noun_agreement,determiner_noun_agreement_1,True,True,False,True,117,-35.3087158203125,-38.00934982299805,1
That person hadn't bothered those girls.,That person hadn't bothered those girl.,morphology,determiner_noun_agreement,determiner_noun_agreement_1,True,True,False,True,118,-45.30553436279297,-47.39509582519531,1
Carla has hired those patients.,Carla has hired those patient.,morphology,determiner_noun_agreement,determiner_noun_agreement_1,True,True,False,True,119,-38.75312805175781,-39.85194778442383,1
Noah talks about this doctor.,Noah talks about this doctors.,morphology,determiner_noun_agreement,determiner_noun_agreement_1,True,True,False,True,120,-38.482078552246094,-39.75608825683594,1
Rachel ran around those high schools.,Rachel ran around those high school.,morphology,determiner_noun_agreement,determiner_noun_agreement_1,True,True,False,True,121,-33.406394958496094,-28.369794845581055,0
All waiters run around these malls.,All waiters run around these mall.,morphology,determiner_noun_agreement,determiner_noun_agreement_1,True,True,False,True,122,-53.917789459228516,-49.77022933959961,0
All students didn't buy these schools.,All students didn't buy these school.,morphology,determiner_noun_agreement,determiner_noun_agreement_1,True,True,False,True,123,-33.62507247924805,-36.74745178222656,1
Patricia bikes to those malls.,Patricia bikes to those mall.,morphology,determiner_noun_agreement,determiner_noun_agreement_1,True,True,False,True,124,-51.86366271972656,-48.44597625732422,0
Vanessa hadn't taken those grocery stores.,Vanessa hadn't taken those grocery store.,morphology,determiner_noun_agreement,determiner_noun_agreement_1,True,True,False,True,125,-49.75434875488281,-50.754241943359375,1
Bethany walked through this school.,Bethany walked through this schools.,morphology,determiner_noun_agreement,determiner_noun_agreement_1,True,True,False,True,126,-52.77696228027344,-56.70665740966797,1
Patricia had argued about those children.,Patricia had argued about those child.,morphology,determiner_noun_agreement,determiner_noun_agreement_1,True,True,False,True,127,-40.468772888183594,-43.12672424316406,1
Julie did flee from this waitress.,Julie did flee from this waitresses.,morphology,determiner_noun_agreement,determiner_noun_agreement_1,True,True,False,True,128,-49.39198303222656,-58.791465759277344,1
