sentence_good,sentence_bad,field,linguistics_term,UID,simple_LM_method,one_prefix_method,two_prefix_method,lexically_identical,pair_id,good_prob,bad_prob,correct
Dennis wouldn't hate this standing woman.,Dennis wouldn't hate this standing women.,morphology,determiner_noun_agreement,determiner_noun_agreement_with_adj_irregular_1,True,True,False,True,225,-63.875572204589844,-64.19223022460938,1
Naomi exited that cheap oasis.,Naomi exited that cheap oases.,morphology,determiner_noun_agreement,determiner_noun_agreement_with_adj_irregular_1,True,True,False,True,226,-59.415382385253906,-61.094139099121094,1
Diane had appreciated that displeased man.,Diane had appreciated that displeased men.,morphology,determiner_noun_agreement,determiner_noun_agreement_with_adj_irregular_1,True,True,False,True,227,-74.56047058105469,-75.09609985351562,1
Stacy questioned those concealed alumni.,Stacy questioned those concealed alumnus.,morphology,determiner_noun_agreement,determiner_noun_agreement_with_adj_irregular_1,True,True,False,True,228,-59.478233337402344,-74.95015716552734,1
Denise lifted these sick lice.,Denise lifted these sick louse.,morphology,determiner_noun_agreement,determiner_noun_agreement_with_adj_irregular_1,True,True,False,True,229,-52.69263458251953,-51.31188201904297,0
Florence visited that hard oasis.,Florence visited that hard oases.,morphology,determiner_noun_agreement,determiner_noun_agreement_with_adj_irregular_1,True,True,False,True,230,-60.56434631347656,-62.19466781616211,1
Many projectors are confusing this smart man.,Many projectors are confusing this smart men.,morphology,determiner_noun_agreement,determiner_noun_agreement_with_adj_irregular_1,True,True,False,True,231,-58.602508544921875,-59.84431076049805,1
James breaks those purple teeth.,James breaks those purple tooth.,morphology,determiner_noun_agreement,determiner_noun_agreement_with_adj_irregular_1,True,True,False,True,232,-35.213294982910156,-36.8204231262207,1
Thomas has hidden those small teeth.,Thomas has hidden those small tooth.,morphology,determiner_noun_agreement,determiner_noun_agreement_with_adj_irregular_1,True,True,False,True,233,-36.79763412475586,-38.850765228271484,1
Kristin cured that old man.,Kristin cured that old men.,morphology,determiner_noun_agreement,determiner_noun_agreement_with_adj_irregular_1,True,True,False,True,234,-38.39875793457031,-39.85118865966797,1
Cynthia explored that orange oasis.,Cynthia explored that orange oases.,morphology,determiner_noun_agreement,determiner_noun_agreement_with_adj_irregular_1,True,True,False,True,235,-73.33299255371094,-75.468994140625,1
Donna escapes from these scared men.,Donna escapes from these scared man.,morphology,determiner_noun_agreement,determiner_noun_agreement_with_adj_irregular_1,True,True,False,True,236,-51.258026123046875,-52.81047058105469,1
Some students astounded that excited person.,Some students astounded that excited people.,morphology,determiner_noun_agreement,determiner_noun_agreement_with_adj_irregular_1,True,True,False,True,237,-54.60563278198242,-53.39251708984375,0
Steven isn't visiting these displeased people.,Steven isn't visiting these displeased person.,morphology,determiner_noun_agreement,determiner_noun_agreement_with_adj_irregular_1,True,True,False,True,238,-52.0744743347168,-56.739784240722656,1
Many pedestrians disagreed with this lost woman.,Many pedestrians disagreed with this lost women.,morphology,determiner_noun_agreement,determiner_noun_agreement_with_adj_irregular_1,True,True,False,True,239,-56.87501907348633,-56.87596130371094,1
Some guys hug these good men.,Some guys hug these good man.,morphology,determiner_noun_agreement,determiner_noun_agreement_with_adj_irregular_1,True,True,False,True,240,-41.75055694580078,-42.90204620361328,1
Robert had those big cacti.,Robert had those big cactus.,morphology,determiner_noun_agreement,determiner_noun_agreement_with_adj_irregular_1,True,True,False,True,241,-43.681983947753906,-36.448970794677734,0
Jeffrey has examined that bad synopsis.,Jeffrey has examined that bad synopses.,morphology,determiner_noun_agreement,determiner_noun_agreement_with_adj_irregular_1,True,True,False,True,242,-56.714111328125,-67.99839782714844,1
Jodi might upset these old children.,Jodi might upset these old child.,morphology,determiner_noun_agreement,determiner_noun_agreement_with_adj_irregular_1,True,True,False,True,243,-54.530296325683594,-57.045326232910156,1
Brenda helped those bad women.,Brenda helped those bad woman.,morphology,determiner_noun_agreement,determiner_noun_agreement_with_adj_irregular_1,True,True,False,True,244,-36.57574462890625,-37.714176177978516,1
All waiters aren't listening to that happy alumnus.,All waiters aren't listening to that happy alumni.,morphology,determiner_noun_agreement,determiner_noun_agreement_with_adj_irregular_1,True,True,False,True,245,-81.93438720703125,-67.31619262695312,0
The girl disagrees with this good man.,The girl disagrees with this good men.,morphology,determiner_noun_agreement,determiner_noun_agreement_with_adj_irregular_1,True,True,False,True,246,-48.690162658691406,-49.718353271484375,1
Jill conceals that excited person.,Jill conceals that excited people.,morphology,determiner_noun_agreement,determiner_noun_agreement_with_adj_irregular_1,True,True,False,True,247,-63.01606750488281,-61.022789001464844,0
Julia remembered this young person.,Julia remembered this young people.,morphology,determiner_noun_agreement,determiner_noun_agreement_with_adj_irregular_1,True,True,False,True,248,-38.86962127685547,-38.05982971191406,0
Bruce disliked these confident alumni.,Bruce disliked these confident alumnus.,morphology,determiner_noun_agreement,determiner_noun_agreement_with_adj_irregular_1,True,True,False,True,249,-49.74753952026367,-64.98924255371094,1
These teachers cure these sick people.,These teachers cure these sick person.,morphology,determiner_noun_agreement,determiner_noun_agreement_with_adj_irregular_1,True,True,False,True,250,-42.59928512573242,-45.12368392944336,1
Karla does fix these red feet.,Karla does fix these red foot.,morphology,determiner_noun_agreement,determiner_noun_agreement_with_adj_irregular_1,True,True,False,True,251,-48.52555847167969,-50.742591857910156,1
Judy hadn't attacked that nice woman.,Judy hadn't attacked that nice women.,morphology,determiner_noun_agreement,determiner_noun_agreement_with_adj_irregular_1,True,True,False,True,252,-46.72437286376953,-46.555328369140625,0
The apple disgusted that sick child.,The apple disgusted that sick children.,morphology,determiner_noun_agreement,determiner_noun_agreement_with_adj_irregular_1,True,True,False,True,253,-48.26375198364258,-49.6050910949707,1
Charles upset this content child.,Charles upset this content children.,morphology,determiner_noun_agreement,determiner_noun_agreement_with_adj_irregular_1,True,True,False,True,254,-39.600189208984375,-41.28799057006836,1
The waiters disagree with this fast person.,The waiters disagree with this fast people.,morphology,determiner_noun_agreement,determiner_noun_agreement_with_adj_irregular_1,True,True,False,True,255,-55.07891845703125,-55.32217025756836,1
Christopher isn't hiring this determined man.,Christopher isn't hiring this determined men.,morphology,determiner_noun_agreement,determiner_noun_agreement_with_adj_irregular_1,True,True,False,True,256,-46.84254837036133,-48.89170837402344,1
Elaine couldn't exit those rough oases.,Elaine couldn't exit those rough oasis.,morphology,determiner_noun_agreement,determiner_noun_agreement_with_adj_irregular_1,True,True,False,True,257,-69.50535583496094,-67.56492614746094,0
Jason wouldn't like those exposed lice.,Jason wouldn't like those exposed louse.,morphology,determiner_noun_agreement,determiner_noun_agreement_with_adj_irregular_1,True,True,False,True,258,-52.01491928100586,-50.4154167175293,0
Sherry hadn't insulted those clever alumni.,Sherry hadn't insulted those clever alumnus.,morphology,determiner_noun_agreement,determiner_noun_agreement_with_adj_irregular_1,True,True,False,True,259,-71.71448516845703,-88.00788879394531,1
Amanda has hidden these yellow cacti.,Amanda has hidden these yellow cactus.,morphology,determiner_noun_agreement,determiner_noun_agreement_with_adj_irregular_1,True,True,False,True,260,-60.14373779296875,-53.10894012451172,0
Paula thinks about these green lice.,Paula thinks about these green louse.,morphology,determiner_noun_agreement,determiner_noun_agreement_with_adj_irregular_1,True,True,False,True,261,-55.30817794799805,-53.13954544067383,0
All doctors argue about those long analyses.,All doctors argue about those long analysis.,morphology,determiner_noun_agreement,determiner_noun_agreement_with_adj_irregular_1,True,True,False,True,262,-50.027950286865234,-45.63817596435547,0
Heidi can break this out in the open foot.,Heidi can break this out in the open feet.,morphology,determiner_noun_agreement,determiner_noun_agreement_with_adj_irregular_1,True,True,False,True,263,-57.32677459716797,-58.41376495361328,1
Carla hugged those young children.,Carla hugged those young child.,morphology,determiner_noun_agreement,determiner_noun_agreement_with_adj_irregular_1,True,True,False,True,264,-40.02909851074219,-42.69866943359375,1
A guest was attacking those confident men.,A guest was attacking those confident man.,morphology,determiner_noun_agreement,determiner_noun_agreement_with_adj_irregular_1,True,True,False,True,265,-64.177978515625,-65.81754302978516,1
The Impressionists boycott those hard oases.,The Impressionists boycott those hard oasis.,morphology,determiner_noun_agreement,determiner_noun_agreement_with_adj_irregular_1,True,True,False,True,266,-87.13910675048828,-84.93453216552734,0
Katherine isn't disgusting this out in the open alumnus.,Katherine isn't disgusting this out in the open alumni.,morphology,determiner_noun_agreement,determiner_noun_agreement_with_adj_irregular_1,True,True,False,True,267,-89.29800415039062,-77.34465026855469,0
A window is bothering those popular men.,A window is bothering those popular man.,morphology,determiner_noun_agreement,determiner_noun_agreement_with_adj_irregular_1,True,True,False,True,268,-59.67823028564453,-60.24388122558594,1
A lot of cashiers discover that smart man.,A lot of cashiers discover that smart men.,morphology,determiner_noun_agreement,determiner_noun_agreement_with_adj_irregular_1,True,True,False,True,269,-72.97154998779297,-73.69293212890625,1
Jodi approaches that unlucky woman.,Jodi approaches that unlucky women.,morphology,determiner_noun_agreement,determiner_noun_agreement_with_adj_irregular_1,True,True,False,True,270,-58.47776412963867,-58.287025451660156,0
Jesus discussed that fast child.,Jesus discussed that fast children.,morphology,determiner_noun_agreement,determiner_noun_agreement_with_adj_irregular_1,True,True,False,True,271,-32.80045700073242,-34.13135528564453,1
Carts hadn't disgusted those content men.,Carts hadn't disgusted those content man.,morphology,determiner_noun_agreement,determiner_noun_agreement_with_adj_irregular_1,True,True,False,True,272,-70.54542541503906,-71.1655044555664,1
Deborah talks about these smart men.,Deborah talks about these smart man.,morphology,determiner_noun_agreement,determiner_noun_agreement_with_adj_irregular_1,True,True,False,True,273,-41.570377349853516,-43.08329772949219,1
Thomas was returning to that unsure man.,Thomas was returning to that unsure men.,morphology,determiner_noun_agreement,determiner_noun_agreement_with_adj_irregular_1,True,True,False,True,274,-44.363258361816406,-44.868743896484375,1
Every student will break this clean tooth.,Every student will break this clean teeth.,morphology,determiner_noun_agreement,determiner_noun_agreement_with_adj_irregular_1,True,True,False,True,275,-45.14155960083008,-43.247459411621094,0
Valerie talks about this young woman.,Valerie talks about this young women.,morphology,determiner_noun_agreement,determiner_noun_agreement_with_adj_irregular_1,True,True,False,True,276,-41.241397857666016,-42.04342269897461,1
The Clintons discuss this yellow thesis.,The Clintons discuss this yellow theses.,morphology,determiner_noun_agreement,determiner_noun_agreement_with_adj_irregular_1,True,True,False,True,277,-59.67878341674805,-67.68576049804688,1
These cashiers break those dirty feet.,These cashiers break those dirty foot.,morphology,determiner_noun_agreement,determiner_noun_agreement_with_adj_irregular_1,True,True,False,True,278,-51.928123474121094,-54.430625915527344,1
Noah exited these concealed oases.,Noah exited these concealed oasis.,morphology,determiner_noun_agreement,determiner_noun_agreement_with_adj_irregular_1,True,True,False,True,279,-69.477783203125,-67.7886734008789,0
Elaine toured that rough oasis.,Elaine toured that rough oases.,morphology,determiner_noun_agreement,determiner_noun_agreement_with_adj_irregular_1,True,True,False,True,280,-57.676937103271484,-59.99860382080078,1
Allison hides that gray mouse.,Allison hides that gray mice.,morphology,determiner_noun_agreement,determiner_noun_agreement_with_adj_irregular_1,True,True,False,True,281,-51.77033996582031,-51.32228469848633,0
All vases irritated that hopeful man.,All vases irritated that hopeful men.,morphology,determiner_noun_agreement,determiner_noun_agreement_with_adj_irregular_1,True,True,False,True,282,-63.068634033203125,-63.836238861083984,1
Chad boycotted that smooth oasis.,Chad boycotted that smooth oases.,morphology,determiner_noun_agreement,determiner_noun_agreement_with_adj_irregular_1,True,True,False,True,283,-75.6091079711914,-77.43548583984375,1
The Clintons drive to these green oases.,The Clintons drive to these green oasis.,morphology,determiner_noun_agreement,determiner_noun_agreement_with_adj_irregular_1,True,True,False,True,284,-66.90460205078125,-64.46089935302734,0
Many ladies aren't concealing that brown louse.,Many ladies aren't concealing that brown lice.,morphology,determiner_noun_agreement,determiner_noun_agreement_with_adj_irregular_1,True,True,False,True,285,-70.4494400024414,-71.21955108642578,1
Brenda couldn't hire this serious child.,Brenda couldn't hire this serious children.,morphology,determiner_noun_agreement,determiner_noun_agreement_with_adj_irregular_1,True,True,False,True,286,-45.35929870605469,-46.04414367675781,1
Pamela sounds like that displeased person.,Pamela sounds like that displeased people.,morphology,determiner_noun_agreement,determiner_noun_agreement_with_adj_irregular_1,True,True,False,True,287,-77.760009765625,-74.25602722167969,0
Eva doesn't arrive at these gray oases.,Eva doesn't arrive at these gray oasis.,morphology,determiner_noun_agreement,determiner_noun_agreement_with_adj_irregular_1,True,True,False,True,288,-59.911827087402344,-57.359153747558594,0
Raymond hurt that old alumnus.,Raymond hurt that old alumni.,morphology,determiner_noun_agreement,determiner_noun_agreement_with_adj_irregular_1,True,True,False,True,289,-58.30128479003906,-45.30495834350586,0
Most waitresses don't observe these exposed alumni.,Most waitresses don't observe these exposed alumnus.,morphology,determiner_noun_agreement,determiner_noun_agreement_with_adj_irregular_1,True,True,False,True,290,-76.52240753173828,-91.86955261230469,1
Edward finds these gray oases.,Edward finds these gray oasis.,morphology,determiner_noun_agreement,determiner_noun_agreement_with_adj_irregular_1,True,True,False,True,291,-47.936683654785156,-45.81580352783203,0
Becky fixes that small foot.,Becky fixes that small feet.,morphology,determiner_noun_agreement,determiner_noun_agreement_with_adj_irregular_1,True,True,False,True,292,-43.10857009887695,-43.145469665527344,1
Erin will conceal these nice alumni.,Erin will conceal these nice alumnus.,morphology,determiner_noun_agreement,determiner_noun_agreement_with_adj_irregular_1,True,True,False,True,293,-55.74486541748047,-71.02471160888672,1
Denise isn't shocking these serious alumni.,Denise isn't shocking these serious alumnus.,morphology,determiner_noun_agreement,determiner_noun_agreement_with_adj_irregular_1,True,True,False,True,294,-59.724815368652344,-74.37063598632812,1
Martin isn't curing these concealed oxen.,Martin isn't curing these concealed ox.,morphology,determiner_noun_agreement,determiner_noun_agreement_with_adj_irregular_1,True,True,False,True,295,-57.915191650390625,-55.07805252075195,0
Lori wasn't watching this clever woman.,Lori wasn't watching this clever women.,morphology,determiner_noun_agreement,determiner_noun_agreement_with_adj_irregular_1,True,True,False,True,296,-53.28568649291992,-54.62501525878906,1
These wheelbarrows disgust these sick men.,These wheelbarrows disgust these sick man.,morphology,determiner_noun_agreement,determiner_noun_agreement_with_adj_irregular_1,True,True,False,True,297,-73.23323059082031,-73.89860534667969,1
These women discuss that confident woman.,These women discuss that confident women.,morphology,determiner_noun_agreement,determiner_noun_agreement_with_adj_irregular_1,True,True,False,True,298,-41.783077239990234,-40.91703796386719,0
Noah hadn't remembered these bad analyses.,Noah hadn't remembered these bad analysis.,morphology,determiner_noun_agreement,determiner_noun_agreement_with_adj_irregular_1,True,True,False,True,299,-59.08070373535156,-53.49253845214844,0
Nina is boring this smart child.,Nina is boring this smart children.,morphology,determiner_noun_agreement,determiner_noun_agreement_with_adj_irregular_1,True,True,False,True,300,-55.67174530029297,-57.218204498291016,1
The Lutherans like these scared people.,The Lutherans like these scared person.,morphology,determiner_noun_agreement,determiner_noun_agreement_with_adj_irregular_1,True,True,False,True,301,-52.164344787597656,-54.500648498535156,1
Leslie could return to those lost people.,Leslie could return to those lost person.,morphology,determiner_noun_agreement,determiner_noun_agreement_with_adj_irregular_1,True,True,False,True,302,-54.69400405883789,-58.55697250366211,1
Galileo liked this small child.,Galileo liked this small children.,morphology,determiner_noun_agreement,determiner_noun_agreement_with_adj_irregular_1,True,True,False,True,303,-45.248130798339844,-46.208492279052734,1
Denise was talking about that determined person.,Denise was talking about that determined people.,morphology,determiner_noun_agreement,determiner_noun_agreement_with_adj_irregular_1,True,True,False,True,304,-41.838035583496094,-38.583961486816406,0
Andrew respected that white oasis.,Andrew respected that white oases.,morphology,determiner_noun_agreement,determiner_noun_agreement_with_adj_irregular_1,True,True,False,True,305,-42.676780700683594,-44.817073822021484,1
Renee has dropped by these old oases.,Renee has dropped by these old oasis.,morphology,determiner_noun_agreement,determiner_noun_agreement_with_adj_irregular_1,True,True,False,True,306,-63.14882278442383,-60.696533203125,0
That bread shouldn't aggravate this unconvinced alumnus.,That bread shouldn't aggravate this unconvinced alumni.,morphology,determiner_noun_agreement,determiner_noun_agreement_with_adj_irregular_1,True,True,False,True,307,-112.44500732421875,-97.47889709472656,0
All ladies appreciate these brown oases.,All ladies appreciate these brown oasis.,morphology,determiner_noun_agreement,determiner_noun_agreement_with_adj_irregular_1,True,True,False,True,308,-58.39894485473633,-56.10824966430664,0
A doctor drives to this out in the open oasis.,A doctor drives to this out in the open oases.,morphology,determiner_noun_agreement,determiner_noun_agreement_with_adj_irregular_1,True,True,False,True,309,-77.37107849121094,-80.38330841064453,1
The teenagers tour these black oases.,The teenagers tour these black oasis.,morphology,determiner_noun_agreement,determiner_noun_agreement_with_adj_irregular_1,True,True,False,True,310,-58.91497802734375,-56.803680419921875,0
Becca didn't think about those out in the open oxen.,Becca didn't think about those out in the open ox.,morphology,determiner_noun_agreement,determiner_noun_agreement_with_adj_irregular_1,True,True,False,True,311,-64.64016723632812,-62.89344787597656,0
Eric hadn't loved that exposed person.,Eric hadn't loved that exposed people.,morphology,determiner_noun_agreement,determiner_noun_agreement_with_adj_irregular_1,True,True,False,True,312,-43.13093566894531,-40.378971099853516,0
Every person wasn't hiding those black axes.,Every person wasn't hiding those black axis.,morphology,determiner_noun_agreement,determiner_noun_agreement_with_adj_irregular_1,True,True,False,True,313,-52.37650680541992,-47.79106903076172,0
Tina respected that unemployed child.,Tina respected that unemployed children.,morphology,determiner_noun_agreement,determiner_noun_agreement_with_adj_irregular_1,True,True,False,True,314,-55.45509719848633,-55.19374465942383,0
Broccoli astounds this unemployed child.,Broccoli astounds this unemployed children.,morphology,determiner_noun_agreement,determiner_noun_agreement_with_adj_irregular_1,True,True,False,True,315,-71.57345581054688,-72.72483825683594,1
The waitresses break this cheap foot.,The waitresses break this cheap feet.,morphology,determiner_noun_agreement,determiner_noun_agreement_with_adj_irregular_1,True,True,False,True,316,-57.68741226196289,-57.458412170410156,0
Janice brought this brown nucleus.,Janice brought this brown nuclei.,morphology,determiner_noun_agreement,determiner_noun_agreement_with_adj_irregular_1,True,True,False,True,317,-48.51818084716797,-58.04487609863281,1
Gerald wasn't dropping by these old oases.,Gerald wasn't dropping by these old oasis.,morphology,determiner_noun_agreement,determiner_noun_agreement_with_adj_irregular_1,True,True,False,True,318,-77.20973205566406,-74.61769104003906,0
These slopes haven't astounded those unemployed alumni.,These slopes haven't astounded those unemployed alumnus.,morphology,determiner_noun_agreement,determiner_noun_agreement_with_adj_irregular_1,True,True,False,True,319,-76.48294067382812,-91.48782348632812,1
Ellen was astounding these unsure men.,Ellen was astounding these unsure man.,morphology,determiner_noun_agreement,determiner_noun_agreement_with_adj_irregular_1,True,True,False,True,320,-56.26434326171875,-56.61162185668945,1
That story will annoy this fast person.,That story will annoy this fast people.,morphology,determiner_noun_agreement,determiner_noun_agreement_with_adj_irregular_1,True,True,False,True,321,-49.85424041748047,-50.82863998413086,1
Most photographs look like those clever children.,Most photographs look like those clever child.,morphology,determiner_noun_agreement,determiner_noun_agreement_with_adj_irregular_1,True,True,False,True,322,-44.28609085083008,-45.23860168457031,1
These screens distracted that young alumnus.,These screens distracted that young alumni.,morphology,determiner_noun_agreement,determiner_noun_agreement_with_adj_irregular_1,True,True,False,True,323,-67.92770385742188,-53.665496826171875,0
Craig does distract this small woman.,Craig does distract this small women.,morphology,determiner_noun_agreement,determiner_noun_agreement_with_adj_irregular_1,True,True,False,True,324,-44.41453552246094,-46.21795654296875,1
Monet arrived at those blue oases.,Monet arrived at those blue oasis.,morphology,determiner_noun_agreement,determiner_noun_agreement_with_adj_irregular_1,True,True,False,True,325,-56.39889907836914,-53.47906494140625,0
The ladies lift those blue feet.,The ladies lift those blue foot.,morphology,determiner_noun_agreement,determiner_noun_agreement_with_adj_irregular_1,True,True,False,True,326,-43.10889434814453,-44.86598205566406,1
A grocery store does confuse this displeased woman.,A grocery store does confuse this displeased women.,morphology,determiner_noun_agreement,determiner_noun_agreement_with_adj_irregular_1,True,True,False,True,327,-93.13212585449219,-93.14076232910156,1
Douglas was escaping from those unlucky children.,Douglas was escaping from those unlucky child.,morphology,determiner_noun_agreement,determiner_noun_agreement_with_adj_irregular_1,True,True,False,True,328,-57.21337890625,-58.69835662841797,1
Brenda had returned to these scared alumni.,Brenda had returned to these scared alumnus.,morphology,determiner_noun_agreement,determiner_noun_agreement_with_adj_irregular_1,True,True,False,True,329,-51.24502944946289,-66.31611633300781,1
Alicia scans these good synopses.,Alicia scans these good synopsis.,morphology,determiner_noun_agreement,determiner_noun_agreement_with_adj_irregular_1,True,True,False,True,330,-86.52510070800781,-76.37689971923828,0
Some senators attack those confident men.,Some senators attack those confident man.,morphology,determiner_noun_agreement,determiner_noun_agreement_with_adj_irregular_1,True,True,False,True,331,-57.56087112426758,-58.13554382324219,1
Some fish shocked those small people.,Some fish shocked those small person.,morphology,determiner_noun_agreement,determiner_noun_agreement_with_adj_irregular_1,True,True,False,True,332,-40.66011047363281,-42.927364349365234,1
Timothy had cared for these fast men.,Timothy had cared for these fast man.,morphology,determiner_noun_agreement,determiner_noun_agreement_with_adj_irregular_1,True,True,False,True,333,-48.398284912109375,-49.72344207763672,1
Lucille hasn't run around those concealed oases.,Lucille hasn't run around those concealed oasis.,morphology,determiner_noun_agreement,determiner_noun_agreement_with_adj_irregular_1,True,True,False,True,334,-72.51268005371094,-70.05303955078125,0
Tonya observed that fast alumnus.,Tonya observed that fast alumni.,morphology,determiner_noun_agreement,determiner_noun_agreement_with_adj_irregular_1,True,True,False,True,335,-65.88798522949219,-51.36507034301758,0
Every picture was astounding this lucky alumnus.,Every picture was astounding this lucky alumni.,morphology,determiner_noun_agreement,determiner_noun_agreement_with_adj_irregular_1,True,True,False,True,336,-75.17643737792969,-61.980979919433594,0
