sentence_good,sentence_bad,field,linguistics_term,UID,simple_LM_method,one_prefix_method,two_prefix_method,lexically_identical,pair_id,good_prob,bad_prob,correct
Guy describes this thesis.,Guy describes these thesis.,morphology,determiner_noun_agreement,determiner_noun_agreement_irregular_2,True,False,True,True,498,-29.305683135986328,-31.841073989868164,1
Rachel broke these feet.,Rachel broke this feet.,morphology,determiner_noun_agreement,determiner_noun_agreement_irregular_2,True,False,True,True,499,-25.2659969329834,-25.643421173095703,1
April might bring this cactus.,April might bring these cactus.,morphology,determiner_noun_agreement,determiner_noun_agreement_irregular_2,True,False,True,True,500,-43.200687408447266,-42.06169128417969,0
Every lady revealed those oxen.,Every lady revealed that oxen.,morphology,determiner_noun_agreement,determiner_noun_agreement_irregular_2,True,False,True,True,501,-45.25072479248047,-41.85993194580078,0
Russell will hate that child.,Russell will hate those child.,morphology,determiner_noun_agreement,determiner_noun_agreement_irregular_2,True,False,True,True,502,-27.319149017333984,-31.96938705444336,1
Jerry didn't notice those fungi.,Jerry didn't notice that fungi.,morphology,determiner_noun_agreement,determiner_noun_agreement_irregular_2,True,False,True,True,503,-33.910560607910156,-33.53544998168945,0
Jill wouldn't hurt those men.,Jill wouldn't hurt that men.,morphology,determiner_noun_agreement,determiner_noun_agreement_irregular_2,True,False,True,True,504,-44.61585998535156,-45.83416748046875,1
Kayla bored these people.,Kayla bored this people.,morphology,determiner_noun_agreement,determiner_noun_agreement_irregular_2,True,False,True,True,505,-33.45145797729492,-37.61140060424805,1
Pamela hadn't loved this woman.,Pamela hadn't loved these woman.,morphology,determiner_noun_agreement,determiner_noun_agreement_irregular_2,True,False,True,True,506,-49.11634063720703,-53.857147216796875,1
Richard isn't biking to that oasis.,Richard isn't biking to those oasis.,morphology,determiner_noun_agreement,determiner_noun_agreement_irregular_2,True,False,True,True,507,-54.83464050292969,-55.515968322753906,1
Homer admires those children.,Homer admires that children.,morphology,determiner_noun_agreement,determiner_noun_agreement_irregular_2,True,False,True,True,508,-51.682132720947266,-50.572601318359375,0
Every organization hurts those men.,Every organization hurts that men.,morphology,determiner_noun_agreement,determiner_noun_agreement_irregular_2,True,False,True,True,509,-35.76648712158203,-35.241153717041016,0
The Clintons hadn't shocked this alumnus.,The Clintons hadn't shocked these alumnus.,morphology,determiner_noun_agreement,determiner_noun_agreement_irregular_2,True,False,True,True,510,-74.86573028564453,-75.93305206298828,1
These skirts do aggravate these men.,These skirts do aggravate this men.,morphology,determiner_noun_agreement,determiner_noun_agreement_irregular_2,True,False,True,True,511,-47.69872283935547,-50.47174072265625,1
These children worries those children.,These children worries that children.,morphology,determiner_noun_agreement,determiner_noun_agreement_irregular_2,True,False,True,True,512,-30.708276748657227,-32.54869842529297,1
That pork shocks that woman.,That pork shocks those woman.,morphology,determiner_noun_agreement,determiner_noun_agreement_irregular_2,True,False,True,True,513,-40.118412017822266,-45.38438034057617,1
Alicia wouldn't annoy this man.,Alicia wouldn't annoy these man.,morphology,determiner_noun_agreement,determiner_noun_agreement_irregular_2,True,False,True,True,514,-59.56644058227539,-62.436485290527344,1
Christine wasn't questioning those men.,Christine wasn't questioning that men.,morphology,determiner_noun_agreement,determiner_noun_agreement_irregular_2,True,False,True,True,515,-43.55814743041992,-44.087242126464844,1
Victoria returns to this person.,Victoria returns to these person.,morphology,determiner_noun_agreement,determiner_noun_agreement_irregular_2,True,False,True,True,516,-22.16034698486328,-26.702377319335938,1
This icicle confuses these men.,This icicle confuses this men.,morphology,determiner_noun_agreement,determiner_noun_agreement_irregular_2,True,False,True,True,517,-64.71631622314453,-66.73072814941406,1
Jennifer isn't discussing this child.,Jennifer isn't discussing these child.,morphology,determiner_noun_agreement,determiner_noun_agreement_irregular_2,True,False,True,True,518,-29.943531036376953,-31.899539947509766,1
Noah skates around these oases.,Noah skates around this oases.,morphology,determiner_noun_agreement,determiner_noun_agreement_irregular_2,True,False,True,True,519,-65.17755126953125,-65.30098724365234,1
Amy kissed this child.,Amy kissed these child.,morphology,determiner_noun_agreement,determiner_noun_agreement_irregular_2,True,False,True,True,520,-23.040691375732422,-25.770288467407227,1
Andrew insults this oasis.,Andrew insults these oasis.,morphology,determiner_noun_agreement,determiner_noun_agreement_irregular_2,True,False,True,True,521,-44.90425491333008,-43.38361358642578,0
Cheryl was finding this axis.,Cheryl was finding these axis.,morphology,determiner_noun_agreement,determiner_noun_agreement_irregular_2,True,False,True,True,522,-69.03680419921875,-68.98185729980469,0
The Clintons escape from these children.,The Clintons escape from this children.,morphology,determiner_noun_agreement,determiner_noun_agreement_irregular_2,True,False,True,True,523,-47.016910552978516,-48.48755645751953,1
Laurie talks to that woman.,Laurie talks to those woman.,morphology,determiner_noun_agreement,determiner_noun_agreement_irregular_2,True,False,True,True,524,-34.69683074951172,-38.436683654785156,1
Irene hired that man.,Irene hired those man.,morphology,determiner_noun_agreement,determiner_noun_agreement_irregular_2,True,False,True,True,525,-34.51206588745117,-38.779537200927734,1
All drivers have found these people.,All drivers have found this people.,morphology,determiner_noun_agreement,determiner_noun_agreement_irregular_2,True,False,True,True,526,-32.14341735839844,-36.62675476074219,1
The actresses boycott these oases.,The actresses boycott this oases.,morphology,determiner_noun_agreement,determiner_noun_agreement_irregular_2,True,False,True,True,527,-56.99699783325195,-58.80417251586914,1
Theresa was criticizing this woman.,Theresa was criticizing these woman.,morphology,determiner_noun_agreement,determiner_noun_agreement_irregular_2,True,False,True,True,528,-43.04895782470703,-47.32528305053711,1
Douglas can't argue about that thesis.,Douglas can't argue about those thesis.,morphology,determiner_noun_agreement,determiner_noun_agreement_irregular_2,True,False,True,True,529,-44.470794677734375,-46.402015686035156,1
Many plates bother this person.,Many plates bother these person.,morphology,determiner_noun_agreement,determiner_noun_agreement_irregular_2,True,False,True,True,530,-36.24039840698242,-38.72194290161133,1
Melanie has passed that oasis.,Melanie has passed those oasis.,morphology,determiner_noun_agreement,determiner_noun_agreement_irregular_2,True,False,True,True,531,-48.35710144042969,-49.241580963134766,1
Art did stun that man.,Art did stun those man.,morphology,determiner_noun_agreement,determiner_noun_agreement_irregular_2,True,False,True,True,532,-37.250267028808594,-39.745567321777344,1
Bethany will pass this oasis.,Bethany will pass these oasis.,morphology,determiner_noun_agreement,determiner_noun_agreement_irregular_2,True,False,True,True,533,-68.17056274414062,-67.87397766113281,0
All people think about those synopses.,All people think about that synopses.,morphology,determiner_noun_agreement,determiner_noun_agreement_irregular_2,True,False,True,True,534,-47.606910705566406,-47.269378662109375,0
Tonya should visit that woman.,Tonya should visit those woman.,morphology,determiner_noun_agreement,determiner_noun_agreement_irregular_2,True,False,True,True,535,-36.855934143066406,-41.850860595703125,1
Guys tour these oases.,Guys tour this oases.,morphology,determiner_noun_agreement,determiner_noun_agreement_irregular_2,True,False,True,True,536,-48.19475173950195,-49.71211242675781,1
Many waitresses argue about those synopses.,Many waitresses argue about that synopses.,morphology,determiner_noun_agreement,determiner_noun_agreement_irregular_2,True,False,True,True,537,-72.17562866210938,-72.36158752441406,1
Wendy hasn't concealed that woman.,Wendy hasn't concealed those woman.,morphology,determiner_noun_agreement,determiner_noun_agreement_irregular_2,True,False,True,True,538,-54.57472610473633,-58.76857376098633,1
Some face bores those people.,Some face bores that people.,morphology,determiner_noun_agreement,determiner_noun_agreement_irregular_2,True,False,True,True,539,-41.9127311706543,-40.25973892211914,0
Catherine won't run around this oasis.,Catherine won't run around these oasis.,morphology,determiner_noun_agreement,determiner_noun_agreement_irregular_2,True,False,True,True,540,-57.33024215698242,-57.74275207519531,1
Alan hadn't revealed that mouse.,Alan hadn't revealed those mouse.,morphology,determiner_noun_agreement,determiner_noun_agreement_irregular_2,True,False,True,True,541,-38.02141571044922,-42.20552062988281,1
A person is cleaning those oxen.,A person is cleaning that oxen.,morphology,determiner_noun_agreement,determiner_noun_agreement_irregular_2,True,False,True,True,542,-57.876800537109375,-56.87602996826172,0
Clyde bored that person.,Clyde bored those person.,morphology,determiner_noun_agreement,determiner_noun_agreement_irregular_2,True,False,True,True,543,-51.292545318603516,-54.85750961303711,1
This mirror shouldn't embarrass those men.,This mirror shouldn't embarrass that men.,morphology,determiner_noun_agreement,determiner_noun_agreement_irregular_2,True,False,True,True,544,-48.53437423706055,-48.43712615966797,0
Tammy discovers this cactus.,Tammy discovers these cactus.,morphology,determiner_noun_agreement,determiner_noun_agreement_irregular_2,True,False,True,True,545,-44.83915328979492,-43.98748016357422,0
The Impressionists conceal those feet.,The Impressionists conceal that feet.,morphology,determiner_noun_agreement,determiner_noun_agreement_irregular_2,True,False,True,True,546,-60.441436767578125,-61.61336135864258,1
Most guys couldn't pass these oases.,Most guys couldn't pass this oases.,morphology,determiner_noun_agreement,determiner_noun_agreement_irregular_2,True,False,True,True,547,-51.84577941894531,-53.030738830566406,1
The Borgias work with these people.,The Borgias work with this people.,morphology,determiner_noun_agreement,determiner_noun_agreement_irregular_2,True,False,True,True,548,-47.43058776855469,-51.360923767089844,1
That grocery store wasn't alarming that person.,That grocery store wasn't alarming those person.,morphology,determiner_noun_agreement,determiner_noun_agreement_irregular_2,True,False,True,True,549,-57.451263427734375,-61.674774169921875,1
This waitress wasn't biking to these oases.,This waitress wasn't biking to this oases.,morphology,determiner_noun_agreement,determiner_noun_agreement_irregular_2,True,False,True,True,550,-71.20533752441406,-72.24392700195312,1
The Lutherans fix that foot.,The Lutherans fix those foot.,morphology,determiner_noun_agreement,determiner_noun_agreement_irregular_2,True,False,True,True,551,-47.23197937011719,-50.3298225402832,1
Bradley had known that woman.,Bradley had known those woman.,morphology,determiner_noun_agreement,determiner_noun_agreement_irregular_2,True,False,True,True,552,-33.86663818359375,-37.78120422363281,1
Some women discover this goose.,Some women discover these goose.,morphology,determiner_noun_agreement,determiner_noun_agreement_irregular_2,True,False,True,True,553,-38.141456604003906,-38.30146026611328,1
Pedestrians listen to those women.,Pedestrians listen to that women.,morphology,determiner_noun_agreement,determiner_noun_agreement_irregular_2,True,False,True,True,554,-40.0524787902832,-41.795936584472656,1
Melissa hid these octopi.,Melissa hid this octopi.,morphology,determiner_noun_agreement,determiner_noun_agreement_irregular_2,True,False,True,True,555,-46.152610778808594,-47.31572723388672,1
Rose biked to these oases.,Rose biked to this oases.,morphology,determiner_noun_agreement,determiner_noun_agreement_irregular_2,True,False,True,True,556,-52.752777099609375,-53.85553741455078,1
Kevin has watched that person.,Kevin has watched those person.,morphology,determiner_noun_agreement,determiner_noun_agreement_irregular_2,True,False,True,True,557,-24.774471282958984,-29.418428421020508,1
Some high school isn't confusing those men.,Some high school isn't confusing that men.,morphology,determiner_noun_agreement,determiner_noun_agreement_irregular_2,True,False,True,True,558,-46.71501159667969,-45.126197814941406,0
Many schools praise that woman.,Many schools praise those woman.,morphology,determiner_noun_agreement,determiner_noun_agreement_irregular_2,True,False,True,True,559,-33.03307342529297,-37.29670715332031,1
The chair disgusts these women.,The chair disgusts this women.,morphology,determiner_noun_agreement,determiner_noun_agreement_irregular_2,True,False,True,True,560,-42.08565139770508,-44.741127014160156,1
Curtis might know this man.,Curtis might know these man.,morphology,determiner_noun_agreement,determiner_noun_agreement_irregular_2,True,False,True,True,561,-51.39305114746094,-54.59748840332031,1
That committee couldn't aggravate this person.,That committee couldn't aggravate these person.,morphology,determiner_noun_agreement,determiner_noun_agreement_irregular_2,True,False,True,True,562,-55.4981803894043,-59.370216369628906,1
Gerald does boast about these ellipses.,Gerald does boast about this ellipses.,morphology,determiner_noun_agreement,determiner_noun_agreement_irregular_2,True,False,True,True,563,-80.3624038696289,-80.44161987304688,1
Patrick conceals those oases.,Patrick conceals that oases.,morphology,determiner_noun_agreement,determiner_noun_agreement_irregular_2,True,False,True,True,564,-49.625946044921875,-46.73127746582031,0
Men will aggravate these men.,Men will aggravate this men.,morphology,determiner_noun_agreement,determiner_noun_agreement_irregular_2,True,False,True,True,565,-38.70589065551758,-40.68235778808594,1
Florence watched this child.,Florence watched these child.,morphology,determiner_noun_agreement,determiner_noun_agreement_irregular_2,True,False,True,True,566,-35.454017639160156,-38.73418426513672,1
Most doctors find these theses.,Most doctors find this theses.,morphology,determiner_noun_agreement,determiner_noun_agreement_irregular_2,True,False,True,True,567,-41.52239227294922,-42.84412384033203,1
Elizabeth can't describe these people.,Elizabeth can't describe this people.,morphology,determiner_noun_agreement,determiner_noun_agreement_irregular_2,True,False,True,True,568,-27.2294979095459,-30.997804641723633,1
The public park annoys this child.,The public park annoys these child.,morphology,determiner_noun_agreement,determiner_noun_agreement_irregular_2,True,False,True,True,569,-51.983985900878906,-54.23777770996094,1
Kristin examined that thesis.,Kristin examined those thesis.,morphology,determiner_noun_agreement,determiner_noun_agreement_irregular_2,True,False,True,True,570,-39.44633483886719,-41.21491241455078,1
Rachel can shock these men.,Rachel can shock this men.,morphology,determiner_noun_agreement,determiner_noun_agreement_irregular_2,True,False,True,True,571,-34.783573150634766,-37.27742385864258,1
These dancers upset these children.,These dancers upset this children.,morphology,determiner_noun_agreement,determiner_noun_agreement_irregular_2,True,False,True,True,572,-36.20482635498047,-39.83323669433594,1
The books are disagreeing with this person.,The books are disagreeing with these person.,morphology,determiner_noun_agreement,determiner_noun_agreement_irregular_2,True,False,True,True,573,-48.270477294921875,-52.0394401550293,1
Rose can't impress that man.,Rose can't impress those man.,morphology,determiner_noun_agreement,determiner_noun_agreement_irregular_2,True,False,True,True,574,-31.095726013183594,-34.61018753051758,1
Cindy was running around these oases.,Cindy was running around this oases.,morphology,determiner_noun_agreement,determiner_noun_agreement_irregular_2,True,False,True,True,575,-61.93628692626953,-61.74325180053711,0
All patients were questioning these children.,All patients were questioning this children.,morphology,determiner_noun_agreement,determiner_noun_agreement_irregular_2,True,False,True,True,576,-36.71073913574219,-40.41643142700195,1
All adults go to those oases.,All adults go to that oases.,morphology,determiner_noun_agreement,determiner_noun_agreement_irregular_2,True,False,True,True,577,-43.151023864746094,-42.81686019897461,0
Many drawings wouldn't look like this woman.,Many drawings wouldn't look like these woman.,morphology,determiner_noun_agreement,determiner_noun_agreement_irregular_2,True,False,True,True,578,-42.664249420166016,-45.24296569824219,1
Every lady drops by these oases.,Every lady drops by this oases.,morphology,determiner_noun_agreement,determiner_noun_agreement_irregular_2,True,False,True,True,579,-55.86648178100586,-56.185821533203125,1
Cindy could praise these men.,Cindy could praise this men.,morphology,determiner_noun_agreement,determiner_noun_agreement_irregular_2,True,False,True,True,580,-50.371910095214844,-52.702754974365234,1
Most wheelbarrows bother this woman.,Most wheelbarrows bother these woman.,morphology,determiner_noun_agreement,determiner_noun_agreement_irregular_2,True,False,True,True,581,-59.70948791503906,-62.311424255371094,1
Jill talks about this thesis.,Jill talks about these thesis.,morphology,determiner_noun_agreement,determiner_noun_agreement_irregular_2,True,False,True,True,582,-43.76294708251953,-46.03757858276367,1
Bethany was fixing that tooth.,Bethany was fixing those tooth.,morphology,determiner_noun_agreement,determiner_noun_agreement_irregular_2,True,False,True,True,583,-56.7478141784668,-59.61503219604492,1
Scott appreciates this basis.,Scott appreciates these basis.,morphology,determiner_noun_agreement,determiner_noun_agreement_irregular_2,True,False,True,True,584,-33.175323486328125,-37.710235595703125,1
Rhonda can admire this fungus.,Rhonda can admire these fungus.,morphology,determiner_noun_agreement,determiner_noun_agreement_irregular_2,True,False,True,True,585,-45.99317932128906,-47.219642639160156,1
Ellen had broken this tooth.,Ellen had broken these tooth.,morphology,determiner_noun_agreement,determiner_noun_agreement_irregular_2,True,False,True,True,586,-36.187538146972656,-39.10272979736328,1
Linda hasn't run around that oasis.,Linda hasn't run around those oasis.,morphology,determiner_noun_agreement,determiner_noun_agreement_irregular_2,True,False,True,True,587,-52.56230163574219,-54.288795471191406,1
Some guests conceal those alumni.,Some guests conceal that alumni.,morphology,determiner_noun_agreement,determiner_noun_agreement_irregular_2,True,False,True,True,588,-43.21101379394531,-42.627174377441406,0
Todd was questioning that woman.,Todd was questioning those woman.,morphology,determiner_noun_agreement,determiner_noun_agreement_irregular_2,True,False,True,True,589,-28.870954513549805,-33.12139892578125,1
The vases bother that child.,The vases bother those child.,morphology,determiner_noun_agreement,determiner_noun_agreement_irregular_2,True,False,True,True,590,-44.63543701171875,-47.65943145751953,1
Tanya wasn't watching those women.,Tanya wasn't watching that women.,morphology,determiner_noun_agreement,determiner_noun_agreement_irregular_2,True,False,True,True,591,-44.536834716796875,-45.83771514892578,1
Melanie scans that analysis.,Melanie scans those analysis.,morphology,determiner_noun_agreement,determiner_noun_agreement_irregular_2,True,False,True,True,592,-42.248260498046875,-46.469390869140625,1
Most girls drive to those oases.,Most girls drive to that oases.,morphology,determiner_noun_agreement,determiner_noun_agreement_irregular_2,True,False,True,True,593,-46.557823181152344,-46.35395812988281,0
Some essays shock those people.,Some essays shock that people.,morphology,determiner_noun_agreement,determiner_noun_agreement_irregular_2,True,False,True,True,594,-36.287628173828125,-34.93728256225586,0
That waitress insults this alumnus.,That waitress insults these alumnus.,morphology,determiner_noun_agreement,determiner_noun_agreement_irregular_2,True,False,True,True,595,-67.34439086914062,-68.02526092529297,1
The museum had that ox.,The museum had those ox.,morphology,determiner_noun_agreement,determiner_noun_agreement_irregular_2,True,False,True,True,596,-31.21959114074707,-34.62904357910156,1
That horse upsets those men.,That horse upsets that men.,morphology,determiner_noun_agreement,determiner_noun_agreement_irregular_2,True,False,True,True,597,-48.414581298828125,-45.2440299987793,0
Jodi approaches those children.,Jodi approaches that children.,morphology,determiner_noun_agreement,determiner_noun_agreement_irregular_2,True,False,True,True,598,-41.64002990722656,-41.841583251953125,1
Pamela liked that oasis.,Pamela liked those oasis.,morphology,determiner_noun_agreement,determiner_noun_agreement_irregular_2,True,False,True,True,599,-52.73298645019531,-55.23004913330078,1
Those steps embarrass that man.,Those steps embarrass those man.,morphology,determiner_noun_agreement,determiner_noun_agreement_irregular_2,True,False,True,True,600,-37.168853759765625,-38.98811721801758,1
Jill is investigating that child.,Jill is investigating those child.,morphology,determiner_noun_agreement,determiner_noun_agreement_irregular_2,True,False,True,True,601,-42.25421142578125,-44.83928680419922,1
Allison hasn't approached these women.,Allison hasn't approached this women.,morphology,determiner_noun_agreement,determiner_noun_agreement_irregular_2,True,False,True,True,602,-44.36359786987305,-47.77166748046875,1
A lot of men concealed those nuclei.,A lot of men concealed that nuclei.,morphology,determiner_noun_agreement,determiner_noun_agreement_irregular_2,True,False,True,True,603,-71.66561889648438,-70.54013061523438,0
Tara forgets that woman.,Tara forgets those woman.,morphology,determiner_noun_agreement,determiner_noun_agreement_irregular_2,True,False,True,True,604,-46.194847106933594,-50.476829528808594,1
Naomi leaves those men.,Naomi leaves that men.,morphology,determiner_noun_agreement,determiner_noun_agreement_irregular_2,True,False,True,True,605,-37.90571212768555,-38.65803146362305,1
The guests sound like those analyses.,The guests sound like that analyses.,morphology,determiner_noun_agreement,determiner_noun_agreement_irregular_2,True,False,True,True,606,-44.46152114868164,-43.6337890625,0
Lisa didn't irritate this woman.,Lisa didn't irritate these woman.,morphology,determiner_noun_agreement,determiner_noun_agreement_irregular_2,True,False,True,True,607,-38.98976516723633,-43.35022735595703,1
Anna hasn't respected those men.,Anna hasn't respected that men.,morphology,determiner_noun_agreement,determiner_noun_agreement_irregular_2,True,False,True,True,608,-34.463375091552734,-33.94718933105469,0
Every glove disturbs that child.,Every glove disturbs those child.,morphology,determiner_noun_agreement,determiner_noun_agreement_irregular_2,True,False,True,True,609,-46.53986740112305,-50.77977752685547,1
A lot of senators visit those men.,A lot of senators visit that men.,morphology,determiner_noun_agreement,determiner_noun_agreement_irregular_2,True,False,True,True,610,-59.42033386230469,-58.44880676269531,0
Carl has fixed those teeth.,Carl has fixed that teeth.,morphology,determiner_noun_agreement,determiner_noun_agreement_irregular_2,True,False,True,True,611,-31.197832107543945,-29.944087982177734,0
Many children arrive at those oases.,Many children arrive at that oases.,morphology,determiner_noun_agreement,determiner_noun_agreement_irregular_2,True,False,True,True,612,-46.848533630371094,-46.5181999206543,0
Rachel sells that nucleus.,Rachel sells those nucleus.,morphology,determiner_noun_agreement,determiner_noun_agreement_irregular_2,True,False,True,True,613,-28.423316955566406,-30.073667526245117,1
All dancers drop by these oases.,All dancers drop by this oases.,morphology,determiner_noun_agreement,determiner_noun_agreement_irregular_2,True,False,True,True,614,-58.03062438964844,-58.846107482910156,1
Jennifer was biking to those oases.,Jennifer was biking to that oases.,morphology,determiner_noun_agreement,determiner_noun_agreement_irregular_2,True,False,True,True,615,-51.158111572265625,-51.07196807861328,0
John wouldn't complain about those women.,John wouldn't complain about that women.,morphology,determiner_noun_agreement,determiner_noun_agreement_irregular_2,True,False,True,True,616,-29.45868492126465,-31.76096534729004,1
The boy had passed those oases.,The boy had passed that oases.,morphology,determiner_noun_agreement,determiner_noun_agreement_irregular_2,True,False,True,True,617,-49.328651428222656,-48.5134162902832,0
Danielle sold those oases.,Danielle sold that oases.,morphology,determiner_noun_agreement,determiner_noun_agreement_irregular_2,True,False,True,True,618,-45.33005142211914,-45.17036056518555,0
Eric disliked these children.,Eric disliked this children.,morphology,determiner_noun_agreement,determiner_noun_agreement_irregular_2,True,False,True,True,619,-27.713645935058594,-31.176986694335938,1
Becky has argued about these alumni.,Becky has argued about this alumni.,morphology,determiner_noun_agreement,determiner_noun_agreement_irregular_2,True,False,True,True,620,-44.034446716308594,-42.46031188964844,0
Cheryl isn't stunning those people.,Cheryl isn't stunning that people.,morphology,determiner_noun_agreement,determiner_noun_agreement_irregular_2,True,False,True,True,621,-69.82962036132812,-67.59471130371094,0
Irene lifts those cacti.,Irene lifts that cacti.,morphology,determiner_noun_agreement,determiner_noun_agreement_irregular_2,True,False,True,True,622,-54.789031982421875,-53.59519577026367,0
