sentence_good,sentence_bad,field,linguistics_term,UID,simple_LM_method,one_prefix_method,two_prefix_method,lexically_identical,pair_id,good_prob,bad_prob,correct
Every library impresses itself.,Every library impresses themselves.,morphology,anaphor_agreement,anaphor_number_agreement,True,True,False,True,554,-44.295753479003906,-44.33717346191406,1
Michelle hasn't concealed herself.,Michelle hasn't concealed themselves.,morphology,anaphor_agreement,anaphor_number_agreement,True,True,False,True,555,-32.023807525634766,-31.623855590820312,0
Linda stunned herself.,Linda stunned themselves.,morphology,anaphor_agreement,anaphor_number_agreement,True,True,False,True,556,-34.48457717895508,-33.12294387817383,0
Some men were approaching themselves.,Some men were approaching herself.,morphology,anaphor_agreement,anaphor_number_agreement,True,True,False,True,557,-26.14260482788086,-30.044696807861328,1
All ladies work with themselves.,All ladies work with itself.,morphology,anaphor_agreement,anaphor_number_agreement,True,True,False,True,558,-30.184837341308594,-33.11977767944336,1
Those guys have concealed themselves.,Those guys have concealed itself.,morphology,anaphor_agreement,anaphor_number_agreement,True,True,False,True,559,-29.196372985839844,-31.890377044677734,1
Homer can find himself.,Homer can find themselves.,morphology,anaphor_agreement,anaphor_number_agreement,True,True,False,True,560,-33.490970611572266,-33.103736877441406,0
Those pedestrians bored themselves.,Those pedestrians bored himself.,morphology,anaphor_agreement,anaphor_number_agreement,True,True,False,True,561,-34.32740020751953,-38.10939025878906,1
Sandra could upset herself.,Sandra could upset themselves.,morphology,anaphor_agreement,anaphor_number_agreement,True,True,False,True,562,-44.48392868041992,-43.29987335205078,0
Heidi has distracted herself.,Heidi has distracted themselves.,morphology,anaphor_agreement,anaphor_number_agreement,True,True,False,True,563,-42.20673370361328,-41.98577117919922,0
Peter isn't kissing himself.,Peter isn't kissing themselves.,morphology,anaphor_agreement,anaphor_number_agreement,True,True,False,True,564,-27.13705062866211,-28.174598693847656,1
These students aren't aggravating themselves.,These students aren't aggravating itself.,morphology,anaphor_agreement,anaphor_number_agreement,True,True,False,True,565,-33.117103576660156,-36.29737091064453,1
Guy bothered himself.,Guy bothered themselves.,morphology,anaphor_agreement,anaphor_number_agreement,True,True,False,True,566,-20.534778594970703,-20.329269409179688,0
Tara wasn't concealing herself.,Tara wasn't concealing themselves.,morphology,anaphor_agreement,anaphor_number_agreement,True,True,False,True,567,-57.533817291259766,-56.951263427734375,0
Most teachers concealed themselves.,Most teachers concealed himself.,morphology,anaphor_agreement,anaphor_number_agreement,True,True,False,True,568,-33.415252685546875,-37.478057861328125,1
The university can't astound itself.,The university can't astound themselves.,morphology,anaphor_agreement,anaphor_number_agreement,True,True,False,True,569,-42.933921813964844,-41.88801574707031,0
Some waiters do visit themselves.,Some waiters do visit itself.,morphology,anaphor_agreement,anaphor_number_agreement,True,True,False,True,570,-43.41388702392578,-46.89973449707031,1
Those cashiers have concealed themselves.,Those cashiers have concealed himself.,morphology,anaphor_agreement,anaphor_number_agreement,True,True,False,True,571,-46.53954315185547,-49.77522659301758,1
The children can know themselves.,The children can know itself.,morphology,anaphor_agreement,anaphor_number_agreement,True,True,False,True,572,-29.73495864868164,-31.627073287963867,1
Jacqueline couldn't love herself.,Jacqueline couldn't love themselves.,morphology,anaphor_agreement,anaphor_number_agreement,True,True,False,True,573,-40.2626838684082,-38.947086334228516,0
All drivers would praise themselves.,All drivers would praise herself.,morphology,anaphor_agreement,anaphor_number_agreement,True,True,False,True,574,-33.91726303100586,-38.09911346435547,1
Catherine does complain about herself.,Catherine does complain about themselves.,morphology,anaphor_agreement,anaphor_number_agreement,True,True,False,True,575,-46.470008850097656,-44.817909240722656,0
Beth had upset herself.,Beth had upset themselves.,morphology,anaphor_agreement,anaphor_number_agreement,True,True,False,True,576,-50.743751525878906,-47.99562454223633,0
These senators had seen themselves.,These senators had seen herself.,morphology,anaphor_agreement,anaphor_number_agreement,True,True,False,True,577,-34.65159225463867,-39.060150146484375,1
Those schools don't irritate themselves.,Those schools don't irritate itself.,morphology,anaphor_agreement,anaphor_number_agreement,True,True,False,True,578,-35.974613189697266,-38.77601623535156,1
Waitresses irritate themselves.,Waitresses irritate himself.,morphology,anaphor_agreement,anaphor_number_agreement,True,True,False,True,579,-37.83784484863281,-38.824012756347656,1
A lot of teenagers have visited themselves.,A lot of teenagers have visited himself.,morphology,anaphor_agreement,anaphor_number_agreement,True,True,False,True,580,-47.25830078125,-49.99260711669922,1
All adults worked with themselves.,All adults worked with herself.,morphology,anaphor_agreement,anaphor_number_agreement,True,True,False,True,581,-29.288406372070312,-33.4852294921875,1
The teenagers scared themselves.,The teenagers scared itself.,morphology,anaphor_agreement,anaphor_number_agreement,True,True,False,True,582,-30.136669158935547,-31.823768615722656,1
Valerie wasn't embarrassing herself.,Valerie wasn't embarrassing themselves.,morphology,anaphor_agreement,anaphor_number_agreement,True,True,False,True,583,-43.968788146972656,-44.31538391113281,1
Rhonda does flee from herself.,Rhonda does flee from themselves.,morphology,anaphor_agreement,anaphor_number_agreement,True,True,False,True,584,-46.62700653076172,-45.60085678100586,0
All patients care for themselves.,All patients care for herself.,morphology,anaphor_agreement,anaphor_number_agreement,True,True,False,True,585,-30.710161209106445,-35.3338623046875,1
Sara can visit herself.,Sara can visit themselves.,morphology,anaphor_agreement,anaphor_number_agreement,True,True,False,True,586,-42.02954864501953,-39.758872985839844,0
All doctors wouldn't distract themselves.,All doctors wouldn't distract herself.,morphology,anaphor_agreement,anaphor_number_agreement,True,True,False,True,587,-35.0511589050293,-38.396671295166016,1
Russell sounds like himself.,Russell sounds like themselves.,morphology,anaphor_agreement,anaphor_number_agreement,True,True,False,True,588,-21.351699829101562,-21.729969024658203,1
All actresses approached themselves.,All actresses approached himself.,morphology,anaphor_agreement,anaphor_number_agreement,True,True,False,True,589,-30.704313278198242,-32.48626708984375,1
These people had revealed themselves.,These people had revealed himself.,morphology,anaphor_agreement,anaphor_number_agreement,True,True,False,True,590,-28.13141632080078,-31.049781799316406,1
James isn't talking to himself.,James isn't talking to themselves.,morphology,anaphor_agreement,anaphor_number_agreement,True,True,False,True,591,-22.906295776367188,-23.372142791748047,1
Jennifer is concealing herself.,Jennifer is concealing themselves.,morphology,anaphor_agreement,anaphor_number_agreement,True,True,False,True,592,-36.76348114013672,-36.16946792602539,0
Debra is discovering herself.,Debra is discovering themselves.,morphology,anaphor_agreement,anaphor_number_agreement,True,True,False,True,593,-33.01731872558594,-31.169986724853516,0
Brett thought about himself.,Brett thought about themselves.,morphology,anaphor_agreement,anaphor_number_agreement,True,True,False,True,594,-44.967529296875,-44.33978271484375,0
Jane had upset herself.,Jane had upset themselves.,morphology,anaphor_agreement,anaphor_number_agreement,True,True,False,True,595,-26.688865661621094,-25.000991821289062,0
All doctors haven't respected themselves.,All doctors haven't respected itself.,morphology,anaphor_agreement,anaphor_number_agreement,True,True,False,True,596,-33.339996337890625,-36.888450622558594,1
Marla won't hurt herself.,Marla won't hurt themselves.,morphology,anaphor_agreement,anaphor_number_agreement,True,True,False,True,597,-29.623811721801758,-29.640159606933594,1
These cashiers aren't concealing themselves.,These cashiers aren't concealing himself.,morphology,anaphor_agreement,anaphor_number_agreement,True,True,False,True,598,-56.227561950683594,-59.23333740234375,1
The Impressionists haven't respected themselves.,The Impressionists haven't respected itself.,morphology,anaphor_agreement,anaphor_number_agreement,True,True,False,True,599,-55.47902297973633,-58.35373306274414,1
Teresa has remembered herself.,Teresa has remembered themselves.,morphology,anaphor_agreement,anaphor_number_agreement,True,True,False,True,600,-38.96013641357422,-36.284141540527344,0
Jessica had fired herself.,Jessica had fired themselves.,morphology,anaphor_agreement,anaphor_number_agreement,True,True,False,True,601,-24.018978118896484,-23.66073226928711,0
Mark doesn't flee from himself.,Mark doesn't flee from themselves.,morphology,anaphor_agreement,anaphor_number_agreement,True,True,False,True,602,-35.78472137451172,-35.53666687011719,0
Some museum distracted itself.,Some museum distracted themselves.,morphology,anaphor_agreement,anaphor_number_agreement,True,True,False,True,603,-35.898345947265625,-33.94267272949219,0
Most children aren't upsetting themselves.,Most children aren't upsetting herself.,morphology,anaphor_agreement,anaphor_number_agreement,True,True,False,True,604,-30.237445831298828,-33.54240417480469,1
The company upsets itself.,The company upsets themselves.,morphology,anaphor_agreement,anaphor_number_agreement,True,True,False,True,605,-38.50128173828125,-36.61790466308594,0
Noah would conceal himself.,Noah would conceal themselves.,morphology,anaphor_agreement,anaphor_number_agreement,True,True,False,True,606,-42.62083053588867,-41.91421890258789,0
Kendra might shock herself.,Kendra might shock themselves.,morphology,anaphor_agreement,anaphor_number_agreement,True,True,False,True,607,-52.79024887084961,-50.5029296875,0
The teachers weren't arguing about themselves.,The teachers weren't arguing about itself.,morphology,anaphor_agreement,anaphor_number_agreement,True,True,False,True,608,-38.318302154541016,-40.92258071899414,1
Most universities upset themselves.,Most universities upset himself.,morphology,anaphor_agreement,anaphor_number_agreement,True,True,False,True,609,-29.467315673828125,-32.944175720214844,1
Some bank distracts itself.,Some bank distracts themselves.,morphology,anaphor_agreement,anaphor_number_agreement,True,True,False,True,610,-44.351959228515625,-42.85022735595703,0
These students don't boast about themselves.,These students don't boast about itself.,morphology,anaphor_agreement,anaphor_number_agreement,True,True,False,True,611,-38.02525329589844,-40.982330322265625,1
Candice shouldn't know herself.,Candice shouldn't know themselves.,morphology,anaphor_agreement,anaphor_number_agreement,True,True,False,True,612,-34.01766586303711,-31.98360824584961,0
Melinda concealed herself.,Melinda concealed themselves.,morphology,anaphor_agreement,anaphor_number_agreement,True,True,False,True,613,-35.0982551574707,-33.76378631591797,0
Natalie wouldn't hurt herself.,Natalie wouldn't hurt themselves.,morphology,anaphor_agreement,anaphor_number_agreement,True,True,False,True,614,-38.35362243652344,-37.51060485839844,0
Sandra fled from herself.,Sandra fled from themselves.,morphology,anaphor_agreement,anaphor_number_agreement,True,True,False,True,615,-39.52162170410156,-40.079891204833984,1
April kissed herself.,April kissed themselves.,morphology,anaphor_agreement,anaphor_number_agreement,True,True,False,True,616,-23.264806747436523,-21.185022354125977,0
Travis approached himself.,Travis approached themselves.,morphology,anaphor_agreement,anaphor_number_agreement,True,True,False,True,617,-40.722984313964844,-40.020835876464844,0
A lot of senators watched themselves.,A lot of senators watched herself.,morphology,anaphor_agreement,anaphor_number_agreement,True,True,False,True,618,-50.98534393310547,-54.458961486816406,1
Grace cared for herself.,Grace cared for themselves.,morphology,anaphor_agreement,anaphor_number_agreement,True,True,False,True,619,-32.28427505493164,-29.789676666259766,0
That company annoys itself.,That company annoys themselves.,morphology,anaphor_agreement,anaphor_number_agreement,True,True,False,True,620,-42.26701354980469,-41.50922393798828,0
Teenagers were working with themselves.,Teenagers were working with itself.,morphology,anaphor_agreement,anaphor_number_agreement,True,True,False,True,621,-35.39419937133789,-38.02516555786133,1
Children haven't appreciated themselves.,Children haven't appreciated himself.,morphology,anaphor_agreement,anaphor_number_agreement,True,True,False,True,622,-27.05379867553711,-29.423198699951172,1
Candice isn't visiting herself.,Candice isn't visiting themselves.,morphology,anaphor_agreement,anaphor_number_agreement,True,True,False,True,623,-36.64644241333008,-34.87554168701172,0
Many libraries are stunning themselves.,Many libraries are stunning herself.,morphology,anaphor_agreement,anaphor_number_agreement,True,True,False,True,624,-38.624534606933594,-41.48628616333008,1
Matt doesn't find himself.,Matt doesn't find themselves.,morphology,anaphor_agreement,anaphor_number_agreement,True,True,False,True,625,-19.84095001220703,-19.88039779663086,1
The girls hadn't scared themselves.,The girls hadn't scared himself.,morphology,anaphor_agreement,anaphor_number_agreement,True,True,False,True,626,-35.70211410522461,-37.55404281616211,1
Tiffany isn't criticizing herself.,Tiffany isn't criticizing themselves.,morphology,anaphor_agreement,anaphor_number_agreement,True,True,False,True,627,-55.2639045715332,-53.44853973388672,0
Bill can reference himself.,Bill can reference themselves.,morphology,anaphor_agreement,anaphor_number_agreement,True,True,False,True,628,-33.66154479980469,-32.63858413696289,0
Spain worries itself.,Spain worries themselves.,morphology,anaphor_agreement,anaphor_number_agreement,True,True,False,True,629,-21.503463745117188,-19.80070686340332,0
Lawrence had thought about himself.,Lawrence had thought about themselves.,morphology,anaphor_agreement,anaphor_number_agreement,True,True,False,True,630,-29.769765853881836,-29.736501693725586,0
Connie isn't boasting about herself.,Connie isn't boasting about themselves.,morphology,anaphor_agreement,anaphor_number_agreement,True,True,False,True,631,-48.38470458984375,-47.96382141113281,0
Todd isn't revealing himself.,Todd isn't revealing themselves.,morphology,anaphor_agreement,anaphor_number_agreement,True,True,False,True,632,-29.066362380981445,-29.333065032958984,1
Mark had talked about himself.,Mark had talked about themselves.,morphology,anaphor_agreement,anaphor_number_agreement,True,True,False,True,633,-26.232078552246094,-25.373645782470703,0
The Borgias were escaping from themselves.,The Borgias were escaping from himself.,morphology,anaphor_agreement,anaphor_number_agreement,True,True,False,True,634,-53.41641616821289,-54.44947814941406,1
Phillip hasn't impressed himself.,Phillip hasn't impressed themselves.,morphology,anaphor_agreement,anaphor_number_agreement,True,True,False,True,635,-36.839561462402344,-36.22770309448242,0
Beverly hated herself.,Beverly hated themselves.,morphology,anaphor_agreement,anaphor_number_agreement,True,True,False,True,636,-44.14512634277344,-42.99522018432617,0
Students are working with themselves.,Students are working with itself.,morphology,anaphor_agreement,anaphor_number_agreement,True,True,False,True,637,-19.553287506103516,-22.216018676757812,1
The Clintons shouldn't conceal themselves.,The Clintons shouldn't conceal himself.,morphology,anaphor_agreement,anaphor_number_agreement,True,True,False,True,638,-47.33052444458008,-48.93589401245117,1
These men kiss themselves.,These men kiss herself.,morphology,anaphor_agreement,anaphor_number_agreement,True,True,False,True,639,-24.29779815673828,-28.958194732666016,1
That play isn't disagreeing with itself.,That play isn't disagreeing with themselves.,morphology,anaphor_agreement,anaphor_number_agreement,True,True,False,True,640,-55.96369171142578,-54.112709045410156,0
Guests haven't questioned themselves.,Guests haven't questioned herself.,morphology,anaphor_agreement,anaphor_number_agreement,True,True,False,True,641,-34.88225555419922,-37.994102478027344,1
James distracted himself.,James distracted themselves.,morphology,anaphor_agreement,anaphor_number_agreement,True,True,False,True,642,-20.201679229736328,-20.192771911621094,0
Most girls knew themselves.,Most girls knew himself.,morphology,anaphor_agreement,anaphor_number_agreement,True,True,False,True,643,-26.4730167388916,-29.233890533447266,1
All men can hug themselves.,All men can hug himself.,morphology,anaphor_agreement,anaphor_number_agreement,True,True,False,True,644,-29.80313491821289,-31.419343948364258,1
Those actors admired themselves.,Those actors admired itself.,morphology,anaphor_agreement,anaphor_number_agreement,True,True,False,True,645,-30.49907112121582,-32.83232879638672,1
A documentary should disagree with itself.,A documentary should disagree with themselves.,morphology,anaphor_agreement,anaphor_number_agreement,True,True,False,True,646,-53.39413070678711,-51.59024429321289,0
The guy had admired himself.,The guy had admired themselves.,morphology,anaphor_agreement,anaphor_number_agreement,True,True,False,True,647,-33.300716400146484,-33.40658187866211,1
Dancers sounded like themselves.,Dancers sounded like herself.,morphology,anaphor_agreement,anaphor_number_agreement,True,True,False,True,648,-39.44567108154297,-41.28209686279297,1
Lissa might notice herself.,Lissa might notice themselves.,morphology,anaphor_agreement,anaphor_number_agreement,True,True,False,True,649,-40.74092102050781,-38.237754821777344,0
Some essay is disagreeing with itself.,Some essay is disagreeing with themselves.,morphology,anaphor_agreement,anaphor_number_agreement,True,True,False,True,650,-51.444862365722656,-49.60204315185547,0
Susan wasn't talking about herself.,Susan wasn't talking about themselves.,morphology,anaphor_agreement,anaphor_number_agreement,True,True,False,True,651,-22.740272521972656,-22.60873794555664,0
Amanda would stun herself.,Amanda would stun themselves.,morphology,anaphor_agreement,anaphor_number_agreement,True,True,False,True,652,-39.228233337402344,-37.48297882080078,0
Melanie would reference herself.,Melanie would reference themselves.,morphology,anaphor_agreement,anaphor_number_agreement,True,True,False,True,653,-43.52819061279297,-41.961849212646484,0
The cashiers help themselves.,The cashiers help herself.,morphology,anaphor_agreement,anaphor_number_agreement,True,True,False,True,654,-36.547149658203125,-40.6748046875,1
The adults can return to themselves.,The adults can return to itself.,morphology,anaphor_agreement,anaphor_number_agreement,True,True,False,True,655,-29.79392433166504,-31.376981735229492,1
Holly hadn't worked with herself.,Holly hadn't worked with themselves.,morphology,anaphor_agreement,anaphor_number_agreement,True,True,False,True,656,-35.1973762512207,-34.70521926879883,0
Jessica won't impress herself.,Jessica won't impress themselves.,morphology,anaphor_agreement,anaphor_number_agreement,True,True,False,True,657,-25.103404998779297,-24.87607192993164,0
A lot of waitresses astound themselves.,A lot of waitresses astound itself.,morphology,anaphor_agreement,anaphor_number_agreement,True,True,False,True,658,-67.2580337524414,-68.40504455566406,1
A lot of actors might visit themselves.,A lot of actors might visit herself.,morphology,anaphor_agreement,anaphor_number_agreement,True,True,False,True,659,-49.37089157104492,-53.07389831542969,1
Actresses hadn't hidden themselves.,Actresses hadn't hidden himself.,morphology,anaphor_agreement,anaphor_number_agreement,True,True,False,True,660,-42.49420928955078,-43.19349670410156,1
Those adults hadn't irritated themselves.,Those adults hadn't irritated itself.,morphology,anaphor_agreement,anaphor_number_agreement,True,True,False,True,661,-37.38304901123047,-41.15705108642578,1
Some actresses discover themselves.,Some actresses discover herself.,morphology,anaphor_agreement,anaphor_number_agreement,True,True,False,True,662,-31.050090789794922,-34.95127487182617,1
Stephanie couldn't talk to herself.,Stephanie couldn't talk to themselves.,morphology,anaphor_agreement,anaphor_number_agreement,True,True,False,True,663,-35.71927261352539,-35.219146728515625,0
Many universities haven't worried themselves.,Many universities haven't worried himself.,morphology,anaphor_agreement,anaphor_number_agreement,True,True,False,True,664,-38.981163024902344,-41.34016418457031,1
Dancers hated themselves.,Dancers hated himself.,morphology,anaphor_agreement,anaphor_number_agreement,True,True,False,True,665,-34.175987243652344,-35.63690185546875,1
Homer hadn't remembered himself.,Homer hadn't remembered themselves.,morphology,anaphor_agreement,anaphor_number_agreement,True,True,False,True,666,-42.21221923828125,-41.69082260131836,0
All actors wouldn't forget themselves.,All actors wouldn't forget itself.,morphology,anaphor_agreement,anaphor_number_agreement,True,True,False,True,667,-35.499263763427734,-37.52404022216797,1
A lot of girls hadn't hidden themselves.,A lot of girls hadn't hidden himself.,morphology,anaphor_agreement,anaphor_number_agreement,True,True,False,True,668,-50.579559326171875,-51.97240447998047,1
All dancers discussed themselves.,All dancers discussed herself.,morphology,anaphor_agreement,anaphor_number_agreement,True,True,False,True,669,-31.47511100769043,-35.601402282714844,1
Dana impressed herself.,Dana impressed themselves.,morphology,anaphor_agreement,anaphor_number_agreement,True,True,False,True,670,-33.02647399902344,-31.035207748413086,0
Some waitress did discuss herself.,Some waitress did discuss themselves.,morphology,anaphor_agreement,anaphor_number_agreement,True,True,False,True,671,-45.01951217651367,-40.71168899536133,0
Heather wasn't healing herself.,Heather wasn't healing themselves.,morphology,anaphor_agreement,anaphor_number_agreement,True,True,False,True,672,-41.60797119140625,-43.25096893310547,1
Some ladies aren't worrying themselves.,Some ladies aren't worrying herself.,morphology,anaphor_agreement,anaphor_number_agreement,True,True,False,True,673,-35.96922302246094,-39.49228286743164,1
A lot of drivers fired themselves.,A lot of drivers fired itself.,morphology,anaphor_agreement,anaphor_number_agreement,True,True,False,True,674,-44.677825927734375,-47.87550354003906,1
Most committees had astounded themselves.,Most committees had astounded itself.,morphology,anaphor_agreement,anaphor_number_agreement,True,True,False,True,675,-43.813011169433594,-45.811256408691406,1
Most adults disgusted themselves.,Most adults disgusted himself.,morphology,anaphor_agreement,anaphor_number_agreement,True,True,False,True,676,-30.4141845703125,-34.560142517089844,1
Many cashiers cured themselves.,Many cashiers cured himself.,morphology,anaphor_agreement,anaphor_number_agreement,True,True,False,True,677,-42.609405517578125,-45.52033233642578,1
Debra was scaring herself.,Debra was scaring themselves.,morphology,anaphor_agreement,anaphor_number_agreement,True,True,False,True,678,-31.90167236328125,-30.213375091552734,0
Some universities aren't bothering themselves.,Some universities aren't bothering himself.,morphology,anaphor_agreement,anaphor_number_agreement,True,True,False,True,679,-30.6746768951416,-34.00556182861328,1
Vincent astounded himself.,Vincent astounded themselves.,morphology,anaphor_agreement,anaphor_number_agreement,True,True,False,True,680,-46.593048095703125,-47.06617736816406,1
Those students could return to themselves.,Those students could return to herself.,morphology,anaphor_agreement,anaphor_number_agreement,True,True,False,True,681,-28.063947677612305,-31.97032928466797,1
Alice might confuse herself.,Alice might confuse themselves.,morphology,anaphor_agreement,anaphor_number_agreement,True,True,False,True,682,-30.585983276367188,-28.512386322021484,0
All cashiers aggravated themselves.,All cashiers aggravated itself.,morphology,anaphor_agreement,anaphor_number_agreement,True,True,False,True,683,-50.00983428955078,-52.070465087890625,1
Deborah can't conceal herself.,Deborah can't conceal themselves.,morphology,anaphor_agreement,anaphor_number_agreement,True,True,False,True,684,-34.869285583496094,-33.681068420410156,0
A lot of drivers return to themselves.,A lot of drivers return to itself.,morphology,anaphor_agreement,anaphor_number_agreement,True,True,False,True,685,-47.48291778564453,-49.574607849121094,1
Carlos had discussed himself.,Carlos had discussed themselves.,morphology,anaphor_agreement,anaphor_number_agreement,True,True,False,True,686,-31.213090896606445,-30.75000762939453,0
A lot of girls can watch themselves.,A lot of girls can watch herself.,morphology,anaphor_agreement,anaphor_number_agreement,True,True,False,True,687,-38.273563385009766,-42.11981201171875,1
Karla hadn't hurt herself.,Karla hadn't hurt themselves.,morphology,anaphor_agreement,anaphor_number_agreement,True,True,False,True,688,-33.90705490112305,-33.213348388671875,0
Jessica escaped from herself.,Jessica escaped from themselves.,morphology,anaphor_agreement,anaphor_number_agreement,True,True,False,True,689,-21.76407814025879,-21.40749740600586,0
The Impressionists weren't appreciating themselves.,The Impressionists weren't appreciating herself.,morphology,anaphor_agreement,anaphor_number_agreement,True,True,False,True,690,-63.362274169921875,-66.34896850585938,1
