sentence_good,sentence_bad,field,linguistics_term,UID,simple_LM_method,one_prefix_method,two_prefix_method,lexically_identical,pair_id,good_prob,bad_prob,correct
James is pleasant to flee from.,James is apt to flee from.,syntax_semantics,control_raising,tough_vs_raising_1,True,False,False,False,0,-39.23689270019531,-39.441864013671875,1
Samuel's lawyer was easy to reference.,Samuel's lawyer was certain to reference.,syntax_semantics,control_raising,tough_vs_raising_1,True,False,False,False,1,-49.257102966308594,-50.858463287353516,1
Benjamin's tutor was easy to boast about.,Benjamin's tutor was certain to boast about.,syntax_semantics,control_raising,tough_vs_raising_1,True,False,False,False,2,-65.85936737060547,-71.19412231445312,1
Laura isn't interesting to cure.,Laura isn't soon to cure.,syntax_semantics,control_raising,tough_vs_raising_1,True,False,False,False,3,-32.1255989074707,-34.76544189453125,1
Some jacket wasn't ready to wear.,Some jacket wasn't bound to wear.,syntax_semantics,control_raising,tough_vs_raising_1,True,False,False,False,4,-38.68452453613281,-41.91963195800781,1
Many drivers aren't difficult to reference.,Many drivers aren't likely to reference.,syntax_semantics,control_raising,tough_vs_raising_1,True,False,False,False,5,-41.724029541015625,-41.334938049316406,0
Julia wasn't fun to talk to.,Julia wasn't unlikely to talk to.,syntax_semantics,control_raising,tough_vs_raising_1,True,False,False,False,6,-33.3812141418457,-39.161155700683594,1
Valerie's colleagues aren't pleasant to respect.,Valerie's colleagues aren't likely to respect.,syntax_semantics,control_raising,tough_vs_raising_1,True,False,False,False,7,-57.068946838378906,-55.09025955200195,0
Veronica isn't boring to conceal.,Veronica isn't unlikely to conceal.,syntax_semantics,control_raising,tough_vs_raising_1,True,False,False,False,8,-44.33181381225586,-46.03184509277344,1
Stacey wasn't interesting to listen to.,Stacey wasn't soon to listen to.,syntax_semantics,control_raising,tough_vs_raising_1,True,False,False,False,9,-47.20846176147461,-50.33250427246094,1
Those glasses aren't hard work to wear.,Those glasses aren't soon to wear.,syntax_semantics,control_raising,tough_vs_raising_1,True,False,False,False,10,-41.73709487915039,-41.58405303955078,0
Linda was interesting to reference.,Linda was soon to reference.,syntax_semantics,control_raising,tough_vs_raising_1,True,False,False,False,11,-41.06333923339844,-42.99772644042969,1
This waitress is exciting to conceal.,This waitress is unlikely to conceal.,syntax_semantics,control_raising,tough_vs_raising_1,True,False,False,False,12,-42.68702697753906,-44.31107711791992,1
Some drivers are tough to listen to.,Some drivers are apt to listen to.,syntax_semantics,control_raising,tough_vs_raising_1,True,False,False,False,13,-32.975467681884766,-35.7021369934082,1
Omar wasn't interesting to reference.,Omar wasn't soon to reference.,syntax_semantics,control_raising,tough_vs_raising_1,True,False,False,False,14,-46.57450866699219,-50.99626541137695,1
Every dress isn't unpleasant to wear.,Every dress isn't likely to wear.,syntax_semantics,control_raising,tough_vs_raising_1,True,False,False,False,15,-44.39379119873047,-39.448646545410156,0
Raymond wasn't hard to argue about.,Raymond wasn't soon to argue about.,syntax_semantics,control_raising,tough_vs_raising_1,True,False,False,False,16,-41.573219299316406,-48.44968795776367,1
Robert wasn't pleasant to respect.,Robert wasn't soon to respect.,syntax_semantics,control_raising,tough_vs_raising_1,True,False,False,False,17,-35.076480865478516,-35.793399810791016,1
Clyde's partners are annoying to respect.,Clyde's partners are apt to respect.,syntax_semantics,control_raising,tough_vs_raising_1,True,False,False,False,18,-75.89105987548828,-75.01640319824219,0
These bikes aren't unpleasant to conceal.,These bikes aren't apt to conceal.,syntax_semantics,control_raising,tough_vs_raising_1,True,False,False,False,19,-48.6463508605957,-48.16337585449219,0
Colleen's girlfriend is irritating to cure.,Colleen's girlfriend is about to cure.,syntax_semantics,control_raising,tough_vs_raising_1,True,False,False,False,20,-53.46311569213867,-45.89786911010742,0
Kayla wasn't pleasant to cure.,Kayla wasn't bound to cure.,syntax_semantics,control_raising,tough_vs_raising_1,True,False,False,False,21,-44.31188201904297,-40.97039031982422,0
The restaurant was easy to drive to.,The restaurant was about to drive to.,syntax_semantics,control_raising,tough_vs_raising_1,True,False,False,False,22,-34.24280548095703,-36.819358825683594,1
A school was ready to go to.,A school was apt to go to.,syntax_semantics,control_raising,tough_vs_raising_1,True,False,False,False,23,-41.340675354003906,-48.131927490234375,1
Leslie was tough to escape from.,Leslie was unlikely to escape from.,syntax_semantics,control_raising,tough_vs_raising_1,True,False,False,False,24,-45.656455993652344,-50.663841247558594,1
Some glaciers are unpleasant to return to.,Some glaciers are likely to return to.,syntax_semantics,control_raising,tough_vs_raising_1,True,False,False,False,25,-47.31017303466797,-40.30223083496094,0
Sonia isn't exciting to care for.,Sonia isn't bound to care for.,syntax_semantics,control_raising,tough_vs_raising_1,True,False,False,False,26,-51.276222229003906,-48.866207122802734,0
Kevin isn't irritating to work with.,Kevin isn't bound to work with.,syntax_semantics,control_raising,tough_vs_raising_1,True,False,False,False,27,-35.96148681640625,-31.144691467285156,0
A restaurant was enjoyable to arrive at.,A restaurant was unlikely to arrive at.,syntax_semantics,control_raising,tough_vs_raising_1,True,False,False,False,28,-57.619903564453125,-55.316184997558594,0
Some blouse wasn't irritating to wear.,Some blouse wasn't about to wear.,syntax_semantics,control_raising,tough_vs_raising_1,True,False,False,False,29,-50.70188903808594,-46.952083587646484,0
What wasn't ready to wear.,What wasn't soon to wear.,syntax_semantics,control_raising,tough_vs_raising_1,True,False,False,False,30,-31.35753059387207,-36.88998794555664,1
Daniel's ex-boyfriends weren't exciting to flee from.,Daniel's ex-boyfriends weren't soon to flee from.,syntax_semantics,control_raising,tough_vs_raising_1,True,False,False,False,31,-77.18966674804688,-77.95503234863281,1
The Impressionists were hard work to disagree with.,The Impressionists were likely to disagree with.,syntax_semantics,control_raising,tough_vs_raising_1,True,False,False,False,32,-63.601158142089844,-56.39778137207031,0
Judy is easy to work with.,Judy is certain to work with.,syntax_semantics,control_raising,tough_vs_raising_1,True,False,False,False,33,-29.873924255371094,-36.670814514160156,1
Craig's associates are irritating to talk about.,Craig's associates are about to talk about.,syntax_semantics,control_raising,tough_vs_raising_1,True,False,False,False,34,-42.92360305786133,-36.27538299560547,0
Marie wasn't fun to complain about.,Marie wasn't unlikely to complain about.,syntax_semantics,control_raising,tough_vs_raising_1,True,False,False,False,35,-38.35275650024414,-42.98652648925781,1
The public park isn't pleasant to drive to.,The public park isn't about to drive to.,syntax_semantics,control_raising,tough_vs_raising_1,True,False,False,False,36,-51.7589111328125,-47.60809326171875,0
Rivers were hard work to bike to.,Rivers were bound to bike to.,syntax_semantics,control_raising,tough_vs_raising_1,True,False,False,False,37,-57.53745651245117,-52.02366638183594,0
Christina is annoying to scare.,Christina is about to scare.,syntax_semantics,control_raising,tough_vs_raising_1,True,False,False,False,38,-39.20310592651367,-33.480682373046875,0
A lot of rugs aren't annoying to lift.,A lot of rugs aren't about to lift.,syntax_semantics,control_raising,tough_vs_raising_1,True,False,False,False,39,-67.49024963378906,-62.810707092285156,0
Vanessa is fun to work with.,Vanessa is likely to work with.,syntax_semantics,control_raising,tough_vs_raising_1,True,False,False,False,40,-34.60722351074219,-34.12359619140625,0
A doctor isn't difficult to respect.,A doctor isn't certain to respect.,syntax_semantics,control_raising,tough_vs_raising_1,True,False,False,False,41,-48.234676361083984,-52.241031646728516,1
Karla's handyman is pleasant to reference.,Karla's handyman is sure to reference.,syntax_semantics,control_raising,tough_vs_raising_1,True,False,False,False,42,-64.43218231201172,-65.26748657226562,1
Most actors aren't enjoyable to conceal.,Most actors aren't bound to conceal.,syntax_semantics,control_raising,tough_vs_raising_1,True,False,False,False,43,-45.69674301147461,-40.569339752197266,0
Steven's niece isn't fun to flee from.,Steven's niece isn't sure to flee from.,syntax_semantics,control_raising,tough_vs_raising_1,True,False,False,False,44,-52.72796630859375,-53.62052917480469,1
These sisters of Angela aren't ready to cure.,These sisters of Angela aren't unlikely to cure.,syntax_semantics,control_raising,tough_vs_raising_1,True,False,False,False,45,-52.093910217285156,-60.31755065917969,1
Some banks weren't enjoyable to go to.,Some banks weren't certain to go to.,syntax_semantics,control_raising,tough_vs_raising_1,True,False,False,False,46,-43.859107971191406,-42.73689270019531,0
That glacier was exciting to go to.,That glacier was certain to go to.,syntax_semantics,control_raising,tough_vs_raising_1,True,False,False,False,47,-46.78961181640625,-49.25364303588867,1
That mountain isn't difficult to bike to.,That mountain isn't likely to bike to.,syntax_semantics,control_raising,tough_vs_raising_1,True,False,False,False,48,-47.898101806640625,-50.25257873535156,1
A lot of children aren't exciting to escape from.,A lot of children aren't unlikely to escape from.,syntax_semantics,control_raising,tough_vs_raising_1,True,False,False,False,49,-61.35996627807617,-63.511470794677734,1
Many adults weren't exciting to argue about.,Many adults weren't apt to argue about.,syntax_semantics,control_raising,tough_vs_raising_1,True,False,False,False,50,-43.50926971435547,-44.876617431640625,1
Most shawls weren't interesting to wear.,Most shawls weren't certain to wear.,syntax_semantics,control_raising,tough_vs_raising_1,True,False,False,False,51,-59.005821228027344,-61.37834548950195,1
This college campus wasn't exciting to bike to.,This college campus wasn't unlikely to bike to.,syntax_semantics,control_raising,tough_vs_raising_1,True,False,False,False,52,-60.3921012878418,-63.691810607910156,1
Some rivers weren't easy to bike to.,Some rivers weren't bound to bike to.,syntax_semantics,control_raising,tough_vs_raising_1,True,False,False,False,53,-47.0143928527832,-48.04730224609375,1
That grocery store was tough to go to.,That grocery store was apt to go to.,syntax_semantics,control_raising,tough_vs_raising_1,True,False,False,False,54,-46.22333908081055,-51.72344207763672,1
Raymond was fun to complain about.,Raymond was likely to complain about.,syntax_semantics,control_raising,tough_vs_raising_1,True,False,False,False,55,-41.616153717041016,-40.36174774169922,0
Rebecca is ready to cure.,Rebecca is likely to cure.,syntax_semantics,control_raising,tough_vs_raising_1,True,False,False,False,56,-26.500350952148438,-30.80547332763672,1
Heidi's grandfather isn't difficult to examine.,Heidi's grandfather isn't about to examine.,syntax_semantics,control_raising,tough_vs_raising_1,True,False,False,False,57,-58.20045471191406,-57.48506164550781,0
Carl was exciting to listen to.,Carl was soon to listen to.,syntax_semantics,control_raising,tough_vs_raising_1,True,False,False,False,58,-28.606311798095703,-28.151264190673828,0
Rabbits are hard work to reveal.,Rabbits are soon to reveal.,syntax_semantics,control_raising,tough_vs_raising_1,True,False,False,False,59,-57.21122741699219,-57.50188446044922,1
Those brothers of Jeffrey were boring to reference.,Those brothers of Jeffrey were sure to reference.,syntax_semantics,control_raising,tough_vs_raising_1,True,False,False,False,60,-57.93799591064453,-57.704158782958984,0
Carolyn's cousin wasn't hard to respect.,Carolyn's cousin wasn't bound to respect.,syntax_semantics,control_raising,tough_vs_raising_1,True,False,False,False,61,-55.31689453125,-58.32787322998047,1
Patrick is irritating to respect.,Patrick is about to respect.,syntax_semantics,control_raising,tough_vs_raising_1,True,False,False,False,62,-31.348785400390625,-25.48522186279297,0
April isn't interesting to conceal.,April isn't bound to conceal.,syntax_semantics,control_raising,tough_vs_raising_1,True,False,False,False,63,-38.68648910522461,-36.87832260131836,0
This grocery store was annoying to drive to.,This grocery store was apt to drive to.,syntax_semantics,control_raising,tough_vs_raising_1,True,False,False,False,64,-54.11506652832031,-51.450252532958984,0
Guy is tough to escape from.,Guy is certain to escape from.,syntax_semantics,control_raising,tough_vs_raising_1,True,False,False,False,65,-30.99740219116211,-35.30074691772461,1
Some bread is boring to lift.,Some bread is bound to lift.,syntax_semantics,control_raising,tough_vs_raising_1,True,False,False,False,66,-36.98135757446289,-34.27338409423828,0
Jill isn't fun to conceal.,Jill isn't about to conceal.,syntax_semantics,control_raising,tough_vs_raising_1,True,False,False,False,67,-48.7358512878418,-49.20629119873047,1
That bank isn't enjoyable to drop by.,That bank isn't likely to drop by.,syntax_semantics,control_raising,tough_vs_raising_1,True,False,False,False,68,-52.095733642578125,-46.2209587097168,0
Carmen isn't boring to scare.,Carmen isn't apt to scare.,syntax_semantics,control_raising,tough_vs_raising_1,True,False,False,False,69,-55.42518615722656,-55.15614318847656,0
Denise was hard work to reveal.,Denise was bound to reveal.,syntax_semantics,control_raising,tough_vs_raising_1,True,False,False,False,70,-40.66638946533203,-35.02043151855469,0
Elizabeth wasn't boring to flee from.,Elizabeth wasn't about to flee from.,syntax_semantics,control_raising,tough_vs_raising_1,True,False,False,False,71,-43.186405181884766,-39.27320098876953,0
Janice isn't hard to argue about.,Janice isn't soon to argue about.,syntax_semantics,control_raising,tough_vs_raising_1,True,False,False,False,72,-40.266441345214844,-48.91337585449219,1
Kayla isn't fun to fire.,Kayla isn't certain to fire.,syntax_semantics,control_raising,tough_vs_raising_1,True,False,False,False,73,-38.56383514404297,-42.884727478027344,1
Katherine's best friend wasn't hard work to scare.,Katherine's best friend wasn't likely to scare.,syntax_semantics,control_raising,tough_vs_raising_1,True,False,False,False,74,-66.38114929199219,-58.78865432739258,0
Daniel isn't hard work to scare.,Daniel isn't likely to scare.,syntax_semantics,control_raising,tough_vs_raising_1,True,False,False,False,75,-37.34223937988281,-31.999509811401367,0
Some friend of Alicia was ready to fire.,Some friend of Alicia was soon to fire.,syntax_semantics,control_raising,tough_vs_raising_1,True,False,False,False,76,-46.837249755859375,-52.11463165283203,1
Naomi is easy to complain about.,Naomi is apt to complain about.,syntax_semantics,control_raising,tough_vs_raising_1,True,False,False,False,77,-38.12588882446289,-44.480445861816406,1
Beth was ready to listen to.,Beth was unlikely to listen to.,syntax_semantics,control_raising,tough_vs_raising_1,True,False,False,False,78,-46.28955841064453,-52.76994323730469,1
Amy's partners were enjoyable to boast about.,Amy's partners were about to boast about.,syntax_semantics,control_raising,tough_vs_raising_1,True,False,False,False,79,-55.22254943847656,-50.04846954345703,0
All offspring aren't ready to complain about.,All offspring aren't certain to complain about.,syntax_semantics,control_raising,tough_vs_raising_1,True,False,False,False,80,-41.82331466674805,-48.850669860839844,1
Katherine is difficult to care for.,Katherine is unlikely to care for.,syntax_semantics,control_raising,tough_vs_raising_1,True,False,False,False,81,-39.08503341674805,-44.425048828125,1
Teresa wasn't tough to work with.,Teresa wasn't apt to work with.,syntax_semantics,control_raising,tough_vs_raising_1,True,False,False,False,82,-42.21189498901367,-46.48640060424805,1
They were irritating to respect.,They were certain to respect.,syntax_semantics,control_raising,tough_vs_raising_1,True,False,False,False,83,-31.375701904296875,-26.891071319580078,0
Maria is unpleasant to argue about.,Maria is bound to argue about.,syntax_semantics,control_raising,tough_vs_raising_1,True,False,False,False,84,-35.842491149902344,-31.185527801513672,0
A restaurant wasn't ready to drop by.,A restaurant wasn't sure to drop by.,syntax_semantics,control_raising,tough_vs_raising_1,True,False,False,False,85,-53.32264709472656,-57.25632858276367,1
Raymond isn't difficult to talk about.,Raymond isn't apt to talk about.,syntax_semantics,control_raising,tough_vs_raising_1,True,False,False,False,86,-37.42041778564453,-42.178070068359375,1
Laura isn't fun to fire.,Laura isn't likely to fire.,syntax_semantics,control_raising,tough_vs_raising_1,True,False,False,False,87,-29.466455459594727,-29.60594940185547,1
That lady isn't hard to escape from.,That lady isn't sure to escape from.,syntax_semantics,control_raising,tough_vs_raising_1,True,False,False,False,88,-42.44758987426758,-46.9705810546875,1
These essays about the Lutherans were fun to argue about.,These essays about the Lutherans were apt to argue about.,syntax_semantics,control_raising,tough_vs_raising_1,True,False,False,False,89,-76.1822280883789,-78.91545104980469,1
Denise wasn't boring to flee from.,Denise wasn't soon to flee from.,syntax_semantics,control_raising,tough_vs_raising_1,True,False,False,False,90,-49.05683898925781,-50.86540222167969,1
Most nuclei were ready to lift.,Most nuclei were apt to lift.,syntax_semantics,control_raising,tough_vs_raising_1,True,False,False,False,91,-46.89061737060547,-54.13671112060547,1
Amelia isn't boring to talk to.,Amelia isn't about to talk to.,syntax_semantics,control_raising,tough_vs_raising_1,True,False,False,False,92,-44.00596237182617,-39.7596435546875,0
Winston Churchill was tough to conceal.,Winston Churchill was unlikely to conceal.,syntax_semantics,control_raising,tough_vs_raising_1,True,False,False,False,93,-49.96037292480469,-54.27702331542969,1
Ann wasn't tough to conceal.,Ann wasn't likely to conceal.,syntax_semantics,control_raising,tough_vs_raising_1,True,False,False,False,94,-37.327796936035156,-36.47879409790039,0
Elaine is unpleasant to reference.,Elaine is apt to reference.,syntax_semantics,control_raising,tough_vs_raising_1,True,False,False,False,95,-42.447853088378906,-41.934112548828125,0
Victoria isn't pleasant to argue about.,Victoria isn't certain to argue about.,syntax_semantics,control_raising,tough_vs_raising_1,True,False,False,False,96,-37.18575668334961,-38.49577331542969,1
That skirt is annoying to wear.,That skirt is certain to wear.,syntax_semantics,control_raising,tough_vs_raising_1,True,False,False,False,97,-40.802188873291016,-40.924381256103516,1
Harvard University was ready to drive to.,Harvard University was likely to drive to.,syntax_semantics,control_raising,tough_vs_raising_1,True,False,False,False,98,-46.75519561767578,-49.28562545776367,1
Angela was ready to reference.,Angela was soon to reference.,syntax_semantics,control_raising,tough_vs_raising_1,True,False,False,False,99,-32.26795196533203,-38.506813049316406,1
Bruce is tough to scare.,Bruce is sure to scare.,syntax_semantics,control_raising,tough_vs_raising_1,True,False,False,False,100,-23.47015953063965,-29.171457290649414,1
This father of every actress isn't hard work to respect.,This father of every actress isn't about to respect.,syntax_semantics,control_raising,tough_vs_raising_1,True,False,False,False,101,-70.47604370117188,-59.70747375488281,0
The Great Lakes were boring to bike to.,The Great Lakes were likely to bike to.,syntax_semantics,control_raising,tough_vs_raising_1,True,False,False,False,102,-54.30854034423828,-52.17922592163086,0
That actress is exciting to boast about.,That actress is unlikely to boast about.,syntax_semantics,control_raising,tough_vs_raising_1,True,False,False,False,103,-53.68018341064453,-55.61907958984375,1
Brad is hard to listen to.,Brad is apt to listen to.,syntax_semantics,control_raising,tough_vs_raising_1,True,False,False,False,104,-20.22885513305664,-30.4041748046875,1
Lucille's mothers were interesting to escape from.,Lucille's mothers were certain to escape from.,syntax_semantics,control_raising,tough_vs_raising_1,True,False,False,False,105,-56.68275833129883,-57.623199462890625,1
Holly is annoying to flee from.,Holly is soon to flee from.,syntax_semantics,control_raising,tough_vs_raising_1,True,False,False,False,106,-48.22044372558594,-47.717796325683594,0
Dancers' hairdressers were ready to argue about.,Dancers' hairdressers were apt to argue about.,syntax_semantics,control_raising,tough_vs_raising_1,True,False,False,False,107,-76.78981018066406,-84.7003173828125,1
Most cafes are boring to walk through.,Most cafes are unlikely to walk through.,syntax_semantics,control_raising,tough_vs_raising_1,True,False,False,False,108,-44.25691223144531,-46.48799514770508,1
Elizabeth isn't annoying to work with.,Elizabeth isn't soon to work with.,syntax_semantics,control_raising,tough_vs_raising_1,True,False,False,False,109,-34.318115234375,-34.09355926513672,0
Denise isn't easy to reveal.,Denise isn't certain to reveal.,syntax_semantics,control_raising,tough_vs_raising_1,True,False,False,False,110,-36.386932373046875,-43.0104866027832,1
Michelle is tough to escape from.,Michelle is about to escape from.,syntax_semantics,control_raising,tough_vs_raising_1,True,False,False,False,111,-31.975208282470703,-32.07081604003906,1
Tamara isn't enjoyable to work with.,Tamara isn't apt to work with.,syntax_semantics,control_raising,tough_vs_raising_1,True,False,False,False,112,-45.989990234375,-42.16743469238281,0
Dan wasn't hard to boast about.,Dan wasn't likely to boast about.,syntax_semantics,control_raising,tough_vs_raising_1,True,False,False,False,113,-42.00726318359375,-44.41260528564453,1
That oasis is irritating to walk through.,That oasis is likely to walk through.,syntax_semantics,control_raising,tough_vs_raising_1,True,False,False,False,114,-51.596527099609375,-47.02951431274414,0
James was pleasant to reference.,James was apt to reference.,syntax_semantics,control_raising,tough_vs_raising_1,True,False,False,False,115,-32.28596496582031,-33.86309814453125,1
Vanessa's colleague was annoying to cure.,Vanessa's colleague was sure to cure.,syntax_semantics,control_raising,tough_vs_raising_1,True,False,False,False,116,-56.90876007080078,-53.24867248535156,0
Carolyn isn't enjoyable to boast about.,Carolyn isn't about to boast about.,syntax_semantics,control_raising,tough_vs_raising_1,True,False,False,False,117,-61.285369873046875,-55.329917907714844,0
The grandson of those teenagers is pleasant to conceal.,The grandson of those teenagers is likely to conceal.,syntax_semantics,control_raising,tough_vs_raising_1,True,False,False,False,118,-59.424739837646484,-55.752933502197266,0
Monica isn't exciting to escape from.,Monica isn't unlikely to escape from.,syntax_semantics,control_raising,tough_vs_raising_1,True,False,False,False,119,-46.2517204284668,-49.07189178466797,1
Teresa isn't tough to disagree with.,Teresa isn't bound to disagree with.,syntax_semantics,control_raising,tough_vs_raising_1,True,False,False,False,120,-45.02512741088867,-45.123775482177734,1
That customer was fun to listen to.,That customer was sure to listen to.,syntax_semantics,control_raising,tough_vs_raising_1,True,False,False,False,121,-37.5506591796875,-39.69839859008789,1
A lot of blouses are tough to wear.,A lot of blouses are bound to wear.,syntax_semantics,control_raising,tough_vs_raising_1,True,False,False,False,122,-60.321346282958984,-59.998870849609375,0
Many newspaper articles were ready to conceal.,Many newspaper articles were apt to conceal.,syntax_semantics,control_raising,tough_vs_raising_1,True,False,False,False,123,-47.79292678833008,-54.81203842163086,1
Rachelle isn't tough to reveal.,Rachelle isn't certain to reveal.,syntax_semantics,control_raising,tough_vs_raising_1,True,False,False,False,124,-42.203636169433594,-46.87466812133789,1
All grocery stores are boring to drop by.,All grocery stores are unlikely to drop by.,syntax_semantics,control_raising,tough_vs_raising_1,True,False,False,False,125,-49.529605865478516,-52.07622528076172,1
Sheila's employees were hard work to fire.,Sheila's employees were likely to fire.,syntax_semantics,control_raising,tough_vs_raising_1,True,False,False,False,126,-59.398597717285156,-52.64886474609375,0
Aaron's friend was pleasant to disagree with.,Aaron's friend was about to disagree with.,syntax_semantics,control_raising,tough_vs_raising_1,True,False,False,False,127,-46.046546936035156,-40.22278594970703,0
Every son of Jerry isn't enjoyable to cure.,Every son of Jerry isn't soon to cure.,syntax_semantics,control_raising,tough_vs_raising_1,True,False,False,False,128,-59.160888671875,-56.609657287597656,0
Steve's mother was irritating to examine.,Steve's mother was about to examine.,syntax_semantics,control_raising,tough_vs_raising_1,True,False,False,False,129,-42.237998962402344,-34.02334976196289,0
Rachel isn't easy to talk to.,Rachel isn't about to talk to.,syntax_semantics,control_raising,tough_vs_raising_1,True,False,False,False,130,-26.838085174560547,-29.74102020263672,1
All waitresses' electrician isn't fun to reference.,All waitresses' electrician isn't soon to reference.,syntax_semantics,control_raising,tough_vs_raising_1,True,False,False,False,131,-88.29695892333984,-94.02531433105469,1
Andrew isn't exciting to listen to.,Andrew isn't certain to listen to.,syntax_semantics,control_raising,tough_vs_raising_1,True,False,False,False,132,-30.63112449645996,-35.448997497558594,1
