sentence_good,sentence_bad,field,linguistics_term,UID,simple_LM_method,one_prefix_method,two_prefix_method,lexically_identical,pair_id,good_prob,bad_prob,correct
A lot of dancers cured this boy.,A lot of dancers cured this boys.,morphology,determiner_noun_agreement,determiner_noun_agreement_1,True,True,False,True,256,-58.30978775024414,-59.25817108154297,1
Tiffany hadn't distracted this patient.,Tiffany hadn't distracted this patients.,morphology,determiner_noun_agreement,determiner_noun_agreement_1,True,True,False,True,257,-62.71616744995117,-63.473419189453125,1
Students sell that rug.,Students sell that rugs.,morphology,determiner_noun_agreement,determiner_noun_agreement_1,True,True,False,True,258,-27.627750396728516,-31.761005401611328,1
Christopher concealed this art gallery.,Christopher concealed this art galleries.,morphology,determiner_noun_agreement,determiner_noun_agreement_1,True,True,False,True,259,-44.263458251953125,-44.06077575683594,0
These guys admired that school.,These guys admired that schools.,morphology,determiner_noun_agreement,determiner_noun_agreement_1,True,True,False,True,260,-33.974090576171875,-35.36216735839844,1
Rugs astound that association.,Rugs astound that associations.,morphology,determiner_noun_agreement,determiner_noun_agreement_1,True,True,False,True,261,-59.468353271484375,-61.92084503173828,1
Robert wasn't scaring these museums.,Robert wasn't scaring these museum.,morphology,determiner_noun_agreement,determiner_noun_agreement_1,True,True,False,True,262,-40.98280715942383,-42.137420654296875,1
Kendra investigates these ladies.,Kendra investigates these lady.,morphology,determiner_noun_agreement,determiner_noun_agreement_1,True,True,False,True,263,-56.39253234863281,-58.02153015136719,1
A lot of ladies arrive at that museum.,A lot of ladies arrive at that museums.,morphology,determiner_noun_agreement,determiner_noun_agreement_1,True,True,False,True,264,-52.34239196777344,-57.12015914916992,1
Some pedestrians drive to this movie theater.,Some pedestrians drive to this movie theaters.,morphology,determiner_noun_agreement,determiner_noun_agreement_1,True,True,False,True,265,-46.36236572265625,-47.38337707519531,1
Tonya hasn't remembered that brochure.,Tonya hasn't remembered that brochures.,morphology,determiner_noun_agreement,determiner_noun_agreement_1,True,True,False,True,266,-55.85836410522461,-53.94961166381836,0
Museums hadn't disturbed that patient.,Museums hadn't disturbed that patients.,morphology,determiner_noun_agreement,determiner_noun_agreement_1,True,True,False,True,267,-62.9903564453125,-64.09432220458984,1
Every person left that actress.,Every person left that actresses.,morphology,determiner_noun_agreement,determiner_noun_agreement_1,True,True,False,True,268,-28.637596130371094,-29.06911277770996,1
Sandra should disgust that actor.,Sandra should disgust that actors.,morphology,determiner_noun_agreement,determiner_noun_agreement_1,True,True,False,True,269,-52.87028503417969,-54.50383758544922,1
Amelia is disgusting these ladies.,Amelia is disgusting these lady.,morphology,determiner_noun_agreement,determiner_noun_agreement_1,True,True,False,True,270,-42.06034851074219,-43.82872772216797,1
Carla isn't taking those sketches.,Carla isn't taking those sketch.,morphology,determiner_noun_agreement,determiner_noun_agreement_1,True,True,False,True,271,-41.556785583496094,-41.093074798583984,0
Florence was investigating these actors.,Florence was investigating these actor.,morphology,determiner_noun_agreement,determiner_noun_agreement_1,True,True,False,True,272,-46.2713623046875,-48.00823974609375,1
Many cashiers disagree with those cashiers.,Many cashiers disagree with those cashier.,morphology,determiner_noun_agreement,determiner_noun_agreement_1,True,True,False,True,273,-60.1397590637207,-60.03935241699219,0
These committees argue about this commentary.,These committees argue about this commentaries.,morphology,determiner_noun_agreement,determiner_noun_agreement_1,True,True,False,True,274,-41.400123596191406,-47.229427337646484,1
Brian sees those horses.,Brian sees those horse.,morphology,determiner_noun_agreement,determiner_noun_agreement_1,True,True,False,True,275,-23.710010528564453,-26.118072509765625,1
Candice hasn't explored this art gallery.,Candice hasn't explored this art galleries.,morphology,determiner_noun_agreement,determiner_noun_agreement_1,True,True,False,True,276,-57.87480545043945,-57.460140228271484,0
Aaron walks through those art galleries.,Aaron walks through those art gallery.,morphology,determiner_noun_agreement,determiner_noun_agreement_1,True,True,False,True,277,-42.56864929199219,-44.075016021728516,1
Some books alarm that cashier.,Some books alarm that cashiers.,morphology,determiner_noun_agreement,determiner_noun_agreement_1,True,True,False,True,278,-50.487003326416016,-50.701194763183594,1
Raymond wasn't kissing that guest.,Raymond wasn't kissing that guests.,morphology,determiner_noun_agreement,determiner_noun_agreement_1,True,True,False,True,279,-46.55984878540039,-48.7269401550293,1
Some cashier might boycott that art gallery.,Some cashier might boycott that art galleries.,morphology,determiner_noun_agreement,determiner_noun_agreement_1,True,True,False,True,280,-71.47346496582031,-70.61080932617188,0
Winston Churchill hadn't hidden this adult.,Winston Churchill hadn't hidden this adults.,morphology,determiner_noun_agreement,determiner_noun_agreement_1,True,True,False,True,281,-59.95085906982422,-59.654029846191406,0
Jennifer skates around this public park.,Jennifer skates around this public parks.,morphology,determiner_noun_agreement,determiner_noun_agreement_1,True,True,False,True,282,-44.15840148925781,-44.48759460449219,1
Ruth doesn't flee from those malls.,Ruth doesn't flee from those mall.,morphology,determiner_noun_agreement,determiner_noun_agreement_1,True,True,False,True,283,-62.38465118408203,-58.554195404052734,0
Some waiters have known those guests.,Some waiters have known those guest.,morphology,determiner_noun_agreement,determiner_noun_agreement_1,True,True,False,True,284,-49.095741271972656,-53.740901947021484,1
Patricia thinks about that legislature.,Patricia thinks about that legislatures.,morphology,determiner_noun_agreement,determiner_noun_agreement_1,True,True,False,True,285,-43.93501663208008,-44.596336364746094,1
Every patient shouldn't drive to these schools.,Every patient shouldn't drive to these school.,morphology,determiner_noun_agreement,determiner_noun_agreement_1,True,True,False,True,286,-42.908119201660156,-44.95181655883789,1
Most boys hadn't disagreed with those books.,Most boys hadn't disagreed with those book.,morphology,determiner_noun_agreement,determiner_noun_agreement_1,True,True,False,True,287,-48.78345489501953,-51.693965911865234,1
Mark fled from those guys.,Mark fled from those guy.,morphology,determiner_noun_agreement,determiner_noun_agreement_1,True,True,False,True,288,-30.442005157470703,-33.07267761230469,1
Grace should break these cups.,Grace should break these cup.,morphology,determiner_noun_agreement,determiner_noun_agreement_1,True,True,False,True,289,-37.87448501586914,-38.959556579589844,1
Carrie passes those restaurants.,Carrie passes those restaurant.,morphology,determiner_noun_agreement,determiner_noun_agreement_1,True,True,False,True,290,-38.60748291015625,-40.03577423095703,1
Anne was returning to these guys.,Anne was returning to these guy.,morphology,determiner_noun_agreement,determiner_noun_agreement_1,True,True,False,True,291,-30.587890625,-34.031002044677734,1
Craig could disturb those teenagers.,Craig could disturb those teenager.,morphology,determiner_noun_agreement,determiner_noun_agreement_1,True,True,False,True,292,-33.743289947509766,-37.571563720703125,1
Linda has this rabbit.,Linda has this rabbits.,morphology,determiner_noun_agreement,determiner_noun_agreement_1,True,True,False,True,293,-33.069786071777344,-35.35227966308594,1
Christopher does pass this hospital.,Christopher does pass this hospitals.,morphology,determiner_noun_agreement,determiner_noun_agreement_1,True,True,False,True,294,-36.72093963623047,-37.32792282104492,1
Mitchell wasn't embarrassing these adults.,Mitchell wasn't embarrassing these adult.,morphology,determiner_noun_agreement,determiner_noun_agreement_1,True,True,False,True,295,-48.3359260559082,-52.311824798583984,1
These senators clean these grocery stores.,These senators clean these grocery store.,morphology,determiner_noun_agreement,determiner_noun_agreement_1,True,True,False,True,296,-50.881309509277344,-52.36119079589844,1
Cynthia should complain about those actresses.,Cynthia should complain about those actress.,morphology,determiner_noun_agreement,determiner_noun_agreement_1,True,True,False,True,297,-60.46183776855469,-63.71611404418945,1
Curtis hasn't praised these boys.,Curtis hasn't praised these boy.,morphology,determiner_noun_agreement,determiner_noun_agreement_1,True,True,False,True,298,-52.93304443359375,-56.299781799316406,1
Florence listened to that patient.,Florence listened to that patients.,morphology,determiner_noun_agreement,determiner_noun_agreement_1,True,True,False,True,299,-41.20519256591797,-43.44251251220703,1
Jodi might break these chairs.,Jodi might break these chair.,morphology,determiner_noun_agreement,determiner_noun_agreement_1,True,True,False,True,300,-45.62141418457031,-46.79109191894531,1
Sherry forgot that play.,Sherry forgot that plays.,morphology,determiner_noun_agreement,determiner_noun_agreement_1,True,True,False,True,301,-38.325260162353516,-39.211952209472656,1
Clyde hasn't loved these boys.,Clyde hasn't loved these boy.,morphology,determiner_noun_agreement,determiner_noun_agreement_1,True,True,False,True,302,-53.487030029296875,-56.55583953857422,1
A lot of hats aggravate that legislature.,A lot of hats aggravate that legislatures.,morphology,determiner_noun_agreement,determiner_noun_agreement_1,True,True,False,True,303,-66.711669921875,-67.4149169921875,1
Ellen will look like those prints.,Ellen will look like those print.,morphology,determiner_noun_agreement,determiner_noun_agreement_1,True,True,False,True,304,-41.831214904785156,-43.89481735229492,1
April wasn't examining those reports.,April wasn't examining those report.,morphology,determiner_noun_agreement,determiner_noun_agreement_1,True,True,False,True,305,-38.33950424194336,-40.044403076171875,1
Diana isn't selling that car.,Diana isn't selling that cars.,morphology,determiner_noun_agreement,determiner_noun_agreement_1,True,True,False,True,306,-43.2827033996582,-47.24418640136719,1
Christina knew this doctor.,Christina knew this doctors.,morphology,determiner_noun_agreement,determiner_noun_agreement_1,True,True,False,True,307,-33.26483917236328,-34.663780212402344,1
Catherine wouldn't research these universities.,Catherine wouldn't research these university.,morphology,determiner_noun_agreement,determiner_noun_agreement_1,True,True,False,True,308,-49.277793884277344,-50.46783447265625,1
Those customers weren't researching this government.,Those customers weren't researching this governments.,morphology,determiner_noun_agreement,determiner_noun_agreement_1,True,True,False,True,309,-44.03400802612305,-47.57714080810547,1
All doctors know that student.,All doctors know that students.,morphology,determiner_noun_agreement,determiner_noun_agreement_1,True,True,False,True,310,-32.50056076049805,-31.767192840576172,0
Tonya has insulted that play.,Tonya has insulted that plays.,morphology,determiner_noun_agreement,determiner_noun_agreement_1,True,True,False,True,311,-40.20109176635742,-42.57941818237305,1
Those documentaries were disagreeing with that lady.,Those documentaries were disagreeing with that ladies.,morphology,determiner_noun_agreement,determiner_noun_agreement_1,True,True,False,True,312,-55.31135177612305,-58.193695068359375,1
An organization had respected that doctor.,An organization had respected that doctors.,morphology,determiner_noun_agreement,determiner_noun_agreement_1,True,True,False,True,313,-40.65447235107422,-40.82380676269531,1
Timothy explores this restaurant.,Timothy explores this restaurants.,morphology,determiner_noun_agreement,determiner_noun_agreement_1,True,True,False,True,314,-32.022987365722656,-35.80362319946289,1
Sarah hires this waiter.,Sarah hires this waiters.,morphology,determiner_noun_agreement,determiner_noun_agreement_1,True,True,False,True,315,-31.864681243896484,-41.480934143066406,1
Kendra exits this art gallery.,Kendra exits this art galleries.,morphology,determiner_noun_agreement,determiner_noun_agreement_1,True,True,False,True,316,-63.861961364746094,-63.75105285644531,0
Natalie concealed this hospital.,Natalie concealed this hospitals.,morphology,determiner_noun_agreement,determiner_noun_agreement_1,True,True,False,True,317,-44.1082878112793,-44.80256271362305,1
Amelia was impressing this company.,Amelia was impressing this companies.,morphology,determiner_noun_agreement,determiner_noun_agreement_1,True,True,False,True,318,-44.215660095214844,-46.980384826660156,1
Wendy hadn't scared that bank.,Wendy hadn't scared that banks.,morphology,determiner_noun_agreement,determiner_noun_agreement_1,True,True,False,True,319,-54.081871032714844,-55.500709533691406,1
Mark will cure those guys.,Mark will cure those guy.,morphology,determiner_noun_agreement,determiner_noun_agreement_1,True,True,False,True,320,-31.680110931396484,-34.72145080566406,1
Spain was describing those actors.,Spain was describing those actor.,morphology,determiner_noun_agreement,determiner_noun_agreement_1,True,True,False,True,321,-32.94401550292969,-34.521324157714844,1
Allison talked about those schools.,Allison talked about those school.,morphology,determiner_noun_agreement,determiner_noun_agreement_1,True,True,False,True,322,-33.790714263916016,-35.49802780151367,1
William buys those jackets.,William buys those jacket.,morphology,determiner_noun_agreement,determiner_noun_agreement_1,True,True,False,True,323,-30.865001678466797,-31.040328979492188,1
Timothy escaped from that cashier.,Timothy escaped from that cashiers.,morphology,determiner_noun_agreement,determiner_noun_agreement_1,True,True,False,True,324,-42.81940460205078,-43.61591339111328,1
Susan isn't fixing those couches.,Susan isn't fixing those couch.,morphology,determiner_noun_agreement,determiner_noun_agreement_1,True,True,False,True,325,-45.915565490722656,-37.21846008300781,0
Tonya boasts about this patient.,Tonya boasts about this patients.,morphology,determiner_noun_agreement,determiner_noun_agreement_1,True,True,False,True,326,-44.33882522583008,-44.90221405029297,1
Stephanie talked to those cashiers.,Stephanie talked to those cashier.,morphology,determiner_noun_agreement,determiner_noun_agreement_1,True,True,False,True,327,-48.91020202636719,-48.9246826171875,1
Those children describe those pedestrians.,Those children describe those pedestrian.,morphology,determiner_noun_agreement,determiner_noun_agreement_1,True,True,False,True,328,-35.665802001953125,-37.09473419189453,1
Sara would embarrass that guest.,Sara would embarrass that guests.,morphology,determiner_noun_agreement,determiner_noun_agreement_1,True,True,False,True,329,-44.5291633605957,-45.97123718261719,1
Rebecca complained about that brochure.,Rebecca complained about that brochures.,morphology,determiner_noun_agreement,determiner_noun_agreement_1,True,True,False,True,330,-47.21989440917969,-45.63784408569336,0
Amelia has thought about those horses.,Amelia has thought about those horse.,morphology,determiner_noun_agreement,determiner_noun_agreement_1,True,True,False,True,331,-37.6554069519043,-40.269744873046875,1
Those books were astounding that government.,Those books were astounding that governments.,morphology,determiner_noun_agreement,determiner_noun_agreement_1,True,True,False,True,332,-40.92925262451172,-43.724761962890625,1
Most waiters weren't watching that lady.,Most waiters weren't watching that ladies.,morphology,determiner_noun_agreement,determiner_noun_agreement_1,True,True,False,True,333,-49.89942169189453,-52.944114685058594,1
Alan had cleaned that plate.,Alan had cleaned that plates.,morphology,determiner_noun_agreement,determiner_noun_agreement_1,True,True,False,True,334,-28.59762191772461,-32.39033508300781,1
Benjamin cured that turtle.,Benjamin cured that turtles.,morphology,determiner_noun_agreement,determiner_noun_agreement_1,True,True,False,True,335,-42.21943664550781,-42.64569854736328,1
Melanie isn't scanning those reports.,Melanie isn't scanning those report.,morphology,determiner_noun_agreement,determiner_noun_agreement_1,True,True,False,True,336,-49.471988677978516,-51.39012908935547,1
Beverly is hiding this skirt.,Beverly is hiding this skirts.,morphology,determiner_noun_agreement,determiner_noun_agreement_1,True,True,False,True,337,-58.185211181640625,-60.38018035888672,1
Some waiter should praise that newspaper article.,Some waiter should praise that newspaper articles.,morphology,determiner_noun_agreement,determiner_noun_agreement_1,True,True,False,True,338,-53.732505798339844,-55.689693450927734,1
Janet helped these doctors.,Janet helped these doctor.,morphology,determiner_noun_agreement,determiner_noun_agreement_1,True,True,False,True,339,-35.895652770996094,-38.46963119506836,1
Judy impressed these universities.,Judy impressed these university.,morphology,determiner_noun_agreement,determiner_noun_agreement_1,True,True,False,True,340,-34.427528381347656,-34.94184112548828,1
The Impressionists complain about those children.,The Impressionists complain about those child.,morphology,determiner_noun_agreement,determiner_noun_agreement_1,True,True,False,True,341,-55.3287353515625,-58.05205154418945,1
The Clintons help these guys.,The Clintons help these guy.,morphology,determiner_noun_agreement,determiner_noun_agreement_1,True,True,False,True,342,-41.927791595458984,-45.434391021728516,1
These prints look like those art galleries.,These prints look like those art gallery.,morphology,determiner_noun_agreement,determiner_noun_agreement_1,True,True,False,True,343,-48.869834899902344,-50.10591125488281,1
Every picture looks like those scarves.,Every picture looks like those scarf.,morphology,determiner_noun_agreement,determiner_noun_agreement_1,True,True,False,True,344,-46.093994140625,-40.48434066772461,0
Claire has researched that print.,Claire has researched that prints.,morphology,determiner_noun_agreement,determiner_noun_agreement_1,True,True,False,True,345,-40.17999267578125,-41.40300369262695,1
Roger isn't watching these teachers.,Roger isn't watching these teacher.,morphology,determiner_noun_agreement,determiner_noun_agreement_1,True,True,False,True,346,-34.01520538330078,-36.46452331542969,1
These patients exit these restaurants.,These patients exit these restaurant.,morphology,determiner_noun_agreement,determiner_noun_agreement_1,True,True,False,True,347,-37.86835479736328,-40.61711883544922,1
Stephanie wasn't talking to these cashiers.,Stephanie wasn't talking to these cashier.,morphology,determiner_noun_agreement,determiner_noun_agreement_1,True,True,False,True,348,-54.86655044555664,-54.641395568847656,0
Amelia was scanning those stories.,Amelia was scanning those story.,morphology,determiner_noun_agreement,determiner_noun_agreement_1,True,True,False,True,349,-39.1014404296875,-42.61573028564453,1
Some actor shouldn't care for those senators.,Some actor shouldn't care for those senator.,morphology,determiner_noun_agreement,determiner_noun_agreement_1,True,True,False,True,350,-51.37236785888672,-49.00775146484375,0
Kristin was embarrassing these waitresses.,Kristin was embarrassing these waitress.,morphology,determiner_noun_agreement,determiner_noun_agreement_1,True,True,False,True,351,-57.84238815307617,-47.222076416015625,0
Every committee should dislike those banks.,Every committee should dislike those bank.,morphology,determiner_noun_agreement,determiner_noun_agreement_1,True,True,False,True,352,-45.03233337402344,-45.67487335205078,1
Ruth couldn't scare these patients.,Ruth couldn't scare these patient.,morphology,determiner_noun_agreement,determiner_noun_agreement_1,True,True,False,True,353,-50.86181640625,-52.91343307495117,1
Jerry isn't fixing these glasses.,Jerry isn't fixing these glass.,morphology,determiner_noun_agreement,determiner_noun_agreement_1,True,True,False,True,354,-36.559024810791016,-35.65583801269531,0
Katherine hasn't gone to these banks.,Katherine hasn't gone to these bank.,morphology,determiner_noun_agreement,determiner_noun_agreement_1,True,True,False,True,355,-48.04273223876953,-46.498207092285156,0
That report stuns this organization.,That report stuns this organizations.,morphology,determiner_noun_agreement,determiner_noun_agreement_1,True,True,False,True,356,-49.9737434387207,-52.493717193603516,1
Daniel conceals these waitresses.,Daniel conceals these waitress.,morphology,determiner_noun_agreement,determiner_noun_agreement_1,True,True,False,True,357,-54.99330139160156,-46.08106231689453,0
Stacey disturbed these doctors.,Stacey disturbed these doctor.,morphology,determiner_noun_agreement,determiner_noun_agreement_1,True,True,False,True,358,-46.21183776855469,-48.875732421875,1
Some teenagers arrived at that bank.,Some teenagers arrived at that banks.,morphology,determiner_noun_agreement,determiner_noun_agreement_1,True,True,False,True,359,-35.21574020385742,-37.283538818359375,1
Jessica has this glove.,Jessica has this gloves.,morphology,determiner_noun_agreement,determiner_noun_agreement_1,True,True,False,True,360,-23.339187622070312,-24.115936279296875,1
Gerald researches that hospital.,Gerald researches that hospitals.,morphology,determiner_noun_agreement,determiner_noun_agreement_1,True,True,False,True,361,-52.63038635253906,-53.65447235107422,1
Julia might think about this waitress.,Julia might think about this waitresses.,morphology,determiner_noun_agreement,determiner_noun_agreement_1,True,True,False,True,362,-41.261844635009766,-50.54151916503906,1
Some pedestrian had worried that guest.,Some pedestrian had worried that guests.,morphology,determiner_noun_agreement,determiner_noun_agreement_1,True,True,False,True,363,-50.170166015625,-50.90182876586914,1
Colleen did reveal those skirts.,Colleen did reveal those skirt.,morphology,determiner_noun_agreement,determiner_noun_agreement_1,True,True,False,True,364,-46.016475677490234,-46.368038177490234,1
All cashiers clean that snake.,All cashiers clean that snakes.,morphology,determiner_noun_agreement,determiner_noun_agreement_1,True,True,False,True,365,-49.54109191894531,-49.383689880371094,0
Those companies praise that actress.,Those companies praise that actresses.,morphology,determiner_noun_agreement,determiner_noun_agreement_1,True,True,False,True,366,-35.718074798583984,-35.960330963134766,1
Natalie isn't selling this nose.,Natalie isn't selling this noses.,morphology,determiner_noun_agreement,determiner_noun_agreement_1,True,True,False,True,367,-42.72378921508789,-46.52112579345703,1
Samuel will hurt that actor.,Samuel will hurt that actors.,morphology,determiner_noun_agreement,determiner_noun_agreement_1,True,True,False,True,368,-34.924774169921875,-37.818634033203125,1
Thomas has disturbed this boy.,Thomas has disturbed this boys.,morphology,determiner_noun_agreement,determiner_noun_agreement_1,True,True,False,True,369,-31.707794189453125,-34.7897834777832,1
Sally will pass these grocery stores.,Sally will pass these grocery store.,morphology,determiner_noun_agreement,determiner_noun_agreement_1,True,True,False,True,370,-50.319915771484375,-51.126182556152344,1
That convertible annoyed that company.,That convertible annoyed that companies.,morphology,determiner_noun_agreement,determiner_noun_agreement_1,True,True,False,True,371,-48.06914138793945,-48.58879089355469,1
Most guys see those dresses.,Most guys see those dress.,morphology,determiner_noun_agreement,determiner_noun_agreement_1,True,True,False,True,372,-30.39117431640625,-31.395320892333984,1
Most patients had forgotten those actors.,Most patients had forgotten those actor.,morphology,determiner_noun_agreement,determiner_noun_agreement_1,True,True,False,True,373,-41.899574279785156,-43.8948860168457,1
Most vases alarm that driver.,Most vases alarm that drivers.,morphology,determiner_noun_agreement,determiner_noun_agreement_1,True,True,False,True,374,-53.9810676574707,-53.58893966674805,0
This shirt astounded those senators.,This shirt astounded those senator.,morphology,determiner_noun_agreement,determiner_noun_agreement_1,True,True,False,True,375,-52.73508834838867,-52.057682037353516,0
Laura has attacked this teenager.,Laura has attacked this teenagers.,morphology,determiner_noun_agreement,determiner_noun_agreement_1,True,True,False,True,376,-33.25307846069336,-33.68035125732422,1
This senator might boycott that restaurant.,This senator might boycott that restaurants.,morphology,determiner_noun_agreement,determiner_noun_agreement_1,True,True,False,True,377,-54.03995895385742,-55.27452850341797,1
A lot of actors bother those teachers.,A lot of actors bother those teacher.,morphology,determiner_noun_agreement,determiner_noun_agreement_1,True,True,False,True,378,-52.76404571533203,-54.816375732421875,1
A banana embarrassed those actresses.,A banana embarrassed those actress.,morphology,determiner_noun_agreement,determiner_noun_agreement_1,True,True,False,True,379,-51.11280059814453,-53.88756561279297,1
That cucumber did confuse that boy.,That cucumber did confuse that boys.,morphology,determiner_noun_agreement,determiner_noun_agreement_1,True,True,False,True,380,-54.1475715637207,-56.81846618652344,1
Joseph isn't concealing these students.,Joseph isn't concealing these student.,morphology,determiner_noun_agreement,determiner_noun_agreement_1,True,True,False,True,381,-51.114288330078125,-53.85377883911133,1
