sentence_good,sentence_bad,field,linguistics_term,UID,simple_LM_method,one_prefix_method,two_prefix_method,lexically_identical,pair_id,good_prob,bad_prob,correct
Timothy couldn't disturb that guy.,Timothy couldn't disturb that guys.,morphology,determiner_noun_agreement,determiner_noun_agreement_1,True,True,False,True,639,-34.77500534057617,-37.61212921142578,1
A lot of guys find these guests.,A lot of guys find these guest.,morphology,determiner_noun_agreement,determiner_noun_agreement_1,True,True,False,True,640,-47.36322021484375,-51.289634704589844,1
Many fish can't look like this picture.,Many fish can't look like this pictures.,morphology,determiner_noun_agreement,determiner_noun_agreement_1,True,True,False,True,641,-36.504859924316406,-39.06131362915039,1
Craig drops by these cafes.,Craig drops by these cafe.,morphology,determiner_noun_agreement,determiner_noun_agreement_1,True,True,False,True,642,-39.2303466796875,-37.37055206298828,0
Carlos fired that waitress.,Carlos fired that waitresses.,morphology,determiner_noun_agreement,determiner_noun_agreement_1,True,True,False,True,643,-37.872589111328125,-46.555965423583984,1
Those girls conceal this blouse.,Those girls conceal this blouses.,morphology,determiner_noun_agreement,determiner_noun_agreement_1,True,True,False,True,644,-45.18275451660156,-46.30978012084961,1
The ladies walk through this public park.,The ladies walk through this public parks.,morphology,determiner_noun_agreement,determiner_noun_agreement_1,True,True,False,True,645,-44.29939651489258,-45.07642364501953,1
Irene has hidden those cashiers.,Irene has hidden those cashier.,morphology,determiner_noun_agreement,determiner_noun_agreement_1,True,True,False,True,646,-57.30369567871094,-56.66582489013672,0
Nancy wouldn't describe that driver.,Nancy wouldn't describe that drivers.,morphology,determiner_noun_agreement,determiner_noun_agreement_1,True,True,False,True,647,-39.46196746826172,-41.5897216796875,1
A lot of reports didn't disagree with those documentaries.,A lot of reports didn't disagree with those documentary.,morphology,determiner_noun_agreement,determiner_noun_agreement_1,True,True,False,True,648,-64.94223022460938,-64.40869140625,0
Every projector alarms that teacher.,Every projector alarms that teachers.,morphology,determiner_noun_agreement,determiner_noun_agreement_1,True,True,False,True,649,-45.06272506713867,-44.59757614135742,0
The associations worked with that actor.,The associations worked with that actors.,morphology,determiner_noun_agreement,determiner_noun_agreement_1,True,True,False,True,650,-38.63795852661133,-39.99278259277344,1
Tanya fixed this cup.,Tanya fixed this cups.,morphology,determiner_noun_agreement,determiner_noun_agreement_1,True,True,False,True,651,-40.085487365722656,-41.83143615722656,1
Samuel did sound like this museum.,Samuel did sound like this museums.,morphology,determiner_noun_agreement,determiner_noun_agreement_1,True,True,False,True,652,-40.65818786621094,-45.04417419433594,1
The drawing isn't annoying these waitresses.,The drawing isn't annoying these waitress.,morphology,determiner_noun_agreement,determiner_noun_agreement_1,True,True,False,True,653,-61.32463455200195,-52.19749450683594,0
That fork aggravates this university.,That fork aggravates this universities.,morphology,determiner_noun_agreement,determiner_noun_agreement_1,True,True,False,True,654,-51.057960510253906,-54.37425994873047,1
Amelia has attacked this patient.,Amelia has attacked this patients.,morphology,determiner_noun_agreement,determiner_noun_agreement_1,True,True,False,True,655,-40.780738830566406,-42.125701904296875,1
Margaret praises that student.,Margaret praises that students.,morphology,determiner_noun_agreement,determiner_noun_agreement_1,True,True,False,True,656,-35.13206481933594,-33.777069091796875,0
Dawn could love these essays.,Dawn could love these essay.,morphology,determiner_noun_agreement,determiner_noun_agreement_1,True,True,False,True,657,-50.284141540527344,-51.53313446044922,1
Natalie is finding these hats.,Natalie is finding these hat.,morphology,determiner_noun_agreement,determiner_noun_agreement_1,True,True,False,True,658,-37.97499465942383,-38.883296966552734,1
The Impressionists escape from this library.,The Impressionists escape from this libraries.,morphology,determiner_noun_agreement,determiner_noun_agreement_1,True,True,False,True,659,-59.00299072265625,-64.3746337890625,1
This government dislikes these guys.,This government dislikes these guy.,morphology,determiner_noun_agreement,determiner_noun_agreement_1,True,True,False,True,660,-48.866493225097656,-52.272212982177734,1
Phillip wasn't embarrassing this government.,Phillip wasn't embarrassing this governments.,morphology,determiner_noun_agreement,determiner_noun_agreement_1,True,True,False,True,661,-42.63397216796875,-46.452754974365234,1
Kenneth knew these students.,Kenneth knew these student.,morphology,determiner_noun_agreement,determiner_noun_agreement_1,True,True,False,True,662,-36.745880126953125,-38.71150207519531,1
A lot of lakes disturb that museum.,A lot of lakes disturb that museums.,morphology,determiner_noun_agreement,determiner_noun_agreement_1,True,True,False,True,663,-55.802879333496094,-57.99723434448242,1
Irene was going to that public park.,Irene was going to that public parks.,morphology,determiner_noun_agreement,determiner_noun_agreement_1,True,True,False,True,664,-42.19933319091797,-42.81288146972656,1
Heidi worked with those patients.,Heidi worked with those patient.,morphology,determiner_noun_agreement,determiner_noun_agreement_1,True,True,False,True,665,-39.49345397949219,-40.3216438293457,1
Renee was breaking that glass.,Renee was breaking that glasses.,morphology,determiner_noun_agreement,determiner_noun_agreement_1,True,True,False,True,666,-34.133270263671875,-37.52784729003906,1
Gregory dislikes this adult.,Gregory dislikes this adults.,morphology,determiner_noun_agreement,determiner_noun_agreement_1,True,True,False,True,667,-48.924495697021484,-50.04414749145508,1
Paul isn't taking this painting.,Paul isn't taking this paintings.,morphology,determiner_noun_agreement,determiner_noun_agreement_1,True,True,False,True,668,-29.55222511291504,-33.153907775878906,1
Rose is exiting this bank.,Rose is exiting this banks.,morphology,determiner_noun_agreement,determiner_noun_agreement_1,True,True,False,True,669,-38.50802993774414,-41.44016647338867,1
Lucille wasn't kissing that teenager.,Lucille wasn't kissing that teenagers.,morphology,determiner_noun_agreement,determiner_noun_agreement_1,True,True,False,True,670,-48.0647087097168,-47.05625534057617,0
Ann concealed these guests.,Ann concealed these guest.,morphology,determiner_noun_agreement,determiner_noun_agreement_1,True,True,False,True,671,-34.03923416137695,-37.656524658203125,1
Amanda notices these rabbits.,Amanda notices these rabbit.,morphology,determiner_noun_agreement,determiner_noun_agreement_1,True,True,False,True,672,-40.78298568725586,-40.968162536621094,1
Most pedestrians describe those plays.,Most pedestrians describe those play.,morphology,determiner_noun_agreement,determiner_noun_agreement_1,True,True,False,True,673,-40.43852996826172,-38.83577346801758,0
Guy has escaped from those girls.,Guy has escaped from those girl.,morphology,determiner_noun_agreement,determiner_noun_agreement_1,True,True,False,True,674,-32.064998626708984,-34.73257827758789,1
Naomi returned to this guy.,Naomi returned to this guys.,morphology,determiner_noun_agreement,determiner_noun_agreement_1,True,True,False,True,675,-33.92366027832031,-36.046756744384766,1
Elaine is messing up that glass.,Elaine is messing up that glasses.,morphology,determiner_noun_agreement,determiner_noun_agreement_1,True,True,False,True,676,-43.848907470703125,-46.826778411865234,1
Most banks should look like those drawings.,Most banks should look like those drawing.,morphology,determiner_noun_agreement,determiner_noun_agreement_1,True,True,False,True,677,-43.81345748901367,-45.255592346191406,1
Christopher hasn't hidden that chair.,Christopher hasn't hidden that chairs.,morphology,determiner_noun_agreement,determiner_noun_agreement_1,True,True,False,True,678,-34.429683685302734,-37.949241638183594,1
Florence talked to that doctor.,Florence talked to that doctors.,morphology,determiner_noun_agreement,determiner_noun_agreement_1,True,True,False,True,679,-38.00396728515625,-41.26415252685547,1
Sara had run around this library.,Sara had run around this libraries.,morphology,determiner_noun_agreement,determiner_noun_agreement_1,True,True,False,True,680,-42.829010009765625,-49.277076721191406,1
Helen was biking to these grocery stores.,Helen was biking to these grocery store.,morphology,determiner_noun_agreement,determiner_noun_agreement_1,True,True,False,True,681,-52.44646453857422,-53.48870086669922,1
Some children see these drawings.,Some children see these drawing.,morphology,determiner_noun_agreement,determiner_noun_agreement_1,True,True,False,True,682,-32.194480895996094,-33.34524917602539,1
A lot of pictures have annoyed this actress.,A lot of pictures have annoyed this actresses.,morphology,determiner_noun_agreement,determiner_noun_agreement_1,True,True,False,True,683,-62.19572448730469,-62.614376068115234,1
The Clintons hadn't argued about those boys.,The Clintons hadn't argued about those boy.,morphology,determiner_noun_agreement,determiner_noun_agreement_1,True,True,False,True,684,-54.74249267578125,-57.85300064086914,1
Mitchell healed that adult.,Mitchell healed that adults.,morphology,determiner_noun_agreement,determiner_noun_agreement_1,True,True,False,True,685,-43.35700607299805,-43.51094436645508,1
Omar doesn't forget these students.,Omar doesn't forget these student.,morphology,determiner_noun_agreement,determiner_noun_agreement_1,True,True,False,True,686,-41.28834533691406,-44.0056037902832,1
Carlos drops by that library.,Carlos drops by that libraries.,morphology,determiner_noun_agreement,determiner_noun_agreement_1,True,True,False,True,687,-39.59710693359375,-43.887718200683594,1
Some children were healing these students.,Some children were healing these student.,morphology,determiner_noun_agreement,determiner_noun_agreement_1,True,True,False,True,688,-35.65259552001953,-37.93682098388672,1
A fish isn't irritating this adult.,A fish isn't irritating this adults.,morphology,determiner_noun_agreement,determiner_noun_agreement_1,True,True,False,True,689,-57.62150573730469,-57.859130859375,1
Galileo had those glasses.,Galileo had those glass.,morphology,determiner_noun_agreement,determiner_noun_agreement_1,True,True,False,True,690,-37.851783752441406,-37.339324951171875,0
Candice would sound like these waiters.,Candice would sound like these waiter.,morphology,determiner_noun_agreement,determiner_noun_agreement_1,True,True,False,True,691,-51.014320373535156,-44.22382354736328,0
Tamara does tour those restaurants.,Tamara does tour those restaurant.,morphology,determiner_noun_agreement,determiner_noun_agreement_1,True,True,False,True,692,-45.5985107421875,-47.267555236816406,1
Mitchell will boast about those boys.,Mitchell will boast about those boy.,morphology,determiner_noun_agreement,determiner_noun_agreement_1,True,True,False,True,693,-52.04304504394531,-56.13384246826172,1
Nancy does pass those museums.,Nancy does pass those museum.,morphology,determiner_noun_agreement,determiner_noun_agreement_1,True,True,False,True,694,-45.45711135864258,-45.7051887512207,1
Brad liked those grocery stores.,Brad liked those grocery store.,morphology,determiner_noun_agreement,determiner_noun_agreement_1,True,True,False,True,695,-36.947959899902344,-38.26231002807617,1
Carol insults that actor.,Carol insults that actors.,morphology,determiner_noun_agreement,determiner_noun_agreement_1,True,True,False,True,696,-43.07441711425781,-43.787757873535156,1
Thomas knows those guests.,Thomas knows those guest.,morphology,determiner_noun_agreement,determiner_noun_agreement_1,True,True,False,True,697,-29.438812255859375,-30.590852737426758,1
Angela watched this pedestrian.,Angela watched this pedestrians.,morphology,determiner_noun_agreement,determiner_noun_agreement_1,True,True,False,True,698,-35.88159942626953,-35.49559020996094,0
Sally hasn't known that waitress.,Sally hasn't known that waitresses.,morphology,determiner_noun_agreement,determiner_noun_agreement_1,True,True,False,True,699,-46.23204040527344,-56.3245964050293,1
Harvard University didn't hate this adult.,Harvard University didn't hate this adults.,morphology,determiner_noun_agreement,determiner_noun_agreement_1,True,True,False,True,700,-53.973236083984375,-52.533355712890625,0
Anna hadn't fled from these restaurants.,Anna hadn't fled from these restaurant.,morphology,determiner_noun_agreement,determiner_noun_agreement_1,True,True,False,True,701,-41.96181106567383,-43.34081268310547,1
The Impressionists hadn't lifted this sweater.,The Impressionists hadn't lifted this sweaters.,morphology,determiner_noun_agreement,determiner_noun_agreement_1,True,True,False,True,702,-69.76800537109375,-74.69105529785156,1
Allison couldn't listen to this guest.,Allison couldn't listen to this guests.,morphology,determiner_noun_agreement,determiner_noun_agreement_1,True,True,False,True,703,-44.925140380859375,-45.17719650268555,1
All teenagers insult these movie theaters.,All teenagers insult these movie theater.,morphology,determiner_noun_agreement,determiner_noun_agreement_1,True,True,False,True,704,-51.192562103271484,-51.822120666503906,1
The carriage scares those senators.,The carriage scares those senator.,morphology,determiner_noun_agreement,determiner_noun_agreement_1,True,True,False,True,705,-43.1082878112793,-41.42878341674805,0
These students didn't disagree with those children.,These students didn't disagree with those child.,morphology,determiner_noun_agreement,determiner_noun_agreement_1,True,True,False,True,706,-36.27981948852539,-39.07306671142578,1
Children bike to those banks.,Children bike to those bank.,morphology,determiner_noun_agreement,determiner_noun_agreement_1,True,True,False,True,707,-36.82193374633789,-36.305973052978516,0
Alice isn't complaining about that waitress.,Alice isn't complaining about that waitresses.,morphology,determiner_noun_agreement,determiner_noun_agreement_1,True,True,False,True,708,-37.64873504638672,-47.433929443359375,1
Some girls clean this car.,Some girls clean this cars.,morphology,determiner_noun_agreement,determiner_noun_agreement_1,True,True,False,True,709,-29.640186309814453,-32.01470947265625,1
Most waiters could break those couches.,Most waiters could break those couch.,morphology,determiner_noun_agreement,determiner_noun_agreement_1,True,True,False,True,710,-58.32332229614258,-50.26560974121094,0
Bruce questions that cashier.,Bruce questions that cashiers.,morphology,determiner_noun_agreement,determiner_noun_agreement_1,True,True,False,True,711,-39.702816009521484,-39.698760986328125,0
George hated these cashiers.,George hated these cashier.,morphology,determiner_noun_agreement,determiner_noun_agreement_1,True,True,False,True,712,-37.43345642089844,-37.755226135253906,1
Ella concealed these teachers.,Ella concealed these teacher.,morphology,determiner_noun_agreement,determiner_noun_agreement_1,True,True,False,True,713,-47.50675964355469,-50.61253356933594,1
Sheila is bringing this hamster.,Sheila is bringing this hamsters.,morphology,determiner_noun_agreement,determiner_noun_agreement_1,True,True,False,True,714,-47.211273193359375,-45.79810333251953,0
Some doctors boast about those patients.,Some doctors boast about those patient.,morphology,determiner_noun_agreement,determiner_noun_agreement_1,True,True,False,True,715,-47.549198150634766,-48.72222137451172,1
Carla has investigated these boys.,Carla has investigated these boy.,morphology,determiner_noun_agreement,determiner_noun_agreement_1,True,True,False,True,716,-38.40935134887695,-42.07832717895508,1
Those actors have taken those libraries.,Those actors have taken those library.,morphology,determiner_noun_agreement,determiner_noun_agreement_1,True,True,False,True,717,-36.15162658691406,-34.571475982666016,0
Some restaurants irritated that lady.,Some restaurants irritated that ladies.,morphology,determiner_noun_agreement,determiner_noun_agreement_1,True,True,False,True,718,-39.443702697753906,-40.57490539550781,1
Marcus couldn't complain about this teacher.,Marcus couldn't complain about this teachers.,morphology,determiner_noun_agreement,determiner_noun_agreement_1,True,True,False,True,719,-36.142398834228516,-37.30000686645508,1
Carmen isn't boasting about this story.,Carmen isn't boasting about this stories.,morphology,determiner_noun_agreement,determiner_noun_agreement_1,True,True,False,True,720,-57.613380432128906,-60.467041015625,1
That senator is selling that art gallery.,That senator is selling that art galleries.,morphology,determiner_noun_agreement,determiner_noun_agreement_1,True,True,False,True,721,-52.61732482910156,-52.175048828125,0
Patrick investigates these girls.,Patrick investigates these girl.,morphology,determiner_noun_agreement,determiner_noun_agreement_1,True,True,False,True,722,-33.093772888183594,-35.91932678222656,1
Lucille has stunned this guest.,Lucille has stunned this guests.,morphology,determiner_noun_agreement,determiner_noun_agreement_1,True,True,False,True,723,-44.96387481689453,-44.97414016723633,1
Most men examine these reports.,Most men examine these report.,morphology,determiner_noun_agreement,determiner_noun_agreement_1,True,True,False,True,724,-35.89005661010742,-37.93433380126953,1
This eye embarrasses these ladies.,This eye embarrasses these lady.,morphology,determiner_noun_agreement,determiner_noun_agreement_1,True,True,False,True,725,-51.69495391845703,-53.670814514160156,1
Ella hasn't healed that boy.,Ella hasn't healed that boys.,morphology,determiner_noun_agreement,determiner_noun_agreement_1,True,True,False,True,726,-47.1875,-50.319068908691406,1
Sabrina wasn't talking about this mall.,Sabrina wasn't talking about this malls.,morphology,determiner_noun_agreement,determiner_noun_agreement_1,True,True,False,True,727,-36.01545715332031,-41.88252258300781,1
Ella argued about those patients.,Ella argued about those patient.,morphology,determiner_noun_agreement,determiner_noun_agreement_1,True,True,False,True,728,-43.33001708984375,-44.532047271728516,1
This girl could arrive at those college campuses.,This girl could arrive at those college campus.,morphology,determiner_noun_agreement,determiner_noun_agreement_1,True,True,False,True,729,-52.557167053222656,-52.61212921142578,1
Cheryl wasn't revealing those ladies.,Cheryl wasn't revealing those lady.,morphology,determiner_noun_agreement,determiner_noun_agreement_1,True,True,False,True,730,-60.52276611328125,-60.86589813232422,1
Jodi boasted about that book.,Jodi boasted about that books.,morphology,determiner_noun_agreement,determiner_noun_agreement_1,True,True,False,True,731,-44.86214828491211,-48.047847747802734,1
Colleen has known that pedestrian.,Colleen has known that pedestrians.,morphology,determiner_noun_agreement,determiner_noun_agreement_1,True,True,False,True,732,-44.62200927734375,-44.383766174316406,0
David wouldn't sell this plate.,David wouldn't sell this plates.,morphology,determiner_noun_agreement,determiner_noun_agreement_1,True,True,False,True,733,-29.078340530395508,-32.120994567871094,1
This legislature wouldn't help that teenager.,This legislature wouldn't help that teenagers.,morphology,determiner_noun_agreement,determiner_noun_agreement_1,True,True,False,True,734,-47.149566650390625,-45.23744583129883,0
Wayne was driving to this high school.,Wayne was driving to this high schools.,morphology,determiner_noun_agreement,determiner_noun_agreement_1,True,True,False,True,735,-38.27308654785156,-45.13340759277344,1
Dana will discuss this dancer.,Dana will discuss this dancers.,morphology,determiner_noun_agreement,determiner_noun_agreement_1,True,True,False,True,736,-43.68247985839844,-46.17366027832031,1
Candice cared for those teachers.,Candice cared for those teacher.,morphology,determiner_noun_agreement,determiner_noun_agreement_1,True,True,False,True,737,-38.205352783203125,-40.37598419189453,1
Every sketch looks like this brochure.,Every sketch looks like this brochures.,morphology,determiner_noun_agreement,determiner_noun_agreement_1,True,True,False,True,738,-50.29619598388672,-48.29387664794922,0
Most waiters love these documentaries.,Most waiters love these documentary.,morphology,determiner_noun_agreement,determiner_noun_agreement_1,True,True,False,True,739,-51.428443908691406,-49.86983871459961,0
Dancers are researching these pictures.,Dancers are researching these picture.,morphology,determiner_noun_agreement,determiner_noun_agreement_1,True,True,False,True,740,-48.56034851074219,-50.74024200439453,1
Christopher would aggravate these governments.,Christopher would aggravate these government.,morphology,determiner_noun_agreement,determiner_noun_agreement_1,True,True,False,True,741,-41.77910614013672,-39.56221389770508,0
Winston Churchill wasn't criticizing this college campus.,Winston Churchill wasn't criticizing this college campuses.,morphology,determiner_noun_agreement,determiner_noun_agreement_1,True,True,False,True,742,-71.02716827392578,-72.3483657836914,1
Mitchell discussed this teenager.,Mitchell discussed this teenagers.,morphology,determiner_noun_agreement,determiner_noun_agreement_1,True,True,False,True,743,-39.393646240234375,-38.811851501464844,0
Monet fired those waiters.,Monet fired those waiter.,morphology,determiner_noun_agreement,determiner_noun_agreement_1,True,True,False,True,744,-45.243980407714844,-38.660728454589844,0
The chicken shocks those committees.,The chicken shocks those committee.,morphology,determiner_noun_agreement,determiner_noun_agreement_1,True,True,False,True,745,-38.98822784423828,-38.61113357543945,0
The Lutherans approach this adult.,The Lutherans approach this adults.,morphology,determiner_noun_agreement,determiner_noun_agreement_1,True,True,False,True,746,-50.348960876464844,-50.64090347290039,1
Carol didn't return to that boy.,Carol didn't return to that boys.,morphology,determiner_noun_agreement,determiner_noun_agreement_1,True,True,False,True,747,-39.03424072265625,-41.30157470703125,1
Jane arrived at these restaurants.,Jane arrived at these restaurant.,morphology,determiner_noun_agreement,determiner_noun_agreement_1,True,True,False,True,748,-27.977344512939453,-29.121166229248047,1
That teacher revealed these teachers.,That teacher revealed these teacher.,morphology,determiner_noun_agreement,determiner_noun_agreement_1,True,True,False,True,749,-40.31951904296875,-42.07817840576172,1
Every book isn't stunning these banks.,Every book isn't stunning these bank.,morphology,determiner_noun_agreement,determiner_noun_agreement_1,True,True,False,True,750,-50.1192741394043,-50.745338439941406,1
Carla isn't messing up those couches.,Carla isn't messing up those couch.,morphology,determiner_noun_agreement,determiner_noun_agreement_1,True,True,False,True,751,-57.22702407836914,-49.24135208129883,0
Lori hasn't exited that grocery store.,Lori hasn't exited that grocery stores.,morphology,determiner_noun_agreement,determiner_noun_agreement_1,True,True,False,True,752,-58.47004699707031,-59.2493782043457,1
Waitresses lift those socks.,Waitresses lift those sock.,morphology,determiner_noun_agreement,determiner_noun_agreement_1,True,True,False,True,753,-39.34254455566406,-42.893924713134766,1
John wasn't shocking this doctor.,John wasn't shocking this doctors.,morphology,determiner_noun_agreement,determiner_noun_agreement_1,True,True,False,True,754,-40.224422454833984,-42.818519592285156,1
Gerald cleans that scarf.,Gerald cleans that scarves.,morphology,determiner_noun_agreement,determiner_noun_agreement_1,True,True,False,True,755,-45.0509033203125,-49.360191345214844,1
Larry wasn't scaring this legislature.,Larry wasn't scaring this legislatures.,morphology,determiner_noun_agreement,determiner_noun_agreement_1,True,True,False,True,756,-42.335533142089844,-43.24586486816406,1
All ladders wouldn't annoy this girl.,All ladders wouldn't annoy this girls.,morphology,determiner_noun_agreement,determiner_noun_agreement_1,True,True,False,True,757,-55.9894905090332,-59.014610290527344,1
The Borgias haven't cared for those children.,The Borgias haven't cared for those child.,morphology,determiner_noun_agreement,determiner_noun_agreement_1,True,True,False,True,758,-54.939056396484375,-58.16338348388672,1
Emily disagrees with that boy.,Emily disagrees with that boys.,morphology,determiner_noun_agreement,determiner_noun_agreement_1,True,True,False,True,759,-30.664865493774414,-33.10856246948242,1
Guy has cleaned these restaurants.,Guy has cleaned these restaurant.,morphology,determiner_noun_agreement,determiner_noun_agreement_1,True,True,False,True,760,-29.318687438964844,-31.872039794921875,1
Ruth looks like that sketch.,Ruth looks like that sketches.,morphology,determiner_noun_agreement,determiner_noun_agreement_1,True,True,False,True,761,-43.43067169189453,-45.14726257324219,1
Every river shocks this boy.,Every river shocks this boys.,morphology,determiner_noun_agreement,determiner_noun_agreement_1,True,True,False,True,762,-38.97039031982422,-40.77813720703125,1
The sketch wouldn't look like these cups.,The sketch wouldn't look like these cup.,morphology,determiner_noun_agreement,determiner_noun_agreement_1,True,True,False,True,763,-47.229248046875,-49.262054443359375,1
The cashiers pass this grocery store.,The cashiers pass this grocery stores.,morphology,determiner_noun_agreement,determiner_noun_agreement_1,True,True,False,True,764,-50.040199279785156,-51.52489471435547,1
Those actors hire those waitresses.,Those actors hire those waitress.,morphology,determiner_noun_agreement,determiner_noun_agreement_1,True,True,False,True,765,-49.6920280456543,-39.882591247558594,0
