sentence_good,sentence_bad,field,linguistics_term,UID,simple_LM_method,one_prefix_method,two_prefix_method,lexically_identical,pair_id,good_prob,bad_prob,correct
Timothy couldn't disturb that guy.,Timothy couldn't disturb that guys.,morphology,determiner_noun_agreement,determiner_noun_agreement_1,True,True,False,True,639,-36.14042663574219,-38.447776794433594,1
A lot of guys find these guests.,A lot of guys find these guest.,morphology,determiner_noun_agreement,determiner_noun_agreement_1,True,True,False,True,640,-49.649051666259766,-53.62956237792969,1
Many fish can't look like this picture.,Many fish can't look like this pictures.,morphology,determiner_noun_agreement,determiner_noun_agreement_1,True,True,False,True,641,-38.86651611328125,-39.407264709472656,1
Craig drops by these cafes.,Craig drops by these cafe.,morphology,determiner_noun_agreement,determiner_noun_agreement_1,True,True,False,True,642,-39.45467758178711,-37.93587875366211,0
Carlos fired that waitress.,Carlos fired that waitresses.,morphology,determiner_noun_agreement,determiner_noun_agreement_1,True,True,False,True,643,-38.38737487792969,-44.776649475097656,1
Those girls conceal this blouse.,Those girls conceal this blouses.,morphology,determiner_noun_agreement,determiner_noun_agreement_1,True,True,False,True,644,-44.25816345214844,-44.986907958984375,1
The ladies walk through this public park.,The ladies walk through this public parks.,morphology,determiner_noun_agreement,determiner_noun_agreement_1,True,True,False,True,645,-45.02996063232422,-44.88433837890625,0
Irene has hidden those cashiers.,Irene has hidden those cashier.,morphology,determiner_noun_agreement,determiner_noun_agreement_1,True,True,False,True,646,-57.0772590637207,-57.26301193237305,1
Nancy wouldn't describe that driver.,Nancy wouldn't describe that drivers.,morphology,determiner_noun_agreement,determiner_noun_agreement_1,True,True,False,True,647,-43.3813362121582,-45.047027587890625,1
A lot of reports didn't disagree with those documentaries.,A lot of reports didn't disagree with those documentary.,morphology,determiner_noun_agreement,determiner_noun_agreement_1,True,True,False,True,648,-64.72916412353516,-65.38677215576172,1
Every projector alarms that teacher.,Every projector alarms that teachers.,morphology,determiner_noun_agreement,determiner_noun_agreement_1,True,True,False,True,649,-46.40045928955078,-45.06971740722656,0
The associations worked with that actor.,The associations worked with that actors.,morphology,determiner_noun_agreement,determiner_noun_agreement_1,True,True,False,True,650,-38.877357482910156,-40.1402702331543,1
Tanya fixed this cup.,Tanya fixed this cups.,morphology,determiner_noun_agreement,determiner_noun_agreement_1,True,True,False,True,651,-45.37987518310547,-48.07038116455078,1
Samuel did sound like this museum.,Samuel did sound like this museums.,morphology,determiner_noun_agreement,determiner_noun_agreement_1,True,True,False,True,652,-41.09074401855469,-43.58335494995117,1
The drawing isn't annoying these waitresses.,The drawing isn't annoying these waitress.,morphology,determiner_noun_agreement,determiner_noun_agreement_1,True,True,False,True,653,-63.797611236572266,-54.180824279785156,0
That fork aggravates this university.,That fork aggravates this universities.,morphology,determiner_noun_agreement,determiner_noun_agreement_1,True,True,False,True,654,-51.7108268737793,-53.74105453491211,1
Amelia has attacked this patient.,Amelia has attacked this patients.,morphology,determiner_noun_agreement,determiner_noun_agreement_1,True,True,False,True,655,-46.043087005615234,-47.2050666809082,1
Margaret praises that student.,Margaret praises that students.,morphology,determiner_noun_agreement,determiner_noun_agreement_1,True,True,False,True,656,-34.27850341796875,-33.98020935058594,0
Dawn could love these essays.,Dawn could love these essay.,morphology,determiner_noun_agreement,determiner_noun_agreement_1,True,True,False,True,657,-52.486427307128906,-54.5220832824707,1
Natalie is finding these hats.,Natalie is finding these hat.,morphology,determiner_noun_agreement,determiner_noun_agreement_1,True,True,False,True,658,-43.075931549072266,-43.809547424316406,1
The Impressionists escape from this library.,The Impressionists escape from this libraries.,morphology,determiner_noun_agreement,determiner_noun_agreement_1,True,True,False,True,659,-59.12894058227539,-64.34165954589844,1
This government dislikes these guys.,This government dislikes these guy.,morphology,determiner_noun_agreement,determiner_noun_agreement_1,True,True,False,True,660,-45.92345428466797,-48.893821716308594,1
Phillip wasn't embarrassing this government.,Phillip wasn't embarrassing this governments.,morphology,determiner_noun_agreement,determiner_noun_agreement_1,True,True,False,True,661,-45.64422607421875,-49.884033203125,1
Kenneth knew these students.,Kenneth knew these student.,morphology,determiner_noun_agreement,determiner_noun_agreement_1,True,True,False,True,662,-34.415504455566406,-36.36038589477539,1
A lot of lakes disturb that museum.,A lot of lakes disturb that museums.,morphology,determiner_noun_agreement,determiner_noun_agreement_1,True,True,False,True,663,-59.14305114746094,-62.16179656982422,1
Irene was going to that public park.,Irene was going to that public parks.,morphology,determiner_noun_agreement,determiner_noun_agreement_1,True,True,False,True,664,-44.225093841552734,-43.814430236816406,0
Heidi worked with those patients.,Heidi worked with those patient.,morphology,determiner_noun_agreement,determiner_noun_agreement_1,True,True,False,True,665,-38.024715423583984,-39.94192123413086,1
Renee was breaking that glass.,Renee was breaking that glasses.,morphology,determiner_noun_agreement,determiner_noun_agreement_1,True,True,False,True,666,-35.121585845947266,-38.484092712402344,1
Gregory dislikes this adult.,Gregory dislikes this adults.,morphology,determiner_noun_agreement,determiner_noun_agreement_1,True,True,False,True,667,-49.91327667236328,-48.6652946472168,0
Paul isn't taking this painting.,Paul isn't taking this paintings.,morphology,determiner_noun_agreement,determiner_noun_agreement_1,True,True,False,True,668,-29.85997200012207,-32.84098815917969,1
Rose is exiting this bank.,Rose is exiting this banks.,morphology,determiner_noun_agreement,determiner_noun_agreement_1,True,True,False,True,669,-37.51899337768555,-40.655113220214844,1
Lucille wasn't kissing that teenager.,Lucille wasn't kissing that teenagers.,morphology,determiner_noun_agreement,determiner_noun_agreement_1,True,True,False,True,670,-48.789161682128906,-48.018226623535156,0
Ann concealed these guests.,Ann concealed these guest.,morphology,determiner_noun_agreement,determiner_noun_agreement_1,True,True,False,True,671,-36.15977478027344,-39.963706970214844,1
Amanda notices these rabbits.,Amanda notices these rabbit.,morphology,determiner_noun_agreement,determiner_noun_agreement_1,True,True,False,True,672,-41.801536560058594,-42.380882263183594,1
Most pedestrians describe those plays.,Most pedestrians describe those play.,morphology,determiner_noun_agreement,determiner_noun_agreement_1,True,True,False,True,673,-40.86384582519531,-39.77561950683594,0
Guy has escaped from those girls.,Guy has escaped from those girl.,morphology,determiner_noun_agreement,determiner_noun_agreement_1,True,True,False,True,674,-30.60418701171875,-32.9071044921875,1
Naomi returned to this guy.,Naomi returned to this guys.,morphology,determiner_noun_agreement,determiner_noun_agreement_1,True,True,False,True,675,-33.32255172729492,-34.894554138183594,1
Elaine is messing up that glass.,Elaine is messing up that glasses.,morphology,determiner_noun_agreement,determiner_noun_agreement_1,True,True,False,True,676,-41.110965728759766,-43.237464904785156,1
Most banks should look like those drawings.,Most banks should look like those drawing.,morphology,determiner_noun_agreement,determiner_noun_agreement_1,True,True,False,True,677,-43.63066101074219,-46.03786849975586,1
Christopher hasn't hidden that chair.,Christopher hasn't hidden that chairs.,morphology,determiner_noun_agreement,determiner_noun_agreement_1,True,True,False,True,678,-34.07860565185547,-37.2291374206543,1
Florence talked to that doctor.,Florence talked to that doctors.,morphology,determiner_noun_agreement,determiner_noun_agreement_1,True,True,False,True,679,-38.38721466064453,-39.77492141723633,1
Sara had run around this library.,Sara had run around this libraries.,morphology,determiner_noun_agreement,determiner_noun_agreement_1,True,True,False,True,680,-50.293357849121094,-56.16596603393555,1
Helen was biking to these grocery stores.,Helen was biking to these grocery store.,morphology,determiner_noun_agreement,determiner_noun_agreement_1,True,True,False,True,681,-52.741458892822266,-54.813323974609375,1
Some children see these drawings.,Some children see these drawing.,morphology,determiner_noun_agreement,determiner_noun_agreement_1,True,True,False,True,682,-31.980558395385742,-33.71440887451172,1
A lot of pictures have annoyed this actress.,A lot of pictures have annoyed this actresses.,morphology,determiner_noun_agreement,determiner_noun_agreement_1,True,True,False,True,683,-64.94145202636719,-66.00273132324219,1
The Clintons hadn't argued about those boys.,The Clintons hadn't argued about those boy.,morphology,determiner_noun_agreement,determiner_noun_agreement_1,True,True,False,True,684,-55.36016082763672,-57.82647705078125,1
Mitchell healed that adult.,Mitchell healed that adults.,morphology,determiner_noun_agreement,determiner_noun_agreement_1,True,True,False,True,685,-43.17778396606445,-43.01012420654297,0
Omar doesn't forget these students.,Omar doesn't forget these student.,morphology,determiner_noun_agreement,determiner_noun_agreement_1,True,True,False,True,686,-44.99293899536133,-47.65707778930664,1
Carlos drops by that library.,Carlos drops by that libraries.,morphology,determiner_noun_agreement,determiner_noun_agreement_1,True,True,False,True,687,-40.21009826660156,-44.61796188354492,1
Some children were healing these students.,Some children were healing these student.,morphology,determiner_noun_agreement,determiner_noun_agreement_1,True,True,False,True,688,-37.35398483276367,-39.664588928222656,1
A fish isn't irritating this adult.,A fish isn't irritating this adults.,morphology,determiner_noun_agreement,determiner_noun_agreement_1,True,True,False,True,689,-57.90126419067383,-57.33788299560547,0
Galileo had those glasses.,Galileo had those glass.,morphology,determiner_noun_agreement,determiner_noun_agreement_1,True,True,False,True,690,-36.91193389892578,-36.41032028198242,0
Candice would sound like these waiters.,Candice would sound like these waiter.,morphology,determiner_noun_agreement,determiner_noun_agreement_1,True,True,False,True,691,-49.92790222167969,-42.51824951171875,0
Tamara does tour those restaurants.,Tamara does tour those restaurant.,morphology,determiner_noun_agreement,determiner_noun_agreement_1,True,True,False,True,692,-42.69405746459961,-46.11359405517578,1
Mitchell will boast about those boys.,Mitchell will boast about those boy.,morphology,determiner_noun_agreement,determiner_noun_agreement_1,True,True,False,True,693,-51.1209716796875,-54.617401123046875,1
Nancy does pass those museums.,Nancy does pass those museum.,morphology,determiner_noun_agreement,determiner_noun_agreement_1,True,True,False,True,694,-46.25371551513672,-46.287086486816406,1
Brad liked those grocery stores.,Brad liked those grocery store.,morphology,determiner_noun_agreement,determiner_noun_agreement_1,True,True,False,True,695,-37.06188201904297,-38.290523529052734,1
Carol insults that actor.,Carol insults that actors.,morphology,determiner_noun_agreement,determiner_noun_agreement_1,True,True,False,True,696,-45.801231384277344,-47.3871955871582,1
Thomas knows those guests.,Thomas knows those guest.,morphology,determiner_noun_agreement,determiner_noun_agreement_1,True,True,False,True,697,-28.313209533691406,-29.839691162109375,1
Angela watched this pedestrian.,Angela watched this pedestrians.,morphology,determiner_noun_agreement,determiner_noun_agreement_1,True,True,False,True,698,-39.14521026611328,-37.904518127441406,0
Sally hasn't known that waitress.,Sally hasn't known that waitresses.,morphology,determiner_noun_agreement,determiner_noun_agreement_1,True,True,False,True,699,-55.38441848754883,-62.30229949951172,1
Harvard University didn't hate this adult.,Harvard University didn't hate this adults.,morphology,determiner_noun_agreement,determiner_noun_agreement_1,True,True,False,True,700,-56.6229248046875,-55.12935256958008,0
Anna hadn't fled from these restaurants.,Anna hadn't fled from these restaurant.,morphology,determiner_noun_agreement,determiner_noun_agreement_1,True,True,False,True,701,-40.814125061035156,-43.19327926635742,1
The Impressionists hadn't lifted this sweater.,The Impressionists hadn't lifted this sweaters.,morphology,determiner_noun_agreement,determiner_noun_agreement_1,True,True,False,True,702,-68.91647338867188,-73.94908905029297,1
Allison couldn't listen to this guest.,Allison couldn't listen to this guests.,morphology,determiner_noun_agreement,determiner_noun_agreement_1,True,True,False,True,703,-44.35652160644531,-43.412322998046875,0
All teenagers insult these movie theaters.,All teenagers insult these movie theater.,morphology,determiner_noun_agreement,determiner_noun_agreement_1,True,True,False,True,704,-53.24323654174805,-52.957275390625,0
The carriage scares those senators.,The carriage scares those senator.,morphology,determiner_noun_agreement,determiner_noun_agreement_1,True,True,False,True,705,-44.684425354003906,-42.874977111816406,0
These students didn't disagree with those children.,These students didn't disagree with those child.,morphology,determiner_noun_agreement,determiner_noun_agreement_1,True,True,False,True,706,-35.392173767089844,-38.95006561279297,1
Children bike to those banks.,Children bike to those bank.,morphology,determiner_noun_agreement,determiner_noun_agreement_1,True,True,False,True,707,-35.161094665527344,-35.188907623291016,1
Alice isn't complaining about that waitress.,Alice isn't complaining about that waitresses.,morphology,determiner_noun_agreement,determiner_noun_agreement_1,True,True,False,True,708,-35.88843536376953,-45.18300247192383,1
Some girls clean this car.,Some girls clean this cars.,morphology,determiner_noun_agreement,determiner_noun_agreement_1,True,True,False,True,709,-29.89066505432129,-32.207664489746094,1
Most waiters could break those couches.,Most waiters could break those couch.,morphology,determiner_noun_agreement,determiner_noun_agreement_1,True,True,False,True,710,-58.385841369628906,-51.282772064208984,0
Bruce questions that cashier.,Bruce questions that cashiers.,morphology,determiner_noun_agreement,determiner_noun_agreement_1,True,True,False,True,711,-39.14289093017578,-39.031898498535156,0
George hated these cashiers.,George hated these cashier.,morphology,determiner_noun_agreement,determiner_noun_agreement_1,True,True,False,True,712,-38.41374969482422,-38.43113708496094,1
Ella concealed these teachers.,Ella concealed these teacher.,morphology,determiner_noun_agreement,determiner_noun_agreement_1,True,True,False,True,713,-48.251914978027344,-51.21641540527344,1
Sheila is bringing this hamster.,Sheila is bringing this hamsters.,morphology,determiner_noun_agreement,determiner_noun_agreement_1,True,True,False,True,714,-45.58074188232422,-45.146331787109375,0
Some doctors boast about those patients.,Some doctors boast about those patient.,morphology,determiner_noun_agreement,determiner_noun_agreement_1,True,True,False,True,715,-44.290489196777344,-46.97565841674805,1
Carla has investigated these boys.,Carla has investigated these boy.,morphology,determiner_noun_agreement,determiner_noun_agreement_1,True,True,False,True,716,-37.87942886352539,-41.15544891357422,1
Those actors have taken those libraries.,Those actors have taken those library.,morphology,determiner_noun_agreement,determiner_noun_agreement_1,True,True,False,True,717,-37.61627960205078,-35.77251434326172,0
Some restaurants irritated that lady.,Some restaurants irritated that ladies.,morphology,determiner_noun_agreement,determiner_noun_agreement_1,True,True,False,True,718,-38.23619842529297,-39.87305450439453,1
Marcus couldn't complain about this teacher.,Marcus couldn't complain about this teachers.,morphology,determiner_noun_agreement,determiner_noun_agreement_1,True,True,False,True,719,-37.71816635131836,-37.94462966918945,1
Carmen isn't boasting about this story.,Carmen isn't boasting about this stories.,morphology,determiner_noun_agreement,determiner_noun_agreement_1,True,True,False,True,720,-62.871334075927734,-63.74740982055664,1
That senator is selling that art gallery.,That senator is selling that art galleries.,morphology,determiner_noun_agreement,determiner_noun_agreement_1,True,True,False,True,721,-53.1963996887207,-52.025089263916016,0
Patrick investigates these girls.,Patrick investigates these girl.,morphology,determiner_noun_agreement,determiner_noun_agreement_1,True,True,False,True,722,-32.333126068115234,-35.44469451904297,1
Lucille has stunned this guest.,Lucille has stunned this guests.,morphology,determiner_noun_agreement,determiner_noun_agreement_1,True,True,False,True,723,-46.16804122924805,-45.430274963378906,0
Most men examine these reports.,Most men examine these report.,morphology,determiner_noun_agreement,determiner_noun_agreement_1,True,True,False,True,724,-36.175933837890625,-38.96470260620117,1
This eye embarrasses these ladies.,This eye embarrasses these lady.,morphology,determiner_noun_agreement,determiner_noun_agreement_1,True,True,False,True,725,-49.64131164550781,-50.85304641723633,1
Ella hasn't healed that boy.,Ella hasn't healed that boys.,morphology,determiner_noun_agreement,determiner_noun_agreement_1,True,True,False,True,726,-49.93423843383789,-52.79596710205078,1
Sabrina wasn't talking about this mall.,Sabrina wasn't talking about this malls.,morphology,determiner_noun_agreement,determiner_noun_agreement_1,True,True,False,True,727,-38.024314880371094,-43.8272705078125,1
Ella argued about those patients.,Ella argued about those patient.,morphology,determiner_noun_agreement,determiner_noun_agreement_1,True,True,False,True,728,-45.40184020996094,-47.859703063964844,1
This girl could arrive at those college campuses.,This girl could arrive at those college campus.,morphology,determiner_noun_agreement,determiner_noun_agreement_1,True,True,False,True,729,-53.33540344238281,-52.32374954223633,0
Cheryl wasn't revealing those ladies.,Cheryl wasn't revealing those lady.,morphology,determiner_noun_agreement,determiner_noun_agreement_1,True,True,False,True,730,-67.00704956054688,-66.52702331542969,0
Jodi boasted about that book.,Jodi boasted about that books.,morphology,determiner_noun_agreement,determiner_noun_agreement_1,True,True,False,True,731,-48.281490325927734,-51.096126556396484,1
Colleen has known that pedestrian.,Colleen has known that pedestrians.,morphology,determiner_noun_agreement,determiner_noun_agreement_1,True,True,False,True,732,-49.477867126464844,-48.272544860839844,0
David wouldn't sell this plate.,David wouldn't sell this plates.,morphology,determiner_noun_agreement,determiner_noun_agreement_1,True,True,False,True,733,-29.431081771850586,-31.75389289855957,1
This legislature wouldn't help that teenager.,This legislature wouldn't help that teenagers.,morphology,determiner_noun_agreement,determiner_noun_agreement_1,True,True,False,True,734,-47.58983612060547,-45.239990234375,0
Wayne was driving to this high school.,Wayne was driving to this high schools.,morphology,determiner_noun_agreement,determiner_noun_agreement_1,True,True,False,True,735,-38.417137145996094,-46.33140563964844,1
Dana will discuss this dancer.,Dana will discuss this dancers.,morphology,determiner_noun_agreement,determiner_noun_agreement_1,True,True,False,True,736,-42.19502258300781,-45.05065155029297,1
Candice cared for those teachers.,Candice cared for those teacher.,morphology,determiner_noun_agreement,determiner_noun_agreement_1,True,True,False,True,737,-35.40351867675781,-37.38838195800781,1
Every sketch looks like this brochure.,Every sketch looks like this brochures.,morphology,determiner_noun_agreement,determiner_noun_agreement_1,True,True,False,True,738,-50.7006721496582,-49.43717956542969,0
Most waiters love these documentaries.,Most waiters love these documentary.,morphology,determiner_noun_agreement,determiner_noun_agreement_1,True,True,False,True,739,-51.26668930053711,-51.13961410522461,0
Dancers are researching these pictures.,Dancers are researching these picture.,morphology,determiner_noun_agreement,determiner_noun_agreement_1,True,True,False,True,740,-50.5732421875,-53.18989944458008,1
Christopher would aggravate these governments.,Christopher would aggravate these government.,morphology,determiner_noun_agreement,determiner_noun_agreement_1,True,True,False,True,741,-40.97825622558594,-38.5455322265625,0
Winston Churchill wasn't criticizing this college campus.,Winston Churchill wasn't criticizing this college campuses.,morphology,determiner_noun_agreement,determiner_noun_agreement_1,True,True,False,True,742,-72.06776428222656,-73.36994171142578,1
Mitchell discussed this teenager.,Mitchell discussed this teenagers.,morphology,determiner_noun_agreement,determiner_noun_agreement_1,True,True,False,True,743,-40.27275085449219,-40.399742126464844,1
Monet fired those waiters.,Monet fired those waiter.,morphology,determiner_noun_agreement,determiner_noun_agreement_1,True,True,False,True,744,-44.68069839477539,-37.433982849121094,0
The chicken shocks those committees.,The chicken shocks those committee.,morphology,determiner_noun_agreement,determiner_noun_agreement_1,True,True,False,True,745,-39.510108947753906,-40.855674743652344,1
The Lutherans approach this adult.,The Lutherans approach this adults.,morphology,determiner_noun_agreement,determiner_noun_agreement_1,True,True,False,True,746,-53.05549621582031,-52.39111328125,0
Carol didn't return to that boy.,Carol didn't return to that boys.,morphology,determiner_noun_agreement,determiner_noun_agreement_1,True,True,False,True,747,-42.32048034667969,-45.200286865234375,1
Jane arrived at these restaurants.,Jane arrived at these restaurant.,morphology,determiner_noun_agreement,determiner_noun_agreement_1,True,True,False,True,748,-28.745445251464844,-29.672687530517578,1
That teacher revealed these teachers.,That teacher revealed these teacher.,morphology,determiner_noun_agreement,determiner_noun_agreement_1,True,True,False,True,749,-41.8282356262207,-43.52484893798828,1
Every book isn't stunning these banks.,Every book isn't stunning these bank.,morphology,determiner_noun_agreement,determiner_noun_agreement_1,True,True,False,True,750,-49.133705139160156,-50.11454772949219,1
Carla isn't messing up those couches.,Carla isn't messing up those couch.,morphology,determiner_noun_agreement,determiner_noun_agreement_1,True,True,False,True,751,-56.607025146484375,-47.99516296386719,0
Lori hasn't exited that grocery store.,Lori hasn't exited that grocery stores.,morphology,determiner_noun_agreement,determiner_noun_agreement_1,True,True,False,True,752,-63.65966033935547,-63.2674560546875,0
Waitresses lift those socks.,Waitresses lift those sock.,morphology,determiner_noun_agreement,determiner_noun_agreement_1,True,True,False,True,753,-40.863609313964844,-43.67520523071289,1
John wasn't shocking this doctor.,John wasn't shocking this doctors.,morphology,determiner_noun_agreement,determiner_noun_agreement_1,True,True,False,True,754,-39.55455780029297,-41.11774444580078,1
Gerald cleans that scarf.,Gerald cleans that scarves.,morphology,determiner_noun_agreement,determiner_noun_agreement_1,True,True,False,True,755,-44.802223205566406,-48.91503143310547,1
Larry wasn't scaring this legislature.,Larry wasn't scaring this legislatures.,morphology,determiner_noun_agreement,determiner_noun_agreement_1,True,True,False,True,756,-42.56492614746094,-44.5200309753418,1
All ladders wouldn't annoy this girl.,All ladders wouldn't annoy this girls.,morphology,determiner_noun_agreement,determiner_noun_agreement_1,True,True,False,True,757,-56.38789367675781,-59.288997650146484,1
The Borgias haven't cared for those children.,The Borgias haven't cared for those child.,morphology,determiner_noun_agreement,determiner_noun_agreement_1,True,True,False,True,758,-55.323219299316406,-58.96707534790039,1
Emily disagrees with that boy.,Emily disagrees with that boys.,morphology,determiner_noun_agreement,determiner_noun_agreement_1,True,True,False,True,759,-29.379117965698242,-31.08226776123047,1
Guy has cleaned these restaurants.,Guy has cleaned these restaurant.,morphology,determiner_noun_agreement,determiner_noun_agreement_1,True,True,False,True,760,-30.130584716796875,-32.843231201171875,1
Ruth looks like that sketch.,Ruth looks like that sketches.,morphology,determiner_noun_agreement,determiner_noun_agreement_1,True,True,False,True,761,-41.28949737548828,-43.86723709106445,1
Every river shocks this boy.,Every river shocks this boys.,morphology,determiner_noun_agreement,determiner_noun_agreement_1,True,True,False,True,762,-39.98390579223633,-41.01288986206055,1
The sketch wouldn't look like these cups.,The sketch wouldn't look like these cup.,morphology,determiner_noun_agreement,determiner_noun_agreement_1,True,True,False,True,763,-49.46540069580078,-49.78937911987305,1
The cashiers pass this grocery store.,The cashiers pass this grocery stores.,morphology,determiner_noun_agreement,determiner_noun_agreement_1,True,True,False,True,764,-54.3310546875,-54.964359283447266,1
Those actors hire those waitresses.,Those actors hire those waitress.,morphology,determiner_noun_agreement,determiner_noun_agreement_1,True,True,False,True,765,-51.22563171386719,-40.876190185546875,0
