sentence_good,sentence_bad,field,linguistics_term,UID,simple_LM_method,one_prefix_method,two_prefix_method,lexically_identical,pair_id,good_prob,bad_prob,correct
Rachel's supervisors do ascertain there to be many lights disappearing.,Rachel's supervisors do persuade there to be many lights disappearing.,syntax_semantics,control_raising,existential_there_object_raising,True,False,True,False,758,-84.85358428955078,-83.13436889648438,0
Beverly's friend does find there to be fewer than three high schools aggravating Alice.,Beverly's friend does entreat there to be fewer than three high schools aggravating Alice.,syntax_semantics,control_raising,existential_there_object_raising,True,False,True,False,759,-131.2342529296875,-147.892578125,1
Allison anticipated there to be a brother of Christine speaking up.,Allison urged there to be a brother of Christine speaking up.,syntax_semantics,control_raising,existential_there_object_raising,True,False,True,False,760,-83.63861846923828,-82.85607147216797,0
Cynthia had predicted there to be a closet vanishing.,Cynthia had entreated there to be a closet vanishing.,syntax_semantics,control_raising,existential_there_object_raising,True,False,True,False,761,-83.69799041748047,-100.72350311279297,1
Melissa had ascertained there to be no tomatoes scaring Kenneth.,Melissa had convinced there to be no tomatoes scaring Kenneth.,syntax_semantics,control_raising,existential_there_object_raising,True,False,True,False,762,-98.99040985107422,-82.43373107910156,0
William's sister wants there to be a grandmother of Cindy complaining.,William's sister induces there to be a grandmother of Cindy complaining.,syntax_semantics,control_raising,existential_there_object_raising,True,False,True,False,763,-69.70052337646484,-84.48955535888672,1
Donna's classmate might discover there to be a lot of steps existing.,Donna's classmate might prompt there to be a lot of steps existing.,syntax_semantics,control_raising,existential_there_object_raising,True,False,True,False,764,-87.904296875,-93.84889221191406,1
Alicia's tutors predict there to be few dresses vanishing.,Alicia's tutors forced there to be few dresses vanishing.,syntax_semantics,control_raising,existential_there_object_raising,True,False,True,False,765,-113.26126098632812,-108.65185546875,0
Samuel's oncologists aren't preferring there to be more than three senators boasting.,Samuel's oncologists aren't advising there to be more than three senators boasting.,syntax_semantics,control_raising,existential_there_object_raising,True,False,True,False,766,-125.73246765136719,-125.37179565429688,0
These schools find there to be a painting of Janice looking like a boy.,These schools motivate there to be a painting of Janice looking like a boy.,syntax_semantics,control_raising,existential_there_object_raising,True,False,True,False,767,-90.07925415039062,-98.33436584472656,1
Paula's ex-girlfriends ascertained there to be actresses vanishing.,Paula's ex-girlfriends motivate there to be actresses vanishing.,syntax_semantics,control_raising,existential_there_object_raising,True,False,True,False,768,-114.51728057861328,-97.68614196777344,0
Sharon's ex-wives aren't wanting there to be no pants unfolding.,Sharon's ex-wives aren't requiring there to be no pants unfolding.,syntax_semantics,control_raising,existential_there_object_raising,True,False,True,False,769,-88.89952087402344,-94.080322265625,1
Bethany finds there to be a mushroom annoying Michelle.,Bethany forces there to be a mushroom annoying Michelle.,syntax_semantics,control_raising,existential_there_object_raising,True,False,True,False,770,-90.58944702148438,-90.82533264160156,1
Todd shouldn't find there to be more than three screens falling.,Todd shouldn't prod there to be more than three screens falling.,syntax_semantics,control_raising,existential_there_object_raising,True,False,True,False,771,-65.37422180175781,-77.9449234008789,1
Wayne did need there to be a dress crumpling.,Wayne did sway there to be a dress crumpling.,syntax_semantics,control_raising,existential_there_object_raising,True,False,True,False,772,-72.43018341064453,-79.92803192138672,1
Jason found there to be a newspaper article about the Clintons winning.,Jason encouraged there to be a newspaper article about the Clintons winning.,syntax_semantics,control_raising,existential_there_object_raising,True,False,True,False,773,-73.97196197509766,-73.26097106933594,0
These children find there to be a couch boring Bruce.,These children prod there to be a couch boring Bruce.,syntax_semantics,control_raising,existential_there_object_raising,True,False,True,False,774,-63.111114501953125,-76.84013366699219,1
Wayne was anticipating there to be fewer than three pictures of every child existing.,Wayne was imploring there to be fewer than three pictures of every child existing.,syntax_semantics,control_raising,existential_there_object_raising,True,False,True,False,775,-101.69224548339844,-109.47105407714844,1
Brian's friend isn't wanting there to be a river disgusting Stephanie.,Brian's friend isn't urging there to be a river disgusting Stephanie.,syntax_semantics,control_raising,existential_there_object_raising,True,False,True,False,776,-78.01468658447266,-85.2529525756836,1
Sara wouldn't judge there to be no schools swaying Becca to hire Sonia.,Sara wouldn't entice there to be no schools swaying Becca to hire Sonia.,syntax_semantics,control_raising,existential_there_object_raising,True,False,True,False,777,-128.21185302734375,-142.21243286132812,1
That niece of Alexander has judged there to be a face annoying that waitress.,That niece of Alexander has implored there to be a face annoying that waitress.,syntax_semantics,control_raising,existential_there_object_raising,True,False,True,False,778,-102.323486328125,-111.11355590820312,1
Erin's piano teachers declare there to be a lot of daughters of Claire fighting.,Erin's piano teachers prompted there to be a lot of daughters of Claire fighting.,syntax_semantics,control_raising,existential_there_object_raising,True,False,True,False,779,-104.3681640625,-106.50776672363281,1
That waitress's plumbers aren't needing there to be a spotlight darkening.,That waitress's plumbers aren't prodding there to be a spotlight darkening.,syntax_semantics,control_raising,existential_there_object_raising,True,False,True,False,780,-107.36868286132812,-127.73500061035156,1
Karla would ascertain there to be fish astounding Lori.,Karla would induce there to be fish astounding Lori.,syntax_semantics,control_raising,existential_there_object_raising,True,False,True,False,781,-82.55946350097656,-79.53077697753906,0
Many children haven't predicted there to be many mirrors bothering Heidi.,Many children haven't advised there to be many mirrors bothering Heidi.,syntax_semantics,control_raising,existential_there_object_raising,True,False,True,False,782,-78.85165405273438,-79.91764068603516,1
Those patients declare there to be a jacket scaring Renee.,Those patients require there to be a jacket scaring Renee.,syntax_semantics,control_raising,existential_there_object_raising,True,False,True,False,783,-89.7038803100586,-82.1303939819336,0
Every government predicts there to be fewer than three cafes worrying Teresa.,Every government induces there to be fewer than three cafes worrying Teresa.,syntax_semantics,control_raising,existential_there_object_raising,True,False,True,False,784,-101.17999267578125,-104.67375183105469,1
Randolf's grandsons wanted there to be steak scorching.,Randolf's grandsons command there to be steak scorching.,syntax_semantics,control_raising,existential_there_object_raising,True,False,True,False,785,-99.89666748046875,-108.33702087402344,1
Patrick's colleague couldn't predict there to be a documentary about music bothering Christina.,Patrick's colleague couldn't dare there to be a documentary about music bothering Christina.,syntax_semantics,control_raising,existential_there_object_raising,True,False,True,False,786,-101.76870727539062,-101.21984100341797,0
Curtis found there to be a door appearing.,Curtis advises there to be a door appearing.,syntax_semantics,control_raising,existential_there_object_raising,True,False,True,False,787,-67.19489288330078,-72.8863296508789,1
Chad did consider there to be an apple worrying every dancer.,Chad did oblige there to be an apple worrying every dancer.,syntax_semantics,control_raising,existential_there_object_raising,True,False,True,False,788,-89.35002136230469,-98.37358856201172,1
Every boy can need there to be few mouths upsetting Carmen.,Every boy can push there to be few mouths upsetting Carmen.,syntax_semantics,control_raising,existential_there_object_raising,True,False,True,False,789,-85.44054412841797,-84.32798767089844,0
Sarah considered there to be a book stunning this waitress.,Sarah asks there to be a book stunning this waitress.,syntax_semantics,control_raising,existential_there_object_raising,True,False,True,False,790,-67.08399963378906,-66.7478256225586,0
Bradley could prefer there to be a grocery store shocking Melanie.,Bradley could ask there to be a grocery store shocking Melanie.,syntax_semantics,control_raising,existential_there_object_raising,True,False,True,False,791,-79.5670166015625,-75.2935791015625,0
That hospital hadn't expected there to be many dogs hiding.,That hospital hadn't asked there to be many dogs hiding.,syntax_semantics,control_raising,existential_there_object_raising,True,False,True,False,792,-74.37407684326172,-73.86309814453125,0
Many teachers judge there to be a candle brightening.,Many teachers force there to be a candle brightening.,syntax_semantics,control_raising,existential_there_object_raising,True,False,True,False,793,-72.57681274414062,-68.88699340820312,0
Guy won't judge there to be no mirrors vanishing.,Guy won't tempt there to be no mirrors vanishing.,syntax_semantics,control_raising,existential_there_object_raising,True,False,True,False,794,-60.730552673339844,-65.84271240234375,1
These doctors ascertain there to be a student bothering to shout.,These doctors compelled there to be a student bothering to shout.,syntax_semantics,control_raising,existential_there_object_raising,True,False,True,False,795,-77.53688049316406,-74.12899780273438,0
Rodney's associates need there to be an organization annoying Peter.,Rodney's associates forced there to be an organization annoying Peter.,syntax_semantics,control_raising,existential_there_object_raising,True,False,True,False,796,-78.05328369140625,-81.15440368652344,1
Teresa wasn't discovering there to be a lot of stories about Spain scaring Allison.,Teresa wasn't pressuring there to be a lot of stories about Spain scaring Allison.,syntax_semantics,control_raising,existential_there_object_raising,True,False,True,False,797,-106.89620971679688,-108.97840881347656,1
Vincent's friends find there to be a cafe astounding Victoria.,Vincent's friends commanded there to be a cafe astounding Victoria.,syntax_semantics,control_raising,existential_there_object_raising,True,False,True,False,798,-91.25758361816406,-98.0086898803711,1
Bethany considers there to be some eggplants vanishing.,Bethany pushed there to be some eggplants vanishing.,syntax_semantics,control_raising,existential_there_object_raising,True,False,True,False,799,-96.834228515625,-99.28688049316406,1
Christine anticipates there to be a lot of universities forfeiting.,Christine presses there to be a lot of universities forfeiting.,syntax_semantics,control_raising,existential_there_object_raising,True,False,True,False,800,-94.46266174316406,-83.99789428710938,0
Some girls find there to be many cucumbers blackening.,Some girls persuaded there to be many cucumbers blackening.,syntax_semantics,control_raising,existential_there_object_raising,True,False,True,False,801,-76.62503814697266,-81.84537506103516,1
Mark had preferred there to be a report vanishing.,Mark had convinced there to be a report vanishing.,syntax_semantics,control_raising,existential_there_object_raising,True,False,True,False,802,-56.00283432006836,-57.8243293762207,1
That waitress hasn't discovered there to be a child pushing Candice to respect many doctors.,That waitress hasn't persuaded there to be a child pushing Candice to respect many doctors.,syntax_semantics,control_raising,existential_there_object_raising,True,False,True,False,803,-113.61363220214844,-116.7773208618164,1
Heidi's girlfriend hasn't anticipated there to be no plays scaring every student.,Heidi's girlfriend hasn't forced there to be no plays scaring every student.,syntax_semantics,control_raising,existential_there_object_raising,True,False,True,False,804,-108.92786407470703,-103.77224731445312,0
Russell's dentists weren't considering there to be more than three windows appearing.,Russell's dentists weren't motivating there to be more than three windows appearing.,syntax_semantics,control_raising,existential_there_object_raising,True,False,True,False,805,-91.51712036132812,-98.65404510498047,1
That patient expects there to be a college campus vanishing.,That patient requires there to be a college campus vanishing.,syntax_semantics,control_raising,existential_there_object_raising,True,False,True,False,806,-73.82684326171875,-72.34405517578125,0
Edward considered there to be a mall existing.,Edward entices there to be a mall existing.,syntax_semantics,control_raising,existential_there_object_raising,True,False,True,False,807,-48.73269271850586,-66.27046203613281,1
Tammy's teacher would prefer there to be fish looking like that sketch.,Tammy's teacher would persuade there to be fish looking like that sketch.,syntax_semantics,control_raising,existential_there_object_raising,True,False,True,False,808,-78.51438903808594,-83.46240997314453,1
John's daughter wanted there to be an organization annoying Kayla.,John's daughter pressures there to be an organization annoying Kayla.,syntax_semantics,control_raising,existential_there_object_raising,True,False,True,False,809,-71.86873626708984,-82.78709411621094,1
Jodi finds there to be cilantro hurting Stephanie.,Jodi asks there to be cilantro hurting Stephanie.,syntax_semantics,control_raising,existential_there_object_raising,True,False,True,False,810,-91.15231323242188,-90.07473754882812,0
Thomas's grandson wants there to be a drawing shocking Tamara.,Thomas's grandson encourages there to be a drawing shocking Tamara.,syntax_semantics,control_raising,existential_there_object_raising,True,False,True,False,811,-80.7781753540039,-87.74360656738281,1
This father of Monet has needed there to be broccoli going bad.,This father of Monet has badgered there to be broccoli going bad.,syntax_semantics,control_raising,existential_there_object_raising,True,False,True,False,812,-94.90694427490234,-105.73822021484375,1
Laurie's ex-girlfriends have ascertained there to be a lot of casseroles disappearing.,Laurie's ex-girlfriends have begged there to be a lot of casseroles disappearing.,syntax_semantics,control_raising,existential_there_object_raising,True,False,True,False,813,-148.52694702148438,-131.67691040039062,0
Monet needs there to be a painting of James scaring most waiters.,Monet requires there to be a painting of James scaring most waiters.,syntax_semantics,control_raising,existential_there_object_raising,True,False,True,False,814,-99.0650863647461,-100.1778564453125,1
A niece of that girl can need there to be a lot of blouses crumpling.,A niece of that girl can advise there to be a lot of blouses crumpling.,syntax_semantics,control_raising,existential_there_object_raising,True,False,True,False,815,-113.2411880493164,-115.07495880126953,1
Kendra hasn't ascertained there to be a photograph of Marla appearing.,Kendra hasn't persuaded there to be a photograph of Marla appearing.,syntax_semantics,control_raising,existential_there_object_raising,True,False,True,False,816,-117.59135437011719,-98.8672866821289,0
This driver isn't declaring there to be spotlights irritating every doctor.,This driver isn't begging there to be spotlights irritating every doctor.,syntax_semantics,control_raising,existential_there_object_raising,True,False,True,False,817,-101.00288391113281,-97.31312561035156,0
Monet hasn't wanted there to be an association thinking about who won't order Cindy to come here.,Monet hasn't encouraged there to be an association thinking about who won't order Cindy to come here.,syntax_semantics,control_raising,existential_there_object_raising,True,False,True,False,818,-113.85870361328125,-118.36552429199219,1
Carla's best friends discovered there to be a doctor helping Florence.,Carla's best friends commission there to be a doctor helping Florence.,syntax_semantics,control_raising,existential_there_object_raising,True,False,True,False,819,-80.2640380859375,-87.33941650390625,1
Alan's brothers hadn't found there to be many students studying.,Alan's brothers hadn't obligated there to be many students studying.,syntax_semantics,control_raising,existential_there_object_raising,True,False,True,False,820,-63.99982833862305,-73.20457458496094,1
Diana declares there to be a print worrying Bruce.,Diana compelled there to be a print worrying Bruce.,syntax_semantics,control_raising,existential_there_object_raising,True,False,True,False,821,-83.18067932128906,-84.46664428710938,1
Dennis's plumber was judging there to be some high schools existing.,Dennis's plumber was daring there to be some high schools existing.,syntax_semantics,control_raising,existential_there_object_raising,True,False,True,False,822,-101.25753784179688,-101.451416015625,1
Kenneth hasn't predicted there to be a photograph existing.,Kenneth hasn't persuaded there to be a photograph existing.,syntax_semantics,control_raising,existential_there_object_raising,True,False,True,False,823,-67.55713653564453,-67.94296264648438,1
Kirsten anticipates there to be a skateboard falling.,Kirsten urged there to be a skateboard falling.,syntax_semantics,control_raising,existential_there_object_raising,True,False,True,False,824,-93.82778930664062,-81.02336120605469,0
Galileo's grandsons want there to be a couch looking like most sketches.,Galileo's grandsons pressured there to be a couch looking like most sketches.,syntax_semantics,control_raising,existential_there_object_raising,True,False,True,False,825,-115.6700210571289,-123.37654876708984,1
Jennifer's French teachers find there to be a popsicle impressing Chad.,Jennifer's French teachers ordered there to be a popsicle impressing Chad.,syntax_semantics,control_raising,existential_there_object_raising,True,False,True,False,826,-99.79656982421875,-103.77055358886719,1
Lisa considered there to be a lot of cashiers appreciating the Lutherans.,Lisa requires there to be a lot of cashiers appreciating the Lutherans.,syntax_semantics,control_raising,existential_there_object_raising,True,False,True,False,827,-97.0694580078125,-98.84230041503906,1
Florence predicts there to be many girls departing.,Florence advises there to be many girls departing.,syntax_semantics,control_raising,existential_there_object_raising,True,False,True,False,828,-75.85933685302734,-71.19998168945312,0
Guy isn't considering there to be waitresses grinning.,Guy isn't entreating there to be waitresses grinning.,syntax_semantics,control_raising,existential_there_object_raising,True,False,True,False,829,-73.95311737060547,-86.67449951171875,1
Amanda's bosses needed there to be some daughters of Heidi running around many hills.,Amanda's bosses prompt there to be some daughters of Heidi running around many hills.,syntax_semantics,control_raising,existential_there_object_raising,True,False,True,False,830,-109.58148193359375,-118.45751190185547,1
Most fathers of Larry ascertain there to be a lot of trucks irritating Melanie.,Most fathers of Larry dared there to be a lot of trucks irritating Melanie.,syntax_semantics,control_raising,existential_there_object_raising,True,False,True,False,831,-100.00818634033203,-97.43258666992188,0
Timothy's mentees believe there to be a committee arguing about Kenneth.,Timothy's mentees prompt there to be a committee arguing about Kenneth.,syntax_semantics,control_raising,existential_there_object_raising,True,False,True,False,832,-98.80461120605469,-106.70781707763672,1
Some ladies could declare there to be a picture wasting away.,Some ladies could compel there to be a picture wasting away.,syntax_semantics,control_raising,existential_there_object_raising,True,False,True,False,833,-70.07237243652344,-77.49392700195312,1
That bank anticipated there to be movie theaters existing.,That bank tempted there to be movie theaters existing.,syntax_semantics,control_raising,existential_there_object_raising,True,False,True,False,834,-77.4364013671875,-75.99077606201172,0
Charles wants there to be a shoe boring most senators.,Charles obligates there to be a shoe boring most senators.,syntax_semantics,control_raising,existential_there_object_raising,True,False,True,False,835,-69.27730560302734,-80.92672729492188,1
Samantha needed there to be a pie aggravating Denise.,Samantha entices there to be a pie aggravating Denise.,syntax_semantics,control_raising,existential_there_object_raising,True,False,True,False,836,-91.48001098632812,-107.0130615234375,1
Clyde believed there to be fewer than three vases disappearing.,Clyde compelled there to be fewer than three vases disappearing.,syntax_semantics,control_raising,existential_there_object_raising,True,False,True,False,837,-106.27490997314453,-107.97833251953125,1
Kevin hadn't considered there to be a senator vanishing.,Kevin hadn't advised there to be a senator vanishing.,syntax_semantics,control_raising,existential_there_object_raising,True,False,True,False,838,-59.806549072265625,-63.713199615478516,1
Most mothers of Sara predict there to be a doctor begging Carol to yawn.,Most mothers of Sara press there to be a doctor begging Carol to yawn.,syntax_semantics,control_raising,existential_there_object_raising,True,False,True,False,839,-108.0416488647461,-107.21259307861328,0
This brother of Walter might need there to be a mushroom charring.,This brother of Walter might persuade there to be a mushroom charring.,syntax_semantics,control_raising,existential_there_object_raising,True,False,True,False,840,-87.8866958618164,-93.57772827148438,1
Tonya hadn't wanted there to be fewer than three tomatoes annoying Larry.,Tonya hadn't prompted there to be fewer than three tomatoes annoying Larry.,syntax_semantics,control_raising,existential_there_object_raising,True,False,True,False,841,-93.28850555419922,-100.8232192993164,1
Liam's associate needs there to be bread charring.,Liam's associate urged there to be bread charring.,syntax_semantics,control_raising,existential_there_object_raising,True,False,True,False,842,-83.32454681396484,-88.83975219726562,1
Most committees haven't discovered there to be a cat coming here.,Most committees haven't pressured there to be a cat coming here.,syntax_semantics,control_raising,existential_there_object_raising,True,False,True,False,843,-60.422420501708984,-69.44215393066406,1
Committees haven't preferred there to be a cat scaring Sandra.,Committees haven't obligated there to be a cat scaring Sandra.,syntax_semantics,control_raising,existential_there_object_raising,True,False,True,False,844,-79.04087829589844,-84.04818725585938,1
Naomi is preferring there to be more than three lights scaring Donna.,Naomi is imploring there to be more than three lights scaring Donna.,syntax_semantics,control_raising,existential_there_object_raising,True,False,True,False,845,-93.07223510742188,-98.25445556640625,1
That guy judged there to be many chairs embarrassing every driver.,That guy pressured there to be many chairs embarrassing every driver.,syntax_semantics,control_raising,existential_there_object_raising,True,False,True,False,846,-85.59085845947266,-91.197021484375,1
Clyde's fathers weren't predicting there to be some pictures of a guest looking like Meredith.,Clyde's fathers weren't pushing there to be some pictures of a guest looking like Meredith.,syntax_semantics,control_raising,existential_there_object_raising,True,False,True,False,847,-141.28329467773438,-135.56546020507812,0
Some cousin of Curtis considers there to be a museum surrendering.,Some cousin of Curtis prompts there to be a museum surrendering.,syntax_semantics,control_raising,existential_there_object_raising,True,False,True,False,848,-87.50910949707031,-92.32281494140625,1
Most daughters of Melanie need there to be a cousin of Rebecca embarrassing Mary.,Most daughters of Melanie forced there to be a cousin of Rebecca embarrassing Mary.,syntax_semantics,control_raising,existential_there_object_raising,True,False,True,False,849,-100.64118957519531,-101.97250366210938,1
Diana's classmates were wanting there to be more than three fish annoying those patients.,Diana's classmates were inducing there to be more than three fish annoying those patients.,syntax_semantics,control_raising,existential_there_object_raising,True,False,True,False,850,-109.69080352783203,-121.90943145751953,1
The granddaughters of Rodney will need there to be a grocery store vanishing.,The granddaughters of Rodney will prod there to be a grocery store vanishing.,syntax_semantics,control_raising,existential_there_object_raising,True,False,True,False,851,-99.11163330078125,-108.69066619873047,1
Some senators discovered there to be a child failing to concur.,Some senators prod there to be a child failing to concur.,syntax_semantics,control_raising,existential_there_object_raising,True,False,True,False,852,-81.35443115234375,-88.3912353515625,1
Every waitress wasn't believing there to be a car alarming Claire.,Every waitress wasn't requiring there to be a car alarming Claire.,syntax_semantics,control_raising,existential_there_object_raising,True,False,True,False,853,-82.74942016601562,-85.61981201171875,1
