sentence_good,sentence_bad,field,linguistics_term,UID,simple_LM_method,one_prefix_method,two_prefix_method,lexically_identical,pair_id,good_prob,bad_prob,correct
It's themselves that these dancers weren't revealing.,It's themselves that weren't revealing these dancers.,syntax_semantics,binding,principle_A_reconstruction,True,False,False,True,259,-55.14517593383789,-54.235931396484375,0
It's herself that Diane is questioning.,It's herself that is questioning Diane.,syntax_semantics,binding,principle_A_reconstruction,True,False,False,True,260,-48.80481719970703,-48.311485290527344,0
It's themselves who most teenagers sound like.,It's themselves who sound like most teenagers.,syntax_semantics,binding,principle_A_reconstruction,True,False,False,True,261,-52.067657470703125,-46.33784484863281,0
It's herself that Suzanne revealed.,It's herself that revealed Suzanne.,syntax_semantics,binding,principle_A_reconstruction,True,False,False,True,262,-45.395751953125,-45.71868133544922,1
It's themselves who the Clintons would hire.,It's themselves who would hire the Clintons.,syntax_semantics,binding,principle_A_reconstruction,True,False,False,True,263,-57.15140914916992,-53.003971099853516,0
It's itself that every lake scares.,It's itself that scares every lake.,syntax_semantics,binding,principle_A_reconstruction,True,False,False,True,264,-49.74160385131836,-45.45186996459961,0
It's himself who Kevin observes.,It's himself who observes Kevin.,syntax_semantics,binding,principle_A_reconstruction,True,False,False,True,265,-46.658607482910156,-48.67572784423828,1
It's himself who Richard references.,It's himself who references Richard.,syntax_semantics,binding,principle_A_reconstruction,True,False,False,True,266,-43.21038055419922,-48.35062789916992,1
It's herself that Sherry conceals.,It's herself that conceals Sherry.,syntax_semantics,binding,principle_A_reconstruction,True,False,False,True,267,-57.457183837890625,-61.41722106933594,1
It's himself who Homer doesn't hire.,It's himself who doesn't hire Homer.,syntax_semantics,binding,principle_A_reconstruction,True,False,False,True,268,-49.753578186035156,-46.29662322998047,0
It's themselves that the high schools confused.,It's themselves that confused the high schools.,syntax_semantics,binding,principle_A_reconstruction,True,False,False,True,269,-46.583709716796875,-44.3205451965332,0
It's herself who Rose returned to.,It's herself who returned to Rose.,syntax_semantics,binding,principle_A_reconstruction,True,False,False,True,270,-46.86632537841797,-42.68926239013672,0
It's himself who Derek criticizes.,It's himself who criticizes Derek.,syntax_semantics,binding,principle_A_reconstruction,True,False,False,True,271,-56.74876403808594,-56.84979248046875,1
It's himself that Alexander escapes from.,It's himself that escapes from Alexander.,syntax_semantics,binding,principle_A_reconstruction,True,False,False,True,272,-46.287200927734375,-46.34080505371094,1
It's itself that the plane isn't hurting.,It's itself that isn't hurting the plane.,syntax_semantics,binding,principle_A_reconstruction,True,False,False,True,273,-48.74684143066406,-46.07744598388672,0
It's herself who Carmen questioned.,It's herself who questioned Carmen.,syntax_semantics,binding,principle_A_reconstruction,True,False,False,True,274,-48.29166030883789,-46.371158599853516,0
It's herself who Deanna isn't hiding.,It's herself who isn't hiding Deanna.,syntax_semantics,binding,principle_A_reconstruction,True,False,False,True,275,-62.78458023071289,-59.72565460205078,0
It's herself who Donna left.,It's herself who left Donna.,syntax_semantics,binding,principle_A_reconstruction,True,False,False,True,276,-43.862037658691406,-41.40885925292969,0
It's himself who Walter has questioned.,It's himself who has questioned Walter.,syntax_semantics,binding,principle_A_reconstruction,True,False,False,True,277,-50.667755126953125,-47.15126037597656,0
It's himself that Alexander does question.,It's himself that does question Alexander.,syntax_semantics,binding,principle_A_reconstruction,True,False,False,True,278,-42.608211517333984,-45.623924255371094,1
It's herself that Carrie isn't watching.,It's herself that isn't watching Carrie.,syntax_semantics,binding,principle_A_reconstruction,True,False,False,True,279,-48.921241760253906,-48.26975631713867,0
It's himself who James has visited.,It's himself who has visited James.,syntax_semantics,binding,principle_A_reconstruction,True,False,False,True,280,-47.456031799316406,-44.31721878051758,0
It's himself who Kenneth watched.,It's himself who watched Kenneth.,syntax_semantics,binding,principle_A_reconstruction,True,False,False,True,281,-44.898963928222656,-44.50421905517578,0
It's herself who Angela did talk about.,It's herself who did talk about Angela.,syntax_semantics,binding,principle_A_reconstruction,True,False,False,True,282,-51.80528259277344,-48.746673583984375,0
It's himself that this waiter talks about.,It's himself that talks about this waiter.,syntax_semantics,binding,principle_A_reconstruction,True,False,False,True,283,-45.915245056152344,-42.706939697265625,0
It's herself that Heather is arguing about.,It's herself that is arguing about Heather.,syntax_semantics,binding,principle_A_reconstruction,True,False,False,True,284,-54.17539978027344,-50.87624740600586,0
It's herself who Tara should talk to.,It's herself who should talk to Tara.,syntax_semantics,binding,principle_A_reconstruction,True,False,False,True,285,-55.173309326171875,-49.99760055541992,0
It's itself that the legislature references.,It's itself that references the legislature.,syntax_semantics,binding,principle_A_reconstruction,True,False,False,True,286,-45.967525482177734,-48.26460266113281,1
It's herself that Rose does think about.,It's herself that does think about Rose.,syntax_semantics,binding,principle_A_reconstruction,True,False,False,True,287,-50.250694274902344,-48.11334228515625,0
It's themselves that the men will remember.,It's themselves that will remember the men.,syntax_semantics,binding,principle_A_reconstruction,True,False,False,True,288,-39.91191864013672,-39.99324035644531,1
It's themselves who a lot of children are hugging.,It's themselves who are hugging a lot of children.,syntax_semantics,binding,principle_A_reconstruction,True,False,False,True,289,-50.4324836730957,-46.88999938964844,0
It's himself who Brad talked to.,It's himself who talked to Brad.,syntax_semantics,binding,principle_A_reconstruction,True,False,False,True,290,-48.05668640136719,-44.420867919921875,0
It's herself that Christina listened to.,It's herself that listened to Christina.,syntax_semantics,binding,principle_A_reconstruction,True,False,False,True,291,-45.4212760925293,-44.20133972167969,0
It's himself who Timothy didn't watch.,It's himself who didn't watch Timothy.,syntax_semantics,binding,principle_A_reconstruction,True,False,False,True,292,-49.835113525390625,-46.22323989868164,0
It's itself that some hospital couldn't argue about.,It's itself that couldn't argue about some hospital.,syntax_semantics,binding,principle_A_reconstruction,True,False,False,True,293,-57.88655090332031,-52.35028076171875,0
It's herself that Jacqueline discovers.,It's herself that discovers Jacqueline.,syntax_semantics,binding,principle_A_reconstruction,True,False,False,True,294,-53.101593017578125,-54.03147888183594,1
It's herself who Kirsten was appreciating.,It's herself who was appreciating Kirsten.,syntax_semantics,binding,principle_A_reconstruction,True,False,False,True,295,-59.919471740722656,-59.08257293701172,0
It's himself that Theodore had shocked.,It's himself that had shocked Theodore.,syntax_semantics,binding,principle_A_reconstruction,True,False,False,True,296,-50.72903823852539,-52.03189468383789,1
It's himself that Brett hadn't admired.,It's himself that hadn't admired Brett.,syntax_semantics,binding,principle_A_reconstruction,True,False,False,True,297,-55.10633087158203,-54.03566360473633,0
It's himself who Noah does find.,It's himself who does find Noah.,syntax_semantics,binding,principle_A_reconstruction,True,False,False,True,298,-49.297767639160156,-47.63520050048828,0
It's herself that Monica appreciated.,It's herself that appreciated Monica.,syntax_semantics,binding,principle_A_reconstruction,True,False,False,True,299,-44.19956588745117,-45.692420959472656,1
It's herself who Allison does stun.,It's herself who does stun Allison.,syntax_semantics,binding,principle_A_reconstruction,True,False,False,True,300,-62.25697708129883,-56.24330520629883,0
It's himself that Guy fired.,It's himself that fired Guy.,syntax_semantics,binding,principle_A_reconstruction,True,False,False,True,301,-41.194610595703125,-43.210693359375,1
It's herself that Allison had watched.,It's herself that had watched Allison.,syntax_semantics,binding,principle_A_reconstruction,True,False,False,True,302,-52.20555877685547,-49.64884567260742,0
It's himself that Liam flees from.,It's himself that flees from Liam.,syntax_semantics,binding,principle_A_reconstruction,True,False,False,True,303,-58.391239166259766,-53.19047546386719,0
It's himself who Frank hadn't healed.,It's himself who hadn't healed Frank.,syntax_semantics,binding,principle_A_reconstruction,True,False,False,True,304,-55.91281509399414,-55.56523895263672,0
It's himself who Marcus had cared for.,It's himself who had cared for Marcus.,syntax_semantics,binding,principle_A_reconstruction,True,False,False,True,305,-54.41189956665039,-50.18937683105469,0
It's herself that Emily hadn't hidden.,It's herself that hadn't hidden Emily.,syntax_semantics,binding,principle_A_reconstruction,True,False,False,True,306,-53.048301696777344,-50.755226135253906,0
It's herself that Leslie described.,It's herself that described Leslie.,syntax_semantics,binding,principle_A_reconstruction,True,False,False,True,307,-43.37091827392578,-44.78851318359375,1
It's himself that David was noticing.,It's himself that was noticing David.,syntax_semantics,binding,principle_A_reconstruction,True,False,False,True,308,-42.80414581298828,-43.6652946472168,1
It's themselves that these hills might scare.,It's themselves that might scare these hills.,syntax_semantics,binding,principle_A_reconstruction,True,False,False,True,309,-51.743743896484375,-49.3317756652832,0
It's himself who Clyde disturbed.,It's himself who disturbed Clyde.,syntax_semantics,binding,principle_A_reconstruction,True,False,False,True,310,-47.67711639404297,-48.750205993652344,1
It's himself who Frank could notice.,It's himself who could notice Frank.,syntax_semantics,binding,principle_A_reconstruction,True,False,False,True,311,-49.08735656738281,-47.1943473815918,0
It's herself that Melanie had confused.,It's herself that had confused Melanie.,syntax_semantics,binding,principle_A_reconstruction,True,False,False,True,312,-48.635108947753906,-49.9268798828125,1
It's himself that Rodney talked about.,It's himself that talked about Rodney.,syntax_semantics,binding,principle_A_reconstruction,True,False,False,True,313,-43.03588104248047,-38.53569412231445,0
It's himself who Mitchell had kissed.,It's himself who had kissed Mitchell.,syntax_semantics,binding,principle_A_reconstruction,True,False,False,True,314,-51.642242431640625,-47.84577178955078,0
It's herself that Sherry worked with.,It's herself that worked with Sherry.,syntax_semantics,binding,principle_A_reconstruction,True,False,False,True,315,-49.214019775390625,-45.112884521484375,0
It's themselves that a lot of boxes don't stun.,It's themselves that don't stun a lot of boxes.,syntax_semantics,binding,principle_A_reconstruction,True,False,False,True,316,-59.1056022644043,-53.6097526550293,0
It's herself who Sara was helping.,It's herself who was helping Sara.,syntax_semantics,binding,principle_A_reconstruction,True,False,False,True,317,-47.98124694824219,-44.96150207519531,0
It's itself that every convertible was disgusting.,It's itself that was disgusting every convertible.,syntax_semantics,binding,principle_A_reconstruction,True,False,False,True,318,-54.86555480957031,-54.63672637939453,0
It's himself that some adult investigates.,It's himself that investigates some adult.,syntax_semantics,binding,principle_A_reconstruction,True,False,False,True,319,-48.400184631347656,-53.15269088745117,1
It's himself who Brad couldn't appreciate.,It's himself who couldn't appreciate Brad.,syntax_semantics,binding,principle_A_reconstruction,True,False,False,True,320,-56.83435821533203,-52.24421691894531,0
It's herself who Karla works with.,It's herself who works with Karla.,syntax_semantics,binding,principle_A_reconstruction,True,False,False,True,321,-53.76629638671875,-45.81370544433594,0
It's herself that Karen criticized.,It's herself that criticized Karen.,syntax_semantics,binding,principle_A_reconstruction,True,False,False,True,322,-41.30274200439453,-43.573707580566406,1
It's herself who Amanda might criticize.,It's herself who might criticize Amanda.,syntax_semantics,binding,principle_A_reconstruction,True,False,False,True,323,-54.75913619995117,-51.97301483154297,0
It's himself who the man helped.,It's himself who helped the man.,syntax_semantics,binding,principle_A_reconstruction,True,False,False,True,324,-40.72574996948242,-36.85912322998047,0
It's herself that Rhonda had thought about.,It's herself that had thought about Rhonda.,syntax_semantics,binding,principle_A_reconstruction,True,False,False,True,325,-57.592445373535156,-55.68610763549805,0
It's herself who the lady hadn't escaped from.,It's herself who hadn't escaped from the lady.,syntax_semantics,binding,principle_A_reconstruction,True,False,False,True,326,-60.83518981933594,-55.54021072387695,0
It's himself that Timothy notices.,It's himself that notices Timothy.,syntax_semantics,binding,principle_A_reconstruction,True,False,False,True,327,-43.25505828857422,-45.069068908691406,1
It's herself that Anne found.,It's herself that found Anne.,syntax_semantics,binding,principle_A_reconstruction,True,False,False,True,328,-39.57923126220703,-40.81964111328125,1
It's himself who Stephen is distracting.,It's himself who is distracting Stephen.,syntax_semantics,binding,principle_A_reconstruction,True,False,False,True,329,-50.068885803222656,-48.4205436706543,0
It's himself who Phillip will like.,It's himself who will like Phillip.,syntax_semantics,binding,principle_A_reconstruction,True,False,False,True,330,-50.44438171386719,-46.135948181152344,0
It's himself that Aaron approached.,It's himself that approached Aaron.,syntax_semantics,binding,principle_A_reconstruction,True,False,False,True,331,-43.16884994506836,-42.80427551269531,0
It's herself who Bethany doesn't alarm.,It's herself who doesn't alarm Bethany.,syntax_semantics,binding,principle_A_reconstruction,True,False,False,True,332,-63.940521240234375,-62.06327438354492,0
It's herself that Pamela shouldn't distract.,It's herself that shouldn't distract Pamela.,syntax_semantics,binding,principle_A_reconstruction,True,False,False,True,333,-58.650146484375,-52.425689697265625,0
It's himself who Noah isn't hugging.,It's himself who isn't hugging Noah.,syntax_semantics,binding,principle_A_reconstruction,True,False,False,True,334,-57.18521499633789,-55.685272216796875,0
It's herself who Marla does leave.,It's herself who does leave Marla.,syntax_semantics,binding,principle_A_reconstruction,True,False,False,True,335,-55.1008415222168,-50.468536376953125,0
It's herself that Janet fired.,It's herself that fired Janet.,syntax_semantics,binding,principle_A_reconstruction,True,False,False,True,336,-43.07759094238281,-44.449546813964844,1
It's herself that a waitress had attacked.,It's herself that had attacked a waitress.,syntax_semantics,binding,principle_A_reconstruction,True,False,False,True,337,-52.248939514160156,-47.72676086425781,0
It's herself that Tamara boasts about.,It's herself that boasts about Tamara.,syntax_semantics,binding,principle_A_reconstruction,True,False,False,True,338,-60.71588897705078,-58.31986618041992,0
It's themselves that most sweaters are embarrassing.,It's themselves that are embarrassing most sweaters.,syntax_semantics,binding,principle_A_reconstruction,True,False,False,True,339,-53.2176513671875,-54.858524322509766,1
It's himself who Rodney had healed.,It's himself who had healed Rodney.,syntax_semantics,binding,principle_A_reconstruction,True,False,False,True,340,-55.356693267822266,-51.151573181152344,0
It's himself who Wayne heals.,It's himself who heals Wayne.,syntax_semantics,binding,principle_A_reconstruction,True,False,False,True,341,-46.04119873046875,-45.03034973144531,0
It's themselves that many guests won't embarrass.,It's themselves that won't embarrass many guests.,syntax_semantics,binding,principle_A_reconstruction,True,False,False,True,342,-55.64673614501953,-52.42465591430664,0
It's themselves that those committees should shock.,It's themselves that should shock those committees.,syntax_semantics,binding,principle_A_reconstruction,True,False,False,True,343,-55.032691955566406,-53.011016845703125,0
It's himself that Peter dislikes.,It's himself that dislikes Peter.,syntax_semantics,binding,principle_A_reconstruction,True,False,False,True,344,-50.37948226928711,-55.91426086425781,1
It's herself who Rachel was disturbing.,It's herself who was disturbing Rachel.,syntax_semantics,binding,principle_A_reconstruction,True,False,False,True,345,-50.621612548828125,-48.477020263671875,0
It's itself that the skirt wasn't shocking.,It's itself that wasn't shocking the skirt.,syntax_semantics,binding,principle_A_reconstruction,True,False,False,True,346,-51.44661331176758,-51.210567474365234,0
It's himself that Patrick wasn't listening to.,It's himself that wasn't listening to Patrick.,syntax_semantics,binding,principle_A_reconstruction,True,False,False,True,347,-48.20051956176758,-45.65312194824219,0
It's itself that every book hasn't disagreed with.,It's itself that hasn't disagreed with every book.,syntax_semantics,binding,principle_A_reconstruction,True,False,False,True,348,-63.55494689941406,-57.78855895996094,0
It's himself that Joel should like.,It's himself that should like Joel.,syntax_semantics,binding,principle_A_reconstruction,True,False,False,True,349,-46.08515930175781,-44.962799072265625,0
It's himself that Bradley should attack.,It's himself that should attack Bradley.,syntax_semantics,binding,principle_A_reconstruction,True,False,False,True,350,-48.00980758666992,-47.79374313354492,0
It's herself who a woman sounded like.,It's herself who sounded like a woman.,syntax_semantics,binding,principle_A_reconstruction,True,False,False,True,351,-48.06591033935547,-39.29171371459961,0
It's herself that Melinda is confusing.,It's herself that is confusing Melinda.,syntax_semantics,binding,principle_A_reconstruction,True,False,False,True,352,-51.847862243652344,-54.417091369628906,1
It's himself who Paul distracted.,It's himself who distracted Paul.,syntax_semantics,binding,principle_A_reconstruction,True,False,False,True,353,-42.898109436035156,-42.993629455566406,1
It's himself who Raymond sees.,It's himself who sees Raymond.,syntax_semantics,binding,principle_A_reconstruction,True,False,False,True,354,-42.161502838134766,-40.567344665527344,0
It's herself who Carol cared for.,It's herself who cared for Carol.,syntax_semantics,binding,principle_A_reconstruction,True,False,False,True,355,-49.002662658691406,-44.097660064697266,0
It's himself that Chad is worrying.,It's himself that is worrying Chad.,syntax_semantics,binding,principle_A_reconstruction,True,False,False,True,356,-46.37873840332031,-47.475013732910156,1
It's herself that Heidi conceals.,It's herself that conceals Heidi.,syntax_semantics,binding,principle_A_reconstruction,True,False,False,True,357,-54.545326232910156,-57.080867767333984,1
It's himself who Timothy conceals.,It's himself who conceals Timothy.,syntax_semantics,binding,principle_A_reconstruction,True,False,False,True,358,-57.211402893066406,-57.326175689697266,1
It's himself that Eric would notice.,It's himself that would notice Eric.,syntax_semantics,binding,principle_A_reconstruction,True,False,False,True,359,-41.05634689331055,-42.250614166259766,1
It's herself who Tanya notices.,It's herself who notices Tanya.,syntax_semantics,binding,principle_A_reconstruction,True,False,False,True,360,-56.815223693847656,-52.783329010009766,0
It's themselves that a lot of teenagers were thinking about.,It's themselves that were thinking about a lot of teenagers.,syntax_semantics,binding,principle_A_reconstruction,True,False,False,True,361,-48.98491668701172,-45.99067306518555,0
It's herself that Colleen has concealed.,It's herself that has concealed Colleen.,syntax_semantics,binding,principle_A_reconstruction,True,False,False,True,362,-61.21561813354492,-60.68042755126953,0
It's himself who Brian questions.,It's himself who questions Brian.,syntax_semantics,binding,principle_A_reconstruction,True,False,False,True,363,-42.20978546142578,-45.49565505981445,1
It's itself that this screen has impressed.,It's itself that has impressed this screen.,syntax_semantics,binding,principle_A_reconstruction,True,False,False,True,364,-50.22096252441406,-50.121009826660156,0
It's themselves who many actresses weren't hiding.,It's themselves who weren't hiding many actresses.,syntax_semantics,binding,principle_A_reconstruction,True,False,False,True,365,-59.085723876953125,-56.11985778808594,0
It's herself who Pamela questions.,It's herself who questions Pamela.,syntax_semantics,binding,principle_A_reconstruction,True,False,False,True,366,-44.98185729980469,-49.616703033447266,1
It's itself that a sweater didn't disturb.,It's itself that didn't disturb a sweater.,syntax_semantics,binding,principle_A_reconstruction,True,False,False,True,367,-53.18784713745117,-47.84452819824219,0
It's himself that Matt hasn't sounded like.,It's himself that hasn't sounded like Matt.,syntax_semantics,binding,principle_A_reconstruction,True,False,False,True,368,-49.74822998046875,-47.69803237915039,0
It's themselves that some ladies hadn't sounded like.,It's themselves that hadn't sounded like some ladies.,syntax_semantics,binding,principle_A_reconstruction,True,False,False,True,369,-59.73979949951172,-54.20097351074219,0
It's himself who Kevin fires.,It's himself who fires Kevin.,syntax_semantics,binding,principle_A_reconstruction,True,False,False,True,370,-43.32659149169922,-44.985897064208984,1
It's herself that Sally flees from.,It's herself that flees from Sally.,syntax_semantics,binding,principle_A_reconstruction,True,False,False,True,371,-55.042396545410156,-54.54157257080078,0
It's itself that every glass wasn't irritating.,It's itself that wasn't irritating every glass.,syntax_semantics,binding,principle_A_reconstruction,True,False,False,True,372,-52.15916442871094,-50.19384765625,0
It's herself that Jill hadn't noticed.,It's herself that hadn't noticed Jill.,syntax_semantics,binding,principle_A_reconstruction,True,False,False,True,373,-48.387046813964844,-49.342933654785156,1
It's herself who an actress will heal.,It's herself who will heal an actress.,syntax_semantics,binding,principle_A_reconstruction,True,False,False,True,374,-54.04373550415039,-49.83366775512695,0
It's himself who Derek might appreciate.,It's himself who might appreciate Derek.,syntax_semantics,binding,principle_A_reconstruction,True,False,False,True,375,-52.866878509521484,-50.259002685546875,0
It's itself that a drawing wasn't irritating.,It's itself that wasn't irritating a drawing.,syntax_semantics,binding,principle_A_reconstruction,True,False,False,True,376,-53.674495697021484,-51.37742614746094,0
It's himself who Scott doesn't attack.,It's himself who doesn't attack Scott.,syntax_semantics,binding,principle_A_reconstruction,True,False,False,True,377,-48.834022521972656,-45.954193115234375,0
It's himself who the pedestrian has worried.,It's himself who has worried the pedestrian.,syntax_semantics,binding,principle_A_reconstruction,True,False,False,True,378,-55.836273193359375,-52.519046783447266,0
It's herself who Carol escaped from.,It's herself who escaped from Carol.,syntax_semantics,binding,principle_A_reconstruction,True,False,False,True,379,-50.34211730957031,-44.60575866699219,0
It's himself who Daniel should observe.,It's himself who should observe Daniel.,syntax_semantics,binding,principle_A_reconstruction,True,False,False,True,380,-53.438232421875,-50.77427673339844,0
It's himself who Wayne won't describe.,It's himself who won't describe Wayne.,syntax_semantics,binding,principle_A_reconstruction,True,False,False,True,381,-49.64636993408203,-46.877166748046875,0
It's themselves who the Borgias aren't watching.,It's themselves who aren't watching the Borgias.,syntax_semantics,binding,principle_A_reconstruction,True,False,False,True,382,-69.3006591796875,-64.40062713623047,0
It's herself who Kristin was concealing.,It's herself who was concealing Kristin.,syntax_semantics,binding,principle_A_reconstruction,True,False,False,True,383,-71.87159729003906,-67.54646301269531,0
It's herself that some waitress discovered.,It's herself that discovered some waitress.,syntax_semantics,binding,principle_A_reconstruction,True,False,False,True,384,-47.83381271362305,-47.397216796875,0
It's himself who Noah is criticizing.,It's himself who is criticizing Noah.,syntax_semantics,binding,principle_A_reconstruction,True,False,False,True,385,-49.83489227294922,-50.61109924316406,1
It's herself who Cheryl isn't talking to.,It's herself who isn't talking to Cheryl.,syntax_semantics,binding,principle_A_reconstruction,True,False,False,True,386,-51.671714782714844,-49.70860290527344,0
It's himself that Russell should appreciate.,It's himself that should appreciate Russell.,syntax_semantics,binding,principle_A_reconstruction,True,False,False,True,387,-47.18904113769531,-46.49368667602539,0
It's herself who Candice finds.,It's herself who finds Candice.,syntax_semantics,binding,principle_A_reconstruction,True,False,False,True,388,-54.55635070800781,-48.822357177734375,0
