sentence_good,sentence_bad,field,linguistics_term,UID,simple_LM_method,one_prefix_method,two_prefix_method,lexically_identical,pair_id,good_prob,bad_prob,correct
Many patients that stunned Eric kissed themselves.,Many patients that stunned Eric kissed himself.,syntax_semantics,binding,principle_A_c_command,True,True,False,False,438,-56.465919494628906,-56.403663635253906,0
All essays that would stun Aaron would confuse themselves.,All essays that would stun Aaron would confuse himself.,syntax_semantics,binding,principle_A_c_command,True,True,False,False,439,-74.18844604492188,-75.63887786865234,1
Some boy who won't shock Jane wouldn't discover himself.,Some boy who won't shock Jane wouldn't discover herself.,syntax_semantics,binding,principle_A_c_command,True,True,False,False,440,-70.57334899902344,-72.46971130371094,1
Some guests who had worn this hat couldn't sound like themselves.,Some guests who had worn this hat couldn't sound like itself.,syntax_semantics,binding,principle_A_c_command,True,True,False,False,441,-70.34129333496094,-72.18792724609375,1
Some girl that wouldn't drive to the closets isn't insulting herself.,Some girl that wouldn't drive to the closets isn't insulting themselves.,syntax_semantics,binding,principle_A_c_command,True,True,False,False,442,-80.90682983398438,-78.57952880859375,0
Libraries that helped Florence described themselves.,Libraries that helped Florence described herself.,syntax_semantics,binding,principle_A_c_command,True,True,False,False,443,-61.74959945678711,-62.131961822509766,1
Some actresses that hired Debra aren't hugging themselves.,Some actresses that hired Debra aren't hugging herself.,syntax_semantics,binding,principle_A_c_command,True,True,False,False,444,-72.87771606445312,-75.37439727783203,1
That actress that referenced girls heals herself.,That actress that referenced girls heals themselves.,syntax_semantics,binding,principle_A_c_command,True,True,False,False,445,-72.644287109375,-71.01266479492188,0
All college campuses that weren't impressing Mark can't scare themselves.,All college campuses that weren't impressing Mark can't scare himself.,syntax_semantics,binding,principle_A_c_command,True,True,False,False,446,-89.08993530273438,-88.92330932617188,0
These teenagers that conceal Mark were concealing themselves.,These teenagers that conceal Mark were concealing himself.,syntax_semantics,binding,principle_A_c_command,True,True,False,False,447,-72.2288818359375,-72.60777282714844,1
Every dancer who complained about every report listens to herself.,Every dancer who complained about every report listens to itself.,syntax_semantics,binding,principle_A_c_command,True,True,False,False,448,-67.15443420410156,-68.58866882324219,1
Waiters that impressed Marie knew themselves.,Waiters that impressed Marie knew herself.,syntax_semantics,binding,principle_A_c_command,True,True,False,False,449,-61.640560150146484,-63.77482604980469,1
The girl that shouldn't research some museums loves herself.,The girl that shouldn't research some museums loves themselves.,syntax_semantics,binding,principle_A_c_command,True,True,False,False,450,-71.50440216064453,-69.04754638671875,0
Some library that scared John boasted about itself.,Some library that scared John boasted about himself.,syntax_semantics,binding,principle_A_c_command,True,True,False,False,451,-66.19793701171875,-65.24213409423828,0
An actress who hasn't discussed a lot of cashiers was concealing herself.,An actress who hasn't discussed a lot of cashiers was concealing themselves.,syntax_semantics,binding,principle_A_c_command,True,True,False,False,452,-94.16604614257812,-93.31940460205078,0
Every mushroom that is bothering Keith hadn't annoyed itself.,Every mushroom that is bothering Keith hadn't annoyed himself.,syntax_semantics,binding,principle_A_c_command,True,True,False,False,453,-78.46044158935547,-77.69979858398438,0
Organizations that hurt Stephen hadn't argued about themselves.,Organizations that hurt Stephen hadn't argued about himself.,syntax_semantics,binding,principle_A_c_command,True,True,False,False,454,-68.56361389160156,-68.60647583007812,1
Some forks that astound Alexander hadn't bothered themselves.,Some forks that astound Alexander hadn't bothered himself.,syntax_semantics,binding,principle_A_c_command,True,True,False,False,455,-76.94229125976562,-77.43955993652344,1
A lot of girls that are bringing this window do care for themselves.,A lot of girls that are bringing this window do care for itself.,syntax_semantics,binding,principle_A_c_command,True,True,False,False,456,-78.786376953125,-81.24568939208984,1
Some nose that had disturbed Carlos isn't shocking itself.,Some nose that had disturbed Carlos isn't shocking himself.,syntax_semantics,binding,principle_A_c_command,True,True,False,False,457,-87.00521850585938,-87.11956787109375,1
All drivers that walked through every mall helped themselves.,All drivers that walked through every mall helped itself.,syntax_semantics,binding,principle_A_c_command,True,True,False,False,458,-63.5828857421875,-65.97835540771484,1
Most stairs that aren't scaring Rachelle are aggravating themselves.,Most stairs that aren't scaring Rachelle are aggravating herself.,syntax_semantics,binding,principle_A_c_command,True,True,False,False,459,-87.08482360839844,-89.17784881591797,1
A girl that hadn't cleaned every tomato knows herself.,A girl that hadn't cleaned every tomato knows itself.,syntax_semantics,binding,principle_A_c_command,True,True,False,False,460,-82.98316192626953,-81.76545715332031,0
That gate that embarrassed Tiffany can't hurt itself.,That gate that embarrassed Tiffany can't hurt herself.,syntax_semantics,binding,principle_A_c_command,True,True,False,False,461,-71.68437194824219,-71.21614837646484,0
These ladies who won't explore every hospital cared for themselves.,These ladies who won't explore every hospital cared for itself.,syntax_semantics,binding,principle_A_c_command,True,True,False,False,462,-68.18729400634766,-70.79067993164062,1
A dancer who ascended hills is helping herself.,A dancer who ascended hills is helping themselves.,syntax_semantics,binding,principle_A_c_command,True,True,False,False,463,-74.87882995605469,-73.06819152832031,0
All committees that have talked about Vanessa should know themselves.,All committees that have talked about Vanessa should know herself.,syntax_semantics,binding,principle_A_c_command,True,True,False,False,464,-66.16899108886719,-68.69918823242188,1
That guy that shouldn't discuss some lakes leaves himself.,That guy that shouldn't discuss some lakes leaves themselves.,syntax_semantics,binding,principle_A_c_command,True,True,False,False,465,-69.21754455566406,-68.47869873046875,0
The actors that shouldn't tour that river watched themselves.,The actors that shouldn't tour that river watched itself.,syntax_semantics,binding,principle_A_c_command,True,True,False,False,466,-69.11299133300781,-70.78273010253906,1
These universities that appreciate every actress were worrying themselves.,These universities that appreciate every actress were worrying herself.,syntax_semantics,binding,principle_A_c_command,True,True,False,False,467,-66.9553451538086,-68.4417495727539,1
These horses that climbed down a mountain aren't finding themselves.,These horses that climbed down a mountain aren't finding itself.,syntax_semantics,binding,principle_A_c_command,True,True,False,False,468,-68.12152099609375,-69.98297119140625,1
Some teachers that observe Donald can't discover themselves.,Some teachers that observe Donald can't discover himself.,syntax_semantics,binding,principle_A_c_command,True,True,False,False,469,-63.49876403808594,-64.90306091308594,1
That play that wasn't boring Wayne sounds like itself.,That play that wasn't boring Wayne sounds like himself.,syntax_semantics,binding,principle_A_c_command,True,True,False,False,470,-68.37457275390625,-68.16494750976562,0
These girls who praised Colleen had forgotten themselves.,These girls who praised Colleen had forgotten herself.,syntax_semantics,binding,principle_A_c_command,True,True,False,False,471,-71.61082458496094,-74.73694610595703,1
That boy that hadn't attacked Becca had fired himself.,That boy that hadn't attacked Becca had fired herself.,syntax_semantics,binding,principle_A_c_command,True,True,False,False,472,-75.3822021484375,-76.88630676269531,1
A lot of birds that shocked this committee are bothering themselves.,A lot of birds that shocked this committee are bothering itself.,syntax_semantics,binding,principle_A_c_command,True,True,False,False,473,-76.34391784667969,-79.69788360595703,1
Those patients who discussed Frank have hugged themselves.,Those patients who discussed Frank have hugged himself.,syntax_semantics,binding,principle_A_c_command,True,True,False,False,474,-63.0824089050293,-63.362545013427734,1
All drivers who won't pass every bank weren't insulting themselves.,All drivers who won't pass every bank weren't insulting itself.,syntax_semantics,binding,principle_A_c_command,True,True,False,False,475,-77.8157958984375,-80.7747802734375,1
Some guests who would tour the lake aren't arguing about themselves.,Some guests who would tour the lake aren't arguing about itself.,syntax_semantics,binding,principle_A_c_command,True,True,False,False,476,-72.99866485595703,-75.87548065185547,1
All girls that disgust Kathleen don't see themselves.,All girls that disgust Kathleen don't see herself.,syntax_semantics,binding,principle_A_c_command,True,True,False,False,477,-63.685855865478516,-67.5215835571289,1
The man who disturbs Sara was discovering himself.,The man who disturbs Sara was discovering herself.,syntax_semantics,binding,principle_A_c_command,True,True,False,False,478,-64.0676040649414,-66.08379364013672,1
This guy who can't observe Angela likes himself.,This guy who can't observe Angela likes herself.,syntax_semantics,binding,principle_A_c_command,True,True,False,False,479,-58.80416488647461,-60.836692810058594,1
Every lady who should tour a lake praises herself.,Every lady who should tour a lake praises itself.,syntax_semantics,binding,principle_A_c_command,True,True,False,False,480,-69.66777038574219,-68.89779663085938,0
The ladies who aren't messing up some restaurant shouldn't discuss themselves.,The ladies who aren't messing up some restaurant shouldn't discuss itself.,syntax_semantics,binding,principle_A_c_command,True,True,False,False,481,-75.18927001953125,-77.38470458984375,1
Most adults who hadn't irritated Craig had escaped from themselves.,Most adults who hadn't irritated Craig had escaped from himself.,syntax_semantics,binding,principle_A_c_command,True,True,False,False,482,-77.50639343261719,-77.99214172363281,1
Those girls who could see the icicle were hiring themselves.,Those girls who could see the icicle were hiring itself.,syntax_semantics,binding,principle_A_c_command,True,True,False,False,483,-68.33421325683594,-70.31536102294922,1
Pasta that was stunning Samantha has impressed itself.,Pasta that was stunning Samantha has impressed herself.,syntax_semantics,binding,principle_A_c_command,True,True,False,False,484,-71.78277587890625,-72.1507797241211,1
Waiters who shocks Bill didn't conceal themselves.,Waiters who shocks Bill didn't conceal himself.,syntax_semantics,binding,principle_A_c_command,True,True,False,False,485,-70.81775665283203,-69.83255004882812,0
All cashiers that were firing Denise will disagree with themselves.,All cashiers that were firing Denise will disagree with herself.,syntax_semantics,binding,principle_A_c_command,True,True,False,False,486,-83.04887390136719,-85.88330078125,1
A light that stuns Rose hasn't stunned itself.,A light that stuns Rose hasn't stunned herself.,syntax_semantics,binding,principle_A_c_command,True,True,False,False,487,-93.9703140258789,-93.51567840576172,0
The legislature that wasn't describing Margaret hates itself.,The legislature that wasn't describing Margaret hates herself.,syntax_semantics,binding,principle_A_c_command,True,True,False,False,488,-67.43679809570312,-67.73455810546875,1
A lot of actors who were hiring Brian haven't fired themselves.,A lot of actors who were hiring Brian haven't fired himself.,syntax_semantics,binding,principle_A_c_command,True,True,False,False,489,-84.91424560546875,-83.5621337890625,0
This committee that shouldn't take all shoes discusses itself.,This committee that shouldn't take all shoes discusses themselves.,syntax_semantics,binding,principle_A_c_command,True,True,False,False,490,-67.85568237304688,-67.22584533691406,0
The man who astounded Rebecca appreciates himself.,The man who astounded Rebecca appreciates herself.,syntax_semantics,binding,principle_A_c_command,True,True,False,False,491,-69.07979583740234,-70.48281860351562,1
Some screen that wasn't aggravating Douglas has bored itself.,Some screen that wasn't aggravating Douglas has bored himself.,syntax_semantics,binding,principle_A_c_command,True,True,False,False,492,-80.22701263427734,-79.2643051147461,0
This screen that is disgusting Helen did bore itself.,This screen that is disgusting Helen did bore herself.,syntax_semantics,binding,principle_A_c_command,True,True,False,False,493,-75.43942260742188,-74.77729797363281,0
The children that hadn't climbed down the slope investigated themselves.,The children that hadn't climbed down the slope investigated itself.,syntax_semantics,binding,principle_A_c_command,True,True,False,False,494,-69.19429016113281,-70.07305908203125,1
Those art galleries that can't hurt Tara distracted themselves.,Those art galleries that can't hurt Tara distracted herself.,syntax_semantics,binding,principle_A_c_command,True,True,False,False,495,-72.2918930053711,-74.94142150878906,1
Those drivers who were boycotting that association insulted themselves.,Those drivers who were boycotting that association insulted itself.,syntax_semantics,binding,principle_A_c_command,True,True,False,False,496,-77.72344970703125,-80.41856384277344,1
Every mall that stuns these waitresses hadn't distracted itself.,Every mall that stuns these waitresses hadn't distracted themselves.,syntax_semantics,binding,principle_A_c_command,True,True,False,False,497,-101.11908721923828,-99.6683349609375,0
Some teachers who pass every hospital annoyed themselves.,Some teachers who pass every hospital annoyed itself.,syntax_semantics,binding,principle_A_c_command,True,True,False,False,498,-58.38300323486328,-59.709041595458984,1
The girl that was irritating Chad isn't fleeing from herself.,The girl that was irritating Chad isn't fleeing from himself.,syntax_semantics,binding,principle_A_c_command,True,True,False,False,499,-80.46150207519531,-79.14291381835938,0
The guests who escape from every movie theater healed themselves.,The guests who escape from every movie theater healed itself.,syntax_semantics,binding,principle_A_c_command,True,True,False,False,500,-75.6685562133789,-75.71653747558594,1
Many men that concealed Marie discovered themselves.,Many men that concealed Marie discovered herself.,syntax_semantics,binding,principle_A_c_command,True,True,False,False,501,-58.15362548828125,-61.56553268432617,1
Every bank that bothered Jerry is embarrassing itself.,Every bank that bothered Jerry is embarrassing himself.,syntax_semantics,binding,principle_A_c_command,True,True,False,False,502,-62.99934768676758,-63.619571685791016,1
Many cucumbers that embarrassed Diane weren't impressing themselves.,Many cucumbers that embarrassed Diane weren't impressing herself.,syntax_semantics,binding,principle_A_c_command,True,True,False,False,503,-88.52349090576172,-90.08614349365234,1
This boy who couldn't love a lot of actresses observes himself.,This boy who couldn't love a lot of actresses observes themselves.,syntax_semantics,binding,principle_A_c_command,True,True,False,False,504,-72.54717254638672,-72.49947357177734,0
All pedestrians that have boycotted Spain were disagreeing with themselves.,All pedestrians that have boycotted Spain were disagreeing with itself.,syntax_semantics,binding,principle_A_c_command,True,True,False,False,505,-104.66799926757812,-107.40823364257812,1
Those pedestrians that hadn't hated Lori had aggravated themselves.,Those pedestrians that hadn't hated Lori had aggravated herself.,syntax_semantics,binding,principle_A_c_command,True,True,False,False,506,-83.93367004394531,-86.55370330810547,1
That waitress that boycotts all associations hates herself.,That waitress that boycotts all associations hates themselves.,syntax_semantics,binding,principle_A_c_command,True,True,False,False,507,-89.8824462890625,-86.35304260253906,0
The museum that listens to Michelle praises itself.,The museum that listens to Michelle praises herself.,syntax_semantics,binding,principle_A_c_command,True,True,False,False,508,-56.931453704833984,-56.72938537597656,0
The men that had talked to Mitchell weren't describing themselves.,The men that had talked to Mitchell weren't describing himself.,syntax_semantics,binding,principle_A_c_command,True,True,False,False,509,-66.91358184814453,-67.56005096435547,1
Most patients that won't talk to Margaret healed themselves.,Most patients that won't talk to Margaret healed herself.,syntax_semantics,binding,principle_A_c_command,True,True,False,False,510,-64.13407897949219,-65.63264465332031,1
Some shirt that aggravated Kevin scares itself.,Some shirt that aggravated Kevin scares himself.,syntax_semantics,binding,principle_A_c_command,True,True,False,False,511,-66.43434143066406,-63.17285919189453,0
Most committees that shocked Andrew had hated themselves.,Most committees that shocked Andrew had hated himself.,syntax_semantics,binding,principle_A_c_command,True,True,False,False,512,-65.62721252441406,-65.30162048339844,0
All sketches that have scared Sharon aren't disturbing themselves.,All sketches that have scared Sharon aren't disturbing herself.,syntax_semantics,binding,principle_A_c_command,True,True,False,False,513,-74.60456848144531,-77.07865905761719,1
This actress that complains about some ladies discusses herself.,This actress that complains about some ladies discusses themselves.,syntax_semantics,binding,principle_A_c_command,True,True,False,False,514,-72.8896255493164,-71.01620483398438,0
A lot of guys that wouldn't dislike Brad aren't approaching themselves.,A lot of guys that wouldn't dislike Brad aren't approaching himself.,syntax_semantics,binding,principle_A_c_command,True,True,False,False,515,-86.70787048339844,-88.19365692138672,1
A lot of drivers that hadn't disturbed Thomas haven't questioned themselves.,A lot of drivers that hadn't disturbed Thomas haven't questioned himself.,syntax_semantics,binding,principle_A_c_command,True,True,False,False,516,-87.93880462646484,-89.18385314941406,1
A lot of legislatures that had scared Nicole aren't appreciating themselves.,A lot of legislatures that had scared Nicole aren't appreciating herself.,syntax_semantics,binding,principle_A_c_command,True,True,False,False,517,-98.54882049560547,-100.96761322021484,1
Every man that has complained about Sally is revealing himself.,Every man that has complained about Sally is revealing herself.,syntax_semantics,binding,principle_A_c_command,True,True,False,False,518,-65.19816589355469,-66.4407730102539,1
Some universities that worried Ellen disturbed themselves.,Some universities that worried Ellen disturbed herself.,syntax_semantics,binding,principle_A_c_command,True,True,False,False,519,-56.21861267089844,-58.2196159362793,1
That actress who won't clean some sock should notice herself.,That actress who won't clean some sock should notice itself.,syntax_semantics,binding,principle_A_c_command,True,True,False,False,520,-80.21197509765625,-80.742919921875,1
This lady who had fired Timothy attacks herself.,This lady who had fired Timothy attacks himself.,syntax_semantics,binding,principle_A_c_command,True,True,False,False,521,-60.82825469970703,-60.078269958496094,0
The tomato that won't embarrass Emily isn't stunning itself.,The tomato that won't embarrass Emily isn't stunning herself.,syntax_semantics,binding,principle_A_c_command,True,True,False,False,522,-80.16513061523438,-79.19551849365234,0
That mall that doesn't look like most sketches was disturbing itself.,That mall that doesn't look like most sketches was disturbing themselves.,syntax_semantics,binding,principle_A_c_command,True,True,False,False,523,-76.94464111328125,-75.41453552246094,0
This dancer that alarmed Samuel does cure herself.,This dancer that alarmed Samuel does cure himself.,syntax_semantics,binding,principle_A_c_command,True,True,False,False,524,-73.86622619628906,-72.3048095703125,0
A lot of dancers who didn't disgust Rachel weren't boasting about themselves.,A lot of dancers who didn't disgust Rachel weren't boasting about herself.,syntax_semantics,binding,principle_A_c_command,True,True,False,False,525,-104.42376708984375,-106.6575927734375,1
All organizations that stunned Danielle don't hire themselves.,All organizations that stunned Danielle don't hire herself.,syntax_semantics,binding,principle_A_c_command,True,True,False,False,526,-67.36967468261719,-70.55211639404297,1
Some commentary that isn't confusing Melissa would confuse itself.,Some commentary that isn't confusing Melissa would confuse herself.,syntax_semantics,binding,principle_A_c_command,True,True,False,False,527,-79.89971160888672,-79.29461669921875,0
Some men who can't bike to the library aren't approaching themselves.,Some men who can't bike to the library aren't approaching itself.,syntax_semantics,binding,principle_A_c_command,True,True,False,False,528,-71.81317901611328,-74.79741668701172,1
Every girl that hasn't skated around this mall visits herself.,Every girl that hasn't skated around this mall visits itself.,syntax_semantics,binding,principle_A_c_command,True,True,False,False,529,-78.94794464111328,-77.29801177978516,0
This woman that was researching the hospitals isn't firing herself.,This woman that was researching the hospitals isn't firing themselves.,syntax_semantics,binding,principle_A_c_command,True,True,False,False,530,-71.34614562988281,-69.5557861328125,0
Some government that fires many teenagers couldn't argue about itself.,Some government that fires many teenagers couldn't argue about themselves.,syntax_semantics,binding,principle_A_c_command,True,True,False,False,531,-69.89500427246094,-67.79318237304688,0
Every woman who had discussed Liam loves herself.,Every woman who had discussed Liam loves himself.,syntax_semantics,binding,principle_A_c_command,True,True,False,False,532,-55.843963623046875,-54.25836944580078,0
A lot of students that exit every cafe were thinking about themselves.,A lot of students that exit every cafe were thinking about itself.,syntax_semantics,binding,principle_A_c_command,True,True,False,False,533,-78.60790252685547,-80.01019287109375,1
Most ladies that bothers Patricia talked about themselves.,Most ladies that bothers Patricia talked about herself.,syntax_semantics,binding,principle_A_c_command,True,True,False,False,534,-57.24163055419922,-59.6988525390625,1
All photographs that annoyed Diane haven't annoyed themselves.,All photographs that annoyed Diane haven't annoyed herself.,syntax_semantics,binding,principle_A_c_command,True,True,False,False,535,-76.45915985107422,-78.29605102539062,1
All reports that hadn't sounded like Danielle shouldn't disagree with themselves.,All reports that hadn't sounded like Danielle shouldn't disagree with herself.,syntax_semantics,binding,principle_A_c_command,True,True,False,False,536,-80.17817687988281,-82.85343170166016,1
This museum that shouldn't bore Elizabeth scares itself.,This museum that shouldn't bore Elizabeth scares herself.,syntax_semantics,binding,principle_A_c_command,True,True,False,False,537,-68.8998794555664,-67.01578521728516,0
A report that hadn't sounded like most guests sounds like itself.,A report that hadn't sounded like most guests sounds like themselves.,syntax_semantics,binding,principle_A_c_command,True,True,False,False,538,-81.99664306640625,-80.3172607421875,0
Every girl who described Joel isn't attacking herself.,Every girl who described Joel isn't attacking himself.,syntax_semantics,binding,principle_A_c_command,True,True,False,False,539,-63.03196334838867,-61.15826416015625,0
Some man who hasn't fired Kathleen cures himself.,Some man who hasn't fired Kathleen cures herself.,syntax_semantics,binding,principle_A_c_command,True,True,False,False,540,-67.44471740722656,-68.58919525146484,1
Guys who can embarrass Liam cured themselves.,Guys who can embarrass Liam cured himself.,syntax_semantics,binding,principle_A_c_command,True,True,False,False,541,-58.296348571777344,-58.37848663330078,1
A lot of boys that embarrassed Joel have hugged themselves.,A lot of boys that embarrassed Joel have hugged himself.,syntax_semantics,binding,principle_A_c_command,True,True,False,False,542,-83.62335968017578,-84.4319076538086,1
All men who disgusted Rhonda aren't watching themselves.,All men who disgusted Rhonda aren't watching herself.,syntax_semantics,binding,principle_A_c_command,True,True,False,False,543,-72.24427795410156,-75.14374542236328,1
Some organizations that had every fish hadn't talked to themselves.,Some organizations that had every fish hadn't talked to itself.,syntax_semantics,binding,principle_A_c_command,True,True,False,False,544,-59.80903625488281,-63.00428771972656,1
Some senators that do alarm Steven boasted about themselves.,Some senators that do alarm Steven boasted about himself.,syntax_semantics,binding,principle_A_c_command,True,True,False,False,545,-75.63277435302734,-76.21440124511719,1
Some hospital that is working with Theodore admired itself.,Some hospital that is working with Theodore admired himself.,syntax_semantics,binding,principle_A_c_command,True,True,False,False,546,-63.55693054199219,-63.93243408203125,1
