sentence_good,sentence_bad,field,linguistics_term,UID,simple_LM_method,one_prefix_method,two_prefix_method,lexically_identical,pair_id,good_prob,bad_prob,correct
Dennis wouldn't hate this standing woman.,Dennis wouldn't hate this standing women.,morphology,determiner_noun_agreement,determiner_noun_agreement_with_adj_irregular_1,True,True,False,True,225,-66.86187744140625,-66.2979736328125,0
Naomi exited that cheap oasis.,Naomi exited that cheap oases.,morphology,determiner_noun_agreement,determiner_noun_agreement_with_adj_irregular_1,True,True,False,True,226,-58.38688659667969,-61.344764709472656,1
Diane had appreciated that displeased man.,Diane had appreciated that displeased men.,morphology,determiner_noun_agreement,determiner_noun_agreement_with_adj_irregular_1,True,True,False,True,227,-71.82606506347656,-72.68537902832031,1
Stacy questioned those concealed alumni.,Stacy questioned those concealed alumnus.,morphology,determiner_noun_agreement,determiner_noun_agreement_with_adj_irregular_1,True,True,False,True,228,-61.18895721435547,-76.40911865234375,1
Denise lifted these sick lice.,Denise lifted these sick louse.,morphology,determiner_noun_agreement,determiner_noun_agreement_with_adj_irregular_1,True,True,False,True,229,-55.752254486083984,-55.25166320800781,0
Florence visited that hard oasis.,Florence visited that hard oases.,morphology,determiner_noun_agreement,determiner_noun_agreement_with_adj_irregular_1,True,True,False,True,230,-54.551292419433594,-58.333892822265625,1
Many projectors are confusing this smart man.,Many projectors are confusing this smart men.,morphology,determiner_noun_agreement,determiner_noun_agreement_with_adj_irregular_1,True,True,False,True,231,-57.541893005371094,-58.77960205078125,1
James breaks those purple teeth.,James breaks those purple tooth.,morphology,determiner_noun_agreement,determiner_noun_agreement_with_adj_irregular_1,True,True,False,True,232,-36.57196807861328,-39.00309753417969,1
Thomas has hidden those small teeth.,Thomas has hidden those small tooth.,morphology,determiner_noun_agreement,determiner_noun_agreement_with_adj_irregular_1,True,True,False,True,233,-37.71480178833008,-40.18975830078125,1
Kristin cured that old man.,Kristin cured that old men.,morphology,determiner_noun_agreement,determiner_noun_agreement_with_adj_irregular_1,True,True,False,True,234,-39.40895080566406,-41.35649871826172,1
Cynthia explored that orange oasis.,Cynthia explored that orange oases.,morphology,determiner_noun_agreement,determiner_noun_agreement_with_adj_irregular_1,True,True,False,True,235,-73.64383697509766,-77.3809585571289,1
Donna escapes from these scared men.,Donna escapes from these scared man.,morphology,determiner_noun_agreement,determiner_noun_agreement_with_adj_irregular_1,True,True,False,True,236,-56.05765914916992,-56.66276168823242,1
Some students astounded that excited person.,Some students astounded that excited people.,morphology,determiner_noun_agreement,determiner_noun_agreement_with_adj_irregular_1,True,True,False,True,237,-55.35700225830078,-52.60735321044922,0
Steven isn't visiting these displeased people.,Steven isn't visiting these displeased person.,morphology,determiner_noun_agreement,determiner_noun_agreement_with_adj_irregular_1,True,True,False,True,238,-56.13196563720703,-60.01410675048828,1
Many pedestrians disagreed with this lost woman.,Many pedestrians disagreed with this lost women.,morphology,determiner_noun_agreement,determiner_noun_agreement_with_adj_irregular_1,True,True,False,True,239,-58.040802001953125,-56.53834915161133,0
Some guys hug these good men.,Some guys hug these good man.,morphology,determiner_noun_agreement,determiner_noun_agreement_with_adj_irregular_1,True,True,False,True,240,-42.543792724609375,-44.422752380371094,1
Robert had those big cacti.,Robert had those big cactus.,morphology,determiner_noun_agreement,determiner_noun_agreement_with_adj_irregular_1,True,True,False,True,241,-41.247840881347656,-35.79172897338867,0
Jeffrey has examined that bad synopsis.,Jeffrey has examined that bad synopses.,morphology,determiner_noun_agreement,determiner_noun_agreement_with_adj_irregular_1,True,True,False,True,242,-57.353511810302734,-68.43562316894531,1
Jodi might upset these old children.,Jodi might upset these old child.,morphology,determiner_noun_agreement,determiner_noun_agreement_with_adj_irregular_1,True,True,False,True,243,-55.485595703125,-57.4898796081543,1
Brenda helped those bad women.,Brenda helped those bad woman.,morphology,determiner_noun_agreement,determiner_noun_agreement_with_adj_irregular_1,True,True,False,True,244,-37.5029411315918,-39.554317474365234,1
All waiters aren't listening to that happy alumnus.,All waiters aren't listening to that happy alumni.,morphology,determiner_noun_agreement,determiner_noun_agreement_with_adj_irregular_1,True,True,False,True,245,-84.02391815185547,-69.19557189941406,0
The girl disagrees with this good man.,The girl disagrees with this good men.,morphology,determiner_noun_agreement,determiner_noun_agreement_with_adj_irregular_1,True,True,False,True,246,-51.09130859375,-51.247047424316406,1
Jill conceals that excited person.,Jill conceals that excited people.,morphology,determiner_noun_agreement,determiner_noun_agreement_with_adj_irregular_1,True,True,False,True,247,-65.02726745605469,-62.35584259033203,0
Julia remembered this young person.,Julia remembered this young people.,morphology,determiner_noun_agreement,determiner_noun_agreement_with_adj_irregular_1,True,True,False,True,248,-37.57019805908203,-37.666812896728516,1
Bruce disliked these confident alumni.,Bruce disliked these confident alumnus.,morphology,determiner_noun_agreement,determiner_noun_agreement_with_adj_irregular_1,True,True,False,True,249,-50.2178955078125,-66.6658935546875,1
These teachers cure these sick people.,These teachers cure these sick person.,morphology,determiner_noun_agreement,determiner_noun_agreement_with_adj_irregular_1,True,True,False,True,250,-41.3637809753418,-44.70375061035156,1
Karla does fix these red feet.,Karla does fix these red foot.,morphology,determiner_noun_agreement,determiner_noun_agreement_with_adj_irregular_1,True,True,False,True,251,-47.893280029296875,-48.98119354248047,1
Judy hadn't attacked that nice woman.,Judy hadn't attacked that nice women.,morphology,determiner_noun_agreement,determiner_noun_agreement_with_adj_irregular_1,True,True,False,True,252,-48.99695587158203,-49.989776611328125,1
The apple disgusted that sick child.,The apple disgusted that sick children.,morphology,determiner_noun_agreement,determiner_noun_agreement_with_adj_irregular_1,True,True,False,True,253,-51.414066314697266,-52.0564079284668,1
Charles upset this content child.,Charles upset this content children.,morphology,determiner_noun_agreement,determiner_noun_agreement_with_adj_irregular_1,True,True,False,True,254,-37.25672149658203,-39.22245788574219,1
The waiters disagree with this fast person.,The waiters disagree with this fast people.,morphology,determiner_noun_agreement,determiner_noun_agreement_with_adj_irregular_1,True,True,False,True,255,-57.54471206665039,-55.311370849609375,0
Christopher isn't hiring this determined man.,Christopher isn't hiring this determined men.,morphology,determiner_noun_agreement,determiner_noun_agreement_with_adj_irregular_1,True,True,False,True,256,-48.81093215942383,-50.5910758972168,1
Elaine couldn't exit those rough oases.,Elaine couldn't exit those rough oasis.,morphology,determiner_noun_agreement,determiner_noun_agreement_with_adj_irregular_1,True,True,False,True,257,-73.30479431152344,-70.29876708984375,0
Jason wouldn't like those exposed lice.,Jason wouldn't like those exposed louse.,morphology,determiner_noun_agreement,determiner_noun_agreement_with_adj_irregular_1,True,True,False,True,258,-50.62054443359375,-50.42097091674805,0
Sherry hadn't insulted those clever alumni.,Sherry hadn't insulted those clever alumnus.,morphology,determiner_noun_agreement,determiner_noun_agreement_with_adj_irregular_1,True,True,False,True,259,-75.21183776855469,-89.70293426513672,1
Amanda has hidden these yellow cacti.,Amanda has hidden these yellow cactus.,morphology,determiner_noun_agreement,determiner_noun_agreement_with_adj_irregular_1,True,True,False,True,260,-56.02329635620117,-50.47370910644531,0
Paula thinks about these green lice.,Paula thinks about these green louse.,morphology,determiner_noun_agreement,determiner_noun_agreement_with_adj_irregular_1,True,True,False,True,261,-57.42838668823242,-55.959800720214844,0
All doctors argue about those long analyses.,All doctors argue about those long analysis.,morphology,determiner_noun_agreement,determiner_noun_agreement_with_adj_irregular_1,True,True,False,True,262,-49.441383361816406,-45.101863861083984,0
Heidi can break this out in the open foot.,Heidi can break this out in the open feet.,morphology,determiner_noun_agreement,determiner_noun_agreement_with_adj_irregular_1,True,True,False,True,263,-55.864845275878906,-57.46366882324219,1
Carla hugged those young children.,Carla hugged those young child.,morphology,determiner_noun_agreement,determiner_noun_agreement_with_adj_irregular_1,True,True,False,True,264,-41.54453659057617,-44.336082458496094,1
A guest was attacking those confident men.,A guest was attacking those confident man.,morphology,determiner_noun_agreement,determiner_noun_agreement_with_adj_irregular_1,True,True,False,True,265,-66.33109283447266,-67.04396057128906,1
The Impressionists boycott those hard oases.,The Impressionists boycott those hard oasis.,morphology,determiner_noun_agreement,determiner_noun_agreement_with_adj_irregular_1,True,True,False,True,266,-86.54411315917969,-84.06369018554688,0
Katherine isn't disgusting this out in the open alumnus.,Katherine isn't disgusting this out in the open alumni.,morphology,determiner_noun_agreement,determiner_noun_agreement_with_adj_irregular_1,True,True,False,True,267,-92.07920837402344,-79.14583587646484,0
A window is bothering those popular men.,A window is bothering those popular man.,morphology,determiner_noun_agreement,determiner_noun_agreement_with_adj_irregular_1,True,True,False,True,268,-57.05027389526367,-58.50421905517578,1
A lot of cashiers discover that smart man.,A lot of cashiers discover that smart men.,morphology,determiner_noun_agreement,determiner_noun_agreement_with_adj_irregular_1,True,True,False,True,269,-70.10456848144531,-71.2629165649414,1
Jodi approaches that unlucky woman.,Jodi approaches that unlucky women.,morphology,determiner_noun_agreement,determiner_noun_agreement_with_adj_irregular_1,True,True,False,True,270,-56.802154541015625,-57.843528747558594,1
Jesus discussed that fast child.,Jesus discussed that fast children.,morphology,determiner_noun_agreement,determiner_noun_agreement_with_adj_irregular_1,True,True,False,True,271,-31.485881805419922,-29.593490600585938,0
Carts hadn't disgusted those content men.,Carts hadn't disgusted those content man.,morphology,determiner_noun_agreement,determiner_noun_agreement_with_adj_irregular_1,True,True,False,True,272,-73.89051055908203,-73.72771453857422,0
Deborah talks about these smart men.,Deborah talks about these smart man.,morphology,determiner_noun_agreement,determiner_noun_agreement_with_adj_irregular_1,True,True,False,True,273,-44.403053283691406,-45.60284423828125,1
Thomas was returning to that unsure man.,Thomas was returning to that unsure men.,morphology,determiner_noun_agreement,determiner_noun_agreement_with_adj_irregular_1,True,True,False,True,274,-45.78520584106445,-46.3772087097168,1
Every student will break this clean tooth.,Every student will break this clean teeth.,morphology,determiner_noun_agreement,determiner_noun_agreement_with_adj_irregular_1,True,True,False,True,275,-47.06877899169922,-45.030426025390625,0
Valerie talks about this young woman.,Valerie talks about this young women.,morphology,determiner_noun_agreement,determiner_noun_agreement_with_adj_irregular_1,True,True,False,True,276,-42.726051330566406,-42.47597885131836,0
The Clintons discuss this yellow thesis.,The Clintons discuss this yellow theses.,morphology,determiner_noun_agreement,determiner_noun_agreement_with_adj_irregular_1,True,True,False,True,277,-59.65079879760742,-67.66238403320312,1
These cashiers break those dirty feet.,These cashiers break those dirty foot.,morphology,determiner_noun_agreement,determiner_noun_agreement_with_adj_irregular_1,True,True,False,True,278,-52.771949768066406,-54.79057312011719,1
Noah exited these concealed oases.,Noah exited these concealed oasis.,morphology,determiner_noun_agreement,determiner_noun_agreement_with_adj_irregular_1,True,True,False,True,279,-71.05684661865234,-68.16697692871094,0
Elaine toured that rough oasis.,Elaine toured that rough oases.,morphology,determiner_noun_agreement,determiner_noun_agreement_with_adj_irregular_1,True,True,False,True,280,-58.83490753173828,-62.16944122314453,1
Allison hides that gray mouse.,Allison hides that gray mice.,morphology,determiner_noun_agreement,determiner_noun_agreement_with_adj_irregular_1,True,True,False,True,281,-51.49733352661133,-51.474300384521484,0
All vases irritated that hopeful man.,All vases irritated that hopeful men.,morphology,determiner_noun_agreement,determiner_noun_agreement_with_adj_irregular_1,True,True,False,True,282,-63.08499526977539,-64.53358459472656,1
Chad boycotted that smooth oasis.,Chad boycotted that smooth oases.,morphology,determiner_noun_agreement,determiner_noun_agreement_with_adj_irregular_1,True,True,False,True,283,-76.14759826660156,-79.57270812988281,1
The Clintons drive to these green oases.,The Clintons drive to these green oasis.,morphology,determiner_noun_agreement,determiner_noun_agreement_with_adj_irregular_1,True,True,False,True,284,-65.15704345703125,-61.88286590576172,0
Many ladies aren't concealing that brown louse.,Many ladies aren't concealing that brown lice.,morphology,determiner_noun_agreement,determiner_noun_agreement_with_adj_irregular_1,True,True,False,True,285,-71.59467315673828,-71.98121643066406,1
Brenda couldn't hire this serious child.,Brenda couldn't hire this serious children.,morphology,determiner_noun_agreement,determiner_noun_agreement_with_adj_irregular_1,True,True,False,True,286,-48.33860778808594,-49.361297607421875,1
Pamela sounds like that displeased person.,Pamela sounds like that displeased people.,morphology,determiner_noun_agreement,determiner_noun_agreement_with_adj_irregular_1,True,True,False,True,287,-77.52719116210938,-74.46283721923828,0
Eva doesn't arrive at these gray oases.,Eva doesn't arrive at these gray oasis.,morphology,determiner_noun_agreement,determiner_noun_agreement_with_adj_irregular_1,True,True,False,True,288,-58.08038330078125,-54.300025939941406,0
Raymond hurt that old alumnus.,Raymond hurt that old alumni.,morphology,determiner_noun_agreement,determiner_noun_agreement_with_adj_irregular_1,True,True,False,True,289,-59.89769744873047,-45.68336486816406,0
Most waitresses don't observe these exposed alumni.,Most waitresses don't observe these exposed alumnus.,morphology,determiner_noun_agreement,determiner_noun_agreement_with_adj_irregular_1,True,True,False,True,290,-76.00201416015625,-91.1668701171875,1
Edward finds these gray oases.,Edward finds these gray oasis.,morphology,determiner_noun_agreement,determiner_noun_agreement_with_adj_irregular_1,True,True,False,True,291,-46.52240753173828,-43.20068359375,0
Becky fixes that small foot.,Becky fixes that small feet.,morphology,determiner_noun_agreement,determiner_noun_agreement_with_adj_irregular_1,True,True,False,True,292,-45.5732536315918,-45.947391510009766,1
Erin will conceal these nice alumni.,Erin will conceal these nice alumnus.,morphology,determiner_noun_agreement,determiner_noun_agreement_with_adj_irregular_1,True,True,False,True,293,-58.117835998535156,-74.18196105957031,1
Denise isn't shocking these serious alumni.,Denise isn't shocking these serious alumnus.,morphology,determiner_noun_agreement,determiner_noun_agreement_with_adj_irregular_1,True,True,False,True,294,-61.98734664916992,-75.56865692138672,1
Martin isn't curing these concealed oxen.,Martin isn't curing these concealed ox.,morphology,determiner_noun_agreement,determiner_noun_agreement_with_adj_irregular_1,True,True,False,True,295,-59.8994255065918,-58.0252799987793,0
Lori wasn't watching this clever woman.,Lori wasn't watching this clever women.,morphology,determiner_noun_agreement,determiner_noun_agreement_with_adj_irregular_1,True,True,False,True,296,-57.14463806152344,-58.15361022949219,1
These wheelbarrows disgust these sick men.,These wheelbarrows disgust these sick man.,morphology,determiner_noun_agreement,determiner_noun_agreement_with_adj_irregular_1,True,True,False,True,297,-69.17424774169922,-70.09967041015625,1
These women discuss that confident woman.,These women discuss that confident women.,morphology,determiner_noun_agreement,determiner_noun_agreement_with_adj_irregular_1,True,True,False,True,298,-43.61198043823242,-42.22040557861328,0
Noah hadn't remembered these bad analyses.,Noah hadn't remembered these bad analysis.,morphology,determiner_noun_agreement,determiner_noun_agreement_with_adj_irregular_1,True,True,False,True,299,-64.02037048339844,-58.580963134765625,0
Nina is boring this smart child.,Nina is boring this smart children.,morphology,determiner_noun_agreement,determiner_noun_agreement_with_adj_irregular_1,True,True,False,True,300,-54.96168899536133,-54.851470947265625,0
The Lutherans like these scared people.,The Lutherans like these scared person.,morphology,determiner_noun_agreement,determiner_noun_agreement_with_adj_irregular_1,True,True,False,True,301,-55.679847717285156,-57.72395324707031,1
Leslie could return to those lost people.,Leslie could return to those lost person.,morphology,determiner_noun_agreement,determiner_noun_agreement_with_adj_irregular_1,True,True,False,True,302,-50.43441390991211,-53.86798858642578,1
Galileo liked this small child.,Galileo liked this small children.,morphology,determiner_noun_agreement,determiner_noun_agreement_with_adj_irregular_1,True,True,False,True,303,-46.156341552734375,-46.863739013671875,1
Denise was talking about that determined person.,Denise was talking about that determined people.,morphology,determiner_noun_agreement,determiner_noun_agreement_with_adj_irregular_1,True,True,False,True,304,-41.86899948120117,-37.67448425292969,0
Andrew respected that white oasis.,Andrew respected that white oases.,morphology,determiner_noun_agreement,determiner_noun_agreement_with_adj_irregular_1,True,True,False,True,305,-42.25761413574219,-45.558013916015625,1
Renee has dropped by these old oases.,Renee has dropped by these old oasis.,morphology,determiner_noun_agreement,determiner_noun_agreement_with_adj_irregular_1,True,True,False,True,306,-66.56196594238281,-63.34904479980469,0
That bread shouldn't aggravate this unconvinced alumnus.,That bread shouldn't aggravate this unconvinced alumni.,morphology,determiner_noun_agreement,determiner_noun_agreement_with_adj_irregular_1,True,True,False,True,307,-113.41227722167969,-99.10710144042969,0
All ladies appreciate these brown oases.,All ladies appreciate these brown oasis.,morphology,determiner_noun_agreement,determiner_noun_agreement_with_adj_irregular_1,True,True,False,True,308,-57.0695915222168,-55.11147689819336,0
A doctor drives to this out in the open oasis.,A doctor drives to this out in the open oases.,morphology,determiner_noun_agreement,determiner_noun_agreement_with_adj_irregular_1,True,True,False,True,309,-76.895751953125,-81.20983123779297,1
The teenagers tour these black oases.,The teenagers tour these black oasis.,morphology,determiner_noun_agreement,determiner_noun_agreement_with_adj_irregular_1,True,True,False,True,310,-57.48994827270508,-55.70820999145508,0
Becca didn't think about those out in the open oxen.,Becca didn't think about those out in the open ox.,morphology,determiner_noun_agreement,determiner_noun_agreement_with_adj_irregular_1,True,True,False,True,311,-70.53773498535156,-68.13044738769531,0
Eric hadn't loved that exposed person.,Eric hadn't loved that exposed people.,morphology,determiner_noun_agreement,determiner_noun_agreement_with_adj_irregular_1,True,True,False,True,312,-42.87038040161133,-40.44742202758789,0
Every person wasn't hiding those black axes.,Every person wasn't hiding those black axis.,morphology,determiner_noun_agreement,determiner_noun_agreement_with_adj_irregular_1,True,True,False,True,313,-53.24541473388672,-50.9830322265625,0
Tina respected that unemployed child.,Tina respected that unemployed children.,morphology,determiner_noun_agreement,determiner_noun_agreement_with_adj_irregular_1,True,True,False,True,314,-54.931495666503906,-55.14845275878906,1
Broccoli astounds this unemployed child.,Broccoli astounds this unemployed children.,morphology,determiner_noun_agreement,determiner_noun_agreement_with_adj_irregular_1,True,True,False,True,315,-63.10225296020508,-64.21807098388672,1
The waitresses break this cheap foot.,The waitresses break this cheap feet.,morphology,determiner_noun_agreement,determiner_noun_agreement_with_adj_irregular_1,True,True,False,True,316,-59.308387756347656,-59.504268646240234,1
Janice brought this brown nucleus.,Janice brought this brown nuclei.,morphology,determiner_noun_agreement,determiner_noun_agreement_with_adj_irregular_1,True,True,False,True,317,-46.88174057006836,-55.62567901611328,1
Gerald wasn't dropping by these old oases.,Gerald wasn't dropping by these old oasis.,morphology,determiner_noun_agreement,determiner_noun_agreement_with_adj_irregular_1,True,True,False,True,318,-74.18014526367188,-70.94602966308594,0
These slopes haven't astounded those unemployed alumni.,These slopes haven't astounded those unemployed alumnus.,morphology,determiner_noun_agreement,determiner_noun_agreement_with_adj_irregular_1,True,True,False,True,319,-74.69163513183594,-89.07971954345703,1
Ellen was astounding these unsure men.,Ellen was astounding these unsure man.,morphology,determiner_noun_agreement,determiner_noun_agreement_with_adj_irregular_1,True,True,False,True,320,-58.267852783203125,-58.4879150390625,1
That story will annoy this fast person.,That story will annoy this fast people.,morphology,determiner_noun_agreement,determiner_noun_agreement_with_adj_irregular_1,True,True,False,True,321,-51.89570617675781,-50.49596405029297,0
Most photographs look like those clever children.,Most photographs look like those clever child.,morphology,determiner_noun_agreement,determiner_noun_agreement_with_adj_irregular_1,True,True,False,True,322,-45.913997650146484,-47.44602966308594,1
These screens distracted that young alumnus.,These screens distracted that young alumni.,morphology,determiner_noun_agreement,determiner_noun_agreement_with_adj_irregular_1,True,True,False,True,323,-66.8528060913086,-53.79574966430664,0
Craig does distract this small woman.,Craig does distract this small women.,morphology,determiner_noun_agreement,determiner_noun_agreement_with_adj_irregular_1,True,True,False,True,324,-43.0757942199707,-45.30839538574219,1
Monet arrived at those blue oases.,Monet arrived at those blue oasis.,morphology,determiner_noun_agreement,determiner_noun_agreement_with_adj_irregular_1,True,True,False,True,325,-57.10692596435547,-53.274723052978516,0
The ladies lift those blue feet.,The ladies lift those blue foot.,morphology,determiner_noun_agreement,determiner_noun_agreement_with_adj_irregular_1,True,True,False,True,326,-44.224857330322266,-45.91984939575195,1
A grocery store does confuse this displeased woman.,A grocery store does confuse this displeased women.,morphology,determiner_noun_agreement,determiner_noun_agreement_with_adj_irregular_1,True,True,False,True,327,-86.01283264160156,-86.67572784423828,1
Douglas was escaping from those unlucky children.,Douglas was escaping from those unlucky child.,morphology,determiner_noun_agreement,determiner_noun_agreement_with_adj_irregular_1,True,True,False,True,328,-56.37382888793945,-57.76369857788086,1
Brenda had returned to these scared alumni.,Brenda had returned to these scared alumnus.,morphology,determiner_noun_agreement,determiner_noun_agreement_with_adj_irregular_1,True,True,False,True,329,-53.59746551513672,-69.48802185058594,1
Alicia scans these good synopses.,Alicia scans these good synopsis.,morphology,determiner_noun_agreement,determiner_noun_agreement_with_adj_irregular_1,True,True,False,True,330,-84.4183120727539,-72.83140563964844,0
Some senators attack those confident men.,Some senators attack those confident man.,morphology,determiner_noun_agreement,determiner_noun_agreement_with_adj_irregular_1,True,True,False,True,331,-56.79673385620117,-58.026798248291016,1
Some fish shocked those small people.,Some fish shocked those small person.,morphology,determiner_noun_agreement,determiner_noun_agreement_with_adj_irregular_1,True,True,False,True,332,-42.725135803222656,-45.217647552490234,1
Timothy had cared for these fast men.,Timothy had cared for these fast man.,morphology,determiner_noun_agreement,determiner_noun_agreement_with_adj_irregular_1,True,True,False,True,333,-48.47516632080078,-50.957916259765625,1
Lucille hasn't run around those concealed oases.,Lucille hasn't run around those concealed oasis.,morphology,determiner_noun_agreement,determiner_noun_agreement_with_adj_irregular_1,True,True,False,True,334,-71.19066619873047,-67.69281005859375,0
Tonya observed that fast alumnus.,Tonya observed that fast alumni.,morphology,determiner_noun_agreement,determiner_noun_agreement_with_adj_irregular_1,True,True,False,True,335,-65.25117492675781,-50.23963165283203,0
Every picture was astounding this lucky alumnus.,Every picture was astounding this lucky alumni.,morphology,determiner_noun_agreement,determiner_noun_agreement_with_adj_irregular_1,True,True,False,True,336,-78.13982391357422,-63.443973541259766,0
