sentence_good,sentence_bad,field,linguistics_term,UID,simple_LM_method,one_prefix_method,two_prefix_method,lexically_identical,pair_id,good_prob,bad_prob,correct
There isn't a bank conspiring.,There isn't each bank conspiring.,semantics,quantifiers,existential_there_quantifiers_1,True,False,False,False,490,-30.45484733581543,-38.0839729309082,1
There wasn't a report boring Travis.,There wasn't every report boring Travis.,semantics,quantifiers,existential_there_quantifiers_1,True,False,False,False,491,-45.100807189941406,-52.30619812011719,1
There is a restaurant hurting a lot of doctors.,There is every restaurant hurting a lot of doctors.,semantics,quantifiers,existential_there_quantifiers_1,True,False,False,False,492,-38.25121307373047,-48.20294189453125,1
There weren't few wheelbarrows accelerating.,There weren't most wheelbarrows accelerating.,semantics,quantifiers,existential_there_quantifiers_1,True,False,False,False,493,-66.81396484375,-67.57807159423828,1
There are no hospitals meeting.,There are most hospitals meeting.,semantics,quantifiers,existential_there_quantifiers_1,True,False,False,False,494,-27.28553009033203,-29.523754119873047,1
There were no computers impressing every patient.,There were most computers impressing every patient.,semantics,quantifiers,existential_there_quantifiers_1,True,False,False,False,495,-55.454612731933594,-56.674285888671875,1
There are no guests astounding that hospital.,There are most guests astounding that hospital.,semantics,quantifiers,existential_there_quantifiers_1,True,False,False,False,496,-48.65521240234375,-52.488677978515625,1
There were some pictures of a light disgusting Heidi.,There were most pictures of a light disgusting Heidi.,semantics,quantifiers,existential_there_quantifiers_1,True,False,False,False,497,-54.948158264160156,-59.01752471923828,1
There weren't many eyes vanishing.,There weren't all eyes vanishing.,semantics,quantifiers,existential_there_quantifiers_1,True,False,False,False,498,-37.609954833984375,-41.410255432128906,1
There were no drivers turning out to irritate Barbara.,There were most drivers turning out to irritate Barbara.,semantics,quantifiers,existential_there_quantifiers_1,True,False,False,False,499,-67.68447875976562,-68.97856903076172,1
There were some prints of Bethany vanishing.,There were most prints of Bethany vanishing.,semantics,quantifiers,existential_there_quantifiers_1,True,False,False,False,500,-60.32185363769531,-64.32748413085938,1
There are few children concealing some spotlight.,There are most children concealing some spotlight.,semantics,quantifiers,existential_there_quantifiers_1,True,False,False,False,501,-57.65275192260742,-60.566165924072266,1
There isn't a niece of the Clintons continuing to salute.,There isn't every niece of the Clintons continuing to salute.,semantics,quantifiers,existential_there_quantifiers_1,True,False,False,False,502,-73.05813598632812,-80.20393371582031,1
There wasn't a documentary aggravating Rachelle.,There wasn't every documentary aggravating Rachelle.,semantics,quantifiers,existential_there_quantifiers_1,True,False,False,False,503,-62.19230651855469,-70.13333892822266,1
There are many eggplants charring.,There are all eggplants charring.,semantics,quantifiers,existential_there_quantifiers_1,True,False,False,False,504,-55.63247299194336,-58.02056884765625,1
There are few actors hunting.,There are all actors hunting.,semantics,quantifiers,existential_there_quantifiers_1,True,False,False,False,505,-32.04619598388672,-31.861223220825195,0
There were no sons of Carla surrendering.,There were all sons of Carla surrendering.,semantics,quantifiers,existential_there_quantifiers_1,True,False,False,False,506,-58.750614166259766,-59.939537048339844,1
There is a report bothering Victoria.,There is each report bothering Victoria.,semantics,quantifiers,existential_there_quantifiers_1,True,False,False,False,507,-37.814453125,-47.3216667175293,1
There are few high schools impressing Jason.,There are most high schools impressing Jason.,semantics,quantifiers,existential_there_quantifiers_1,True,False,False,False,508,-57.34999465942383,-57.270172119140625,0
There are few candles wasting away.,There are all candles wasting away.,semantics,quantifiers,existential_there_quantifiers_1,True,False,False,False,509,-39.49457550048828,-41.01221466064453,1
There are no committees forcing that lady to sigh.,There are most committees forcing that lady to sigh.,semantics,quantifiers,existential_there_quantifiers_1,True,False,False,False,510,-58.59994125366211,-61.02301788330078,1
There was a skateboard falling.,There was each skateboard falling.,semantics,quantifiers,existential_there_quantifiers_1,True,False,False,False,511,-37.229164123535156,-47.92708206176758,1
There were many patients obligating Candice's supervisors to get a job.,There were most patients obligating Candice's supervisors to get a job.,semantics,quantifiers,existential_there_quantifiers_1,True,False,False,False,512,-95.07670593261719,-98.51284790039062,1
There weren't few gloves twisting.,There weren't most gloves twisting.,semantics,quantifiers,existential_there_quantifiers_1,True,False,False,False,513,-43.43384552001953,-43.16135787963867,0
There was a skateboard wasting away.,There was each skateboard wasting away.,semantics,quantifiers,existential_there_quantifiers_1,True,False,False,False,514,-46.74653244018555,-57.645023345947266,1
There was a scarf confusing that adult.,There was every scarf confusing that adult.,semantics,quantifiers,existential_there_quantifiers_1,True,False,False,False,515,-49.48236083984375,-56.71421813964844,1
There weren't many turtles climbing up those hills.,There weren't all turtles climbing up those hills.,semantics,quantifiers,existential_there_quantifiers_1,True,False,False,False,516,-55.810699462890625,-58.715736389160156,1
There are few organizations confusing Elaine.,There are all organizations confusing Elaine.,semantics,quantifiers,existential_there_quantifiers_1,True,False,False,False,517,-44.09349822998047,-45.95873260498047,1
There are few books boring Martha.,There are all books boring Martha.,semantics,quantifiers,existential_there_quantifiers_1,True,False,False,False,518,-43.11845397949219,-45.40629577636719,1
There was a face stunning Steve.,There was each face stunning Steve.,semantics,quantifiers,existential_there_quantifiers_1,True,False,False,False,519,-44.266517639160156,-55.24610900878906,1
There were some documentaries hurting Jane.,There were most documentaries hurting Jane.,semantics,quantifiers,existential_there_quantifiers_1,True,False,False,False,520,-47.331695556640625,-50.02954864501953,1
There wasn't a drawing appearing.,There wasn't each drawing appearing.,semantics,quantifiers,existential_there_quantifiers_1,True,False,False,False,521,-35.157859802246094,-44.07612228393555,1
There wasn't a plane dropping.,There wasn't each plane dropping.,semantics,quantifiers,existential_there_quantifiers_1,True,False,False,False,522,-31.439273834228516,-40.24475860595703,1
There is a sketch confusing Christine.,There is each sketch confusing Christine.,semantics,quantifiers,existential_there_quantifiers_1,True,False,False,False,523,-43.13655471801758,-53.553466796875,1
There are no gloves shrinking.,There are all gloves shrinking.,semantics,quantifiers,existential_there_quantifiers_1,True,False,False,False,524,-33.8953742980957,-36.24815368652344,1
There are few boxes annoying the dancer.,There are most boxes annoying the dancer.,semantics,quantifiers,existential_there_quantifiers_1,True,False,False,False,525,-49.36537170410156,-50.55218505859375,1
There weren't many cakes embarrassing Gregory.,There weren't most cakes embarrassing Gregory.,semantics,quantifiers,existential_there_quantifiers_1,True,False,False,False,526,-50.481666564941406,-55.31511306762695,1
There were few pictures of Janice disturbing Christina.,There were most pictures of Janice disturbing Christina.,semantics,quantifiers,existential_there_quantifiers_1,True,False,False,False,527,-68.76339721679688,-69.69926452636719,1
There are some newspaper articles about the Clintons bothering many hospitals.,There are most newspaper articles about the Clintons bothering many hospitals.,semantics,quantifiers,existential_there_quantifiers_1,True,False,False,False,528,-77.88128662109375,-82.52070617675781,1
There was a candle disappearing.,There was every candle disappearing.,semantics,quantifiers,existential_there_quantifiers_1,True,False,False,False,529,-29.789297103881836,-39.03801727294922,1
There is a report vanishing.,There is each report vanishing.,semantics,quantifiers,existential_there_quantifiers_1,True,False,False,False,530,-29.978893280029297,-40.201072692871094,1
There are no children failing to describe Veronica.,There are all children failing to describe Veronica.,semantics,quantifiers,existential_there_quantifiers_1,True,False,False,False,531,-47.21556091308594,-51.10724639892578,1
There are no governments continuing to testify.,There are most governments continuing to testify.,semantics,quantifiers,existential_there_quantifiers_1,True,False,False,False,532,-43.313621520996094,-46.07577896118164,1
There are no cucumbers ripening.,There are most cucumbers ripening.,semantics,quantifiers,existential_there_quantifiers_1,True,False,False,False,533,-52.85871887207031,-54.782814025878906,1
There are some cousins of some men winning.,There are all cousins of some men winning.,semantics,quantifiers,existential_there_quantifiers_1,True,False,False,False,534,-45.53292465209961,-48.541900634765625,1
There wasn't a child moving.,There wasn't every child moving.,semantics,quantifiers,existential_there_quantifiers_1,True,False,False,False,535,-27.585102081298828,-35.47148132324219,1
There was a brother of Janice crying.,There was each brother of Janice crying.,semantics,quantifiers,existential_there_quantifiers_1,True,False,False,False,536,-44.098365783691406,-56.542564392089844,1
There isn't a jacket warping.,There isn't every jacket warping.,semantics,quantifiers,existential_there_quantifiers_1,True,False,False,False,537,-44.16804504394531,-52.38189697265625,1
There is a movie about Galileo disgusting Ronald.,There is every movie about Galileo disgusting Ronald.,semantics,quantifiers,existential_there_quantifiers_1,True,False,False,False,538,-64.27725219726562,-71.40593719482422,1
There were no daughters of Connie running around these glaciers.,There were all daughters of Connie running around these glaciers.,semantics,quantifiers,existential_there_quantifiers_1,True,False,False,False,539,-67.23316192626953,-69.93077850341797,1
There isn't a documentary disagreeing.,There isn't every documentary disagreeing.,semantics,quantifiers,existential_there_quantifiers_1,True,False,False,False,540,-38.99709701538086,-44.89076614379883,1
There are some prints of Frank disturbing an association.,There are most prints of Frank disturbing an association.,semantics,quantifiers,existential_there_quantifiers_1,True,False,False,False,541,-61.36985778808594,-64.92498779296875,1
There weren't few books shocking Galileo.,There weren't all books shocking Galileo.,semantics,quantifiers,existential_there_quantifiers_1,True,False,False,False,542,-54.01152038574219,-55.22346115112305,1
There were few nephews of Andrea threatening to speak up.,There were all nephews of Andrea threatening to speak up.,semantics,quantifiers,existential_there_quantifiers_1,True,False,False,False,543,-76.79774475097656,-75.54888916015625,0
There were no banks appearing to escape from many teachers.,There were all banks appearing to escape from many teachers.,semantics,quantifiers,existential_there_quantifiers_1,True,False,False,False,544,-65.1820068359375,-66.85505676269531,1
There is a mirror wasting away.,There is each mirror wasting away.,semantics,quantifiers,existential_there_quantifiers_1,True,False,False,False,545,-34.574188232421875,-46.776790618896484,1
There aren't few dogs falling.,There aren't most dogs falling.,semantics,quantifiers,existential_there_quantifiers_1,True,False,False,False,546,-36.93838882446289,-38.349395751953125,1
There was a movie theater scaring James.,There was each movie theater scaring James.,semantics,quantifiers,existential_there_quantifiers_1,True,False,False,False,547,-47.384246826171875,-58.47856521606445,1
There was a high school annoying Omar.,There was each high school annoying Omar.,semantics,quantifiers,existential_there_quantifiers_1,True,False,False,False,548,-44.05645751953125,-53.32252502441406,1
There isn't a lady obliging Karla to discuss Paula.,There isn't every lady obliging Karla to discuss Paula.,semantics,quantifiers,existential_there_quantifiers_1,True,False,False,False,549,-81.6201171875,-89.82901000976562,1
There wasn't a museum approving.,There wasn't each museum approving.,semantics,quantifiers,existential_there_quantifiers_1,True,False,False,False,550,-36.43055725097656,-44.91809844970703,1
There wasn't a book about the Clintons astounding Mary.,There wasn't each book about the Clintons astounding Mary.,semantics,quantifiers,existential_there_quantifiers_1,True,False,False,False,551,-70.64340209960938,-81.32879638671875,1
There is a cashier grinning.,There is every cashier grinning.,semantics,quantifiers,existential_there_quantifiers_1,True,False,False,False,552,-39.6075325012207,-47.349021911621094,1
There isn't a pie confusing many actresses.,There isn't each pie confusing many actresses.,semantics,quantifiers,existential_there_quantifiers_1,True,False,False,False,553,-51.687721252441406,-61.565277099609375,1
There weren't few waitresses corresponding.,There weren't all waitresses corresponding.,semantics,quantifiers,existential_there_quantifiers_1,True,False,False,False,554,-53.824954986572266,-53.02803421020508,0
There isn't a school pushing Marcus to reference Valerie.,There isn't every school pushing Marcus to reference Valerie.,semantics,quantifiers,existential_there_quantifiers_1,True,False,False,False,555,-76.0345230102539,-81.44670104980469,1
There wasn't a son of Brenda winning.,There wasn't every son of Brenda winning.,semantics,quantifiers,existential_there_quantifiers_1,True,False,False,False,556,-45.37455368041992,-53.381080627441406,1
There are many essays impressing these legislatures.,There are all essays impressing these legislatures.,semantics,quantifiers,existential_there_quantifiers_1,True,False,False,False,557,-56.44057846069336,-59.203857421875,1
There wasn't a waiter considering this cart to crash.,There wasn't every waiter considering this cart to crash.,semantics,quantifiers,existential_there_quantifiers_1,True,False,False,False,558,-69.2677001953125,-77.40042114257812,1
There is a candle astounding the Clintons.,There is each candle astounding the Clintons.,semantics,quantifiers,existential_there_quantifiers_1,True,False,False,False,559,-54.43788528442383,-65.4798355102539,1
There isn't a mouth wasting away.,There isn't every mouth wasting away.,semantics,quantifiers,existential_there_quantifiers_1,True,False,False,False,560,-39.40949249267578,-48.508018493652344,1
There isn't an apple confusing Ella.,There isn't every apple confusing Ella.,semantics,quantifiers,existential_there_quantifiers_1,True,False,False,False,561,-48.79962158203125,-54.352020263671875,1
There weren't many prints alarming Nicole.,There weren't all prints alarming Nicole.,semantics,quantifiers,existential_there_quantifiers_1,True,False,False,False,562,-54.85090637207031,-57.03233337402344,1
There is a candle embarrassing some boys.,There is every candle embarrassing some boys.,semantics,quantifiers,existential_there_quantifiers_1,True,False,False,False,563,-46.65346145629883,-54.81432342529297,1
There was a waitress lifting a lot of cats.,There was each waitress lifting a lot of cats.,semantics,quantifiers,existential_there_quantifiers_1,True,False,False,False,564,-43.66272735595703,-56.301239013671875,1
There isn't a girl commanding Anne to disturb every hospital.,There isn't each girl commanding Anne to disturb every hospital.,semantics,quantifiers,existential_there_quantifiers_1,True,False,False,False,565,-75.29837799072266,-84.50857543945312,1
There is a granddaughter of Vincent running around every mountain.,There is each granddaughter of Vincent running around every mountain.,semantics,quantifiers,existential_there_quantifiers_1,True,False,False,False,566,-61.283714294433594,-71.75514221191406,1
There are some drawings of every cafe impressing Danielle.,There are all drawings of every cafe impressing Danielle.,semantics,quantifiers,existential_there_quantifiers_1,True,False,False,False,567,-74.07943725585938,-77.29814910888672,1
There weren't few books looking like these sketches.,There weren't most books looking like these sketches.,semantics,quantifiers,existential_there_quantifiers_1,True,False,False,False,568,-55.47273254394531,-57.28296661376953,1
There wasn't a face irritating Brian.,There wasn't every face irritating Brian.,semantics,quantifiers,existential_there_quantifiers_1,True,False,False,False,569,-46.0477409362793,-55.74127197265625,1
There isn't a book about science disturbing Kirsten.,There isn't every book about science disturbing Kirsten.,semantics,quantifiers,existential_there_quantifiers_1,True,False,False,False,570,-59.13851547241211,-66.72022247314453,1
There are few cucumbers falling.,There are all cucumbers falling.,semantics,quantifiers,existential_there_quantifiers_1,True,False,False,False,571,-42.78502655029297,-43.04852294921875,1
There are some mouths flinging open.,There are most mouths flinging open.,semantics,quantifiers,existential_there_quantifiers_1,True,False,False,False,572,-43.07728958129883,-45.7957763671875,1
There were no windows confusing Ronald.,There were most windows confusing Ronald.,semantics,quantifiers,existential_there_quantifiers_1,True,False,False,False,573,-49.76864242553711,-51.098960876464844,1
There isn't a student running around some lake.,There isn't each student running around some lake.,semantics,quantifiers,existential_there_quantifiers_1,True,False,False,False,574,-46.58441162109375,-54.84078598022461,1
There are no unicycles falling.,There are most unicycles falling.,semantics,quantifiers,existential_there_quantifiers_1,True,False,False,False,575,-50.59883117675781,-51.56707000732422,1
There isn't a dish shattering.,There isn't every dish shattering.,semantics,quantifiers,existential_there_quantifiers_1,True,False,False,False,576,-32.995201110839844,-39.34336853027344,1
There is an eye disappearing.,There is every eye disappearing.,semantics,quantifiers,existential_there_quantifiers_1,True,False,False,False,577,-27.49324607849121,-36.104461669921875,1
There is a pepper irritating some pedestrian.,There is each pepper irritating some pedestrian.,semantics,quantifiers,existential_there_quantifiers_1,True,False,False,False,578,-50.48624801635742,-59.994361877441406,1
There aren't few grandfathers of Kayla turning out to win.,There aren't all grandfathers of Kayla turning out to win.,semantics,quantifiers,existential_there_quantifiers_1,True,False,False,False,579,-83.96377563476562,-85.33583068847656,1
There were some reports wasting away.,There were all reports wasting away.,semantics,quantifiers,existential_there_quantifiers_1,True,False,False,False,580,-37.648338317871094,-40.869171142578125,1
There was a grandmother of Jesus spinning around.,There was every grandmother of Jesus spinning around.,semantics,quantifiers,existential_there_quantifiers_1,True,False,False,False,581,-47.61173629760742,-57.625755310058594,1
There wasn't an actress upsetting the teenagers.,There wasn't each actress upsetting the teenagers.,semantics,quantifiers,existential_there_quantifiers_1,True,False,False,False,582,-47.91260528564453,-54.37327194213867,1
There are some pedestrians descending most mountains.,There are most pedestrians descending most mountains.,semantics,quantifiers,existential_there_quantifiers_1,True,False,False,False,583,-50.05332946777344,-53.158409118652344,1
There wasn't a teacher whispering.,There wasn't each teacher whispering.,semantics,quantifiers,existential_there_quantifiers_1,True,False,False,False,584,-31.093151092529297,-39.77140808105469,1
There were some coats bothering this man.,There were all coats bothering this man.,semantics,quantifiers,existential_there_quantifiers_1,True,False,False,False,585,-45.09867477416992,-48.179786682128906,1
There isn't a coat shocking Galileo.,There isn't every coat shocking Galileo.,semantics,quantifiers,existential_there_quantifiers_1,True,False,False,False,586,-47.10081481933594,-55.118316650390625,1
There is a cart looking like every painting.,There is each cart looking like every painting.,semantics,quantifiers,existential_there_quantifiers_1,True,False,False,False,587,-47.548912048339844,-58.227882385253906,1
There isn't a boy blinking.,There isn't every boy blinking.,semantics,quantifiers,existential_there_quantifiers_1,True,False,False,False,588,-32.85694122314453,-41.127838134765625,1
There were few dancers reacting.,There were all dancers reacting.,semantics,quantifiers,existential_there_quantifiers_1,True,False,False,False,589,-35.45953369140625,-35.39044189453125,0
There wasn't a lady cheering.,There wasn't each lady cheering.,semantics,quantifiers,existential_there_quantifiers_1,True,False,False,False,590,-32.8059196472168,-42.12165832519531,1
There were few grocery stores bothering all drivers.,There were most grocery stores bothering all drivers.,semantics,quantifiers,existential_there_quantifiers_1,True,False,False,False,591,-58.34177017211914,-58.616119384765625,1
There were some glasses aggravating Carmen.,There were most glasses aggravating Carmen.,semantics,quantifiers,existential_there_quantifiers_1,True,False,False,False,592,-50.96390151977539,-55.170555114746094,1
There was a snake hiding.,There was every snake hiding.,semantics,quantifiers,existential_there_quantifiers_1,True,False,False,False,593,-26.683307647705078,-37.01877975463867,1
There is an actor wishing to boast about Eva.,There is each actor wishing to boast about Eva.,semantics,quantifiers,existential_there_quantifiers_1,True,False,False,False,594,-61.027626037597656,-71.30142211914062,1
There aren't few plays stunning Melanie.,There aren't most plays stunning Melanie.,semantics,quantifiers,existential_there_quantifiers_1,True,False,False,False,595,-54.18291473388672,-55.415706634521484,1
There are no lights dimming.,There are all lights dimming.,semantics,quantifiers,existential_there_quantifiers_1,True,False,False,False,596,-38.0360221862793,-40.5572509765625,1
There weren't many books about the Great Lakes impressing the Clintons.,There weren't all books about the Great Lakes impressing the Clintons.,semantics,quantifiers,existential_there_quantifiers_1,True,False,False,False,597,-85.52191162109375,-89.19498443603516,1
There aren't many mothers of Brett upsetting Alan.,There aren't most mothers of Brett upsetting Alan.,semantics,quantifiers,existential_there_quantifiers_1,True,False,False,False,598,-66.97918701171875,-71.19578552246094,1
There were some commentaries about politics boring most teachers.,There were most commentaries about politics boring most teachers.,semantics,quantifiers,existential_there_quantifiers_1,True,False,False,False,599,-72.9273452758789,-78.33209228515625,1
There isn't a daughter of Carla chuckling.,There isn't each daughter of Carla chuckling.,semantics,quantifiers,existential_there_quantifiers_1,True,False,False,False,600,-52.329261779785156,-62.096954345703125,1
There isn't a photograph disgusting Galileo.,There isn't every photograph disgusting Galileo.,semantics,quantifiers,existential_there_quantifiers_1,True,False,False,False,601,-46.89302062988281,-55.234718322753906,1
There were some women descending a lot of mountains.,There were all women descending a lot of mountains.,semantics,quantifiers,existential_there_quantifiers_1,True,False,False,False,602,-46.93922805786133,-49.64122772216797,1
There are no banks reacting.,There are most banks reacting.,semantics,quantifiers,existential_there_quantifiers_1,True,False,False,False,603,-27.60381507873535,-30.655920028686523,1
There are no closets alarming Dennis.,There are most closets alarming Dennis.,semantics,quantifiers,existential_there_quantifiers_1,True,False,False,False,604,-52.48574447631836,-54.94934844970703,1
There isn't a commentary about the Balkans winning.,There isn't each commentary about the Balkans winning.,semantics,quantifiers,existential_there_quantifiers_1,True,False,False,False,605,-56.74296188354492,-64.80937957763672,1
There wasn't a customer ascending all mountains.,There wasn't every customer ascending all mountains.,semantics,quantifiers,existential_there_quantifiers_1,True,False,False,False,606,-51.398475646972656,-58.749755859375,1
There are some granddaughters of Gina discovering Omar.,There are most granddaughters of Gina discovering Omar.,semantics,quantifiers,existential_there_quantifiers_1,True,False,False,False,607,-80.86875915527344,-84.25382232666016,1
There isn't a painting of Rodney disturbing many men.,There isn't every painting of Rodney disturbing many men.,semantics,quantifiers,existential_there_quantifiers_1,True,False,False,False,608,-66.89030456542969,-72.23411560058594,1
There are no pants vanishing.,There are most pants vanishing.,semantics,quantifiers,existential_there_quantifiers_1,True,False,False,False,609,-31.087339401245117,-34.16484069824219,1
There isn't a company needing to stun Stacy.,There isn't each company needing to stun Stacy.,semantics,quantifiers,existential_there_quantifiers_1,True,False,False,False,610,-59.57196044921875,-65.61253356933594,1
There is a movie about Spain astounding Amy.,There is every movie about Spain astounding Amy.,semantics,quantifiers,existential_there_quantifiers_1,True,False,False,False,611,-57.5284423828125,-64.83236694335938,1
