sentence_good,sentence_bad,field,linguistics_term,UID,simple_LM_method,one_prefix_method,two_prefix_method,lexically_identical,pair_id,good_prob,bad_prob,correct
Most actresses flee from themselves.,Most actresses flee from herself.,morphology,anaphor_agreement,anaphor_number_agreement,True,True,False,True,277,-41.185264587402344,-43.991981506347656,1
Gina is listening to herself.,Gina is listening to themselves.,morphology,anaphor_agreement,anaphor_number_agreement,True,True,False,True,278,-38.39767074584961,-37.40007781982422,0
The Impressionists distracted themselves.,The Impressionists distracted himself.,morphology,anaphor_agreement,anaphor_number_agreement,True,True,False,True,279,-52.5875244140625,-56.28919219970703,1
Ann hasn't bothered herself.,Ann hasn't bothered themselves.,morphology,anaphor_agreement,anaphor_number_agreement,True,True,False,True,280,-28.062440872192383,-26.598628997802734,0
Samuel hadn't hated himself.,Samuel hadn't hated themselves.,morphology,anaphor_agreement,anaphor_number_agreement,True,True,False,True,281,-32.012596130371094,-32.550537109375,1
The cashiers shouldn't worry themselves.,The cashiers shouldn't worry itself.,morphology,anaphor_agreement,anaphor_number_agreement,True,True,False,True,282,-49.0599250793457,-49.26899719238281,1
The Borgias have talked about themselves.,The Borgias have talked about himself.,morphology,anaphor_agreement,anaphor_number_agreement,True,True,False,True,283,-47.05180358886719,-48.53474807739258,1
James isn't watching himself.,James isn't watching themselves.,morphology,anaphor_agreement,anaphor_number_agreement,True,True,False,True,284,-22.159263610839844,-22.329235076904297,1
Ruth wasn't discussing herself.,Ruth wasn't discussing themselves.,morphology,anaphor_agreement,anaphor_number_agreement,True,True,False,True,285,-47.6838493347168,-46.03103256225586,0
All doctors discover themselves.,All doctors discover itself.,morphology,anaphor_agreement,anaphor_number_agreement,True,True,False,True,286,-28.833332061767578,-31.145401000976562,1
The doctors described themselves.,The doctors described itself.,morphology,anaphor_agreement,anaphor_number_agreement,True,True,False,True,287,-26.80161476135254,-28.701143264770508,1
All waitresses hurt themselves.,All waitresses hurt herself.,morphology,anaphor_agreement,anaphor_number_agreement,True,True,False,True,288,-44.81781005859375,-46.804744720458984,1
Those children could think about themselves.,Those children could think about itself.,morphology,anaphor_agreement,anaphor_number_agreement,True,True,False,True,289,-27.765628814697266,-29.77652359008789,1
These senators had hated themselves.,These senators had hated herself.,morphology,anaphor_agreement,anaphor_number_agreement,True,True,False,True,290,-37.449825286865234,-41.33074951171875,1
Karen didn't heal herself.,Karen didn't heal themselves.,morphology,anaphor_agreement,anaphor_number_agreement,True,True,False,True,291,-39.36451721191406,-37.708438873291016,0
Linda does talk to herself.,Linda does talk to themselves.,morphology,anaphor_agreement,anaphor_number_agreement,True,True,False,True,292,-37.530601501464844,-36.6262321472168,0
Douglas is visiting himself.,Douglas is visiting themselves.,morphology,anaphor_agreement,anaphor_number_agreement,True,True,False,True,293,-30.74770164489746,-30.20108985900879,0
Todd has aggravated himself.,Todd has aggravated themselves.,morphology,anaphor_agreement,anaphor_number_agreement,True,True,False,True,294,-30.901744842529297,-30.579607009887695,0
Noah can't discover himself.,Noah can't discover themselves.,morphology,anaphor_agreement,anaphor_number_agreement,True,True,False,True,295,-41.58677673339844,-41.29158401489258,0
The organizations bother themselves.,The organizations bother herself.,morphology,anaphor_agreement,anaphor_number_agreement,True,True,False,True,296,-28.391098022460938,-33.329139709472656,1
Boys reference themselves.,Boys reference himself.,morphology,anaphor_agreement,anaphor_number_agreement,True,True,False,True,297,-41.347442626953125,-43.39746856689453,1
Daniel isn't revealing himself.,Daniel isn't revealing themselves.,morphology,anaphor_agreement,anaphor_number_agreement,True,True,False,True,298,-31.156612396240234,-31.39031982421875,1
Tracy hadn't described herself.,Tracy hadn't described themselves.,morphology,anaphor_agreement,anaphor_number_agreement,True,True,False,True,299,-34.84172821044922,-33.17041778564453,0
Tina wasn't curing herself.,Tina wasn't curing themselves.,morphology,anaphor_agreement,anaphor_number_agreement,True,True,False,True,300,-45.264278411865234,-44.36699676513672,0
All dancers have aggravated themselves.,All dancers have aggravated himself.,morphology,anaphor_agreement,anaphor_number_agreement,True,True,False,True,301,-40.249446868896484,-43.142173767089844,1
Cheryl does disgust herself.,Cheryl does disgust themselves.,morphology,anaphor_agreement,anaphor_number_agreement,True,True,False,True,302,-58.347808837890625,-56.35160827636719,0
These boys haven't attacked themselves.,These boys haven't attacked himself.,morphology,anaphor_agreement,anaphor_number_agreement,True,True,False,True,303,-27.25372314453125,-30.492639541625977,1
Steven was hiding himself.,Steven was hiding themselves.,morphology,anaphor_agreement,anaphor_number_agreement,True,True,False,True,304,-22.43138885498047,-24.110706329345703,1
Amelia should notice herself.,Amelia should notice themselves.,morphology,anaphor_agreement,anaphor_number_agreement,True,True,False,True,305,-37.921714782714844,-35.236366271972656,0
Suzanne respected herself.,Suzanne respected themselves.,morphology,anaphor_agreement,anaphor_number_agreement,True,True,False,True,306,-33.046241760253906,-30.403440475463867,0
Sarah had boasted about herself.,Sarah had boasted about themselves.,morphology,anaphor_agreement,anaphor_number_agreement,True,True,False,True,307,-36.39078140258789,-35.53050994873047,0
Many dancers are concealing themselves.,Many dancers are concealing itself.,morphology,anaphor_agreement,anaphor_number_agreement,True,True,False,True,308,-42.90169143676758,-45.741661071777344,1
April attacked herself.,April attacked themselves.,morphology,anaphor_agreement,anaphor_number_agreement,True,True,False,True,309,-24.522315979003906,-22.125228881835938,0
This man had worked with himself.,This man had worked with themselves.,morphology,anaphor_agreement,anaphor_number_agreement,True,True,False,True,310,-28.782814025878906,-29.743576049804688,1
The governments embarrassed themselves.,The governments embarrassed herself.,morphology,anaphor_agreement,anaphor_number_agreement,True,True,False,True,311,-32.5109977722168,-36.92791748046875,1
Most libraries are scaring themselves.,Most libraries are scaring himself.,morphology,anaphor_agreement,anaphor_number_agreement,True,True,False,True,312,-36.63146209716797,-39.6627197265625,1
Jill hadn't irritated herself.,Jill hadn't irritated themselves.,morphology,anaphor_agreement,anaphor_number_agreement,True,True,False,True,313,-51.31882858276367,-50.333927154541016,0
Helen praised herself.,Helen praised themselves.,morphology,anaphor_agreement,anaphor_number_agreement,True,True,False,True,314,-24.843624114990234,-22.724102020263672,0
Most pedestrians aren't referencing themselves.,Most pedestrians aren't referencing herself.,morphology,anaphor_agreement,anaphor_number_agreement,True,True,False,True,315,-41.857688903808594,-45.11817169189453,1
Some ladies do talk to themselves.,Some ladies do talk to itself.,morphology,anaphor_agreement,anaphor_number_agreement,True,True,False,True,316,-30.86406898498535,-35.17608642578125,1
Those pedestrians embarrassed themselves.,Those pedestrians embarrassed itself.,morphology,anaphor_agreement,anaphor_number_agreement,True,True,False,True,317,-34.0694694519043,-35.032047271728516,1
Mary has seen herself.,Mary has seen themselves.,morphology,anaphor_agreement,anaphor_number_agreement,True,True,False,True,318,-23.560707092285156,-20.916030883789062,0
The Impressionists haven't hurt themselves.,The Impressionists haven't hurt itself.,morphology,anaphor_agreement,anaphor_number_agreement,True,True,False,True,319,-51.39268112182617,-54.666725158691406,1
Some waitresses had sounded like themselves.,Some waitresses had sounded like itself.,morphology,anaphor_agreement,anaphor_number_agreement,True,True,False,True,320,-55.816627502441406,-56.38485336303711,1
That woman had criticized herself.,That woman had criticized themselves.,morphology,anaphor_agreement,anaphor_number_agreement,True,True,False,True,321,-34.02552032470703,-33.012237548828125,0
A lady hadn't worked with herself.,A lady hadn't worked with themselves.,morphology,anaphor_agreement,anaphor_number_agreement,True,True,False,True,322,-45.40576934814453,-44.655914306640625,0
Becky astounded herself.,Becky astounded themselves.,morphology,anaphor_agreement,anaphor_number_agreement,True,True,False,True,323,-31.205366134643555,-30.083467483520508,0
Some actors investigate themselves.,Some actors investigate himself.,morphology,anaphor_agreement,anaphor_number_agreement,True,True,False,True,324,-30.10618019104004,-33.4128303527832,1
Omar hated himself.,Omar hated themselves.,morphology,anaphor_agreement,anaphor_number_agreement,True,True,False,True,325,-32.80800247192383,-32.39228820800781,0
The cashiers astounded themselves.,The cashiers astounded itself.,morphology,anaphor_agreement,anaphor_number_agreement,True,True,False,True,326,-46.72509002685547,-48.33736801147461,1
Many teenagers distracted themselves.,Many teenagers distracted herself.,morphology,anaphor_agreement,anaphor_number_agreement,True,True,False,True,327,-31.313404083251953,-35.814823150634766,1
Janice will respect herself.,Janice will respect themselves.,morphology,anaphor_agreement,anaphor_number_agreement,True,True,False,True,328,-36.74565124511719,-34.34889602661133,0
A lot of women worry themselves.,A lot of women worry herself.,morphology,anaphor_agreement,anaphor_number_agreement,True,True,False,True,329,-43.15057373046875,-46.86432647705078,1
Derek should hug himself.,Derek should hug themselves.,morphology,anaphor_agreement,anaphor_number_agreement,True,True,False,True,330,-38.85986328125,-39.054847717285156,1
A lot of people complain about themselves.,A lot of people complain about itself.,morphology,anaphor_agreement,anaphor_number_agreement,True,True,False,True,331,-42.913719177246094,-45.39740753173828,1
Jill thought about herself.,Jill thought about themselves.,morphology,anaphor_agreement,anaphor_number_agreement,True,True,False,True,332,-43.40227508544922,-41.929954528808594,0
The Lutherans could praise themselves.,The Lutherans could praise itself.,morphology,anaphor_agreement,anaphor_number_agreement,True,True,False,True,333,-50.01776885986328,-51.35620880126953,1
A lot of students astounded themselves.,A lot of students astounded itself.,morphology,anaphor_agreement,anaphor_number_agreement,True,True,False,True,334,-50.83411407470703,-53.70293426513672,1
Many teenagers describe themselves.,Many teenagers describe himself.,morphology,anaphor_agreement,anaphor_number_agreement,True,True,False,True,335,-26.796537399291992,-30.27410125732422,1
Anne will discover herself.,Anne will discover themselves.,morphology,anaphor_agreement,anaphor_number_agreement,True,True,False,True,336,-28.555715560913086,-26.439228057861328,0
These guests haven't approached themselves.,These guests haven't approached herself.,morphology,anaphor_agreement,anaphor_number_agreement,True,True,False,True,337,-32.16593933105469,-36.24583435058594,1
Carla annoyed herself.,Carla annoyed themselves.,morphology,anaphor_agreement,anaphor_number_agreement,True,True,False,True,338,-28.88267707824707,-26.64084243774414,0
Edward hasn't bothered himself.,Edward hasn't bothered themselves.,morphology,anaphor_agreement,anaphor_number_agreement,True,True,False,True,339,-25.342439651489258,-25.84821319580078,1
Matt isn't working with himself.,Matt isn't working with themselves.,morphology,anaphor_agreement,anaphor_number_agreement,True,True,False,True,340,-24.487375259399414,-25.696149826049805,1
Guy hadn't left himself.,Guy hadn't left themselves.,morphology,anaphor_agreement,anaphor_number_agreement,True,True,False,True,341,-25.121253967285156,-25.713470458984375,1
The children admired themselves.,The children admired itself.,morphology,anaphor_agreement,anaphor_number_agreement,True,True,False,True,342,-28.520111083984375,-30.641094207763672,1
Larry isn't healing himself.,Larry isn't healing themselves.,morphology,anaphor_agreement,anaphor_number_agreement,True,True,False,True,343,-32.020347595214844,-31.863069534301758,0
A lot of girls discover themselves.,A lot of girls discover itself.,morphology,anaphor_agreement,anaphor_number_agreement,True,True,False,True,344,-42.06092834472656,-44.50519943237305,1
The Clintons worry themselves.,The Clintons worry herself.,morphology,anaphor_agreement,anaphor_number_agreement,True,True,False,True,345,-40.49522018432617,-43.29542541503906,1
These teenagers alarm themselves.,These teenagers alarm itself.,morphology,anaphor_agreement,anaphor_number_agreement,True,True,False,True,346,-29.3341064453125,-31.804828643798828,1
Guy hadn't upset himself.,Guy hadn't upset themselves.,morphology,anaphor_agreement,anaphor_number_agreement,True,True,False,True,347,-27.848344802856445,-28.117515563964844,1
A documentary isn't disagreeing with itself.,A documentary isn't disagreeing with themselves.,morphology,anaphor_agreement,anaphor_number_agreement,True,True,False,True,348,-68.97578430175781,-66.94743347167969,0
Veronica was healing herself.,Veronica was healing themselves.,morphology,anaphor_agreement,anaphor_number_agreement,True,True,False,True,349,-34.7502326965332,-34.517669677734375,0
Some pedestrians don't insult themselves.,Some pedestrians don't insult herself.,morphology,anaphor_agreement,anaphor_number_agreement,True,True,False,True,350,-40.72477722167969,-44.008338928222656,1
A lot of cashiers weren't boring themselves.,A lot of cashiers weren't boring herself.,morphology,anaphor_agreement,anaphor_number_agreement,True,True,False,True,351,-60.557613372802734,-63.1695442199707,1
Those dancers had approached themselves.,Those dancers had approached itself.,morphology,anaphor_agreement,anaphor_number_agreement,True,True,False,True,352,-34.234222412109375,-36.718711853027344,1
Some women will insult themselves.,Some women will insult itself.,morphology,anaphor_agreement,anaphor_number_agreement,True,True,False,True,353,-31.02930450439453,-33.965728759765625,1
Bruce found himself.,Bruce found themselves.,morphology,anaphor_agreement,anaphor_number_agreement,True,True,False,True,354,-18.75741195678711,-18.79995346069336,1
Timothy should cure himself.,Timothy should cure themselves.,morphology,anaphor_agreement,anaphor_number_agreement,True,True,False,True,355,-31.96595001220703,-31.784358978271484,0
Stacey was discovering herself.,Stacey was discovering themselves.,morphology,anaphor_agreement,anaphor_number_agreement,True,True,False,True,356,-36.913848876953125,-36.41449737548828,0
The Lutherans know themselves.,The Lutherans know himself.,morphology,anaphor_agreement,anaphor_number_agreement,True,True,False,True,357,-45.582298278808594,-46.11993408203125,1
A lot of drivers do boast about themselves.,A lot of drivers do boast about herself.,morphology,anaphor_agreement,anaphor_number_agreement,True,True,False,True,358,-58.26191711425781,-62.2562255859375,1
Roger kissed himself.,Roger kissed themselves.,morphology,anaphor_agreement,anaphor_number_agreement,True,True,False,True,359,-16.29170036315918,-17.522775650024414,1
Laurie has described herself.,Laurie has described themselves.,morphology,anaphor_agreement,anaphor_number_agreement,True,True,False,True,360,-38.29655075073242,-37.42155075073242,0
Deborah alarmed herself.,Deborah alarmed themselves.,morphology,anaphor_agreement,anaphor_number_agreement,True,True,False,True,361,-32.225040435791016,-30.309202194213867,0
Most girls complained about themselves.,Most girls complained about himself.,morphology,anaphor_agreement,anaphor_number_agreement,True,True,False,True,362,-31.213850021362305,-33.919960021972656,1
Waitresses aren't listening to themselves.,Waitresses aren't listening to itself.,morphology,anaphor_agreement,anaphor_number_agreement,True,True,False,True,363,-40.52227020263672,-42.89678192138672,1
Allison wasn't kissing herself.,Allison wasn't kissing themselves.,morphology,anaphor_agreement,anaphor_number_agreement,True,True,False,True,364,-41.708778381347656,-40.91813659667969,0
Melissa hadn't discussed herself.,Melissa hadn't discussed themselves.,morphology,anaphor_agreement,anaphor_number_agreement,True,True,False,True,365,-34.71070861816406,-33.58284378051758,0
These schools confuse themselves.,These schools confuse herself.,morphology,anaphor_agreement,anaphor_number_agreement,True,True,False,True,366,-25.95737075805664,-31.367931365966797,1
Kevin doesn't care for himself.,Kevin doesn't care for themselves.,morphology,anaphor_agreement,anaphor_number_agreement,True,True,False,True,367,-21.09495735168457,-21.117605209350586,1
Michael isn't astounding himself.,Michael isn't astounding themselves.,morphology,anaphor_agreement,anaphor_number_agreement,True,True,False,True,368,-31.972370147705078,-32.11817169189453,1
Many children talk to themselves.,Many children talk to himself.,morphology,anaphor_agreement,anaphor_number_agreement,True,True,False,True,369,-22.44231414794922,-25.747079849243164,1
Many women found themselves.,Many women found itself.,morphology,anaphor_agreement,anaphor_number_agreement,True,True,False,True,370,-21.81983184814453,-24.140535354614258,1
Carlos did talk to himself.,Carlos did talk to themselves.,morphology,anaphor_agreement,anaphor_number_agreement,True,True,False,True,371,-32.552520751953125,-32.34797286987305,0
Heidi was stunning herself.,Heidi was stunning themselves.,morphology,anaphor_agreement,anaphor_number_agreement,True,True,False,True,372,-41.2097053527832,-41.73549270629883,1
Tracy hasn't stunned herself.,Tracy hasn't stunned themselves.,morphology,anaphor_agreement,anaphor_number_agreement,True,True,False,True,373,-38.06132888793945,-36.39520263671875,0
The Lutherans dislike themselves.,The Lutherans dislike itself.,morphology,anaphor_agreement,anaphor_number_agreement,True,True,False,True,374,-45.710594177246094,-46.134700775146484,1
Some men care for themselves.,Some men care for itself.,morphology,anaphor_agreement,anaphor_number_agreement,True,True,False,True,375,-25.036094665527344,-28.76439666748047,1
Many actors are boring themselves.,Many actors are boring himself.,morphology,anaphor_agreement,anaphor_number_agreement,True,True,False,True,376,-29.235366821289062,-32.228919982910156,1
Drivers loved themselves.,Drivers loved himself.,morphology,anaphor_agreement,anaphor_number_agreement,True,True,False,True,377,-27.039981842041016,-29.281879425048828,1
Melanie won't kiss herself.,Melanie won't kiss themselves.,morphology,anaphor_agreement,anaphor_number_agreement,True,True,False,True,378,-34.38641357421875,-34.63426971435547,1
Donald hired himself.,Donald hired themselves.,morphology,anaphor_agreement,anaphor_number_agreement,True,True,False,True,379,-17.157386779785156,-17.866289138793945,1
Carlos approached himself.,Carlos approached themselves.,morphology,anaphor_agreement,anaphor_number_agreement,True,True,False,True,380,-26.25442886352539,-26.140796661376953,0
Meredith was escaping from herself.,Meredith was escaping from themselves.,morphology,anaphor_agreement,anaphor_number_agreement,True,True,False,True,381,-45.81556701660156,-45.10443878173828,0
Stacy astounded herself.,Stacy astounded themselves.,morphology,anaphor_agreement,anaphor_number_agreement,True,True,False,True,382,-39.132999420166016,-37.29893493652344,0
The Clintons scared themselves.,The Clintons scared itself.,morphology,anaphor_agreement,anaphor_number_agreement,True,True,False,True,383,-37.733741760253906,-37.937984466552734,1
Customers would discuss themselves.,Customers would discuss itself.,morphology,anaphor_agreement,anaphor_number_agreement,True,True,False,True,384,-29.155736923217773,-30.165571212768555,1
An association impresses itself.,An association impresses themselves.,morphology,anaphor_agreement,anaphor_number_agreement,True,True,False,True,385,-43.71592330932617,-43.4454460144043,0
Those ladies weren't talking to themselves.,Those ladies weren't talking to itself.,morphology,anaphor_agreement,anaphor_number_agreement,True,True,False,True,386,-28.817350387573242,-33.61869812011719,1
Carl is admiring himself.,Carl is admiring themselves.,morphology,anaphor_agreement,anaphor_number_agreement,True,True,False,True,387,-34.76587677001953,-34.908973693847656,1
Sandra hid herself.,Sandra hid themselves.,morphology,anaphor_agreement,anaphor_number_agreement,True,True,False,True,388,-36.672454833984375,-36.28303527832031,0
Those actors can't question themselves.,Those actors can't question itself.,morphology,anaphor_agreement,anaphor_number_agreement,True,True,False,True,389,-32.14189147949219,-34.84046936035156,1
Jerry is finding himself.,Jerry is finding themselves.,morphology,anaphor_agreement,anaphor_number_agreement,True,True,False,True,390,-22.601421356201172,-23.36215591430664,1
Roger does complain about himself.,Roger does complain about themselves.,morphology,anaphor_agreement,anaphor_number_agreement,True,True,False,True,391,-31.86186981201172,-30.8544921875,0
Amy has concealed herself.,Amy has concealed themselves.,morphology,anaphor_agreement,anaphor_number_agreement,True,True,False,True,392,-28.208377838134766,-27.031925201416016,0
Edward had distracted himself.,Edward had distracted themselves.,morphology,anaphor_agreement,anaphor_number_agreement,True,True,False,True,393,-26.17615509033203,-27.015031814575195,1
A lot of waitresses complained about themselves.,A lot of waitresses complained about himself.,morphology,anaphor_agreement,anaphor_number_agreement,True,True,False,True,394,-65.8603286743164,-67.34144592285156,1
Most customers won't hate themselves.,Most customers won't hate herself.,morphology,anaphor_agreement,anaphor_number_agreement,True,True,False,True,395,-35.93343734741211,-39.05662155151367,1
Candice liked herself.,Candice liked themselves.,morphology,anaphor_agreement,anaphor_number_agreement,True,True,False,True,396,-27.990339279174805,-25.87911033630371,0
Janet complained about herself.,Janet complained about themselves.,morphology,anaphor_agreement,anaphor_number_agreement,True,True,False,True,397,-35.70396423339844,-33.7086181640625,0
Maria was insulting herself.,Maria was insulting themselves.,morphology,anaphor_agreement,anaphor_number_agreement,True,True,False,True,398,-25.443309783935547,-26.63492202758789,1
All guys are approaching themselves.,All guys are approaching himself.,morphology,anaphor_agreement,anaphor_number_agreement,True,True,False,True,399,-28.414236068725586,-30.62774085998535,1
Most children admired themselves.,Most children admired himself.,morphology,anaphor_agreement,anaphor_number_agreement,True,True,False,True,400,-28.18305778503418,-31.258869171142578,1
A lot of committees have astounded themselves.,A lot of committees have astounded itself.,morphology,anaphor_agreement,anaphor_number_agreement,True,True,False,True,401,-58.89482498168945,-61.155311584472656,1
The Borgias investigated themselves.,The Borgias investigated herself.,morphology,anaphor_agreement,anaphor_number_agreement,True,True,False,True,402,-46.672119140625,-48.911216735839844,1
Those men question themselves.,Those men question herself.,morphology,anaphor_agreement,anaphor_number_agreement,True,True,False,True,403,-28.50208282470703,-33.29239273071289,1
Charles isn't annoying himself.,Charles isn't annoying themselves.,morphology,anaphor_agreement,anaphor_number_agreement,True,True,False,True,404,-27.893001556396484,-28.656883239746094,1
Some guys were concealing themselves.,Some guys were concealing itself.,morphology,anaphor_agreement,anaphor_number_agreement,True,True,False,True,405,-38.64591979980469,-42.39287185668945,1
These guests weren't boring themselves.,These guests weren't boring herself.,morphology,anaphor_agreement,anaphor_number_agreement,True,True,False,True,406,-32.281166076660156,-36.01527404785156,1
Carla can talk to herself.,Carla can talk to themselves.,morphology,anaphor_agreement,anaphor_number_agreement,True,True,False,True,407,-31.28681182861328,-30.179729461669922,0
A lot of teenagers hadn't attacked themselves.,A lot of teenagers hadn't attacked himself.,morphology,anaphor_agreement,anaphor_number_agreement,True,True,False,True,408,-54.91813278198242,-57.023529052734375,1
Some lady couldn't return to herself.,Some lady couldn't return to themselves.,morphology,anaphor_agreement,anaphor_number_agreement,True,True,False,True,409,-39.94010925292969,-38.2431755065918,0
A lot of associations do upset themselves.,A lot of associations do upset himself.,morphology,anaphor_agreement,anaphor_number_agreement,True,True,False,True,410,-52.83327102661133,-55.73543167114258,1
Some boys weren't concealing themselves.,Some boys weren't concealing himself.,morphology,anaphor_agreement,anaphor_number_agreement,True,True,False,True,411,-46.0169677734375,-48.27583312988281,1
Peter worried himself.,Peter worried themselves.,morphology,anaphor_agreement,anaphor_number_agreement,True,True,False,True,412,-22.728679656982422,-22.926660537719727,1
Cindy does praise herself.,Cindy does praise themselves.,morphology,anaphor_agreement,anaphor_number_agreement,True,True,False,True,413,-51.7626953125,-49.27093505859375,0
A book hasn't disagreed with itself.,A book hasn't disagreed with themselves.,morphology,anaphor_agreement,anaphor_number_agreement,True,True,False,True,414,-57.3153076171875,-55.13795852661133,0
