sentence_good,sentence_bad,field,linguistics_term,UID,simple_LM_method,one_prefix_method,two_prefix_method,lexically_identical,pair_id,good_prob,bad_prob,correct
Many patients that stunned Eric kissed themselves.,Many patients that stunned Eric kissed himself.,syntax_semantics,binding,principle_A_c_command,True,True,False,False,438,-54.91810989379883,-55.83027267456055,1
All essays that would stun Aaron would confuse themselves.,All essays that would stun Aaron would confuse himself.,syntax_semantics,binding,principle_A_c_command,True,True,False,False,439,-73.83634948730469,-74.97930908203125,1
Some boy who won't shock Jane wouldn't discover himself.,Some boy who won't shock Jane wouldn't discover herself.,syntax_semantics,binding,principle_A_c_command,True,True,False,False,440,-67.80311584472656,-69.58570861816406,1
Some guests who had worn this hat couldn't sound like themselves.,Some guests who had worn this hat couldn't sound like itself.,syntax_semantics,binding,principle_A_c_command,True,True,False,False,441,-73.76842498779297,-75.57363891601562,1
Some girl that wouldn't drive to the closets isn't insulting herself.,Some girl that wouldn't drive to the closets isn't insulting themselves.,syntax_semantics,binding,principle_A_c_command,True,True,False,False,442,-82.85301208496094,-81.38137817382812,0
Libraries that helped Florence described themselves.,Libraries that helped Florence described herself.,syntax_semantics,binding,principle_A_c_command,True,True,False,False,443,-60.97016906738281,-62.37029266357422,1
Some actresses that hired Debra aren't hugging themselves.,Some actresses that hired Debra aren't hugging herself.,syntax_semantics,binding,principle_A_c_command,True,True,False,False,444,-76.26251220703125,-78.69783020019531,1
That actress that referenced girls heals herself.,That actress that referenced girls heals themselves.,syntax_semantics,binding,principle_A_c_command,True,True,False,False,445,-67.5712661743164,-64.94203186035156,0
All college campuses that weren't impressing Mark can't scare themselves.,All college campuses that weren't impressing Mark can't scare himself.,syntax_semantics,binding,principle_A_c_command,True,True,False,False,446,-88.73419189453125,-89.59480285644531,1
These teenagers that conceal Mark were concealing themselves.,These teenagers that conceal Mark were concealing himself.,syntax_semantics,binding,principle_A_c_command,True,True,False,False,447,-76.53282928466797,-77.21951293945312,1
Every dancer who complained about every report listens to herself.,Every dancer who complained about every report listens to itself.,syntax_semantics,binding,principle_A_c_command,True,True,False,False,448,-67.11019897460938,-68.89594268798828,1
Waiters that impressed Marie knew themselves.,Waiters that impressed Marie knew herself.,syntax_semantics,binding,principle_A_c_command,True,True,False,False,449,-57.22188186645508,-59.73235321044922,1
The girl that shouldn't research some museums loves herself.,The girl that shouldn't research some museums loves themselves.,syntax_semantics,binding,principle_A_c_command,True,True,False,False,450,-71.86276245117188,-69.03935241699219,0
Some library that scared John boasted about itself.,Some library that scared John boasted about himself.,syntax_semantics,binding,principle_A_c_command,True,True,False,False,451,-64.28163146972656,-62.96434020996094,0
An actress who hasn't discussed a lot of cashiers was concealing herself.,An actress who hasn't discussed a lot of cashiers was concealing themselves.,syntax_semantics,binding,principle_A_c_command,True,True,False,False,452,-95.93927764892578,-94.62409210205078,0
Every mushroom that is bothering Keith hadn't annoyed itself.,Every mushroom that is bothering Keith hadn't annoyed himself.,syntax_semantics,binding,principle_A_c_command,True,True,False,False,453,-79.19979095458984,-78.1156005859375,0
Organizations that hurt Stephen hadn't argued about themselves.,Organizations that hurt Stephen hadn't argued about himself.,syntax_semantics,binding,principle_A_c_command,True,True,False,False,454,-68.5270767211914,-69.29524230957031,1
Some forks that astound Alexander hadn't bothered themselves.,Some forks that astound Alexander hadn't bothered himself.,syntax_semantics,binding,principle_A_c_command,True,True,False,False,455,-74.12423706054688,-75.26533508300781,1
A lot of girls that are bringing this window do care for themselves.,A lot of girls that are bringing this window do care for itself.,syntax_semantics,binding,principle_A_c_command,True,True,False,False,456,-80.21798706054688,-83.51251220703125,1
Some nose that had disturbed Carlos isn't shocking itself.,Some nose that had disturbed Carlos isn't shocking himself.,syntax_semantics,binding,principle_A_c_command,True,True,False,False,457,-82.7727279663086,-83.8788833618164,1
All drivers that walked through every mall helped themselves.,All drivers that walked through every mall helped itself.,syntax_semantics,binding,principle_A_c_command,True,True,False,False,458,-61.095062255859375,-64.17108154296875,1
Most stairs that aren't scaring Rachelle are aggravating themselves.,Most stairs that aren't scaring Rachelle are aggravating herself.,syntax_semantics,binding,principle_A_c_command,True,True,False,False,459,-88.23790740966797,-90.55329132080078,1
A girl that hadn't cleaned every tomato knows herself.,A girl that hadn't cleaned every tomato knows itself.,syntax_semantics,binding,principle_A_c_command,True,True,False,False,460,-82.60511779785156,-83.11552429199219,1
That gate that embarrassed Tiffany can't hurt itself.,That gate that embarrassed Tiffany can't hurt herself.,syntax_semantics,binding,principle_A_c_command,True,True,False,False,461,-70.49581146240234,-70.78097534179688,1
These ladies who won't explore every hospital cared for themselves.,These ladies who won't explore every hospital cared for itself.,syntax_semantics,binding,principle_A_c_command,True,True,False,False,462,-65.46693420410156,-68.18499755859375,1
A dancer who ascended hills is helping herself.,A dancer who ascended hills is helping themselves.,syntax_semantics,binding,principle_A_c_command,True,True,False,False,463,-74.71896362304688,-71.01325225830078,0
All committees that have talked about Vanessa should know themselves.,All committees that have talked about Vanessa should know herself.,syntax_semantics,binding,principle_A_c_command,True,True,False,False,464,-64.60472869873047,-67.07078552246094,1
That guy that shouldn't discuss some lakes leaves himself.,That guy that shouldn't discuss some lakes leaves themselves.,syntax_semantics,binding,principle_A_c_command,True,True,False,False,465,-66.38481140136719,-65.19424438476562,0
The actors that shouldn't tour that river watched themselves.,The actors that shouldn't tour that river watched itself.,syntax_semantics,binding,principle_A_c_command,True,True,False,False,466,-70.04055786132812,-71.42730712890625,1
These universities that appreciate every actress were worrying themselves.,These universities that appreciate every actress were worrying herself.,syntax_semantics,binding,principle_A_c_command,True,True,False,False,467,-67.48692321777344,-69.25932312011719,1
These horses that climbed down a mountain aren't finding themselves.,These horses that climbed down a mountain aren't finding itself.,syntax_semantics,binding,principle_A_c_command,True,True,False,False,468,-65.99781036376953,-68.6890640258789,1
Some teachers that observe Donald can't discover themselves.,Some teachers that observe Donald can't discover himself.,syntax_semantics,binding,principle_A_c_command,True,True,False,False,469,-62.58073043823242,-63.97224426269531,1
That play that wasn't boring Wayne sounds like itself.,That play that wasn't boring Wayne sounds like himself.,syntax_semantics,binding,principle_A_c_command,True,True,False,False,470,-69.66494750976562,-69.53115844726562,0
These girls who praised Colleen had forgotten themselves.,These girls who praised Colleen had forgotten herself.,syntax_semantics,binding,principle_A_c_command,True,True,False,False,471,-71.22392272949219,-74.14897918701172,1
That boy that hadn't attacked Becca had fired himself.,That boy that hadn't attacked Becca had fired herself.,syntax_semantics,binding,principle_A_c_command,True,True,False,False,472,-78.49021911621094,-79.66389465332031,1
A lot of birds that shocked this committee are bothering themselves.,A lot of birds that shocked this committee are bothering itself.,syntax_semantics,binding,principle_A_c_command,True,True,False,False,473,-77.65597534179688,-82.56924438476562,1
Those patients who discussed Frank have hugged themselves.,Those patients who discussed Frank have hugged himself.,syntax_semantics,binding,principle_A_c_command,True,True,False,False,474,-63.536739349365234,-65.1468505859375,1
All drivers who won't pass every bank weren't insulting themselves.,All drivers who won't pass every bank weren't insulting itself.,syntax_semantics,binding,principle_A_c_command,True,True,False,False,475,-78.841552734375,-81.01062774658203,1
Some guests who would tour the lake aren't arguing about themselves.,Some guests who would tour the lake aren't arguing about itself.,syntax_semantics,binding,principle_A_c_command,True,True,False,False,476,-75.41114044189453,-77.08711242675781,1
All girls that disgust Kathleen don't see themselves.,All girls that disgust Kathleen don't see herself.,syntax_semantics,binding,principle_A_c_command,True,True,False,False,477,-60.71063232421875,-65.07270050048828,1
The man who disturbs Sara was discovering himself.,The man who disturbs Sara was discovering herself.,syntax_semantics,binding,principle_A_c_command,True,True,False,False,478,-64.85408782958984,-66.35061645507812,1
This guy who can't observe Angela likes himself.,This guy who can't observe Angela likes herself.,syntax_semantics,binding,principle_A_c_command,True,True,False,False,479,-55.16284942626953,-56.97859191894531,1
Every lady who should tour a lake praises herself.,Every lady who should tour a lake praises itself.,syntax_semantics,binding,principle_A_c_command,True,True,False,False,480,-68.0613784790039,-67.32807922363281,0
The ladies who aren't messing up some restaurant shouldn't discuss themselves.,The ladies who aren't messing up some restaurant shouldn't discuss itself.,syntax_semantics,binding,principle_A_c_command,True,True,False,False,481,-77.0627212524414,-79.72582244873047,1
Most adults who hadn't irritated Craig had escaped from themselves.,Most adults who hadn't irritated Craig had escaped from himself.,syntax_semantics,binding,principle_A_c_command,True,True,False,False,482,-76.9830322265625,-78.27996826171875,1
Those girls who could see the icicle were hiring themselves.,Those girls who could see the icicle were hiring itself.,syntax_semantics,binding,principle_A_c_command,True,True,False,False,483,-69.51591491699219,-71.03181457519531,1
Pasta that was stunning Samantha has impressed itself.,Pasta that was stunning Samantha has impressed herself.,syntax_semantics,binding,principle_A_c_command,True,True,False,False,484,-72.0107650756836,-71.7470703125,0
Waiters who shocks Bill didn't conceal themselves.,Waiters who shocks Bill didn't conceal himself.,syntax_semantics,binding,principle_A_c_command,True,True,False,False,485,-65.85536193847656,-66.32594299316406,1
All cashiers that were firing Denise will disagree with themselves.,All cashiers that were firing Denise will disagree with herself.,syntax_semantics,binding,principle_A_c_command,True,True,False,False,486,-83.11541748046875,-85.91206359863281,1
A light that stuns Rose hasn't stunned itself.,A light that stuns Rose hasn't stunned herself.,syntax_semantics,binding,principle_A_c_command,True,True,False,False,487,-92.539306640625,-92.47421264648438,0
The legislature that wasn't describing Margaret hates itself.,The legislature that wasn't describing Margaret hates herself.,syntax_semantics,binding,principle_A_c_command,True,True,False,False,488,-69.24769592285156,-68.64559173583984,0
A lot of actors who were hiring Brian haven't fired themselves.,A lot of actors who were hiring Brian haven't fired himself.,syntax_semantics,binding,principle_A_c_command,True,True,False,False,489,-85.49217224121094,-84.94525909423828,0
This committee that shouldn't take all shoes discusses itself.,This committee that shouldn't take all shoes discusses themselves.,syntax_semantics,binding,principle_A_c_command,True,True,False,False,490,-69.01737213134766,-67.50773620605469,0
The man who astounded Rebecca appreciates himself.,The man who astounded Rebecca appreciates herself.,syntax_semantics,binding,principle_A_c_command,True,True,False,False,491,-68.44581604003906,-69.90763092041016,1
Some screen that wasn't aggravating Douglas has bored itself.,Some screen that wasn't aggravating Douglas has bored himself.,syntax_semantics,binding,principle_A_c_command,True,True,False,False,492,-80.71117401123047,-79.89950561523438,0
This screen that is disgusting Helen did bore itself.,This screen that is disgusting Helen did bore herself.,syntax_semantics,binding,principle_A_c_command,True,True,False,False,493,-76.42518615722656,-76.32289123535156,0
The children that hadn't climbed down the slope investigated themselves.,The children that hadn't climbed down the slope investigated itself.,syntax_semantics,binding,principle_A_c_command,True,True,False,False,494,-65.87809753417969,-67.2694091796875,1
Those art galleries that can't hurt Tara distracted themselves.,Those art galleries that can't hurt Tara distracted herself.,syntax_semantics,binding,principle_A_c_command,True,True,False,False,495,-75.01378631591797,-78.13890075683594,1
Those drivers who were boycotting that association insulted themselves.,Those drivers who were boycotting that association insulted itself.,syntax_semantics,binding,principle_A_c_command,True,True,False,False,496,-81.80047607421875,-83.96077728271484,1
Every mall that stuns these waitresses hadn't distracted itself.,Every mall that stuns these waitresses hadn't distracted themselves.,syntax_semantics,binding,principle_A_c_command,True,True,False,False,497,-99.91844177246094,-98.08477020263672,0
Some teachers who pass every hospital annoyed themselves.,Some teachers who pass every hospital annoyed itself.,syntax_semantics,binding,principle_A_c_command,True,True,False,False,498,-62.44081115722656,-63.869850158691406,1
The girl that was irritating Chad isn't fleeing from herself.,The girl that was irritating Chad isn't fleeing from himself.,syntax_semantics,binding,principle_A_c_command,True,True,False,False,499,-78.99806213378906,-77.95643615722656,0
The guests who escape from every movie theater healed themselves.,The guests who escape from every movie theater healed itself.,syntax_semantics,binding,principle_A_c_command,True,True,False,False,500,-76.05003356933594,-76.72801971435547,1
Many men that concealed Marie discovered themselves.,Many men that concealed Marie discovered herself.,syntax_semantics,binding,principle_A_c_command,True,True,False,False,501,-57.27007293701172,-60.41764831542969,1
Every bank that bothered Jerry is embarrassing itself.,Every bank that bothered Jerry is embarrassing himself.,syntax_semantics,binding,principle_A_c_command,True,True,False,False,502,-63.91002655029297,-63.75594711303711,0
Many cucumbers that embarrassed Diane weren't impressing themselves.,Many cucumbers that embarrassed Diane weren't impressing herself.,syntax_semantics,binding,principle_A_c_command,True,True,False,False,503,-89.03449249267578,-91.81379699707031,1
This boy who couldn't love a lot of actresses observes himself.,This boy who couldn't love a lot of actresses observes themselves.,syntax_semantics,binding,principle_A_c_command,True,True,False,False,504,-70.43659210205078,-69.90016174316406,0
All pedestrians that have boycotted Spain were disagreeing with themselves.,All pedestrians that have boycotted Spain were disagreeing with itself.,syntax_semantics,binding,principle_A_c_command,True,True,False,False,505,-100.36090087890625,-103.6886215209961,1
Those pedestrians that hadn't hated Lori had aggravated themselves.,Those pedestrians that hadn't hated Lori had aggravated herself.,syntax_semantics,binding,principle_A_c_command,True,True,False,False,506,-88.83395385742188,-91.71568298339844,1
That waitress that boycotts all associations hates herself.,That waitress that boycotts all associations hates themselves.,syntax_semantics,binding,principle_A_c_command,True,True,False,False,507,-91.36424255371094,-88.04600524902344,0
The museum that listens to Michelle praises itself.,The museum that listens to Michelle praises herself.,syntax_semantics,binding,principle_A_c_command,True,True,False,False,508,-57.427181243896484,-58.239540100097656,1
The men that had talked to Mitchell weren't describing themselves.,The men that had talked to Mitchell weren't describing himself.,syntax_semantics,binding,principle_A_c_command,True,True,False,False,509,-65.32789611816406,-66.12979125976562,1
Most patients that won't talk to Margaret healed themselves.,Most patients that won't talk to Margaret healed herself.,syntax_semantics,binding,principle_A_c_command,True,True,False,False,510,-62.916725158691406,-64.93326568603516,1
Some shirt that aggravated Kevin scares itself.,Some shirt that aggravated Kevin scares himself.,syntax_semantics,binding,principle_A_c_command,True,True,False,False,511,-66.69630432128906,-63.98554611206055,0
Most committees that shocked Andrew had hated themselves.,Most committees that shocked Andrew had hated himself.,syntax_semantics,binding,principle_A_c_command,True,True,False,False,512,-63.77463912963867,-64.89742279052734,1
All sketches that have scared Sharon aren't disturbing themselves.,All sketches that have scared Sharon aren't disturbing herself.,syntax_semantics,binding,principle_A_c_command,True,True,False,False,513,-76.71647644042969,-78.8150634765625,1
This actress that complains about some ladies discusses herself.,This actress that complains about some ladies discusses themselves.,syntax_semantics,binding,principle_A_c_command,True,True,False,False,514,-75.35931396484375,-71.87164306640625,0
A lot of guys that wouldn't dislike Brad aren't approaching themselves.,A lot of guys that wouldn't dislike Brad aren't approaching himself.,syntax_semantics,binding,principle_A_c_command,True,True,False,False,515,-90.07978820800781,-92.03471374511719,1
A lot of drivers that hadn't disturbed Thomas haven't questioned themselves.,A lot of drivers that hadn't disturbed Thomas haven't questioned himself.,syntax_semantics,binding,principle_A_c_command,True,True,False,False,516,-90.9500732421875,-93.646240234375,1
A lot of legislatures that had scared Nicole aren't appreciating themselves.,A lot of legislatures that had scared Nicole aren't appreciating herself.,syntax_semantics,binding,principle_A_c_command,True,True,False,False,517,-101.40220642089844,-102.98431396484375,1
Every man that has complained about Sally is revealing himself.,Every man that has complained about Sally is revealing herself.,syntax_semantics,binding,principle_A_c_command,True,True,False,False,518,-64.8409194946289,-65.86646270751953,1
Some universities that worried Ellen disturbed themselves.,Some universities that worried Ellen disturbed herself.,syntax_semantics,binding,principle_A_c_command,True,True,False,False,519,-58.358028411865234,-61.613319396972656,1
That actress who won't clean some sock should notice herself.,That actress who won't clean some sock should notice itself.,syntax_semantics,binding,principle_A_c_command,True,True,False,False,520,-78.51577758789062,-78.15621948242188,0
This lady who had fired Timothy attacks herself.,This lady who had fired Timothy attacks himself.,syntax_semantics,binding,principle_A_c_command,True,True,False,False,521,-59.40455627441406,-58.6841926574707,0
The tomato that won't embarrass Emily isn't stunning itself.,The tomato that won't embarrass Emily isn't stunning herself.,syntax_semantics,binding,principle_A_c_command,True,True,False,False,522,-79.10153198242188,-79.1422119140625,1
That mall that doesn't look like most sketches was disturbing itself.,That mall that doesn't look like most sketches was disturbing themselves.,syntax_semantics,binding,principle_A_c_command,True,True,False,False,523,-79.46986389160156,-77.49378967285156,0
This dancer that alarmed Samuel does cure herself.,This dancer that alarmed Samuel does cure himself.,syntax_semantics,binding,principle_A_c_command,True,True,False,False,524,-71.52177429199219,-70.02374267578125,0
A lot of dancers who didn't disgust Rachel weren't boasting about themselves.,A lot of dancers who didn't disgust Rachel weren't boasting about herself.,syntax_semantics,binding,principle_A_c_command,True,True,False,False,525,-110.13954162597656,-112.66534423828125,1
All organizations that stunned Danielle don't hire themselves.,All organizations that stunned Danielle don't hire herself.,syntax_semantics,binding,principle_A_c_command,True,True,False,False,526,-67.16241455078125,-71.46233367919922,1
Some commentary that isn't confusing Melissa would confuse itself.,Some commentary that isn't confusing Melissa would confuse herself.,syntax_semantics,binding,principle_A_c_command,True,True,False,False,527,-77.91615295410156,-77.35808563232422,0
Some men who can't bike to the library aren't approaching themselves.,Some men who can't bike to the library aren't approaching itself.,syntax_semantics,binding,principle_A_c_command,True,True,False,False,528,-69.02078247070312,-72.1319580078125,1
Every girl that hasn't skated around this mall visits herself.,Every girl that hasn't skated around this mall visits itself.,syntax_semantics,binding,principle_A_c_command,True,True,False,False,529,-82.2037582397461,-81.3019790649414,0
This woman that was researching the hospitals isn't firing herself.,This woman that was researching the hospitals isn't firing themselves.,syntax_semantics,binding,principle_A_c_command,True,True,False,False,530,-70.44659423828125,-68.49674987792969,0
Some government that fires many teenagers couldn't argue about itself.,Some government that fires many teenagers couldn't argue about themselves.,syntax_semantics,binding,principle_A_c_command,True,True,False,False,531,-70.14056396484375,-67.92976379394531,0
Every woman who had discussed Liam loves herself.,Every woman who had discussed Liam loves himself.,syntax_semantics,binding,principle_A_c_command,True,True,False,False,532,-57.64453887939453,-55.73295211791992,0
A lot of students that exit every cafe were thinking about themselves.,A lot of students that exit every cafe were thinking about itself.,syntax_semantics,binding,principle_A_c_command,True,True,False,False,533,-82.28213500976562,-84.38412475585938,1
Most ladies that bothers Patricia talked about themselves.,Most ladies that bothers Patricia talked about herself.,syntax_semantics,binding,principle_A_c_command,True,True,False,False,534,-55.70296859741211,-58.402854919433594,1
All photographs that annoyed Diane haven't annoyed themselves.,All photographs that annoyed Diane haven't annoyed herself.,syntax_semantics,binding,principle_A_c_command,True,True,False,False,535,-74.89033508300781,-76.64429473876953,1
All reports that hadn't sounded like Danielle shouldn't disagree with themselves.,All reports that hadn't sounded like Danielle shouldn't disagree with herself.,syntax_semantics,binding,principle_A_c_command,True,True,False,False,536,-81.46617889404297,-84.04017639160156,1
This museum that shouldn't bore Elizabeth scares itself.,This museum that shouldn't bore Elizabeth scares herself.,syntax_semantics,binding,principle_A_c_command,True,True,False,False,537,-66.30865478515625,-65.41463470458984,0
A report that hadn't sounded like most guests sounds like itself.,A report that hadn't sounded like most guests sounds like themselves.,syntax_semantics,binding,principle_A_c_command,True,True,False,False,538,-85.90045928955078,-84.08082580566406,0
Every girl who described Joel isn't attacking herself.,Every girl who described Joel isn't attacking himself.,syntax_semantics,binding,principle_A_c_command,True,True,False,False,539,-63.87372970581055,-62.23863983154297,0
Some man who hasn't fired Kathleen cures himself.,Some man who hasn't fired Kathleen cures herself.,syntax_semantics,binding,principle_A_c_command,True,True,False,False,540,-66.44828796386719,-67.56794738769531,1
Guys who can embarrass Liam cured themselves.,Guys who can embarrass Liam cured himself.,syntax_semantics,binding,principle_A_c_command,True,True,False,False,541,-58.219886779785156,-59.13496398925781,1
A lot of boys that embarrassed Joel have hugged themselves.,A lot of boys that embarrassed Joel have hugged himself.,syntax_semantics,binding,principle_A_c_command,True,True,False,False,542,-82.59867858886719,-84.9494400024414,1
All men who disgusted Rhonda aren't watching themselves.,All men who disgusted Rhonda aren't watching herself.,syntax_semantics,binding,principle_A_c_command,True,True,False,False,543,-72.49749755859375,-76.08446502685547,1
Some organizations that had every fish hadn't talked to themselves.,Some organizations that had every fish hadn't talked to itself.,syntax_semantics,binding,principle_A_c_command,True,True,False,False,544,-60.162315368652344,-63.7315788269043,1
Some senators that do alarm Steven boasted about themselves.,Some senators that do alarm Steven boasted about himself.,syntax_semantics,binding,principle_A_c_command,True,True,False,False,545,-75.33738708496094,-75.71332550048828,1
Some hospital that is working with Theodore admired itself.,Some hospital that is working with Theodore admired himself.,syntax_semantics,binding,principle_A_c_command,True,True,False,False,546,-64.7234115600586,-65.13255310058594,1
