sentence_good,sentence_bad,field,linguistics_term,UID,simple_LM_method,one_prefix_method,two_prefix_method,lexically_identical,pair_id,good_prob,bad_prob,correct
A lot of dancers cured this boy.,A lot of dancers cured this boys.,morphology,determiner_noun_agreement,determiner_noun_agreement_1,True,True,False,True,256,-58.222904205322266,-59.20466232299805,1
Tiffany hadn't distracted this patient.,Tiffany hadn't distracted this patients.,morphology,determiner_noun_agreement,determiner_noun_agreement_1,True,True,False,True,257,-64.97266387939453,-65.57933044433594,1
Students sell that rug.,Students sell that rugs.,morphology,determiner_noun_agreement,determiner_noun_agreement_1,True,True,False,True,258,-25.429718017578125,-29.000900268554688,1
Christopher concealed this art gallery.,Christopher concealed this art galleries.,morphology,determiner_noun_agreement,determiner_noun_agreement_1,True,True,False,True,259,-45.07627487182617,-43.321617126464844,0
These guys admired that school.,These guys admired that schools.,morphology,determiner_noun_agreement,determiner_noun_agreement_1,True,True,False,True,260,-30.483606338500977,-32.29304504394531,1
Rugs astound that association.,Rugs astound that associations.,morphology,determiner_noun_agreement,determiner_noun_agreement_1,True,True,False,True,261,-60.2712516784668,-59.244972229003906,0
Robert wasn't scaring these museums.,Robert wasn't scaring these museum.,morphology,determiner_noun_agreement,determiner_noun_agreement_1,True,True,False,True,262,-42.09263610839844,-42.449100494384766,1
Kendra investigates these ladies.,Kendra investigates these lady.,morphology,determiner_noun_agreement,determiner_noun_agreement_1,True,True,False,True,263,-57.074615478515625,-57.930946350097656,1
A lot of ladies arrive at that museum.,A lot of ladies arrive at that museums.,morphology,determiner_noun_agreement,determiner_noun_agreement_1,True,True,False,True,264,-52.67268371582031,-56.01130676269531,1
Some pedestrians drive to this movie theater.,Some pedestrians drive to this movie theaters.,morphology,determiner_noun_agreement,determiner_noun_agreement_1,True,True,False,True,265,-47.7416877746582,-47.867530822753906,1
Tonya hasn't remembered that brochure.,Tonya hasn't remembered that brochures.,morphology,determiner_noun_agreement,determiner_noun_agreement_1,True,True,False,True,266,-55.21528625488281,-53.813377380371094,0
Museums hadn't disturbed that patient.,Museums hadn't disturbed that patients.,morphology,determiner_noun_agreement,determiner_noun_agreement_1,True,True,False,True,267,-65.19066619873047,-65.88917541503906,1
Every person left that actress.,Every person left that actresses.,morphology,determiner_noun_agreement,determiner_noun_agreement_1,True,True,False,True,268,-30.96514892578125,-30.505083084106445,0
Sandra should disgust that actor.,Sandra should disgust that actors.,morphology,determiner_noun_agreement,determiner_noun_agreement_1,True,True,False,True,269,-59.59861755371094,-60.40985870361328,1
Amelia is disgusting these ladies.,Amelia is disgusting these lady.,morphology,determiner_noun_agreement,determiner_noun_agreement_1,True,True,False,True,270,-46.6865119934082,-48.43788146972656,1
Carla isn't taking those sketches.,Carla isn't taking those sketch.,morphology,determiner_noun_agreement,determiner_noun_agreement_1,True,True,False,True,271,-43.11562728881836,-42.72537612915039,0
Florence was investigating these actors.,Florence was investigating these actor.,morphology,determiner_noun_agreement,determiner_noun_agreement_1,True,True,False,True,272,-48.029659271240234,-49.8584098815918,1
Many cashiers disagree with those cashiers.,Many cashiers disagree with those cashier.,morphology,determiner_noun_agreement,determiner_noun_agreement_1,True,True,False,True,273,-61.64366149902344,-62.03374481201172,1
These committees argue about this commentary.,These committees argue about this commentaries.,morphology,determiner_noun_agreement,determiner_noun_agreement_1,True,True,False,True,274,-42.237144470214844,-49.72556686401367,1
Brian sees those horses.,Brian sees those horse.,morphology,determiner_noun_agreement,determiner_noun_agreement_1,True,True,False,True,275,-24.601503372192383,-26.600887298583984,1
Candice hasn't explored this art gallery.,Candice hasn't explored this art galleries.,morphology,determiner_noun_agreement,determiner_noun_agreement_1,True,True,False,True,276,-57.31827163696289,-57.35441207885742,1
Aaron walks through those art galleries.,Aaron walks through those art gallery.,morphology,determiner_noun_agreement,determiner_noun_agreement_1,True,True,False,True,277,-41.893310546875,-44.272708892822266,1
Some books alarm that cashier.,Some books alarm that cashiers.,morphology,determiner_noun_agreement,determiner_noun_agreement_1,True,True,False,True,278,-48.915008544921875,-49.86176681518555,1
Raymond wasn't kissing that guest.,Raymond wasn't kissing that guests.,morphology,determiner_noun_agreement,determiner_noun_agreement_1,True,True,False,True,279,-46.86177062988281,-48.18510437011719,1
Some cashier might boycott that art gallery.,Some cashier might boycott that art galleries.,morphology,determiner_noun_agreement,determiner_noun_agreement_1,True,True,False,True,280,-72.24161529541016,-70.69105529785156,0
Winston Churchill hadn't hidden this adult.,Winston Churchill hadn't hidden this adults.,morphology,determiner_noun_agreement,determiner_noun_agreement_1,True,True,False,True,281,-61.017608642578125,-59.80174255371094,0
Jennifer skates around this public park.,Jennifer skates around this public parks.,morphology,determiner_noun_agreement,determiner_noun_agreement_1,True,True,False,True,282,-45.31214141845703,-45.898563385009766,1
Ruth doesn't flee from those malls.,Ruth doesn't flee from those mall.,morphology,determiner_noun_agreement,determiner_noun_agreement_1,True,True,False,True,283,-62.608062744140625,-59.20118713378906,0
Some waiters have known those guests.,Some waiters have known those guest.,morphology,determiner_noun_agreement,determiner_noun_agreement_1,True,True,False,True,284,-51.40145492553711,-54.03208923339844,1
Patricia thinks about that legislature.,Patricia thinks about that legislatures.,morphology,determiner_noun_agreement,determiner_noun_agreement_1,True,True,False,True,285,-42.96722412109375,-43.7977409362793,1
Every patient shouldn't drive to these schools.,Every patient shouldn't drive to these school.,morphology,determiner_noun_agreement,determiner_noun_agreement_1,True,True,False,True,286,-42.3526496887207,-44.40943908691406,1
Most boys hadn't disagreed with those books.,Most boys hadn't disagreed with those book.,morphology,determiner_noun_agreement,determiner_noun_agreement_1,True,True,False,True,287,-48.54189682006836,-52.11058044433594,1
Mark fled from those guys.,Mark fled from those guy.,morphology,determiner_noun_agreement,determiner_noun_agreement_1,True,True,False,True,288,-30.43726348876953,-33.84326934814453,1
Grace should break these cups.,Grace should break these cup.,morphology,determiner_noun_agreement,determiner_noun_agreement_1,True,True,False,True,289,-39.026580810546875,-40.03833770751953,1
Carrie passes those restaurants.,Carrie passes those restaurant.,morphology,determiner_noun_agreement,determiner_noun_agreement_1,True,True,False,True,290,-36.63671112060547,-39.10386657714844,1
Anne was returning to these guys.,Anne was returning to these guy.,morphology,determiner_noun_agreement,determiner_noun_agreement_1,True,True,False,True,291,-30.287914276123047,-34.247833251953125,1
Craig could disturb those teenagers.,Craig could disturb those teenager.,morphology,determiner_noun_agreement,determiner_noun_agreement_1,True,True,False,True,292,-34.020538330078125,-37.58661651611328,1
Linda has this rabbit.,Linda has this rabbits.,morphology,determiner_noun_agreement,determiner_noun_agreement_1,True,True,False,True,293,-38.441287994384766,-39.408443450927734,1
Christopher does pass this hospital.,Christopher does pass this hospitals.,morphology,determiner_noun_agreement,determiner_noun_agreement_1,True,True,False,True,294,-35.480777740478516,-36.62885284423828,1
Mitchell wasn't embarrassing these adults.,Mitchell wasn't embarrassing these adult.,morphology,determiner_noun_agreement,determiner_noun_agreement_1,True,True,False,True,295,-52.23248291015625,-56.10301208496094,1
These senators clean these grocery stores.,These senators clean these grocery store.,morphology,determiner_noun_agreement,determiner_noun_agreement_1,True,True,False,True,296,-49.118778228759766,-50.603126525878906,1
Cynthia should complain about those actresses.,Cynthia should complain about those actress.,morphology,determiner_noun_agreement,determiner_noun_agreement_1,True,True,False,True,297,-68.87191772460938,-71.32421112060547,1
Curtis hasn't praised these boys.,Curtis hasn't praised these boy.,morphology,determiner_noun_agreement,determiner_noun_agreement_1,True,True,False,True,298,-61.96434020996094,-66.20984649658203,1
Florence listened to that patient.,Florence listened to that patients.,morphology,determiner_noun_agreement,determiner_noun_agreement_1,True,True,False,True,299,-41.67377471923828,-42.8804817199707,1
Jodi might break these chairs.,Jodi might break these chair.,morphology,determiner_noun_agreement,determiner_noun_agreement_1,True,True,False,True,300,-46.71186065673828,-48.31174850463867,1
Sherry forgot that play.,Sherry forgot that plays.,morphology,determiner_noun_agreement,determiner_noun_agreement_1,True,True,False,True,301,-44.08377456665039,-43.808990478515625,0
Clyde hasn't loved these boys.,Clyde hasn't loved these boy.,morphology,determiner_noun_agreement,determiner_noun_agreement_1,True,True,False,True,302,-61.25349426269531,-64.97620391845703,1
A lot of hats aggravate that legislature.,A lot of hats aggravate that legislatures.,morphology,determiner_noun_agreement,determiner_noun_agreement_1,True,True,False,True,303,-67.13986206054688,-67.8645248413086,1
Ellen will look like those prints.,Ellen will look like those print.,morphology,determiner_noun_agreement,determiner_noun_agreement_1,True,True,False,True,304,-37.186744689941406,-38.957244873046875,1
April wasn't examining those reports.,April wasn't examining those report.,morphology,determiner_noun_agreement,determiner_noun_agreement_1,True,True,False,True,305,-38.393646240234375,-41.28101348876953,1
Diana isn't selling that car.,Diana isn't selling that cars.,morphology,determiner_noun_agreement,determiner_noun_agreement_1,True,True,False,True,306,-46.517677307128906,-48.950077056884766,1
Christina knew this doctor.,Christina knew this doctors.,morphology,determiner_noun_agreement,determiner_noun_agreement_1,True,True,False,True,307,-34.822784423828125,-36.845558166503906,1
Catherine wouldn't research these universities.,Catherine wouldn't research these university.,morphology,determiner_noun_agreement,determiner_noun_agreement_1,True,True,False,True,308,-53.28646469116211,-55.0999755859375,1
Those customers weren't researching this government.,Those customers weren't researching this governments.,morphology,determiner_noun_agreement,determiner_noun_agreement_1,True,True,False,True,309,-41.50823211669922,-45.286224365234375,1
All doctors know that student.,All doctors know that students.,morphology,determiner_noun_agreement,determiner_noun_agreement_1,True,True,False,True,310,-32.01947021484375,-31.628150939941406,0
Tonya has insulted that play.,Tonya has insulted that plays.,morphology,determiner_noun_agreement,determiner_noun_agreement_1,True,True,False,True,311,-39.653480529785156,-39.3223876953125,0
Those documentaries were disagreeing with that lady.,Those documentaries were disagreeing with that ladies.,morphology,determiner_noun_agreement,determiner_noun_agreement_1,True,True,False,True,312,-52.50566864013672,-54.838985443115234,1
An organization had respected that doctor.,An organization had respected that doctors.,morphology,determiner_noun_agreement,determiner_noun_agreement_1,True,True,False,True,313,-42.79567337036133,-42.48540496826172,0
Timothy explores this restaurant.,Timothy explores this restaurants.,morphology,determiner_noun_agreement,determiner_noun_agreement_1,True,True,False,True,314,-35.48335647583008,-39.709442138671875,1
Sarah hires this waiter.,Sarah hires this waiters.,morphology,determiner_noun_agreement,determiner_noun_agreement_1,True,True,False,True,315,-34.35243225097656,-41.493900299072266,1
Kendra exits this art gallery.,Kendra exits this art galleries.,morphology,determiner_noun_agreement,determiner_noun_agreement_1,True,True,False,True,316,-65.07257843017578,-63.29150390625,0
Natalie concealed this hospital.,Natalie concealed this hospitals.,morphology,determiner_noun_agreement,determiner_noun_agreement_1,True,True,False,True,317,-49.96101379394531,-50.939239501953125,1
Amelia was impressing this company.,Amelia was impressing this companies.,morphology,determiner_noun_agreement,determiner_noun_agreement_1,True,True,False,True,318,-46.884437561035156,-50.40973663330078,1
Wendy hadn't scared that bank.,Wendy hadn't scared that banks.,morphology,determiner_noun_agreement,determiner_noun_agreement_1,True,True,False,True,319,-54.59882354736328,-56.473731994628906,1
Mark will cure those guys.,Mark will cure those guy.,morphology,determiner_noun_agreement,determiner_noun_agreement_1,True,True,False,True,320,-30.03779411315918,-33.16529846191406,1
Spain was describing those actors.,Spain was describing those actor.,morphology,determiner_noun_agreement,determiner_noun_agreement_1,True,True,False,True,321,-33.5173225402832,-35.24058532714844,1
Allison talked about those schools.,Allison talked about those school.,morphology,determiner_noun_agreement,determiner_noun_agreement_1,True,True,False,True,322,-35.34406280517578,-38.020652770996094,1
William buys those jackets.,William buys those jacket.,morphology,determiner_noun_agreement,determiner_noun_agreement_1,True,True,False,True,323,-31.471820831298828,-32.07067108154297,1
Timothy escaped from that cashier.,Timothy escaped from that cashiers.,morphology,determiner_noun_agreement,determiner_noun_agreement_1,True,True,False,True,324,-47.56932830810547,-47.89680862426758,1
Susan isn't fixing those couches.,Susan isn't fixing those couch.,morphology,determiner_noun_agreement,determiner_noun_agreement_1,True,True,False,True,325,-42.7496337890625,-36.886802673339844,0
Tonya boasts about this patient.,Tonya boasts about this patients.,morphology,determiner_noun_agreement,determiner_noun_agreement_1,True,True,False,True,326,-42.367431640625,-43.010887145996094,1
Stephanie talked to those cashiers.,Stephanie talked to those cashier.,morphology,determiner_noun_agreement,determiner_noun_agreement_1,True,True,False,True,327,-46.95319366455078,-46.90159606933594,0
Those children describe those pedestrians.,Those children describe those pedestrian.,morphology,determiner_noun_agreement,determiner_noun_agreement_1,True,True,False,True,328,-36.06684875488281,-36.18008041381836,1
Sara would embarrass that guest.,Sara would embarrass that guests.,morphology,determiner_noun_agreement,determiner_noun_agreement_1,True,True,False,True,329,-50.260711669921875,-50.84716033935547,1
Rebecca complained about that brochure.,Rebecca complained about that brochures.,morphology,determiner_noun_agreement,determiner_noun_agreement_1,True,True,False,True,330,-48.067718505859375,-46.88652038574219,0
Amelia has thought about those horses.,Amelia has thought about those horse.,morphology,determiner_noun_agreement,determiner_noun_agreement_1,True,True,False,True,331,-40.9818000793457,-42.93070983886719,1
Those books were astounding that government.,Those books were astounding that governments.,morphology,determiner_noun_agreement,determiner_noun_agreement_1,True,True,False,True,332,-42.030677795410156,-44.38702392578125,1
Most waiters weren't watching that lady.,Most waiters weren't watching that ladies.,morphology,determiner_noun_agreement,determiner_noun_agreement_1,True,True,False,True,333,-48.411014556884766,-50.67793273925781,1
Alan had cleaned that plate.,Alan had cleaned that plates.,morphology,determiner_noun_agreement,determiner_noun_agreement_1,True,True,False,True,334,-28.894784927368164,-31.76941680908203,1
Benjamin cured that turtle.,Benjamin cured that turtles.,morphology,determiner_noun_agreement,determiner_noun_agreement_1,True,True,False,True,335,-41.83045196533203,-43.0462646484375,1
Melanie isn't scanning those reports.,Melanie isn't scanning those report.,morphology,determiner_noun_agreement,determiner_noun_agreement_1,True,True,False,True,336,-47.57292556762695,-50.77015686035156,1
Beverly is hiding this skirt.,Beverly is hiding this skirts.,morphology,determiner_noun_agreement,determiner_noun_agreement_1,True,True,False,True,337,-56.698524475097656,-59.686771392822266,1
Some waiter should praise that newspaper article.,Some waiter should praise that newspaper articles.,morphology,determiner_noun_agreement,determiner_noun_agreement_1,True,True,False,True,338,-55.86444091796875,-57.410682678222656,1
Janet helped these doctors.,Janet helped these doctor.,morphology,determiner_noun_agreement,determiner_noun_agreement_1,True,True,False,True,339,-36.86036682128906,-38.85194396972656,1
Judy impressed these universities.,Judy impressed these university.,morphology,determiner_noun_agreement,determiner_noun_agreement_1,True,True,False,True,340,-37.66119384765625,-38.66545104980469,1
The Impressionists complain about those children.,The Impressionists complain about those child.,morphology,determiner_noun_agreement,determiner_noun_agreement_1,True,True,False,True,341,-58.06503677368164,-62.01567459106445,1
The Clintons help these guys.,The Clintons help these guy.,morphology,determiner_noun_agreement,determiner_noun_agreement_1,True,True,False,True,342,-40.93026351928711,-44.37932586669922,1
These prints look like those art galleries.,These prints look like those art gallery.,morphology,determiner_noun_agreement,determiner_noun_agreement_1,True,True,False,True,343,-47.41979217529297,-49.91680145263672,1
Every picture looks like those scarves.,Every picture looks like those scarf.,morphology,determiner_noun_agreement,determiner_noun_agreement_1,True,True,False,True,344,-44.76122283935547,-40.008907318115234,0
Claire has researched that print.,Claire has researched that prints.,morphology,determiner_noun_agreement,determiner_noun_agreement_1,True,True,False,True,345,-41.968177795410156,-42.286067962646484,1
Roger isn't watching these teachers.,Roger isn't watching these teacher.,morphology,determiner_noun_agreement,determiner_noun_agreement_1,True,True,False,True,346,-32.71332550048828,-35.36530685424805,1
These patients exit these restaurants.,These patients exit these restaurant.,morphology,determiner_noun_agreement,determiner_noun_agreement_1,True,True,False,True,347,-35.88080978393555,-38.95384979248047,1
Stephanie wasn't talking to these cashiers.,Stephanie wasn't talking to these cashier.,morphology,determiner_noun_agreement,determiner_noun_agreement_1,True,True,False,True,348,-55.164241790771484,-54.91956329345703,0
Amelia was scanning those stories.,Amelia was scanning those story.,morphology,determiner_noun_agreement,determiner_noun_agreement_1,True,True,False,True,349,-44.15445327758789,-47.650047302246094,1
Some actor shouldn't care for those senators.,Some actor shouldn't care for those senator.,morphology,determiner_noun_agreement,determiner_noun_agreement_1,True,True,False,True,350,-50.2567138671875,-47.32295608520508,0
Kristin was embarrassing these waitresses.,Kristin was embarrassing these waitress.,morphology,determiner_noun_agreement,determiner_noun_agreement_1,True,True,False,True,351,-58.512996673583984,-48.49345397949219,0
Every committee should dislike those banks.,Every committee should dislike those bank.,morphology,determiner_noun_agreement,determiner_noun_agreement_1,True,True,False,True,352,-43.316062927246094,-44.668800354003906,1
Ruth couldn't scare these patients.,Ruth couldn't scare these patient.,morphology,determiner_noun_agreement,determiner_noun_agreement_1,True,True,False,True,353,-51.68913269042969,-54.15180969238281,1
Jerry isn't fixing these glasses.,Jerry isn't fixing these glass.,morphology,determiner_noun_agreement,determiner_noun_agreement_1,True,True,False,True,354,-35.28868103027344,-34.770179748535156,0
Katherine hasn't gone to these banks.,Katherine hasn't gone to these bank.,morphology,determiner_noun_agreement,determiner_noun_agreement_1,True,True,False,True,355,-47.57505798339844,-47.98870849609375,1
That report stuns this organization.,That report stuns this organizations.,morphology,determiner_noun_agreement,determiner_noun_agreement_1,True,True,False,True,356,-46.554595947265625,-49.953216552734375,1
Daniel conceals these waitresses.,Daniel conceals these waitress.,morphology,determiner_noun_agreement,determiner_noun_agreement_1,True,True,False,True,357,-53.38723373413086,-44.582035064697266,0
Stacey disturbed these doctors.,Stacey disturbed these doctor.,morphology,determiner_noun_agreement,determiner_noun_agreement_1,True,True,False,True,358,-48.85152053833008,-50.830108642578125,1
Some teenagers arrived at that bank.,Some teenagers arrived at that banks.,morphology,determiner_noun_agreement,determiner_noun_agreement_1,True,True,False,True,359,-33.47846984863281,-36.12016296386719,1
Jessica has this glove.,Jessica has this gloves.,morphology,determiner_noun_agreement,determiner_noun_agreement_1,True,True,False,True,360,-25.32500457763672,-23.574756622314453,0
Gerald researches that hospital.,Gerald researches that hospitals.,morphology,determiner_noun_agreement,determiner_noun_agreement_1,True,True,False,True,361,-57.30633544921875,-58.213111877441406,1
Julia might think about this waitress.,Julia might think about this waitresses.,morphology,determiner_noun_agreement,determiner_noun_agreement_1,True,True,False,True,362,-40.63515090942383,-50.53171157836914,1
Some pedestrian had worried that guest.,Some pedestrian had worried that guests.,morphology,determiner_noun_agreement,determiner_noun_agreement_1,True,True,False,True,363,-50.57133865356445,-51.318023681640625,1
Colleen did reveal those skirts.,Colleen did reveal those skirt.,morphology,determiner_noun_agreement,determiner_noun_agreement_1,True,True,False,True,364,-50.36309051513672,-50.64892578125,1
All cashiers clean that snake.,All cashiers clean that snakes.,morphology,determiner_noun_agreement,determiner_noun_agreement_1,True,True,False,True,365,-50.593223571777344,-50.44971466064453,0
Those companies praise that actress.,Those companies praise that actresses.,morphology,determiner_noun_agreement,determiner_noun_agreement_1,True,True,False,True,366,-39.224998474121094,-37.84272766113281,0
Natalie isn't selling this nose.,Natalie isn't selling this noses.,morphology,determiner_noun_agreement,determiner_noun_agreement_1,True,True,False,True,367,-50.62422561645508,-53.84577941894531,1
Samuel will hurt that actor.,Samuel will hurt that actors.,morphology,determiner_noun_agreement,determiner_noun_agreement_1,True,True,False,True,368,-35.22576141357422,-36.170928955078125,1
Thomas has disturbed this boy.,Thomas has disturbed this boys.,morphology,determiner_noun_agreement,determiner_noun_agreement_1,True,True,False,True,369,-32.66529083251953,-34.85683059692383,1
Sally will pass these grocery stores.,Sally will pass these grocery store.,morphology,determiner_noun_agreement,determiner_noun_agreement_1,True,True,False,True,370,-54.39569091796875,-55.81912612915039,1
That convertible annoyed that company.,That convertible annoyed that companies.,morphology,determiner_noun_agreement,determiner_noun_agreement_1,True,True,False,True,371,-46.92808532714844,-48.44950866699219,1
Most guys see those dresses.,Most guys see those dress.,morphology,determiner_noun_agreement,determiner_noun_agreement_1,True,True,False,True,372,-32.572906494140625,-33.023189544677734,1
Most patients had forgotten those actors.,Most patients had forgotten those actor.,morphology,determiner_noun_agreement,determiner_noun_agreement_1,True,True,False,True,373,-41.98308563232422,-44.745140075683594,1
Most vases alarm that driver.,Most vases alarm that drivers.,morphology,determiner_noun_agreement,determiner_noun_agreement_1,True,True,False,True,374,-51.688446044921875,-51.25651550292969,0
This shirt astounded those senators.,This shirt astounded those senator.,morphology,determiner_noun_agreement,determiner_noun_agreement_1,True,True,False,True,375,-55.64501190185547,-54.5775146484375,0
Laura has attacked this teenager.,Laura has attacked this teenagers.,morphology,determiner_noun_agreement,determiner_noun_agreement_1,True,True,False,True,376,-33.28881072998047,-34.48139190673828,1
This senator might boycott that restaurant.,This senator might boycott that restaurants.,morphology,determiner_noun_agreement,determiner_noun_agreement_1,True,True,False,True,377,-51.92169189453125,-53.254066467285156,1
A lot of actors bother those teachers.,A lot of actors bother those teacher.,morphology,determiner_noun_agreement,determiner_noun_agreement_1,True,True,False,True,378,-54.11805725097656,-55.8179931640625,1
A banana embarrassed those actresses.,A banana embarrassed those actress.,morphology,determiner_noun_agreement,determiner_noun_agreement_1,True,True,False,True,379,-51.2551383972168,-53.674407958984375,1
That cucumber did confuse that boy.,That cucumber did confuse that boys.,morphology,determiner_noun_agreement,determiner_noun_agreement_1,True,True,False,True,380,-56.016475677490234,-57.1899299621582,1
Joseph isn't concealing these students.,Joseph isn't concealing these student.,morphology,determiner_noun_agreement,determiner_noun_agreement_1,True,True,False,True,381,-50.73432922363281,-54.8275146484375,1
Linda isn't discussing those waitresses.,Linda isn't discussing those waitress.,morphology,determiner_noun_agreement,determiner_noun_agreement_1,True,True,False,True,382,-63.824623107910156,-53.13679885864258,0
