sentence_good,sentence_bad,field,linguistics_term,UID,simple_LM_method,one_prefix_method,two_prefix_method,lexically_identical,pair_id,good_prob,bad_prob,correct
Adam won't say that he escapes from Gerald.,Adam won't say that himself escapes from Gerald.,syntax_semantics,binding,principle_A_case_1,True,True,False,False,237,-49.650634765625,-54.37804412841797,1
Anna had explained that she won't help Daniel.,Anna had explained that herself won't help Daniel.,syntax_semantics,binding,principle_A_case_1,True,True,False,False,238,-48.737815856933594,-58.632015228271484,1
Chad is saying that he criticizes Kendra.,Chad is saying that himself criticizes Kendra.,syntax_semantics,binding,principle_A_case_1,True,True,False,False,239,-84.47058868408203,-90.2055892944336,1
Irene hasn't explained that she has hired some actor.,Irene hasn't explained that herself has hired some actor.,syntax_semantics,binding,principle_A_case_1,True,True,False,False,240,-68.38536834716797,-75.98612213134766,1
Katherine says that she hadn't worn a shirt.,Katherine says that herself hadn't worn a shirt.,syntax_semantics,binding,principle_A_case_1,True,True,False,False,241,-57.25220489501953,-63.450347900390625,1
Alan should explain that he conceals Joseph.,Alan should explain that himself conceals Joseph.,syntax_semantics,binding,principle_A_case_1,True,True,False,False,242,-61.27384567260742,-68.65597534179688,1
Melinda isn't saying that she cures a waiter.,Melinda isn't saying that herself cures a waiter.,syntax_semantics,binding,principle_A_case_1,True,True,False,False,243,-57.971458435058594,-66.10588073730469,1
Cynthia isn't thinking that she wasn't going to the mountain.,Cynthia isn't thinking that herself wasn't going to the mountain.,syntax_semantics,binding,principle_A_case_1,True,True,False,False,244,-73.77831268310547,-80.39730834960938,1
Aaron thinks that he boycotted this closet.,Aaron thinks that himself boycotted this closet.,syntax_semantics,binding,principle_A_case_1,True,True,False,False,245,-67.36785888671875,-71.56535339355469,1
Laura hadn't explained that she wasn't wearing this shawl.,Laura hadn't explained that herself wasn't wearing this shawl.,syntax_semantics,binding,principle_A_case_1,True,True,False,False,246,-70.55241394042969,-79.26803588867188,1
Karen thought that she should discuss some doctors.,Karen thought that herself should discuss some doctors.,syntax_semantics,binding,principle_A_case_1,True,True,False,False,247,-63.57109451293945,-69.58389282226562,1
Omar thought that he hadn't talked about Debra.,Omar thought that himself hadn't talked about Debra.,syntax_semantics,binding,principle_A_case_1,True,True,False,False,248,-61.702117919921875,-69.14307403564453,1
Benjamin is explaining that he praises Kendra.,Benjamin is explaining that himself praises Kendra.,syntax_semantics,binding,principle_A_case_1,True,True,False,False,249,-73.57395935058594,-79.50983428955078,1
Christina was explaining that she had cared for Adam.,Christina was explaining that herself had cared for Adam.,syntax_semantics,binding,principle_A_case_1,True,True,False,False,250,-60.24128723144531,-68.49330139160156,1
Renee hadn't said that she had described Connie.,Renee hadn't said that herself had described Connie.,syntax_semantics,binding,principle_A_case_1,True,True,False,False,251,-59.64129638671875,-66.70623016357422,1
Bill imagines that he had taken those libraries.,Bill imagines that himself had taken those libraries.,syntax_semantics,binding,principle_A_case_1,True,True,False,False,252,-62.866783142089844,-69.41223907470703,1
Christina imagines that she isn't observing Mary.,Christina imagines that herself isn't observing Mary.,syntax_semantics,binding,principle_A_case_1,True,True,False,False,253,-76.73393249511719,-82.283447265625,1
Carrie explained that she appreciates all stories.,Carrie explained that herself appreciates all stories.,syntax_semantics,binding,principle_A_case_1,True,True,False,False,254,-61.80674743652344,-69.82513427734375,1
Helen says that she did drive to these art galleries.,Helen says that herself did drive to these art galleries.,syntax_semantics,binding,principle_A_case_1,True,True,False,False,255,-63.03662872314453,-69.50987243652344,1
Many cashiers wouldn't say that they weren't biking to this river.,Many cashiers wouldn't say that themselves weren't biking to this river.,syntax_semantics,binding,principle_A_case_1,True,True,False,False,256,-77.81349182128906,-87.013427734375,1
Kirsten thinks that she can care for every waitress.,Kirsten thinks that herself can care for every waitress.,syntax_semantics,binding,principle_A_case_1,True,True,False,False,257,-76.7718734741211,-83.66294860839844,1
Irene hasn't said that she scares Raymond.,Irene hasn't said that herself scares Raymond.,syntax_semantics,binding,principle_A_case_1,True,True,False,False,258,-58.40845489501953,-64.40580749511719,1
Kendra explained that she is scanning the essay.,Kendra explained that herself is scanning the essay.,syntax_semantics,binding,principle_A_case_1,True,True,False,False,259,-72.71337890625,-79.61840057373047,1
Laurie is thinking that she has resembled most photographs.,Laurie is thinking that herself has resembled most photographs.,syntax_semantics,binding,principle_A_case_1,True,True,False,False,260,-76.06938934326172,-83.40547180175781,1
These actresses think that they worries Jodi.,These actresses think that themselves worries Jodi.,syntax_semantics,binding,principle_A_case_1,True,True,False,False,261,-59.034732818603516,-66.03592681884766,1
Ronald hadn't thought that he can insult Russell.,Ronald hadn't thought that himself can insult Russell.,syntax_semantics,binding,principle_A_case_1,True,True,False,False,262,-63.37226104736328,-70.377197265625,1
Ruth has thought that she had kissed Laurie.,Ruth has thought that herself had kissed Laurie.,syntax_semantics,binding,principle_A_case_1,True,True,False,False,263,-68.6158447265625,-75.61965942382812,1
The Borgias think that they praise every story.,The Borgias think that themselves praise every story.,syntax_semantics,binding,principle_A_case_1,True,True,False,False,264,-68.39083862304688,-76.40716552734375,1
Patrick might say that he hadn't complained about Vincent.,Patrick might say that himself hadn't complained about Vincent.,syntax_semantics,binding,principle_A_case_1,True,True,False,False,265,-52.95675277709961,-59.903404235839844,1
All men imagine that they hadn't messed up most art galleries.,All men imagine that themselves hadn't messed up most art galleries.,syntax_semantics,binding,principle_A_case_1,True,True,False,False,266,-70.12692260742188,-78.09489440917969,1
Tammy wasn't thinking that she hasn't bought the unicycle.,Tammy wasn't thinking that herself hasn't bought the unicycle.,syntax_semantics,binding,principle_A_case_1,True,True,False,False,267,-64.14195251464844,-70.6800765991211,1
Tracy has thought that she wasn't biking to these restaurants.,Tracy has thought that herself wasn't biking to these restaurants.,syntax_semantics,binding,principle_A_case_1,True,True,False,False,268,-66.5576171875,-73.42817687988281,1
Ann does say that she had noticed Margaret.,Ann does say that herself had noticed Margaret.,syntax_semantics,binding,principle_A_case_1,True,True,False,False,269,-52.84003448486328,-59.827850341796875,1
Claire can't explain that she is embarrassing Frank.,Claire can't explain that herself is embarrassing Frank.,syntax_semantics,binding,principle_A_case_1,True,True,False,False,270,-65.80337524414062,-69.45709991455078,1
The boys imagined that they concealed Kevin.,The boys imagined that themselves concealed Kevin.,syntax_semantics,binding,principle_A_case_1,True,True,False,False,271,-56.41645050048828,-64.40065002441406,1
Rose imagines that she hasn't worked with Monica.,Rose imagines that herself hasn't worked with Monica.,syntax_semantics,binding,principle_A_case_1,True,True,False,False,272,-58.67772674560547,-66.9572525024414,1
Regina was explaining that she hasn't bored Curtis.,Regina was explaining that herself hasn't bored Curtis.,syntax_semantics,binding,principle_A_case_1,True,True,False,False,273,-68.26126098632812,-75.59739685058594,1
Florence thinks that she had bought steak.,Florence thinks that herself had bought steak.,syntax_semantics,binding,principle_A_case_1,True,True,False,False,274,-62.21023941040039,-68.31035614013672,1
Jessica thought that she cared for Winston Churchill.,Jessica thought that herself cared for Winston Churchill.,syntax_semantics,binding,principle_A_case_1,True,True,False,False,275,-53.511695861816406,-60.447418212890625,1
Daniel says that he would approach Emily.,Daniel says that himself would approach Emily.,syntax_semantics,binding,principle_A_case_1,True,True,False,False,276,-43.305450439453125,-51.48431396484375,1
Renee says that she wears many sweaters.,Renee says that herself wears many sweaters.,syntax_semantics,binding,principle_A_case_1,True,True,False,False,277,-57.08441925048828,-64.81982421875,1
Emily had thought that she argued about Benjamin.,Emily had thought that herself argued about Benjamin.,syntax_semantics,binding,principle_A_case_1,True,True,False,False,278,-48.100250244140625,-55.06134796142578,1
Carl was imagining that he visits waiters.,Carl was imagining that himself visits waiters.,syntax_semantics,binding,principle_A_case_1,True,True,False,False,279,-61.13624954223633,-66.5494384765625,1
Becca is saying that she was kissing Amanda.,Becca is saying that herself was kissing Amanda.,syntax_semantics,binding,principle_A_case_1,True,True,False,False,280,-54.306785583496094,-62.64076614379883,1
Most ladies say that they irritated Linda.,Most ladies say that themselves irritated Linda.,syntax_semantics,binding,principle_A_case_1,True,True,False,False,281,-49.01704406738281,-55.80266189575195,1
Peter has said that he hasn't described Dan.,Peter has said that himself hasn't described Dan.,syntax_semantics,binding,principle_A_case_1,True,True,False,False,282,-46.195987701416016,-54.71872329711914,1
Alexander imagined that he attacked Vincent.,Alexander imagined that himself attacked Vincent.,syntax_semantics,binding,principle_A_case_1,True,True,False,False,283,-45.02586364746094,-52.291099548339844,1
Emily has explained that she embarrassed Keith.,Emily has explained that herself embarrassed Keith.,syntax_semantics,binding,principle_A_case_1,True,True,False,False,284,-49.54159164428711,-57.248497009277344,1
Patients imagine that they shouldn't bike to that high school.,Patients imagine that themselves shouldn't bike to that high school.,syntax_semantics,binding,principle_A_case_1,True,True,False,False,285,-71.82783508300781,-78.99736022949219,1
Gregory won't say that he couldn't bore Renee.,Gregory won't say that himself couldn't bore Renee.,syntax_semantics,binding,principle_A_case_1,True,True,False,False,286,-66.97782135009766,-75.82026672363281,1
Debra isn't imagining that she is running around some glacier.,Debra isn't imagining that herself is running around some glacier.,syntax_semantics,binding,principle_A_case_1,True,True,False,False,287,-73.70719909667969,-80.25936126708984,1
Carla could think that she attacks Christopher.,Carla could think that herself attacks Christopher.,syntax_semantics,binding,principle_A_case_1,True,True,False,False,288,-59.83983612060547,-65.7057113647461,1
Vincent has imagined that he has hugged Katherine.,Vincent has imagined that himself has hugged Katherine.,syntax_semantics,binding,principle_A_case_1,True,True,False,False,289,-73.5718994140625,-81.30233764648438,1
Gina explains that she hasn't taken most couches.,Gina explains that herself hasn't taken most couches.,syntax_semantics,binding,principle_A_case_1,True,True,False,False,290,-75.99162292480469,-82.82969665527344,1
Travis does think that he hadn't brought all newspaper articles.,Travis does think that himself hadn't brought all newspaper articles.,syntax_semantics,binding,principle_A_case_1,True,True,False,False,291,-87.40148162841797,-94.20970153808594,1
Rodney could imagine that he observes Lisa.,Rodney could imagine that himself observes Lisa.,syntax_semantics,binding,principle_A_case_1,True,True,False,False,292,-60.065391540527344,-67.28207397460938,1
Holly should imagine that she is fixing many mirrors.,Holly should imagine that herself is fixing many mirrors.,syntax_semantics,binding,principle_A_case_1,True,True,False,False,293,-68.05252075195312,-73.2321548461914,1
Those men imagine that they listened to Mary.,Those men imagine that themselves listened to Mary.,syntax_semantics,binding,principle_A_case_1,True,True,False,False,294,-46.57377243041992,-54.80810546875,1
Raymond hadn't imagined that he examines all documentaries.,Raymond hadn't imagined that himself examines all documentaries.,syntax_semantics,binding,principle_A_case_1,True,True,False,False,295,-75.37918090820312,-82.89115905761719,1
Those ladies say that they cure Judy.,Those ladies say that themselves cure Judy.,syntax_semantics,binding,principle_A_case_1,True,True,False,False,296,-45.82529830932617,-52.93075942993164,1
Sharon couldn't explain that she hasn't dropped by that glacier.,Sharon couldn't explain that herself hasn't dropped by that glacier.,syntax_semantics,binding,principle_A_case_1,True,True,False,False,297,-73.13304138183594,-77.41543579101562,1
Jacqueline wasn't saying that she did bother Suzanne.,Jacqueline wasn't saying that herself did bother Suzanne.,syntax_semantics,binding,principle_A_case_1,True,True,False,False,298,-68.14013671875,-75.55415344238281,1
Martin wasn't imagining that he has researched those governments.,Martin wasn't imagining that himself has researched those governments.,syntax_semantics,binding,principle_A_case_1,True,True,False,False,299,-61.01774597167969,-69.65031433105469,1
James won't say that he climbed down the mountains.,James won't say that himself climbed down the mountains.,syntax_semantics,binding,principle_A_case_1,True,True,False,False,300,-38.74565505981445,-46.56724548339844,1
The students explain that they can't return to Jane.,The students explain that themselves can't return to Jane.,syntax_semantics,binding,principle_A_case_1,True,True,False,False,301,-50.06196594238281,-58.72333526611328,1
Tanya wouldn't think that she couldn't observe Lisa.,Tanya wouldn't think that herself couldn't observe Lisa.,syntax_semantics,binding,principle_A_case_1,True,True,False,False,302,-70.1089859008789,-76.4856185913086,1
James can think that he was praising some doctors.,James can think that himself was praising some doctors.,syntax_semantics,binding,principle_A_case_1,True,True,False,False,303,-54.624000549316406,-62.225894927978516,1
Bruce imagined that he should approach Margaret.,Bruce imagined that himself should approach Margaret.,syntax_semantics,binding,principle_A_case_1,True,True,False,False,304,-52.612754821777344,-60.83815002441406,1
Elizabeth said that she should embarrass Clyde.,Elizabeth said that herself should embarrass Clyde.,syntax_semantics,binding,principle_A_case_1,True,True,False,False,305,-48.38459014892578,-55.67766189575195,1
Martha is saying that she fixes most cups.,Martha is saying that herself fixes most cups.,syntax_semantics,binding,principle_A_case_1,True,True,False,False,306,-62.37108612060547,-70.2265625,1
The Borgias explain that they fires Brett.,The Borgias explain that themselves fires Brett.,syntax_semantics,binding,principle_A_case_1,True,True,False,False,307,-74.8608169555664,-80.64352416992188,1
Anne thinks that she hadn't explored those hospitals.,Anne thinks that herself hadn't explored those hospitals.,syntax_semantics,binding,principle_A_case_1,True,True,False,False,308,-52.676055908203125,-59.7039680480957,1
Marcus is saying that he was biking to a public park.,Marcus is saying that himself was biking to a public park.,syntax_semantics,binding,principle_A_case_1,True,True,False,False,309,-58.757965087890625,-66.392333984375,1
Teresa says that she climbs up the ladder.,Teresa says that herself climbs up the ladder.,syntax_semantics,binding,principle_A_case_1,True,True,False,False,310,-54.653045654296875,-62.33390426635742,1
Cynthia could say that she arrives at the glaciers.,Cynthia could say that herself arrives at the glaciers.,syntax_semantics,binding,principle_A_case_1,True,True,False,False,311,-74.02338409423828,-80.25862884521484,1
Raymond wasn't thinking that he watches Brett.,Raymond wasn't thinking that himself watches Brett.,syntax_semantics,binding,principle_A_case_1,True,True,False,False,312,-58.56987762451172,-66.22029113769531,1
Emily couldn't explain that she complained about Christine.,Emily couldn't explain that herself complained about Christine.,syntax_semantics,binding,principle_A_case_1,True,True,False,False,313,-52.10685348510742,-58.12916946411133,1
Sarah hasn't said that she has disgusted Bethany.,Sarah hasn't said that herself has disgusted Bethany.,syntax_semantics,binding,principle_A_case_1,True,True,False,False,314,-63.50035858154297,-69.10569763183594,1
April imagines that she was observing Tanya.,April imagines that herself was observing Tanya.,syntax_semantics,binding,principle_A_case_1,True,True,False,False,315,-71.18634796142578,-79.0248031616211,1
Matt was thinking that he hates the actresses.,Matt was thinking that himself hates the actresses.,syntax_semantics,binding,principle_A_case_1,True,True,False,False,316,-39.610023498535156,-47.724586486816406,1
Frank has thought that he had lifted a computer.,Frank has thought that himself had lifted a computer.,syntax_semantics,binding,principle_A_case_1,True,True,False,False,317,-46.152591705322266,-52.68756866455078,1
Julia has thought that she describes Adam.,Julia has thought that herself describes Adam.,syntax_semantics,binding,principle_A_case_1,True,True,False,False,318,-49.75197982788086,-56.638282775878906,1
Victoria didn't say that she resembled this sketch.,Victoria didn't say that herself resembled this sketch.,syntax_semantics,binding,principle_A_case_1,True,True,False,False,319,-47.80288314819336,-54.129150390625,1
The woman said that she irritated Tammy.,The woman said that herself irritated Tammy.,syntax_semantics,binding,principle_A_case_1,True,True,False,False,320,-48.96332931518555,-55.925262451171875,1
Tamara thinks that she praised every story.,Tamara thinks that herself praised every story.,syntax_semantics,binding,principle_A_case_1,True,True,False,False,321,-54.35502624511719,-60.0130615234375,1
Katherine had explained that she was criticizing many waiters.,Katherine had explained that herself was criticizing many waiters.,syntax_semantics,binding,principle_A_case_1,True,True,False,False,322,-82.69776916503906,-91.03079986572266,1
Carmen will think that she isn't discovering Lawrence.,Carmen will think that herself isn't discovering Lawrence.,syntax_semantics,binding,principle_A_case_1,True,True,False,False,323,-80.73771667480469,-85.7179183959961,1
Omar has said that he cares for Bill.,Omar has said that himself cares for Bill.,syntax_semantics,binding,principle_A_case_1,True,True,False,False,324,-57.694156646728516,-66.50914001464844,1
Meredith has explained that she will bring the shawl.,Meredith has explained that herself will bring the shawl.,syntax_semantics,binding,principle_A_case_1,True,True,False,False,325,-79.72102355957031,-87.94044494628906,1
This waitress said that she hadn't explored some high school.,This waitress said that herself hadn't explored some high school.,syntax_semantics,binding,principle_A_case_1,True,True,False,False,326,-64.88339233398438,-72.75523376464844,1
Helen might think that she wasn't helping John.,Helen might think that herself wasn't helping John.,syntax_semantics,binding,principle_A_case_1,True,True,False,False,327,-51.36238098144531,-57.0695686340332,1
The Lutherans aren't thinking that they exited the grocery stores.,The Lutherans aren't thinking that themselves exited the grocery stores.,syntax_semantics,binding,principle_A_case_1,True,True,False,False,328,-78.7124252319336,-88.04281616210938,1
Tiffany explained that she would investigate that teacher.,Tiffany explained that herself would investigate that teacher.,syntax_semantics,binding,principle_A_case_1,True,True,False,False,329,-70.55767822265625,-78.39250183105469,1
Michelle said that she thinks about this photograph.,Michelle said that herself thinks about this photograph.,syntax_semantics,binding,principle_A_case_1,True,True,False,False,330,-40.63792419433594,-50.473175048828125,1
Carmen imagines that she discovered Carolyn.,Carmen imagines that herself discovered Carolyn.,syntax_semantics,binding,principle_A_case_1,True,True,False,False,331,-79.11843872070312,-86.74920654296875,1
Kathleen explained that she had discovered that patient.,Kathleen explained that herself had discovered that patient.,syntax_semantics,binding,principle_A_case_1,True,True,False,False,332,-73.22502136230469,-81.96006774902344,1
Many dancers won't imagine that they aren't walking through Harvard University.,Many dancers won't imagine that themselves aren't walking through Harvard University.,syntax_semantics,binding,principle_A_case_1,True,True,False,False,333,-72.00534057617188,-79.13128662109375,1
Jeffrey explained that he was observing Dana.,Jeffrey explained that himself was observing Dana.,syntax_semantics,binding,principle_A_case_1,True,True,False,False,334,-56.54616928100586,-65.74983978271484,1
Barbara said that she has thought about this window.,Barbara said that herself has thought about this window.,syntax_semantics,binding,principle_A_case_1,True,True,False,False,335,-46.8791618347168,-54.62689208984375,1
Debra thought that she isn't returning to Sheila.,Debra thought that herself isn't returning to Sheila.,syntax_semantics,binding,principle_A_case_1,True,True,False,False,336,-56.08306884765625,-61.516212463378906,1
Some customers imagine that they go to Harvard University.,Some customers imagine that themselves go to Harvard University.,syntax_semantics,binding,principle_A_case_1,True,True,False,False,337,-47.595481872558594,-54.31802749633789,1
Every actress should explain that she climbed down a mountain.,Every actress should explain that herself climbed down a mountain.,syntax_semantics,binding,principle_A_case_1,True,True,False,False,338,-61.13341522216797,-68.44338989257812,1
All actresses imagined that they could attack some boy.,All actresses imagined that themselves could attack some boy.,syntax_semantics,binding,principle_A_case_1,True,True,False,False,339,-61.162139892578125,-69.61089324951172,1
George could think that he hasn't confused some student.,George could think that himself hasn't confused some student.,syntax_semantics,binding,principle_A_case_1,True,True,False,False,340,-56.16021728515625,-62.475101470947266,1
The students imagine that they have examined this report.,The students imagine that themselves have examined this report.,syntax_semantics,binding,principle_A_case_1,True,True,False,False,341,-52.40235137939453,-59.236572265625,1
Actresses say that they shouldn't disgust Travis.,Actresses say that themselves shouldn't disgust Travis.,syntax_semantics,binding,principle_A_case_1,True,True,False,False,342,-64.16667938232422,-71.2947998046875,1
Travis thinks that he hasn't talked about Michelle.,Travis thinks that himself hasn't talked about Michelle.,syntax_semantics,binding,principle_A_case_1,True,True,False,False,343,-67.02392578125,-74.47230529785156,1
Melanie says that she scares Theodore.,Melanie says that herself scares Theodore.,syntax_semantics,binding,principle_A_case_1,True,True,False,False,344,-51.240623474121094,-57.441287994384766,1
Sharon explains that she has broken this cart.,Sharon explains that herself has broken this cart.,syntax_semantics,binding,principle_A_case_1,True,True,False,False,345,-58.9560546875,-66.63766479492188,1
Patricia has imagined that she looks like every picture.,Patricia has imagined that herself looks like every picture.,syntax_semantics,binding,principle_A_case_1,True,True,False,False,346,-62.309654235839844,-68.77818298339844,1
Elaine said that she didn't run around the art gallery.,Elaine said that herself didn't run around the art gallery.,syntax_semantics,binding,principle_A_case_1,True,True,False,False,347,-63.999114990234375,-72.1395034790039,1
Helen wasn't thinking that she disturbs Kendra.,Helen wasn't thinking that herself disturbs Kendra.,syntax_semantics,binding,principle_A_case_1,True,True,False,False,348,-71.83158874511719,-75.92842102050781,1
Girls explain that they broke the windows.,Girls explain that themselves broke the windows.,syntax_semantics,binding,principle_A_case_1,True,True,False,False,349,-35.978965759277344,-43.86791229248047,1
The children couldn't explain that they fled from the Clintons.,The children couldn't explain that themselves fled from the Clintons.,syntax_semantics,binding,principle_A_case_1,True,True,False,False,350,-63.51734924316406,-72.15876770019531,1
Many teenagers think that they appreciate this pedestrian.,Many teenagers think that themselves appreciate this pedestrian.,syntax_semantics,binding,principle_A_case_1,True,True,False,False,351,-50.38262176513672,-57.54170227050781,1
Karla thinks that she appreciates Julie.,Karla thinks that herself appreciates Julie.,syntax_semantics,binding,principle_A_case_1,True,True,False,False,352,-57.371097564697266,-64.53137969970703,1
Carol explained that she cared for the boys.,Carol explained that herself cared for the boys.,syntax_semantics,binding,principle_A_case_1,True,True,False,False,353,-54.50151062011719,-62.30223083496094,1
Bruce imagined that he wasn't passing this closet.,Bruce imagined that himself wasn't passing this closet.,syntax_semantics,binding,principle_A_case_1,True,True,False,False,354,-54.188812255859375,-62.76813507080078,1
Kendra was thinking that she hadn't irritated Galileo.,Kendra was thinking that herself hadn't irritated Galileo.,syntax_semantics,binding,principle_A_case_1,True,True,False,False,355,-85.58991241455078,-93.03805541992188,1
