sentence_good,sentence_bad,field,linguistics_term,UID,simple_LM_method,one_prefix_method,two_prefix_method,lexically_identical,pair_id,good_prob,bad_prob,correct
Lissa wasn't driving to that white oasis.,Lissa wasn't driving to that white oases.,morphology,determiner_noun_agreement,determiner_noun_agreement_with_adj_irregular_1,True,True,False,True,672,-61.963905334472656,-65.93243408203125,1
The customers have exited this old oasis.,The customers have exited this old oases.,morphology,determiner_noun_agreement,determiner_noun_agreement_with_adj_irregular_1,True,True,False,True,673,-59.73413848876953,-63.142242431640625,1
Guy was leaving this confident child.,Guy was leaving this confident children.,morphology,determiner_noun_agreement,determiner_noun_agreement_with_adj_irregular_1,True,True,False,True,674,-38.41828155517578,-38.950782775878906,1
Keith goes to this rough oasis.,Keith goes to this rough oases.,morphology,determiner_noun_agreement,determiner_noun_agreement_with_adj_irregular_1,True,True,False,True,675,-44.21723175048828,-48.57650375366211,1
Most cashiers complain about those old men.,Most cashiers complain about those old man.,morphology,determiner_noun_agreement,determiner_noun_agreement_with_adj_irregular_1,True,True,False,True,676,-54.88417053222656,-56.68830871582031,1
Vincent shouldn't scare that busy person.,Vincent shouldn't scare that busy people.,morphology,determiner_noun_agreement,determiner_noun_agreement_with_adj_irregular_1,True,True,False,True,677,-62.66977310180664,-60.73501968383789,0
Beth hugged that nice child.,Beth hugged that nice children.,morphology,determiner_noun_agreement,determiner_noun_agreement_with_adj_irregular_1,True,True,False,True,678,-58.49309539794922,-58.788883209228516,1
Guy shouldn't praise these smart people.,Guy shouldn't praise these smart person.,morphology,determiner_noun_agreement,determiner_noun_agreement_with_adj_irregular_1,True,True,False,True,679,-43.64256286621094,-47.87963104248047,1
Florence sells these small feet.,Florence sells these small foot.,morphology,determiner_noun_agreement,determiner_noun_agreement_with_adj_irregular_1,True,True,False,True,680,-44.78661346435547,-46.374393463134766,1
Walter didn't know this out in the open woman.,Walter didn't know this out in the open women.,morphology,determiner_noun_agreement,determiner_noun_agreement_with_adj_irregular_1,True,True,False,True,681,-56.63651657104492,-56.67815017700195,1
Barbara has messed up those broken teeth.,Barbara has messed up those broken tooth.,morphology,determiner_noun_agreement,determiner_noun_agreement_with_adj_irregular_1,True,True,False,True,682,-47.16321563720703,-49.80837631225586,1
Carl will help these busy men.,Carl will help these busy man.,morphology,determiner_noun_agreement,determiner_noun_agreement_with_adj_irregular_1,True,True,False,True,683,-37.130836486816406,-40.113914489746094,1
This guest could hire these nice men.,This guest could hire these nice man.,morphology,determiner_noun_agreement,determiner_noun_agreement_with_adj_irregular_1,True,True,False,True,684,-51.101356506347656,-52.72407531738281,1
Rodney wasn't bothering this small alumnus.,Rodney wasn't bothering this small alumni.,morphology,determiner_noun_agreement,determiner_noun_agreement_with_adj_irregular_1,True,True,False,True,685,-67.90229797363281,-54.12843322753906,0
These students break these messy teeth.,These students break these messy tooth.,morphology,determiner_noun_agreement,determiner_noun_agreement_with_adj_irregular_1,True,True,False,True,686,-44.00555419921875,-46.55134582519531,1
April wasn't biking to those hard oases.,April wasn't biking to those hard oasis.,morphology,determiner_noun_agreement,determiner_noun_agreement_with_adj_irregular_1,True,True,False,True,687,-68.81636047363281,-65.08802032470703,0
Stephanie hated those fast alumni.,Stephanie hated those fast alumnus.,morphology,determiner_noun_agreement,determiner_noun_agreement_with_adj_irregular_1,True,True,False,True,688,-50.624725341796875,-64.99574279785156,1
Dawn has disturbed these ill men.,Dawn has disturbed these ill man.,morphology,determiner_noun_agreement,determiner_noun_agreement_with_adj_irregular_1,True,True,False,True,689,-59.80373764038086,-61.794307708740234,1
Chad questioned this unsure child.,Chad questioned this unsure children.,morphology,determiner_noun_agreement,determiner_noun_agreement_with_adj_irregular_1,True,True,False,True,690,-53.00932312011719,-55.2415885925293,1
That shirt disgusted this busy woman.,That shirt disgusted this busy women.,morphology,determiner_noun_agreement,determiner_noun_agreement_with_adj_irregular_1,True,True,False,True,691,-58.094520568847656,-60.68260192871094,1
Daniel has toured that red oasis.,Daniel has toured that red oases.,morphology,determiner_noun_agreement,determiner_noun_agreement_with_adj_irregular_1,True,True,False,True,692,-48.368492126464844,-51.53564453125,1
Joel finds those hidden men.,Joel finds those hidden man.,morphology,determiner_noun_agreement,determiner_noun_agreement_with_adj_irregular_1,True,True,False,True,693,-39.583473205566406,-40.59485626220703,1
Some adult did arrive at that old oasis.,Some adult did arrive at that old oases.,morphology,determiner_noun_agreement,determiner_noun_agreement_with_adj_irregular_1,True,True,False,True,694,-58.29811096191406,-62.057777404785156,1
A lot of carriages weren't alarming that employed woman.,A lot of carriages weren't alarming that employed women.,morphology,determiner_noun_agreement,determiner_noun_agreement_with_adj_irregular_1,True,True,False,True,695,-85.52015686035156,-84.49668884277344,0
Tina wasn't observing these unemployed children.,Tina wasn't observing these unemployed child.,morphology,determiner_noun_agreement,determiner_noun_agreement_with_adj_irregular_1,True,True,False,True,696,-64.48832702636719,-66.1484375,1
All dresses aggravate these important men.,All dresses aggravate these important man.,morphology,determiner_noun_agreement,determiner_noun_agreement_with_adj_irregular_1,True,True,False,True,697,-52.728355407714844,-54.017051696777344,1
This car had disturbed those important men.,This car had disturbed those important man.,morphology,determiner_noun_agreement,determiner_noun_agreement_with_adj_irregular_1,True,True,False,True,698,-48.59991455078125,-50.40093994140625,1
Florence will return to that confident person.,Florence will return to that confident people.,morphology,determiner_noun_agreement,determiner_noun_agreement_with_adj_irregular_1,True,True,False,True,699,-55.213653564453125,-52.32859802246094,0
Some cashiers criticized those uncertain women.,Some cashiers criticized those uncertain woman.,morphology,determiner_noun_agreement,determiner_noun_agreement_with_adj_irregular_1,True,True,False,True,700,-62.399024963378906,-64.60368347167969,1
Meredith investigated this excited child.,Meredith investigated this excited children.,morphology,determiner_noun_agreement,determiner_noun_agreement_with_adj_irregular_1,True,True,False,True,701,-60.27559280395508,-60.62950897216797,1
Sarah is concealing that busy woman.,Sarah is concealing that busy women.,morphology,determiner_noun_agreement,determiner_noun_agreement_with_adj_irregular_1,True,True,False,True,702,-53.14865493774414,-52.2669792175293,0
Janice criticizes this good analysis.,Janice criticizes this good analyses.,morphology,determiner_noun_agreement,determiner_noun_agreement_with_adj_irregular_1,True,True,False,True,703,-52.753028869628906,-58.66339111328125,1
Many guys weren't noticing this lost child.,Many guys weren't noticing this lost children.,morphology,determiner_noun_agreement,determiner_noun_agreement_with_adj_irregular_1,True,True,False,True,704,-53.71245193481445,-53.222633361816406,0
Homer can pass that concealed oasis.,Homer can pass that concealed oases.,morphology,determiner_noun_agreement,determiner_noun_agreement_with_adj_irregular_1,True,True,False,True,705,-68.93611907958984,-72.06145477294922,1
The drivers hide this concealed fungus.,The drivers hide this concealed fungi.,morphology,determiner_noun_agreement,determiner_noun_agreement_with_adj_irregular_1,True,True,False,True,706,-55.45819854736328,-54.173946380615234,0
Marla had investigated that content person.,Marla had investigated that content people.,morphology,determiner_noun_agreement,determiner_noun_agreement_with_adj_irregular_1,True,True,False,True,707,-50.57501983642578,-50.019832611083984,0
The Borgias explore this white oasis.,The Borgias explore this white oases.,morphology,determiner_noun_agreement,determiner_noun_agreement_with_adj_irregular_1,True,True,False,True,708,-69.565185546875,-73.19322967529297,1
Heather brought this black tooth.,Heather brought this black teeth.,morphology,determiner_noun_agreement,determiner_noun_agreement_with_adj_irregular_1,True,True,False,True,709,-44.75511169433594,-43.05015182495117,0
Walter doesn't drop by those smooth oases.,Walter doesn't drop by those smooth oasis.,morphology,determiner_noun_agreement,determiner_noun_agreement_with_adj_irregular_1,True,True,False,True,710,-63.187652587890625,-60.143943786621094,0
Sharon knows this hopeful man.,Sharon knows this hopeful men.,morphology,determiner_noun_agreement,determiner_noun_agreement_with_adj_irregular_1,True,True,False,True,711,-45.18458557128906,-47.346214294433594,1
The companies irritate this ill child.,The companies irritate this ill children.,morphology,determiner_noun_agreement,determiner_noun_agreement_with_adj_irregular_1,True,True,False,True,712,-51.713035583496094,-52.584754943847656,1
Alice is noticing those orange mice.,Alice is noticing those orange mouse.,morphology,determiner_noun_agreement,determiner_noun_agreement_with_adj_irregular_1,True,True,False,True,713,-43.093379974365234,-43.91327667236328,1
Kimberley loves this nice woman.,Kimberley loves this nice women.,morphology,determiner_noun_agreement,determiner_noun_agreement_with_adj_irregular_1,True,True,False,True,714,-44.18572998046875,-45.891456604003906,1
The Borgias have examined this purple thesis.,The Borgias have examined this purple theses.,morphology,determiner_noun_agreement,determiner_noun_agreement_with_adj_irregular_1,True,True,False,True,715,-70.4545669555664,-79.24295806884766,1
Douglas went to this concealed oasis.,Douglas went to this concealed oases.,morphology,determiner_noun_agreement,determiner_noun_agreement_with_adj_irregular_1,True,True,False,True,716,-59.23086929321289,-63.1400032043457,1
Ladies scan these long synopses.,Ladies scan these long synopsis.,morphology,determiner_noun_agreement,determiner_noun_agreement_with_adj_irregular_1,True,True,False,True,717,-74.48796844482422,-63.27477264404297,0
Adam can question that lost woman.,Adam can question that lost women.,morphology,determiner_noun_agreement,determiner_noun_agreement_with_adj_irregular_1,True,True,False,True,718,-41.845802307128906,-40.444847106933594,0
George fixes those purple teeth.,George fixes those purple tooth.,morphology,determiner_noun_agreement,determiner_noun_agreement_with_adj_irregular_1,True,True,False,True,719,-43.84742736816406,-46.178504943847656,1
The Clintons praise these long analyses.,The Clintons praise these long analysis.,morphology,determiner_noun_agreement,determiner_noun_agreement_with_adj_irregular_1,True,True,False,True,720,-61.80776596069336,-57.770816802978516,0
Craig shouldn't bike to these yellow oases.,Craig shouldn't bike to these yellow oasis.,morphology,determiner_noun_agreement,determiner_noun_agreement_with_adj_irregular_1,True,True,False,True,721,-61.77797317504883,-58.71134948730469,0
The child hasn't loved these good synopses.,The child hasn't loved these good synopsis.,morphology,determiner_noun_agreement,determiner_noun_agreement_with_adj_irregular_1,True,True,False,True,722,-66.93209838867188,-55.4161376953125,0
These waitresses might reference this out in the open alumnus.,These waitresses might reference this out in the open alumni.,morphology,determiner_noun_agreement,determiner_noun_agreement_with_adj_irregular_1,True,True,False,True,723,-101.85294342041016,-87.4050064086914,0
Phillip questions this young child.,Phillip questions this young children.,morphology,determiner_noun_agreement,determiner_noun_agreement_with_adj_irregular_1,True,True,False,True,724,-39.625099182128906,-39.66548156738281,1
Jodi hadn't impressed that excited woman.,Jodi hadn't impressed that excited women.,morphology,determiner_noun_agreement,determiner_noun_agreement_with_adj_irregular_1,True,True,False,True,725,-63.36014938354492,-63.27360153198242,0
Guys break those out in the open teeth.,Guys break those out in the open tooth.,morphology,determiner_noun_agreement,determiner_noun_agreement_with_adj_irregular_1,True,True,False,True,726,-48.971275329589844,-51.23236083984375,1
Joel saw these lost mice.,Joel saw these lost mouse.,morphology,determiner_noun_agreement,determiner_noun_agreement_with_adj_irregular_1,True,True,False,True,727,-43.077335357666016,-44.74372863769531,1
The Impressionists were fixing those gray teeth.,The Impressionists were fixing those gray tooth.,morphology,determiner_noun_agreement,determiner_noun_agreement_with_adj_irregular_1,True,True,False,True,728,-66.96895599365234,-69.35672760009766,1
Kristen has discussed those good analyses.,Kristen has discussed those good analysis.,morphology,determiner_noun_agreement,determiner_noun_agreement_with_adj_irregular_1,True,True,False,True,729,-46.01830291748047,-41.837135314941406,0
The girls had described those upset people.,The girls had described those upset person.,morphology,determiner_noun_agreement,determiner_noun_agreement_with_adj_irregular_1,True,True,False,True,730,-46.0246467590332,-49.66688537597656,1
Veronica approaches those small women.,Veronica approaches those small woman.,morphology,determiner_noun_agreement,determiner_noun_agreement_with_adj_irregular_1,True,True,False,True,731,-45.30378723144531,-47.285888671875,1
Robert hugs this scared person.,Robert hugs this scared people.,morphology,determiner_noun_agreement,determiner_noun_agreement_with_adj_irregular_1,True,True,False,True,732,-42.77741241455078,-44.324424743652344,1
Mitchell had bought this concealed cactus.,Mitchell had bought this concealed cacti.,morphology,determiner_noun_agreement,determiner_noun_agreement_with_adj_irregular_1,True,True,False,True,733,-64.23674011230469,-70.23042297363281,1
A pepper shocked these displeased alumni.,A pepper shocked these displeased alumnus.,morphology,determiner_noun_agreement,determiner_noun_agreement_with_adj_irregular_1,True,True,False,True,734,-80.22346496582031,-94.20199584960938,1
Timothy walked through these new oases.,Timothy walked through these new oasis.,morphology,determiner_noun_agreement,determiner_noun_agreement_with_adj_irregular_1,True,True,False,True,735,-55.14148712158203,-51.357322692871094,0
Janice did clean these smooth teeth.,Janice did clean these smooth tooth.,morphology,determiner_noun_agreement,determiner_noun_agreement_with_adj_irregular_1,True,True,False,True,736,-51.65824890136719,-53.995399475097656,1
Andrew had approached that small man.,Andrew had approached that small men.,morphology,determiner_noun_agreement,determiner_noun_agreement_with_adj_irregular_1,True,True,False,True,737,-36.72928237915039,-36.448829650878906,0
Wendy hides these red cacti.,Wendy hides these red cactus.,morphology,determiner_noun_agreement,determiner_noun_agreement_with_adj_irregular_1,True,True,False,True,738,-72.37028503417969,-66.50711059570312,0
Leslie visits that sick man.,Leslie visits that sick men.,morphology,determiner_noun_agreement,determiner_noun_agreement_with_adj_irregular_1,True,True,False,True,739,-47.65343475341797,-49.833648681640625,1
Those girls exit this brown oasis.,Those girls exit this brown oases.,morphology,determiner_noun_agreement,determiner_noun_agreement_with_adj_irregular_1,True,True,False,True,740,-53.83917999267578,-56.5338134765625,1
Christopher liked this red nucleus.,Christopher liked this red nuclei.,morphology,determiner_noun_agreement,determiner_noun_agreement_with_adj_irregular_1,True,True,False,True,741,-36.073516845703125,-43.120479583740234,1
Florence might forget this sick woman.,Florence might forget this sick women.,morphology,determiner_noun_agreement,determiner_noun_agreement_with_adj_irregular_1,True,True,False,True,742,-55.673946380615234,-57.89042663574219,1
These ladies sell that green cactus.,These ladies sell that green cacti.,morphology,determiner_noun_agreement,determiner_noun_agreement_with_adj_irregular_1,True,True,False,True,743,-46.031410217285156,-52.010276794433594,1
A lot of blouses disgust that uncertain alumnus.,A lot of blouses disgust that uncertain alumni.,morphology,determiner_noun_agreement,determiner_noun_agreement_with_adj_irregular_1,True,True,False,True,744,-100.99437713623047,-84.00428771972656,0
Patrick had exited those hidden oases.,Patrick had exited those hidden oasis.,morphology,determiner_noun_agreement,determiner_noun_agreement_with_adj_irregular_1,True,True,False,True,745,-59.742156982421875,-56.19304275512695,0
Gina was taking this big stimulus.,Gina was taking this big stimuli.,morphology,determiner_noun_agreement,determiner_noun_agreement_with_adj_irregular_1,True,True,False,True,746,-50.83082580566406,-51.70671844482422,1
A lot of pictures look like this uncertain child.,A lot of pictures look like this uncertain children.,morphology,determiner_noun_agreement,determiner_noun_agreement_with_adj_irregular_1,True,True,False,True,747,-62.606319427490234,-64.23551177978516,1
Adam passes this exposed oasis.,Adam passes this exposed oases.,morphology,determiner_noun_agreement,determiner_noun_agreement_with_adj_irregular_1,True,True,False,True,748,-49.25003433227539,-53.40593338012695,1
Some drawings shock that hidden woman.,Some drawings shock that hidden women.,morphology,determiner_noun_agreement,determiner_noun_agreement_with_adj_irregular_1,True,True,False,True,749,-51.08232879638672,-50.92311096191406,0
Nina has boycotted those small oases.,Nina has boycotted those small oasis.,morphology,determiner_noun_agreement,determiner_noun_agreement_with_adj_irregular_1,True,True,False,True,750,-88.52030944824219,-84.73622131347656,0
Bruce exits that white oasis.,Bruce exits that white oases.,morphology,determiner_noun_agreement,determiner_noun_agreement_with_adj_irregular_1,True,True,False,True,751,-46.50856018066406,-49.45659637451172,1
Mary investigated this unsure woman.,Mary investigated this unsure women.,morphology,determiner_noun_agreement,determiner_noun_agreement_with_adj_irregular_1,True,True,False,True,752,-43.30329513549805,-44.3367919921875,1
Diane criticized that bad synopsis.,Diane criticized that bad synopses.,morphology,determiner_noun_agreement,determiner_noun_agreement_with_adj_irregular_1,True,True,False,True,753,-60.114952087402344,-71.36972045898438,1
Those sketches stun this fast child.,Those sketches stun this fast children.,morphology,determiner_noun_agreement,determiner_noun_agreement_with_adj_irregular_1,True,True,False,True,754,-53.06861114501953,-51.73768615722656,0
Vanessa shouldn't observe these determined women.,Vanessa shouldn't observe these determined woman.,morphology,determiner_noun_agreement,determiner_noun_agreement_with_adj_irregular_1,True,True,False,True,755,-57.9820556640625,-60.232479095458984,1
Jill doesn't reference those clever children.,Jill doesn't reference those clever child.,morphology,determiner_noun_agreement,determiner_noun_agreement_with_adj_irregular_1,True,True,False,True,756,-63.44841003417969,-64.97785949707031,1
Every driver ran around that green oasis.,Every driver ran around that green oases.,morphology,determiner_noun_agreement,determiner_noun_agreement_with_adj_irregular_1,True,True,False,True,757,-56.56389617919922,-60.463600158691406,1
Many guys question this unlucky person.,Many guys question this unlucky people.,morphology,determiner_noun_agreement,determiner_noun_agreement_with_adj_irregular_1,True,True,False,True,758,-47.59858703613281,-46.60674285888672,0
Laura won't heal that concealed man.,Laura won't heal that concealed men.,morphology,determiner_noun_agreement,determiner_noun_agreement_with_adj_irregular_1,True,True,False,True,759,-44.58667755126953,-45.35588836669922,1
A lot of people care for that unemployed person.,A lot of people care for that unemployed people.,morphology,determiner_noun_agreement,determiner_noun_agreement_with_adj_irregular_1,True,True,False,True,760,-54.50765609741211,-51.41428756713867,0
Natalie liked those small lice.,Natalie liked those small louse.,morphology,determiner_noun_agreement,determiner_noun_agreement_with_adj_irregular_1,True,True,False,True,761,-54.68595886230469,-53.69738006591797,0
An eggplant bores those small women.,An eggplant bores those small woman.,morphology,determiner_noun_agreement,determiner_noun_agreement_with_adj_irregular_1,True,True,False,True,762,-65.01822662353516,-67.13915252685547,1
A lot of waiters admire this big louse.,A lot of waiters admire this big lice.,morphology,determiner_noun_agreement,determiner_noun_agreement_with_adj_irregular_1,True,True,False,True,763,-83.52057647705078,-84.17178344726562,1
These students conceal those standing children.,These students conceal those standing child.,morphology,determiner_noun_agreement,determiner_noun_agreement_with_adj_irregular_1,True,True,False,True,764,-50.76211166381836,-50.70585632324219,0
The customers appreciate those happy people.,The customers appreciate those happy person.,morphology,determiner_noun_agreement,determiner_noun_agreement_with_adj_irregular_1,True,True,False,True,765,-43.874977111816406,-46.035003662109375,1
Ronald has scared this popular child.,Ronald has scared this popular children.,morphology,determiner_noun_agreement,determiner_noun_agreement_with_adj_irregular_1,True,True,False,True,766,-50.687652587890625,-51.91408920288086,1
Matt hadn't walked through those hidden oases.,Matt hadn't walked through those hidden oasis.,morphology,determiner_noun_agreement,determiner_noun_agreement_with_adj_irregular_1,True,True,False,True,767,-59.47983169555664,-55.99327087402344,0
Barbara couldn't walk through those old oases.,Barbara couldn't walk through those old oasis.,morphology,determiner_noun_agreement,determiner_noun_agreement_with_adj_irregular_1,True,True,False,True,768,-57.1377067565918,-53.59050750732422,0
These actors messed up that messy foot.,These actors messed up that messy feet.,morphology,determiner_noun_agreement,determiner_noun_agreement_with_adj_irregular_1,True,True,False,True,769,-48.761207580566406,-46.79078674316406,0
Donald conceals those red cacti.,Donald conceals those red cactus.,morphology,determiner_noun_agreement,determiner_noun_agreement_with_adj_irregular_1,True,True,False,True,770,-61.83366775512695,-56.43915557861328,0
Many commentaries shock those happy men.,Many commentaries shock those happy man.,morphology,determiner_noun_agreement,determiner_noun_agreement_with_adj_irregular_1,True,True,False,True,771,-62.18061828613281,-62.847389221191406,1
Every guy hugged this lucky child.,Every guy hugged this lucky children.,morphology,determiner_noun_agreement,determiner_noun_agreement_with_adj_irregular_1,True,True,False,True,772,-47.010986328125,-48.21229553222656,1
Janice should hire this unsure alumnus.,Janice should hire this unsure alumni.,morphology,determiner_noun_agreement,determiner_noun_agreement_with_adj_irregular_1,True,True,False,True,773,-78.02896118164062,-60.62272644042969,0
Many organizations haven't fired those big men.,Many organizations haven't fired those big man.,morphology,determiner_noun_agreement,determiner_noun_agreement_with_adj_irregular_1,True,True,False,True,774,-48.29899978637695,-49.49144744873047,1
Ice cream alarmed that unsure man.,Ice cream alarmed that unsure men.,morphology,determiner_noun_agreement,determiner_noun_agreement_with_adj_irregular_1,True,True,False,True,775,-51.21727752685547,-53.574867248535156,1
Carol wasn't returning to these displeased people.,Carol wasn't returning to these displeased person.,morphology,determiner_noun_agreement,determiner_noun_agreement_with_adj_irregular_1,True,True,False,True,776,-65.33573913574219,-69.66484069824219,1
Robert has thought about this unsure person.,Robert has thought about this unsure people.,morphology,determiner_noun_agreement,determiner_noun_agreement_with_adj_irregular_1,True,True,False,True,777,-41.87847137451172,-42.20703887939453,1
Karen explores those green oases.,Karen explores those green oasis.,morphology,determiner_noun_agreement,determiner_noun_agreement_with_adj_irregular_1,True,True,False,True,778,-68.61064910888672,-66.29541778564453,0
Every child hasn't scared this determined child.,Every child hasn't scared this determined children.,morphology,determiner_noun_agreement,determiner_noun_agreement_with_adj_irregular_1,True,True,False,True,779,-51.617435455322266,-50.747886657714844,0
Some couch aggravates this excited child.,Some couch aggravates this excited children.,morphology,determiner_noun_agreement,determiner_noun_agreement_with_adj_irregular_1,True,True,False,True,780,-58.01012420654297,-57.642093658447266,0
The Impressionists had hired these confident alumni.,The Impressionists had hired these confident alumnus.,morphology,determiner_noun_agreement,determiner_noun_agreement_with_adj_irregular_1,True,True,False,True,781,-78.86245727539062,-95.40457916259766,1
Melanie hasn't toured that black oasis.,Melanie hasn't toured that black oases.,morphology,determiner_noun_agreement,determiner_noun_agreement_with_adj_irregular_1,True,True,False,True,782,-59.63429260253906,-63.14152526855469,1
Joseph had brought this exposed nucleus.,Joseph had brought this exposed nuclei.,morphology,determiner_noun_agreement,determiner_noun_agreement_with_adj_irregular_1,True,True,False,True,783,-46.86835479736328,-54.652462005615234,1
