sentence_good,sentence_bad,field,linguistics_term,UID,simple_LM_method,one_prefix_method,two_prefix_method,lexically_identical,pair_id,good_prob,bad_prob,correct
Suzanne shouldn't reveal that thesis.,Suzanne shouldn't reveal those thesis.,morphology,determiner_noun_agreement,determiner_noun_agreement_irregular_2,True,False,True,True,747,-50.04720687866211,-51.4830436706543,1
Jerry shocked that woman.,Jerry shocked those woman.,morphology,determiner_noun_agreement,determiner_noun_agreement_irregular_2,True,False,True,True,748,-25.382389068603516,-30.50276756286621,1
Most women fire these women.,Most women fire this women.,morphology,determiner_noun_agreement,determiner_noun_agreement_irregular_2,True,False,True,True,749,-32.529476165771484,-35.95323181152344,1
The Clintons conceal that louse.,The Clintons conceal those louse.,morphology,determiner_noun_agreement,determiner_noun_agreement_irregular_2,True,False,True,True,750,-50.415794372558594,-52.98039627075195,1
Those ladies go to those oases.,Those ladies go to that oases.,morphology,determiner_noun_agreement,determiner_noun_agreement_irregular_2,True,False,True,True,751,-42.01705551147461,-41.84862518310547,0
The closet bores that person.,The closet bores those person.,morphology,determiner_noun_agreement,determiner_noun_agreement_irregular_2,True,False,True,True,752,-42.134246826171875,-47.05066680908203,1
Craig wouldn't irritate that alumnus.,Craig wouldn't irritate those alumnus.,morphology,determiner_noun_agreement,determiner_noun_agreement_irregular_2,True,False,True,True,753,-62.6732177734375,-65.19591522216797,1
A lot of children mess up these feet.,A lot of children mess up this feet.,morphology,determiner_noun_agreement,determiner_noun_agreement_irregular_2,True,False,True,True,754,-52.143096923828125,-52.899627685546875,1
Kristin hadn't stunned this child.,Kristin hadn't stunned these child.,morphology,determiner_noun_agreement,determiner_noun_agreement_irregular_2,True,False,True,True,755,-45.8252067565918,-48.335811614990234,1
Aaron left this child.,Aaron left these child.,morphology,determiner_noun_agreement,determiner_noun_agreement_irregular_2,True,False,True,True,756,-22.7083740234375,-26.287067413330078,1
Many students saw these feet.,Many students saw this feet.,morphology,determiner_noun_agreement,determiner_noun_agreement_irregular_2,True,False,True,True,757,-32.0861930847168,-34.389366149902344,1
Some bicycle embarrassed these alumni.,Some bicycle embarrassed this alumni.,morphology,determiner_noun_agreement,determiner_noun_agreement_irregular_2,True,False,True,True,758,-47.600181579589844,-47.735435485839844,1
Carol isn't examining those analyses.,Carol isn't examining that analyses.,morphology,determiner_noun_agreement,determiner_noun_agreement_irregular_2,True,False,True,True,759,-49.72596740722656,-50.11255645751953,1
Caroline has respected this woman.,Caroline has respected these woman.,morphology,determiner_noun_agreement,determiner_noun_agreement_irregular_2,True,False,True,True,760,-34.83639907836914,-39.15498733520508,1
The teenager has hidden those fungi.,The teenager has hidden that fungi.,morphology,determiner_noun_agreement,determiner_noun_agreement_irregular_2,True,False,True,True,761,-46.11167907714844,-45.411346435546875,0
Sheila won't pass this oasis.,Sheila won't pass these oasis.,morphology,determiner_noun_agreement,determiner_noun_agreement_irregular_2,True,False,True,True,762,-52.3798828125,-52.3555908203125,0
Phillip won't walk through that oasis.,Phillip won't walk through those oasis.,morphology,determiner_noun_agreement,determiner_noun_agreement_irregular_2,True,False,True,True,763,-53.57273864746094,-55.04408264160156,1
Monet cared for those children.,Monet cared for that children.,morphology,determiner_noun_agreement,determiner_noun_agreement_irregular_2,True,False,True,True,764,-32.93202590942383,-33.73145294189453,1
Bradley hadn't hugged those alumni.,Bradley hadn't hugged that alumni.,morphology,determiner_noun_agreement,determiner_noun_agreement_irregular_2,True,False,True,True,765,-50.20936584472656,-50.32205581665039,1
Heidi boasted about this diagnosis.,Heidi boasted about these diagnosis.,morphology,determiner_noun_agreement,determiner_noun_agreement_irregular_2,True,False,True,True,766,-50.810523986816406,-52.70412063598633,1
Emily won't scare those women.,Emily won't scare that women.,morphology,determiner_noun_agreement,determiner_noun_agreement_irregular_2,True,False,True,True,767,-29.55978012084961,-31.880695343017578,1
Every waiter could care for that man.,Every waiter could care for those man.,morphology,determiner_noun_agreement,determiner_noun_agreement_irregular_2,True,False,True,True,768,-42.1087760925293,-45.338436126708984,1
That company aggravated these women.,That company aggravated this women.,morphology,determiner_noun_agreement,determiner_noun_agreement_irregular_2,True,False,True,True,769,-45.95018005371094,-49.47577667236328,1
Christine disturbed this woman.,Christine disturbed these woman.,morphology,determiner_noun_agreement,determiner_noun_agreement_irregular_2,True,False,True,True,770,-36.20124435424805,-40.42833709716797,1
This photograph shouldn't look like this mouse.,This photograph shouldn't look like these mouse.,morphology,determiner_noun_agreement,determiner_noun_agreement_irregular_2,True,False,True,True,771,-48.79954528808594,-50.583702087402344,1
Dana won't scan this analysis.,Dana won't scan these analysis.,morphology,determiner_noun_agreement,determiner_noun_agreement_irregular_2,True,False,True,True,772,-48.91349411010742,-50.71775436401367,1
Aaron isn't fixing that tooth.,Aaron isn't fixing those tooth.,morphology,determiner_noun_agreement,determiner_noun_agreement_irregular_2,True,False,True,True,773,-32.082061767578125,-34.98222732543945,1
Some cashier doesn't sell those oxen.,Some cashier doesn't sell that oxen.,morphology,determiner_noun_agreement,determiner_noun_agreement_irregular_2,True,False,True,True,774,-57.29584503173828,-54.659698486328125,0
Julia kisses that person.,Julia kisses those person.,morphology,determiner_noun_agreement,determiner_noun_agreement_irregular_2,True,False,True,True,775,-31.217269897460938,-34.37367248535156,1
Monica boycotts those oases.,Monica boycotts that oases.,morphology,determiner_noun_agreement,determiner_noun_agreement_irregular_2,True,False,True,True,776,-60.05577087402344,-59.277679443359375,0
Peter wasn't lifting that ox.,Peter wasn't lifting those ox.,morphology,determiner_noun_agreement,determiner_noun_agreement_irregular_2,True,False,True,True,777,-38.271949768066406,-38.832054138183594,1
Julia isn't shocking that man.,Julia isn't shocking those man.,morphology,determiner_noun_agreement,determiner_noun_agreement_irregular_2,True,False,True,True,778,-39.86030578613281,-44.29709243774414,1
Walter wasn't discovering those nuclei.,Walter wasn't discovering that nuclei.,morphology,determiner_noun_agreement,determiner_noun_agreement_irregular_2,True,False,True,True,779,-58.725860595703125,-56.647613525390625,0
Most customers have gone to that oasis.,Most customers have gone to those oasis.,morphology,determiner_noun_agreement,determiner_noun_agreement_irregular_2,True,False,True,True,780,-43.74005889892578,-43.77825927734375,1
Monica can't research those phenomena.,Monica can't research that phenomena.,morphology,determiner_noun_agreement,determiner_noun_agreement_irregular_2,True,False,True,True,781,-47.05579376220703,-46.481082916259766,0
Maria wouldn't know this child.,Maria wouldn't know these child.,morphology,determiner_noun_agreement,determiner_noun_agreement_irregular_2,True,False,True,True,782,-26.073759078979492,-28.449161529541016,1
Debra hasn't cared for those children.,Debra hasn't cared for that children.,morphology,determiner_noun_agreement,determiner_noun_agreement_irregular_2,True,False,True,True,783,-35.779685974121094,-37.126800537109375,1
David is selling these geese.,David is selling this geese.,morphology,determiner_noun_agreement,determiner_noun_agreement_irregular_2,True,False,True,True,784,-39.98743438720703,-39.4078369140625,0
The guests disagree with that woman.,The guests disagree with those woman.,morphology,determiner_noun_agreement,determiner_noun_agreement_irregular_2,True,False,True,True,785,-36.313011169433594,-40.44315719604492,1
Beverly was working with this person.,Beverly was working with these person.,morphology,determiner_noun_agreement,determiner_noun_agreement_irregular_2,True,False,True,True,786,-53.503990173339844,-57.81822967529297,1
Diana respected these people.,Diana respected this people.,morphology,determiner_noun_agreement,determiner_noun_agreement_irregular_2,True,False,True,True,787,-39.27973937988281,-43.989654541015625,1
Peter hadn't remembered that woman.,Peter hadn't remembered those woman.,morphology,determiner_noun_agreement,determiner_noun_agreement_irregular_2,True,False,True,True,788,-30.964080810546875,-35.99915313720703,1
Alice wouldn't describe this child.,Alice wouldn't describe these child.,morphology,determiner_noun_agreement,determiner_noun_agreement_irregular_2,True,False,True,True,789,-28.04083251953125,-31.022891998291016,1
Omar doesn't distract those men.,Omar doesn't distract that men.,morphology,determiner_noun_agreement,determiner_noun_agreement_irregular_2,True,False,True,True,790,-44.486717224121094,-45.429298400878906,1
Mitchell might care for this child.,Mitchell might care for these child.,morphology,determiner_noun_agreement,determiner_noun_agreement_irregular_2,True,False,True,True,791,-44.78001403808594,-47.981422424316406,1
This skirt has impressed these men.,This skirt has impressed this men.,morphology,determiner_noun_agreement,determiner_noun_agreement_irregular_2,True,False,True,True,792,-43.41777038574219,-45.76446533203125,1
Stephen irritated this man.,Stephen irritated these man.,morphology,determiner_noun_agreement,determiner_noun_agreement_irregular_2,True,False,True,True,793,-25.776735305786133,-29.08465576171875,1
Ann will lift those geese.,Ann will lift that geese.,morphology,determiner_noun_agreement,determiner_noun_agreement_irregular_2,True,False,True,True,794,-43.43292236328125,-41.457557678222656,0
Julie isn't criticizing those men.,Julie isn't criticizing that men.,morphology,determiner_noun_agreement,determiner_noun_agreement_irregular_2,True,False,True,True,795,-39.267173767089844,-39.24241638183594,0
Those people found this thesis.,Those people found these thesis.,morphology,determiner_noun_agreement,determiner_noun_agreement_irregular_2,True,False,True,True,796,-30.133987426757812,-30.88263702392578,1
Anne isn't confusing that woman.,Anne isn't confusing those woman.,morphology,determiner_noun_agreement,determiner_noun_agreement_irregular_2,True,False,True,True,797,-35.7819709777832,-40.7122688293457,1
Many sketches have looked like those fungi.,Many sketches have looked like that fungi.,morphology,determiner_noun_agreement,determiner_noun_agreement_irregular_2,True,False,True,True,798,-46.979522705078125,-46.789886474609375,0
Edward hugged those men.,Edward hugged that men.,morphology,determiner_noun_agreement,determiner_noun_agreement_irregular_2,True,False,True,True,799,-28.232528686523438,-30.134355545043945,1
A lot of tomatoes astound these women.,A lot of tomatoes astound this women.,morphology,determiner_noun_agreement,determiner_noun_agreement_irregular_2,True,False,True,True,800,-62.81884002685547,-66.61196899414062,1
Some photograph will look like those octopi.,Some photograph will look like that octopi.,morphology,determiner_noun_agreement,determiner_noun_agreement_irregular_2,True,False,True,True,801,-56.076656341552734,-54.43709945678711,0
Those actresses were escaping from these men.,Those actresses were escaping from this men.,morphology,determiner_noun_agreement,determiner_noun_agreement_irregular_2,True,False,True,True,802,-42.76969909667969,-43.90250778198242,1
Grace ran around these oases.,Grace ran around this oases.,morphology,determiner_noun_agreement,determiner_noun_agreement_irregular_2,True,False,True,True,803,-49.80418014526367,-49.50584411621094,0
An apple can disturb those men.,An apple can disturb that men.,morphology,determiner_noun_agreement,determiner_noun_agreement_irregular_2,True,False,True,True,804,-39.27826690673828,-39.737640380859375,1
A waiter wasn't taking this axis.,A waiter wasn't taking these axis.,morphology,determiner_noun_agreement,determiner_noun_agreement_irregular_2,True,False,True,True,805,-53.46281433105469,-54.51336669921875,1
Christine found those fungi.,Christine found that fungi.,morphology,determiner_noun_agreement,determiner_noun_agreement_irregular_2,True,False,True,True,806,-37.67649459838867,-37.542015075683594,0
Kirsten isn't observing this child.,Kirsten isn't observing these child.,morphology,determiner_noun_agreement,determiner_noun_agreement_irregular_2,True,False,True,True,807,-49.093570709228516,-51.99552536010742,1
A lake irritates that man.,A lake irritates those man.,morphology,determiner_noun_agreement,determiner_noun_agreement_irregular_2,True,False,True,True,808,-54.59864807128906,-58.653961181640625,1
Dana could walk through this oasis.,Dana could walk through these oasis.,morphology,determiner_noun_agreement,determiner_noun_agreement_irregular_2,True,False,True,True,809,-54.18987274169922,-55.17787170410156,1
Caroline liked these stimuli.,Caroline liked this stimuli.,morphology,determiner_noun_agreement,determiner_noun_agreement_irregular_2,True,False,True,True,810,-35.863677978515625,-35.16826629638672,0
Patients disturb those women.,Patients disturb that women.,morphology,determiner_noun_agreement,determiner_noun_agreement_irregular_2,True,False,True,True,811,-39.171958923339844,-40.395240783691406,1
Carla did break these feet.,Carla did break this feet.,morphology,determiner_noun_agreement,determiner_noun_agreement_irregular_2,True,False,True,True,812,-39.37654495239258,-40.80095672607422,1
Some guest could describe those men.,Some guest could describe that men.,morphology,determiner_noun_agreement,determiner_noun_agreement_irregular_2,True,False,True,True,813,-40.48783874511719,-39.65205383300781,0
Laura messes up those teeth.,Laura messes up that teeth.,morphology,determiner_noun_agreement,determiner_noun_agreement_irregular_2,True,False,True,True,814,-40.00737380981445,-39.22733688354492,0
Amy would find these geese.,Amy would find this geese.,morphology,determiner_noun_agreement,determiner_noun_agreement_irregular_2,True,False,True,True,815,-38.51607131958008,-37.43559646606445,0
The Impressionists had cleaned those feet.,The Impressionists had cleaned that feet.,morphology,determiner_noun_agreement,determiner_noun_agreement_irregular_2,True,False,True,True,816,-60.38825225830078,-61.29918670654297,1
Christina observed this alumnus.,Christina observed these alumnus.,morphology,determiner_noun_agreement,determiner_noun_agreement_irregular_2,True,False,True,True,817,-56.18644714355469,-57.55531692504883,1
Irene should boycott that oasis.,Irene should boycott those oasis.,morphology,determiner_noun_agreement,determiner_noun_agreement_irregular_2,True,False,True,True,818,-61.97819137573242,-65.59953308105469,1
Monica runs around those oases.,Monica runs around that oases.,morphology,determiner_noun_agreement,determiner_noun_agreement_irregular_2,True,False,True,True,819,-47.74043273925781,-46.708984375,0
The Clintons drive to these oases.,The Clintons drive to this oases.,morphology,determiner_noun_agreement,determiner_noun_agreement_irregular_2,True,False,True,True,820,-55.12665557861328,-55.20759582519531,1
The icicles had impressed these women.,The icicles had impressed this women.,morphology,determiner_noun_agreement,determiner_noun_agreement_irregular_2,True,False,True,True,821,-50.9248046875,-54.95124435424805,1
A lot of students work with these women.,A lot of students work with this women.,morphology,determiner_noun_agreement,determiner_noun_agreement_irregular_2,True,False,True,True,822,-48.56177520751953,-51.18156433105469,1
Kevin had talked to that man.,Kevin had talked to those man.,morphology,determiner_noun_agreement,determiner_noun_agreement_irregular_2,True,False,True,True,823,-27.123821258544922,-31.256805419921875,1
Lisa praised those alumni.,Lisa praised that alumni.,morphology,determiner_noun_agreement,determiner_noun_agreement_irregular_2,True,False,True,True,824,-32.91912078857422,-30.380245208740234,0
A patient hadn't gone to those oases.,A patient hadn't gone to that oases.,morphology,determiner_noun_agreement,determiner_noun_agreement_irregular_2,True,False,True,True,825,-64.59500885009766,-64.57833099365234,0
Walter is approaching this person.,Walter is approaching these person.,morphology,determiner_noun_agreement,determiner_noun_agreement_irregular_2,True,False,True,True,826,-33.435821533203125,-37.762176513671875,1
Brenda isn't buying those teeth.,Brenda isn't buying that teeth.,morphology,determiner_noun_agreement,determiner_noun_agreement_irregular_2,True,False,True,True,827,-34.613258361816406,-33.8787956237793,0
Marie hasn't fired those men.,Marie hasn't fired that men.,morphology,determiner_noun_agreement,determiner_noun_agreement_irregular_2,True,False,True,True,828,-35.02289581298828,-34.5172233581543,0
Carts upset these men.,Carts upset this men.,morphology,determiner_noun_agreement,determiner_noun_agreement_irregular_2,True,False,True,True,829,-43.68357849121094,-46.18583297729492,1
Those children argue about that diagnosis.,Those children argue about those diagnosis.,morphology,determiner_noun_agreement,determiner_noun_agreement_irregular_2,True,False,True,True,830,-34.55635070800781,-35.8670539855957,1
Maria would tour these oases.,Maria would tour this oases.,morphology,determiner_noun_agreement,determiner_noun_agreement_irregular_2,True,False,True,True,831,-46.980308532714844,-48.8994140625,1
Irene couldn't criticize these oases.,Irene couldn't criticize this oases.,morphology,determiner_noun_agreement,determiner_noun_agreement_irregular_2,True,False,True,True,832,-61.20929718017578,-62.789703369140625,1
Candice references those women.,Candice references that women.,morphology,determiner_noun_agreement,determiner_noun_agreement_irregular_2,True,False,True,True,833,-34.85041046142578,-34.65007781982422,0
Some boys fix those feet.,Some boys fix that feet.,morphology,determiner_noun_agreement,determiner_noun_agreement_irregular_2,True,False,True,True,834,-33.58406066894531,-33.6681022644043,1
Dawn scanned those analyses.,Dawn scanned that analyses.,morphology,determiner_noun_agreement,determiner_noun_agreement_irregular_2,True,False,True,True,835,-49.06562042236328,-49.09716033935547,1
Some person respected this man.,Some person respected these man.,morphology,determiner_noun_agreement,determiner_noun_agreement_irregular_2,True,False,True,True,836,-33.885772705078125,-35.36311721801758,1
Monet is skated around these oases.,Monet is skated around this oases.,morphology,determiner_noun_agreement,determiner_noun_agreement_irregular_2,True,False,True,True,837,-63.783470153808594,-64.01400756835938,1
Gregory wasn't boasting about that diagnosis.,Gregory wasn't boasting about those diagnosis.,morphology,determiner_noun_agreement,determiner_noun_agreement_irregular_2,True,False,True,True,838,-58.46952819824219,-59.679351806640625,1
Many cashiers disagreed with these men.,Many cashiers disagreed with this men.,morphology,determiner_noun_agreement,determiner_noun_agreement_irregular_2,True,False,True,True,839,-50.09250259399414,-51.805946350097656,1
Most teenagers cured those oxen.,Most teenagers cured that oxen.,morphology,determiner_noun_agreement,determiner_noun_agreement_irregular_2,True,False,True,True,840,-47.51583480834961,-44.91090393066406,0
Michael knew these people.,Michael knew this people.,morphology,determiner_noun_agreement,determiner_noun_agreement_irregular_2,True,False,True,True,841,-20.601261138916016,-24.376399993896484,1
Pamela hasn't found these men.,Pamela hasn't found this men.,morphology,determiner_noun_agreement,determiner_noun_agreement_irregular_2,True,False,True,True,842,-50.71712875366211,-52.91980743408203,1
Eric had bought that foot.,Eric had bought those foot.,morphology,determiner_noun_agreement,determiner_noun_agreement_irregular_2,True,False,True,True,843,-27.961105346679688,-31.359899520874023,1
Brian runs around those oases.,Brian runs around that oases.,morphology,determiner_noun_agreement,determiner_noun_agreement_irregular_2,True,False,True,True,844,-40.37432098388672,-39.58251190185547,0
All people drop by these oases.,All people drop by this oases.,morphology,determiner_noun_agreement,determiner_noun_agreement_irregular_2,True,False,True,True,845,-49.91480255126953,-51.03840637207031,1
The companies praise these theses.,The companies praise this theses.,morphology,determiner_noun_agreement,determiner_noun_agreement_irregular_2,True,False,True,True,846,-49.145206451416016,-49.850189208984375,1
Becky hasn't respected these children.,Becky hasn't respected this children.,morphology,determiner_noun_agreement,determiner_noun_agreement_irregular_2,True,False,True,True,847,-33.95301055908203,-38.1834716796875,1
That guest didn't know these people.,That guest didn't know this people.,morphology,determiner_noun_agreement,determiner_noun_agreement_irregular_2,True,False,True,True,848,-39.01708984375,-43.45576477050781,1
Scott hugged these men.,Scott hugged this men.,morphology,determiner_noun_agreement,determiner_noun_agreement_irregular_2,True,False,True,True,849,-28.82705307006836,-31.349903106689453,1
All couches weren't disgusting this man.,All couches weren't disgusting these man.,morphology,determiner_noun_agreement,determiner_noun_agreement_irregular_2,True,False,True,True,850,-56.484458923339844,-58.95270538330078,1
Janice fixes those feet.,Janice fixes that feet.,morphology,determiner_noun_agreement,determiner_noun_agreement_irregular_2,True,False,True,True,851,-40.19236755371094,-40.30832290649414,1
Many doctors exit that oasis.,Many doctors exit those oasis.,morphology,determiner_noun_agreement,determiner_noun_agreement_irregular_2,True,False,True,True,852,-44.964195251464844,-45.55738067626953,1
James hasn't concealed this woman.,James hasn't concealed these woman.,morphology,determiner_noun_agreement,determiner_noun_agreement_irregular_2,True,False,True,True,853,-36.82453918457031,-41.19920349121094,1
Susan is exiting this oasis.,Susan is exiting these oasis.,morphology,determiner_noun_agreement,determiner_noun_agreement_irregular_2,True,False,True,True,854,-48.856224060058594,-48.66149139404297,0
Some waiter might tour that oasis.,Some waiter might tour those oasis.,morphology,determiner_noun_agreement,determiner_noun_agreement_irregular_2,True,False,True,True,855,-58.02423095703125,-60.357147216796875,1
Lawrence criticized these children.,Lawrence criticized this children.,morphology,determiner_noun_agreement,determiner_noun_agreement_irregular_2,True,False,True,True,856,-32.496551513671875,-35.976898193359375,1
Many adults should describe this woman.,Many adults should describe these woman.,morphology,determiner_noun_agreement,determiner_noun_agreement_irregular_2,True,False,True,True,857,-34.13707733154297,-37.50892639160156,1
Carlos messes up these feet.,Carlos messes up this feet.,morphology,determiner_noun_agreement,determiner_noun_agreement_irregular_2,True,False,True,True,858,-45.451473236083984,-45.923439025878906,1
Beth isn't selling these octopi.,Beth isn't selling this octopi.,morphology,determiner_noun_agreement,determiner_noun_agreement_irregular_2,True,False,True,True,859,-69.2817153930664,-69.43927764892578,1
Rachelle wasn't revealing this nucleus.,Rachelle wasn't revealing these nucleus.,morphology,determiner_noun_agreement,determiner_noun_agreement_irregular_2,True,False,True,True,860,-52.33884048461914,-53.869388580322266,1
Leslie listens to that child.,Leslie listens to those child.,morphology,determiner_noun_agreement,determiner_noun_agreement_irregular_2,True,False,True,True,861,-33.286869049072266,-35.989845275878906,1
Richard wasn't fixing those feet.,Richard wasn't fixing that feet.,morphology,determiner_noun_agreement,determiner_noun_agreement_irregular_2,True,False,True,True,862,-31.456256866455078,-31.705005645751953,1
Most teachers escape from these men.,Most teachers escape from this men.,morphology,determiner_noun_agreement,determiner_noun_agreement_irregular_2,True,False,True,True,863,-39.24018096923828,-40.08271026611328,1
Claire doesn't boycott this oasis.,Claire doesn't boycott these oasis.,morphology,determiner_noun_agreement,determiner_noun_agreement_irregular_2,True,False,True,True,864,-58.66935348510742,-58.192771911621094,0
Omar might pass those oases.,Omar might pass that oases.,morphology,determiner_noun_agreement,determiner_noun_agreement_irregular_2,True,False,True,True,865,-54.9199104309082,-54.35279846191406,0
Andrew can't clean this foot.,Andrew can't clean these foot.,morphology,determiner_noun_agreement,determiner_noun_agreement_irregular_2,True,False,True,True,866,-32.227203369140625,-34.95030212402344,1
Janice appreciated that stimulus.,Janice appreciated those stimulus.,morphology,determiner_noun_agreement,determiner_noun_agreement_irregular_2,True,False,True,True,867,-42.64339828491211,-44.30129623413086,1
Gina had hired this child.,Gina had hired these child.,morphology,determiner_noun_agreement,determiner_noun_agreement_irregular_2,True,False,True,True,868,-42.54840850830078,-44.69326400756836,1
Some banks don't respect that oasis.,Some banks don't respect those oasis.,morphology,determiner_noun_agreement,determiner_noun_agreement_irregular_2,True,False,True,True,869,-51.63542175292969,-53.128456115722656,1
The Clintons hire these children.,The Clintons hire this children.,morphology,determiner_noun_agreement,determiner_noun_agreement_irregular_2,True,False,True,True,870,-40.70485305786133,-44.220401763916016,1
