sentence_good,sentence_bad,field,linguistics_term,UID,simple_LM_method,one_prefix_method,two_prefix_method,lexically_identical,pair_id,good_prob,bad_prob,correct
Deanna wasn't concealing Dana.,Deanna wasn't muttering Dana.,syntax,argument_structure,transitive,True,False,True,False,431,-57.42748260498047,-57.16346740722656,0
These customers complain about a lady.,These customers disagreed a lady.,syntax,argument_structure,transitive,True,False,True,False,432,-38.64598846435547,-36.00184631347656,0
Kathleen visited Carlos.,Kathleen lies Carlos.,syntax,argument_structure,transitive,True,False,True,False,433,-51.478485107421875,-52.0592041015625,1
Michelle aggravated Gregory.,Michelle blinks Gregory.,syntax,argument_structure,transitive,True,False,True,False,434,-31.48480987548828,-37.055152893066406,1
Joseph dropped by those closets.,Joseph shrugs those closets.,syntax,argument_structure,transitive,True,False,True,False,435,-38.16747283935547,-46.41157531738281,1
Some organizations referenced Kristen's grandfathers.,Some organizations testify Kristen's grandfathers.,syntax,argument_structure,transitive,True,False,True,False,436,-61.70421600341797,-63.52558517456055,1
A picture looks like a mirror.,A picture falls a mirror.,syntax,argument_structure,transitive,True,False,True,False,437,-42.35772705078125,-48.42731475830078,1
Erin had hidden the adults' wife.,Erin had concurred the adults' wife.,syntax,argument_structure,transitive,True,False,True,False,438,-53.86992645263672,-66.38970947265625,1
A lot of customers fix all cups.,A lot of customers fell all cups.,syntax,argument_structure,transitive,True,False,True,False,439,-55.344482421875,-56.452064514160156,1
Curtis's ex-wives appreciated Harvard University.,Curtis's ex-wives chat Harvard University.,syntax,argument_structure,transitive,True,False,True,False,440,-83.70863342285156,-85.80729675292969,1
Many waitresses' ex-wives have observed all drivers.,Many waitresses' ex-wives have conspired all drivers.,syntax,argument_structure,transitive,True,False,True,False,441,-88.27645874023438,-95.9013671875,1
Anne left most grandmothers of Andrea.,Anne laughs most grandmothers of Andrea.,syntax,argument_structure,transitive,True,False,True,False,442,-56.066444396972656,-59.84571838378906,1
Brenda sounds like a lot of movie theaters.,Brenda blinked a lot of movie theaters.,syntax,argument_structure,transitive,True,False,True,False,443,-41.20645523071289,-55.97169494628906,1
Carl's mentor had insulted every pedestrian.,Carl's mentor had cried every pedestrian.,syntax,argument_structure,transitive,True,False,True,False,444,-60.104393005371094,-58.917274475097656,0
Douglas's plumber is passing a mall.,Douglas's plumber is coming here a mall.,syntax,argument_structure,transitive,True,False,True,False,445,-58.32098388671875,-61.20195388793945,1
Many guys care for Tonya.,Many guys respond Tonya.,syntax,argument_structure,transitive,True,False,True,False,446,-40.74824523925781,-45.79768753051758,1
Those ladies attacked Tammy's piano teachers.,Those ladies came here Tammy's piano teachers.,syntax,argument_structure,transitive,True,False,True,False,447,-58.50323486328125,-62.16297149658203,1
Connie's dermatologist kissed Monica's plumbers.,Connie's dermatologist nods Monica's plumbers.,syntax,argument_structure,transitive,True,False,True,False,448,-84.7575454711914,-91.43014526367188,1
Kristin does lift most shirts.,Kristin does shout most shirts.,syntax,argument_structure,transitive,True,False,True,False,449,-48.33289337158203,-50.77392578125,1
Sheila could clean a lot of banks.,Sheila could concur a lot of banks.,syntax,argument_structure,transitive,True,False,True,False,450,-42.27909469604492,-53.908817291259766,1
Most hospitals help Meredith's grandmothers.,Most hospitals joke around Meredith's grandmothers.,syntax,argument_structure,transitive,True,False,True,False,451,-53.50324630737305,-62.58152389526367,1
Many governments might argue about Melinda.,Many governments might react Melinda.,syntax,argument_structure,transitive,True,False,True,False,452,-51.28778076171875,-49.53832244873047,0
Sonia's hairdresser messed up all schools.,Sonia's hairdresser struggles all schools.,syntax,argument_structure,transitive,True,False,True,False,453,-68.47921752929688,-71.28343963623047,1
Brian criticized some brothers of Raymond.,Brian shrugged some brothers of Raymond.,syntax,argument_structure,transitive,True,False,True,False,454,-46.65615463256836,-53.107688903808594,1
Those boys admire a lot of peppers.,Those boys slumped over a lot of peppers.,syntax,argument_structure,transitive,True,False,True,False,455,-39.11742401123047,-50.8721809387207,1
Joseph's sons remember many mountains.,Joseph's sons screamed many mountains.,syntax,argument_structure,transitive,True,False,True,False,456,-44.54313659667969,-48.96010208129883,1
A lot of children had noticed all teachers.,A lot of children had sighed all teachers.,syntax,argument_structure,transitive,True,False,True,False,457,-53.28364181518555,-63.554866790771484,1
A lot of shawls embarrass some pedestrians.,A lot of shawls fall some pedestrians.,syntax,argument_structure,transitive,True,False,True,False,458,-73.43798828125,-71.08490753173828,0
Every student's oncologist had concealed Vincent's teachers.,Every student's oncologist had fallen asleep Vincent's teachers.,syntax,argument_structure,transitive,True,False,True,False,459,-85.22749328613281,-85.54000854492188,1
The dancer wouldn't talk about Heather's boss.,The dancer wouldn't escape Heather's boss.,syntax,argument_structure,transitive,True,False,True,False,460,-53.13286590576172,-56.118858337402344,1
Barbara loved most mothers of Beth.,Barbara screams most mothers of Beth.,syntax,argument_structure,transitive,True,False,True,False,461,-53.298973083496094,-55.568626403808594,1
Some adults scan Tina's spouse.,Some adults die Tina's spouse.,syntax,argument_structure,transitive,True,False,True,False,462,-51.70935821533203,-50.063087463378906,0
Catherine's handymen would disgust Michael's daughter.,Catherine's handymen would slump over Michael's daughter.,syntax,argument_structure,transitive,True,False,True,False,463,-77.67521667480469,-89.40911102294922,1
Christopher's dermatologist will notice Liam.,Christopher's dermatologist will fall asleep Liam.,syntax,argument_structure,transitive,True,False,True,False,464,-58.96837615966797,-63.55607986450195,1
Natalie thinks about Sandra.,Natalie sighs Sandra.,syntax,argument_structure,transitive,True,False,True,False,465,-41.82642364501953,-40.07081985473633,0
Every cashier had kissed Sally's dermatologist.,Every cashier had cried Sally's dermatologist.,syntax,argument_structure,transitive,True,False,True,False,466,-77.55381774902344,-77.79505920410156,1
Margaret's mothers aren't admiring Angela.,Margaret's mothers aren't reacting Angela.,syntax,argument_structure,transitive,True,False,True,False,467,-60.50138473510742,-49.46166229248047,0
Stacy discovered grandsons of Carmen.,Stacy screamed grandsons of Carmen.,syntax,argument_structure,transitive,True,False,True,False,468,-67.64252471923828,-71.60494232177734,1
Heather can criticize some student.,Heather can nod some student.,syntax,argument_structure,transitive,True,False,True,False,469,-43.81280517578125,-48.97493362426758,1
Candice's podiatrist hadn't scared Dan.,Candice's podiatrist hadn't laughed Dan.,syntax,argument_structure,transitive,True,False,True,False,470,-79.46942901611328,-81.58882141113281,1
Every son of Meredith doesn't alarm Mary.,Every son of Meredith doesn't murmur Mary.,syntax,argument_structure,transitive,True,False,True,False,471,-57.51873779296875,-72.54646301269531,1
Melinda does heal Melissa.,Melinda does slump over Melissa.,syntax,argument_structure,transitive,True,False,True,False,472,-43.694488525390625,-57.56884765625,1
Those rabbits confuse Carla.,Those rabbits fell Carla.,syntax,argument_structure,transitive,True,False,True,False,473,-44.82075500488281,-44.024993896484375,0
Dawn visits every teacher's senator.,Dawn slumps over every teacher's senator.,syntax,argument_structure,transitive,True,False,True,False,474,-61.680198669433594,-74.96456909179688,1
A lot of actors alarm Frank.,A lot of actors communicate Frank.,syntax,argument_structure,transitive,True,False,True,False,475,-54.65041732788086,-53.61064910888672,0
Alicia wasn't climbing down the stairs.,Alicia wasn't blinking the stairs.,syntax,argument_structure,transitive,True,False,True,False,476,-57.34883499145508,-62.60432434082031,1
Brenda's teacher hadn't climbed up stairs.,Brenda's teacher hadn't fallen asleep stairs.,syntax,argument_structure,transitive,True,False,True,False,477,-55.3531608581543,-54.73576736450195,0
Judy will take this book about Monet.,Judy will murmur this book about Monet.,syntax,argument_structure,transitive,True,False,True,False,478,-58.83049392700195,-85.31138610839844,1
The senators clean pants.,The senators coped pants.,syntax,argument_structure,transitive,True,False,True,False,479,-38.97443389892578,-50.37867736816406,1
Brett did clean a bank.,Brett did speak up a bank.,syntax,argument_structure,transitive,True,False,True,False,480,-56.062618255615234,-59.06331253051758,1
Matt's teacher would drive to that grocery store.,Matt's teacher would slump over that grocery store.,syntax,argument_structure,transitive,True,False,True,False,481,-51.613990783691406,-66.39427947998047,1
Tracy can't see most candles.,Tracy can't shrug most candles.,syntax,argument_structure,transitive,True,False,True,False,482,-39.02452850341797,-53.04910659790039,1
Ronald would leave Kendra.,Ronald would litter Kendra.,syntax,argument_structure,transitive,True,False,True,False,483,-52.76896286010742,-59.70375061035156,1
Eric had passed this hospital.,Eric had gone fishing this hospital.,syntax,argument_structure,transitive,True,False,True,False,484,-31.418872833251953,-35.595924377441406,1
Some driver hides women.,Some driver waved women.,syntax,argument_structure,transitive,True,False,True,False,485,-34.57636260986328,-36.95325469970703,1
These children hug Helen.,These children interacted Helen.,syntax,argument_structure,transitive,True,False,True,False,486,-34.17259979248047,-38.203495025634766,1
All organizations couldn't appreciate waitresses.,All organizations couldn't testify waitresses.,syntax,argument_structure,transitive,True,False,True,False,487,-57.11457061767578,-56.853519439697266,0
Kenneth won't praise Wayne.,Kenneth won't cry Wayne.,syntax,argument_structure,transitive,True,False,True,False,488,-46.77333068847656,-41.963340759277344,0
Sara has criticized these mothers of Tara.,Sara has cried these mothers of Tara.,syntax,argument_structure,transitive,True,False,True,False,489,-67.86619567871094,-70.36402893066406,1
Scott notices Stacy.,Scott concurs Stacy.,syntax,argument_structure,transitive,True,False,True,False,490,-29.948057174682617,-39.456050872802734,1
Angela hadn't biked to a lot of art galleries.,Angela hadn't chuckled a lot of art galleries.,syntax,argument_structure,transitive,True,False,True,False,491,-72.10972595214844,-59.70331573486328,0
Some person's tutor arrived at every library.,Some person's tutor nodded every library.,syntax,argument_structure,transitive,True,False,True,False,492,-51.30894470214844,-53.140159606933594,1
Donna talked about Laura.,Donna reacts Laura.,syntax,argument_structure,transitive,True,False,True,False,493,-34.407142639160156,-38.73900604248047,1
Kristen is fleeing from Martha.,Kristen is littering Martha.,syntax,argument_structure,transitive,True,False,True,False,494,-42.21562957763672,-47.38435745239258,1
Allison had appreciated Marcus's ex-girlfriend.,Allison had come here Marcus's ex-girlfriend.,syntax,argument_structure,transitive,True,False,True,False,495,-67.4061279296875,-66.07001495361328,0
Tamara will disturb all grandfathers of most ladies.,Tamara will nod all grandfathers of most ladies.,syntax,argument_structure,transitive,True,False,True,False,496,-78.10600280761719,-84.10677337646484,1
Amanda could flee from Christopher.,Amanda could weep Christopher.,syntax,argument_structure,transitive,True,False,True,False,497,-48.27800750732422,-43.72411346435547,0
Deborah's best friend couldn't go to some hill.,Deborah's best friend couldn't speak up some hill.,syntax,argument_structure,transitive,True,False,True,False,498,-55.343223571777344,-63.35694122314453,1
Eva has shocked James's grandsons.,Eva has cried James's grandsons.,syntax,argument_structure,transitive,True,False,True,False,499,-60.1757698059082,-54.6157112121582,0
Bruce wasn't praising Ronald.,Bruce wasn't falling asleep Ronald.,syntax,argument_structure,transitive,True,False,True,False,500,-39.9369010925293,-39.67721176147461,0
George's oncologist has known that senator.,George's oncologist has wept that senator.,syntax,argument_structure,transitive,True,False,True,False,501,-63.950775146484375,-77.87193298339844,1
Michelle can hate Theodore.,Michelle can murmur Theodore.,syntax,argument_structure,transitive,True,False,True,False,502,-33.98551559448242,-52.910919189453125,1
Amy had known a lot of students' lawyer.,Amy had escaped a lot of students' lawyer.,syntax,argument_structure,transitive,True,False,True,False,503,-46.15693664550781,-48.559051513671875,1
Stacy fixed that window.,Stacy lied that window.,syntax,argument_structure,transitive,True,False,True,False,504,-37.15956115722656,-41.22331619262695,1
That driver's ex-girlfriend sounds like Chad.,That driver's ex-girlfriend littered Chad.,syntax,argument_structure,transitive,True,False,True,False,505,-60.38129806518555,-69.49407958984375,1
Some people buy this lake.,Some people scream this lake.,syntax,argument_structure,transitive,True,False,True,False,506,-25.35488510131836,-32.72890853881836,1
Melanie should talk to Carol.,Melanie should shout Carol.,syntax,argument_structure,transitive,True,False,True,False,507,-41.436710357666016,-43.36063766479492,1
Jacqueline hadn't sold some spotlight.,Jacqueline hadn't joked around some spotlight.,syntax,argument_structure,transitive,True,False,True,False,508,-51.33348846435547,-67.51361083984375,1
Kendra won't talk to Tiffany.,Kendra won't talk Tiffany.,syntax,argument_structure,transitive,True,False,True,False,509,-51.07927703857422,-49.75824737548828,0
This movie irritates Russell's grandmother.,This movie disagreed Russell's grandmother.,syntax,argument_structure,transitive,True,False,True,False,510,-51.90461730957031,-47.0645751953125,0
Vanessa is admiring those cups.,Vanessa is chuckling those cups.,syntax,argument_structure,transitive,True,False,True,False,511,-54.9144287109375,-48.899452209472656,0
Patrick had aggravated Jeffrey.,Patrick had murmured Jeffrey.,syntax,argument_structure,transitive,True,False,True,False,512,-44.553985595703125,-46.550411224365234,1
Most nieces of Beverly have investigated many customers.,Most nieces of Beverly have competed many customers.,syntax,argument_structure,transitive,True,False,True,False,513,-77.96366882324219,-80.61744689941406,1
Every organization admired some steak.,Every organization lied some steak.,syntax,argument_structure,transitive,True,False,True,False,514,-43.89289093017578,-44.64793014526367,1
This adult hugs Phillip.,This adult suffers Phillip.,syntax,argument_structure,transitive,True,False,True,False,515,-39.9036979675293,-39.64459991455078,0
Carlos argued about Brett's electricians.,Carlos litters Brett's electricians.,syntax,argument_structure,transitive,True,False,True,False,516,-64.92483520507812,-66.10798645019531,1
Susan couldn't respect Christine.,Susan couldn't murmur Christine.,syntax,argument_structure,transitive,True,False,True,False,517,-35.68170166015625,-51.27275848388672,1
Theodore described Cindy's cousin.,Theodore compromises Cindy's cousin.,syntax,argument_structure,transitive,True,False,True,False,518,-52.27533721923828,-56.45827102661133,1
Richard hadn't investigated Sheila.,Richard hadn't chuckled Sheila.,syntax,argument_structure,transitive,True,False,True,False,519,-35.170745849609375,-40.46225357055664,1
Pamela's dermatologists have most pictures of Melissa.,Pamela's dermatologists compete most pictures of Melissa.,syntax,argument_structure,transitive,True,False,True,False,520,-91.46805572509766,-100.26371765136719,1
Anne buys every shirt.,Anne waves every shirt.,syntax,argument_structure,transitive,True,False,True,False,521,-31.921049118041992,-33.692420959472656,1
The computers were scaring Rose's plumber.,The computers were falling Rose's plumber.,syntax,argument_structure,transitive,True,False,True,False,522,-60.494728088378906,-56.78196334838867,0
Tiffany boycotts the grocery stores.,Tiffany negotiates the grocery stores.,syntax,argument_structure,transitive,True,False,True,False,523,-72.29878234863281,-71.37640380859375,0
Lissa's partners examine these fathers of that waitress.,Lissa's partners come here these fathers of that waitress.,syntax,argument_structure,transitive,True,False,True,False,524,-83.45648193359375,-88.03306579589844,1
Lissa shouldn't listen to many dancers' nephews.,Lissa shouldn't nod many dancers' nephews.,syntax,argument_structure,transitive,True,False,True,False,525,-70.43402099609375,-80.54004669189453,1
Noah's associates have taken some birds.,Noah's associates have littered some birds.,syntax,argument_structure,transitive,True,False,True,False,526,-56.72632598876953,-69.53218078613281,1
Dana saw Sarah.,Dana suffered Sarah.,syntax,argument_structure,transitive,True,False,True,False,527,-36.15577697753906,-39.60712814331055,1
Martha's dermatologist leaves Katherine.,Martha's dermatologist chuckled Katherine.,syntax,argument_structure,transitive,True,False,True,False,528,-63.42318344116211,-68.98634338378906,1
Kristen bored Carla's contractor.,Kristen boasts Carla's contractor.,syntax,argument_structure,transitive,True,False,True,False,529,-52.77334213256836,-53.03078842163086,1
These mushrooms don't disgust Sandra.,These mushrooms don't fall Sandra.,syntax,argument_structure,transitive,True,False,True,False,530,-47.75243377685547,-41.78837966918945,0
These customers had loved Melissa's teachers.,These customers had compromised Melissa's teachers.,syntax,argument_structure,transitive,True,False,True,False,531,-48.54072570800781,-56.05262756347656,1
Colleen's cousins aren't selling some glove.,Colleen's cousins aren't compromising some glove.,syntax,argument_structure,transitive,True,False,True,False,532,-57.909759521484375,-65.95185852050781,1
Alice is running around some banks.,Alice is speaking up some banks.,syntax,argument_structure,transitive,True,False,True,False,533,-30.6583251953125,-35.7554931640625,1
Nancy isn't hiding all hospitals.,Nancy isn't dying all hospitals.,syntax,argument_structure,transitive,True,False,True,False,534,-46.05460739135742,-47.680965423583984,1
Every man's granddaughter admired the Clintons.,Every man's granddaughter waved the Clintons.,syntax,argument_structure,transitive,True,False,True,False,535,-52.51573181152344,-53.56962585449219,1
Sherry could look like every drawing of this hair.,Sherry could shrug every drawing of this hair.,syntax,argument_structure,transitive,True,False,True,False,536,-74.29006958007812,-83.61003875732422,1
Sally was biking to the school.,Sally was speaking up the school.,syntax,argument_structure,transitive,True,False,True,False,537,-49.242713928222656,-46.55371856689453,0
Carrie hasn't concealed Pamela's daughter.,Carrie hasn't come here Pamela's daughter.,syntax,argument_structure,transitive,True,False,True,False,538,-62.24257278442383,-59.64342498779297,0
These women had passed some college campus.,These women had chuckled some college campus.,syntax,argument_structure,transitive,True,False,True,False,539,-45.734275817871094,-57.73566436767578,1
The student's best friends had discussed Heather's dentists.,The student's best friends had chatted Heather's dentists.,syntax,argument_structure,transitive,True,False,True,False,540,-73.55975341796875,-84.99112701416016,1
Lissa's grandfathers hadn't distracted James.,Lissa's grandfathers hadn't blinked James.,syntax,argument_structure,transitive,True,False,True,False,541,-73.61255645751953,-77.84423828125,1
The high schools are disturbing Tanya.,The high schools are falling Tanya.,syntax,argument_structure,transitive,True,False,True,False,542,-47.62476348876953,-51.32278823852539,1
Angela isn't watching the grandfathers of Caroline.,Angela isn't waving the grandfathers of Caroline.,syntax,argument_structure,transitive,True,False,True,False,543,-62.99778366088867,-66.90853881835938,1
An adult's ex-husbands had disagreed with Brett's brother.,An adult's ex-husbands had negotiated Brett's brother.,syntax,argument_structure,transitive,True,False,True,False,544,-101.85244750976562,-102.97229766845703,1
Emily won't sound like Katherine.,Emily won't cry Katherine.,syntax,argument_structure,transitive,True,False,True,False,545,-32.65050506591797,-30.758089065551758,0
Laurie had known Katherine.,Laurie had blinked Katherine.,syntax,argument_structure,transitive,True,False,True,False,546,-49.42027282714844,-58.32356643676758,1
Omar hasn't boasted about Samantha.,Omar hasn't escaped Samantha.,syntax,argument_structure,transitive,True,False,True,False,547,-55.178016662597656,-47.587711334228516,0
Winston Churchill's employees observe Theodore.,Winston Churchill's employees smile Theodore.,syntax,argument_structure,transitive,True,False,True,False,548,-64.75440979003906,-63.38811492919922,0
Melissa hadn't hurt Anna.,Melissa hadn't waved Anna.,syntax,argument_structure,transitive,True,False,True,False,549,-38.12913513183594,-46.26287841796875,1
Mark's mothers haven't messed up some gloves.,Mark's mothers haven't fallen some gloves.,syntax,argument_structure,transitive,True,False,True,False,550,-52.847084045410156,-51.97935104370117,0
Laura's brothers know every child's sisters.,Laura's brothers retaliated every child's sisters.,syntax,argument_structure,transitive,True,False,True,False,551,-47.37322998046875,-59.881187438964844,1
Nicole admired Cindy.,Nicole compromised Cindy.,syntax,argument_structure,transitive,True,False,True,False,552,-37.686485290527344,-38.4782600402832,1
Actors were boring that waitress's spouse.,Actors were clashing that waitress's spouse.,syntax,argument_structure,transitive,True,False,True,False,553,-77.83123779296875,-82.48394775390625,1
Many guests messed up all dishes.,Many guests murmured all dishes.,syntax,argument_structure,transitive,True,False,True,False,554,-39.693931579589844,-51.59440612792969,1
Those actors run around cafes.,Those actors confer cafes.,syntax,argument_structure,transitive,True,False,True,False,555,-40.92277526855469,-41.64398956298828,1
Steve hasn't talked about most nephews of Laura.,Steve hasn't gone fishing most nephews of Laura.,syntax,argument_structure,transitive,True,False,True,False,556,-58.441619873046875,-66.25871276855469,1
The painting of some truck wouldn't resemble some photograph of gloves.,The painting of some truck wouldn't fall some photograph of gloves.,syntax,argument_structure,transitive,True,False,True,False,557,-82.38349914550781,-81.76116943359375,0
Most doctors thought about Joseph.,Most doctors grin Joseph.,syntax,argument_structure,transitive,True,False,True,False,558,-32.119171142578125,-41.987667083740234,1
Melanie shouldn't hurt Patrick.,Melanie shouldn't shout Patrick.,syntax,argument_structure,transitive,True,False,True,False,559,-41.612213134765625,-45.26781463623047,1
Some teachers' colleagues hide a lot of gates.,Some teachers' colleagues blink a lot of gates.,syntax,argument_structure,transitive,True,False,True,False,560,-54.061058044433594,-57.00969314575195,1
These sisters of Susan boast about Dennis.,These sisters of Susan scream Dennis.,syntax,argument_structure,transitive,True,False,True,False,561,-61.440128326416016,-53.5858154296875,0
Laurie breaks this carriage.,Laurie smiles this carriage.,syntax,argument_structure,transitive,True,False,True,False,562,-48.96243667602539,-52.369808197021484,1
This sister of Derek was disturbing some women.,This sister of Derek was disagreeing some women.,syntax,argument_structure,transitive,True,False,True,False,563,-56.03131866455078,-67.5964584350586,1
Ella fired Michelle.,Ella escaped Michelle.,syntax,argument_structure,transitive,True,False,True,False,564,-37.310604095458984,-38.1302490234375,1
Judy hadn't cared for Martin.,Judy hadn't screamed Martin.,syntax,argument_structure,transitive,True,False,True,False,565,-43.01355743408203,-44.31797790527344,1
Grace's partners embarrasses Lisa's bosses.,Grace's partners struggled Lisa's bosses.,syntax,argument_structure,transitive,True,False,True,False,566,-72.474853515625,-65.08320617675781,0
Galileo's associates return to Kendra's ex-girlfriend.,Galileo's associates smiled Kendra's ex-girlfriend.,syntax,argument_structure,transitive,True,False,True,False,567,-91.31878662109375,-94.86729431152344,1
Valerie attacks Matt's boyfriend.,Valerie died Matt's boyfriend.,syntax,argument_structure,transitive,True,False,True,False,568,-50.09650421142578,-43.30261993408203,0
Scott fixed those couches.,Scott chuckles those couches.,syntax,argument_structure,transitive,True,False,True,False,569,-38.39649963378906,-41.496551513671875,1
The sketch had bored that patient's employee.,The sketch had fallen that patient's employee.,syntax,argument_structure,transitive,True,False,True,False,570,-64.7947998046875,-62.76892852783203,0
Melissa was visiting Travis.,Melissa was blinking Travis.,syntax,argument_structure,transitive,True,False,True,False,571,-34.88642120361328,-39.398841857910156,1
Lisa brought the scarves.,Lisa grins the scarves.,syntax,argument_structure,transitive,True,False,True,False,572,-29.341922760009766,-42.328819274902344,1
Matt doesn't have these art galleries.,Matt doesn't go fishing these art galleries.,syntax,argument_structure,transitive,True,False,True,False,573,-38.094566345214844,-49.13947296142578,1
