sentence_good,sentence_bad,field,linguistics_term,UID,simple_LM_method,one_prefix_method,two_prefix_method,lexically_identical,pair_id,good_prob,bad_prob,correct
The teenagers explain that they aren't breaking all glasses.,The teenagers explain that themselves aren't breaking all glasses.,syntax_semantics,binding,principle_A_case_1,True,True,False,False,0,-61.12828826904297,-67.76994323730469,1
Carl can't imagine that he complained about Lisa.,Carl can't imagine that himself complained about Lisa.,syntax_semantics,binding,principle_A_case_1,True,True,False,False,1,-48.97190475463867,-56.21014404296875,1
Angela wasn't thinking that she likes Susan.,Angela wasn't thinking that herself likes Susan.,syntax_semantics,binding,principle_A_case_1,True,True,False,False,2,-47.78206253051758,-56.39280319213867,1
Tara thinks that she sounded like Wayne.,Tara thinks that herself sounded like Wayne.,syntax_semantics,binding,principle_A_case_1,True,True,False,False,3,-58.60033416748047,-63.80960464477539,1
Those waiters explain that they did climb down mountains.,Those waiters explain that themselves did climb down mountains.,syntax_semantics,binding,principle_A_case_1,True,True,False,False,4,-65.82766723632812,-73.30062866210938,1
Tina wasn't saying that she descends most ladders.,Tina wasn't saying that herself descends most ladders.,syntax_semantics,binding,principle_A_case_1,True,True,False,False,5,-94.65458679199219,-101.24835205078125,1
Cindy explained that she has concealed all cashiers.,Cindy explained that herself has concealed all cashiers.,syntax_semantics,binding,principle_A_case_1,True,True,False,False,6,-82.91507720947266,-89.55062866210938,1
Bethany has imagined that she has fired Margaret.,Bethany has imagined that herself has fired Margaret.,syntax_semantics,binding,principle_A_case_1,True,True,False,False,7,-78.73262786865234,-85.953125,1
Pamela thinks that she isn't returning to Stephanie.,Pamela thinks that herself isn't returning to Stephanie.,syntax_semantics,binding,principle_A_case_1,True,True,False,False,8,-76.95989227294922,-82.61848449707031,1
A lot of doctors say that they had skated around that college campus.,A lot of doctors say that themselves had skated around that college campus.,syntax_semantics,binding,principle_A_case_1,True,True,False,False,9,-84.31553649902344,-93.68374633789062,1
Many women explain that they fix the cart.,Many women explain that themselves fix the cart.,syntax_semantics,binding,principle_A_case_1,True,True,False,False,10,-46.951515197753906,-54.987422943115234,1
Donna has imagined that she is breaking the bicycle.,Donna has imagined that herself is breaking the bicycle.,syntax_semantics,binding,principle_A_case_1,True,True,False,False,11,-58.01451110839844,-65.02922058105469,1
Alan was explaining that he criticizes Holly.,Alan was explaining that himself criticizes Holly.,syntax_semantics,binding,principle_A_case_1,True,True,False,False,12,-62.58822250366211,-68.82556915283203,1
Michelle thinks that she was discussing Natalie.,Michelle thinks that herself was discussing Natalie.,syntax_semantics,binding,principle_A_case_1,True,True,False,False,13,-43.6235237121582,-52.882347106933594,1
Janet explains that she will hurt Leslie.,Janet explains that herself will hurt Leslie.,syntax_semantics,binding,principle_A_case_1,True,True,False,False,14,-58.019325256347656,-65.0090560913086,1
Some patients say that they distracted Caroline.,Some patients say that themselves distracted Caroline.,syntax_semantics,binding,principle_A_case_1,True,True,False,False,15,-48.9282341003418,-56.4781379699707,1
Many ladies think that they aren't astounding Todd.,Many ladies think that themselves aren't astounding Todd.,syntax_semantics,binding,principle_A_case_1,True,True,False,False,16,-56.35240936279297,-61.97499084472656,1
The Impressionists say that they were criticizing Heidi.,The Impressionists say that themselves were criticizing Heidi.,syntax_semantics,binding,principle_A_case_1,True,True,False,False,17,-69.13504028320312,-76.18285369873047,1
Larry thinks that he is researching some universities.,Larry thinks that himself is researching some universities.,syntax_semantics,binding,principle_A_case_1,True,True,False,False,18,-49.25660705566406,-55.577659606933594,1
Cynthia had thought that she can't bother Kendra.,Cynthia had thought that herself can't bother Kendra.,syntax_semantics,binding,principle_A_case_1,True,True,False,False,19,-88.85054779052734,-95.71054077148438,1
Homer imagined that he is disgusting Rachel.,Homer imagined that himself is disgusting Rachel.,syntax_semantics,binding,principle_A_case_1,True,True,False,False,20,-67.96591186523438,-72.79437255859375,1
Clyde explains that he cleans a lot of cups.,Clyde explains that himself cleans a lot of cups.,syntax_semantics,binding,principle_A_case_1,True,True,False,False,21,-81.71653747558594,-89.2459716796875,1
Peter said that he was bothering every actor.,Peter said that himself was bothering every actor.,syntax_semantics,binding,principle_A_case_1,True,True,False,False,22,-40.05329895019531,-49.25432586669922,1
Sally couldn't imagine that she wasn't criticizing Robert.,Sally couldn't imagine that herself wasn't criticizing Robert.,syntax_semantics,binding,principle_A_case_1,True,True,False,False,23,-74.5599594116211,-80.36188507080078,1
Sheila isn't saying that she isn't noticing Caroline.,Sheila isn't saying that herself isn't noticing Caroline.,syntax_semantics,binding,principle_A_case_1,True,True,False,False,24,-61.865135192871094,-68.0859146118164,1
Every guy imagined that he annoyed Ruth.,Every guy imagined that himself annoyed Ruth.,syntax_semantics,binding,principle_A_case_1,True,True,False,False,25,-55.75045394897461,-64.24043273925781,1
Barbara thinks that she isn't boring every adult.,Barbara thinks that herself isn't boring every adult.,syntax_semantics,binding,principle_A_case_1,True,True,False,False,26,-59.59923553466797,-63.049537658691406,1
Gerald thinks that he scans an essay.,Gerald thinks that himself scans an essay.,syntax_semantics,binding,principle_A_case_1,True,True,False,False,27,-72.74641418457031,-78.94060516357422,1
Some boys have explained that they respected Rachel.,Some boys have explained that themselves respected Rachel.,syntax_semantics,binding,principle_A_case_1,True,True,False,False,28,-49.923118591308594,-58.12773895263672,1
A woman wasn't explaining that she did complain about Alexander.,A woman wasn't explaining that herself did complain about Alexander.,syntax_semantics,binding,principle_A_case_1,True,True,False,False,29,-75.3006591796875,-83.74644470214844,1
Kenneth imagines that he healed Linda.,Kenneth imagines that himself healed Linda.,syntax_semantics,binding,principle_A_case_1,True,True,False,False,30,-68.90528869628906,-76.33442687988281,1
These students think that they might like Rodney.,These students think that themselves might like Rodney.,syntax_semantics,binding,principle_A_case_1,True,True,False,False,31,-41.89744186401367,-49.22293472290039,1
Alan had imagined that he can praise Kathleen.,Alan had imagined that himself can praise Kathleen.,syntax_semantics,binding,principle_A_case_1,True,True,False,False,32,-58.7227668762207,-65.9595718383789,1
Rachelle hasn't imagined that she bikes to some movie theaters.,Rachelle hasn't imagined that herself bikes to some movie theaters.,syntax_semantics,binding,principle_A_case_1,True,True,False,False,33,-85.09944915771484,-90.77381896972656,1
Stacy was saying that she thinks about Eva.,Stacy was saying that herself thinks about Eva.,syntax_semantics,binding,principle_A_case_1,True,True,False,False,34,-57.583030700683594,-67.02059173583984,1
Amanda thinks that she had cleaned those restaurants.,Amanda thinks that herself had cleaned those restaurants.,syntax_semantics,binding,principle_A_case_1,True,True,False,False,35,-55.606483459472656,-62.29672622680664,1
Diane hadn't explained that she broke the cart.,Diane hadn't explained that herself broke the cart.,syntax_semantics,binding,principle_A_case_1,True,True,False,False,36,-65.55615234375,-73.11341094970703,1
Dana thought that she is messing up that hospital.,Dana thought that herself is messing up that hospital.,syntax_semantics,binding,principle_A_case_1,True,True,False,False,37,-60.830726623535156,-67.47974395751953,1
The Impressionists say that they were complaining about Rose.,The Impressionists say that themselves were complaining about Rose.,syntax_semantics,binding,principle_A_case_1,True,True,False,False,38,-69.49664306640625,-76.77272033691406,1
Barbara wasn't saying that she shouldn't climb down some ladder.,Barbara wasn't saying that herself shouldn't climb down some ladder.,syntax_semantics,binding,principle_A_case_1,True,True,False,False,39,-68.31739044189453,-74.21814727783203,1
Marla thought that she broke some skateboard.,Marla thought that herself broke some skateboard.,syntax_semantics,binding,principle_A_case_1,True,True,False,False,40,-57.446895599365234,-63.47533416748047,1
Karen had imagined that she wasn't referencing Theresa.,Karen had imagined that herself wasn't referencing Theresa.,syntax_semantics,binding,principle_A_case_1,True,True,False,False,41,-77.71929931640625,-85.18284606933594,1
A lot of guests imagined that they haven't left the hospitals.,A lot of guests imagined that themselves haven't left the hospitals.,syntax_semantics,binding,principle_A_case_1,True,True,False,False,42,-72.66032409667969,-81.30609130859375,1
Sheila was thinking that she saw this steak.,Sheila was thinking that herself saw this steak.,syntax_semantics,binding,principle_A_case_1,True,True,False,False,43,-48.133968353271484,-56.62389373779297,1
Sheila explained that she might aggravate Angela.,Sheila explained that herself might aggravate Angela.,syntax_semantics,binding,principle_A_case_1,True,True,False,False,44,-62.566864013671875,-69.43186950683594,1
Kevin hadn't said that he was appreciating Eva.,Kevin hadn't said that himself was appreciating Eva.,syntax_semantics,binding,principle_A_case_1,True,True,False,False,45,-53.48788833618164,-60.7541389465332,1
Laura thought that she was alarming Jason.,Laura thought that herself was alarming Jason.,syntax_semantics,binding,principle_A_case_1,True,True,False,False,46,-46.17573547363281,-53.811622619628906,1
Rodney imagined that he has praised Vanessa.,Rodney imagined that himself has praised Vanessa.,syntax_semantics,binding,principle_A_case_1,True,True,False,False,47,-58.63414001464844,-66.93022155761719,1
Todd should think that he scares Brett.,Todd should think that himself scares Brett.,syntax_semantics,binding,principle_A_case_1,True,True,False,False,48,-47.58584976196289,-53.9688720703125,1
Brett explains that he had that newspaper article.,Brett explains that himself had that newspaper article.,syntax_semantics,binding,principle_A_case_1,True,True,False,False,49,-66.32717895507812,-74.82994079589844,1
All people explain that they could explore this mall.,All people explain that themselves could explore this mall.,syntax_semantics,binding,principle_A_case_1,True,True,False,False,50,-45.95372009277344,-55.88067626953125,1
Charles wasn't saying that he climbs up ladders.,Charles wasn't saying that himself climbs up ladders.,syntax_semantics,binding,principle_A_case_1,True,True,False,False,51,-55.00032043457031,-62.8953971862793,1
Caroline shouldn't think that she drives to the mountain.,Caroline shouldn't think that herself drives to the mountain.,syntax_semantics,binding,principle_A_case_1,True,True,False,False,52,-60.891517639160156,-65.96153259277344,1
Lissa thinks that she scanned some report.,Lissa thinks that herself scanned some report.,syntax_semantics,binding,principle_A_case_1,True,True,False,False,53,-64.66484069824219,-70.58631896972656,1
Most adults say that they have irritated Lori.,Most adults say that themselves have irritated Lori.,syntax_semantics,binding,principle_A_case_1,True,True,False,False,54,-49.40928649902344,-56.210079193115234,1
Jeffrey said that he hadn't arrived at the river.,Jeffrey said that himself hadn't arrived at the river.,syntax_semantics,binding,principle_A_case_1,True,True,False,False,55,-53.94934844970703,-60.83747863769531,1
Ronald wasn't imagining that he scares some organization.,Ronald wasn't imagining that himself scares some organization.,syntax_semantics,binding,principle_A_case_1,True,True,False,False,56,-66.7341537475586,-74.7979736328125,1
Becky hasn't imagined that she had fixed the window.,Becky hasn't imagined that herself had fixed the window.,syntax_semantics,binding,principle_A_case_1,True,True,False,False,57,-57.31117248535156,-65.10101318359375,1
Kathleen had imagined that she had argued about every person.,Kathleen had imagined that herself had argued about every person.,syntax_semantics,binding,principle_A_case_1,True,True,False,False,58,-84.04029846191406,-91.41474914550781,1
Gary wouldn't think that he tours most grocery stores.,Gary wouldn't think that himself tours most grocery stores.,syntax_semantics,binding,principle_A_case_1,True,True,False,False,59,-61.33567810058594,-67.62360382080078,1
All guys explain that they escape from Allison.,All guys explain that themselves escape from Allison.,syntax_semantics,binding,principle_A_case_1,True,True,False,False,60,-56.38009262084961,-65.44548034667969,1
Christine thinks that she was praising Emily.,Christine thinks that herself was praising Emily.,syntax_semantics,binding,principle_A_case_1,True,True,False,False,61,-60.10047149658203,-67.82502746582031,1
Kevin hadn't thought that he could sell all pictures.,Kevin hadn't thought that himself could sell all pictures.,syntax_semantics,binding,principle_A_case_1,True,True,False,False,62,-46.27503204345703,-52.66307830810547,1
Kenneth is explaining that he boycotted all hospitals.,Kenneth is explaining that himself boycotted all hospitals.,syntax_semantics,binding,principle_A_case_1,True,True,False,False,63,-83.240478515625,-87.46843719482422,1
Nicole imagines that she isn't investigating some guest.,Nicole imagines that herself isn't investigating some guest.,syntax_semantics,binding,principle_A_case_1,True,True,False,False,64,-82.42169189453125,-87.80679321289062,1
These waiters weren't thinking that they discovered a car.,These waiters weren't thinking that themselves discovered a car.,syntax_semantics,binding,principle_A_case_1,True,True,False,False,65,-60.46658706665039,-69.1070327758789,1
A lot of waitresses say that they hadn't disgusted Carolyn.,A lot of waitresses say that themselves hadn't disgusted Carolyn.,syntax_semantics,binding,principle_A_case_1,True,True,False,False,66,-95.67250061035156,-104.5337142944336,1
The pedestrians could imagine that they explored Spain.,The pedestrians could imagine that themselves explored Spain.,syntax_semantics,binding,principle_A_case_1,True,True,False,False,67,-57.080352783203125,-64.98091125488281,1
Beth has explained that she hasn't worked with Jane.,Beth has explained that herself hasn't worked with Jane.,syntax_semantics,binding,principle_A_case_1,True,True,False,False,68,-69.42098236083984,-77.85917663574219,1
Amanda should explain that she works with Lori.,Amanda should explain that herself works with Lori.,syntax_semantics,binding,principle_A_case_1,True,True,False,False,69,-59.81842803955078,-68.28475952148438,1
Connie explains that she was approaching April.,Connie explains that herself was approaching April.,syntax_semantics,binding,principle_A_case_1,True,True,False,False,70,-49.08409118652344,-57.55706024169922,1
Christina was explaining that she didn't go to the museums.,Christina was explaining that herself didn't go to the museums.,syntax_semantics,binding,principle_A_case_1,True,True,False,False,71,-56.32988357543945,-65.32994842529297,1
Larry said that he could work with Douglas.,Larry said that himself could work with Douglas.,syntax_semantics,binding,principle_A_case_1,True,True,False,False,72,-37.03518295288086,-46.4654541015625,1
The Borgias have explained that they weren't bothering Marcus.,The Borgias have explained that themselves weren't bothering Marcus.,syntax_semantics,binding,principle_A_case_1,True,True,False,False,73,-79.08048248291016,-88.94029235839844,1
Stephen was thinking that he should aggravate many waitresses.,Stephen was thinking that himself should aggravate many waitresses.,syntax_semantics,binding,principle_A_case_1,True,True,False,False,74,-75.63104248046875,-82.30424499511719,1
Those people say that they disagreed with Beth.,Those people say that themselves disagreed with Beth.,syntax_semantics,binding,principle_A_case_1,True,True,False,False,75,-46.198822021484375,-53.682098388671875,1
Holly was thinking that she astounded Brett.,Holly was thinking that herself astounded Brett.,syntax_semantics,binding,principle_A_case_1,True,True,False,False,76,-69.54462432861328,-74.85906982421875,1
Guests think that they sell most glasses.,Guests think that themselves sell most glasses.,syntax_semantics,binding,principle_A_case_1,True,True,False,False,77,-47.07524108886719,-54.867958068847656,1
Those teenagers say that they described some mountains.,Those teenagers say that themselves described some mountains.,syntax_semantics,binding,principle_A_case_1,True,True,False,False,78,-44.673851013183594,-51.75053405761719,1
Becca imagined that she isn't arguing about Margaret.,Becca imagined that herself isn't arguing about Margaret.,syntax_semantics,binding,principle_A_case_1,True,True,False,False,79,-67.03656768798828,-74.66778564453125,1
Nicole imagines that she has hugged Meredith.,Nicole imagines that herself has hugged Meredith.,syntax_semantics,binding,principle_A_case_1,True,True,False,False,80,-74.34011840820312,-80.96138000488281,1
Carl should explain that he had hurt David.,Carl should explain that himself had hurt David.,syntax_semantics,binding,principle_A_case_1,True,True,False,False,81,-48.84657287597656,-58.93232727050781,1
Marie had thought that she references Wayne.,Marie had thought that herself references Wayne.,syntax_semantics,binding,principle_A_case_1,True,True,False,False,82,-53.31767272949219,-59.23053741455078,1
Bill explained that he shouldn't hug Sonia.,Bill explained that himself shouldn't hug Sonia.,syntax_semantics,binding,principle_A_case_1,True,True,False,False,83,-60.96233367919922,-68.94538116455078,1
These girls think that they aren't listening to Beth.,These girls think that themselves aren't listening to Beth.,syntax_semantics,binding,principle_A_case_1,True,True,False,False,84,-47.04681396484375,-53.305633544921875,1
Phillip wasn't explaining that he was shocking Tammy.,Phillip wasn't explaining that himself was shocking Tammy.,syntax_semantics,binding,principle_A_case_1,True,True,False,False,85,-66.1218490600586,-74.85041809082031,1
Nancy can imagine that she isn't arriving at the Great Lakes.,Nancy can imagine that herself isn't arriving at the Great Lakes.,syntax_semantics,binding,principle_A_case_1,True,True,False,False,86,-78.90421295166016,-84.36099243164062,1
Deanna does explain that she discussed some pedestrian.,Deanna does explain that herself discussed some pedestrian.,syntax_semantics,binding,principle_A_case_1,True,True,False,False,87,-68.40925598144531,-75.73480987548828,1
Many adults imagine that they weren't walking through art galleries.,Many adults imagine that themselves weren't walking through art galleries.,syntax_semantics,binding,principle_A_case_1,True,True,False,False,88,-62.67228317260742,-71.73676300048828,1
Richard was explaining that he did kiss those boys.,Richard was explaining that himself did kiss those boys.,syntax_semantics,binding,principle_A_case_1,True,True,False,False,89,-51.260711669921875,-61.352909088134766,1
Regina imagined that she appreciated a lot of cafes.,Regina imagined that herself appreciated a lot of cafes.,syntax_semantics,binding,principle_A_case_1,True,True,False,False,90,-66.83331298828125,-72.14015197753906,1
A lot of waiters can explain that they can't scare Noah.,A lot of waiters can explain that themselves can't scare Noah.,syntax_semantics,binding,principle_A_case_1,True,True,False,False,91,-83.6976089477539,-93.20621490478516,1
Charles couldn't think that he hasn't discussed the rivers.,Charles couldn't think that himself hasn't discussed the rivers.,syntax_semantics,binding,principle_A_case_1,True,True,False,False,92,-48.577247619628906,-54.06245422363281,1
Paula wasn't thinking that she had seen Candice.,Paula wasn't thinking that herself had seen Candice.,syntax_semantics,binding,principle_A_case_1,True,True,False,False,93,-56.2039794921875,-65.0810546875,1
Wayne hadn't explained that he was discovering Kevin.,Wayne hadn't explained that himself was discovering Kevin.,syntax_semantics,binding,principle_A_case_1,True,True,False,False,94,-65.2786865234375,-74.69367218017578,1
Teresa will say that she wasn't discussing that customer.,Teresa will say that herself wasn't discussing that customer.,syntax_semantics,binding,principle_A_case_1,True,True,False,False,95,-63.26137924194336,-70.06255340576172,1
Brian imagined that he has concealed Amy.,Brian imagined that himself has concealed Amy.,syntax_semantics,binding,principle_A_case_1,True,True,False,False,96,-49.60774612426758,-58.19517135620117,1
Martha said that she should respect Clyde.,Martha said that herself should respect Clyde.,syntax_semantics,binding,principle_A_case_1,True,True,False,False,97,-54.81141662597656,-61.285037994384766,1
Cindy is imagining that she wasn't concealing Connie.,Cindy is imagining that herself wasn't concealing Connie.,syntax_semantics,binding,principle_A_case_1,True,True,False,False,98,-86.76480102539062,-94.34562683105469,1
Becca shouldn't imagine that she watched Joseph.,Becca shouldn't imagine that herself watched Joseph.,syntax_semantics,binding,principle_A_case_1,True,True,False,False,99,-56.833892822265625,-65.35797882080078,1
Keith says that he has thought about the window.,Keith says that himself has thought about the window.,syntax_semantics,binding,principle_A_case_1,True,True,False,False,100,-39.08018112182617,-47.04267883300781,1
Roger will say that he left many waitresses.,Roger will say that himself left many waitresses.,syntax_semantics,binding,principle_A_case_1,True,True,False,False,101,-59.73797607421875,-67.51776123046875,1
All customers imagine that they weren't dropping by this bank.,All customers imagine that themselves weren't dropping by this bank.,syntax_semantics,binding,principle_A_case_1,True,True,False,False,102,-61.428558349609375,-69.7540283203125,1
A lot of ladies say that they will irritate Dan.,A lot of ladies say that themselves will irritate Dan.,syntax_semantics,binding,principle_A_case_1,True,True,False,False,103,-74.62435913085938,-81.32755279541016,1
Some doctors have said that they cleaned these mushrooms.,Some doctors have said that themselves cleaned these mushrooms.,syntax_semantics,binding,principle_A_case_1,True,True,False,False,104,-49.65532302856445,-59.20695114135742,1
Laurie thinks that she had insulted Joseph.,Laurie thinks that herself had insulted Joseph.,syntax_semantics,binding,principle_A_case_1,True,True,False,False,105,-70.35601043701172,-77.71891021728516,1
Timothy explained that he climbed up this ladder.,Timothy explained that himself climbed up this ladder.,syntax_semantics,binding,principle_A_case_1,True,True,False,False,106,-55.20408248901367,-64.77175903320312,1
Deborah hasn't explained that she brought that mouth.,Deborah hasn't explained that herself brought that mouth.,syntax_semantics,binding,principle_A_case_1,True,True,False,False,107,-58.25847625732422,-64.70018005371094,1
Brett said that he brought most hills.,Brett said that himself brought most hills.,syntax_semantics,binding,principle_A_case_1,True,True,False,False,108,-64.73757934570312,-71.61308288574219,1
These actresses explain that they hide all steps.,These actresses explain that themselves hide all steps.,syntax_semantics,binding,principle_A_case_1,True,True,False,False,109,-52.194175720214844,-60.30580520629883,1
Stacey thinks that she brought those restaurants.,Stacey thinks that herself brought those restaurants.,syntax_semantics,binding,principle_A_case_1,True,True,False,False,110,-57.84170150756836,-65.12397003173828,1
Linda does say that she hasn't hurt Dennis.,Linda does say that herself hasn't hurt Dennis.,syntax_semantics,binding,principle_A_case_1,True,True,False,False,111,-65.63026428222656,-71.33980560302734,1
The man explained that he concealed Jerry.,The man explained that himself concealed Jerry.,syntax_semantics,binding,principle_A_case_1,True,True,False,False,112,-52.48432159423828,-61.646400451660156,1
Holly says that she does clean the dishes.,Holly says that herself does clean the dishes.,syntax_semantics,binding,principle_A_case_1,True,True,False,False,113,-52.05022430419922,-58.26769256591797,1
Waiters think that they had bored Monet.,Waiters think that themselves had bored Monet.,syntax_semantics,binding,principle_A_case_1,True,True,False,False,114,-59.43244934082031,-67.57085418701172,1
Patricia thought that she arrived at most lakes.,Patricia thought that herself arrived at most lakes.,syntax_semantics,binding,principle_A_case_1,True,True,False,False,115,-61.76274108886719,-67.01143646240234,1
Karen says that she will exit these lakes.,Karen says that herself will exit these lakes.,syntax_semantics,binding,principle_A_case_1,True,True,False,False,116,-66.23838806152344,-71.73377227783203,1
Guests imagine that they have known Sonia.,Guests imagine that themselves have known Sonia.,syntax_semantics,binding,principle_A_case_1,True,True,False,False,117,-56.861839294433594,-64.01719665527344,1
Charles wasn't explaining that he wasn't praising Travis.,Charles wasn't explaining that himself wasn't praising Travis.,syntax_semantics,binding,principle_A_case_1,True,True,False,False,118,-61.15070343017578,-69.62957763671875,1
