sentence_good,sentence_bad,field,linguistics_term,UID,simple_LM_method,one_prefix_method,two_prefix_method,lexically_identical,pair_id,good_prob,bad_prob,correct
The men who upset Naomi don't argue about themselves.,The men who upset Naomi don't argue about herself.,syntax_semantics,binding,principle_A_c_command,True,True,False,False,766,-57.29400634765625,-59.61138916015625,1
That broccoli that shouldn't impress Jessica is disturbing itself.,That broccoli that shouldn't impress Jessica is disturbing herself.,syntax_semantics,binding,principle_A_c_command,True,True,False,False,767,-79.09220886230469,-78.55078125,0
That university that hasn't criticized all plays hadn't concealed itself.,That university that hasn't criticized all plays hadn't concealed themselves.,syntax_semantics,binding,principle_A_c_command,True,True,False,False,768,-88.03007507324219,-86.83927917480469,0
The libraries that have boasted about Mitchell have referenced themselves.,The libraries that have boasted about Mitchell have referenced himself.,syntax_semantics,binding,principle_A_c_command,True,True,False,False,769,-81.60176086425781,-82.8510971069336,1
A lot of cats that aren't aggravating Liam found themselves.,A lot of cats that aren't aggravating Liam found himself.,syntax_semantics,binding,principle_A_c_command,True,True,False,False,770,-79.09613800048828,-80.72340393066406,1
All students who haven't seen Michael hadn't hidden themselves.,All students who haven't seen Michael hadn't hidden himself.,syntax_semantics,binding,principle_A_c_command,True,True,False,False,771,-64.3324966430664,-64.20304870605469,0
The guests that might fire Matt have impressed themselves.,The guests that might fire Matt have impressed himself.,syntax_semantics,binding,principle_A_c_command,True,True,False,False,772,-67.98725891113281,-68.463623046875,1
Every waitress that disliked Robert conceals herself.,Every waitress that disliked Robert conceals himself.,syntax_semantics,binding,principle_A_c_command,True,True,False,False,773,-74.73454284667969,-74.18798828125,0
All associations that buy some river are listening to themselves.,All associations that buy some river are listening to itself.,syntax_semantics,binding,principle_A_c_command,True,True,False,False,774,-63.16742706298828,-65.72805786132812,1
Those patients who can't flee from Deborah do boast about themselves.,Those patients who can't flee from Deborah do boast about herself.,syntax_semantics,binding,principle_A_c_command,True,True,False,False,775,-90.34910583496094,-92.8418960571289,1
This hospital that would worry Melissa praises itself.,This hospital that would worry Melissa praises herself.,syntax_semantics,binding,principle_A_c_command,True,True,False,False,776,-70.1452407836914,-70.20094299316406,1
All children who loved Wendy aren't kissing themselves.,All children who loved Wendy aren't kissing herself.,syntax_semantics,binding,principle_A_c_command,True,True,False,False,777,-63.93497085571289,-65.175048828125,1
The school that took these blouses wasn't insulting itself.,The school that took these blouses wasn't insulting themselves.,syntax_semantics,binding,principle_A_c_command,True,True,False,False,778,-74.37030792236328,-72.42475891113281,0
The teenagers that irritate William aren't healing themselves.,The teenagers that irritate William aren't healing himself.,syntax_semantics,binding,principle_A_c_command,True,True,False,False,779,-74.36695861816406,-75.04515838623047,1
Every waitress who is helping Martin visits herself.,Every waitress who is helping Martin visits himself.,syntax_semantics,binding,principle_A_c_command,True,True,False,False,780,-64.93618774414062,-63.99119567871094,0
All guests that discuss Robert were criticizing themselves.,All guests that discuss Robert were criticizing himself.,syntax_semantics,binding,principle_A_c_command,True,True,False,False,781,-67.97545623779297,-68.25587463378906,1
The rugs that astound Keith aggravated themselves.,The rugs that astound Keith aggravated himself.,syntax_semantics,binding,principle_A_c_command,True,True,False,False,782,-82.11262512207031,-82.658203125,1
Legislatures that shouldn't respect Barbara upset themselves.,Legislatures that shouldn't respect Barbara upset herself.,syntax_semantics,binding,principle_A_c_command,True,True,False,False,783,-80.496337890625,-82.94486999511719,1
These hospitals that hurt Alan weren't confusing themselves.,These hospitals that hurt Alan weren't confusing himself.,syntax_semantics,binding,principle_A_c_command,True,True,False,False,784,-65.18357849121094,-66.5781478881836,1
That lady who is disgusting Keith cures herself.,That lady who is disgusting Keith cures himself.,syntax_semantics,binding,principle_A_c_command,True,True,False,False,785,-66.60395050048828,-65.82557678222656,0
Every skateboard that disturbs Regina is embarrassing itself.,Every skateboard that disturbs Regina is embarrassing herself.,syntax_semantics,binding,principle_A_c_command,True,True,False,False,786,-80.54961395263672,-82.65348815917969,1
Those cashiers that left Melissa fled from themselves.,Those cashiers that left Melissa fled from herself.,syntax_semantics,binding,principle_A_c_command,True,True,False,False,787,-69.38245391845703,-70.93754577636719,1
The boy who hasn't annoyed Diane sees himself.,The boy who hasn't annoyed Diane sees herself.,syntax_semantics,binding,principle_A_c_command,True,True,False,False,788,-64.83265686035156,-66.77584838867188,1
A company that isn't stunning Larry knew itself.,A company that isn't stunning Larry knew himself.,syntax_semantics,binding,principle_A_c_command,True,True,False,False,789,-75.49636840820312,-74.895751953125,0
Some fish that upset Richard upset itself.,Some fish that upset Richard upset himself.,syntax_semantics,binding,principle_A_c_command,True,True,False,False,790,-54.3658561706543,-53.067787170410156,0
That fish that can't break some plates found itself.,That fish that can't break some plates found themselves.,syntax_semantics,binding,principle_A_c_command,True,True,False,False,791,-60.58208465576172,-59.36885070800781,0
Some ladies that saw a drawing can't reveal themselves.,Some ladies that saw a drawing can't reveal itself.,syntax_semantics,binding,principle_A_c_command,True,True,False,False,792,-62.7833251953125,-63.65068054199219,1
Every lady that will notice these boys cares for herself.,Every lady that will notice these boys cares for themselves.,syntax_semantics,binding,principle_A_c_command,True,True,False,False,793,-63.12788009643555,-59.530433654785156,0
All women that have climbed up some ladder weren't describing themselves.,All women that have climbed up some ladder weren't describing itself.,syntax_semantics,binding,principle_A_c_command,True,True,False,False,794,-78.10295104980469,-80.60426330566406,1
A woman who didn't describe James has visited herself.,A woman who didn't describe James has visited himself.,syntax_semantics,binding,principle_A_c_command,True,True,False,False,795,-71.49626159667969,-69.82142639160156,0
A lot of pedestrians that worked with Sharon will insult themselves.,A lot of pedestrians that worked with Sharon will insult herself.,syntax_semantics,binding,principle_A_c_command,True,True,False,False,796,-87.695068359375,-89.88302612304688,1
The cashiers that should praise Lawrence have fired themselves.,The cashiers that should praise Lawrence have fired himself.,syntax_semantics,binding,principle_A_c_command,True,True,False,False,797,-77.61775207519531,-78.24967956542969,1
This boy that hasn't boasted about Cheryl has returned to himself.,This boy that hasn't boasted about Cheryl has returned to herself.,syntax_semantics,binding,principle_A_c_command,True,True,False,False,798,-79.59869384765625,-80.90663146972656,1
Most women that will astound Michael are discovering themselves.,Most women that will astound Michael are discovering himself.,syntax_semantics,binding,principle_A_c_command,True,True,False,False,799,-76.16647338867188,-76.7664794921875,1
Actresses that walk through a closet don't talk to themselves.,Actresses that walk through a closet don't talk to itself.,syntax_semantics,binding,principle_A_c_command,True,True,False,False,800,-63.299983978271484,-64.81414794921875,1
Some plane that bothered Mark doesn't stun itself.,Some plane that bothered Mark doesn't stun himself.,syntax_semantics,binding,principle_A_c_command,True,True,False,False,801,-70.77144622802734,-69.92399597167969,0
The people that had kissed Nancy hugged themselves.,The people that had kissed Nancy hugged herself.,syntax_semantics,binding,principle_A_c_command,True,True,False,False,802,-55.83698272705078,-57.527000427246094,1
Those legislatures that sold this high school forgot themselves.,Those legislatures that sold this high school forgot itself.,syntax_semantics,binding,principle_A_c_command,True,True,False,False,803,-63.952369689941406,-64.510009765625,1
A lot of boys that cleaned a grocery store did listen to themselves.,A lot of boys that cleaned a grocery store did listen to itself.,syntax_semantics,binding,principle_A_c_command,True,True,False,False,804,-83.04546356201172,-85.06119537353516,1
The essays that haven't impressed Harvard University weren't worrying themselves.,The essays that haven't impressed Harvard University weren't worrying itself.,syntax_semantics,binding,principle_A_c_command,True,True,False,False,805,-92.31478881835938,-93.26734924316406,1
Those guys that drop by some hospital loved themselves.,Those guys that drop by some hospital loved itself.,syntax_semantics,binding,principle_A_c_command,True,True,False,False,806,-60.57334518432617,-62.823204040527344,1
Some guests who wouldn't discover Jane hadn't healed themselves.,Some guests who wouldn't discover Jane hadn't healed herself.,syntax_semantics,binding,principle_A_c_command,True,True,False,False,807,-75.57637786865234,-76.27302551269531,1
Many pictures that aggravated Carl can't scare themselves.,Many pictures that aggravated Carl can't scare himself.,syntax_semantics,binding,principle_A_c_command,True,True,False,False,808,-68.5567626953125,-69.72240447998047,1
That bank that wouldn't resemble those sketches is talking to itself.,That bank that wouldn't resemble those sketches is talking to themselves.,syntax_semantics,binding,principle_A_c_command,True,True,False,False,809,-76.28756713867188,-73.86705017089844,0
Some teachers that watched Sarah approached themselves.,Some teachers that watched Sarah approached herself.,syntax_semantics,binding,principle_A_c_command,True,True,False,False,810,-54.24950408935547,-55.70857238769531,1
A lot of eyes that are embarrassing Russell astounded themselves.,A lot of eyes that are embarrassing Russell astounded himself.,syntax_semantics,binding,principle_A_c_command,True,True,False,False,811,-81.96624755859375,-83.78758239746094,1
The snake that climbed down these mountains hasn't shocked itself.,The snake that climbed down these mountains hasn't shocked themselves.,syntax_semantics,binding,principle_A_c_command,True,True,False,False,812,-75.24920654296875,-72.77822875976562,0
Chicken that hurts Margaret shouldn't alarm itself.,Chicken that hurts Margaret shouldn't alarm herself.,syntax_semantics,binding,principle_A_c_command,True,True,False,False,813,-59.8647575378418,-58.78649139404297,0
This play that has annoyed Daniel has scared itself.,This play that has annoyed Daniel has scared himself.,syntax_semantics,binding,principle_A_c_command,True,True,False,False,814,-72.89881896972656,-71.58431243896484,0
Some senators who passed that hospital couldn't conceal themselves.,Some senators who passed that hospital couldn't conceal itself.,syntax_semantics,binding,principle_A_c_command,True,True,False,False,815,-75.94416046142578,-77.50477600097656,1
The association that has these cars didn't hate itself.,The association that has these cars didn't hate themselves.,syntax_semantics,binding,principle_A_c_command,True,True,False,False,816,-57.69620132446289,-55.2209358215332,0
Most adults who left Victoria noticed themselves.,Most adults who left Victoria noticed herself.,syntax_semantics,binding,principle_A_c_command,True,True,False,False,817,-52.807403564453125,-54.513004302978516,1
Every essay that is hurting Victoria was worrying itself.,Every essay that is hurting Victoria was worrying herself.,syntax_semantics,binding,principle_A_c_command,True,True,False,False,818,-70.34172058105469,-71.883544921875,1
Many teachers that would go to that hill wouldn't alarm themselves.,Many teachers that would go to that hill wouldn't alarm itself.,syntax_semantics,binding,principle_A_c_command,True,True,False,False,819,-63.15159606933594,-64.35299682617188,1
Many guys who don't talk about Stephen aren't finding themselves.,Many guys who don't talk about Stephen aren't finding himself.,syntax_semantics,binding,principle_A_c_command,True,True,False,False,820,-63.56515884399414,-63.88374710083008,1
Many associations that are arguing about Sonia loved themselves.,Many associations that are arguing about Sonia loved herself.,syntax_semantics,binding,principle_A_c_command,True,True,False,False,821,-64.9156494140625,-68.82596588134766,1
This shawl that will aggravate Dawn can't disgust itself.,This shawl that will aggravate Dawn can't disgust herself.,syntax_semantics,binding,principle_A_c_command,True,True,False,False,822,-94.9778823852539,-94.46424102783203,0
Some dancer who hasn't investigated Brad discovers herself.,Some dancer who hasn't investigated Brad discovers himself.,syntax_semantics,binding,principle_A_c_command,True,True,False,False,823,-69.67887878417969,-68.07017517089844,0
Some woman who hadn't messed up that library escapes from herself.,Some woman who hadn't messed up that library escapes from itself.,syntax_semantics,binding,principle_A_c_command,True,True,False,False,824,-74.1083755493164,-74.2228012084961,1
The drivers that wouldn't drop by some grocery store would find themselves.,The drivers that wouldn't drop by some grocery store would find itself.,syntax_semantics,binding,principle_A_c_command,True,True,False,False,825,-79.45158386230469,-81.6441650390625,1
All doctors that have referenced Carla observed themselves.,All doctors that have referenced Carla observed herself.,syntax_semantics,binding,principle_A_c_command,True,True,False,False,826,-72.31246948242188,-74.77244567871094,1
Every boy who runs around all rivers was admiring himself.,Every boy who runs around all rivers was admiring themselves.,syntax_semantics,binding,principle_A_c_command,True,True,False,False,827,-75.95692443847656,-74.77261352539062,0
Some high schools that haven't disturbed Matt hadn't worried themselves.,Some high schools that haven't disturbed Matt hadn't worried himself.,syntax_semantics,binding,principle_A_c_command,True,True,False,False,828,-83.37995910644531,-84.19554901123047,1
Most jackets that have hurt Anna bored themselves.,Most jackets that have hurt Anna bored herself.,syntax_semantics,binding,principle_A_c_command,True,True,False,False,829,-60.75669860839844,-62.394744873046875,1
This cilantro that wasn't annoying Jason is disturbing itself.,This cilantro that wasn't annoying Jason is disturbing himself.,syntax_semantics,binding,principle_A_c_command,True,True,False,False,830,-88.13804626464844,-86.07548522949219,0
Many men that haven't hidden Kayla hadn't talked about themselves.,Many men that haven't hidden Kayla hadn't talked about herself.,syntax_semantics,binding,principle_A_c_command,True,True,False,False,831,-76.31902313232422,-78.42815399169922,1
Some cashiers who broke that skateboard noticed themselves.,Some cashiers who broke that skateboard noticed itself.,syntax_semantics,binding,principle_A_c_command,True,True,False,False,832,-80.03392028808594,-80.96001434326172,1
Those adults who had examined this report talked to themselves.,Those adults who had examined this report talked to itself.,syntax_semantics,binding,principle_A_c_command,True,True,False,False,833,-60.64018630981445,-62.895992279052734,1
That girl that works with the Clintons hasn't criticized herself.,That girl that works with the Clintons hasn't criticized themselves.,syntax_semantics,binding,principle_A_c_command,True,True,False,False,834,-69.78498077392578,-68.63288879394531,0
That cup that confused Christina stunned itself.,That cup that confused Christina stunned herself.,syntax_semantics,binding,principle_A_c_command,True,True,False,False,835,-68.55438232421875,-69.32894897460938,1
Some pictures that resembled this picture can't shock themselves.,Some pictures that resembled this picture can't shock itself.,syntax_semantics,binding,principle_A_c_command,True,True,False,False,836,-68.1229476928711,-68.77591705322266,1
Some shirt that can't resemble these drawings bored itself.,Some shirt that can't resemble these drawings bored themselves.,syntax_semantics,binding,principle_A_c_command,True,True,False,False,837,-70.13162231445312,-69.23828887939453,0
All shoes that could astound Phillip are bothering themselves.,All shoes that could astound Phillip are bothering himself.,syntax_semantics,binding,principle_A_c_command,True,True,False,False,838,-78.14411926269531,-79.84048461914062,1
These dancers that complained about Phillip can leave themselves.,These dancers that complained about Phillip can leave himself.,syntax_semantics,binding,principle_A_c_command,True,True,False,False,839,-62.263824462890625,-64.64765167236328,1
That actress who walked through these high schools would investigate herself.,That actress who walked through these high schools would investigate themselves.,syntax_semantics,binding,principle_A_c_command,True,True,False,False,840,-74.4807357788086,-71.96427154541016,0
All guys that lifted a lake won't see themselves.,All guys that lifted a lake won't see itself.,syntax_semantics,binding,principle_A_c_command,True,True,False,False,841,-59.74184799194336,-61.7231559753418,1
The women who reference Heather discussed themselves.,The women who reference Heather discussed herself.,syntax_semantics,binding,principle_A_c_command,True,True,False,False,842,-56.99083709716797,-58.36931228637695,1
Every waitress that wouldn't notice some skirt might conceal herself.,Every waitress that wouldn't notice some skirt might conceal itself.,syntax_semantics,binding,principle_A_c_command,True,True,False,False,843,-79.43698120117188,-77.53894805908203,0
Cucumbers that disgust Bill haven't worried themselves.,Cucumbers that disgust Bill haven't worried himself.,syntax_semantics,binding,principle_A_c_command,True,True,False,False,844,-89.71336364746094,-89.72669982910156,1
The actress that breaks these glasses described herself.,The actress that breaks these glasses described themselves.,syntax_semantics,binding,principle_A_c_command,True,True,False,False,845,-63.427940368652344,-60.97382354736328,0
These actresses who watched Derek will appreciate themselves.,These actresses who watched Derek will appreciate himself.,syntax_semantics,binding,principle_A_c_command,True,True,False,False,846,-64.91596984863281,-65.89761352539062,1
This dancer who hadn't known Aaron hadn't appreciated herself.,This dancer who hadn't known Aaron hadn't appreciated himself.,syntax_semantics,binding,principle_A_c_command,True,True,False,False,847,-79.7789535522461,-78.01850891113281,0
Every rug that had scared many guests isn't embarrassing itself.,Every rug that had scared many guests isn't embarrassing themselves.,syntax_semantics,binding,principle_A_c_command,True,True,False,False,848,-80.74075317382812,-79.41954040527344,0
This company that embarrassed Florence hadn't disliked itself.,This company that embarrassed Florence hadn't disliked herself.,syntax_semantics,binding,principle_A_c_command,True,True,False,False,849,-70.8995590209961,-71.07293701171875,1
The children that won't work with Carla aggravated themselves.,The children that won't work with Carla aggravated herself.,syntax_semantics,binding,principle_A_c_command,True,True,False,False,850,-70.80091857910156,-72.42947387695312,1
Most legislatures that upset Michael hadn't criticized themselves.,Most legislatures that upset Michael hadn't criticized himself.,syntax_semantics,binding,principle_A_c_command,True,True,False,False,851,-65.94819641113281,-66.12606811523438,1
These senators who will scare Bethany disgusted themselves.,These senators who will scare Bethany disgusted herself.,syntax_semantics,binding,principle_A_c_command,True,True,False,False,852,-84.3878173828125,-86.42253875732422,1
Some man who ascends a lot of steps observes himself.,Some man who ascends a lot of steps observes themselves.,syntax_semantics,binding,principle_A_c_command,True,True,False,False,853,-74.1472396850586,-73.72581481933594,0
Some cafe that scared Dennis was scaring itself.,Some cafe that scared Dennis was scaring himself.,syntax_semantics,binding,principle_A_c_command,True,True,False,False,854,-67.20265197753906,-64.58277130126953,0
Every waitress that is looking like the sketch hasn't scared herself.,Every waitress that is looking like the sketch hasn't scared itself.,syntax_semantics,binding,principle_A_c_command,True,True,False,False,855,-78.4037857055664,-76.85543823242188,0
That government that disgusts Mitchell dislikes itself.,That government that disgusts Mitchell dislikes himself.,syntax_semantics,binding,principle_A_c_command,True,True,False,False,856,-79.77176666259766,-80.93429565429688,1
Many banks that fired Sherry are insulting themselves.,Many banks that fired Sherry are insulting herself.,syntax_semantics,binding,principle_A_c_command,True,True,False,False,857,-70.87602233886719,-73.45536041259766,1
That boy that isn't fleeing from Sara is watching himself.,That boy that isn't fleeing from Sara is watching herself.,syntax_semantics,binding,principle_A_c_command,True,True,False,False,858,-73.51177978515625,-74.87295532226562,1
All customers who loved this book shouldn't dislike themselves.,All customers who loved this book shouldn't dislike itself.,syntax_semantics,binding,principle_A_c_command,True,True,False,False,859,-64.89815521240234,-66.88177490234375,1
Some guests who hadn't discussed Denise respected themselves.,Some guests who hadn't discussed Denise respected herself.,syntax_semantics,binding,principle_A_c_command,True,True,False,False,860,-69.02711486816406,-71.34862518310547,1
Many waitresses that admire Douglas sounded like themselves.,Many waitresses that admire Douglas sounded like himself.,syntax_semantics,binding,principle_A_c_command,True,True,False,False,861,-73.75387573242188,-74.01891326904297,1
A lot of teenagers who haven't visited Brian might heal themselves.,A lot of teenagers who haven't visited Brian might heal himself.,syntax_semantics,binding,principle_A_c_command,True,True,False,False,862,-88.47853088378906,-87.5220947265625,0
A dancer who did reveal all actresses isn't thinking about herself.,A dancer who did reveal all actresses isn't thinking about themselves.,syntax_semantics,binding,principle_A_c_command,True,True,False,False,863,-87.91261291503906,-85.63134765625,0
The senators that have researched art investigated themselves.,The senators that have researched art investigated itself.,syntax_semantics,binding,principle_A_c_command,True,True,False,False,864,-64.45062255859375,-64.17239379882812,0
Waitresses that haven't disturbed Tanya have observed themselves.,Waitresses that haven't disturbed Tanya have observed herself.,syntax_semantics,binding,principle_A_c_command,True,True,False,False,865,-84.52042388916016,-87.07252502441406,1
The dancer that has cared for the senators visits herself.,The dancer that has cared for the senators visits themselves.,syntax_semantics,binding,principle_A_c_command,True,True,False,False,866,-69.37080383300781,-67.21083068847656,0
Cashiers that messed up this dress would love themselves.,Cashiers that messed up this dress would love itself.,syntax_semantics,binding,principle_A_c_command,True,True,False,False,867,-62.096160888671875,-63.13300323486328,1
The picture that bothers cashiers bored itself.,The picture that bothers cashiers bored themselves.,syntax_semantics,binding,principle_A_c_command,True,True,False,False,868,-65.50973510742188,-64.89570617675781,0
The girls that discover Amy aren't listening to themselves.,The girls that discover Amy aren't listening to herself.,syntax_semantics,binding,principle_A_c_command,True,True,False,False,869,-57.60996627807617,-59.95850372314453,1
A lot of pedestrians who hadn't talked about some college campus won't watch themselves.,A lot of pedestrians who hadn't talked about some college campus won't watch itself.,syntax_semantics,binding,principle_A_c_command,True,True,False,False,870,-103.13192749023438,-105.15428924560547,1
Most cashiers who can approach Tamara didn't reveal themselves.,Most cashiers who can approach Tamara didn't reveal herself.,syntax_semantics,binding,principle_A_c_command,True,True,False,False,871,-92.21834564208984,-93.76625061035156,1
Every man that concealed Deborah hasn't hidden himself.,Every man that concealed Deborah hasn't hidden herself.,syntax_semantics,binding,principle_A_c_command,True,True,False,False,872,-70.08412170410156,-71.28182983398438,1
These companies that were working with Christine aren't insulting themselves.,These companies that were working with Christine aren't insulting herself.,syntax_semantics,binding,principle_A_c_command,True,True,False,False,873,-65.30903625488281,-67.979248046875,1
The lady who had healed the man respects herself.,The lady who had healed the man respects himself.,syntax_semantics,binding,principle_A_c_command,True,True,False,False,874,-61.32361602783203,-60.187461853027344,0
A company that bored Karla praises itself.,A company that bored Karla praises herself.,syntax_semantics,binding,principle_A_c_command,True,True,False,False,875,-80.83282470703125,-80.92526245117188,1
