sentence_good,sentence_bad,field,linguistics_term,UID,simple_LM_method,one_prefix_method,two_prefix_method,lexically_identical,pair_id,good_prob,bad_prob,correct
Raymond is selling this sketch.,Raymond is selling this sketches.,morphology,determiner_noun_agreement,determiner_noun_agreement_1,True,True,False,True,0,-40.307861328125,-42.702239990234375,1
Craig explored that grocery store.,Craig explored that grocery stores.,morphology,determiner_noun_agreement,determiner_noun_agreement_1,True,True,False,True,1,-38.16694641113281,-38.55350875854492,1
Eva has scared these children.,Eva has scared these child.,morphology,determiner_noun_agreement,determiner_noun_agreement_1,True,True,False,True,2,-26.939605712890625,-31.155014038085938,1
Marcus would conceal that pamphlet.,Marcus would conceal that pamphlets.,morphology,determiner_noun_agreement,determiner_noun_agreement_1,True,True,False,True,3,-39.78008270263672,-47.015655517578125,1
Carmen hadn't shocked these customers.,Carmen hadn't shocked these customer.,morphology,determiner_noun_agreement,determiner_noun_agreement_1,True,True,False,True,4,-61.799339294433594,-64.87648010253906,1
The Impressionists were walking through this library.,The Impressionists were walking through this libraries.,morphology,determiner_noun_agreement,determiner_noun_agreement_1,True,True,False,True,5,-59.097808837890625,-64.8367691040039,1
Some men weren't touring those cafes.,Some men weren't touring those cafe.,morphology,determiner_noun_agreement,determiner_noun_agreement_1,True,True,False,True,6,-48.7200927734375,-45.20333480834961,0
Leslie isn't firing that actress.,Leslie isn't firing that actresses.,morphology,determiner_noun_agreement,determiner_noun_agreement_1,True,True,False,True,7,-51.21989440917969,-50.63376235961914,0
Jennifer concealed those cups.,Jennifer concealed those cup.,morphology,determiner_noun_agreement,determiner_noun_agreement_1,True,True,False,True,8,-35.939022064208984,-37.13251495361328,1
A waitress does take those hospitals.,A waitress does take those hospital.,morphology,determiner_noun_agreement,determiner_noun_agreement_1,True,True,False,True,9,-51.51551055908203,-54.89842224121094,1
The man walks through those hospitals.,The man walks through those hospital.,morphology,determiner_noun_agreement,determiner_noun_agreement_1,True,True,False,True,10,-37.0072135925293,-38.459632873535156,1
Winston Churchill boycotts these public parks.,Winston Churchill boycotts these public park.,morphology,determiner_noun_agreement,determiner_noun_agreement_1,True,True,False,True,11,-70.75642395019531,-71.94984436035156,1
This sock disturbs that customer.,This sock disturbs that customers.,morphology,determiner_noun_agreement,determiner_noun_agreement_1,True,True,False,True,12,-50.778961181640625,-52.60796356201172,1
William described this movie.,William described this movies.,morphology,determiner_noun_agreement,determiner_noun_agreement_1,True,True,False,True,13,-23.275724411010742,-27.133193969726562,1
Monet dropped by those libraries.,Monet dropped by those library.,morphology,determiner_noun_agreement,determiner_noun_agreement_1,True,True,False,True,14,-45.34485626220703,-43.34686279296875,0
Elaine was biking to this bank.,Elaine was biking to this banks.,morphology,determiner_noun_agreement,determiner_noun_agreement_1,True,True,False,True,15,-47.53207778930664,-50.77068328857422,1
These senators wear that jacket.,These senators wear that jackets.,morphology,determiner_noun_agreement,determiner_noun_agreement_1,True,True,False,True,16,-41.16461944580078,-42.49158477783203,1
The Lutherans notice that drawing.,The Lutherans notice that drawings.,morphology,determiner_noun_agreement,determiner_noun_agreement_1,True,True,False,True,17,-52.294281005859375,-53.552696228027344,1
Cheryl is hurting that teacher.,Cheryl is hurting that teachers.,morphology,determiner_noun_agreement,determiner_noun_agreement_1,True,True,False,True,18,-56.06311798095703,-56.734375,1
Russell might break those cups.,Russell might break those cup.,morphology,determiner_noun_agreement,determiner_noun_agreement_1,True,True,False,True,19,-32.14191436767578,-32.45022964477539,1
A lot of patients resemble these pictures.,A lot of patients resemble these picture.,morphology,determiner_noun_agreement,determiner_noun_agreement_1,True,True,False,True,20,-54.10570526123047,-57.388275146484375,1
Vanessa can talk to these doctors.,Vanessa can talk to these doctor.,morphology,determiner_noun_agreement,determiner_noun_agreement_1,True,True,False,True,21,-38.89429473876953,-40.80286407470703,1
Janice had worn this shawl.,Janice had worn this shawls.,morphology,determiner_noun_agreement,determiner_noun_agreement_1,True,True,False,True,22,-57.067100524902344,-57.88020324707031,1
A lot of waitresses find those jackets.,A lot of waitresses find those jacket.,morphology,determiner_noun_agreement,determiner_noun_agreement_1,True,True,False,True,23,-69.64007568359375,-70.00027465820312,1
Every dancer hasn't admired this skirt.,Every dancer hasn't admired this skirts.,morphology,determiner_noun_agreement,determiner_noun_agreement_1,True,True,False,True,24,-49.21499252319336,-51.284217834472656,1
The adult doesn't hide those malls.,The adult doesn't hide those mall.,morphology,determiner_noun_agreement,determiner_noun_agreement_1,True,True,False,True,25,-45.92314529418945,-42.419219970703125,0
Samuel criticizes that art gallery.,Samuel criticizes that art galleries.,morphology,determiner_noun_agreement,determiner_noun_agreement_1,True,True,False,True,26,-55.791847229003906,-54.22258377075195,0
A teacher annoyed those senators.,A teacher annoyed those senator.,morphology,determiner_noun_agreement,determiner_noun_agreement_1,True,True,False,True,27,-53.99974822998047,-51.12710189819336,0
A teacher talked to that customer.,A teacher talked to that customers.,morphology,determiner_noun_agreement,determiner_noun_agreement_1,True,True,False,True,28,-43.964176177978516,-44.796260833740234,1
Mark discovered this face.,Mark discovered this faces.,morphology,determiner_noun_agreement,determiner_noun_agreement_1,True,True,False,True,29,-28.857601165771484,-31.51581573486328,1
Carmen toured these restaurants.,Carmen toured these restaurant.,morphology,determiner_noun_agreement,determiner_noun_agreement_1,True,True,False,True,30,-50.717864990234375,-54.53976058959961,1
Eva toured this school.,Eva toured this schools.,morphology,determiner_noun_agreement,determiner_noun_agreement_1,True,True,False,True,31,-24.62279510498047,-27.19243812561035,1
Travis would tour that hospital.,Travis would tour that hospitals.,morphology,determiner_noun_agreement,determiner_noun_agreement_1,True,True,False,True,32,-55.98130416870117,-56.95353317260742,1
Some stories aggravated those libraries.,Some stories aggravated those library.,morphology,determiner_noun_agreement,determiner_noun_agreement_1,True,True,False,True,33,-47.660125732421875,-46.56187438964844,0
These cashiers hate that guest.,These cashiers hate that guests.,morphology,determiner_noun_agreement,determiner_noun_agreement_1,True,True,False,True,34,-48.44966125488281,-49.14189529418945,1
Heather messed up this dish.,Heather messed up this dishs.,morphology,determiner_noun_agreement,determiner_noun_agreement_1,True,True,False,True,35,-37.38951110839844,-46.888057708740234,1
Alan listened to these guests.,Alan listened to these guest.,morphology,determiner_noun_agreement,determiner_noun_agreement_1,True,True,False,True,36,-29.225627899169922,-31.92862892150879,1
Most children examine this pamphlet.,Most children examine this pamphlets.,morphology,determiner_noun_agreement,determiner_noun_agreement_1,True,True,False,True,37,-39.1131477355957,-46.85131072998047,1
Stacey will know these patients.,Stacey will know these patient.,morphology,determiner_noun_agreement,determiner_noun_agreement_1,True,True,False,True,38,-50.432884216308594,-52.63103485107422,1
Jessica sold this rabbit.,Jessica sold this rabbits.,morphology,determiner_noun_agreement,determiner_noun_agreement_1,True,True,False,True,39,-27.789085388183594,-28.417251586914062,1
Daniel couldn't hate those cashiers.,Daniel couldn't hate those cashier.,morphology,determiner_noun_agreement,determiner_noun_agreement_1,True,True,False,True,40,-46.28588104248047,-46.12154006958008,0
Those ladies kiss those adults.,Those ladies kiss those adult.,morphology,determiner_noun_agreement,determiner_noun_agreement_1,True,True,False,True,41,-35.41255187988281,-38.12217712402344,1
Diane works with these waiters.,Diane works with these waiter.,morphology,determiner_noun_agreement,determiner_noun_agreement_1,True,True,False,True,42,-57.052276611328125,-50.69138717651367,0
Most women conceal that blouse.,Most women conceal that blouses.,morphology,determiner_noun_agreement,determiner_noun_agreement_1,True,True,False,True,43,-42.04997253417969,-42.98548126220703,1
Senators can't disagree with that newspaper article.,Senators can't disagree with that newspaper articles.,morphology,determiner_noun_agreement,determiner_noun_agreement_1,True,True,False,True,44,-50.21783447265625,-52.28291320800781,1
Jane has concealed this book.,Jane has concealed this books.,morphology,determiner_noun_agreement,determiner_noun_agreement_1,True,True,False,True,45,-33.906681060791016,-37.62818908691406,1
Marla took this pamphlet.,Marla took this pamphlets.,morphology,determiner_noun_agreement,determiner_noun_agreement_1,True,True,False,True,46,-36.39683532714844,-43.63706970214844,1
The skirt wasn't annoying those dancers.,The skirt wasn't annoying those dancer.,morphology,determiner_noun_agreement,determiner_noun_agreement_1,True,True,False,True,47,-49.043174743652344,-50.66633605957031,1
Most guys conceal this driver.,Most guys conceal this drivers.,morphology,determiner_noun_agreement,determiner_noun_agreement_1,True,True,False,True,48,-38.76255798339844,-38.64325714111328,0
David wasn't lifting those hats.,David wasn't lifting those hat.,morphology,determiner_noun_agreement,determiner_noun_agreement_1,True,True,False,True,49,-37.46620559692383,-38.422752380371094,1
The dancers are driving to those art galleries.,The dancers are driving to those art gallery.,morphology,determiner_noun_agreement,determiner_noun_agreement_1,True,True,False,True,50,-51.445762634277344,-53.51683044433594,1
Tracy might cure those patients.,Tracy might cure those patient.,morphology,determiner_noun_agreement,determiner_noun_agreement_1,True,True,False,True,51,-42.315765380859375,-44.219200134277344,1
Heather cleans that print.,Heather cleans that prints.,morphology,determiner_noun_agreement,determiner_noun_agreement_1,True,True,False,True,52,-41.029747009277344,-40.9091796875,0
Rose won't reference these movies.,Rose won't reference these movie.,morphology,determiner_noun_agreement,determiner_noun_agreement_1,True,True,False,True,53,-39.20631790161133,-42.682403564453125,1
Many reports irritate these senators.,Many reports irritate these senator.,morphology,determiner_noun_agreement,determiner_noun_agreement_1,True,True,False,True,54,-46.918758392333984,-46.06578063964844,0
Dan couldn't walk through this public park.,Dan couldn't walk through this public parks.,morphology,determiner_noun_agreement,determiner_noun_agreement_1,True,True,False,True,55,-43.349708557128906,-44.55168914794922,1
Rose hated this girl.,Rose hated this girls.,morphology,determiner_noun_agreement,determiner_noun_agreement_1,True,True,False,True,56,-26.10857391357422,-29.43975067138672,1
Melinda hires that teacher.,Melinda hires that teachers.,morphology,determiner_noun_agreement,determiner_noun_agreement_1,True,True,False,True,57,-42.47454833984375,-43.23895263671875,1
Joseph healed these customers.,Joseph healed these customer.,morphology,determiner_noun_agreement,determiner_noun_agreement_1,True,True,False,True,58,-31.321979522705078,-34.407630920410156,1
A door doesn't distract those students.,A door doesn't distract those student.,morphology,determiner_noun_agreement,determiner_noun_agreement_1,True,True,False,True,59,-51.186988830566406,-54.40229034423828,1
Theodore skated around that art gallery.,Theodore skated around that art galleries.,morphology,determiner_noun_agreement,determiner_noun_agreement_1,True,True,False,True,60,-65.04254150390625,-63.310211181640625,0
These tomatoes shock these dancers.,These tomatoes shock these dancer.,morphology,determiner_noun_agreement,determiner_noun_agreement_1,True,True,False,True,61,-42.87616729736328,-44.587154388427734,1
Guys observe these children.,Guys observe these child.,morphology,determiner_noun_agreement,determiner_noun_agreement_1,True,True,False,True,62,-29.490615844726562,-33.236270904541016,1
Some guests flee from those dancers.,Some guests flee from those dancer.,morphology,determiner_noun_agreement,determiner_noun_agreement_1,True,True,False,True,63,-48.98344421386719,-50.64311218261719,1
Linda isn't embarrassing these waitresses.,Linda isn't embarrassing these waitress.,morphology,determiner_noun_agreement,determiner_noun_agreement_1,True,True,False,True,64,-68.75337219238281,-58.13566207885742,0
Walter hides these dancers.,Walter hides these dancer.,morphology,determiner_noun_agreement,determiner_noun_agreement_1,True,True,False,True,65,-36.95476531982422,-38.10745620727539,1
Sharon investigated those waiters.,Sharon investigated those waiter.,morphology,determiner_noun_agreement,determiner_noun_agreement_1,True,True,False,True,66,-46.9984130859375,-40.37145233154297,0
Bradley should explore this high school.,Bradley should explore this high schools.,morphology,determiner_noun_agreement,determiner_noun_agreement_1,True,True,False,True,67,-38.585906982421875,-42.36235046386719,1
Tanya wears these socks.,Tanya wears these sock.,morphology,determiner_noun_agreement,determiner_noun_agreement_1,True,True,False,True,68,-46.40947723388672,-49.633514404296875,1
That cat had bored those ladies.,That cat had bored those lady.,morphology,determiner_noun_agreement,determiner_noun_agreement_1,True,True,False,True,69,-49.591896057128906,-50.464054107666016,1
Stephen had cleaned this bank.,Stephen had cleaned this banks.,morphology,determiner_noun_agreement,determiner_noun_agreement_1,True,True,False,True,70,-28.614675521850586,-31.442733764648438,1
Waiters have left that driver.,Waiters have left that drivers.,morphology,determiner_noun_agreement,determiner_noun_agreement_1,True,True,False,True,71,-35.76332092285156,-35.33802032470703,0
Heather wasn't criticizing these teachers.,Heather wasn't criticizing these teacher.,morphology,determiner_noun_agreement,determiner_noun_agreement_1,True,True,False,True,72,-51.45384216308594,-53.55494689941406,1
Brian wasn't concealing those cafes.,Brian wasn't concealing those cafe.,morphology,determiner_noun_agreement,determiner_noun_agreement_1,True,True,False,True,73,-55.87700271606445,-52.30876922607422,0
Some trucks weren't boring that cashier.,Some trucks weren't boring that cashiers.,morphology,determiner_noun_agreement,determiner_noun_agreement_1,True,True,False,True,74,-53.881858825683594,-55.09560012817383,1
Many eggplants aren't scaring this teacher.,Many eggplants aren't scaring this teachers.,morphology,determiner_noun_agreement,determiner_noun_agreement_1,True,True,False,True,75,-64.1440658569336,-64.45214080810547,1
Children aren't boring this lady.,Children aren't boring this ladies.,morphology,determiner_noun_agreement,determiner_noun_agreement_1,True,True,False,True,76,-31.401857376098633,-34.43650436401367,1
Karla hadn't brought these pictures.,Karla hadn't brought these picture.,morphology,determiner_noun_agreement,determiner_noun_agreement_1,True,True,False,True,77,-39.98216247558594,-43.54590606689453,1
Janice hasn't cared for that waitress.,Janice hasn't cared for that waitresses.,morphology,determiner_noun_agreement,determiner_noun_agreement_1,True,True,False,True,78,-49.20960235595703,-59.793800354003906,1
A lot of doctors exit those art galleries.,A lot of doctors exit those art gallery.,morphology,determiner_noun_agreement,determiner_noun_agreement_1,True,True,False,True,79,-63.19435119628906,-65.45530700683594,1
Thomas should hug this waiter.,Thomas should hug this waiters.,morphology,determiner_noun_agreement,determiner_noun_agreement_1,True,True,False,True,80,-40.1395263671875,-48.088356018066406,1
Candice hasn't attacked that boy.,Candice hasn't attacked that boys.,morphology,determiner_noun_agreement,determiner_noun_agreement_1,True,True,False,True,81,-41.02528762817383,-43.38389587402344,1
Katherine wasn't taking that public park.,Katherine wasn't taking that public parks.,morphology,determiner_noun_agreement,determiner_noun_agreement_1,True,True,False,True,82,-51.67210388183594,-51.528236389160156,0
The Clintons watch those drivers.,The Clintons watch those driver.,morphology,determiner_noun_agreement,determiner_noun_agreement_1,True,True,False,True,83,-45.265296936035156,-47.175750732421875,1
Amelia loves this waiter.,Amelia loves this waiters.,morphology,determiner_noun_agreement,determiner_noun_agreement_1,True,True,False,True,84,-38.45219039916992,-47.379722595214844,1
Caroline hasn't known this boy.,Caroline hasn't known this boys.,morphology,determiner_noun_agreement,determiner_noun_agreement_1,True,True,False,True,85,-41.60940170288086,-44.60282897949219,1
Sheila isn't passing that cafe.,Sheila isn't passing that cafes.,morphology,determiner_noun_agreement,determiner_noun_agreement_1,True,True,False,True,86,-46.51456832885742,-48.848297119140625,1
Claire had cleaned that picture.,Claire had cleaned that pictures.,morphology,determiner_noun_agreement,determiner_noun_agreement_1,True,True,False,True,87,-36.09095001220703,-36.66250228881836,1
The people exit these movie theaters.,The people exit these movie theater.,morphology,determiner_noun_agreement,determiner_noun_agreement_1,True,True,False,True,88,-44.23204040527344,-44.681793212890625,1
Bruce won't mess up that restaurant.,Bruce won't mess up that restaurants.,morphology,determiner_noun_agreement,determiner_noun_agreement_1,True,True,False,True,89,-33.70478057861328,-36.48246765136719,1
Margaret hasn't bought that blouse.,Margaret hasn't bought that blouses.,morphology,determiner_noun_agreement,determiner_noun_agreement_1,True,True,False,True,90,-39.115867614746094,-41.08679962158203,1
Some waitresses remember that driver.,Some waitresses remember that drivers.,morphology,determiner_noun_agreement,determiner_noun_agreement_1,True,True,False,True,91,-52.015220642089844,-51.23114776611328,0
Timothy loved this boy.,Timothy loved this boys.,morphology,determiner_noun_agreement,determiner_noun_agreement_1,True,True,False,True,92,-30.02136993408203,-32.41980743408203,1
A lot of adults help that guy.,A lot of adults help that guys.,morphology,determiner_noun_agreement,determiner_noun_agreement_1,True,True,False,True,93,-46.32627868652344,-47.02916717529297,1
Steven has broken that cup.,Steven has broken that cups.,morphology,determiner_noun_agreement,determiner_noun_agreement_1,True,True,False,True,94,-28.786670684814453,-30.49999237060547,1
Patricia loved those cashiers.,Patricia loved those cashier.,morphology,determiner_noun_agreement,determiner_noun_agreement_1,True,True,False,True,95,-47.207916259765625,-47.60335159301758,1
Many drivers fix that glass.,Many drivers fix that glasses.,morphology,determiner_noun_agreement,determiner_noun_agreement_1,True,True,False,True,96,-32.9846076965332,-35.344383239746094,1
A lot of cashiers mess up that library.,A lot of cashiers mess up that libraries.,morphology,determiner_noun_agreement,determiner_noun_agreement_1,True,True,False,True,97,-66.014404296875,-71.13693237304688,1
Waitresses drive to that school.,Waitresses drive to that schools.,morphology,determiner_noun_agreement,determiner_noun_agreement_1,True,True,False,True,98,-36.88922119140625,-39.205589294433594,1
Roger should sound like that waitress.,Roger should sound like that waitresses.,morphology,determiner_noun_agreement,determiner_noun_agreement_1,True,True,False,True,99,-38.39824295043945,-47.00428771972656,1
The Impressionists do listen to this waitress.,The Impressionists do listen to this waitresses.,morphology,determiner_noun_agreement,determiner_noun_agreement_1,True,True,False,True,100,-61.80888366699219,-73.30182647705078,1
Theresa bought this drawing.,Theresa bought this drawings.,morphology,determiner_noun_agreement,determiner_noun_agreement_1,True,True,False,True,101,-39.35072326660156,-39.253997802734375,0
The Impressionists walk through this cafe.,The Impressionists walk through this cafes.,morphology,determiner_noun_agreement,determiner_noun_agreement_1,True,True,False,True,102,-60.7439079284668,-63.491554260253906,1
Thomas can boycott these committees.,Thomas can boycott these committee.,morphology,determiner_noun_agreement,determiner_noun_agreement_1,True,True,False,True,103,-45.93128967285156,-46.711387634277344,1
Alan had boasted about those girls.,Alan had boasted about those girl.,morphology,determiner_noun_agreement,determiner_noun_agreement_1,True,True,False,True,104,-40.779762268066406,-43.909698486328125,1
Sally isn't escaping from these boys.,Sally isn't escaping from these boy.,morphology,determiner_noun_agreement,determiner_noun_agreement_1,True,True,False,True,105,-56.459136962890625,-60.729713439941406,1
Jesus can run around this high school.,Jesus can run around this high schools.,morphology,determiner_noun_agreement,determiner_noun_agreement_1,True,True,False,True,106,-34.6012077331543,-39.126441955566406,1
Amy wasn't confusing those companies.,Amy wasn't confusing those company.,morphology,determiner_noun_agreement,determiner_noun_agreement_1,True,True,False,True,107,-36.53895568847656,-39.284515380859375,1
Tanya boycotts that university.,Tanya boycotts that universities.,morphology,determiner_noun_agreement,determiner_noun_agreement_1,True,True,False,True,108,-60.713356018066406,-62.485595703125,1
Roger ran around this school.,Roger ran around this schools.,morphology,determiner_noun_agreement,determiner_noun_agreement_1,True,True,False,True,109,-26.154916763305664,-29.587791442871094,1
These teachers escape from those restaurants.,These teachers escape from those restaurant.,morphology,determiner_noun_agreement,determiner_noun_agreement_1,True,True,False,True,110,-40.714195251464844,-43.79167938232422,1
Maria was talking to this guest.,Maria was talking to this guests.,morphology,determiner_noun_agreement,determiner_noun_agreement_1,True,True,False,True,111,-28.538801193237305,-30.66114616394043,1
Rachel has hugged those boys.,Rachel has hugged those boy.,morphology,determiner_noun_agreement,determiner_noun_agreement_1,True,True,False,True,112,-33.468223571777344,-36.409095764160156,1
The students fire this patient.,The students fire this patients.,morphology,determiner_noun_agreement,determiner_noun_agreement_1,True,True,False,True,113,-40.11468505859375,-41.20909881591797,1
Jennifer helped those guests.,Jennifer helped those guest.,morphology,determiner_noun_agreement,determiner_noun_agreement_1,True,True,False,True,114,-27.153528213500977,-29.414989471435547,1
Some plays disgust this legislature.,Some plays disgust this legislatures.,morphology,determiner_noun_agreement,determiner_noun_agreement_1,True,True,False,True,115,-46.33057403564453,-47.62571334838867,1
Jerry had hidden these cups.,Jerry had hidden these cup.,morphology,determiner_noun_agreement,determiner_noun_agreement_1,True,True,False,True,116,-34.24522399902344,-35.11800003051758,1
Martin has concealed this boy.,Martin has concealed this boys.,morphology,determiner_noun_agreement,determiner_noun_agreement_1,True,True,False,True,117,-36.96553039550781,-38.71678161621094,1
That person hadn't bothered those girls.,That person hadn't bothered those girl.,morphology,determiner_noun_agreement,determiner_noun_agreement_1,True,True,False,True,118,-42.82709503173828,-44.938899993896484,1
Carla has hired those patients.,Carla has hired those patient.,morphology,determiner_noun_agreement,determiner_noun_agreement_1,True,True,False,True,119,-39.19873046875,-41.86927795410156,1
Noah talks about this doctor.,Noah talks about this doctors.,morphology,determiner_noun_agreement,determiner_noun_agreement_1,True,True,False,True,120,-37.982200622558594,-39.645172119140625,1
Rachel ran around those high schools.,Rachel ran around those high school.,morphology,determiner_noun_agreement,determiner_noun_agreement_1,True,True,False,True,121,-32.20612335205078,-27.970458984375,0
All waiters run around these malls.,All waiters run around these mall.,morphology,determiner_noun_agreement,determiner_noun_agreement_1,True,True,False,True,122,-55.2879524230957,-51.49089050292969,0
All students didn't buy these schools.,All students didn't buy these school.,morphology,determiner_noun_agreement,determiner_noun_agreement_1,True,True,False,True,123,-33.88182067871094,-36.89173889160156,1
Patricia bikes to those malls.,Patricia bikes to those mall.,morphology,determiner_noun_agreement,determiner_noun_agreement_1,True,True,False,True,124,-52.88550567626953,-49.463287353515625,0
Vanessa hadn't taken those grocery stores.,Vanessa hadn't taken those grocery store.,morphology,determiner_noun_agreement,determiner_noun_agreement_1,True,True,False,True,125,-48.62042999267578,-50.2970085144043,1
Bethany walked through this school.,Bethany walked through this schools.,morphology,determiner_noun_agreement,determiner_noun_agreement_1,True,True,False,True,126,-56.57481002807617,-59.10551834106445,1
Patricia had argued about those children.,Patricia had argued about those child.,morphology,determiner_noun_agreement,determiner_noun_agreement_1,True,True,False,True,127,-42.095619201660156,-46.151126861572266,1
Julie did flee from this waitress.,Julie did flee from this waitresses.,morphology,determiner_noun_agreement,determiner_noun_agreement_1,True,True,False,True,128,-45.719757080078125,-56.56387710571289,1
