sentence_good,sentence_bad,field,linguistics_term,UID,simple_LM_method,one_prefix_method,two_prefix_method,lexically_identical,pair_id,good_prob,bad_prob,correct
Carl can bother himself.,Carl can bother themselves.,morphology,anaphor_agreement,anaphor_number_agreement,True,True,False,True,691,-23.564411163330078,-23.23530387878418,0
Tamara hasn't kissed herself.,Tamara hasn't kissed themselves.,morphology,anaphor_agreement,anaphor_number_agreement,True,True,False,True,692,-34.62238311767578,-33.56866455078125,0
Edward couldn't praise himself.,Edward couldn't praise themselves.,morphology,anaphor_agreement,anaphor_number_agreement,True,True,False,True,693,-27.964397430419922,-28.544883728027344,1
Most guys might stun themselves.,Most guys might stun itself.,morphology,anaphor_agreement,anaphor_number_agreement,True,True,False,True,694,-36.32306671142578,-39.2032470703125,1
A lot of teachers will worry themselves.,A lot of teachers will worry itself.,morphology,anaphor_agreement,anaphor_number_agreement,True,True,False,True,695,-50.521881103515625,-51.72181701660156,1
Brenda wasn't concealing herself.,Brenda wasn't concealing themselves.,morphology,anaphor_agreement,anaphor_number_agreement,True,True,False,True,696,-45.651451110839844,-44.686553955078125,0
A lot of women would flee from themselves.,A lot of women would flee from itself.,morphology,anaphor_agreement,anaphor_number_agreement,True,True,False,True,697,-51.85150909423828,-53.394500732421875,1
The Lutherans had scared themselves.,The Lutherans had scared itself.,morphology,anaphor_agreement,anaphor_number_agreement,True,True,False,True,698,-50.4941520690918,-51.32017135620117,1
A lot of girls weren't shocking themselves.,A lot of girls weren't shocking herself.,morphology,anaphor_agreement,anaphor_number_agreement,True,True,False,True,699,-50.97323989868164,-53.331626892089844,1
All adults thought about themselves.,All adults thought about himself.,morphology,anaphor_agreement,anaphor_number_agreement,True,True,False,True,700,-29.196819305419922,-31.81607437133789,1
This dancer shouldn't aggravate herself.,This dancer shouldn't aggravate themselves.,morphology,anaphor_agreement,anaphor_number_agreement,True,True,False,True,701,-48.480464935302734,-47.14488983154297,0
Most doctors are hurting themselves.,Most doctors are hurting itself.,morphology,anaphor_agreement,anaphor_number_agreement,True,True,False,True,702,-24.109310150146484,-28.539859771728516,1
The drivers hadn't returned to themselves.,The drivers hadn't returned to herself.,morphology,anaphor_agreement,anaphor_number_agreement,True,True,False,True,703,-37.17794418334961,-40.157073974609375,1
Nicole should complain about herself.,Nicole should complain about themselves.,morphology,anaphor_agreement,anaphor_number_agreement,True,True,False,True,704,-39.7591552734375,-37.39257049560547,0
Heather remembered herself.,Heather remembered themselves.,morphology,anaphor_agreement,anaphor_number_agreement,True,True,False,True,705,-34.687171936035156,-33.76583480834961,0
The school bothers itself.,The school bothers themselves.,morphology,anaphor_agreement,anaphor_number_agreement,True,True,False,True,706,-28.117694854736328,-25.952686309814453,0
The guy distracted himself.,The guy distracted themselves.,morphology,anaphor_agreement,anaphor_number_agreement,True,True,False,True,707,-27.630054473876953,-27.626922607421875,0
Walter stunned himself.,Walter stunned themselves.,morphology,anaphor_agreement,anaphor_number_agreement,True,True,False,True,708,-29.224864959716797,-28.439281463623047,0
Some guy returned to himself.,Some guy returned to themselves.,morphology,anaphor_agreement,anaphor_number_agreement,True,True,False,True,709,-26.49489402770996,-25.51949691772461,0
Tonya helped herself.,Tonya helped themselves.,morphology,anaphor_agreement,anaphor_number_agreement,True,True,False,True,710,-28.021488189697266,-26.913108825683594,0
Michael was hiding himself.,Michael was hiding themselves.,morphology,anaphor_agreement,anaphor_number_agreement,True,True,False,True,711,-22.903961181640625,-25.178972244262695,1
Many ladies conceal themselves.,Many ladies conceal herself.,morphology,anaphor_agreement,anaphor_number_agreement,True,True,False,True,712,-30.8243408203125,-35.928531646728516,1
Some cashiers talk about themselves.,Some cashiers talk about himself.,morphology,anaphor_agreement,anaphor_number_agreement,True,True,False,True,713,-38.04370880126953,-40.62165832519531,1
All actors will dislike themselves.,All actors will dislike itself.,morphology,anaphor_agreement,anaphor_number_agreement,True,True,False,True,714,-34.54657745361328,-36.406105041503906,1
Margaret healed herself.,Margaret healed themselves.,morphology,anaphor_agreement,anaphor_number_agreement,True,True,False,True,715,-29.557170867919922,-27.87209129333496,0
Most cashiers have distracted themselves.,Most cashiers have distracted himself.,morphology,anaphor_agreement,anaphor_number_agreement,True,True,False,True,716,-46.049476623535156,-48.673065185546875,1
Adults worked with themselves.,Adults worked with itself.,morphology,anaphor_agreement,anaphor_number_agreement,True,True,False,True,717,-29.077939987182617,-30.599817276000977,1
Rose doesn't reveal herself.,Rose doesn't reveal themselves.,morphology,anaphor_agreement,anaphor_number_agreement,True,True,False,True,718,-27.291778564453125,-25.488380432128906,0
Kendra impressed herself.,Kendra impressed themselves.,morphology,anaphor_agreement,anaphor_number_agreement,True,True,False,True,719,-45.20191955566406,-42.99929428100586,0
Melissa will approach herself.,Melissa will approach themselves.,morphology,anaphor_agreement,anaphor_number_agreement,True,True,False,True,720,-35.145179748535156,-33.03905487060547,0
Those cashiers had sounded like themselves.,Those cashiers had sounded like himself.,morphology,anaphor_agreement,anaphor_number_agreement,True,True,False,True,721,-49.7188720703125,-51.716529846191406,1
The teenagers annoyed themselves.,The teenagers annoyed herself.,morphology,anaphor_agreement,anaphor_number_agreement,True,True,False,True,722,-32.75755310058594,-37.708187103271484,1
Most guys were hiding themselves.,Most guys were hiding himself.,morphology,anaphor_agreement,anaphor_number_agreement,True,True,False,True,723,-28.960309982299805,-30.634634017944336,1
Many actors haven't listened to themselves.,Many actors haven't listened to himself.,morphology,anaphor_agreement,anaphor_number_agreement,True,True,False,True,724,-31.839736938476562,-34.80958938598633,1
Most pedestrians might observe themselves.,Most pedestrians might observe itself.,morphology,anaphor_agreement,anaphor_number_agreement,True,True,False,True,725,-40.89596939086914,-41.874603271484375,1
Craig wasn't attacking himself.,Craig wasn't attacking themselves.,morphology,anaphor_agreement,anaphor_number_agreement,True,True,False,True,726,-26.86724090576172,-26.042449951171875,0
Becca has embarrassed herself.,Becca has embarrassed themselves.,morphology,anaphor_agreement,anaphor_number_agreement,True,True,False,True,727,-40.09156036376953,-37.792022705078125,0
Some guests conceal themselves.,Some guests conceal himself.,morphology,anaphor_agreement,anaphor_number_agreement,True,True,False,True,728,-30.841392517089844,-34.755653381347656,1
Tina remembered herself.,Tina remembered themselves.,morphology,anaphor_agreement,anaphor_number_agreement,True,True,False,True,729,-41.02552032470703,-39.158573150634766,0
Thomas couldn't investigate himself.,Thomas couldn't investigate themselves.,morphology,anaphor_agreement,anaphor_number_agreement,True,True,False,True,730,-26.844070434570312,-28.02468490600586,1
Waiters impressed themselves.,Waiters impressed itself.,morphology,anaphor_agreement,anaphor_number_agreement,True,True,False,True,731,-31.4241943359375,-35.07698059082031,1
The Lutherans found themselves.,The Lutherans found itself.,morphology,anaphor_agreement,anaphor_number_agreement,True,True,False,True,732,-44.426544189453125,-44.64619827270508,1
Kristen shouldn't heal herself.,Kristen shouldn't heal themselves.,morphology,anaphor_agreement,anaphor_number_agreement,True,True,False,True,733,-35.293556213378906,-34.77565002441406,0
The Borgias hadn't listened to themselves.,The Borgias hadn't listened to itself.,morphology,anaphor_agreement,anaphor_number_agreement,True,True,False,True,734,-50.261924743652344,-53.45370864868164,1
Dana astounded herself.,Dana astounded themselves.,morphology,anaphor_agreement,anaphor_number_agreement,True,True,False,True,735,-40.50660705566406,-38.93558120727539,0
All people loved themselves.,All people loved itself.,morphology,anaphor_agreement,anaphor_number_agreement,True,True,False,True,736,-20.40943717956543,-24.094074249267578,1
Some guests have fired themselves.,Some guests have fired herself.,morphology,anaphor_agreement,anaphor_number_agreement,True,True,False,True,737,-28.417171478271484,-31.980546951293945,1
Elizabeth hadn't worried herself.,Elizabeth hadn't worried themselves.,morphology,anaphor_agreement,anaphor_number_agreement,True,True,False,True,738,-34.130104064941406,-32.85491180419922,0
Most pedestrians have kissed themselves.,Most pedestrians have kissed herself.,morphology,anaphor_agreement,anaphor_number_agreement,True,True,False,True,739,-34.723426818847656,-38.50196075439453,1
These banks aggravate themselves.,These banks aggravate itself.,morphology,anaphor_agreement,anaphor_number_agreement,True,True,False,True,740,-33.448883056640625,-35.439517974853516,1
The Clintons impressed themselves.,The Clintons impressed itself.,morphology,anaphor_agreement,anaphor_number_agreement,True,True,False,True,741,-36.99055099487305,-38.174461364746094,1
Claire wasn't talking to herself.,Claire wasn't talking to themselves.,morphology,anaphor_agreement,anaphor_number_agreement,True,True,False,True,742,-31.217771530151367,-30.2613525390625,0
Many cashiers hadn't worked with themselves.,Many cashiers hadn't worked with herself.,morphology,anaphor_agreement,anaphor_number_agreement,True,True,False,True,743,-46.776702880859375,-49.694976806640625,1
Alicia concealed herself.,Alicia concealed themselves.,morphology,anaphor_agreement,anaphor_number_agreement,True,True,False,True,744,-51.808189392089844,-48.97822952270508,0
Bradley isn't talking about himself.,Bradley isn't talking about themselves.,morphology,anaphor_agreement,anaphor_number_agreement,True,True,False,True,745,-27.047237396240234,-27.221128463745117,1
Steven has hurt himself.,Steven has hurt themselves.,morphology,anaphor_agreement,anaphor_number_agreement,True,True,False,True,746,-20.827638626098633,-21.38667106628418,1
Many men are impressing themselves.,Many men are impressing himself.,morphology,anaphor_agreement,anaphor_number_agreement,True,True,False,True,747,-32.151668548583984,-35.038169860839844,1
Many boys were healing themselves.,Many boys were healing himself.,morphology,anaphor_agreement,anaphor_number_agreement,True,True,False,True,748,-29.47742462158203,-32.07907485961914,1
Jessica is scaring herself.,Jessica is scaring themselves.,morphology,anaphor_agreement,anaphor_number_agreement,True,True,False,True,749,-25.999122619628906,-25.94536781311035,0
Carol does worry herself.,Carol does worry themselves.,morphology,anaphor_agreement,anaphor_number_agreement,True,True,False,True,750,-40.34895706176758,-38.20069122314453,0
Dennis would watch himself.,Dennis would watch themselves.,morphology,anaphor_agreement,anaphor_number_agreement,True,True,False,True,751,-34.49672317504883,-33.76155090332031,0
Samuel had concealed himself.,Samuel had concealed themselves.,morphology,anaphor_agreement,anaphor_number_agreement,True,True,False,True,752,-34.23309326171875,-34.579856872558594,1
Most senators healed themselves.,Most senators healed itself.,morphology,anaphor_agreement,anaphor_number_agreement,True,True,False,True,753,-38.20689010620117,-39.212562561035156,1
A lot of girls could observe themselves.,A lot of girls could observe herself.,morphology,anaphor_agreement,anaphor_number_agreement,True,True,False,True,754,-45.59381103515625,-49.05248260498047,1
Gerald hasn't astounded himself.,Gerald hasn't astounded themselves.,morphology,anaphor_agreement,anaphor_number_agreement,True,True,False,True,755,-57.36066436767578,-56.739158630371094,0
Elizabeth shouldn't remember herself.,Elizabeth shouldn't remember themselves.,morphology,anaphor_agreement,anaphor_number_agreement,True,True,False,True,756,-28.19232177734375,-26.51229476928711,0
Steve insulted himself.,Steve insulted themselves.,morphology,anaphor_agreement,anaphor_number_agreement,True,True,False,True,757,-18.888216018676758,-18.54897689819336,0
Laurie was hiding herself.,Laurie was hiding themselves.,morphology,anaphor_agreement,anaphor_number_agreement,True,True,False,True,758,-37.228973388671875,-37.84327697753906,1
The Lutherans distracted themselves.,The Lutherans distracted herself.,morphology,anaphor_agreement,anaphor_number_agreement,True,True,False,True,759,-48.690364837646484,-50.73183059692383,1
Regina was upsetting herself.,Regina was upsetting themselves.,morphology,anaphor_agreement,anaphor_number_agreement,True,True,False,True,760,-34.09355926513672,-32.740150451660156,0
Jacqueline disgusted herself.,Jacqueline disgusted themselves.,morphology,anaphor_agreement,anaphor_number_agreement,True,True,False,True,761,-36.94658660888672,-35.96120071411133,0
Carolyn was concealing herself.,Carolyn was concealing themselves.,morphology,anaphor_agreement,anaphor_number_agreement,True,True,False,True,762,-42.67196273803711,-41.64885711669922,0
Senators haven't embarrassed themselves.,Senators haven't embarrassed itself.,morphology,anaphor_agreement,anaphor_number_agreement,True,True,False,True,763,-35.40538787841797,-38.029537200927734,1
Richard disgusted himself.,Richard disgusted themselves.,morphology,anaphor_agreement,anaphor_number_agreement,True,True,False,True,764,-20.852792739868164,-21.195201873779297,1
Kenneth had embarrassed himself.,Kenneth had embarrassed themselves.,morphology,anaphor_agreement,anaphor_number_agreement,True,True,False,True,765,-39.41082000732422,-38.939964294433594,0
Most girls conceal themselves.,Most girls conceal herself.,morphology,anaphor_agreement,anaphor_number_agreement,True,True,False,True,766,-28.726781845092773,-33.52482604980469,1
Paula watched herself.,Paula watched themselves.,morphology,anaphor_agreement,anaphor_number_agreement,True,True,False,True,767,-27.304750442504883,-26.400218963623047,0
The Impressionists escape from themselves.,The Impressionists escape from itself.,morphology,anaphor_agreement,anaphor_number_agreement,True,True,False,True,768,-56.37532424926758,-56.802337646484375,1
The actresses notice themselves.,The actresses notice himself.,morphology,anaphor_agreement,anaphor_number_agreement,True,True,False,True,769,-32.76885223388672,-34.580970764160156,1
Sharon wasn't disgusting herself.,Sharon wasn't disgusting themselves.,morphology,anaphor_agreement,anaphor_number_agreement,True,True,False,True,770,-40.87625503540039,-40.829689025878906,0
This company aggravates itself.,This company aggravates themselves.,morphology,anaphor_agreement,anaphor_number_agreement,True,True,False,True,771,-34.30009460449219,-33.94013214111328,0
The fish found themselves.,The fish found himself.,morphology,anaphor_agreement,anaphor_number_agreement,True,True,False,True,772,-25.078384399414062,-27.257986068725586,1
Teenagers hadn't complained about themselves.,Teenagers hadn't complained about itself.,morphology,anaphor_agreement,anaphor_number_agreement,True,True,False,True,773,-47.11774826049805,-49.171897888183594,1
Bill is discovering himself.,Bill is discovering themselves.,morphology,anaphor_agreement,anaphor_number_agreement,True,True,False,True,774,-26.360952377319336,-25.98525619506836,0
Most guys criticize themselves.,Most guys criticize itself.,morphology,anaphor_agreement,anaphor_number_agreement,True,True,False,True,775,-27.988359451293945,-30.8133544921875,1
A lot of cashiers aren't working with themselves.,A lot of cashiers aren't working with himself.,morphology,anaphor_agreement,anaphor_number_agreement,True,True,False,True,776,-60.374961853027344,-62.56745147705078,1
Charles couldn't hate himself.,Charles couldn't hate themselves.,morphology,anaphor_agreement,anaphor_number_agreement,True,True,False,True,777,-26.484588623046875,-26.779762268066406,1
Joseph hasn't disturbed himself.,Joseph hasn't disturbed themselves.,morphology,anaphor_agreement,anaphor_number_agreement,True,True,False,True,778,-29.110448837280273,-29.487667083740234,1
Senators might talk about themselves.,Senators might talk about itself.,morphology,anaphor_agreement,anaphor_number_agreement,True,True,False,True,779,-30.88498306274414,-32.707855224609375,1
Laura hasn't hugged herself.,Laura hasn't hugged themselves.,morphology,anaphor_agreement,anaphor_number_agreement,True,True,False,True,780,-31.783891677856445,-31.341922760009766,0
The teenagers think about themselves.,The teenagers think about herself.,morphology,anaphor_agreement,anaphor_number_agreement,True,True,False,True,781,-30.849639892578125,-34.34779357910156,1
Carlos hasn't referenced himself.,Carlos hasn't referenced themselves.,morphology,anaphor_agreement,anaphor_number_agreement,True,True,False,True,782,-38.188201904296875,-37.88795471191406,0
Steven had returned to himself.,Steven had returned to themselves.,morphology,anaphor_agreement,anaphor_number_agreement,True,True,False,True,783,-24.489206314086914,-24.220762252807617,0
A lot of waiters were listening to themselves.,A lot of waiters were listening to herself.,morphology,anaphor_agreement,anaphor_number_agreement,True,True,False,True,784,-60.97818374633789,-64.47340393066406,1
Steve is helping himself.,Steve is helping themselves.,morphology,anaphor_agreement,anaphor_number_agreement,True,True,False,True,785,-19.78315544128418,-19.876712799072266,1
Colleen will aggravate herself.,Colleen will aggravate themselves.,morphology,anaphor_agreement,anaphor_number_agreement,True,True,False,True,786,-44.382057189941406,-42.46259307861328,0
Noah shouldn't argue about himself.,Noah shouldn't argue about themselves.,morphology,anaphor_agreement,anaphor_number_agreement,True,True,False,True,787,-45.51380920410156,-44.34648895263672,0
Travis won't approach himself.,Travis won't approach themselves.,morphology,anaphor_agreement,anaphor_number_agreement,True,True,False,True,788,-47.66145324707031,-47.03273010253906,0
Candice hadn't thought about herself.,Candice hadn't thought about themselves.,morphology,anaphor_agreement,anaphor_number_agreement,True,True,False,True,789,-36.05190658569336,-33.874393463134766,0
Every waitress boasted about herself.,Every waitress boasted about themselves.,morphology,anaphor_agreement,anaphor_number_agreement,True,True,False,True,790,-47.050514221191406,-44.95937728881836,0
Guests concealed themselves.,Guests concealed herself.,morphology,anaphor_agreement,anaphor_number_agreement,True,True,False,True,791,-34.87559509277344,-38.18505096435547,1
Melissa had bored herself.,Melissa had bored themselves.,morphology,anaphor_agreement,anaphor_number_agreement,True,True,False,True,792,-35.09812927246094,-34.77198028564453,0
Meredith hasn't revealed herself.,Meredith hasn't revealed themselves.,morphology,anaphor_agreement,anaphor_number_agreement,True,True,False,True,793,-46.46816635131836,-45.01479721069336,0
The actors were observing themselves.,The actors were observing herself.,morphology,anaphor_agreement,anaphor_number_agreement,True,True,False,True,794,-32.814247131347656,-35.88988494873047,1
Many teenagers haven't forgotten themselves.,Many teenagers haven't forgotten herself.,morphology,anaphor_agreement,anaphor_number_agreement,True,True,False,True,795,-32.83182907104492,-37.10697937011719,1
Those museums are stunning themselves.,Those museums are stunning himself.,morphology,anaphor_agreement,anaphor_number_agreement,True,True,False,True,796,-33.13758087158203,-36.555206298828125,1
Most girls didn't aggravate themselves.,Most girls didn't aggravate himself.,morphology,anaphor_agreement,anaphor_number_agreement,True,True,False,True,797,-38.28843307495117,-41.088802337646484,1
Kevin wasn't disturbing himself.,Kevin wasn't disturbing themselves.,morphology,anaphor_agreement,anaphor_number_agreement,True,True,False,True,798,-25.792112350463867,-26.77477264404297,1
Most patients have investigated themselves.,Most patients have investigated itself.,morphology,anaphor_agreement,anaphor_number_agreement,True,True,False,True,799,-30.562122344970703,-32.676918029785156,1
Gina didn't see herself.,Gina didn't see themselves.,morphology,anaphor_agreement,anaphor_number_agreement,True,True,False,True,800,-35.94868469238281,-33.778656005859375,0
The man praised himself.,The man praised themselves.,morphology,anaphor_agreement,anaphor_number_agreement,True,True,False,True,801,-29.207290649414062,-28.791458129882812,0
Rachelle hasn't healed herself.,Rachelle hasn't healed themselves.,morphology,anaphor_agreement,anaphor_number_agreement,True,True,False,True,802,-38.378173828125,-38.29207992553711,0
Carolyn approached herself.,Carolyn approached themselves.,morphology,anaphor_agreement,anaphor_number_agreement,True,True,False,True,803,-28.561281204223633,-26.570619583129883,0
Gary was scaring himself.,Gary was scaring themselves.,morphology,anaphor_agreement,anaphor_number_agreement,True,True,False,True,804,-24.052593231201172,-25.212413787841797,1
The Borgias were admiring themselves.,The Borgias were admiring herself.,morphology,anaphor_agreement,anaphor_number_agreement,True,True,False,True,805,-56.48786544799805,-59.11412048339844,1
People can't approach themselves.,People can't approach himself.,morphology,anaphor_agreement,anaphor_number_agreement,True,True,False,True,806,-23.027462005615234,-25.163606643676758,1
Those people should remember themselves.,Those people should remember herself.,morphology,anaphor_agreement,anaphor_number_agreement,True,True,False,True,807,-21.382095336914062,-26.112953186035156,1
Most women weren't helping themselves.,Most women weren't helping itself.,morphology,anaphor_agreement,anaphor_number_agreement,True,True,False,True,808,-27.852561950683594,-32.322235107421875,1
Most actors hug themselves.,Most actors hug herself.,morphology,anaphor_agreement,anaphor_number_agreement,True,True,False,True,809,-30.588024139404297,-34.893157958984375,1
The Clintons couldn't conceal themselves.,The Clintons couldn't conceal himself.,morphology,anaphor_agreement,anaphor_number_agreement,True,True,False,True,810,-47.34052658081055,-48.58088684082031,1
All banks had upset themselves.,All banks had upset himself.,morphology,anaphor_agreement,anaphor_number_agreement,True,True,False,True,811,-37.16603088378906,-39.74555587768555,1
Kimberley had cured herself.,Kimberley had cured themselves.,morphology,anaphor_agreement,anaphor_number_agreement,True,True,False,True,812,-41.49993896484375,-40.63734817504883,0
David is questioning himself.,David is questioning themselves.,morphology,anaphor_agreement,anaphor_number_agreement,True,True,False,True,813,-23.733362197875977,-24.73040008544922,1
Most waitresses wouldn't sound like themselves.,Most waitresses wouldn't sound like himself.,morphology,anaphor_agreement,anaphor_number_agreement,True,True,False,True,814,-55.37224197387695,-56.44702911376953,1
Renee bothered herself.,Renee bothered themselves.,morphology,anaphor_agreement,anaphor_number_agreement,True,True,False,True,815,-32.01580047607422,-29.706575393676758,0
Homer fired himself.,Homer fired themselves.,morphology,anaphor_agreement,anaphor_number_agreement,True,True,False,True,816,-31.323238372802734,-30.73566436767578,0
The Impressionists haven't found themselves.,The Impressionists haven't found himself.,morphology,anaphor_agreement,anaphor_number_agreement,True,True,False,True,817,-52.057491302490234,-54.58955383300781,1
Andrea didn't dislike herself.,Andrea didn't dislike themselves.,morphology,anaphor_agreement,anaphor_number_agreement,True,True,False,True,818,-38.90348815917969,-36.985469818115234,0
Girls kiss themselves.,Girls kiss himself.,morphology,anaphor_agreement,anaphor_number_agreement,True,True,False,True,819,-17.703569412231445,-20.95305633544922,1
These organizations stunned themselves.,These organizations stunned himself.,morphology,anaphor_agreement,anaphor_number_agreement,True,True,False,True,820,-29.432029724121094,-33.95625305175781,1
Rebecca hired herself.,Rebecca hired themselves.,morphology,anaphor_agreement,anaphor_number_agreement,True,True,False,True,821,-24.73700714111328,-23.65570640563965,0
Patrick approached himself.,Patrick approached themselves.,morphology,anaphor_agreement,anaphor_number_agreement,True,True,False,True,822,-17.952848434448242,-19.0419979095459,1
Mark hasn't referenced himself.,Mark hasn't referenced themselves.,morphology,anaphor_agreement,anaphor_number_agreement,True,True,False,True,823,-32.40703582763672,-32.51213073730469,1
Many adults have hired themselves.,Many adults have hired herself.,morphology,anaphor_agreement,anaphor_number_agreement,True,True,False,True,824,-26.113418579101562,-30.60434341430664,1
A lot of people escaped from themselves.,A lot of people escaped from itself.,morphology,anaphor_agreement,anaphor_number_agreement,True,True,False,True,825,-42.516578674316406,-43.996944427490234,1
Some students shouldn't remember themselves.,Some students shouldn't remember herself.,morphology,anaphor_agreement,anaphor_number_agreement,True,True,False,True,826,-31.02688217163086,-35.12482833862305,1
Those students listen to themselves.,Those students listen to herself.,morphology,anaphor_agreement,anaphor_number_agreement,True,True,False,True,827,-20.78504180908203,-25.76978302001953,1
Stephanie will hurt herself.,Stephanie will hurt themselves.,morphology,anaphor_agreement,anaphor_number_agreement,True,True,False,True,828,-32.55207824707031,-32.33707809448242,0
