sentence_good,sentence_bad,field,linguistics_term,UID,simple_LM_method,one_prefix_method,two_prefix_method,lexically_identical,pair_id,good_prob,bad_prob,correct
Susan revealed herself.,Susan revealed themselves.,morphology,anaphor_agreement,anaphor_number_agreement,True,True,False,True,0,-23.043256759643555,-22.200592041015625,0
Renee hasn't hurt herself.,Renee hasn't hurt themselves.,morphology,anaphor_agreement,anaphor_number_agreement,True,True,False,True,1,-34.73246765136719,-34.146766662597656,0
These patients do respect themselves.,These patients do respect himself.,morphology,anaphor_agreement,anaphor_number_agreement,True,True,False,True,2,-29.44747543334961,-33.94192123413086,1
Mary should criticize herself.,Mary should criticize themselves.,morphology,anaphor_agreement,anaphor_number_agreement,True,True,False,True,3,-28.905296325683594,-27.15475845336914,0
Kristin irritated herself.,Kristin irritated themselves.,morphology,anaphor_agreement,anaphor_number_agreement,True,True,False,True,4,-30.78260040283203,-29.59120750427246,0
Tracy described herself.,Tracy described themselves.,morphology,anaphor_agreement,anaphor_number_agreement,True,True,False,True,5,-26.277868270874023,-23.949180603027344,0
A lot of girls had bothered themselves.,A lot of girls had bothered himself.,morphology,anaphor_agreement,anaphor_number_agreement,True,True,False,True,6,-46.605934143066406,-49.140907287597656,1
Many teenagers were helping themselves.,Many teenagers were helping herself.,morphology,anaphor_agreement,anaphor_number_agreement,True,True,False,True,7,-26.821304321289062,-31.557889938354492,1
Girls talked to themselves.,Girls talked to itself.,morphology,anaphor_agreement,anaphor_number_agreement,True,True,False,True,8,-17.619647979736328,-20.8831787109375,1
All senators listened to themselves.,All senators listened to itself.,morphology,anaphor_agreement,anaphor_number_agreement,True,True,False,True,9,-37.42652130126953,-38.8826904296875,1
Laura hired herself.,Laura hired themselves.,morphology,anaphor_agreement,anaphor_number_agreement,True,True,False,True,10,-18.50727081298828,-18.119306564331055,0
Claire won't conceal herself.,Claire won't conceal themselves.,morphology,anaphor_agreement,anaphor_number_agreement,True,True,False,True,11,-35.88762664794922,-34.91546630859375,0
Becca shouldn't impress herself.,Becca shouldn't impress themselves.,morphology,anaphor_agreement,anaphor_number_agreement,True,True,False,True,12,-40.76982116699219,-38.48809814453125,0
This woman has criticized herself.,This woman has criticized themselves.,morphology,anaphor_agreement,anaphor_number_agreement,True,True,False,True,13,-30.327863693237305,-29.45516014099121,0
Sonia would cure herself.,Sonia would cure themselves.,morphology,anaphor_agreement,anaphor_number_agreement,True,True,False,True,14,-41.39745330810547,-39.534202575683594,0
Most girls hate themselves.,Most girls hate himself.,morphology,anaphor_agreement,anaphor_number_agreement,True,True,False,True,15,-25.814476013183594,-28.65446662902832,1
This legislature worried itself.,This legislature worried themselves.,morphology,anaphor_agreement,anaphor_number_agreement,True,True,False,True,16,-38.63567352294922,-39.36454772949219,1
Florence had left herself.,Florence had left themselves.,morphology,anaphor_agreement,anaphor_number_agreement,True,True,False,True,17,-35.088844299316406,-35.006507873535156,0
The Borgias scare themselves.,The Borgias scare himself.,morphology,anaphor_agreement,anaphor_number_agreement,True,True,False,True,18,-45.30699920654297,-46.588829040527344,1
The adults hadn't forgotten themselves.,The adults hadn't forgotten himself.,morphology,anaphor_agreement,anaphor_number_agreement,True,True,False,True,19,-34.177127838134766,-36.89591979980469,1
The patients disgusted themselves.,The patients disgusted himself.,morphology,anaphor_agreement,anaphor_number_agreement,True,True,False,True,20,-32.509803771972656,-36.099124908447266,1
Thomas complained about himself.,Thomas complained about themselves.,morphology,anaphor_agreement,anaphor_number_agreement,True,True,False,True,21,-21.860618591308594,-22.139617919921875,1
Randolf knew himself.,Randolf knew themselves.,morphology,anaphor_agreement,anaphor_number_agreement,True,True,False,True,22,-29.36918067932129,-29.23137855529785,0
The students shouldn't upset themselves.,The students shouldn't upset herself.,morphology,anaphor_agreement,anaphor_number_agreement,True,True,False,True,23,-36.977447509765625,-41.04624938964844,1
All waiters couldn't criticize themselves.,All waiters couldn't criticize himself.,morphology,anaphor_agreement,anaphor_number_agreement,True,True,False,True,24,-49.79970932006836,-51.83760452270508,1
Ronald can't reference himself.,Ronald can't reference themselves.,morphology,anaphor_agreement,anaphor_number_agreement,True,True,False,True,25,-39.546356201171875,-39.092777252197266,0
Julie hadn't revealed herself.,Julie hadn't revealed themselves.,morphology,anaphor_agreement,anaphor_number_agreement,True,True,False,True,26,-32.398475646972656,-32.13666915893555,0
Many people bothered themselves.,Many people bothered itself.,morphology,anaphor_agreement,anaphor_number_agreement,True,True,False,True,27,-21.276561737060547,-25.21588134765625,1
Most girls annoyed themselves.,Most girls annoyed himself.,morphology,anaphor_agreement,anaphor_number_agreement,True,True,False,True,28,-29.007413864135742,-32.64984893798828,1
Most ladies weren't arguing about themselves.,Most ladies weren't arguing about herself.,morphology,anaphor_agreement,anaphor_number_agreement,True,True,False,True,29,-40.356685638427734,-43.81610870361328,1
The waitresses investigated themselves.,The waitresses investigated itself.,morphology,anaphor_agreement,anaphor_number_agreement,True,True,False,True,30,-45.62873840332031,-45.05695724487305,0
Peter won't fire himself.,Peter won't fire themselves.,morphology,anaphor_agreement,anaphor_number_agreement,True,True,False,True,31,-22.930871963500977,-23.18520736694336,1
Those waitresses had loved themselves.,Those waitresses had loved herself.,morphology,anaphor_agreement,anaphor_number_agreement,True,True,False,True,32,-46.16053009033203,-49.5477294921875,1
Cheryl isn't insulting herself.,Cheryl isn't insulting themselves.,morphology,anaphor_agreement,anaphor_number_agreement,True,True,False,True,33,-56.90111541748047,-56.65802001953125,0
Joseph isn't revealing himself.,Joseph isn't revealing themselves.,morphology,anaphor_agreement,anaphor_number_agreement,True,True,False,True,34,-30.230201721191406,-30.415706634521484,1
Most universities aren't scaring themselves.,Most universities aren't scaring herself.,morphology,anaphor_agreement,anaphor_number_agreement,True,True,False,True,35,-35.13970947265625,-39.19392395019531,1
Natalie hadn't fired herself.,Natalie hadn't fired themselves.,morphology,anaphor_agreement,anaphor_number_agreement,True,True,False,True,36,-42.73469543457031,-42.40827178955078,0
Donald had worked with himself.,Donald had worked with themselves.,morphology,anaphor_agreement,anaphor_number_agreement,True,True,False,True,37,-22.468185424804688,-23.393016815185547,1
Kirsten hasn't admired herself.,Kirsten hasn't admired themselves.,morphology,anaphor_agreement,anaphor_number_agreement,True,True,False,True,38,-51.73987579345703,-50.283077239990234,0
Patricia hadn't hated herself.,Patricia hadn't hated themselves.,morphology,anaphor_agreement,anaphor_number_agreement,True,True,False,True,39,-38.836280822753906,-37.44112014770508,0
Most reports disagreed with themselves.,Most reports disagreed with herself.,morphology,anaphor_agreement,anaphor_number_agreement,True,True,False,True,40,-35.412288665771484,-39.13107681274414,1
Dawn could worry herself.,Dawn could worry themselves.,morphology,anaphor_agreement,anaphor_number_agreement,True,True,False,True,41,-44.29258728027344,-42.03736877441406,0
Randolf might approach himself.,Randolf might approach themselves.,morphology,anaphor_agreement,anaphor_number_agreement,True,True,False,True,42,-37.813838958740234,-37.78983688354492,0
Stacy didn't remember herself.,Stacy didn't remember themselves.,morphology,anaphor_agreement,anaphor_number_agreement,True,True,False,True,43,-32.5244140625,-30.688684463500977,0
Richard returned to himself.,Richard returned to themselves.,morphology,anaphor_agreement,anaphor_number_agreement,True,True,False,True,44,-17.806236267089844,-18.933645248413086,1
All boys listen to themselves.,All boys listen to herself.,morphology,anaphor_agreement,anaphor_number_agreement,True,True,False,True,45,-23.8962345123291,-27.84304428100586,1
Bruce hadn't discovered himself.,Bruce hadn't discovered themselves.,morphology,anaphor_agreement,anaphor_number_agreement,True,True,False,True,46,-27.590015411376953,-27.183902740478516,0
Many teenagers hadn't found themselves.,Many teenagers hadn't found itself.,morphology,anaphor_agreement,anaphor_number_agreement,True,True,False,True,47,-32.785850524902344,-35.682960510253906,1
Daniel does hate himself.,Daniel does hate themselves.,morphology,anaphor_agreement,anaphor_number_agreement,True,True,False,True,48,-26.419681549072266,-26.712646484375,1
Most adults have discovered themselves.,Most adults have discovered itself.,morphology,anaphor_agreement,anaphor_number_agreement,True,True,False,True,49,-27.89948272705078,-29.66187286376953,1
Some men could notice themselves.,Some men could notice himself.,morphology,anaphor_agreement,anaphor_number_agreement,True,True,False,True,50,-27.98147964477539,-30.474727630615234,1
These museums should insult themselves.,These museums should insult itself.,morphology,anaphor_agreement,anaphor_number_agreement,True,True,False,True,51,-37.37682342529297,-39.59961700439453,1
All actresses flee from themselves.,All actresses flee from herself.,morphology,anaphor_agreement,anaphor_number_agreement,True,True,False,True,52,-42.0745849609375,-44.09252166748047,1
Carol couldn't criticize herself.,Carol couldn't criticize themselves.,morphology,anaphor_agreement,anaphor_number_agreement,True,True,False,True,53,-37.81190490722656,-36.269134521484375,0
All girls haven't discussed themselves.,All girls haven't discussed himself.,morphology,anaphor_agreement,anaphor_number_agreement,True,True,False,True,54,-30.14483642578125,-32.25979232788086,1
All senators complained about themselves.,All senators complained about himself.,morphology,anaphor_agreement,anaphor_number_agreement,True,True,False,True,55,-40.646766662597656,-42.28622817993164,1
Some actors shock themselves.,Some actors shock herself.,morphology,anaphor_agreement,anaphor_number_agreement,True,True,False,True,56,-30.16322135925293,-34.549583435058594,1
Jane aggravated herself.,Jane aggravated themselves.,morphology,anaphor_agreement,anaphor_number_agreement,True,True,False,True,57,-26.463436126708984,-26.13446807861328,0
Becca praised herself.,Becca praised themselves.,morphology,anaphor_agreement,anaphor_number_agreement,True,True,False,True,58,-33.381019592285156,-30.71381950378418,0
Those students don't confuse themselves.,Those students don't confuse himself.,morphology,anaphor_agreement,anaphor_number_agreement,True,True,False,True,59,-28.98120880126953,-31.808639526367188,1
Jodi left herself.,Jodi left themselves.,morphology,anaphor_agreement,anaphor_number_agreement,True,True,False,True,60,-38.60511779785156,-36.57773208618164,0
The students have thought about themselves.,The students have thought about itself.,morphology,anaphor_agreement,anaphor_number_agreement,True,True,False,True,61,-28.97116470336914,-31.112701416015625,1
A lot of customers weren't returning to themselves.,A lot of customers weren't returning to herself.,morphology,anaphor_agreement,anaphor_number_agreement,True,True,False,True,62,-52.07082748413086,-55.455116271972656,1
Those customers praise themselves.,Those customers praise herself.,morphology,anaphor_agreement,anaphor_number_agreement,True,True,False,True,63,-27.376556396484375,-32.7952880859375,1
David stunned himself.,David stunned themselves.,morphology,anaphor_agreement,anaphor_number_agreement,True,True,False,True,64,-20.59204864501953,-20.80934715270996,1
Beverly disturbed herself.,Beverly disturbed themselves.,morphology,anaphor_agreement,anaphor_number_agreement,True,True,False,True,65,-45.628318786621094,-43.75468826293945,0
Thomas was hurting himself.,Thomas was hurting themselves.,morphology,anaphor_agreement,anaphor_number_agreement,True,True,False,True,66,-20.724979400634766,-22.405418395996094,1
Lori attacked herself.,Lori attacked themselves.,morphology,anaphor_agreement,anaphor_number_agreement,True,True,False,True,67,-33.066978454589844,-31.54192352294922,0
Joel escaped from himself.,Joel escaped from themselves.,morphology,anaphor_agreement,anaphor_number_agreement,True,True,False,True,68,-29.538278579711914,-30.121458053588867,1
The woman had worried herself.,The woman had worried themselves.,morphology,anaphor_agreement,anaphor_number_agreement,True,True,False,True,69,-37.989524841308594,-36.415855407714844,0
Kayla scared herself.,Kayla scared themselves.,morphology,anaphor_agreement,anaphor_number_agreement,True,True,False,True,70,-28.52972412109375,-27.442419052124023,0
Samuel didn't kiss himself.,Samuel didn't kiss themselves.,morphology,anaphor_agreement,anaphor_number_agreement,True,True,False,True,71,-27.676837921142578,-28.37713623046875,1
This government alarms itself.,This government alarms themselves.,morphology,anaphor_agreement,anaphor_number_agreement,True,True,False,True,72,-32.4534912109375,-32.8245735168457,1
Kristin left herself.,Kristin left themselves.,morphology,anaphor_agreement,anaphor_number_agreement,True,True,False,True,73,-26.837970733642578,-25.48949432373047,0
An association annoys itself.,An association annoys themselves.,morphology,anaphor_agreement,anaphor_number_agreement,True,True,False,True,74,-40.80518341064453,-40.062461853027344,0
Many actors thought about themselves.,Many actors thought about itself.,morphology,anaphor_agreement,anaphor_number_agreement,True,True,False,True,75,-30.098751068115234,-31.398548126220703,1
Teresa has scared herself.,Teresa has scared themselves.,morphology,anaphor_agreement,anaphor_number_agreement,True,True,False,True,76,-38.47831726074219,-35.833946228027344,0
Russell hadn't complained about himself.,Russell hadn't complained about themselves.,morphology,anaphor_agreement,anaphor_number_agreement,True,True,False,True,77,-31.68991470336914,-30.937713623046875,0
All cashiers liked themselves.,All cashiers liked itself.,morphology,anaphor_agreement,anaphor_number_agreement,True,True,False,True,78,-41.84807586669922,-42.799739837646484,1
Kendra doesn't shock herself.,Kendra doesn't shock themselves.,morphology,anaphor_agreement,anaphor_number_agreement,True,True,False,True,79,-51.252052307128906,-49.162567138671875,0
Jason hasn't stunned himself.,Jason hasn't stunned themselves.,morphology,anaphor_agreement,anaphor_number_agreement,True,True,False,True,80,-29.865856170654297,-30.449970245361328,1
Children did conceal themselves.,Children did conceal itself.,morphology,anaphor_agreement,anaphor_number_agreement,True,True,False,True,81,-25.204540252685547,-28.001873016357422,1
Cheryl did worry herself.,Cheryl did worry themselves.,morphology,anaphor_agreement,anaphor_number_agreement,True,True,False,True,82,-56.90290832519531,-54.494300842285156,0
Colleen can't impress herself.,Colleen can't impress themselves.,morphology,anaphor_agreement,anaphor_number_agreement,True,True,False,True,83,-36.036617279052734,-34.723365783691406,0
Kendra wasn't thinking about herself.,Kendra wasn't thinking about themselves.,morphology,anaphor_agreement,anaphor_number_agreement,True,True,False,True,84,-50.667686462402344,-49.14237594604492,0
The guests respect themselves.,The guests respect herself.,morphology,anaphor_agreement,anaphor_number_agreement,True,True,False,True,85,-29.367935180664062,-33.95012664794922,1
Kenneth was confusing himself.,Kenneth was confusing themselves.,morphology,anaphor_agreement,anaphor_number_agreement,True,True,False,True,86,-36.43799591064453,-37.503501892089844,1
Some children flee from themselves.,Some children flee from itself.,morphology,anaphor_agreement,anaphor_number_agreement,True,True,False,True,87,-34.999977111816406,-36.78078079223633,1
This organization hadn't aggravated itself.,This organization hadn't aggravated themselves.,morphology,anaphor_agreement,anaphor_number_agreement,True,True,False,True,88,-47.70594024658203,-45.15739440917969,0
Michael can't disturb himself.,Michael can't disturb themselves.,morphology,anaphor_agreement,anaphor_number_agreement,True,True,False,True,89,-25.95111846923828,-26.07143211364746,1
Many universities disgust themselves.,Many universities disgust herself.,morphology,anaphor_agreement,anaphor_number_agreement,True,True,False,True,90,-32.4345588684082,-37.41379165649414,1
Some museums annoy themselves.,Some museums annoy herself.,morphology,anaphor_agreement,anaphor_number_agreement,True,True,False,True,91,-30.792434692382812,-35.739219665527344,1
All waiters cured themselves.,All waiters cured himself.,morphology,anaphor_agreement,anaphor_number_agreement,True,True,False,True,92,-45.0161247253418,-47.78082275390625,1
The teenagers shouldn't bore themselves.,The teenagers shouldn't bore himself.,morphology,anaphor_agreement,anaphor_number_agreement,True,True,False,True,93,-40.03578186035156,-42.826446533203125,1
All cashiers hurt themselves.,All cashiers hurt himself.,morphology,anaphor_agreement,anaphor_number_agreement,True,True,False,True,94,-39.32066345214844,-41.545509338378906,1
The Clintons admired themselves.,The Clintons admired himself.,morphology,anaphor_agreement,anaphor_number_agreement,True,True,False,True,95,-39.832584381103516,-41.85565185546875,1
Cynthia wasn't escaping from herself.,Cynthia wasn't escaping from themselves.,morphology,anaphor_agreement,anaphor_number_agreement,True,True,False,True,96,-64.51666259765625,-63.18991470336914,0
Many banks haven't aggravated themselves.,Many banks haven't aggravated herself.,morphology,anaphor_agreement,anaphor_number_agreement,True,True,False,True,97,-41.8602294921875,-45.536922454833984,1
All organizations have confused themselves.,All organizations have confused herself.,morphology,anaphor_agreement,anaphor_number_agreement,True,True,False,True,98,-31.476322174072266,-35.55013656616211,1
Steven talked about himself.,Steven talked about themselves.,morphology,anaphor_agreement,anaphor_number_agreement,True,True,False,True,99,-19.700336456298828,-19.566104888916016,0
Most men fled from themselves.,Most men fled from itself.,morphology,anaphor_agreement,anaphor_number_agreement,True,True,False,True,100,-32.16859436035156,-33.60701370239258,1
Patrick had cared for himself.,Patrick had cared for themselves.,morphology,anaphor_agreement,anaphor_number_agreement,True,True,False,True,101,-26.09917449951172,-26.45425796508789,1
James can kiss himself.,James can kiss themselves.,morphology,anaphor_agreement,anaphor_number_agreement,True,True,False,True,102,-25.08993148803711,-24.988113403320312,0
Most dancers shouldn't reveal themselves.,Most dancers shouldn't reveal herself.,morphology,anaphor_agreement,anaphor_number_agreement,True,True,False,True,103,-39.33275604248047,-42.6900634765625,1
All waitresses conceal themselves.,All waitresses conceal herself.,morphology,anaphor_agreement,anaphor_number_agreement,True,True,False,True,104,-46.541648864746094,-49.16240310668945,1
Some girls weren't complaining about themselves.,Some girls weren't complaining about itself.,morphology,anaphor_agreement,anaphor_number_agreement,True,True,False,True,105,-35.99711608886719,-38.73607635498047,1
Andrew hugged himself.,Andrew hugged themselves.,morphology,anaphor_agreement,anaphor_number_agreement,True,True,False,True,106,-20.723804473876953,-21.053422927856445,1
These guys are aggravating themselves.,These guys are aggravating himself.,morphology,anaphor_agreement,anaphor_number_agreement,True,True,False,True,107,-26.619213104248047,-30.147037506103516,1
Those teachers are praising themselves.,Those teachers are praising herself.,morphology,anaphor_agreement,anaphor_number_agreement,True,True,False,True,108,-29.747676849365234,-33.94989776611328,1
A lot of actresses visit themselves.,A lot of actresses visit herself.,morphology,anaphor_agreement,anaphor_number_agreement,True,True,False,True,109,-45.59733963012695,-48.98396301269531,1
Carlos attacked himself.,Carlos attacked themselves.,morphology,anaphor_agreement,anaphor_number_agreement,True,True,False,True,110,-25.267799377441406,-24.756040573120117,0
Marla might visit herself.,Marla might visit themselves.,morphology,anaphor_agreement,anaphor_number_agreement,True,True,False,True,111,-34.67742156982422,-32.57536315917969,0
The guests know themselves.,The guests know itself.,morphology,anaphor_agreement,anaphor_number_agreement,True,True,False,True,112,-27.66132926940918,-28.916208267211914,1
Most men hadn't embarrassed themselves.,Most men hadn't embarrassed itself.,morphology,anaphor_agreement,anaphor_number_agreement,True,True,False,True,113,-36.31867599487305,-39.108428955078125,1
Jane hasn't escaped from herself.,Jane hasn't escaped from themselves.,morphology,anaphor_agreement,anaphor_number_agreement,True,True,False,True,114,-31.027053833007812,-31.307086944580078,1
All boys are shocking themselves.,All boys are shocking herself.,morphology,anaphor_agreement,anaphor_number_agreement,True,True,False,True,115,-32.74724578857422,-36.04685974121094,1
Craig hasn't insulted himself.,Craig hasn't insulted themselves.,morphology,anaphor_agreement,anaphor_number_agreement,True,True,False,True,116,-31.186786651611328,-30.3291072845459,0
A lot of ladies impressed themselves.,A lot of ladies impressed itself.,morphology,anaphor_agreement,anaphor_number_agreement,True,True,False,True,117,-44.944889068603516,-49.13195037841797,1
Some school distracts itself.,Some school distracts themselves.,morphology,anaphor_agreement,anaphor_number_agreement,True,True,False,True,118,-43.27301025390625,-41.653656005859375,0
All girls scared themselves.,All girls scared himself.,morphology,anaphor_agreement,anaphor_number_agreement,True,True,False,True,119,-26.146718978881836,-29.080562591552734,1
Homer had worried himself.,Homer had worried themselves.,morphology,anaphor_agreement,anaphor_number_agreement,True,True,False,True,120,-43.78459167480469,-43.36737060546875,0
All men had concealed themselves.,All men had concealed herself.,morphology,anaphor_agreement,anaphor_number_agreement,True,True,False,True,121,-34.80915069580078,-37.86266326904297,1
These pedestrians upset themselves.,These pedestrians upset itself.,morphology,anaphor_agreement,anaphor_number_agreement,True,True,False,True,122,-32.635711669921875,-34.525882720947266,1
These companies wouldn't aggravate themselves.,These companies wouldn't aggravate itself.,morphology,anaphor_agreement,anaphor_number_agreement,True,True,False,True,123,-34.992130279541016,-37.631568908691406,1
Many people hired themselves.,Many people hired herself.,morphology,anaphor_agreement,anaphor_number_agreement,True,True,False,True,124,-19.465503692626953,-24.162391662597656,1
The man won't hate himself.,The man won't hate themselves.,morphology,anaphor_agreement,anaphor_number_agreement,True,True,False,True,125,-35.35348129272461,-34.92436218261719,0
Guy is questioning himself.,Guy is questioning themselves.,morphology,anaphor_agreement,anaphor_number_agreement,True,True,False,True,126,-22.023151397705078,-22.84410285949707,1
These doctors help themselves.,These doctors help herself.,morphology,anaphor_agreement,anaphor_number_agreement,True,True,False,True,127,-22.142784118652344,-28.009496688842773,1
The teachers are talking to themselves.,The teachers are talking to itself.,morphology,anaphor_agreement,anaphor_number_agreement,True,True,False,True,128,-24.57438087463379,-28.445323944091797,1
Alicia admired herself.,Alicia admired themselves.,morphology,anaphor_agreement,anaphor_number_agreement,True,True,False,True,129,-49.54798126220703,-46.77187728881836,0
Edward worked with himself.,Edward worked with themselves.,morphology,anaphor_agreement,anaphor_number_agreement,True,True,False,True,130,-18.05623435974121,-19.699398040771484,1
The men couldn't disagree with themselves.,The men couldn't disagree with herself.,morphology,anaphor_agreement,anaphor_number_agreement,True,True,False,True,131,-37.06459045410156,-39.836700439453125,1
The dancers flee from themselves.,The dancers flee from himself.,morphology,anaphor_agreement,anaphor_number_agreement,True,True,False,True,132,-42.40953063964844,-43.941490173339844,1
Valerie hasn't thought about herself.,Valerie hasn't thought about themselves.,morphology,anaphor_agreement,anaphor_number_agreement,True,True,False,True,133,-39.817195892333984,-38.090919494628906,0
The universities are astounding themselves.,The universities are astounding himself.,morphology,anaphor_agreement,anaphor_number_agreement,True,True,False,True,134,-34.71250534057617,-38.368404388427734,1
These cashiers had concealed themselves.,These cashiers had concealed himself.,morphology,anaphor_agreement,anaphor_number_agreement,True,True,False,True,135,-48.44953918457031,-51.53900146484375,1
Michelle was embarrassing herself.,Michelle was embarrassing themselves.,morphology,anaphor_agreement,anaphor_number_agreement,True,True,False,True,136,-26.31719970703125,-27.831382751464844,1
Omar is concealing himself.,Omar is concealing themselves.,morphology,anaphor_agreement,anaphor_number_agreement,True,True,False,True,137,-49.07884979248047,-48.614418029785156,0
Most teachers hurt themselves.,Most teachers hurt herself.,morphology,anaphor_agreement,anaphor_number_agreement,True,True,False,True,138,-25.109140396118164,-29.361589431762695,1
