sentence_good,sentence_bad,field,linguistics_term,UID,simple_LM_method,one_prefix_method,two_prefix_method,lexically_identical,pair_id,good_prob,bad_prob,correct
Raymond is selling this sketch.,Raymond is selling this sketches.,morphology,determiner_noun_agreement,determiner_noun_agreement_1,True,True,False,True,0,-39.05230712890625,-40.860145568847656,1
Craig explored that grocery store.,Craig explored that grocery stores.,morphology,determiner_noun_agreement,determiner_noun_agreement_1,True,True,False,True,1,-37.61853790283203,-37.284889221191406,0
Eva has scared these children.,Eva has scared these child.,morphology,determiner_noun_agreement,determiner_noun_agreement_1,True,True,False,True,2,-25.581199645996094,-29.46681785583496,1
Marcus would conceal that pamphlet.,Marcus would conceal that pamphlets.,morphology,determiner_noun_agreement,determiner_noun_agreement_1,True,True,False,True,3,-41.94935607910156,-48.48340606689453,1
Carmen hadn't shocked these customers.,Carmen hadn't shocked these customer.,morphology,determiner_noun_agreement,determiner_noun_agreement_1,True,True,False,True,4,-59.869117736816406,-62.11339569091797,1
The Impressionists were walking through this library.,The Impressionists were walking through this libraries.,morphology,determiner_noun_agreement,determiner_noun_agreement_1,True,True,False,True,5,-58.75659942626953,-63.19521713256836,1
Some men weren't touring those cafes.,Some men weren't touring those cafe.,morphology,determiner_noun_agreement,determiner_noun_agreement_1,True,True,False,True,6,-49.34904861450195,-46.956031799316406,0
Leslie isn't firing that actress.,Leslie isn't firing that actresses.,morphology,determiner_noun_agreement,determiner_noun_agreement_1,True,True,False,True,7,-44.996543884277344,-46.15294647216797,1
Jennifer concealed those cups.,Jennifer concealed those cup.,morphology,determiner_noun_agreement,determiner_noun_agreement_1,True,True,False,True,8,-36.758724212646484,-37.37082290649414,1
A waitress does take those hospitals.,A waitress does take those hospital.,morphology,determiner_noun_agreement,determiner_noun_agreement_1,True,True,False,True,9,-48.639442443847656,-51.89519500732422,1
The man walks through those hospitals.,The man walks through those hospital.,morphology,determiner_noun_agreement,determiner_noun_agreement_1,True,True,False,True,10,-37.530242919921875,-39.69804382324219,1
Winston Churchill boycotts these public parks.,Winston Churchill boycotts these public park.,morphology,determiner_noun_agreement,determiner_noun_agreement_1,True,True,False,True,11,-72.96793365478516,-74.41627502441406,1
This sock disturbs that customer.,This sock disturbs that customers.,morphology,determiner_noun_agreement,determiner_noun_agreement_1,True,True,False,True,12,-51.43003845214844,-52.071434020996094,1
William described this movie.,William described this movies.,morphology,determiner_noun_agreement,determiner_noun_agreement_1,True,True,False,True,13,-24.07080841064453,-27.0260009765625,1
Monet dropped by those libraries.,Monet dropped by those library.,morphology,determiner_noun_agreement,determiner_noun_agreement_1,True,True,False,True,14,-43.396507263183594,-40.299041748046875,0
Elaine was biking to this bank.,Elaine was biking to this banks.,morphology,determiner_noun_agreement,determiner_noun_agreement_1,True,True,False,True,15,-46.716758728027344,-50.634212493896484,1
These senators wear that jacket.,These senators wear that jackets.,morphology,determiner_noun_agreement,determiner_noun_agreement_1,True,True,False,True,16,-41.59429931640625,-43.84830093383789,1
The Lutherans notice that drawing.,The Lutherans notice that drawings.,morphology,determiner_noun_agreement,determiner_noun_agreement_1,True,True,False,True,17,-53.08699417114258,-54.99609375,1
Cheryl is hurting that teacher.,Cheryl is hurting that teachers.,morphology,determiner_noun_agreement,determiner_noun_agreement_1,True,True,False,True,18,-59.92889404296875,-61.427772521972656,1
Russell might break those cups.,Russell might break those cup.,morphology,determiner_noun_agreement,determiner_noun_agreement_1,True,True,False,True,19,-32.38697814941406,-32.397499084472656,1
A lot of patients resemble these pictures.,A lot of patients resemble these picture.,morphology,determiner_noun_agreement,determiner_noun_agreement_1,True,True,False,True,20,-53.86542510986328,-56.578338623046875,1
Vanessa can talk to these doctors.,Vanessa can talk to these doctor.,morphology,determiner_noun_agreement,determiner_noun_agreement_1,True,True,False,True,21,-37.33447265625,-40.093505859375,1
Janice had worn this shawl.,Janice had worn this shawls.,morphology,determiner_noun_agreement,determiner_noun_agreement_1,True,True,False,True,22,-57.065128326416016,-57.1854133605957,1
A lot of waitresses find those jackets.,A lot of waitresses find those jacket.,morphology,determiner_noun_agreement,determiner_noun_agreement_1,True,True,False,True,23,-72.03723907470703,-70.56403350830078,0
Every dancer hasn't admired this skirt.,Every dancer hasn't admired this skirts.,morphology,determiner_noun_agreement,determiner_noun_agreement_1,True,True,False,True,24,-48.60365295410156,-52.27119827270508,1
The adult doesn't hide those malls.,The adult doesn't hide those mall.,morphology,determiner_noun_agreement,determiner_noun_agreement_1,True,True,False,True,25,-44.75244140625,-40.473785400390625,0
Samuel criticizes that art gallery.,Samuel criticizes that art galleries.,morphology,determiner_noun_agreement,determiner_noun_agreement_1,True,True,False,True,26,-54.413780212402344,-52.93806076049805,0
A teacher annoyed those senators.,A teacher annoyed those senator.,morphology,determiner_noun_agreement,determiner_noun_agreement_1,True,True,False,True,27,-54.8316650390625,-52.82856369018555,0
A teacher talked to that customer.,A teacher talked to that customers.,morphology,determiner_noun_agreement,determiner_noun_agreement_1,True,True,False,True,28,-42.810447692871094,-43.29868698120117,1
Mark discovered this face.,Mark discovered this faces.,morphology,determiner_noun_agreement,determiner_noun_agreement_1,True,True,False,True,29,-27.535480499267578,-29.61460304260254,1
Carmen toured these restaurants.,Carmen toured these restaurant.,morphology,determiner_noun_agreement,determiner_noun_agreement_1,True,True,False,True,30,-49.28741455078125,-52.221656799316406,1
Eva toured this school.,Eva toured this schools.,morphology,determiner_noun_agreement,determiner_noun_agreement_1,True,True,False,True,31,-22.81688690185547,-26.613113403320312,1
Travis would tour that hospital.,Travis would tour that hospitals.,morphology,determiner_noun_agreement,determiner_noun_agreement_1,True,True,False,True,32,-58.26443099975586,-59.303592681884766,1
Some stories aggravated those libraries.,Some stories aggravated those library.,morphology,determiner_noun_agreement,determiner_noun_agreement_1,True,True,False,True,33,-49.395652770996094,-46.78228759765625,0
These cashiers hate that guest.,These cashiers hate that guests.,morphology,determiner_noun_agreement,determiner_noun_agreement_1,True,True,False,True,34,-49.832725524902344,-50.49993133544922,1
Heather messed up this dish.,Heather messed up this dishs.,morphology,determiner_noun_agreement,determiner_noun_agreement_1,True,True,False,True,35,-36.32759094238281,-43.87887191772461,1
Alan listened to these guests.,Alan listened to these guest.,morphology,determiner_noun_agreement,determiner_noun_agreement_1,True,True,False,True,36,-28.57695198059082,-32.5184440612793,1
Most children examine this pamphlet.,Most children examine this pamphlets.,morphology,determiner_noun_agreement,determiner_noun_agreement_1,True,True,False,True,37,-40.97817611694336,-49.85692596435547,1
Stacey will know these patients.,Stacey will know these patient.,morphology,determiner_noun_agreement,determiner_noun_agreement_1,True,True,False,True,38,-50.2173957824707,-51.77177429199219,1
Jessica sold this rabbit.,Jessica sold this rabbits.,morphology,determiner_noun_agreement,determiner_noun_agreement_1,True,True,False,True,39,-28.260271072387695,-28.910297393798828,1
Daniel couldn't hate those cashiers.,Daniel couldn't hate those cashier.,morphology,determiner_noun_agreement,determiner_noun_agreement_1,True,True,False,True,40,-47.33984375,-47.14484786987305,0
Those ladies kiss those adults.,Those ladies kiss those adult.,morphology,determiner_noun_agreement,determiner_noun_agreement_1,True,True,False,True,41,-35.499454498291016,-38.253456115722656,1
Diane works with these waiters.,Diane works with these waiter.,morphology,determiner_noun_agreement,determiner_noun_agreement_1,True,True,False,True,42,-54.55450439453125,-46.747352600097656,0
Most women conceal that blouse.,Most women conceal that blouses.,morphology,determiner_noun_agreement,determiner_noun_agreement_1,True,True,False,True,43,-43.631011962890625,-44.34185791015625,1
Senators can't disagree with that newspaper article.,Senators can't disagree with that newspaper articles.,morphology,determiner_noun_agreement,determiner_noun_agreement_1,True,True,False,True,44,-48.97917175292969,-50.774169921875,1
Jane has concealed this book.,Jane has concealed this books.,morphology,determiner_noun_agreement,determiner_noun_agreement_1,True,True,False,True,45,-32.973880767822266,-36.23618698120117,1
Marla took this pamphlet.,Marla took this pamphlets.,morphology,determiner_noun_agreement,determiner_noun_agreement_1,True,True,False,True,46,-35.212947845458984,-42.63758087158203,1
The skirt wasn't annoying those dancers.,The skirt wasn't annoying those dancer.,morphology,determiner_noun_agreement,determiner_noun_agreement_1,True,True,False,True,47,-51.08987808227539,-51.02467727661133,0
Most guys conceal this driver.,Most guys conceal this drivers.,morphology,determiner_noun_agreement,determiner_noun_agreement_1,True,True,False,True,48,-38.26484298706055,-39.1466064453125,1
David wasn't lifting those hats.,David wasn't lifting those hat.,morphology,determiner_noun_agreement,determiner_noun_agreement_1,True,True,False,True,49,-37.25811767578125,-37.151275634765625,0
The dancers are driving to those art galleries.,The dancers are driving to those art gallery.,morphology,determiner_noun_agreement,determiner_noun_agreement_1,True,True,False,True,50,-50.4106559753418,-52.318851470947266,1
Tracy might cure those patients.,Tracy might cure those patient.,morphology,determiner_noun_agreement,determiner_noun_agreement_1,True,True,False,True,51,-44.423431396484375,-46.268157958984375,1
Heather cleans that print.,Heather cleans that prints.,morphology,determiner_noun_agreement,determiner_noun_agreement_1,True,True,False,True,52,-39.024776458740234,-39.47625732421875,1
Rose won't reference these movies.,Rose won't reference these movie.,morphology,determiner_noun_agreement,determiner_noun_agreement_1,True,True,False,True,53,-38.7080078125,-41.19955825805664,1
Many reports irritate these senators.,Many reports irritate these senator.,morphology,determiner_noun_agreement,determiner_noun_agreement_1,True,True,False,True,54,-48.12668991088867,-47.26260757446289,0
Dan couldn't walk through this public park.,Dan couldn't walk through this public parks.,morphology,determiner_noun_agreement,determiner_noun_agreement_1,True,True,False,True,55,-45.23003387451172,-44.959049224853516,0
Rose hated this girl.,Rose hated this girls.,morphology,determiner_noun_agreement,determiner_noun_agreement_1,True,True,False,True,56,-25.02878761291504,-27.998809814453125,1
Melinda hires that teacher.,Melinda hires that teachers.,morphology,determiner_noun_agreement,determiner_noun_agreement_1,True,True,False,True,57,-37.18326950073242,-37.158939361572266,0
Joseph healed these customers.,Joseph healed these customer.,morphology,determiner_noun_agreement,determiner_noun_agreement_1,True,True,False,True,58,-31.31796646118164,-32.84667205810547,1
A door doesn't distract those students.,A door doesn't distract those student.,morphology,determiner_noun_agreement,determiner_noun_agreement_1,True,True,False,True,59,-51.44674301147461,-54.38611602783203,1
Theodore skated around that art gallery.,Theodore skated around that art galleries.,morphology,determiner_noun_agreement,determiner_noun_agreement_1,True,True,False,True,60,-65.3449478149414,-64.09459686279297,0
These tomatoes shock these dancers.,These tomatoes shock these dancer.,morphology,determiner_noun_agreement,determiner_noun_agreement_1,True,True,False,True,61,-43.79002380371094,-44.02854537963867,1
Guys observe these children.,Guys observe these child.,morphology,determiner_noun_agreement,determiner_noun_agreement_1,True,True,False,True,62,-31.102296829223633,-34.30229187011719,1
Some guests flee from those dancers.,Some guests flee from those dancer.,morphology,determiner_noun_agreement,determiner_noun_agreement_1,True,True,False,True,63,-47.277801513671875,-48.53797149658203,1
Linda isn't embarrassing these waitresses.,Linda isn't embarrassing these waitress.,morphology,determiner_noun_agreement,determiner_noun_agreement_1,True,True,False,True,64,-65.12788391113281,-55.20223617553711,0
Walter hides these dancers.,Walter hides these dancer.,morphology,determiner_noun_agreement,determiner_noun_agreement_1,True,True,False,True,65,-37.65813446044922,-37.913978576660156,1
Sharon investigated those waiters.,Sharon investigated those waiter.,morphology,determiner_noun_agreement,determiner_noun_agreement_1,True,True,False,True,66,-48.24781036376953,-40.34619140625,0
Bradley should explore this high school.,Bradley should explore this high schools.,morphology,determiner_noun_agreement,determiner_noun_agreement_1,True,True,False,True,67,-36.66868591308594,-41.023651123046875,1
Tanya wears these socks.,Tanya wears these sock.,morphology,determiner_noun_agreement,determiner_noun_agreement_1,True,True,False,True,68,-46.19078063964844,-49.47026443481445,1
That cat had bored those ladies.,That cat had bored those lady.,morphology,determiner_noun_agreement,determiner_noun_agreement_1,True,True,False,True,69,-47.633155822753906,-47.772361755371094,1
Stephen had cleaned this bank.,Stephen had cleaned this banks.,morphology,determiner_noun_agreement,determiner_noun_agreement_1,True,True,False,True,70,-32.570404052734375,-37.089500427246094,1
Waiters have left that driver.,Waiters have left that drivers.,morphology,determiner_noun_agreement,determiner_noun_agreement_1,True,True,False,True,71,-36.336605072021484,-36.4629020690918,1
Heather wasn't criticizing these teachers.,Heather wasn't criticizing these teacher.,morphology,determiner_noun_agreement,determiner_noun_agreement_1,True,True,False,True,72,-50.936119079589844,-52.85021209716797,1
Brian wasn't concealing those cafes.,Brian wasn't concealing those cafe.,morphology,determiner_noun_agreement,determiner_noun_agreement_1,True,True,False,True,73,-53.29629135131836,-51.40045166015625,0
Some trucks weren't boring that cashier.,Some trucks weren't boring that cashiers.,morphology,determiner_noun_agreement,determiner_noun_agreement_1,True,True,False,True,74,-56.65984344482422,-57.306034088134766,1
Many eggplants aren't scaring this teacher.,Many eggplants aren't scaring this teachers.,morphology,determiner_noun_agreement,determiner_noun_agreement_1,True,True,False,True,75,-67.81324005126953,-67.55462646484375,0
Children aren't boring this lady.,Children aren't boring this ladies.,morphology,determiner_noun_agreement,determiner_noun_agreement_1,True,True,False,True,76,-32.036094665527344,-35.70935821533203,1
Karla hadn't brought these pictures.,Karla hadn't brought these picture.,morphology,determiner_noun_agreement,determiner_noun_agreement_1,True,True,False,True,77,-38.495906829833984,-42.0621452331543,1
Janice hasn't cared for that waitress.,Janice hasn't cared for that waitresses.,morphology,determiner_noun_agreement,determiner_noun_agreement_1,True,True,False,True,78,-46.97405242919922,-57.00098419189453,1
A lot of doctors exit those art galleries.,A lot of doctors exit those art gallery.,morphology,determiner_noun_agreement,determiner_noun_agreement_1,True,True,False,True,79,-64.39911651611328,-66.33467102050781,1
Thomas should hug this waiter.,Thomas should hug this waiters.,morphology,determiner_noun_agreement,determiner_noun_agreement_1,True,True,False,True,80,-39.34813690185547,-48.35365676879883,1
Candice hasn't attacked that boy.,Candice hasn't attacked that boys.,morphology,determiner_noun_agreement,determiner_noun_agreement_1,True,True,False,True,81,-39.06398010253906,-41.8498420715332,1
Katherine wasn't taking that public park.,Katherine wasn't taking that public parks.,morphology,determiner_noun_agreement,determiner_noun_agreement_1,True,True,False,True,82,-53.12510681152344,-51.83439636230469,0
The Clintons watch those drivers.,The Clintons watch those driver.,morphology,determiner_noun_agreement,determiner_noun_agreement_1,True,True,False,True,83,-45.21966552734375,-47.322837829589844,1
Amelia loves this waiter.,Amelia loves this waiters.,morphology,determiner_noun_agreement,determiner_noun_agreement_1,True,True,False,True,84,-38.38092041015625,-48.48023223876953,1
Caroline hasn't known this boy.,Caroline hasn't known this boys.,morphology,determiner_noun_agreement,determiner_noun_agreement_1,True,True,False,True,85,-41.41318130493164,-43.960174560546875,1
Sheila isn't passing that cafe.,Sheila isn't passing that cafes.,morphology,determiner_noun_agreement,determiner_noun_agreement_1,True,True,False,True,86,-45.250484466552734,-47.02867889404297,1
Claire had cleaned that picture.,Claire had cleaned that pictures.,morphology,determiner_noun_agreement,determiner_noun_agreement_1,True,True,False,True,87,-40.11528015136719,-41.947227478027344,1
The people exit these movie theaters.,The people exit these movie theater.,morphology,determiner_noun_agreement,determiner_noun_agreement_1,True,True,False,True,88,-45.831809997558594,-45.15613555908203,0
Bruce won't mess up that restaurant.,Bruce won't mess up that restaurants.,morphology,determiner_noun_agreement,determiner_noun_agreement_1,True,True,False,True,89,-34.128684997558594,-36.706260681152344,1
Margaret hasn't bought that blouse.,Margaret hasn't bought that blouses.,morphology,determiner_noun_agreement,determiner_noun_agreement_1,True,True,False,True,90,-39.00136184692383,-40.59580612182617,1
Some waitresses remember that driver.,Some waitresses remember that drivers.,morphology,determiner_noun_agreement,determiner_noun_agreement_1,True,True,False,True,91,-53.673789978027344,-53.80695343017578,1
Timothy loved this boy.,Timothy loved this boys.,morphology,determiner_noun_agreement,determiner_noun_agreement_1,True,True,False,True,92,-29.357646942138672,-32.42494201660156,1
A lot of adults help that guy.,A lot of adults help that guys.,morphology,determiner_noun_agreement,determiner_noun_agreement_1,True,True,False,True,93,-46.92399215698242,-46.62853240966797,0
Steven has broken that cup.,Steven has broken that cups.,morphology,determiner_noun_agreement,determiner_noun_agreement_1,True,True,False,True,94,-26.571266174316406,-28.293437957763672,1
Patricia loved those cashiers.,Patricia loved those cashier.,morphology,determiner_noun_agreement,determiner_noun_agreement_1,True,True,False,True,95,-44.492740631103516,-44.816932678222656,1
Many drivers fix that glass.,Many drivers fix that glasses.,morphology,determiner_noun_agreement,determiner_noun_agreement_1,True,True,False,True,96,-32.646034240722656,-35.93248748779297,1
A lot of cashiers mess up that library.,A lot of cashiers mess up that libraries.,morphology,determiner_noun_agreement,determiner_noun_agreement_1,True,True,False,True,97,-66.80949401855469,-70.81455993652344,1
Waitresses drive to that school.,Waitresses drive to that schools.,morphology,determiner_noun_agreement,determiner_noun_agreement_1,True,True,False,True,98,-35.703163146972656,-38.5050048828125,1
Roger should sound like that waitress.,Roger should sound like that waitresses.,morphology,determiner_noun_agreement,determiner_noun_agreement_1,True,True,False,True,99,-35.883480072021484,-43.88248825073242,1
The Impressionists do listen to this waitress.,The Impressionists do listen to this waitresses.,morphology,determiner_noun_agreement,determiner_noun_agreement_1,True,True,False,True,100,-60.509368896484375,-71.7833023071289,1
Theresa bought this drawing.,Theresa bought this drawings.,morphology,determiner_noun_agreement,determiner_noun_agreement_1,True,True,False,True,101,-38.37065887451172,-39.05560302734375,1
The Impressionists walk through this cafe.,The Impressionists walk through this cafes.,morphology,determiner_noun_agreement,determiner_noun_agreement_1,True,True,False,True,102,-58.63166046142578,-61.69596862792969,1
Thomas can boycott these committees.,Thomas can boycott these committee.,morphology,determiner_noun_agreement,determiner_noun_agreement_1,True,True,False,True,103,-45.729957580566406,-47.54057312011719,1
Alan had boasted about those girls.,Alan had boasted about those girl.,morphology,determiner_noun_agreement,determiner_noun_agreement_1,True,True,False,True,104,-38.70075607299805,-40.22233963012695,1
Sally isn't escaping from these boys.,Sally isn't escaping from these boy.,morphology,determiner_noun_agreement,determiner_noun_agreement_1,True,True,False,True,105,-56.09564208984375,-59.60013198852539,1
Jesus can run around this high school.,Jesus can run around this high schools.,morphology,determiner_noun_agreement,determiner_noun_agreement_1,True,True,False,True,106,-34.80244827270508,-40.34497833251953,1
Amy wasn't confusing those companies.,Amy wasn't confusing those company.,morphology,determiner_noun_agreement,determiner_noun_agreement_1,True,True,False,True,107,-34.03908920288086,-36.6662712097168,1
Tanya boycotts that university.,Tanya boycotts that universities.,morphology,determiner_noun_agreement,determiner_noun_agreement_1,True,True,False,True,108,-62.77562713623047,-63.59973907470703,1
Roger ran around this school.,Roger ran around this schools.,morphology,determiner_noun_agreement,determiner_noun_agreement_1,True,True,False,True,109,-25.76573944091797,-29.364803314208984,1
These teachers escape from those restaurants.,These teachers escape from those restaurant.,morphology,determiner_noun_agreement,determiner_noun_agreement_1,True,True,False,True,110,-39.932342529296875,-42.994834899902344,1
Maria was talking to this guest.,Maria was talking to this guests.,morphology,determiner_noun_agreement,determiner_noun_agreement_1,True,True,False,True,111,-28.79444122314453,-29.271419525146484,1
Rachel has hugged those boys.,Rachel has hugged those boy.,morphology,determiner_noun_agreement,determiner_noun_agreement_1,True,True,False,True,112,-30.757349014282227,-33.31785583496094,1
The students fire this patient.,The students fire this patients.,morphology,determiner_noun_agreement,determiner_noun_agreement_1,True,True,False,True,113,-40.125999450683594,-40.503604888916016,1
Jennifer helped those guests.,Jennifer helped those guest.,morphology,determiner_noun_agreement,determiner_noun_agreement_1,True,True,False,True,114,-25.899253845214844,-29.611690521240234,1
Some plays disgust this legislature.,Some plays disgust this legislatures.,morphology,determiner_noun_agreement,determiner_noun_agreement_1,True,True,False,True,115,-47.60466003417969,-47.86772155761719,1
Jerry had hidden these cups.,Jerry had hidden these cup.,morphology,determiner_noun_agreement,determiner_noun_agreement_1,True,True,False,True,116,-34.54625701904297,-34.70619201660156,1
Martin has concealed this boy.,Martin has concealed this boys.,morphology,determiner_noun_agreement,determiner_noun_agreement_1,True,True,False,True,117,-35.724647521972656,-37.781700134277344,1
That person hadn't bothered those girls.,That person hadn't bothered those girl.,morphology,determiner_noun_agreement,determiner_noun_agreement_1,True,True,False,True,118,-44.10994338989258,-45.24455642700195,1
Carla has hired those patients.,Carla has hired those patient.,morphology,determiner_noun_agreement,determiner_noun_agreement_1,True,True,False,True,119,-38.907371520996094,-40.91729736328125,1
Noah talks about this doctor.,Noah talks about this doctors.,morphology,determiner_noun_agreement,determiner_noun_agreement_1,True,True,False,True,120,-38.330875396728516,-38.58447265625,1
Rachel ran around those high schools.,Rachel ran around those high school.,morphology,determiner_noun_agreement,determiner_noun_agreement_1,True,True,False,True,121,-32.41065216064453,-28.262981414794922,0
All waiters run around these malls.,All waiters run around these mall.,morphology,determiner_noun_agreement,determiner_noun_agreement_1,True,True,False,True,122,-55.341583251953125,-50.728233337402344,0
All students didn't buy these schools.,All students didn't buy these school.,morphology,determiner_noun_agreement,determiner_noun_agreement_1,True,True,False,True,123,-33.20869445800781,-36.17506408691406,1
Patricia bikes to those malls.,Patricia bikes to those mall.,morphology,determiner_noun_agreement,determiner_noun_agreement_1,True,True,False,True,124,-49.02680206298828,-43.617225646972656,0
Vanessa hadn't taken those grocery stores.,Vanessa hadn't taken those grocery store.,morphology,determiner_noun_agreement,determiner_noun_agreement_1,True,True,False,True,125,-48.88416290283203,-50.372798919677734,1
Bethany walked through this school.,Bethany walked through this schools.,morphology,determiner_noun_agreement,determiner_noun_agreement_1,True,True,False,True,126,-57.10089111328125,-59.535648345947266,1
Patricia had argued about those children.,Patricia had argued about those child.,morphology,determiner_noun_agreement,determiner_noun_agreement_1,True,True,False,True,127,-38.75662612915039,-41.94019317626953,1
Julie did flee from this waitress.,Julie did flee from this waitresses.,morphology,determiner_noun_agreement,determiner_noun_agreement_1,True,True,False,True,128,-45.47239303588867,-57.736698150634766,1
