sentence_good,sentence_bad,field,linguistics_term,UID,simple_LM_method,one_prefix_method,two_prefix_method,lexically_identical,pair_id,good_prob,bad_prob,correct
The men who upset Naomi don't argue about themselves.,The men who upset Naomi don't argue about herself.,syntax_semantics,binding,principle_A_c_command,True,True,False,False,766,-56.39772033691406,-59.15507125854492,1
That broccoli that shouldn't impress Jessica is disturbing itself.,That broccoli that shouldn't impress Jessica is disturbing herself.,syntax_semantics,binding,principle_A_c_command,True,True,False,False,767,-78.85504913330078,-78.32072448730469,0
That university that hasn't criticized all plays hadn't concealed itself.,That university that hasn't criticized all plays hadn't concealed themselves.,syntax_semantics,binding,principle_A_c_command,True,True,False,False,768,-92.05673217773438,-90.47344970703125,0
The libraries that have boasted about Mitchell have referenced themselves.,The libraries that have boasted about Mitchell have referenced himself.,syntax_semantics,binding,principle_A_c_command,True,True,False,False,769,-84.05650329589844,-85.8740234375,1
A lot of cats that aren't aggravating Liam found themselves.,A lot of cats that aren't aggravating Liam found himself.,syntax_semantics,binding,principle_A_c_command,True,True,False,False,770,-77.17161560058594,-79.67329406738281,1
All students who haven't seen Michael hadn't hidden themselves.,All students who haven't seen Michael hadn't hidden himself.,syntax_semantics,binding,principle_A_c_command,True,True,False,False,771,-64.47969818115234,-64.44839477539062,0
The guests that might fire Matt have impressed themselves.,The guests that might fire Matt have impressed himself.,syntax_semantics,binding,principle_A_c_command,True,True,False,False,772,-68.03887939453125,-68.27102661132812,1
Every waitress that disliked Robert conceals herself.,Every waitress that disliked Robert conceals himself.,syntax_semantics,binding,principle_A_c_command,True,True,False,False,773,-73.97351837158203,-72.97631072998047,0
All associations that buy some river are listening to themselves.,All associations that buy some river are listening to itself.,syntax_semantics,binding,principle_A_c_command,True,True,False,False,774,-64.75343322753906,-67.85859680175781,1
Those patients who can't flee from Deborah do boast about themselves.,Those patients who can't flee from Deborah do boast about herself.,syntax_semantics,binding,principle_A_c_command,True,True,False,False,775,-84.51024627685547,-87.20380401611328,1
This hospital that would worry Melissa praises itself.,This hospital that would worry Melissa praises herself.,syntax_semantics,binding,principle_A_c_command,True,True,False,False,776,-67.87701416015625,-68.0419921875,1
All children who loved Wendy aren't kissing themselves.,All children who loved Wendy aren't kissing herself.,syntax_semantics,binding,principle_A_c_command,True,True,False,False,777,-60.76948928833008,-62.294219970703125,1
The school that took these blouses wasn't insulting itself.,The school that took these blouses wasn't insulting themselves.,syntax_semantics,binding,principle_A_c_command,True,True,False,False,778,-74.66270446777344,-72.79591369628906,0
The teenagers that irritate William aren't healing themselves.,The teenagers that irritate William aren't healing himself.,syntax_semantics,binding,principle_A_c_command,True,True,False,False,779,-72.26716613769531,-73.94902038574219,1
Every waitress who is helping Martin visits herself.,Every waitress who is helping Martin visits himself.,syntax_semantics,binding,principle_A_c_command,True,True,False,False,780,-62.67384338378906,-61.24100112915039,0
All guests that discuss Robert were criticizing themselves.,All guests that discuss Robert were criticizing himself.,syntax_semantics,binding,principle_A_c_command,True,True,False,False,781,-67.13394165039062,-67.24855041503906,1
The rugs that astound Keith aggravated themselves.,The rugs that astound Keith aggravated himself.,syntax_semantics,binding,principle_A_c_command,True,True,False,False,782,-82.94561004638672,-83.24729919433594,1
Legislatures that shouldn't respect Barbara upset themselves.,Legislatures that shouldn't respect Barbara upset herself.,syntax_semantics,binding,principle_A_c_command,True,True,False,False,783,-82.61015319824219,-85.07473754882812,1
These hospitals that hurt Alan weren't confusing themselves.,These hospitals that hurt Alan weren't confusing himself.,syntax_semantics,binding,principle_A_c_command,True,True,False,False,784,-65.55125427246094,-66.79611206054688,1
That lady who is disgusting Keith cures herself.,That lady who is disgusting Keith cures himself.,syntax_semantics,binding,principle_A_c_command,True,True,False,False,785,-67.52804565429688,-66.75736999511719,0
Every skateboard that disturbs Regina is embarrassing itself.,Every skateboard that disturbs Regina is embarrassing herself.,syntax_semantics,binding,principle_A_c_command,True,True,False,False,786,-82.40843200683594,-84.09317016601562,1
Those cashiers that left Melissa fled from themselves.,Those cashiers that left Melissa fled from herself.,syntax_semantics,binding,principle_A_c_command,True,True,False,False,787,-69.79632568359375,-71.12623596191406,1
The boy who hasn't annoyed Diane sees himself.,The boy who hasn't annoyed Diane sees herself.,syntax_semantics,binding,principle_A_c_command,True,True,False,False,788,-61.219024658203125,-62.96540832519531,1
A company that isn't stunning Larry knew itself.,A company that isn't stunning Larry knew himself.,syntax_semantics,binding,principle_A_c_command,True,True,False,False,789,-75.90003204345703,-74.39134979248047,0
Some fish that upset Richard upset itself.,Some fish that upset Richard upset himself.,syntax_semantics,binding,principle_A_c_command,True,True,False,False,790,-53.302223205566406,-52.75851058959961,0
That fish that can't break some plates found itself.,That fish that can't break some plates found themselves.,syntax_semantics,binding,principle_A_c_command,True,True,False,False,791,-59.711883544921875,-57.845516204833984,0
Some ladies that saw a drawing can't reveal themselves.,Some ladies that saw a drawing can't reveal itself.,syntax_semantics,binding,principle_A_c_command,True,True,False,False,792,-61.88969802856445,-64.97735595703125,1
Every lady that will notice these boys cares for herself.,Every lady that will notice these boys cares for themselves.,syntax_semantics,binding,principle_A_c_command,True,True,False,False,793,-63.88759231567383,-60.56783676147461,0
All women that have climbed up some ladder weren't describing themselves.,All women that have climbed up some ladder weren't describing itself.,syntax_semantics,binding,principle_A_c_command,True,True,False,False,794,-74.62429809570312,-77.85694885253906,1
A woman who didn't describe James has visited herself.,A woman who didn't describe James has visited himself.,syntax_semantics,binding,principle_A_c_command,True,True,False,False,795,-70.4747314453125,-68.76513671875,0
A lot of pedestrians that worked with Sharon will insult themselves.,A lot of pedestrians that worked with Sharon will insult herself.,syntax_semantics,binding,principle_A_c_command,True,True,False,False,796,-86.20501708984375,-88.691162109375,1
The cashiers that should praise Lawrence have fired themselves.,The cashiers that should praise Lawrence have fired himself.,syntax_semantics,binding,principle_A_c_command,True,True,False,False,797,-75.96227264404297,-76.84300994873047,1
This boy that hasn't boasted about Cheryl has returned to himself.,This boy that hasn't boasted about Cheryl has returned to herself.,syntax_semantics,binding,principle_A_c_command,True,True,False,False,798,-81.28330993652344,-82.48948669433594,1
Most women that will astound Michael are discovering themselves.,Most women that will astound Michael are discovering himself.,syntax_semantics,binding,principle_A_c_command,True,True,False,False,799,-71.83412170410156,-73.53993225097656,1
Actresses that walk through a closet don't talk to themselves.,Actresses that walk through a closet don't talk to itself.,syntax_semantics,binding,principle_A_c_command,True,True,False,False,800,-64.98185729980469,-68.03953552246094,1
Some plane that bothered Mark doesn't stun itself.,Some plane that bothered Mark doesn't stun himself.,syntax_semantics,binding,principle_A_c_command,True,True,False,False,801,-71.6773681640625,-70.64497375488281,0
The people that had kissed Nancy hugged themselves.,The people that had kissed Nancy hugged herself.,syntax_semantics,binding,principle_A_c_command,True,True,False,False,802,-55.840721130371094,-57.775821685791016,1
Those legislatures that sold this high school forgot themselves.,Those legislatures that sold this high school forgot itself.,syntax_semantics,binding,principle_A_c_command,True,True,False,False,803,-65.5890884399414,-66.38673400878906,1
A lot of boys that cleaned a grocery store did listen to themselves.,A lot of boys that cleaned a grocery store did listen to itself.,syntax_semantics,binding,principle_A_c_command,True,True,False,False,804,-86.10016632080078,-90.13114929199219,1
The essays that haven't impressed Harvard University weren't worrying themselves.,The essays that haven't impressed Harvard University weren't worrying itself.,syntax_semantics,binding,principle_A_c_command,True,True,False,False,805,-89.43962097167969,-90.56604766845703,1
Those guys that drop by some hospital loved themselves.,Those guys that drop by some hospital loved itself.,syntax_semantics,binding,principle_A_c_command,True,True,False,False,806,-59.19084167480469,-63.24197769165039,1
Some guests who wouldn't discover Jane hadn't healed themselves.,Some guests who wouldn't discover Jane hadn't healed herself.,syntax_semantics,binding,principle_A_c_command,True,True,False,False,807,-71.33666229248047,-73.38215637207031,1
Many pictures that aggravated Carl can't scare themselves.,Many pictures that aggravated Carl can't scare himself.,syntax_semantics,binding,principle_A_c_command,True,True,False,False,808,-67.84724426269531,-69.00364685058594,1
That bank that wouldn't resemble those sketches is talking to itself.,That bank that wouldn't resemble those sketches is talking to themselves.,syntax_semantics,binding,principle_A_c_command,True,True,False,False,809,-76.07232666015625,-72.72209167480469,0
Some teachers that watched Sarah approached themselves.,Some teachers that watched Sarah approached herself.,syntax_semantics,binding,principle_A_c_command,True,True,False,False,810,-52.03364562988281,-55.01329040527344,1
A lot of eyes that are embarrassing Russell astounded themselves.,A lot of eyes that are embarrassing Russell astounded himself.,syntax_semantics,binding,principle_A_c_command,True,True,False,False,811,-82.69064331054688,-85.29365539550781,1
The snake that climbed down these mountains hasn't shocked itself.,The snake that climbed down these mountains hasn't shocked themselves.,syntax_semantics,binding,principle_A_c_command,True,True,False,False,812,-76.54534912109375,-73.86201477050781,0
Chicken that hurts Margaret shouldn't alarm itself.,Chicken that hurts Margaret shouldn't alarm herself.,syntax_semantics,binding,principle_A_c_command,True,True,False,False,813,-57.92934799194336,-56.454524993896484,0
This play that has annoyed Daniel has scared itself.,This play that has annoyed Daniel has scared himself.,syntax_semantics,binding,principle_A_c_command,True,True,False,False,814,-70.67448425292969,-68.66212463378906,0
Some senators who passed that hospital couldn't conceal themselves.,Some senators who passed that hospital couldn't conceal itself.,syntax_semantics,binding,principle_A_c_command,True,True,False,False,815,-74.65939331054688,-76.91973114013672,1
The association that has these cars didn't hate itself.,The association that has these cars didn't hate themselves.,syntax_semantics,binding,principle_A_c_command,True,True,False,False,816,-61.220252990722656,-58.111534118652344,0
Most adults who left Victoria noticed themselves.,Most adults who left Victoria noticed herself.,syntax_semantics,binding,principle_A_c_command,True,True,False,False,817,-50.14869689941406,-52.91859436035156,1
Every essay that is hurting Victoria was worrying itself.,Every essay that is hurting Victoria was worrying herself.,syntax_semantics,binding,principle_A_c_command,True,True,False,False,818,-69.94483947753906,-70.26248931884766,1
Many teachers that would go to that hill wouldn't alarm themselves.,Many teachers that would go to that hill wouldn't alarm itself.,syntax_semantics,binding,principle_A_c_command,True,True,False,False,819,-62.80222702026367,-65.08790588378906,1
Many guys who don't talk about Stephen aren't finding themselves.,Many guys who don't talk about Stephen aren't finding himself.,syntax_semantics,binding,principle_A_c_command,True,True,False,False,820,-63.01812744140625,-63.60786056518555,1
Many associations that are arguing about Sonia loved themselves.,Many associations that are arguing about Sonia loved herself.,syntax_semantics,binding,principle_A_c_command,True,True,False,False,821,-64.85020446777344,-69.11848449707031,1
This shawl that will aggravate Dawn can't disgust itself.,This shawl that will aggravate Dawn can't disgust herself.,syntax_semantics,binding,principle_A_c_command,True,True,False,False,822,-97.41565704345703,-98.088623046875,1
Some dancer who hasn't investigated Brad discovers herself.,Some dancer who hasn't investigated Brad discovers himself.,syntax_semantics,binding,principle_A_c_command,True,True,False,False,823,-71.36477661132812,-69.79000091552734,0
Some woman who hadn't messed up that library escapes from herself.,Some woman who hadn't messed up that library escapes from itself.,syntax_semantics,binding,principle_A_c_command,True,True,False,False,824,-74.9310302734375,-75.89535522460938,1
The drivers that wouldn't drop by some grocery store would find themselves.,The drivers that wouldn't drop by some grocery store would find itself.,syntax_semantics,binding,principle_A_c_command,True,True,False,False,825,-80.40182495117188,-83.00041198730469,1
All doctors that have referenced Carla observed themselves.,All doctors that have referenced Carla observed herself.,syntax_semantics,binding,principle_A_c_command,True,True,False,False,826,-68.37760925292969,-71.8348388671875,1
Every boy who runs around all rivers was admiring himself.,Every boy who runs around all rivers was admiring themselves.,syntax_semantics,binding,principle_A_c_command,True,True,False,False,827,-77.86769104003906,-77.03810119628906,0
Some high schools that haven't disturbed Matt hadn't worried themselves.,Some high schools that haven't disturbed Matt hadn't worried himself.,syntax_semantics,binding,principle_A_c_command,True,True,False,False,828,-79.31975555419922,-80.02152252197266,1
Most jackets that have hurt Anna bored themselves.,Most jackets that have hurt Anna bored herself.,syntax_semantics,binding,principle_A_c_command,True,True,False,False,829,-63.9344367980957,-65.75300598144531,1
This cilantro that wasn't annoying Jason is disturbing itself.,This cilantro that wasn't annoying Jason is disturbing himself.,syntax_semantics,binding,principle_A_c_command,True,True,False,False,830,-90.0980224609375,-88.64823913574219,0
Many men that haven't hidden Kayla hadn't talked about themselves.,Many men that haven't hidden Kayla hadn't talked about herself.,syntax_semantics,binding,principle_A_c_command,True,True,False,False,831,-80.17105865478516,-83.13360595703125,1
Some cashiers who broke that skateboard noticed themselves.,Some cashiers who broke that skateboard noticed itself.,syntax_semantics,binding,principle_A_c_command,True,True,False,False,832,-77.58351135253906,-79.03053283691406,1
Those adults who had examined this report talked to themselves.,Those adults who had examined this report talked to itself.,syntax_semantics,binding,principle_A_c_command,True,True,False,False,833,-60.45603942871094,-63.722755432128906,1
That girl that works with the Clintons hasn't criticized herself.,That girl that works with the Clintons hasn't criticized themselves.,syntax_semantics,binding,principle_A_c_command,True,True,False,False,834,-72.02337646484375,-69.98900604248047,0
That cup that confused Christina stunned itself.,That cup that confused Christina stunned herself.,syntax_semantics,binding,principle_A_c_command,True,True,False,False,835,-69.51210021972656,-71.02604675292969,1
Some pictures that resembled this picture can't shock themselves.,Some pictures that resembled this picture can't shock itself.,syntax_semantics,binding,principle_A_c_command,True,True,False,False,836,-67.32958984375,-68.74675750732422,1
Some shirt that can't resemble these drawings bored itself.,Some shirt that can't resemble these drawings bored themselves.,syntax_semantics,binding,principle_A_c_command,True,True,False,False,837,-70.79127502441406,-69.459716796875,0
All shoes that could astound Phillip are bothering themselves.,All shoes that could astound Phillip are bothering himself.,syntax_semantics,binding,principle_A_c_command,True,True,False,False,838,-72.44403076171875,-75.5728759765625,1
These dancers that complained about Phillip can leave themselves.,These dancers that complained about Phillip can leave himself.,syntax_semantics,binding,principle_A_c_command,True,True,False,False,839,-62.285118103027344,-65.02490234375,1
That actress who walked through these high schools would investigate herself.,That actress who walked through these high schools would investigate themselves.,syntax_semantics,binding,principle_A_c_command,True,True,False,False,840,-75.12315368652344,-73.39315795898438,0
All guys that lifted a lake won't see themselves.,All guys that lifted a lake won't see itself.,syntax_semantics,binding,principle_A_c_command,True,True,False,False,841,-63.09749984741211,-64.867919921875,1
The women who reference Heather discussed themselves.,The women who reference Heather discussed herself.,syntax_semantics,binding,principle_A_c_command,True,True,False,False,842,-58.04161834716797,-60.67866516113281,1
Every waitress that wouldn't notice some skirt might conceal herself.,Every waitress that wouldn't notice some skirt might conceal itself.,syntax_semantics,binding,principle_A_c_command,True,True,False,False,843,-81.21082305908203,-80.07734680175781,0
Cucumbers that disgust Bill haven't worried themselves.,Cucumbers that disgust Bill haven't worried himself.,syntax_semantics,binding,principle_A_c_command,True,True,False,False,844,-86.29911804199219,-86.22825622558594,0
The actress that breaks these glasses described herself.,The actress that breaks these glasses described themselves.,syntax_semantics,binding,principle_A_c_command,True,True,False,False,845,-65.54693603515625,-62.482505798339844,0
These actresses who watched Derek will appreciate themselves.,These actresses who watched Derek will appreciate himself.,syntax_semantics,binding,principle_A_c_command,True,True,False,False,846,-66.0165786743164,-66.88172912597656,1
This dancer who hadn't known Aaron hadn't appreciated herself.,This dancer who hadn't known Aaron hadn't appreciated himself.,syntax_semantics,binding,principle_A_c_command,True,True,False,False,847,-78.88484191894531,-77.53630065917969,0
Every rug that had scared many guests isn't embarrassing itself.,Every rug that had scared many guests isn't embarrassing themselves.,syntax_semantics,binding,principle_A_c_command,True,True,False,False,848,-79.96745300292969,-78.08515930175781,0
This company that embarrassed Florence hadn't disliked itself.,This company that embarrassed Florence hadn't disliked herself.,syntax_semantics,binding,principle_A_c_command,True,True,False,False,849,-70.0375747680664,-70.39013671875,1
The children that won't work with Carla aggravated themselves.,The children that won't work with Carla aggravated herself.,syntax_semantics,binding,principle_A_c_command,True,True,False,False,850,-70.03388977050781,-71.08322143554688,1
Most legislatures that upset Michael hadn't criticized themselves.,Most legislatures that upset Michael hadn't criticized himself.,syntax_semantics,binding,principle_A_c_command,True,True,False,False,851,-66.9122314453125,-67.54830932617188,1
These senators who will scare Bethany disgusted themselves.,These senators who will scare Bethany disgusted herself.,syntax_semantics,binding,principle_A_c_command,True,True,False,False,852,-82.49246215820312,-84.56507873535156,1
Some man who ascends a lot of steps observes himself.,Some man who ascends a lot of steps observes themselves.,syntax_semantics,binding,principle_A_c_command,True,True,False,False,853,-71.05802154541016,-70.02415466308594,0
Some cafe that scared Dennis was scaring itself.,Some cafe that scared Dennis was scaring himself.,syntax_semantics,binding,principle_A_c_command,True,True,False,False,854,-68.99674224853516,-66.87496948242188,0
Every waitress that is looking like the sketch hasn't scared herself.,Every waitress that is looking like the sketch hasn't scared itself.,syntax_semantics,binding,principle_A_c_command,True,True,False,False,855,-78.21957397460938,-76.57438659667969,0
That government that disgusts Mitchell dislikes itself.,That government that disgusts Mitchell dislikes himself.,syntax_semantics,binding,principle_A_c_command,True,True,False,False,856,-79.92532348632812,-80.36358642578125,1
Many banks that fired Sherry are insulting themselves.,Many banks that fired Sherry are insulting herself.,syntax_semantics,binding,principle_A_c_command,True,True,False,False,857,-68.98173522949219,-72.69157409667969,1
That boy that isn't fleeing from Sara is watching himself.,That boy that isn't fleeing from Sara is watching herself.,syntax_semantics,binding,principle_A_c_command,True,True,False,False,858,-73.71907043457031,-74.95564270019531,1
All customers who loved this book shouldn't dislike themselves.,All customers who loved this book shouldn't dislike itself.,syntax_semantics,binding,principle_A_c_command,True,True,False,False,859,-63.288604736328125,-65.77157592773438,1
Some guests who hadn't discussed Denise respected themselves.,Some guests who hadn't discussed Denise respected herself.,syntax_semantics,binding,principle_A_c_command,True,True,False,False,860,-67.0835952758789,-70.10636901855469,1
Many waitresses that admire Douglas sounded like themselves.,Many waitresses that admire Douglas sounded like himself.,syntax_semantics,binding,principle_A_c_command,True,True,False,False,861,-76.42007446289062,-75.72581481933594,0
A lot of teenagers who haven't visited Brian might heal themselves.,A lot of teenagers who haven't visited Brian might heal himself.,syntax_semantics,binding,principle_A_c_command,True,True,False,False,862,-90.14193725585938,-90.40148162841797,1
A dancer who did reveal all actresses isn't thinking about herself.,A dancer who did reveal all actresses isn't thinking about themselves.,syntax_semantics,binding,principle_A_c_command,True,True,False,False,863,-88.73049926757812,-86.67558288574219,0
The senators that have researched art investigated themselves.,The senators that have researched art investigated itself.,syntax_semantics,binding,principle_A_c_command,True,True,False,False,864,-66.33675384521484,-66.64212036132812,1
Waitresses that haven't disturbed Tanya have observed themselves.,Waitresses that haven't disturbed Tanya have observed herself.,syntax_semantics,binding,principle_A_c_command,True,True,False,False,865,-84.47454833984375,-86.80928039550781,1
The dancer that has cared for the senators visits herself.,The dancer that has cared for the senators visits themselves.,syntax_semantics,binding,principle_A_c_command,True,True,False,False,866,-70.15083312988281,-67.25578308105469,0
Cashiers that messed up this dress would love themselves.,Cashiers that messed up this dress would love itself.,syntax_semantics,binding,principle_A_c_command,True,True,False,False,867,-62.369590759277344,-64.61536407470703,1
The picture that bothers cashiers bored itself.,The picture that bothers cashiers bored themselves.,syntax_semantics,binding,principle_A_c_command,True,True,False,False,868,-66.53434753417969,-66.05951690673828,0
The girls that discover Amy aren't listening to themselves.,The girls that discover Amy aren't listening to herself.,syntax_semantics,binding,principle_A_c_command,True,True,False,False,869,-57.01823806762695,-59.964561462402344,1
A lot of pedestrians who hadn't talked about some college campus won't watch themselves.,A lot of pedestrians who hadn't talked about some college campus won't watch itself.,syntax_semantics,binding,principle_A_c_command,True,True,False,False,870,-105.56059265136719,-108.44772338867188,1
Most cashiers who can approach Tamara didn't reveal themselves.,Most cashiers who can approach Tamara didn't reveal herself.,syntax_semantics,binding,principle_A_c_command,True,True,False,False,871,-89.79708099365234,-92.60102844238281,1
Every man that concealed Deborah hasn't hidden himself.,Every man that concealed Deborah hasn't hidden herself.,syntax_semantics,binding,principle_A_c_command,True,True,False,False,872,-70.4509048461914,-71.14447021484375,1
These companies that were working with Christine aren't insulting themselves.,These companies that were working with Christine aren't insulting herself.,syntax_semantics,binding,principle_A_c_command,True,True,False,False,873,-63.609867095947266,-66.67269897460938,1
The lady who had healed the man respects herself.,The lady who had healed the man respects himself.,syntax_semantics,binding,principle_A_c_command,True,True,False,False,874,-61.68163299560547,-60.26512908935547,0
A company that bored Karla praises itself.,A company that bored Karla praises herself.,syntax_semantics,binding,principle_A_c_command,True,True,False,False,875,-81.57490539550781,-82.5844497680664,1
