sentence_good,sentence_bad,field,linguistics_term,UID,simple_LM_method,one_prefix_method,two_prefix_method,lexically_identical,pair_id,good_prob,bad_prob,correct
Wayne wasn't discussed by some senator.,Wayne wasn't discussed by some dishes.,syntax,s-selection,animate_subject_passive,True,True,False,False,673,-52.22785949707031,-49.58171844482422,0
This ladder wasn't ascended by some woman.,This ladder wasn't ascended by some rabbits.,syntax,s-selection,animate_subject_passive,True,True,False,False,674,-53.79633331298828,-57.66326141357422,1
The river wasn't fled from by some children.,The river wasn't fled from by some government.,syntax,s-selection,animate_subject_passive,True,True,False,False,675,-54.237850189208984,-55.47438049316406,1
Some window is broken by the adult.,Some window is broken by the pies.,syntax,s-selection,animate_subject_passive,True,True,False,False,676,-40.03374481201172,-41.61677551269531,1
Pants were bought by the teenagers.,Pants were bought by the apple.,syntax,s-selection,animate_subject_passive,True,True,False,False,677,-43.9511833190918,-45.21502685546875,1
These peppers aren't taken by the waitress.,These peppers aren't taken by the snakes.,syntax,s-selection,animate_subject_passive,True,True,False,False,678,-46.10393524169922,-44.38859558105469,0
These malls are toured by some ladies.,These malls are toured by some bananas.,syntax,s-selection,animate_subject_passive,True,True,False,False,679,-51.451255798339844,-51.86249923706055,1
Christopher wasn't investigated by some alumni.,Christopher wasn't investigated by some crisis.,syntax,s-selection,animate_subject_passive,True,True,False,False,680,-44.973228454589844,-42.2938346862793,0
Some stories were remembered by the ladies.,Some stories were remembered by the rice.,syntax,s-selection,animate_subject_passive,True,True,False,False,681,-39.09511947631836,-40.27484893798828,1
William was returned to by some lady.,William was returned to by some documentaries.,syntax,s-selection,animate_subject_passive,True,True,False,False,682,-40.396907806396484,-42.89790725708008,1
Many casseroles are taken by the doctors.,Many casseroles are taken by the universities.,syntax,s-selection,animate_subject_passive,True,True,False,False,683,-54.43817138671875,-55.910858154296875,1
April was argued about by some senator.,April was argued about by some dishes.,syntax,s-selection,animate_subject_passive,True,True,False,False,684,-48.39326477050781,-46.17194747924805,0
All museums were returned to by some guest.,All museums were returned to by some shoe.,syntax,s-selection,animate_subject_passive,True,True,False,False,685,-51.773643493652344,-52.07355499267578,1
The play wasn't researched by the adult.,The play wasn't researched by the apple.,syntax,s-selection,animate_subject_passive,True,True,False,False,686,-48.6923942565918,-49.87843322753906,1
A dancer wasn't watched by some man.,A dancer wasn't watched by some crisis.,syntax,s-selection,animate_subject_passive,True,True,False,False,687,-59.36903381347656,-62.13285446166992,1
Florence isn't healed by some lady.,Florence isn't healed by some cars.,syntax,s-selection,animate_subject_passive,True,True,False,False,688,-63.09992218017578,-60.62688446044922,0
Many children are talked to by some actor.,Many children are talked to by some steak.,syntax,s-selection,animate_subject_passive,True,True,False,False,689,-43.009002685546875,-45.38023376464844,1
Gerald is complained about by the guests.,Gerald is complained about by the cucumber.,syntax,s-selection,animate_subject_passive,True,True,False,False,690,-54.096763610839844,-63.12103271484375,1
Some hill isn't boycotted by the guests.,Some hill isn't boycotted by the spotlights.,syntax,s-selection,animate_subject_passive,True,True,False,False,691,-72.90046691894531,-84.41122436523438,1
The river wasn't walked through by the man.,The river wasn't walked through by the lamp.,syntax,s-selection,animate_subject_passive,True,True,False,False,692,-50.36058044433594,-51.78325271606445,1
Tanya wasn't cared for by the guest.,Tanya wasn't cared for by the projectors.,syntax,s-selection,animate_subject_passive,True,True,False,False,693,-59.470947265625,-67.17301177978516,1
Martha was described by the cashier.,Martha was described by the association.,syntax,s-selection,animate_subject_passive,True,True,False,False,694,-51.028839111328125,-42.28227233886719,0
Jeffrey is fired by some customers.,Jeffrey is fired by some fish.,syntax,s-selection,animate_subject_passive,True,True,False,False,695,-42.11088562011719,-40.32232666015625,0
Irene wasn't returned to by the senators.,Irene wasn't returned to by the octopus.,syntax,s-selection,animate_subject_passive,True,True,False,False,696,-56.891624450683594,-56.23393249511719,0
Some bank isn't driven to by the patients.,Some bank isn't driven to by the synopsis.,syntax,s-selection,animate_subject_passive,True,True,False,False,697,-54.839027404785156,-61.810707092285156,1
Florence isn't referenced by some adults.,Florence isn't referenced by some teeth.,syntax,s-selection,animate_subject_passive,True,True,False,False,698,-61.01237106323242,-63.477725982666016,1
Steps weren't cleaned by some teacher.,Steps weren't cleaned by some casseroles.,syntax,s-selection,animate_subject_passive,True,True,False,False,699,-47.75043487548828,-62.92427062988281,1
Candice isn't returned to by some actresses.,Candice isn't returned to by some carriage.,syntax,s-selection,animate_subject_passive,True,True,False,False,700,-52.957427978515625,-53.653770446777344,1
The grocery store is toured by the person.,The grocery store is toured by the organization.,syntax,s-selection,animate_subject_passive,True,True,False,False,701,-47.206748962402344,-47.47254180908203,1
High schools weren't arrived at by the woman.,High schools weren't arrived at by the hypotheses.,syntax,s-selection,animate_subject_passive,True,True,False,False,702,-52.02216720581055,-56.276527404785156,1
Bruce wasn't complained about by the patients.,Bruce wasn't complained about by the jackets.,syntax,s-selection,animate_subject_passive,True,True,False,False,703,-44.56425476074219,-47.50904846191406,1
Sheila was criticized by some alumnus.,Sheila was criticized by some windows.,syntax,s-selection,animate_subject_passive,True,True,False,False,704,-59.246585845947266,-42.11038589477539,0
Rachelle is returned to by the men.,Rachelle is returned to by the tooth.,syntax,s-selection,animate_subject_passive,True,True,False,False,705,-44.35856628417969,-46.63362121582031,1
Vanessa isn't fired by the child.,Vanessa isn't fired by the ellipses.,syntax,s-selection,animate_subject_passive,True,True,False,False,706,-44.232872009277344,-69.04428100585938,1
The Great Lakes aren't biked to by the offspring.,The Great Lakes aren't biked to by the computers.,syntax,s-selection,animate_subject_passive,True,True,False,False,707,-72.25491333007812,-69.04585266113281,0
These cars weren't thought about by the boys.,These cars weren't thought about by the door.,syntax,s-selection,animate_subject_passive,True,True,False,False,708,-42.19198989868164,-43.742515563964844,1
The college campus isn't driven to by some woman.,The college campus isn't driven to by some fish.,syntax,s-selection,animate_subject_passive,True,True,False,False,709,-63.55012130737305,-63.0557861328125,0
A plate isn't found by some children.,A plate isn't found by some chairs.,syntax,s-selection,animate_subject_passive,True,True,False,False,710,-55.09870910644531,-59.972537994384766,1
Angela wasn't hated by some alumni.,Angela wasn't hated by some gloves.,syntax,s-selection,animate_subject_passive,True,True,False,False,711,-57.4564208984375,-53.99821090698242,0
Cynthia wasn't listened to by the patient.,Cynthia wasn't listened to by the shawl.,syntax,s-selection,animate_subject_passive,True,True,False,False,712,-66.1863784790039,-79.03968811035156,1
Janet wasn't visited by the customer.,Janet wasn't visited by the bike.,syntax,s-selection,animate_subject_passive,True,True,False,False,713,-53.35420608520508,-53.16389465332031,0
Benjamin was hugged by the woman.,Benjamin was hugged by the essay.,syntax,s-selection,animate_subject_passive,True,True,False,False,714,-46.114952087402344,-49.88902282714844,1
The Great Lakes are driven to by some women.,The Great Lakes are driven to by some foot.,syntax,s-selection,animate_subject_passive,True,True,False,False,715,-53.54587173461914,-55.93470764160156,1
This hamster is sold by the people.,This hamster is sold by the slope.,syntax,s-selection,animate_subject_passive,True,True,False,False,716,-46.036991119384766,-50.644508361816406,1
Carolyn wasn't praised by the doctor.,Carolyn wasn't praised by the analyses.,syntax,s-selection,animate_subject_passive,True,True,False,False,717,-48.358245849609375,-53.718528747558594,1
Tracy was listened to by some girls.,Tracy was listened to by some ladder.,syntax,s-selection,animate_subject_passive,True,True,False,False,718,-46.34016418457031,-50.61396789550781,1
A unicycle was taken by the pedestrian.,A unicycle was taken by the print.,syntax,s-selection,animate_subject_passive,True,True,False,False,719,-62.07145690917969,-58.39573669433594,0
This hill isn't ascended by some guys.,This hill isn't ascended by some movies.,syntax,s-selection,animate_subject_passive,True,True,False,False,720,-53.26305389404297,-50.116973876953125,0
Brian isn't sounded like by some teachers.,Brian isn't sounded like by some sheep.,syntax,s-selection,animate_subject_passive,True,True,False,False,721,-46.02339172363281,-49.13520050048828,1
This pedestrian wasn't fled from by some driver.,This pedestrian wasn't fled from by some brochure.,syntax,s-selection,animate_subject_passive,True,True,False,False,722,-70.36143493652344,-80.74295806884766,1
Many college campuses aren't dropped by by some ladies.,Many college campuses aren't dropped by by some sock.,syntax,s-selection,animate_subject_passive,True,True,False,False,723,-67.09162902832031,-69.34365844726562,1
Tiffany isn't approached by some patient.,Tiffany isn't approached by some organizations.,syntax,s-selection,animate_subject_passive,True,True,False,False,724,-67.8668441772461,-65.75349426269531,0
Most carriages were taken by some woman.,Most carriages were taken by some species.,syntax,s-selection,animate_subject_passive,True,True,False,False,725,-50.98338317871094,-50.448028564453125,0
The woman wasn't kissed by the doctor.,The woman wasn't kissed by the nucleus.,syntax,s-selection,animate_subject_passive,True,True,False,False,726,-43.764976501464844,-47.17711639404297,1
These customers are thought about by the senator.,These customers are thought about by the photograph.,syntax,s-selection,animate_subject_passive,True,True,False,False,727,-43.61846923828125,-43.369876861572266,0
Larry was loved by some children.,Larry was loved by some horses.,syntax,s-selection,animate_subject_passive,True,True,False,False,728,-29.80808448791504,-36.08404541015625,1
Carol is cured by the cashier.,Carol is cured by the legislatures.,syntax,s-selection,animate_subject_passive,True,True,False,False,729,-50.767295837402344,-44.89198684692383,0
That guy isn't described by the cashiers.,That guy isn't described by the turtle.,syntax,s-selection,animate_subject_passive,True,True,False,False,730,-53.5043830871582,-46.07999038696289,0
Randolf wasn't healed by some patients.,Randolf wasn't healed by some sketch.,syntax,s-selection,animate_subject_passive,True,True,False,False,731,-55.552711486816406,-58.738067626953125,1
These banks weren't driven to by some men.,These banks weren't driven to by some shoe.,syntax,s-selection,animate_subject_passive,True,True,False,False,732,-54.67510986328125,-57.28144454956055,1
A lot of banks are messed up by the waiters.,A lot of banks are messed up by the universities.,syntax,s-selection,animate_subject_passive,True,True,False,False,733,-69.5765380859375,-59.9625244140625,0
Many public parks were run around by the teenager.,Many public parks were run around by the cat.,syntax,s-selection,animate_subject_passive,True,True,False,False,734,-51.79154586791992,-50.595436096191406,0
Kevin isn't hired by the guys.,Kevin isn't hired by the glass.,syntax,s-selection,animate_subject_passive,True,True,False,False,735,-36.5929069519043,-39.24913024902344,1
The slope was descended by some boys.,The slope was descended by some planes.,syntax,s-selection,animate_subject_passive,True,True,False,False,736,-47.06924819946289,-50.47370910644531,1
The mushroom isn't bought by some men.,The mushroom isn't bought by some plane.,syntax,s-selection,animate_subject_passive,True,True,False,False,737,-53.66064453125,-55.109527587890625,1
Amelia is listened to by the woman.,Amelia is listened to by the newspaper articles.,syntax,s-selection,animate_subject_passive,True,True,False,False,738,-48.91545104980469,-57.343955993652344,1
Jerry isn't approached by the woman.,Jerry isn't approached by the banana.,syntax,s-selection,animate_subject_passive,True,True,False,False,739,-37.55894088745117,-41.65633010864258,1
Steps are climbed down by the alumni.,Steps are climbed down by the rice.,syntax,s-selection,animate_subject_passive,True,True,False,False,740,-45.95433044433594,-43.24848937988281,0
Some schools weren't walked through by the teenager.,Some schools weren't walked through by the water.,syntax,s-selection,animate_subject_passive,True,True,False,False,741,-50.72576904296875,-45.629730224609375,0
Theodore isn't revealed by the girl.,Theodore isn't revealed by the glass.,syntax,s-selection,animate_subject_passive,True,True,False,False,742,-52.509056091308594,-53.01786804199219,1
These people are observed by some alumnus.,These people are observed by some glove.,syntax,s-selection,animate_subject_passive,True,True,False,False,743,-55.42302322387695,-41.728485107421875,0
The Borgias were sounded like by the guests.,The Borgias were sounded like by the glasses.,syntax,s-selection,animate_subject_passive,True,True,False,False,744,-61.821556091308594,-63.43450927734375,1
Some doors are taken by some dancer.,Some doors are taken by some mouth.,syntax,s-selection,animate_subject_passive,True,True,False,False,745,-43.07627868652344,-40.811607360839844,0
Some bank is toured by the girl.,Some bank is toured by the gates.,syntax,s-selection,animate_subject_passive,True,True,False,False,746,-45.40376281738281,-46.083953857421875,1
Some hill was descended by some guests.,Some hill was descended by some stories.,syntax,s-selection,animate_subject_passive,True,True,False,False,747,-51.14220428466797,-49.765403747558594,0
Cynthia is discovered by some doctors.,Cynthia is discovered by some eggplants.,syntax,s-selection,animate_subject_passive,True,True,False,False,748,-57.70835494995117,-76.63270568847656,1
The senator is cured by the students.,The senator is cured by the carriages.,syntax,s-selection,animate_subject_passive,True,True,False,False,749,-39.42753601074219,-49.27186584472656,1
A hill isn't climbed up by the actor.,A hill isn't climbed up by the plate.,syntax,s-selection,animate_subject_passive,True,True,False,False,750,-66.58963012695312,-62.944793701171875,0
Those museums aren't biked to by the waiters.,Those museums aren't biked to by the pamphlets.,syntax,s-selection,animate_subject_passive,True,True,False,False,751,-71.38371276855469,-73.5888671875,1
Tanya wasn't attacked by the patients.,Tanya wasn't attacked by the bike.,syntax,s-selection,animate_subject_passive,True,True,False,False,752,-54.189300537109375,-54.96556091308594,1
An art gallery was passed by some boys.,An art gallery was passed by some dishes.,syntax,s-selection,animate_subject_passive,True,True,False,False,753,-50.771629333496094,-52.208168029785156,1
Eva was loved by some people.,Eva was loved by some light.,syntax,s-selection,animate_subject_passive,True,True,False,False,754,-28.74742889404297,-34.145633697509766,1
A closet is gone to by some man.,A closet is gone to by some sketches.,syntax,s-selection,animate_subject_passive,True,True,False,False,755,-56.55739974975586,-60.2845573425293,1
Christina was hated by some teenager.,Christina was hated by some paralyses.,syntax,s-selection,animate_subject_passive,True,True,False,False,756,-47.053062438964844,-59.36367416381836,1
All art galleries weren't passed by the lady.,All art galleries weren't passed by the paralyses.,syntax,s-selection,animate_subject_passive,True,True,False,False,757,-57.55635452270508,-68.93073272705078,1
The guest isn't escaped from by the senator.,The guest isn't escaped from by the stairs.,syntax,s-selection,animate_subject_passive,True,True,False,False,758,-57.16449737548828,-55.83265686035156,0
Those bikes are broken by some guest.,Those bikes are broken by some cake.,syntax,s-selection,animate_subject_passive,True,True,False,False,759,-44.87548828125,-42.44708251953125,0
Many glaciers were explored by some alumnus.,Many glaciers were explored by some report.,syntax,s-selection,animate_subject_passive,True,True,False,False,760,-68.08476257324219,-50.31846237182617,0
Every mountain isn't run around by some dancer.,Every mountain isn't run around by some plate.,syntax,s-selection,animate_subject_passive,True,True,False,False,761,-57.0009765625,-54.75171661376953,0
Many slopes were concealed by some actresses.,Many slopes were concealed by some light.,syntax,s-selection,animate_subject_passive,True,True,False,False,762,-54.904876708984375,-52.59465026855469,0
Rodney wasn't appreciated by the adults.,Rodney wasn't appreciated by the fungus.,syntax,s-selection,animate_subject_passive,True,True,False,False,763,-42.189491271972656,-45.067176818847656,1
Some ice isn't lifted by some boy.,Some ice isn't lifted by some octopus.,syntax,s-selection,animate_subject_passive,True,True,False,False,764,-53.375450134277344,-55.417354583740234,1
The glaciers weren't arrived at by some doctors.,The glaciers weren't arrived at by some books.,syntax,s-selection,animate_subject_passive,True,True,False,False,765,-63.07722854614258,-62.05458450317383,0
Chicken wasn't taken by some lady.,Chicken wasn't taken by some hamsters.,syntax,s-selection,animate_subject_passive,True,True,False,False,766,-39.4283332824707,-46.53064727783203,1
These guests aren't cured by some driver.,These guests aren't cured by some shoe.,syntax,s-selection,animate_subject_passive,True,True,False,False,767,-48.44565200805664,-48.791595458984375,1
These libraries weren't cleaned by some waiter.,These libraries weren't cleaned by some lice.,syntax,s-selection,animate_subject_passive,True,True,False,False,768,-54.85947036743164,-61.586524963378906,1
That art gallery isn't visited by some actor.,That art gallery isn't visited by some shoes.,syntax,s-selection,animate_subject_passive,True,True,False,False,769,-69.32923889160156,-68.43531036376953,0
That closet wasn't passed by some woman.,That closet wasn't passed by some goose.,syntax,s-selection,animate_subject_passive,True,True,False,False,770,-50.78888702392578,-56.526283264160156,1
Some movies were examined by some actresses.,Some movies were examined by some louse.,syntax,s-selection,animate_subject_passive,True,True,False,False,771,-43.002357482910156,-51.407447814941406,1
Daniel isn't concealed by the teenagers.,Daniel isn't concealed by the bananas.,syntax,s-selection,animate_subject_passive,True,True,False,False,772,-42.79365539550781,-43.788543701171875,1
The fork is revealed by some dancer.,The fork is revealed by some geese.,syntax,s-selection,animate_subject_passive,True,True,False,False,773,-48.93172836303711,-54.96400451660156,1
The prints aren't concealed by the woman.,The prints aren't concealed by the steak.,syntax,s-selection,animate_subject_passive,True,True,False,False,774,-49.1490592956543,-52.5771369934082,1
Robert isn't concealed by some patient.,Robert isn't concealed by some drawing.,syntax,s-selection,animate_subject_passive,True,True,False,False,775,-44.69420623779297,-48.872215270996094,1
James wasn't escaped from by the women.,James wasn't escaped from by the cart.,syntax,s-selection,animate_subject_passive,True,True,False,False,776,-45.12733459472656,-52.38813018798828,1
Most hills are driven to by some senators.,Most hills are driven to by some carriages.,syntax,s-selection,animate_subject_passive,True,True,False,False,777,-54.40648651123047,-58.54674530029297,1
This dress is sold by some waitresses.,This dress is sold by some report.,syntax,s-selection,animate_subject_passive,True,True,False,False,778,-54.755165100097656,-41.39739990234375,0
Many glasses were brought by the alumnus.,Many glasses were brought by the paintings.,syntax,s-selection,animate_subject_passive,True,True,False,False,779,-57.87311553955078,-41.61863708496094,0
Douglas was fired by some driver.,Douglas was fired by some skateboards.,syntax,s-selection,animate_subject_passive,True,True,False,False,780,-46.16204071044922,-53.97087097167969,1
Many slopes aren't climbed down by some waiters.,Many slopes aren't climbed down by some cakes.,syntax,s-selection,animate_subject_passive,True,True,False,False,781,-71.1285629272461,-62.22148132324219,0
Beverly was criticized by some actresses.,Beverly was criticized by some synthesis.,syntax,s-selection,animate_subject_passive,True,True,False,False,782,-62.556549072265625,-66.09101867675781,1
Those public parks aren't skated around by the child.,Those public parks aren't skated around by the screens.,syntax,s-selection,animate_subject_passive,True,True,False,False,783,-60.754119873046875,-62.336917877197266,1
Most ladders weren't ascended by the alumnus.,Most ladders weren't ascended by the paintings.,syntax,s-selection,animate_subject_passive,True,True,False,False,784,-78.51705932617188,-61.40867614746094,0
Candice isn't visited by the man.,Candice isn't visited by the vase.,syntax,s-selection,animate_subject_passive,True,True,False,False,785,-44.025917053222656,-53.32596969604492,1
Alexander isn't attacked by some offspring.,Alexander isn't attacked by some horse.,syntax,s-selection,animate_subject_passive,True,True,False,False,786,-44.305320739746094,-42.85697555541992,0
A high school isn't messed up by the actresses.,A high school isn't messed up by the octopus.,syntax,s-selection,animate_subject_passive,True,True,False,False,787,-59.58318328857422,-59.66569137573242,1
A dancer was fired by the adult.,A dancer was fired by the convertible.,syntax,s-selection,animate_subject_passive,True,True,False,False,788,-50.840087890625,-52.74192810058594,1
Donna isn't escaped from by the woman.,Donna isn't escaped from by the ladder.,syntax,s-selection,animate_subject_passive,True,True,False,False,789,-55.80039978027344,-57.19361114501953,1
Bethany isn't disliked by some alumnus.,Bethany isn't disliked by some fish.,syntax,s-selection,animate_subject_passive,True,True,False,False,790,-93.55595397949219,-73.6983642578125,0
These apples aren't found by some patients.,These apples aren't found by some commentary.,syntax,s-selection,animate_subject_passive,True,True,False,False,791,-47.77848815917969,-52.09044647216797,1
That company is boycotted by some offspring.,That company is boycotted by some banana.,syntax,s-selection,animate_subject_passive,True,True,False,False,792,-70.62751770019531,-70.3494873046875,0
The socks are taken by some men.,The socks are taken by some jacket.,syntax,s-selection,animate_subject_passive,True,True,False,False,793,-42.59923553466797,-45.73046875,1
A slope is ascended by the guests.,A slope is ascended by the scarves.,syntax,s-selection,animate_subject_passive,True,True,False,False,794,-57.098655700683594,-66.66781616210938,1
The restaurant was explored by the waitresses.,The restaurant was explored by the association.,syntax,s-selection,animate_subject_passive,True,True,False,False,795,-52.37861633300781,-41.56556701660156,0
Randolf wasn't appreciated by some guy.,Randolf wasn't appreciated by some paralysis.,syntax,s-selection,animate_subject_passive,True,True,False,False,796,-52.748565673828125,-57.92852020263672,1
Laurie was appreciated by the drivers.,Laurie was appreciated by the report.,syntax,s-selection,animate_subject_passive,True,True,False,False,797,-50.2373046875,-47.452484130859375,0
Gary is listened to by some drivers.,Gary is listened to by some skateboard.,syntax,s-selection,animate_subject_passive,True,True,False,False,798,-42.212703704833984,-48.90538787841797,1
A lot of pictures weren't researched by some men.,A lot of pictures weren't researched by some nuclei.,syntax,s-selection,animate_subject_passive,True,True,False,False,799,-71.72200775146484,-83.98884582519531,1
Suzanne is referenced by the senators.,Suzanne is referenced by the organization.,syntax,s-selection,animate_subject_passive,True,True,False,False,800,-46.85527420043945,-40.91484832763672,0
Cups aren't cleaned by the teachers.,Cups aren't cleaned by the foot.,syntax,s-selection,animate_subject_passive,True,True,False,False,801,-49.0958251953125,-47.89524459838867,0
Most bikes weren't broken by some waitress.,Most bikes weren't broken by some projectors.,syntax,s-selection,animate_subject_passive,True,True,False,False,802,-54.21282958984375,-62.12037658691406,1
Many cafes were exited by some doctors.,Many cafes were exited by some screens.,syntax,s-selection,animate_subject_passive,True,True,False,False,803,-53.506011962890625,-56.34699630737305,1
Benjamin isn't seen by some ladies.,Benjamin isn't seen by some mouth.,syntax,s-selection,animate_subject_passive,True,True,False,False,804,-53.466766357421875,-53.62818908691406,1
Veronica isn't questioned by the patient.,Veronica isn't questioned by the eyes.,syntax,s-selection,animate_subject_passive,True,True,False,False,805,-45.52595520019531,-45.916587829589844,1
That skirt wasn't worn by the ladies.,That skirt wasn't worn by the dog.,syntax,s-selection,animate_subject_passive,True,True,False,False,806,-47.81881332397461,-44.20689392089844,0
