sentence_good,sentence_bad,field,linguistics_term,UID,simple_LM_method,one_prefix_method,two_prefix_method,lexically_identical,pair_id,good_prob,bad_prob,correct
Some men that don't escape from a bank were helping themselves.,Some men that don't escape from a bank were helping itself.,syntax_semantics,binding,principle_A_c_command,True,True,False,False,219,-62.68345642089844,-67.33245849609375,1
Some waitress that was climbing up all hills had insulted herself.,Some waitress that was climbing up all hills had insulted themselves.,syntax_semantics,binding,principle_A_c_command,True,True,False,False,220,-79.43150329589844,-75.69546508789062,0
This boy who annoyed Laurie disagrees with himself.,This boy who annoyed Laurie disagrees with herself.,syntax_semantics,binding,principle_A_c_command,True,True,False,False,221,-65.44479370117188,-66.55966186523438,1
The pedestrians that exit this museum weren't fleeing from themselves.,The pedestrians that exit this museum weren't fleeing from itself.,syntax_semantics,binding,principle_A_c_command,True,True,False,False,222,-82.10601806640625,-83.06913757324219,1
Those pedestrians who had examined this play hadn't watched themselves.,Those pedestrians who had examined this play hadn't watched itself.,syntax_semantics,binding,principle_A_c_command,True,True,False,False,223,-78.19284057617188,-80.57361602783203,1
A lady who isn't bringing the shawls returns to herself.,A lady who isn't bringing the shawls returns to themselves.,syntax_semantics,binding,principle_A_c_command,True,True,False,False,224,-86.48722839355469,-85.04966735839844,0
Actresses who haven't biked to every movie theater aren't hugging themselves.,Actresses who haven't biked to every movie theater aren't hugging itself.,syntax_semantics,binding,principle_A_c_command,True,True,False,False,225,-114.57145690917969,-117.79960632324219,1
Many chairs that shock Heidi haven't stunned themselves.,Many chairs that shock Heidi haven't stunned herself.,syntax_semantics,binding,principle_A_c_command,True,True,False,False,226,-70.40270233154297,-73.90977478027344,1
A scarf that has embarrassed Carolyn wasn't disgusting itself.,A scarf that has embarrassed Carolyn wasn't disgusting herself.,syntax_semantics,binding,principle_A_c_command,True,True,False,False,227,-86.2550048828125,-86.75396728515625,1
Many pedestrians that distracts Lisa investigated themselves.,Many pedestrians that distracts Lisa investigated herself.,syntax_semantics,binding,principle_A_c_command,True,True,False,False,228,-71.30240631103516,-73.52519226074219,1
Most waitresses who weren't concealing John have approached themselves.,Most waitresses who weren't concealing John have approached himself.,syntax_semantics,binding,principle_A_c_command,True,True,False,False,229,-104.8292007446289,-105.74606323242188,1
Dancers who hadn't concealed some hospital were discovering themselves.,Dancers who hadn't concealed some hospital were discovering itself.,syntax_semantics,binding,principle_A_c_command,True,True,False,False,230,-95.22576141357422,-97.5368881225586,1
Many museums that work with Mitchell couldn't help themselves.,Many museums that work with Mitchell couldn't help himself.,syntax_semantics,binding,principle_A_c_command,True,True,False,False,231,-60.179656982421875,-61.719390869140625,1
This museum that wasn't taking the mouths is talking to itself.,This museum that wasn't taking the mouths is talking to themselves.,syntax_semantics,binding,principle_A_c_command,True,True,False,False,232,-67.10182189941406,-63.70951843261719,0
Some guy that does help Laurie leaves himself.,Some guy that does help Laurie leaves herself.,syntax_semantics,binding,principle_A_c_command,True,True,False,False,233,-55.9295654296875,-57.03041458129883,1
Children that aren't irritating David might flee from themselves.,Children that aren't irritating David might flee from himself.,syntax_semantics,binding,principle_A_c_command,True,True,False,False,234,-63.53387451171875,-63.969627380371094,1
That actress that won't discover that plate watches herself.,That actress that won't discover that plate watches itself.,syntax_semantics,binding,principle_A_c_command,True,True,False,False,235,-68.99552154541016,-68.24226379394531,0
A lot of associations that will remember Ruth do work with themselves.,A lot of associations that will remember Ruth do work with herself.,syntax_semantics,binding,principle_A_c_command,True,True,False,False,236,-83.83190155029297,-85.31022644042969,1
The doors that haven't scared Amy wouldn't distract themselves.,The doors that haven't scared Amy wouldn't distract herself.,syntax_semantics,binding,principle_A_c_command,True,True,False,False,237,-68.01272583007812,-70.95769500732422,1
This company that wasn't talking to Heather talks about itself.,This company that wasn't talking to Heather talks about herself.,syntax_semantics,binding,principle_A_c_command,True,True,False,False,238,-62.05886459350586,-61.89918899536133,0
That dancer who thinks about a car isn't hugging herself.,That dancer who thinks about a car isn't hugging itself.,syntax_semantics,binding,principle_A_c_command,True,True,False,False,239,-69.93315124511719,-72.00799560546875,1
These glasses that disturbed Bradley can't aggravate themselves.,These glasses that disturbed Bradley can't aggravate himself.,syntax_semantics,binding,principle_A_c_command,True,True,False,False,240,-69.34335327148438,-71.96015167236328,1
These guys who disturb Sarah criticized themselves.,These guys who disturb Sarah criticized herself.,syntax_semantics,binding,principle_A_c_command,True,True,False,False,241,-51.65196228027344,-53.7177619934082,1
Most waiters that were disagreeing with Omar hadn't respected themselves.,Most waiters that were disagreeing with Omar hadn't respected himself.,syntax_semantics,binding,principle_A_c_command,True,True,False,False,242,-100.15975952148438,-102.8505859375,1
Teachers who brought that car wouldn't disagree with themselves.,Teachers who brought that car wouldn't disagree with itself.,syntax_semantics,binding,principle_A_c_command,True,True,False,False,243,-59.81562042236328,-62.52909851074219,1
All mushrooms that hurt William disgusted themselves.,All mushrooms that hurt William disgusted himself.,syntax_semantics,binding,principle_A_c_command,True,True,False,False,244,-61.68553924560547,-61.942710876464844,1
This mountain that would distract Heidi can stun itself.,This mountain that would distract Heidi can stun herself.,syntax_semantics,binding,principle_A_c_command,True,True,False,False,245,-74.19927215576172,-75.02982330322266,1
Most women who didn't disturb Stacey are investigating themselves.,Most women who didn't disturb Stacey are investigating herself.,syntax_semantics,binding,principle_A_c_command,True,True,False,False,246,-71.20660400390625,-74.47077941894531,1
Some girl who hasn't climbed up the hill wasn't watching herself.,Some girl who hasn't climbed up the hill wasn't watching itself.,syntax_semantics,binding,principle_A_c_command,True,True,False,False,247,-71.24720764160156,-72.0533447265625,1
Some waitress that hadn't cured Daniel flees from herself.,Some waitress that hadn't cured Daniel flees from himself.,syntax_semantics,binding,principle_A_c_command,True,True,False,False,248,-84.07877349853516,-82.96456909179688,0
Many committees that haven't sold this bicycle do talk to themselves.,Many committees that haven't sold this bicycle do talk to itself.,syntax_semantics,binding,principle_A_c_command,True,True,False,False,249,-74.37429809570312,-77.27349853515625,1
Those teenagers that didn't climb up a slope weren't disgusting themselves.,Those teenagers that didn't climb up a slope weren't disgusting itself.,syntax_semantics,binding,principle_A_c_command,True,True,False,False,250,-80.41612243652344,-81.73359680175781,1
A guy who scares some committees healed himself.,A guy who scares some committees healed themselves.,syntax_semantics,binding,principle_A_c_command,True,True,False,False,251,-71.22984313964844,-70.72256469726562,0
A lot of movie theaters that had bored Phillip aggravated themselves.,A lot of movie theaters that had bored Phillip aggravated himself.,syntax_semantics,binding,principle_A_c_command,True,True,False,False,252,-99.07804107666016,-99.80510711669922,1
Most girls that listen to Christopher have visited themselves.,Most girls that listen to Christopher have visited himself.,syntax_semantics,binding,principle_A_c_command,True,True,False,False,253,-58.78544235229492,-59.980491638183594,1
Some museums that shouldn't know George hadn't talked to themselves.,Some museums that shouldn't know George hadn't talked to himself.,syntax_semantics,binding,principle_A_c_command,True,True,False,False,254,-64.04093933105469,-64.24284362792969,1
Some dancer who had dropped by a lot of movie theaters isn't working with herself.,Some dancer who had dropped by a lot of movie theaters isn't working with themselves.,syntax_semantics,binding,principle_A_c_command,True,True,False,False,255,-92.12376403808594,-89.97746276855469,0
That boy who had hated Paula attacks himself.,That boy who had hated Paula attacks herself.,syntax_semantics,binding,principle_A_c_command,True,True,False,False,256,-61.80934524536133,-62.514930725097656,1
Every high school that annoys Emily does impress itself.,Every high school that annoys Emily does impress herself.,syntax_semantics,binding,principle_A_c_command,True,True,False,False,257,-76.65739440917969,-76.88319396972656,1
Some bank that knows Patrick helps itself.,Some bank that knows Patrick helps himself.,syntax_semantics,binding,principle_A_c_command,True,True,False,False,258,-54.402549743652344,-53.166282653808594,0
Some students who walk through the library were curing themselves.,Some students who walk through the library were curing itself.,syntax_semantics,binding,principle_A_c_command,True,True,False,False,259,-60.29908752441406,-62.53516387939453,1
The wheelbarrows that should bore Sonia irritated themselves.,The wheelbarrows that should bore Sonia irritated herself.,syntax_semantics,binding,principle_A_c_command,True,True,False,False,260,-91.3011474609375,-94.3648452758789,1
The plates that have irritated Victoria were alarming themselves.,The plates that have irritated Victoria were alarming herself.,syntax_semantics,binding,principle_A_c_command,True,True,False,False,261,-72.28726196289062,-74.65505981445312,1
Some picture that had hurt Elizabeth upset itself.,Some picture that had hurt Elizabeth upset herself.,syntax_semantics,binding,principle_A_c_command,True,True,False,False,262,-62.881587982177734,-62.416812896728516,0
This woman that had lifted some cats thought about herself.,This woman that had lifted some cats thought about themselves.,syntax_semantics,binding,principle_A_c_command,True,True,False,False,263,-67.25103759765625,-64.64404296875,0
A lot of cashiers who go to a mountain admired themselves.,A lot of cashiers who go to a mountain admired itself.,syntax_semantics,binding,principle_A_c_command,True,True,False,False,264,-85.7999267578125,-86.57776641845703,1
Patients who might impress Laurie haven't hired themselves.,Patients who might impress Laurie haven't hired herself.,syntax_semantics,binding,principle_A_c_command,True,True,False,False,265,-81.0600814819336,-83.70268249511719,1
All associations that aren't boring Peter weren't discussing themselves.,All associations that aren't boring Peter weren't discussing himself.,syntax_semantics,binding,principle_A_c_command,True,True,False,False,266,-75.25048828125,-76.64128875732422,1
All senators who could walk through this library hadn't cured themselves.,All senators who could walk through this library hadn't cured itself.,syntax_semantics,binding,principle_A_c_command,True,True,False,False,267,-84.4906005859375,-86.02433776855469,1
The association that doesn't embarrass Noah references itself.,The association that doesn't embarrass Noah references himself.,syntax_semantics,binding,principle_A_c_command,True,True,False,False,268,-66.41767883300781,-66.76106262207031,1
Some man that insults Kristin approached himself.,Some man that insults Kristin approached herself.,syntax_semantics,binding,principle_A_c_command,True,True,False,False,269,-68.35049438476562,-69.44049835205078,1
That actress who hurt a lot of women liked herself.,That actress who hurt a lot of women liked themselves.,syntax_semantics,binding,principle_A_c_command,True,True,False,False,270,-56.249900817871094,-53.22112274169922,0
Every organization that is boring Bill wouldn't fire itself.,Every organization that is boring Bill wouldn't fire himself.,syntax_semantics,binding,principle_A_c_command,True,True,False,False,271,-65.44097137451172,-63.21209716796875,0
The customers who could worry Sharon knew themselves.,The customers who could worry Sharon knew herself.,syntax_semantics,binding,principle_A_c_command,True,True,False,False,272,-59.839149475097656,-61.91815948486328,1
Some people who annoy William are watching themselves.,Some people who annoy William are watching himself.,syntax_semantics,binding,principle_A_c_command,True,True,False,False,273,-49.95209884643555,-51.29560852050781,1
All hospitals that scared Kirsten will reference themselves.,All hospitals that scared Kirsten will reference herself.,syntax_semantics,binding,principle_A_c_command,True,True,False,False,274,-70.88650512695312,-74.53155517578125,1
That boy that hated Pamela cares for himself.,That boy that hated Pamela cares for herself.,syntax_semantics,binding,principle_A_c_command,True,True,False,False,275,-64.516357421875,-65.62739562988281,1
Every school that couldn't know Stacy describes itself.,Every school that couldn't know Stacy describes herself.,syntax_semantics,binding,principle_A_c_command,True,True,False,False,276,-59.3868408203125,-59.87651062011719,1
All waitresses who weren't hurting Jason might discover themselves.,All waitresses who weren't hurting Jason might discover himself.,syntax_semantics,binding,principle_A_c_command,True,True,False,False,277,-91.27232360839844,-91.45482635498047,1
Most customers who are impressing Laurie have found themselves.,Most customers who are impressing Laurie have found herself.,syntax_semantics,binding,principle_A_c_command,True,True,False,False,278,-72.31912231445312,-74.45599365234375,1
Some cars that embarrassed this boy aren't scaring themselves.,Some cars that embarrassed this boy aren't scaring himself.,syntax_semantics,binding,principle_A_c_command,True,True,False,False,279,-66.0037841796875,-67.24858093261719,1
Some carriage that isn't annoying Cheryl bored itself.,Some carriage that isn't annoying Cheryl bored herself.,syntax_semantics,binding,principle_A_c_command,True,True,False,False,280,-76.50353240966797,-77.15239715576172,1
Some cats that resemble that painting had impressed themselves.,Some cats that resemble that painting had impressed itself.,syntax_semantics,binding,principle_A_c_command,True,True,False,False,281,-61.55900573730469,-65.3631591796875,1
A lot of icicles that can confuse Alice haven't impressed themselves.,A lot of icicles that can confuse Alice haven't impressed herself.,syntax_semantics,binding,principle_A_c_command,True,True,False,False,282,-96.789306640625,-100.09457397460938,1
The lady who has impressed Homer had discussed herself.,The lady who has impressed Homer had discussed himself.,syntax_semantics,binding,principle_A_c_command,True,True,False,False,283,-63.387943267822266,-61.806549072265625,0
All cashiers that had driven to the library hugged themselves.,All cashiers that had driven to the library hugged itself.,syntax_semantics,binding,principle_A_c_command,True,True,False,False,284,-78.22650909423828,-80.95600128173828,1
Some shawl that bored Mitchell is impressing itself.,Some shawl that bored Mitchell is impressing himself.,syntax_semantics,binding,principle_A_c_command,True,True,False,False,285,-89.47665405273438,-89.05630493164062,0
A lot of waiters who have broken a window might visit themselves.,A lot of waiters who have broken a window might visit itself.,syntax_semantics,binding,principle_A_c_command,True,True,False,False,286,-92.59648132324219,-96.21855163574219,1
These cakes that don't aggravate Ruth do scare themselves.,These cakes that don't aggravate Ruth do scare herself.,syntax_semantics,binding,principle_A_c_command,True,True,False,False,287,-72.14134216308594,-75.5802001953125,1
Pedestrians who hadn't loved Brian cured themselves.,Pedestrians who hadn't loved Brian cured himself.,syntax_semantics,binding,principle_A_c_command,True,True,False,False,288,-70.7137680053711,-70.93302917480469,1
Some doctors that aren't describing Thomas revealed themselves.,Some doctors that aren't describing Thomas revealed himself.,syntax_semantics,binding,principle_A_c_command,True,True,False,False,289,-60.393272399902344,-62.59336471557617,1
A lot of actors who haven't fired Theodore haven't respected themselves.,A lot of actors who haven't fired Theodore haven't respected himself.,syntax_semantics,binding,principle_A_c_command,True,True,False,False,290,-92.10054016113281,-93.87821960449219,1
Some drivers that hated Nicole knew themselves.,Some drivers that hated Nicole knew herself.,syntax_semantics,binding,principle_A_c_command,True,True,False,False,291,-57.869991302490234,-61.145355224609375,1
This waitress that drove to every river had hurt herself.,This waitress that drove to every river had hurt itself.,syntax_semantics,binding,principle_A_c_command,True,True,False,False,292,-74.53523254394531,-75.17434692382812,1
All committees that can't boast about Wayne don't irritate themselves.,All committees that can't boast about Wayne don't irritate himself.,syntax_semantics,binding,principle_A_c_command,True,True,False,False,293,-85.63302612304688,-87.39549255371094,1
Some man who had bought every fork referenced himself.,Some man who had bought every fork referenced itself.,syntax_semantics,binding,principle_A_c_command,True,True,False,False,294,-67.54533386230469,-69.0177993774414,1
An organization that could bore Tiffany helps itself.,An organization that could bore Tiffany helps herself.,syntax_semantics,binding,principle_A_c_command,True,True,False,False,295,-65.60143280029297,-66.81095123291016,1
The waitresses that concealed Karla disliked themselves.,The waitresses that concealed Karla disliked herself.,syntax_semantics,binding,principle_A_c_command,True,True,False,False,296,-87.58526611328125,-89.39900207519531,1
These guests that do notice Derek aren't boasting about themselves.,These guests that do notice Derek aren't boasting about himself.,syntax_semantics,binding,principle_A_c_command,True,True,False,False,297,-78.53445434570312,-80.97091674804688,1
Every museum that helped a man could hate itself.,Every museum that helped a man could hate himself.,syntax_semantics,binding,principle_A_c_command,True,True,False,False,298,-55.310401916503906,-52.797576904296875,0
A waitress that is messing up many glasses helped herself.,A waitress that is messing up many glasses helped themselves.,syntax_semantics,binding,principle_A_c_command,True,True,False,False,299,-85.68812561035156,-81.16363525390625,0
A commentary that was irritating these legislatures disagrees with itself.,A commentary that was irritating these legislatures disagrees with themselves.,syntax_semantics,binding,principle_A_c_command,True,True,False,False,300,-98.06085205078125,-95.24993133544922,0
The dancer who stunned Russell approached herself.,The dancer who stunned Russell approached himself.,syntax_semantics,binding,principle_A_c_command,True,True,False,False,301,-62.716426849365234,-61.06635284423828,0
A museum that has astounded Eva didn't hate itself.,A museum that has astounded Eva didn't hate herself.,syntax_semantics,binding,principle_A_c_command,True,True,False,False,302,-89.1214828491211,-89.4005126953125,1
The senators that had hugged Deanna cured themselves.,The senators that had hugged Deanna cured herself.,syntax_semantics,binding,principle_A_c_command,True,True,False,False,303,-81.44728088378906,-83.88764190673828,1
These banks that appreciated Derek referenced themselves.,These banks that appreciated Derek referenced himself.,syntax_semantics,binding,principle_A_c_command,True,True,False,False,304,-57.84730911254883,-60.975276947021484,1
All teachers who won't take some movie theater wouldn't complain about themselves.,All teachers who won't take some movie theater wouldn't complain about itself.,syntax_semantics,binding,principle_A_c_command,True,True,False,False,305,-77.00946044921875,-79.05157470703125,1
This rug that hadn't stunned the doctors embarrassed itself.,This rug that hadn't stunned the doctors embarrassed themselves.,syntax_semantics,binding,principle_A_c_command,True,True,False,False,306,-69.71464538574219,-68.0546875,0
Every library that was distracting Carol describes itself.,Every library that was distracting Carol describes herself.,syntax_semantics,binding,principle_A_c_command,True,True,False,False,307,-61.798587799072266,-62.13028335571289,1
The girls that stun Lucille would conceal themselves.,The girls that stun Lucille would conceal herself.,syntax_semantics,binding,principle_A_c_command,True,True,False,False,308,-70.69310760498047,-74.48500061035156,1
All teachers that scare some waitress noticed themselves.,All teachers that scare some waitress noticed herself.,syntax_semantics,binding,principle_A_c_command,True,True,False,False,309,-63.164527893066406,-67.11640930175781,1
All guests who could reveal Gerald haven't observed themselves.,All guests who could reveal Gerald haven't observed himself.,syntax_semantics,binding,principle_A_c_command,True,True,False,False,310,-72.42189025878906,-72.60928344726562,1
Some casserole that resembled the photographs can't disgust itself.,Some casserole that resembled the photographs can't disgust themselves.,syntax_semantics,binding,principle_A_c_command,True,True,False,False,311,-94.2440414428711,-93.7332534790039,0
Every school that hasn't confused Carrie helped itself.,Every school that hasn't confused Carrie helped herself.,syntax_semantics,binding,principle_A_c_command,True,True,False,False,312,-62.07219696044922,-61.71375274658203,0
Every girl who toured some hill loves herself.,Every girl who toured some hill loves itself.,syntax_semantics,binding,principle_A_c_command,True,True,False,False,313,-61.04345703125,-62.687705993652344,1
All pedestrians that do embarrass Christine weren't revealing themselves.,All pedestrians that do embarrass Christine weren't revealing herself.,syntax_semantics,binding,principle_A_c_command,True,True,False,False,314,-77.61398315429688,-80.78197479248047,1
Some bicycle that looks like most sketches worried itself.,Some bicycle that looks like most sketches worried themselves.,syntax_semantics,binding,principle_A_c_command,True,True,False,False,315,-67.61305236816406,-66.88092041015625,0
Those actresses that were curing this dancer are escaping from themselves.,Those actresses that were curing this dancer are escaping from herself.,syntax_semantics,binding,principle_A_c_command,True,True,False,False,316,-75.49331665039062,-77.96990966796875,1
A guy who shouldn't forget all waitresses wasn't approaching himself.,A guy who shouldn't forget all waitresses wasn't approaching themselves.,syntax_semantics,binding,principle_A_c_command,True,True,False,False,317,-97.20502471923828,-97.3175048828125,1
Some committee that hasn't remembered Kimberley isn't criticizing itself.,Some committee that hasn't remembered Kimberley isn't criticizing herself.,syntax_semantics,binding,principle_A_c_command,True,True,False,False,318,-92.0289535522461,-92.66569519042969,1
Every waitress that exits a cafe escapes from herself.,Every waitress that exits a cafe escapes from itself.,syntax_semantics,binding,principle_A_c_command,True,True,False,False,319,-73.10385131835938,-71.76611328125,0
A lot of legislatures that would reference that man have hired themselves.,A lot of legislatures that would reference that man have hired himself.,syntax_semantics,binding,principle_A_c_command,True,True,False,False,320,-88.40967559814453,-88.6009521484375,1
Most jackets that bothered Carlos had disgusted themselves.,Most jackets that bothered Carlos had disgusted himself.,syntax_semantics,binding,principle_A_c_command,True,True,False,False,321,-77.60145568847656,-79.50264739990234,1
Most waiters that see Daniel have forgotten themselves.,Most waiters that see Daniel have forgotten himself.,syntax_semantics,binding,principle_A_c_command,True,True,False,False,322,-69.99159240722656,-71.50148010253906,1
The dancer that embarrassed this committee thinks about herself.,The dancer that embarrassed this committee thinks about itself.,syntax_semantics,binding,principle_A_c_command,True,True,False,False,323,-70.8001937866211,-70.58787536621094,0
A dancer that researched this art gallery fled from herself.,A dancer that researched this art gallery fled from itself.,syntax_semantics,binding,principle_A_c_command,True,True,False,False,324,-94.33572387695312,-93.47177124023438,0
The men who bother Carlos haven't hired themselves.,The men who bother Carlos haven't hired himself.,syntax_semantics,binding,principle_A_c_command,True,True,False,False,325,-58.464630126953125,-60.0499267578125,1
Every actress who has bored a lot of teachers hasn't boasted about herself.,Every actress who has bored a lot of teachers hasn't boasted about themselves.,syntax_semantics,binding,principle_A_c_command,True,True,False,False,326,-86.45917510986328,-83.65161895751953,0
These people who hired Wayne don't complain about themselves.,These people who hired Wayne don't complain about himself.,syntax_semantics,binding,principle_A_c_command,True,True,False,False,327,-53.339229583740234,-55.47811508178711,1
