sentence_good,sentence_bad,field,linguistics_term,UID,simple_LM_method,one_prefix_method,two_prefix_method,lexically_identical,pair_id,good_prob,bad_prob,correct
This banana isn't tough to lift.,This banana isn't soon to lift.,syntax_semantics,control_raising,tough_vs_raising_1,True,False,False,False,526,-41.58345413208008,-47.800315856933594,1
Holly's cousin was easy to return to.,Holly's cousin was apt to return to.,syntax_semantics,control_raising,tough_vs_raising_1,True,False,False,False,527,-53.00275421142578,-58.27613067626953,1
Some mountain is easy to drive to.,Some mountain is certain to drive to.,syntax_semantics,control_raising,tough_vs_raising_1,True,False,False,False,528,-35.84892654418945,-43.379268646240234,1
The restaurants are fun to go to.,The restaurants are soon to go to.,syntax_semantics,control_raising,tough_vs_raising_1,True,False,False,False,529,-33.961483001708984,-36.52357864379883,1
The pamphlet was irritating to lift.,The pamphlet was about to lift.,syntax_semantics,control_raising,tough_vs_raising_1,True,False,False,False,530,-44.479427337646484,-39.26079559326172,0
Becky wasn't ready to talk about.,Becky wasn't unlikely to talk about.,syntax_semantics,control_raising,tough_vs_raising_1,True,False,False,False,531,-27.156625747680664,-36.26971435546875,1
Cindy was fun to complain about.,Cindy was about to complain about.,syntax_semantics,control_raising,tough_vs_raising_1,True,False,False,False,532,-49.44708251953125,-48.388153076171875,0
Karen wasn't pleasant to reveal.,Karen wasn't about to reveal.,syntax_semantics,control_raising,tough_vs_raising_1,True,False,False,False,533,-49.80989074707031,-45.595767974853516,0
Kristin isn't unpleasant to return to.,Kristin isn't unlikely to return to.,syntax_semantics,control_raising,tough_vs_raising_1,True,False,False,False,534,-45.514068603515625,-45.463844299316406,0
Travis's ex-boyfriend wasn't enjoyable to complain about.,Travis's ex-boyfriend wasn't soon to complain about.,syntax_semantics,control_raising,tough_vs_raising_1,True,False,False,False,535,-95.993896484375,-93.029052734375,0
This customer wasn't easy to respect.,This customer wasn't bound to respect.,syntax_semantics,control_raising,tough_vs_raising_1,True,False,False,False,536,-37.52179718017578,-40.47607421875,1
Allison isn't easy to respect.,Allison isn't apt to respect.,syntax_semantics,control_raising,tough_vs_raising_1,True,False,False,False,537,-39.17103576660156,-45.22052001953125,1
Bethany isn't tough to reference.,Bethany isn't likely to reference.,syntax_semantics,control_raising,tough_vs_raising_1,True,False,False,False,538,-62.95740509033203,-65.20146179199219,1
Many pamphlets about the Clintons were exciting to examine.,Many pamphlets about the Clintons were about to examine.,syntax_semantics,control_raising,tough_vs_raising_1,True,False,False,False,539,-80.199951171875,-75.34724426269531,0
Some libraries are hard to walk through.,Some libraries are unlikely to walk through.,syntax_semantics,control_raising,tough_vs_raising_1,True,False,False,False,540,-38.30686569213867,-45.51013946533203,1
Glasses are boring to wear.,Glasses are about to wear.,syntax_semantics,control_raising,tough_vs_raising_1,True,False,False,False,541,-38.00408935546875,-35.916404724121094,0
Erin's guests aren't ready to respect.,Erin's guests aren't likely to respect.,syntax_semantics,control_raising,tough_vs_raising_1,True,False,False,False,542,-50.72758483886719,-53.11055374145508,1
A lot of grocery stores are easy to go to.,A lot of grocery stores are unlikely to go to.,syntax_semantics,control_raising,tough_vs_raising_1,True,False,False,False,543,-55.634559631347656,-62.343231201171875,1
Vanessa isn't hard to flee from.,Vanessa isn't soon to flee from.,syntax_semantics,control_raising,tough_vs_raising_1,True,False,False,False,544,-44.89265060424805,-52.72489929199219,1
That dress isn't irritating to wear.,That dress isn't bound to wear.,syntax_semantics,control_raising,tough_vs_raising_1,True,False,False,False,545,-44.062042236328125,-40.87905502319336,0
Lisa's mentee wasn't easy to cure.,Lisa's mentee wasn't unlikely to cure.,syntax_semantics,control_raising,tough_vs_raising_1,True,False,False,False,546,-55.28982925415039,-62.56869125366211,1
All pamphlets about science are hard work to talk about.,All pamphlets about science are about to talk about.,syntax_semantics,control_raising,tough_vs_raising_1,True,False,False,False,547,-68.06285095214844,-63.14414978027344,0
Becca is hard work to flee from.,Becca is bound to flee from.,syntax_semantics,control_raising,tough_vs_raising_1,True,False,False,False,548,-47.542503356933594,-42.10401153564453,0
Some girls weren't easy to work with.,Some girls weren't certain to work with.,syntax_semantics,control_raising,tough_vs_raising_1,True,False,False,False,549,-38.22425079345703,-42.763771057128906,1
A newspaper article about the Clintons was boring to reveal.,A newspaper article about the Clintons was certain to reveal.,syntax_semantics,control_raising,tough_vs_raising_1,True,False,False,False,550,-82.17921447753906,-81.46078491210938,0
Lucille's granddaughters are difficult to argue about.,Lucille's granddaughters are bound to argue about.,syntax_semantics,control_raising,tough_vs_raising_1,True,False,False,False,551,-65.03646850585938,-66.27462768554688,1
Vanessa was interesting to respect.,Vanessa was likely to respect.,syntax_semantics,control_raising,tough_vs_raising_1,True,False,False,False,552,-35.88019561767578,-34.73540115356445,0
Carl wasn't interesting to conceal.,Carl wasn't unlikely to conceal.,syntax_semantics,control_raising,tough_vs_raising_1,True,False,False,False,553,-37.35607147216797,-41.233089447021484,1
Some grandson of Natalie wasn't boring to examine.,Some grandson of Natalie wasn't sure to examine.,syntax_semantics,control_raising,tough_vs_raising_1,True,False,False,False,554,-61.818504333496094,-59.128456115722656,0
The pedestrian isn't hard to care for.,The pedestrian isn't about to care for.,syntax_semantics,control_raising,tough_vs_raising_1,True,False,False,False,555,-41.72295379638672,-46.20353317260742,1
Some banks were annoying to walk through.,Some banks were certain to walk through.,syntax_semantics,control_raising,tough_vs_raising_1,True,False,False,False,556,-44.28752517700195,-43.132667541503906,0
This school isn't exciting to go to.,This school isn't certain to go to.,syntax_semantics,control_raising,tough_vs_raising_1,True,False,False,False,557,-37.01569366455078,-40.16552734375,1
Jessica is enjoyable to scare.,Jessica is certain to scare.,syntax_semantics,control_raising,tough_vs_raising_1,True,False,False,False,558,-34.252532958984375,-31.6175479888916,0
These offspring are hard work to talk about.,These offspring are certain to talk about.,syntax_semantics,control_raising,tough_vs_raising_1,True,False,False,False,559,-37.892791748046875,-36.625396728515625,0
Dawn was boring to flee from.,Dawn was certain to flee from.,syntax_semantics,control_raising,tough_vs_raising_1,True,False,False,False,560,-55.90758514404297,-58.944679260253906,1
Todd's brothers were annoying to return to.,Todd's brothers were likely to return to.,syntax_semantics,control_raising,tough_vs_raising_1,True,False,False,False,561,-45.747520446777344,-38.88249969482422,0
Grace wasn't tough to cure.,Grace wasn't sure to cure.,syntax_semantics,control_raising,tough_vs_raising_1,True,False,False,False,562,-43.576602935791016,-43.35319519042969,0
Bradley's husband wasn't irritating to examine.,Bradley's husband wasn't sure to examine.,syntax_semantics,control_raising,tough_vs_raising_1,True,False,False,False,563,-50.52814483642578,-44.78565216064453,0
Most waiters aren't easy to fire.,Most waiters aren't soon to fire.,syntax_semantics,control_raising,tough_vs_raising_1,True,False,False,False,564,-47.927337646484375,-53.574703216552734,1
The restaurant isn't annoying to escape from.,The restaurant isn't unlikely to escape from.,syntax_semantics,control_raising,tough_vs_raising_1,True,False,False,False,565,-50.82237243652344,-50.39976501464844,0
Marie's mothers are difficult to disagree with.,Marie's mothers are apt to disagree with.,syntax_semantics,control_raising,tough_vs_raising_1,True,False,False,False,566,-40.53715896606445,-45.414241790771484,1
Sheila isn't annoying to flee from.,Sheila isn't unlikely to flee from.,syntax_semantics,control_raising,tough_vs_raising_1,True,False,False,False,567,-53.79418182373047,-54.45579147338867,1
These waitresses are hard work to boast about.,These waitresses are soon to boast about.,syntax_semantics,control_raising,tough_vs_raising_1,True,False,False,False,568,-68.40199279785156,-66.35400390625,0
Those lakes are ready to go to.,Those lakes are about to go to.,syntax_semantics,control_raising,tough_vs_raising_1,True,False,False,False,569,-26.213010787963867,-31.42673110961914,1
A lot of ladies' plumbers were hard work to flee from.,A lot of ladies' plumbers were unlikely to flee from.,syntax_semantics,control_raising,tough_vs_raising_1,True,False,False,False,570,-95.5377197265625,-92.42015075683594,0
Kendra isn't enjoyable to care for.,Kendra isn't likely to care for.,syntax_semantics,control_raising,tough_vs_raising_1,True,False,False,False,571,-58.619422912597656,-53.10163879394531,0
All senators' handyman is fun to examine.,All senators' handyman is about to examine.,syntax_semantics,control_raising,tough_vs_raising_1,True,False,False,False,572,-73.18155670166016,-70.0628662109375,0
Charles is hard work to complain about.,Charles is about to complain about.,syntax_semantics,control_raising,tough_vs_raising_1,True,False,False,False,573,-38.540802001953125,-29.239612579345703,0
A lot of sweaters are hard work to wear.,A lot of sweaters are soon to wear.,syntax_semantics,control_raising,tough_vs_raising_1,True,False,False,False,574,-62.58628845214844,-61.78432083129883,0
Sonia isn't ready to listen to.,Sonia isn't sure to listen to.,syntax_semantics,control_raising,tough_vs_raising_1,True,False,False,False,575,-40.751705169677734,-45.228275299072266,1
Elaine's daughters aren't boring to examine.,Elaine's daughters aren't soon to examine.,syntax_semantics,control_raising,tough_vs_raising_1,True,False,False,False,576,-57.806514739990234,-59.52084732055664,1
Benjamin wasn't unpleasant to respect.,Benjamin wasn't about to respect.,syntax_semantics,control_raising,tough_vs_raising_1,True,False,False,False,577,-46.106056213378906,-41.125953674316406,0
Ella is hard work to complain about.,Ella is sure to complain about.,syntax_semantics,control_raising,tough_vs_raising_1,True,False,False,False,578,-47.88549041748047,-41.98239517211914,0
Those cafes weren't tough to go to.,Those cafes weren't sure to go to.,syntax_semantics,control_raising,tough_vs_raising_1,True,False,False,False,579,-43.448699951171875,-43.902732849121094,1
Some mountain wasn't hard work to flee from.,Some mountain wasn't sure to flee from.,syntax_semantics,control_raising,tough_vs_raising_1,True,False,False,False,580,-58.11962127685547,-53.3826904296875,0
Phillip's teachers were easy to fire.,Phillip's teachers were unlikely to fire.,syntax_semantics,control_raising,tough_vs_raising_1,True,False,False,False,581,-46.328311920166016,-50.321533203125,1
Edward wasn't hard work to listen to.,Edward wasn't likely to listen to.,syntax_semantics,control_raising,tough_vs_raising_1,True,False,False,False,582,-35.17354202270508,-29.2047119140625,0
That pamphlet about art wasn't unpleasant to disagree with.,That pamphlet about art wasn't bound to disagree with.,syntax_semantics,control_raising,tough_vs_raising_1,True,False,False,False,583,-71.06373596191406,-67.74322509765625,0
Douglas was tough to flee from.,Douglas was likely to flee from.,syntax_semantics,control_raising,tough_vs_raising_1,True,False,False,False,584,-45.92652130126953,-47.571510314941406,1
Curtis wasn't enjoyable to reveal.,Curtis wasn't sure to reveal.,syntax_semantics,control_raising,tough_vs_raising_1,True,False,False,False,585,-60.493019104003906,-55.92273712158203,0
Most restaurants are boring to drop by.,Most restaurants are sure to drop by.,syntax_semantics,control_raising,tough_vs_raising_1,True,False,False,False,586,-38.838157653808594,-38.458683013916016,0
Allison is fun to conceal.,Allison is apt to conceal.,syntax_semantics,control_raising,tough_vs_raising_1,True,False,False,False,587,-40.36606979370117,-42.395713806152344,1
Some man's granddaughters are unpleasant to care for.,Some man's granddaughters are soon to care for.,syntax_semantics,control_raising,tough_vs_raising_1,True,False,False,False,588,-68.75447082519531,-69.19963073730469,1
Stephanie's doctor wasn't interesting to disagree with.,Stephanie's doctor wasn't bound to disagree with.,syntax_semantics,control_raising,tough_vs_raising_1,True,False,False,False,589,-58.15656661987305,-57.88203811645508,0
Cats were pleasant to lift.,Cats were bound to lift.,syntax_semantics,control_raising,tough_vs_raising_1,True,False,False,False,590,-47.98476028442383,-43.354347229003906,0
Spain is hard to return to.,Spain is bound to return to.,syntax_semantics,control_raising,tough_vs_raising_1,True,False,False,False,591,-24.103530883789062,-27.946996688842773,1
The bank is hard work to go to.,The bank is apt to go to.,syntax_semantics,control_raising,tough_vs_raising_1,True,False,False,False,592,-36.388816833496094,-35.46641540527344,0
Joseph's tutor isn't difficult to fire.,Joseph's tutor isn't about to fire.,syntax_semantics,control_raising,tough_vs_raising_1,True,False,False,False,593,-45.96891784667969,-43.79981231689453,0
Jill was unpleasant to listen to.,Jill was likely to listen to.,syntax_semantics,control_raising,tough_vs_raising_1,True,False,False,False,594,-44.840572357177734,-38.86800765991211,0
Some drivers were annoying to conceal.,Some drivers were sure to conceal.,syntax_semantics,control_raising,tough_vs_raising_1,True,False,False,False,595,-44.68400192260742,-40.34160614013672,0
These mountains aren't irritating to drop by.,These mountains aren't soon to drop by.,syntax_semantics,control_raising,tough_vs_raising_1,True,False,False,False,596,-47.517578125,-47.54064178466797,1
The waitress wasn't hard work to cure.,The waitress wasn't unlikely to cure.,syntax_semantics,control_raising,tough_vs_raising_1,True,False,False,False,597,-50.17523956298828,-47.38270950317383,0
A woman's hairdresser wasn't easy to disagree with.,A woman's hairdresser wasn't sure to disagree with.,syntax_semantics,control_raising,tough_vs_raising_1,True,False,False,False,598,-75.08447265625,-79.22038269042969,1
Homer was interesting to fire.,Homer was unlikely to fire.,syntax_semantics,control_raising,tough_vs_raising_1,True,False,False,False,599,-38.923465728759766,-39.81999206542969,1
Sabrina wasn't enjoyable to boast about.,Sabrina wasn't apt to boast about.,syntax_semantics,control_raising,tough_vs_raising_1,True,False,False,False,600,-58.596405029296875,-56.03074645996094,0
Winston Churchill isn't tough to talk about.,Winston Churchill isn't bound to talk about.,syntax_semantics,control_raising,tough_vs_raising_1,True,False,False,False,601,-49.22508239746094,-48.72239303588867,0
Jacqueline isn't pleasant to scare.,Jacqueline isn't bound to scare.,syntax_semantics,control_raising,tough_vs_raising_1,True,False,False,False,602,-50.262386322021484,-46.91107940673828,0
Beverly wasn't irritating to talk about.,Beverly wasn't certain to talk about.,syntax_semantics,control_raising,tough_vs_raising_1,True,False,False,False,603,-56.52771759033203,-54.83607482910156,0
This grandfather of Danielle wasn't fun to argue about.,This grandfather of Danielle wasn't likely to argue about.,syntax_semantics,control_raising,tough_vs_raising_1,True,False,False,False,604,-66.6697998046875,-65.42204284667969,0
Some grandson of every person isn't hard to examine.,Some grandson of every person isn't soon to examine.,syntax_semantics,control_raising,tough_vs_raising_1,True,False,False,False,605,-55.303260803222656,-62.97423553466797,1
A person's mentees were irritating to conceal.,A person's mentees were sure to conceal.,syntax_semantics,control_raising,tough_vs_raising_1,True,False,False,False,606,-79.70008087158203,-76.70703887939453,0
Men weren't hard to talk about.,Men weren't bound to talk about.,syntax_semantics,control_raising,tough_vs_raising_1,True,False,False,False,607,-27.537918090820312,-30.359355926513672,1
Christina wasn't annoying to escape from.,Christina wasn't apt to escape from.,syntax_semantics,control_raising,tough_vs_raising_1,True,False,False,False,608,-50.17882537841797,-48.654998779296875,0
Heidi wasn't enjoyable to respect.,Heidi wasn't about to respect.,syntax_semantics,control_raising,tough_vs_raising_1,True,False,False,False,609,-52.29601287841797,-44.62633514404297,0
Some essay isn't tough to talk about.,Some essay isn't unlikely to talk about.,syntax_semantics,control_raising,tough_vs_raising_1,True,False,False,False,610,-43.21314239501953,-46.90729522705078,1
Laura wasn't ready to reveal.,Laura wasn't likely to reveal.,syntax_semantics,control_raising,tough_vs_raising_1,True,False,False,False,611,-30.02329444885254,-33.67365646362305,1
That man isn't ready to argue about.,That man isn't likely to argue about.,syntax_semantics,control_raising,tough_vs_raising_1,True,False,False,False,612,-38.27336120605469,-41.09539031982422,1
Most students' piano teacher was fun to listen to.,Most students' piano teacher was apt to listen to.,syntax_semantics,control_raising,tough_vs_raising_1,True,False,False,False,613,-62.00678253173828,-65.53189849853516,1
That movie theater isn't annoying to arrive at.,That movie theater isn't unlikely to arrive at.,syntax_semantics,control_raising,tough_vs_raising_1,True,False,False,False,614,-57.08375930786133,-56.88041305541992,0
Jodi is ready to reference.,Jodi is sure to reference.,syntax_semantics,control_raising,tough_vs_raising_1,True,False,False,False,615,-40.843414306640625,-44.21632766723633,1
Rose is boring to cure.,Rose is about to cure.,syntax_semantics,control_raising,tough_vs_raising_1,True,False,False,False,616,-28.758277893066406,-23.674970626831055,0
This essay about music isn't easy to boast about.,This essay about music isn't unlikely to boast about.,syntax_semantics,control_raising,tough_vs_raising_1,True,False,False,False,617,-64.8626480102539,-72.51785278320312,1
Emily's fathers are ready to reveal.,Emily's fathers are unlikely to reveal.,syntax_semantics,control_raising,tough_vs_raising_1,True,False,False,False,618,-37.586708068847656,-45.39488983154297,1
Keith's boss isn't pleasant to conceal.,Keith's boss isn't bound to conceal.,syntax_semantics,control_raising,tough_vs_raising_1,True,False,False,False,619,-49.954673767089844,-46.42459487915039,0
Ronald's ex-boyfriend is exciting to talk about.,Ronald's ex-boyfriend is apt to talk about.,syntax_semantics,control_raising,tough_vs_raising_1,True,False,False,False,620,-63.660919189453125,-65.7635269165039,1
This river wasn't enjoyable to arrive at.,This river wasn't about to arrive at.,syntax_semantics,control_raising,tough_vs_raising_1,True,False,False,False,621,-50.18504333496094,-42.681602478027344,0
Elaine was irritating to talk to.,Elaine was sure to talk to.,syntax_semantics,control_raising,tough_vs_raising_1,True,False,False,False,622,-43.238128662109375,-38.4583740234375,0
Debra is easy to reference.,Debra is unlikely to reference.,syntax_semantics,control_raising,tough_vs_raising_1,True,False,False,False,623,-33.93313980102539,-37.085262298583984,1
Andrea isn't interesting to conceal.,Andrea isn't likely to conceal.,syntax_semantics,control_raising,tough_vs_raising_1,True,False,False,False,624,-47.052284240722656,-45.9538459777832,0
Those people aren't exciting to talk to.,Those people aren't unlikely to talk to.,syntax_semantics,control_raising,tough_vs_raising_1,True,False,False,False,625,-31.733749389648438,-34.403385162353516,1
This river isn't fun to drop by.,This river isn't unlikely to drop by.,syntax_semantics,control_raising,tough_vs_raising_1,True,False,False,False,626,-43.125831604003906,-47.37396240234375,1
Bethany wasn't unpleasant to conceal.,Bethany wasn't soon to conceal.,syntax_semantics,control_raising,tough_vs_raising_1,True,False,False,False,627,-68.88470458984375,-69.09523010253906,1
Diana's doctors are enjoyable to complain about.,Diana's doctors are about to complain about.,syntax_semantics,control_raising,tough_vs_raising_1,True,False,False,False,628,-67.37796020507812,-60.857913970947266,0
A newspaper article about the Clintons wasn't unpleasant to examine.,A newspaper article about the Clintons wasn't bound to examine.,syntax_semantics,control_raising,tough_vs_raising_1,True,False,False,False,629,-87.70028686523438,-83.95767974853516,0
Some rice wasn't fun to lift.,Some rice wasn't apt to lift.,syntax_semantics,control_raising,tough_vs_raising_1,True,False,False,False,630,-42.011512756347656,-46.0616455078125,1
A means isn't fun to complain about.,A means isn't apt to complain about.,syntax_semantics,control_raising,tough_vs_raising_1,True,False,False,False,631,-54.43882751464844,-58.795799255371094,1
Mitchell was hard to boast about.,Mitchell was unlikely to boast about.,syntax_semantics,control_raising,tough_vs_raising_1,True,False,False,False,632,-49.44193649291992,-57.09703826904297,1
Essays about Galileo weren't fun to disagree with.,Essays about Galileo weren't about to disagree with.,syntax_semantics,control_raising,tough_vs_raising_1,True,False,False,False,633,-70.72960662841797,-70.56034088134766,0
Glasses were enjoyable to wear.,Glasses were about to wear.,syntax_semantics,control_raising,tough_vs_raising_1,True,False,False,False,634,-44.710357666015625,-38.18730545043945,0
Many lakes aren't unpleasant to drop by.,Many lakes aren't soon to drop by.,syntax_semantics,control_raising,tough_vs_raising_1,True,False,False,False,635,-49.412811279296875,-49.48724365234375,1
Martin was tough to listen to.,Martin was sure to listen to.,syntax_semantics,control_raising,tough_vs_raising_1,True,False,False,False,636,-24.01126480102539,-26.57892608642578,1
Elaine isn't hard work to escape from.,Elaine isn't apt to escape from.,syntax_semantics,control_raising,tough_vs_raising_1,True,False,False,False,637,-55.25217056274414,-50.98938751220703,0
Those rivers are tough to walk through.,Those rivers are soon to walk through.,syntax_semantics,control_raising,tough_vs_raising_1,True,False,False,False,638,-34.02107238769531,-38.662540435791016,1
Barbara wasn't interesting to fire.,Barbara wasn't certain to fire.,syntax_semantics,control_raising,tough_vs_raising_1,True,False,False,False,639,-37.22771453857422,-40.05792236328125,1
Randolf's daughter isn't boring to scare.,Randolf's daughter isn't sure to scare.,syntax_semantics,control_raising,tough_vs_raising_1,True,False,False,False,640,-53.15127944946289,-49.5084228515625,0
Many actors weren't irritating to talk to.,Many actors weren't certain to talk to.,syntax_semantics,control_raising,tough_vs_raising_1,True,False,False,False,641,-46.500858306884766,-44.06684875488281,0
The Impressionists are enjoyable to boast about.,The Impressionists are likely to boast about.,syntax_semantics,control_raising,tough_vs_raising_1,True,False,False,False,642,-69.7727279663086,-63.654541015625,0
Every restaurant isn't hard to bike to.,Every restaurant isn't soon to bike to.,syntax_semantics,control_raising,tough_vs_raising_1,True,False,False,False,643,-44.525848388671875,-53.43459701538086,1
That adult wasn't annoying to flee from.,That adult wasn't bound to flee from.,syntax_semantics,control_raising,tough_vs_raising_1,True,False,False,False,644,-57.08949279785156,-52.06058883666992,0
Most sisters of Rebecca weren't tough to work with.,Most sisters of Rebecca weren't bound to work with.,syntax_semantics,control_raising,tough_vs_raising_1,True,False,False,False,645,-61.89937973022461,-60.966880798339844,0
Walter was difficult to talk to.,Walter was soon to talk to.,syntax_semantics,control_raising,tough_vs_raising_1,True,False,False,False,646,-31.93381690979004,-35.54644012451172,1
That coat is difficult to wear.,That coat is bound to wear.,syntax_semantics,control_raising,tough_vs_raising_1,True,False,False,False,647,-32.785797119140625,-35.27885818481445,1
Many glaciers weren't ready to flee from.,Many glaciers weren't about to flee from.,syntax_semantics,control_raising,tough_vs_raising_1,True,False,False,False,648,-53.25490951538086,-57.19580841064453,1
Jane isn't enjoyable to conceal.,Jane isn't apt to conceal.,syntax_semantics,control_raising,tough_vs_raising_1,True,False,False,False,649,-41.101478576660156,-37.85304260253906,0
Colleen is annoying to talk about.,Colleen is likely to talk about.,syntax_semantics,control_raising,tough_vs_raising_1,True,False,False,False,650,-39.637107849121094,-33.69868469238281,0
Shirts weren't tough to wear.,Shirts weren't unlikely to wear.,syntax_semantics,control_raising,tough_vs_raising_1,True,False,False,False,651,-43.317161560058594,-47.77943420410156,1
All art galleries are annoying to respect.,All art galleries are certain to respect.,syntax_semantics,control_raising,tough_vs_raising_1,True,False,False,False,652,-47.361419677734375,-44.78194808959961,0
Elizabeth's bosses aren't interesting to fire.,Elizabeth's bosses aren't unlikely to fire.,syntax_semantics,control_raising,tough_vs_raising_1,True,False,False,False,653,-43.52201843261719,-46.53277587890625,1
Wendy is fun to flee from.,Wendy is about to flee from.,syntax_semantics,control_raising,tough_vs_raising_1,True,False,False,False,654,-54.85531997680664,-52.54909133911133,0
The mountains were hard to lift.,The mountains were soon to lift.,syntax_semantics,control_raising,tough_vs_raising_1,True,False,False,False,655,-32.36835861206055,-37.92253112792969,1
