sentence_good,sentence_bad,field,linguistics_term,UID,simple_LM_method,one_prefix_method,two_prefix_method,lexically_identical,pair_id,good_prob,bad_prob,correct
The adult was soon to fail to sing.,The adult was pleasant to fail to sing.,syntax_semantics,control_raising,tough_vs_raising_2,True,False,False,False,469,-46.94682693481445,-48.882728576660156,1
A woman isn't bound to fire Deborah.,A woman isn't boring to fire Deborah.,syntax_semantics,control_raising,tough_vs_raising_2,True,False,False,False,470,-61.93743896484375,-64.72742462158203,1
Every woman is sure to prefer Anna to admire this cafe.,Every woman is unpleasant to prefer Anna to admire this cafe.,syntax_semantics,control_raising,tough_vs_raising_2,True,False,False,False,471,-78.33743286132812,-84.1668472290039,1
Holly is soon to conceal these pedestrians.,Holly is easy to conceal these pedestrians.,syntax_semantics,control_raising,tough_vs_raising_2,True,False,False,False,472,-61.70384979248047,-56.31182861328125,0
Bradley wasn't likely to grin.,Bradley wasn't pleasant to grin.,syntax_semantics,control_raising,tough_vs_raising_2,True,False,False,False,473,-38.94207763671875,-41.612022399902344,1
Grandmothers of Stacy aren't certain to pressure David's bosses to sell the pepper.,Grandmothers of Stacy aren't fun to pressure David's bosses to sell the pepper.,syntax_semantics,control_raising,tough_vs_raising_2,True,False,False,False,474,-112.63288879394531,-110.2422103881836,0
Michelle's contractor isn't likely to discover April to cook.,Michelle's contractor isn't boring to discover April to cook.,syntax_semantics,control_raising,tough_vs_raising_2,True,False,False,False,475,-70.26295471191406,-74.77639770507812,1
Homer isn't sure to arrive at the movie theater.,Homer isn't fun to arrive at the movie theater.,syntax_semantics,control_raising,tough_vs_raising_2,True,False,False,False,476,-69.36773681640625,-68.71955108642578,0
The cousins of Anna weren't unlikely to say Steve is whispering.,The cousins of Anna weren't easy to say Steve is whispering.,syntax_semantics,control_raising,tough_vs_raising_2,True,False,False,False,477,-88.49125671386719,-81.29845428466797,0
Kendra is certain to help Douglas.,Kendra is boring to help Douglas.,syntax_semantics,control_raising,tough_vs_raising_2,True,False,False,False,478,-58.96522521972656,-55.34318542480469,0
Tiffany wasn't bound to appreciate these documentaries.,Tiffany wasn't unpleasant to appreciate these documentaries.,syntax_semantics,control_raising,tough_vs_raising_2,True,False,False,False,479,-73.52084350585938,-77.38084411621094,1
Carol is unlikely to chuckle.,Carol is fun to chuckle.,syntax_semantics,control_raising,tough_vs_raising_2,True,False,False,False,480,-42.55263900756836,-38.51570129394531,0
Some children's ex-wife was apt to escape.,Some children's ex-wife was boring to escape.,syntax_semantics,control_raising,tough_vs_raising_2,True,False,False,False,481,-56.377079010009766,-56.16352844238281,0
Meredith is soon to prod Aaron to exercise.,Meredith is boring to prod Aaron to exercise.,syntax_semantics,control_raising,tough_vs_raising_2,True,False,False,False,482,-75.25404357910156,-73.215087890625,0
Marcus isn't soon to respect Wendy.,Marcus isn't hard work to respect Wendy.,syntax_semantics,control_raising,tough_vs_raising_2,True,False,False,False,483,-51.66403579711914,-52.55328369140625,1
Liam is sure to spur the Clintons to help Connie.,Liam is easy to spur the Clintons to help Connie.,syntax_semantics,control_raising,tough_vs_raising_2,True,False,False,False,484,-83.40459442138672,-80.83560180664062,0
Beth was about to scream.,Beth was difficult to scream.,syntax_semantics,control_raising,tough_vs_raising_2,True,False,False,False,485,-50.29566192626953,-52.758018493652344,1
Chad wasn't unlikely to find Nicole to train.,Chad wasn't hard to find Nicole to train.,syntax_semantics,control_raising,tough_vs_raising_2,True,False,False,False,486,-67.15322875976562,-58.26644515991211,0
Fathers of Nicole are likely to respond.,Fathers of Nicole are boring to respond.,syntax_semantics,control_raising,tough_vs_raising_2,True,False,False,False,487,-53.79481506347656,-57.948402404785156,1
Every dancer was about to see the eggplant.,Every dancer was hard work to see the eggplant.,syntax_semantics,control_raising,tough_vs_raising_2,True,False,False,False,488,-51.827056884765625,-61.16535949707031,1
Becca's piano teachers aren't sure to testify.,Becca's piano teachers aren't exciting to testify.,syntax_semantics,control_raising,tough_vs_raising_2,True,False,False,False,489,-61.49610900878906,-64.95143127441406,1
Lissa's cousins aren't about to annoy all adults.,Lissa's cousins aren't exciting to annoy all adults.,syntax_semantics,control_raising,tough_vs_raising_2,True,False,False,False,490,-69.22053527832031,-73.65333557128906,1
That screen wasn't likely to astound Amelia.,That screen wasn't enjoyable to astound Amelia.,syntax_semantics,control_raising,tough_vs_raising_2,True,False,False,False,491,-66.40220642089844,-70.05628967285156,1
A grandmother of Kathleen wasn't unlikely to complain about Charles.,A grandmother of Kathleen wasn't boring to complain about Charles.,syntax_semantics,control_raising,tough_vs_raising_2,True,False,False,False,492,-87.50099182128906,-87.4337158203125,0
The actresses were soon to conceal Alice.,The actresses were irritating to conceal Alice.,syntax_semantics,control_raising,tough_vs_raising_2,True,False,False,False,493,-56.17665100097656,-59.03801727294922,1
Linda is certain to cure Keith.,Linda is enjoyable to cure Keith.,syntax_semantics,control_raising,tough_vs_raising_2,True,False,False,False,494,-55.28502655029297,-56.16050720214844,1
Cynthia's French teacher is likely to explain Galileo heals Alice.,Cynthia's French teacher is boring to explain Galileo heals Alice.,syntax_semantics,control_raising,tough_vs_raising_2,True,False,False,False,495,-117.28854370117188,-121.35310363769531,1
Many plates aren't sure to resemble that picture.,Many plates aren't irritating to resemble that picture.,syntax_semantics,control_raising,tough_vs_raising_2,True,False,False,False,496,-53.53235626220703,-57.25811004638672,1
Monet was soon to hire Cindy.,Monet was tough to hire Cindy.,syntax_semantics,control_raising,tough_vs_raising_2,True,False,False,False,497,-48.60657501220703,-46.57787322998047,0
Diane was bound to pass a hospital.,Diane was fun to pass a hospital.,syntax_semantics,control_raising,tough_vs_raising_2,True,False,False,False,498,-52.72610092163086,-52.8728141784668,1
Some driver's bosses aren't soon to clean some college campuses.,Some driver's bosses aren't exciting to clean some college campuses.,syntax_semantics,control_raising,tough_vs_raising_2,True,False,False,False,499,-83.02284240722656,-81.31283569335938,0
Teresa's hairdressers aren't soon to appear to heal Catherine.,Teresa's hairdressers aren't hard to appear to heal Catherine.,syntax_semantics,control_raising,tough_vs_raising_2,True,False,False,False,500,-99.62873077392578,-92.25321197509766,0
Monet's ex-wife was sure to reveal Travis.,Monet's ex-wife was pleasant to reveal Travis.,syntax_semantics,control_raising,tough_vs_raising_2,True,False,False,False,501,-65.378662109375,-68.12715148925781,1
Sheila isn't unlikely to approach Brad.,Sheila isn't easy to approach Brad.,syntax_semantics,control_raising,tough_vs_raising_2,True,False,False,False,502,-60.61376190185547,-53.86031723022461,0
Derek isn't apt to think about some cucumbers.,Derek isn't boring to think about some cucumbers.,syntax_semantics,control_raising,tough_vs_raising_2,True,False,False,False,503,-73.2605209350586,-72.66885375976562,0
Dan's sister isn't likely to reveal some convertible.,Dan's sister isn't fun to reveal some convertible.,syntax_semantics,control_raising,tough_vs_raising_2,True,False,False,False,504,-59.12980651855469,-60.886390686035156,1
Amy is unlikely to beg this friend of Peter to embarrass Colleen.,Amy is unpleasant to beg this friend of Peter to embarrass Colleen.,syntax_semantics,control_raising,tough_vs_raising_2,True,False,False,False,505,-96.30243682861328,-97.80305480957031,1
Brad isn't certain to go to many grocery stores.,Brad isn't difficult to go to many grocery stores.,syntax_semantics,control_raising,tough_vs_raising_2,True,False,False,False,506,-57.972801208496094,-52.589385986328125,0
Colleen was sure to break this bike.,Colleen was enjoyable to break this bike.,syntax_semantics,control_raising,tough_vs_raising_2,True,False,False,False,507,-44.82456970214844,-52.81913375854492,1
Aaron is certain to mess up a lot of high schools.,Aaron is pleasant to mess up a lot of high schools.,syntax_semantics,control_raising,tough_vs_raising_2,True,False,False,False,508,-50.53678512573242,-47.9794921875,0
Every waiter isn't bound to exit every public park.,Every waiter isn't annoying to exit every public park.,syntax_semantics,control_raising,tough_vs_raising_2,True,False,False,False,509,-66.29432678222656,-70.33692932128906,1
That story about the Clintons wasn't bound to stun Tanya.,That story about the Clintons wasn't interesting to stun Tanya.,syntax_semantics,control_raising,tough_vs_raising_2,True,False,False,False,510,-87.32592010498047,-87.40634155273438,1
Most drivers weren't apt to testify.,Most drivers weren't easy to testify.,syntax_semantics,control_raising,tough_vs_raising_2,True,False,False,False,511,-46.26240539550781,-41.00115966796875,0
Debra is unlikely to think about Heather.,Debra is irritating to think about Heather.,syntax_semantics,control_raising,tough_vs_raising_2,True,False,False,False,512,-47.371910095214844,-48.442100524902344,1
Theresa's employee was certain to prod all children's friend to explain everything.,Theresa's employee was tough to prod all children's friend to explain everything.,syntax_semantics,control_raising,tough_vs_raising_2,True,False,False,False,513,-103.64599609375,-99.89529418945312,0
Alexander wasn't certain to predict the associations to collaborate.,Alexander wasn't hard work to predict the associations to collaborate.,syntax_semantics,control_raising,tough_vs_raising_2,True,False,False,False,514,-65.43360137939453,-67.43571472167969,1
A lot of dishes were about to worry Clyde.,A lot of dishes were hard to worry Clyde.,syntax_semantics,control_raising,tough_vs_raising_2,True,False,False,False,515,-67.26174926757812,-64.49087524414062,0
Martin's teachers are unlikely to discuss Andrew.,Martin's teachers are hard to discuss Andrew.,syntax_semantics,control_raising,tough_vs_raising_2,True,False,False,False,516,-51.207008361816406,-44.358489990234375,0
Some library was soon to order this student to escape.,Some library was enjoyable to order this student to escape.,syntax_semantics,control_raising,tough_vs_raising_2,True,False,False,False,517,-65.16800689697266,-69.2916259765625,1
Anna isn't unlikely to sigh.,Anna isn't unpleasant to sigh.,syntax_semantics,control_raising,tough_vs_raising_2,True,False,False,False,518,-37.31688690185547,-38.15070343017578,1
Some lice are bound to aggravate Brett.,Some lice are irritating to aggravate Brett.,syntax_semantics,control_raising,tough_vs_raising_2,True,False,False,False,519,-64.79228973388672,-70.23450469970703,1
Some waitress was unlikely to ascend this hill.,Some waitress was easy to ascend this hill.,syntax_semantics,control_raising,tough_vs_raising_2,True,False,False,False,520,-64.97147369384766,-59.15912628173828,0
Some offspring is likely to admire broccoli.,Some offspring is unpleasant to admire broccoli.,syntax_semantics,control_raising,tough_vs_raising_2,True,False,False,False,521,-50.879310607910156,-55.36298370361328,1
Gary's piano teachers aren't about to forget Bill.,Gary's piano teachers aren't pleasant to forget Bill.,syntax_semantics,control_raising,tough_vs_raising_2,True,False,False,False,522,-60.84212875366211,-64.78977966308594,1
This hospital wasn't bound to induce Dennis's classmate to love Jacqueline.,This hospital wasn't interesting to induce Dennis's classmate to love Jacqueline.,syntax_semantics,control_raising,tough_vs_raising_2,True,False,False,False,523,-103.28878784179688,-102.64239501953125,0
Janet wasn't unlikely to explore those glaciers.,Janet wasn't unpleasant to explore those glaciers.,syntax_semantics,control_raising,tough_vs_raising_2,True,False,False,False,524,-62.00227355957031,-62.316627502441406,1
Suzanne's tutors were likely to alarm the legislatures.,Suzanne's tutors were easy to alarm the legislatures.,syntax_semantics,control_raising,tough_vs_raising_2,True,False,False,False,525,-80.86250305175781,-79.92890930175781,0
Many fathers of Alicia are unlikely to impress Guy.,Many fathers of Alicia are hard to impress Guy.,syntax_semantics,control_raising,tough_vs_raising_2,True,False,False,False,526,-71.28578186035156,-64.7619400024414,0
Cynthia is bound to speak up.,Cynthia is irritating to speak up.,syntax_semantics,control_raising,tough_vs_raising_2,True,False,False,False,527,-56.13428497314453,-61.406005859375,1
Susan is unlikely to appear to criticize many commentaries.,Susan is pleasant to appear to criticize many commentaries.,syntax_semantics,control_raising,tough_vs_raising_2,True,False,False,False,528,-70.10499572753906,-69.79165649414062,0
Danielle wasn't soon to manage to disappear.,Danielle wasn't exciting to manage to disappear.,syntax_semantics,control_raising,tough_vs_raising_2,True,False,False,False,529,-53.21788787841797,-54.100067138671875,1
Brett's employees are bound to research every museum.,Brett's employees are boring to research every museum.,syntax_semantics,control_raising,tough_vs_raising_2,True,False,False,False,530,-75.4167709350586,-80.82341003417969,1
Alan isn't soon to fall.,Alan isn't easy to fall.,syntax_semantics,control_raising,tough_vs_raising_2,True,False,False,False,531,-35.022987365722656,-27.46548080444336,0
Bradley isn't certain to prod Laurie to chuckle.,Bradley isn't easy to prod Laurie to chuckle.,syntax_semantics,control_raising,tough_vs_raising_2,True,False,False,False,532,-75.63276672363281,-68.16120910644531,0
Jesus's girlfriend is sure to exit a hospital.,Jesus's girlfriend is hard to exit a hospital.,syntax_semantics,control_raising,tough_vs_raising_2,True,False,False,False,533,-48.8780517578125,-44.90715408325195,0
Marla's grandmother isn't apt to wear these glasses.,Marla's grandmother isn't irritating to wear these glasses.,syntax_semantics,control_raising,tough_vs_raising_2,True,False,False,False,534,-62.933311462402344,-64.0069808959961,1
Nancy's mothers weren't likely to clash.,Nancy's mothers weren't irritating to clash.,syntax_semantics,control_raising,tough_vs_raising_2,True,False,False,False,535,-65.24339294433594,-70.0091323852539,1
Bruce's sons were sure to manage to worry Keith.,Bruce's sons were annoying to manage to worry Keith.,syntax_semantics,control_raising,tough_vs_raising_2,True,False,False,False,536,-60.228416442871094,-65.02635192871094,1
Colleen is bound to boycott all rivers.,Colleen is hard work to boycott all rivers.,syntax_semantics,control_raising,tough_vs_raising_2,True,False,False,False,537,-55.892791748046875,-62.99618911743164,1
Samuel is likely to climb up most slopes.,Samuel is hard work to climb up most slopes.,syntax_semantics,control_raising,tough_vs_raising_2,True,False,False,False,538,-51.162818908691406,-57.936580657958984,1
Ann isn't about to mutter.,Ann isn't tough to mutter.,syntax_semantics,control_raising,tough_vs_raising_2,True,False,False,False,539,-41.470176696777344,-41.93852233886719,1
John isn't unlikely to talk to Jesus.,John isn't tough to talk to Jesus.,syntax_semantics,control_raising,tough_vs_raising_2,True,False,False,False,540,-43.23951721191406,-38.35491180419922,0
Samantha is unlikely to talk.,Samantha is fun to talk.,syntax_semantics,control_raising,tough_vs_raising_2,True,False,False,False,541,-53.57758331298828,-49.795963287353516,0
Every customer wasn't likely to investigate what looked like Vincent.,Every customer wasn't fun to investigate what looked like Vincent.,syntax_semantics,control_raising,tough_vs_raising_2,True,False,False,False,542,-69.46050262451172,-69.47198486328125,1
John was likely to heal Keith.,John was easy to heal Keith.,syntax_semantics,control_raising,tough_vs_raising_2,True,False,False,False,543,-40.92311096191406,-39.42812728881836,0
Rachel isn't certain to boast.,Rachel isn't fun to boast.,syntax_semantics,control_raising,tough_vs_raising_2,True,False,False,False,544,-41.267799377441406,-34.51408386230469,0
Mitchell isn't about to upset Peter.,Mitchell isn't exciting to upset Peter.,syntax_semantics,control_raising,tough_vs_raising_2,True,False,False,False,545,-53.30133056640625,-56.51713943481445,1
Steve is apt to kiss Richard.,Steve is fun to kiss Richard.,syntax_semantics,control_raising,tough_vs_raising_2,True,False,False,False,546,-40.2739143371582,-37.79542922973633,0
Kirsten was likely to urge Beth to argue.,Kirsten was exciting to urge Beth to argue.,syntax_semantics,control_raising,tough_vs_raising_2,True,False,False,False,547,-73.01559448242188,-76.82046508789062,1
Rodney isn't bound to prompt Danielle to attack Allison.,Rodney isn't pleasant to prompt Danielle to attack Allison.,syntax_semantics,control_raising,tough_vs_raising_2,True,False,False,False,548,-81.32504272460938,-85.20083618164062,1
Banks aren't about to confer.,Banks aren't pleasant to confer.,syntax_semantics,control_raising,tough_vs_raising_2,True,False,False,False,549,-54.66643524169922,-58.19462203979492,1
Christine isn't unlikely to talk.,Christine isn't annoying to talk.,syntax_semantics,control_raising,tough_vs_raising_2,True,False,False,False,550,-39.2061767578125,-37.91087341308594,0
Kenneth's electricians aren't certain to laugh.,Kenneth's electricians aren't fun to laugh.,syntax_semantics,control_raising,tough_vs_raising_2,True,False,False,False,551,-63.12059020996094,-61.266273498535156,0
That rug was about to shock Mary.,That rug was interesting to shock Mary.,syntax_semantics,control_raising,tough_vs_raising_2,True,False,False,False,552,-51.39008331298828,-51.41397476196289,1
Liam wasn't likely to happen to blink.,Liam wasn't irritating to happen to blink.,syntax_semantics,control_raising,tough_vs_raising_2,True,False,False,False,553,-52.819664001464844,-58.62238693237305,1
This customer's piano teacher was sure to oblige George to forfeit.,This customer's piano teacher was interesting to oblige George to forfeit.,syntax_semantics,control_raising,tough_vs_raising_2,True,False,False,False,554,-102.15996551513672,-101.92977142333984,0
Samuel's sisters weren't soon to negotiate.,Samuel's sisters weren't hard work to negotiate.,syntax_semantics,control_raising,tough_vs_raising_2,True,False,False,False,555,-53.40263748168945,-54.676231384277344,1
A lot of students weren't about to interact.,A lot of students weren't easy to interact.,syntax_semantics,control_raising,tough_vs_raising_2,True,False,False,False,556,-55.92417907714844,-54.99135208129883,0
Children weren't likely to predict most children to fight.,Children weren't boring to predict most children to fight.,syntax_semantics,control_raising,tough_vs_raising_2,True,False,False,False,557,-56.61301803588867,-62.237998962402344,1
Dan is soon to yearn to scare George.,Dan is hard to yearn to scare George.,syntax_semantics,control_raising,tough_vs_raising_2,True,False,False,False,558,-72.45073699951172,-66.3702621459961,0
These dancers' employees aren't soon to pass schools.,These dancers' employees aren't annoying to pass schools.,syntax_semantics,control_raising,tough_vs_raising_2,True,False,False,False,559,-67.17669677734375,-64.66761779785156,0
Paula was bound to happen to lift this water.,Paula was annoying to happen to lift this water.,syntax_semantics,control_raising,tough_vs_raising_2,True,False,False,False,560,-53.287391662597656,-56.23296356201172,1
Raymond wasn't likely to slump over.,Raymond wasn't fun to slump over.,syntax_semantics,control_raising,tough_vs_raising_2,True,False,False,False,561,-55.471458435058594,-56.71464920043945,1
Alicia wasn't bound to conceal Jessica.,Alicia wasn't enjoyable to conceal Jessica.,syntax_semantics,control_raising,tough_vs_raising_2,True,False,False,False,562,-71.10648345947266,-76.02491760253906,1
That university was sure to reply.,That university was unpleasant to reply.,syntax_semantics,control_raising,tough_vs_raising_2,True,False,False,False,563,-40.45573043823242,-45.704010009765625,1
Those rugs aren't about to bore Holly.,Those rugs aren't hard to bore Holly.,syntax_semantics,control_raising,tough_vs_raising_2,True,False,False,False,564,-61.20195007324219,-58.860191345214844,0
Jerry's classmates weren't about to insult these dancers.,Jerry's classmates weren't interesting to insult these dancers.,syntax_semantics,control_raising,tough_vs_raising_2,True,False,False,False,565,-66.7716293334961,-69.91900634765625,1
Irene is bound to hide these pants.,Irene is tough to hide these pants.,syntax_semantics,control_raising,tough_vs_raising_2,True,False,False,False,566,-51.869346618652344,-50.11247634887695,0
Richard is apt to question the patients.,Richard is difficult to question the patients.,syntax_semantics,control_raising,tough_vs_raising_2,True,False,False,False,567,-40.59136962890625,-36.782386779785156,0
Margaret wasn't soon to research some college campus.,Margaret wasn't tough to research some college campus.,syntax_semantics,control_raising,tough_vs_raising_2,True,False,False,False,568,-63.761619567871094,-59.2365608215332,0
Those doctors weren't sure to encourage these friends of Brenda to work with that dancer.,Those doctors weren't unpleasant to encourage these friends of Brenda to work with that dancer.,syntax_semantics,control_raising,tough_vs_raising_2,True,False,False,False,569,-94.44273376464844,-99.38984680175781,1
Those people are about to exit some closet.,Those people are hard work to exit some closet.,syntax_semantics,control_raising,tough_vs_raising_2,True,False,False,False,570,-43.7591438293457,-53.0511474609375,1
Some teenager isn't sure to entice Sandra to break these trucks.,Some teenager isn't difficult to entice Sandra to break these trucks.,syntax_semantics,control_raising,tough_vs_raising_2,True,False,False,False,571,-94.78215026855469,-93.96575927734375,0
Some nephew of Dan was apt to descend all steps.,Some nephew of Dan was enjoyable to descend all steps.,syntax_semantics,control_raising,tough_vs_raising_2,True,False,False,False,572,-77.26686096191406,-80.26972961425781,1
Becky is apt to go to some mountains.,Becky is hard to go to some mountains.,syntax_semantics,control_raising,tough_vs_raising_2,True,False,False,False,573,-36.77459716796875,-29.344459533691406,0
Jill is certain to boast.,Jill is hard to boast.,syntax_semantics,control_raising,tough_vs_raising_2,True,False,False,False,574,-52.68299865722656,-42.05202865600586,0
The Borgias weren't bound to fix those screens.,The Borgias weren't exciting to fix those screens.,syntax_semantics,control_raising,tough_vs_raising_2,True,False,False,False,575,-69.18275451660156,-73.02459716796875,1
Sherry was soon to remember who might divorce.,Sherry was hard work to remember who might divorce.,syntax_semantics,control_raising,tough_vs_raising_2,True,False,False,False,576,-70.76939392089844,-74.99327850341797,1
Most patients weren't likely to grin.,Most patients weren't interesting to grin.,syntax_semantics,control_raising,tough_vs_raising_2,True,False,False,False,577,-44.65223693847656,-45.887699127197266,1
Monica isn't likely to wear most hats.,Monica isn't boring to wear most hats.,syntax_semantics,control_raising,tough_vs_raising_2,True,False,False,False,578,-54.1568603515625,-57.55250930786133,1
Amanda wasn't unlikely to concur.,Amanda wasn't interesting to concur.,syntax_semantics,control_raising,tough_vs_raising_2,True,False,False,False,579,-53.023895263671875,-49.129981994628906,0
Joel wasn't soon to consider some box to shut.,Joel wasn't easy to consider some box to shut.,syntax_semantics,control_raising,tough_vs_raising_2,True,False,False,False,580,-68.49907684326172,-60.89202880859375,0
Sheila wasn't bound to discover most essays.,Sheila wasn't exciting to discover most essays.,syntax_semantics,control_raising,tough_vs_raising_2,True,False,False,False,581,-58.817291259765625,-62.34697723388672,1
Irene is likely to attempt to boast.,Irene is pleasant to attempt to boast.,syntax_semantics,control_raising,tough_vs_raising_2,True,False,False,False,582,-51.803462982177734,-55.534942626953125,1
A student wasn't unlikely to climb up stairs.,A student wasn't hard work to climb up stairs.,syntax_semantics,control_raising,tough_vs_raising_2,True,False,False,False,583,-67.56448364257812,-69.45338439941406,1
Karla's hairdressers aren't apt to work hard.,Karla's hairdressers aren't pleasant to work hard.,syntax_semantics,control_raising,tough_vs_raising_2,True,False,False,False,584,-75.48079681396484,-74.51719665527344,0
Jerry is unlikely to want Derek to climb down many mountains.,Jerry is boring to want Derek to climb down many mountains.,syntax_semantics,control_raising,tough_vs_raising_2,True,False,False,False,585,-73.13591003417969,-72.05037689208984,0
Brett is certain to discover that carriage.,Brett is annoying to discover that carriage.,syntax_semantics,control_raising,tough_vs_raising_2,True,False,False,False,586,-71.11111450195312,-68.8677978515625,0
Cheryl isn't unlikely to want some glacier to evaporate.,Cheryl isn't interesting to want some glacier to evaporate.,syntax_semantics,control_raising,tough_vs_raising_2,True,False,False,False,587,-104.31221008300781,-100.1304931640625,0
An organization was bound to cope.,An organization was tough to cope.,syntax_semantics,control_raising,tough_vs_raising_2,True,False,False,False,588,-34.989532470703125,-34.409488677978516,0
