sentence_good,sentence_bad,field,linguistics_term,UID,simple_LM_method,one_prefix_method,two_prefix_method,lexically_identical,pair_id,good_prob,bad_prob,correct
Sabrina can't annoy that alumnus.,Sabrina can't annoy those alumnus.,morphology,determiner_noun_agreement,determiner_noun_agreement_irregular_2,True,False,True,True,248,-61.98672866821289,-62.22403335571289,1
Erin would hate that child.,Erin would hate those child.,morphology,determiner_noun_agreement,determiner_noun_agreement_irregular_2,True,False,True,True,249,-34.39188766479492,-39.683685302734375,1
These patients couldn't drop by this oasis.,These patients couldn't drop by these oasis.,morphology,determiner_noun_agreement,determiner_noun_agreement_irregular_2,True,False,True,True,250,-58.586177825927734,-57.40302276611328,0
Erin isn't noticing those geese.,Erin isn't noticing that geese.,morphology,determiner_noun_agreement,determiner_noun_agreement_irregular_2,True,False,True,True,251,-54.95427703857422,-51.69664764404297,0
Eric hasn't brought those nuclei.,Eric hasn't brought that nuclei.,morphology,determiner_noun_agreement,determiner_noun_agreement_irregular_2,True,False,True,True,252,-45.75919723510742,-42.490509033203125,0
Thomas hired these people.,Thomas hired this people.,morphology,determiner_noun_agreement,determiner_noun_agreement_irregular_2,True,False,True,True,253,-22.878067016601562,-27.686506271362305,1
Peter has those theses.,Peter has that theses.,morphology,determiner_noun_agreement,determiner_noun_agreement_irregular_2,True,False,True,True,254,-32.747955322265625,-31.28250503540039,0
Elaine couldn't examine these synopses.,Elaine couldn't examine this synopses.,morphology,determiner_noun_agreement,determiner_noun_agreement_irregular_2,True,False,True,True,255,-66.77459716796875,-68.19386291503906,1
This bicycle has disgusted that alumnus.,This bicycle has disgusted those alumnus.,morphology,determiner_noun_agreement,determiner_noun_agreement_irregular_2,True,False,True,True,256,-64.59785461425781,-68.12687683105469,1
Rhonda praised that child.,Rhonda praised those child.,morphology,determiner_noun_agreement,determiner_noun_agreement_irregular_2,True,False,True,True,257,-35.40583801269531,-38.626251220703125,1
Angela did skate around these oases.,Angela did skate around this oases.,morphology,determiner_noun_agreement,determiner_noun_agreement_irregular_2,True,False,True,True,258,-58.25444030761719,-58.55830383300781,1
Most teachers flee from this man.,Most teachers flee from these man.,morphology,determiner_noun_agreement,determiner_noun_agreement_irregular_2,True,False,True,True,259,-42.33696746826172,-44.9387321472168,1
Diana dropped by those oases.,Diana dropped by that oases.,morphology,determiner_noun_agreement,determiner_noun_agreement_irregular_2,True,False,True,True,260,-61.03892135620117,-60.4036865234375,0
Eva dislikes that oasis.,Eva dislikes those oasis.,morphology,determiner_noun_agreement,determiner_noun_agreement_irregular_2,True,False,True,True,261,-49.001380920410156,-51.920745849609375,1
Edward could reveal these oxen.,Edward could reveal this oxen.,morphology,determiner_noun_agreement,determiner_noun_agreement_irregular_2,True,False,True,True,262,-42.33888244628906,-42.32099533081055,0
The Borgias talk to those children.,The Borgias talk to that children.,morphology,determiner_noun_agreement,determiner_noun_agreement_irregular_2,True,False,True,True,263,-49.948585510253906,-51.406333923339844,1
Dennis wasn't dropping by those oases.,Dennis wasn't dropping by that oases.,morphology,determiner_noun_agreement,determiner_noun_agreement_irregular_2,True,False,True,True,264,-66.6125717163086,-65.71113586425781,0
Paula will argue about that child.,Paula will argue about those child.,morphology,determiner_noun_agreement,determiner_noun_agreement_irregular_2,True,False,True,True,265,-33.412132263183594,-36.33950424194336,1
Janet breaks these teeth.,Janet breaks this teeth.,morphology,determiner_noun_agreement,determiner_noun_agreement_irregular_2,True,False,True,True,266,-35.67729949951172,-36.05168151855469,1
The Borgias help this child.,The Borgias help these child.,morphology,determiner_noun_agreement,determiner_noun_agreement_irregular_2,True,False,True,True,267,-51.168453216552734,-53.587440490722656,1
Stephanie argued about those ellipses.,Stephanie argued about that ellipses.,morphology,determiner_noun_agreement,determiner_noun_agreement_irregular_2,True,False,True,True,268,-61.622413635253906,-59.72895050048828,0
Those people help that woman.,Those people help those woman.,morphology,determiner_noun_agreement,determiner_noun_agreement_irregular_2,True,False,True,True,269,-25.170490264892578,-28.604537963867188,1
Melissa can't criticize these synopses.,Melissa can't criticize this synopses.,morphology,determiner_noun_agreement,determiner_noun_agreement_irregular_2,True,False,True,True,270,-62.59095001220703,-63.74885177612305,1
Most dancers examine that thesis.,Most dancers examine those thesis.,morphology,determiner_noun_agreement,determiner_noun_agreement_irregular_2,True,False,True,True,271,-42.029441833496094,-43.9569206237793,1
Brett found that mouse.,Brett found those mouse.,morphology,determiner_noun_agreement,determiner_noun_agreement_irregular_2,True,False,True,True,272,-47.737518310546875,-49.725067138671875,1
Sherry hasn't gone to those oases.,Sherry hasn't gone to that oases.,morphology,determiner_noun_agreement,determiner_noun_agreement_irregular_2,True,False,True,True,273,-56.78253936767578,-56.770965576171875,0
Nancy tours these oases.,Nancy tours this oases.,morphology,determiner_noun_agreement,determiner_noun_agreement_irregular_2,True,False,True,True,274,-49.13237762451172,-51.23296356201172,1
Tamara discovers those women.,Tamara discovers that women.,morphology,determiner_noun_agreement,determiner_noun_agreement_irregular_2,True,False,True,True,275,-31.2683162689209,-32.672157287597656,1
Naomi wasn't selling these oxen.,Naomi wasn't selling this oxen.,morphology,determiner_noun_agreement,determiner_noun_agreement_irregular_2,True,False,True,True,276,-53.564388275146484,-53.252601623535156,0
Grace was touring that oasis.,Grace was touring those oasis.,morphology,determiner_noun_agreement,determiner_noun_agreement_irregular_2,True,False,True,True,277,-48.541378021240234,-49.8079833984375,1
The Lutherans upset this man.,The Lutherans upset these man.,morphology,determiner_noun_agreement,determiner_noun_agreement_irregular_2,True,False,True,True,278,-49.3104362487793,-52.896636962890625,1
Eva visited this oasis.,Eva visited these oasis.,morphology,determiner_noun_agreement,determiner_noun_agreement_irregular_2,True,False,True,True,279,-37.50177001953125,-36.674415588378906,0
John had listened to those people.,John had listened to that people.,morphology,determiner_noun_agreement,determiner_noun_agreement_irregular_2,True,False,True,True,280,-26.3013858795166,-28.605945587158203,1
The Clintons sell this ox.,The Clintons sell these ox.,morphology,determiner_noun_agreement,determiner_noun_agreement_irregular_2,True,False,True,True,281,-46.70426940917969,-47.176673889160156,1
Jeffrey biked to that oasis.,Jeffrey biked to those oasis.,morphology,determiner_noun_agreement,determiner_noun_agreement_irregular_2,True,False,True,True,282,-59.410789489746094,-59.897212982177734,1
Craig lifted that nucleus.,Craig lifted those nucleus.,morphology,determiner_noun_agreement,determiner_noun_agreement_irregular_2,True,False,True,True,283,-29.776779174804688,-31.36927604675293,1
Many doctors might investigate these children.,Many doctors might investigate this children.,morphology,determiner_noun_agreement,determiner_noun_agreement_irregular_2,True,False,True,True,284,-35.915313720703125,-39.679840087890625,1
Sandra knew these men.,Sandra knew this men.,morphology,determiner_noun_agreement,determiner_noun_agreement_irregular_2,True,False,True,True,285,-37.96295166015625,-40.35462188720703,1
Galileo could sell these lice.,Galileo could sell this lice.,morphology,determiner_noun_agreement,determiner_noun_agreement_irregular_2,True,False,True,True,286,-54.50977325439453,-53.45651626586914,0
The legislatures could dislike this oasis.,The legislatures could dislike these oasis.,morphology,determiner_noun_agreement,determiner_noun_agreement_irregular_2,True,False,True,True,287,-60.284706115722656,-59.26549530029297,0
Many children upset this child.,Many children upset these child.,morphology,determiner_noun_agreement,determiner_noun_agreement_irregular_2,True,False,True,True,288,-31.2357177734375,-32.65593719482422,1
Marie isn't revealing this goose.,Marie isn't revealing these goose.,morphology,determiner_noun_agreement,determiner_noun_agreement_irregular_2,True,False,True,True,289,-43.26278305053711,-45.66853713989258,1
Lisa cleaned those cacti.,Lisa cleaned that cacti.,morphology,determiner_noun_agreement,determiner_noun_agreement_irregular_2,True,False,True,True,290,-42.28559875488281,-41.235836029052734,0
These shawls could irritate these alumni.,These shawls could irritate this alumni.,morphology,determiner_noun_agreement,determiner_noun_agreement_irregular_2,True,False,True,True,291,-71.4085693359375,-71.83494567871094,1
Rodney hires that man.,Rodney hires those man.,morphology,determiner_noun_agreement,determiner_noun_agreement_irregular_2,True,False,True,True,292,-34.7651252746582,-37.69242858886719,1
Jill has scared that child.,Jill has scared those child.,morphology,determiner_noun_agreement,determiner_noun_agreement_irregular_2,True,False,True,True,293,-45.36113357543945,-48.86195373535156,1
Mary should discuss this analysis.,Mary should discuss these analysis.,morphology,determiner_noun_agreement,determiner_noun_agreement_irregular_2,True,False,True,True,294,-33.840179443359375,-35.9407958984375,1
A lot of doctors skate around those oases.,A lot of doctors skate around that oases.,morphology,determiner_noun_agreement,determiner_noun_agreement_irregular_2,True,False,True,True,295,-71.22444915771484,-69.98161315917969,0
Lawrence has lifted those feet.,Lawrence has lifted that feet.,morphology,determiner_noun_agreement,determiner_noun_agreement_irregular_2,True,False,True,True,296,-40.56201171875,-40.670597076416016,1
Kayla scanned this synopsis.,Kayla scanned these synopsis.,morphology,determiner_noun_agreement,determiner_noun_agreement_irregular_2,True,False,True,True,297,-48.83576202392578,-50.91219711303711,1
Danielle could know that man.,Danielle could know those man.,morphology,determiner_noun_agreement,determiner_noun_agreement_irregular_2,True,False,True,True,298,-35.451438903808594,-38.871490478515625,1
The Borgias aggravate these men.,The Borgias aggravate this men.,morphology,determiner_noun_agreement,determiner_noun_agreement_irregular_2,True,False,True,True,299,-61.733795166015625,-63.88134002685547,1
Most cashiers bike to this oasis.,Most cashiers bike to these oasis.,morphology,determiner_noun_agreement,determiner_noun_agreement_irregular_2,True,False,True,True,300,-64.43196868896484,-63.602569580078125,0
Andrew exited this oasis.,Andrew exited these oasis.,morphology,determiner_noun_agreement,determiner_noun_agreement_irregular_2,True,False,True,True,301,-41.879974365234375,-42.06283187866211,1
Brian exits these oases.,Brian exits this oases.,morphology,determiner_noun_agreement,determiner_noun_agreement_irregular_2,True,False,True,True,302,-43.35334777832031,-44.65522003173828,1
Gary scares that woman.,Gary scares those woman.,morphology,determiner_noun_agreement,determiner_noun_agreement_irregular_2,True,False,True,True,303,-25.012035369873047,-29.51459503173828,1
Every sketch looks like these fungi.,Every sketch looks like this fungi.,morphology,determiner_noun_agreement,determiner_noun_agreement_irregular_2,True,False,True,True,304,-41.66586685180664,-41.63957214355469,0
April doesn't work with these people.,April doesn't work with this people.,morphology,determiner_noun_agreement,determiner_noun_agreement_irregular_2,True,False,True,True,305,-28.173721313476562,-31.811534881591797,1
Karla is kissing that person.,Karla is kissing those person.,morphology,determiner_noun_agreement,determiner_noun_agreement_irregular_2,True,False,True,True,306,-37.14942169189453,-39.8238525390625,1
Kenneth had broken those feet.,Kenneth had broken that feet.,morphology,determiner_noun_agreement,determiner_noun_agreement_irregular_2,True,False,True,True,307,-39.37892150878906,-39.80356979370117,1
Thomas was breaking these feet.,Thomas was breaking this feet.,morphology,determiner_noun_agreement,determiner_noun_agreement_irregular_2,True,False,True,True,308,-29.574100494384766,-31.506412506103516,1
The Clintons hire this person.,The Clintons hire these person.,morphology,determiner_noun_agreement,determiner_noun_agreement_irregular_2,True,False,True,True,309,-41.40380096435547,-45.137046813964844,1
Cindy isn't cleaning these feet.,Cindy isn't cleaning this feet.,morphology,determiner_noun_agreement,determiner_noun_agreement_irregular_2,True,False,True,True,310,-51.81671142578125,-53.033180236816406,1
Martin walked through those oases.,Martin walked through that oases.,morphology,determiner_noun_agreement,determiner_noun_agreement_irregular_2,True,False,True,True,311,-40.4940185546875,-39.72748947143555,0
These blouses embarrass that woman.,These blouses embarrass those woman.,morphology,determiner_noun_agreement,determiner_noun_agreement_irregular_2,True,False,True,True,312,-49.7501220703125,-50.98694610595703,1
Douglas hadn't admired that person.,Douglas hadn't admired those person.,morphology,determiner_noun_agreement,determiner_noun_agreement_irregular_2,True,False,True,True,313,-47.610267639160156,-50.4623908996582,1
Those children argue about that medium.,Those children argue about those medium.,morphology,determiner_noun_agreement,determiner_noun_agreement_irregular_2,True,False,True,True,314,-33.73627471923828,-35.93523406982422,1
These adults question those men.,These adults question that men.,morphology,determiner_noun_agreement,determiner_noun_agreement_irregular_2,True,False,True,True,315,-36.745853424072266,-35.508384704589844,0
The museum can hate that analysis.,The museum can hate those analysis.,morphology,determiner_noun_agreement,determiner_noun_agreement_irregular_2,True,False,True,True,316,-38.090919494628906,-42.025821685791016,1
This driver cared for that person.,This driver cared for those person.,morphology,determiner_noun_agreement,determiner_noun_agreement_irregular_2,True,False,True,True,317,-34.60192108154297,-37.950714111328125,1
Roger dislikes this man.,Roger dislikes these man.,morphology,determiner_noun_agreement,determiner_noun_agreement_irregular_2,True,False,True,True,318,-39.768367767333984,-42.51127624511719,1
Curtis hated that man.,Curtis hated those man.,morphology,determiner_noun_agreement,determiner_noun_agreement_irregular_2,True,False,True,True,319,-45.669395446777344,-50.0235595703125,1
Samantha returned to this oasis.,Samantha returned to these oasis.,morphology,determiner_noun_agreement,determiner_noun_agreement_irregular_2,True,False,True,True,320,-52.26282501220703,-52.9860954284668,1
Regina had talked about this analysis.,Regina had talked about these analysis.,morphology,determiner_noun_agreement,determiner_noun_agreement_irregular_2,True,False,True,True,321,-40.10346984863281,-42.352508544921875,1
Scott criticizes that thesis.,Scott criticizes those thesis.,morphology,determiner_noun_agreement,determiner_noun_agreement_irregular_2,True,False,True,True,322,-39.73857879638672,-42.97101593017578,1
This dog astounds these children.,This dog astounds this children.,morphology,determiner_noun_agreement,determiner_noun_agreement_irregular_2,True,False,True,True,323,-46.30448532104492,-49.169212341308594,1
These women think about these nuclei.,These women think about this nuclei.,morphology,determiner_noun_agreement,determiner_noun_agreement_irregular_2,True,False,True,True,324,-43.1181640625,-42.08515930175781,0
Museums should know these women.,Museums should know this women.,morphology,determiner_noun_agreement,determiner_noun_agreement_irregular_2,True,False,True,True,325,-48.09762954711914,-52.06318664550781,1
The Borgias tour those oases.,The Borgias tour that oases.,morphology,determiner_noun_agreement,determiner_noun_agreement_irregular_2,True,False,True,True,326,-69.81320190429688,-65.20832824707031,0
Spain should hate that woman.,Spain should hate those woman.,morphology,determiner_noun_agreement,determiner_noun_agreement_irregular_2,True,False,True,True,327,-30.608001708984375,-35.0081787109375,1
Andrew hadn't cured this woman.,Andrew hadn't cured these woman.,morphology,determiner_noun_agreement,determiner_noun_agreement_irregular_2,True,False,True,True,328,-38.034385681152344,-42.29287338256836,1
Every guest leaves this alumnus.,Every guest leaves these alumnus.,morphology,determiner_noun_agreement,determiner_noun_agreement_irregular_2,True,False,True,True,329,-53.64210891723633,-55.65964889526367,1
Many children know that alumnus.,Many children know those alumnus.,morphology,determiner_noun_agreement,determiner_noun_agreement_irregular_2,True,False,True,True,330,-46.419715881347656,-48.80997848510742,1
These drivers help that man.,These drivers help those man.,morphology,determiner_noun_agreement,determiner_noun_agreement_irregular_2,True,False,True,True,331,-31.721172332763672,-34.67311096191406,1
Some men discover these fungi.,Some men discover this fungi.,morphology,determiner_noun_agreement,determiner_noun_agreement_irregular_2,True,False,True,True,332,-39.031761169433594,-40.293968200683594,1
Some candles bore that man.,Some candles bore those man.,morphology,determiner_noun_agreement,determiner_noun_agreement_irregular_2,True,False,True,True,333,-37.236148834228516,-39.849693298339844,1
Teresa knows this child.,Teresa knows these child.,morphology,determiner_noun_agreement,determiner_noun_agreement_irregular_2,True,False,True,True,334,-35.536312103271484,-37.81068801879883,1
All waitresses approach that person.,All waitresses approach those person.,morphology,determiner_noun_agreement,determiner_noun_agreement_irregular_2,True,False,True,True,335,-50.38733673095703,-54.6740608215332,1
Amanda conceals those theses.,Amanda conceals that theses.,morphology,determiner_noun_agreement,determiner_noun_agreement_irregular_2,True,False,True,True,336,-59.73191833496094,-53.54243469238281,0
Mary exits this oasis.,Mary exits these oasis.,morphology,determiner_noun_agreement,determiner_noun_agreement_irregular_2,True,False,True,True,337,-42.37963104248047,-41.78168487548828,0
Cindy had taken that ox.,Cindy had taken those ox.,morphology,determiner_noun_agreement,determiner_noun_agreement_irregular_2,True,False,True,True,338,-49.271018981933594,-50.62548065185547,1
Cheryl hasn't fired this woman.,Cheryl hasn't fired these woman.,morphology,determiner_noun_agreement,determiner_noun_agreement_irregular_2,True,False,True,True,339,-64.57564544677734,-68.95660400390625,1
Those cashiers hate this person.,Those cashiers hate these person.,morphology,determiner_noun_agreement,determiner_noun_agreement_irregular_2,True,False,True,True,340,-44.22669982910156,-48.65564727783203,1
Brad broke that tooth.,Brad broke those tooth.,morphology,determiner_noun_agreement,determiner_noun_agreement_irregular_2,True,False,True,True,341,-26.598426818847656,-30.754623413085938,1
These children healed this alumnus.,These children healed these alumnus.,morphology,determiner_noun_agreement,determiner_noun_agreement_irregular_2,True,False,True,True,342,-56.315093994140625,-56.4930534362793,1
A lot of teachers notice that cactus.,A lot of teachers notice those cactus.,morphology,determiner_noun_agreement,determiner_noun_agreement_irregular_2,True,False,True,True,343,-61.016357421875,-62.476341247558594,1
A pepper aggravates that woman.,A pepper aggravates those woman.,morphology,determiner_noun_agreement,determiner_noun_agreement_irregular_2,True,False,True,True,344,-53.04913330078125,-57.115360260009766,1
Joseph loved that person.,Joseph loved those person.,morphology,determiner_noun_agreement,determiner_noun_agreement_irregular_2,True,False,True,True,345,-19.957275390625,-23.762027740478516,1
That waitress was exiting those oases.,That waitress was exiting that oases.,morphology,determiner_noun_agreement,determiner_noun_agreement_irregular_2,True,False,True,True,346,-67.96831512451172,-64.42378997802734,0
Renee knew this child.,Renee knew these child.,morphology,determiner_noun_agreement,determiner_noun_agreement_irregular_2,True,False,True,True,347,-32.267677307128906,-34.591339111328125,1
Most girls research those paralyses.,Most girls research that paralyses.,morphology,determiner_noun_agreement,determiner_noun_agreement_irregular_2,True,False,True,True,348,-52.08238220214844,-49.366485595703125,0
Patients watch this woman.,Patients watch these woman.,morphology,determiner_noun_agreement,determiner_noun_agreement_irregular_2,True,False,True,True,349,-36.537574768066406,-40.442378997802734,1
Tina notices this nucleus.,Tina notices these nucleus.,morphology,determiner_noun_agreement,determiner_noun_agreement_irregular_2,True,False,True,True,350,-46.687416076660156,-47.916648864746094,1
Anne leaves this person.,Anne leaves these person.,morphology,determiner_noun_agreement,determiner_noun_agreement_irregular_2,True,False,True,True,351,-23.1683349609375,-28.25432014465332,1
Veronica does kiss that woman.,Veronica does kiss those woman.,morphology,determiner_noun_agreement,determiner_noun_agreement_irregular_2,True,False,True,True,352,-37.34090042114258,-42.471214294433594,1
Eric had dropped by those oases.,Eric had dropped by that oases.,morphology,determiner_noun_agreement,determiner_noun_agreement_irregular_2,True,False,True,True,353,-50.3394660949707,-50.08736801147461,0
Stephanie wasn't revealing this ox.,Stephanie wasn't revealing these ox.,morphology,determiner_noun_agreement,determiner_noun_agreement_irregular_2,True,False,True,True,354,-53.484764099121094,-53.593570709228516,1
Some carts wouldn't worry that child.,Some carts wouldn't worry those child.,morphology,determiner_noun_agreement,determiner_noun_agreement_irregular_2,True,False,True,True,355,-44.802852630615234,-50.026546478271484,1
Laurie shocked those men.,Laurie shocked that men.,morphology,determiner_noun_agreement,determiner_noun_agreement_irregular_2,True,False,True,True,356,-39.30683898925781,-38.43403625488281,0
Benjamin has thought about those women.,Benjamin has thought about that women.,morphology,determiner_noun_agreement,determiner_noun_agreement_irregular_2,True,False,True,True,357,-33.808345794677734,-35.153865814208984,1
Curtis fled from that man.,Curtis fled from those man.,morphology,determiner_noun_agreement,determiner_noun_agreement_irregular_2,True,False,True,True,358,-54.16963195800781,-57.89789581298828,1
Robert has kissed this person.,Robert has kissed these person.,morphology,determiner_noun_agreement,determiner_noun_agreement_irregular_2,True,False,True,True,359,-29.794540405273438,-33.40803146362305,1
Waitresses were healing those people.,Waitresses were healing that people.,morphology,determiner_noun_agreement,determiner_noun_agreement_irregular_2,True,False,True,True,360,-49.68284606933594,-47.96375274658203,0
Kendra skated around those oases.,Kendra skated around that oases.,morphology,determiner_noun_agreement,determiner_noun_agreement_irregular_2,True,False,True,True,361,-67.44406127929688,-66.3759994506836,0
Jodi isn't irritating this woman.,Jodi isn't irritating these woman.,morphology,determiner_noun_agreement,determiner_noun_agreement_irregular_2,True,False,True,True,362,-51.2276725769043,-55.691307067871094,1
David hasn't explored this oasis.,David hasn't explored these oasis.,morphology,determiner_noun_agreement,determiner_noun_agreement_irregular_2,True,False,True,True,363,-47.39369201660156,-46.71173858642578,0
Frank lifted these lice.,Frank lifted this lice.,morphology,determiner_noun_agreement,determiner_noun_agreement_irregular_2,True,False,True,True,364,-39.635765075683594,-38.56285858154297,0
Many committees can dislike these alumni.,Many committees can dislike this alumni.,morphology,determiner_noun_agreement,determiner_noun_agreement_irregular_2,True,False,True,True,365,-47.48828125,-47.470664978027344,0
Christopher noticed those stimuli.,Christopher noticed that stimuli.,morphology,determiner_noun_agreement,determiner_noun_agreement_irregular_2,True,False,True,True,366,-31.216712951660156,-29.605392456054688,0
Most dancers describe these men.,Most dancers describe this men.,morphology,determiner_noun_agreement,determiner_noun_agreement_irregular_2,True,False,True,True,367,-35.87903594970703,-37.970001220703125,1
Randolf has broken these feet.,Randolf has broken this feet.,morphology,determiner_noun_agreement,determiner_noun_agreement_irregular_2,True,False,True,True,368,-37.70671844482422,-39.19453430175781,1
This person discovered that child.,This person discovered those child.,morphology,determiner_noun_agreement,determiner_noun_agreement_irregular_2,True,False,True,True,369,-28.097393035888672,-31.627260208129883,1
The Clintons sell these oxen.,The Clintons sell this oxen.,morphology,determiner_noun_agreement,determiner_noun_agreement_irregular_2,True,False,True,True,370,-50.34205627441406,-49.80278778076172,0
Candice should describe that child.,Candice should describe those child.,morphology,determiner_noun_agreement,determiner_noun_agreement_irregular_2,True,False,True,True,371,-32.49408721923828,-36.36300277709961,1
That association hated those theses.,That association hated that theses.,morphology,determiner_noun_agreement,determiner_noun_agreement_irregular_2,True,False,True,True,372,-54.14411926269531,-50.028564453125,0
Ann boycotted those oases.,Ann boycotted that oases.,morphology,determiner_noun_agreement,determiner_noun_agreement_irregular_2,True,False,True,True,373,-58.992671966552734,-58.140052795410156,0
