sentence_good,sentence_bad,field,linguistics_term,UID,simple_LM_method,one_prefix_method,two_prefix_method,lexically_identical,pair_id,good_prob,bad_prob,correct
There are no turtles distracting Lori.,There are most turtles distracting Lori.,semantics,quantifiers,existential_there_quantifiers_1,True,False,False,False,247,-48.40680694580078,-50.091880798339844,1
There aren't many museums enticing many schools to forget Erin.,There aren't most museums enticing many schools to forget Erin.,semantics,quantifiers,existential_there_quantifiers_1,True,False,False,False,248,-82.34152221679688,-85.74331665039062,1
There was a niece of Erin singing.,There was every niece of Erin singing.,semantics,quantifiers,existential_there_quantifiers_1,True,False,False,False,249,-43.637908935546875,-53.03491973876953,1
There are no casseroles burning.,There are all casseroles burning.,semantics,quantifiers,existential_there_quantifiers_1,True,False,False,False,250,-45.59608840942383,-46.900665283203125,1
There is an eggplant worrying April.,There is each eggplant worrying April.,semantics,quantifiers,existential_there_quantifiers_1,True,False,False,False,251,-57.676109313964844,-67.56995391845703,1
There is a bike aggravating Alexander.,There is each bike aggravating Alexander.,semantics,quantifiers,existential_there_quantifiers_1,True,False,False,False,252,-45.75000762939453,-56.07957458496094,1
There weren't many nephews of Aaron revealing some box.,There weren't most nephews of Aaron revealing some box.,semantics,quantifiers,existential_there_quantifiers_1,True,False,False,False,253,-78.61216735839844,-83.17141723632812,1
There are few jackets disgusting Aaron.,There are all jackets disgusting Aaron.,semantics,quantifiers,existential_there_quantifiers_1,True,False,False,False,254,-47.281070709228516,-46.58451843261719,0
There isn't a mouth disgusting Rachelle.,There isn't every mouth disgusting Rachelle.,semantics,quantifiers,existential_there_quantifiers_1,True,False,False,False,255,-53.51148986816406,-63.28485107421875,1
There were some cashiers examining this book.,There were most cashiers examining this book.,semantics,quantifiers,existential_there_quantifiers_1,True,False,False,False,256,-50.380123138427734,-54.67375564575195,1
There were some men surrendering.,There were most men surrendering.,semantics,quantifiers,existential_there_quantifiers_1,True,False,False,False,257,-37.386505126953125,-41.62700653076172,1
There were some fish looking like a print.,There were most fish looking like a print.,semantics,quantifiers,existential_there_quantifiers_1,True,False,False,False,258,-40.741607666015625,-45.18644332885742,1
There was a lady doubting some senator shouldn't motivate some woman to pass this glacier.,There was each lady doubting some senator shouldn't motivate some woman to pass this glacier.,semantics,quantifiers,existential_there_quantifiers_1,True,False,False,False,259,-123.96601867675781,-131.8545684814453,1
There isn't a library forcing Florence to break a wheelbarrow.,There isn't each library forcing Florence to break a wheelbarrow.,semantics,quantifiers,existential_there_quantifiers_1,True,False,False,False,260,-88.2921142578125,-97.35595703125,1
There weren't few mountains upsetting Karen.,There weren't most mountains upsetting Karen.,semantics,quantifiers,existential_there_quantifiers_1,True,False,False,False,261,-52.236045837402344,-52.03083801269531,0
There were no stories shocking Natalie.,There were most stories shocking Natalie.,semantics,quantifiers,existential_there_quantifiers_1,True,False,False,False,262,-45.53990936279297,-47.011741638183594,1
There wasn't a grandfather of the teenagers descending this hill.,There wasn't each grandfather of the teenagers descending this hill.,semantics,quantifiers,existential_there_quantifiers_1,True,False,False,False,263,-72.80500030517578,-81.26908874511719,1
There were some movie theaters upsetting Jason.,There were all movie theaters upsetting Jason.,semantics,quantifiers,existential_there_quantifiers_1,True,False,False,False,264,-56.31761932373047,-61.1076545715332,1
There wasn't a grocery store disappearing.,There wasn't every grocery store disappearing.,semantics,quantifiers,existential_there_quantifiers_1,True,False,False,False,265,-41.64054489135742,-51.395111083984375,1
There isn't a grandmother of Eva astounding Rachel.,There isn't each grandmother of Eva astounding Rachel.,semantics,quantifiers,existential_there_quantifiers_1,True,False,False,False,266,-64.66549682617188,-76.34253692626953,1
There aren't few prints of those hats distracting Douglas.,There aren't most prints of those hats distracting Douglas.,semantics,quantifiers,existential_there_quantifiers_1,True,False,False,False,267,-75.31966400146484,-75.4113540649414,1
There wasn't a closet astounding Mary.,There wasn't every closet astounding Mary.,semantics,quantifiers,existential_there_quantifiers_1,True,False,False,False,268,-48.858036041259766,-57.78203582763672,1
There was a projector worrying Richard.,There was every projector worrying Richard.,semantics,quantifiers,existential_there_quantifiers_1,True,False,False,False,269,-46.361328125,-55.92262268066406,1
There was a sketch bothering Timothy.,There was each sketch bothering Timothy.,semantics,quantifiers,existential_there_quantifiers_1,True,False,False,False,270,-42.406341552734375,-52.411006927490234,1
There weren't few shows about art aggravating Paul.,There weren't most shows about art aggravating Paul.,semantics,quantifiers,existential_there_quantifiers_1,True,False,False,False,271,-69.07769775390625,-69.01985168457031,0
There was a legislature believing waiters to cooperate.,There was every legislature believing waiters to cooperate.,semantics,quantifiers,existential_there_quantifiers_1,True,False,False,False,272,-69.33499145507812,-77.35540771484375,1
There was a public park stunning that government.,There was each public park stunning that government.,semantics,quantifiers,existential_there_quantifiers_1,True,False,False,False,273,-50.17198944091797,-59.664886474609375,1
There was a projector stunning Robert.,There was each projector stunning Robert.,semantics,quantifiers,existential_there_quantifiers_1,True,False,False,False,274,-49.29334259033203,-59.643211364746094,1
There is a rabbit wasting away.,There is each rabbit wasting away.,semantics,quantifiers,existential_there_quantifiers_1,True,False,False,False,275,-35.87040710449219,-46.807926177978516,1
There were no public parks alarming Curtis.,There were all public parks alarming Curtis.,semantics,quantifiers,existential_there_quantifiers_1,True,False,False,False,276,-53.43656921386719,-55.25989532470703,1
There wasn't a sketch aggravating Tiffany.,There wasn't every sketch aggravating Tiffany.,semantics,quantifiers,existential_there_quantifiers_1,True,False,False,False,277,-52.4839973449707,-59.53773498535156,1
There weren't many senators hiring Donna.,There weren't all senators hiring Donna.,semantics,quantifiers,existential_there_quantifiers_1,True,False,False,False,278,-55.08366012573242,-58.95452117919922,1
There are some plays about art disturbing Pamela.,There are most plays about art disturbing Pamela.,semantics,quantifiers,existential_there_quantifiers_1,True,False,False,False,279,-60.13479995727539,-64.03643035888672,1
There isn't a movie theater irritating Edward.,There isn't every movie theater irritating Edward.,semantics,quantifiers,existential_there_quantifiers_1,True,False,False,False,280,-52.56079864501953,-58.8026008605957,1
There is a legislature thinking about who say the carriage hadn't impressed Sara.,There is every legislature thinking about who say the carriage hadn't impressed Sara.,semantics,quantifiers,existential_there_quantifiers_1,True,False,False,False,281,-97.29936218261719,-104.06449890136719,1
There was a school failing to nod.,There was every school failing to nod.,semantics,quantifiers,existential_there_quantifiers_1,True,False,False,False,282,-43.71571350097656,-49.208778381347656,1
There was a grandmother of these doctors pressuring Colleen to heal Homer.,There was every grandmother of these doctors pressuring Colleen to heal Homer.,semantics,quantifiers,existential_there_quantifiers_1,True,False,False,False,283,-99.18440246582031,-107.30767822265625,1
There were no dogs disgusting dancers.,There were all dogs disgusting dancers.,semantics,quantifiers,existential_there_quantifiers_1,True,False,False,False,284,-44.75054168701172,-44.68344497680664,0
There was an essay boring Carla.,There was every essay boring Carla.,semantics,quantifiers,existential_there_quantifiers_1,True,False,False,False,285,-47.17091369628906,-55.554203033447266,1
There were many cafes alarming Sonia.,There were most cafes alarming Sonia.,semantics,quantifiers,existential_there_quantifiers_1,True,False,False,False,286,-57.44704055786133,-59.20930480957031,1
There were some hospitals assembling.,There were most hospitals assembling.,semantics,quantifiers,existential_there_quantifiers_1,True,False,False,False,287,-33.80812072753906,-37.83501052856445,1
There was a print falling.,There was each print falling.,semantics,quantifiers,existential_there_quantifiers_1,True,False,False,False,288,-28.394176483154297,-38.989009857177734,1
There were some nieces of Helen urging Christina's senator to discuss those adults.,There were most nieces of Helen urging Christina's senator to discuss those adults.,semantics,quantifiers,existential_there_quantifiers_1,True,False,False,False,289,-119.56842803955078,-123.02717590332031,1
There was a wheelbarrow vanishing.,There was every wheelbarrow vanishing.,semantics,quantifiers,existential_there_quantifiers_1,True,False,False,False,290,-51.216552734375,-59.083702087402344,1
There were no sketches of Ann boring every woman.,There were most sketches of Ann boring every woman.,semantics,quantifiers,existential_there_quantifiers_1,True,False,False,False,291,-63.70650100708008,-66.51580810546875,1
There weren't many patients happening to wake up.,There weren't all patients happening to wake up.,semantics,quantifiers,existential_there_quantifiers_1,True,False,False,False,292,-45.86049270629883,-50.12913131713867,1
There is a box bothering Anna.,There is each box bothering Anna.,semantics,quantifiers,existential_there_quantifiers_1,True,False,False,False,293,-37.98027420043945,-47.40831756591797,1
There are no forks slipping.,There are all forks slipping.,semantics,quantifiers,existential_there_quantifiers_1,True,False,False,False,294,-34.009822845458984,-35.762062072753906,1
There wasn't a granddaughter of Ella fixing most wheelbarrows.,There wasn't each granddaughter of Ella fixing most wheelbarrows.,semantics,quantifiers,existential_there_quantifiers_1,True,False,False,False,295,-94.70634460449219,-103.91950988769531,1
There weren't many windows chipping.,There weren't all windows chipping.,semantics,quantifiers,existential_there_quantifiers_1,True,False,False,False,296,-41.92864990234375,-45.38861083984375,1
There isn't a muffin worrying Tamara.,There isn't each muffin worrying Tamara.,semantics,quantifiers,existential_there_quantifiers_1,True,False,False,False,297,-57.591552734375,-68.06820678710938,1
There are no trucks steering.,There are most trucks steering.,semantics,quantifiers,existential_there_quantifiers_1,True,False,False,False,298,-30.150888442993164,-32.197113037109375,1
There were some committees boring Eric.,There were most committees boring Eric.,semantics,quantifiers,existential_there_quantifiers_1,True,False,False,False,299,-43.85674285888672,-47.87496566772461,1
There is a book annoying Tamara.,There is each book annoying Tamara.,semantics,quantifiers,existential_there_quantifiers_1,True,False,False,False,300,-48.11920166015625,-57.32916259765625,1
There wasn't a play about Spain boring Laura.,There wasn't each play about Spain boring Laura.,semantics,quantifiers,existential_there_quantifiers_1,True,False,False,False,301,-64.02391052246094,-72.49800109863281,1
There were no prints of most cafes disappearing.,There were most prints of most cafes disappearing.,semantics,quantifiers,existential_there_quantifiers_1,True,False,False,False,302,-61.82196807861328,-64.60720825195312,1
There isn't a skirt looking like the photographs.,There isn't each skirt looking like the photographs.,semantics,quantifiers,existential_there_quantifiers_1,True,False,False,False,303,-45.3325080871582,-55.72343444824219,1
There wasn't a drawing aggravating Caroline.,There wasn't each drawing aggravating Caroline.,semantics,quantifiers,existential_there_quantifiers_1,True,False,False,False,304,-51.83489227294922,-61.85995864868164,1
There are many muffins scorching.,There are all muffins scorching.,semantics,quantifiers,existential_there_quantifiers_1,True,False,False,False,305,-46.331878662109375,-48.41883087158203,1
There was a senator hugging Judy.,There was every senator hugging Judy.,semantics,quantifiers,existential_there_quantifiers_1,True,False,False,False,306,-46.38270568847656,-55.320945739746094,1
There weren't many mirrors worrying Frank.,There weren't most mirrors worrying Frank.,semantics,quantifiers,existential_there_quantifiers_1,True,False,False,False,307,-51.5615348815918,-55.75440216064453,1
There wasn't a book about politics bothering Barbara.,There wasn't each book about politics bothering Barbara.,semantics,quantifiers,existential_there_quantifiers_1,True,False,False,False,308,-55.48858642578125,-66.21249389648438,1
There are some chairs distracting Alicia.,There are most chairs distracting Alicia.,semantics,quantifiers,existential_there_quantifiers_1,True,False,False,False,309,-44.59962463378906,-48.23064422607422,1
There aren't few plays about art disagreeing.,There aren't all plays about art disagreeing.,semantics,quantifiers,existential_there_quantifiers_1,True,False,False,False,310,-57.698951721191406,-55.25321960449219,0
There isn't a father of Randolf exiting those restaurants.,There isn't each father of Randolf exiting those restaurants.,semantics,quantifiers,existential_there_quantifiers_1,True,False,False,False,311,-76.26554107666016,-85.81898498535156,1
There are few guests insulting all actresses.,There are all guests insulting all actresses.,semantics,quantifiers,existential_there_quantifiers_1,True,False,False,False,312,-52.04212951660156,-52.02024841308594,0
There isn't a cake astounding Rachel.,There isn't every cake astounding Rachel.,semantics,quantifiers,existential_there_quantifiers_1,True,False,False,False,313,-50.09189224243164,-57.93199157714844,1
There were many fish climbing down mountains.,There were all fish climbing down mountains.,semantics,quantifiers,existential_there_quantifiers_1,True,False,False,False,314,-41.47148513793945,-42.41398620605469,1
There wasn't a cashier boycotting an association.,There wasn't each cashier boycotting an association.,semantics,quantifiers,existential_there_quantifiers_1,True,False,False,False,315,-73.55694580078125,-79.92930603027344,1
There was a drawing of Melissa embarrassing Gregory.,There was every drawing of Melissa embarrassing Gregory.,semantics,quantifiers,existential_there_quantifiers_1,True,False,False,False,316,-58.792728424072266,-67.87845611572266,1
There wasn't a jacket vanishing.,There wasn't every jacket vanishing.,semantics,quantifiers,existential_there_quantifiers_1,True,False,False,False,317,-34.512725830078125,-43.12388610839844,1
There are many reports about the Lutherans impressing many banks.,There are most reports about the Lutherans impressing many banks.,semantics,quantifiers,existential_there_quantifiers_1,True,False,False,False,318,-83.32899475097656,-85.9248046875,1
There were some lamps shocking Russell.,There were all lamps shocking Russell.,semantics,quantifiers,existential_there_quantifiers_1,True,False,False,False,319,-46.65177536010742,-48.99148941040039,1
There are few doors wasting away.,There are most doors wasting away.,semantics,quantifiers,existential_there_quantifiers_1,True,False,False,False,320,-37.24263000488281,-38.52936553955078,1
There were many nephews of some actor visiting Frank.,There were all nephews of some actor visiting Frank.,semantics,quantifiers,existential_there_quantifiers_1,True,False,False,False,321,-71.63468170166016,-72.97897338867188,1
There are no eyes bothering Grace.,There are most eyes bothering Grace.,semantics,quantifiers,existential_there_quantifiers_1,True,False,False,False,322,-41.159698486328125,-45.06666946411133,1
There are no public parks falling.,There are most public parks falling.,semantics,quantifiers,existential_there_quantifiers_1,True,False,False,False,323,-35.089637756347656,-37.82933044433594,1
There isn't a unicycle disappearing.,There isn't every unicycle disappearing.,semantics,quantifiers,existential_there_quantifiers_1,True,False,False,False,324,-42.14281463623047,-50.873592376708984,1
There were some libraries embarrassing Spain.,There were most libraries embarrassing Spain.,semantics,quantifiers,existential_there_quantifiers_1,True,False,False,False,325,-47.0604248046875,-50.817848205566406,1
There wasn't a mall wasting away.,There wasn't each mall wasting away.,semantics,quantifiers,existential_there_quantifiers_1,True,False,False,False,326,-41.02395248413086,-49.661537170410156,1
There isn't a hill impressing Regina.,There isn't each hill impressing Regina.,semantics,quantifiers,existential_there_quantifiers_1,True,False,False,False,327,-54.125,-63.488258361816406,1
There weren't few hamsters astounding Nicole.,There weren't all hamsters astounding Nicole.,semantics,quantifiers,existential_there_quantifiers_1,True,False,False,False,328,-64.56083679199219,-64.19711303710938,0
There aren't few cars aggravating Laurie.,There aren't most cars aggravating Laurie.,semantics,quantifiers,existential_there_quantifiers_1,True,False,False,False,329,-51.11935043334961,-52.09034729003906,1
There are no chairs falling.,There are most chairs falling.,semantics,quantifiers,existential_there_quantifiers_1,True,False,False,False,330,-31.44037437438965,-33.986000061035156,1
There was a restaurant disturbing Melinda.,There was every restaurant disturbing Melinda.,semantics,quantifiers,existential_there_quantifiers_1,True,False,False,False,331,-46.99132537841797,-57.00193405151367,1
There were few candles worrying Rachel.,There were most candles worrying Rachel.,semantics,quantifiers,existential_there_quantifiers_1,True,False,False,False,332,-50.06397247314453,-50.1144905090332,1
There were some movies disagreeing.,There were most movies disagreeing.,semantics,quantifiers,existential_there_quantifiers_1,True,False,False,False,333,-32.24888610839844,-37.469058990478516,1
There isn't a daughter of Leslie compelling Andrew to talk to Eva.,There isn't every daughter of Leslie compelling Andrew to talk to Eva.,semantics,quantifiers,existential_there_quantifiers_1,True,False,False,False,334,-84.50343322753906,-92.55351257324219,1
There wasn't a sweater twisting.,There wasn't every sweater twisting.,semantics,quantifiers,existential_there_quantifiers_1,True,False,False,False,335,-35.98910903930664,-43.48708724975586,1
There were no candles wasting away.,There were most candles wasting away.,semantics,quantifiers,existential_there_quantifiers_1,True,False,False,False,336,-40.56423568725586,-43.207435607910156,1
There are no daughters of Stacey cooking.,There are all daughters of Stacey cooking.,semantics,quantifiers,existential_there_quantifiers_1,True,False,False,False,337,-51.66831970214844,-54.27266311645508,1
There weren't many drivers responding.,There weren't most drivers responding.,semantics,quantifiers,existential_there_quantifiers_1,True,False,False,False,338,-38.06806945800781,-41.697776794433594,1
There was a grandson of every customer disgusting Sheila.,There was every grandson of every customer disgusting Sheila.,semantics,quantifiers,existential_there_quantifiers_1,True,False,False,False,339,-62.39409637451172,-69.82737731933594,1
There wasn't a pedestrian finding out who didn't bake.,There wasn't every pedestrian finding out who didn't bake.,semantics,quantifiers,existential_there_quantifiers_1,True,False,False,False,340,-59.78175735473633,-69.5541763305664,1
There are few dishes distracting cashiers.,There are most dishes distracting cashiers.,semantics,quantifiers,existential_there_quantifiers_1,True,False,False,False,341,-53.37688064575195,-54.72099685668945,1
There wasn't a light astounding Brad.,There wasn't every light astounding Brad.,semantics,quantifiers,existential_there_quantifiers_1,True,False,False,False,342,-49.87811279296875,-57.634639739990234,1
There weren't many drivers inducing the Borgias to leave Tanya.,There weren't most drivers inducing the Borgias to leave Tanya.,semantics,quantifiers,existential_there_quantifiers_1,True,False,False,False,343,-98.8841552734375,-102.22272491455078,1
There was a turtle embarrassing a lot of girls.,There was every turtle embarrassing a lot of girls.,semantics,quantifiers,existential_there_quantifiers_1,True,False,False,False,344,-46.81116485595703,-56.83479690551758,1
There isn't a play about the Lutherans alarming Samantha.,There isn't each play about the Lutherans alarming Samantha.,semantics,quantifiers,existential_there_quantifiers_1,True,False,False,False,345,-79.926513671875,-87.39720916748047,1
There are few restaurants alarming Stephanie.,There are all restaurants alarming Stephanie.,semantics,quantifiers,existential_there_quantifiers_1,True,False,False,False,346,-46.583831787109375,-47.963623046875,1
There were no governments realizing who wasn't spinning around.,There were all governments realizing who wasn't spinning around.,semantics,quantifiers,existential_there_quantifiers_1,True,False,False,False,347,-66.00104522705078,-68.36360168457031,1
There was a sock wasting away.,There was every sock wasting away.,semantics,quantifiers,existential_there_quantifiers_1,True,False,False,False,348,-38.19922637939453,-46.924259185791016,1
There are some prints of Cheryl shocking Edward.,There are most prints of Cheryl shocking Edward.,semantics,quantifiers,existential_there_quantifiers_1,True,False,False,False,349,-63.92097091674805,-67.0618896484375,1
There is a brother of Alan figuring out who shrug.,There is every brother of Alan figuring out who shrug.,semantics,quantifiers,existential_there_quantifiers_1,True,False,False,False,350,-67.71307373046875,-77.74767303466797,1
There is a chair shocking Becca.,There is every chair shocking Becca.,semantics,quantifiers,existential_there_quantifiers_1,True,False,False,False,351,-48.897247314453125,-55.99897766113281,1
There aren't many mountains astounding Florence.,There aren't most mountains astounding Florence.,semantics,quantifiers,existential_there_quantifiers_1,True,False,False,False,352,-52.54090118408203,-55.642906188964844,1
There are few birds alarming Tanya.,There are most birds alarming Tanya.,semantics,quantifiers,existential_there_quantifiers_1,True,False,False,False,353,-53.46644592285156,-54.52241897583008,1
There are no bikes maneuvering.,There are all bikes maneuvering.,semantics,quantifiers,existential_there_quantifiers_1,True,False,False,False,354,-37.48406219482422,-39.88560485839844,1
There are no waitresses curing all teachers.,There are most waitresses curing all teachers.,semantics,quantifiers,existential_there_quantifiers_1,True,False,False,False,355,-57.6010856628418,-61.44066619873047,1
There isn't an art gallery looking like the paintings.,There isn't every art gallery looking like the paintings.,semantics,quantifiers,existential_there_quantifiers_1,True,False,False,False,356,-56.67483901977539,-63.921669006347656,1
There is a college campus disgusting Vanessa.,There is each college campus disgusting Vanessa.,semantics,quantifiers,existential_there_quantifiers_1,True,False,False,False,357,-53.09868240356445,-62.218780517578125,1
There weren't few pants irritating a man.,There weren't all pants irritating a man.,semantics,quantifiers,existential_there_quantifiers_1,True,False,False,False,358,-51.41097640991211,-49.642822265625,0
There are some muffins disgusting Mary.,There are all muffins disgusting Mary.,semantics,quantifiers,existential_there_quantifiers_1,True,False,False,False,359,-47.80561447143555,-50.87153625488281,1
There aren't few prints of Maria irritating that waitress.,There aren't all prints of Maria irritating that waitress.,semantics,quantifiers,existential_there_quantifiers_1,True,False,False,False,360,-78.14775848388672,-76.72909545898438,0
There wasn't a college campus shocking Beverly.,There wasn't each college campus shocking Beverly.,semantics,quantifiers,existential_there_quantifiers_1,True,False,False,False,361,-57.42274475097656,-67.85041046142578,1
There wasn't a muffin scorching.,There wasn't each muffin scorching.,semantics,quantifiers,existential_there_quantifiers_1,True,False,False,False,362,-46.506561279296875,-57.88407897949219,1
There wasn't a sketch of the rugs embarrassing Tara.,There wasn't each sketch of the rugs embarrassing Tara.,semantics,quantifiers,existential_there_quantifiers_1,True,False,False,False,363,-71.34075927734375,-79.73123931884766,1
There aren't few art galleries impressing Brian.,There aren't most art galleries impressing Brian.,semantics,quantifiers,existential_there_quantifiers_1,True,False,False,False,364,-67.30046081542969,-67.49739074707031,1
There was a son of William wishing to look like a lot of photographs.,There was each son of William wishing to look like a lot of photographs.,semantics,quantifiers,existential_there_quantifiers_1,True,False,False,False,365,-60.63254165649414,-73.55946350097656,1
There were some cousins of Becca thinking the pedestrian wasn't questioning Tamara.,There were all cousins of Becca thinking the pedestrian wasn't questioning Tamara.,semantics,quantifiers,existential_there_quantifiers_1,True,False,False,False,366,-110.35774993896484,-112.49425506591797,1
