sentence_good,sentence_bad,field,linguistics_term,UID,simple_LM_method,one_prefix_method,two_prefix_method,lexically_identical,pair_id,good_prob,bad_prob,correct
A lot of patients who can sell some couch didn't investigate themselves.,A lot of patients who can sell some couch didn't investigate itself.,syntax_semantics,binding,principle_A_c_command,True,True,False,False,0,-81.67650604248047,-84.60748291015625,1
A lot of actresses that thought about Alice healed themselves.,A lot of actresses that thought about Alice healed herself.,syntax_semantics,binding,principle_A_c_command,True,True,False,False,1,-74.77204132080078,-75.0562744140625,1
A guy that has seen the wheelbarrow notices himself.,A guy that has seen the wheelbarrow notices itself.,syntax_semantics,binding,principle_A_c_command,True,True,False,False,2,-88.40092468261719,-86.8865737915039,0
The children that were complaining about Gregory hated themselves.,The children that were complaining about Gregory hated himself.,syntax_semantics,binding,principle_A_c_command,True,True,False,False,3,-55.39694595336914,-55.575897216796875,1
Every boy that isn't selling the grocery stores isn't healing himself.,Every boy that isn't selling the grocery stores isn't healing themselves.,syntax_semantics,binding,principle_A_c_command,True,True,False,False,4,-83.85631561279297,-82.93946838378906,0
The hospitals that talk to Ann talked to themselves.,The hospitals that talk to Ann talked to herself.,syntax_semantics,binding,principle_A_c_command,True,True,False,False,5,-52.059993743896484,-53.43896484375,1
Many skirts that stun some waitress are boring themselves.,Many skirts that stun some waitress are boring herself.,syntax_semantics,binding,principle_A_c_command,True,True,False,False,6,-68.87638854980469,-72.11280059814453,1
All men that might fire Tiffany have worked with themselves.,All men that might fire Tiffany have worked with herself.,syntax_semantics,binding,principle_A_c_command,True,True,False,False,7,-65.55974578857422,-69.17450714111328,1
That actress who admired the cup praises herself.,That actress who admired the cup praises itself.,syntax_semantics,binding,principle_A_c_command,True,True,False,False,8,-69.63706970214844,-68.87867736816406,0
This lady who is healing Charles wasn't hiding herself.,This lady who is healing Charles wasn't hiding himself.,syntax_semantics,binding,principle_A_c_command,True,True,False,False,9,-66.62452697753906,-65.416748046875,0
Every woman that was hiring the Borgias argued about herself.,Every woman that was hiring the Borgias argued about themselves.,syntax_semantics,binding,principle_A_c_command,True,True,False,False,10,-80.51747131347656,-78.88485717773438,0
Every lady who does walk through a lot of movie theaters hadn't hugged herself.,Every lady who does walk through a lot of movie theaters hadn't hugged themselves.,syntax_semantics,binding,principle_A_c_command,True,True,False,False,11,-88.96862030029297,-87.58055114746094,0
These doctors who do leave Melissa fled from themselves.,These doctors who do leave Melissa fled from herself.,syntax_semantics,binding,principle_A_c_command,True,True,False,False,12,-60.416778564453125,-62.83214569091797,1
These ladies that hadn't forgotten Victoria fled from themselves.,These ladies that hadn't forgotten Victoria fled from herself.,syntax_semantics,binding,principle_A_c_command,True,True,False,False,13,-68.64873504638672,-70.43336486816406,1
The customers who embarrass Kevin are discussing themselves.,The customers who embarrass Kevin are discussing himself.,syntax_semantics,binding,principle_A_c_command,True,True,False,False,14,-63.348045349121094,-64.01606750488281,1
Some steak that scares Stacy doesn't shock itself.,Some steak that scares Stacy doesn't shock herself.,syntax_semantics,binding,principle_A_c_command,True,True,False,False,15,-69.63935089111328,-69.81752014160156,1
All ladies who were bothering Dan observed themselves.,All ladies who were bothering Dan observed himself.,syntax_semantics,binding,principle_A_c_command,True,True,False,False,16,-60.32777404785156,-60.43146514892578,1
The woman who hadn't taken a screen should respect herself.,The woman who hadn't taken a screen should respect itself.,syntax_semantics,binding,principle_A_c_command,True,True,False,False,17,-67.89630126953125,-68.55494689941406,1
Most women who were arriving at every hospital fired themselves.,Most women who were arriving at every hospital fired itself.,syntax_semantics,binding,principle_A_c_command,True,True,False,False,18,-60.108970642089844,-62.34091567993164,1
Some hill that could distract Barbara is alarming itself.,Some hill that could distract Barbara is alarming herself.,syntax_semantics,binding,principle_A_c_command,True,True,False,False,19,-77.3614501953125,-78.68563842773438,1
A lot of senators who climbed down the hill hired themselves.,A lot of senators who climbed down the hill hired itself.,syntax_semantics,binding,principle_A_c_command,True,True,False,False,20,-85.26380157470703,-87.6894302368164,1
The dancers who haven't shocked Candice aren't appreciating themselves.,The dancers who haven't shocked Candice aren't appreciating herself.,syntax_semantics,binding,principle_A_c_command,True,True,False,False,21,-93.63064575195312,-95.60777282714844,1
A legislature that wouldn't criticize Patrick hasn't helped itself.,A legislature that wouldn't criticize Patrick hasn't helped himself.,syntax_semantics,binding,principle_A_c_command,True,True,False,False,22,-84.6224365234375,-81.61402893066406,0
Most guests who were revealing Colleen weren't complaining about themselves.,Most guests who were revealing Colleen weren't complaining about herself.,syntax_semantics,binding,principle_A_c_command,True,True,False,False,23,-81.94223022460938,-84.51860809326172,1
A guy who hasn't annoyed Laura argued about himself.,A guy who hasn't annoyed Laura argued about herself.,syntax_semantics,binding,principle_A_c_command,True,True,False,False,24,-78.46170043945312,-80.06048583984375,1
That company that had known Sandra annoyed itself.,That company that had known Sandra annoyed herself.,syntax_semantics,binding,principle_A_c_command,True,True,False,False,25,-65.79558563232422,-66.33190155029297,1
Those senators who had a slope have cared for themselves.,Those senators who had a slope have cared for itself.,syntax_semantics,binding,principle_A_c_command,True,True,False,False,26,-67.18167114257812,-69.78118896484375,1
A cat that hasn't impressed Joseph couldn't distract itself.,A cat that hasn't impressed Joseph couldn't distract himself.,syntax_semantics,binding,principle_A_c_command,True,True,False,False,27,-89.13909912109375,-85.77513885498047,0
Some association that had forgotten Claire insults itself.,Some association that had forgotten Claire insults herself.,syntax_semantics,binding,principle_A_c_command,True,True,False,False,28,-65.79866027832031,-68.24114990234375,1
That plane that was scaring Wendy has disgusted itself.,That plane that was scaring Wendy has disgusted herself.,syntax_semantics,binding,principle_A_c_command,True,True,False,False,29,-80.52656555175781,-80.03207397460938,0
The dancer who has brought those fish could care for herself.,The dancer who has brought those fish could care for themselves.,syntax_semantics,binding,principle_A_c_command,True,True,False,False,30,-64.36903381347656,-61.59147262573242,0
Some boy that disturbed Jill could argue about himself.,Some boy that disturbed Jill could argue about herself.,syntax_semantics,binding,principle_A_c_command,True,True,False,False,31,-68.52995300292969,-70.03123474121094,1
Some woman that was exploring some hill can't think about herself.,Some woman that was exploring some hill can't think about itself.,syntax_semantics,binding,principle_A_c_command,True,True,False,False,32,-69.7718276977539,-69.27253723144531,0
All actors that disgust Veronica escaped from themselves.,All actors that disgust Veronica escaped from herself.,syntax_semantics,binding,principle_A_c_command,True,True,False,False,33,-66.26922607421875,-68.40083312988281,1
Some museum that doesn't like a waitress was praising itself.,Some museum that doesn't like a waitress was praising herself.,syntax_semantics,binding,principle_A_c_command,True,True,False,False,34,-69.0671615600586,-70.88704681396484,1
These pies that were embarrassing Jennifer are annoying themselves.,These pies that were embarrassing Jennifer are annoying herself.,syntax_semantics,binding,principle_A_c_command,True,True,False,False,35,-74.46681213378906,-76.80144500732422,1
The book that is disgusting dancers would irritate itself.,The book that is disgusting dancers would irritate themselves.,syntax_semantics,binding,principle_A_c_command,True,True,False,False,36,-69.01004791259766,-67.41677856445312,0
The drivers who attack Jodi haven't revealed themselves.,The drivers who attack Jodi haven't revealed herself.,syntax_semantics,binding,principle_A_c_command,True,True,False,False,37,-74.85723876953125,-77.67584991455078,1
A lot of adults that scared Stacey talked to themselves.,A lot of adults that scared Stacey talked to herself.,syntax_semantics,binding,principle_A_c_command,True,True,False,False,38,-79.05937194824219,-81.68470764160156,1
A girl that wouldn't watch Omar questions herself.,A girl that wouldn't watch Omar questions himself.,syntax_semantics,binding,principle_A_c_command,True,True,False,False,39,-72.38775634765625,-71.74295043945312,0
The men who weren't confusing Valerie were kissing themselves.,The men who weren't confusing Valerie were kissing herself.,syntax_semantics,binding,principle_A_c_command,True,True,False,False,40,-68.06340026855469,-69.22252655029297,1
Some guests who didn't discover Melissa were visiting themselves.,Some guests who didn't discover Melissa were visiting herself.,syntax_semantics,binding,principle_A_c_command,True,True,False,False,41,-66.42184448242188,-67.82998657226562,1
A lot of waiters who weren't boring Joseph would heal themselves.,A lot of waiters who weren't boring Joseph would heal himself.,syntax_semantics,binding,principle_A_c_command,True,True,False,False,42,-97.91856384277344,-97.57876586914062,0
Some organizations that haven't respected Nicole hadn't worked with themselves.,Some organizations that haven't respected Nicole hadn't worked with herself.,syntax_semantics,binding,principle_A_c_command,True,True,False,False,43,-68.98271179199219,-70.91934967041016,1
Some dancer who isn't admiring mushrooms thinks about herself.,Some dancer who isn't admiring mushrooms thinks about themselves.,syntax_semantics,binding,principle_A_c_command,True,True,False,False,44,-88.05551147460938,-85.8150405883789,0
These actors who think about Russell won't remember themselves.,These actors who think about Russell won't remember himself.,syntax_semantics,binding,principle_A_c_command,True,True,False,False,45,-57.97199630737305,-58.90312957763672,1
All cashiers who will respect Florence criticized themselves.,All cashiers who will respect Florence criticized herself.,syntax_semantics,binding,principle_A_c_command,True,True,False,False,46,-77.58059692382812,-79.16064453125,1
This book that hurt Kirsten has disagreed with itself.,This book that hurt Kirsten has disagreed with herself.,syntax_semantics,binding,principle_A_c_command,True,True,False,False,47,-70.83086395263672,-71.28140258789062,1
These adults that won't listen to Janice impressed themselves.,These adults that won't listen to Janice impressed herself.,syntax_semantics,binding,principle_A_c_command,True,True,False,False,48,-62.43217468261719,-65.47413635253906,1
The actors that were escaping from Carrie had cured themselves.,The actors that were escaping from Carrie had cured herself.,syntax_semantics,binding,principle_A_c_command,True,True,False,False,49,-71.22225952148438,-73.2637939453125,1
Every government that boasted about Amanda wasn't embarrassing itself.,Every government that boasted about Amanda wasn't embarrassing herself.,syntax_semantics,binding,principle_A_c_command,True,True,False,False,50,-71.98870849609375,-72.17781066894531,1
Some cucumbers that can embarrass Amanda disgusted themselves.,Some cucumbers that can embarrass Amanda disgusted herself.,syntax_semantics,binding,principle_A_c_command,True,True,False,False,51,-77.02165222167969,-78.81306457519531,1
Some association that would astound Gregory had scared itself.,Some association that would astound Gregory had scared himself.,syntax_semantics,binding,principle_A_c_command,True,True,False,False,52,-77.73124694824219,-77.36322784423828,0
The customers that descend every hill can praise themselves.,The customers that descend every hill can praise itself.,syntax_semantics,binding,principle_A_c_command,True,True,False,False,53,-67.86935424804688,-70.11388397216797,1
That woman who had noticed John fled from herself.,That woman who had noticed John fled from himself.,syntax_semantics,binding,principle_A_c_command,True,True,False,False,54,-61.701194763183594,-60.25892639160156,0
Some beef that had annoyed this dancer is stunning itself.,Some beef that had annoyed this dancer is stunning herself.,syntax_semantics,binding,principle_A_c_command,True,True,False,False,55,-77.33169555664062,-78.900634765625,1
These guests that haven't discovered Caroline had seen themselves.,These guests that haven't discovered Caroline had seen herself.,syntax_semantics,binding,principle_A_c_command,True,True,False,False,56,-63.6429443359375,-66.81031799316406,1
A library that has stunned Samantha criticized itself.,A library that has stunned Samantha criticized herself.,syntax_semantics,binding,principle_A_c_command,True,True,False,False,57,-77.21632385253906,-78.52107238769531,1
Every actress who observed Eric kissed herself.,Every actress who observed Eric kissed himself.,syntax_semantics,binding,principle_A_c_command,True,True,False,False,58,-55.572776794433594,-54.06935119628906,0
Every girl that hadn't disgusted Travis can't approach herself.,Every girl that hadn't disgusted Travis can't approach himself.,syntax_semantics,binding,principle_A_c_command,True,True,False,False,59,-80.62344360351562,-79.5242919921875,0
Every woman that noticed some library respects herself.,Every woman that noticed some library respects itself.,syntax_semantics,binding,principle_A_c_command,True,True,False,False,60,-60.05722427368164,-58.42743682861328,0
Senators who disagree with Thomas can't heal themselves.,Senators who disagree with Thomas can't heal himself.,syntax_semantics,binding,principle_A_c_command,True,True,False,False,61,-66.83080291748047,-66.7131118774414,0
The dancers that argue about Beverly observed themselves.,The dancers that argue about Beverly observed herself.,syntax_semantics,binding,principle_A_c_command,True,True,False,False,62,-59.366268157958984,-61.8902702331543,1
The turtles that were boring Christine disgusted themselves.,The turtles that were boring Christine disgusted herself.,syntax_semantics,binding,principle_A_c_command,True,True,False,False,63,-66.85894012451172,-68.74069213867188,1
These doctors that didn't flee from Michael visited themselves.,These doctors that didn't flee from Michael visited himself.,syntax_semantics,binding,principle_A_c_command,True,True,False,False,64,-61.88119125366211,-63.00592803955078,1
Some guy who is visiting some lakes cares for himself.,Some guy who is visiting some lakes cares for themselves.,syntax_semantics,binding,principle_A_c_command,True,True,False,False,65,-61.97771453857422,-61.2347297668457,0
Those students that looked like this print fired themselves.,Those students that looked like this print fired itself.,syntax_semantics,binding,principle_A_c_command,True,True,False,False,66,-56.040077209472656,-57.9112663269043,1
Some girl who researches committees boasts about herself.,Some girl who researches committees boasts about themselves.,syntax_semantics,binding,principle_A_c_command,True,True,False,False,67,-84.55995178222656,-82.01011657714844,0
All customers who would drive to every river haven't returned to themselves.,All customers who would drive to every river haven't returned to itself.,syntax_semantics,binding,principle_A_c_command,True,True,False,False,68,-74.08142852783203,-76.15525817871094,1
That dog that wasn't boring Jason scared itself.,That dog that wasn't boring Jason scared himself.,syntax_semantics,binding,principle_A_c_command,True,True,False,False,69,-64.84101867675781,-63.42903137207031,0
That woman that hated Scott hadn't talked about herself.,That woman that hated Scott hadn't talked about himself.,syntax_semantics,binding,principle_A_c_command,True,True,False,False,70,-64.98587799072266,-63.47029113769531,0
Some women that would approach Pamela had cured themselves.,Some women that would approach Pamela had cured herself.,syntax_semantics,binding,principle_A_c_command,True,True,False,False,71,-65.23481750488281,-68.31085205078125,1
This committee that is referencing Gina works with itself.,This committee that is referencing Gina works with herself.,syntax_semantics,binding,principle_A_c_command,True,True,False,False,72,-69.02593231201172,-68.3798828125,0
The rabbits that won't look like a painting disturbed themselves.,The rabbits that won't look like a painting disturbed itself.,syntax_semantics,binding,principle_A_c_command,True,True,False,False,73,-66.49464416503906,-66.27291107177734,0
A lot of boys who hadn't appreciated some river were working with themselves.,A lot of boys who hadn't appreciated some river were working with itself.,syntax_semantics,binding,principle_A_c_command,True,True,False,False,74,-89.41537475585938,-93.22847747802734,1
The river that impressed Cindy is impressing itself.,The river that impressed Cindy is impressing herself.,syntax_semantics,binding,principle_A_c_command,True,True,False,False,75,-69.69974517822266,-69.45976257324219,0
Most children who astounded Larry have seen themselves.,Most children who astounded Larry have seen himself.,syntax_semantics,binding,principle_A_c_command,True,True,False,False,76,-70.00558471679688,-70.98048400878906,1
Customers who love Russell had investigated themselves.,Customers who love Russell had investigated himself.,syntax_semantics,binding,principle_A_c_command,True,True,False,False,77,-56.15756607055664,-55.849220275878906,0
Some company that discussed James discusses itself.,Some company that discussed James discusses himself.,syntax_semantics,binding,principle_A_c_command,True,True,False,False,78,-55.688941955566406,-54.40829849243164,0
That couch that shouldn't aggravate all women was annoying itself.,That couch that shouldn't aggravate all women was annoying themselves.,syntax_semantics,binding,principle_A_c_command,True,True,False,False,79,-87.11729431152344,-85.58445739746094,0
Wheelbarrows that shocked the company distracted themselves.,Wheelbarrows that shocked the company distracted itself.,syntax_semantics,binding,principle_A_c_command,True,True,False,False,80,-68.54840850830078,-68.6495132446289,1
These shoes that irritate Omar hurt themselves.,These shoes that irritate Omar hurt himself.,syntax_semantics,binding,principle_A_c_command,True,True,False,False,81,-64.75709533691406,-67.00628662109375,1
An association that conceals Laurie insulted itself.,An association that conceals Laurie insulted herself.,syntax_semantics,binding,principle_A_c_command,True,True,False,False,82,-73.85084533691406,-73.50201416015625,0
That fish that astounded this actress hadn't scared itself.,That fish that astounded this actress hadn't scared herself.,syntax_semantics,binding,principle_A_c_command,True,True,False,False,83,-83.49864196777344,-83.52926635742188,1
That lady that was examining the movies remembers herself.,That lady that was examining the movies remembers themselves.,syntax_semantics,binding,principle_A_c_command,True,True,False,False,84,-60.541282653808594,-58.93421936035156,0
Most waitresses that couldn't think about some vase had disliked themselves.,Most waitresses that couldn't think about some vase had disliked itself.,syntax_semantics,binding,principle_A_c_command,True,True,False,False,85,-95.56427001953125,-96.7885513305664,1
Most boys who have confused Kristin hadn't concealed themselves.,Most boys who have confused Kristin hadn't concealed herself.,syntax_semantics,binding,principle_A_c_command,True,True,False,False,86,-82.38308715820312,-84.38697052001953,1
Most doctors that are running around this library did love themselves.,Most doctors that are running around this library did love itself.,syntax_semantics,binding,principle_A_c_command,True,True,False,False,87,-63.77936553955078,-65.58043670654297,1
The adults that scared Mary are approaching themselves.,The adults that scared Mary are approaching herself.,syntax_semantics,binding,principle_A_c_command,True,True,False,False,88,-60.557334899902344,-62.6313362121582,1
The customers who distracts the guy would investigate themselves.,The customers who distracts the guy would investigate himself.,syntax_semantics,binding,principle_A_c_command,True,True,False,False,89,-67.83769989013672,-68.12890625,1
Most cars that astound Catherine irritated themselves.,Most cars that astound Catherine irritated herself.,syntax_semantics,binding,principle_A_c_command,True,True,False,False,90,-64.39200592041016,-66.54594421386719,1
The woman who loves Theodore notices herself.,The woman who loves Theodore notices himself.,syntax_semantics,binding,principle_A_c_command,True,True,False,False,91,-53.47871780395508,-52.2591552734375,0
Most women that passed the hill won't conceal themselves.,Most women that passed the hill won't conceal itself.,syntax_semantics,binding,principle_A_c_command,True,True,False,False,92,-62.281673431396484,-64.08405303955078,1
A girl that is fleeing from Derek wasn't discovering herself.,A girl that is fleeing from Derek wasn't discovering himself.,syntax_semantics,binding,principle_A_c_command,True,True,False,False,93,-91.98341369628906,-90.54338836669922,0
Some children who leave Erin are observing themselves.,Some children who leave Erin are observing herself.,syntax_semantics,binding,principle_A_c_command,True,True,False,False,94,-57.06883239746094,-60.01342010498047,1
Most waitresses that praised Ruth aren't appreciating themselves.,Most waitresses that praised Ruth aren't appreciating herself.,syntax_semantics,binding,principle_A_c_command,True,True,False,False,95,-89.42171478271484,-90.97103881835938,1
Some legislatures that haven't argued about Jeffrey worked with themselves.,Some legislatures that haven't argued about Jeffrey worked with himself.,syntax_semantics,binding,principle_A_c_command,True,True,False,False,96,-77.70054626464844,-77.94602966308594,1
The organization that has disliked many books insults itself.,The organization that has disliked many books insults themselves.,syntax_semantics,binding,principle_A_c_command,True,True,False,False,97,-68.60514831542969,-68.71319580078125,1
Those fish that are embarrassing Catherine aren't disgusting themselves.,Those fish that are embarrassing Catherine aren't disgusting herself.,syntax_semantics,binding,principle_A_c_command,True,True,False,False,98,-63.16156768798828,-66.03984069824219,1
This girl who boasted about some book could hate herself.,This girl who boasted about some book could hate itself.,syntax_semantics,binding,principle_A_c_command,True,True,False,False,99,-70.37823486328125,-70.65678405761719,1
A lot of banks that weren't talking to Kayla will forget themselves.,A lot of banks that weren't talking to Kayla will forget herself.,syntax_semantics,binding,principle_A_c_command,True,True,False,False,100,-91.90126037597656,-95.23775482177734,1
These committees that don't work with Frank will dislike themselves.,These committees that don't work with Frank will dislike himself.,syntax_semantics,binding,principle_A_c_command,True,True,False,False,101,-67.23318481445312,-68.28627014160156,1
An actress that wasn't boasting about Todd isn't discovering herself.,An actress that wasn't boasting about Todd isn't discovering himself.,syntax_semantics,binding,principle_A_c_command,True,True,False,False,102,-90.14903259277344,-88.74188232421875,0
Some companies that were hurting David don't criticize themselves.,Some companies that were hurting David don't criticize himself.,syntax_semantics,binding,principle_A_c_command,True,True,False,False,103,-58.98438262939453,-59.29482650756836,1
All dancers who passed the college campus can hate themselves.,All dancers who passed the college campus can hate itself.,syntax_semantics,binding,principle_A_c_command,True,True,False,False,104,-72.90769958496094,-74.96784973144531,1
All universities that aggravated Carmen shouldn't astound themselves.,All universities that aggravated Carmen shouldn't astound herself.,syntax_semantics,binding,principle_A_c_command,True,True,False,False,105,-85.10159301757812,-85.40199279785156,1
This unicycle that shouldn't hurt Suzanne will disturb itself.,This unicycle that shouldn't hurt Suzanne will disturb herself.,syntax_semantics,binding,principle_A_c_command,True,True,False,False,106,-82.44526672363281,-82.54031372070312,1
That waitress who talked about many malls observed herself.,That waitress who talked about many malls observed themselves.,syntax_semantics,binding,principle_A_c_command,True,True,False,False,107,-78.96392059326172,-76.46044921875,0
That eggplant that astounded Douglas disturbs itself.,That eggplant that astounded Douglas disturbs himself.,syntax_semantics,binding,principle_A_c_command,True,True,False,False,108,-92.62846374511719,-92.19847106933594,0
Every girl that should bike to some hospitals had attacked herself.,Every girl that should bike to some hospitals had attacked themselves.,syntax_semantics,binding,principle_A_c_command,True,True,False,False,109,-76.84481048583984,-74.72148132324219,0
