sentence_good,sentence_bad,field,linguistics_term,UID,simple_LM_method,one_prefix_method,two_prefix_method,lexically_identical,pair_id,good_prob,bad_prob,correct
Craig hasn't preferred there to be a library daring every nephew of Thomas to win.,Craig hasn't pressured there to be a library daring every nephew of Thomas to win.,syntax_semantics,control_raising,existential_there_object_raising,True,False,True,False,188,-110.5261459350586,-116.48785400390625,1
Michael isn't declaring there to be an essay winning.,Michael isn't urging there to be an essay winning.,syntax_semantics,control_raising,existential_there_object_raising,True,False,True,False,189,-60.66534423828125,-62.50742721557617,1
All synopses have declared there to be fewer than three cars disturbing every actor.,All synopses have prodded there to be fewer than three cars disturbing every actor.,syntax_semantics,control_raising,existential_there_object_raising,True,False,True,False,190,-113.5788803100586,-129.8643798828125,1
Liam's friends predicted there to be many mouths scaring Karen.,Liam's friends motivate there to be many mouths scaring Karen.,syntax_semantics,control_raising,existential_there_object_raising,True,False,True,False,191,-99.43956756591797,-104.04841613769531,1
The sons of Alexander haven't predicted there to be some universities proposing to negotiate.,The sons of Alexander haven't convinced there to be some universities proposing to negotiate.,syntax_semantics,control_raising,existential_there_object_raising,True,False,True,False,192,-99.19154357910156,-100.00773620605469,1
Gregory's brother did consider there to be no adults persuading Cindy to blink.,Gregory's brother did prompt there to be no adults persuading Cindy to blink.,syntax_semantics,control_raising,existential_there_object_raising,True,False,True,False,193,-124.61737060546875,-130.64744567871094,1
Edward could consider there to be many teachers vanishing.,Edward could encourage there to be many teachers vanishing.,syntax_semantics,control_raising,existential_there_object_raising,True,False,True,False,194,-60.439125061035156,-61.954139709472656,1
Linda did anticipate there to be some lamps darkening.,Linda did commission there to be some lamps darkening.,syntax_semantics,control_raising,existential_there_object_raising,True,False,True,False,195,-92.68269348144531,-89.7037124633789,0
Legislatures haven't believed there to be a driver chuckling.,Legislatures haven't induced there to be a driver chuckling.,syntax_semantics,control_raising,existential_there_object_raising,True,False,True,False,196,-87.32524108886719,-92.24958801269531,1
Monica's partners expect there to be eyes flinging open.,Monica's partners advised there to be eyes flinging open.,syntax_semantics,control_raising,existential_there_object_raising,True,False,True,False,197,-81.58314514160156,-84.47896575927734,1
Sheila wants there to be a fork chipping.,Sheila entices there to be a fork chipping.,syntax_semantics,control_raising,existential_there_object_raising,True,False,True,False,198,-63.091453552246094,-82.33868408203125,1
John's student couldn't prefer there to be a high school existing.,John's student couldn't encourage there to be a high school existing.,syntax_semantics,control_raising,existential_there_object_raising,True,False,True,False,199,-73.030029296875,-71.7544937133789,0
Walter isn't believing there to be broccoli stunning Tonya.,Walter isn't prodding there to be broccoli stunning Tonya.,syntax_semantics,control_raising,existential_there_object_raising,True,False,True,False,200,-86.72834014892578,-105.15617370605469,1
Kirsten's French teacher had ascertained there to be no essays about the Lutherans alarming Candice.,Kirsten's French teacher had pressed there to be no essays about the Lutherans alarming Candice.,syntax_semantics,control_raising,existential_there_object_raising,True,False,True,False,201,-177.87362670898438,-161.11669921875,0
All grandmothers of Regina would want there to be a muffin looking like most pictures.,All grandmothers of Regina would prompt there to be a muffin looking like most pictures.,syntax_semantics,control_raising,existential_there_object_raising,True,False,True,False,202,-109.19954681396484,-119.1983642578125,1
Lissa can judge there to be computers alarming Holly.,Lissa can beg there to be computers alarming Holly.,syntax_semantics,control_raising,existential_there_object_raising,True,False,True,False,203,-87.15047454833984,-87.27798461914062,1
All guys will need there to be a woman astounding Kayla.,All guys will oblige there to be a woman astounding Kayla.,syntax_semantics,control_raising,existential_there_object_raising,True,False,True,False,204,-83.87028503417969,-95.29691314697266,1
Tonya's mentors will anticipate there to be a plate appearing.,Tonya's mentors will compel there to be a plate appearing.,syntax_semantics,control_raising,existential_there_object_raising,True,False,True,False,205,-90.91576385498047,-93.28773498535156,1
Steve isn't finding there to be an essay aggravating Valerie.,Steve isn't imploring there to be an essay aggravating Valerie.,syntax_semantics,control_raising,existential_there_object_raising,True,False,True,False,206,-77.5162124633789,-90.00814056396484,1
Many committees don't need there to be a mouth annoying Laurie.,Many committees don't badger there to be a mouth annoying Laurie.,syntax_semantics,control_raising,existential_there_object_raising,True,False,True,False,207,-73.94847106933594,-93.45977783203125,1
Ruth was discovering there to be slopes disgusting Tracy.,Ruth was advising there to be slopes disgusting Tracy.,syntax_semantics,control_raising,existential_there_object_raising,True,False,True,False,208,-91.53993225097656,-90.36027526855469,0
Alicia wants there to be a mother of the adult going fishing.,Alicia motivates there to be a mother of the adult going fishing.,syntax_semantics,control_raising,existential_there_object_raising,True,False,True,False,209,-88.99955749511719,-108.4012222290039,1
Linda's nephews consider there to be a car astounding a waitress.,Linda's nephews force there to be a car astounding a waitress.,syntax_semantics,control_raising,existential_there_object_raising,True,False,True,False,210,-92.30596160888672,-91.25758361816406,0
Jerry had believed there to be many drawings falling.,Jerry had pressured there to be many drawings falling.,syntax_semantics,control_raising,existential_there_object_raising,True,False,True,False,211,-61.133216857910156,-66.1721420288086,1
Cindy's spouse would declare there to be rabbits falling.,Cindy's spouse would sway there to be rabbits falling.,syntax_semantics,control_raising,existential_there_object_raising,True,False,True,False,212,-98.48058319091797,-100.94608306884766,1
Heidi could need there to be fewer than three wheelbarrows slowing.,Heidi could require there to be fewer than three wheelbarrows slowing.,syntax_semantics,control_raising,existential_there_object_raising,True,False,True,False,213,-105.36624145507812,-104.90927124023438,0
Tanya hadn't declared there to be an actress leaving Laura.,Tanya hadn't badgered there to be an actress leaving Laura.,syntax_semantics,control_raising,existential_there_object_raising,True,False,True,False,214,-88.39820861816406,-101.80740356445312,1
Karla's plumber wouldn't discover there to be no horses climbing up some steps.,Karla's plumber wouldn't require there to be no horses climbing up some steps.,syntax_semantics,control_raising,existential_there_object_raising,True,False,True,False,215,-106.42388916015625,-102.8602294921875,0
Some fathers of Danielle can't declare there to be pork irritating Brenda.,Some fathers of Danielle can't encourage there to be pork irritating Brenda.,syntax_semantics,control_raising,existential_there_object_raising,True,False,True,False,216,-102.14087677001953,-99.99388122558594,0
Brenda might declare there to be a car bothering the guest.,Brenda might prod there to be a car bothering the guest.,syntax_semantics,control_raising,existential_there_object_raising,True,False,True,False,217,-69.5496826171875,-76.92200469970703,1
Kimberley's brother declares there to be a lot of students turning out to flatten.,Kimberley's brother persuades there to be a lot of students turning out to flatten.,syntax_semantics,control_raising,existential_there_object_raising,True,False,True,False,218,-106.55021667480469,-121.2279281616211,1
Cindy hadn't found there to be many lights annoying a lot of students.,Cindy hadn't asked there to be many lights annoying a lot of students.,syntax_semantics,control_raising,existential_there_object_raising,True,False,True,False,219,-96.49708557128906,-97.65446472167969,1
All grandmothers of Victoria are declaring there to be an icicle freezing.,All grandmothers of Victoria are swaying there to be an icicle freezing.,syntax_semantics,control_raising,existential_there_object_raising,True,False,True,False,220,-102.19693756103516,-105.68962097167969,1
Patrick hasn't considered there to be no pedestrians hiring Cheryl.,Patrick hasn't persuaded there to be no pedestrians hiring Cheryl.,syntax_semantics,control_raising,existential_there_object_raising,True,False,True,False,221,-74.69735717773438,-77.7221908569336,1
Tonya isn't judging there to be a banana disappearing.,Tonya isn't compelling there to be a banana disappearing.,syntax_semantics,control_raising,existential_there_object_raising,True,False,True,False,222,-68.44503021240234,-68.56196594238281,1
Alicia believes there to be fewer than three glaciers embarrassing Candice.,Alicia orders there to be fewer than three glaciers embarrassing Candice.,syntax_semantics,control_raising,existential_there_object_raising,True,False,True,False,223,-113.51936340332031,-115.21124267578125,1
Some boys weren't believing there to be fewer than three shows about travel bothering Nicole.,Some boys weren't enticing there to be fewer than three shows about travel bothering Nicole.,syntax_semantics,control_raising,existential_there_object_raising,True,False,True,False,224,-104.91140747070312,-109.06689453125,1
Vincent's granddaughters prefer there to be a lot of lights worrying Carmen.,Vincent's granddaughters obligated there to be a lot of lights worrying Carmen.,syntax_semantics,control_raising,existential_there_object_raising,True,False,True,False,225,-116.60723876953125,-122.43330383300781,1
Cheryl expected there to be cilantro existing.,Cheryl induced there to be cilantro existing.,syntax_semantics,control_raising,existential_there_object_raising,True,False,True,False,226,-92.99531555175781,-95.21923828125,1
Bill's students wanted there to be fewer than three hospitals advising that nephew of Julia to break some bicycles.,Bill's students compel there to be fewer than three hospitals advising that nephew of Julia to break some bicycles.,syntax_semantics,control_raising,existential_there_object_raising,True,False,True,False,227,-140.04806518554688,-155.15269470214844,1
Connie needed there to be few art galleries scaring Mitchell.,Connie forces there to be few art galleries scaring Mitchell.,syntax_semantics,control_raising,existential_there_object_raising,True,False,True,False,228,-89.19318389892578,-92.10231018066406,1
Some teacher's handymen wanted there to be few steps annoying the Clintons.,Some teacher's handymen force there to be few steps annoying the Clintons.,syntax_semantics,control_raising,existential_there_object_raising,True,False,True,False,229,-108.26994323730469,-110.39614868164062,1
A thesis judged there to be fewer than three brothers of Karen leaving.,A thesis implores there to be fewer than three brothers of Karen leaving.,syntax_semantics,control_raising,existential_there_object_raising,True,False,True,False,230,-101.58607482910156,-112.4377212524414,1
Every woman was predicting there to be a lady boasting.,Every woman was commissioning there to be a lady boasting.,syntax_semantics,control_raising,existential_there_object_raising,True,False,True,False,231,-67.50466918945312,-72.86886596679688,1
Legislatures don't anticipate there to be fewer than three gloves flattening.,Legislatures don't motivate there to be fewer than three gloves flattening.,syntax_semantics,control_raising,existential_there_object_raising,True,False,True,False,232,-114.46824645996094,-114.5341796875,1
Cynthia believes there to be a person scanning a report.,Cynthia spurred there to be a person scanning a report.,syntax_semantics,control_raising,existential_there_object_raising,True,False,True,False,233,-90.1879653930664,-97.92052459716797,1
These guests ascertained there to be a newspaper article about the Borgias shocking Theodore.,These guests prod there to be a newspaper article about the Borgias shocking Theodore.,syntax_semantics,control_raising,existential_there_object_raising,True,False,True,False,234,-134.20162963867188,-121.87553405761719,0
Regina judged there to be candles astounding most guests.,Regina entreats there to be candles astounding most guests.,syntax_semantics,control_raising,existential_there_object_raising,True,False,True,False,235,-86.31765747070312,-100.23919677734375,1
Some son of Keith wasn't declaring there to be a casserole baking.,Some son of Keith wasn't begging there to be a casserole baking.,syntax_semantics,control_raising,existential_there_object_raising,True,False,True,False,236,-105.0838394165039,-101.12226104736328,0
Kristin declares there to be a public park wasting away.,Kristin sways there to be a public park wasting away.,syntax_semantics,control_raising,existential_there_object_raising,True,False,True,False,237,-70.45386505126953,-78.5567398071289,1
That brother of Karen needs there to be a scarf tightening.,That brother of Karen begged there to be a scarf tightening.,syntax_semantics,control_raising,existential_there_object_raising,True,False,True,False,238,-76.62583923339844,-78.6498794555664,1
Andrea's piano teachers preferred there to be a couch chipping.,Andrea's piano teachers entreat there to be a couch chipping.,syntax_semantics,control_raising,existential_there_object_raising,True,False,True,False,239,-90.6993637084961,-101.17303466796875,1
Robert's podiatrists expected there to be a lot of girls distracting Danielle.,Robert's podiatrists dared there to be a lot of girls distracting Danielle.,syntax_semantics,control_raising,existential_there_object_raising,True,False,True,False,240,-116.85614013671875,-118.76134490966797,1
A man ascertained there to be a shoe disgusting Margaret.,A man dares there to be a shoe disgusting Margaret.,syntax_semantics,control_raising,existential_there_object_raising,True,False,True,False,241,-100.54564666748047,-86.15129852294922,0
Douglas predicts there to be many tomatoes confusing Mark.,Douglas requires there to be many tomatoes confusing Mark.,syntax_semantics,control_raising,existential_there_object_raising,True,False,True,False,242,-85.59510040283203,-78.12306213378906,0
The Impressionists might expect there to be a lot of mothers of Vanessa walking through the rivers.,The Impressionists might beg there to be a lot of mothers of Vanessa walking through the rivers.,syntax_semantics,control_raising,existential_there_object_raising,True,False,True,False,243,-114.19137573242188,-116.11309051513672,1
Karla believed there to be few windows alarming Beverly.,Karla entices there to be few windows alarming Beverly.,syntax_semantics,control_raising,existential_there_object_raising,True,False,True,False,244,-79.75286102294922,-97.0344467163086,1
Some bank shouldn't want there to be unicycles slowing.,Some bank shouldn't entreat there to be unicycles slowing.,syntax_semantics,control_raising,existential_there_object_raising,True,False,True,False,245,-88.000732421875,-105.78500366210938,1
Pamela believes there to be fewer than three museums listening to Michelle.,Pamela commissioned there to be fewer than three museums listening to Michelle.,syntax_semantics,control_raising,existential_there_object_raising,True,False,True,False,246,-101.60527038574219,-103.99806213378906,1
Rachelle hadn't anticipated there to be a glass falling.,Rachelle hadn't pressured there to be a glass falling.,syntax_semantics,control_raising,existential_there_object_raising,True,False,True,False,247,-66.23796844482422,-68.60801696777344,1
Kimberley did believe there to be a lot of legislatures persuading Alicia to see all bikes.,Kimberley did convince there to be a lot of legislatures persuading Alicia to see all bikes.,syntax_semantics,control_raising,existential_there_object_raising,True,False,True,False,248,-141.51931762695312,-145.52027893066406,1
Maria's tutors haven't preferred there to be more than three boys happening to write.,Maria's tutors haven't advised there to be more than three boys happening to write.,syntax_semantics,control_raising,existential_there_object_raising,True,False,True,False,249,-99.26708984375,-101.73591613769531,1
Stacy's partners wanted there to be a lot of scarves folding.,Stacy's partners persuaded there to be a lot of scarves folding.,syntax_semantics,control_raising,existential_there_object_raising,True,False,True,False,250,-92.05145263671875,-96.06929016113281,1
A lot of senators weren't needing there to be gates boring Tara.,A lot of senators weren't daring there to be gates boring Tara.,syntax_semantics,control_raising,existential_there_object_raising,True,False,True,False,251,-101.4232177734375,-105.85247039794922,1
Every woman ascertains there to be a popsicle shocking Clyde.,Every woman prods there to be a popsicle shocking Clyde.,syntax_semantics,control_raising,existential_there_object_raising,True,False,True,False,252,-104.44190216064453,-100.94554138183594,0
Tonya was finding there to be a drawing disturbing Bill.,Tonya was imploring there to be a drawing disturbing Bill.,syntax_semantics,control_raising,existential_there_object_raising,True,False,True,False,253,-74.3502426147461,-88.27378845214844,1
The Lutherans' spouse hasn't believed there to be some sons of Heather winning.,The Lutherans' spouse hasn't implored there to be some sons of Heather winning.,syntax_semantics,control_raising,existential_there_object_raising,True,False,True,False,254,-117.549560546875,-130.88169860839844,1
Rachelle predicted there to be many cars accelerating.,Rachelle induces there to be many cars accelerating.,syntax_semantics,control_raising,existential_there_object_raising,True,False,True,False,255,-63.282493591308594,-70.79615783691406,1
The Impressionists found there to be a person smiling.,The Impressionists asked there to be a person smiling.,syntax_semantics,control_raising,existential_there_object_raising,True,False,True,False,256,-70.81542205810547,-73.24345397949219,1
Renee hasn't wanted there to be a vase bothering these customers.,Renee hasn't spurred there to be a vase bothering these customers.,syntax_semantics,control_raising,existential_there_object_raising,True,False,True,False,257,-87.41282653808594,-97.34321594238281,1
Kristen's wife is expecting there to be shoes embarrassing Kevin.,Kristen's wife is persuading there to be shoes embarrassing Kevin.,syntax_semantics,control_raising,existential_there_object_raising,True,False,True,False,258,-72.07404327392578,-96.23670196533203,1
Matt had declared there to be a newspaper article upsetting Lawrence.,Matt had induced there to be a newspaper article upsetting Lawrence.,syntax_semantics,control_raising,existential_there_object_raising,True,False,True,False,259,-72.95852661132812,-75.92825317382812,1
These offspring want there to be few computers aggravating that man.,These offspring prod there to be few computers aggravating that man.,syntax_semantics,control_raising,existential_there_object_raising,True,False,True,False,260,-81.22875213623047,-92.58111572265625,1
These men expect there to be some glasses falling.,These men spurred there to be some glasses falling.,syntax_semantics,control_raising,existential_there_object_raising,True,False,True,False,261,-58.452415466308594,-66.68327331542969,1
Every customer's cousins predict there to be a blouse impressing Brian.,Every customer's cousins urged there to be a blouse impressing Brian.,syntax_semantics,control_raising,existential_there_object_raising,True,False,True,False,262,-104.69459533691406,-103.40786743164062,0
Keith ascertains there to be a blouse twisting.,Keith forced there to be a blouse twisting.,syntax_semantics,control_raising,existential_there_object_raising,True,False,True,False,263,-74.83558654785156,-58.03440475463867,0
Jerry judges there to be pies boring Tracy.,Jerry spurs there to be pies boring Tracy.,syntax_semantics,control_raising,existential_there_object_raising,True,False,True,False,264,-66.36971282958984,-72.38153076171875,1
These companies expect there to be a cafe alarming a government.,These companies sway there to be a cafe alarming a government.,syntax_semantics,control_raising,existential_there_object_raising,True,False,True,False,265,-70.95221710205078,-74.32804107666016,1
A granddaughter of Jerry was declaring there to be a popsicle wasting away.,A granddaughter of Jerry was pressing there to be a popsicle wasting away.,syntax_semantics,control_raising,existential_there_object_raising,True,False,True,False,266,-113.27815246582031,-110.64886474609375,0
A brother of Becca anticipates there to be a person trying to sound like Sharon.,A brother of Becca commanded there to be a person trying to sound like Sharon.,syntax_semantics,control_raising,existential_there_object_raising,True,False,True,False,267,-122.46122741699219,-108.64598846435547,0
Jill will believe there to be movie theaters existing.,Jill will push there to be movie theaters existing.,syntax_semantics,control_raising,existential_there_object_raising,True,False,True,False,268,-81.09205627441406,-82.14053344726562,1
Mary declares there to be some books boring Candice.,Mary orders there to be some books boring Candice.,syntax_semantics,control_raising,existential_there_object_raising,True,False,True,False,269,-71.85331726074219,-71.373046875,0
Every girl needs there to be few rivers evaporating.,Every girl prompts there to be few rivers evaporating.,syntax_semantics,control_raising,existential_there_object_raising,True,False,True,False,270,-66.12229919433594,-76.66549682617188,1
Many senators are finding there to be a cart alarming Carla.,Many senators are pushing there to be a cart alarming Carla.,syntax_semantics,control_raising,existential_there_object_raising,True,False,True,False,271,-83.12803649902344,-83.39695739746094,1
Tamara expected there to be a girl vanishing.,Tamara encourages there to be a girl vanishing.,syntax_semantics,control_raising,existential_there_object_raising,True,False,True,False,272,-57.26127624511719,-59.88304138183594,1
Julie's grandmothers ascertain there to be a picture of a boy looking like those pictures.,Julie's grandmothers entice there to be a picture of a boy looking like those pictures.,syntax_semantics,control_raising,existential_there_object_raising,True,False,True,False,273,-105.55821228027344,-111.23721313476562,1
Christina isn't discovering there to be some nieces of every man driving to a glacier.,Christina isn't obliging there to be some nieces of every man driving to a glacier.,syntax_semantics,control_raising,existential_there_object_raising,True,False,True,False,274,-122.7428207397461,-127.071044921875,1
Most pedestrians were anticipating there to be a doctor badgering Renee's granddaughters to suffer.,Most pedestrians were inducing there to be a doctor badgering Renee's granddaughters to suffer.,syntax_semantics,control_raising,existential_there_object_raising,True,False,True,False,275,-150.7193603515625,-153.503173828125,1
All people need there to be a boy kissing a lot of patients.,All people compel there to be a boy kissing a lot of patients.,syntax_semantics,control_raising,existential_there_object_raising,True,False,True,False,276,-62.203453063964844,-77.70721435546875,1
That niece of these students isn't predicting there to be movies shocking those waiters.,That niece of these students isn't requiring there to be movies shocking those waiters.,syntax_semantics,control_raising,existential_there_object_raising,True,False,True,False,277,-125.23185729980469,-123.70044708251953,0
Wayne isn't considering there to be a hat existing.,Wayne isn't persuading there to be a hat existing.,syntax_semantics,control_raising,existential_there_object_raising,True,False,True,False,278,-68.04674530029297,-86.45643615722656,1
Julie predicted there to be a lot of essays disturbing Richard.,Julie urged there to be a lot of essays disturbing Richard.,syntax_semantics,control_raising,existential_there_object_raising,True,False,True,False,279,-70.24163055419922,-71.5933609008789,1
Caroline wasn't declaring there to be a book boring Roger.,Caroline wasn't prompting there to be a book boring Roger.,syntax_semantics,control_raising,existential_there_object_raising,True,False,True,False,280,-82.52182006835938,-82.25044250488281,0
That pedestrian will consider there to be some brothers of Martha moving.,That pedestrian will force there to be some brothers of Martha moving.,syntax_semantics,control_raising,existential_there_object_raising,True,False,True,False,281,-88.14224243164062,-87.09547424316406,0
Steve's classmates were declaring there to be many grandsons of Tonya anticipating Anne to flee from the patients.,Steve's classmates were commissioning there to be many grandsons of Tonya anticipating Anne to flee from the patients.,syntax_semantics,control_raising,existential_there_object_raising,True,False,True,False,282,-170.11148071289062,-177.35769653320312,1
Marcus will discover there to be few bikes wasting away.,Marcus will beg there to be few bikes wasting away.,syntax_semantics,control_raising,existential_there_object_raising,True,False,True,False,283,-70.07624053955078,-70.63117980957031,1
