sentence_good,sentence_bad,field,linguistics_term,UID,simple_LM_method,one_prefix_method,two_prefix_method,lexically_identical,pair_id,good_prob,bad_prob,correct
William has declared there to be no guests getting fired.,William has obliged there to be no guests getting fired.,syntax_semantics,control_raising,existential_there_object_raising,True,False,True,False,0,-61.305137634277344,-63.773956298828125,1
Richard believed there to be many boxes stunning Ellen.,Richard sways there to be many boxes stunning Ellen.,syntax_semantics,control_raising,existential_there_object_raising,True,False,True,False,1,-69.15306091308594,-81.4839096069336,1
Teresa finds there to be many bananas stunning Claire.,Teresa swayed there to be many bananas stunning Claire.,syntax_semantics,control_raising,existential_there_object_raising,True,False,True,False,2,-82.72529602050781,-88.89107513427734,1
Mary can declare there to be some ladders falling.,Mary can entreat there to be some ladders falling.,syntax_semantics,control_raising,existential_there_object_raising,True,False,True,False,3,-67.3826675415039,-80.93177795410156,1
An actress wouldn't declare there to be a print looking like that ice.,An actress wouldn't command there to be a print looking like that ice.,syntax_semantics,control_raising,existential_there_object_raising,True,False,True,False,4,-85.55626678466797,-88.83289337158203,1
Christina anticipates there to be many coats tightening.,Christina urged there to be many coats tightening.,syntax_semantics,control_raising,existential_there_object_raising,True,False,True,False,5,-79.4208984375,-67.07613372802734,0
Gregory is declaring there to be a movie irritating Douglas.,Gregory is pushing there to be a movie irritating Douglas.,syntax_semantics,control_raising,existential_there_object_raising,True,False,True,False,6,-72.2685775756836,-67.18754577636719,0
Dana hasn't declared there to be a unicycle dropping.,Dana hasn't ordered there to be a unicycle dropping.,syntax_semantics,control_raising,existential_there_object_raising,True,False,True,False,7,-83.11309051513672,-81.74636840820312,0
Frank judged there to be a photograph of Michael looking like Sherry.,Frank compelled there to be a photograph of Michael looking like Sherry.,syntax_semantics,control_raising,existential_there_object_raising,True,False,True,False,8,-85.23974609375,-85.8122329711914,1
Sarah was judging there to be a cashier exiting that mountain.,Sarah was enticing there to be a cashier exiting that mountain.,syntax_semantics,control_raising,existential_there_object_raising,True,False,True,False,9,-84.2232894897461,-88.60948944091797,1
Cynthia believed there to be a lot of apples boring Kevin.,Cynthia advised there to be a lot of apples boring Kevin.,syntax_semantics,control_raising,existential_there_object_raising,True,False,True,False,10,-95.61652374267578,-95.58080291748047,0
Many organizations have believed there to be no stories distracting some company.,Many organizations have induced there to be no stories distracting some company.,syntax_semantics,control_raising,existential_there_object_raising,True,False,True,False,11,-75.5753402709961,-79.3145751953125,1
Ann hadn't believed there to be no birds disappearing.,Ann hadn't urged there to be no birds disappearing.,syntax_semantics,control_raising,existential_there_object_raising,True,False,True,False,12,-61.95853805541992,-67.39530944824219,1
Anna's best friend believes there to be more than three cashiers helping Bruce.,Anna's best friend prompted there to be more than three cashiers helping Bruce.,syntax_semantics,control_raising,existential_there_object_raising,True,False,True,False,13,-99.07565307617188,-104.14035034179688,1
Steven's tutors wouldn't expect there to be a father of some women pressing that waitress to study.,Steven's tutors wouldn't advise there to be a father of some women pressing that waitress to study.,syntax_semantics,control_raising,existential_there_object_raising,True,False,True,False,14,-124.69834899902344,-127.44877624511719,1
Ella couldn't ascertain there to be many drivers daring Carlos to stun Charles.,Ella couldn't obligate there to be many drivers daring Carlos to stun Charles.,syntax_semantics,control_raising,existential_there_object_raising,True,False,True,False,15,-128.76943969726562,-132.81698608398438,1
Some dancer judged there to be a light scaring Scott.,Some dancer advises there to be a light scaring Scott.,syntax_semantics,control_raising,existential_there_object_raising,True,False,True,False,16,-75.20277404785156,-75.03630065917969,0
Some cousins of Debra haven't ascertained there to be fewer than three governments inducing Kendra to argue.,Some cousins of Debra haven't spurred there to be fewer than three governments inducing Kendra to argue.,syntax_semantics,control_raising,existential_there_object_raising,True,False,True,False,17,-167.3040008544922,-154.50018310546875,0
Victoria declares there to be commentaries confusing a lot of customers.,Victoria advised there to be commentaries confusing a lot of customers.,syntax_semantics,control_raising,existential_there_object_raising,True,False,True,False,18,-84.5155029296875,-82.62297058105469,0
Every association had needed there to be many grocery stores stunning Colleen.,Every association had pushed there to be many grocery stores stunning Colleen.,syntax_semantics,control_raising,existential_there_object_raising,True,False,True,False,19,-104.62086486816406,-107.76487731933594,1
Janice predicts there to be many lamps disturbing Ella.,Janice prods there to be many lamps disturbing Ella.,syntax_semantics,control_raising,existential_there_object_raising,True,False,True,False,20,-90.39482116699219,-98.0218505859375,1
Kathleen hadn't found there to be a committee describing Kristen.,Kathleen hadn't advised there to be a committee describing Kristen.,syntax_semantics,control_raising,existential_there_object_raising,True,False,True,False,21,-97.43846130371094,-102.07569885253906,1
Irene's granddaughters prefer there to be more than three plates falling.,Irene's granddaughters required there to be more than three plates falling.,syntax_semantics,control_raising,existential_there_object_raising,True,False,True,False,22,-102.83085632324219,-100.89064025878906,0
Becca will ascertain there to be museums reuniting.,Becca will sway there to be museums reuniting.,syntax_semantics,control_raising,existential_there_object_raising,True,False,True,False,23,-81.44842529296875,-78.99720764160156,0
The library didn't discover there to be an art gallery disappearing.,The library didn't prompt there to be an art gallery disappearing.,syntax_semantics,control_raising,existential_there_object_raising,True,False,True,False,24,-76.95767211914062,-81.39042663574219,1
Most banks believed there to be a lot of waiters discussing Phillip.,Most banks encourage there to be a lot of waiters discussing Phillip.,syntax_semantics,control_raising,existential_there_object_raising,True,False,True,False,25,-90.19584655761719,-93.02069854736328,1
Dawn can declare there to be few waitresses working hard.,Dawn can command there to be few waitresses working hard.,syntax_semantics,control_raising,existential_there_object_raising,True,False,True,False,26,-95.50218963623047,-97.94598388671875,1
David had judged there to be a lot of mouths irritating some girls.,David had spurred there to be a lot of mouths irritating some girls.,syntax_semantics,control_raising,existential_there_object_raising,True,False,True,False,27,-77.7972183227539,-83.10786437988281,1
The museums judge there to be an icicle condensing.,The museums persuade there to be an icicle condensing.,syntax_semantics,control_raising,existential_there_object_raising,True,False,True,False,28,-88.4044189453125,-88.91354370117188,1
The customers needed there to be an art gallery irritating Stacy.,The customers convince there to be an art gallery irritating Stacy.,syntax_semantics,control_raising,existential_there_object_raising,True,False,True,False,29,-81.85379028320312,-88.81745910644531,1
An organization will judge there to be a drawing looking like every dog.,An organization will oblige there to be a drawing looking like every dog.,syntax_semantics,control_raising,existential_there_object_raising,True,False,True,False,30,-83.95526123046875,-92.69832611083984,1
Danielle didn't find there to be a cashier compromising.,Danielle didn't implore there to be a cashier compromising.,syntax_semantics,control_raising,existential_there_object_raising,True,False,True,False,31,-69.10124969482422,-87.1005859375,1
Some teacher's plumbers anticipated there to be some slopes wasting away.,Some teacher's plumbers implored there to be some slopes wasting away.,syntax_semantics,control_raising,existential_there_object_raising,True,False,True,False,32,-99.43486022949219,-108.62773895263672,1
Some boys predicted there to be a cashier swaying a lot of boys' mothers to conspire.,Some boys advise there to be a cashier swaying a lot of boys' mothers to conspire.,syntax_semantics,control_raising,existential_there_object_raising,True,False,True,False,33,-130.55262756347656,-128.57061767578125,0
A lot of synopses weren't discovering there to be no rugs confusing Frank.,A lot of synopses weren't obligating there to be no rugs confusing Frank.,syntax_semantics,control_raising,existential_there_object_raising,True,False,True,False,34,-130.11434936523438,-133.19261169433594,1
This child ascertained there to be no documentaries about Winston Churchill hurting Douglas.,This child tempted there to be no documentaries about Winston Churchill hurting Douglas.,syntax_semantics,control_raising,existential_there_object_raising,True,False,True,False,35,-123.217041015625,-104.82670593261719,0
Donna hasn't expected there to be a plate worrying Alice.,Donna hasn't obliged there to be a plate worrying Alice.,syntax_semantics,control_raising,existential_there_object_raising,True,False,True,False,36,-77.8923568725586,-83.69647979736328,1
Most fathers of Frank prefer there to be some dogs breaking the computer.,Most fathers of Frank induce there to be some dogs breaking the computer.,syntax_semantics,control_raising,existential_there_object_raising,True,False,True,False,37,-88.91929626464844,-92.98603057861328,1
Most grandsons of Christina declared there to be a commentary about the Impressionists worrying Irene.,Most grandsons of Christina push there to be a commentary about the Impressionists worrying Irene.,syntax_semantics,control_raising,existential_there_object_raising,True,False,True,False,38,-155.5211181640625,-155.3826446533203,0
Some library considers there to be few pictures of Nancy hurting Winston Churchill.,Some library required there to be few pictures of Nancy hurting Winston Churchill.,syntax_semantics,control_raising,existential_there_object_raising,True,False,True,False,39,-101.96864318847656,-97.5066909790039,0
Guy isn't ascertaining there to be no associations appearing to boycott all cafes.,Guy isn't enticing there to be no associations appearing to boycott all cafes.,syntax_semantics,control_raising,existential_there_object_raising,True,False,True,False,40,-122.52754211425781,-109.09910583496094,0
A lot of museums needed there to be a lot of drivers lifting that fish.,A lot of museums pressure there to be a lot of drivers lifting that fish.,syntax_semantics,control_raising,existential_there_object_raising,True,False,True,False,41,-90.3755111694336,-93.07167053222656,1
Craig's lawyers were needing there to be fish irritating a lot of actors.,Craig's lawyers were motivating there to be fish irritating a lot of actors.,syntax_semantics,control_raising,existential_there_object_raising,True,False,True,False,42,-83.8641357421875,-90.67314910888672,1
Gregory has expected there to be some skirts loosening.,Gregory has encouraged there to be some skirts loosening.,syntax_semantics,control_raising,existential_there_object_raising,True,False,True,False,43,-75.77264404296875,-78.3043441772461,1
Edward didn't need there to be a company arguing.,Edward didn't sway there to be a company arguing.,syntax_semantics,control_raising,existential_there_object_raising,True,False,True,False,44,-45.528682708740234,-53.911651611328125,1
Julie won't want there to be fewer than three legislatures irritating Brad.,Julie won't compel there to be fewer than three legislatures irritating Brad.,syntax_semantics,control_raising,existential_there_object_raising,True,False,True,False,45,-91.23544311523438,-101.95390319824219,1
Danielle considers there to be many cups impressing Lucille.,Danielle obligated there to be many cups impressing Lucille.,syntax_semantics,control_raising,existential_there_object_raising,True,False,True,False,46,-91.65498352050781,-94.35980224609375,1
Libraries needed there to be a woman persuading those girls to learn.,Libraries require there to be a woman persuading those girls to learn.,syntax_semantics,control_raising,existential_there_object_raising,True,False,True,False,47,-108.29737091064453,-108.10212707519531,0
Alexander hadn't declared there to be a library hurting Marie.,Alexander hadn't ordered there to be a library hurting Marie.,syntax_semantics,control_raising,existential_there_object_raising,True,False,True,False,48,-72.02813720703125,-70.09268951416016,0
Every waiter hadn't believed there to be some eyes aggravating Erin.,Every waiter hadn't convinced there to be some eyes aggravating Erin.,syntax_semantics,control_raising,existential_there_object_raising,True,False,True,False,49,-90.553466796875,-93.14569091796875,1
Kathleen's electricians were expecting there to be a company persuading Joseph's ex-wife to compromise.,Kathleen's electricians were tempting there to be a company persuading Joseph's ex-wife to compromise.,syntax_semantics,control_raising,existential_there_object_raising,True,False,True,False,50,-162.79666137695312,-170.7579345703125,1
John considered there to be a casserole shocking Samantha.,John encourages there to be a casserole shocking Samantha.,syntax_semantics,control_raising,existential_there_object_raising,True,False,True,False,51,-82.10374450683594,-87.20709991455078,1
Cheryl isn't believing there to be a college campus existing.,Cheryl isn't asking there to be a college campus existing.,syntax_semantics,control_raising,existential_there_object_raising,True,False,True,False,52,-101.17886352539062,-97.53408813476562,0
Todd wanted there to be a closet worrying William.,Todd convinces there to be a closet worrying William.,syntax_semantics,control_raising,existential_there_object_raising,True,False,True,False,53,-58.758140563964844,-75.7851333618164,1
The Borgias' brothers need there to be more than three cafes existing.,The Borgias' brothers pressed there to be more than three cafes existing.,syntax_semantics,control_raising,existential_there_object_raising,True,False,True,False,54,-102.98687744140625,-112.43104553222656,1
Those sisters of Tammy wanted there to be fewer than three companies tempting some pedestrian to drive to that library.,Those sisters of Tammy require there to be fewer than three companies tempting some pedestrian to drive to that library.,syntax_semantics,control_raising,existential_there_object_raising,True,False,True,False,55,-136.30712890625,-139.29701232910156,1
All nephews of Teresa judged there to be a commentary confusing Daniel.,All nephews of Teresa ask there to be a commentary confusing Daniel.,syntax_semantics,control_raising,existential_there_object_raising,True,False,True,False,56,-101.2271957397461,-96.85212707519531,0
Monet's classmates can prefer there to be some movie theaters alarming the Clintons.,Monet's classmates can ask there to be some movie theaters alarming the Clintons.,syntax_semantics,control_raising,existential_there_object_raising,True,False,True,False,57,-116.88015747070312,-112.6563720703125,0
Lawrence hasn't wanted there to be no shows about Spain astounding Robert.,Lawrence hasn't compelled there to be no shows about Spain astounding Robert.,syntax_semantics,control_raising,existential_there_object_raising,True,False,True,False,58,-95.0025634765625,-103.09957122802734,1
Paul's ex-wives discover there to be a grocery store confusing this government.,Paul's ex-wives obligate there to be a grocery store confusing this government.,syntax_semantics,control_raising,existential_there_object_raising,True,False,True,False,59,-94.37701416015625,-103.4630126953125,1
Colleen's mothers predict there to be a lot of screens vanishing.,Colleen's mothers oblige there to be a lot of screens vanishing.,syntax_semantics,control_raising,existential_there_object_raising,True,False,True,False,60,-84.46807861328125,-91.48959350585938,1
James hadn't anticipated there to be some pictures stunning Brad.,James hadn't induced there to be some pictures stunning Brad.,syntax_semantics,control_raising,existential_there_object_raising,True,False,True,False,61,-81.72496032714844,-83.16929626464844,1
Sherry finds there to be some children listening to Lawrence.,Sherry begs there to be some children listening to Lawrence.,syntax_semantics,control_raising,existential_there_object_raising,True,False,True,False,62,-70.23383331298828,-77.10094451904297,1
Lawrence will expect there to be many shoes twisting.,Lawrence will entreat there to be many shoes twisting.,syntax_semantics,control_raising,existential_there_object_raising,True,False,True,False,63,-66.09038543701172,-80.40253448486328,1
Jerry's grandsons wanted there to be a car worrying Rhonda.,Jerry's grandsons urge there to be a car worrying Rhonda.,syntax_semantics,control_raising,existential_there_object_raising,True,False,True,False,64,-100.91822814941406,-106.10828399658203,1
This boy's bosses prefer there to be no drivers falling asleep.,This boy's bosses pressed there to be no drivers falling asleep.,syntax_semantics,control_raising,existential_there_object_raising,True,False,True,False,65,-81.5103988647461,-85.12358856201172,1
A lot of guests' contractor wanted there to be many pedestrians anticipating an association to reply.,A lot of guests' contractor prompted there to be many pedestrians anticipating an association to reply.,syntax_semantics,control_raising,existential_there_object_raising,True,False,True,False,66,-142.57540893554688,-147.75201416015625,1
Alexander was believing there to be more than three prints of that muffin irritating those students.,Alexander was imploring there to be more than three prints of that muffin irritating those students.,syntax_semantics,control_raising,existential_there_object_raising,True,False,True,False,67,-107.54727172851562,-117.71268463134766,1
Donna has declared there to be a niece of Alice appearing to embrace.,Donna has forced there to be a niece of Alice appearing to embrace.,syntax_semantics,control_raising,existential_there_object_raising,True,False,True,False,68,-93.5705337524414,-91.1122817993164,0
The Borgias' nieces need there to be a lot of grandmothers of Sonia admiring Colleen.,The Borgias' nieces advised there to be a lot of grandmothers of Sonia admiring Colleen.,syntax_semantics,control_raising,existential_there_object_raising,True,False,True,False,69,-174.90765380859375,-178.5777587890625,1
Bill's senator had ascertained there to be a lot of carts stopping.,Bill's senator had spurred there to be a lot of carts stopping.,syntax_semantics,control_raising,existential_there_object_raising,True,False,True,False,70,-93.89881896972656,-81.3900146484375,0
Dan's boyfriend predicted there to be fewer than three grocery stores wasting away.,Dan's boyfriend convinced there to be fewer than three grocery stores wasting away.,syntax_semantics,control_raising,existential_there_object_raising,True,False,True,False,71,-93.509521484375,-93.15762329101562,0
Dennis judges there to be some lakes scaring Irene.,Dennis pushes there to be some lakes scaring Irene.,syntax_semantics,control_raising,existential_there_object_raising,True,False,True,False,72,-93.24726867675781,-91.4920654296875,0
Chad's ex-wives weren't judging there to be a restaurant astounding Tiffany.,Chad's ex-wives weren't imploring there to be a restaurant astounding Tiffany.,syntax_semantics,control_raising,existential_there_object_raising,True,False,True,False,73,-117.58296966552734,-125.08988952636719,1
Amelia will expect there to be a lot of women waving.,Amelia will commission there to be a lot of women waving.,syntax_semantics,control_raising,existential_there_object_raising,True,False,True,False,74,-65.84526062011719,-73.01408386230469,1
Marie wasn't preferring there to be steps vanishing.,Marie wasn't advising there to be steps vanishing.,syntax_semantics,control_raising,existential_there_object_raising,True,False,True,False,75,-64.89244842529297,-63.29230880737305,0
These men declare there to be fewer than three women advising Benjamin's oncologist to talk about Matt.,These men commissioned there to be fewer than three women advising Benjamin's oncologist to talk about Matt.,syntax_semantics,control_raising,existential_there_object_raising,True,False,True,False,76,-147.34512329101562,-145.29443359375,0
Dancers' senators need there to be a lot of commentaries scaring Lawrence.,Dancers' senators urge there to be a lot of commentaries scaring Lawrence.,syntax_semantics,control_raising,existential_there_object_raising,True,False,True,False,77,-115.5701675415039,-118.85902404785156,1
Some senators' tutor does consider there to be few horses stunning Andrew.,Some senators' tutor does entreat there to be few horses stunning Andrew.,syntax_semantics,control_raising,existential_there_object_raising,True,False,True,False,78,-110.53413391113281,-124.25935363769531,1
Adam's handymen weren't believing there to be a hat aggravating Kayla.,Adam's handymen weren't pressuring there to be a hat aggravating Kayla.,syntax_semantics,control_raising,existential_there_object_raising,True,False,True,False,79,-111.60870361328125,-116.58979797363281,1
Some cousins of Wayne might expect there to be some guests lifting the projector.,Some cousins of Wayne might convince there to be some guests lifting the projector.,syntax_semantics,control_raising,existential_there_object_raising,True,False,True,False,80,-98.65582275390625,-101.06941223144531,1
Dawn ascertained there to be some teenagers meeting.,Dawn advised there to be some teenagers meeting.,syntax_semantics,control_raising,existential_there_object_raising,True,False,True,False,81,-85.23866271972656,-65.23453521728516,0
Caroline discovers there to be an apple burning.,Caroline swayed there to be an apple burning.,syntax_semantics,control_raising,existential_there_object_raising,True,False,True,False,82,-58.44463348388672,-61.622867584228516,1
A lot of men's students did anticipate there to be more than three grandfathers of Raymond realizing who wasn't slumping over.,A lot of men's students did entice there to be more than three grandfathers of Raymond realizing who wasn't slumping over.,syntax_semantics,control_raising,existential_there_object_raising,True,False,True,False,83,-175.015625,-180.7187042236328,1
Victoria's wife wasn't considering there to be a hill stunning Bill.,Victoria's wife wasn't spurring there to be a hill stunning Bill.,syntax_semantics,control_raising,existential_there_object_raising,True,False,True,False,84,-78.73863220214844,-89.27638244628906,1
Donna is wanting there to be no high schools alarming Kayla.,Donna is swaying there to be no high schools alarming Kayla.,syntax_semantics,control_raising,existential_there_object_raising,True,False,True,False,85,-92.26258087158203,-101.80618286132812,1
Some grandmother of Nancy had needed there to be a person hoping to clean some art gallery.,Some grandmother of Nancy had pressured there to be a person hoping to clean some art gallery.,syntax_semantics,control_raising,existential_there_object_raising,True,False,True,False,86,-111.66714477539062,-117.4524154663086,1
Russell isn't expecting there to be a drawing of Tonya shocking Heidi.,Russell isn't pressing there to be a drawing of Tonya shocking Heidi.,syntax_semantics,control_raising,existential_there_object_raising,True,False,True,False,87,-88.07947540283203,-95.62826538085938,1
Janice's students had judged there to be a picture worrying some driver.,Janice's students had pressed there to be a picture worrying some driver.,syntax_semantics,control_raising,existential_there_object_raising,True,False,True,False,88,-93.37364196777344,-94.30775451660156,1
Mitchell is considering there to be bread appearing.,Mitchell is enticing there to be bread appearing.,syntax_semantics,control_raising,existential_there_object_raising,True,False,True,False,89,-59.380653381347656,-66.57613372802734,1
Bill's senator was preferring there to be a report boring Brenda.,Bill's senator was compelling there to be a report boring Brenda.,syntax_semantics,control_raising,existential_there_object_raising,True,False,True,False,90,-85.87682342529297,-83.94507598876953,0
Natalie's lawyers expect there to be few teenagers profiting.,Natalie's lawyers swayed there to be few teenagers profiting.,syntax_semantics,control_raising,existential_there_object_raising,True,False,True,False,91,-93.29237365722656,-100.52154541015625,1
These waiters declare there to be a mountain worrying those banks.,These waiters commission there to be a mountain worrying those banks.,syntax_semantics,control_raising,existential_there_object_raising,True,False,True,False,92,-88.86590576171875,-89.08345794677734,1
Andrew hasn't expected there to be a screen annoying Bill.,Andrew hasn't dared there to be a screen annoying Bill.,syntax_semantics,control_raising,existential_there_object_raising,True,False,True,False,93,-69.10746002197266,-71.6019058227539,1
