sentence_good,sentence_bad,field,linguistics_term,UID,simple_LM_method,one_prefix_method,two_prefix_method,lexically_identical,pair_id,good_prob,bad_prob,correct
Timothy couldn't disturb that guy.,Timothy couldn't disturb that guys.,morphology,determiner_noun_agreement,determiner_noun_agreement_1,True,True,False,True,639,-36.521095275878906,-40.159141540527344,1
A lot of guys find these guests.,A lot of guys find these guest.,morphology,determiner_noun_agreement,determiner_noun_agreement_1,True,True,False,True,640,-49.60883712768555,-52.132991790771484,1
Many fish can't look like this picture.,Many fish can't look like this pictures.,morphology,determiner_noun_agreement,determiner_noun_agreement_1,True,True,False,True,641,-35.64306640625,-37.794898986816406,1
Craig drops by these cafes.,Craig drops by these cafe.,morphology,determiner_noun_agreement,determiner_noun_agreement_1,True,True,False,True,642,-41.555877685546875,-38.935611724853516,0
Carlos fired that waitress.,Carlos fired that waitresses.,morphology,determiner_noun_agreement,determiner_noun_agreement_1,True,True,False,True,643,-38.201202392578125,-46.631378173828125,1
Those girls conceal this blouse.,Those girls conceal this blouses.,morphology,determiner_noun_agreement,determiner_noun_agreement_1,True,True,False,True,644,-42.88994598388672,-43.424774169921875,1
The ladies walk through this public park.,The ladies walk through this public parks.,morphology,determiner_noun_agreement,determiner_noun_agreement_1,True,True,False,True,645,-45.24755096435547,-46.20271301269531,1
Irene has hidden those cashiers.,Irene has hidden those cashier.,morphology,determiner_noun_agreement,determiner_noun_agreement_1,True,True,False,True,646,-55.814971923828125,-55.69817352294922,0
Nancy wouldn't describe that driver.,Nancy wouldn't describe that drivers.,morphology,determiner_noun_agreement,determiner_noun_agreement_1,True,True,False,True,647,-45.85441589355469,-46.972801208496094,1
A lot of reports didn't disagree with those documentaries.,A lot of reports didn't disagree with those documentary.,morphology,determiner_noun_agreement,determiner_noun_agreement_1,True,True,False,True,648,-66.3782730102539,-66.14249420166016,0
Every projector alarms that teacher.,Every projector alarms that teachers.,morphology,determiner_noun_agreement,determiner_noun_agreement_1,True,True,False,True,649,-44.28284454345703,-44.79145050048828,1
The associations worked with that actor.,The associations worked with that actors.,morphology,determiner_noun_agreement,determiner_noun_agreement_1,True,True,False,True,650,-40.306846618652344,-41.52732849121094,1
Tanya fixed this cup.,Tanya fixed this cups.,morphology,determiner_noun_agreement,determiner_noun_agreement_1,True,True,False,True,651,-44.85614013671875,-47.341278076171875,1
Samuel did sound like this museum.,Samuel did sound like this museums.,morphology,determiner_noun_agreement,determiner_noun_agreement_1,True,True,False,True,652,-39.4043083190918,-42.373722076416016,1
The drawing isn't annoying these waitresses.,The drawing isn't annoying these waitress.,morphology,determiner_noun_agreement,determiner_noun_agreement_1,True,True,False,True,653,-63.772926330566406,-52.962791442871094,0
That fork aggravates this university.,That fork aggravates this universities.,morphology,determiner_noun_agreement,determiner_noun_agreement_1,True,True,False,True,654,-49.6055793762207,-52.13664627075195,1
Amelia has attacked this patient.,Amelia has attacked this patients.,morphology,determiner_noun_agreement,determiner_noun_agreement_1,True,True,False,True,655,-43.94153594970703,-44.53925704956055,1
Margaret praises that student.,Margaret praises that students.,morphology,determiner_noun_agreement,determiner_noun_agreement_1,True,True,False,True,656,-34.995361328125,-35.12220001220703,1
Dawn could love these essays.,Dawn could love these essay.,morphology,determiner_noun_agreement,determiner_noun_agreement_1,True,True,False,True,657,-51.41502380371094,-53.422943115234375,1
Natalie is finding these hats.,Natalie is finding these hat.,morphology,determiner_noun_agreement,determiner_noun_agreement_1,True,True,False,True,658,-47.20379638671875,-48.58790969848633,1
The Impressionists escape from this library.,The Impressionists escape from this libraries.,morphology,determiner_noun_agreement,determiner_noun_agreement_1,True,True,False,True,659,-62.11589050292969,-67.54692077636719,1
This government dislikes these guys.,This government dislikes these guy.,morphology,determiner_noun_agreement,determiner_noun_agreement_1,True,True,False,True,660,-47.90705490112305,-51.286502838134766,1
Phillip wasn't embarrassing this government.,Phillip wasn't embarrassing this governments.,morphology,determiner_noun_agreement,determiner_noun_agreement_1,True,True,False,True,661,-44.35173416137695,-48.115196228027344,1
Kenneth knew these students.,Kenneth knew these student.,morphology,determiner_noun_agreement,determiner_noun_agreement_1,True,True,False,True,662,-35.61574935913086,-38.21508026123047,1
A lot of lakes disturb that museum.,A lot of lakes disturb that museums.,morphology,determiner_noun_agreement,determiner_noun_agreement_1,True,True,False,True,663,-56.937347412109375,-59.45853805541992,1
Irene was going to that public park.,Irene was going to that public parks.,morphology,determiner_noun_agreement,determiner_noun_agreement_1,True,True,False,True,664,-43.0312614440918,-44.112037658691406,1
Heidi worked with those patients.,Heidi worked with those patient.,morphology,determiner_noun_agreement,determiner_noun_agreement_1,True,True,False,True,665,-36.1648063659668,-38.08099365234375,1
Renee was breaking that glass.,Renee was breaking that glasses.,morphology,determiner_noun_agreement,determiner_noun_agreement_1,True,True,False,True,666,-35.076377868652344,-37.631385803222656,1
Gregory dislikes this adult.,Gregory dislikes this adults.,morphology,determiner_noun_agreement,determiner_noun_agreement_1,True,True,False,True,667,-49.59431457519531,-49.30892562866211,0
Paul isn't taking this painting.,Paul isn't taking this paintings.,morphology,determiner_noun_agreement,determiner_noun_agreement_1,True,True,False,True,668,-31.16650390625,-34.62295150756836,1
Rose is exiting this bank.,Rose is exiting this banks.,morphology,determiner_noun_agreement,determiner_noun_agreement_1,True,True,False,True,669,-39.354705810546875,-42.398807525634766,1
Lucille wasn't kissing that teenager.,Lucille wasn't kissing that teenagers.,morphology,determiner_noun_agreement,determiner_noun_agreement_1,True,True,False,True,670,-49.13307189941406,-47.090240478515625,0
Ann concealed these guests.,Ann concealed these guest.,morphology,determiner_noun_agreement,determiner_noun_agreement_1,True,True,False,True,671,-40.33745574951172,-43.49638748168945,1
Amanda notices these rabbits.,Amanda notices these rabbit.,morphology,determiner_noun_agreement,determiner_noun_agreement_1,True,True,False,True,672,-44.276611328125,-44.67439270019531,1
Most pedestrians describe those plays.,Most pedestrians describe those play.,morphology,determiner_noun_agreement,determiner_noun_agreement_1,True,True,False,True,673,-42.574928283691406,-41.872440338134766,0
Guy has escaped from those girls.,Guy has escaped from those girl.,morphology,determiner_noun_agreement,determiner_noun_agreement_1,True,True,False,True,674,-31.54534149169922,-34.88453674316406,1
Naomi returned to this guy.,Naomi returned to this guys.,morphology,determiner_noun_agreement,determiner_noun_agreement_1,True,True,False,True,675,-35.62236785888672,-38.25947189331055,1
Elaine is messing up that glass.,Elaine is messing up that glasses.,morphology,determiner_noun_agreement,determiner_noun_agreement_1,True,True,False,True,676,-44.59144592285156,-46.973602294921875,1
Most banks should look like those drawings.,Most banks should look like those drawing.,morphology,determiner_noun_agreement,determiner_noun_agreement_1,True,True,False,True,677,-42.444725036621094,-45.67718505859375,1
Christopher hasn't hidden that chair.,Christopher hasn't hidden that chairs.,morphology,determiner_noun_agreement,determiner_noun_agreement_1,True,True,False,True,678,-36.581382751464844,-38.61563491821289,1
Florence talked to that doctor.,Florence talked to that doctors.,morphology,determiner_noun_agreement,determiner_noun_agreement_1,True,True,False,True,679,-39.886009216308594,-42.741302490234375,1
Sara had run around this library.,Sara had run around this libraries.,morphology,determiner_noun_agreement,determiner_noun_agreement_1,True,True,False,True,680,-49.501869201660156,-55.33135223388672,1
Helen was biking to these grocery stores.,Helen was biking to these grocery store.,morphology,determiner_noun_agreement,determiner_noun_agreement_1,True,True,False,True,681,-53.372718811035156,-55.02845001220703,1
Some children see these drawings.,Some children see these drawing.,morphology,determiner_noun_agreement,determiner_noun_agreement_1,True,True,False,True,682,-31.051645278930664,-33.29700469970703,1
A lot of pictures have annoyed this actress.,A lot of pictures have annoyed this actresses.,morphology,determiner_noun_agreement,determiner_noun_agreement_1,True,True,False,True,683,-63.70481872558594,-64.23400115966797,1
The Clintons hadn't argued about those boys.,The Clintons hadn't argued about those boy.,morphology,determiner_noun_agreement,determiner_noun_agreement_1,True,True,False,True,684,-54.0062255859375,-57.19820022583008,1
Mitchell healed that adult.,Mitchell healed that adults.,morphology,determiner_noun_agreement,determiner_noun_agreement_1,True,True,False,True,685,-43.76081085205078,-42.8934326171875,0
Omar doesn't forget these students.,Omar doesn't forget these student.,morphology,determiner_noun_agreement,determiner_noun_agreement_1,True,True,False,True,686,-46.96650314331055,-50.85536193847656,1
Carlos drops by that library.,Carlos drops by that libraries.,morphology,determiner_noun_agreement,determiner_noun_agreement_1,True,True,False,True,687,-40.33089065551758,-45.347007751464844,1
Some children were healing these students.,Some children were healing these student.,morphology,determiner_noun_agreement,determiner_noun_agreement_1,True,True,False,True,688,-35.92493438720703,-38.88310241699219,1
A fish isn't irritating this adult.,A fish isn't irritating this adults.,morphology,determiner_noun_agreement,determiner_noun_agreement_1,True,True,False,True,689,-58.11202621459961,-57.20164108276367,0
Galileo had those glasses.,Galileo had those glass.,morphology,determiner_noun_agreement,determiner_noun_agreement_1,True,True,False,True,690,-39.26641082763672,-39.040733337402344,0
Candice would sound like these waiters.,Candice would sound like these waiter.,morphology,determiner_noun_agreement,determiner_noun_agreement_1,True,True,False,True,691,-50.28726577758789,-43.70222091674805,0
Tamara does tour those restaurants.,Tamara does tour those restaurant.,morphology,determiner_noun_agreement,determiner_noun_agreement_1,True,True,False,True,692,-44.95386505126953,-48.462684631347656,1
Mitchell will boast about those boys.,Mitchell will boast about those boy.,morphology,determiner_noun_agreement,determiner_noun_agreement_1,True,True,False,True,693,-51.25665283203125,-55.18849563598633,1
Nancy does pass those museums.,Nancy does pass those museum.,morphology,determiner_noun_agreement,determiner_noun_agreement_1,True,True,False,True,694,-52.89427185058594,-52.88345718383789,0
Brad liked those grocery stores.,Brad liked those grocery store.,morphology,determiner_noun_agreement,determiner_noun_agreement_1,True,True,False,True,695,-35.944862365722656,-37.05541229248047,1
Carol insults that actor.,Carol insults that actors.,morphology,determiner_noun_agreement,determiner_noun_agreement_1,True,True,False,True,696,-44.217559814453125,-44.69811248779297,1
Thomas knows those guests.,Thomas knows those guest.,morphology,determiner_noun_agreement,determiner_noun_agreement_1,True,True,False,True,697,-29.101917266845703,-30.46367073059082,1
Angela watched this pedestrian.,Angela watched this pedestrians.,morphology,determiner_noun_agreement,determiner_noun_agreement_1,True,True,False,True,698,-36.84917068481445,-36.685333251953125,0
Sally hasn't known that waitress.,Sally hasn't known that waitresses.,morphology,determiner_noun_agreement,determiner_noun_agreement_1,True,True,False,True,699,-53.122337341308594,-62.1935920715332,1
Harvard University didn't hate this adult.,Harvard University didn't hate this adults.,morphology,determiner_noun_agreement,determiner_noun_agreement_1,True,True,False,True,700,-54.401222229003906,-52.699951171875,0
Anna hadn't fled from these restaurants.,Anna hadn't fled from these restaurant.,morphology,determiner_noun_agreement,determiner_noun_agreement_1,True,True,False,True,701,-42.995262145996094,-45.43568420410156,1
The Impressionists hadn't lifted this sweater.,The Impressionists hadn't lifted this sweaters.,morphology,determiner_noun_agreement,determiner_noun_agreement_1,True,True,False,True,702,-68.82666015625,-74.51835632324219,1
Allison couldn't listen to this guest.,Allison couldn't listen to this guests.,morphology,determiner_noun_agreement,determiner_noun_agreement_1,True,True,False,True,703,-44.42967987060547,-44.76408386230469,1
All teenagers insult these movie theaters.,All teenagers insult these movie theater.,morphology,determiner_noun_agreement,determiner_noun_agreement_1,True,True,False,True,704,-53.75136947631836,-54.88468551635742,1
The carriage scares those senators.,The carriage scares those senator.,morphology,determiner_noun_agreement,determiner_noun_agreement_1,True,True,False,True,705,-44.940757751464844,-42.65095901489258,0
These students didn't disagree with those children.,These students didn't disagree with those child.,morphology,determiner_noun_agreement,determiner_noun_agreement_1,True,True,False,True,706,-36.62500762939453,-40.02293395996094,1
Children bike to those banks.,Children bike to those bank.,morphology,determiner_noun_agreement,determiner_noun_agreement_1,True,True,False,True,707,-34.68144226074219,-35.26927185058594,1
Alice isn't complaining about that waitress.,Alice isn't complaining about that waitresses.,morphology,determiner_noun_agreement,determiner_noun_agreement_1,True,True,False,True,708,-37.836429595947266,-47.75123596191406,1
Some girls clean this car.,Some girls clean this cars.,morphology,determiner_noun_agreement,determiner_noun_agreement_1,True,True,False,True,709,-28.733280181884766,-31.006664276123047,1
Most waiters could break those couches.,Most waiters could break those couch.,morphology,determiner_noun_agreement,determiner_noun_agreement_1,True,True,False,True,710,-55.35931396484375,-49.262298583984375,0
Bruce questions that cashier.,Bruce questions that cashiers.,morphology,determiner_noun_agreement,determiner_noun_agreement_1,True,True,False,True,711,-38.64274597167969,-39.23004150390625,1
George hated these cashiers.,George hated these cashier.,morphology,determiner_noun_agreement,determiner_noun_agreement_1,True,True,False,True,712,-38.43587112426758,-38.883811950683594,1
Ella concealed these teachers.,Ella concealed these teacher.,morphology,determiner_noun_agreement,determiner_noun_agreement_1,True,True,False,True,713,-53.6217041015625,-56.16374588012695,1
Sheila is bringing this hamster.,Sheila is bringing this hamsters.,morphology,determiner_noun_agreement,determiner_noun_agreement_1,True,True,False,True,714,-46.2921142578125,-45.08786392211914,0
Some doctors boast about those patients.,Some doctors boast about those patient.,morphology,determiner_noun_agreement,determiner_noun_agreement_1,True,True,False,True,715,-44.86762237548828,-46.77802658081055,1
Carla has investigated these boys.,Carla has investigated these boy.,morphology,determiner_noun_agreement,determiner_noun_agreement_1,True,True,False,True,716,-37.9866828918457,-42.425392150878906,1
Those actors have taken those libraries.,Those actors have taken those library.,morphology,determiner_noun_agreement,determiner_noun_agreement_1,True,True,False,True,717,-36.665626525878906,-35.26929473876953,0
Some restaurants irritated that lady.,Some restaurants irritated that ladies.,morphology,determiner_noun_agreement,determiner_noun_agreement_1,True,True,False,True,718,-38.258995056152344,-39.36985397338867,1
Marcus couldn't complain about this teacher.,Marcus couldn't complain about this teachers.,morphology,determiner_noun_agreement,determiner_noun_agreement_1,True,True,False,True,719,-33.85984802246094,-35.287654876708984,1
Carmen isn't boasting about this story.,Carmen isn't boasting about this stories.,morphology,determiner_noun_agreement,determiner_noun_agreement_1,True,True,False,True,720,-66.89024353027344,-69.2090072631836,1
That senator is selling that art gallery.,That senator is selling that art galleries.,morphology,determiner_noun_agreement,determiner_noun_agreement_1,True,True,False,True,721,-54.020503997802734,-52.9114990234375,0
Patrick investigates these girls.,Patrick investigates these girl.,morphology,determiner_noun_agreement,determiner_noun_agreement_1,True,True,False,True,722,-34.0914421081543,-37.18037796020508,1
Lucille has stunned this guest.,Lucille has stunned this guests.,morphology,determiner_noun_agreement,determiner_noun_agreement_1,True,True,False,True,723,-47.32068634033203,-47.25714874267578,0
Most men examine these reports.,Most men examine these report.,morphology,determiner_noun_agreement,determiner_noun_agreement_1,True,True,False,True,724,-35.07298278808594,-38.074825286865234,1
This eye embarrasses these ladies.,This eye embarrasses these lady.,morphology,determiner_noun_agreement,determiner_noun_agreement_1,True,True,False,True,725,-50.48063659667969,-52.150306701660156,1
Ella hasn't healed that boy.,Ella hasn't healed that boys.,morphology,determiner_noun_agreement,determiner_noun_agreement_1,True,True,False,True,726,-55.88975524902344,-57.830039978027344,1
Sabrina wasn't talking about this mall.,Sabrina wasn't talking about this malls.,morphology,determiner_noun_agreement,determiner_noun_agreement_1,True,True,False,True,727,-36.45576858520508,-43.01092529296875,1
Ella argued about those patients.,Ella argued about those patient.,morphology,determiner_noun_agreement,determiner_noun_agreement_1,True,True,False,True,728,-49.482078552246094,-51.826988220214844,1
This girl could arrive at those college campuses.,This girl could arrive at those college campus.,morphology,determiner_noun_agreement,determiner_noun_agreement_1,True,True,False,True,729,-50.716976165771484,-48.99403381347656,0
Cheryl wasn't revealing those ladies.,Cheryl wasn't revealing those lady.,morphology,determiner_noun_agreement,determiner_noun_agreement_1,True,True,False,True,730,-67.0360107421875,-68.25015258789062,1
Jodi boasted about that book.,Jodi boasted about that books.,morphology,determiner_noun_agreement,determiner_noun_agreement_1,True,True,False,True,731,-48.670814514160156,-51.472938537597656,1
Colleen has known that pedestrian.,Colleen has known that pedestrians.,morphology,determiner_noun_agreement,determiner_noun_agreement_1,True,True,False,True,732,-48.78655242919922,-47.55818176269531,0
David wouldn't sell this plate.,David wouldn't sell this plates.,morphology,determiner_noun_agreement,determiner_noun_agreement_1,True,True,False,True,733,-29.79520034790039,-32.406890869140625,1
This legislature wouldn't help that teenager.,This legislature wouldn't help that teenagers.,morphology,determiner_noun_agreement,determiner_noun_agreement_1,True,True,False,True,734,-47.20281982421875,-45.96671676635742,0
Wayne was driving to this high school.,Wayne was driving to this high schools.,morphology,determiner_noun_agreement,determiner_noun_agreement_1,True,True,False,True,735,-39.67245864868164,-45.11914825439453,1
Dana will discuss this dancer.,Dana will discuss this dancers.,morphology,determiner_noun_agreement,determiner_noun_agreement_1,True,True,False,True,736,-44.91614532470703,-46.412071228027344,1
Candice cared for those teachers.,Candice cared for those teacher.,morphology,determiner_noun_agreement,determiner_noun_agreement_1,True,True,False,True,737,-36.02939224243164,-38.08157730102539,1
Every sketch looks like this brochure.,Every sketch looks like this brochures.,morphology,determiner_noun_agreement,determiner_noun_agreement_1,True,True,False,True,738,-49.68659973144531,-48.93130111694336,0
Most waiters love these documentaries.,Most waiters love these documentary.,morphology,determiner_noun_agreement,determiner_noun_agreement_1,True,True,False,True,739,-51.76871871948242,-51.94230651855469,1
Dancers are researching these pictures.,Dancers are researching these picture.,morphology,determiner_noun_agreement,determiner_noun_agreement_1,True,True,False,True,740,-52.31727600097656,-55.20834732055664,1
Christopher would aggravate these governments.,Christopher would aggravate these government.,morphology,determiner_noun_agreement,determiner_noun_agreement_1,True,True,False,True,741,-40.42454528808594,-38.34539794921875,0
Winston Churchill wasn't criticizing this college campus.,Winston Churchill wasn't criticizing this college campuses.,morphology,determiner_noun_agreement,determiner_noun_agreement_1,True,True,False,True,742,-73.03654479980469,-75.11846923828125,1
Mitchell discussed this teenager.,Mitchell discussed this teenagers.,morphology,determiner_noun_agreement,determiner_noun_agreement_1,True,True,False,True,743,-42.0584716796875,-42.13053894042969,1
Monet fired those waiters.,Monet fired those waiter.,morphology,determiner_noun_agreement,determiner_noun_agreement_1,True,True,False,True,744,-45.735198974609375,-40.447418212890625,0
The chicken shocks those committees.,The chicken shocks those committee.,morphology,determiner_noun_agreement,determiner_noun_agreement_1,True,True,False,True,745,-41.29414367675781,-42.63292694091797,1
The Lutherans approach this adult.,The Lutherans approach this adults.,morphology,determiner_noun_agreement,determiner_noun_agreement_1,True,True,False,True,746,-53.5345458984375,-52.88850402832031,0
Carol didn't return to that boy.,Carol didn't return to that boys.,morphology,determiner_noun_agreement,determiner_noun_agreement_1,True,True,False,True,747,-42.36109161376953,-44.30089569091797,1
Jane arrived at these restaurants.,Jane arrived at these restaurant.,morphology,determiner_noun_agreement,determiner_noun_agreement_1,True,True,False,True,748,-28.300704956054688,-30.225967407226562,1
That teacher revealed these teachers.,That teacher revealed these teacher.,morphology,determiner_noun_agreement,determiner_noun_agreement_1,True,True,False,True,749,-39.90748596191406,-41.47304153442383,1
Every book isn't stunning these banks.,Every book isn't stunning these bank.,morphology,determiner_noun_agreement,determiner_noun_agreement_1,True,True,False,True,750,-48.843143463134766,-50.882225036621094,1
Carla isn't messing up those couches.,Carla isn't messing up those couch.,morphology,determiner_noun_agreement,determiner_noun_agreement_1,True,True,False,True,751,-54.338661193847656,-48.97244644165039,0
Lori hasn't exited that grocery store.,Lori hasn't exited that grocery stores.,morphology,determiner_noun_agreement,determiner_noun_agreement_1,True,True,False,True,752,-67.50982666015625,-67.38552856445312,0
Waitresses lift those socks.,Waitresses lift those sock.,morphology,determiner_noun_agreement,determiner_noun_agreement_1,True,True,False,True,753,-41.01756286621094,-43.72836685180664,1
John wasn't shocking this doctor.,John wasn't shocking this doctors.,morphology,determiner_noun_agreement,determiner_noun_agreement_1,True,True,False,True,754,-41.13236999511719,-43.73400115966797,1
Gerald cleans that scarf.,Gerald cleans that scarves.,morphology,determiner_noun_agreement,determiner_noun_agreement_1,True,True,False,True,755,-48.24994659423828,-52.643882751464844,1
Larry wasn't scaring this legislature.,Larry wasn't scaring this legislatures.,morphology,determiner_noun_agreement,determiner_noun_agreement_1,True,True,False,True,756,-42.41114807128906,-44.785099029541016,1
All ladders wouldn't annoy this girl.,All ladders wouldn't annoy this girls.,morphology,determiner_noun_agreement,determiner_noun_agreement_1,True,True,False,True,757,-55.77196502685547,-58.75039291381836,1
The Borgias haven't cared for those children.,The Borgias haven't cared for those child.,morphology,determiner_noun_agreement,determiner_noun_agreement_1,True,True,False,True,758,-55.28340148925781,-58.969749450683594,1
Emily disagrees with that boy.,Emily disagrees with that boys.,morphology,determiner_noun_agreement,determiner_noun_agreement_1,True,True,False,True,759,-30.898555755615234,-32.41230010986328,1
Guy has cleaned these restaurants.,Guy has cleaned these restaurant.,morphology,determiner_noun_agreement,determiner_noun_agreement_1,True,True,False,True,760,-28.632850646972656,-31.36130142211914,1
Ruth looks like that sketch.,Ruth looks like that sketches.,morphology,determiner_noun_agreement,determiner_noun_agreement_1,True,True,False,True,761,-43.77330780029297,-46.50749969482422,1
Every river shocks this boy.,Every river shocks this boys.,morphology,determiner_noun_agreement,determiner_noun_agreement_1,True,True,False,True,762,-39.983089447021484,-41.610260009765625,1
The sketch wouldn't look like these cups.,The sketch wouldn't look like these cup.,morphology,determiner_noun_agreement,determiner_noun_agreement_1,True,True,False,True,763,-46.912986755371094,-47.780311584472656,1
The cashiers pass this grocery store.,The cashiers pass this grocery stores.,morphology,determiner_noun_agreement,determiner_noun_agreement_1,True,True,False,True,764,-52.88860321044922,-54.1505241394043,1
Those actors hire those waitresses.,Those actors hire those waitress.,morphology,determiner_noun_agreement,determiner_noun_agreement_1,True,True,False,True,765,-50.39921951293945,-40.062355041503906,0
