sentence_good,sentence_bad,field,linguistics_term,UID,simple_LM_method,one_prefix_method,two_prefix_method,lexically_identical,pair_id,good_prob,bad_prob,correct
All waiters haven't thought that they hadn't taken all grocery stores.,All waiters haven't thought that themselves hadn't taken all grocery stores.,syntax_semantics,binding,principle_A_case_1,True,True,False,False,712,-79.3368148803711,-88.10942077636719,1
Nina thinks that she did think about all hospitals.,Nina thinks that herself did think about all hospitals.,syntax_semantics,binding,principle_A_case_1,True,True,False,False,713,-62.00262451171875,-68.93327331542969,1
April imagined that she liked screens.,April imagined that herself liked screens.,syntax_semantics,binding,principle_A_case_1,True,True,False,False,714,-43.69284439086914,-52.222023010253906,1
Waitresses think that they aren't describing those libraries.,Waitresses think that themselves aren't describing those libraries.,syntax_semantics,binding,principle_A_case_1,True,True,False,False,715,-66.93095397949219,-72.5828628540039,1
Tanya says that she bored Jesus.,Tanya says that herself bored Jesus.,syntax_semantics,binding,principle_A_case_1,True,True,False,False,716,-60.86299133300781,-67.27879333496094,1
Joseph was thinking that he has upset Karen.,Joseph was thinking that himself has upset Karen.,syntax_semantics,binding,principle_A_case_1,True,True,False,False,717,-46.963130950927734,-55.472259521484375,1
Kendra wasn't thinking that she wouldn't clean the gloves.,Kendra wasn't thinking that herself wouldn't clean the gloves.,syntax_semantics,binding,principle_A_case_1,True,True,False,False,718,-73.86076354980469,-81.50948333740234,1
Sarah couldn't imagine that she disturbed Monet.,Sarah couldn't imagine that herself disturbed Monet.,syntax_semantics,binding,principle_A_case_1,True,True,False,False,719,-59.348968505859375,-64.31639099121094,1
Donna isn't saying that she isn't worrying Renee.,Donna isn't saying that herself isn't worrying Renee.,syntax_semantics,binding,principle_A_case_1,True,True,False,False,720,-69.23011016845703,-75.87120056152344,1
That boy thinks that he is passing these malls.,That boy thinks that himself is passing these malls.,syntax_semantics,binding,principle_A_case_1,True,True,False,False,721,-57.93827819824219,-64.01850891113281,1
Anne would explain that she healed Tiffany.,Anne would explain that herself healed Tiffany.,syntax_semantics,binding,principle_A_case_1,True,True,False,False,722,-53.6134033203125,-58.480255126953125,1
Andrew hasn't thought that he has cared for Brian.,Andrew hasn't thought that himself has cared for Brian.,syntax_semantics,binding,principle_A_case_1,True,True,False,False,723,-48.999229431152344,-54.6251220703125,1
Kristen isn't saying that she messed up all schools.,Kristen isn't saying that herself messed up all schools.,syntax_semantics,binding,principle_A_case_1,True,True,False,False,724,-52.79843521118164,-58.75346755981445,1
Omar thought that he wasn't hurting William.,Omar thought that himself wasn't hurting William.,syntax_semantics,binding,principle_A_case_1,True,True,False,False,725,-56.559852600097656,-63.47003173828125,1
Omar couldn't think that he hasn't referenced Douglas.,Omar couldn't think that himself hasn't referenced Douglas.,syntax_semantics,binding,principle_A_case_1,True,True,False,False,726,-68.12306213378906,-73.19078826904297,1
All students think that they had hidden some hat.,All students think that themselves had hidden some hat.,syntax_semantics,binding,principle_A_case_1,True,True,False,False,727,-49.502967834472656,-56.708839416503906,1
Cynthia is saying that she was disturbing those customers.,Cynthia is saying that herself was disturbing those customers.,syntax_semantics,binding,principle_A_case_1,True,True,False,False,728,-75.08930969238281,-83.53935241699219,1
Brad did imagine that he isn't disgusting Kendra.,Brad did imagine that himself isn't disgusting Kendra.,syntax_semantics,binding,principle_A_case_1,True,True,False,False,729,-73.44032287597656,-77.76138305664062,1
Eric has thought that he referenced Stephen.,Eric has thought that himself referenced Stephen.,syntax_semantics,binding,principle_A_case_1,True,True,False,False,730,-47.34294128417969,-54.24365997314453,1
Douglas might think that he will clean the cup.,Douglas might think that himself will clean the cup.,syntax_semantics,binding,principle_A_case_1,True,True,False,False,731,-57.185386657714844,-62.4482421875,1
Tracy says that she does hurt Pamela.,Tracy says that herself does hurt Pamela.,syntax_semantics,binding,principle_A_case_1,True,True,False,False,732,-51.46586990356445,-58.464176177978516,1
Martha was imagining that she questioned every doctor.,Martha was imagining that herself questioned every doctor.,syntax_semantics,binding,principle_A_case_1,True,True,False,False,733,-57.26801300048828,-64.85183715820312,1
Diana couldn't explain that she isn't impressing many guys.,Diana couldn't explain that herself isn't impressing many guys.,syntax_semantics,binding,principle_A_case_1,True,True,False,False,734,-84.91252136230469,-89.76678466796875,1
Susan imagines that she can fix some screens.,Susan imagines that herself can fix some screens.,syntax_semantics,binding,principle_A_case_1,True,True,False,False,735,-57.095458984375,-63.31163024902344,1
Those people think that they have thought about Bill.,Those people think that themselves have thought about Bill.,syntax_semantics,binding,principle_A_case_1,True,True,False,False,736,-39.05282974243164,-45.4125862121582,1
Allison explains that she could discuss Jacqueline.,Allison explains that herself could discuss Jacqueline.,syntax_semantics,binding,principle_A_case_1,True,True,False,False,737,-64.65957641601562,-73.60952758789062,1
Theodore explained that he has known Regina.,Theodore explained that himself has known Regina.,syntax_semantics,binding,principle_A_case_1,True,True,False,False,738,-59.78156280517578,-68.4525146484375,1
Monica explains that she isn't walking through this public park.,Monica explains that herself isn't walking through this public park.,syntax_semantics,binding,principle_A_case_1,True,True,False,False,739,-68.36051177978516,-75.23995208740234,1
Most guests imagine that they couldn't kiss Chad.,Most guests imagine that themselves couldn't kiss Chad.,syntax_semantics,binding,principle_A_case_1,True,True,False,False,740,-58.1763916015625,-66.6859359741211,1
Most customers imagine that they hurt Samuel.,Most customers imagine that themselves hurt Samuel.,syntax_semantics,binding,principle_A_case_1,True,True,False,False,741,-49.63380432128906,-57.0888557434082,1
The Impressionists should imagine that they aren't selling some hospitals.,The Impressionists should imagine that themselves aren't selling some hospitals.,syntax_semantics,binding,principle_A_case_1,True,True,False,False,742,-77.10026550292969,-84.34735107421875,1
George isn't imagining that he remembers Kathleen.,George isn't imagining that himself remembers Kathleen.,syntax_semantics,binding,principle_A_case_1,True,True,False,False,743,-55.12461471557617,-63.676937103271484,1
Most waiters say that they had ascended slopes.,Most waiters say that themselves had ascended slopes.,syntax_semantics,binding,principle_A_case_1,True,True,False,False,744,-67.4870376586914,-74.84516143798828,1
Jodi doesn't say that she kisses Carol.,Jodi doesn't say that herself kisses Carol.,syntax_semantics,binding,principle_A_case_1,True,True,False,False,745,-67.0673599243164,-72.98554992675781,1
Lucille thought that she is finding Diana.,Lucille thought that herself is finding Diana.,syntax_semantics,binding,principle_A_case_1,True,True,False,False,746,-52.92425537109375,-58.168853759765625,1
Travis can imagine that he shouldn't exit the college campuses.,Travis can imagine that himself shouldn't exit the college campuses.,syntax_semantics,binding,principle_A_case_1,True,True,False,False,747,-86.72747039794922,-93.01277160644531,1
Russell has imagined that he had escaped from Helen.,Russell has imagined that himself had escaped from Helen.,syntax_semantics,binding,principle_A_case_1,True,True,False,False,748,-55.79116439819336,-63.75640106201172,1
Stephen has thought that he hadn't insulted the Clintons.,Stephen has thought that himself hadn't insulted the Clintons.,syntax_semantics,binding,principle_A_case_1,True,True,False,False,749,-59.69545364379883,-66.84318542480469,1
Eric says that he was finding Eva.,Eric says that himself was finding Eva.,syntax_semantics,binding,principle_A_case_1,True,True,False,False,750,-39.12725067138672,-48.80192184448242,1
That girl thinks that she likes Margaret.,That girl thinks that herself likes Margaret.,syntax_semantics,binding,principle_A_case_1,True,True,False,False,751,-43.78464126586914,-51.21397399902344,1
Jennifer imagines that she climbed up the hill.,Jennifer imagines that herself climbed up the hill.,syntax_semantics,binding,principle_A_case_1,True,True,False,False,752,-55.07855987548828,-62.58209991455078,1
Some actresses thought that they do disturb the adult.,Some actresses thought that themselves do disturb the adult.,syntax_semantics,binding,principle_A_case_1,True,True,False,False,753,-54.319908142089844,-60.683902740478516,1
Elaine says that she hasn't boycotted these public parks.,Elaine says that herself hasn't boycotted these public parks.,syntax_semantics,binding,principle_A_case_1,True,True,False,False,754,-89.82589721679688,-94.9779281616211,1
Donna hadn't explained that she alarmed Joel.,Donna hadn't explained that herself alarmed Joel.,syntax_semantics,binding,principle_A_case_1,True,True,False,False,755,-61.617149353027344,-67.40528106689453,1
Carmen explains that she had healed Katherine.,Carmen explains that herself had healed Katherine.,syntax_semantics,binding,principle_A_case_1,True,True,False,False,756,-78.36337280273438,-85.89207458496094,1
Eric wasn't explaining that he disgusted some guy.,Eric wasn't explaining that himself disgusted some guy.,syntax_semantics,binding,principle_A_case_1,True,True,False,False,757,-57.81312942504883,-63.06647491455078,1
Joseph wasn't saying that he hadn't sold horses.,Joseph wasn't saying that himself hadn't sold horses.,syntax_semantics,binding,principle_A_case_1,True,True,False,False,758,-47.47966384887695,-54.77755355834961,1
Sonia imagines that she has taken rugs.,Sonia imagines that herself has taken rugs.,syntax_semantics,binding,principle_A_case_1,True,True,False,False,759,-80.35770416259766,-86.37718200683594,1
The Impressionists explain that they upsets Florence.,The Impressionists explain that themselves upsets Florence.,syntax_semantics,binding,principle_A_case_1,True,True,False,False,760,-81.48043060302734,-87.61570739746094,1
All drivers say that they weren't describing Cynthia.,All drivers say that themselves weren't describing Cynthia.,syntax_semantics,binding,principle_A_case_1,True,True,False,False,761,-51.773075103759766,-59.89628219604492,1
Some man explained that he doesn't notice Carlos.,Some man explained that himself doesn't notice Carlos.,syntax_semantics,binding,principle_A_case_1,True,True,False,False,762,-53.574554443359375,-63.126617431640625,1
Lori has explained that she hadn't stunned children.,Lori has explained that herself hadn't stunned children.,syntax_semantics,binding,principle_A_case_1,True,True,False,False,763,-69.0408935546875,-77.87046813964844,1
Derek might imagine that he remembered Jennifer.,Derek might imagine that himself remembered Jennifer.,syntax_semantics,binding,principle_A_case_1,True,True,False,False,764,-65.6045150756836,-74.06724548339844,1
Raymond was thinking that he wasn't talking about Christine.,Raymond was thinking that himself wasn't talking about Christine.,syntax_semantics,binding,principle_A_case_1,True,True,False,False,765,-48.771148681640625,-56.80534362792969,1
Pamela thought that she hasn't bored every teacher.,Pamela thought that herself hasn't bored every teacher.,syntax_semantics,binding,principle_A_case_1,True,True,False,False,766,-81.92536163330078,-87.34089660644531,1
Clyde can think that he has respected Kenneth.,Clyde can think that himself has respected Kenneth.,syntax_semantics,binding,principle_A_case_1,True,True,False,False,767,-82.4784927368164,-88.45787048339844,1
Many teachers imagine that they hire Linda.,Many teachers imagine that themselves hire Linda.,syntax_semantics,binding,principle_A_case_1,True,True,False,False,768,-50.57758712768555,-58.80668640136719,1
Amelia says that she has watched some patients.,Amelia says that herself has watched some patients.,syntax_semantics,binding,principle_A_case_1,True,True,False,False,769,-54.184814453125,-60.643959045410156,1
The Impressionists explain that they aren't boasting about John.,The Impressionists explain that themselves aren't boasting about John.,syntax_semantics,binding,principle_A_case_1,True,True,False,False,770,-84.7642822265625,-90.55415344238281,1
Every woman isn't thinking that she wasn't escaping from Katherine.,Every woman isn't thinking that herself wasn't escaping from Katherine.,syntax_semantics,binding,principle_A_case_1,True,True,False,False,771,-64.47191619873047,-71.74625396728516,1
The Lutherans imagine that they have dropped by many hospitals.,The Lutherans imagine that themselves have dropped by many hospitals.,syntax_semantics,binding,principle_A_case_1,True,True,False,False,772,-73.84440612792969,-80.54682922363281,1
These ladies think that they alarmed Anna.,These ladies think that themselves alarmed Anna.,syntax_semantics,binding,principle_A_case_1,True,True,False,False,773,-48.990928649902344,-56.30033493041992,1
The man wasn't saying that he isn't shocking Edward.,The man wasn't saying that himself isn't shocking Edward.,syntax_semantics,binding,principle_A_case_1,True,True,False,False,774,-60.343605041503906,-66.64300537109375,1
These students think that they were disgusting Kevin.,These students think that themselves were disgusting Kevin.,syntax_semantics,binding,principle_A_case_1,True,True,False,False,775,-47.00924301147461,-53.431396484375,1
All women haven't thought that they cure Grace.,All women haven't thought that themselves cure Grace.,syntax_semantics,binding,principle_A_case_1,True,True,False,False,776,-53.62737274169922,-60.363075256347656,1
Jason imagines that he hadn't looked like all prints.,Jason imagines that himself hadn't looked like all prints.,syntax_semantics,binding,principle_A_case_1,True,True,False,False,777,-68.17930603027344,-74.41580200195312,1
Jacqueline thinks that she escapes from Ellen.,Jacqueline thinks that herself escapes from Ellen.,syntax_semantics,binding,principle_A_case_1,True,True,False,False,778,-66.49429321289062,-71.29376220703125,1
Nancy imagines that she could care for Julia.,Nancy imagines that herself could care for Julia.,syntax_semantics,binding,principle_A_case_1,True,True,False,False,779,-75.19342041015625,-83.9075927734375,1
Scott imagined that he knew Candice.,Scott imagined that himself knew Candice.,syntax_semantics,binding,principle_A_case_1,True,True,False,False,780,-47.271644592285156,-57.499664306640625,1
All waiters think that they haven't confused James.,All waiters think that themselves haven't confused James.,syntax_semantics,binding,principle_A_case_1,True,True,False,False,781,-66.48220825195312,-74.64788818359375,1
Vanessa thinks that she complained about Adam.,Vanessa thinks that herself complained about Adam.,syntax_semantics,binding,principle_A_case_1,True,True,False,False,782,-52.239707946777344,-59.56071853637695,1
Frank thought that he hadn't disliked Roger.,Frank thought that himself hadn't disliked Roger.,syntax_semantics,binding,principle_A_case_1,True,True,False,False,783,-54.20446014404297,-61.04844284057617,1
Jeffrey was saying that he worried Kirsten.,Jeffrey was saying that himself worried Kirsten.,syntax_semantics,binding,principle_A_case_1,True,True,False,False,784,-61.412933349609375,-69.0044174194336,1
Kirsten is thinking that she disgusted Dan.,Kirsten is thinking that herself disgusted Dan.,syntax_semantics,binding,principle_A_case_1,True,True,False,False,785,-67.81597137451172,-74.85899353027344,1
Angela has imagined that she has thought about Renee.,Angela has imagined that herself has thought about Renee.,syntax_semantics,binding,principle_A_case_1,True,True,False,False,786,-63.94039535522461,-72.37892150878906,1
Rebecca shouldn't imagine that she boasted about Jesus.,Rebecca shouldn't imagine that herself boasted about Jesus.,syntax_semantics,binding,principle_A_case_1,True,True,False,False,787,-63.16568374633789,-70.0582046508789,1
Noah thinks that he does bore some men.,Noah thinks that himself does bore some men.,syntax_semantics,binding,principle_A_case_1,True,True,False,False,788,-64.81983184814453,-70.61430358886719,1
Elizabeth imagines that she has the pictures.,Elizabeth imagines that herself has the pictures.,syntax_semantics,binding,principle_A_case_1,True,True,False,False,789,-47.62588119506836,-54.830848693847656,1
Donna was thinking that she had known senators.,Donna was thinking that herself had known senators.,syntax_semantics,binding,principle_A_case_1,True,True,False,False,790,-55.49885177612305,-63.39793395996094,1
Colleen might imagine that she would remember John.,Colleen might imagine that herself would remember John.,syntax_semantics,binding,principle_A_case_1,True,True,False,False,791,-59.39773941040039,-65.70498657226562,1
Deanna will imagine that she isn't running around every hill.,Deanna will imagine that herself isn't running around every hill.,syntax_semantics,binding,principle_A_case_1,True,True,False,False,792,-68.35311889648438,-73.28395080566406,1
This girl isn't imagining that she hadn't approached Rachelle.,This girl isn't imagining that herself hadn't approached Rachelle.,syntax_semantics,binding,principle_A_case_1,True,True,False,False,793,-74.9632797241211,-84.6635971069336,1
Stacey didn't explain that she had fixed many plates.,Stacey didn't explain that herself had fixed many plates.,syntax_semantics,binding,principle_A_case_1,True,True,False,False,794,-71.33992004394531,-78.53419494628906,1
Roger says that he hadn't boycotted a museum.,Roger says that himself hadn't boycotted a museum.,syntax_semantics,binding,principle_A_case_1,True,True,False,False,795,-68.41439819335938,-74.75907135009766,1
Children imagine that they hadn't lifted pasta.,Children imagine that themselves hadn't lifted pasta.,syntax_semantics,binding,principle_A_case_1,True,True,False,False,796,-50.17900848388672,-58.1826171875,1
Victoria wouldn't imagine that she bought prints.,Victoria wouldn't imagine that herself bought prints.,syntax_semantics,binding,principle_A_case_1,True,True,False,False,797,-45.86634826660156,-52.257869720458984,1
Danielle might say that she appreciated Kirsten.,Danielle might say that herself appreciated Kirsten.,syntax_semantics,binding,principle_A_case_1,True,True,False,False,798,-62.750038146972656,-67.7900390625,1
Beth can say that she was irritating Scott.,Beth can say that herself was irritating Scott.,syntax_semantics,binding,principle_A_case_1,True,True,False,False,799,-69.53450012207031,-75.66397094726562,1
Erin is explaining that she ascended steps.,Erin is explaining that herself ascended steps.,syntax_semantics,binding,principle_A_case_1,True,True,False,False,800,-58.483455657958984,-64.83558654785156,1
The Borgias imagine that they disgusts Debra.,The Borgias imagine that themselves disgusts Debra.,syntax_semantics,binding,principle_A_case_1,True,True,False,False,801,-85.44139862060547,-93.38591003417969,1
Richard hasn't said that he doesn't know Rodney.,Richard hasn't said that himself doesn't know Rodney.,syntax_semantics,binding,principle_A_case_1,True,True,False,False,802,-44.13971710205078,-52.96973419189453,1
Adam isn't thinking that he has boycotted a mall.,Adam isn't thinking that himself has boycotted a mall.,syntax_semantics,binding,principle_A_case_1,True,True,False,False,803,-71.09046173095703,-78.45558166503906,1
Martha hasn't imagined that she hasn't fled from the cafe.,Martha hasn't imagined that herself hasn't fled from the cafe.,syntax_semantics,binding,principle_A_case_1,True,True,False,False,804,-68.05086517333984,-75.45884704589844,1
Caroline shouldn't say that she was fleeing from Samuel.,Caroline shouldn't say that herself was fleeing from Samuel.,syntax_semantics,binding,principle_A_case_1,True,True,False,False,805,-66.5811538696289,-73.84765625,1
Carol wouldn't think that she broke every chair.,Carol wouldn't think that herself broke every chair.,syntax_semantics,binding,principle_A_case_1,True,True,False,False,806,-57.760894775390625,-63.69034194946289,1
Kristin thinks that she loves Dawn.,Kristin thinks that herself loves Dawn.,syntax_semantics,binding,principle_A_case_1,True,True,False,False,807,-45.843441009521484,-53.71354293823242,1
Lori wouldn't say that she would walk through those movie theaters.,Lori wouldn't say that herself would walk through those movie theaters.,syntax_semantics,binding,principle_A_case_1,True,True,False,False,808,-80.06218719482422,-86.27998352050781,1
These women think that they would see hills.,These women think that themselves would see hills.,syntax_semantics,binding,principle_A_case_1,True,True,False,False,809,-39.228172302246094,-45.994693756103516,1
William did imagine that he listens to the Borgias.,William did imagine that himself listens to the Borgias.,syntax_semantics,binding,principle_A_case_1,True,True,False,False,810,-68.59835815429688,-76.17906188964844,1
Tonya was thinking that she hadn't boycotted those restaurants.,Tonya was thinking that herself hadn't boycotted those restaurants.,syntax_semantics,binding,principle_A_case_1,True,True,False,False,811,-79.50106811523438,-86.68305969238281,1
Derek is imagining that he should research a print.,Derek is imagining that himself should research a print.,syntax_semantics,binding,principle_A_case_1,True,True,False,False,812,-71.43119812011719,-80.11125183105469,1
James says that he works with Ella.,James says that himself works with Ella.,syntax_semantics,binding,principle_A_case_1,True,True,False,False,813,-36.50157165527344,-47.170372009277344,1
Mitchell said that he climbed up many slopes.,Mitchell said that himself climbed up many slopes.,syntax_semantics,binding,principle_A_case_1,True,True,False,False,814,-59.675777435302734,-68.10350036621094,1
Gary was imagining that he wasn't leaving Theodore.,Gary was imagining that himself wasn't leaving Theodore.,syntax_semantics,binding,principle_A_case_1,True,True,False,False,815,-48.763084411621094,-58.77527618408203,1
All teachers were thinking that they irritate Roger.,All teachers were thinking that themselves irritate Roger.,syntax_semantics,binding,principle_A_case_1,True,True,False,False,816,-57.51450729370117,-64.74237060546875,1
Julie says that she had boycotted some restaurant.,Julie says that herself had boycotted some restaurant.,syntax_semantics,binding,principle_A_case_1,True,True,False,False,817,-68.62612915039062,-75.97689056396484,1
Kristin thinks that she is thinking about that girl.,Kristin thinks that herself is thinking about that girl.,syntax_semantics,binding,principle_A_case_1,True,True,False,False,818,-47.80497741699219,-55.536643981933594,1
Those waiters explain that they haven't arrived at art galleries.,Those waiters explain that themselves haven't arrived at art galleries.,syntax_semantics,binding,principle_A_case_1,True,True,False,False,819,-76.63616943359375,-84.96026611328125,1
Kirsten had thought that she walks through those museums.,Kirsten had thought that herself walks through those museums.,syntax_semantics,binding,principle_A_case_1,True,True,False,False,820,-72.43661499023438,-79.60847473144531,1
Becky isn't thinking that she knew Carla.,Becky isn't thinking that herself knew Carla.,syntax_semantics,binding,principle_A_case_1,True,True,False,False,821,-55.635231018066406,-64.46807861328125,1
The children think that they are observing Joseph.,The children think that themselves are observing Joseph.,syntax_semantics,binding,principle_A_case_1,True,True,False,False,822,-47.35064697265625,-53.715049743652344,1
John isn't thinking that he had left Melinda.,John isn't thinking that himself had left Melinda.,syntax_semantics,binding,principle_A_case_1,True,True,False,False,823,-57.433753967285156,-65.82457733154297,1
Kayla explains that she hated Brenda.,Kayla explains that herself hated Brenda.,syntax_semantics,binding,principle_A_case_1,True,True,False,False,824,-53.81473159790039,-61.64327621459961,1
The Impressionists are imagining that they hadn't worried Robert.,The Impressionists are imagining that themselves hadn't worried Robert.,syntax_semantics,binding,principle_A_case_1,True,True,False,False,825,-84.28997039794922,-93.78377532958984,1
Susan imagines that she knew Stacey.,Susan imagines that herself knew Stacey.,syntax_semantics,binding,principle_A_case_1,True,True,False,False,826,-61.16053009033203,-70.59147644042969,1
A lot of waitresses think that they are skated around those hills.,A lot of waitresses think that themselves are skated around those hills.,syntax_semantics,binding,principle_A_case_1,True,True,False,False,827,-95.81121826171875,-103.14277648925781,1
The Impressionists explain that they didn't scan stories.,The Impressionists explain that themselves didn't scan stories.,syntax_semantics,binding,principle_A_case_1,True,True,False,False,828,-69.89383697509766,-77.41744995117188,1
Denise says that she should reference Daniel.,Denise says that herself should reference Daniel.,syntax_semantics,binding,principle_A_case_1,True,True,False,False,829,-54.99490737915039,-60.73987579345703,1
Rachelle has said that she hadn't worn a dress.,Rachelle has said that herself hadn't worn a dress.,syntax_semantics,binding,principle_A_case_1,True,True,False,False,830,-54.934600830078125,-62.124908447265625,1
