sentence_good,sentence_bad,field,linguistics_term,UID,simple_LM_method,one_prefix_method,two_prefix_method,lexically_identical,pair_id,good_prob,bad_prob,correct
A government doesn't respect dancers.,A government doesn't negotiate dancers.,syntax,argument_structure,transitive,True,False,True,False,286,-48.88943862915039,-49.55085754394531,1
Martha's plumbers sounded like the Borgias.,Martha's plumbers talk the Borgias.,syntax,argument_structure,transitive,True,False,True,False,287,-73.89089965820312,-76.64202880859375,1
All grandmothers of Liam didn't take many schools.,All grandmothers of Liam didn't litter many schools.,syntax,argument_structure,transitive,True,False,True,False,288,-65.18826293945312,-76.60304260253906,1
Noah's grandsons could hire Carlos.,Noah's grandsons could come here Carlos.,syntax,argument_structure,transitive,True,False,True,False,289,-77.83233642578125,-81.86904907226562,1
Kendra heals the patient.,Kendra shouts the patient.,syntax,argument_structure,transitive,True,False,True,False,290,-53.35015869140625,-50.60593795776367,0
Michael boasted about Anna.,Michael muttered Anna.,syntax,argument_structure,transitive,True,False,True,False,291,-35.285247802734375,-30.675556182861328,0
Every senator is approaching Beverly.,Every senator is slumping over Beverly.,syntax,argument_structure,transitive,True,False,True,False,292,-40.926300048828125,-55.707679748535156,1
Jill's classmates observe Sherry's handyman.,Jill's classmates conferred Sherry's handyman.,syntax,argument_structure,transitive,True,False,True,False,293,-92.31094360351562,-93.83335876464844,1
All associations argue about Tina.,All associations lied Tina.,syntax,argument_structure,transitive,True,False,True,False,294,-38.68157958984375,-40.82112503051758,1
Those books about politics could upset Bethany.,Those books about politics could fall Bethany.,syntax,argument_structure,transitive,True,False,True,False,295,-64.566650390625,-62.93938446044922,0
Organizations are taking most libraries.,Organizations are responding most libraries.,syntax,argument_structure,transitive,True,False,True,False,296,-41.38277816772461,-47.54566955566406,1
Ellen described every teenager's partner.,Ellen cried every teenager's partner.,syntax,argument_structure,transitive,True,False,True,False,297,-50.838558197021484,-49.7006721496582,0
Angela wasn't lifting every newspaper article.,Angela wasn't murmuring every newspaper article.,syntax,argument_structure,transitive,True,False,True,False,298,-52.58916091918945,-61.631080627441406,1
James wasn't wearing this sock.,James wasn't blinking this sock.,syntax,argument_structure,transitive,True,False,True,False,299,-34.50884246826172,-43.77685546875,1
Melissa's doctors attack Gregory's grandfather.,Melissa's doctors blinked Gregory's grandfather.,syntax,argument_structure,transitive,True,False,True,False,300,-60.13151550292969,-66.28768920898438,1
Most ladies bothered Barbara's nephew.,Most ladies sighed Barbara's nephew.,syntax,argument_structure,transitive,True,False,True,False,301,-50.07304000854492,-55.184173583984375,1
Kevin had found those fish.,Kevin had died those fish.,syntax,argument_structure,transitive,True,False,True,False,302,-27.977306365966797,-32.969810485839844,1
Vincent's electrician biked to that closet.,Vincent's electrician slumped over that closet.,syntax,argument_structure,transitive,True,False,True,False,303,-85.6280746459961,-80.24949645996094,0
All prints look like a dish.,All prints fall a dish.,syntax,argument_structure,transitive,True,False,True,False,304,-33.73087692260742,-38.828094482421875,1
Kendra might arrive at many grocery stores.,Kendra might suffer many grocery stores.,syntax,argument_structure,transitive,True,False,True,False,305,-66.47985076904297,-66.9322509765625,1
Stacy's ex-girlfriends discussed those teachers.,Stacy's ex-girlfriends cried those teachers.,syntax,argument_structure,transitive,True,False,True,False,306,-71.39764404296875,-74.74830627441406,1
Jason hadn't upset Amanda.,Jason hadn't screamed Amanda.,syntax,argument_structure,transitive,True,False,True,False,307,-35.93375015258789,-39.278533935546875,1
Vanessa knows Amanda's granddaughter.,Vanessa cried Amanda's granddaughter.,syntax,argument_structure,transitive,True,False,True,False,308,-43.80061721801758,-44.47956085205078,1
The adults' girlfriend observed Sandra's grandfather.,The adults' girlfriend cooperates Sandra's grandfather.,syntax,argument_structure,transitive,True,False,True,False,309,-66.92947387695312,-78.09961700439453,1
Carla does complain about all documentaries.,Carla does smile all documentaries.,syntax,argument_structure,transitive,True,False,True,False,310,-50.378028869628906,-51.34099578857422,1
The Impressionists lift every rug.,The Impressionists concur every rug.,syntax,argument_structure,transitive,True,False,True,False,311,-61.17107391357422,-70.52496337890625,1
A lot of granddaughters of Lucille reveal banks.,A lot of granddaughters of Lucille chat banks.,syntax,argument_structure,transitive,True,False,True,False,312,-91.46156311035156,-91.22879028320312,0
Renee would alarm Paul's friends.,Renee would mutter Paul's friends.,syntax,argument_structure,transitive,True,False,True,False,313,-51.22420120239258,-54.55634689331055,1
Regina has arrived at those college campuses.,Regina has spoken up those college campuses.,syntax,argument_structure,transitive,True,False,True,False,314,-53.608116149902344,-56.60462188720703,1
Phillip wouldn't annoy Monica.,Phillip wouldn't concur Monica.,syntax,argument_structure,transitive,True,False,True,False,315,-42.2119140625,-48.030982971191406,1
Martin did hire Janice.,Martin did lie Janice.,syntax,argument_structure,transitive,True,False,True,False,316,-41.66025161743164,-40.028629302978516,0
Every vase hurts Linda.,Every vase falls Linda.,syntax,argument_structure,transitive,True,False,True,False,317,-44.677635192871094,-47.15911102294922,1
Some waitress hurt Jeffrey.,Some waitress smiles Jeffrey.,syntax,argument_structure,transitive,True,False,True,False,318,-44.794410705566406,-45.45745849609375,1
All icicles confused Colleen's piano teacher.,All icicles fell Colleen's piano teacher.,syntax,argument_structure,transitive,True,False,True,False,319,-83.37214660644531,-79.40982055664062,0
Raymond's guests break those chairs.,Raymond's guests suffered those chairs.,syntax,argument_structure,transitive,True,False,True,False,320,-52.636600494384766,-53.471168518066406,1
Anne was admiring Travis.,Anne was nodding Travis.,syntax,argument_structure,transitive,True,False,True,False,321,-42.016876220703125,-33.95613479614258,0
Jerry doesn't fire Susan.,Jerry doesn't shout Susan.,syntax,argument_structure,transitive,True,False,True,False,322,-31.437164306640625,-31.178428649902344,0
Rachelle's supervisor wasn't hiding dogs.,Rachelle's supervisor wasn't smiling dogs.,syntax,argument_structure,transitive,True,False,True,False,323,-56.83620071411133,-58.08528137207031,1
Travis's ex-wife cleaned these shoes.,Travis's ex-wife lied these shoes.,syntax,argument_structure,transitive,True,False,True,False,324,-70.07676696777344,-74.83023834228516,1
Sonia can describe a man.,Sonia can speak up a man.,syntax,argument_structure,transitive,True,False,True,False,325,-42.84375,-49.19758605957031,1
Amanda hadn't fled from Steve.,Amanda hadn't nodded Steve.,syntax,argument_structure,transitive,True,False,True,False,326,-48.16237258911133,-48.19470977783203,1
Colleen's sisters are healing Amanda.,Colleen's sisters are falling Amanda.,syntax,argument_structure,transitive,True,False,True,False,327,-52.04185485839844,-50.2321662902832,0
Marcus's French teacher talks to Alexander.,Marcus's French teacher lied Alexander.,syntax,argument_structure,transitive,True,False,True,False,328,-46.49231719970703,-45.9808349609375,0
Wayne's father could drop by every lake.,Wayne's father could smile every lake.,syntax,argument_structure,transitive,True,False,True,False,329,-57.33185577392578,-53.65714645385742,0
Andrew discussed Kimberley.,Andrew reacts Kimberley.,syntax,argument_structure,transitive,True,False,True,False,330,-38.30927276611328,-37.04727554321289,0
Dancers sound like Karla.,Dancers correspond Karla.,syntax,argument_structure,transitive,True,False,True,False,331,-52.00062942504883,-54.553829193115234,1
Susan's fathers bothered that actress.,Susan's fathers confer that actress.,syntax,argument_structure,transitive,True,False,True,False,332,-47.3916130065918,-54.76074981689453,1
Kimberley goes to the libraries.,Kimberley laughed the libraries.,syntax,argument_structure,transitive,True,False,True,False,333,-40.49409866333008,-48.3465690612793,1
That boy's cousins are attacking Gerald.,That boy's cousins are communicating Gerald.,syntax,argument_structure,transitive,True,False,True,False,334,-51.12166976928711,-54.325984954833984,1
The picture of this candle looks like a picture of this dress.,The picture of this candle falls a picture of this dress.,syntax,argument_structure,transitive,True,False,True,False,335,-64.2093734741211,-68.43682861328125,1
These dancers' ex-wives fire Roger.,These dancers' ex-wives died Roger.,syntax,argument_structure,transitive,True,False,True,False,336,-69.82855224609375,-66.41472625732422,0
Many doctors work with April.,Many doctors compete April.,syntax,argument_structure,transitive,True,False,True,False,337,-32.813697814941406,-34.24549102783203,1
Sandra hadn't worked with Becca.,Sandra hadn't waved Becca.,syntax,argument_structure,transitive,True,False,True,False,338,-53.35340118408203,-60.2467041015625,1
Brian watched John.,Brian nods John.,syntax,argument_structure,transitive,True,False,True,False,339,-23.813343048095703,-29.480175018310547,1
Amelia wasn't cleaning books.,Amelia wasn't shouting books.,syntax,argument_structure,transitive,True,False,True,False,340,-42.2281379699707,-40.113319396972656,0
Granddaughters of Aaron embarrass Samantha.,Granddaughters of Aaron responded Samantha.,syntax,argument_structure,transitive,True,False,True,False,341,-63.60637664794922,-63.837135314941406,1
Some essays about politics disagreed with Paul.,Some essays about politics disagree Paul.,syntax,argument_structure,transitive,True,False,True,False,342,-60.34746170043945,-55.845314025878906,0
Rhonda's oncologist hadn't referenced a cashier.,Rhonda's oncologist hadn't murmured a cashier.,syntax,argument_structure,transitive,True,False,True,False,343,-91.47349548339844,-98.93815612792969,1
Tammy isn't healing many waitresses.,Tammy isn't coming here many waitresses.,syntax,argument_structure,transitive,True,False,True,False,344,-60.836788177490234,-60.14949035644531,0
Jane researched those grocery stores.,Jane screamed those grocery stores.,syntax,argument_structure,transitive,True,False,True,False,345,-39.93913650512695,-41.10019302368164,1
That granddaughter of Becky criticizes the teenager.,That granddaughter of Becky sighs the teenager.,syntax,argument_structure,transitive,True,False,True,False,346,-70.09237670898438,-63.09600067138672,0
Deborah's hairdressers have alarmed Martha.,Deborah's hairdressers have wept Martha.,syntax,argument_structure,transitive,True,False,True,False,347,-71.67204284667969,-76.15403747558594,1
An actress's podiatrist is upsetting Dana.,An actress's podiatrist is screaming Dana.,syntax,argument_structure,transitive,True,False,True,False,348,-74.20402526855469,-72.0708999633789,0
Every lady's grandfathers hadn't returned to Tara.,Every lady's grandfathers hadn't shrugged Tara.,syntax,argument_structure,transitive,True,False,True,False,349,-60.81702423095703,-71.97712707519531,1
Mitchell does astound Anne's piano teachers.,Mitchell does suffer Anne's piano teachers.,syntax,argument_structure,transitive,True,False,True,False,350,-77.06111145019531,-69.52276611328125,0
Joel's grandfathers flee from the boy's father.,Joel's grandfathers coped the boy's father.,syntax,argument_structure,transitive,True,False,True,False,351,-70.17967224121094,-68.40377807617188,0
The senator is climbing up some ladders.,The senator is speaking up some ladders.,syntax,argument_structure,transitive,True,False,True,False,352,-52.20989990234375,-56.522525787353516,1
Diane couldn't lift this print.,Diane couldn't fall this print.,syntax,argument_structure,transitive,True,False,True,False,353,-51.87786102294922,-54.190345764160156,1
Andrea left James.,Andrea slumped over James.,syntax,argument_structure,transitive,True,False,True,False,354,-35.09895324707031,-50.027435302734375,1
Laura's teachers had healed Sabrina.,Laura's teachers had wept Sabrina.,syntax,argument_structure,transitive,True,False,True,False,355,-55.83472442626953,-60.35543441772461,1
Some broccoli hurts Melanie.,Some broccoli rots Melanie.,syntax,argument_structure,transitive,True,False,True,False,356,-39.006778717041016,-45.92646789550781,1
Gary forgot Rachelle's granddaughters.,Gary boasted Rachelle's granddaughters.,syntax,argument_structure,transitive,True,False,True,False,357,-64.392578125,-65.80108642578125,1
Janice won't dislike Jennifer.,Janice won't weep Jennifer.,syntax,argument_structure,transitive,True,False,True,False,358,-46.428924560546875,-46.00886535644531,0
Gary has appreciated Sharon.,Gary has spoken up Sharon.,syntax,argument_structure,transitive,True,False,True,False,359,-33.31533432006836,-34.20960998535156,1
Christine's doctors were hiding many shawls.,Christine's doctors were laughing many shawls.,syntax,argument_structure,transitive,True,False,True,False,360,-71.53399658203125,-72.44957733154297,1
Those men are investigating Janice.,Those men are falling Janice.,syntax,argument_structure,transitive,True,False,True,False,361,-41.56714630126953,-38.98660659790039,0
Monet's student broke unicycles.,Monet's student copes unicycles.,syntax,argument_structure,transitive,True,False,True,False,362,-69.22160339355469,-80.47853088378906,1
Many boys noticed Allison.,Many boys smiled Allison.,syntax,argument_structure,transitive,True,False,True,False,363,-34.80726623535156,-37.051456451416016,1
Computers were embarrassing Daniel.,Computers were falling Daniel.,syntax,argument_structure,transitive,True,False,True,False,364,-43.863765716552734,-40.74165344238281,0
Most sketches bother Emily.,Most sketches fell Emily.,syntax,argument_structure,transitive,True,False,True,False,365,-40.51924133300781,-41.221927642822266,1
That movie theater alarmed Kathleen's students.,That movie theater fell Kathleen's students.,syntax,argument_structure,transitive,True,False,True,False,366,-67.00643920898438,-62.52310562133789,0
Vincent's sons dislike Andrew's teachers.,Vincent's sons cooperate Andrew's teachers.,syntax,argument_structure,transitive,True,False,True,False,367,-67.86588287353516,-71.34429931640625,1
Carlos did reference Tiffany.,Carlos did smile Tiffany.,syntax,argument_structure,transitive,True,False,True,False,368,-45.28333282470703,-44.52113723754883,0
Some actors fix this truck.,Some actors chuckled this truck.,syntax,argument_structure,transitive,True,False,True,False,369,-33.731449127197266,-45.99995422363281,1
Tammy's associates go to this high school.,Tammy's associates flirt this high school.,syntax,argument_structure,transitive,True,False,True,False,370,-42.58594512939453,-53.39276885986328,1
Sharon had watched Julia's grandmothers.,Sharon had waved Julia's grandmothers.,syntax,argument_structure,transitive,True,False,True,False,371,-58.926204681396484,-63.86821746826172,1
A lot of grandfathers of Dana liked some carriage.,A lot of grandfathers of Dana struggled some carriage.,syntax,argument_structure,transitive,True,False,True,False,372,-84.30511474609375,-90.15328979492188,1
The grandson of Valerie wasn't hiding Stephanie.,The grandson of Valerie wasn't shouting Stephanie.,syntax,argument_structure,transitive,True,False,True,False,373,-60.39146423339844,-59.83628845214844,0
Cindy wouldn't clean those museums.,Cindy wouldn't smile those museums.,syntax,argument_structure,transitive,True,False,True,False,374,-56.362361907958984,-58.99998474121094,1
Joseph was complaining about Kenneth's nephew.,Joseph was laughing Kenneth's nephew.,syntax,argument_structure,transitive,True,False,True,False,375,-40.97782897949219,-41.706111907958984,1
The waiter should astound Rebecca's bosses.,The waiter should come here Rebecca's bosses.,syntax,argument_structure,transitive,True,False,True,False,376,-65.3655776977539,-56.61240768432617,0
A high school shocked Cindy.,A high school fell Cindy.,syntax,argument_structure,transitive,True,False,True,False,377,-48.694183349609375,-48.34498596191406,0
Janet visits the hill.,Janet copes the hill.,syntax,argument_structure,transitive,True,False,True,False,378,-43.795654296875,-46.81409454345703,1
Jane does aggravate Debra's dermatologist.,Jane does slump over Debra's dermatologist.,syntax,argument_structure,transitive,True,False,True,False,379,-72.73094177246094,-82.3565673828125,1
Many adults haven't hired that dancer.,Many adults haven't blinked that dancer.,syntax,argument_structure,transitive,True,False,True,False,380,-42.55120086669922,-49.61332702636719,1
Colleen discovers most newspaper articles.,Colleen fell most newspaper articles.,syntax,argument_structure,transitive,True,False,True,False,381,-53.09953689575195,-54.84789276123047,1
A student hid Jacqueline's sons.,A student retaliates Jacqueline's sons.,syntax,argument_structure,transitive,True,False,True,False,382,-65.73452758789062,-75.0047607421875,1
Martin has messed up some movie theaters.,Martin has waved some movie theaters.,syntax,argument_structure,transitive,True,False,True,False,383,-42.49553298950195,-44.84430694580078,1
Nicole's guest wouldn't disagree with a dancer.,Nicole's guest wouldn't nod a dancer.,syntax,argument_structure,transitive,True,False,True,False,384,-59.70774841308594,-62.97332763671875,1
Sandra looked like that photograph.,Sandra chuckles that photograph.,syntax,argument_structure,transitive,True,False,True,False,385,-42.61537551879883,-48.340030670166016,1
Some nieces of Heidi stuns Nancy.,Some nieces of Heidi confer Nancy.,syntax,argument_structure,transitive,True,False,True,False,386,-79.6490478515625,-72.10955810546875,0
Some guy does like these cakes.,Some guy does murmur these cakes.,syntax,argument_structure,transitive,True,False,True,False,387,-35.6408576965332,-59.41300582885742,1
Those women do research some university.,Those women do concur some university.,syntax,argument_structure,transitive,True,False,True,False,388,-37.721073150634766,-44.52174377441406,1
Liam's mentor wasn't disagreeing with Tracy.,Liam's mentor wasn't compromising Tracy.,syntax,argument_structure,transitive,True,False,True,False,389,-80.650634765625,-70.69808197021484,0
Marie didn't pass the glaciers.,Marie didn't grin the glaciers.,syntax,argument_structure,transitive,True,False,True,False,390,-34.1682014465332,-42.07032012939453,1
Rhonda examined many commentaries.,Rhonda lied many commentaries.,syntax,argument_structure,transitive,True,False,True,False,391,-54.9472770690918,-54.41373825073242,0
Pamela's lawyers weren't leaving Cheryl.,Pamela's lawyers weren't falling Cheryl.,syntax,argument_structure,transitive,True,False,True,False,392,-73.28987884521484,-75.92123413085938,1
David complained about Amelia.,David muttered Amelia.,syntax,argument_structure,transitive,True,False,True,False,393,-26.941402435302734,-31.95703887939453,1
Michael isn't talking about some play.,Michael isn't falling some play.,syntax,argument_structure,transitive,True,False,True,False,394,-30.89776611328125,-39.391700744628906,1
The girls' nieces attacked Patrick.,The girls' nieces went fishing Patrick.,syntax,argument_structure,transitive,True,False,True,False,395,-68.0801773071289,-73.72687530517578,1
Theodore hadn't revealed Karla.,Theodore hadn't boasted Karla.,syntax,argument_structure,transitive,True,False,True,False,396,-57.938690185546875,-63.00596618652344,1
Bradley attacks that person.,Bradley slumped over that person.,syntax,argument_structure,transitive,True,False,True,False,397,-28.457916259765625,-42.765357971191406,1
Monica climbs up some slope.,Monica escaped some slope.,syntax,argument_structure,transitive,True,False,True,False,398,-38.39304733276367,-37.49370574951172,0
Timothy found rivers.,Timothy sighs rivers.,syntax,argument_structure,transitive,True,False,True,False,399,-30.549823760986328,-32.121253967285156,1
Melissa had questioned Leslie.,Melissa had laughed Leslie.,syntax,argument_structure,transitive,True,False,True,False,400,-39.790184020996094,-41.64150619506836,1
Dawn hugged Becky.,Dawn talks Becky.,syntax,argument_structure,transitive,True,False,True,False,401,-41.3282470703125,-42.94293212890625,1
Sherry shouldn't tour some bank.,Sherry shouldn't litter some bank.,syntax,argument_structure,transitive,True,False,True,False,402,-59.469444274902344,-60.33184051513672,1
Allison might buy some movie theaters.,Allison might fall some movie theaters.,syntax,argument_structure,transitive,True,False,True,False,403,-49.30099868774414,-58.03940200805664,1
That actor's partner questions Homer.,That actor's partner cried Homer.,syntax,argument_structure,transitive,True,False,True,False,404,-54.480525970458984,-53.615234375,0
Some adult finds some bicycle.,Some adult went fishing some bicycle.,syntax,argument_structure,transitive,True,False,True,False,405,-39.06626510620117,-45.7081184387207,1
All men had exited these grocery stores.,All men had littered these grocery stores.,syntax,argument_structure,transitive,True,False,True,False,406,-52.55485534667969,-55.686363220214844,1
Phillip had visited those daughters of Candice.,Phillip had fallen asleep those daughters of Candice.,syntax,argument_structure,transitive,True,False,True,False,407,-65.673583984375,-72.33395385742188,1
Some teacher has left Timothy.,Some teacher has talked Timothy.,syntax,argument_structure,transitive,True,False,True,False,408,-36.912933349609375,-40.343387603759766,1
Those pedestrians flee from Eric.,Those pedestrians joked around Eric.,syntax,argument_structure,transitive,True,False,True,False,409,-46.551177978515625,-55.40296173095703,1
The adult was scanning most newspaper articles.,The adult was murmuring most newspaper articles.,syntax,argument_structure,transitive,True,False,True,False,410,-58.70121765136719,-65.44559478759766,1
Some hamster breaks these windows.,Some hamster falls these windows.,syntax,argument_structure,transitive,True,False,True,False,411,-45.132564544677734,-47.62635040283203,1
Some patient's colleagues have concealed Janice.,Some patient's colleagues have lied Janice.,syntax,argument_structure,transitive,True,False,True,False,412,-62.89858627319336,-62.767093658447266,0
Every brother of Andrea remembers a lot of customers.,Every brother of Andrea complains a lot of customers.,syntax,argument_structure,transitive,True,False,True,False,413,-54.84470748901367,-59.4829216003418,1
Some person's ex-wives exited Harvard University.,Some person's ex-wives work hard Harvard University.,syntax,argument_structure,transitive,True,False,True,False,414,-65.6861801147461,-69.97404479980469,1
James's mentees kiss Clyde.,James's mentees worked hard Clyde.,syntax,argument_structure,transitive,True,False,True,False,415,-59.4580078125,-63.366703033447266,1
The museums argue about all teachers.,The museums chatted all teachers.,syntax,argument_structure,transitive,True,False,True,False,416,-41.6219596862793,-49.585914611816406,1
The lady's colleagues stuns every customer.,The lady's colleagues collaborated every customer.,syntax,argument_structure,transitive,True,False,True,False,417,-61.399288177490234,-58.073280334472656,0
Some dancer wasn't finding a niece of those girls.,Some dancer wasn't muttering a niece of those girls.,syntax,argument_structure,transitive,True,False,True,False,418,-60.482906341552734,-79.4544448852539,1
Sharon's grandmothers haven't talked about many boys.,Sharon's grandmothers haven't flirted many boys.,syntax,argument_structure,transitive,True,False,True,False,419,-59.38795852661133,-72.83772277832031,1
Carolyn hadn't confused Diana.,Carolyn hadn't lied Diana.,syntax,argument_structure,transitive,True,False,True,False,420,-45.25199508666992,-47.14741516113281,1
This unicycle resembles some prints of that driver.,This unicycle falls some prints of that driver.,syntax,argument_structure,transitive,True,False,True,False,421,-73.14257049560547,-74.69966888427734,1
Amanda walks through all art galleries.,Amanda escapes all art galleries.,syntax,argument_structure,transitive,True,False,True,False,422,-52.087493896484375,-48.59996795654297,0
Natalie can't wear shirts.,Natalie can't fall shirts.,syntax,argument_structure,transitive,True,False,True,False,423,-38.84217071533203,-41.372718811035156,1
Most fish can astound Paula.,Most fish can escape Paula.,syntax,argument_structure,transitive,True,False,True,False,424,-45.079097747802734,-35.49486541748047,0
Karla won't bring all bikes.,Karla won't joke around all bikes.,syntax,argument_structure,transitive,True,False,True,False,425,-41.79011917114258,-51.61869812011719,1
Victoria hid Robert's hairdresser.,Victoria shrugs Robert's hairdresser.,syntax,argument_structure,transitive,True,False,True,False,426,-52.03154373168945,-65.13722229003906,1
Lisa couldn't attack Bill's mentees.,Lisa couldn't weep Bill's mentees.,syntax,argument_structure,transitive,True,False,True,False,427,-55.68159484863281,-57.907135009765625,1
William has dropped by the hospital.,William has compromised the hospital.,syntax,argument_structure,transitive,True,False,True,False,428,-33.941734313964844,-38.02313232421875,1
Some art gallery shocks Donna.,Some art gallery falls Donna.,syntax,argument_structure,transitive,True,False,True,False,429,-48.61354064941406,-47.16529846191406,0
These commentaries disagree with David's contractors.,These commentaries disagreed David's contractors.,syntax,argument_structure,transitive,True,False,True,False,430,-65.56058502197266,-63.74415588378906,0
