sentence_good,sentence_bad,field,linguistics_term,UID,simple_LM_method,one_prefix_method,two_prefix_method,lexically_identical,pair_id,good_prob,bad_prob,correct
A lot of patients who can sell some couch didn't investigate themselves.,A lot of patients who can sell some couch didn't investigate itself.,syntax_semantics,binding,principle_A_c_command,True,True,False,False,0,-84.65367126464844,-86.63687133789062,1
A lot of actresses that thought about Alice healed themselves.,A lot of actresses that thought about Alice healed herself.,syntax_semantics,binding,principle_A_c_command,True,True,False,False,1,-76.8355484008789,-77.75698852539062,1
A guy that has seen the wheelbarrow notices himself.,A guy that has seen the wheelbarrow notices itself.,syntax_semantics,binding,principle_A_c_command,True,True,False,False,2,-89.60475158691406,-88.24305725097656,0
The children that were complaining about Gregory hated themselves.,The children that were complaining about Gregory hated himself.,syntax_semantics,binding,principle_A_c_command,True,True,False,False,3,-55.76465606689453,-56.18280029296875,1
Every boy that isn't selling the grocery stores isn't healing himself.,Every boy that isn't selling the grocery stores isn't healing themselves.,syntax_semantics,binding,principle_A_c_command,True,True,False,False,4,-81.80206298828125,-79.52507781982422,0
The hospitals that talk to Ann talked to themselves.,The hospitals that talk to Ann talked to herself.,syntax_semantics,binding,principle_A_c_command,True,True,False,False,5,-54.372840881347656,-56.56613540649414,1
Many skirts that stun some waitress are boring themselves.,Many skirts that stun some waitress are boring herself.,syntax_semantics,binding,principle_A_c_command,True,True,False,False,6,-68.31031799316406,-71.17447662353516,1
All men that might fire Tiffany have worked with themselves.,All men that might fire Tiffany have worked with herself.,syntax_semantics,binding,principle_A_c_command,True,True,False,False,7,-67.58966827392578,-69.76744842529297,1
That actress who admired the cup praises herself.,That actress who admired the cup praises itself.,syntax_semantics,binding,principle_A_c_command,True,True,False,False,8,-67.68500518798828,-66.75001525878906,0
This lady who is healing Charles wasn't hiding herself.,This lady who is healing Charles wasn't hiding himself.,syntax_semantics,binding,principle_A_c_command,True,True,False,False,9,-67.08030700683594,-65.74319458007812,0
Every woman that was hiring the Borgias argued about herself.,Every woman that was hiring the Borgias argued about themselves.,syntax_semantics,binding,principle_A_c_command,True,True,False,False,10,-78.49266052246094,-77.19952392578125,0
Every lady who does walk through a lot of movie theaters hadn't hugged herself.,Every lady who does walk through a lot of movie theaters hadn't hugged themselves.,syntax_semantics,binding,principle_A_c_command,True,True,False,False,11,-94.11543273925781,-92.32318115234375,0
These doctors who do leave Melissa fled from themselves.,These doctors who do leave Melissa fled from herself.,syntax_semantics,binding,principle_A_c_command,True,True,False,False,12,-61.552513122558594,-63.39186477661133,1
These ladies that hadn't forgotten Victoria fled from themselves.,These ladies that hadn't forgotten Victoria fled from herself.,syntax_semantics,binding,principle_A_c_command,True,True,False,False,13,-67.53063201904297,-69.90408325195312,1
The customers who embarrass Kevin are discussing themselves.,The customers who embarrass Kevin are discussing himself.,syntax_semantics,binding,principle_A_c_command,True,True,False,False,14,-65.49404907226562,-67.0062255859375,1
Some steak that scares Stacy doesn't shock itself.,Some steak that scares Stacy doesn't shock herself.,syntax_semantics,binding,principle_A_c_command,True,True,False,False,15,-70.07562255859375,-70.07626342773438,1
All ladies who were bothering Dan observed themselves.,All ladies who were bothering Dan observed himself.,syntax_semantics,binding,principle_A_c_command,True,True,False,False,16,-62.61410903930664,-61.57719802856445,0
The woman who hadn't taken a screen should respect herself.,The woman who hadn't taken a screen should respect itself.,syntax_semantics,binding,principle_A_c_command,True,True,False,False,17,-66.5992431640625,-66.7769546508789,1
Most women who were arriving at every hospital fired themselves.,Most women who were arriving at every hospital fired itself.,syntax_semantics,binding,principle_A_c_command,True,True,False,False,18,-58.67102813720703,-60.68626022338867,1
Some hill that could distract Barbara is alarming itself.,Some hill that could distract Barbara is alarming herself.,syntax_semantics,binding,principle_A_c_command,True,True,False,False,19,-77.35232543945312,-78.54545593261719,1
A lot of senators who climbed down the hill hired themselves.,A lot of senators who climbed down the hill hired itself.,syntax_semantics,binding,principle_A_c_command,True,True,False,False,20,-87.45415496826172,-89.77462768554688,1
The dancers who haven't shocked Candice aren't appreciating themselves.,The dancers who haven't shocked Candice aren't appreciating herself.,syntax_semantics,binding,principle_A_c_command,True,True,False,False,21,-92.77571105957031,-95.29068756103516,1
A legislature that wouldn't criticize Patrick hasn't helped itself.,A legislature that wouldn't criticize Patrick hasn't helped himself.,syntax_semantics,binding,principle_A_c_command,True,True,False,False,22,-85.37068176269531,-83.01739501953125,0
Most guests who were revealing Colleen weren't complaining about themselves.,Most guests who were revealing Colleen weren't complaining about herself.,syntax_semantics,binding,principle_A_c_command,True,True,False,False,23,-88.96331787109375,-91.24666595458984,1
A guy who hasn't annoyed Laura argued about himself.,A guy who hasn't annoyed Laura argued about herself.,syntax_semantics,binding,principle_A_c_command,True,True,False,False,24,-78.28538513183594,-79.72454833984375,1
That company that had known Sandra annoyed itself.,That company that had known Sandra annoyed herself.,syntax_semantics,binding,principle_A_c_command,True,True,False,False,25,-64.48853302001953,-65.29786682128906,1
Those senators who had a slope have cared for themselves.,Those senators who had a slope have cared for itself.,syntax_semantics,binding,principle_A_c_command,True,True,False,False,26,-66.58462524414062,-68.96189880371094,1
A cat that hasn't impressed Joseph couldn't distract itself.,A cat that hasn't impressed Joseph couldn't distract himself.,syntax_semantics,binding,principle_A_c_command,True,True,False,False,27,-91.41960144042969,-88.39747619628906,0
Some association that had forgotten Claire insults itself.,Some association that had forgotten Claire insults herself.,syntax_semantics,binding,principle_A_c_command,True,True,False,False,28,-64.83547973632812,-66.10697174072266,1
That plane that was scaring Wendy has disgusted itself.,That plane that was scaring Wendy has disgusted herself.,syntax_semantics,binding,principle_A_c_command,True,True,False,False,29,-82.83287811279297,-82.40689849853516,0
The dancer who has brought those fish could care for herself.,The dancer who has brought those fish could care for themselves.,syntax_semantics,binding,principle_A_c_command,True,True,False,False,30,-62.02461242675781,-60.16994094848633,0
Some boy that disturbed Jill could argue about himself.,Some boy that disturbed Jill could argue about herself.,syntax_semantics,binding,principle_A_c_command,True,True,False,False,31,-68.25852966308594,-69.3459243774414,1
Some woman that was exploring some hill can't think about herself.,Some woman that was exploring some hill can't think about itself.,syntax_semantics,binding,principle_A_c_command,True,True,False,False,32,-74.25962829589844,-73.01802062988281,0
All actors that disgust Veronica escaped from themselves.,All actors that disgust Veronica escaped from herself.,syntax_semantics,binding,principle_A_c_command,True,True,False,False,33,-66.75492858886719,-68.20695495605469,1
Some museum that doesn't like a waitress was praising itself.,Some museum that doesn't like a waitress was praising herself.,syntax_semantics,binding,principle_A_c_command,True,True,False,False,34,-69.2181396484375,-70.44608306884766,1
These pies that were embarrassing Jennifer are annoying themselves.,These pies that were embarrassing Jennifer are annoying herself.,syntax_semantics,binding,principle_A_c_command,True,True,False,False,35,-72.01522827148438,-73.89979553222656,1
The book that is disgusting dancers would irritate itself.,The book that is disgusting dancers would irritate themselves.,syntax_semantics,binding,principle_A_c_command,True,True,False,False,36,-70.1244888305664,-68.7855224609375,0
The drivers who attack Jodi haven't revealed themselves.,The drivers who attack Jodi haven't revealed herself.,syntax_semantics,binding,principle_A_c_command,True,True,False,False,37,-75.92021179199219,-78.73836517333984,1
A lot of adults that scared Stacey talked to themselves.,A lot of adults that scared Stacey talked to herself.,syntax_semantics,binding,principle_A_c_command,True,True,False,False,38,-81.51455688476562,-83.81861877441406,1
A girl that wouldn't watch Omar questions herself.,A girl that wouldn't watch Omar questions himself.,syntax_semantics,binding,principle_A_c_command,True,True,False,False,39,-73.49404907226562,-72.974853515625,0
The men who weren't confusing Valerie were kissing themselves.,The men who weren't confusing Valerie were kissing herself.,syntax_semantics,binding,principle_A_c_command,True,True,False,False,40,-69.80036926269531,-70.58981323242188,1
Some guests who didn't discover Melissa were visiting themselves.,Some guests who didn't discover Melissa were visiting herself.,syntax_semantics,binding,principle_A_c_command,True,True,False,False,41,-70.01205444335938,-70.68449401855469,1
A lot of waiters who weren't boring Joseph would heal themselves.,A lot of waiters who weren't boring Joseph would heal himself.,syntax_semantics,binding,principle_A_c_command,True,True,False,False,42,-102.2492904663086,-101.91986846923828,0
Some organizations that haven't respected Nicole hadn't worked with themselves.,Some organizations that haven't respected Nicole hadn't worked with herself.,syntax_semantics,binding,principle_A_c_command,True,True,False,False,43,-70.61245727539062,-72.76243591308594,1
Some dancer who isn't admiring mushrooms thinks about herself.,Some dancer who isn't admiring mushrooms thinks about themselves.,syntax_semantics,binding,principle_A_c_command,True,True,False,False,44,-86.71810150146484,-84.9317626953125,0
These actors who think about Russell won't remember themselves.,These actors who think about Russell won't remember himself.,syntax_semantics,binding,principle_A_c_command,True,True,False,False,45,-60.20596694946289,-60.86949920654297,1
All cashiers who will respect Florence criticized themselves.,All cashiers who will respect Florence criticized herself.,syntax_semantics,binding,principle_A_c_command,True,True,False,False,46,-79.68363952636719,-80.92243957519531,1
This book that hurt Kirsten has disagreed with itself.,This book that hurt Kirsten has disagreed with herself.,syntax_semantics,binding,principle_A_c_command,True,True,False,False,47,-76.00835418701172,-76.11520385742188,1
These adults that won't listen to Janice impressed themselves.,These adults that won't listen to Janice impressed herself.,syntax_semantics,binding,principle_A_c_command,True,True,False,False,48,-67.90008544921875,-71.31294250488281,1
The actors that were escaping from Carrie had cured themselves.,The actors that were escaping from Carrie had cured herself.,syntax_semantics,binding,principle_A_c_command,True,True,False,False,49,-70.96458435058594,-72.89106750488281,1
Every government that boasted about Amanda wasn't embarrassing itself.,Every government that boasted about Amanda wasn't embarrassing herself.,syntax_semantics,binding,principle_A_c_command,True,True,False,False,50,-74.02117156982422,-73.84009552001953,0
Some cucumbers that can embarrass Amanda disgusted themselves.,Some cucumbers that can embarrass Amanda disgusted herself.,syntax_semantics,binding,principle_A_c_command,True,True,False,False,51,-76.07530212402344,-78.16573333740234,1
Some association that would astound Gregory had scared itself.,Some association that would astound Gregory had scared himself.,syntax_semantics,binding,principle_A_c_command,True,True,False,False,52,-81.643310546875,-81.80323028564453,1
The customers that descend every hill can praise themselves.,The customers that descend every hill can praise itself.,syntax_semantics,binding,principle_A_c_command,True,True,False,False,53,-68.90101623535156,-71.14263916015625,1
That woman who had noticed John fled from herself.,That woman who had noticed John fled from himself.,syntax_semantics,binding,principle_A_c_command,True,True,False,False,54,-57.67332458496094,-56.60214614868164,0
Some beef that had annoyed this dancer is stunning itself.,Some beef that had annoyed this dancer is stunning herself.,syntax_semantics,binding,principle_A_c_command,True,True,False,False,55,-77.28031921386719,-78.01194763183594,1
These guests that haven't discovered Caroline had seen themselves.,These guests that haven't discovered Caroline had seen herself.,syntax_semantics,binding,principle_A_c_command,True,True,False,False,56,-65.38833618164062,-68.67203521728516,1
A library that has stunned Samantha criticized itself.,A library that has stunned Samantha criticized herself.,syntax_semantics,binding,principle_A_c_command,True,True,False,False,57,-77.88279724121094,-78.74258422851562,1
Every actress who observed Eric kissed herself.,Every actress who observed Eric kissed himself.,syntax_semantics,binding,principle_A_c_command,True,True,False,False,58,-56.384037017822266,-54.549903869628906,0
Every girl that hadn't disgusted Travis can't approach herself.,Every girl that hadn't disgusted Travis can't approach himself.,syntax_semantics,binding,principle_A_c_command,True,True,False,False,59,-82.2677001953125,-81.11687469482422,0
Every woman that noticed some library respects herself.,Every woman that noticed some library respects itself.,syntax_semantics,binding,principle_A_c_command,True,True,False,False,60,-61.5137939453125,-59.621246337890625,0
Senators who disagree with Thomas can't heal themselves.,Senators who disagree with Thomas can't heal himself.,syntax_semantics,binding,principle_A_c_command,True,True,False,False,61,-67.4805679321289,-67.17697143554688,0
The dancers that argue about Beverly observed themselves.,The dancers that argue about Beverly observed herself.,syntax_semantics,binding,principle_A_c_command,True,True,False,False,62,-58.79754638671875,-61.004554748535156,1
The turtles that were boring Christine disgusted themselves.,The turtles that were boring Christine disgusted herself.,syntax_semantics,binding,principle_A_c_command,True,True,False,False,63,-67.00773620605469,-69.04228973388672,1
These doctors that didn't flee from Michael visited themselves.,These doctors that didn't flee from Michael visited himself.,syntax_semantics,binding,principle_A_c_command,True,True,False,False,64,-63.71001052856445,-64.55764770507812,1
Some guy who is visiting some lakes cares for himself.,Some guy who is visiting some lakes cares for themselves.,syntax_semantics,binding,principle_A_c_command,True,True,False,False,65,-63.753963470458984,-62.82928466796875,0
Those students that looked like this print fired themselves.,Those students that looked like this print fired itself.,syntax_semantics,binding,principle_A_c_command,True,True,False,False,66,-56.321720123291016,-58.25825881958008,1
Some girl who researches committees boasts about herself.,Some girl who researches committees boasts about themselves.,syntax_semantics,binding,principle_A_c_command,True,True,False,False,67,-84.6254653930664,-82.25651550292969,0
All customers who would drive to every river haven't returned to themselves.,All customers who would drive to every river haven't returned to itself.,syntax_semantics,binding,principle_A_c_command,True,True,False,False,68,-73.14706420898438,-75.0150146484375,1
That dog that wasn't boring Jason scared itself.,That dog that wasn't boring Jason scared himself.,syntax_semantics,binding,principle_A_c_command,True,True,False,False,69,-65.94037628173828,-65.28117370605469,0
That woman that hated Scott hadn't talked about herself.,That woman that hated Scott hadn't talked about himself.,syntax_semantics,binding,principle_A_c_command,True,True,False,False,70,-65.29926300048828,-63.917823791503906,0
Some women that would approach Pamela had cured themselves.,Some women that would approach Pamela had cured herself.,syntax_semantics,binding,principle_A_c_command,True,True,False,False,71,-67.8218994140625,-69.9622802734375,1
This committee that is referencing Gina works with itself.,This committee that is referencing Gina works with herself.,syntax_semantics,binding,principle_A_c_command,True,True,False,False,72,-69.52244567871094,-69.36595916748047,0
The rabbits that won't look like a painting disturbed themselves.,The rabbits that won't look like a painting disturbed itself.,syntax_semantics,binding,principle_A_c_command,True,True,False,False,73,-65.95292663574219,-65.21394348144531,0
A lot of boys who hadn't appreciated some river were working with themselves.,A lot of boys who hadn't appreciated some river were working with itself.,syntax_semantics,binding,principle_A_c_command,True,True,False,False,74,-90.84916687011719,-93.64639282226562,1
The river that impressed Cindy is impressing itself.,The river that impressed Cindy is impressing herself.,syntax_semantics,binding,principle_A_c_command,True,True,False,False,75,-69.96934509277344,-70.31497955322266,1
Most children who astounded Larry have seen themselves.,Most children who astounded Larry have seen himself.,syntax_semantics,binding,principle_A_c_command,True,True,False,False,76,-67.66385650634766,-68.11920166015625,1
Customers who love Russell had investigated themselves.,Customers who love Russell had investigated himself.,syntax_semantics,binding,principle_A_c_command,True,True,False,False,77,-59.398197174072266,-59.51255416870117,1
Some company that discussed James discusses itself.,Some company that discussed James discusses himself.,syntax_semantics,binding,principle_A_c_command,True,True,False,False,78,-53.354705810546875,-52.30609893798828,0
That couch that shouldn't aggravate all women was annoying itself.,That couch that shouldn't aggravate all women was annoying themselves.,syntax_semantics,binding,principle_A_c_command,True,True,False,False,79,-87.11567687988281,-85.1793441772461,0
Wheelbarrows that shocked the company distracted themselves.,Wheelbarrows that shocked the company distracted itself.,syntax_semantics,binding,principle_A_c_command,True,True,False,False,80,-70.78711700439453,-70.63505554199219,0
These shoes that irritate Omar hurt themselves.,These shoes that irritate Omar hurt himself.,syntax_semantics,binding,principle_A_c_command,True,True,False,False,81,-64.67266082763672,-66.98040008544922,1
An association that conceals Laurie insulted itself.,An association that conceals Laurie insulted herself.,syntax_semantics,binding,principle_A_c_command,True,True,False,False,82,-73.79251098632812,-74.5166015625,1
That fish that astounded this actress hadn't scared itself.,That fish that astounded this actress hadn't scared herself.,syntax_semantics,binding,principle_A_c_command,True,True,False,False,83,-85.50439453125,-85.45425415039062,0
That lady that was examining the movies remembers herself.,That lady that was examining the movies remembers themselves.,syntax_semantics,binding,principle_A_c_command,True,True,False,False,84,-60.78988265991211,-59.741859436035156,0
Most waitresses that couldn't think about some vase had disliked themselves.,Most waitresses that couldn't think about some vase had disliked itself.,syntax_semantics,binding,principle_A_c_command,True,True,False,False,85,-96.38129425048828,-96.63847351074219,1
Most boys who have confused Kristin hadn't concealed themselves.,Most boys who have confused Kristin hadn't concealed herself.,syntax_semantics,binding,principle_A_c_command,True,True,False,False,86,-79.91400909423828,-81.9925537109375,1
Most doctors that are running around this library did love themselves.,Most doctors that are running around this library did love itself.,syntax_semantics,binding,principle_A_c_command,True,True,False,False,87,-67.23567199707031,-68.77188110351562,1
The adults that scared Mary are approaching themselves.,The adults that scared Mary are approaching herself.,syntax_semantics,binding,principle_A_c_command,True,True,False,False,88,-59.3970947265625,-61.60455322265625,1
The customers who distracts the guy would investigate themselves.,The customers who distracts the guy would investigate himself.,syntax_semantics,binding,principle_A_c_command,True,True,False,False,89,-70.55020904541016,-71.0670166015625,1
Most cars that astound Catherine irritated themselves.,Most cars that astound Catherine irritated herself.,syntax_semantics,binding,principle_A_c_command,True,True,False,False,90,-67.69136047363281,-69.91856384277344,1
The woman who loves Theodore notices herself.,The woman who loves Theodore notices himself.,syntax_semantics,binding,principle_A_c_command,True,True,False,False,91,-53.02435302734375,-51.98182678222656,0
Most women that passed the hill won't conceal themselves.,Most women that passed the hill won't conceal itself.,syntax_semantics,binding,principle_A_c_command,True,True,False,False,92,-63.56390380859375,-65.0589370727539,1
A girl that is fleeing from Derek wasn't discovering herself.,A girl that is fleeing from Derek wasn't discovering himself.,syntax_semantics,binding,principle_A_c_command,True,True,False,False,93,-91.13092041015625,-89.84808349609375,0
Some children who leave Erin are observing themselves.,Some children who leave Erin are observing herself.,syntax_semantics,binding,principle_A_c_command,True,True,False,False,94,-59.81833267211914,-62.56171798706055,1
Most waitresses that praised Ruth aren't appreciating themselves.,Most waitresses that praised Ruth aren't appreciating herself.,syntax_semantics,binding,principle_A_c_command,True,True,False,False,95,-88.33078002929688,-90.19720458984375,1
Some legislatures that haven't argued about Jeffrey worked with themselves.,Some legislatures that haven't argued about Jeffrey worked with himself.,syntax_semantics,binding,principle_A_c_command,True,True,False,False,96,-77.78954315185547,-78.7774429321289,1
The organization that has disliked many books insults itself.,The organization that has disliked many books insults themselves.,syntax_semantics,binding,principle_A_c_command,True,True,False,False,97,-64.99665832519531,-63.897132873535156,0
Those fish that are embarrassing Catherine aren't disgusting themselves.,Those fish that are embarrassing Catherine aren't disgusting herself.,syntax_semantics,binding,principle_A_c_command,True,True,False,False,98,-64.33195495605469,-66.74830627441406,1
This girl who boasted about some book could hate herself.,This girl who boasted about some book could hate itself.,syntax_semantics,binding,principle_A_c_command,True,True,False,False,99,-71.89064025878906,-72.35978698730469,1
A lot of banks that weren't talking to Kayla will forget themselves.,A lot of banks that weren't talking to Kayla will forget herself.,syntax_semantics,binding,principle_A_c_command,True,True,False,False,100,-89.66139221191406,-92.95010375976562,1
These committees that don't work with Frank will dislike themselves.,These committees that don't work with Frank will dislike himself.,syntax_semantics,binding,principle_A_c_command,True,True,False,False,101,-67.81611633300781,-69.72166442871094,1
An actress that wasn't boasting about Todd isn't discovering herself.,An actress that wasn't boasting about Todd isn't discovering himself.,syntax_semantics,binding,principle_A_c_command,True,True,False,False,102,-85.69862365722656,-84.39239501953125,0
Some companies that were hurting David don't criticize themselves.,Some companies that were hurting David don't criticize himself.,syntax_semantics,binding,principle_A_c_command,True,True,False,False,103,-59.06768035888672,-59.72418975830078,1
All dancers who passed the college campus can hate themselves.,All dancers who passed the college campus can hate itself.,syntax_semantics,binding,principle_A_c_command,True,True,False,False,104,-73.63362121582031,-75.16981506347656,1
All universities that aggravated Carmen shouldn't astound themselves.,All universities that aggravated Carmen shouldn't astound herself.,syntax_semantics,binding,principle_A_c_command,True,True,False,False,105,-84.13871765136719,-86.11412811279297,1
This unicycle that shouldn't hurt Suzanne will disturb itself.,This unicycle that shouldn't hurt Suzanne will disturb herself.,syntax_semantics,binding,principle_A_c_command,True,True,False,False,106,-81.87183380126953,-82.54823303222656,1
That waitress who talked about many malls observed herself.,That waitress who talked about many malls observed themselves.,syntax_semantics,binding,principle_A_c_command,True,True,False,False,107,-77.11502075195312,-75.28952026367188,0
That eggplant that astounded Douglas disturbs itself.,That eggplant that astounded Douglas disturbs himself.,syntax_semantics,binding,principle_A_c_command,True,True,False,False,108,-94.73966979980469,-94.34950256347656,0
Every girl that should bike to some hospitals had attacked herself.,Every girl that should bike to some hospitals had attacked themselves.,syntax_semantics,binding,principle_A_c_command,True,True,False,False,109,-76.50857543945312,-73.92349243164062,0
