sentence_good,sentence_bad,field,linguistics_term,UID,simple_LM_method,one_prefix_method,two_prefix_method,lexically_identical,pair_id,good_prob,bad_prob,correct
Every hospital isn't about to tempt Tiffany to reference Matt.,Every hospital isn't fun to tempt Tiffany to reference Matt.,syntax_semantics,control_raising,tough_vs_raising_2,True,False,False,False,0,-82.57199096679688,-84.61773681640625,1
Rachel was apt to talk to Alicia.,Rachel was exciting to talk to Alicia.,syntax_semantics,control_raising,tough_vs_raising_2,True,False,False,False,1,-40.10970687866211,-40.974151611328125,1
This doctor's cousins aren't soon to question Kirsten.,This doctor's cousins aren't interesting to question Kirsten.,syntax_semantics,control_raising,tough_vs_raising_2,True,False,False,False,2,-71.60398864746094,-67.2044677734375,0
Sheila is certain to find Stephen to describe this customer.,Sheila is difficult to find Stephen to describe this customer.,syntax_semantics,control_raising,tough_vs_raising_2,True,False,False,False,3,-78.21697998046875,-71.37870788574219,0
Liam's French teachers were sure to want to aggravate many people.,Liam's French teachers were irritating to want to aggravate many people.,syntax_semantics,control_raising,tough_vs_raising_2,True,False,False,False,4,-83.68157958984375,-91.4251480102539,1
Thomas isn't sure to hug Margaret.,Thomas isn't annoying to hug Margaret.,syntax_semantics,control_raising,tough_vs_raising_2,True,False,False,False,5,-43.843135833740234,-45.13409423828125,1
Carrie is bound to explore some public park.,Carrie is pleasant to explore some public park.,syntax_semantics,control_raising,tough_vs_raising_2,True,False,False,False,6,-49.75044250488281,-54.25646209716797,1
Timothy is about to respect most guys.,Timothy is annoying to respect most guys.,syntax_semantics,control_raising,tough_vs_raising_2,True,False,False,False,7,-45.67253112792969,-51.323219299316406,1
Derek's guest is likely to like to forfeit.,Derek's guest is difficult to like to forfeit.,syntax_semantics,control_raising,tough_vs_raising_2,True,False,False,False,8,-64.22706604003906,-63.42512893676758,0
Melinda's guests aren't about to yearn to sit down.,Melinda's guests aren't unpleasant to yearn to sit down.,syntax_semantics,control_raising,tough_vs_raising_2,True,False,False,False,9,-78.4416732788086,-84.0724105834961,1
Mark wasn't certain to climb down the ladder.,Mark wasn't fun to climb down the ladder.,syntax_semantics,control_raising,tough_vs_raising_2,True,False,False,False,10,-50.63928985595703,-45.20327377319336,0
Jesus's tutor wasn't soon to remember Dawn.,Jesus's tutor wasn't tough to remember Dawn.,syntax_semantics,control_raising,tough_vs_raising_2,True,False,False,False,11,-60.322021484375,-55.8382568359375,0
Those organizations were certain to respond.,Those organizations were tough to respond.,syntax_semantics,control_raising,tough_vs_raising_2,True,False,False,False,12,-35.245758056640625,-31.850173950195312,0
Bradley isn't soon to encourage Stephanie to scream.,Bradley isn't hard work to encourage Stephanie to scream.,syntax_semantics,control_raising,tough_vs_raising_2,True,False,False,False,13,-65.97183227539062,-68.50726318359375,1
Tina wasn't sure to conceal what are profiting.,Tina wasn't exciting to conceal what are profiting.,syntax_semantics,control_raising,tough_vs_raising_2,True,False,False,False,14,-79.65811157226562,-83.93376159667969,1
The legislature wasn't unlikely to continue to hug a lot of boys.,The legislature wasn't hard to continue to hug a lot of boys.,syntax_semantics,control_raising,tough_vs_raising_2,True,False,False,False,15,-73.72175598144531,-66.09260559082031,0
Bruce was sure to remember Gerald.,Bruce was annoying to remember Gerald.,syntax_semantics,control_raising,tough_vs_raising_2,True,False,False,False,16,-38.72429656982422,-42.37272262573242,1
Brad's employees aren't likely to retaliate.,Brad's employees aren't irritating to retaliate.,syntax_semantics,control_raising,tough_vs_raising_2,True,False,False,False,17,-46.767913818359375,-50.565155029296875,1
Jennifer isn't apt to walk through a cafe.,Jennifer isn't difficult to walk through a cafe.,syntax_semantics,control_raising,tough_vs_raising_2,True,False,False,False,18,-46.82084274291992,-44.21448516845703,0
Andrea was soon to ascertain Winston Churchill to explore a lot of movie theaters.,Andrea was interesting to ascertain Winston Churchill to explore a lot of movie theaters.,syntax_semantics,control_raising,tough_vs_raising_2,True,False,False,False,19,-105.75599670410156,-104.678466796875,0
Cheryl's daughter isn't sure to find out who work hard.,Cheryl's daughter isn't irritating to find out who work hard.,syntax_semantics,control_raising,tough_vs_raising_2,True,False,False,False,20,-89.68828582763672,-95.3826904296875,1
Douglas's cousin isn't sure to entreat Danielle to stand up.,Douglas's cousin isn't irritating to entreat Danielle to stand up.,syntax_semantics,control_raising,tough_vs_raising_2,True,False,False,False,21,-92.34379577636719,-96.5141372680664,1
Margaret's nieces aren't unlikely to describe Diana.,Margaret's nieces aren't pleasant to describe Diana.,syntax_semantics,control_raising,tough_vs_raising_2,True,False,False,False,22,-77.155029296875,-75.35794067382812,0
Brian is about to walk through that high school.,Brian is pleasant to walk through that high school.,syntax_semantics,control_raising,tough_vs_raising_2,True,False,False,False,23,-34.07090759277344,-40.77436065673828,1
Heidi wasn't certain to like to hate Joseph.,Heidi wasn't easy to like to hate Joseph.,syntax_semantics,control_raising,tough_vs_raising_2,True,False,False,False,24,-69.59564208984375,-62.37809753417969,0
Many adults' boss was certain to hide a lot of spotlights.,Many adults' boss was interesting to hide a lot of spotlights.,syntax_semantics,control_raising,tough_vs_raising_2,True,False,False,False,25,-82.11390686035156,-80.3636703491211,0
Bradley was apt to clean that hat.,Bradley was tough to clean that hat.,syntax_semantics,control_raising,tough_vs_raising_2,True,False,False,False,26,-43.912384033203125,-39.87065505981445,0
Every granddaughter of Renee isn't certain to entice Anne to bike to high schools.,Every granddaughter of Renee isn't irritating to entice Anne to bike to high schools.,syntax_semantics,control_raising,tough_vs_raising_2,True,False,False,False,27,-128.10247802734375,-127.28164672851562,0
These plates were certain to scare Andrew.,These plates were exciting to scare Andrew.,syntax_semantics,control_raising,tough_vs_raising_2,True,False,False,False,28,-52.260963439941406,-50.92371368408203,0
Andrew wasn't sure to oblige Vanessa's guests to work hard.,Andrew wasn't exciting to oblige Vanessa's guests to work hard.,syntax_semantics,control_raising,tough_vs_raising_2,True,False,False,False,29,-83.17517852783203,-87.80162048339844,1
Harvard University was soon to praise Valerie.,Harvard University was hard to praise Valerie.,syntax_semantics,control_raising,tough_vs_raising_2,True,False,False,False,30,-67.6658935546875,-63.27604675292969,0
The association isn't apt to cope.,The association isn't hard to cope.,syntax_semantics,control_raising,tough_vs_raising_2,True,False,False,False,31,-43.969398498535156,-36.28905487060547,0
The mothers of Alice were certain to figure out who continued to describe these customers.,The mothers of Alice were boring to figure out who continued to describe these customers.,syntax_semantics,control_raising,tough_vs_raising_2,True,False,False,False,32,-93.2694091796875,-94.33857727050781,1
Timothy wasn't likely to beg Donna to astound that university.,Timothy wasn't exciting to beg Donna to astound that university.,syntax_semantics,control_raising,tough_vs_raising_2,True,False,False,False,33,-89.31976318359375,-92.63670349121094,1
Florence wasn't unlikely to concur.,Florence wasn't hard to concur.,syntax_semantics,control_raising,tough_vs_raising_2,True,False,False,False,34,-63.9085807800293,-56.70277404785156,0
These grandfathers of Janice are likely to compete.,These grandfathers of Janice are unpleasant to compete.,syntax_semantics,control_raising,tough_vs_raising_2,True,False,False,False,35,-67.57701873779297,-74.57162475585938,1
Irene is likely to appreciate Nina.,Irene is unpleasant to appreciate Nina.,syntax_semantics,control_raising,tough_vs_raising_2,True,False,False,False,36,-50.72687911987305,-56.492401123046875,1
Matt wasn't certain to criticize Nancy.,Matt wasn't easy to criticize Nancy.,syntax_semantics,control_raising,tough_vs_raising_2,True,False,False,False,37,-52.01803970336914,-43.856895446777344,0
Janice's supervisors weren't about to yearn to exit every college campus.,Janice's supervisors weren't hard to yearn to exit every college campus.,syntax_semantics,control_raising,tough_vs_raising_2,True,False,False,False,38,-117.22540283203125,-116.17439270019531,0
Becky isn't apt to respect Jason.,Becky isn't pleasant to respect Jason.,syntax_semantics,control_raising,tough_vs_raising_2,True,False,False,False,39,-49.40180969238281,-48.14539337158203,0
Maria was soon to approach Carlos.,Maria was hard to approach Carlos.,syntax_semantics,control_raising,tough_vs_raising_2,True,False,False,False,40,-43.58292007446289,-39.89213562011719,0
The people are bound to seem to hide.,The people are fun to seem to hide.,syntax_semantics,control_raising,tough_vs_raising_2,True,False,False,False,41,-38.68006134033203,-40.836036682128906,1
Diane's mentor is bound to tempt grandfathers of Carl to blink.,Diane's mentor is unpleasant to tempt grandfathers of Carl to blink.,syntax_semantics,control_raising,tough_vs_raising_2,True,False,False,False,42,-116.16143035888672,-122.10647583007812,1
Nancy's electrician wasn't soon to fail to astound Karen.,Nancy's electrician wasn't enjoyable to fail to astound Karen.,syntax_semantics,control_raising,tough_vs_raising_2,True,False,False,False,43,-113.3533706665039,-114.28549194335938,1
Frank is likely to laugh.,Frank is hard to laugh.,syntax_semantics,control_raising,tough_vs_raising_2,True,False,False,False,44,-24.459754943847656,-20.833194732666016,0
Tina isn't bound to exit every movie theater.,Tina isn't hard to exit every movie theater.,syntax_semantics,control_raising,tough_vs_raising_2,True,False,False,False,45,-71.27946472167969,-69.05915069580078,0
Becky was sure to scan those books.,Becky was hard work to scan those books.,syntax_semantics,control_raising,tough_vs_raising_2,True,False,False,False,46,-43.211822509765625,-48.71391677856445,1
Leslie wasn't likely to discover the dog to climb down this slope.,Leslie wasn't enjoyable to discover the dog to climb down this slope.,syntax_semantics,control_raising,tough_vs_raising_2,True,False,False,False,47,-82.46710968017578,-89.32908630371094,1
All legislatures were soon to stun Steven.,All legislatures were unpleasant to stun Steven.,syntax_semantics,control_raising,tough_vs_raising_2,True,False,False,False,48,-60.586219787597656,-63.56456756591797,1
Donald's supervisor wasn't sure to mutter.,Donald's supervisor wasn't difficult to mutter.,syntax_semantics,control_raising,tough_vs_raising_2,True,False,False,False,49,-56.065223693847656,-55.46334457397461,0
Angela wasn't soon to litter.,Angela wasn't annoying to litter.,syntax_semantics,control_raising,tough_vs_raising_2,True,False,False,False,50,-42.89079666137695,-42.29754638671875,0
A man wasn't certain to wish to shout.,A man wasn't interesting to wish to shout.,syntax_semantics,control_raising,tough_vs_raising_2,True,False,False,False,51,-66.73320770263672,-62.71641540527344,0
Laurie was soon to grin.,Laurie was fun to grin.,syntax_semantics,control_raising,tough_vs_raising_2,True,False,False,False,52,-48.539947509765625,-47.71158218383789,0
These boys aren't likely to confer.,These boys aren't annoying to confer.,syntax_semantics,control_raising,tough_vs_raising_2,True,False,False,False,53,-39.97285461425781,-43.455291748046875,1
Danielle is about to nod.,Danielle is tough to nod.,syntax_semantics,control_raising,tough_vs_raising_2,True,False,False,False,54,-34.635780334472656,-36.66291046142578,1
Samuel isn't apt to turn out to change.,Samuel isn't unpleasant to turn out to change.,syntax_semantics,control_raising,tough_vs_raising_2,True,False,False,False,55,-49.86116409301758,-51.268943786621094,1
Michelle isn't bound to mess up that dress.,Michelle isn't irritating to mess up that dress.,syntax_semantics,control_raising,tough_vs_raising_2,True,False,False,False,56,-44.54273986816406,-49.391746520996094,1
Renee wasn't unlikely to boycott committees.,Renee wasn't hard work to boycott committees.,syntax_semantics,control_raising,tough_vs_raising_2,True,False,False,False,57,-61.92783737182617,-65.19050598144531,1
Tracy is likely to smile.,Tracy is pleasant to smile.,syntax_semantics,control_raising,tough_vs_raising_2,True,False,False,False,58,-33.79332733154297,-36.71083450317383,1
Kimberley wasn't unlikely to explain those waitresses appear to fix this wheelbarrow.,Kimberley wasn't interesting to explain those waitresses appear to fix this wheelbarrow.,syntax_semantics,control_raising,tough_vs_raising_2,True,False,False,False,59,-135.8353729248047,-132.02780151367188,0
Ellen's hairdresser is about to ascertain the computers to embarrass Renee.,Ellen's hairdresser is exciting to ascertain the computers to embarrass Renee.,syntax_semantics,control_raising,tough_vs_raising_2,True,False,False,False,60,-102.65817260742188,-108.02720642089844,1
A lot of waitresses' French teachers aren't apt to obligate Sonia to smile.,A lot of waitresses' French teachers aren't unpleasant to obligate Sonia to smile.,syntax_semantics,control_raising,tough_vs_raising_2,True,False,False,False,61,-137.20330810546875,-137.0880889892578,0
Todd was soon to commission Guy to weep.,Todd was fun to commission Guy to weep.,syntax_semantics,control_raising,tough_vs_raising_2,True,False,False,False,62,-61.11956024169922,-58.90664291381836,0
Cindy was about to conceal some waitresses.,Cindy was hard work to conceal some waitresses.,syntax_semantics,control_raising,tough_vs_raising_2,True,False,False,False,63,-70.900390625,-81.63003540039062,1
Alice wasn't soon to discover all lights to darken.,Alice wasn't annoying to discover all lights to darken.,syntax_semantics,control_raising,tough_vs_raising_2,True,False,False,False,64,-72.80245971679688,-72.7265396118164,0
Dan's bosses were soon to plan to admire Eric.,Dan's bosses were tough to plan to admire Eric.,syntax_semantics,control_raising,tough_vs_raising_2,True,False,False,False,65,-67.90190887451172,-64.48175811767578,0
Nicole's girlfriend isn't certain to figure out who boast about Tonya.,Nicole's girlfriend isn't pleasant to figure out who boast about Tonya.,syntax_semantics,control_raising,tough_vs_raising_2,True,False,False,False,66,-98.16204071044922,-96.47407531738281,0
Amelia wasn't soon to love Lisa.,Amelia wasn't hard to love Lisa.,syntax_semantics,control_raising,tough_vs_raising_2,True,False,False,False,67,-55.23116683959961,-49.658287048339844,0
Theresa's associate is certain to talk.,Theresa's associate is interesting to talk.,syntax_semantics,control_raising,tough_vs_raising_2,True,False,False,False,68,-51.14649963378906,-48.7069091796875,0
Carla was certain to slump over.,Carla was hard to slump over.,syntax_semantics,control_raising,tough_vs_raising_2,True,False,False,False,69,-56.16199493408203,-47.52235412597656,0
Walter is sure to remember who hadn't profited.,Walter is pleasant to remember who hadn't profited.,syntax_semantics,control_raising,tough_vs_raising_2,True,False,False,False,70,-63.258934020996094,-65.88788604736328,1
Mitchell was apt to investigate Dana.,Mitchell was pleasant to investigate Dana.,syntax_semantics,control_raising,tough_vs_raising_2,True,False,False,False,71,-52.78392028808594,-52.98166275024414,1
Craig is sure to predict those guests to benefit.,Craig is exciting to predict those guests to benefit.,syntax_semantics,control_raising,tough_vs_raising_2,True,False,False,False,72,-54.50680160522461,-56.22669982910156,1
Rachel's sons aren't soon to watch Kirsten.,Rachel's sons aren't hard work to watch Kirsten.,syntax_semantics,control_raising,tough_vs_raising_2,True,False,False,False,73,-56.86064147949219,-60.32722091674805,1
Theodore wasn't unlikely to explore the art gallery.,Theodore wasn't irritating to explore the art gallery.,syntax_semantics,control_raising,tough_vs_raising_2,True,False,False,False,74,-69.55079650878906,-69.91230773925781,1
Harvard University wasn't apt to learn who skated around all hospitals.,Harvard University wasn't unpleasant to learn who skated around all hospitals.,syntax_semantics,control_raising,tough_vs_raising_2,True,False,False,False,75,-101.20362854003906,-101.36885070800781,1
Katherine's grandmothers weren't about to remember who returns to Lissa.,Katherine's grandmothers weren't tough to remember who returns to Lissa.,syntax_semantics,control_raising,tough_vs_raising_2,True,False,False,False,76,-91.32487487792969,-93.95035552978516,1
Janet was unlikely to leave this lake.,Janet was irritating to leave this lake.,syntax_semantics,control_raising,tough_vs_raising_2,True,False,False,False,77,-48.40903091430664,-49.831756591796875,1
Aaron isn't unlikely to compel Carol's mentors to disagree.,Aaron isn't hard work to compel Carol's mentors to disagree.,syntax_semantics,control_raising,tough_vs_raising_2,True,False,False,False,78,-88.9874496459961,-89.70640563964844,1
Beverly's contractors aren't sure to aggravate Gregory.,Beverly's contractors aren't easy to aggravate Gregory.,syntax_semantics,control_raising,tough_vs_raising_2,True,False,False,False,79,-93.81275177001953,-90.26576232910156,0
Charles wasn't apt to want a lot of governments to debate.,Charles wasn't easy to want a lot of governments to debate.,syntax_semantics,control_raising,tough_vs_raising_2,True,False,False,False,80,-63.868736267089844,-57.6657600402832,0
Heather was bound to wave.,Heather was unpleasant to wave.,syntax_semantics,control_raising,tough_vs_raising_2,True,False,False,False,81,-39.449378967285156,-46.7236328125,1
Mitchell was sure to prove to sit down.,Mitchell was fun to prove to sit down.,syntax_semantics,control_raising,tough_vs_raising_2,True,False,False,False,82,-47.580955505371094,-48.14089584350586,1
Stacey is certain to notice a lot of lamps.,Stacey is boring to notice a lot of lamps.,syntax_semantics,control_raising,tough_vs_raising_2,True,False,False,False,83,-66.0514144897461,-63.80541229248047,0
Winston Churchill was certain to kiss Eric.,Winston Churchill was tough to kiss Eric.,syntax_semantics,control_raising,tough_vs_raising_2,True,False,False,False,84,-61.28479766845703,-55.83722686767578,0
Dennis isn't likely to care for guys.,Dennis isn't enjoyable to care for guys.,syntax_semantics,control_raising,tough_vs_raising_2,True,False,False,False,85,-58.721431732177734,-62.65140914916992,1
Every patient's friends were bound to fail to donate.,Every patient's friends were annoying to fail to donate.,syntax_semantics,control_raising,tough_vs_raising_2,True,False,False,False,86,-58.86228561401367,-63.852989196777344,1
The muffins are apt to confuse Winston Churchill.,The muffins are boring to confuse Winston Churchill.,syntax_semantics,control_raising,tough_vs_raising_2,True,False,False,False,87,-68.84385681152344,-69.21459197998047,1
Hospitals aren't bound to yearn to reference Brian.,Hospitals aren't hard to yearn to reference Brian.,syntax_semantics,control_raising,tough_vs_raising_2,True,False,False,False,88,-101.62235260009766,-102.6573486328125,1
Stephanie's dentists aren't apt to hug that man.,Stephanie's dentists aren't hard to hug that man.,syntax_semantics,control_raising,tough_vs_raising_2,True,False,False,False,89,-80.55207061767578,-74.83795166015625,0
Nina's husband was sure to lie.,Nina's husband was hard to lie.,syntax_semantics,control_raising,tough_vs_raising_2,True,False,False,False,90,-47.61410903930664,-45.96998977661133,0
Andrew's grandson wasn't apt to convince Kendra to escape from Margaret.,Andrew's grandson wasn't tough to convince Kendra to escape from Margaret.,syntax_semantics,control_raising,tough_vs_raising_2,True,False,False,False,91,-99.47250366210938,-96.53752136230469,0
Alexander's girlfriend wasn't certain to want Ronald to complain.,Alexander's girlfriend wasn't enjoyable to want Ronald to complain.,syntax_semantics,control_raising,tough_vs_raising_2,True,False,False,False,92,-68.12551879882812,-70.56449890136719,1
These actors aren't bound to question Melinda.,These actors aren't annoying to question Melinda.,syntax_semantics,control_raising,tough_vs_raising_2,True,False,False,False,93,-55.14820098876953,-60.145851135253906,1
Customers aren't apt to seem to wash.,Customers aren't enjoyable to seem to wash.,syntax_semantics,control_raising,tough_vs_raising_2,True,False,False,False,94,-45.56519317626953,-46.39177322387695,1
This doctor is likely to criticize Amanda.,This doctor is difficult to criticize Amanda.,syntax_semantics,control_raising,tough_vs_raising_2,True,False,False,False,95,-47.20613098144531,-46.31999206542969,0
Regina's sons aren't about to motivate Vincent's guest to heal this boy.,Regina's sons aren't tough to motivate Vincent's guest to heal this boy.,syntax_semantics,control_raising,tough_vs_raising_2,True,False,False,False,96,-104.30834197998047,-107.04014587402344,1
Joel's tutors aren't soon to appreciate that grocery store.,Joel's tutors aren't hard work to appreciate that grocery store.,syntax_semantics,control_raising,tough_vs_raising_2,True,False,False,False,97,-88.2313232421875,-90.40765380859375,1
Kayla is certain to disturb every library.,Kayla is annoying to disturb every library.,syntax_semantics,control_raising,tough_vs_raising_2,True,False,False,False,98,-56.941680908203125,-54.46096420288086,0
Carlos isn't bound to visit Carrie.,Carlos isn't unpleasant to visit Carrie.,syntax_semantics,control_raising,tough_vs_raising_2,True,False,False,False,99,-47.50071716308594,-51.95964050292969,1
Tonya isn't likely to visit the public park.,Tonya isn't annoying to visit the public park.,syntax_semantics,control_raising,tough_vs_raising_2,True,False,False,False,100,-49.683021545410156,-53.401241302490234,1
That teenager was sure to sound like Danielle.,That teenager was boring to sound like Danielle.,syntax_semantics,control_raising,tough_vs_raising_2,True,False,False,False,101,-56.35319900512695,-60.34727478027344,1
Cynthia's colleagues aren't about to hire Lawrence.,Cynthia's colleagues aren't fun to hire Lawrence.,syntax_semantics,control_raising,tough_vs_raising_2,True,False,False,False,102,-77.92682647705078,-80.49478149414062,1
Carmen is about to sell this public park.,Carmen is easy to sell this public park.,syntax_semantics,control_raising,tough_vs_raising_2,True,False,False,False,103,-58.33159255981445,-56.7252197265625,0
Richard was about to look like the sketches.,Richard was boring to look like the sketches.,syntax_semantics,control_raising,tough_vs_raising_2,True,False,False,False,104,-37.58404541015625,-44.377174377441406,1
Galileo was unlikely to wish to sing.,Galileo was unpleasant to wish to sing.,syntax_semantics,control_raising,tough_vs_raising_2,True,False,False,False,105,-55.92137908935547,-57.422157287597656,1
Martin wasn't about to find Erin.,Martin wasn't enjoyable to find Erin.,syntax_semantics,control_raising,tough_vs_raising_2,True,False,False,False,106,-38.649173736572266,-46.026161193847656,1
Vanessa's sisters weren't certain to prod Becky's nephew to stand up.,Vanessa's sisters weren't annoying to prod Becky's nephew to stand up.,syntax_semantics,control_raising,tough_vs_raising_2,True,False,False,False,107,-101.96562957763672,-101.17677307128906,0
Monica is apt to care for Charles.,Monica is fun to care for Charles.,syntax_semantics,control_raising,tough_vs_raising_2,True,False,False,False,108,-47.56831359863281,-45.31402587890625,0
Dan's ex-wives were unlikely to confer.,Dan's ex-wives were exciting to confer.,syntax_semantics,control_raising,tough_vs_raising_2,True,False,False,False,109,-60.04621887207031,-58.26808166503906,0
Adam isn't bound to think about Deanna.,Adam isn't enjoyable to think about Deanna.,syntax_semantics,control_raising,tough_vs_raising_2,True,False,False,False,110,-48.06877136230469,-53.55743408203125,1
Marla wasn't likely to intend to weep.,Marla wasn't enjoyable to intend to weep.,syntax_semantics,control_raising,tough_vs_raising_2,True,False,False,False,111,-51.012203216552734,-58.64433288574219,1
Brett's podiatrist wasn't about to imagine some popsicle hadn't condensed.,Brett's podiatrist wasn't unpleasant to imagine some popsicle hadn't condensed.,syntax_semantics,control_raising,tough_vs_raising_2,True,False,False,False,112,-144.734375,-150.4451904296875,1
Julie is about to prompt hospitals to clash.,Julie is fun to prompt hospitals to clash.,syntax_semantics,control_raising,tough_vs_raising_2,True,False,False,False,113,-55.96910858154297,-61.03340148925781,1
All schools aren't soon to collaborate.,All schools aren't boring to collaborate.,syntax_semantics,control_raising,tough_vs_raising_2,True,False,False,False,114,-43.896583557128906,-41.67723846435547,0
A boy isn't certain to come here.,A boy isn't irritating to come here.,syntax_semantics,control_raising,tough_vs_raising_2,True,False,False,False,115,-51.67961883544922,-51.346839904785156,0
Rodney wasn't about to walk through those museums.,Rodney wasn't difficult to walk through those museums.,syntax_semantics,control_raising,tough_vs_raising_2,True,False,False,False,116,-53.066558837890625,-54.39191436767578,1
All men are about to argue about Lissa.,All men are unpleasant to argue about Lissa.,syntax_semantics,control_raising,tough_vs_raising_2,True,False,False,False,117,-49.98442840576172,-58.48511505126953,1
