sentence_good,sentence_bad,field,linguistics_term,UID,simple_LM_method,one_prefix_method,two_prefix_method,lexically_identical,pair_id,good_prob,bad_prob,correct
There was a documentary about music irritating Allison.,There was each documentary about music irritating Allison.,semantics,quantifiers,existential_there_quantifiers_1,True,False,False,False,0,-56.516265869140625,-67.64337158203125,1
There were no legislatures working hard.,There were most legislatures working hard.,semantics,quantifiers,existential_there_quantifiers_1,True,False,False,False,1,-41.42981719970703,-43.65809631347656,1
There was a sweater shocking David.,There was each sweater shocking David.,semantics,quantifiers,existential_there_quantifiers_1,True,False,False,False,2,-43.37958526611328,-53.30385971069336,1
There are some brothers of Rachel arriving at a library.,There are all brothers of Rachel arriving at a library.,semantics,quantifiers,existential_there_quantifiers_1,True,False,False,False,3,-54.6870002746582,-57.90586853027344,1
There aren't many lights darkening.,There aren't all lights darkening.,semantics,quantifiers,existential_there_quantifiers_1,True,False,False,False,4,-41.43085479736328,-44.798492431640625,1
There are many rugs embarrassing Galileo.,There are most rugs embarrassing Galileo.,semantics,quantifiers,existential_there_quantifiers_1,True,False,False,False,5,-51.19779968261719,-52.89022445678711,1
There is a mother of Theodore imagining those adults responded.,There is each mother of Theodore imagining those adults responded.,semantics,quantifiers,existential_there_quantifiers_1,True,False,False,False,6,-68.84668731689453,-79.0284423828125,1
There wasn't a window chipping.,There wasn't each window chipping.,semantics,quantifiers,existential_there_quantifiers_1,True,False,False,False,7,-40.249176025390625,-48.12945556640625,1
There isn't a dancer slumping over.,There isn't every dancer slumping over.,semantics,quantifiers,existential_there_quantifiers_1,True,False,False,False,8,-47.29253387451172,-55.47587585449219,1
There is a committee coping.,There is every committee coping.,semantics,quantifiers,existential_there_quantifiers_1,True,False,False,False,9,-28.969541549682617,-37.73206329345703,1
There are some sisters of Ann climbing up all ladders.,There are all sisters of Ann climbing up all ladders.,semantics,quantifiers,existential_there_quantifiers_1,True,False,False,False,10,-71.70272064208984,-75.17701721191406,1
There is an essay about Winston Churchill irritating Alexander.,There is each essay about Winston Churchill irritating Alexander.,semantics,quantifiers,existential_there_quantifiers_1,True,False,False,False,11,-73.35135650634766,-82.11787414550781,1
There was a rug disappearing.,There was every rug disappearing.,semantics,quantifiers,existential_there_quantifiers_1,True,False,False,False,12,-29.74038314819336,-38.716670989990234,1
There aren't few documentaries disturbing some actors.,There aren't all documentaries disturbing some actors.,semantics,quantifiers,existential_there_quantifiers_1,True,False,False,False,13,-57.29755401611328,-58.601463317871094,1
There are no peppers upsetting all governments.,There are all peppers upsetting all governments.,semantics,quantifiers,existential_there_quantifiers_1,True,False,False,False,14,-50.22252655029297,-52.414817810058594,1
There was a cat annoying Alice.,There was each cat annoying Alice.,semantics,quantifiers,existential_there_quantifiers_1,True,False,False,False,15,-37.36310577392578,-49.00846481323242,1
There is a coat soaking.,There is every coat soaking.,semantics,quantifiers,existential_there_quantifiers_1,True,False,False,False,16,-30.27658462524414,-38.21422576904297,1
There isn't a student winning.,There isn't each student winning.,semantics,quantifiers,existential_there_quantifiers_1,True,False,False,False,17,-26.998838424682617,-35.250370025634766,1
There were few bicycles shattering.,There were most bicycles shattering.,semantics,quantifiers,existential_there_quantifiers_1,True,False,False,False,18,-39.683265686035156,-40.40776062011719,1
There weren't many eggplants existing.,There weren't all eggplants existing.,semantics,quantifiers,existential_there_quantifiers_1,True,False,False,False,19,-52.03460693359375,-54.99378204345703,1
There aren't many malls existing.,There aren't most malls existing.,semantics,quantifiers,existential_there_quantifiers_1,True,False,False,False,20,-38.4033203125,-41.53904342651367,1
There weren't many waitresses sitting down.,There weren't all waitresses sitting down.,semantics,quantifiers,existential_there_quantifiers_1,True,False,False,False,21,-50.03028106689453,-51.65007400512695,1
There were many sketches bothering Ruth.,There were all sketches bothering Ruth.,semantics,quantifiers,existential_there_quantifiers_1,True,False,False,False,22,-47.25032424926758,-49.35417556762695,1
There wasn't a commentary worrying some pedestrians.,There wasn't every commentary worrying some pedestrians.,semantics,quantifiers,existential_there_quantifiers_1,True,False,False,False,23,-57.46343994140625,-65.63929748535156,1
There weren't few grandfathers of Beverly returning to the man.,There weren't most grandfathers of Beverly returning to the man.,semantics,quantifiers,existential_there_quantifiers_1,True,False,False,False,24,-77.68597412109375,-78.11344146728516,1
There is a drawing of schools irritating the Clintons.,There is every drawing of schools irritating the Clintons.,semantics,quantifiers,existential_there_quantifiers_1,True,False,False,False,25,-65.1895751953125,-73.01956939697266,1
There is an organization hurting Tammy.,There is every organization hurting Tammy.,semantics,quantifiers,existential_there_quantifiers_1,True,False,False,False,26,-39.03193664550781,-48.644561767578125,1
There were few daughters of Nancy badgering Alicia to see Renee.,There were all daughters of Nancy badgering Alicia to see Renee.,semantics,quantifiers,existential_there_quantifiers_1,True,False,False,False,27,-106.5203628540039,-108.4745864868164,1
There is a boy spinning around.,There is each boy spinning around.,semantics,quantifiers,existential_there_quantifiers_1,True,False,False,False,28,-34.88822555541992,-44.168785095214844,1
There are no mushrooms alarming Winston Churchill.,There are all mushrooms alarming Winston Churchill.,semantics,quantifiers,existential_there_quantifiers_1,True,False,False,False,29,-56.6748046875,-58.8062744140625,1
There was a painting of that movie theater scaring many waitresses.,There was every painting of that movie theater scaring many waitresses.,semantics,quantifiers,existential_there_quantifiers_1,True,False,False,False,30,-86.53939819335938,-95.14859008789062,1
There were many lamps wasting away.,There were all lamps wasting away.,semantics,quantifiers,existential_there_quantifiers_1,True,False,False,False,31,-42.68796157836914,-44.651283264160156,1
There weren't few shows about politics upsetting Andrew.,There weren't most shows about politics upsetting Andrew.,semantics,quantifiers,existential_there_quantifiers_1,True,False,False,False,32,-65.71333312988281,-65.90133666992188,1
There isn't a casserole scaring Sharon.,There isn't each casserole scaring Sharon.,semantics,quantifiers,existential_there_quantifiers_1,True,False,False,False,33,-65.77848815917969,-74.2467269897461,1
There were many cousins of Rhonda boycotting most lakes.,There were most cousins of Rhonda boycotting most lakes.,semantics,quantifiers,existential_there_quantifiers_1,True,False,False,False,34,-85.31256103515625,-88.62863159179688,1
There was a book scaring Kimberley.,There was each book scaring Kimberley.,semantics,quantifiers,existential_there_quantifiers_1,True,False,False,False,35,-53.149532318115234,-64.17761993408203,1
There were few rivers disappearing.,There were all rivers disappearing.,semantics,quantifiers,existential_there_quantifiers_1,True,False,False,False,36,-33.471580505371094,-34.11545944213867,1
There were few stories about politics astounding Alan.,There were most stories about politics astounding Alan.,semantics,quantifiers,existential_there_quantifiers_1,True,False,False,False,37,-62.523719787597656,-65.19241333007812,1
There isn't a truck existing.,There isn't every truck existing.,semantics,quantifiers,existential_there_quantifiers_1,True,False,False,False,38,-30.970319747924805,-38.41084289550781,1
There isn't a cashier eating.,There isn't each cashier eating.,semantics,quantifiers,existential_there_quantifiers_1,True,False,False,False,39,-38.514007568359375,-46.537879943847656,1
There are some cats hurting Tiffany.,There are all cats hurting Tiffany.,semantics,quantifiers,existential_there_quantifiers_1,True,False,False,False,40,-42.070613861083984,-44.47499084472656,1
There isn't a grandson of Becky cheering.,There isn't each grandson of Becky cheering.,semantics,quantifiers,existential_there_quantifiers_1,True,False,False,False,41,-51.871849060058594,-60.64839172363281,1
There isn't a daughter of Mitchell astounding some boy.,There isn't each daughter of Mitchell astounding some boy.,semantics,quantifiers,existential_there_quantifiers_1,True,False,False,False,42,-67.78108215332031,-76.72746276855469,1
There aren't few guests asking all nieces of Sandra to attack Alicia.,There aren't most guests asking all nieces of Sandra to attack Alicia.,semantics,quantifiers,existential_there_quantifiers_1,True,False,False,False,43,-112.5552978515625,-112.83714294433594,1
There weren't few mushrooms scaring some governments.,There weren't most mushrooms scaring some governments.,semantics,quantifiers,existential_there_quantifiers_1,True,False,False,False,44,-58.993263244628906,-59.502830505371094,1
There are many friends of Charles intending to disagree.,There are all friends of Charles intending to disagree.,semantics,quantifiers,existential_there_quantifiers_1,True,False,False,False,45,-53.14183044433594,-57.175537109375,1
There were some associations interacting.,There were all associations interacting.,semantics,quantifiers,existential_there_quantifiers_1,True,False,False,False,46,-36.52347946166992,-40.4442253112793,1
There is a book about the Borgias disturbing Ann.,There is every book about the Borgias disturbing Ann.,semantics,quantifiers,existential_there_quantifiers_1,True,False,False,False,47,-71.96279907226562,-78.91644287109375,1
There weren't many books about Harvard University impressing Daniel.,There weren't most books about Harvard University impressing Daniel.,semantics,quantifiers,existential_there_quantifiers_1,True,False,False,False,48,-76.9688720703125,-81.45320892333984,1
There wasn't a mountain existing.,There wasn't each mountain existing.,semantics,quantifiers,existential_there_quantifiers_1,True,False,False,False,49,-32.16897964477539,-40.33000183105469,1
There wasn't an icicle confusing Martin.,There wasn't every icicle confusing Martin.,semantics,quantifiers,existential_there_quantifiers_1,True,False,False,False,50,-59.47174835205078,-68.13788604736328,1
There weren't many essays about the Impressionists disagreeing with Michelle.,There weren't most essays about the Impressionists disagreeing with Michelle.,semantics,quantifiers,existential_there_quantifiers_1,True,False,False,False,51,-98.73652648925781,-102.19688415527344,1
There is a muffin boring Winston Churchill.,There is each muffin boring Winston Churchill.,semantics,quantifiers,existential_there_quantifiers_1,True,False,False,False,52,-55.05805969238281,-65.83805847167969,1
There are some reports about Monet disagreeing with Janice.,There are all reports about Monet disagreeing with Janice.,semantics,quantifiers,existential_there_quantifiers_1,True,False,False,False,53,-79.33760070800781,-81.55538940429688,1
There is a casserole stunning Carlos.,There is each casserole stunning Carlos.,semantics,quantifiers,existential_there_quantifiers_1,True,False,False,False,54,-60.67442321777344,-72.22996520996094,1
There was a box astounding that doctor.,There was each box astounding that doctor.,semantics,quantifiers,existential_there_quantifiers_1,True,False,False,False,55,-46.54631423950195,-56.670841217041016,1
There was a glove bothering Kristen.,There was every glove bothering Kristen.,semantics,quantifiers,existential_there_quantifiers_1,True,False,False,False,56,-47.04520797729492,-56.575096130371094,1
There were few dresses soaking.,There were most dresses soaking.,semantics,quantifiers,existential_there_quantifiers_1,True,False,False,False,57,-36.96595001220703,-38.13203048706055,1
There were few cakes disgusting Bill.,There were most cakes disgusting Bill.,semantics,quantifiers,existential_there_quantifiers_1,True,False,False,False,58,-48.589324951171875,-49.69410705566406,1
There were some movies about the Clintons boring Amanda.,There were all movies about the Clintons boring Amanda.,semantics,quantifiers,existential_there_quantifiers_1,True,False,False,False,59,-62.587806701660156,-66.4883041381836,1
There isn't a pepper bothering every guy.,There isn't every pepper bothering every guy.,semantics,quantifiers,existential_there_quantifiers_1,True,False,False,False,60,-46.63397979736328,-54.87675476074219,1
There was a son of Monica motivating Kirsten's associate to cry.,There was every son of Monica motivating Kirsten's associate to cry.,semantics,quantifiers,existential_there_quantifiers_1,True,False,False,False,61,-87.44136047363281,-98.02893829345703,1
There is a candle looking like a lot of drawings.,There is every candle looking like a lot of drawings.,semantics,quantifiers,existential_there_quantifiers_1,True,False,False,False,62,-47.56752014160156,-56.47199249267578,1
There were no movies about the Lutherans shocking Dana.,There were most movies about the Lutherans shocking Dana.,semantics,quantifiers,existential_there_quantifiers_1,True,False,False,False,63,-74.39009857177734,-77.13542938232422,1
There were no movies about Harvard University alarming Omar.,There were all movies about Harvard University alarming Omar.,semantics,quantifiers,existential_there_quantifiers_1,True,False,False,False,64,-68.3384017944336,-68.7194595336914,1
There aren't many doors scaring Brian.,There aren't all doors scaring Brian.,semantics,quantifiers,existential_there_quantifiers_1,True,False,False,False,65,-48.44188690185547,-51.20463943481445,1
There weren't many gates looking like most photographs.,There weren't most gates looking like most photographs.,semantics,quantifiers,existential_there_quantifiers_1,True,False,False,False,66,-55.38996124267578,-59.26337432861328,1
There isn't a museum failing to surrender.,There isn't every museum failing to surrender.,semantics,quantifiers,existential_there_quantifiers_1,True,False,False,False,67,-45.155887603759766,-51.30036926269531,1
There is an organization pushing a driver's daughters to have some windows.,There is each organization pushing a driver's daughters to have some windows.,semantics,quantifiers,existential_there_quantifiers_1,True,False,False,False,68,-72.52567291259766,-82.24929809570312,1
There are few prints of a lot of paintings astounding Sabrina.,There are most prints of a lot of paintings astounding Sabrina.,semantics,quantifiers,existential_there_quantifiers_1,True,False,False,False,69,-85.91816711425781,-86.19020080566406,1
There is a man appearing to study.,There is every man appearing to study.,semantics,quantifiers,existential_there_quantifiers_1,True,False,False,False,70,-35.07392120361328,-44.63063430786133,1
There were few pants shocking Charles.,There were all pants shocking Charles.,semantics,quantifiers,existential_there_quantifiers_1,True,False,False,False,71,-50.0358772277832,-48.56157684326172,0
There was a documentary about Harvard University shocking Sheila.,There was every documentary about Harvard University shocking Sheila.,semantics,quantifiers,existential_there_quantifiers_1,True,False,False,False,72,-63.950660705566406,-72.91351318359375,1
There weren't many commentaries about Winston Churchill aggravating Eric.,There weren't most commentaries about Winston Churchill aggravating Eric.,semantics,quantifiers,existential_there_quantifiers_1,True,False,False,False,73,-94.57756805419922,-98.33995056152344,1
There wasn't a restaurant existing.,There wasn't every restaurant existing.,semantics,quantifiers,existential_there_quantifiers_1,True,False,False,False,74,-31.9060115814209,-40.365203857421875,1
There were few cars hurting Keith.,There were most cars hurting Keith.,semantics,quantifiers,existential_there_quantifiers_1,True,False,False,False,75,-43.46926498413086,-45.81158447265625,1
There wasn't a lady obliging Victoria to smile.,There wasn't every lady obliging Victoria to smile.,semantics,quantifiers,existential_there_quantifiers_1,True,False,False,False,76,-62.433963775634766,-70.7665786743164,1
There were no actors attacking Jessica.,There were all actors attacking Jessica.,semantics,quantifiers,existential_there_quantifiers_1,True,False,False,False,77,-43.77259826660156,-44.731475830078125,1
There are some eggplants disgusting Meredith.,There are all eggplants disgusting Meredith.,semantics,quantifiers,existential_there_quantifiers_1,True,False,False,False,78,-60.991416931152344,-64.49536895751953,1
There are some hats stunning Amanda.,There are most hats stunning Amanda.,semantics,quantifiers,existential_there_quantifiers_1,True,False,False,False,79,-44.48057556152344,-47.698486328125,1
There are no customers hiding.,There are all customers hiding.,semantics,quantifiers,existential_there_quantifiers_1,True,False,False,False,80,-28.414030075073242,-31.323490142822266,1
There was a shoe astounding Jacqueline.,There was each shoe astounding Jacqueline.,semantics,quantifiers,existential_there_quantifiers_1,True,False,False,False,81,-52.96978759765625,-63.78003692626953,1
There was a glacier shocking Ruth.,There was every glacier shocking Ruth.,semantics,quantifiers,existential_there_quantifiers_1,True,False,False,False,82,-49.1016845703125,-59.94828796386719,1
There weren't many pies alarming Theodore.,There weren't all pies alarming Theodore.,semantics,quantifiers,existential_there_quantifiers_1,True,False,False,False,83,-54.67679214477539,-58.396240234375,1
There was a couch embarrassing Julia.,There was each couch embarrassing Julia.,semantics,quantifiers,existential_there_quantifiers_1,True,False,False,False,84,-43.07674789428711,-54.28111267089844,1
There isn't a pedestrian arriving at some hills.,There isn't every pedestrian arriving at some hills.,semantics,quantifiers,existential_there_quantifiers_1,True,False,False,False,85,-51.75303268432617,-60.11758804321289,1
There weren't few drawings of Diana worrying Jerry.,There weren't most drawings of Diana worrying Jerry.,semantics,quantifiers,existential_there_quantifiers_1,True,False,False,False,86,-70.51254272460938,-70.31036376953125,0
There isn't a popsicle condensing.,There isn't every popsicle condensing.,semantics,quantifiers,existential_there_quantifiers_1,True,False,False,False,87,-59.850341796875,-68.39076232910156,1
There was a glass appearing.,There was every glass appearing.,semantics,quantifiers,existential_there_quantifiers_1,True,False,False,False,88,-27.928665161132812,-36.63179016113281,1
There weren't many books existing.,There weren't all books existing.,semantics,quantifiers,existential_there_quantifiers_1,True,False,False,False,89,-34.86838150024414,-38.738162994384766,1
There aren't many mirrors dropping.,There aren't all mirrors dropping.,semantics,quantifiers,existential_there_quantifiers_1,True,False,False,False,90,-36.2150993347168,-40.41709899902344,1
There isn't a university learning who work hard.,There isn't every university learning who work hard.,semantics,quantifiers,existential_there_quantifiers_1,True,False,False,False,91,-51.0492057800293,-56.701019287109375,1
There is a newspaper article existing.,There is each newspaper article existing.,semantics,quantifiers,existential_there_quantifiers_1,True,False,False,False,92,-34.91032409667969,-46.42485046386719,1
There was a print of a rabbit upsetting Brad.,There was every print of a rabbit upsetting Brad.,semantics,quantifiers,existential_there_quantifiers_1,True,False,False,False,93,-59.592342376708984,-67.79179382324219,1
There is a child examining some play.,There is each child examining some play.,semantics,quantifiers,existential_there_quantifiers_1,True,False,False,False,94,-39.52531051635742,-48.9747314453125,1
There is a nose stunning Martin.,There is each nose stunning Martin.,semantics,quantifiers,existential_there_quantifiers_1,True,False,False,False,95,-43.1287727355957,-54.98072814941406,1
There are many planes boring Diane.,There are all planes boring Diane.,semantics,quantifiers,existential_there_quantifiers_1,True,False,False,False,96,-41.55651092529297,-44.0118408203125,1
There were no reports falling.,There were all reports falling.,semantics,quantifiers,existential_there_quantifiers_1,True,False,False,False,97,-32.745460510253906,-33.81245422363281,1
There aren't many windows boring Walter.,There aren't most windows boring Walter.,semantics,quantifiers,existential_there_quantifiers_1,True,False,False,False,98,-47.43079376220703,-51.365509033203125,1
There isn't a cashier advising Monica's nephews to argue.,There isn't each cashier advising Monica's nephews to argue.,semantics,quantifiers,existential_there_quantifiers_1,True,False,False,False,99,-87.09587097167969,-94.76744842529297,1
There were no senators arguing about the senator.,There were most senators arguing about the senator.,semantics,quantifiers,existential_there_quantifiers_1,True,False,False,False,100,-53.5809326171875,-55.34819793701172,1
There were no organizations thinking about who shocks this waitress.,There were all organizations thinking about who shocks this waitress.,semantics,quantifiers,existential_there_quantifiers_1,True,False,False,False,101,-70.79045104980469,-71.9521255493164,1
There are some shirts wrinkling.,There are most shirts wrinkling.,semantics,quantifiers,existential_there_quantifiers_1,True,False,False,False,102,-33.52906036376953,-36.76832580566406,1
There were no socks irritating Aaron.,There were most socks irritating Aaron.,semantics,quantifiers,existential_there_quantifiers_1,True,False,False,False,103,-45.31450653076172,-48.404747009277344,1
There was a school fighting.,There was each school fighting.,semantics,quantifiers,existential_there_quantifiers_1,True,False,False,False,104,-23.65885353088379,-31.87354850769043,1
There is a pepper falling.,There is each pepper falling.,semantics,quantifiers,existential_there_quantifiers_1,True,False,False,False,105,-28.87745475769043,-39.029937744140625,1
There wasn't a cake baking.,There wasn't every cake baking.,semantics,quantifiers,existential_there_quantifiers_1,True,False,False,False,106,-34.60258483886719,-41.43476104736328,1
There was a cup distracting this driver.,There was every cup distracting this driver.,semantics,quantifiers,existential_there_quantifiers_1,True,False,False,False,107,-44.199501037597656,-52.43376159667969,1
There are no hospitals falling.,There are all hospitals falling.,semantics,quantifiers,existential_there_quantifiers_1,True,False,False,False,108,-30.281414031982422,-32.6234245300293,1
There isn't a movie theater looking like some painting.,There isn't each movie theater looking like some painting.,semantics,quantifiers,existential_there_quantifiers_1,True,False,False,False,109,-54.71629333496094,-65.03396606445312,1
There was a car vanishing.,There was each car vanishing.,semantics,quantifiers,existential_there_quantifiers_1,True,False,False,False,110,-25.7680606842041,-36.19139099121094,1
There was a box distracting Harvard University.,There was each box distracting Harvard University.,semantics,quantifiers,existential_there_quantifiers_1,True,False,False,False,111,-49.086875915527344,-59.18696594238281,1
There are many spotlights alarming Diane.,There are all spotlights alarming Diane.,semantics,quantifiers,existential_there_quantifiers_1,True,False,False,False,112,-60.92539978027344,-62.392417907714844,1
There was a window annoying Phillip.,There was each window annoying Phillip.,semantics,quantifiers,existential_there_quantifiers_1,True,False,False,False,113,-43.2755126953125,-53.22053527832031,1
There are some prints of Ella stunning Valerie.,There are all prints of Ella stunning Valerie.,semantics,quantifiers,existential_there_quantifiers_1,True,False,False,False,114,-64.50306701660156,-66.84415435791016,1
There was a plate falling.,There was each plate falling.,semantics,quantifiers,existential_there_quantifiers_1,True,False,False,False,115,-28.399002075195312,-39.152591705322266,1
There aren't many movies distracting Kristen.,There aren't most movies distracting Kristen.,semantics,quantifiers,existential_there_quantifiers_1,True,False,False,False,116,-48.90784454345703,-54.138282775878906,1
There were many candles worrying Stephanie.,There were most candles worrying Stephanie.,semantics,quantifiers,existential_there_quantifiers_1,True,False,False,False,117,-45.83275604248047,-48.20465087890625,1
There isn't a legislature listening to Sherry.,There isn't every legislature listening to Sherry.,semantics,quantifiers,existential_there_quantifiers_1,True,False,False,False,118,-52.513179779052734,-58.645347595214844,1
There is an adult departing.,There is each adult departing.,semantics,quantifiers,existential_there_quantifiers_1,True,False,False,False,119,-28.572975158691406,-39.54954147338867,1
There are many shoes irritating Brett.,There are most shoes irritating Brett.,semantics,quantifiers,existential_there_quantifiers_1,True,False,False,False,120,-43.424400329589844,-46.497840881347656,1
There are some vases upsetting Janice.,There are all vases upsetting Janice.,semantics,quantifiers,existential_there_quantifiers_1,True,False,False,False,121,-59.569480895996094,-62.1999397277832,1
