sentence_good,sentence_bad,field,linguistics_term,UID,simple_LM_method,one_prefix_method,two_prefix_method,lexically_identical,pair_id,good_prob,bad_prob,correct
Every movie was scanned by some guys.,Every movie was scanned by some window.,syntax,s-selection,animate_subject_passive,True,True,False,False,539,-42.044334411621094,-44.76483917236328,1
All planes are thought about by the doctors.,All planes are thought about by the computer.,syntax,s-selection,animate_subject_passive,True,True,False,False,540,-43.28925704956055,-42.873382568359375,0
All ladders aren't descended by the women.,All ladders aren't descended by the jacket.,syntax,s-selection,animate_subject_passive,True,True,False,False,541,-55.9339599609375,-60.086944580078125,1
That truck wasn't thought about by some adults.,That truck wasn't thought about by some theses.,syntax,s-selection,animate_subject_passive,True,True,False,False,542,-52.19184112548828,-63.03732681274414,1
Most ladders aren't descended by the men.,Most ladders aren't descended by the couch.,syntax,s-selection,animate_subject_passive,True,True,False,False,543,-56.44895935058594,-58.520774841308594,1
The bikes were seen by the waitresses.,The bikes were seen by the ice.,syntax,s-selection,animate_subject_passive,True,True,False,False,544,-53.70536422729492,-40.97157287597656,0
Ella is appreciated by some alumni.,Ella is appreciated by some box.,syntax,s-selection,animate_subject_passive,True,True,False,False,545,-52.27861785888672,-49.10686492919922,0
A skateboard isn't brought by some woman.,A skateboard isn't brought by some fungus.,syntax,s-selection,animate_subject_passive,True,True,False,False,546,-61.99148941040039,-67.30715942382812,1
A lot of skateboards aren't broken by some actress.,A lot of skateboards aren't broken by some association.,syntax,s-selection,animate_subject_passive,True,True,False,False,547,-79.92540740966797,-79.4464340209961,0
An art gallery wasn't exited by the children.,An art gallery wasn't exited by the movie.,syntax,s-selection,animate_subject_passive,True,True,False,False,548,-56.548927307128906,-57.722068786621094,1
All mountains were descended by some children.,All mountains were descended by some windows.,syntax,s-selection,animate_subject_passive,True,True,False,False,549,-41.32758331298828,-45.3905029296875,1
Richard is worked with by some actresses.,Richard is worked with by some couches.,syntax,s-selection,animate_subject_passive,True,True,False,False,550,-42.95551681518555,-50.72309494018555,1
Those high schools aren't walked through by some children.,Those high schools aren't walked through by some newspaper articles.,syntax,s-selection,animate_subject_passive,True,True,False,False,551,-54.09446716308594,-67.03388977050781,1
Holly wasn't visited by some doctors.,Holly wasn't visited by some steps.,syntax,s-selection,animate_subject_passive,True,True,False,False,552,-50.02351379394531,-50.339996337890625,1
These socks were worn by the student.,These socks were worn by the brochure.,syntax,s-selection,animate_subject_passive,True,True,False,False,553,-41.30574417114258,-52.13941955566406,1
Rodney is kissed by some actor.,Rodney is kissed by some cats.,syntax,s-selection,animate_subject_passive,True,True,False,False,554,-40.46390914916992,-39.88932800292969,0
Angela is watched by some woman.,Angela is watched by some nuclei.,syntax,s-selection,animate_subject_passive,True,True,False,False,555,-43.68899917602539,-57.01329040527344,1
Mark is revealed by the guy.,Mark is revealed by the organization.,syntax,s-selection,animate_subject_passive,True,True,False,False,556,-33.55345153808594,-32.40913772583008,0
A report was scanned by the teenager.,A report was scanned by the light.,syntax,s-selection,animate_subject_passive,True,True,False,False,557,-55.18514633178711,-52.13507080078125,0
Nina wasn't known by the ladies.,Nina wasn't known by the synthesis.,syntax,s-selection,animate_subject_passive,True,True,False,False,558,-50.64249801635742,-53.95294189453125,1
Tina was observed by the waitresses.,Tina was observed by the synopsis.,syntax,s-selection,animate_subject_passive,True,True,False,False,559,-63.39384460449219,-57.74318313598633,0
Those cakes are brought by some child.,Those cakes are brought by some unicycles.,syntax,s-selection,animate_subject_passive,True,True,False,False,560,-41.661285400390625,-68.92125701904297,1
Some stories are discussed by some guys.,Some stories are discussed by some jacket.,syntax,s-selection,animate_subject_passive,True,True,False,False,561,-37.03489303588867,-42.91181564331055,1
Movie theaters were biked to by the waitress.,Movie theaters were biked to by the chair.,syntax,s-selection,animate_subject_passive,True,True,False,False,562,-65.02645874023438,-65.26078033447266,1
A mall was skated around by some teenager.,A mall was skated around by some glasses.,syntax,s-selection,animate_subject_passive,True,True,False,False,563,-67.89839172363281,-67.2909164428711,0
A hill is passed by some customers.,A hill is passed by some socks.,syntax,s-selection,animate_subject_passive,True,True,False,False,564,-54.26011657714844,-55.889129638671875,1
Every documentary isn't thought about by the pedestrians.,Every documentary isn't thought about by the icicles.,syntax,s-selection,animate_subject_passive,True,True,False,False,565,-56.10879898071289,-64.46232604980469,1
That jacket was hidden by the child.,That jacket was hidden by the sketches.,syntax,s-selection,animate_subject_passive,True,True,False,False,566,-42.09028625488281,-45.823814392089844,1
Jennifer is healed by some waiter.,Jennifer is healed by some truck.,syntax,s-selection,animate_subject_passive,True,True,False,False,567,-39.645042419433594,-38.80558776855469,0
All lakes aren't talked about by the woman.,All lakes aren't talked about by the nucleus.,syntax,s-selection,animate_subject_passive,True,True,False,False,568,-48.33191680908203,-49.97084045410156,1
Some computer wasn't broken by some woman.,Some computer wasn't broken by some carriages.,syntax,s-selection,animate_subject_passive,True,True,False,False,569,-49.415443420410156,-58.99334716796875,1
This book wasn't taken by some pedestrians.,This book wasn't taken by some glasses.,syntax,s-selection,animate_subject_passive,True,True,False,False,570,-47.984283447265625,-44.70726776123047,0
Jesus isn't researched by some adults.,Jesus isn't researched by some parentheses.,syntax,s-selection,animate_subject_passive,True,True,False,False,571,-43.75372314453125,-49.87922668457031,1
The guest wasn't attacked by some people.,The guest wasn't attacked by some dogs.,syntax,s-selection,animate_subject_passive,True,True,False,False,572,-43.690425872802734,-50.03582000732422,1
Maria was argued about by some customer.,Maria was argued about by some books.,syntax,s-selection,animate_subject_passive,True,True,False,False,573,-45.643348693847656,-41.26708221435547,0
All cafes aren't researched by the guys.,All cafes aren't researched by the nuclei.,syntax,s-selection,animate_subject_passive,True,True,False,False,574,-55.139183044433594,-66.22811889648438,1
Laurie was disliked by the actresses.,Laurie was disliked by the screens.,syntax,s-selection,animate_subject_passive,True,True,False,False,575,-51.023895263671875,-50.53489685058594,0
Denise is concealed by the doctor.,Denise is concealed by the couch.,syntax,s-selection,animate_subject_passive,True,True,False,False,576,-40.212364196777344,-40.770469665527344,1
Most grocery stores weren't cleaned by some drivers.,Most grocery stores weren't cleaned by some couch.,syntax,s-selection,animate_subject_passive,True,True,False,False,577,-61.529869079589844,-62.600425720214844,1
Ellen isn't argued about by some adult.,Ellen isn't argued about by some carts.,syntax,s-selection,animate_subject_passive,True,True,False,False,578,-65.61976623535156,-67.32020568847656,1
Tracy was hugged by some children.,Tracy was hugged by some mirror.,syntax,s-selection,animate_subject_passive,True,True,False,False,579,-42.9111328125,-50.408470153808594,1
Catherine is disliked by the girls.,Catherine is disliked by the drawings.,syntax,s-selection,animate_subject_passive,True,True,False,False,580,-46.44707107543945,-50.71302795410156,1
William isn't helped by some actress.,William isn't helped by some couches.,syntax,s-selection,animate_subject_passive,True,True,False,False,581,-45.211822509765625,-51.69288635253906,1
That actress was hired by some driver.,That actress was hired by some prints.,syntax,s-selection,animate_subject_passive,True,True,False,False,582,-49.90052032470703,-50.29340362548828,1
Curtis was criticized by some guys.,Curtis was criticized by some plays.,syntax,s-selection,animate_subject_passive,True,True,False,False,583,-53.12797546386719,-56.52538299560547,1
Dawn is approached by some girl.,Dawn is approached by some newspaper article.,syntax,s-selection,animate_subject_passive,True,True,False,False,584,-56.27312469482422,-64.29022216796875,1
All computers are fixed by some woman.,All computers are fixed by some computers.,syntax,s-selection,animate_subject_passive,True,True,False,False,585,-39.0797004699707,-37.615821838378906,0
Judy is praised by some actresses.,Judy is praised by some bikes.,syntax,s-selection,animate_subject_passive,True,True,False,False,586,-44.3599967956543,-45.48016357421875,1
Every movie theater isn't walked through by some senators.,Every movie theater isn't walked through by some casseroles.,syntax,s-selection,animate_subject_passive,True,True,False,False,587,-68.72750854492188,-81.29316711425781,1
John isn't remembered by some doctors.,John isn't remembered by some means.,syntax,s-selection,animate_subject_passive,True,True,False,False,588,-40.765663146972656,-41.69363784790039,1
A lot of hills aren't passed by the boy.,A lot of hills aren't passed by the carts.,syntax,s-selection,animate_subject_passive,True,True,False,False,589,-61.3731689453125,-65.29585266113281,1
This shirt wasn't cleaned by the man.,This shirt wasn't cleaned by the means.,syntax,s-selection,animate_subject_passive,True,True,False,False,590,-42.761329650878906,-45.00752258300781,1
Many movies are examined by the waiters.,Many movies are examined by the axes.,syntax,s-selection,animate_subject_passive,True,True,False,False,591,-44.00914764404297,-40.494781494140625,0
Some documentary is examined by the woman.,Some documentary is examined by the stimuli.,syntax,s-selection,animate_subject_passive,True,True,False,False,592,-46.452457427978516,-49.94090270996094,1
The rice wasn't revealed by some ladies.,The rice wasn't revealed by some associations.,syntax,s-selection,animate_subject_passive,True,True,False,False,593,-52.873985290527344,-53.151649475097656,1
Heidi wasn't loved by the women.,Heidi wasn't loved by the parentheses.,syntax,s-selection,animate_subject_passive,True,True,False,False,594,-48.116432189941406,-53.23247528076172,1
Monet is appreciated by the doctor.,Monet is appreciated by the muffins.,syntax,s-selection,animate_subject_passive,True,True,False,False,595,-39.097686767578125,-46.03215789794922,1
Gary wasn't concealed by the girl.,Gary wasn't concealed by the committees.,syntax,s-selection,animate_subject_passive,True,True,False,False,596,-38.96092987060547,-41.83614730834961,1
Aaron is loved by the students.,Aaron is loved by the chairs.,syntax,s-selection,animate_subject_passive,True,True,False,False,597,-29.928361892700195,-32.94624710083008,1
Many restaurants aren't walked through by the senators.,Many restaurants aren't walked through by the legislature.,syntax,s-selection,animate_subject_passive,True,True,False,False,598,-52.51549530029297,-49.43726348876953,0
The bank isn't cleaned by some guest.,The bank isn't cleaned by some blouses.,syntax,s-selection,animate_subject_passive,True,True,False,False,599,-51.620880126953125,-58.03184509277344,1
James wasn't revealed by some woman.,James wasn't revealed by some cars.,syntax,s-selection,animate_subject_passive,True,True,False,False,600,-38.900386810302734,-39.743099212646484,1
This movie theater wasn't arrived at by the teacher.,This movie theater wasn't arrived at by the report.,syntax,s-selection,animate_subject_passive,True,True,False,False,601,-64.7930908203125,-63.85813522338867,0
Some rivers are dropped by by the child.,Some rivers are dropped by by the carriages.,syntax,s-selection,animate_subject_passive,True,True,False,False,602,-45.919334411621094,-53.13530731201172,1
Wayne wasn't hidden by some drivers.,Wayne wasn't hidden by some sheep.,syntax,s-selection,animate_subject_passive,True,True,False,False,603,-53.01811599731445,-53.774009704589844,1
Becca wasn't criticized by the drivers.,Becca wasn't criticized by the thesis.,syntax,s-selection,animate_subject_passive,True,True,False,False,604,-48.100093841552734,-48.278804779052734,1
Many socks weren't admired by some actors.,Many socks weren't admired by some analysis.,syntax,s-selection,animate_subject_passive,True,True,False,False,605,-55.784828186035156,-54.892574310302734,0
The reports weren't bought by the pedestrian.,The reports weren't bought by the convertibles.,syntax,s-selection,animate_subject_passive,True,True,False,False,606,-50.617401123046875,-62.9611930847168,1
Judy isn't healed by some children.,Judy isn't healed by some candles.,syntax,s-selection,animate_subject_passive,True,True,False,False,607,-47.27109909057617,-51.133792877197266,1
Alicia isn't loved by the teenagers.,Alicia isn't loved by the prints.,syntax,s-selection,animate_subject_passive,True,True,False,False,608,-64.06036376953125,-65.69160461425781,1
This slope was climbed down by some guys.,This slope was climbed down by some cacti.,syntax,s-selection,animate_subject_passive,True,True,False,False,609,-51.625579833984375,-66.82456970214844,1
Many stories were examined by some doctor.,Many stories were examined by some ice.,syntax,s-selection,animate_subject_passive,True,True,False,False,610,-43.12937927246094,-44.523704528808594,1
Many dresses weren't cleaned by some woman.,Many dresses weren't cleaned by some boxes.,syntax,s-selection,animate_subject_passive,True,True,False,False,611,-50.729740142822266,-50.94873046875,1
This mouth was lifted by the men.,This mouth was lifted by the ladders.,syntax,s-selection,animate_subject_passive,True,True,False,False,612,-40.638877868652344,-49.55743408203125,1
Stephen was talked about by some people.,Stephen was talked about by some cucumbers.,syntax,s-selection,animate_subject_passive,True,True,False,False,613,-32.13778305053711,-49.96332550048828,1
A lot of senators weren't found by the adults.,A lot of senators weren't found by the shoes.,syntax,s-selection,animate_subject_passive,True,True,False,False,614,-70.23245239257812,-71.03500366210938,1
Every scarf wasn't worn by some customer.,Every scarf wasn't worn by some movies.,syntax,s-selection,animate_subject_passive,True,True,False,False,615,-52.502113342285156,-47.29512023925781,0
This mountain isn't dropped by by some offspring.,This mountain isn't dropped by by some play.,syntax,s-selection,animate_subject_passive,True,True,False,False,616,-60.042633056640625,-56.7396240234375,0
Helen was referenced by the waitresses.,Helen was referenced by the shoe.,syntax,s-selection,animate_subject_passive,True,True,False,False,617,-55.04163360595703,-44.12207794189453,0
The movie theater isn't arrived at by the dancer.,The movie theater isn't arrived at by the oxen.,syntax,s-selection,animate_subject_passive,True,True,False,False,618,-64.47618103027344,-68.86427307128906,1
The Borgias aren't boycotted by the people.,The Borgias aren't boycotted by the series.,syntax,s-selection,animate_subject_passive,True,True,False,False,619,-77.7464599609375,-81.5276107788086,1
A child isn't concealed by the senators.,A child isn't concealed by the hamsters.,syntax,s-selection,animate_subject_passive,True,True,False,False,620,-64.9970932006836,-67.59623718261719,1
Carol was talked about by some ladies.,Carol was talked about by some screen.,syntax,s-selection,animate_subject_passive,True,True,False,False,621,-48.566192626953125,-49.108917236328125,1
The sketch isn't lifted by the guests.,The sketch isn't lifted by the documentary.,syntax,s-selection,animate_subject_passive,True,True,False,False,622,-49.13479995727539,-50.92414855957031,1
Kristin isn't attacked by the waiters.,Kristin isn't attacked by the snake.,syntax,s-selection,animate_subject_passive,True,True,False,False,623,-57.190338134765625,-48.94269561767578,0
Glaciers weren't lifted by some student.,Glaciers weren't lifted by some dish.,syntax,s-selection,animate_subject_passive,True,True,False,False,624,-63.56414031982422,-63.98114776611328,1
That blouse is worn by some man.,That blouse is worn by some trucks.,syntax,s-selection,animate_subject_passive,True,True,False,False,625,-49.59925842285156,-50.85932922363281,1
Kenneth wasn't discovered by the teenager.,Kenneth wasn't discovered by the wheelbarrow.,syntax,s-selection,animate_subject_passive,True,True,False,False,626,-50.35504913330078,-71.33615112304688,1
Kirsten wasn't hugged by some guy.,Kirsten wasn't hugged by some broccoli.,syntax,s-selection,animate_subject_passive,True,True,False,False,627,-68.40461730957031,-73.63294982910156,1
Many malls were toured by the men.,Many malls were toured by the parenthesis.,syntax,s-selection,animate_subject_passive,True,True,False,False,628,-48.24898147583008,-61.541648864746094,1
This movie theater isn't arrived at by the doctors.,This movie theater isn't arrived at by the skateboards.,syntax,s-selection,animate_subject_passive,True,True,False,False,629,-62.11968231201172,-72.94808959960938,1
This high school was passed by some guests.,This high school was passed by some water.,syntax,s-selection,animate_subject_passive,True,True,False,False,630,-43.77211380004883,-41.4937744140625,0
The Clintons aren't loved by the children.,The Clintons aren't loved by the teeth.,syntax,s-selection,animate_subject_passive,True,True,False,False,631,-50.473716735839844,-55.247684478759766,1
Rhonda was worked with by the guest.,Rhonda was worked with by the steak.,syntax,s-selection,animate_subject_passive,True,True,False,False,632,-48.92794418334961,-50.125282287597656,1
Many wheelbarrows were fixed by some pedestrians.,Many wheelbarrows were fixed by some fungi.,syntax,s-selection,animate_subject_passive,True,True,False,False,633,-70.40873718261719,-70.55010986328125,1
Jesus wasn't criticized by the guy.,Jesus wasn't criticized by the bicycles.,syntax,s-selection,animate_subject_passive,True,True,False,False,634,-34.60352325439453,-40.76490783691406,1
Jane was fled from by some actors.,Jane was fled from by some means.,syntax,s-selection,animate_subject_passive,True,True,False,False,635,-47.79264831542969,-47.91563034057617,1
Caroline is left by some children.,Caroline is left by some bikes.,syntax,s-selection,animate_subject_passive,True,True,False,False,636,-36.83552932739258,-43.400978088378906,1
Kristen wasn't cured by the men.,Kristen wasn't cured by the dress.,syntax,s-selection,animate_subject_passive,True,True,False,False,637,-43.446327209472656,-45.387664794921875,1
These plays aren't talked about by the waiter.,These plays aren't talked about by the face.,syntax,s-selection,animate_subject_passive,True,True,False,False,638,-49.805702209472656,-47.46619415283203,0
Books weren't admired by the students.,Books weren't admired by the mice.,syntax,s-selection,animate_subject_passive,True,True,False,False,639,-36.72937774658203,-41.35016632080078,1
Regina wasn't criticized by some actors.,Regina wasn't criticized by some glasses.,syntax,s-selection,animate_subject_passive,True,True,False,False,640,-51.30786895751953,-51.667964935302734,1
Natalie was revealed by some man.,Natalie was revealed by some nuclei.,syntax,s-selection,animate_subject_passive,True,True,False,False,641,-45.06610870361328,-57.72844696044922,1
A lot of coats aren't worn by the dancer.,A lot of coats aren't worn by the analyses.,syntax,s-selection,animate_subject_passive,True,True,False,False,642,-63.64934158325195,-65.41094970703125,1
Reports aren't examined by some offspring.,Reports aren't examined by some pamphlet.,syntax,s-selection,animate_subject_passive,True,True,False,False,643,-43.827537536621094,-45.14512252807617,1
Jane was questioned by some adults.,Jane was questioned by some glasses.,syntax,s-selection,animate_subject_passive,True,True,False,False,644,-36.0989875793457,-38.053985595703125,1
Some guy wasn't observed by some woman.,Some guy wasn't observed by some basis.,syntax,s-selection,animate_subject_passive,True,True,False,False,645,-47.792930603027344,-49.453880310058594,1
Some teacher wasn't attacked by the actors.,Some teacher wasn't attacked by the water.,syntax,s-selection,animate_subject_passive,True,True,False,False,646,-46.68601608276367,-45.51108169555664,0
Some libraries are exited by the students.,Some libraries are exited by the fish.,syntax,s-selection,animate_subject_passive,True,True,False,False,647,-44.55851745605469,-44.52846908569336,0
Carmen isn't respected by the doctors.,Carmen isn't respected by the foot.,syntax,s-selection,animate_subject_passive,True,True,False,False,648,-55.991180419921875,-58.33586120605469,1
Most hills are climbed down by the women.,Most hills are climbed down by the series.,syntax,s-selection,animate_subject_passive,True,True,False,False,649,-45.35346984863281,-46.710235595703125,1
Karla isn't described by some lady.,Karla isn't described by some organizations.,syntax,s-selection,animate_subject_passive,True,True,False,False,650,-52.82866668701172,-49.55155563354492,0
This driver was kissed by some doctor.,This driver was kissed by some muffins.,syntax,s-selection,animate_subject_passive,True,True,False,False,651,-43.547096252441406,-51.419029235839844,1
The libraries aren't skated around by the boys.,The libraries aren't skated around by the candle.,syntax,s-selection,animate_subject_passive,True,True,False,False,652,-58.09331130981445,-62.74855041503906,1
Most newspaper articles aren't cleaned by the children.,Most newspaper articles aren't cleaned by the doors.,syntax,s-selection,animate_subject_passive,True,True,False,False,653,-52.22675323486328,-54.81666946411133,1
Every snake wasn't thought about by the students.,Every snake wasn't thought about by the sketches.,syntax,s-selection,animate_subject_passive,True,True,False,False,654,-49.5145263671875,-53.828857421875,1
A lot of plays are concealed by the patient.,A lot of plays are concealed by the gloves.,syntax,s-selection,animate_subject_passive,True,True,False,False,655,-66.61032104492188,-66.85394287109375,1
Gina was escaped from by the guy.,Gina was escaped from by the hamster.,syntax,s-selection,animate_subject_passive,True,True,False,False,656,-57.07237243652344,-65.91746520996094,1
Many patients aren't listened to by the girls.,Many patients aren't listened to by the drawing.,syntax,s-selection,animate_subject_passive,True,True,False,False,657,-43.945091247558594,-50.043052673339844,1
Angela was forgotten by some ladies.,Angela was forgotten by some paralyses.,syntax,s-selection,animate_subject_passive,True,True,False,False,658,-47.955841064453125,-60.49314880371094,1
Irene is hated by the women.,Irene is hated by the diagnosis.,syntax,s-selection,animate_subject_passive,True,True,False,False,659,-42.72800827026367,-46.1033935546875,1
Deanna is described by the teachers.,Deanna is described by the cups.,syntax,s-selection,animate_subject_passive,True,True,False,False,660,-44.94902801513672,-47.12413787841797,1
Some ladder wasn't climbed up by some customer.,Some ladder wasn't climbed up by some bicycle.,syntax,s-selection,animate_subject_passive,True,True,False,False,661,-59.52406692504883,-60.19845962524414,1
This restaurant wasn't boycotted by the men.,This restaurant wasn't boycotted by the committees.,syntax,s-selection,animate_subject_passive,True,True,False,False,662,-65.59901428222656,-69.53032684326172,1
Monica is investigated by the actors.,Monica is investigated by the geese.,syntax,s-selection,animate_subject_passive,True,True,False,False,663,-36.51947784423828,-44.24474334716797,1
An art gallery is run around by some waiters.,An art gallery is run around by some candle.,syntax,s-selection,animate_subject_passive,True,True,False,False,664,-67.51516723632812,-60.13642120361328,0
Valerie is known by the guest.,Valerie is known by the picture.,syntax,s-selection,animate_subject_passive,True,True,False,False,665,-44.93462371826172,-44.07902908325195,0
Jennifer was hired by some waiters.,Jennifer was hired by some plane.,syntax,s-selection,animate_subject_passive,True,True,False,False,666,-45.06376647949219,-36.1707763671875,0
Some computers are lifted by some dancer.,Some computers are lifted by some books.,syntax,s-selection,animate_subject_passive,True,True,False,False,667,-44.26369094848633,-39.39069366455078,0
Every newspaper article is scanned by some patients.,Every newspaper article is scanned by some diagnosis.,syntax,s-selection,animate_subject_passive,True,True,False,False,668,-57.68720245361328,-59.58509826660156,1
Every skirt was worn by the actresses.,Every skirt was worn by the couches.,syntax,s-selection,animate_subject_passive,True,True,False,False,669,-44.79155349731445,-50.98111343383789,1
Richard isn't loved by some alumni.,Richard isn't loved by some car.,syntax,s-selection,animate_subject_passive,True,True,False,False,670,-45.82846450805664,-39.50823974609375,0
A dress wasn't hidden by some teenager.,A dress wasn't hidden by some chairs.,syntax,s-selection,animate_subject_passive,True,True,False,False,671,-64.938720703125,-64.05113220214844,0
A lot of customers weren't attacked by some children.,A lot of customers weren't attacked by some cucumber.,syntax,s-selection,animate_subject_passive,True,True,False,False,672,-62.45342254638672,-75.9605484008789,1
