sentence_good,sentence_bad,field,linguistics_term,UID,simple_LM_method,one_prefix_method,two_prefix_method,lexically_identical,pair_id,good_prob,bad_prob,correct
Many patients that stunned Eric kissed themselves.,Many patients that stunned Eric kissed himself.,syntax_semantics,binding,principle_A_c_command,True,True,False,False,438,-57.792083740234375,-58.73529815673828,1
All essays that would stun Aaron would confuse themselves.,All essays that would stun Aaron would confuse himself.,syntax_semantics,binding,principle_A_c_command,True,True,False,False,439,-75.24285125732422,-75.79216003417969,1
Some boy who won't shock Jane wouldn't discover himself.,Some boy who won't shock Jane wouldn't discover herself.,syntax_semantics,binding,principle_A_c_command,True,True,False,False,440,-69.7310791015625,-71.26876831054688,1
Some guests who had worn this hat couldn't sound like themselves.,Some guests who had worn this hat couldn't sound like itself.,syntax_semantics,binding,principle_A_c_command,True,True,False,False,441,-73.01512145996094,-73.62364196777344,1
Some girl that wouldn't drive to the closets isn't insulting herself.,Some girl that wouldn't drive to the closets isn't insulting themselves.,syntax_semantics,binding,principle_A_c_command,True,True,False,False,442,-84.3218994140625,-82.21802520751953,0
Libraries that helped Florence described themselves.,Libraries that helped Florence described herself.,syntax_semantics,binding,principle_A_c_command,True,True,False,False,443,-59.26192855834961,-60.14842224121094,1
Some actresses that hired Debra aren't hugging themselves.,Some actresses that hired Debra aren't hugging herself.,syntax_semantics,binding,principle_A_c_command,True,True,False,False,444,-75.52151489257812,-78.130615234375,1
That actress that referenced girls heals herself.,That actress that referenced girls heals themselves.,syntax_semantics,binding,principle_A_c_command,True,True,False,False,445,-68.29145050048828,-66.17477416992188,0
All college campuses that weren't impressing Mark can't scare themselves.,All college campuses that weren't impressing Mark can't scare himself.,syntax_semantics,binding,principle_A_c_command,True,True,False,False,446,-91.53564453125,-92.45276641845703,1
These teenagers that conceal Mark were concealing themselves.,These teenagers that conceal Mark were concealing himself.,syntax_semantics,binding,principle_A_c_command,True,True,False,False,447,-75.85829162597656,-76.80291748046875,1
Every dancer who complained about every report listens to herself.,Every dancer who complained about every report listens to itself.,syntax_semantics,binding,principle_A_c_command,True,True,False,False,448,-67.10855865478516,-68.37199401855469,1
Waiters that impressed Marie knew themselves.,Waiters that impressed Marie knew herself.,syntax_semantics,binding,principle_A_c_command,True,True,False,False,449,-61.04500198364258,-62.31443786621094,1
The girl that shouldn't research some museums loves herself.,The girl that shouldn't research some museums loves themselves.,syntax_semantics,binding,principle_A_c_command,True,True,False,False,450,-72.07691955566406,-69.34786224365234,0
Some library that scared John boasted about itself.,Some library that scared John boasted about himself.,syntax_semantics,binding,principle_A_c_command,True,True,False,False,451,-64.88961791992188,-63.44558334350586,0
An actress who hasn't discussed a lot of cashiers was concealing herself.,An actress who hasn't discussed a lot of cashiers was concealing themselves.,syntax_semantics,binding,principle_A_c_command,True,True,False,False,452,-93.62482452392578,-92.9219741821289,0
Every mushroom that is bothering Keith hadn't annoyed itself.,Every mushroom that is bothering Keith hadn't annoyed himself.,syntax_semantics,binding,principle_A_c_command,True,True,False,False,453,-79.08047485351562,-77.45303344726562,0
Organizations that hurt Stephen hadn't argued about themselves.,Organizations that hurt Stephen hadn't argued about himself.,syntax_semantics,binding,principle_A_c_command,True,True,False,False,454,-69.17565155029297,-69.71556091308594,1
Some forks that astound Alexander hadn't bothered themselves.,Some forks that astound Alexander hadn't bothered himself.,syntax_semantics,binding,principle_A_c_command,True,True,False,False,455,-77.48152160644531,-78.67312622070312,1
A lot of girls that are bringing this window do care for themselves.,A lot of girls that are bringing this window do care for itself.,syntax_semantics,binding,principle_A_c_command,True,True,False,False,456,-78.29451751708984,-80.34932708740234,1
Some nose that had disturbed Carlos isn't shocking itself.,Some nose that had disturbed Carlos isn't shocking himself.,syntax_semantics,binding,principle_A_c_command,True,True,False,False,457,-84.763916015625,-84.18719482421875,0
All drivers that walked through every mall helped themselves.,All drivers that walked through every mall helped itself.,syntax_semantics,binding,principle_A_c_command,True,True,False,False,458,-62.04267120361328,-64.73676300048828,1
Most stairs that aren't scaring Rachelle are aggravating themselves.,Most stairs that aren't scaring Rachelle are aggravating herself.,syntax_semantics,binding,principle_A_c_command,True,True,False,False,459,-85.83828735351562,-87.65779113769531,1
A girl that hadn't cleaned every tomato knows herself.,A girl that hadn't cleaned every tomato knows itself.,syntax_semantics,binding,principle_A_c_command,True,True,False,False,460,-83.05775451660156,-80.95504760742188,0
That gate that embarrassed Tiffany can't hurt itself.,That gate that embarrassed Tiffany can't hurt herself.,syntax_semantics,binding,principle_A_c_command,True,True,False,False,461,-69.75028228759766,-70.48783874511719,1
These ladies who won't explore every hospital cared for themselves.,These ladies who won't explore every hospital cared for itself.,syntax_semantics,binding,principle_A_c_command,True,True,False,False,462,-67.18157958984375,-68.8873519897461,1
A dancer who ascended hills is helping herself.,A dancer who ascended hills is helping themselves.,syntax_semantics,binding,principle_A_c_command,True,True,False,False,463,-76.83840942382812,-74.50431823730469,0
All committees that have talked about Vanessa should know themselves.,All committees that have talked about Vanessa should know herself.,syntax_semantics,binding,principle_A_c_command,True,True,False,False,464,-64.99627685546875,-67.20167541503906,1
That guy that shouldn't discuss some lakes leaves himself.,That guy that shouldn't discuss some lakes leaves themselves.,syntax_semantics,binding,principle_A_c_command,True,True,False,False,465,-68.9033432006836,-67.89420318603516,0
The actors that shouldn't tour that river watched themselves.,The actors that shouldn't tour that river watched itself.,syntax_semantics,binding,principle_A_c_command,True,True,False,False,466,-69.09152221679688,-71.12873077392578,1
These universities that appreciate every actress were worrying themselves.,These universities that appreciate every actress were worrying herself.,syntax_semantics,binding,principle_A_c_command,True,True,False,False,467,-67.58386993408203,-69.97744750976562,1
These horses that climbed down a mountain aren't finding themselves.,These horses that climbed down a mountain aren't finding itself.,syntax_semantics,binding,principle_A_c_command,True,True,False,False,468,-65.46258544921875,-67.46190643310547,1
Some teachers that observe Donald can't discover themselves.,Some teachers that observe Donald can't discover himself.,syntax_semantics,binding,principle_A_c_command,True,True,False,False,469,-67.68206024169922,-68.60388946533203,1
That play that wasn't boring Wayne sounds like itself.,That play that wasn't boring Wayne sounds like himself.,syntax_semantics,binding,principle_A_c_command,True,True,False,False,470,-68.11778259277344,-67.43059539794922,0
These girls who praised Colleen had forgotten themselves.,These girls who praised Colleen had forgotten herself.,syntax_semantics,binding,principle_A_c_command,True,True,False,False,471,-73.16861724853516,-75.56576538085938,1
That boy that hadn't attacked Becca had fired himself.,That boy that hadn't attacked Becca had fired herself.,syntax_semantics,binding,principle_A_c_command,True,True,False,False,472,-78.02970123291016,-79.48234558105469,1
A lot of birds that shocked this committee are bothering themselves.,A lot of birds that shocked this committee are bothering itself.,syntax_semantics,binding,principle_A_c_command,True,True,False,False,473,-77.67413330078125,-80.8244857788086,1
Those patients who discussed Frank have hugged themselves.,Those patients who discussed Frank have hugged himself.,syntax_semantics,binding,principle_A_c_command,True,True,False,False,474,-66.07341766357422,-67.67796325683594,1
All drivers who won't pass every bank weren't insulting themselves.,All drivers who won't pass every bank weren't insulting itself.,syntax_semantics,binding,principle_A_c_command,True,True,False,False,475,-80.1474609375,-82.25741577148438,1
Some guests who would tour the lake aren't arguing about themselves.,Some guests who would tour the lake aren't arguing about itself.,syntax_semantics,binding,principle_A_c_command,True,True,False,False,476,-76.76757049560547,-79.11652374267578,1
All girls that disgust Kathleen don't see themselves.,All girls that disgust Kathleen don't see herself.,syntax_semantics,binding,principle_A_c_command,True,True,False,False,477,-63.683387756347656,-67.12542724609375,1
The man who disturbs Sara was discovering himself.,The man who disturbs Sara was discovering herself.,syntax_semantics,binding,principle_A_c_command,True,True,False,False,478,-65.830322265625,-67.47029876708984,1
This guy who can't observe Angela likes himself.,This guy who can't observe Angela likes herself.,syntax_semantics,binding,principle_A_c_command,True,True,False,False,479,-58.758888244628906,-60.15213394165039,1
Every lady who should tour a lake praises herself.,Every lady who should tour a lake praises itself.,syntax_semantics,binding,principle_A_c_command,True,True,False,False,480,-67.99993896484375,-66.78340911865234,0
The ladies who aren't messing up some restaurant shouldn't discuss themselves.,The ladies who aren't messing up some restaurant shouldn't discuss itself.,syntax_semantics,binding,principle_A_c_command,True,True,False,False,481,-78.54507446289062,-80.35039520263672,1
Most adults who hadn't irritated Craig had escaped from themselves.,Most adults who hadn't irritated Craig had escaped from himself.,syntax_semantics,binding,principle_A_c_command,True,True,False,False,482,-79.06484985351562,-79.271484375,1
Those girls who could see the icicle were hiring themselves.,Those girls who could see the icicle were hiring itself.,syntax_semantics,binding,principle_A_c_command,True,True,False,False,483,-68.30191802978516,-69.51502227783203,1
Pasta that was stunning Samantha has impressed itself.,Pasta that was stunning Samantha has impressed herself.,syntax_semantics,binding,principle_A_c_command,True,True,False,False,484,-74.67140197753906,-75.083740234375,1
Waiters who shocks Bill didn't conceal themselves.,Waiters who shocks Bill didn't conceal himself.,syntax_semantics,binding,principle_A_c_command,True,True,False,False,485,-70.43070220947266,-70.23219299316406,0
All cashiers that were firing Denise will disagree with themselves.,All cashiers that were firing Denise will disagree with herself.,syntax_semantics,binding,principle_A_c_command,True,True,False,False,486,-83.33732604980469,-86.41819763183594,1
A light that stuns Rose hasn't stunned itself.,A light that stuns Rose hasn't stunned herself.,syntax_semantics,binding,principle_A_c_command,True,True,False,False,487,-92.50666809082031,-92.6943130493164,1
The legislature that wasn't describing Margaret hates itself.,The legislature that wasn't describing Margaret hates herself.,syntax_semantics,binding,principle_A_c_command,True,True,False,False,488,-66.61746215820312,-66.38353729248047,0
A lot of actors who were hiring Brian haven't fired themselves.,A lot of actors who were hiring Brian haven't fired himself.,syntax_semantics,binding,principle_A_c_command,True,True,False,False,489,-87.00587463378906,-86.33536529541016,0
This committee that shouldn't take all shoes discusses itself.,This committee that shouldn't take all shoes discusses themselves.,syntax_semantics,binding,principle_A_c_command,True,True,False,False,490,-68.46339416503906,-67.111083984375,0
The man who astounded Rebecca appreciates himself.,The man who astounded Rebecca appreciates herself.,syntax_semantics,binding,principle_A_c_command,True,True,False,False,491,-69.83012390136719,-70.91409301757812,1
Some screen that wasn't aggravating Douglas has bored itself.,Some screen that wasn't aggravating Douglas has bored himself.,syntax_semantics,binding,principle_A_c_command,True,True,False,False,492,-80.43231201171875,-79.63894653320312,0
This screen that is disgusting Helen did bore itself.,This screen that is disgusting Helen did bore herself.,syntax_semantics,binding,principle_A_c_command,True,True,False,False,493,-75.60835266113281,-75.52902221679688,0
The children that hadn't climbed down the slope investigated themselves.,The children that hadn't climbed down the slope investigated itself.,syntax_semantics,binding,principle_A_c_command,True,True,False,False,494,-67.5192642211914,-68.07728576660156,1
Those art galleries that can't hurt Tara distracted themselves.,Those art galleries that can't hurt Tara distracted herself.,syntax_semantics,binding,principle_A_c_command,True,True,False,False,495,-74.03138732910156,-76.28471374511719,1
Those drivers who were boycotting that association insulted themselves.,Those drivers who were boycotting that association insulted itself.,syntax_semantics,binding,principle_A_c_command,True,True,False,False,496,-82.19300079345703,-83.85997009277344,1
Every mall that stuns these waitresses hadn't distracted itself.,Every mall that stuns these waitresses hadn't distracted themselves.,syntax_semantics,binding,principle_A_c_command,True,True,False,False,497,-99.48841094970703,-98.05540466308594,0
Some teachers who pass every hospital annoyed themselves.,Some teachers who pass every hospital annoyed itself.,syntax_semantics,binding,principle_A_c_command,True,True,False,False,498,-63.40885543823242,-63.814361572265625,1
The girl that was irritating Chad isn't fleeing from herself.,The girl that was irritating Chad isn't fleeing from himself.,syntax_semantics,binding,principle_A_c_command,True,True,False,False,499,-79.34935760498047,-78.20170593261719,0
The guests who escape from every movie theater healed themselves.,The guests who escape from every movie theater healed itself.,syntax_semantics,binding,principle_A_c_command,True,True,False,False,500,-75.55545043945312,-76.8990478515625,1
Many men that concealed Marie discovered themselves.,Many men that concealed Marie discovered herself.,syntax_semantics,binding,principle_A_c_command,True,True,False,False,501,-57.51377487182617,-59.5576057434082,1
Every bank that bothered Jerry is embarrassing itself.,Every bank that bothered Jerry is embarrassing himself.,syntax_semantics,binding,principle_A_c_command,True,True,False,False,502,-64.04366302490234,-64.14225006103516,1
Many cucumbers that embarrassed Diane weren't impressing themselves.,Many cucumbers that embarrassed Diane weren't impressing herself.,syntax_semantics,binding,principle_A_c_command,True,True,False,False,503,-88.65434265136719,-90.93339538574219,1
This boy who couldn't love a lot of actresses observes himself.,This boy who couldn't love a lot of actresses observes themselves.,syntax_semantics,binding,principle_A_c_command,True,True,False,False,504,-70.8910140991211,-70.21776580810547,0
All pedestrians that have boycotted Spain were disagreeing with themselves.,All pedestrians that have boycotted Spain were disagreeing with itself.,syntax_semantics,binding,principle_A_c_command,True,True,False,False,505,-103.6577377319336,-106.20460510253906,1
Those pedestrians that hadn't hated Lori had aggravated themselves.,Those pedestrians that hadn't hated Lori had aggravated herself.,syntax_semantics,binding,principle_A_c_command,True,True,False,False,506,-86.57188415527344,-89.15868377685547,1
That waitress that boycotts all associations hates herself.,That waitress that boycotts all associations hates themselves.,syntax_semantics,binding,principle_A_c_command,True,True,False,False,507,-90.42646789550781,-86.5708999633789,0
The museum that listens to Michelle praises itself.,The museum that listens to Michelle praises herself.,syntax_semantics,binding,principle_A_c_command,True,True,False,False,508,-58.38970947265625,-57.716224670410156,0
The men that had talked to Mitchell weren't describing themselves.,The men that had talked to Mitchell weren't describing himself.,syntax_semantics,binding,principle_A_c_command,True,True,False,False,509,-67.73469543457031,-68.03804016113281,1
Most patients that won't talk to Margaret healed themselves.,Most patients that won't talk to Margaret healed herself.,syntax_semantics,binding,principle_A_c_command,True,True,False,False,510,-64.54824829101562,-66.42720794677734,1
Some shirt that aggravated Kevin scares itself.,Some shirt that aggravated Kevin scares himself.,syntax_semantics,binding,principle_A_c_command,True,True,False,False,511,-66.8935546875,-65.04312133789062,0
Most committees that shocked Andrew had hated themselves.,Most committees that shocked Andrew had hated himself.,syntax_semantics,binding,principle_A_c_command,True,True,False,False,512,-65.09439849853516,-65.23942565917969,1
All sketches that have scared Sharon aren't disturbing themselves.,All sketches that have scared Sharon aren't disturbing herself.,syntax_semantics,binding,principle_A_c_command,True,True,False,False,513,-76.02149963378906,-78.11540222167969,1
This actress that complains about some ladies discusses herself.,This actress that complains about some ladies discusses themselves.,syntax_semantics,binding,principle_A_c_command,True,True,False,False,514,-71.20159912109375,-69.1904525756836,0
A lot of guys that wouldn't dislike Brad aren't approaching themselves.,A lot of guys that wouldn't dislike Brad aren't approaching himself.,syntax_semantics,binding,principle_A_c_command,True,True,False,False,515,-90.56831359863281,-91.4132080078125,1
A lot of drivers that hadn't disturbed Thomas haven't questioned themselves.,A lot of drivers that hadn't disturbed Thomas haven't questioned himself.,syntax_semantics,binding,principle_A_c_command,True,True,False,False,516,-91.47528076171875,-92.05777740478516,1
A lot of legislatures that had scared Nicole aren't appreciating themselves.,A lot of legislatures that had scared Nicole aren't appreciating herself.,syntax_semantics,binding,principle_A_c_command,True,True,False,False,517,-99.87907409667969,-101.78668212890625,1
Every man that has complained about Sally is revealing himself.,Every man that has complained about Sally is revealing herself.,syntax_semantics,binding,principle_A_c_command,True,True,False,False,518,-65.42803955078125,-66.68397521972656,1
Some universities that worried Ellen disturbed themselves.,Some universities that worried Ellen disturbed herself.,syntax_semantics,binding,principle_A_c_command,True,True,False,False,519,-56.86668395996094,-57.61231994628906,1
That actress who won't clean some sock should notice herself.,That actress who won't clean some sock should notice itself.,syntax_semantics,binding,principle_A_c_command,True,True,False,False,520,-76.68875122070312,-76.77554321289062,1
This lady who had fired Timothy attacks herself.,This lady who had fired Timothy attacks himself.,syntax_semantics,binding,principle_A_c_command,True,True,False,False,521,-59.48857879638672,-58.731300354003906,0
The tomato that won't embarrass Emily isn't stunning itself.,The tomato that won't embarrass Emily isn't stunning herself.,syntax_semantics,binding,principle_A_c_command,True,True,False,False,522,-81.89280700683594,-81.65245056152344,0
That mall that doesn't look like most sketches was disturbing itself.,That mall that doesn't look like most sketches was disturbing themselves.,syntax_semantics,binding,principle_A_c_command,True,True,False,False,523,-79.81935119628906,-78.81050109863281,0
This dancer that alarmed Samuel does cure herself.,This dancer that alarmed Samuel does cure himself.,syntax_semantics,binding,principle_A_c_command,True,True,False,False,524,-73.23777770996094,-71.96791076660156,0
A lot of dancers who didn't disgust Rachel weren't boasting about themselves.,A lot of dancers who didn't disgust Rachel weren't boasting about herself.,syntax_semantics,binding,principle_A_c_command,True,True,False,False,525,-106.60768127441406,-108.04908752441406,1
All organizations that stunned Danielle don't hire themselves.,All organizations that stunned Danielle don't hire herself.,syntax_semantics,binding,principle_A_c_command,True,True,False,False,526,-65.75164031982422,-68.99568176269531,1
Some commentary that isn't confusing Melissa would confuse itself.,Some commentary that isn't confusing Melissa would confuse herself.,syntax_semantics,binding,principle_A_c_command,True,True,False,False,527,-77.10392761230469,-76.84700012207031,0
Some men who can't bike to the library aren't approaching themselves.,Some men who can't bike to the library aren't approaching itself.,syntax_semantics,binding,principle_A_c_command,True,True,False,False,528,-72.3772964477539,-74.638427734375,1
Every girl that hasn't skated around this mall visits herself.,Every girl that hasn't skated around this mall visits itself.,syntax_semantics,binding,principle_A_c_command,True,True,False,False,529,-81.1033935546875,-79.87467956542969,0
This woman that was researching the hospitals isn't firing herself.,This woman that was researching the hospitals isn't firing themselves.,syntax_semantics,binding,principle_A_c_command,True,True,False,False,530,-70.13926696777344,-68.5167007446289,0
Some government that fires many teenagers couldn't argue about itself.,Some government that fires many teenagers couldn't argue about themselves.,syntax_semantics,binding,principle_A_c_command,True,True,False,False,531,-65.76995086669922,-63.8294677734375,0
Every woman who had discussed Liam loves herself.,Every woman who had discussed Liam loves himself.,syntax_semantics,binding,principle_A_c_command,True,True,False,False,532,-55.94761657714844,-53.91696548461914,0
A lot of students that exit every cafe were thinking about themselves.,A lot of students that exit every cafe were thinking about itself.,syntax_semantics,binding,principle_A_c_command,True,True,False,False,533,-80.52139282226562,-82.13430786132812,1
Most ladies that bothers Patricia talked about themselves.,Most ladies that bothers Patricia talked about herself.,syntax_semantics,binding,principle_A_c_command,True,True,False,False,534,-56.3969612121582,-58.1602897644043,1
All photographs that annoyed Diane haven't annoyed themselves.,All photographs that annoyed Diane haven't annoyed herself.,syntax_semantics,binding,principle_A_c_command,True,True,False,False,535,-74.41592407226562,-76.35749816894531,1
All reports that hadn't sounded like Danielle shouldn't disagree with themselves.,All reports that hadn't sounded like Danielle shouldn't disagree with herself.,syntax_semantics,binding,principle_A_c_command,True,True,False,False,536,-79.43536376953125,-82.3023910522461,1
This museum that shouldn't bore Elizabeth scares itself.,This museum that shouldn't bore Elizabeth scares herself.,syntax_semantics,binding,principle_A_c_command,True,True,False,False,537,-69.43388366699219,-68.5855712890625,0
A report that hadn't sounded like most guests sounds like itself.,A report that hadn't sounded like most guests sounds like themselves.,syntax_semantics,binding,principle_A_c_command,True,True,False,False,538,-85.19088745117188,-83.95450592041016,0
Every girl who described Joel isn't attacking herself.,Every girl who described Joel isn't attacking himself.,syntax_semantics,binding,principle_A_c_command,True,True,False,False,539,-64.74818420410156,-63.31001281738281,0
Some man who hasn't fired Kathleen cures himself.,Some man who hasn't fired Kathleen cures herself.,syntax_semantics,binding,principle_A_c_command,True,True,False,False,540,-69.8145751953125,-70.76072692871094,1
Guys who can embarrass Liam cured themselves.,Guys who can embarrass Liam cured himself.,syntax_semantics,binding,principle_A_c_command,True,True,False,False,541,-62.23839569091797,-62.79001235961914,1
A lot of boys that embarrassed Joel have hugged themselves.,A lot of boys that embarrassed Joel have hugged himself.,syntax_semantics,binding,principle_A_c_command,True,True,False,False,542,-82.0609130859375,-83.37757110595703,1
All men who disgusted Rhonda aren't watching themselves.,All men who disgusted Rhonda aren't watching herself.,syntax_semantics,binding,principle_A_c_command,True,True,False,False,543,-74.38908386230469,-76.89747619628906,1
Some organizations that had every fish hadn't talked to themselves.,Some organizations that had every fish hadn't talked to itself.,syntax_semantics,binding,principle_A_c_command,True,True,False,False,544,-58.02494812011719,-60.34098815917969,1
Some senators that do alarm Steven boasted about themselves.,Some senators that do alarm Steven boasted about himself.,syntax_semantics,binding,principle_A_c_command,True,True,False,False,545,-73.57633972167969,-74.93490600585938,1
Some hospital that is working with Theodore admired itself.,Some hospital that is working with Theodore admired himself.,syntax_semantics,binding,principle_A_c_command,True,True,False,False,546,-65.81356048583984,-66.74190521240234,1
