sentence_good,sentence_bad,field,linguistics_term,UID,simple_LM_method,one_prefix_method,two_prefix_method,lexically_identical,pair_id,good_prob,bad_prob,correct
It's himself that this cashier attacked.,It's himself that attacked this cashier.,syntax_semantics,binding,principle_A_reconstruction,True,False,False,True,0,-56.82666015625,-55.30937576293945,0
It's herself that Andrea attacked.,It's herself that attacked Andrea.,syntax_semantics,binding,principle_A_reconstruction,True,False,False,True,1,-44.13871765136719,-43.361183166503906,0
It's herself that Sharon talked about.,It's herself that talked about Sharon.,syntax_semantics,binding,principle_A_reconstruction,True,False,False,True,2,-42.43831253051758,-40.90940856933594,0
It's himself that Todd described.,It's himself that described Todd.,syntax_semantics,binding,principle_A_reconstruction,True,False,False,True,3,-40.35321044921875,-42.96121597290039,1
It's themselves that some spotlights astounded.,It's themselves that astounded some spotlights.,syntax_semantics,binding,principle_A_reconstruction,True,False,False,True,4,-67.64895629882812,-67.7730712890625,1
It's herself who Karen criticized.,It's herself who criticized Karen.,syntax_semantics,binding,principle_A_reconstruction,True,False,False,True,5,-45.48881149291992,-44.52757263183594,0
It's itself that some ice isn't stunning.,It's itself that isn't stunning some ice.,syntax_semantics,binding,principle_A_reconstruction,True,False,False,True,6,-53.77714538574219,-56.13011169433594,1
It's himself who Robert discusses.,It's himself who discusses Robert.,syntax_semantics,binding,principle_A_reconstruction,True,False,False,True,7,-44.212242126464844,-46.62145233154297,1
It's herself who Judy wasn't firing.,It's herself who wasn't firing Judy.,syntax_semantics,binding,principle_A_reconstruction,True,False,False,True,8,-54.14552307128906,-52.27314758300781,0
It's herself that Carmen won't stun.,It's herself that won't stun Carmen.,syntax_semantics,binding,principle_A_reconstruction,True,False,False,True,9,-56.83501434326172,-54.21529006958008,0
It's herself who Gina did work with.,It's herself who did work with Gina.,syntax_semantics,binding,principle_A_reconstruction,True,False,False,True,10,-53.12506866455078,-47.884456634521484,0
It's itself that that pork would stun.,It's itself that would stun that pork.,syntax_semantics,binding,principle_A_reconstruction,True,False,False,True,11,-60.62131881713867,-53.910831451416016,0
It's itself that this committee has referenced.,It's itself that has referenced this committee.,syntax_semantics,binding,principle_A_reconstruction,True,False,False,True,12,-52.47125244140625,-51.53646469116211,0
It's herself that Allison couldn't insult.,It's herself that couldn't insult Allison.,syntax_semantics,binding,principle_A_reconstruction,True,False,False,True,13,-56.88602066040039,-53.08634567260742,0
It's themselves that many college campuses haven't disgusted.,It's themselves that haven't disgusted many college campuses.,syntax_semantics,binding,principle_A_reconstruction,True,False,False,True,14,-68.22479248046875,-65.35543060302734,0
It's himself that Guy likes.,It's himself that likes Guy.,syntax_semantics,binding,principle_A_reconstruction,True,False,False,True,15,-38.778472900390625,-38.364891052246094,0
It's himself who Bill astounded.,It's himself who astounded Bill.,syntax_semantics,binding,principle_A_reconstruction,True,False,False,True,16,-50.77008056640625,-54.270992279052734,1
It's herself that Rose had talked to.,It's herself that had talked to Rose.,syntax_semantics,binding,principle_A_reconstruction,True,False,False,True,17,-48.5123291015625,-48.50981521606445,0
It's himself who Robert attacked.,It's himself who attacked Robert.,syntax_semantics,binding,principle_A_reconstruction,True,False,False,True,18,-41.792633056640625,-40.13932800292969,0
It's herself who Jodi stunned.,It's herself who stunned Jodi.,syntax_semantics,binding,principle_A_reconstruction,True,False,False,True,19,-57.81210708618164,-55.465728759765625,0
It's themselves that all dishes weren't distracting.,It's themselves that weren't distracting all dishes.,syntax_semantics,binding,principle_A_reconstruction,True,False,False,True,20,-55.46000671386719,-54.551300048828125,0
It's themselves that some legislatures can't astound.,It's themselves that can't astound some legislatures.,syntax_semantics,binding,principle_A_reconstruction,True,False,False,True,21,-68.51160430908203,-64.66996765136719,0
It's itself that the cake isn't alarming.,It's itself that isn't alarming the cake.,syntax_semantics,binding,principle_A_reconstruction,True,False,False,True,22,-51.779903411865234,-51.9684944152832,1
It's herself who Tamara can talk about.,It's herself who can talk about Tamara.,syntax_semantics,binding,principle_A_reconstruction,True,False,False,True,23,-56.18175506591797,-52.552276611328125,0
It's herself who Andrea had argued about.,It's herself who had argued about Andrea.,syntax_semantics,binding,principle_A_reconstruction,True,False,False,True,24,-61.631614685058594,-56.09382247924805,0
It's herself that Linda wasn't describing.,It's herself that wasn't describing Linda.,syntax_semantics,binding,principle_A_reconstruction,True,False,False,True,25,-49.5128059387207,-47.96574783325195,0
It's himself who Russell didn't hide.,It's himself who didn't hide Russell.,syntax_semantics,binding,principle_A_reconstruction,True,False,False,True,26,-49.07675552368164,-47.71602249145508,0
It's themselves who the Lutherans hadn't disagreed with.,It's themselves who hadn't disagreed with the Lutherans.,syntax_semantics,binding,principle_A_reconstruction,True,False,False,True,27,-80.30094146728516,-73.00543975830078,0
It's himself who Gerald isn't hurting.,It's himself who isn't hurting Gerald.,syntax_semantics,binding,principle_A_reconstruction,True,False,False,True,28,-53.616676330566406,-50.68048858642578,0
It's himself who Steve visits.,It's himself who visits Steve.,syntax_semantics,binding,principle_A_reconstruction,True,False,False,True,29,-44.462791442871094,-45.777225494384766,1
It's herself who Sabrina should boast about.,It's herself who should boast about Sabrina.,syntax_semantics,binding,principle_A_reconstruction,True,False,False,True,30,-73.19032287597656,-69.22737121582031,0
It's himself that Wayne was questioning.,It's himself that was questioning Wayne.,syntax_semantics,binding,principle_A_reconstruction,True,False,False,True,31,-45.986595153808594,-43.80855178833008,0
It's herself who Stacy had bored.,It's herself who had bored Stacy.,syntax_semantics,binding,principle_A_reconstruction,True,False,False,True,32,-53.54107666015625,-50.444252014160156,0
It's herself that Veronica was curing.,It's herself that was curing Veronica.,syntax_semantics,binding,principle_A_reconstruction,True,False,False,True,33,-49.04838562011719,-47.7237434387207,0
It's itself that that commentary has disturbed.,It's itself that has disturbed that commentary.,syntax_semantics,binding,principle_A_reconstruction,True,False,False,True,34,-57.9829216003418,-52.703792572021484,0
It's themselves that all men knew.,It's themselves that knew all men.,syntax_semantics,binding,principle_A_reconstruction,True,False,False,True,35,-39.4716682434082,-42.738224029541016,1
It's herself who Sally respected.,It's herself who respected Sally.,syntax_semantics,binding,principle_A_reconstruction,True,False,False,True,36,-46.751461029052734,-45.24972915649414,0
It's herself who Denise hasn't impressed.,It's herself who hasn't impressed Denise.,syntax_semantics,binding,principle_A_reconstruction,True,False,False,True,37,-55.38530731201172,-54.85264587402344,0
It's itself that some print hurt.,It's itself that hurt some print.,syntax_semantics,binding,principle_A_reconstruction,True,False,False,True,38,-47.46780014038086,-45.31990432739258,0
It's himself that Donald hasn't irritated.,It's himself that hasn't irritated Donald.,syntax_semantics,binding,principle_A_reconstruction,True,False,False,True,39,-50.353729248046875,-50.900150299072266,1
It's herself who Denise attacks.,It's herself who attacks Denise.,syntax_semantics,binding,principle_A_reconstruction,True,False,False,True,40,-44.2724609375,-48.037841796875,1
It's herself that Jane alarmed.,It's herself that alarmed Jane.,syntax_semantics,binding,principle_A_reconstruction,True,False,False,True,41,-43.398284912109375,-47.19031524658203,1
It's herself who Margaret was insulting.,It's herself who was insulting Margaret.,syntax_semantics,binding,principle_A_reconstruction,True,False,False,True,42,-53.07173156738281,-51.78247833251953,0
It's himself who Scott hated.,It's himself who hated Scott.,syntax_semantics,binding,principle_A_reconstruction,True,False,False,True,43,-42.412750244140625,-40.5977897644043,0
It's herself that Lissa fled from.,It's herself that fled from Lissa.,syntax_semantics,binding,principle_A_reconstruction,True,False,False,True,44,-52.17869567871094,-51.346527099609375,0
It's itself that a cart impressed.,It's itself that impressed a cart.,syntax_semantics,binding,principle_A_reconstruction,True,False,False,True,45,-45.900367736816406,-46.98308563232422,1
It's herself who Stacey couldn't bore.,It's herself who couldn't bore Stacey.,syntax_semantics,binding,principle_A_reconstruction,True,False,False,True,46,-69.9400634765625,-65.37081146240234,0
It's herself that some actress was fleeing from.,It's herself that was fleeing from some actress.,syntax_semantics,binding,principle_A_reconstruction,True,False,False,True,47,-60.697296142578125,-55.271366119384766,0
It's himself that Steve flees from.,It's himself that flees from Steve.,syntax_semantics,binding,principle_A_reconstruction,True,False,False,True,48,-53.134822845458984,-53.708946228027344,1
It's herself that Judy argued about.,It's herself that argued about Judy.,syntax_semantics,binding,principle_A_reconstruction,True,False,False,True,49,-48.54181671142578,-49.126617431640625,1
It's himself that David complained about.,It's himself that complained about David.,syntax_semantics,binding,principle_A_reconstruction,True,False,False,True,50,-40.51708984375,-42.982688903808594,1
It's herself who Brenda wasn't firing.,It's herself who wasn't firing Brenda.,syntax_semantics,binding,principle_A_reconstruction,True,False,False,True,51,-55.48404312133789,-52.466461181640625,0
It's themselves that most pedestrians were complaining about.,It's themselves that were complaining about most pedestrians.,syntax_semantics,binding,principle_A_reconstruction,True,False,False,True,52,-57.916542053222656,-54.584774017333984,0
It's herself who Caroline hasn't seen.,It's herself who hasn't seen Caroline.,syntax_semantics,binding,principle_A_reconstruction,True,False,False,True,53,-48.98540496826172,-46.442359924316406,0
It's herself that Tina is hiding.,It's herself that is hiding Tina.,syntax_semantics,binding,principle_A_reconstruction,True,False,False,True,54,-45.522796630859375,-43.77046203613281,0
It's himself that William is attacking.,It's himself that is attacking William.,syntax_semantics,binding,principle_A_reconstruction,True,False,False,True,55,-45.47117614746094,-43.60389709472656,0
It's herself that Carmen visits.,It's herself that visits Carmen.,syntax_semantics,binding,principle_A_reconstruction,True,False,False,True,56,-45.91167449951172,-48.619606018066406,1
It's herself that Laura has investigated.,It's herself that has investigated Laura.,syntax_semantics,binding,principle_A_reconstruction,True,False,False,True,57,-45.48577880859375,-47.939876556396484,1
It's himself who Douglas was listening to.,It's himself who was listening to Douglas.,syntax_semantics,binding,principle_A_reconstruction,True,False,False,True,58,-46.53471755981445,-43.36859893798828,0
It's themselves that the people disagree with.,It's themselves that disagree with the people.,syntax_semantics,binding,principle_A_reconstruction,True,False,False,True,59,-39.77752685546875,-39.04148483276367,0
It's herself who Judy was irritating.,It's herself who was irritating Judy.,syntax_semantics,binding,principle_A_reconstruction,True,False,False,True,60,-51.672515869140625,-51.74561309814453,1
It's herself who Nina forgets.,It's herself who forgets Nina.,syntax_semantics,binding,principle_A_reconstruction,True,False,False,True,61,-50.438720703125,-49.406192779541016,0
It's herself that Rachel cured.,It's herself that cured Rachel.,syntax_semantics,binding,principle_A_reconstruction,True,False,False,True,62,-41.14729309082031,-45.142860412597656,1
It's himself who Kevin hates.,It's himself who hates Kevin.,syntax_semantics,binding,principle_A_reconstruction,True,False,False,True,63,-42.245662689208984,-41.42316818237305,0
It's herself that Kendra was finding.,It's herself that was finding Kendra.,syntax_semantics,binding,principle_A_reconstruction,True,False,False,True,64,-56.13063049316406,-55.29566192626953,0
It's herself who Cynthia isn't insulting.,It's herself who isn't insulting Cynthia.,syntax_semantics,binding,principle_A_reconstruction,True,False,False,True,65,-58.356170654296875,-57.27603530883789,0
It's herself who Sally should think about.,It's herself who should think about Sally.,syntax_semantics,binding,principle_A_reconstruction,True,False,False,True,66,-50.85026550292969,-47.36311340332031,0
It's herself that Sandra did leave.,It's herself that did leave Sandra.,syntax_semantics,binding,principle_A_reconstruction,True,False,False,True,67,-48.11444091796875,-48.30955505371094,1
It's himself that Jerry is insulting.,It's himself that is insulting Jerry.,syntax_semantics,binding,principle_A_reconstruction,True,False,False,True,68,-47.375511169433594,-46.912933349609375,0
It's themselves that most ladies returned to.,It's themselves that returned to most ladies.,syntax_semantics,binding,principle_A_reconstruction,True,False,False,True,69,-48.63770294189453,-47.68196487426758,0
It's herself that every waiter can escape from.,It's herself that can escape from every waiter.,syntax_semantics,binding,principle_A_reconstruction,True,False,False,True,70,-56.31749725341797,-50.840084075927734,0
It's herself that Sherry was praising.,It's herself that was praising Sherry.,syntax_semantics,binding,principle_A_reconstruction,True,False,False,True,71,-53.68736267089844,-54.45881652832031,1
It's itself that the cafe is annoying.,It's itself that is annoying the cafe.,syntax_semantics,binding,principle_A_reconstruction,True,False,False,True,72,-43.14445495605469,-47.174041748046875,1
It's himself who Jeffrey finds.,It's himself who finds Jeffrey.,syntax_semantics,binding,principle_A_reconstruction,True,False,False,True,73,-47.94569396972656,-46.784114837646484,0
It's herself who Heidi complained about.,It's herself who complained about Heidi.,syntax_semantics,binding,principle_A_reconstruction,True,False,False,True,74,-49.860511779785156,-46.847503662109375,0
It's himself who some guy is investigating.,It's himself who is investigating some guy.,syntax_semantics,binding,principle_A_reconstruction,True,False,False,True,75,-50.00422668457031,-45.43593215942383,0
It's herself that Leslie notices.,It's herself that notices Leslie.,syntax_semantics,binding,principle_A_reconstruction,True,False,False,True,76,-43.146034240722656,-45.993125915527344,1
It's herself that Ruth referenced.,It's herself that referenced Ruth.,syntax_semantics,binding,principle_A_reconstruction,True,False,False,True,77,-42.57985305786133,-45.665435791015625,1
It's himself that Benjamin hasn't admired.,It's himself that hasn't admired Benjamin.,syntax_semantics,binding,principle_A_reconstruction,True,False,False,True,78,-52.068443298339844,-51.61962890625,0
It's himself who Dan concealed.,It's himself who concealed Dan.,syntax_semantics,binding,principle_A_reconstruction,True,False,False,True,79,-46.14765167236328,-47.52219009399414,1
It's herself who Martha fled from.,It's herself who fled from Martha.,syntax_semantics,binding,principle_A_reconstruction,True,False,False,True,80,-51.23579406738281,-47.33685302734375,0
It's himself who Robert hires.,It's himself who hires Robert.,syntax_semantics,binding,principle_A_reconstruction,True,False,False,True,81,-44.417903900146484,-46.90976333618164,1
It's themselves that the actresses have disagreed with.,It's themselves that have disagreed with the actresses.,syntax_semantics,binding,principle_A_reconstruction,True,False,False,True,82,-57.911678314208984,-51.33677673339844,0
It's himself that Jason was discovering.,It's himself that was discovering Jason.,syntax_semantics,binding,principle_A_reconstruction,True,False,False,True,83,-48.233306884765625,-47.45306396484375,0
It's herself who Tanya couldn't notice.,It's herself who couldn't notice Tanya.,syntax_semantics,binding,principle_A_reconstruction,True,False,False,True,84,-61.41020202636719,-56.711204528808594,0
It's herself that Alicia astounded.,It's herself that astounded Alicia.,syntax_semantics,binding,principle_A_reconstruction,True,False,False,True,85,-51.36555862426758,-53.82810974121094,1
It's herself who Sonia conceals.,It's herself who conceals Sonia.,syntax_semantics,binding,principle_A_reconstruction,True,False,False,True,86,-58.5788459777832,-61.82361602783203,1
It's herself who Pamela had fled from.,It's herself who had fled from Pamela.,syntax_semantics,binding,principle_A_reconstruction,True,False,False,True,87,-62.10890579223633,-54.168373107910156,0
It's herself who Sharon hasn't embarrassed.,It's herself who hasn't embarrassed Sharon.,syntax_semantics,binding,principle_A_reconstruction,True,False,False,True,88,-53.811065673828125,-54.88148498535156,1
It's itself that a mouth hadn't stunned.,It's itself that hadn't stunned a mouth.,syntax_semantics,binding,principle_A_reconstruction,True,False,False,True,89,-59.56830596923828,-55.45927810668945,0
It's herself that Brenda hasn't admired.,It's herself that hasn't admired Brenda.,syntax_semantics,binding,principle_A_reconstruction,True,False,False,True,90,-55.38164138793945,-52.62492370605469,0
It's herself who Carolyn heals.,It's herself who heals Carolyn.,syntax_semantics,binding,principle_A_reconstruction,True,False,False,True,91,-50.018798828125,-47.671226501464844,0
It's himself that Homer questions.,It's himself that questions Homer.,syntax_semantics,binding,principle_A_reconstruction,True,False,False,True,92,-41.60906982421875,-44.8956184387207,1
It's herself that Melissa left.,It's herself that left Melissa.,syntax_semantics,binding,principle_A_reconstruction,True,False,False,True,93,-38.64484786987305,-41.20927429199219,1
It's herself that Nicole wasn't concealing.,It's herself that wasn't concealing Nicole.,syntax_semantics,binding,principle_A_reconstruction,True,False,False,True,94,-63.062950134277344,-59.828948974609375,0
It's herself that every child approaches.,It's herself that approaches every child.,syntax_semantics,binding,principle_A_reconstruction,True,False,False,True,95,-46.117034912109375,-45.95356750488281,0
It's himself who Omar returned to.,It's himself who returned to Omar.,syntax_semantics,binding,principle_A_reconstruction,True,False,False,True,96,-49.13850402832031,-43.07994842529297,0
It's herself that Karen investigates.,It's herself that investigates Karen.,syntax_semantics,binding,principle_A_reconstruction,True,False,False,True,97,-46.62415313720703,-48.522613525390625,1
It's himself who Bruce watched.,It's himself who watched Bruce.,syntax_semantics,binding,principle_A_reconstruction,True,False,False,True,98,-44.201904296875,-43.768672943115234,0
It's herself who Samantha hadn't hated.,It's herself who hadn't hated Samantha.,syntax_semantics,binding,principle_A_reconstruction,True,False,False,True,99,-59.51184844970703,-56.12771224975586,0
It's herself who Tara hasn't talked to.,It's herself who hasn't talked to Tara.,syntax_semantics,binding,principle_A_reconstruction,True,False,False,True,100,-55.60376739501953,-49.10218811035156,0
It's itself that some organization talks about.,It's itself that talks about some organization.,syntax_semantics,binding,principle_A_reconstruction,True,False,False,True,101,-45.29852294921875,-41.451011657714844,0
It's himself that David had left.,It's himself that had left David.,syntax_semantics,binding,principle_A_reconstruction,True,False,False,True,102,-39.818885803222656,-41.81140899658203,1
It's herself who Maria has helped.,It's herself who has helped Maria.,syntax_semantics,binding,principle_A_reconstruction,True,False,False,True,103,-48.62489318847656,-46.30668258666992,0
It's herself that Patricia investigated.,It's herself that investigated Patricia.,syntax_semantics,binding,principle_A_reconstruction,True,False,False,True,104,-43.02790069580078,-45.270381927490234,1
It's himself that Bradley was irritating.,It's himself that was irritating Bradley.,syntax_semantics,binding,principle_A_reconstruction,True,False,False,True,105,-45.96726989746094,-45.00400161743164,0
It's herself who Meredith likes.,It's herself who likes Meredith.,syntax_semantics,binding,principle_A_reconstruction,True,False,False,True,106,-46.15159606933594,-39.15052032470703,0
It's himself that Joseph cures.,It's himself that cures Joseph.,syntax_semantics,binding,principle_A_reconstruction,True,False,False,True,107,-43.093997955322266,-45.20356750488281,1
It's herself who Anna has boasted about.,It's herself who has boasted about Anna.,syntax_semantics,binding,principle_A_reconstruction,True,False,False,True,108,-59.858795166015625,-56.569969177246094,0
It's herself who Victoria approaches.,It's herself who approaches Victoria.,syntax_semantics,binding,principle_A_reconstruction,True,False,False,True,109,-47.683815002441406,-48.97819900512695,1
It's herself who Sabrina couldn't leave.,It's herself who couldn't leave Sabrina.,syntax_semantics,binding,principle_A_reconstruction,True,False,False,True,110,-61.496253967285156,-58.709495544433594,0
It's themselves that the teachers were concealing.,It's themselves that were concealing the teachers.,syntax_semantics,binding,principle_A_reconstruction,True,False,False,True,111,-55.55860137939453,-57.844032287597656,1
It's itself that the door isn't confusing.,It's itself that isn't confusing the door.,syntax_semantics,binding,principle_A_reconstruction,True,False,False,True,112,-46.121673583984375,-47.729339599609375,1
It's themselves who some actors might leave.,It's themselves who might leave some actors.,syntax_semantics,binding,principle_A_reconstruction,True,False,False,True,113,-53.691978454589844,-50.21617889404297,0
It's herself who Candice is praising.,It's herself who is praising Candice.,syntax_semantics,binding,principle_A_reconstruction,True,False,False,True,114,-60.237083435058594,-58.58236312866211,0
It's herself who Monica helps.,It's herself who helps Monica.,syntax_semantics,binding,principle_A_reconstruction,True,False,False,True,115,-46.87217712402344,-41.54003143310547,0
It's herself who Carol visits.,It's herself who visits Carol.,syntax_semantics,binding,principle_A_reconstruction,True,False,False,True,116,-46.965576171875,-47.56404495239258,1
It's herself who Nancy didn't describe.,It's herself who didn't describe Nancy.,syntax_semantics,binding,principle_A_reconstruction,True,False,False,True,117,-52.37598419189453,-50.45563507080078,0
It's herself who Elizabeth wasn't referencing.,It's herself who wasn't referencing Elizabeth.,syntax_semantics,binding,principle_A_reconstruction,True,False,False,True,118,-56.86155700683594,-55.664642333984375,0
It's herself who Debra returned to.,It's herself who returned to Debra.,syntax_semantics,binding,principle_A_reconstruction,True,False,False,True,119,-53.427616119384766,-47.92182540893555,0
It's herself who some girl wasn't attacking.,It's herself who wasn't attacking some girl.,syntax_semantics,binding,principle_A_reconstruction,True,False,False,True,120,-56.24856185913086,-52.80931091308594,0
It's herself who Candice isn't watching.,It's herself who isn't watching Candice.,syntax_semantics,binding,principle_A_reconstruction,True,False,False,True,121,-59.86449432373047,-55.790283203125,0
It's themselves that all governments described.,It's themselves that described all governments.,syntax_semantics,binding,principle_A_reconstruction,True,False,False,True,122,-44.76033401489258,-44.7486572265625,0
It's themselves that a lot of drivers are investigating.,It's themselves that are investigating a lot of drivers.,syntax_semantics,binding,principle_A_reconstruction,True,False,False,True,123,-50.998321533203125,-48.71516418457031,0
It's herself that Danielle had investigated.,It's herself that had investigated Danielle.,syntax_semantics,binding,principle_A_reconstruction,True,False,False,True,124,-49.995697021484375,-51.039268493652344,1
It's herself who Nancy did remember.,It's herself who did remember Nancy.,syntax_semantics,binding,principle_A_reconstruction,True,False,False,True,125,-52.1353759765625,-50.863155364990234,0
It's herself who Holly listens to.,It's herself who listens to Holly.,syntax_semantics,binding,principle_A_reconstruction,True,False,False,True,126,-47.83433532714844,-45.1442756652832,0
It's herself that Claire has bothered.,It's herself that has bothered Claire.,syntax_semantics,binding,principle_A_reconstruction,True,False,False,True,127,-45.57184600830078,-46.772804260253906,1
It's herself that Florence didn't cure.,It's herself that didn't cure Florence.,syntax_semantics,binding,principle_A_reconstruction,True,False,False,True,128,-47.639991760253906,-45.990421295166016,0
It's itself that a scarf scared.,It's itself that scared a scarf.,syntax_semantics,binding,principle_A_reconstruction,True,False,False,True,129,-45.97638702392578,-45.54951858520508,0
It's herself that Rose was working with.,It's herself that was working with Rose.,syntax_semantics,binding,principle_A_reconstruction,True,False,False,True,130,-46.55317687988281,-45.0943603515625,0
