sentence_good,sentence_bad,field,linguistics_term,UID,simple_LM_method,one_prefix_method,two_prefix_method,lexically_identical,pair_id,good_prob,bad_prob,correct
Some men that don't escape from a bank were helping themselves.,Some men that don't escape from a bank were helping itself.,syntax_semantics,binding,principle_A_c_command,True,True,False,False,219,-64.72364044189453,-67.31864929199219,1
Some waitress that was climbing up all hills had insulted herself.,Some waitress that was climbing up all hills had insulted themselves.,syntax_semantics,binding,principle_A_c_command,True,True,False,False,220,-78.70463562011719,-75.80134582519531,0
This boy who annoyed Laurie disagrees with himself.,This boy who annoyed Laurie disagrees with herself.,syntax_semantics,binding,principle_A_c_command,True,True,False,False,221,-67.49011993408203,-69.54468536376953,1
The pedestrians that exit this museum weren't fleeing from themselves.,The pedestrians that exit this museum weren't fleeing from itself.,syntax_semantics,binding,principle_A_c_command,True,True,False,False,222,-78.98684692382812,-79.79259490966797,1
Those pedestrians who had examined this play hadn't watched themselves.,Those pedestrians who had examined this play hadn't watched itself.,syntax_semantics,binding,principle_A_c_command,True,True,False,False,223,-78.031005859375,-80.16014099121094,1
A lady who isn't bringing the shawls returns to herself.,A lady who isn't bringing the shawls returns to themselves.,syntax_semantics,binding,principle_A_c_command,True,True,False,False,224,-86.22611999511719,-84.50616455078125,0
Actresses who haven't biked to every movie theater aren't hugging themselves.,Actresses who haven't biked to every movie theater aren't hugging itself.,syntax_semantics,binding,principle_A_c_command,True,True,False,False,225,-112.93260192871094,-115.06793975830078,1
Many chairs that shock Heidi haven't stunned themselves.,Many chairs that shock Heidi haven't stunned herself.,syntax_semantics,binding,principle_A_c_command,True,True,False,False,226,-73.09053039550781,-76.03636932373047,1
A scarf that has embarrassed Carolyn wasn't disgusting itself.,A scarf that has embarrassed Carolyn wasn't disgusting herself.,syntax_semantics,binding,principle_A_c_command,True,True,False,False,227,-87.26436614990234,-86.83364868164062,0
Many pedestrians that distracts Lisa investigated themselves.,Many pedestrians that distracts Lisa investigated herself.,syntax_semantics,binding,principle_A_c_command,True,True,False,False,228,-71.66948699951172,-72.76649475097656,1
Most waitresses who weren't concealing John have approached themselves.,Most waitresses who weren't concealing John have approached himself.,syntax_semantics,binding,principle_A_c_command,True,True,False,False,229,-103.50231170654297,-103.08695983886719,0
Dancers who hadn't concealed some hospital were discovering themselves.,Dancers who hadn't concealed some hospital were discovering itself.,syntax_semantics,binding,principle_A_c_command,True,True,False,False,230,-93.48173522949219,-95.3254623413086,1
Many museums that work with Mitchell couldn't help themselves.,Many museums that work with Mitchell couldn't help himself.,syntax_semantics,binding,principle_A_c_command,True,True,False,False,231,-60.9688720703125,-61.56004333496094,1
This museum that wasn't taking the mouths is talking to itself.,This museum that wasn't taking the mouths is talking to themselves.,syntax_semantics,binding,principle_A_c_command,True,True,False,False,232,-64.63616943359375,-61.95585250854492,0
Some guy that does help Laurie leaves himself.,Some guy that does help Laurie leaves herself.,syntax_semantics,binding,principle_A_c_command,True,True,False,False,233,-53.3468132019043,-54.367156982421875,1
Children that aren't irritating David might flee from themselves.,Children that aren't irritating David might flee from himself.,syntax_semantics,binding,principle_A_c_command,True,True,False,False,234,-62.32560729980469,-63.1264533996582,1
That actress that won't discover that plate watches herself.,That actress that won't discover that plate watches itself.,syntax_semantics,binding,principle_A_c_command,True,True,False,False,235,-71.43995666503906,-72.28782653808594,1
A lot of associations that will remember Ruth do work with themselves.,A lot of associations that will remember Ruth do work with herself.,syntax_semantics,binding,principle_A_c_command,True,True,False,False,236,-81.00654602050781,-82.59949493408203,1
The doors that haven't scared Amy wouldn't distract themselves.,The doors that haven't scared Amy wouldn't distract herself.,syntax_semantics,binding,principle_A_c_command,True,True,False,False,237,-70.93869018554688,-72.9181137084961,1
This company that wasn't talking to Heather talks about itself.,This company that wasn't talking to Heather talks about herself.,syntax_semantics,binding,principle_A_c_command,True,True,False,False,238,-59.794925689697266,-60.20575714111328,1
That dancer who thinks about a car isn't hugging herself.,That dancer who thinks about a car isn't hugging itself.,syntax_semantics,binding,principle_A_c_command,True,True,False,False,239,-71.702392578125,-73.67068481445312,1
These glasses that disturbed Bradley can't aggravate themselves.,These glasses that disturbed Bradley can't aggravate himself.,syntax_semantics,binding,principle_A_c_command,True,True,False,False,240,-72.71977233886719,-74.39555358886719,1
These guys who disturb Sarah criticized themselves.,These guys who disturb Sarah criticized herself.,syntax_semantics,binding,principle_A_c_command,True,True,False,False,241,-51.06303787231445,-53.001991271972656,1
Most waiters that were disagreeing with Omar hadn't respected themselves.,Most waiters that were disagreeing with Omar hadn't respected himself.,syntax_semantics,binding,principle_A_c_command,True,True,False,False,242,-98.4473876953125,-99.7152328491211,1
Teachers who brought that car wouldn't disagree with themselves.,Teachers who brought that car wouldn't disagree with itself.,syntax_semantics,binding,principle_A_c_command,True,True,False,False,243,-63.130218505859375,-66.12205505371094,1
All mushrooms that hurt William disgusted themselves.,All mushrooms that hurt William disgusted himself.,syntax_semantics,binding,principle_A_c_command,True,True,False,False,244,-61.1339225769043,-61.184627532958984,1
This mountain that would distract Heidi can stun itself.,This mountain that would distract Heidi can stun herself.,syntax_semantics,binding,principle_A_c_command,True,True,False,False,245,-78.21420288085938,-78.28558349609375,1
Most women who didn't disturb Stacey are investigating themselves.,Most women who didn't disturb Stacey are investigating herself.,syntax_semantics,binding,principle_A_c_command,True,True,False,False,246,-70.93814086914062,-73.29338073730469,1
Some girl who hasn't climbed up the hill wasn't watching herself.,Some girl who hasn't climbed up the hill wasn't watching itself.,syntax_semantics,binding,principle_A_c_command,True,True,False,False,247,-68.43488311767578,-69.75837707519531,1
Some waitress that hadn't cured Daniel flees from herself.,Some waitress that hadn't cured Daniel flees from himself.,syntax_semantics,binding,principle_A_c_command,True,True,False,False,248,-81.14447021484375,-80.18641662597656,0
Many committees that haven't sold this bicycle do talk to themselves.,Many committees that haven't sold this bicycle do talk to itself.,syntax_semantics,binding,principle_A_c_command,True,True,False,False,249,-72.99170684814453,-75.4412841796875,1
Those teenagers that didn't climb up a slope weren't disgusting themselves.,Those teenagers that didn't climb up a slope weren't disgusting itself.,syntax_semantics,binding,principle_A_c_command,True,True,False,False,250,-76.59098815917969,-78.44442749023438,1
A guy who scares some committees healed himself.,A guy who scares some committees healed themselves.,syntax_semantics,binding,principle_A_c_command,True,True,False,False,251,-71.8521728515625,-71.0199203491211,0
A lot of movie theaters that had bored Phillip aggravated themselves.,A lot of movie theaters that had bored Phillip aggravated himself.,syntax_semantics,binding,principle_A_c_command,True,True,False,False,252,-97.27760314941406,-97.49602508544922,1
Most girls that listen to Christopher have visited themselves.,Most girls that listen to Christopher have visited himself.,syntax_semantics,binding,principle_A_c_command,True,True,False,False,253,-58.36763381958008,-59.16510009765625,1
Some museums that shouldn't know George hadn't talked to themselves.,Some museums that shouldn't know George hadn't talked to himself.,syntax_semantics,binding,principle_A_c_command,True,True,False,False,254,-64.8388671875,-64.67167663574219,0
Some dancer who had dropped by a lot of movie theaters isn't working with herself.,Some dancer who had dropped by a lot of movie theaters isn't working with themselves.,syntax_semantics,binding,principle_A_c_command,True,True,False,False,255,-88.02093505859375,-86.60089874267578,0
That boy who had hated Paula attacks himself.,That boy who had hated Paula attacks herself.,syntax_semantics,binding,principle_A_c_command,True,True,False,False,256,-62.491207122802734,-63.27328109741211,1
Every high school that annoys Emily does impress itself.,Every high school that annoys Emily does impress herself.,syntax_semantics,binding,principle_A_c_command,True,True,False,False,257,-77.58512878417969,-76.95393371582031,0
Some bank that knows Patrick helps itself.,Some bank that knows Patrick helps himself.,syntax_semantics,binding,principle_A_c_command,True,True,False,False,258,-54.51173782348633,-51.964622497558594,0
Some students who walk through the library were curing themselves.,Some students who walk through the library were curing itself.,syntax_semantics,binding,principle_A_c_command,True,True,False,False,259,-57.16271209716797,-59.33128356933594,1
The wheelbarrows that should bore Sonia irritated themselves.,The wheelbarrows that should bore Sonia irritated herself.,syntax_semantics,binding,principle_A_c_command,True,True,False,False,260,-91.64701080322266,-93.67888641357422,1
The plates that have irritated Victoria were alarming themselves.,The plates that have irritated Victoria were alarming herself.,syntax_semantics,binding,principle_A_c_command,True,True,False,False,261,-74.88752746582031,-76.1552734375,1
Some picture that had hurt Elizabeth upset itself.,Some picture that had hurt Elizabeth upset herself.,syntax_semantics,binding,principle_A_c_command,True,True,False,False,262,-61.527015686035156,-60.81930923461914,0
This woman that had lifted some cats thought about herself.,This woman that had lifted some cats thought about themselves.,syntax_semantics,binding,principle_A_c_command,True,True,False,False,263,-65.25965881347656,-62.78994369506836,0
A lot of cashiers who go to a mountain admired themselves.,A lot of cashiers who go to a mountain admired itself.,syntax_semantics,binding,principle_A_c_command,True,True,False,False,264,-83.8811264038086,-83.4647445678711,0
Patients who might impress Laurie haven't hired themselves.,Patients who might impress Laurie haven't hired herself.,syntax_semantics,binding,principle_A_c_command,True,True,False,False,265,-81.68257141113281,-83.01875305175781,1
All associations that aren't boring Peter weren't discussing themselves.,All associations that aren't boring Peter weren't discussing himself.,syntax_semantics,binding,principle_A_c_command,True,True,False,False,266,-69.68518829345703,-71.14602661132812,1
All senators who could walk through this library hadn't cured themselves.,All senators who could walk through this library hadn't cured itself.,syntax_semantics,binding,principle_A_c_command,True,True,False,False,267,-83.94781494140625,-85.52481079101562,1
The association that doesn't embarrass Noah references itself.,The association that doesn't embarrass Noah references himself.,syntax_semantics,binding,principle_A_c_command,True,True,False,False,268,-65.26748657226562,-65.11264038085938,0
Some man that insults Kristin approached himself.,Some man that insults Kristin approached herself.,syntax_semantics,binding,principle_A_c_command,True,True,False,False,269,-69.25981903076172,-71.08013916015625,1
That actress who hurt a lot of women liked herself.,That actress who hurt a lot of women liked themselves.,syntax_semantics,binding,principle_A_c_command,True,True,False,False,270,-61.19594192504883,-59.77853012084961,0
Every organization that is boring Bill wouldn't fire itself.,Every organization that is boring Bill wouldn't fire himself.,syntax_semantics,binding,principle_A_c_command,True,True,False,False,271,-64.52222442626953,-61.68977355957031,0
The customers who could worry Sharon knew themselves.,The customers who could worry Sharon knew herself.,syntax_semantics,binding,principle_A_c_command,True,True,False,False,272,-60.43170166015625,-62.52439498901367,1
Some people who annoy William are watching themselves.,Some people who annoy William are watching himself.,syntax_semantics,binding,principle_A_c_command,True,True,False,False,273,-49.6397705078125,-49.906368255615234,1
All hospitals that scared Kirsten will reference themselves.,All hospitals that scared Kirsten will reference herself.,syntax_semantics,binding,principle_A_c_command,True,True,False,False,274,-70.47401428222656,-73.56681823730469,1
That boy that hated Pamela cares for himself.,That boy that hated Pamela cares for herself.,syntax_semantics,binding,principle_A_c_command,True,True,False,False,275,-64.50113677978516,-65.78719329833984,1
Every school that couldn't know Stacy describes itself.,Every school that couldn't know Stacy describes herself.,syntax_semantics,binding,principle_A_c_command,True,True,False,False,276,-61.02837371826172,-60.824222564697266,0
All waitresses who weren't hurting Jason might discover themselves.,All waitresses who weren't hurting Jason might discover himself.,syntax_semantics,binding,principle_A_c_command,True,True,False,False,277,-90.09347534179688,-90.44664764404297,1
Most customers who are impressing Laurie have found themselves.,Most customers who are impressing Laurie have found herself.,syntax_semantics,binding,principle_A_c_command,True,True,False,False,278,-71.6972427368164,-73.67294311523438,1
Some cars that embarrassed this boy aren't scaring themselves.,Some cars that embarrassed this boy aren't scaring himself.,syntax_semantics,binding,principle_A_c_command,True,True,False,False,279,-67.74662780761719,-68.45010375976562,1
Some carriage that isn't annoying Cheryl bored itself.,Some carriage that isn't annoying Cheryl bored herself.,syntax_semantics,binding,principle_A_c_command,True,True,False,False,280,-74.12725067138672,-74.66146850585938,1
Some cats that resemble that painting had impressed themselves.,Some cats that resemble that painting had impressed itself.,syntax_semantics,binding,principle_A_c_command,True,True,False,False,281,-66.94711303710938,-68.71246337890625,1
A lot of icicles that can confuse Alice haven't impressed themselves.,A lot of icicles that can confuse Alice haven't impressed herself.,syntax_semantics,binding,principle_A_c_command,True,True,False,False,282,-98.11116027832031,-99.64775085449219,1
The lady who has impressed Homer had discussed herself.,The lady who has impressed Homer had discussed himself.,syntax_semantics,binding,principle_A_c_command,True,True,False,False,283,-64.77009582519531,-62.95418167114258,0
All cashiers that had driven to the library hugged themselves.,All cashiers that had driven to the library hugged itself.,syntax_semantics,binding,principle_A_c_command,True,True,False,False,284,-80.10162353515625,-80.53594970703125,1
Some shawl that bored Mitchell is impressing itself.,Some shawl that bored Mitchell is impressing himself.,syntax_semantics,binding,principle_A_c_command,True,True,False,False,285,-90.41667175292969,-89.80992126464844,0
A lot of waiters who have broken a window might visit themselves.,A lot of waiters who have broken a window might visit itself.,syntax_semantics,binding,principle_A_c_command,True,True,False,False,286,-91.58257293701172,-94.49908447265625,1
These cakes that don't aggravate Ruth do scare themselves.,These cakes that don't aggravate Ruth do scare herself.,syntax_semantics,binding,principle_A_c_command,True,True,False,False,287,-74.35482025146484,-76.21088409423828,1
Pedestrians who hadn't loved Brian cured themselves.,Pedestrians who hadn't loved Brian cured himself.,syntax_semantics,binding,principle_A_c_command,True,True,False,False,288,-73.05818176269531,-72.4403076171875,0
Some doctors that aren't describing Thomas revealed themselves.,Some doctors that aren't describing Thomas revealed himself.,syntax_semantics,binding,principle_A_c_command,True,True,False,False,289,-58.44308090209961,-60.23676681518555,1
A lot of actors who haven't fired Theodore haven't respected themselves.,A lot of actors who haven't fired Theodore haven't respected himself.,syntax_semantics,binding,principle_A_c_command,True,True,False,False,290,-91.01846313476562,-91.1409912109375,1
Some drivers that hated Nicole knew themselves.,Some drivers that hated Nicole knew herself.,syntax_semantics,binding,principle_A_c_command,True,True,False,False,291,-57.493492126464844,-60.502803802490234,1
This waitress that drove to every river had hurt herself.,This waitress that drove to every river had hurt itself.,syntax_semantics,binding,principle_A_c_command,True,True,False,False,292,-74.6349868774414,-75.18719482421875,1
All committees that can't boast about Wayne don't irritate themselves.,All committees that can't boast about Wayne don't irritate himself.,syntax_semantics,binding,principle_A_c_command,True,True,False,False,293,-88.30431365966797,-89.37799072265625,1
Some man who had bought every fork referenced himself.,Some man who had bought every fork referenced itself.,syntax_semantics,binding,principle_A_c_command,True,True,False,False,294,-65.40972900390625,-66.28895568847656,1
An organization that could bore Tiffany helps itself.,An organization that could bore Tiffany helps herself.,syntax_semantics,binding,principle_A_c_command,True,True,False,False,295,-63.625633239746094,-64.73255157470703,1
The waitresses that concealed Karla disliked themselves.,The waitresses that concealed Karla disliked herself.,syntax_semantics,binding,principle_A_c_command,True,True,False,False,296,-83.42035675048828,-85.31222534179688,1
These guests that do notice Derek aren't boasting about themselves.,These guests that do notice Derek aren't boasting about himself.,syntax_semantics,binding,principle_A_c_command,True,True,False,False,297,-75.13909149169922,-77.31138610839844,1
Every museum that helped a man could hate itself.,Every museum that helped a man could hate himself.,syntax_semantics,binding,principle_A_c_command,True,True,False,False,298,-57.97490692138672,-55.962310791015625,0
A waitress that is messing up many glasses helped herself.,A waitress that is messing up many glasses helped themselves.,syntax_semantics,binding,principle_A_c_command,True,True,False,False,299,-85.61624145507812,-82.14630126953125,0
A commentary that was irritating these legislatures disagrees with itself.,A commentary that was irritating these legislatures disagrees with themselves.,syntax_semantics,binding,principle_A_c_command,True,True,False,False,300,-95.96871948242188,-93.43038940429688,0
The dancer who stunned Russell approached herself.,The dancer who stunned Russell approached himself.,syntax_semantics,binding,principle_A_c_command,True,True,False,False,301,-63.46793746948242,-61.56190872192383,0
A museum that has astounded Eva didn't hate itself.,A museum that has astounded Eva didn't hate herself.,syntax_semantics,binding,principle_A_c_command,True,True,False,False,302,-87.91461181640625,-87.98821258544922,1
The senators that had hugged Deanna cured themselves.,The senators that had hugged Deanna cured herself.,syntax_semantics,binding,principle_A_c_command,True,True,False,False,303,-78.68090057373047,-80.20243835449219,1
These banks that appreciated Derek referenced themselves.,These banks that appreciated Derek referenced himself.,syntax_semantics,binding,principle_A_c_command,True,True,False,False,304,-56.60684585571289,-57.525238037109375,1
All teachers who won't take some movie theater wouldn't complain about themselves.,All teachers who won't take some movie theater wouldn't complain about itself.,syntax_semantics,binding,principle_A_c_command,True,True,False,False,305,-80.76974487304688,-82.8427505493164,1
This rug that hadn't stunned the doctors embarrassed itself.,This rug that hadn't stunned the doctors embarrassed themselves.,syntax_semantics,binding,principle_A_c_command,True,True,False,False,306,-73.69300842285156,-71.96247863769531,0
Every library that was distracting Carol describes itself.,Every library that was distracting Carol describes herself.,syntax_semantics,binding,principle_A_c_command,True,True,False,False,307,-62.04358673095703,-62.201446533203125,1
The girls that stun Lucille would conceal themselves.,The girls that stun Lucille would conceal herself.,syntax_semantics,binding,principle_A_c_command,True,True,False,False,308,-69.25178527832031,-72.38218688964844,1
All teachers that scare some waitress noticed themselves.,All teachers that scare some waitress noticed herself.,syntax_semantics,binding,principle_A_c_command,True,True,False,False,309,-62.84391784667969,-66.43689727783203,1
All guests who could reveal Gerald haven't observed themselves.,All guests who could reveal Gerald haven't observed himself.,syntax_semantics,binding,principle_A_c_command,True,True,False,False,310,-73.45893859863281,-74.0477066040039,1
Some casserole that resembled the photographs can't disgust itself.,Some casserole that resembled the photographs can't disgust themselves.,syntax_semantics,binding,principle_A_c_command,True,True,False,False,311,-90.18997192382812,-88.7536849975586,0
Every school that hasn't confused Carrie helped itself.,Every school that hasn't confused Carrie helped herself.,syntax_semantics,binding,principle_A_c_command,True,True,False,False,312,-62.944732666015625,-61.08969497680664,0
Every girl who toured some hill loves herself.,Every girl who toured some hill loves itself.,syntax_semantics,binding,principle_A_c_command,True,True,False,False,313,-59.020957946777344,-60.58207702636719,1
All pedestrians that do embarrass Christine weren't revealing themselves.,All pedestrians that do embarrass Christine weren't revealing herself.,syntax_semantics,binding,principle_A_c_command,True,True,False,False,314,-77.54043579101562,-80.53070831298828,1
Some bicycle that looks like most sketches worried itself.,Some bicycle that looks like most sketches worried themselves.,syntax_semantics,binding,principle_A_c_command,True,True,False,False,315,-66.28204345703125,-65.46990203857422,0
Those actresses that were curing this dancer are escaping from themselves.,Those actresses that were curing this dancer are escaping from herself.,syntax_semantics,binding,principle_A_c_command,True,True,False,False,316,-76.86732482910156,-79.09176635742188,1
A guy who shouldn't forget all waitresses wasn't approaching himself.,A guy who shouldn't forget all waitresses wasn't approaching themselves.,syntax_semantics,binding,principle_A_c_command,True,True,False,False,317,-97.61036682128906,-97.98448181152344,1
Some committee that hasn't remembered Kimberley isn't criticizing itself.,Some committee that hasn't remembered Kimberley isn't criticizing herself.,syntax_semantics,binding,principle_A_c_command,True,True,False,False,318,-91.28486633300781,-91.16436767578125,0
Every waitress that exits a cafe escapes from herself.,Every waitress that exits a cafe escapes from itself.,syntax_semantics,binding,principle_A_c_command,True,True,False,False,319,-73.88911437988281,-71.3926010131836,0
A lot of legislatures that would reference that man have hired themselves.,A lot of legislatures that would reference that man have hired himself.,syntax_semantics,binding,principle_A_c_command,True,True,False,False,320,-85.2672119140625,-83.93739318847656,0
Most jackets that bothered Carlos had disgusted themselves.,Most jackets that bothered Carlos had disgusted himself.,syntax_semantics,binding,principle_A_c_command,True,True,False,False,321,-75.23696899414062,-75.54674530029297,1
Most waiters that see Daniel have forgotten themselves.,Most waiters that see Daniel have forgotten himself.,syntax_semantics,binding,principle_A_c_command,True,True,False,False,322,-71.26603698730469,-71.84288024902344,1
The dancer that embarrassed this committee thinks about herself.,The dancer that embarrassed this committee thinks about itself.,syntax_semantics,binding,principle_A_c_command,True,True,False,False,323,-70.00021362304688,-68.37496185302734,0
A dancer that researched this art gallery fled from herself.,A dancer that researched this art gallery fled from itself.,syntax_semantics,binding,principle_A_c_command,True,True,False,False,324,-97.83007049560547,-95.97676086425781,0
The men who bother Carlos haven't hired themselves.,The men who bother Carlos haven't hired himself.,syntax_semantics,binding,principle_A_c_command,True,True,False,False,325,-63.3637809753418,-64.09121704101562,1
Every actress who has bored a lot of teachers hasn't boasted about herself.,Every actress who has bored a lot of teachers hasn't boasted about themselves.,syntax_semantics,binding,principle_A_c_command,True,True,False,False,326,-84.7678451538086,-82.68770599365234,0
These people who hired Wayne don't complain about themselves.,These people who hired Wayne don't complain about himself.,syntax_semantics,binding,principle_A_c_command,True,True,False,False,327,-54.08631896972656,-55.66695022583008,1
