sentence_good,sentence_bad,field,linguistics_term,UID,simple_LM_method,one_prefix_method,two_prefix_method,lexically_identical,pair_id,good_prob,bad_prob,correct
Some ladies discovered there to be no commentaries about science winning.,Some ladies urge there to be no commentaries about science winning.,syntax_semantics,control_raising,existential_there_object_raising,True,False,True,False,472,-84.74615478515625,-86.29798126220703,1
The dancer could find there to be an actress finding the pasta.,The dancer could prod there to be an actress finding the pasta.,syntax_semantics,control_raising,existential_there_object_raising,True,False,True,False,473,-74.31962585449219,-88.69353485107422,1
Some children were expecting there to be some prints of George worrying Melinda.,Some children were tempting there to be some prints of George worrying Melinda.,syntax_semantics,control_raising,existential_there_object_raising,True,False,True,False,474,-90.07810974121094,-98.05384063720703,1
The teenagers judge there to be a grocery store scaring Ellen.,The teenagers force there to be a grocery store scaring Ellen.,syntax_semantics,control_raising,existential_there_object_raising,True,False,True,False,475,-83.06232452392578,-78.54379272460938,0
Nina isn't anticipating there to be a movie theater annoying the company.,Nina isn't spurring there to be a movie theater annoying the company.,syntax_semantics,control_raising,existential_there_object_raising,True,False,True,False,476,-95.03108978271484,-99.25955963134766,1
Lucille discovers there to be a book about Galileo vanishing.,Lucille pushed there to be a book about Galileo vanishing.,syntax_semantics,control_raising,existential_there_object_raising,True,False,True,False,477,-79.66136169433594,-79.95234680175781,1
Sara's nephews expect there to be bread alarming this waiter.,Sara's nephews obliged there to be bread alarming this waiter.,syntax_semantics,control_raising,existential_there_object_raising,True,False,True,False,478,-98.62847900390625,-102.27532958984375,1
The actor's daughters anticipate there to be a lot of fathers of Winston Churchill touring a hospital.,The actor's daughters pushed there to be a lot of fathers of Winston Churchill touring a hospital.,syntax_semantics,control_raising,existential_there_object_raising,True,False,True,False,479,-123.28120422363281,-116.20751953125,0
Guys' employees discover there to be a dancer liking to investigate those guests.,Guys' employees press there to be a dancer liking to investigate those guests.,syntax_semantics,control_raising,existential_there_object_raising,True,False,True,False,480,-103.85057067871094,-103.99258422851562,1
Julie isn't ascertaining there to be a niece of Scott preferring the lakes to melt.,Julie isn't forcing there to be a niece of Scott preferring the lakes to melt.,syntax_semantics,control_raising,existential_there_object_raising,True,False,True,False,481,-130.30447387695312,-111.86421203613281,0
A woman hadn't wanted there to be a newspaper article falling.,A woman hadn't pushed there to be a newspaper article falling.,syntax_semantics,control_raising,existential_there_object_raising,True,False,True,False,482,-81.8622817993164,-86.94924926757812,1
Deborah's supervisors ascertain there to be a rug disgusting Debra.,Deborah's supervisors pressured there to be a rug disgusting Debra.,syntax_semantics,control_raising,existential_there_object_raising,True,False,True,False,483,-106.04137420654297,-105.71678924560547,0
Kristin hasn't ascertained there to be a committee imploring Patrick to wave.,Kristin hasn't pushed there to be a committee imploring Patrick to wave.,syntax_semantics,control_raising,existential_there_object_raising,True,False,True,False,484,-123.28715515136719,-103.86720275878906,0
Amelia has found there to be a rug appearing.,Amelia has dared there to be a rug appearing.,syntax_semantics,control_raising,existential_there_object_raising,True,False,True,False,485,-61.34591293334961,-66.52294921875,1
The hospitals discover there to be fewer than three gates wasting away.,The hospitals induced there to be fewer than three gates wasting away.,syntax_semantics,control_raising,existential_there_object_raising,True,False,True,False,486,-84.44297790527344,-86.71980285644531,1
Most girls' fathers haven't anticipated there to be an actor appearing to disturb a lot of girls.,Most girls' fathers haven't begged there to be an actor appearing to disturb a lot of girls.,syntax_semantics,control_raising,existential_there_object_raising,True,False,True,False,487,-110.54716491699219,-108.06332397460938,0
Karen anticipates there to be a lot of stories about science embarrassing Peter.,Karen motivates there to be a lot of stories about science embarrassing Peter.,syntax_semantics,control_raising,existential_there_object_raising,True,False,True,False,488,-103.17759704589844,-105.1169662475586,1
Ella anticipated there to be spinach vanishing.,Ella sways there to be spinach vanishing.,syntax_semantics,control_raising,existential_there_object_raising,True,False,True,False,489,-74.3661880493164,-82.71255493164062,1
Martha's grandsons discover there to be a door disappearing.,Martha's grandsons induce there to be a door disappearing.,syntax_semantics,control_raising,existential_there_object_raising,True,False,True,False,490,-92.76117706298828,-95.08026123046875,1
Jennifer's grandmothers believe there to be a lot of grocery stores disturbing Wayne.,Jennifer's grandmothers convince there to be a lot of grocery stores disturbing Wayne.,syntax_semantics,control_raising,existential_there_object_raising,True,False,True,False,491,-91.27605438232422,-95.5884017944336,1
Most sons of Angela haven't judged there to be a book about Harvard University worrying many universities.,Most sons of Angela haven't asked there to be a book about Harvard University worrying many universities.,syntax_semantics,control_raising,existential_there_object_raising,True,False,True,False,492,-118.49058532714844,-114.02978515625,0
Lisa's handymen weren't finding there to be a chair falling apart.,Lisa's handymen weren't forcing there to be a chair falling apart.,syntax_semantics,control_raising,existential_there_object_raising,True,False,True,False,493,-86.35374450683594,-89.31975555419922,1
Wayne might expect there to be a book shocking Cynthia.,Wayne might tempt there to be a book shocking Cynthia.,syntax_semantics,control_raising,existential_there_object_raising,True,False,True,False,494,-76.1448745727539,-82.42378234863281,1
Gary declared there to be a scarf vanishing.,Gary ordered there to be a scarf vanishing.,syntax_semantics,control_raising,existential_there_object_raising,True,False,True,False,495,-53.31414031982422,-51.91786575317383,0
The patient's podiatrists wanted there to be few grocery stores boring Beth.,The patient's podiatrists tempt there to be few grocery stores boring Beth.,syntax_semantics,control_raising,existential_there_object_raising,True,False,True,False,496,-130.38107299804688,-139.5287628173828,1
Donna wasn't judging there to be a lot of books about travel alarming Margaret.,Donna wasn't requiring there to be a lot of books about travel alarming Margaret.,syntax_semantics,control_raising,existential_there_object_raising,True,False,True,False,497,-99.21826171875,-102.26624298095703,1
Amelia can ascertain there to be a painting of a lot of boxes alarming Tina.,Amelia can press there to be a painting of a lot of boxes alarming Tina.,syntax_semantics,control_raising,existential_there_object_raising,True,False,True,False,498,-105.69436645507812,-101.85357666015625,0
The nieces of Claire aren't preferring there to be a dancer refusing to notice Janet.,The nieces of Claire aren't tempting there to be a dancer refusing to notice Janet.,syntax_semantics,control_raising,existential_there_object_raising,True,False,True,False,499,-126.70306396484375,-127.42253112792969,1
The Lutherans' grandson did need there to be a screen falling.,The Lutherans' grandson did prod there to be a screen falling.,syntax_semantics,control_raising,existential_there_object_raising,True,False,True,False,500,-90.5081558227539,-101.38116455078125,1
Many women anticipate there to be an essay scaring these museums.,Many women force there to be an essay scaring these museums.,syntax_semantics,control_raising,existential_there_object_raising,True,False,True,False,501,-85.43800354003906,-76.23660278320312,0
Susan should ascertain there to be a lot of mushrooms alarming Kathleen.,Susan should tempt there to be a lot of mushrooms alarming Kathleen.,syntax_semantics,control_raising,existential_there_object_raising,True,False,True,False,502,-84.69966888427734,-83.89029693603516,0
Caroline's son wasn't believing there to be a bike shattering.,Caroline's son wasn't entreating there to be a bike shattering.,syntax_semantics,control_raising,existential_there_object_raising,True,False,True,False,503,-76.03802490234375,-89.937744140625,1
Lisa considered there to be many sisters of Clyde climbing up a lot of mountains.,Lisa obliges there to be many sisters of Clyde climbing up a lot of mountains.,syntax_semantics,control_raising,existential_there_object_raising,True,False,True,False,504,-91.56632995605469,-102.14713287353516,1
Tiffany can't ascertain there to be many hamsters climbing down the slopes.,Tiffany can't pressure there to be many hamsters climbing down the slopes.,syntax_semantics,control_raising,existential_there_object_raising,True,False,True,False,505,-110.91535186767578,-108.06838989257812,0
Lucille was wanting there to be a ladder distracting a student.,Lucille was spurring there to be a ladder distracting a student.,syntax_semantics,control_raising,existential_there_object_raising,True,False,True,False,506,-71.22305297851562,-87.2697982788086,1
Candice wants there to be a lot of companies admiring a student.,Candice swayed there to be a lot of companies admiring a student.,syntax_semantics,control_raising,existential_there_object_raising,True,False,True,False,507,-78.01126861572266,-86.45112609863281,1
The daughter of Chad shouldn't discover there to be a friend of Jacqueline looking like some drawings.,The daughter of Chad shouldn't tempt there to be a friend of Jacqueline looking like some drawings.,syntax_semantics,control_raising,existential_there_object_raising,True,False,True,False,508,-120.60295867919922,-123.23931121826172,1
A lot of waiters' ex-husbands consider there to be blouses stretching.,A lot of waiters' ex-husbands motivate there to be blouses stretching.,syntax_semantics,control_raising,existential_there_object_raising,True,False,True,False,509,-142.73085021972656,-148.03170776367188,1
A lot of waitresses' supervisors were needing there to be a company annoying those waitresses.,A lot of waitresses' supervisors were motivating there to be a company annoying those waitresses.,syntax_semantics,control_raising,existential_there_object_raising,True,False,True,False,510,-146.30877685546875,-154.1990203857422,1
Some women had considered there to be horses upsetting Beth.,Some women had badgered there to be horses upsetting Beth.,syntax_semantics,control_raising,existential_there_object_raising,True,False,True,False,511,-70.30950927734375,-83.71528625488281,1
Kevin's dentist judged there to be a niece of Kristen hiding away.,Kevin's dentist prodded there to be a niece of Kristen hiding away.,syntax_semantics,control_raising,existential_there_object_raising,True,False,True,False,512,-94.37264251708984,-108.20281219482422,1
Carrie needs there to be a vase aggravating Stephen.,Carrie encourages there to be a vase aggravating Stephen.,syntax_semantics,control_raising,existential_there_object_raising,True,False,True,False,513,-84.50467681884766,-89.08726501464844,1
Denise judges there to be more than three prints distracting these actresses.,Denise spurs there to be more than three prints distracting these actresses.,syntax_semantics,control_raising,existential_there_object_raising,True,False,True,False,514,-90.05297088623047,-94.34880065917969,1
Tina ascertains there to be a grocery store scaring that man.,Tina sways there to be a grocery store scaring that man.,syntax_semantics,control_raising,existential_there_object_raising,True,False,True,False,515,-106.54791259765625,-99.5369644165039,0
A grandfather of Danielle is declaring there to be some jackets tightening.,A grandfather of Danielle is compelling there to be some jackets tightening.,syntax_semantics,control_raising,existential_there_object_raising,True,False,True,False,516,-104.72576141357422,-104.05198669433594,0
That senator did prefer there to be steak distracting Regina.,That senator did convince there to be steak distracting Regina.,syntax_semantics,control_raising,existential_there_object_raising,True,False,True,False,517,-87.65904998779297,-88.31661987304688,1
Women have predicted there to be some coats vanishing.,Women have required there to be some coats vanishing.,syntax_semantics,control_raising,existential_there_object_raising,True,False,True,False,518,-56.44162368774414,-54.29072570800781,0
Judy's associate didn't anticipate there to be a car aggravating Patricia.,Judy's associate didn't urge there to be a car aggravating Patricia.,syntax_semantics,control_raising,existential_there_object_raising,True,False,True,False,519,-98.49605560302734,-94.08497619628906,0
Denise considers there to be a nose impressing Theresa.,Denise commissions there to be a nose impressing Theresa.,syntax_semantics,control_raising,existential_there_object_raising,True,False,True,False,520,-76.0787124633789,-81.10197448730469,1
All committees anticipate there to be dresses fraying.,All committees pressured there to be dresses fraying.,syntax_semantics,control_raising,existential_there_object_raising,True,False,True,False,521,-78.69884490966797,-78.4866943359375,0
Homer discovers there to be some dogs stunning the students.,Homer pressures there to be some dogs stunning the students.,syntax_semantics,control_raising,existential_there_object_raising,True,False,True,False,522,-87.81781768798828,-88.69157409667969,1
That lady isn't preferring there to be a pie stunning Cindy.,That lady isn't obligating there to be a pie stunning Cindy.,syntax_semantics,control_raising,existential_there_object_raising,True,False,True,False,523,-86.19695281982422,-90.43797302246094,1
These children want there to be an eye irritating Beverly.,These children badger there to be an eye irritating Beverly.,syntax_semantics,control_raising,existential_there_object_raising,True,False,True,False,524,-62.83615493774414,-83.50481414794922,1
Clyde judges there to be few hamsters disturbing Dennis.,Clyde spurs there to be few hamsters disturbing Dennis.,syntax_semantics,control_raising,existential_there_object_raising,True,False,True,False,525,-112.32229614257812,-115.19116973876953,1
Many sisters of Peter found there to be a lot of books about Winston Churchill disagreeing.,Many sisters of Peter compel there to be a lot of books about Winston Churchill disagreeing.,syntax_semantics,control_raising,existential_there_object_raising,True,False,True,False,526,-109.73490905761719,-118.95995330810547,1
Some library prefers there to be few skirts appearing.,Some library pressured there to be few skirts appearing.,syntax_semantics,control_raising,existential_there_object_raising,True,False,True,False,527,-68.28807830810547,-73.98037719726562,1
A grandson of Rose doesn't consider there to be a woman intending to drop by a lot of restaurants.,A grandson of Rose doesn't beg there to be a woman intending to drop by a lot of restaurants.,syntax_semantics,control_raising,existential_there_object_raising,True,False,True,False,528,-117.27533721923828,-121.07166290283203,1
Jane discovered there to be some photographs of the child boring Kayla.,Jane prods there to be some photographs of the child boring Kayla.,syntax_semantics,control_raising,existential_there_object_raising,True,False,True,False,529,-81.11092376708984,-95.54106140136719,1
Sherry's lawyer is wanting there to be few bikes confusing Denise.,Sherry's lawyer is pressing there to be few bikes confusing Denise.,syntax_semantics,control_raising,existential_there_object_raising,True,False,True,False,530,-101.56121826171875,-105.39118957519531,1
Wayne would find there to be some cousins of Jill weeping.,Wayne would entreat there to be some cousins of Jill weeping.,syntax_semantics,control_raising,existential_there_object_raising,True,False,True,False,531,-79.9876480102539,-96.24229431152344,1
These banks predict there to be more than three documentaries disagreeing.,These banks ask there to be more than three documentaries disagreeing.,syntax_semantics,control_raising,existential_there_object_raising,True,False,True,False,532,-86.45028686523438,-80.30006408691406,0
These legislatures declared there to be a unicycle looking like that drawing.,These legislatures force there to be a unicycle looking like that drawing.,syntax_semantics,control_raising,existential_there_object_raising,True,False,True,False,533,-90.11200714111328,-87.34426879882812,0
Kendra anticipates there to be many photographs boring Anna.,Kendra motivates there to be many photographs boring Anna.,syntax_semantics,control_raising,existential_there_object_raising,True,False,True,False,534,-103.13005828857422,-105.37862396240234,1
This bank needs there to be rice confusing Wendy.,This bank asks there to be rice confusing Wendy.,syntax_semantics,control_raising,existential_there_object_raising,True,False,True,False,535,-67.3110122680664,-71.22628021240234,1
Christina was judging there to be a couch alarming Monet.,Christina was tempting there to be a couch alarming Monet.,syntax_semantics,control_raising,existential_there_object_raising,True,False,True,False,536,-83.67793273925781,-84.37176513671875,1
Diana isn't preferring there to be a friend of Walter climbing down all stairs.,Diana isn't tempting there to be a friend of Walter climbing down all stairs.,syntax_semantics,control_raising,existential_there_object_raising,True,False,True,False,537,-109.50669860839844,-108.57501983642578,0
Victoria can consider there to be a photograph of Carolyn impressing Katherine.,Victoria can prod there to be a photograph of Carolyn impressing Katherine.,syntax_semantics,control_raising,existential_there_object_raising,True,False,True,False,538,-89.36968994140625,-97.3049545288086,1
That woman expects there to be a vase distracting Derek.,That woman dared there to be a vase distracting Derek.,syntax_semantics,control_raising,existential_there_object_raising,True,False,True,False,539,-81.19156646728516,-82.65554809570312,1
The Borgias wouldn't believe there to be few pedestrians hoping to reunite.,The Borgias wouldn't order there to be few pedestrians hoping to reunite.,syntax_semantics,control_raising,existential_there_object_raising,True,False,True,False,540,-112.97222900390625,-115.7049560546875,1
Deborah hasn't predicted there to be many glasses shocking this museum.,Deborah hasn't advised there to be many glasses shocking this museum.,syntax_semantics,control_raising,existential_there_object_raising,True,False,True,False,541,-88.82637023925781,-89.37016296386719,1
Stephanie does predict there to be a painting of Martha falling.,Stephanie does beg there to be a painting of Martha falling.,syntax_semantics,control_raising,existential_there_object_raising,True,False,True,False,542,-87.28201293945312,-86.39556884765625,0
Stephanie has ascertained there to be more than three people conspiring.,Stephanie has prodded there to be more than three people conspiring.,syntax_semantics,control_raising,existential_there_object_raising,True,False,True,False,543,-88.8079833984375,-85.62471008300781,0
Richard's mothers declare there to be a blouse falling.,Richard's mothers encouraged there to be a blouse falling.,syntax_semantics,control_raising,existential_there_object_raising,True,False,True,False,544,-73.49628448486328,-69.89958953857422,0
Grace hadn't needed there to be a wheelbarrow stopping.,Grace hadn't forced there to be a wheelbarrow stopping.,syntax_semantics,control_raising,existential_there_object_raising,True,False,True,False,545,-84.02519226074219,-85.08824157714844,1
Catherine wasn't finding there to be a shawl shrinking.,Catherine wasn't enticing there to be a shawl shrinking.,syntax_semantics,control_raising,existential_there_object_raising,True,False,True,False,546,-87.40554809570312,-95.72505187988281,1
A woman ascertained there to be a customer complaining.,A woman encourages there to be a customer complaining.,syntax_semantics,control_raising,existential_there_object_raising,True,False,True,False,547,-88.34583282470703,-71.38555145263672,0
The Clintons prefer there to be universities selling the icicle.,The Clintons require there to be universities selling the icicle.,syntax_semantics,control_raising,existential_there_object_raising,True,False,True,False,548,-89.80339050292969,-87.26797485351562,0
Tammy declared there to be customers leaving.,Tammy advises there to be customers leaving.,syntax_semantics,control_raising,existential_there_object_raising,True,False,True,False,549,-51.75254821777344,-53.91230773925781,1
Vincent's fathers discovered there to be a chair cracking.,Vincent's fathers oblige there to be a chair cracking.,syntax_semantics,control_raising,existential_there_object_raising,True,False,True,False,550,-85.18280792236328,-96.74727630615234,1
Kendra's mentors hadn't believed there to be steak worrying the Clintons.,Kendra's mentors hadn't convinced there to be steak worrying the Clintons.,syntax_semantics,control_raising,existential_there_object_raising,True,False,True,False,551,-123.09729766845703,-126.01429748535156,1
Some actresses find there to be a guest regretting the Borgias are talking.,Some actresses order there to be a guest regretting the Borgias are talking.,syntax_semantics,control_raising,existential_there_object_raising,True,False,True,False,552,-113.14334106445312,-112.02323913574219,0
Homer hadn't declared there to be few shawls warping.,Homer hadn't swayed there to be few shawls warping.,syntax_semantics,control_raising,existential_there_object_raising,True,False,True,False,553,-108.15901184082031,-113.45318603515625,1
The analyses expected there to be spotlights disappearing.,The analyses obligate there to be spotlights disappearing.,syntax_semantics,control_raising,existential_there_object_raising,True,False,True,False,554,-78.18595123291016,-86.86819458007812,1
Benjamin's podiatrists judge there to be a bike falling apart.,Benjamin's podiatrists required there to be a bike falling apart.,syntax_semantics,control_raising,existential_there_object_raising,True,False,True,False,555,-109.87318420410156,-105.81297302246094,0
Sheila's podiatrist had believed there to be a muffin confusing Matt.,Sheila's podiatrist had prompted there to be a muffin confusing Matt.,syntax_semantics,control_raising,existential_there_object_raising,True,False,True,False,556,-120.54776000976562,-125.77900695800781,1
Curtis's cousins were ascertaining there to be a lot of forks vanishing.,Curtis's cousins were entreating there to be a lot of forks vanishing.,syntax_semantics,control_raising,existential_there_object_raising,True,False,True,False,557,-120.30734252929688,-116.58250427246094,0
Michael won't want there to be fewer than three men healing Derek.,Michael won't badger there to be fewer than three men healing Derek.,syntax_semantics,control_raising,existential_there_object_raising,True,False,True,False,558,-78.56773376464844,-94.8364028930664,1
Kenneth considered there to be no museums boring Debra.,Kenneth badgered there to be no museums boring Debra.,syntax_semantics,control_raising,existential_there_object_raising,True,False,True,False,559,-78.50355529785156,-93.33984375,1
Grace doesn't need there to be few computers annoying Wayne.,Grace doesn't motivate there to be few computers annoying Wayne.,syntax_semantics,control_raising,existential_there_object_raising,True,False,True,False,560,-75.71595764160156,-86.54059600830078,1
Many ladies hadn't anticipated there to be some waitresses disturbing Mitchell.,Many ladies hadn't prompted there to be some waitresses disturbing Mitchell.,syntax_semantics,control_raising,existential_there_object_raising,True,False,True,False,561,-102.29472351074219,-103.22943115234375,1
Renee isn't predicting there to be cafes annoying Larry.,Renee isn't enticing there to be cafes annoying Larry.,syntax_semantics,control_raising,existential_there_object_raising,True,False,True,False,562,-92.14623260498047,-91.23947143554688,0
The Borgias found there to be a candle disgusting Alicia.,The Borgias oblige there to be a candle disgusting Alicia.,syntax_semantics,control_raising,existential_there_object_raising,True,False,True,False,563,-88.45574951171875,-102.80782318115234,1
Rachel discovered there to be a high school existing.,Rachel advises there to be a high school existing.,syntax_semantics,control_raising,existential_there_object_raising,True,False,True,False,564,-49.138893127441406,-51.988250732421875,1
Becky's nephew isn't expecting there to be many plates bothering Rose.,Becky's nephew isn't requiring there to be many plates bothering Rose.,syntax_semantics,control_raising,existential_there_object_raising,True,False,True,False,565,-83.1338119506836,-93.08575439453125,1
Guy has considered there to be a mall impressing Winston Churchill.,Guy has prodded there to be a mall impressing Winston Churchill.,syntax_semantics,control_raising,existential_there_object_raising,True,False,True,False,566,-81.69309997558594,-98.79606628417969,1
Kimberley's grandmothers consider there to be no books about the Balkans disappearing.,Kimberley's grandmothers urge there to be no books about the Balkans disappearing.,syntax_semantics,control_raising,existential_there_object_raising,True,False,True,False,567,-113.0882568359375,-114.572265625,1
