sentence_good,sentence_bad,field,linguistics_term,UID,simple_LM_method,one_prefix_method,two_prefix_method,lexically_identical,pair_id,good_prob,bad_prob,correct
Some waiters broke this lost foot.,Some waiters broke this lost feet.,morphology,determiner_noun_agreement,determiner_noun_agreement_with_adj_irregular_1,True,True,False,True,0,-58.88471984863281,-59.144981384277344,1
The company talks about those big women.,The company talks about those big woman.,morphology,determiner_noun_agreement,determiner_noun_agreement_with_adj_irregular_1,True,True,False,True,1,-33.82655334472656,-35.158790588378906,1
This blouse astounds this lost woman.,This blouse astounds this lost women.,morphology,determiner_noun_agreement,determiner_noun_agreement_with_adj_irregular_1,True,True,False,True,2,-70.04745483398438,-69.43402099609375,0
David wasn't kissing these standing children.,David wasn't kissing these standing child.,morphology,determiner_noun_agreement,determiner_noun_agreement_with_adj_irregular_1,True,True,False,True,3,-49.00788879394531,-48.837974548339844,0
This person shouldn't criticize this upset child.,This person shouldn't criticize this upset children.,morphology,determiner_noun_agreement,determiner_noun_agreement_with_adj_irregular_1,True,True,False,True,4,-53.096405029296875,-52.80638885498047,0
These tomatoes astound that concealed person.,These tomatoes astound that concealed people.,morphology,determiner_noun_agreement,determiner_noun_agreement_with_adj_irregular_1,True,True,False,True,5,-63.15717697143555,-60.23407745361328,0
Sally hasn't cleaned these white oxen.,Sally hasn't cleaned these white ox.,morphology,determiner_noun_agreement,determiner_noun_agreement_with_adj_irregular_1,True,True,False,True,6,-65.24760437011719,-62.2908935546875,0
These doors would astound those happy children.,These doors would astound those happy child.,morphology,determiner_noun_agreement,determiner_noun_agreement_with_adj_irregular_1,True,True,False,True,7,-58.595489501953125,-59.822513580322266,1
Katherine is biking to these red oases.,Katherine is biking to these red oasis.,morphology,determiner_noun_agreement,determiner_noun_agreement_with_adj_irregular_1,True,True,False,True,8,-70.80464172363281,-67.8143081665039,0
Katherine hadn't praised this lost man.,Katherine hadn't praised this lost men.,morphology,determiner_noun_agreement,determiner_noun_agreement_with_adj_irregular_1,True,True,False,True,9,-62.79642105102539,-63.724056243896484,1
The driver sees that unlucky person.,The driver sees that unlucky people.,morphology,determiner_noun_agreement,determiner_noun_agreement_with_adj_irregular_1,True,True,False,True,10,-41.46635437011719,-39.99251174926758,0
Edward hadn't described this nice woman.,Edward hadn't described this nice women.,morphology,determiner_noun_agreement,determiner_noun_agreement_with_adj_irregular_1,True,True,False,True,11,-42.45561981201172,-43.37290573120117,1
Heidi returns to that big woman.,Heidi returns to that big women.,morphology,determiner_noun_agreement,determiner_noun_agreement_with_adj_irregular_1,True,True,False,True,12,-43.57163619995117,-45.55109786987305,1
Sara listened to that unconvinced person.,Sara listened to that unconvinced people.,morphology,determiner_noun_agreement,determiner_noun_agreement_with_adj_irregular_1,True,True,False,True,13,-80.80880737304688,-77.69926452636719,0
Samuel had listened to these concealed people.,Samuel had listened to these concealed person.,morphology,determiner_noun_agreement,determiner_noun_agreement_with_adj_irregular_1,True,True,False,True,14,-47.2864990234375,-51.331947326660156,1
Richard flees from those unconvinced men.,Richard flees from those unconvinced man.,morphology,determiner_noun_agreement,determiner_noun_agreement_with_adj_irregular_1,True,True,False,True,15,-71.53598022460938,-72.34855651855469,1
Monica is cleaning that hidden axis.,Monica is cleaning that hidden axes.,morphology,determiner_noun_agreement,determiner_noun_agreement_with_adj_irregular_1,True,True,False,True,16,-51.3596305847168,-53.965328216552734,1
Veronica does break those hard teeth.,Veronica does break those hard tooth.,morphology,determiner_noun_agreement,determiner_noun_agreement_with_adj_irregular_1,True,True,False,True,17,-45.98381042480469,-47.99262237548828,1
Rachel drove to those blue oases.,Rachel drove to those blue oasis.,morphology,determiner_noun_agreement,determiner_noun_agreement_with_adj_irregular_1,True,True,False,True,18,-50.78057861328125,-48.13814926147461,0
These cashiers do break this whole tooth.,These cashiers do break this whole teeth.,morphology,determiner_noun_agreement,determiner_noun_agreement_with_adj_irregular_1,True,True,False,True,19,-52.911155700683594,-52.80119705200195,0
Rose dislikes this bad synopsis.,Rose dislikes this bad synopses.,morphology,determiner_noun_agreement,determiner_noun_agreement_with_adj_irregular_1,True,True,False,True,20,-61.274139404296875,-73.18441772460938,1
Becky had fixed this hard foot.,Becky had fixed this hard feet.,morphology,determiner_noun_agreement,determiner_noun_agreement_with_adj_irregular_1,True,True,False,True,21,-41.27478790283203,-40.654396057128906,0
Gerald questioned those unconvinced men.,Gerald questioned those unconvinced man.,morphology,determiner_noun_agreement,determiner_noun_agreement_with_adj_irregular_1,True,True,False,True,22,-80.40326690673828,-80.72164916992188,1
Stacy doesn't impress this determined person.,Stacy doesn't impress this determined people.,morphology,determiner_noun_agreement,determiner_noun_agreement_with_adj_irregular_1,True,True,False,True,23,-58.9188346862793,-56.94927215576172,0
Nina won't run around this smooth oasis.,Nina won't run around this smooth oases.,morphology,determiner_noun_agreement,determiner_noun_agreement_with_adj_irregular_1,True,True,False,True,24,-71.12773132324219,-73.98806762695312,1
That committee works with those out in the open women.,That committee works with those out in the open woman.,morphology,determiner_noun_agreement,determiner_noun_agreement_with_adj_irregular_1,True,True,False,True,25,-61.87364959716797,-63.740989685058594,1
Most teenagers had complained about these scared men.,Most teenagers had complained about these scared man.,morphology,determiner_noun_agreement,determiner_noun_agreement_with_adj_irregular_1,True,True,False,True,26,-54.62801742553711,-56.552650451660156,1
Bill cures those unsure alumni.,Bill cures those unsure alumnus.,morphology,determiner_noun_agreement,determiner_noun_agreement_with_adj_irregular_1,True,True,False,True,27,-52.948184967041016,-67.81721496582031,1
Derek walked through this smooth oasis.,Derek walked through this smooth oases.,morphology,determiner_noun_agreement,determiner_noun_agreement_with_adj_irregular_1,True,True,False,True,28,-65.43260192871094,-68.23880004882812,1
Some waiters work with this hidden person.,Some waiters work with this hidden people.,morphology,determiner_noun_agreement,determiner_noun_agreement_with_adj_irregular_1,True,True,False,True,29,-56.05226516723633,-56.167144775390625,1
Dennis hasn't healed these unconvinced women.,Dennis hasn't healed these unconvinced woman.,morphology,determiner_noun_agreement,determiner_noun_agreement_with_adj_irregular_1,True,True,False,True,30,-93.57157897949219,-95.07476806640625,1
Kathleen has this exposed thesis.,Kathleen has this exposed theses.,morphology,determiner_noun_agreement,determiner_noun_agreement_with_adj_irregular_1,True,True,False,True,31,-59.0927734375,-65.52354431152344,1
Sheila loved those determined people.,Sheila loved those determined person.,morphology,determiner_noun_agreement,determiner_noun_agreement_with_adj_irregular_1,True,True,False,True,32,-39.24225616455078,-42.55738830566406,1
Guy has toured this green oasis.,Guy has toured this green oases.,morphology,determiner_noun_agreement,determiner_noun_agreement_with_adj_irregular_1,True,True,False,True,33,-50.357574462890625,-52.94815444946289,1
Some senators go to that purple oasis.,Some senators go to that purple oases.,morphology,determiner_noun_agreement,determiner_noun_agreement_with_adj_irregular_1,True,True,False,True,34,-58.4704475402832,-61.02436065673828,1
Anna should scan that bad analysis.,Anna should scan that bad analyses.,morphology,determiner_noun_agreement,determiner_noun_agreement_with_adj_irregular_1,True,True,False,True,35,-41.19020462036133,-48.35988998413086,1
Most waitresses notice that red stimulus.,Most waitresses notice that red stimuli.,morphology,determiner_noun_agreement,determiner_noun_agreement_with_adj_irregular_1,True,True,False,True,36,-62.012229919433594,-62.240234375,1
Diana cured those standing alumni.,Diana cured those standing alumnus.,morphology,determiner_noun_agreement,determiner_noun_agreement_with_adj_irregular_1,True,True,False,True,37,-66.99334716796875,-80.57192993164062,1
Ronald discussed that nice man.,Ronald discussed that nice men.,morphology,determiner_noun_agreement,determiner_noun_agreement_with_adj_irregular_1,True,True,False,True,38,-42.799415588378906,-43.17931365966797,1
Tonya won't buy that brown oasis.,Tonya won't buy that brown oases.,morphology,determiner_noun_agreement,determiner_noun_agreement_with_adj_irregular_1,True,True,False,True,39,-53.10797882080078,-54.857234954833984,1
Marie argued about that good synopsis.,Marie argued about that good synopses.,morphology,determiner_noun_agreement,determiner_noun_agreement_with_adj_irregular_1,True,True,False,True,40,-47.88506317138672,-59.16002655029297,1
Bradley wasn't skated around that out in the open oasis.,Bradley wasn't skated around that out in the open oases.,morphology,determiner_noun_agreement,determiner_noun_agreement_with_adj_irregular_1,True,True,False,True,41,-77.88834381103516,-80.19035339355469,1
Jacqueline wasn't finding that hidden man.,Jacqueline wasn't finding that hidden men.,morphology,determiner_noun_agreement,determiner_noun_agreement_with_adj_irregular_1,True,True,False,True,42,-54.686485290527344,-55.905311584472656,1
Most commentaries hadn't impressed those clever men.,Most commentaries hadn't impressed those clever man.,morphology,determiner_noun_agreement,determiner_noun_agreement_with_adj_irregular_1,True,True,False,True,43,-67.53199768066406,-68.51443481445312,1
Bruce has worked with this lost child.,Bruce has worked with this lost children.,morphology,determiner_noun_agreement,determiner_noun_agreement_with_adj_irregular_1,True,True,False,True,44,-36.448997497558594,-37.65902328491211,1
Karla exits these orange oases.,Karla exits these orange oasis.,morphology,determiner_noun_agreement,determiner_noun_agreement_with_adj_irregular_1,True,True,False,True,45,-61.80729675292969,-60.23726272583008,0
Joseph doesn't sound like these hard theses.,Joseph doesn't sound like these hard thesis.,morphology,determiner_noun_agreement,determiner_noun_agreement_with_adj_irregular_1,True,True,False,True,46,-54.889686584472656,-45.24643325805664,0
Martha had talked to that out in the open person.,Martha had talked to that out in the open people.,morphology,determiner_noun_agreement,determiner_noun_agreement_with_adj_irregular_1,True,True,False,True,47,-56.81621551513672,-55.93927001953125,0
The vase impresses that excited woman.,The vase impresses that excited women.,morphology,determiner_noun_agreement,determiner_noun_agreement_with_adj_irregular_1,True,True,False,True,48,-67.87420654296875,-67.48933410644531,0
Kevin cleans this purple foot.,Kevin cleans this purple feet.,morphology,determiner_noun_agreement,determiner_noun_agreement_with_adj_irregular_1,True,True,False,True,49,-35.330379486083984,-34.876075744628906,0
Sheila could observe this big woman.,Sheila could observe this big women.,morphology,determiner_noun_agreement,determiner_noun_agreement_with_adj_irregular_1,True,True,False,True,50,-45.9725341796875,-48.829437255859375,1
Lisa hugs that young man.,Lisa hugs that young men.,morphology,determiner_noun_agreement,determiner_noun_agreement_with_adj_irregular_1,True,True,False,True,51,-33.32829284667969,-34.842472076416016,1
This waitress explores these black oases.,This waitress explores these black oasis.,morphology,determiner_noun_agreement,determiner_noun_agreement_with_adj_irregular_1,True,True,False,True,52,-64.70262145996094,-62.259822845458984,0
Janet boasts about that fast person.,Janet boasts about that fast people.,morphology,determiner_noun_agreement,determiner_noun_agreement_with_adj_irregular_1,True,True,False,True,53,-51.98947525024414,-50.70148468017578,0
Scott won't confuse these big people.,Scott won't confuse these big person.,morphology,determiner_noun_agreement,determiner_noun_agreement_with_adj_irregular_1,True,True,False,True,54,-37.53900909423828,-40.73640441894531,1
The movie theater was impressing that sick woman.,The movie theater was impressing that sick women.,morphology,determiner_noun_agreement,determiner_noun_agreement_with_adj_irregular_1,True,True,False,True,55,-60.58226013183594,-61.462158203125,1
Every carriage hadn't annoyed this sick alumnus.,Every carriage hadn't annoyed this sick alumni.,morphology,determiner_noun_agreement,determiner_noun_agreement_with_adj_irregular_1,True,True,False,True,56,-82.25677490234375,-65.95124816894531,0
Ronald hadn't discussed those scared people.,Ronald hadn't discussed those scared person.,morphology,determiner_noun_agreement,determiner_noun_agreement_with_adj_irregular_1,True,True,False,True,57,-48.51793670654297,-50.62210464477539,1
This hair upsets this determined alumnus.,This hair upsets this determined alumni.,morphology,determiner_noun_agreement,determiner_noun_agreement_with_adj_irregular_1,True,True,False,True,58,-77.97946166992188,-63.877532958984375,0
Some men have lifted those exposed lice.,Some men have lifted those exposed louse.,morphology,determiner_noun_agreement,determiner_noun_agreement_with_adj_irregular_1,True,True,False,True,59,-58.39134216308594,-56.89204406738281,0
Matt was criticizing that smart man.,Matt was criticizing that smart men.,morphology,determiner_noun_agreement,determiner_noun_agreement_with_adj_irregular_1,True,True,False,True,60,-42.057071685791016,-43.27570343017578,1
Karen didn't buy this blue nucleus.,Karen didn't buy this blue nuclei.,morphology,determiner_noun_agreement,determiner_noun_agreement_with_adj_irregular_1,True,True,False,True,61,-52.99441909790039,-62.45171356201172,1
Deanna might dislike this good analysis.,Deanna might dislike this good analyses.,morphology,determiner_noun_agreement,determiner_noun_agreement_with_adj_irregular_1,True,True,False,True,62,-51.71432876586914,-57.73115539550781,1
Helen approached this busy woman.,Helen approached this busy women.,morphology,determiner_noun_agreement,determiner_noun_agreement_with_adj_irregular_1,True,True,False,True,63,-43.88915252685547,-45.67393493652344,1
Florence wasn't approaching this unconvinced woman.,Florence wasn't approaching this unconvinced women.,morphology,determiner_noun_agreement,determiner_noun_agreement_with_adj_irregular_1,True,True,False,True,64,-90.50194549560547,-91.09944152832031,1
Rachelle can't appreciate those good synopses.,Rachelle can't appreciate those good synopsis.,morphology,determiner_noun_agreement,determiner_noun_agreement_with_adj_irregular_1,True,True,False,True,65,-68.3858871459961,-57.82535934448242,0
Jennifer hadn't thought about these out in the open octopi.,Jennifer hadn't thought about these out in the open octopus.,morphology,determiner_noun_agreement,determiner_noun_agreement_with_adj_irregular_1,True,True,False,True,66,-69.68174743652344,-64.08844757080078,0
Larry described these delighted children.,Larry described these delighted child.,morphology,determiner_noun_agreement,determiner_noun_agreement_with_adj_irregular_1,True,True,False,True,67,-36.98371124267578,-38.196502685546875,1
Many ladies arrive at that black oasis.,Many ladies arrive at that black oases.,morphology,determiner_noun_agreement,determiner_noun_agreement_with_adj_irregular_1,True,True,False,True,68,-51.498146057128906,-54.94098663330078,1
Sally admires those fast women.,Sally admires those fast woman.,morphology,determiner_noun_agreement,determiner_noun_agreement_with_adj_irregular_1,True,True,False,True,69,-66.99649047851562,-67.87162780761719,1
Leslie wouldn't investigate that sick woman.,Leslie wouldn't investigate that sick women.,morphology,determiner_noun_agreement,determiner_noun_agreement_with_adj_irregular_1,True,True,False,True,70,-55.66514587402344,-56.99363708496094,1
All essays did hurt that exposed person.,All essays did hurt that exposed people.,morphology,determiner_noun_agreement,determiner_noun_agreement_with_adj_irregular_1,True,True,False,True,71,-55.67365264892578,-52.47918701171875,0
Guy wouldn't sell that hard oasis.,Guy wouldn't sell that hard oases.,morphology,determiner_noun_agreement,determiner_noun_agreement_with_adj_irregular_1,True,True,False,True,72,-47.11430358886719,-49.086246490478516,1
Some woman hated that clever man.,Some woman hated that clever men.,morphology,determiner_noun_agreement,determiner_noun_agreement_with_adj_irregular_1,True,True,False,True,73,-41.58702850341797,-42.55862808227539,1
Amelia walks through this red oasis.,Amelia walks through this red oases.,morphology,determiner_noun_agreement,determiner_noun_agreement_with_adj_irregular_1,True,True,False,True,74,-55.045692443847656,-58.233848571777344,1
Susan did clean these yellow stimuli.,Susan did clean these yellow stimulus.,morphology,determiner_noun_agreement,determiner_noun_agreement_with_adj_irregular_1,True,True,False,True,75,-46.50403594970703,-47.74947738647461,1
Kristen observed that hopeful woman.,Kristen observed that hopeful women.,morphology,determiner_noun_agreement,determiner_noun_agreement_with_adj_irregular_1,True,True,False,True,76,-48.21985626220703,-47.83757019042969,0
Claire was messing up this small foot.,Claire was messing up this small feet.,morphology,determiner_noun_agreement,determiner_noun_agreement_with_adj_irregular_1,True,True,False,True,77,-51.95256805419922,-52.42649459838867,1
Some waiter hires that unemployed child.,Some waiter hires that unemployed children.,morphology,determiner_noun_agreement,determiner_noun_agreement_with_adj_irregular_1,True,True,False,True,78,-56.593597412109375,-56.266571044921875,0
Diana isn't running around that orange oasis.,Diana isn't running around that orange oases.,morphology,determiner_noun_agreement,determiner_noun_agreement_with_adj_irregular_1,True,True,False,True,79,-71.32759094238281,-73.83818054199219,1
This closet hasn't scared that lucky child.,This closet hasn't scared that lucky children.,morphology,determiner_noun_agreement,determiner_noun_agreement_with_adj_irregular_1,True,True,False,True,80,-54.81742477416992,-54.71794128417969,0
That doctor had hugged that confident woman.,That doctor had hugged that confident women.,morphology,determiner_noun_agreement,determiner_noun_agreement_with_adj_irregular_1,True,True,False,True,81,-57.67725372314453,-57.79216384887695,1
The waitresses research those red theses.,The waitresses research those red thesis.,morphology,determiner_noun_agreement,determiner_noun_agreement_with_adj_irregular_1,True,True,False,True,82,-72.86613464355469,-65.9132308959961,0
Many bananas confuse these displeased women.,Many bananas confuse these displeased woman.,morphology,determiner_noun_agreement,determiner_noun_agreement_with_adj_irregular_1,True,True,False,True,83,-63.356895446777344,-66.2030029296875,1
Committees loved this red thesis.,Committees loved this red theses.,morphology,determiner_noun_agreement,determiner_noun_agreement_with_adj_irregular_1,True,True,False,True,84,-56.733985900878906,-65.11746215820312,1
Deborah observes that lost alumnus.,Deborah observes that lost alumni.,morphology,determiner_noun_agreement,determiner_noun_agreement_with_adj_irregular_1,True,True,False,True,85,-67.02365112304688,-53.209251403808594,0
Marla could break those whole feet.,Marla could break those whole foot.,morphology,determiner_noun_agreement,determiner_noun_agreement_with_adj_irregular_1,True,True,False,True,86,-44.58183288574219,-45.03032302856445,1
Regina alarmed these standing alumni.,Regina alarmed these standing alumnus.,morphology,determiner_noun_agreement,determiner_noun_agreement_with_adj_irregular_1,True,True,False,True,87,-57.82146453857422,-70.83145904541016,1
Kristen cures this scared child.,Kristen cures this scared children.,morphology,determiner_noun_agreement,determiner_noun_agreement_with_adj_irregular_1,True,True,False,True,88,-49.80327606201172,-51.33770751953125,1
All screens astound these unlucky people.,All screens astound these unlucky person.,morphology,determiner_noun_agreement,determiner_noun_agreement_with_adj_irregular_1,True,True,False,True,89,-59.560970306396484,-63.68534469604492,1
Curtis knew these confident men.,Curtis knew these confident man.,morphology,determiner_noun_agreement,determiner_noun_agreement_with_adj_irregular_1,True,True,False,True,90,-63.692962646484375,-64.71186828613281,1
Some lakes confused this unlucky woman.,Some lakes confused this unlucky women.,morphology,determiner_noun_agreement,determiner_noun_agreement_with_adj_irregular_1,True,True,False,True,91,-54.03544235229492,-54.147254943847656,1
Most men lift these blue fungi.,Most men lift these blue fungus.,morphology,determiner_noun_agreement,determiner_noun_agreement_with_adj_irregular_1,True,True,False,True,92,-47.531517028808594,-49.35752868652344,1
Kendra kissed those happy alumni.,Kendra kissed those happy alumnus.,morphology,determiner_noun_agreement,determiner_noun_agreement_with_adj_irregular_1,True,True,False,True,93,-59.468360900878906,-75.3102035522461,1
Most cakes did distract this unsure child.,Most cakes did distract this unsure children.,morphology,determiner_noun_agreement,determiner_noun_agreement_with_adj_irregular_1,True,True,False,True,94,-62.64125442504883,-63.30303955078125,1
Katherine runs around that hard oasis.,Katherine runs around that hard oases.,morphology,determiner_noun_agreement,determiner_noun_agreement_with_adj_irregular_1,True,True,False,True,95,-59.37701416015625,-62.24721145629883,1
The Impressionists pass those black oases.,The Impressionists pass those black oasis.,morphology,determiner_noun_agreement,determiner_noun_agreement_with_adj_irregular_1,True,True,False,True,96,-71.81124877929688,-69.2442398071289,0
Andrea hadn't insulted this good woman.,Andrea hadn't insulted this good women.,morphology,determiner_noun_agreement,determiner_noun_agreement_with_adj_irregular_1,True,True,False,True,97,-53.9332160949707,-54.63153076171875,1
Beth will like these happy men.,Beth will like these happy man.,morphology,determiner_noun_agreement,determiner_noun_agreement_with_adj_irregular_1,True,True,False,True,98,-63.29188537597656,-64.97896575927734,1
Clyde broke that new foot.,Clyde broke that new feet.,morphology,determiner_noun_agreement,determiner_noun_agreement_with_adj_irregular_1,True,True,False,True,99,-61.11262512207031,-60.99067687988281,0
Bradley was watching these unsure men.,Bradley was watching these unsure man.,morphology,determiner_noun_agreement,determiner_noun_agreement_with_adj_irregular_1,True,True,False,True,100,-44.9438591003418,-46.520347595214844,1
The Clintons watch this confident man.,The Clintons watch this confident men.,morphology,determiner_noun_agreement,determiner_noun_agreement_with_adj_irregular_1,True,True,False,True,101,-57.70542907714844,-59.74076461791992,1
Debra had explored those gray oases.,Debra had explored those gray oasis.,morphology,determiner_noun_agreement,determiner_noun_agreement_with_adj_irregular_1,True,True,False,True,102,-61.59093475341797,-59.424800872802734,0
Homer was driving to this smooth oasis.,Homer was driving to this smooth oases.,morphology,determiner_noun_agreement,determiner_noun_agreement_with_adj_irregular_1,True,True,False,True,103,-59.18326950073242,-62.46371078491211,1
Some girl left that sick woman.,Some girl left that sick women.,morphology,determiner_noun_agreement,determiner_noun_agreement_with_adj_irregular_1,True,True,False,True,104,-38.32090759277344,-39.007057189941406,1
Those cafes confuse this old man.,Those cafes confuse this old men.,morphology,determiner_noun_agreement,determiner_noun_agreement_with_adj_irregular_1,True,True,False,True,105,-50.100250244140625,-51.31690979003906,1
Vanessa wasn't driving to that green oasis.,Vanessa wasn't driving to that green oases.,morphology,determiner_noun_agreement,determiner_noun_agreement_with_adj_irregular_1,True,True,False,True,106,-59.895240783691406,-62.41411590576172,1
Nicole has referenced these long analyses.,Nicole has referenced these long analysis.,morphology,determiner_noun_agreement,determiner_noun_agreement_with_adj_irregular_1,True,True,False,True,107,-52.68280029296875,-49.045166015625,0
Irene doesn't bore those hopeful women.,Irene doesn't bore those hopeful woman.,morphology,determiner_noun_agreement,determiner_noun_agreement_with_adj_irregular_1,True,True,False,True,108,-60.60468292236328,-62.642738342285156,1
Colleen didn't scare this old woman.,Colleen didn't scare this old women.,morphology,determiner_noun_agreement,determiner_noun_agreement_with_adj_irregular_1,True,True,False,True,109,-46.18916320800781,-49.116756439208984,1
Most sketches have looked like this green louse.,Most sketches have looked like this green lice.,morphology,determiner_noun_agreement,determiner_noun_agreement_with_adj_irregular_1,True,True,False,True,110,-60.560157775878906,-61.043609619140625,1
Sonia can't hug those hopeful children.,Sonia can't hug those hopeful child.,morphology,determiner_noun_agreement,determiner_noun_agreement_with_adj_irregular_1,True,True,False,True,111,-61.45906066894531,-62.60346221923828,1
Helen had shocked these hopeful children.,Helen had shocked these hopeful child.,morphology,determiner_noun_agreement,determiner_noun_agreement_with_adj_irregular_1,True,True,False,True,112,-51.69349670410156,-54.02780532836914,1
