sentence_good,sentence_bad,field,linguistics_term,UID,simple_LM_method,one_prefix_method,two_prefix_method,lexically_identical,pair_id,good_prob,bad_prob,correct
Cashiers disagreed with these concealed people.,Cashiers disagreed with these concealed person.,morphology,determiner_noun_agreement,determiner_noun_agreement_with_adj_irregular_1,True,True,False,True,448,-55.25020980834961,-59.055694580078125,1
Denise noticed that red nucleus.,Denise noticed that red nuclei.,morphology,determiner_noun_agreement,determiner_noun_agreement_with_adj_irregular_1,True,True,False,True,449,-44.007781982421875,-52.309776306152344,1
Thomas was exploring those orange oases.,Thomas was exploring those orange oasis.,morphology,determiner_noun_agreement,determiner_noun_agreement_with_adj_irregular_1,True,True,False,True,450,-52.47598648071289,-48.869873046875,0
Alexander could exit those smooth oases.,Alexander could exit those smooth oasis.,morphology,determiner_noun_agreement,determiner_noun_agreement_with_adj_irregular_1,True,True,False,True,451,-57.719459533691406,-54.674476623535156,0
Most schools are describing this long analysis.,Most schools are describing this long analyses.,morphology,determiner_noun_agreement,determiner_noun_agreement_with_adj_irregular_1,True,True,False,True,452,-43.5763053894043,-49.607120513916016,1
Martin described those bad analyses.,Martin described those bad analysis.,morphology,determiner_noun_agreement,determiner_noun_agreement_with_adj_irregular_1,True,True,False,True,453,-38.667396545410156,-34.1953125,0
Joel has boycotted these smooth oases.,Joel has boycotted these smooth oasis.,morphology,determiner_noun_agreement,determiner_noun_agreement_with_adj_irregular_1,True,True,False,True,454,-80.2630844116211,-76.47699737548828,0
Jerry discovers these out in the open geese.,Jerry discovers these out in the open goose.,morphology,determiner_noun_agreement,determiner_noun_agreement_with_adj_irregular_1,True,True,False,True,455,-62.80229187011719,-58.15740203857422,0
Stacy drove to this white oasis.,Stacy drove to this white oases.,morphology,determiner_noun_agreement,determiner_noun_agreement_with_adj_irregular_1,True,True,False,True,456,-62.0306396484375,-65.83697509765625,1
Maria hadn't admired that gray goose.,Maria hadn't admired that gray geese.,morphology,determiner_noun_agreement,determiner_noun_agreement_with_adj_irregular_1,True,True,False,True,457,-51.64801025390625,-56.94291305541992,1
Gerald describes those good analyses.,Gerald describes those good analysis.,morphology,determiner_noun_agreement,determiner_noun_agreement_with_adj_irregular_1,True,True,False,True,458,-55.01631546020508,-50.74585723876953,0
Becky doesn't argue about those determined alumni.,Becky doesn't argue about those determined alumnus.,morphology,determiner_noun_agreement,determiner_noun_agreement_with_adj_irregular_1,True,True,False,True,459,-52.34855270385742,-68.30632019042969,1
Kayla isn't breaking those small teeth.,Kayla isn't breaking those small tooth.,morphology,determiner_noun_agreement,determiner_noun_agreement_with_adj_irregular_1,True,True,False,True,460,-49.88911437988281,-52.00798797607422,1
Wayne broke that purple tooth.,Wayne broke that purple teeth.,morphology,determiner_noun_agreement,determiner_noun_agreement_with_adj_irregular_1,True,True,False,True,461,-51.967994689941406,-49.693790435791016,0
Randolf had run around those blue oases.,Randolf had run around those blue oasis.,morphology,determiner_noun_agreement,determiner_noun_agreement_with_adj_irregular_1,True,True,False,True,462,-64.17898559570312,-60.83751678466797,0
Monet hadn't concealed that content alumnus.,Monet hadn't concealed that content alumni.,morphology,determiner_noun_agreement,determiner_noun_agreement_with_adj_irregular_1,True,True,False,True,463,-78.76091003417969,-64.02688598632812,0
Kirsten irritated those happy alumni.,Kirsten irritated those happy alumnus.,morphology,determiner_noun_agreement,determiner_noun_agreement_with_adj_irregular_1,True,True,False,True,464,-66.82556915283203,-82.74610900878906,1
The teenager approached that fast child.,The teenager approached that fast children.,morphology,determiner_noun_agreement,determiner_noun_agreement_with_adj_irregular_1,True,True,False,True,465,-41.55234146118164,-40.45552062988281,0
Tracy kissed this unconvinced woman.,Tracy kissed this unconvinced women.,morphology,determiner_noun_agreement,determiner_noun_agreement_with_adj_irregular_1,True,True,False,True,466,-74.37629699707031,-74.97483825683594,1
Most associations argued about those long analyses.,Most associations argued about those long analysis.,morphology,determiner_noun_agreement,determiner_noun_agreement_with_adj_irregular_1,True,True,False,True,467,-58.00435256958008,-53.30400085449219,0
The waiters discover that brown stimulus.,The waiters discover that brown stimuli.,morphology,determiner_noun_agreement,determiner_noun_agreement_with_adj_irregular_1,True,True,False,True,468,-60.77326202392578,-60.449951171875,0
Brett talks to these young women.,Brett talks to these young woman.,morphology,determiner_noun_agreement,determiner_noun_agreement_with_adj_irregular_1,True,True,False,True,469,-54.543846130371094,-56.99457931518555,1
Some popsicle scares those content children.,Some popsicle scares those content child.,morphology,determiner_noun_agreement,determiner_noun_agreement_with_adj_irregular_1,True,True,False,True,470,-63.72611999511719,-64.17813873291016,1
Women find that hidden mouse.,Women find that hidden mice.,morphology,determiner_noun_agreement,determiner_noun_agreement_with_adj_irregular_1,True,True,False,True,471,-34.55357360839844,-34.02735900878906,0
Those pedestrians return to these nice children.,Those pedestrians return to these nice child.,morphology,determiner_noun_agreement,determiner_noun_agreement_with_adj_irregular_1,True,True,False,True,472,-46.492919921875,-48.723541259765625,1
Jodi scans those bad synopses.,Jodi scans those bad synopsis.,morphology,determiner_noun_agreement,determiner_noun_agreement_with_adj_irregular_1,True,True,False,True,473,-76.51046752929688,-64.68719482421875,0
Ellen is leaving that busy woman.,Ellen is leaving that busy women.,morphology,determiner_noun_agreement,determiner_noun_agreement_with_adj_irregular_1,True,True,False,True,474,-41.29034423828125,-40.52849578857422,0
Peter had known these big men.,Peter had known these big man.,morphology,determiner_noun_agreement,determiner_noun_agreement_with_adj_irregular_1,True,True,False,True,475,-35.151649475097656,-36.68156814575195,1
Brett is thinking about those gray cacti.,Brett is thinking about those gray cactus.,morphology,determiner_noun_agreement,determiner_noun_agreement_with_adj_irregular_1,True,True,False,True,476,-73.36235046386719,-67.74797058105469,0
The Lutherans heal these ill geese.,The Lutherans heal these ill goose.,morphology,determiner_noun_agreement,determiner_noun_agreement_with_adj_irregular_1,True,True,False,True,477,-74.36065673828125,-69.87197875976562,0
Lissa might sound like that good child.,Lissa might sound like that good children.,morphology,determiner_noun_agreement,determiner_noun_agreement_with_adj_irregular_1,True,True,False,True,478,-52.813438415527344,-51.69426727294922,0
Most mouths might stun those busy children.,Most mouths might stun those busy child.,morphology,determiner_noun_agreement,determiner_noun_agreement_with_adj_irregular_1,True,True,False,True,479,-59.93004608154297,-60.986419677734375,1
Kayla has that orange axis.,Kayla has that orange axes.,morphology,determiner_noun_agreement,determiner_noun_agreement_with_adj_irregular_1,True,True,False,True,480,-41.64234161376953,-43.47430419921875,1
Cynthia doesn't heal that clever man.,Cynthia doesn't heal that clever men.,morphology,determiner_noun_agreement,determiner_noun_agreement_with_adj_irregular_1,True,True,False,True,481,-71.39088439941406,-72.69384765625,1
Homer returns to that exposed man.,Homer returns to that exposed men.,morphology,determiner_noun_agreement,determiner_noun_agreement_with_adj_irregular_1,True,True,False,True,482,-57.119895935058594,-57.426971435546875,1
People remember those uncertain people.,People remember those uncertain person.,morphology,determiner_noun_agreement,determiner_noun_agreement_with_adj_irregular_1,True,True,False,True,483,-32.89990234375,-35.75457763671875,1
Theodore hasn't broken those concealed feet.,Theodore hasn't broken those concealed foot.,morphology,determiner_noun_agreement,determiner_noun_agreement_with_adj_irregular_1,True,True,False,True,484,-62.745323181152344,-64.85414123535156,1
Tonya had disturbed that popular man.,Tonya had disturbed that popular men.,morphology,determiner_noun_agreement,determiner_noun_agreement_with_adj_irregular_1,True,True,False,True,485,-48.691375732421875,-48.70158386230469,1
This customer couldn't pass that black oasis.,This customer couldn't pass that black oases.,morphology,determiner_noun_agreement,determiner_noun_agreement_with_adj_irregular_1,True,True,False,True,486,-57.43658447265625,-60.337406158447266,1
William hides that exposed stimulus.,William hides that exposed stimuli.,morphology,determiner_noun_agreement,determiner_noun_agreement_with_adj_irregular_1,True,True,False,True,487,-45.677825927734375,-44.6429443359375,0
Ruth exits that big oasis.,Ruth exits that big oases.,morphology,determiner_noun_agreement,determiner_noun_agreement_with_adj_irregular_1,True,True,False,True,488,-63.2024040222168,-66.27111053466797,1
Judy can discover that red mouse.,Judy can discover that red mice.,morphology,determiner_noun_agreement,determiner_noun_agreement_with_adj_irregular_1,True,True,False,True,489,-46.99265670776367,-47.06965637207031,1
Candice didn't stun that serious alumnus.,Candice didn't stun that serious alumni.,morphology,determiner_noun_agreement,determiner_noun_agreement_with_adj_irregular_1,True,True,False,True,490,-74.90129089355469,-59.31959915161133,0
Jodi hadn't visited these green oases.,Jodi hadn't visited these green oasis.,morphology,determiner_noun_agreement,determiner_noun_agreement_with_adj_irregular_1,True,True,False,True,491,-71.47616577148438,-68.93724060058594,0
Rose doesn't hate these bad analyses.,Rose doesn't hate these bad analysis.,morphology,determiner_noun_agreement,determiner_noun_agreement_with_adj_irregular_1,True,True,False,True,492,-45.66334915161133,-40.09718322753906,0
These men can help that lost alumnus.,These men can help that lost alumni.,morphology,determiner_noun_agreement,determiner_noun_agreement_with_adj_irregular_1,True,True,False,True,493,-62.39267349243164,-48.17913818359375,0
Thomas hadn't arrived at those red oases.,Thomas hadn't arrived at those red oasis.,morphology,determiner_noun_agreement,determiner_noun_agreement_with_adj_irregular_1,True,True,False,True,494,-58.95477294921875,-55.13058090209961,0
A lot of companies remembered this unlucky alumnus.,A lot of companies remembered this unlucky alumni.,morphology,determiner_noun_agreement,determiner_noun_agreement_with_adj_irregular_1,True,True,False,True,495,-83.46188354492188,-66.7418212890625,0
Women fire these content women.,Women fire these content woman.,morphology,determiner_noun_agreement,determiner_noun_agreement_with_adj_irregular_1,True,True,False,True,496,-37.847755432128906,-38.72550964355469,1
George will remember those good synopses.,George will remember those good synopsis.,morphology,determiner_noun_agreement,determiner_noun_agreement_with_adj_irregular_1,True,True,False,True,497,-55.536468505859375,-44.22029113769531,0
The glacier wasn't embarrassing those unlucky people.,The glacier wasn't embarrassing those unlucky person.,morphology,determiner_noun_agreement,determiner_noun_agreement_with_adj_irregular_1,True,True,False,True,498,-60.07328414916992,-62.590110778808594,1
Guy visits that happy woman.,Guy visits that happy women.,morphology,determiner_noun_agreement,determiner_noun_agreement_with_adj_irregular_1,True,True,False,True,499,-37.818931579589844,-38.33536148071289,1
Steven investigates this employed person.,Steven investigates this employed people.,morphology,determiner_noun_agreement,determiner_noun_agreement_with_adj_irregular_1,True,True,False,True,500,-47.090049743652344,-45.48394012451172,0
John didn't conceal those young men.,John didn't conceal those young man.,morphology,determiner_noun_agreement,determiner_noun_agreement_with_adj_irregular_1,True,True,False,True,501,-40.83066940307617,-41.63579177856445,1
Martin hadn't gone to that gray oasis.,Martin hadn't gone to that gray oases.,morphology,determiner_noun_agreement,determiner_noun_agreement_with_adj_irregular_1,True,True,False,True,502,-49.27702331542969,-53.16266632080078,1
The cashiers weren't breaking these brown feet.,The cashiers weren't breaking these brown foot.,morphology,determiner_noun_agreement,determiner_noun_agreement_with_adj_irregular_1,True,True,False,True,503,-60.78919982910156,-63.500579833984375,1
The pedestrians might complain about this small oasis.,The pedestrians might complain about this small oases.,morphology,determiner_noun_agreement,determiner_noun_agreement_with_adj_irregular_1,True,True,False,True,504,-64.32966613769531,-67.2300033569336,1
Tamara won't bike to those exposed oases.,Tamara won't bike to those exposed oasis.,morphology,determiner_noun_agreement,determiner_noun_agreement_with_adj_irregular_1,True,True,False,True,505,-70.31663513183594,-66.79285430908203,0
Jennifer does discuss those purple oases.,Jennifer does discuss those purple oasis.,morphology,determiner_noun_agreement,determiner_noun_agreement_with_adj_irregular_1,True,True,False,True,506,-55.9339599609375,-53.038734436035156,0
Naomi does investigate those clever people.,Naomi does investigate those clever person.,morphology,determiner_noun_agreement,determiner_noun_agreement_with_adj_irregular_1,True,True,False,True,507,-53.85142517089844,-57.421783447265625,1
Beverly wasn't hiding this blue mouse.,Beverly wasn't hiding this blue mice.,morphology,determiner_noun_agreement,determiner_noun_agreement_with_adj_irregular_1,True,True,False,True,508,-66.09449768066406,-66.68360900878906,1
Every sketch astounds that hidden child.,Every sketch astounds that hidden children.,morphology,determiner_noun_agreement,determiner_noun_agreement_with_adj_irregular_1,True,True,False,True,509,-61.49921417236328,-62.22431182861328,1
Christine talks to that determined child.,Christine talks to that determined children.,morphology,determiner_noun_agreement,determiner_noun_agreement_with_adj_irregular_1,True,True,False,True,510,-47.777706146240234,-46.64604568481445,0
Jesus can hire that smart man.,Jesus can hire that smart men.,morphology,determiner_noun_agreement,determiner_noun_agreement_with_adj_irregular_1,True,True,False,True,511,-40.073360443115234,-41.71770095825195,1
These drivers kiss this exposed alumnus.,These drivers kiss this exposed alumni.,morphology,determiner_noun_agreement,determiner_noun_agreement_with_adj_irregular_1,True,True,False,True,512,-67.67469787597656,-53.60509490966797,0
Diane respected those unemployed alumni.,Diane respected those unemployed alumnus.,morphology,determiner_noun_agreement,determiner_noun_agreement_with_adj_irregular_1,True,True,False,True,513,-62.95100402832031,-77.68915557861328,1
Theodore hasn't argued about these unsure people.,Theodore hasn't argued about these unsure person.,morphology,determiner_noun_agreement,determiner_noun_agreement_with_adj_irregular_1,True,True,False,True,514,-64.98784637451172,-67.97870635986328,1
Nina reveals these red theses.,Nina reveals these red thesis.,morphology,determiner_noun_agreement,determiner_noun_agreement_with_adj_irregular_1,True,True,False,True,515,-64.72807312011719,-57.19746398925781,0
Meredith complains about those popular women.,Meredith complains about those popular woman.,morphology,determiner_noun_agreement,determiner_noun_agreement_with_adj_irregular_1,True,True,False,True,516,-60.75892639160156,-62.71055221557617,1
That government hadn't discussed these good synopses.,That government hadn't discussed these good synopsis.,morphology,determiner_noun_agreement,determiner_noun_agreement_with_adj_irregular_1,True,True,False,True,517,-72.03424072265625,-60.56976318359375,0
Colleen had broken that big tooth.,Colleen had broken that big teeth.,morphology,determiner_noun_agreement,determiner_noun_agreement_with_adj_irregular_1,True,True,False,True,518,-43.17544937133789,-41.97774124145508,0
Catherine was revealing that exposed tooth.,Catherine was revealing that exposed teeth.,morphology,determiner_noun_agreement,determiner_noun_agreement_with_adj_irregular_1,True,True,False,True,519,-60.44483947753906,-59.087703704833984,0
A lot of actresses are skated around these purple oases.,A lot of actresses are skated around these purple oasis.,morphology,determiner_noun_agreement,determiner_noun_agreement_with_adj_irregular_1,True,True,False,True,520,-89.31423950195312,-86.23640441894531,0
Most pedestrians criticize these bad men.,Most pedestrians criticize these bad man.,morphology,determiner_noun_agreement,determiner_noun_agreement_with_adj_irregular_1,True,True,False,True,521,-48.09553909301758,-49.55221176147461,1
John hadn't scared that clever man.,John hadn't scared that clever men.,morphology,determiner_noun_agreement,determiner_noun_agreement_with_adj_irregular_1,True,True,False,True,522,-44.27767562866211,-45.74059295654297,1
Julia has astounded that nice child.,Julia has astounded that nice children.,morphology,determiner_noun_agreement,determiner_noun_agreement_with_adj_irregular_1,True,True,False,True,523,-51.665687561035156,-50.97086715698242,0
Laurie has dropped by those cheap oases.,Laurie has dropped by those cheap oasis.,morphology,determiner_noun_agreement,determiner_noun_agreement_with_adj_irregular_1,True,True,False,True,524,-74.17876434326172,-71.06403350830078,0
Rose wouldn't bike to those small oases.,Rose wouldn't bike to those small oasis.,morphology,determiner_noun_agreement,determiner_noun_agreement_with_adj_irregular_1,True,True,False,True,525,-59.51243591308594,-56.14515686035156,0
Holly did observe that unconvinced person.,Holly did observe that unconvinced people.,morphology,determiner_noun_agreement,determiner_noun_agreement_with_adj_irregular_1,True,True,False,True,526,-82.48135375976562,-80.61228942871094,0
Stacy isn't healing this big child.,Stacy isn't healing this big children.,morphology,determiner_noun_agreement,determiner_noun_agreement_with_adj_irregular_1,True,True,False,True,527,-57.49742126464844,-59.04650115966797,1
Every actor complains about this small thesis.,Every actor complains about this small theses.,morphology,determiner_noun_agreement,determiner_noun_agreement_with_adj_irregular_1,True,True,False,True,528,-50.1708984375,-60.25682067871094,1
Some teacher dislikes this determined alumnus.,Some teacher dislikes this determined alumni.,morphology,determiner_noun_agreement,determiner_noun_agreement_with_adj_irregular_1,True,True,False,True,529,-83.95014953613281,-68.33468627929688,0
This driver remembers that scared woman.,This driver remembers that scared women.,morphology,determiner_noun_agreement,determiner_noun_agreement_with_adj_irregular_1,True,True,False,True,530,-42.513145446777344,-44.297882080078125,1
Thomas hadn't aggravated that fast man.,Thomas hadn't aggravated that fast men.,morphology,determiner_noun_agreement,determiner_noun_agreement_with_adj_irregular_1,True,True,False,True,531,-47.8302001953125,-48.978599548339844,1
Tracy messed up those orange feet.,Tracy messed up those orange foot.,morphology,determiner_noun_agreement,determiner_noun_agreement_with_adj_irregular_1,True,True,False,True,532,-42.419742584228516,-44.21902847290039,1
Matt hasn't bothered those employed men.,Matt hasn't bothered those employed man.,morphology,determiner_noun_agreement,determiner_noun_agreement_with_adj_irregular_1,True,True,False,True,533,-46.974952697753906,-47.88056182861328,1
Sharon isn't criticizing those standing children.,Sharon isn't criticizing those standing child.,morphology,determiner_noun_agreement,determiner_noun_agreement_with_adj_irregular_1,True,True,False,True,534,-61.75091552734375,-60.99081802368164,0
Noah admired this hard louse.,Noah admired this hard lice.,morphology,determiner_noun_agreement,determiner_noun_agreement_with_adj_irregular_1,True,True,False,True,535,-64.27543640136719,-64.17572021484375,0
The popsicle confuses this concealed child.,The popsicle confuses this concealed children.,morphology,determiner_noun_agreement,determiner_noun_agreement_with_adj_irregular_1,True,True,False,True,536,-72.88079833984375,-74.37734985351562,1
That apple worried those important people.,That apple worried those important person.,morphology,determiner_noun_agreement,determiner_noun_agreement_with_adj_irregular_1,True,True,False,True,537,-51.59271240234375,-53.14128875732422,1
Robert couldn't like those old feet.,Robert couldn't like those old foot.,morphology,determiner_noun_agreement,determiner_noun_agreement_with_adj_irregular_1,True,True,False,True,538,-34.12021255493164,-36.3409538269043,1
All legislatures help those lucky children.,All legislatures help those lucky child.,morphology,determiner_noun_agreement,determiner_noun_agreement_with_adj_irregular_1,True,True,False,True,539,-49.061920166015625,-50.941776275634766,1
This spinach wasn't scaring that exposed child.,This spinach wasn't scaring that exposed children.,morphology,determiner_noun_agreement,determiner_noun_agreement_with_adj_irregular_1,True,True,False,True,540,-63.932899475097656,-63.050575256347656,0
The teenager returned to those black oases.,The teenager returned to those black oasis.,morphology,determiner_noun_agreement,determiner_noun_agreement_with_adj_irregular_1,True,True,False,True,541,-55.946250915527344,-52.08720397949219,0
Jill is hiring this small man.,Jill is hiring this small men.,morphology,determiner_noun_agreement,determiner_noun_agreement_with_adj_irregular_1,True,True,False,True,542,-53.92319107055664,-55.66111755371094,1
Jeffrey hasn't watched those clever alumni.,Jeffrey hasn't watched those clever alumnus.,morphology,determiner_noun_agreement,determiner_noun_agreement_with_adj_irregular_1,True,True,False,True,543,-58.1351318359375,-72.74848937988281,1
Danielle helps that happy person.,Danielle helps that happy people.,morphology,determiner_noun_agreement,determiner_noun_agreement_with_adj_irregular_1,True,True,False,True,544,-41.021114349365234,-41.43170166015625,1
The Borgias escape from that troubled woman.,The Borgias escape from that troubled women.,morphology,determiner_noun_agreement,determiner_noun_agreement_with_adj_irregular_1,True,True,False,True,545,-71.62858581542969,-71.55714416503906,0
The Borgias wouldn't break that smooth tooth.,The Borgias wouldn't break that smooth teeth.,morphology,determiner_noun_agreement,determiner_noun_agreement_with_adj_irregular_1,True,True,False,True,546,-66.07937622070312,-63.88595199584961,0
Most waiters conceal those smart men.,Most waiters conceal those smart man.,morphology,determiner_noun_agreement,determiner_noun_agreement_with_adj_irregular_1,True,True,False,True,547,-61.3693733215332,-62.05085754394531,1
Kathleen couldn't talk about these good analyses.,Kathleen couldn't talk about these good analysis.,morphology,determiner_noun_agreement,determiner_noun_agreement_with_adj_irregular_1,True,True,False,True,548,-69.22205352783203,-64.14558410644531,0
Veronica hadn't noticed those lost lice.,Veronica hadn't noticed those lost louse.,morphology,determiner_noun_agreement,determiner_noun_agreement_with_adj_irregular_1,True,True,False,True,549,-59.701148986816406,-59.125823974609375,0
Rachel had found those hard cacti.,Rachel had found those hard cactus.,morphology,determiner_noun_agreement,determiner_noun_agreement_with_adj_irregular_1,True,True,False,True,550,-52.07320785522461,-46.56774139404297,0
Denise sounds like that confident person.,Denise sounds like that confident people.,morphology,determiner_noun_agreement,determiner_noun_agreement_with_adj_irregular_1,True,True,False,True,551,-46.02009582519531,-42.507484436035156,0
Many mouths stunned this nice person.,Many mouths stunned this nice people.,morphology,determiner_noun_agreement,determiner_noun_agreement_with_adj_irregular_1,True,True,False,True,552,-50.10803985595703,-51.3421630859375,1
Most adults love these content women.,Most adults love these content woman.,morphology,determiner_noun_agreement,determiner_noun_agreement_with_adj_irregular_1,True,True,False,True,553,-41.65454864501953,-43.44225311279297,1
Donald is hurting these unemployed people.,Donald is hurting these unemployed person.,morphology,determiner_noun_agreement,determiner_noun_agreement_with_adj_irregular_1,True,True,False,True,554,-38.37519073486328,-42.174415588378906,1
Those students reference those smart people.,Those students reference those smart person.,morphology,determiner_noun_agreement,determiner_noun_agreement_with_adj_irregular_1,True,True,False,True,555,-44.30693054199219,-47.796783447265625,1
Jerry shouldn't listen to those serious alumni.,Jerry shouldn't listen to those serious alumnus.,morphology,determiner_noun_agreement,determiner_noun_agreement_with_adj_irregular_1,True,True,False,True,556,-44.89596176147461,-60.96780776977539,1
Many dancers skate around these smooth oases.,Many dancers skate around these smooth oasis.,morphology,determiner_noun_agreement,determiner_noun_agreement_with_adj_irregular_1,True,True,False,True,557,-66.9494400024414,-63.9005012512207,0
Judy liked this determined man.,Judy liked this determined men.,morphology,determiner_noun_agreement,determiner_noun_agreement_with_adj_irregular_1,True,True,False,True,558,-43.24067687988281,-44.08036804199219,1
Dennis hadn't thought about those hidden mice.,Dennis hadn't thought about those hidden mouse.,morphology,determiner_noun_agreement,determiner_noun_agreement_with_adj_irregular_1,True,True,False,True,559,-62.55902862548828,-63.08418273925781,1
