sentence_good,sentence_bad,field,linguistics_term,UID,simple_LM_method,one_prefix_method,two_prefix_method,lexically_identical,pair_id,good_prob,bad_prob,correct
Kristin insulted those dancers.,Kristin insulted those dancer.,morphology,determiner_noun_agreement,determiner_noun_agreement_1,True,True,False,True,512,-38.022926330566406,-38.89620590209961,1
Some sketches had looked like this girl.,Some sketches had looked like this girls.,morphology,determiner_noun_agreement,determiner_noun_agreement_1,True,True,False,True,513,-45.92085266113281,-48.15570831298828,1
Pamela hasn't biked to those libraries.,Pamela hasn't biked to those library.,morphology,determiner_noun_agreement,determiner_noun_agreement_1,True,True,False,True,514,-80.9650650024414,-78.4156494140625,0
Ellen can't exit these public parks.,Ellen can't exit these public park.,morphology,determiner_noun_agreement,determiner_noun_agreement_1,True,True,False,True,515,-44.32866668701172,-45.66883850097656,1
Ruth noticed those newspaper articles.,Ruth noticed those newspaper article.,morphology,determiner_noun_agreement,determiner_noun_agreement_1,True,True,False,True,516,-54.02752685546875,-54.23896026611328,1
Most doctors leave these doctors.,Most doctors leave these doctor.,morphology,determiner_noun_agreement,determiner_noun_agreement_1,True,True,False,True,517,-31.40384292602539,-33.23658752441406,1
Stacy has hurt this guest.,Stacy has hurt this guests.,morphology,determiner_noun_agreement,determiner_noun_agreement_1,True,True,False,True,518,-48.141944885253906,-48.55466079711914,1
Carol would admire those movie theaters.,Carol would admire those movie theater.,morphology,determiner_noun_agreement,determiner_noun_agreement_1,True,True,False,True,519,-56.217979431152344,-57.35857391357422,1
Kayla flees from these cafes.,Kayla flees from these cafe.,morphology,determiner_noun_agreement,determiner_noun_agreement_1,True,True,False,True,520,-53.72488784790039,-49.92778778076172,0
Most dancers haven't forgotten this essay.,Most dancers haven't forgotten this essays.,morphology,determiner_noun_agreement,determiner_noun_agreement_1,True,True,False,True,521,-48.876461029052734,-50.331626892089844,1
Customers shouldn't upset these waiters.,Customers shouldn't upset these waiter.,morphology,determiner_noun_agreement,determiner_noun_agreement_1,True,True,False,True,522,-50.87208938598633,-44.13570785522461,0
Wendy appreciates those pamphlets.,Wendy appreciates those pamphlet.,morphology,determiner_noun_agreement,determiner_noun_agreement_1,True,True,False,True,523,-65.37081909179688,-59.646881103515625,0
Victoria boasted about this play.,Victoria boasted about this plays.,morphology,determiner_noun_agreement,determiner_noun_agreement_1,True,True,False,True,524,-36.015384674072266,-37.57912826538086,1
Jacqueline can't scan these essays.,Jacqueline can't scan these essay.,morphology,determiner_noun_agreement,determiner_noun_agreement_1,True,True,False,True,525,-51.80268859863281,-53.97813034057617,1
The Impressionists explore this art gallery.,The Impressionists explore this art galleries.,morphology,determiner_noun_agreement,determiner_noun_agreement_1,True,True,False,True,526,-70.83465576171875,-69.40345001220703,0
Sarah messed up that cafe.,Sarah messed up that cafes.,morphology,determiner_noun_agreement,determiner_noun_agreement_1,True,True,False,True,527,-30.472606658935547,-33.338722229003906,1
Rodney hasn't remembered this art gallery.,Rodney hasn't remembered this art galleries.,morphology,determiner_noun_agreement,determiner_noun_agreement_1,True,True,False,True,528,-53.48914337158203,-53.281944274902344,0
Raymond kissed that guy.,Raymond kissed that guys.,morphology,determiner_noun_agreement,determiner_noun_agreement_1,True,True,False,True,529,-32.89189147949219,-36.291175842285156,1
Ladies hadn't fixed these couches.,Ladies hadn't fixed these couch.,morphology,determiner_noun_agreement,determiner_noun_agreement_1,True,True,False,True,530,-53.57318878173828,-48.303466796875,0
Guy healed that patient.,Guy healed that patients.,morphology,determiner_noun_agreement,determiner_noun_agreement_1,True,True,False,True,531,-30.32706069946289,-31.858034133911133,1
The Borgias would criticize that story.,The Borgias would criticize that stories.,morphology,determiner_noun_agreement,determiner_noun_agreement_1,True,True,False,True,532,-52.47972106933594,-55.003509521484375,1
Carrie complains about this essay.,Carrie complains about this essays.,morphology,determiner_noun_agreement,determiner_noun_agreement_1,True,True,False,True,533,-43.51921463012695,-44.404048919677734,1
Steve should approach this customer.,Steve should approach this customers.,morphology,determiner_noun_agreement,determiner_noun_agreement_1,True,True,False,True,534,-36.753318786621094,-38.56436538696289,1
The patients didn't skate around those high schools.,The patients didn't skate around those high school.,morphology,determiner_noun_agreement,determiner_noun_agreement_1,True,True,False,True,535,-52.08072280883789,-49.84590148925781,0
Denise bought those prints.,Denise bought those print.,morphology,determiner_noun_agreement,determiner_noun_agreement_1,True,True,False,True,536,-35.795623779296875,-37.19331359863281,1
Susan hadn't hired these guys.,Susan hadn't hired these guy.,morphology,determiner_noun_agreement,determiner_noun_agreement_1,True,True,False,True,537,-33.667930603027344,-36.89440155029297,1
That mushroom is annoying these cashiers.,That mushroom is annoying these cashier.,morphology,determiner_noun_agreement,determiner_noun_agreement_1,True,True,False,True,538,-59.633995056152344,-59.07679748535156,0
Randolf did examine that pamphlet.,Randolf did examine that pamphlets.,morphology,determiner_noun_agreement,determiner_noun_agreement_1,True,True,False,True,539,-48.22759246826172,-55.415855407714844,1
Ellen cared for that teacher.,Ellen cared for that teachers.,morphology,determiner_noun_agreement,determiner_noun_agreement_1,True,True,False,True,540,-30.164995193481445,-31.3331298828125,1
Maria astounded this dancer.,Maria astounded this dancers.,morphology,determiner_noun_agreement,determiner_noun_agreement_1,True,True,False,True,541,-38.06071472167969,-40.12284851074219,1
Holly approaches that pedestrian.,Holly approaches that pedestrians.,morphology,determiner_noun_agreement,determiner_noun_agreement_1,True,True,False,True,542,-40.945701599121094,-39.78586196899414,0
Many waiters investigate these schools.,Many waiters investigate these school.,morphology,determiner_noun_agreement,determiner_noun_agreement_1,True,True,False,True,543,-43.85384750366211,-47.446006774902344,1
Most men explored that school.,Most men explored that schools.,morphology,determiner_noun_agreement,determiner_noun_agreement_1,True,True,False,True,544,-34.37251281738281,-36.36195373535156,1
Ellen wasn't observing these customers.,Ellen wasn't observing these customer.,morphology,determiner_noun_agreement,determiner_noun_agreement_1,True,True,False,True,545,-43.03915023803711,-45.738059997558594,1
Chad isn't concealing those adults.,Chad isn't concealing those adult.,morphology,determiner_noun_agreement,determiner_noun_agreement_1,True,True,False,True,546,-63.090965270996094,-66.90835571289062,1
Those guests bike to this school.,Those guests bike to this schools.,morphology,determiner_noun_agreement,determiner_noun_agreement_1,True,True,False,True,547,-39.79395294189453,-42.29673767089844,1
Most adults hurt these teachers.,Most adults hurt these teacher.,morphology,determiner_noun_agreement,determiner_noun_agreement_1,True,True,False,True,548,-34.717472076416016,-36.87792205810547,1
Paula was listening to those drivers.,Paula was listening to those driver.,morphology,determiner_noun_agreement,determiner_noun_agreement_1,True,True,False,True,549,-34.885528564453125,-36.36661148071289,1
Natalie wasn't researching these college campuses.,Natalie wasn't researching these college campus.,morphology,determiner_noun_agreement,determiner_noun_agreement_1,True,True,False,True,550,-65.29841613769531,-65.21566772460938,0
Gregory is attacking this doctor.,Gregory is attacking this doctors.,morphology,determiner_noun_agreement,determiner_noun_agreement_1,True,True,False,True,551,-37.536476135253906,-39.81199264526367,1
Stacy was watching these teachers.,Stacy was watching these teacher.,morphology,determiner_noun_agreement,determiner_noun_agreement_1,True,True,False,True,552,-43.58356857299805,-45.007911682128906,1
Holly wasn't exploring those art galleries.,Holly wasn't exploring those art gallery.,morphology,determiner_noun_agreement,determiner_noun_agreement_1,True,True,False,True,553,-55.4503288269043,-56.9278450012207,1
The Impressionists helped those teenagers.,The Impressionists helped those teenager.,morphology,determiner_noun_agreement,determiner_noun_agreement_1,True,True,False,True,554,-55.96210861206055,-59.83280563354492,1
These universities stunned this association.,These universities stunned this associations.,morphology,determiner_noun_agreement,determiner_noun_agreement_1,True,True,False,True,555,-42.90425109863281,-43.499755859375,1
All actors know those waitresses.,All actors know those waitress.,morphology,determiner_noun_agreement,determiner_noun_agreement_1,True,True,False,True,556,-50.8380126953125,-42.157466888427734,0
Every woman boycotted those high schools.,Every woman boycotted those high school.,morphology,determiner_noun_agreement,determiner_noun_agreement_1,True,True,False,True,557,-54.63853454589844,-52.450809478759766,0
Nancy cleans this cup.,Nancy cleans this cups.,morphology,determiner_noun_agreement,determiner_noun_agreement_1,True,True,False,True,558,-44.93022918701172,-47.527557373046875,1
Julia is healing these snakes.,Julia is healing these snake.,morphology,determiner_noun_agreement,determiner_noun_agreement_1,True,True,False,True,559,-45.17268753051758,-47.52082824707031,1
Some guys are disagreeing with these essays.,Some guys are disagreeing with these essay.,morphology,determiner_noun_agreement,determiner_noun_agreement_1,True,True,False,True,560,-49.85019302368164,-51.75517272949219,1
These doctors scan this pamphlet.,These doctors scan this pamphlets.,morphology,determiner_noun_agreement,determiner_noun_agreement_1,True,True,False,True,561,-41.34747314453125,-48.70304870605469,1
Walter wasn't talking about those children.,Walter wasn't talking about those child.,morphology,determiner_noun_agreement,determiner_noun_agreement_1,True,True,False,True,562,-31.214920043945312,-34.77045440673828,1
Stephen knew that adult.,Stephen knew that adults.,morphology,determiner_noun_agreement,determiner_noun_agreement_1,True,True,False,True,563,-24.589031219482422,-23.811552047729492,0
This patient was concealing that senator.,This patient was concealing that senators.,morphology,determiner_noun_agreement,determiner_noun_agreement_1,True,True,False,True,564,-57.60328674316406,-60.44793701171875,1
That organization bores those pedestrians.,That organization bores those pedestrian.,morphology,determiner_noun_agreement,determiner_noun_agreement_1,True,True,False,True,565,-54.53590774536133,-54.97988510131836,1
Daniel tours this library.,Daniel tours this libraries.,morphology,determiner_noun_agreement,determiner_noun_agreement_1,True,True,False,True,566,-30.86266326904297,-34.93217468261719,1
Patricia runs around these movie theaters.,Patricia runs around these movie theater.,morphology,determiner_noun_agreement,determiner_noun_agreement_1,True,True,False,True,567,-52.99031066894531,-53.23579406738281,1
Dawn alarmed that driver.,Dawn alarmed that drivers.,morphology,determiner_noun_agreement,determiner_noun_agreement_1,True,True,False,True,568,-49.85121536254883,-49.22837448120117,0
All jackets embarrass this teacher.,All jackets embarrass this teachers.,morphology,determiner_noun_agreement,determiner_noun_agreement_1,True,True,False,True,569,-44.71710205078125,-44.98332977294922,1
Natalie will examine those reports.,Natalie will examine those report.,morphology,determiner_noun_agreement,determiner_noun_agreement_1,True,True,False,True,570,-46.314117431640625,-48.514251708984375,1
James was lifting that cup.,James was lifting that cups.,morphology,determiner_noun_agreement,determiner_noun_agreement_1,True,True,False,True,571,-30.87454605102539,-31.927778244018555,1
Scott healed this driver.,Scott healed this drivers.,morphology,determiner_noun_agreement,determiner_noun_agreement_1,True,True,False,True,572,-31.22891616821289,-31.757251739501953,1
Suzanne has hugged that patient.,Suzanne has hugged that patients.,morphology,determiner_noun_agreement,determiner_noun_agreement_1,True,True,False,True,573,-51.39921188354492,-51.42974090576172,1
Erin wasn't listening to those teachers.,Erin wasn't listening to those teacher.,morphology,determiner_noun_agreement,determiner_noun_agreement_1,True,True,False,True,574,-39.36073303222656,-40.70747375488281,1
Jason should investigate these boys.,Jason should investigate these boy.,morphology,determiner_noun_agreement,determiner_noun_agreement_1,True,True,False,True,575,-33.75324249267578,-37.12255859375,1
Jane could work with this guy.,Jane could work with this guys.,morphology,determiner_noun_agreement,determiner_noun_agreement_1,True,True,False,True,576,-29.075456619262695,-31.953336715698242,1
Omar toured that public park.,Omar toured that public parks.,morphology,determiner_noun_agreement,determiner_noun_agreement_1,True,True,False,True,577,-52.20012664794922,-51.945072174072266,0
Carts bothered these waitresses.,Carts bothered these waitress.,morphology,determiner_noun_agreement,determiner_noun_agreement_1,True,True,False,True,578,-61.9039192199707,-52.375511169433594,0
Becky hid that face.,Becky hid that faces.,morphology,determiner_noun_agreement,determiner_noun_agreement_1,True,True,False,True,579,-28.07555389404297,-29.700759887695312,1
Lori isn't running around these restaurants.,Lori isn't running around these restaurant.,morphology,determiner_noun_agreement,determiner_noun_agreement_1,True,True,False,True,580,-52.311832427978516,-55.05231857299805,1
Liam hasn't healed those cats.,Liam hasn't healed those cat.,morphology,determiner_noun_agreement,determiner_noun_agreement_1,True,True,False,True,581,-54.132442474365234,-54.541996002197266,1
Suzanne is embarrassing that actress.,Suzanne is embarrassing that actresses.,morphology,determiner_noun_agreement,determiner_noun_agreement_1,True,True,False,True,582,-47.768192291259766,-47.60819625854492,0
Ronald explored those schools.,Ronald explored those school.,morphology,determiner_noun_agreement,determiner_noun_agreement_1,True,True,False,True,583,-39.01458740234375,-42.52723693847656,1
A lot of cashiers buy those jackets.,A lot of cashiers buy those jacket.,morphology,determiner_noun_agreement,determiner_noun_agreement_1,True,True,False,True,584,-63.458961486816406,-63.47694396972656,1
The Clintons ran around this public park.,The Clintons ran around this public parks.,morphology,determiner_noun_agreement,determiner_noun_agreement_1,True,True,False,True,585,-53.205657958984375,-54.206851959228516,1
Kirsten stunned that actor.,Kirsten stunned that actors.,morphology,determiner_noun_agreement,determiner_noun_agreement_1,True,True,False,True,586,-54.260841369628906,-54.362144470214844,1
Melissa did wear this hat.,Melissa did wear this hats.,morphology,determiner_noun_agreement,determiner_noun_agreement_1,True,True,False,True,587,-38.859703063964844,-42.166969299316406,1
Peter was observing these girls.,Peter was observing these girl.,morphology,determiner_noun_agreement,determiner_noun_agreement_1,True,True,False,True,588,-33.80340576171875,-36.16543960571289,1
Frank hadn't researched these associations.,Frank hadn't researched these association.,morphology,determiner_noun_agreement,determiner_noun_agreement_1,True,True,False,True,589,-44.16865539550781,-45.198387145996094,1
Christine heals this girl.,Christine heals this girls.,morphology,determiner_noun_agreement,determiner_noun_agreement_1,True,True,False,True,590,-40.75379943847656,-43.497676849365234,1
The Lutherans astounds these pedestrians.,The Lutherans astounds these pedestrian.,morphology,determiner_noun_agreement,determiner_noun_agreement_1,True,True,False,True,591,-70.41131591796875,-70.98992919921875,1
Regina arrived at this art gallery.,Regina arrived at this art galleries.,morphology,determiner_noun_agreement,determiner_noun_agreement_1,True,True,False,True,592,-47.642250061035156,-46.55173873901367,0
All women see this patient.,All women see this patients.,morphology,determiner_noun_agreement,determiner_noun_agreement_1,True,True,False,True,593,-31.504314422607422,-33.03672409057617,1
Those guys hadn't disagreed with this commentary.,Those guys hadn't disagreed with this commentaries.,morphology,determiner_noun_agreement,determiner_noun_agreement_1,True,True,False,True,594,-53.47398376464844,-61.96943283081055,1
Allison didn't visit those museums.,Allison didn't visit those museum.,morphology,determiner_noun_agreement,determiner_noun_agreement_1,True,True,False,True,595,-47.80221176147461,-47.842063903808594,1
Kimberley worried this museum.,Kimberley worried this museums.,morphology,determiner_noun_agreement,determiner_noun_agreement_1,True,True,False,True,596,-46.60762023925781,-49.798553466796875,1
Those forks bother these pedestrians.,Those forks bother these pedestrian.,morphology,determiner_noun_agreement,determiner_noun_agreement_1,True,True,False,True,597,-43.223716735839844,-44.311920166015625,1
Some school isn't helping these pedestrians.,Some school isn't helping these pedestrian.,morphology,determiner_noun_agreement,determiner_noun_agreement_1,True,True,False,True,598,-44.584896087646484,-44.813499450683594,1
Many patients notice this dress.,Many patients notice this dresses.,morphology,determiner_noun_agreement,determiner_noun_agreement_1,True,True,False,True,599,-36.128501892089844,-36.76896667480469,1
Most pedestrians attack this lady.,Most pedestrians attack this ladies.,morphology,determiner_noun_agreement,determiner_noun_agreement_1,True,True,False,True,600,-41.15456008911133,-44.71466827392578,1
Paula should visit those museums.,Paula should visit those museum.,morphology,determiner_noun_agreement,determiner_noun_agreement_1,True,True,False,True,601,-41.45665740966797,-41.044376373291016,0
All actresses visit this student.,All actresses visit this students.,morphology,determiner_noun_agreement,determiner_noun_agreement_1,True,True,False,True,602,-41.55699157714844,-43.0011100769043,1
Catherine drove to those banks.,Catherine drove to those bank.,morphology,determiner_noun_agreement,determiner_noun_agreement_1,True,True,False,True,603,-45.982391357421875,-46.37052917480469,1
Jessica helps these boys.,Jessica helps these boy.,morphology,determiner_noun_agreement,determiner_noun_agreement_1,True,True,False,True,604,-25.56248664855957,-29.23344612121582,1
Carrie doesn't annoy this patient.,Carrie doesn't annoy this patients.,morphology,determiner_noun_agreement,determiner_noun_agreement_1,True,True,False,True,605,-44.903358459472656,-45.98408889770508,1
James fired this patient.,James fired this patients.,morphology,determiner_noun_agreement,determiner_noun_agreement_1,True,True,False,True,606,-28.36451530456543,-29.741363525390625,1
Every movie theater aggravated those guys.,Every movie theater aggravated those guy.,morphology,determiner_noun_agreement,determiner_noun_agreement_1,True,True,False,True,607,-49.77994918823242,-53.1864013671875,1
Eric skated around that museum.,Eric skated around that museums.,morphology,determiner_noun_agreement,determiner_noun_agreement_1,True,True,False,True,608,-39.78937530517578,-42.817298889160156,1
Stacy conceals this turtle.,Stacy conceals this turtles.,morphology,determiner_noun_agreement,determiner_noun_agreement_1,True,True,False,True,609,-56.94636154174805,-57.84878921508789,1
A projector could confuse that guest.,A projector could confuse that guests.,morphology,determiner_noun_agreement,determiner_noun_agreement_1,True,True,False,True,610,-59.778839111328125,-60.57567596435547,1
Stacy doesn't leave this guy.,Stacy doesn't leave this guys.,morphology,determiner_noun_agreement,determiner_noun_agreement_1,True,True,False,True,611,-39.91476058959961,-43.16593933105469,1
Some mall wasn't disgusting those universities.,Some mall wasn't disgusting those university.,morphology,determiner_noun_agreement,determiner_noun_agreement_1,True,True,False,True,612,-52.54528045654297,-53.36621856689453,1
Julie might flee from these teachers.,Julie might flee from these teacher.,morphology,determiner_noun_agreement,determiner_noun_agreement_1,True,True,False,True,613,-43.562156677246094,-45.96238327026367,1
Jodi wasn't disgusting those girls.,Jodi wasn't disgusting those girl.,morphology,determiner_noun_agreement,determiner_noun_agreement_1,True,True,False,True,614,-50.439552307128906,-52.49260330200195,1
George isn't bringing this grocery store.,George isn't bringing this grocery stores.,morphology,determiner_noun_agreement,determiner_noun_agreement_1,True,True,False,True,615,-42.78761291503906,-43.61924743652344,1
A boy ran around this museum.,A boy ran around this museums.,morphology,determiner_noun_agreement,determiner_noun_agreement_1,True,True,False,True,616,-43.86865234375,-47.26606750488281,1
Lori shouldn't break this dish.,Lori shouldn't break this dishs.,morphology,determiner_noun_agreement,determiner_noun_agreement_1,True,True,False,True,617,-47.17332458496094,-56.688194274902344,1
Some cakes embarrass those actresses.,Some cakes embarrass those actress.,morphology,determiner_noun_agreement,determiner_noun_agreement_1,True,True,False,True,618,-45.48442840576172,-48.090972900390625,1
Literature disturbs those universities.,Literature disturbs those university.,morphology,determiner_noun_agreement,determiner_noun_agreement_1,True,True,False,True,619,-50.31953811645508,-51.61722946166992,1
The teachers argue about those guys.,The teachers argue about those guy.,morphology,determiner_noun_agreement,determiner_noun_agreement_1,True,True,False,True,620,-30.478485107421875,-34.31940841674805,1
All pies aren't shocking these dancers.,All pies aren't shocking these dancer.,morphology,determiner_noun_agreement,determiner_noun_agreement_1,True,True,False,True,621,-50.43819046020508,-52.346961975097656,1
Some students weren't disagreeing with these adults.,Some students weren't disagreeing with these adult.,morphology,determiner_noun_agreement,determiner_noun_agreement_1,True,True,False,True,622,-53.4532470703125,-58.37387466430664,1
A woman is looking like those paintings.,A woman is looking like those painting.,morphology,determiner_noun_agreement,determiner_noun_agreement_1,True,True,False,True,623,-48.611793518066406,-48.70621109008789,1
A box alarms these actresses.,A box alarms these actress.,morphology,determiner_noun_agreement,determiner_noun_agreement_1,True,True,False,True,624,-52.454673767089844,-55.277427673339844,1
A lot of ladies can have that pamphlet.,A lot of ladies can have that pamphlets.,morphology,determiner_noun_agreement,determiner_noun_agreement_1,True,True,False,True,625,-52.078060150146484,-58.53105163574219,1
Meredith cured these guys.,Meredith cured these guy.,morphology,determiner_noun_agreement,determiner_noun_agreement_1,True,True,False,True,626,-48.51638412475586,-51.84369659423828,1
Phillip won't think about those students.,Phillip won't think about those student.,morphology,determiner_noun_agreement,determiner_noun_agreement_1,True,True,False,True,627,-37.89678192138672,-41.29130554199219,1
This hat disgusts that boy.,This hat disgusts that boys.,morphology,determiner_noun_agreement,determiner_noun_agreement_1,True,True,False,True,628,-44.04814147949219,-45.701171875,1
Raymond has forgotten that guy.,Raymond has forgotten that guys.,morphology,determiner_noun_agreement,determiner_noun_agreement_1,True,True,False,True,629,-36.79560089111328,-38.25787353515625,1
Erin hasn't toured these grocery stores.,Erin hasn't toured these grocery store.,morphology,determiner_noun_agreement,determiner_noun_agreement_1,True,True,False,True,630,-57.121559143066406,-59.82841110229492,1
The pies did alarm these students.,The pies did alarm these student.,morphology,determiner_noun_agreement,determiner_noun_agreement_1,True,True,False,True,631,-48.37550354003906,-51.409244537353516,1
Daniel does exit these public parks.,Daniel does exit these public park.,morphology,determiner_noun_agreement,determiner_noun_agreement_1,True,True,False,True,632,-45.51667785644531,-46.61836242675781,1
Theresa is arriving at that hospital.,Theresa is arriving at that hospitals.,morphology,determiner_noun_agreement,determiner_noun_agreement_1,True,True,False,True,633,-39.2027587890625,-43.49165344238281,1
Emily hasn't exited these grocery stores.,Emily hasn't exited these grocery store.,morphology,determiner_noun_agreement,determiner_noun_agreement_1,True,True,False,True,634,-51.53338623046875,-54.00428009033203,1
Sherry is concealing these brochures.,Sherry is concealing these brochure.,morphology,determiner_noun_agreement,determiner_noun_agreement_1,True,True,False,True,635,-76.6587142944336,-79.26402282714844,1
Jeffrey does complain about those reports.,Jeffrey does complain about those report.,morphology,determiner_noun_agreement,determiner_noun_agreement_1,True,True,False,True,636,-45.865936279296875,-48.91496276855469,1
All girls see that pedestrian.,All girls see that pedestrians.,morphology,determiner_noun_agreement,determiner_noun_agreement_1,True,True,False,True,637,-36.054561614990234,-35.28514099121094,0
Those actresses approach that student.,Those actresses approach that students.,morphology,determiner_noun_agreement,determiner_noun_agreement_1,True,True,False,True,638,-36.788787841796875,-36.12495803833008,0
