sentence_good,sentence_bad,field,linguistics_term,UID,simple_LM_method,one_prefix_method,two_prefix_method,lexically_identical,pair_id,good_prob,bad_prob,correct
Patricia wasn't pleasant to escape from.,Patricia wasn't unlikely to escape from.,syntax_semantics,control_raising,tough_vs_raising_1,True,False,False,False,656,-48.72064971923828,-49.49709701538086,1
Those glaciers are difficult to go to.,Those glaciers are likely to go to.,syntax_semantics,control_raising,tough_vs_raising_1,True,False,False,False,657,-34.48700714111328,-34.54491424560547,1
Elizabeth isn't tough to boast about.,Elizabeth isn't apt to boast about.,syntax_semantics,control_raising,tough_vs_raising_1,True,False,False,False,658,-44.45808410644531,-46.183128356933594,1
Laurie is tough to conceal.,Laurie is certain to conceal.,syntax_semantics,control_raising,tough_vs_raising_1,True,False,False,False,659,-42.167266845703125,-47.17518615722656,1
Winston Churchill's oncologists are exciting to work with.,Winston Churchill's oncologists are about to work with.,syntax_semantics,control_raising,tough_vs_raising_1,True,False,False,False,660,-83.73655700683594,-79.32310485839844,0
Kimberley's contractor was pleasant to flee from.,Kimberley's contractor was apt to flee from.,syntax_semantics,control_raising,tough_vs_raising_1,True,False,False,False,661,-66.48404693603516,-66.128173828125,0
A book about the Great Lakes is unpleasant to examine.,A book about the Great Lakes is about to examine.,syntax_semantics,control_raising,tough_vs_raising_1,True,False,False,False,662,-74.51934814453125,-66.76544189453125,0
The movie theater isn't pleasant to bike to.,The movie theater isn't apt to bike to.,syntax_semantics,control_raising,tough_vs_raising_1,True,False,False,False,663,-56.11814880371094,-57.0928955078125,1
Craig wasn't tough to argue about.,Craig wasn't about to argue about.,syntax_semantics,control_raising,tough_vs_raising_1,True,False,False,False,664,-35.504417419433594,-34.09056091308594,0
Some college campus is interesting to drop by.,Some college campus is sure to drop by.,syntax_semantics,control_raising,tough_vs_raising_1,True,False,False,False,665,-51.25295639038086,-52.940589904785156,1
Dan's French teachers aren't ready to reveal.,Dan's French teachers aren't apt to reveal.,syntax_semantics,control_raising,tough_vs_raising_1,True,False,False,False,666,-48.77454376220703,-55.048789978027344,1
Clyde is unpleasant to reference.,Clyde is certain to reference.,syntax_semantics,control_raising,tough_vs_raising_1,True,False,False,False,667,-65.76504516601562,-62.601783752441406,0
Judy wasn't fun to respect.,Judy wasn't soon to respect.,syntax_semantics,control_raising,tough_vs_raising_1,True,False,False,False,668,-37.196468353271484,-42.382568359375,1
A lot of children's brothers aren't difficult to talk to.,A lot of children's brothers aren't soon to talk to.,syntax_semantics,control_raising,tough_vs_raising_1,True,False,False,False,669,-61.73579025268555,-67.01905822753906,1
Deborah isn't interesting to return to.,Deborah isn't certain to return to.,syntax_semantics,control_raising,tough_vs_raising_1,True,False,False,False,670,-42.03187561035156,-44.118709564208984,1
Sheila is unpleasant to cure.,Sheila is soon to cure.,syntax_semantics,control_raising,tough_vs_raising_1,True,False,False,False,671,-42.66691589355469,-40.39680480957031,0
Alice is irritating to flee from.,Alice is apt to flee from.,syntax_semantics,control_raising,tough_vs_raising_1,True,False,False,False,672,-38.46001434326172,-38.2470703125,0
Julie's sisters weren't hard work to work with.,Julie's sisters weren't likely to work with.,syntax_semantics,control_raising,tough_vs_raising_1,True,False,False,False,673,-53.42700958251953,-46.861572265625,0
Julia was difficult to talk to.,Julia was apt to talk to.,syntax_semantics,control_raising,tough_vs_raising_1,True,False,False,False,674,-30.02393341064453,-34.03096008300781,1
Women aren't boring to reveal.,Women aren't sure to reveal.,syntax_semantics,control_raising,tough_vs_raising_1,True,False,False,False,675,-32.682167053222656,-30.98385238647461,0
The Borgias weren't enjoyable to escape from.,The Borgias weren't sure to escape from.,syntax_semantics,control_raising,tough_vs_raising_1,True,False,False,False,676,-67.58627319335938,-63.65005111694336,0
All movie theaters aren't enjoyable to go to.,All movie theaters aren't about to go to.,syntax_semantics,control_raising,tough_vs_raising_1,True,False,False,False,677,-56.412803649902344,-50.97059631347656,0
That driver is unpleasant to conceal.,That driver is unlikely to conceal.,syntax_semantics,control_raising,tough_vs_raising_1,True,False,False,False,678,-44.99292755126953,-44.189022064208984,0
Anne wasn't boring to boast about.,Anne wasn't likely to boast about.,syntax_semantics,control_raising,tough_vs_raising_1,True,False,False,False,679,-49.216644287109375,-44.668312072753906,0
Robert is difficult to scare.,Robert is certain to scare.,syntax_semantics,control_raising,tough_vs_raising_1,True,False,False,False,680,-28.214641571044922,-31.911500930786133,1
Jerry wasn't ready to scare.,Jerry wasn't sure to scare.,syntax_semantics,control_raising,tough_vs_raising_1,True,False,False,False,681,-28.857479095458984,-31.642126083374023,1
Those high schools weren't tough to arrive at.,Those high schools weren't bound to arrive at.,syntax_semantics,control_raising,tough_vs_raising_1,True,False,False,False,682,-49.10475158691406,-47.90369415283203,0
The cafe was unpleasant to drop by.,The cafe was apt to drop by.,syntax_semantics,control_raising,tough_vs_raising_1,True,False,False,False,683,-46.721866607666016,-44.93511962890625,0
Every closet wasn't difficult to go to.,Every closet wasn't bound to go to.,syntax_semantics,control_raising,tough_vs_raising_1,True,False,False,False,684,-38.28010177612305,-39.526634216308594,1
The museum wasn't exciting to drop by.,The museum wasn't unlikely to drop by.,syntax_semantics,control_raising,tough_vs_raising_1,True,False,False,False,685,-46.21058654785156,-48.6694221496582,1
Laurie's nephews weren't exciting to flee from.,Laurie's nephews weren't sure to flee from.,syntax_semantics,control_raising,tough_vs_raising_1,True,False,False,False,686,-72.79649353027344,-72.97113800048828,1
Most nephews of Alan weren't boring to flee from.,Most nephews of Alan weren't sure to flee from.,syntax_semantics,control_raising,tough_vs_raising_1,True,False,False,False,687,-78.76969909667969,-76.15306854248047,0
Florence wasn't irritating to scare.,Florence wasn't likely to scare.,syntax_semantics,control_raising,tough_vs_raising_1,True,False,False,False,688,-50.74565887451172,-46.47471237182617,0
The dress isn't interesting to wear.,The dress isn't soon to wear.,syntax_semantics,control_raising,tough_vs_raising_1,True,False,False,False,689,-37.93096923828125,-43.46170425415039,1
This oasis isn't hard work to walk through.,This oasis isn't soon to walk through.,syntax_semantics,control_raising,tough_vs_raising_1,True,False,False,False,690,-60.15020751953125,-58.497127532958984,0
Those malls were ready to drive to.,Those malls were apt to drive to.,syntax_semantics,control_raising,tough_vs_raising_1,True,False,False,False,691,-39.74836349487305,-47.25466537475586,1
Roger's daughters are easy to escape from.,Roger's daughters are sure to escape from.,syntax_semantics,control_raising,tough_vs_raising_1,True,False,False,False,692,-43.394981384277344,-45.925960540771484,1
Teresa isn't tough to complain about.,Teresa isn't sure to complain about.,syntax_semantics,control_raising,tough_vs_raising_1,True,False,False,False,693,-46.75876998901367,-47.49955368041992,1
Jason's best friend wasn't interesting to examine.,Jason's best friend wasn't unlikely to examine.,syntax_semantics,control_raising,tough_vs_raising_1,True,False,False,False,694,-49.461849212646484,-53.72315979003906,1
That bike isn't hard to lift.,That bike isn't likely to lift.,syntax_semantics,control_raising,tough_vs_raising_1,True,False,False,False,695,-37.84560775756836,-42.93125915527344,1
Many photographs of the spotlight aren't annoying to conceal.,Many photographs of the spotlight aren't soon to conceal.,syntax_semantics,control_raising,tough_vs_raising_1,True,False,False,False,696,-65.05681610107422,-65.28900146484375,1
Maria is enjoyable to respect.,Maria is apt to respect.,syntax_semantics,control_raising,tough_vs_raising_1,True,False,False,False,697,-33.8419075012207,-32.988285064697266,0
That mountain wasn't annoying to escape from.,That mountain wasn't unlikely to escape from.,syntax_semantics,control_raising,tough_vs_raising_1,True,False,False,False,698,-53.951683044433594,-53.27043151855469,0
What is boring to walk through.,What is unlikely to walk through.,syntax_semantics,control_raising,tough_vs_raising_1,True,False,False,False,699,-33.302101135253906,-35.018287658691406,1
Most companies are exciting to scare.,Most companies are soon to scare.,syntax_semantics,control_raising,tough_vs_raising_1,True,False,False,False,700,-34.89148712158203,-37.00105667114258,1
Most men are fun to reference.,Most men are unlikely to reference.,syntax_semantics,control_raising,tough_vs_raising_1,True,False,False,False,701,-37.2288932800293,-38.62670135498047,1
Most drawings are hard to conceal.,Most drawings are certain to conceal.,syntax_semantics,control_raising,tough_vs_raising_1,True,False,False,False,702,-37.04193878173828,-42.6666259765625,1
What was enjoyable to bike to.,What was sure to bike to.,syntax_semantics,control_raising,tough_vs_raising_1,True,False,False,False,703,-40.536041259765625,-40.98371505737305,1
Some banks were hard work to arrive at.,Some banks were unlikely to arrive at.,syntax_semantics,control_raising,tough_vs_raising_1,True,False,False,False,704,-46.15719223022461,-43.89044952392578,0
A granddaughter of Christopher isn't pleasant to talk to.,A granddaughter of Christopher isn't likely to talk to.,syntax_semantics,control_raising,tough_vs_raising_1,True,False,False,False,705,-68.7541275024414,-65.1552963256836,0
This popsicle is ready to conceal.,This popsicle is soon to conceal.,syntax_semantics,control_raising,tough_vs_raising_1,True,False,False,False,706,-47.49420166015625,-54.60567855834961,1
Many girls aren't hard to care for.,Many girls aren't certain to care for.,syntax_semantics,control_raising,tough_vs_raising_1,True,False,False,False,707,-35.77922439575195,-41.17250061035156,1
Janet is interesting to escape from.,Janet is certain to escape from.,syntax_semantics,control_raising,tough_vs_raising_1,True,False,False,False,708,-41.486915588378906,-45.19157028198242,1
Many offspring aren't unpleasant to complain about.,Many offspring aren't soon to complain about.,syntax_semantics,control_raising,tough_vs_raising_1,True,False,False,False,709,-50.47412109375,-49.963836669921875,0
Melinda's mother was hard work to listen to.,Melinda's mother was unlikely to listen to.,syntax_semantics,control_raising,tough_vs_raising_1,True,False,False,False,710,-49.93431091308594,-47.227874755859375,0
This school was easy to drop by.,This school was unlikely to drop by.,syntax_semantics,control_raising,tough_vs_raising_1,True,False,False,False,711,-38.25424575805664,-43.4550895690918,1
Ella wasn't unpleasant to boast about.,Ella wasn't likely to boast about.,syntax_semantics,control_raising,tough_vs_raising_1,True,False,False,False,712,-61.010154724121094,-55.51690673828125,0
Beverly's fathers are easy to scare.,Beverly's fathers are apt to scare.,syntax_semantics,control_raising,tough_vs_raising_1,True,False,False,False,713,-67.6082992553711,-71.94482421875,1
Those grocery stores were difficult to drive to.,Those grocery stores were likely to drive to.,syntax_semantics,control_raising,tough_vs_raising_1,True,False,False,False,714,-43.75617980957031,-45.47613525390625,1
Deanna is annoying to cure.,Deanna is sure to cure.,syntax_semantics,control_raising,tough_vs_raising_1,True,False,False,False,715,-39.19921875,-35.113277435302734,0
Most libraries weren't interesting to bike to.,Most libraries weren't apt to bike to.,syntax_semantics,control_raising,tough_vs_raising_1,True,False,False,False,716,-54.40338897705078,-56.6988525390625,1
Steven isn't hard work to conceal.,Steven isn't likely to conceal.,syntax_semantics,control_raising,tough_vs_raising_1,True,False,False,False,717,-40.650962829589844,-35.18804168701172,0
Some glacier isn't hard work to drop by.,Some glacier isn't about to drop by.,syntax_semantics,control_raising,tough_vs_raising_1,True,False,False,False,718,-57.912452697753906,-50.65277862548828,0
What was ready to bike to.,What was bound to bike to.,syntax_semantics,control_raising,tough_vs_raising_1,True,False,False,False,719,-36.54086685180664,-36.41695022583008,0
A lot of oases weren't irritating to bike to.,A lot of oases weren't sure to bike to.,syntax_semantics,control_raising,tough_vs_raising_1,True,False,False,False,720,-85.25341033935547,-82.50825500488281,0
She was irritating to scare.,She was likely to scare.,syntax_semantics,control_raising,tough_vs_raising_1,True,False,False,False,721,-30.833961486816406,-25.687498092651367,0
Every man wasn't boring to flee from.,Every man wasn't certain to flee from.,syntax_semantics,control_raising,tough_vs_raising_1,True,False,False,False,722,-50.28350830078125,-50.64910888671875,1
Carla is irritating to escape from.,Carla is likely to escape from.,syntax_semantics,control_raising,tough_vs_raising_1,True,False,False,False,723,-44.685028076171875,-39.46113586425781,0
Valerie's handymen weren't ready to fire.,Valerie's handymen weren't soon to fire.,syntax_semantics,control_raising,tough_vs_raising_1,True,False,False,False,724,-67.07719421386719,-73.79434967041016,1
Diana was annoying to escape from.,Diana was unlikely to escape from.,syntax_semantics,control_raising,tough_vs_raising_1,True,False,False,False,725,-56.951637268066406,-55.57323455810547,0
These hospitals were hard work to walk through.,These hospitals were unlikely to walk through.,syntax_semantics,control_raising,tough_vs_raising_1,True,False,False,False,726,-42.42878723144531,-41.5491828918457,0
Gary's mother isn't pleasant to scare.,Gary's mother isn't unlikely to scare.,syntax_semantics,control_raising,tough_vs_raising_1,True,False,False,False,727,-42.6218376159668,-43.44078826904297,1
These lakes were fun to arrive at.,These lakes were bound to arrive at.,syntax_semantics,control_raising,tough_vs_raising_1,True,False,False,False,728,-40.65161895751953,-38.81987762451172,0
Cynthia's partner was pleasant to examine.,Cynthia's partner was apt to examine.,syntax_semantics,control_raising,tough_vs_raising_1,True,False,False,False,729,-75.43877410888672,-74.75361633300781,0
Omar isn't ready to care for.,Omar isn't soon to care for.,syntax_semantics,control_raising,tough_vs_raising_1,True,False,False,False,730,-42.139122009277344,-51.74846267700195,1
Charles is hard to care for.,Charles is bound to care for.,syntax_semantics,control_raising,tough_vs_raising_1,True,False,False,False,731,-24.979787826538086,-27.75482177734375,1
Banks aren't easy to arrive at.,Banks aren't sure to arrive at.,syntax_semantics,control_raising,tough_vs_raising_1,True,False,False,False,732,-53.59267044067383,-56.48786163330078,1
A play wasn't unpleasant to examine.,A play wasn't apt to examine.,syntax_semantics,control_raising,tough_vs_raising_1,True,False,False,False,733,-58.683990478515625,-58.106407165527344,0
Brenda's piano teachers weren't unpleasant to escape from.,Brenda's piano teachers weren't unlikely to escape from.,syntax_semantics,control_raising,tough_vs_raising_1,True,False,False,False,734,-72.19719696044922,-73.1829833984375,1
Margaret's grandfathers aren't pleasant to examine.,Margaret's grandfathers aren't apt to examine.,syntax_semantics,control_raising,tough_vs_raising_1,True,False,False,False,735,-60.12626647949219,-59.82181167602539,0
Martha wasn't exciting to disagree with.,Martha wasn't unlikely to disagree with.,syntax_semantics,control_raising,tough_vs_raising_1,True,False,False,False,736,-42.625545501708984,-45.73326110839844,1
The bank isn't easy to go to.,The bank isn't soon to go to.,syntax_semantics,control_raising,tough_vs_raising_1,True,False,False,False,737,-33.0063362121582,-42.11479187011719,1
These mountains were pleasant to go to.,These mountains were soon to go to.,syntax_semantics,control_raising,tough_vs_raising_1,True,False,False,False,738,-39.44467544555664,-36.742557525634766,0
Omar's student is unpleasant to reference.,Omar's student is sure to reference.,syntax_semantics,control_raising,tough_vs_raising_1,True,False,False,False,739,-55.566627502441406,-53.8986701965332,0
A man was boring to respect.,A man was likely to respect.,syntax_semantics,control_raising,tough_vs_raising_1,True,False,False,False,740,-48.274356842041016,-45.30499267578125,0
A glacier is fun to bike to.,A glacier is soon to bike to.,syntax_semantics,control_raising,tough_vs_raising_1,True,False,False,False,741,-59.194732666015625,-62.69904327392578,1
These lice are annoying to lift.,These lice are sure to lift.,syntax_semantics,control_raising,tough_vs_raising_1,True,False,False,False,742,-47.30359649658203,-45.226959228515625,0
That shoe isn't boring to wear.,That shoe isn't apt to wear.,syntax_semantics,control_raising,tough_vs_raising_1,True,False,False,False,743,-42.440589904785156,-43.948795318603516,1
Many museums were annoying to scare.,Many museums were unlikely to scare.,syntax_semantics,control_raising,tough_vs_raising_1,True,False,False,False,744,-43.42655944824219,-42.152496337890625,0
The rug is easy to reveal.,The rug is soon to reveal.,syntax_semantics,control_raising,tough_vs_raising_1,True,False,False,False,745,-35.73023223876953,-41.26756286621094,1
A lot of cafes are difficult to arrive at.,A lot of cafes are certain to arrive at.,syntax_semantics,control_raising,tough_vs_raising_1,True,False,False,False,746,-61.97884750366211,-65.29605102539062,1
That high school was ready to go to.,That high school was bound to go to.,syntax_semantics,control_raising,tough_vs_raising_1,True,False,False,False,747,-36.14804458618164,-37.388526916503906,1
Hospitals are annoying to drive to.,Hospitals are apt to drive to.,syntax_semantics,control_raising,tough_vs_raising_1,True,False,False,False,748,-52.878517150878906,-52.22496032714844,0
Bruce was hard work to care for.,Bruce was sure to care for.,syntax_semantics,control_raising,tough_vs_raising_1,True,False,False,False,749,-37.396480560302734,-32.26581573486328,0
Douglas's spouse is fun to return to.,Douglas's spouse is apt to return to.,syntax_semantics,control_raising,tough_vs_raising_1,True,False,False,False,750,-58.150638580322266,-61.00381851196289,1
Chad is annoying to boast about.,Chad is certain to boast about.,syntax_semantics,control_raising,tough_vs_raising_1,True,False,False,False,751,-56.650360107421875,-56.997901916503906,1
This public park isn't irritating to bike to.,This public park isn't apt to bike to.,syntax_semantics,control_raising,tough_vs_raising_1,True,False,False,False,752,-58.19160079956055,-59.24504089355469,1
That shawl wasn't tough to lift.,That shawl wasn't sure to lift.,syntax_semantics,control_raising,tough_vs_raising_1,True,False,False,False,753,-54.32193374633789,-56.75859069824219,1
A cafe was unpleasant to arrive at.,A cafe was sure to arrive at.,syntax_semantics,control_raising,tough_vs_raising_1,True,False,False,False,754,-57.95869445800781,-54.1607551574707,0
That cafe isn't tough to bike to.,That cafe isn't sure to bike to.,syntax_semantics,control_raising,tough_vs_raising_1,True,False,False,False,755,-50.39910125732422,-54.693603515625,1
Some bank is fun to drop by.,Some bank is apt to drop by.,syntax_semantics,control_raising,tough_vs_raising_1,True,False,False,False,756,-42.8994255065918,-45.394020080566406,1
Guy wasn't ready to reference.,Guy wasn't sure to reference.,syntax_semantics,control_raising,tough_vs_raising_1,True,False,False,False,757,-30.91337013244629,-33.11932373046875,1
Diane wasn't hard to argue about.,Diane wasn't certain to argue about.,syntax_semantics,control_raising,tough_vs_raising_1,True,False,False,False,758,-48.85651397705078,-56.28386688232422,1
The patients' teachers aren't hard work to complain about.,The patients' teachers aren't about to complain about.,syntax_semantics,control_raising,tough_vs_raising_1,True,False,False,False,759,-65.00228881835938,-57.75813293457031,0
Joseph was tough to reference.,Joseph was apt to reference.,syntax_semantics,control_raising,tough_vs_raising_1,True,False,False,False,760,-28.187747955322266,-34.185726165771484,1
A lot of college campuses aren't difficult to arrive at.,A lot of college campuses aren't apt to arrive at.,syntax_semantics,control_raising,tough_vs_raising_1,True,False,False,False,761,-71.24476623535156,-76.27428436279297,1
Nancy's grandsons aren't exciting to examine.,Nancy's grandsons aren't unlikely to examine.,syntax_semantics,control_raising,tough_vs_raising_1,True,False,False,False,762,-78.09342193603516,-81.21646118164062,1
Diana wasn't easy to listen to.,Diana wasn't sure to listen to.,syntax_semantics,control_raising,tough_vs_raising_1,True,False,False,False,763,-44.87273406982422,-47.430633544921875,1
The river was hard work to arrive at.,The river was certain to arrive at.,syntax_semantics,control_raising,tough_vs_raising_1,True,False,False,False,764,-42.842315673828125,-42.736454010009766,0
Cheryl wasn't ready to escape from.,Cheryl wasn't sure to escape from.,syntax_semantics,control_raising,tough_vs_raising_1,True,False,False,False,765,-60.184783935546875,-64.1461410522461,1
Every analysis is boring to argue about.,Every analysis is about to argue about.,syntax_semantics,control_raising,tough_vs_raising_1,True,False,False,False,766,-40.8558464050293,-36.10096740722656,0
Some father of Martin is ready to scare.,Some father of Martin is soon to scare.,syntax_semantics,control_raising,tough_vs_raising_1,True,False,False,False,767,-48.97081756591797,-56.412200927734375,1
A lot of alumni aren't annoying to reference.,A lot of alumni aren't bound to reference.,syntax_semantics,control_raising,tough_vs_raising_1,True,False,False,False,768,-69.24491882324219,-64.4958724975586,0
Stephen's mothers weren't exciting to reveal.,Stephen's mothers weren't unlikely to reveal.,syntax_semantics,control_raising,tough_vs_raising_1,True,False,False,False,769,-48.661651611328125,-51.063140869140625,1
Those books weren't ready to lift.,Those books weren't sure to lift.,syntax_semantics,control_raising,tough_vs_raising_1,True,False,False,False,770,-35.475807189941406,-40.396270751953125,1
That college campus is difficult to lift.,That college campus is soon to lift.,syntax_semantics,control_raising,tough_vs_raising_1,True,False,False,False,771,-48.217918395996094,-54.29273986816406,1
April's supervisors were interesting to conceal.,April's supervisors were soon to conceal.,syntax_semantics,control_raising,tough_vs_raising_1,True,False,False,False,772,-53.3079948425293,-54.5374755859375,1
These stories about Winston Churchill weren't tough to disagree with.,These stories about Winston Churchill weren't apt to disagree with.,syntax_semantics,control_raising,tough_vs_raising_1,True,False,False,False,773,-71.33505249023438,-74.70318603515625,1
Carrie wasn't interesting to talk about.,Carrie wasn't bound to talk about.,syntax_semantics,control_raising,tough_vs_raising_1,True,False,False,False,774,-39.0424690246582,-38.671043395996094,0
The jackets aren't irritating to wear.,The jackets aren't likely to wear.,syntax_semantics,control_raising,tough_vs_raising_1,True,False,False,False,775,-44.238704681396484,-39.80226135253906,0
Wendy's dermatologists aren't fun to return to.,Wendy's dermatologists aren't apt to return to.,syntax_semantics,control_raising,tough_vs_raising_1,True,False,False,False,776,-80.74771118164062,-84.75345611572266,1
A lot of high schools weren't unpleasant to arrive at.,A lot of high schools weren't likely to arrive at.,syntax_semantics,control_raising,tough_vs_raising_1,True,False,False,False,777,-71.28388977050781,-66.9753189086914,0
Every guest wasn't easy to conceal.,Every guest wasn't about to conceal.,syntax_semantics,control_raising,tough_vs_raising_1,True,False,False,False,778,-42.930580139160156,-44.938499450683594,1
Some thesis is hard to conceal.,Some thesis is likely to conceal.,syntax_semantics,control_raising,tough_vs_raising_1,True,False,False,False,779,-37.22758865356445,-39.9810905456543,1
A museum was ready to drive to.,A museum was apt to drive to.,syntax_semantics,control_raising,tough_vs_raising_1,True,False,False,False,780,-46.60813903808594,-52.97551727294922,1
An alumnus is boring to cure.,An alumnus is certain to cure.,syntax_semantics,control_raising,tough_vs_raising_1,True,False,False,False,781,-49.67427444458008,-51.87590789794922,1
This niece of Helen isn't annoying to examine.,This niece of Helen isn't apt to examine.,syntax_semantics,control_raising,tough_vs_raising_1,True,False,False,False,782,-65.72482299804688,-64.53805541992188,0
Amanda wasn't boring to return to.,Amanda wasn't soon to return to.,syntax_semantics,control_raising,tough_vs_raising_1,True,False,False,False,783,-44.22207260131836,-45.79689025878906,1
The college campus wasn't annoying to drive to.,The college campus wasn't about to drive to.,syntax_semantics,control_raising,tough_vs_raising_1,True,False,False,False,784,-56.90284729003906,-51.58032989501953,0
This public park isn't unpleasant to walk through.,This public park isn't certain to walk through.,syntax_semantics,control_raising,tough_vs_raising_1,True,False,False,False,785,-55.571380615234375,-55.4754638671875,0
Dennis was ready to boast about.,Dennis was bound to boast about.,syntax_semantics,control_raising,tough_vs_raising_1,True,False,False,False,786,-54.12189483642578,-56.47818374633789,1
