sentence_good,sentence_bad,field,linguistics_term,UID,simple_LM_method,one_prefix_method,two_prefix_method,lexically_identical,pair_id,good_prob,bad_prob,correct
High schools are interesting to drop by.,High schools are certain to drop by.,syntax_semantics,control_raising,tough_vs_raising_1,True,False,False,False,264,-39.626731872558594,-41.717960357666016,1
Brenda was difficult to work with.,Brenda was unlikely to work with.,syntax_semantics,control_raising,tough_vs_raising_1,True,False,False,False,265,-31.797178268432617,-35.39500427246094,1
Every man is easy to talk about.,Every man is about to talk about.,syntax_semantics,control_raising,tough_vs_raising_1,True,False,False,False,266,-29.594581604003906,-29.036575317382812,0
Matt isn't difficult to complain about.,Matt isn't likely to complain about.,syntax_semantics,control_raising,tough_vs_raising_1,True,False,False,False,267,-34.01511001586914,-34.52465057373047,1
That river wasn't interesting to drive to.,That river wasn't about to drive to.,syntax_semantics,control_raising,tough_vs_raising_1,True,False,False,False,268,-43.08668899536133,-43.001861572265625,0
Those schools weren't pleasant to drop by.,Those schools weren't bound to drop by.,syntax_semantics,control_raising,tough_vs_raising_1,True,False,False,False,269,-45.8831672668457,-41.64493179321289,0
Michelle wasn't hard work to complain about.,Michelle wasn't bound to complain about.,syntax_semantics,control_raising,tough_vs_raising_1,True,False,False,False,270,-41.57194519042969,-36.07904815673828,0
Restaurants aren't exciting to drop by.,Restaurants aren't apt to drop by.,syntax_semantics,control_raising,tough_vs_raising_1,True,False,False,False,271,-55.100746154785156,-56.801910400390625,1
Eva isn't exciting to reference.,Eva isn't about to reference.,syntax_semantics,control_raising,tough_vs_raising_1,True,False,False,False,272,-34.20991516113281,-31.595630645751953,0
Most art galleries weren't enjoyable to drop by.,Most art galleries weren't bound to drop by.,syntax_semantics,control_raising,tough_vs_raising_1,True,False,False,False,273,-59.88344955444336,-55.08715057373047,0
Janet wasn't boring to fire.,Janet wasn't apt to fire.,syntax_semantics,control_raising,tough_vs_raising_1,True,False,False,False,274,-42.60887908935547,-43.155948638916016,1
Spain is difficult to bike to.,Spain is likely to bike to.,syntax_semantics,control_raising,tough_vs_raising_1,True,False,False,False,275,-33.55316925048828,-35.141902923583984,1
These cashiers are tough to work with.,These cashiers are certain to work with.,syntax_semantics,control_raising,tough_vs_raising_1,True,False,False,False,276,-43.5523681640625,-46.86106872558594,1
A lot of college campuses aren't boring to walk through.,A lot of college campuses aren't sure to walk through.,syntax_semantics,control_raising,tough_vs_raising_1,True,False,False,False,277,-72.762451171875,-72.7544937133789,0
Daniel's grandmother is irritating to cure.,Daniel's grandmother is unlikely to cure.,syntax_semantics,control_raising,tough_vs_raising_1,True,False,False,False,278,-43.35980224609375,-42.08317565917969,0
All girls weren't hard work to care for.,All girls weren't soon to care for.,syntax_semantics,control_raising,tough_vs_raising_1,True,False,False,False,279,-49.30912780761719,-48.08038330078125,0
The nuclei weren't ready to lift.,The nuclei weren't soon to lift.,syntax_semantics,control_raising,tough_vs_raising_1,True,False,False,False,280,-47.926490783691406,-54.97028350830078,1
Eric is enjoyable to return to.,Eric is certain to return to.,syntax_semantics,control_raising,tough_vs_raising_1,True,False,False,False,281,-37.35456848144531,-32.47511291503906,0
Raymond was hard to boast about.,Raymond was about to boast about.,syntax_semantics,control_raising,tough_vs_raising_1,True,False,False,False,282,-47.26899719238281,-49.1480712890625,1
Matt wasn't easy to scare.,Matt wasn't bound to scare.,syntax_semantics,control_raising,tough_vs_raising_1,True,False,False,False,283,-30.15231704711914,-32.946533203125,1
Some art gallery isn't boring to drive to.,Some art gallery isn't soon to drive to.,syntax_semantics,control_raising,tough_vs_raising_1,True,False,False,False,284,-57.081695556640625,-59.09466552734375,1
Roger wasn't boring to reveal.,Roger wasn't soon to reveal.,syntax_semantics,control_raising,tough_vs_raising_1,True,False,False,False,285,-36.876014709472656,-37.2156982421875,1
The girl isn't pleasant to return to.,The girl isn't apt to return to.,syntax_semantics,control_raising,tough_vs_raising_1,True,False,False,False,286,-46.449867248535156,-45.43771743774414,0
Stephanie isn't pleasant to boast about.,Stephanie isn't likely to boast about.,syntax_semantics,control_raising,tough_vs_raising_1,True,False,False,False,287,-58.620357513427734,-54.70520782470703,0
Leslie wasn't unpleasant to argue about.,Leslie wasn't likely to argue about.,syntax_semantics,control_raising,tough_vs_raising_1,True,False,False,False,288,-53.162139892578125,-47.85212707519531,0
Those malls are hard to walk through.,Those malls are about to walk through.,syntax_semantics,control_raising,tough_vs_raising_1,True,False,False,False,289,-38.38209915161133,-41.050201416015625,1
Heather wasn't unpleasant to talk about.,Heather wasn't unlikely to talk about.,syntax_semantics,control_raising,tough_vs_raising_1,True,False,False,False,290,-47.1033935546875,-47.04269790649414,0
Catherine's grandsons are pleasant to examine.,Catherine's grandsons are likely to examine.,syntax_semantics,control_raising,tough_vs_raising_1,True,False,False,False,291,-76.33326721191406,-72.26679229736328,0
Those grocery stores were annoying to drive to.,Those grocery stores were certain to drive to.,syntax_semantics,control_raising,tough_vs_raising_1,True,False,False,False,292,-51.62245559692383,-49.46647262573242,0
Melanie's friends are interesting to listen to.,Melanie's friends are apt to listen to.,syntax_semantics,control_raising,tough_vs_raising_1,True,False,False,False,293,-44.590476989746094,-46.28726577758789,1
The dancers were unpleasant to listen to.,The dancers were soon to listen to.,syntax_semantics,control_raising,tough_vs_raising_1,True,False,False,False,294,-40.096343994140625,-38.21717071533203,0
The cafe is tough to walk through.,The cafe is sure to walk through.,syntax_semantics,control_raising,tough_vs_raising_1,True,False,False,False,295,-36.18731689453125,-39.34053039550781,1
That ice is easy to lift.,That ice is sure to lift.,syntax_semantics,control_raising,tough_vs_raising_1,True,False,False,False,296,-37.81523513793945,-43.88936996459961,1
Waitresses weren't easy to talk about.,Waitresses weren't bound to talk about.,syntax_semantics,control_raising,tough_vs_raising_1,True,False,False,False,297,-41.72785949707031,-44.866737365722656,1
Stacey isn't fun to argue about.,Stacey isn't bound to argue about.,syntax_semantics,control_raising,tough_vs_raising_1,True,False,False,False,298,-51.75437927246094,-52.84905242919922,1
The restaurant was annoying to walk through.,The restaurant was likely to walk through.,syntax_semantics,control_raising,tough_vs_raising_1,True,False,False,False,299,-42.82915496826172,-37.22397994995117,0
Donna's supervisors weren't enjoyable to talk about.,Donna's supervisors weren't certain to talk about.,syntax_semantics,control_raising,tough_vs_raising_1,True,False,False,False,300,-65.30057525634766,-63.393577575683594,0
Scarves aren't enjoyable to wear.,Scarves aren't sure to wear.,syntax_semantics,control_raising,tough_vs_raising_1,True,False,False,False,301,-43.61859893798828,-41.41286849975586,0
The son of Patrick was tough to conceal.,The son of Patrick was certain to conceal.,syntax_semantics,control_raising,tough_vs_raising_1,True,False,False,False,302,-50.587955474853516,-55.066253662109375,1
Some sweaters are enjoyable to wear.,Some sweaters are bound to wear.,syntax_semantics,control_raising,tough_vs_raising_1,True,False,False,False,303,-43.49129104614258,-38.00772476196289,0
Eva was hard work to argue about.,Eva was bound to argue about.,syntax_semantics,control_raising,tough_vs_raising_1,True,False,False,False,304,-37.97920227050781,-30.65766143798828,0
Pamphlets were hard work to boast about.,Pamphlets were apt to boast about.,syntax_semantics,control_raising,tough_vs_raising_1,True,False,False,False,305,-76.97303771972656,-74.01569366455078,0
Craig isn't pleasant to escape from.,Craig isn't unlikely to escape from.,syntax_semantics,control_raising,tough_vs_raising_1,True,False,False,False,306,-40.84907531738281,-41.35767364501953,1
A screen wasn't hard work to conceal.,A screen wasn't unlikely to conceal.,syntax_semantics,control_raising,tough_vs_raising_1,True,False,False,False,307,-62.23228454589844,-60.940032958984375,0
Many college campuses weren't annoying to escape from.,Many college campuses weren't sure to escape from.,syntax_semantics,control_raising,tough_vs_raising_1,True,False,False,False,308,-61.3327751159668,-57.98668670654297,0
Those libraries were hard to drive to.,Those libraries were unlikely to drive to.,syntax_semantics,control_raising,tough_vs_raising_1,True,False,False,False,309,-37.769813537597656,-45.63945007324219,1
Men were hard work to talk to.,Men were bound to talk to.,syntax_semantics,control_raising,tough_vs_raising_1,True,False,False,False,310,-34.989341735839844,-27.307395935058594,0
A lot of mountains aren't interesting to drive to.,A lot of mountains aren't unlikely to drive to.,syntax_semantics,control_raising,tough_vs_raising_1,True,False,False,False,311,-62.20817184448242,-65.26879119873047,1
Every woman's piano teachers aren't fun to reveal.,Every woman's piano teachers aren't likely to reveal.,syntax_semantics,control_raising,tough_vs_raising_1,True,False,False,False,312,-62.2967529296875,-60.39685821533203,0
Some son of the actresses was easy to complain about.,Some son of the actresses was soon to complain about.,syntax_semantics,control_raising,tough_vs_raising_1,True,False,False,False,313,-53.45655059814453,-57.38579559326172,1
Grocery stores were annoying to walk through.,Grocery stores were certain to walk through.,syntax_semantics,control_raising,tough_vs_raising_1,True,False,False,False,314,-69.32648468017578,-67.39811706542969,0
Chad's classmates aren't hard work to examine.,Chad's classmates aren't bound to examine.,syntax_semantics,control_raising,tough_vs_raising_1,True,False,False,False,315,-66.59907531738281,-60.380210876464844,0
Some college campuses were pleasant to walk through.,Some college campuses were apt to walk through.,syntax_semantics,control_raising,tough_vs_raising_1,True,False,False,False,316,-52.57767868041992,-52.54144287109375,0
Theresa wasn't hard work to fire.,Theresa wasn't unlikely to fire.,syntax_semantics,control_raising,tough_vs_raising_1,True,False,False,False,317,-47.75495910644531,-44.72205352783203,0
Sabrina is tough to flee from.,Sabrina is apt to flee from.,syntax_semantics,control_raising,tough_vs_raising_1,True,False,False,False,318,-39.82356262207031,-45.28411865234375,1
Randolf is interesting to scare.,Randolf is unlikely to scare.,syntax_semantics,control_raising,tough_vs_raising_1,True,False,False,False,319,-37.62314987182617,-40.69035339355469,1
That hill wasn't enjoyable to drop by.,That hill wasn't sure to drop by.,syntax_semantics,control_raising,tough_vs_raising_1,True,False,False,False,320,-54.31371307373047,-50.558143615722656,0
The Borgias aren't hard to care for.,The Borgias aren't about to care for.,syntax_semantics,control_raising,tough_vs_raising_1,True,False,False,False,321,-51.77745056152344,-54.968589782714844,1
Those mothers of Carolyn were annoying to reference.,Those mothers of Carolyn were sure to reference.,syntax_semantics,control_raising,tough_vs_raising_1,True,False,False,False,322,-61.233978271484375,-58.19959259033203,0
Karla wasn't irritating to fire.,Karla wasn't certain to fire.,syntax_semantics,control_raising,tough_vs_raising_1,True,False,False,False,323,-43.35166549682617,-44.2007942199707,1
Some jackets aren't easy to wear.,Some jackets aren't unlikely to wear.,syntax_semantics,control_raising,tough_vs_raising_1,True,False,False,False,324,-36.31001663208008,-43.24180603027344,1
Those closets were easy to drive to.,Those closets were certain to drive to.,syntax_semantics,control_raising,tough_vs_raising_1,True,False,False,False,325,-41.10877990722656,-48.04197692871094,1
Katherine's tutors weren't fun to flee from.,Katherine's tutors weren't likely to flee from.,syntax_semantics,control_raising,tough_vs_raising_1,True,False,False,False,326,-77.03190612792969,-77.87667846679688,1
A lot of public parks weren't hard work to drop by.,A lot of public parks weren't likely to drop by.,syntax_semantics,control_raising,tough_vs_raising_1,True,False,False,False,327,-77.17322540283203,-70.32656860351562,0
Bradley was boring to conceal.,Bradley was unlikely to conceal.,syntax_semantics,control_raising,tough_vs_raising_1,True,False,False,False,328,-38.72736358642578,-39.994937896728516,1
Tiffany's mentee wasn't hard work to examine.,Tiffany's mentee wasn't about to examine.,syntax_semantics,control_raising,tough_vs_raising_1,True,False,False,False,329,-94.37372589111328,-85.74038696289062,0
Some children are ready to flee from.,Some children are soon to flee from.,syntax_semantics,control_raising,tough_vs_raising_1,True,False,False,False,330,-34.52875518798828,-43.96869659423828,1
Thomas's contractors weren't enjoyable to talk about.,Thomas's contractors weren't unlikely to talk about.,syntax_semantics,control_raising,tough_vs_raising_1,True,False,False,False,331,-56.38404846191406,-55.73954772949219,0
All museums are easy to drop by.,All museums are bound to drop by.,syntax_semantics,control_raising,tough_vs_raising_1,True,False,False,False,332,-39.27485656738281,-40.31501770019531,1
Mitchell wasn't pleasant to conceal.,Mitchell wasn't unlikely to conceal.,syntax_semantics,control_raising,tough_vs_raising_1,True,False,False,False,333,-50.554161071777344,-51.881744384765625,1
These grandsons of Carlos were easy to conceal.,These grandsons of Carlos were soon to conceal.,syntax_semantics,control_raising,tough_vs_raising_1,True,False,False,False,334,-71.97480010986328,-76.19328308105469,1
Some hospitals are irritating to escape from.,Some hospitals are apt to escape from.,syntax_semantics,control_raising,tough_vs_raising_1,True,False,False,False,335,-45.068050384521484,-43.47917938232422,0
This closet was irritating to walk through.,This closet was apt to walk through.,syntax_semantics,control_raising,tough_vs_raising_1,True,False,False,False,336,-45.683929443359375,-44.17234802246094,0
Carolyn's French teacher was fun to talk about.,Carolyn's French teacher was soon to talk about.,syntax_semantics,control_raising,tough_vs_raising_1,True,False,False,False,337,-61.09636306762695,-63.00352478027344,1
Peter's ex-husbands weren't fun to fire.,Peter's ex-husbands weren't sure to fire.,syntax_semantics,control_raising,tough_vs_raising_1,True,False,False,False,338,-65.88740539550781,-70.07064819335938,1
A lot of brothers of a dancer were irritating to fire.,A lot of brothers of a dancer were sure to fire.,syntax_semantics,control_raising,tough_vs_raising_1,True,False,False,False,339,-77.1922836303711,-75.31614685058594,0
That mountain was tough to lift.,That mountain was unlikely to lift.,syntax_semantics,control_raising,tough_vs_raising_1,True,False,False,False,340,-38.44597625732422,-44.28521728515625,1
Dawn is fun to reference.,Dawn is apt to reference.,syntax_semantics,control_raising,tough_vs_raising_1,True,False,False,False,341,-45.798179626464844,-49.94139099121094,1
Cynthia isn't exciting to care for.,Cynthia isn't likely to care for.,syntax_semantics,control_raising,tough_vs_raising_1,True,False,False,False,342,-63.16347885131836,-63.391944885253906,1
Diana's son isn't fun to conceal.,Diana's son isn't about to conceal.,syntax_semantics,control_raising,tough_vs_raising_1,True,False,False,False,343,-65.17386627197266,-63.030540466308594,0
Many people were enjoyable to talk to.,Many people were soon to talk to.,syntax_semantics,control_raising,tough_vs_raising_1,True,False,False,False,344,-33.88764953613281,-31.160694122314453,0
Raymond wasn't pleasant to talk to.,Raymond wasn't unlikely to talk to.,syntax_semantics,control_raising,tough_vs_raising_1,True,False,False,False,345,-45.03877639770508,-46.42958068847656,1
Some public park was tough to bike to.,Some public park was about to bike to.,syntax_semantics,control_raising,tough_vs_raising_1,True,False,False,False,346,-51.15544891357422,-49.58427047729492,0
Heidi's nieces weren't exciting to work with.,Heidi's nieces weren't unlikely to work with.,syntax_semantics,control_raising,tough_vs_raising_1,True,False,False,False,347,-77.51850128173828,-80.26589965820312,1
Closets weren't exciting to arrive at.,Closets weren't unlikely to arrive at.,syntax_semantics,control_raising,tough_vs_raising_1,True,False,False,False,348,-57.607177734375,-59.845603942871094,1
The senators are boring to cure.,The senators are soon to cure.,syntax_semantics,control_raising,tough_vs_raising_1,True,False,False,False,349,-40.13468933105469,-42.24609375,1
Cheryl's tutor was irritating to listen to.,Cheryl's tutor was soon to listen to.,syntax_semantics,control_raising,tough_vs_raising_1,True,False,False,False,350,-76.05372619628906,-73.88420104980469,0
This dancer is enjoyable to argue about.,This dancer is certain to argue about.,syntax_semantics,control_raising,tough_vs_raising_1,True,False,False,False,351,-44.81715393066406,-42.0623893737793,0
This college campus wasn't interesting to arrive at.,This college campus wasn't bound to arrive at.,syntax_semantics,control_raising,tough_vs_raising_1,True,False,False,False,352,-55.513370513916016,-56.37617111206055,1
Some drivers weren't interesting to complain about.,Some drivers weren't bound to complain about.,syntax_semantics,control_raising,tough_vs_raising_1,True,False,False,False,353,-46.54069900512695,-44.9317512512207,0
Carlos's classmate wasn't ready to reference.,Carlos's classmate wasn't certain to reference.,syntax_semantics,control_raising,tough_vs_raising_1,True,False,False,False,354,-56.47901153564453,-60.63492965698242,1
Winston Churchill wasn't hard to listen to.,Winston Churchill wasn't bound to listen to.,syntax_semantics,control_raising,tough_vs_raising_1,True,False,False,False,355,-45.15339660644531,-48.64656066894531,1
Rhonda's grandmothers aren't hard work to escape from.,Rhonda's grandmothers aren't bound to escape from.,syntax_semantics,control_raising,tough_vs_raising_1,True,False,False,False,356,-74.82991027832031,-67.80514526367188,0
The restaurant isn't unpleasant to drop by.,The restaurant isn't likely to drop by.,syntax_semantics,control_raising,tough_vs_raising_1,True,False,False,False,357,-49.83742904663086,-45.45432662963867,0
A public park is hard to drive to.,A public park is sure to drive to.,syntax_semantics,control_raising,tough_vs_raising_1,True,False,False,False,358,-51.072044372558594,-59.529632568359375,1
That grocery store wasn't irritating to drop by.,That grocery store wasn't likely to drop by.,syntax_semantics,control_raising,tough_vs_raising_1,True,False,False,False,359,-61.664634704589844,-58.87355041503906,0
Edward isn't boring to listen to.,Edward isn't apt to listen to.,syntax_semantics,control_raising,tough_vs_raising_1,True,False,False,False,360,-32.585086822509766,-30.635738372802734,0
A closet isn't hard to arrive at.,A closet isn't certain to arrive at.,syntax_semantics,control_raising,tough_vs_raising_1,True,False,False,False,361,-53.08839797973633,-61.73602294921875,1
The Borgias' ex-girlfriends were difficult to work with.,The Borgias' ex-girlfriends were bound to work with.,syntax_semantics,control_raising,tough_vs_raising_1,True,False,False,False,362,-86.16108703613281,-86.87478637695312,1
Every mall isn't exciting to drop by.,Every mall isn't soon to drop by.,syntax_semantics,control_raising,tough_vs_raising_1,True,False,False,False,363,-48.36216735839844,-50.66377639770508,1
Claire's grandmothers were hard work to argue about.,Claire's grandmothers were soon to argue about.,syntax_semantics,control_raising,tough_vs_raising_1,True,False,False,False,364,-68.72618865966797,-65.41798400878906,0
Derek wasn't hard work to respect.,Derek wasn't apt to respect.,syntax_semantics,control_raising,tough_vs_raising_1,True,False,False,False,365,-56.20400619506836,-52.63595199584961,0
An essay wasn't difficult to disagree with.,An essay wasn't certain to disagree with.,syntax_semantics,control_raising,tough_vs_raising_1,True,False,False,False,366,-45.43428039550781,-50.20931625366211,1
Raymond is irritating to conceal.,Raymond is unlikely to conceal.,syntax_semantics,control_raising,tough_vs_raising_1,True,False,False,False,367,-43.140220642089844,-43.12127685546875,0
Debra wasn't hard work to talk to.,Debra wasn't unlikely to talk to.,syntax_semantics,control_raising,tough_vs_raising_1,True,False,False,False,368,-43.52845001220703,-42.29659652709961,0
Christopher was tough to cure.,Christopher was bound to cure.,syntax_semantics,control_raising,tough_vs_raising_1,True,False,False,False,369,-26.63888931274414,-28.001155853271484,1
Skirts are annoying to wear.,Skirts are soon to wear.,syntax_semantics,control_raising,tough_vs_raising_1,True,False,False,False,370,-41.66051483154297,-42.059898376464844,1
A lot of pants were tough to reveal.,A lot of pants were unlikely to reveal.,syntax_semantics,control_raising,tough_vs_raising_1,True,False,False,False,371,-57.63501739501953,-62.14494323730469,1
That art gallery wasn't easy to arrive at.,That art gallery wasn't certain to arrive at.,syntax_semantics,control_raising,tough_vs_raising_1,True,False,False,False,372,-55.846519470214844,-62.989501953125,1
Some high school isn't interesting to walk through.,Some high school isn't sure to walk through.,syntax_semantics,control_raising,tough_vs_raising_1,True,False,False,False,373,-43.70757293701172,-45.12982940673828,1
This teenager's nephew is enjoyable to scare.,This teenager's nephew is sure to scare.,syntax_semantics,control_raising,tough_vs_raising_1,True,False,False,False,374,-57.247802734375,-53.64092254638672,0
Libraries aren't annoying to go to.,Libraries aren't apt to go to.,syntax_semantics,control_raising,tough_vs_raising_1,True,False,False,False,375,-47.80565643310547,-47.671791076660156,0
Joseph wasn't annoying to fire.,Joseph wasn't likely to fire.,syntax_semantics,control_raising,tough_vs_raising_1,True,False,False,False,376,-34.03416442871094,-30.476009368896484,0
The Great Lakes aren't irritating to bike to.,The Great Lakes aren't soon to bike to.,syntax_semantics,control_raising,tough_vs_raising_1,True,False,False,False,377,-58.348846435546875,-59.11103057861328,1
Some patients' mentee was exciting to conceal.,Some patients' mentee was about to conceal.,syntax_semantics,control_raising,tough_vs_raising_1,True,False,False,False,378,-76.3111572265625,-70.86973571777344,0
Winston Churchill's friends aren't unpleasant to return to.,Winston Churchill's friends aren't about to return to.,syntax_semantics,control_raising,tough_vs_raising_1,True,False,False,False,379,-68.76286315917969,-63.62276840209961,0
Most cafes weren't ready to bike to.,Most cafes weren't likely to bike to.,syntax_semantics,control_raising,tough_vs_raising_1,True,False,False,False,380,-51.9792594909668,-53.64955139160156,1
Carl was hard to work with.,Carl was soon to work with.,syntax_semantics,control_raising,tough_vs_raising_1,True,False,False,False,381,-24.29529571533203,-29.822723388671875,1
Kenneth's contractors were difficult to return to.,Kenneth's contractors were bound to return to.,syntax_semantics,control_raising,tough_vs_raising_1,True,False,False,False,382,-63.31473922729492,-64.05252075195312,1
Christine is ready to listen to.,Christine is certain to listen to.,syntax_semantics,control_raising,tough_vs_raising_1,True,False,False,False,383,-28.06695556640625,-37.77208709716797,1
Tracy's best friends aren't hard to return to.,Tracy's best friends aren't unlikely to return to.,syntax_semantics,control_raising,tough_vs_raising_1,True,False,False,False,384,-51.161991119384766,-58.56980514526367,1
A lot of drivers' daughter wasn't hard work to complain about.,A lot of drivers' daughter wasn't certain to complain about.,syntax_semantics,control_raising,tough_vs_raising_1,True,False,False,False,385,-84.78395080566406,-80.21112060546875,0
These people weren't boring to reference.,These people weren't about to reference.,syntax_semantics,control_raising,tough_vs_raising_1,True,False,False,False,386,-37.69664764404297,-33.7401008605957,0
Deanna is irritating to cure.,Deanna is bound to cure.,syntax_semantics,control_raising,tough_vs_raising_1,True,False,False,False,387,-39.74969482421875,-34.508384704589844,0
Bill wasn't fun to scare.,Bill wasn't sure to scare.,syntax_semantics,control_raising,tough_vs_raising_1,True,False,False,False,388,-32.359317779541016,-31.79657745361328,0
Most mountains are hard work to bike to.,Most mountains are likely to bike to.,syntax_semantics,control_raising,tough_vs_raising_1,True,False,False,False,389,-47.977783203125,-42.33971405029297,0
Some hill wasn't exciting to go to.,Some hill wasn't unlikely to go to.,syntax_semantics,control_raising,tough_vs_raising_1,True,False,False,False,390,-44.662818908691406,-47.527896881103516,1
Cheryl is enjoyable to cure.,Cheryl is about to cure.,syntax_semantics,control_raising,tough_vs_raising_1,True,False,False,False,391,-59.219993591308594,-50.64814758300781,0
A lot of nieces of a child aren't difficult to respect.,A lot of nieces of a child aren't sure to respect.,syntax_semantics,control_raising,tough_vs_raising_1,True,False,False,False,392,-90.46094512939453,-92.84883117675781,1
