sentence_good,sentence_bad,field,linguistics_term,UID,simple_LM_method,one_prefix_method,two_prefix_method,lexically_identical,pair_id,good_prob,bad_prob,correct
Some men that don't escape from a bank were helping themselves.,Some men that don't escape from a bank were helping itself.,syntax_semantics,binding,principle_A_c_command,True,True,False,False,219,-65.29804992675781,-68.06236267089844,1
Some waitress that was climbing up all hills had insulted herself.,Some waitress that was climbing up all hills had insulted themselves.,syntax_semantics,binding,principle_A_c_command,True,True,False,False,220,-80.95423889160156,-77.31582641601562,0
This boy who annoyed Laurie disagrees with himself.,This boy who annoyed Laurie disagrees with herself.,syntax_semantics,binding,principle_A_c_command,True,True,False,False,221,-68.9903564453125,-70.38099670410156,1
The pedestrians that exit this museum weren't fleeing from themselves.,The pedestrians that exit this museum weren't fleeing from itself.,syntax_semantics,binding,principle_A_c_command,True,True,False,False,222,-81.45185852050781,-82.50918579101562,1
Those pedestrians who had examined this play hadn't watched themselves.,Those pedestrians who had examined this play hadn't watched itself.,syntax_semantics,binding,principle_A_c_command,True,True,False,False,223,-77.20559692382812,-79.1993408203125,1
A lady who isn't bringing the shawls returns to herself.,A lady who isn't bringing the shawls returns to themselves.,syntax_semantics,binding,principle_A_c_command,True,True,False,False,224,-87.97373962402344,-86.544921875,0
Actresses who haven't biked to every movie theater aren't hugging themselves.,Actresses who haven't biked to every movie theater aren't hugging itself.,syntax_semantics,binding,principle_A_c_command,True,True,False,False,225,-112.35639953613281,-114.74849700927734,1
Many chairs that shock Heidi haven't stunned themselves.,Many chairs that shock Heidi haven't stunned herself.,syntax_semantics,binding,principle_A_c_command,True,True,False,False,226,-73.68968200683594,-76.04273986816406,1
A scarf that has embarrassed Carolyn wasn't disgusting itself.,A scarf that has embarrassed Carolyn wasn't disgusting herself.,syntax_semantics,binding,principle_A_c_command,True,True,False,False,227,-87.96775817871094,-88.37837219238281,1
Many pedestrians that distracts Lisa investigated themselves.,Many pedestrians that distracts Lisa investigated herself.,syntax_semantics,binding,principle_A_c_command,True,True,False,False,228,-69.95106506347656,-71.229736328125,1
Most waitresses who weren't concealing John have approached themselves.,Most waitresses who weren't concealing John have approached himself.,syntax_semantics,binding,principle_A_c_command,True,True,False,False,229,-104.239990234375,-104.54354858398438,1
Dancers who hadn't concealed some hospital were discovering themselves.,Dancers who hadn't concealed some hospital were discovering itself.,syntax_semantics,binding,principle_A_c_command,True,True,False,False,230,-92.7105941772461,-94.0426025390625,1
Many museums that work with Mitchell couldn't help themselves.,Many museums that work with Mitchell couldn't help himself.,syntax_semantics,binding,principle_A_c_command,True,True,False,False,231,-61.84354782104492,-62.778507232666016,1
This museum that wasn't taking the mouths is talking to itself.,This museum that wasn't taking the mouths is talking to themselves.,syntax_semantics,binding,principle_A_c_command,True,True,False,False,232,-66.53195190429688,-64.6767578125,0
Some guy that does help Laurie leaves himself.,Some guy that does help Laurie leaves herself.,syntax_semantics,binding,principle_A_c_command,True,True,False,False,233,-55.79533004760742,-56.543861389160156,1
Children that aren't irritating David might flee from themselves.,Children that aren't irritating David might flee from himself.,syntax_semantics,binding,principle_A_c_command,True,True,False,False,234,-64.33509826660156,-64.27730560302734,0
That actress that won't discover that plate watches herself.,That actress that won't discover that plate watches itself.,syntax_semantics,binding,principle_A_c_command,True,True,False,False,235,-72.3836898803711,-72.05945587158203,0
A lot of associations that will remember Ruth do work with themselves.,A lot of associations that will remember Ruth do work with herself.,syntax_semantics,binding,principle_A_c_command,True,True,False,False,236,-86.35183715820312,-88.33399963378906,1
The doors that haven't scared Amy wouldn't distract themselves.,The doors that haven't scared Amy wouldn't distract herself.,syntax_semantics,binding,principle_A_c_command,True,True,False,False,237,-66.98673248291016,-69.3488998413086,1
This company that wasn't talking to Heather talks about itself.,This company that wasn't talking to Heather talks about herself.,syntax_semantics,binding,principle_A_c_command,True,True,False,False,238,-62.351993560791016,-62.12723922729492,0
That dancer who thinks about a car isn't hugging herself.,That dancer who thinks about a car isn't hugging itself.,syntax_semantics,binding,principle_A_c_command,True,True,False,False,239,-72.77861022949219,-74.07496643066406,1
These glasses that disturbed Bradley can't aggravate themselves.,These glasses that disturbed Bradley can't aggravate himself.,syntax_semantics,binding,principle_A_c_command,True,True,False,False,240,-73.93963623046875,-74.67178344726562,1
These guys who disturb Sarah criticized themselves.,These guys who disturb Sarah criticized herself.,syntax_semantics,binding,principle_A_c_command,True,True,False,False,241,-53.833091735839844,-55.14596939086914,1
Most waiters that were disagreeing with Omar hadn't respected themselves.,Most waiters that were disagreeing with Omar hadn't respected himself.,syntax_semantics,binding,principle_A_c_command,True,True,False,False,242,-100.07907104492188,-101.68406677246094,1
Teachers who brought that car wouldn't disagree with themselves.,Teachers who brought that car wouldn't disagree with itself.,syntax_semantics,binding,principle_A_c_command,True,True,False,False,243,-59.17845916748047,-61.02581787109375,1
All mushrooms that hurt William disgusted themselves.,All mushrooms that hurt William disgusted himself.,syntax_semantics,binding,principle_A_c_command,True,True,False,False,244,-60.024192810058594,-60.061153411865234,1
This mountain that would distract Heidi can stun itself.,This mountain that would distract Heidi can stun herself.,syntax_semantics,binding,principle_A_c_command,True,True,False,False,245,-76.9016342163086,-77.72856903076172,1
Most women who didn't disturb Stacey are investigating themselves.,Most women who didn't disturb Stacey are investigating herself.,syntax_semantics,binding,principle_A_c_command,True,True,False,False,246,-73.09599304199219,-74.91950988769531,1
Some girl who hasn't climbed up the hill wasn't watching herself.,Some girl who hasn't climbed up the hill wasn't watching itself.,syntax_semantics,binding,principle_A_c_command,True,True,False,False,247,-71.55722045898438,-72.13456726074219,1
Some waitress that hadn't cured Daniel flees from herself.,Some waitress that hadn't cured Daniel flees from himself.,syntax_semantics,binding,principle_A_c_command,True,True,False,False,248,-81.58840942382812,-80.28755950927734,0
Many committees that haven't sold this bicycle do talk to themselves.,Many committees that haven't sold this bicycle do talk to itself.,syntax_semantics,binding,principle_A_c_command,True,True,False,False,249,-71.98700714111328,-73.97613525390625,1
Those teenagers that didn't climb up a slope weren't disgusting themselves.,Those teenagers that didn't climb up a slope weren't disgusting itself.,syntax_semantics,binding,principle_A_c_command,True,True,False,False,250,-77.02696228027344,-78.39639282226562,1
A guy who scares some committees healed himself.,A guy who scares some committees healed themselves.,syntax_semantics,binding,principle_A_c_command,True,True,False,False,251,-73.32591247558594,-72.19593811035156,0
A lot of movie theaters that had bored Phillip aggravated themselves.,A lot of movie theaters that had bored Phillip aggravated himself.,syntax_semantics,binding,principle_A_c_command,True,True,False,False,252,-99.90745544433594,-99.87528991699219,0
Most girls that listen to Christopher have visited themselves.,Most girls that listen to Christopher have visited himself.,syntax_semantics,binding,principle_A_c_command,True,True,False,False,253,-59.93519592285156,-60.889400482177734,1
Some museums that shouldn't know George hadn't talked to themselves.,Some museums that shouldn't know George hadn't talked to himself.,syntax_semantics,binding,principle_A_c_command,True,True,False,False,254,-65.78471374511719,-64.83751678466797,0
Some dancer who had dropped by a lot of movie theaters isn't working with herself.,Some dancer who had dropped by a lot of movie theaters isn't working with themselves.,syntax_semantics,binding,principle_A_c_command,True,True,False,False,255,-90.92652893066406,-89.09843444824219,0
That boy who had hated Paula attacks himself.,That boy who had hated Paula attacks herself.,syntax_semantics,binding,principle_A_c_command,True,True,False,False,256,-63.90641784667969,-64.72406768798828,1
Every high school that annoys Emily does impress itself.,Every high school that annoys Emily does impress herself.,syntax_semantics,binding,principle_A_c_command,True,True,False,False,257,-74.71984100341797,-75.29472351074219,1
Some bank that knows Patrick helps itself.,Some bank that knows Patrick helps himself.,syntax_semantics,binding,principle_A_c_command,True,True,False,False,258,-55.428436279296875,-53.67203903198242,0
Some students who walk through the library were curing themselves.,Some students who walk through the library were curing itself.,syntax_semantics,binding,principle_A_c_command,True,True,False,False,259,-61.89630889892578,-63.085540771484375,1
The wheelbarrows that should bore Sonia irritated themselves.,The wheelbarrows that should bore Sonia irritated herself.,syntax_semantics,binding,principle_A_c_command,True,True,False,False,260,-94.8941421508789,-96.84519958496094,1
The plates that have irritated Victoria were alarming themselves.,The plates that have irritated Victoria were alarming herself.,syntax_semantics,binding,principle_A_c_command,True,True,False,False,261,-72.43568420410156,-75.08873748779297,1
Some picture that had hurt Elizabeth upset itself.,Some picture that had hurt Elizabeth upset herself.,syntax_semantics,binding,principle_A_c_command,True,True,False,False,262,-61.1109619140625,-61.0953369140625,0
This woman that had lifted some cats thought about herself.,This woman that had lifted some cats thought about themselves.,syntax_semantics,binding,principle_A_c_command,True,True,False,False,263,-66.62255859375,-64.13072204589844,0
A lot of cashiers who go to a mountain admired themselves.,A lot of cashiers who go to a mountain admired itself.,syntax_semantics,binding,principle_A_c_command,True,True,False,False,264,-87.7679443359375,-87.76504516601562,0
Patients who might impress Laurie haven't hired themselves.,Patients who might impress Laurie haven't hired herself.,syntax_semantics,binding,principle_A_c_command,True,True,False,False,265,-85.61583709716797,-87.65594482421875,1
All associations that aren't boring Peter weren't discussing themselves.,All associations that aren't boring Peter weren't discussing himself.,syntax_semantics,binding,principle_A_c_command,True,True,False,False,266,-73.24267578125,-74.49143981933594,1
All senators who could walk through this library hadn't cured themselves.,All senators who could walk through this library hadn't cured itself.,syntax_semantics,binding,principle_A_c_command,True,True,False,False,267,-85.64097595214844,-86.68907928466797,1
The association that doesn't embarrass Noah references itself.,The association that doesn't embarrass Noah references himself.,syntax_semantics,binding,principle_A_c_command,True,True,False,False,268,-66.94596862792969,-67.41643524169922,1
Some man that insults Kristin approached himself.,Some man that insults Kristin approached herself.,syntax_semantics,binding,principle_A_c_command,True,True,False,False,269,-67.79814147949219,-69.092041015625,1
That actress who hurt a lot of women liked herself.,That actress who hurt a lot of women liked themselves.,syntax_semantics,binding,principle_A_c_command,True,True,False,False,270,-59.86397171020508,-57.750667572021484,0
Every organization that is boring Bill wouldn't fire itself.,Every organization that is boring Bill wouldn't fire himself.,syntax_semantics,binding,principle_A_c_command,True,True,False,False,271,-65.13276672363281,-63.29200744628906,0
The customers who could worry Sharon knew themselves.,The customers who could worry Sharon knew herself.,syntax_semantics,binding,principle_A_c_command,True,True,False,False,272,-61.3927116394043,-63.24733352661133,1
Some people who annoy William are watching themselves.,Some people who annoy William are watching himself.,syntax_semantics,binding,principle_A_c_command,True,True,False,False,273,-49.117645263671875,-49.876548767089844,1
All hospitals that scared Kirsten will reference themselves.,All hospitals that scared Kirsten will reference herself.,syntax_semantics,binding,principle_A_c_command,True,True,False,False,274,-70.24374389648438,-73.12542724609375,1
That boy that hated Pamela cares for himself.,That boy that hated Pamela cares for herself.,syntax_semantics,binding,principle_A_c_command,True,True,False,False,275,-65.00678253173828,-66.08747863769531,1
Every school that couldn't know Stacy describes itself.,Every school that couldn't know Stacy describes herself.,syntax_semantics,binding,principle_A_c_command,True,True,False,False,276,-59.675899505615234,-59.673255920410156,0
All waitresses who weren't hurting Jason might discover themselves.,All waitresses who weren't hurting Jason might discover himself.,syntax_semantics,binding,principle_A_c_command,True,True,False,False,277,-91.22244262695312,-91.05743408203125,0
Most customers who are impressing Laurie have found themselves.,Most customers who are impressing Laurie have found herself.,syntax_semantics,binding,principle_A_c_command,True,True,False,False,278,-73.2903823852539,-75.98832702636719,1
Some cars that embarrassed this boy aren't scaring themselves.,Some cars that embarrassed this boy aren't scaring himself.,syntax_semantics,binding,principle_A_c_command,True,True,False,False,279,-67.458251953125,-68.01348876953125,1
Some carriage that isn't annoying Cheryl bored itself.,Some carriage that isn't annoying Cheryl bored herself.,syntax_semantics,binding,principle_A_c_command,True,True,False,False,280,-72.88115692138672,-73.76885986328125,1
Some cats that resemble that painting had impressed themselves.,Some cats that resemble that painting had impressed itself.,syntax_semantics,binding,principle_A_c_command,True,True,False,False,281,-63.77830123901367,-65.61209869384766,1
A lot of icicles that can confuse Alice haven't impressed themselves.,A lot of icicles that can confuse Alice haven't impressed herself.,syntax_semantics,binding,principle_A_c_command,True,True,False,False,282,-100.10710144042969,-101.99554443359375,1
The lady who has impressed Homer had discussed herself.,The lady who has impressed Homer had discussed himself.,syntax_semantics,binding,principle_A_c_command,True,True,False,False,283,-63.64532470703125,-61.906070709228516,0
All cashiers that had driven to the library hugged themselves.,All cashiers that had driven to the library hugged itself.,syntax_semantics,binding,principle_A_c_command,True,True,False,False,284,-77.54888916015625,-79.31095886230469,1
Some shawl that bored Mitchell is impressing itself.,Some shawl that bored Mitchell is impressing himself.,syntax_semantics,binding,principle_A_c_command,True,True,False,False,285,-85.63658142089844,-86.29930114746094,1
A lot of waiters who have broken a window might visit themselves.,A lot of waiters who have broken a window might visit itself.,syntax_semantics,binding,principle_A_c_command,True,True,False,False,286,-92.616943359375,-95.06060028076172,1
These cakes that don't aggravate Ruth do scare themselves.,These cakes that don't aggravate Ruth do scare herself.,syntax_semantics,binding,principle_A_c_command,True,True,False,False,287,-73.70423126220703,-77.26022338867188,1
Pedestrians who hadn't loved Brian cured themselves.,Pedestrians who hadn't loved Brian cured himself.,syntax_semantics,binding,principle_A_c_command,True,True,False,False,288,-74.61768341064453,-74.31805419921875,0
Some doctors that aren't describing Thomas revealed themselves.,Some doctors that aren't describing Thomas revealed himself.,syntax_semantics,binding,principle_A_c_command,True,True,False,False,289,-62.68506622314453,-63.74161911010742,1
A lot of actors who haven't fired Theodore haven't respected themselves.,A lot of actors who haven't fired Theodore haven't respected himself.,syntax_semantics,binding,principle_A_c_command,True,True,False,False,290,-94.7807388305664,-95.50873565673828,1
Some drivers that hated Nicole knew themselves.,Some drivers that hated Nicole knew herself.,syntax_semantics,binding,principle_A_c_command,True,True,False,False,291,-58.864097595214844,-60.64069366455078,1
This waitress that drove to every river had hurt herself.,This waitress that drove to every river had hurt itself.,syntax_semantics,binding,principle_A_c_command,True,True,False,False,292,-73.66780090332031,-73.17678833007812,0
All committees that can't boast about Wayne don't irritate themselves.,All committees that can't boast about Wayne don't irritate himself.,syntax_semantics,binding,principle_A_c_command,True,True,False,False,293,-88.38674926757812,-89.45558166503906,1
Some man who had bought every fork referenced himself.,Some man who had bought every fork referenced itself.,syntax_semantics,binding,principle_A_c_command,True,True,False,False,294,-65.49242401123047,-65.98004150390625,1
An organization that could bore Tiffany helps itself.,An organization that could bore Tiffany helps herself.,syntax_semantics,binding,principle_A_c_command,True,True,False,False,295,-61.97454071044922,-62.905906677246094,1
The waitresses that concealed Karla disliked themselves.,The waitresses that concealed Karla disliked herself.,syntax_semantics,binding,principle_A_c_command,True,True,False,False,296,-82.9921875,-84.60127258300781,1
These guests that do notice Derek aren't boasting about themselves.,These guests that do notice Derek aren't boasting about himself.,syntax_semantics,binding,principle_A_c_command,True,True,False,False,297,-78.14453125,-79.95449829101562,1
Every museum that helped a man could hate itself.,Every museum that helped a man could hate himself.,syntax_semantics,binding,principle_A_c_command,True,True,False,False,298,-56.772430419921875,-55.40776062011719,0
A waitress that is messing up many glasses helped herself.,A waitress that is messing up many glasses helped themselves.,syntax_semantics,binding,principle_A_c_command,True,True,False,False,299,-84.64131927490234,-80.98744201660156,0
A commentary that was irritating these legislatures disagrees with itself.,A commentary that was irritating these legislatures disagrees with themselves.,syntax_semantics,binding,principle_A_c_command,True,True,False,False,300,-96.64469909667969,-94.29609680175781,0
The dancer who stunned Russell approached herself.,The dancer who stunned Russell approached himself.,syntax_semantics,binding,principle_A_c_command,True,True,False,False,301,-62.636268615722656,-61.12400817871094,0
A museum that has astounded Eva didn't hate itself.,A museum that has astounded Eva didn't hate herself.,syntax_semantics,binding,principle_A_c_command,True,True,False,False,302,-91.28887939453125,-91.19349670410156,0
The senators that had hugged Deanna cured themselves.,The senators that had hugged Deanna cured herself.,syntax_semantics,binding,principle_A_c_command,True,True,False,False,303,-80.624267578125,-82.39181518554688,1
These banks that appreciated Derek referenced themselves.,These banks that appreciated Derek referenced himself.,syntax_semantics,binding,principle_A_c_command,True,True,False,False,304,-57.03235626220703,-58.66267395019531,1
All teachers who won't take some movie theater wouldn't complain about themselves.,All teachers who won't take some movie theater wouldn't complain about itself.,syntax_semantics,binding,principle_A_c_command,True,True,False,False,305,-78.80419921875,-80.49919128417969,1
This rug that hadn't stunned the doctors embarrassed itself.,This rug that hadn't stunned the doctors embarrassed themselves.,syntax_semantics,binding,principle_A_c_command,True,True,False,False,306,-73.5468521118164,-71.9538803100586,0
Every library that was distracting Carol describes itself.,Every library that was distracting Carol describes herself.,syntax_semantics,binding,principle_A_c_command,True,True,False,False,307,-61.97221374511719,-61.78688049316406,0
The girls that stun Lucille would conceal themselves.,The girls that stun Lucille would conceal herself.,syntax_semantics,binding,principle_A_c_command,True,True,False,False,308,-72.73542785644531,-74.9615249633789,1
All teachers that scare some waitress noticed themselves.,All teachers that scare some waitress noticed herself.,syntax_semantics,binding,principle_A_c_command,True,True,False,False,309,-65.96117401123047,-68.605712890625,1
All guests who could reveal Gerald haven't observed themselves.,All guests who could reveal Gerald haven't observed himself.,syntax_semantics,binding,principle_A_c_command,True,True,False,False,310,-77.6346435546875,-77.36396789550781,0
Some casserole that resembled the photographs can't disgust itself.,Some casserole that resembled the photographs can't disgust themselves.,syntax_semantics,binding,principle_A_c_command,True,True,False,False,311,-90.9330825805664,-89.35745239257812,0
Every school that hasn't confused Carrie helped itself.,Every school that hasn't confused Carrie helped herself.,syntax_semantics,binding,principle_A_c_command,True,True,False,False,312,-63.5695915222168,-62.48317337036133,0
Every girl who toured some hill loves herself.,Every girl who toured some hill loves itself.,syntax_semantics,binding,principle_A_c_command,True,True,False,False,313,-63.2192497253418,-63.64382553100586,1
All pedestrians that do embarrass Christine weren't revealing themselves.,All pedestrians that do embarrass Christine weren't revealing herself.,syntax_semantics,binding,principle_A_c_command,True,True,False,False,314,-78.90996551513672,-81.51348876953125,1
Some bicycle that looks like most sketches worried itself.,Some bicycle that looks like most sketches worried themselves.,syntax_semantics,binding,principle_A_c_command,True,True,False,False,315,-67.35275268554688,-66.95917510986328,0
Those actresses that were curing this dancer are escaping from themselves.,Those actresses that were curing this dancer are escaping from herself.,syntax_semantics,binding,principle_A_c_command,True,True,False,False,316,-74.831298828125,-77.23394775390625,1
A guy who shouldn't forget all waitresses wasn't approaching himself.,A guy who shouldn't forget all waitresses wasn't approaching themselves.,syntax_semantics,binding,principle_A_c_command,True,True,False,False,317,-99.79878997802734,-99.59021759033203,0
Some committee that hasn't remembered Kimberley isn't criticizing itself.,Some committee that hasn't remembered Kimberley isn't criticizing herself.,syntax_semantics,binding,principle_A_c_command,True,True,False,False,318,-91.11582946777344,-91.5331039428711,1
Every waitress that exits a cafe escapes from herself.,Every waitress that exits a cafe escapes from itself.,syntax_semantics,binding,principle_A_c_command,True,True,False,False,319,-72.13493347167969,-71.33904266357422,0
A lot of legislatures that would reference that man have hired themselves.,A lot of legislatures that would reference that man have hired himself.,syntax_semantics,binding,principle_A_c_command,True,True,False,False,320,-87.7655029296875,-87.00640869140625,0
Most jackets that bothered Carlos had disgusted themselves.,Most jackets that bothered Carlos had disgusted himself.,syntax_semantics,binding,principle_A_c_command,True,True,False,False,321,-73.49910736083984,-74.01383972167969,1
Most waiters that see Daniel have forgotten themselves.,Most waiters that see Daniel have forgotten himself.,syntax_semantics,binding,principle_A_c_command,True,True,False,False,322,-71.49784088134766,-72.81451416015625,1
The dancer that embarrassed this committee thinks about herself.,The dancer that embarrassed this committee thinks about itself.,syntax_semantics,binding,principle_A_c_command,True,True,False,False,323,-68.9331283569336,-67.87030029296875,0
A dancer that researched this art gallery fled from herself.,A dancer that researched this art gallery fled from itself.,syntax_semantics,binding,principle_A_c_command,True,True,False,False,324,-95.64299011230469,-94.6971435546875,0
The men who bother Carlos haven't hired themselves.,The men who bother Carlos haven't hired himself.,syntax_semantics,binding,principle_A_c_command,True,True,False,False,325,-62.58467483520508,-62.709739685058594,1
Every actress who has bored a lot of teachers hasn't boasted about herself.,Every actress who has bored a lot of teachers hasn't boasted about themselves.,syntax_semantics,binding,principle_A_c_command,True,True,False,False,326,-83.42937469482422,-80.56326293945312,0
These people who hired Wayne don't complain about themselves.,These people who hired Wayne don't complain about himself.,syntax_semantics,binding,principle_A_c_command,True,True,False,False,327,-54.593536376953125,-56.206687927246094,1
