sentence_good,sentence_bad,field,linguistics_term,UID,simple_LM_method,one_prefix_method,two_prefix_method,lexically_identical,pair_id,good_prob,bad_prob,correct
It's themselves that the women disagreed with.,It's themselves that disagreed with the women.,syntax_semantics,binding,principle_A_reconstruction,True,False,False,True,647,-46.54771041870117,-45.52629089355469,0
It's himself that Scott wasn't criticizing.,It's himself that wasn't criticizing Scott.,syntax_semantics,binding,principle_A_reconstruction,True,False,False,True,648,-49.242401123046875,-47.747467041015625,0
It's herself that this waitress forgets.,It's herself that forgets this waitress.,syntax_semantics,binding,principle_A_reconstruction,True,False,False,True,649,-54.862152099609375,-54.983116149902344,1
It's themselves that a lot of pants distracted.,It's themselves that distracted a lot of pants.,syntax_semantics,binding,principle_A_reconstruction,True,False,False,True,650,-50.92247772216797,-50.206214904785156,0
It's herself who Valerie complained about.,It's herself who complained about Valerie.,syntax_semantics,binding,principle_A_reconstruction,True,False,False,True,651,-49.72809982299805,-47.143497467041016,0
It's himself who Curtis complains about.,It's himself who complains about Curtis.,syntax_semantics,binding,principle_A_reconstruction,True,False,False,True,652,-49.58152389526367,-47.11125183105469,0
It's themselves that the Impressionists didn't hurt.,It's themselves that didn't hurt the Impressionists.,syntax_semantics,binding,principle_A_reconstruction,True,False,False,True,653,-65.87718200683594,-62.57121658325195,0
It's himself who James had scared.,It's himself who had scared James.,syntax_semantics,binding,principle_A_reconstruction,True,False,False,True,654,-47.302467346191406,-46.726341247558594,0
It's herself who Sheila hasn't argued about.,It's herself who hasn't argued about Sheila.,syntax_semantics,binding,principle_A_reconstruction,True,False,False,True,655,-57.921112060546875,-54.786460876464844,0
It's themselves that all trucks hurt.,It's themselves that hurt all trucks.,syntax_semantics,binding,principle_A_reconstruction,True,False,False,True,656,-42.46927261352539,-40.831695556640625,0
It's himself that Todd cures.,It's himself that cures Todd.,syntax_semantics,binding,principle_A_reconstruction,True,False,False,True,657,-43.14528274536133,-46.8062858581543,1
It's himself that Peter is thinking about.,It's himself that is thinking about Peter.,syntax_semantics,binding,principle_A_reconstruction,True,False,False,True,658,-45.337013244628906,-44.10007858276367,0
It's himself that Omar cures.,It's himself that cures Omar.,syntax_semantics,binding,principle_A_reconstruction,True,False,False,True,659,-48.12236785888672,-46.44160079956055,0
It's herself that Samantha sounds like.,It's herself that sounds like Samantha.,syntax_semantics,binding,principle_A_reconstruction,True,False,False,True,660,-46.654876708984375,-37.274200439453125,0
It's herself who Leslie wasn't impressing.,It's herself who wasn't impressing Leslie.,syntax_semantics,binding,principle_A_reconstruction,True,False,False,True,661,-63.532779693603516,-59.385826110839844,0
It's himself who Peter had stunned.,It's himself who had stunned Peter.,syntax_semantics,binding,principle_A_reconstruction,True,False,False,True,662,-52.73799514770508,-53.470088958740234,1
It's herself who Paula did conceal.,It's herself who did conceal Paula.,syntax_semantics,binding,principle_A_reconstruction,True,False,False,True,663,-56.99432373046875,-52.580596923828125,0
It's himself who William cares for.,It's himself who cares for William.,syntax_semantics,binding,principle_A_reconstruction,True,False,False,True,664,-45.86204147338867,-41.60138702392578,0
It's herself that Melanie hadn't worked with.,It's herself that hadn't worked with Melanie.,syntax_semantics,binding,principle_A_reconstruction,True,False,False,True,665,-54.13595199584961,-50.5928840637207,0
It's itself that that commentary aggravated.,It's itself that aggravated that commentary.,syntax_semantics,binding,principle_A_reconstruction,True,False,False,True,666,-60.72350311279297,-56.76572799682617,0
It's themselves that the Clintons are boring.,It's themselves that are boring the Clintons.,syntax_semantics,binding,principle_A_reconstruction,True,False,False,True,667,-49.835845947265625,-52.010047912597656,1
It's herself that Anna discovers.,It's herself that discovers Anna.,syntax_semantics,binding,principle_A_reconstruction,True,False,False,True,668,-39.95634078979492,-44.80369186401367,1
It's herself who Catherine helps.,It's herself who helps Catherine.,syntax_semantics,binding,principle_A_reconstruction,True,False,False,True,669,-42.27207565307617,-40.76179504394531,0
It's itself that that company isn't listening to.,It's itself that isn't listening to that company.,syntax_semantics,binding,principle_A_reconstruction,True,False,False,True,670,-49.968650817871094,-45.90351867675781,0
It's herself that Teresa isn't aggravating.,It's herself that isn't aggravating Teresa.,syntax_semantics,binding,principle_A_reconstruction,True,False,False,True,671,-55.94736099243164,-52.7120361328125,0
It's himself who that cashier is returning to.,It's himself who is returning to that cashier.,syntax_semantics,binding,principle_A_reconstruction,True,False,False,True,672,-63.761070251464844,-55.63932800292969,0
It's herself who Monica hasn't worried.,It's herself who hasn't worried Monica.,syntax_semantics,binding,principle_A_reconstruction,True,False,False,True,673,-57.628875732421875,-54.96422576904297,0
It's herself that Rebecca boasted about.,It's herself that boasted about Rebecca.,syntax_semantics,binding,principle_A_reconstruction,True,False,False,True,674,-51.58750915527344,-49.97446823120117,0
It's herself who Naomi had questioned.,It's herself who had questioned Naomi.,syntax_semantics,binding,principle_A_reconstruction,True,False,False,True,675,-52.177528381347656,-51.894073486328125,0
It's herself who Kirsten is thinking about.,It's herself who is thinking about Kirsten.,syntax_semantics,binding,principle_A_reconstruction,True,False,False,True,676,-54.46057891845703,-50.4142951965332,0
It's herself that Amanda wasn't hugging.,It's herself that wasn't hugging Amanda.,syntax_semantics,binding,principle_A_reconstruction,True,False,False,True,677,-52.45045852661133,-49.17238235473633,0
It's herself that an adult hasn't thought about.,It's herself that hasn't thought about an adult.,syntax_semantics,binding,principle_A_reconstruction,True,False,False,True,678,-52.35023498535156,-46.00486755371094,0
It's themselves that many steps are bothering.,It's themselves that are bothering many steps.,syntax_semantics,binding,principle_A_reconstruction,True,False,False,True,679,-47.04365158081055,-46.37848663330078,0
It's herself who a guest fired.,It's herself who fired a guest.,syntax_semantics,binding,principle_A_reconstruction,True,False,False,True,680,-49.504512786865234,-45.60340118408203,0
It's itself that some lake disturbed.,It's itself that disturbed some lake.,syntax_semantics,binding,principle_A_reconstruction,True,False,False,True,681,-51.436981201171875,-48.978660583496094,0
It's herself that Meredith fires.,It's herself that fires Meredith.,syntax_semantics,binding,principle_A_reconstruction,True,False,False,True,682,-44.83014678955078,-44.47599411010742,0
It's herself that Carolyn might watch.,It's herself that might watch Carolyn.,syntax_semantics,binding,principle_A_reconstruction,True,False,False,True,683,-50.44137191772461,-45.96915817260742,0
It's herself who Angela has described.,It's herself who has described Angela.,syntax_semantics,binding,principle_A_reconstruction,True,False,False,True,684,-50.679168701171875,-48.66444396972656,0
It's himself who Curtis was discovering.,It's himself who was discovering Curtis.,syntax_semantics,binding,principle_A_reconstruction,True,False,False,True,685,-50.15397644042969,-49.95561218261719,0
It's herself who Rose had criticized.,It's herself who had criticized Rose.,syntax_semantics,binding,principle_A_reconstruction,True,False,False,True,686,-51.21125030517578,-49.94750213623047,0
It's himself that Larry is kissing.,It's himself that is kissing Larry.,syntax_semantics,binding,principle_A_reconstruction,True,False,False,True,687,-44.559139251708984,-43.88102722167969,0
It's herself that Caroline dislikes.,It's herself that dislikes Caroline.,syntax_semantics,binding,principle_A_reconstruction,True,False,False,True,688,-57.048824310302734,-57.48273849487305,1
It's herself who Amanda wasn't discovering.,It's herself who wasn't discovering Amanda.,syntax_semantics,binding,principle_A_reconstruction,True,False,False,True,689,-57.80367660522461,-54.56487274169922,0
It's themselves that some chairs had stunned.,It's themselves that had stunned some chairs.,syntax_semantics,binding,principle_A_reconstruction,True,False,False,True,690,-58.0069694519043,-54.41254806518555,0
It's himself that Peter wasn't aggravating.,It's himself that wasn't aggravating Peter.,syntax_semantics,binding,principle_A_reconstruction,True,False,False,True,691,-50.15729522705078,-51.26520538330078,1
It's herself who the waiter cared for.,It's herself who cared for the waiter.,syntax_semantics,binding,principle_A_reconstruction,True,False,False,True,692,-49.98097610473633,-44.61188888549805,0
It's herself that Suzanne returned to.,It's herself that returned to Suzanne.,syntax_semantics,binding,principle_A_reconstruction,True,False,False,True,693,-47.008399963378906,-42.0025634765625,0
It's themselves that most teenagers have criticized.,It's themselves that have criticized most teenagers.,syntax_semantics,binding,principle_A_reconstruction,True,False,False,True,694,-47.177093505859375,-46.988590240478516,0
It's herself who Deanna was questioning.,It's herself who was questioning Deanna.,syntax_semantics,binding,principle_A_reconstruction,True,False,False,True,695,-59.28144454956055,-56.6395263671875,0
It's himself that John hadn't bothered.,It's himself that hadn't bothered John.,syntax_semantics,binding,principle_A_reconstruction,True,False,False,True,696,-47.37649917602539,-48.44179916381836,1
It's itself that that dress disturbs.,It's itself that disturbs that dress.,syntax_semantics,binding,principle_A_reconstruction,True,False,False,True,697,-54.35538101196289,-52.819480895996094,0
It's himself who Craig will hide.,It's himself who will hide Craig.,syntax_semantics,binding,principle_A_reconstruction,True,False,False,True,698,-51.08638000488281,-47.82100296020508,0
It's himself that Lawrence wasn't helping.,It's himself that wasn't helping Lawrence.,syntax_semantics,binding,principle_A_reconstruction,True,False,False,True,699,-45.99498748779297,-42.359046936035156,0
It's herself who Karla sees.,It's herself who sees Karla.,syntax_semantics,binding,principle_A_reconstruction,True,False,False,True,700,-51.530696868896484,-46.7000732421875,0
It's herself that Allison wasn't watching.,It's herself that wasn't watching Allison.,syntax_semantics,binding,principle_A_reconstruction,True,False,False,True,701,-51.48150634765625,-46.27796173095703,0
It's herself that Nancy fired.,It's herself that fired Nancy.,syntax_semantics,binding,principle_A_reconstruction,True,False,False,True,702,-41.86751937866211,-42.9296760559082,1
It's itself that some dress isn't annoying.,It's itself that isn't annoying some dress.,syntax_semantics,binding,principle_A_reconstruction,True,False,False,True,703,-50.64396667480469,-54.26118850708008,1
It's himself that Clyde will notice.,It's himself that will notice Clyde.,syntax_semantics,binding,principle_A_reconstruction,True,False,False,True,704,-48.107025146484375,-48.39621353149414,1
It's himself who Noah isn't talking about.,It's himself who isn't talking about Noah.,syntax_semantics,binding,principle_A_reconstruction,True,False,False,True,705,-48.78601837158203,-46.42409133911133,0
It's herself who Theresa did fire.,It's herself who did fire Theresa.,syntax_semantics,binding,principle_A_reconstruction,True,False,False,True,706,-52.998939514160156,-49.601932525634766,0
It's themselves that some muffins do distract.,It's themselves that do distract some muffins.,syntax_semantics,binding,principle_A_reconstruction,True,False,False,True,707,-60.327659606933594,-57.99434280395508,0
It's themselves who dancers aren't noticing.,It's themselves who aren't noticing dancers.,syntax_semantics,binding,principle_A_reconstruction,True,False,False,True,708,-52.81891632080078,-51.274600982666016,0
It's himself that Guy has noticed.,It's himself that has noticed Guy.,syntax_semantics,binding,principle_A_reconstruction,True,False,False,True,709,-44.47721862792969,-44.67264175415039,1
It's himself that Martin was embarrassing.,It's himself that was embarrassing Martin.,syntax_semantics,binding,principle_A_reconstruction,True,False,False,True,710,-42.69361877441406,-43.350799560546875,1
It's themselves that the boxes have distracted.,It's themselves that have distracted the boxes.,syntax_semantics,binding,principle_A_reconstruction,True,False,False,True,711,-49.44171905517578,-49.021854400634766,0
It's themselves who the Clintons had referenced.,It's themselves who had referenced the Clintons.,syntax_semantics,binding,principle_A_reconstruction,True,False,False,True,712,-62.343414306640625,-58.649505615234375,0
It's herself that Vanessa listened to.,It's herself that listened to Vanessa.,syntax_semantics,binding,principle_A_reconstruction,True,False,False,True,713,-42.89408874511719,-42.38397216796875,0
It's himself that Eric has concealed.,It's himself that has concealed Eric.,syntax_semantics,binding,principle_A_reconstruction,True,False,False,True,714,-47.035560607910156,-49.07325744628906,1
It's herself who Sara has kissed.,It's herself who has kissed Sara.,syntax_semantics,binding,principle_A_reconstruction,True,False,False,True,715,-50.136512756347656,-46.52214813232422,0
It's himself who Bruce should conceal.,It's himself who should conceal Bruce.,syntax_semantics,binding,principle_A_reconstruction,True,False,False,True,716,-54.03407287597656,-51.499488830566406,0
It's themselves who many waitresses shouldn't leave.,It's themselves who shouldn't leave many waitresses.,syntax_semantics,binding,principle_A_reconstruction,True,False,False,True,717,-69.79568481445312,-66.91178131103516,0
It's herself that Mary isn't attacking.,It's herself that isn't attacking Mary.,syntax_semantics,binding,principle_A_reconstruction,True,False,False,True,718,-49.12185287475586,-47.29358673095703,0
It's herself who Tanya wasn't listening to.,It's herself who wasn't listening to Tanya.,syntax_semantics,binding,principle_A_reconstruction,True,False,False,True,719,-63.37904739379883,-55.18556213378906,0
It's itself that some jacket has embarrassed.,It's itself that has embarrassed some jacket.,syntax_semantics,binding,principle_A_reconstruction,True,False,False,True,720,-53.31739044189453,-51.85194778442383,0
It's himself that George will conceal.,It's himself that will conceal George.,syntax_semantics,binding,principle_A_reconstruction,True,False,False,True,721,-48.37574768066406,-46.73369598388672,0
It's himself who Bruce flees from.,It's himself who flees from Bruce.,syntax_semantics,binding,principle_A_reconstruction,True,False,False,True,722,-57.018253326416016,-57.15630340576172,1
It's themselves that a lot of people had insulted.,It's themselves that had insulted a lot of people.,syntax_semantics,binding,principle_A_reconstruction,True,False,False,True,723,-48.971092224121094,-46.15762710571289,0
It's herself who Beth worked with.,It's herself who worked with Beth.,syntax_semantics,binding,principle_A_reconstruction,True,False,False,True,724,-48.4838752746582,-43.929954528808594,0
It's himself who the driver did confuse.,It's himself who did confuse the driver.,syntax_semantics,binding,principle_A_reconstruction,True,False,False,True,725,-56.618309020996094,-51.112396240234375,0
It's himself who Bruce hasn't healed.,It's himself who hasn't healed Bruce.,syntax_semantics,binding,principle_A_reconstruction,True,False,False,True,726,-54.3583869934082,-53.71774673461914,0
It's herself that Judy criticized.,It's herself that criticized Judy.,syntax_semantics,binding,principle_A_reconstruction,True,False,False,True,727,-41.792144775390625,-44.678836822509766,1
It's herself that Patricia wasn't attacking.,It's herself that wasn't attacking Patricia.,syntax_semantics,binding,principle_A_reconstruction,True,False,False,True,728,-51.28511047363281,-46.20478057861328,0
It's itself that that hat impressed.,It's itself that impressed that hat.,syntax_semantics,binding,principle_A_reconstruction,True,False,False,True,729,-48.77027893066406,-45.67741394042969,0
It's himself who Gary could boast about.,It's himself who could boast about Gary.,syntax_semantics,binding,principle_A_reconstruction,True,False,False,True,730,-61.81861877441406,-56.55942153930664,0
It's herself that Heather concealed.,It's herself that concealed Heather.,syntax_semantics,binding,principle_A_reconstruction,True,False,False,True,731,-45.71784973144531,-47.23297119140625,1
It's herself that Irene discusses.,It's herself that discusses Irene.,syntax_semantics,binding,principle_A_reconstruction,True,False,False,True,732,-50.90515899658203,-53.89741516113281,1
It's himself that Randolf hurt.,It's himself that hurt Randolf.,syntax_semantics,binding,principle_A_reconstruction,True,False,False,True,733,-49.85161209106445,-50.38450622558594,1
It's themselves that the ladies might work with.,It's themselves that might work with the ladies.,syntax_semantics,binding,principle_A_reconstruction,True,False,False,True,734,-49.69807052612305,-44.119964599609375,0
It's herself who Susan hadn't remembered.,It's herself who hadn't remembered Susan.,syntax_semantics,binding,principle_A_reconstruction,True,False,False,True,735,-53.17180633544922,-54.10395050048828,1
It's itself that Harvard University had criticized.,It's itself that had criticized Harvard University.,syntax_semantics,binding,principle_A_reconstruction,True,False,False,True,736,-51.93721008300781,-52.71482467651367,1
It's himself who Theodore wouldn't talk about.,It's himself who wouldn't talk about Theodore.,syntax_semantics,binding,principle_A_reconstruction,True,False,False,True,737,-51.411468505859375,-47.75774383544922,0
It's herself that Heidi works with.,It's herself that works with Heidi.,syntax_semantics,binding,principle_A_reconstruction,True,False,False,True,738,-43.50123977661133,-40.83831787109375,0
It's herself that Melissa knew.,It's herself that knew Melissa.,syntax_semantics,binding,principle_A_reconstruction,True,False,False,True,739,-38.344757080078125,-43.26129150390625,1
It's himself who Derek finds.,It's himself who finds Derek.,syntax_semantics,binding,principle_A_reconstruction,True,False,False,True,740,-43.14006423950195,-41.11198043823242,0
It's herself that Elizabeth worried.,It's herself that worried Elizabeth.,syntax_semantics,binding,principle_A_reconstruction,True,False,False,True,741,-40.34068298339844,-41.85209274291992,1
It's himself who Donald couldn't hire.,It's himself who couldn't hire Donald.,syntax_semantics,binding,principle_A_reconstruction,True,False,False,True,742,-50.72813415527344,-48.78822326660156,0
It's herself that Catherine wasn't aggravating.,It's herself that wasn't aggravating Catherine.,syntax_semantics,binding,principle_A_reconstruction,True,False,False,True,743,-52.20873260498047,-50.97547912597656,0
It's himself that Eric is praising.,It's himself that is praising Eric.,syntax_semantics,binding,principle_A_reconstruction,True,False,False,True,744,-47.133140563964844,-49.0916862487793,1
It's himself that Daniel isn't confusing.,It's himself that isn't confusing Daniel.,syntax_semantics,binding,principle_A_reconstruction,True,False,False,True,745,-48.206512451171875,-46.341522216796875,0
It's herself that Lisa was talking to.,It's herself that was talking to Lisa.,syntax_semantics,binding,principle_A_reconstruction,True,False,False,True,746,-41.643592834472656,-41.284637451171875,0
It's himself that Bradley hadn't bothered.,It's himself that hadn't bothered Bradley.,syntax_semantics,binding,principle_A_reconstruction,True,False,False,True,747,-51.17412567138672,-50.47065353393555,0
It's himself that Gerald hides.,It's himself that hides Gerald.,syntax_semantics,binding,principle_A_reconstruction,True,False,False,True,748,-43.86503219604492,-45.88957977294922,1
It's herself that that pedestrian cures.,It's herself that cures that pedestrian.,syntax_semantics,binding,principle_A_reconstruction,True,False,False,True,749,-53.7833251953125,-52.42178726196289,0
It's herself who Stacey wasn't annoying.,It's herself who wasn't annoying Stacey.,syntax_semantics,binding,principle_A_reconstruction,True,False,False,True,750,-64.1140365600586,-61.672386169433594,0
It's itself that this commentary would impress.,It's itself that would impress this commentary.,syntax_semantics,binding,principle_A_reconstruction,True,False,False,True,751,-55.695281982421875,-53.189571380615234,0
It's herself that Elizabeth hides.,It's herself that hides Elizabeth.,syntax_semantics,binding,principle_A_reconstruction,True,False,False,True,752,-42.69190979003906,-45.54875183105469,1
It's herself who Meredith would hide.,It's herself who would hide Meredith.,syntax_semantics,binding,principle_A_reconstruction,True,False,False,True,753,-52.784507751464844,-49.76337814331055,0
It's herself that Rachel is admiring.,It's herself that is admiring Rachel.,syntax_semantics,binding,principle_A_reconstruction,True,False,False,True,754,-55.978633880615234,-56.613521575927734,1
It's herself that Dawn sounds like.,It's herself that sounds like Dawn.,syntax_semantics,binding,principle_A_reconstruction,True,False,False,True,755,-44.59197998046875,-37.247840881347656,0
It's herself who Heidi criticizes.,It's herself who criticizes Heidi.,syntax_semantics,binding,principle_A_reconstruction,True,False,False,True,756,-58.092552185058594,-59.50662612915039,1
It's himself that Patrick had disliked.,It's himself that had disliked Patrick.,syntax_semantics,binding,principle_A_reconstruction,True,False,False,True,757,-49.66940689086914,-52.539833068847656,1
It's himself who this guest will discuss.,It's himself who will discuss this guest.,syntax_semantics,binding,principle_A_reconstruction,True,False,False,True,758,-53.68085479736328,-48.39481735229492,0
It's themselves that the shawls irritated.,It's themselves that irritated the shawls.,syntax_semantics,binding,principle_A_reconstruction,True,False,False,True,759,-60.22361755371094,-57.981231689453125,0
It's himself that Daniel will like.,It's himself that will like Daniel.,syntax_semantics,binding,principle_A_reconstruction,True,False,False,True,760,-44.95331954956055,-41.095096588134766,0
It's themselves that most cakes are embarrassing.,It's themselves that are embarrassing most cakes.,syntax_semantics,binding,principle_A_reconstruction,True,False,False,True,761,-49.71263122558594,-52.15782165527344,1
It's herself who Amelia works with.,It's herself who works with Amelia.,syntax_semantics,binding,principle_A_reconstruction,True,False,False,True,762,-44.647071838378906,-41.49872589111328,0
It's herself who Florence can't kiss.,It's herself who can't kiss Florence.,syntax_semantics,binding,principle_A_reconstruction,True,False,False,True,763,-52.79948806762695,-48.19140625,0
It's herself who Rebecca concealed.,It's herself who concealed Rebecca.,syntax_semantics,binding,principle_A_reconstruction,True,False,False,True,764,-50.27558135986328,-48.302154541015625,0
It's himself who Phillip finds.,It's himself who finds Phillip.,syntax_semantics,binding,principle_A_reconstruction,True,False,False,True,765,-44.768882751464844,-42.664608001708984,0
It's itself that Harvard University wasn't describing.,It's itself that wasn't describing Harvard University.,syntax_semantics,binding,principle_A_reconstruction,True,False,False,True,766,-56.645790100097656,-55.11947250366211,0
It's herself that Sherry shouldn't discover.,It's herself that shouldn't discover Sherry.,syntax_semantics,binding,principle_A_reconstruction,True,False,False,True,767,-56.78718566894531,-56.10356140136719,0
It's herself who Melanie wasn't hiding.,It's herself who wasn't hiding Melanie.,syntax_semantics,binding,principle_A_reconstruction,True,False,False,True,768,-55.62678527832031,-51.839935302734375,0
It's himself who Brett is criticizing.,It's himself who is criticizing Brett.,syntax_semantics,binding,principle_A_reconstruction,True,False,False,True,769,-48.997230529785156,-49.88893127441406,1
It's herself who Martha fires.,It's herself who fires Martha.,syntax_semantics,binding,principle_A_reconstruction,True,False,False,True,770,-47.10472106933594,-48.25701904296875,1
It's themselves that these men liked.,It's themselves that liked these men.,syntax_semantics,binding,principle_A_reconstruction,True,False,False,True,771,-41.29386901855469,-40.84454345703125,0
It's herself who Jodi disagrees with.,It's herself who disagrees with Jodi.,syntax_semantics,binding,principle_A_reconstruction,True,False,False,True,772,-65.27886962890625,-59.757564544677734,0
It's herself that Michelle cured.,It's herself that cured Michelle.,syntax_semantics,binding,principle_A_reconstruction,True,False,False,True,773,-41.510894775390625,-44.038475036621094,1
It's himself who Travis hasn't concealed.,It's himself who hasn't concealed Travis.,syntax_semantics,binding,principle_A_reconstruction,True,False,False,True,774,-57.113677978515625,-55.62641906738281,0
It's herself who Eva did admire.,It's herself who did admire Eva.,syntax_semantics,binding,principle_A_reconstruction,True,False,False,True,775,-54.65580749511719,-50.97685623168945,0
