sentence_good,sentence_bad,field,linguistics_term,UID,simple_LM_method,one_prefix_method,two_prefix_method,lexically_identical,pair_id,good_prob,bad_prob,correct
Janet explains that she references Alice.,Janet explains that herself references Alice.,syntax_semantics,binding,principle_A_case_1,True,True,False,False,474,-60.96681213378906,-66.6197509765625,1
James explains that he notices Noah.,James explains that himself notices Noah.,syntax_semantics,binding,principle_A_case_1,True,True,False,False,475,-46.075931549072266,-54.68659591674805,1
Benjamin might imagine that he explores a lot of schools.,Benjamin might imagine that himself explores a lot of schools.,syntax_semantics,binding,principle_A_case_1,True,True,False,False,476,-61.571205139160156,-69.32182312011719,1
Amanda had said that she boasted about Tracy.,Amanda had said that herself boasted about Tracy.,syntax_semantics,binding,principle_A_case_1,True,True,False,False,477,-64.53592681884766,-72.4158706665039,1
The actors explain that they are skated around a library.,The actors explain that themselves are skated around a library.,syntax_semantics,binding,principle_A_case_1,True,True,False,False,478,-60.93476867675781,-68.22008514404297,1
Stephen imagined that he shouldn't listen to Russell.,Stephen imagined that himself shouldn't listen to Russell.,syntax_semantics,binding,principle_A_case_1,True,True,False,False,479,-48.51433181762695,-56.528541564941406,1
Jason imagined that he had fled from Margaret.,Jason imagined that himself had fled from Margaret.,syntax_semantics,binding,principle_A_case_1,True,True,False,False,480,-55.20096206665039,-63.339324951171875,1
Gary didn't say that he would shock Rodney.,Gary didn't say that himself would shock Rodney.,syntax_semantics,binding,principle_A_case_1,True,True,False,False,481,-45.29658508300781,-50.93123245239258,1
Some dancers said that they disliked this newspaper article.,Some dancers said that themselves disliked this newspaper article.,syntax_semantics,binding,principle_A_case_1,True,True,False,False,482,-58.901756286621094,-68.46083068847656,1
Scott hadn't thought that he was returning to Beverly.,Scott hadn't thought that himself was returning to Beverly.,syntax_semantics,binding,principle_A_case_1,True,True,False,False,483,-45.29438781738281,-52.00312805175781,1
A lot of ladies say that they aren't fixing every plane.,A lot of ladies say that themselves aren't fixing every plane.,syntax_semantics,binding,principle_A_case_1,True,True,False,False,484,-69.08841705322266,-75.59558868408203,1
Rodney won't think that he talks about Grace.,Rodney won't think that himself talks about Grace.,syntax_semantics,binding,principle_A_case_1,True,True,False,False,485,-50.323326110839844,-58.08116912841797,1
Emily hadn't thought that she had ascended a hill.,Emily hadn't thought that herself had ascended a hill.,syntax_semantics,binding,principle_A_case_1,True,True,False,False,486,-55.516597747802734,-60.67169952392578,1
Some pedestrians think that they distract Tamara.,Some pedestrians think that themselves distract Tamara.,syntax_semantics,binding,principle_A_case_1,True,True,False,False,487,-59.69236755371094,-66.79656982421875,1
Tara will think that she could love Homer.,Tara will think that herself could love Homer.,syntax_semantics,binding,principle_A_case_1,True,True,False,False,488,-60.453678131103516,-67.29949951171875,1
Jacqueline imagined that she annoyed Deanna.,Jacqueline imagined that herself annoyed Deanna.,syntax_semantics,binding,principle_A_case_1,True,True,False,False,489,-73.63228607177734,-81.5440444946289,1
Kendra isn't thinking that she fixes those carriages.,Kendra isn't thinking that herself fixes those carriages.,syntax_semantics,binding,principle_A_case_1,True,True,False,False,490,-88.3882827758789,-96.62203979492188,1
A lot of actors could say that they climbed down a hill.,A lot of actors could say that themselves climbed down a hill.,syntax_semantics,binding,principle_A_case_1,True,True,False,False,491,-69.83810424804688,-77.84062194824219,1
Alicia was saying that she did scare Larry.,Alicia was saying that herself did scare Larry.,syntax_semantics,binding,principle_A_case_1,True,True,False,False,492,-76.08482360839844,-84.63517761230469,1
Benjamin wasn't saying that he descends the hill.,Benjamin wasn't saying that himself descends the hill.,syntax_semantics,binding,principle_A_case_1,True,True,False,False,493,-73.3873291015625,-81.50694274902344,1
Kevin imagines that he has attacked Rebecca.,Kevin imagines that himself has attacked Rebecca.,syntax_semantics,binding,principle_A_case_1,True,True,False,False,494,-57.095550537109375,-65.19768524169922,1
Jennifer shouldn't think that she is investigating Paula.,Jennifer shouldn't think that herself is investigating Paula.,syntax_semantics,binding,principle_A_case_1,True,True,False,False,495,-52.13605880737305,-56.62968444824219,1
Lucille says that she might lift every gate.,Lucille says that herself might lift every gate.,syntax_semantics,binding,principle_A_case_1,True,True,False,False,496,-57.98736572265625,-63.11648178100586,1
William hadn't explained that he kisses Sandra.,William hadn't explained that himself kisses Sandra.,syntax_semantics,binding,principle_A_case_1,True,True,False,False,497,-55.86256408691406,-62.042633056640625,1
Those boys say that they hurt these pedestrians.,Those boys say that themselves hurt these pedestrians.,syntax_semantics,binding,principle_A_case_1,True,True,False,False,498,-43.044673919677734,-50.22611618041992,1
Dan does think that he will confuse Lucille.,Dan does think that himself will confuse Lucille.,syntax_semantics,binding,principle_A_case_1,True,True,False,False,499,-60.66872024536133,-65.76618957519531,1
All men say that they lifted some movie theaters.,All men say that themselves lifted some movie theaters.,syntax_semantics,binding,principle_A_case_1,True,True,False,False,500,-53.65699768066406,-61.61460876464844,1
Irene might explain that she hates Beverly.,Irene might explain that herself hates Beverly.,syntax_semantics,binding,principle_A_case_1,True,True,False,False,501,-61.68031311035156,-66.91026306152344,1
Joseph shouldn't imagine that he is revealing this fish.,Joseph shouldn't imagine that himself is revealing this fish.,syntax_semantics,binding,principle_A_case_1,True,True,False,False,502,-58.242835998535156,-64.87574768066406,1
Carolyn did say that she irritated Gregory.,Carolyn did say that herself irritated Gregory.,syntax_semantics,binding,principle_A_case_1,True,True,False,False,503,-65.46761322021484,-70.63912963867188,1
Heather will think that she hadn't hurt Samantha.,Heather will think that herself hadn't hurt Samantha.,syntax_semantics,binding,principle_A_case_1,True,True,False,False,504,-65.17137908935547,-70.66526794433594,1
Roger isn't explaining that he scanned a lot of documentaries.,Roger isn't explaining that himself scanned a lot of documentaries.,syntax_semantics,binding,principle_A_case_1,True,True,False,False,505,-63.934059143066406,-68.8965072631836,1
Carla thinks that she messed up the high schools.,Carla thinks that herself messed up the high schools.,syntax_semantics,binding,principle_A_case_1,True,True,False,False,506,-56.81611633300781,-61.73612976074219,1
Erin imagined that she discussed Gina.,Erin imagined that herself discussed Gina.,syntax_semantics,binding,principle_A_case_1,True,True,False,False,507,-52.97051239013672,-61.22689437866211,1
Most waitresses think that they talked about Janet.,Most waitresses think that themselves talked about Janet.,syntax_semantics,binding,principle_A_case_1,True,True,False,False,508,-63.55534362792969,-72.36396789550781,1
Stacy hasn't thought that she bothered Florence.,Stacy hasn't thought that herself bothered Florence.,syntax_semantics,binding,principle_A_case_1,True,True,False,False,509,-61.56257247924805,-68.06546020507812,1
Jerry wasn't imagining that he didn't worry Bill.,Jerry wasn't imagining that himself didn't worry Bill.,syntax_semantics,binding,principle_A_case_1,True,True,False,False,510,-52.388404846191406,-61.07810592651367,1
Dawn could imagine that she arrives at many art galleries.,Dawn could imagine that herself arrives at many art galleries.,syntax_semantics,binding,principle_A_case_1,True,True,False,False,511,-80.3008041381836,-87.23382568359375,1
John was saying that he is bringing every eggplant.,John was saying that himself is bringing every eggplant.,syntax_semantics,binding,principle_A_case_1,True,True,False,False,512,-63.01818084716797,-70.28104400634766,1
Lisa won't say that she scanned every newspaper article.,Lisa won't say that herself scanned every newspaper article.,syntax_semantics,binding,principle_A_case_1,True,True,False,False,513,-58.064979553222656,-64.6788330078125,1
Candice had imagined that she wasn't admiring Joel.,Candice had imagined that herself wasn't admiring Joel.,syntax_semantics,binding,principle_A_case_1,True,True,False,False,514,-78.2104721069336,-85.58576202392578,1
Walter won't say that he remembered Stacy.,Walter won't say that himself remembered Stacy.,syntax_semantics,binding,principle_A_case_1,True,True,False,False,515,-49.120513916015625,-58.52218246459961,1
Allison thinks that she can hate this dancer.,Allison thinks that herself can hate this dancer.,syntax_semantics,binding,principle_A_case_1,True,True,False,False,516,-56.61631774902344,-63.98420715332031,1
Steven explains that he boasts about Homer.,Steven explains that himself boasts about Homer.,syntax_semantics,binding,principle_A_case_1,True,True,False,False,517,-52.46175765991211,-60.58363342285156,1
Cindy is explaining that she annoyed Patrick.,Cindy is explaining that herself annoyed Patrick.,syntax_semantics,binding,principle_A_case_1,True,True,False,False,518,-69.29090881347656,-77.39505004882812,1
These girls say that they looked like some picture.,These girls say that themselves looked like some picture.,syntax_semantics,binding,principle_A_case_1,True,True,False,False,519,-43.258026123046875,-50.657039642333984,1
Many guests explain that they should bring some restaurants.,Many guests explain that themselves should bring some restaurants.,syntax_semantics,binding,principle_A_case_1,True,True,False,False,520,-49.880645751953125,-57.526737213134766,1
Beverly imagines that she should escape from these adults.,Beverly imagines that herself should escape from these adults.,syntax_semantics,binding,principle_A_case_1,True,True,False,False,521,-94.20431518554688,-100.14016723632812,1
This girl explains that she fled from Douglas.,This girl explains that herself fled from Douglas.,syntax_semantics,binding,principle_A_case_1,True,True,False,False,522,-52.59223556518555,-60.57242965698242,1
Kendra says that she helped this waitress.,Kendra says that herself helped this waitress.,syntax_semantics,binding,principle_A_case_1,True,True,False,False,523,-65.21459197998047,-73.36947631835938,1
Ladies can't explain that they had sounded like Kevin.,Ladies can't explain that themselves had sounded like Kevin.,syntax_semantics,binding,principle_A_case_1,True,True,False,False,524,-63.5352668762207,-71.23310852050781,1
Bethany thought that she has bothered Mitchell.,Bethany thought that herself has bothered Mitchell.,syntax_semantics,binding,principle_A_case_1,True,True,False,False,525,-74.96821594238281,-80.82615661621094,1
Marcus says that he praises Meredith.,Marcus says that himself praises Meredith.,syntax_semantics,binding,principle_A_case_1,True,True,False,False,526,-42.909366607666016,-50.545719146728516,1
Martin isn't imagining that he isn't noticing all actresses.,Martin isn't imagining that himself isn't noticing all actresses.,syntax_semantics,binding,principle_A_case_1,True,True,False,False,527,-65.310302734375,-73.28388214111328,1
Gary wasn't saying that he notices those boys.,Gary wasn't saying that himself notices those boys.,syntax_semantics,binding,principle_A_case_1,True,True,False,False,528,-46.774620056152344,-55.203983306884766,1
Tamara had imagined that she has brought most candles.,Tamara had imagined that herself has brought most candles.,syntax_semantics,binding,principle_A_case_1,True,True,False,False,529,-62.62253952026367,-69.37920379638672,1
Judy shouldn't say that she hates Tina.,Judy shouldn't say that herself hates Tina.,syntax_semantics,binding,principle_A_case_1,True,True,False,False,530,-48.722938537597656,-54.76558303833008,1
Lawrence explained that he examines some documentary.,Lawrence explained that himself examines some documentary.,syntax_semantics,binding,principle_A_case_1,True,True,False,False,531,-58.88461685180664,-67.14132690429688,1
Heidi had imagined that she isn't criticizing the cashiers.,Heidi had imagined that herself isn't criticizing the cashiers.,syntax_semantics,binding,principle_A_case_1,True,True,False,False,532,-81.68302917480469,-88.99075317382812,1
Lucille thought that she can break a lot of bikes.,Lucille thought that herself can break a lot of bikes.,syntax_semantics,binding,principle_A_case_1,True,True,False,False,533,-58.372249603271484,-65.07630920410156,1
Karla explains that she hasn't driven to this restaurant.,Karla explains that herself hasn't driven to this restaurant.,syntax_semantics,binding,principle_A_case_1,True,True,False,False,534,-59.945152282714844,-67.19548034667969,1
Heidi doesn't say that she bored Martin.,Heidi doesn't say that herself bored Martin.,syntax_semantics,binding,principle_A_case_1,True,True,False,False,535,-58.20869445800781,-62.68045425415039,1
Sarah imagined that she cares for Naomi.,Sarah imagined that herself cares for Naomi.,syntax_semantics,binding,principle_A_case_1,True,True,False,False,536,-48.81391143798828,-57.54935073852539,1
Holly thought that she isn't confusing Margaret.,Holly thought that herself isn't confusing Margaret.,syntax_semantics,binding,principle_A_case_1,True,True,False,False,537,-63.48344421386719,-67.25912475585938,1
Andrea did say that she couldn't hate Monet.,Andrea did say that herself couldn't hate Monet.,syntax_semantics,binding,principle_A_case_1,True,True,False,False,538,-70.90739440917969,-78.85853576660156,1
Jerry thought that he hadn't scanned those plays.,Jerry thought that himself hadn't scanned those plays.,syntax_semantics,binding,principle_A_case_1,True,True,False,False,539,-53.75015640258789,-60.61030197143555,1
Connie is imagining that she can't insult Carl.,Connie is imagining that herself can't insult Carl.,syntax_semantics,binding,principle_A_case_1,True,True,False,False,540,-61.217105865478516,-71.86064147949219,1
Kristen does say that she boycotts some restaurant.,Kristen does say that herself boycotts some restaurant.,syntax_semantics,binding,principle_A_case_1,True,True,False,False,541,-69.27136993408203,-76.00543975830078,1
All cashiers imagine that they wear those shirts.,All cashiers imagine that themselves wear those shirts.,syntax_semantics,binding,principle_A_case_1,True,True,False,False,542,-62.92552947998047,-71.5374755859375,1
Kayla thinks that she might drive to this mountain.,Kayla thinks that herself might drive to this mountain.,syntax_semantics,binding,principle_A_case_1,True,True,False,False,543,-60.50904083251953,-65.53083038330078,1
Jane explains that she couldn't look like a sketch.,Jane explains that herself couldn't look like a sketch.,syntax_semantics,binding,principle_A_case_1,True,True,False,False,544,-48.745582580566406,-57.61315155029297,1
Actors imagine that they can't find Alan.,Actors imagine that themselves can't find Alan.,syntax_semantics,binding,principle_A_case_1,True,True,False,False,545,-63.27984619140625,-70.83163452148438,1
Gary wouldn't think that he had questioned Janet.,Gary wouldn't think that himself had questioned Janet.,syntax_semantics,binding,principle_A_case_1,True,True,False,False,546,-49.73173522949219,-56.04357147216797,1
Scott says that he has found Linda.,Scott says that himself has found Linda.,syntax_semantics,binding,principle_A_case_1,True,True,False,False,547,-38.616878509521484,-46.541778564453125,1
Kristin can imagine that she is confusing James.,Kristin can imagine that herself is confusing James.,syntax_semantics,binding,principle_A_case_1,True,True,False,False,548,-58.560943603515625,-64.13993072509766,1
Douglas imagined that he doesn't research every story.,Douglas imagined that himself doesn't research every story.,syntax_semantics,binding,principle_A_case_1,True,True,False,False,549,-62.729557037353516,-70.35186004638672,1
Teresa hasn't explained that she can take the shoe.,Teresa hasn't explained that herself can take the shoe.,syntax_semantics,binding,principle_A_case_1,True,True,False,False,550,-63.46642303466797,-71.41240692138672,1
Kendra hadn't imagined that she was confusing Helen.,Kendra hadn't imagined that herself was confusing Helen.,syntax_semantics,binding,principle_A_case_1,True,True,False,False,551,-79.31859588623047,-86.64289855957031,1
The people say that they go to some grocery stores.,The people say that themselves go to some grocery stores.,syntax_semantics,binding,principle_A_case_1,True,True,False,False,552,-45.01054000854492,-51.02290344238281,1
Becky hadn't imagined that she wasn't firing David.,Becky hadn't imagined that herself wasn't firing David.,syntax_semantics,binding,principle_A_case_1,True,True,False,False,553,-57.47772979736328,-65.04539489746094,1
Caroline says that she shouldn't bore Michelle.,Caroline says that herself shouldn't bore Michelle.,syntax_semantics,binding,principle_A_case_1,True,True,False,False,554,-62.28441619873047,-68.7825927734375,1
Most boys haven't said that they haven't messed up the glasses.,Most boys haven't said that themselves haven't messed up the glasses.,syntax_semantics,binding,principle_A_case_1,True,True,False,False,555,-54.89524459838867,-63.45355987548828,1
These actresses had imagined that they are listening to Eva.,These actresses had imagined that themselves are listening to Eva.,syntax_semantics,binding,principle_A_case_1,True,True,False,False,556,-60.99271774291992,-67.8402099609375,1
Kirsten explains that she fled from Tonya.,Kirsten explains that herself fled from Tonya.,syntax_semantics,binding,principle_A_case_1,True,True,False,False,557,-76.42980194091797,-83.72147369384766,1
Many cashiers can imagine that they haven't visited Ruth.,Many cashiers can imagine that themselves haven't visited Ruth.,syntax_semantics,binding,principle_A_case_1,True,True,False,False,558,-68.26274108886719,-78.45335388183594,1
These actresses imagine that they are going to the grocery store.,These actresses imagine that themselves are going to the grocery store.,syntax_semantics,binding,principle_A_case_1,True,True,False,False,559,-52.70112228393555,-58.904022216796875,1
Those pedestrians imagine that they buy these socks.,Those pedestrians imagine that themselves buy these socks.,syntax_semantics,binding,principle_A_case_1,True,True,False,False,560,-52.84314727783203,-60.672855377197266,1
Kevin thinks that he couldn't skate around these malls.,Kevin thinks that himself couldn't skate around these malls.,syntax_semantics,binding,principle_A_case_1,True,True,False,False,561,-61.90317916870117,-69.62183380126953,1
Amy is saying that she cleans some doors.,Amy is saying that herself cleans some doors.,syntax_semantics,binding,principle_A_case_1,True,True,False,False,562,-44.82400131225586,-51.022308349609375,1
Nina is saying that she had helped Sara.,Nina is saying that herself had helped Sara.,syntax_semantics,binding,principle_A_case_1,True,True,False,False,563,-59.23973083496094,-67.31553649902344,1
Alice explained that she is firing Paul.,Alice explained that herself is firing Paul.,syntax_semantics,binding,principle_A_case_1,True,True,False,False,564,-45.65207290649414,-54.11270523071289,1
All waiters imagined that they break a convertible.,All waiters imagined that themselves break a convertible.,syntax_semantics,binding,principle_A_case_1,True,True,False,False,565,-66.65702056884766,-74.87944030761719,1
Carl is explaining that he dropped by all banks.,Carl is explaining that himself dropped by all banks.,syntax_semantics,binding,principle_A_case_1,True,True,False,False,566,-58.71697235107422,-64.36074829101562,1
Diane might explain that she scanned this newspaper article.,Diane might explain that herself scanned this newspaper article.,syntax_semantics,binding,principle_A_case_1,True,True,False,False,567,-80.75770568847656,-86.03305053710938,1
Emily thought that she would love Larry.,Emily thought that herself would love Larry.,syntax_semantics,binding,principle_A_case_1,True,True,False,False,568,-38.89964294433594,-47.03984451293945,1
Jeffrey says that he has praised Karen.,Jeffrey says that himself has praised Karen.,syntax_semantics,binding,principle_A_case_1,True,True,False,False,569,-55.180870056152344,-62.38467025756836,1
Michelle explained that she was noticing these carts.,Michelle explained that herself was noticing these carts.,syntax_semantics,binding,principle_A_case_1,True,True,False,False,570,-53.02000427246094,-63.63796615600586,1
Renee wouldn't think that she wouldn't tour the high schools.,Renee wouldn't think that herself wouldn't tour the high schools.,syntax_semantics,binding,principle_A_case_1,True,True,False,False,571,-63.15214157104492,-70.22991943359375,1
Vincent had explained that he embarrassed some cashier.,Vincent had explained that himself embarrassed some cashier.,syntax_semantics,binding,principle_A_case_1,True,True,False,False,572,-75.10909271240234,-84.54150390625,1
Sheila shouldn't think that she hired Clyde.,Sheila shouldn't think that herself hired Clyde.,syntax_semantics,binding,principle_A_case_1,True,True,False,False,573,-59.61122512817383,-65.82299041748047,1
Cindy had said that she isn't investigating Colleen.,Cindy had said that herself isn't investigating Colleen.,syntax_semantics,binding,principle_A_case_1,True,True,False,False,574,-83.1359634399414,-90.13627624511719,1
Rebecca explained that she hasn't brought those tomatoes.,Rebecca explained that herself hasn't brought those tomatoes.,syntax_semantics,binding,principle_A_case_1,True,True,False,False,575,-55.83116912841797,-63.71528244018555,1
Anne wasn't imagining that she does climb down most slopes.,Anne wasn't imagining that herself does climb down most slopes.,syntax_semantics,binding,principle_A_case_1,True,True,False,False,576,-69.76176452636719,-77.27581787109375,1
Eric says that he can break this truck.,Eric says that himself can break this truck.,syntax_semantics,binding,principle_A_case_1,True,True,False,False,577,-36.25113296508789,-45.46363067626953,1
Dan hadn't explained that he couldn't cure Liam.,Dan hadn't explained that himself couldn't cure Liam.,syntax_semantics,binding,principle_A_case_1,True,True,False,False,578,-54.29302215576172,-62.67036056518555,1
These girls explain that they broke this car.,These girls explain that themselves broke this car.,syntax_semantics,binding,principle_A_case_1,True,True,False,False,579,-40.6674919128418,-49.07045364379883,1
Anna explained that she had hired Guy.,Anna explained that herself had hired Guy.,syntax_semantics,binding,principle_A_case_1,True,True,False,False,580,-44.529685974121094,-54.828826904296875,1
Jill is explaining that she helps Mark.,Jill is explaining that herself helps Mark.,syntax_semantics,binding,principle_A_case_1,True,True,False,False,581,-65.26451873779297,-73.10450744628906,1
Roger won't imagine that he hadn't helped the Lutherans.,Roger won't imagine that himself hadn't helped the Lutherans.,syntax_semantics,binding,principle_A_case_1,True,True,False,False,582,-63.280113220214844,-71.13624572753906,1
Tracy hadn't imagined that she was working with those guests.,Tracy hadn't imagined that herself was working with those guests.,syntax_semantics,binding,principle_A_case_1,True,True,False,False,583,-62.46504211425781,-71.67817687988281,1
Most pedestrians explain that they have biked to the hills.,Most pedestrians explain that themselves have biked to the hills.,syntax_semantics,binding,principle_A_case_1,True,True,False,False,584,-68.42314147949219,-76.58711242675781,1
Kirsten imagined that she examines a lot of newspaper articles.,Kirsten imagined that herself examines a lot of newspaper articles.,syntax_semantics,binding,principle_A_case_1,True,True,False,False,585,-86.93585205078125,-95.34414672851562,1
Those women say that they escape from Tamara.,Those women say that themselves escape from Tamara.,syntax_semantics,binding,principle_A_case_1,True,True,False,False,586,-51.859832763671875,-59.15799331665039,1
Sonia thought that she dislikes Danielle.,Sonia thought that herself dislikes Danielle.,syntax_semantics,binding,principle_A_case_1,True,True,False,False,587,-79.49665832519531,-85.4023666381836,1
Sabrina imagined that she exited some school.,Sabrina imagined that herself exited some school.,syntax_semantics,binding,principle_A_case_1,True,True,False,False,588,-62.637821197509766,-70.03842163085938,1
Some waiters imagine that they can describe Bethany.,Some waiters imagine that themselves can describe Bethany.,syntax_semantics,binding,principle_A_case_1,True,True,False,False,589,-73.35718536376953,-80.49655151367188,1
Emily doesn't think that she hasn't remembered many high schools.,Emily doesn't think that herself hasn't remembered many high schools.,syntax_semantics,binding,principle_A_case_1,True,True,False,False,590,-54.718143463134766,-60.539695739746094,1
Cindy was imagining that she hadn't hated Benjamin.,Cindy was imagining that herself hadn't hated Benjamin.,syntax_semantics,binding,principle_A_case_1,True,True,False,False,591,-75.02355194091797,-83.80210876464844,1
Christina explains that she did return to Colleen.,Christina explains that herself did return to Colleen.,syntax_semantics,binding,principle_A_case_1,True,True,False,False,592,-68.74359130859375,-78.58181762695312,1
