sentence_good,sentence_bad,field,linguistics_term,UID,simple_LM_method,one_prefix_method,two_prefix_method,lexically_identical,pair_id,good_prob,bad_prob,correct
The men who upset Naomi don't argue about themselves.,The men who upset Naomi don't argue about herself.,syntax_semantics,binding,principle_A_c_command,True,True,False,False,766,-59.00438690185547,-61.481964111328125,1
That broccoli that shouldn't impress Jessica is disturbing itself.,That broccoli that shouldn't impress Jessica is disturbing herself.,syntax_semantics,binding,principle_A_c_command,True,True,False,False,767,-79.02235412597656,-78.74252319335938,0
That university that hasn't criticized all plays hadn't concealed itself.,That university that hasn't criticized all plays hadn't concealed themselves.,syntax_semantics,binding,principle_A_c_command,True,True,False,False,768,-87.59197235107422,-86.54449462890625,0
The libraries that have boasted about Mitchell have referenced themselves.,The libraries that have boasted about Mitchell have referenced himself.,syntax_semantics,binding,principle_A_c_command,True,True,False,False,769,-80.34637451171875,-81.34465026855469,1
A lot of cats that aren't aggravating Liam found themselves.,A lot of cats that aren't aggravating Liam found himself.,syntax_semantics,binding,principle_A_c_command,True,True,False,False,770,-75.6856689453125,-77.75798034667969,1
All students who haven't seen Michael hadn't hidden themselves.,All students who haven't seen Michael hadn't hidden himself.,syntax_semantics,binding,principle_A_c_command,True,True,False,False,771,-65.70803833007812,-65.29505920410156,0
The guests that might fire Matt have impressed themselves.,The guests that might fire Matt have impressed himself.,syntax_semantics,binding,principle_A_c_command,True,True,False,False,772,-67.86366271972656,-68.2668228149414,1
Every waitress that disliked Robert conceals herself.,Every waitress that disliked Robert conceals himself.,syntax_semantics,binding,principle_A_c_command,True,True,False,False,773,-76.41536712646484,-76.09417724609375,0
All associations that buy some river are listening to themselves.,All associations that buy some river are listening to itself.,syntax_semantics,binding,principle_A_c_command,True,True,False,False,774,-63.04764175415039,-65.31709289550781,1
Those patients who can't flee from Deborah do boast about themselves.,Those patients who can't flee from Deborah do boast about herself.,syntax_semantics,binding,principle_A_c_command,True,True,False,False,775,-86.98407745361328,-90.0741195678711,1
This hospital that would worry Melissa praises itself.,This hospital that would worry Melissa praises herself.,syntax_semantics,binding,principle_A_c_command,True,True,False,False,776,-68.52957153320312,-68.03624725341797,0
All children who loved Wendy aren't kissing themselves.,All children who loved Wendy aren't kissing herself.,syntax_semantics,binding,principle_A_c_command,True,True,False,False,777,-61.99053955078125,-64.52473449707031,1
The school that took these blouses wasn't insulting itself.,The school that took these blouses wasn't insulting themselves.,syntax_semantics,binding,principle_A_c_command,True,True,False,False,778,-72.06858825683594,-69.9835205078125,0
The teenagers that irritate William aren't healing themselves.,The teenagers that irritate William aren't healing himself.,syntax_semantics,binding,principle_A_c_command,True,True,False,False,779,-73.77468872070312,-75.1449966430664,1
Every waitress who is helping Martin visits herself.,Every waitress who is helping Martin visits himself.,syntax_semantics,binding,principle_A_c_command,True,True,False,False,780,-64.14585876464844,-63.01919937133789,0
All guests that discuss Robert were criticizing themselves.,All guests that discuss Robert were criticizing himself.,syntax_semantics,binding,principle_A_c_command,True,True,False,False,781,-65.36865234375,-65.54145050048828,1
The rugs that astound Keith aggravated themselves.,The rugs that astound Keith aggravated himself.,syntax_semantics,binding,principle_A_c_command,True,True,False,False,782,-79.24508666992188,-80.00108337402344,1
Legislatures that shouldn't respect Barbara upset themselves.,Legislatures that shouldn't respect Barbara upset herself.,syntax_semantics,binding,principle_A_c_command,True,True,False,False,783,-78.73469543457031,-79.90904998779297,1
These hospitals that hurt Alan weren't confusing themselves.,These hospitals that hurt Alan weren't confusing himself.,syntax_semantics,binding,principle_A_c_command,True,True,False,False,784,-62.456790924072266,-64.26951599121094,1
That lady who is disgusting Keith cures herself.,That lady who is disgusting Keith cures himself.,syntax_semantics,binding,principle_A_c_command,True,True,False,False,785,-70.00212860107422,-69.27479553222656,0
Every skateboard that disturbs Regina is embarrassing itself.,Every skateboard that disturbs Regina is embarrassing herself.,syntax_semantics,binding,principle_A_c_command,True,True,False,False,786,-80.46369934082031,-82.97451782226562,1
Those cashiers that left Melissa fled from themselves.,Those cashiers that left Melissa fled from herself.,syntax_semantics,binding,principle_A_c_command,True,True,False,False,787,-70.85482788085938,-72.70809936523438,1
The boy who hasn't annoyed Diane sees himself.,The boy who hasn't annoyed Diane sees herself.,syntax_semantics,binding,principle_A_c_command,True,True,False,False,788,-65.99441528320312,-67.97480773925781,1
A company that isn't stunning Larry knew itself.,A company that isn't stunning Larry knew himself.,syntax_semantics,binding,principle_A_c_command,True,True,False,False,789,-75.20218658447266,-73.46073913574219,0
Some fish that upset Richard upset itself.,Some fish that upset Richard upset himself.,syntax_semantics,binding,principle_A_c_command,True,True,False,False,790,-53.94770812988281,-52.06298065185547,0
That fish that can't break some plates found itself.,That fish that can't break some plates found themselves.,syntax_semantics,binding,principle_A_c_command,True,True,False,False,791,-58.756317138671875,-56.89158630371094,0
Some ladies that saw a drawing can't reveal themselves.,Some ladies that saw a drawing can't reveal itself.,syntax_semantics,binding,principle_A_c_command,True,True,False,False,792,-65.26435852050781,-68.06221008300781,1
Every lady that will notice these boys cares for herself.,Every lady that will notice these boys cares for themselves.,syntax_semantics,binding,principle_A_c_command,True,True,False,False,793,-63.07536697387695,-59.92418670654297,0
All women that have climbed up some ladder weren't describing themselves.,All women that have climbed up some ladder weren't describing itself.,syntax_semantics,binding,principle_A_c_command,True,True,False,False,794,-72.73908996582031,-75.3538818359375,1
A woman who didn't describe James has visited herself.,A woman who didn't describe James has visited himself.,syntax_semantics,binding,principle_A_c_command,True,True,False,False,795,-70.07998657226562,-67.89421081542969,0
A lot of pedestrians that worked with Sharon will insult themselves.,A lot of pedestrians that worked with Sharon will insult herself.,syntax_semantics,binding,principle_A_c_command,True,True,False,False,796,-86.70608520507812,-88.41716766357422,1
The cashiers that should praise Lawrence have fired themselves.,The cashiers that should praise Lawrence have fired himself.,syntax_semantics,binding,principle_A_c_command,True,True,False,False,797,-76.06692504882812,-76.4896240234375,1
This boy that hasn't boasted about Cheryl has returned to himself.,This boy that hasn't boasted about Cheryl has returned to herself.,syntax_semantics,binding,principle_A_c_command,True,True,False,False,798,-81.07792663574219,-82.68541717529297,1
Most women that will astound Michael are discovering themselves.,Most women that will astound Michael are discovering himself.,syntax_semantics,binding,principle_A_c_command,True,True,False,False,799,-73.65037536621094,-74.37663269042969,1
Actresses that walk through a closet don't talk to themselves.,Actresses that walk through a closet don't talk to itself.,syntax_semantics,binding,principle_A_c_command,True,True,False,False,800,-65.66162109375,-67.5521011352539,1
Some plane that bothered Mark doesn't stun itself.,Some plane that bothered Mark doesn't stun himself.,syntax_semantics,binding,principle_A_c_command,True,True,False,False,801,-70.46236419677734,-68.4056396484375,0
The people that had kissed Nancy hugged themselves.,The people that had kissed Nancy hugged herself.,syntax_semantics,binding,principle_A_c_command,True,True,False,False,802,-56.47832107543945,-57.34401321411133,1
Those legislatures that sold this high school forgot themselves.,Those legislatures that sold this high school forgot itself.,syntax_semantics,binding,principle_A_c_command,True,True,False,False,803,-64.13825225830078,-64.96302795410156,1
A lot of boys that cleaned a grocery store did listen to themselves.,A lot of boys that cleaned a grocery store did listen to itself.,syntax_semantics,binding,principle_A_c_command,True,True,False,False,804,-81.212158203125,-84.42765045166016,1
The essays that haven't impressed Harvard University weren't worrying themselves.,The essays that haven't impressed Harvard University weren't worrying itself.,syntax_semantics,binding,principle_A_c_command,True,True,False,False,805,-87.24256896972656,-88.15434265136719,1
Those guys that drop by some hospital loved themselves.,Those guys that drop by some hospital loved itself.,syntax_semantics,binding,principle_A_c_command,True,True,False,False,806,-59.277503967285156,-61.91014862060547,1
Some guests who wouldn't discover Jane hadn't healed themselves.,Some guests who wouldn't discover Jane hadn't healed herself.,syntax_semantics,binding,principle_A_c_command,True,True,False,False,807,-70.89579772949219,-71.97817993164062,1
Many pictures that aggravated Carl can't scare themselves.,Many pictures that aggravated Carl can't scare himself.,syntax_semantics,binding,principle_A_c_command,True,True,False,False,808,-70.52059936523438,-70.52464294433594,1
That bank that wouldn't resemble those sketches is talking to itself.,That bank that wouldn't resemble those sketches is talking to themselves.,syntax_semantics,binding,principle_A_c_command,True,True,False,False,809,-77.60670471191406,-74.62896728515625,0
Some teachers that watched Sarah approached themselves.,Some teachers that watched Sarah approached herself.,syntax_semantics,binding,principle_A_c_command,True,True,False,False,810,-52.212745666503906,-53.86181640625,1
A lot of eyes that are embarrassing Russell astounded themselves.,A lot of eyes that are embarrassing Russell astounded himself.,syntax_semantics,binding,principle_A_c_command,True,True,False,False,811,-80.2359619140625,-81.9539794921875,1
The snake that climbed down these mountains hasn't shocked itself.,The snake that climbed down these mountains hasn't shocked themselves.,syntax_semantics,binding,principle_A_c_command,True,True,False,False,812,-80.51300048828125,-78.41829681396484,0
Chicken that hurts Margaret shouldn't alarm itself.,Chicken that hurts Margaret shouldn't alarm herself.,syntax_semantics,binding,principle_A_c_command,True,True,False,False,813,-58.60344696044922,-56.92022705078125,0
This play that has annoyed Daniel has scared itself.,This play that has annoyed Daniel has scared himself.,syntax_semantics,binding,principle_A_c_command,True,True,False,False,814,-71.92535400390625,-70.71898651123047,0
Some senators who passed that hospital couldn't conceal themselves.,Some senators who passed that hospital couldn't conceal itself.,syntax_semantics,binding,principle_A_c_command,True,True,False,False,815,-75.18244934082031,-77.15730285644531,1
The association that has these cars didn't hate itself.,The association that has these cars didn't hate themselves.,syntax_semantics,binding,principle_A_c_command,True,True,False,False,816,-58.062076568603516,-55.69509506225586,0
Most adults who left Victoria noticed themselves.,Most adults who left Victoria noticed herself.,syntax_semantics,binding,principle_A_c_command,True,True,False,False,817,-50.51092529296875,-52.830955505371094,1
Every essay that is hurting Victoria was worrying itself.,Every essay that is hurting Victoria was worrying herself.,syntax_semantics,binding,principle_A_c_command,True,True,False,False,818,-71.41304779052734,-71.09288787841797,0
Many teachers that would go to that hill wouldn't alarm themselves.,Many teachers that would go to that hill wouldn't alarm itself.,syntax_semantics,binding,principle_A_c_command,True,True,False,False,819,-61.05271911621094,-62.3026123046875,1
Many guys who don't talk about Stephen aren't finding themselves.,Many guys who don't talk about Stephen aren't finding himself.,syntax_semantics,binding,principle_A_c_command,True,True,False,False,820,-63.63831329345703,-64.26002502441406,1
Many associations that are arguing about Sonia loved themselves.,Many associations that are arguing about Sonia loved herself.,syntax_semantics,binding,principle_A_c_command,True,True,False,False,821,-64.67288970947266,-68.78199005126953,1
This shawl that will aggravate Dawn can't disgust itself.,This shawl that will aggravate Dawn can't disgust herself.,syntax_semantics,binding,principle_A_c_command,True,True,False,False,822,-97.14657592773438,-96.86592864990234,0
Some dancer who hasn't investigated Brad discovers herself.,Some dancer who hasn't investigated Brad discovers himself.,syntax_semantics,binding,principle_A_c_command,True,True,False,False,823,-72.07035827636719,-70.13700103759766,0
Some woman who hadn't messed up that library escapes from herself.,Some woman who hadn't messed up that library escapes from itself.,syntax_semantics,binding,principle_A_c_command,True,True,False,False,824,-72.90572357177734,-72.85140228271484,0
The drivers that wouldn't drop by some grocery store would find themselves.,The drivers that wouldn't drop by some grocery store would find itself.,syntax_semantics,binding,principle_A_c_command,True,True,False,False,825,-80.0008773803711,-82.49929809570312,1
All doctors that have referenced Carla observed themselves.,All doctors that have referenced Carla observed herself.,syntax_semantics,binding,principle_A_c_command,True,True,False,False,826,-68.43804931640625,-71.19932556152344,1
Every boy who runs around all rivers was admiring himself.,Every boy who runs around all rivers was admiring themselves.,syntax_semantics,binding,principle_A_c_command,True,True,False,False,827,-78.61726379394531,-78.15696716308594,0
Some high schools that haven't disturbed Matt hadn't worried themselves.,Some high schools that haven't disturbed Matt hadn't worried himself.,syntax_semantics,binding,principle_A_c_command,True,True,False,False,828,-82.25924682617188,-83.0050048828125,1
Most jackets that have hurt Anna bored themselves.,Most jackets that have hurt Anna bored herself.,syntax_semantics,binding,principle_A_c_command,True,True,False,False,829,-63.46308135986328,-64.01472473144531,1
This cilantro that wasn't annoying Jason is disturbing itself.,This cilantro that wasn't annoying Jason is disturbing himself.,syntax_semantics,binding,principle_A_c_command,True,True,False,False,830,-88.6202621459961,-86.34559631347656,0
Many men that haven't hidden Kayla hadn't talked about themselves.,Many men that haven't hidden Kayla hadn't talked about herself.,syntax_semantics,binding,principle_A_c_command,True,True,False,False,831,-74.91365051269531,-77.72178649902344,1
Some cashiers who broke that skateboard noticed themselves.,Some cashiers who broke that skateboard noticed itself.,syntax_semantics,binding,principle_A_c_command,True,True,False,False,832,-78.52821350097656,-80.50111389160156,1
Those adults who had examined this report talked to themselves.,Those adults who had examined this report talked to itself.,syntax_semantics,binding,principle_A_c_command,True,True,False,False,833,-59.23045349121094,-62.40745544433594,1
That girl that works with the Clintons hasn't criticized herself.,That girl that works with the Clintons hasn't criticized themselves.,syntax_semantics,binding,principle_A_c_command,True,True,False,False,834,-69.55587768554688,-68.036865234375,0
That cup that confused Christina stunned itself.,That cup that confused Christina stunned herself.,syntax_semantics,binding,principle_A_c_command,True,True,False,False,835,-69.70742797851562,-70.89048767089844,1
Some pictures that resembled this picture can't shock themselves.,Some pictures that resembled this picture can't shock itself.,syntax_semantics,binding,principle_A_c_command,True,True,False,False,836,-66.34654235839844,-67.80023193359375,1
Some shirt that can't resemble these drawings bored itself.,Some shirt that can't resemble these drawings bored themselves.,syntax_semantics,binding,principle_A_c_command,True,True,False,False,837,-71.64871215820312,-70.06907653808594,0
All shoes that could astound Phillip are bothering themselves.,All shoes that could astound Phillip are bothering himself.,syntax_semantics,binding,principle_A_c_command,True,True,False,False,838,-70.91217041015625,-73.19424438476562,1
These dancers that complained about Phillip can leave themselves.,These dancers that complained about Phillip can leave himself.,syntax_semantics,binding,principle_A_c_command,True,True,False,False,839,-61.356388092041016,-62.868892669677734,1
That actress who walked through these high schools would investigate herself.,That actress who walked through these high schools would investigate themselves.,syntax_semantics,binding,principle_A_c_command,True,True,False,False,840,-76.58613586425781,-74.27288055419922,0
All guys that lifted a lake won't see themselves.,All guys that lifted a lake won't see itself.,syntax_semantics,binding,principle_A_c_command,True,True,False,False,841,-62.18193817138672,-64.72523498535156,1
The women who reference Heather discussed themselves.,The women who reference Heather discussed herself.,syntax_semantics,binding,principle_A_c_command,True,True,False,False,842,-55.193870544433594,-57.52179718017578,1
Every waitress that wouldn't notice some skirt might conceal herself.,Every waitress that wouldn't notice some skirt might conceal itself.,syntax_semantics,binding,principle_A_c_command,True,True,False,False,843,-80.56565856933594,-79.22259521484375,0
Cucumbers that disgust Bill haven't worried themselves.,Cucumbers that disgust Bill haven't worried himself.,syntax_semantics,binding,principle_A_c_command,True,True,False,False,844,-86.79667663574219,-87.32579040527344,1
The actress that breaks these glasses described herself.,The actress that breaks these glasses described themselves.,syntax_semantics,binding,principle_A_c_command,True,True,False,False,845,-63.57710647583008,-60.86724853515625,0
These actresses who watched Derek will appreciate themselves.,These actresses who watched Derek will appreciate himself.,syntax_semantics,binding,principle_A_c_command,True,True,False,False,846,-65.77005004882812,-65.96382141113281,1
This dancer who hadn't known Aaron hadn't appreciated herself.,This dancer who hadn't known Aaron hadn't appreciated himself.,syntax_semantics,binding,principle_A_c_command,True,True,False,False,847,-80.1517105102539,-78.739990234375,0
Every rug that had scared many guests isn't embarrassing itself.,Every rug that had scared many guests isn't embarrassing themselves.,syntax_semantics,binding,principle_A_c_command,True,True,False,False,848,-78.4445571899414,-76.35899353027344,0
This company that embarrassed Florence hadn't disliked itself.,This company that embarrassed Florence hadn't disliked herself.,syntax_semantics,binding,principle_A_c_command,True,True,False,False,849,-69.55423736572266,-68.97322845458984,0
The children that won't work with Carla aggravated themselves.,The children that won't work with Carla aggravated herself.,syntax_semantics,binding,principle_A_c_command,True,True,False,False,850,-71.1778564453125,-71.99893951416016,1
Most legislatures that upset Michael hadn't criticized themselves.,Most legislatures that upset Michael hadn't criticized himself.,syntax_semantics,binding,principle_A_c_command,True,True,False,False,851,-67.17903900146484,-66.86126708984375,0
These senators who will scare Bethany disgusted themselves.,These senators who will scare Bethany disgusted herself.,syntax_semantics,binding,principle_A_c_command,True,True,False,False,852,-82.98844909667969,-84.37174224853516,1
Some man who ascends a lot of steps observes himself.,Some man who ascends a lot of steps observes themselves.,syntax_semantics,binding,principle_A_c_command,True,True,False,False,853,-74.04058837890625,-73.36494445800781,0
Some cafe that scared Dennis was scaring itself.,Some cafe that scared Dennis was scaring himself.,syntax_semantics,binding,principle_A_c_command,True,True,False,False,854,-68.77500915527344,-66.80078125,0
Every waitress that is looking like the sketch hasn't scared herself.,Every waitress that is looking like the sketch hasn't scared itself.,syntax_semantics,binding,principle_A_c_command,True,True,False,False,855,-76.7941665649414,-74.79747772216797,0
That government that disgusts Mitchell dislikes itself.,That government that disgusts Mitchell dislikes himself.,syntax_semantics,binding,principle_A_c_command,True,True,False,False,856,-81.63731384277344,-81.96633911132812,1
Many banks that fired Sherry are insulting themselves.,Many banks that fired Sherry are insulting herself.,syntax_semantics,binding,principle_A_c_command,True,True,False,False,857,-69.45652770996094,-72.73533630371094,1
That boy that isn't fleeing from Sara is watching himself.,That boy that isn't fleeing from Sara is watching herself.,syntax_semantics,binding,principle_A_c_command,True,True,False,False,858,-74.8695068359375,-76.47587585449219,1
All customers who loved this book shouldn't dislike themselves.,All customers who loved this book shouldn't dislike itself.,syntax_semantics,binding,principle_A_c_command,True,True,False,False,859,-65.19325256347656,-67.42713165283203,1
Some guests who hadn't discussed Denise respected themselves.,Some guests who hadn't discussed Denise respected herself.,syntax_semantics,binding,principle_A_c_command,True,True,False,False,860,-64.80750274658203,-67.38310241699219,1
Many waitresses that admire Douglas sounded like themselves.,Many waitresses that admire Douglas sounded like himself.,syntax_semantics,binding,principle_A_c_command,True,True,False,False,861,-73.64654541015625,-73.17768859863281,0
A lot of teenagers who haven't visited Brian might heal themselves.,A lot of teenagers who haven't visited Brian might heal himself.,syntax_semantics,binding,principle_A_c_command,True,True,False,False,862,-86.26785278320312,-85.2051773071289,0
A dancer who did reveal all actresses isn't thinking about herself.,A dancer who did reveal all actresses isn't thinking about themselves.,syntax_semantics,binding,principle_A_c_command,True,True,False,False,863,-90.27473449707031,-87.34602355957031,0
The senators that have researched art investigated themselves.,The senators that have researched art investigated itself.,syntax_semantics,binding,principle_A_c_command,True,True,False,False,864,-65.3220443725586,-64.53648376464844,0
Waitresses that haven't disturbed Tanya have observed themselves.,Waitresses that haven't disturbed Tanya have observed herself.,syntax_semantics,binding,principle_A_c_command,True,True,False,False,865,-87.3744888305664,-88.89761352539062,1
The dancer that has cared for the senators visits herself.,The dancer that has cared for the senators visits themselves.,syntax_semantics,binding,principle_A_c_command,True,True,False,False,866,-71.738525390625,-69.81784057617188,0
Cashiers that messed up this dress would love themselves.,Cashiers that messed up this dress would love itself.,syntax_semantics,binding,principle_A_c_command,True,True,False,False,867,-64.0879898071289,-65.10382843017578,1
The picture that bothers cashiers bored itself.,The picture that bothers cashiers bored themselves.,syntax_semantics,binding,principle_A_c_command,True,True,False,False,868,-68.19969177246094,-67.60588836669922,0
The girls that discover Amy aren't listening to themselves.,The girls that discover Amy aren't listening to herself.,syntax_semantics,binding,principle_A_c_command,True,True,False,False,869,-56.525020599365234,-58.70192337036133,1
A lot of pedestrians who hadn't talked about some college campus won't watch themselves.,A lot of pedestrians who hadn't talked about some college campus won't watch itself.,syntax_semantics,binding,principle_A_c_command,True,True,False,False,870,-102.5374755859375,-105.02814483642578,1
Most cashiers who can approach Tamara didn't reveal themselves.,Most cashiers who can approach Tamara didn't reveal herself.,syntax_semantics,binding,principle_A_c_command,True,True,False,False,871,-91.53366088867188,-93.33145141601562,1
Every man that concealed Deborah hasn't hidden himself.,Every man that concealed Deborah hasn't hidden herself.,syntax_semantics,binding,principle_A_c_command,True,True,False,False,872,-71.76541900634766,-73.13803100585938,1
These companies that were working with Christine aren't insulting themselves.,These companies that were working with Christine aren't insulting herself.,syntax_semantics,binding,principle_A_c_command,True,True,False,False,873,-61.0476188659668,-64.22943878173828,1
The lady who had healed the man respects herself.,The lady who had healed the man respects himself.,syntax_semantics,binding,principle_A_c_command,True,True,False,False,874,-62.92216110229492,-61.72077178955078,0
A company that bored Karla praises itself.,A company that bored Karla praises herself.,syntax_semantics,binding,principle_A_c_command,True,True,False,False,875,-81.68824768066406,-81.77070617675781,1
