sentence_good,sentence_bad,field,linguistics_term,UID,simple_LM_method,one_prefix_method,two_prefix_method,lexically_identical,pair_id,good_prob,bad_prob,correct
Some turtles alarm Kimberley.,Some turtles come here Kimberley.,syntax,argument_structure,transitive,True,False,True,False,0,-55.27228546142578,-53.61613082885742,0
Diane watched Alan.,Diane screamed Alan.,syntax,argument_structure,transitive,True,False,True,False,1,-42.39291763305664,-43.286834716796875,1
This cousin of Theodore buys some mushroom.,This cousin of Theodore wept some mushroom.,syntax,argument_structure,transitive,True,False,True,False,2,-60.44554901123047,-69.24874877929688,1
Rhonda was arguing about this nephew of Dana.,Rhonda was going fishing this nephew of Dana.,syntax,argument_structure,transitive,True,False,True,False,3,-56.58624267578125,-60.39366149902344,1
A lot of actresses' nieces have toured that art gallery.,A lot of actresses' nieces have coped that art gallery.,syntax,argument_structure,transitive,True,False,True,False,4,-106.16474914550781,-113.6513671875,1
Debra wears many skirts.,Debra slumps over many skirts.,syntax,argument_structure,transitive,True,False,True,False,5,-38.09869384765625,-54.26784896850586,1
Chad's daughters embarrasses Erin's girlfriend.,Chad's daughters screamed Erin's girlfriend.,syntax,argument_structure,transitive,True,False,True,False,6,-75.19419860839844,-65.74494171142578,0
Elaine criticized Jill.,Elaine shrugs Jill.,syntax,argument_structure,transitive,True,False,True,False,7,-41.123748779296875,-52.000823974609375,1
The pedestrians question some people.,The pedestrians wave some people.,syntax,argument_structure,transitive,True,False,True,False,8,-36.8794059753418,-37.49397659301758,1
Vanessa has gone to a lot of college campuses.,Vanessa has smiled a lot of college campuses.,syntax,argument_structure,transitive,True,False,True,False,9,-47.900306701660156,-57.3502197265625,1
Those committees listened to Kristen.,Those committees react Kristen.,syntax,argument_structure,transitive,True,False,True,False,10,-41.29720687866211,-38.27471923828125,0
Most pedestrians' father might climb up the slope.,Most pedestrians' father might murmur the slope.,syntax,argument_structure,transitive,True,False,True,False,11,-63.709442138671875,-83.61515808105469,1
Theresa shouldn't scan this essay.,Theresa shouldn't murmur this essay.,syntax,argument_structure,transitive,True,False,True,False,12,-54.97686004638672,-71.61295318603516,1
Andrea's ex-husbands toured this art gallery.,Andrea's ex-husbands cry this art gallery.,syntax,argument_structure,transitive,True,False,True,False,13,-89.55958557128906,-92.60295867919922,1
A lot of girls' son hadn't insulted Jerry.,A lot of girls' son hadn't sighed Jerry.,syntax,argument_structure,transitive,True,False,True,False,14,-73.97986602783203,-77.5181884765625,1
Denise has escaped from Marie's grandsons.,Denise has fallen Marie's grandsons.,syntax,argument_structure,transitive,True,False,True,False,15,-68.3418960571289,-62.124324798583984,0
Grace is investigating a lot of girls' ex-wife.,Grace is going fishing a lot of girls' ex-wife.,syntax,argument_structure,transitive,True,False,True,False,16,-64.90426635742188,-68.13951110839844,1
Donna talked about Anna's friends.,Donna replies Anna's friends.,syntax,argument_structure,transitive,True,False,True,False,17,-42.130767822265625,-49.4049072265625,1
Many sisters of some guest forget Eva.,Many sisters of some guest murmured Eva.,syntax,argument_structure,transitive,True,False,True,False,18,-60.58110809326172,-68.9813461303711,1
The truck hadn't astounded a bank.,The truck hadn't fallen a bank.,syntax,argument_structure,transitive,True,False,True,False,19,-55.96573257446289,-41.2149772644043,0
April's mentees weren't kissing Matt's nephews.,April's mentees weren't chuckling Matt's nephews.,syntax,argument_structure,transitive,True,False,True,False,20,-79.61297607421875,-87.7374267578125,1
Phillip isn't observing Winston Churchill.,Phillip isn't grinning Winston Churchill.,syntax,argument_structure,transitive,True,False,True,False,21,-55.968135833740234,-58.345096588134766,1
Bill explores the bank.,Bill wept the bank.,syntax,argument_structure,transitive,True,False,True,False,22,-26.341514587402344,-33.65032958984375,1
These grandmothers of Rebecca remembered Angela.,These grandmothers of Rebecca flirted Angela.,syntax,argument_structure,transitive,True,False,True,False,23,-61.04546356201172,-68.35426330566406,1
Many universities describe Samantha.,Many universities reacted Samantha.,syntax,argument_structure,transitive,True,False,True,False,24,-34.99943542480469,-35.635169982910156,1
A lot of grandmothers of Melanie go to the mall.,A lot of grandmothers of Melanie murmured the mall.,syntax,argument_structure,transitive,True,False,True,False,25,-73.18634033203125,-89.99700927734375,1
Stacy's cousins haven't scanned many drivers' oncologists.,Stacy's cousins haven't concurred many drivers' oncologists.,syntax,argument_structure,transitive,True,False,True,False,26,-101.16806030273438,-110.35350799560547,1
Ella's tutor can't fire every adult.,Ella's tutor can't talk every adult.,syntax,argument_structure,transitive,True,False,True,False,27,-63.28584671020508,-62.6337890625,0
Christopher researched most public parks.,Christopher suffered most public parks.,syntax,argument_structure,transitive,True,False,True,False,28,-36.69063949584961,-35.245216369628906,0
Melinda explores those closets.,Melinda slumped over those closets.,syntax,argument_structure,transitive,True,False,True,False,29,-43.36066436767578,-53.883724212646484,1
Most nieces of Jacqueline worry Phillip.,Most nieces of Jacqueline wave Phillip.,syntax,argument_structure,transitive,True,False,True,False,30,-80.8215103149414,-79.76422882080078,0
Some mother of Diane wasn't distracting a lot of students' ex-girlfriends.,Some mother of Diane wasn't coming here a lot of students' ex-girlfriends.,syntax,argument_structure,transitive,True,False,True,False,31,-107.66233825683594,-106.12430572509766,0
Robert hasn't escaped from Brenda.,Robert hasn't talked Brenda.,syntax,argument_structure,transitive,True,False,True,False,32,-39.144718170166016,-33.928466796875,0
Marcus wasn't running around that high school.,Marcus wasn't smiling that high school.,syntax,argument_structure,transitive,True,False,True,False,33,-32.96593475341797,-34.16117858886719,1
Monet hadn't examined most commentaries.,Monet hadn't wept most commentaries.,syntax,argument_structure,transitive,True,False,True,False,34,-63.568092346191406,-69.33857727050781,1
Many actresses escape from Cynthia.,Many actresses weep Cynthia.,syntax,argument_structure,transitive,True,False,True,False,35,-43.291595458984375,-40.69477462768555,0
Amy's cousins distracts a lot of women.,Amy's cousins reply a lot of women.,syntax,argument_structure,transitive,True,False,True,False,36,-51.660789489746094,-44.01311492919922,0
Many senators' niece admires Brian's ex-husband.,Many senators' niece chuckled Brian's ex-husband.,syntax,argument_structure,transitive,True,False,True,False,37,-86.08322143554688,-80.04942321777344,0
Carmen's father isn't cleaning a lot of cups.,Carmen's father isn't waving a lot of cups.,syntax,argument_structure,transitive,True,False,True,False,38,-73.58562469482422,-72.01651763916016,0
Rose couldn't like Liam's employees.,Rose couldn't go fishing Liam's employees.,syntax,argument_structure,transitive,True,False,True,False,39,-39.847442626953125,-49.679386138916016,1
Daniel's ex-husband resembles a lot of prints of actresses.,Daniel's ex-husband compromises a lot of prints of actresses.,syntax,argument_structure,transitive,True,False,True,False,40,-68.6236572265625,-72.42298889160156,1
Heidi sells every banana.,Heidi sighed every banana.,syntax,argument_structure,transitive,True,False,True,False,41,-46.056846618652344,-51.2396240234375,1
Phillip's senators alarm the driver.,Phillip's senators shouted the driver.,syntax,argument_structure,transitive,True,False,True,False,42,-59.14624786376953,-60.52680969238281,1
The actress can notice every student.,The actress can weep every student.,syntax,argument_structure,transitive,True,False,True,False,43,-44.19390869140625,-47.499080657958984,1
The mothers of Kimberley think about all universities.,The mothers of Kimberley sighed all universities.,syntax,argument_structure,transitive,True,False,True,False,44,-68.70061492919922,-80.7721176147461,1
The Clintons heal Kimberley.,The Clintons retaliated Kimberley.,syntax,argument_structure,transitive,True,False,True,False,45,-58.21954345703125,-67.77444458007812,1
Most schools hurt Marcus.,Most schools fall Marcus.,syntax,argument_structure,transitive,True,False,True,False,46,-33.85420227050781,-33.97669219970703,1
Phillip knows Jill's senator.,Phillip reacts Jill's senator.,syntax,argument_structure,transitive,True,False,True,False,47,-46.98963165283203,-46.893760681152344,0
Sabrina was criticizing Jennifer.,Sabrina was falling Jennifer.,syntax,argument_structure,transitive,True,False,True,False,48,-44.008140563964844,-38.92097473144531,0
Lori was exploring art galleries.,Lori was compromising art galleries.,syntax,argument_structure,transitive,True,False,True,False,49,-54.808631896972656,-57.10480880737305,1
Beth will embarrass Eric.,Beth will concur Eric.,syntax,argument_structure,transitive,True,False,True,False,50,-53.16184616088867,-60.48033142089844,1
The guy hadn't skated around schools.,The guy hadn't complained schools.,syntax,argument_structure,transitive,True,False,True,False,51,-49.44817352294922,-42.23151779174805,0
Ella's teachers hire Nina.,Ella's teachers clashed Nina.,syntax,argument_structure,transitive,True,False,True,False,52,-48.25026321411133,-54.28430938720703,1
Every cashier astounded Barbara's nieces.,Every cashier boasts Barbara's nieces.,syntax,argument_structure,transitive,True,False,True,False,53,-84.51807403564453,-79.14091491699219,0
That mushroom irritates Michael's daughters.,That mushroom rotted Michael's daughters.,syntax,argument_structure,transitive,True,False,True,False,54,-60.72808837890625,-63.21396255493164,1
Valerie's electricians arrive at the rivers.,Valerie's electricians smiled the rivers.,syntax,argument_structure,transitive,True,False,True,False,55,-60.40740966796875,-65.91911315917969,1
Every hospital shocked Donald.,Every hospital boasts Donald.,syntax,argument_structure,transitive,True,False,True,False,56,-40.73792266845703,-41.978546142578125,1
Patricia did lift that hat.,Patricia did slump over that hat.,syntax,argument_structure,transitive,True,False,True,False,57,-45.97340393066406,-62.861846923828125,1
Irene resembled every painting.,Irene testifies every painting.,syntax,argument_structure,transitive,True,False,True,False,58,-43.07347869873047,-49.169315338134766,1
Michelle praises Bradley.,Michelle testifies Bradley.,syntax,argument_structure,transitive,True,False,True,False,59,-28.077653884887695,-39.15435791015625,1
That brother of Michael revealed many mushrooms.,That brother of Michael goes fishing many mushrooms.,syntax,argument_structure,transitive,True,False,True,False,60,-61.15818786621094,-66.94759368896484,1
This teacher's plumbers can't skate around many movie theaters.,This teacher's plumbers can't clash many movie theaters.,syntax,argument_structure,transitive,True,False,True,False,61,-85.07083892822266,-80.93069458007812,0
Cousins of Stephanie run around all art galleries.,Cousins of Stephanie mutter all art galleries.,syntax,argument_structure,transitive,True,False,True,False,62,-82.32313537597656,-88.98095703125,1
These drivers questioned sons of Janice.,These drivers confer sons of Janice.,syntax,argument_structure,transitive,True,False,True,False,63,-58.47650909423828,-61.87805938720703,1
Drawings of Judy are annoying that student.,Drawings of Judy are falling that student.,syntax,argument_structure,transitive,True,False,True,False,64,-58.1316032409668,-58.1783561706543,1
The Borgias disagreed with the teenager's granddaughters.,The Borgias come here the teenager's granddaughters.,syntax,argument_structure,transitive,True,False,True,False,65,-88.57711029052734,-86.30757141113281,0
Customers' ex-girlfriends bike to the Great Lakes.,Customers' ex-girlfriends escape the Great Lakes.,syntax,argument_structure,transitive,True,False,True,False,66,-77.47663879394531,-76.3143310546875,0
All grandmothers of Debra run around some art galleries.,All grandmothers of Debra fall some art galleries.,syntax,argument_structure,transitive,True,False,True,False,67,-83.89016723632812,-81.68779754638672,0
Jerry wasn't escaping from a waitress.,Jerry wasn't crying a waitress.,syntax,argument_structure,transitive,True,False,True,False,68,-38.343017578125,-29.450788497924805,0
Naomi talked to Guy.,Naomi sighed Guy.,syntax,argument_structure,transitive,True,False,True,False,69,-39.39992141723633,-43.77128982543945,1
Doctors' lawyer discussed the niece of Lucille.,Doctors' lawyer lies the niece of Lucille.,syntax,argument_structure,transitive,True,False,True,False,70,-65.94738006591797,-67.15821075439453,1
Guy's daughters talk to Jesus.,Guy's daughters complained Jesus.,syntax,argument_structure,transitive,True,False,True,False,71,-34.007423400878906,-39.66078186035156,1
That girl can admire Meredith.,That girl can escape Meredith.,syntax,argument_structure,transitive,True,False,True,False,72,-38.85395050048828,-38.0671501159668,0
Some actors' tutor hadn't questioned Candice's mentors.,Some actors' tutor hadn't shrugged Candice's mentors.,syntax,argument_structure,transitive,True,False,True,False,73,-93.6809310913086,-101.0220947265625,1
Some student wasn't healing that guy.,Some student wasn't talking that guy.,syntax,argument_structure,transitive,True,False,True,False,74,-45.702239990234375,-40.3095703125,0
Lawrence's grandson won't sell every glove.,Lawrence's grandson won't suffer every glove.,syntax,argument_structure,transitive,True,False,True,False,75,-54.119293212890625,-57.43110275268555,1
Stacy's ex-wife passes these grocery stores.,Stacy's ex-wife cries these grocery stores.,syntax,argument_structure,transitive,True,False,True,False,76,-68.01417541503906,-71.5887222290039,1
Carrie did discover Daniel.,Carrie did joke around Daniel.,syntax,argument_structure,transitive,True,False,True,False,77,-43.24666213989258,-45.95115661621094,1
Alicia wasn't referencing Victoria.,Alicia wasn't compromising Victoria.,syntax,argument_structure,transitive,True,False,True,False,78,-61.95277404785156,-61.44394302368164,0
John scans Leslie's tutors.,John blinked Leslie's tutors.,syntax,argument_structure,transitive,True,False,True,False,79,-50.784976959228516,-53.10873031616211,1
A girl's supervisors worries boys' son.,A girl's supervisors chatted boys' son.,syntax,argument_structure,transitive,True,False,True,False,80,-72.02516174316406,-81.4810791015625,1
Jacqueline's sons hated the Borgias.,Jacqueline's sons communicated the Borgias.,syntax,argument_structure,transitive,True,False,True,False,81,-73.27461242675781,-80.33250427246094,1
Some shawl might resemble many prints of the screen.,Some shawl might fall many prints of the screen.,syntax,argument_structure,transitive,True,False,True,False,82,-77.48932647705078,-77.69404602050781,1
A carriage upsets Amanda.,A carriage fell Amanda.,syntax,argument_structure,transitive,True,False,True,False,83,-60.2730712890625,-48.94306945800781,0
Some senators have attacked Pamela.,Some senators have cooperated Pamela.,syntax,argument_structure,transitive,True,False,True,False,84,-46.498390197753906,-52.95304870605469,1
All prints upset Robert.,All prints fell Robert.,syntax,argument_structure,transitive,True,False,True,False,85,-37.79362487792969,-40.004669189453125,1
Some teacher's nieces buy this high school.,Some teacher's nieces complain this high school.,syntax,argument_structure,transitive,True,False,True,False,86,-63.971397399902344,-68.97738647460938,1
A lot of photographs have alarmed some pedestrians.,A lot of photographs have fallen some pedestrians.,syntax,argument_structure,transitive,True,False,True,False,87,-64.06216430664062,-60.38438415527344,0
Carolyn's grandfathers ran around these grocery stores.,Carolyn's grandfathers conspired these grocery stores.,syntax,argument_structure,transitive,True,False,True,False,88,-69.6530532836914,-79.14993286132812,1
Wendy complains about Lissa.,Wendy comes here Lissa.,syntax,argument_structure,transitive,True,False,True,False,89,-51.72166442871094,-50.488853454589844,0
Many children's son helped Robert.,Many children's son shrugged Robert.,syntax,argument_structure,transitive,True,False,True,False,90,-37.53150939941406,-48.60304260253906,1
Sonia's teachers exit a hill.,Sonia's teachers screamed a hill.,syntax,argument_structure,transitive,True,False,True,False,91,-55.917301177978516,-55.18552017211914,0
The son of Diana wouldn't buy most sweaters.,The son of Diana wouldn't complain most sweaters.,syntax,argument_structure,transitive,True,False,True,False,92,-60.12805938720703,-65.05674743652344,1
Rodney has revealed some restaurant.,Rodney has slumped over some restaurant.,syntax,argument_structure,transitive,True,False,True,False,93,-38.52037048339844,-46.344757080078125,1
Laura talks to Carrie.,Laura chuckled Carrie.,syntax,argument_structure,transitive,True,False,True,False,94,-28.22152328491211,-32.06331253051758,1
Margaret is investigating Rodney's hairdressers.,Margaret is shrugging Rodney's hairdressers.,syntax,argument_structure,transitive,True,False,True,False,95,-65.00387573242188,-80.76268005371094,1
Many fathers of Florence lifted every light.,Many fathers of Florence waved every light.,syntax,argument_structure,transitive,True,False,True,False,96,-54.54755401611328,-57.74302673339844,1
Florence's wife hadn't dropped by that lake.,Florence's wife hadn't come here that lake.,syntax,argument_structure,transitive,True,False,True,False,97,-66.43475341796875,-66.34568786621094,0
Tanya's cousins sell some drawing.,Tanya's cousins fell some drawing.,syntax,argument_structure,transitive,True,False,True,False,98,-63.8208122253418,-67.93751525878906,1
Most cashiers tour that movie theater.,Most cashiers littered that movie theater.,syntax,argument_structure,transitive,True,False,True,False,99,-63.582847595214844,-69.88157653808594,1
Erin's employees were discovering this rug.,Erin's employees were speaking up this rug.,syntax,argument_structure,transitive,True,False,True,False,100,-61.663185119628906,-63.092830657958984,1
Kristin ran around some glacier.,Kristin screams some glacier.,syntax,argument_structure,transitive,True,False,True,False,101,-40.39414978027344,-40.164947509765625,0
Some rabbits hadn't shocked John's hairdresser.,Some rabbits hadn't come here John's hairdresser.,syntax,argument_structure,transitive,True,False,True,False,102,-77.5074462890625,-74.35162353515625,0
Russell runs around a lot of closets.,Russell falls a lot of closets.,syntax,argument_structure,transitive,True,False,True,False,103,-37.868675231933594,-38.091243743896484,1
Men tour some closets.,Men weep some closets.,syntax,argument_structure,transitive,True,False,True,False,104,-38.813785552978516,-39.45956039428711,1
The lady liked Craig.,The lady concurred Craig.,syntax,argument_structure,transitive,True,False,True,False,105,-30.644577026367188,-47.5081901550293,1
Kimberley will care for Cynthia.,Kimberley will smile Cynthia.,syntax,argument_structure,transitive,True,False,True,False,106,-49.55315017700195,-47.40000915527344,0
Peter isn't lifting some fork.,Peter isn't coming here some fork.,syntax,argument_structure,transitive,True,False,True,False,107,-40.862266540527344,-44.2030029296875,1
That son of Brad helps some actresses.,That son of Brad cooperates some actresses.,syntax,argument_structure,transitive,True,False,True,False,108,-55.186439514160156,-66.63311004638672,1
Cheryl hasn't cared for Amanda.,Cheryl hasn't joked around Amanda.,syntax,argument_structure,transitive,True,False,True,False,109,-63.701133728027344,-77.28732299804688,1
Allison is discussing every brother of Jane.,Allison is nodding every brother of Jane.,syntax,argument_structure,transitive,True,False,True,False,110,-61.40611267089844,-67.04905700683594,1
Ruth kisses Chad.,Ruth talks Chad.,syntax,argument_structure,transitive,True,False,True,False,111,-44.60948944091797,-44.44413757324219,0
All bananas disturb Gina.,All bananas rot Gina.,syntax,argument_structure,transitive,True,False,True,False,112,-40.25751495361328,-38.67414093017578,0
Russell's sisters discover some unicycle.,Russell's sisters fall some unicycle.,syntax,argument_structure,transitive,True,False,True,False,113,-51.898170471191406,-51.43494415283203,0
A print of many windows embarrasses Noah.,A print of many windows fell Noah.,syntax,argument_structure,transitive,True,False,True,False,114,-82.1225814819336,-69.14321899414062,0
These banks boasted about Eric's bosses.,These banks conspire Eric's bosses.,syntax,argument_structure,transitive,True,False,True,False,115,-57.3127555847168,-58.99156951904297,1
That picture of that newspaper article looked like some screen.,That picture of that newspaper article fell some screen.,syntax,argument_structure,transitive,True,False,True,False,116,-69.07405090332031,-69.72518920898438,1
The patients observe Jessica.,The patients laughed Jessica.,syntax,argument_structure,transitive,True,False,True,False,117,-38.73136901855469,-36.478797912597656,0
Some children are talking about Amy.,Some children are going fishing Amy.,syntax,argument_structure,transitive,True,False,True,False,118,-22.919675827026367,-30.25853729248047,1
That movie about the Lutherans had irritated Julia.,That movie about the Lutherans had disagreed Julia.,syntax,argument_structure,transitive,True,False,True,False,119,-75.82018280029297,-76.71066284179688,1
Brenda's students were boring Beth.,Brenda's students were screaming Beth.,syntax,argument_structure,transitive,True,False,True,False,120,-48.75502014160156,-49.077980041503906,1
Fathers of Amelia distract many teachers.,Fathers of Amelia disagreed many teachers.,syntax,argument_structure,transitive,True,False,True,False,121,-55.05455017089844,-56.777774810791016,1
A lot of bikes are looking like that drawing.,A lot of bikes are falling that drawing.,syntax,argument_structure,transitive,True,False,True,False,122,-60.687381744384766,-61.10355758666992,1
Every woman's classmate broke a lot of chairs.,Every woman's classmate works hard a lot of chairs.,syntax,argument_structure,transitive,True,False,True,False,123,-49.9289665222168,-59.769554138183594,1
Tiffany's contractors watch the father of Kristen.,Tiffany's contractors confer the father of Kristen.,syntax,argument_structure,transitive,True,False,True,False,124,-85.85469055175781,-93.76953125,1
Most guests aren't biking to Spain.,Most guests aren't working hard Spain.,syntax,argument_structure,transitive,True,False,True,False,125,-46.25693893432617,-43.90289306640625,0
Sarah brought the photograph of this cilantro.,Sarah mutters the photograph of this cilantro.,syntax,argument_structure,transitive,True,False,True,False,126,-54.28022766113281,-72.32106018066406,1
Angela hasn't aggravated the senator's piano teachers.,Angela hasn't come here the senator's piano teachers.,syntax,argument_structure,transitive,True,False,True,False,127,-74.30960083007812,-66.47462463378906,0
A mountain shocks Walter.,A mountain fell Walter.,syntax,argument_structure,transitive,True,False,True,False,128,-49.102386474609375,-49.45612335205078,1
Carmen's podiatrists have cleaned that picture.,Carmen's podiatrists have died that picture.,syntax,argument_structure,transitive,True,False,True,False,129,-99.77827453613281,-101.31763458251953,1
Laurie was fleeing from most lakes.,Laurie was blinking most lakes.,syntax,argument_structure,transitive,True,False,True,False,130,-58.232852935791016,-57.32773208618164,0
Anne's wife revealed Julie.,Anne's wife complained Julie.,syntax,argument_structure,transitive,True,False,True,False,131,-35.91111373901367,-37.76615905761719,1
This waitress had praised these guys.,This waitress had gone fishing these guys.,syntax,argument_structure,transitive,True,False,True,False,132,-48.074928283691406,-49.120121002197266,1
Every teacher doesn't reveal Bruce.,Every teacher doesn't sigh Bruce.,syntax,argument_structure,transitive,True,False,True,False,133,-39.8420295715332,-43.30607223510742,1
Lisa is aggravating Liam.,Lisa is muttering Liam.,syntax,argument_structure,transitive,True,False,True,False,134,-32.76974105834961,-40.21591567993164,1
Vanessa does fix that couch.,Vanessa does grin that couch.,syntax,argument_structure,transitive,True,False,True,False,135,-43.91891860961914,-54.421356201171875,1
This friend of Joseph had these pants.,This friend of Joseph spoke up these pants.,syntax,argument_structure,transitive,True,False,True,False,136,-50.02863311767578,-59.268184661865234,1
Richard would reference Phillip's tutor.,Richard would scream Phillip's tutor.,syntax,argument_structure,transitive,True,False,True,False,137,-50.38844680786133,-47.620933532714844,0
This college campus confused Nancy.,This college campus falls Nancy.,syntax,argument_structure,transitive,True,False,True,False,138,-49.89371109008789,-49.28705596923828,0
Rodney's friend might climb up a hill.,Rodney's friend might complain a hill.,syntax,argument_structure,transitive,True,False,True,False,139,-49.70264434814453,-53.376853942871094,1
Cheryl's hairdressers criticize that child.,Cheryl's hairdressers corresponded that child.,syntax,argument_structure,transitive,True,False,True,False,140,-93.67362976074219,-101.69924926757812,1
Dan hadn't arrived at all public parks.,Dan hadn't complained all public parks.,syntax,argument_structure,transitive,True,False,True,False,141,-41.71919631958008,-48.77973556518555,1
