sentence_good,sentence_bad,field,linguistics_term,UID,simple_LM_method,one_prefix_method,two_prefix_method,lexically_identical,pair_id,good_prob,bad_prob,correct
All boys boast about that child.,All boys boast about those child.,morphology,determiner_noun_agreement,determiner_noun_agreement_irregular_2,True,False,True,True,0,-41.53974533081055,-44.31352233886719,1
Candice has taken that axis.,Candice has taken those axis.,morphology,determiner_noun_agreement,determiner_noun_agreement_irregular_2,True,False,True,True,1,-37.95909881591797,-38.69953536987305,1
Those ladies walk through those oases.,Those ladies walk through that oases.,morphology,determiner_noun_agreement,determiner_noun_agreement_irregular_2,True,False,True,True,2,-47.0186653137207,-46.303855895996094,0
The legislatures praise this woman.,The legislatures praise these woman.,morphology,determiner_noun_agreement,determiner_noun_agreement_irregular_2,True,False,True,True,3,-40.919944763183594,-44.89501953125,1
Many icicles do bore that child.,Many icicles do bore those child.,morphology,determiner_noun_agreement,determiner_noun_agreement_irregular_2,True,False,True,True,4,-53.49435806274414,-55.045379638671875,1
Actors see this tooth.,Actors see these tooth.,morphology,determiner_noun_agreement,determiner_noun_agreement_irregular_2,True,False,True,True,5,-47.78807830810547,-49.38197326660156,1
Diane lifts these oxen.,Diane lifts this oxen.,morphology,determiner_noun_agreement,determiner_noun_agreement_irregular_2,True,False,True,True,6,-51.12290954589844,-51.60822296142578,1
Sonia hadn't boasted about those men.,Sonia hadn't boasted about that men.,morphology,determiner_noun_agreement,determiner_noun_agreement_irregular_2,True,False,True,True,7,-58.19038009643555,-58.83575439453125,1
Benjamin wasn't running around this oasis.,Benjamin wasn't running around these oasis.,morphology,determiner_noun_agreement,determiner_noun_agreement_irregular_2,True,False,True,True,8,-53.89216613769531,-54.1270866394043,1
Elaine isn't breaking that foot.,Elaine isn't breaking those foot.,morphology,determiner_noun_agreement,determiner_noun_agreement_irregular_2,True,False,True,True,9,-40.478824615478516,-43.30479431152344,1
This window hadn't embarrassed those people.,This window hadn't embarrassed that people.,morphology,determiner_noun_agreement,determiner_noun_agreement_irregular_2,True,False,True,True,10,-46.640777587890625,-44.660621643066406,0
A pedestrian lifted this axis.,A pedestrian lifted these axis.,morphology,determiner_noun_agreement,determiner_noun_agreement_irregular_2,True,False,True,True,11,-53.73535919189453,-53.65900802612305,0
Kathleen wouldn't discuss that alumnus.,Kathleen wouldn't discuss those alumnus.,morphology,determiner_noun_agreement,determiner_noun_agreement_irregular_2,True,False,True,True,12,-68.16661071777344,-72.02962493896484,1
Candice skated around these oases.,Candice skated around this oases.,morphology,determiner_noun_agreement,determiner_noun_agreement_irregular_2,True,False,True,True,13,-57.290706634521484,-56.953609466552734,0
Helen argued about these syntheses.,Helen argued about this syntheses.,morphology,determiner_noun_agreement,determiner_noun_agreement_irregular_2,True,False,True,True,14,-46.70205307006836,-44.38083267211914,0
Natalie describes this child.,Natalie describes these child.,morphology,determiner_noun_agreement,determiner_noun_agreement_irregular_2,True,False,True,True,15,-32.864036560058594,-35.533485412597656,1
Every story disagreed with these people.,Every story disagreed with this people.,morphology,determiner_noun_agreement,determiner_noun_agreement_irregular_2,True,False,True,True,16,-35.29371643066406,-38.85616683959961,1
Karla helped these men.,Karla helped this men.,morphology,determiner_noun_agreement,determiner_noun_agreement_irregular_2,True,False,True,True,17,-31.906675338745117,-34.44774627685547,1
A government has described that child.,A government has described those child.,morphology,determiner_noun_agreement,determiner_noun_agreement_irregular_2,True,False,True,True,18,-46.98832321166992,-51.673126220703125,1
Every customer discusses those theses.,Every customer discusses that theses.,morphology,determiner_noun_agreement,determiner_noun_agreement_irregular_2,True,False,True,True,19,-49.3214111328125,-43.48420715332031,0
Marla is attacking that man.,Marla is attacking those man.,morphology,determiner_noun_agreement,determiner_noun_agreement_irregular_2,True,False,True,True,20,-34.809688568115234,-37.98081970214844,1
Some cashiers hide that nucleus.,Some cashiers hide those nucleus.,morphology,determiner_noun_agreement,determiner_noun_agreement_irregular_2,True,False,True,True,21,-50.47228240966797,-51.428016662597656,1
Robert attacks that child.,Robert attacks those child.,morphology,determiner_noun_agreement,determiner_noun_agreement_irregular_2,True,False,True,True,22,-25.86208724975586,-30.112751007080078,1
Ruth couldn't discover that fungus.,Ruth couldn't discover those fungus.,morphology,determiner_noun_agreement,determiner_noun_agreement_irregular_2,True,False,True,True,23,-53.16499328613281,-52.91972351074219,0
Christine talks about this child.,Christine talks about these child.,morphology,determiner_noun_agreement,determiner_noun_agreement_irregular_2,True,False,True,True,24,-30.105804443359375,-33.78605270385742,1
All books were irritating those men.,All books were irritating that men.,morphology,determiner_noun_agreement,determiner_noun_agreement_irregular_2,True,False,True,True,25,-43.509307861328125,-42.87957763671875,0
Scott has bought these axes.,Scott has bought this axes.,morphology,determiner_noun_agreement,determiner_noun_agreement_irregular_2,True,False,True,True,26,-33.688419342041016,-33.27070236206055,0
Those mouths disturb that woman.,Those mouths disturb those woman.,morphology,determiner_noun_agreement,determiner_noun_agreement_irregular_2,True,False,True,True,27,-37.77836227416992,-40.286128997802734,1
Carl likes these geese.,Carl likes this geese.,morphology,determiner_noun_agreement,determiner_noun_agreement_irregular_2,True,False,True,True,28,-37.22909164428711,-35.46846008300781,0
Carlos returns to these children.,Carlos returns to this children.,morphology,determiner_noun_agreement,determiner_noun_agreement_irregular_2,True,False,True,True,29,-30.832809448242188,-33.1535530090332,1
Becca hadn't boycotted those oases.,Becca hadn't boycotted that oases.,morphology,determiner_noun_agreement,determiner_noun_agreement_irregular_2,True,False,True,True,30,-79.266357421875,-78.971435546875,0
A legislature hadn't aggravated this person.,A legislature hadn't aggravated these person.,morphology,determiner_noun_agreement,determiner_noun_agreement_irregular_2,True,False,True,True,31,-66.08816528320312,-69.98394012451172,1
Monica has loved this man.,Monica has loved these man.,morphology,determiner_noun_agreement,determiner_noun_agreement_irregular_2,True,False,True,True,32,-33.02933120727539,-36.71883773803711,1
Marcus praises this man.,Marcus praises these man.,morphology,determiner_noun_agreement,determiner_noun_agreement_irregular_2,True,False,True,True,33,-28.76031494140625,-31.632617950439453,1
Many men examine those analyses.,Many men examine that analyses.,morphology,determiner_noun_agreement,determiner_noun_agreement_irregular_2,True,False,True,True,34,-42.21865463256836,-41.48370361328125,0
A drawing looks like these cacti.,A drawing looks like this cacti.,morphology,determiner_noun_agreement,determiner_noun_agreement_irregular_2,True,False,True,True,35,-59.7098274230957,-58.6478385925293,0
A mouth had disgusted that man.,A mouth had disgusted those man.,morphology,determiner_noun_agreement,determiner_noun_agreement_irregular_2,True,False,True,True,36,-56.82244110107422,-60.72426986694336,1
Sally couldn't love these men.,Sally couldn't love this men.,morphology,determiner_noun_agreement,determiner_noun_agreement_irregular_2,True,False,True,True,37,-45.32679748535156,-47.12004470825195,1
Gary wasn't healing this man.,Gary wasn't healing these man.,morphology,determiner_noun_agreement,determiner_noun_agreement_irregular_2,True,False,True,True,38,-34.92186737060547,-39.03972625732422,1
Steven arrived at this oasis.,Steven arrived at these oasis.,morphology,determiner_noun_agreement,determiner_noun_agreement_irregular_2,True,False,True,True,39,-37.319271087646484,-37.76905822753906,1
Carlos isn't exiting those oases.,Carlos isn't exiting that oases.,morphology,determiner_noun_agreement,determiner_noun_agreement_irregular_2,True,False,True,True,40,-63.54973602294922,-61.347137451171875,0
This waitress doesn't sell those stimuli.,This waitress doesn't sell that stimuli.,morphology,determiner_noun_agreement,determiner_noun_agreement_irregular_2,True,False,True,True,41,-45.5883903503418,-44.42052459716797,0
Janice has hated this alumnus.,Janice has hated these alumnus.,morphology,determiner_noun_agreement,determiner_noun_agreement_irregular_2,True,False,True,True,42,-59.50373840332031,-60.622962951660156,1
Pamela is talking to these men.,Pamela is talking to this men.,morphology,determiner_noun_agreement,determiner_noun_agreement_irregular_2,True,False,True,True,43,-47.16374206542969,-49.50517272949219,1
Susan notices these teeth.,Susan notices this teeth.,morphology,determiner_noun_agreement,determiner_noun_agreement_irregular_2,True,False,True,True,44,-31.649154663085938,-31.371475219726562,0
Elizabeth has referenced that child.,Elizabeth has referenced those child.,morphology,determiner_noun_agreement,determiner_noun_agreement_irregular_2,True,False,True,True,45,-29.277902603149414,-33.292320251464844,1
Allison isn't noticing these nuclei.,Allison isn't noticing this nuclei.,morphology,determiner_noun_agreement,determiner_noun_agreement_irregular_2,True,False,True,True,46,-63.49693298339844,-62.94048309326172,0
Lissa sounds like those women.,Lissa sounds like that women.,morphology,determiner_noun_agreement,determiner_noun_agreement_irregular_2,True,False,True,True,47,-34.67672348022461,-36.18156433105469,1
Rebecca cures that child.,Rebecca cures those child.,morphology,determiner_noun_agreement,determiner_noun_agreement_irregular_2,True,False,True,True,48,-35.57000732421875,-38.239784240722656,1
Pedestrians conceal those lice.,Pedestrians conceal that lice.,morphology,determiner_noun_agreement,determiner_noun_agreement_irregular_2,True,False,True,True,49,-56.407958984375,-54.63190460205078,0
Sabrina admired that person.,Sabrina admired those person.,morphology,determiner_noun_agreement,determiner_noun_agreement_irregular_2,True,False,True,True,50,-34.90570831298828,-37.92578125,1
Kevin hires that person.,Kevin hires those person.,morphology,determiner_noun_agreement,determiner_noun_agreement_irregular_2,True,False,True,True,51,-27.165475845336914,-30.949501037597656,1
Cynthia hadn't concealed those children.,Cynthia hadn't concealed that children.,morphology,determiner_noun_agreement,determiner_noun_agreement_irregular_2,True,False,True,True,52,-62.23118591308594,-62.68998718261719,1
Kristin thought about that foot.,Kristin thought about those foot.,morphology,determiner_noun_agreement,determiner_noun_agreement_irregular_2,True,False,True,True,53,-32.62342834472656,-35.594356536865234,1
Theresa isn't dropping by that oasis.,Theresa isn't dropping by those oasis.,morphology,determiner_noun_agreement,determiner_noun_agreement_irregular_2,True,False,True,True,54,-60.688148498535156,-61.85291290283203,1
Tonya boasts about those men.,Tonya boasts about that men.,morphology,determiner_noun_agreement,determiner_noun_agreement_irregular_2,True,False,True,True,55,-41.10067367553711,-42.107051849365234,1
Bikes hurt this person.,Bikes hurt these person.,morphology,determiner_noun_agreement,determiner_noun_agreement_irregular_2,True,False,True,True,56,-44.27723693847656,-49.14442443847656,1
Many customers question this man.,Many customers question these man.,morphology,determiner_noun_agreement,determiner_noun_agreement_irregular_2,True,False,True,True,57,-37.37467956542969,-38.744354248046875,1
The casseroles scare this woman.,The casseroles scare these woman.,morphology,determiner_noun_agreement,determiner_noun_agreement_irregular_2,True,False,True,True,58,-54.758399963378906,-58.03722381591797,1
Museums were stunning this child.,Museums were stunning these child.,morphology,determiner_noun_agreement,determiner_noun_agreement_irregular_2,True,False,True,True,59,-54.00743865966797,-56.686397552490234,1
All projectors embarrass those people.,All projectors embarrass that people.,morphology,determiner_noun_agreement,determiner_noun_agreement_irregular_2,True,False,True,True,60,-45.59352111816406,-46.13776397705078,1
Michelle won't clean this tooth.,Michelle won't clean these tooth.,morphology,determiner_noun_agreement,determiner_noun_agreement_irregular_2,True,False,True,True,61,-30.084102630615234,-33.666839599609375,1
A hill bothers this man.,A hill bothers these man.,morphology,determiner_noun_agreement,determiner_noun_agreement_irregular_2,True,False,True,True,62,-48.28046417236328,-51.827884674072266,1
Many committees argue about this alumnus.,Many committees argue about these alumnus.,morphology,determiner_noun_agreement,determiner_noun_agreement_irregular_2,True,False,True,True,63,-56.53635787963867,-58.03047561645508,1
Natalie references this child.,Natalie references these child.,morphology,determiner_noun_agreement,determiner_noun_agreement_irregular_2,True,False,True,True,64,-35.07304382324219,-38.257049560546875,1
Carolyn wouldn't notice that foot.,Carolyn wouldn't notice those foot.,morphology,determiner_noun_agreement,determiner_noun_agreement_irregular_2,True,False,True,True,65,-42.50802230834961,-45.70579528808594,1
All students tour these oases.,All students tour this oases.,morphology,determiner_noun_agreement,determiner_noun_agreement_irregular_2,True,False,True,True,66,-49.551361083984375,-51.926673889160156,1
Some rivers didn't bore that woman.,Some rivers didn't bore those woman.,morphology,determiner_noun_agreement,determiner_noun_agreement_irregular_2,True,False,True,True,67,-44.47487258911133,-47.41404724121094,1
Tanya cleaned these teeth.,Tanya cleaned this teeth.,morphology,determiner_noun_agreement,determiner_noun_agreement_irregular_2,True,False,True,True,68,-47.93924331665039,-47.98895263671875,1
This broccoli is alarming those children.,This broccoli is alarming that children.,morphology,determiner_noun_agreement,determiner_noun_agreement_irregular_2,True,False,True,True,69,-47.69805908203125,-47.54936218261719,0
That movie won't astound these women.,That movie won't astound this women.,morphology,determiner_noun_agreement,determiner_noun_agreement_irregular_2,True,False,True,True,70,-54.468345642089844,-58.74944305419922,1
That girl finds these men.,That girl finds this men.,morphology,determiner_noun_agreement,determiner_noun_agreement_irregular_2,True,False,True,True,71,-32.59593200683594,-35.143043518066406,1
Those girls would disagree with that child.,Those girls would disagree with those child.,morphology,determiner_noun_agreement,determiner_noun_agreement_irregular_2,True,False,True,True,72,-36.0078010559082,-38.279876708984375,1
Elaine does question this man.,Elaine does question these man.,morphology,determiner_noun_agreement,determiner_noun_agreement_irregular_2,True,False,True,True,73,-41.683815002441406,-44.8438606262207,1
Ella loves that synopsis.,Ella loves those synopsis.,morphology,determiner_noun_agreement,determiner_noun_agreement_irregular_2,True,False,True,True,74,-43.38121032714844,-44.86912536621094,1
Joel might criticize those theses.,Joel might criticize that theses.,morphology,determiner_noun_agreement,determiner_noun_agreement_irregular_2,True,False,True,True,75,-51.70994567871094,-47.945594787597656,0
Some people run around that oasis.,Some people run around those oasis.,morphology,determiner_noun_agreement,determiner_noun_agreement_irregular_2,True,False,True,True,76,-39.26941680908203,-40.32087707519531,1
The essays disturb that person.,The essays disturb those person.,morphology,determiner_noun_agreement,determiner_noun_agreement_irregular_2,True,False,True,True,77,-38.86968231201172,-41.496620178222656,1
Noah finds that man.,Noah finds those man.,morphology,determiner_noun_agreement,determiner_noun_agreement_irregular_2,True,False,True,True,78,-38.29676818847656,-41.93293380737305,1
This cashier kisses these children.,This cashier kisses this children.,morphology,determiner_noun_agreement,determiner_noun_agreement_irregular_2,True,False,True,True,79,-52.20164108276367,-54.585514068603516,1
Bill isn't touring this oasis.,Bill isn't touring these oasis.,morphology,determiner_noun_agreement,determiner_noun_agreement_irregular_2,True,False,True,True,80,-47.45937728881836,-47.198787689208984,0
The museums fire those alumni.,The museums fire that alumni.,morphology,determiner_noun_agreement,determiner_noun_agreement_irregular_2,True,False,True,True,81,-47.18540954589844,-43.52570343017578,0
All patients have this tooth.,All patients have these tooth.,morphology,determiner_noun_agreement,determiner_noun_agreement_irregular_2,True,False,True,True,82,-31.648231506347656,-33.33894348144531,1
Vanessa sees this woman.,Vanessa sees these woman.,morphology,determiner_noun_agreement,determiner_noun_agreement_irregular_2,True,False,True,True,83,-33.969947814941406,-38.8787841796875,1
Every boy has escaped from these women.,Every boy has escaped from this women.,morphology,determiner_noun_agreement,determiner_noun_agreement_irregular_2,True,False,True,True,84,-39.39479064941406,-41.45005798339844,1
Debra skates around those oases.,Debra skates around that oases.,morphology,determiner_noun_agreement,determiner_noun_agreement_irregular_2,True,False,True,True,85,-54.93451690673828,-54.253150939941406,0
Caroline isn't visiting this child.,Caroline isn't visiting these child.,morphology,determiner_noun_agreement,determiner_noun_agreement_irregular_2,True,False,True,True,86,-34.80431365966797,-37.23272705078125,1
Lori hasn't shocked those women.,Lori hasn't shocked that women.,morphology,determiner_noun_agreement,determiner_noun_agreement_irregular_2,True,False,True,True,87,-46.56864547729492,-47.03340148925781,1
Sarah talks to those children.,Sarah talks to that children.,morphology,determiner_noun_agreement,determiner_noun_agreement_irregular_2,True,False,True,True,88,-24.885339736938477,-26.230098724365234,1
Samuel isn't exploring those oases.,Samuel isn't exploring that oases.,morphology,determiner_noun_agreement,determiner_noun_agreement_irregular_2,True,False,True,True,89,-53.876461029052734,-53.17091369628906,0
Melissa brought this louse.,Melissa brought these louse.,morphology,determiner_noun_agreement,determiner_noun_agreement_irregular_2,True,False,True,True,90,-39.68067932128906,-39.69967269897461,1
Brenda boycotts these oases.,Brenda boycotts this oases.,morphology,determiner_noun_agreement,determiner_noun_agreement_irregular_2,True,False,True,True,91,-55.3100471496582,-56.54521560668945,1
Linda could observe this child.,Linda could observe these child.,morphology,determiner_noun_agreement,determiner_noun_agreement_irregular_2,True,False,True,True,92,-38.60894012451172,-41.34485626220703,1
Dawn can bike to these oases.,Dawn can bike to this oases.,morphology,determiner_noun_agreement,determiner_noun_agreement_irregular_2,True,False,True,True,93,-61.29849624633789,-62.09543228149414,1
Some actress won't sell that oasis.,Some actress won't sell those oasis.,morphology,determiner_noun_agreement,determiner_noun_agreement_irregular_2,True,False,True,True,94,-51.84867858886719,-52.82851791381836,1
Brett lifted these teeth.,Brett lifted this teeth.,morphology,determiner_noun_agreement,determiner_noun_agreement_irregular_2,True,False,True,True,95,-50.15074920654297,-50.554786682128906,1
Dawn shocked these children.,Dawn shocked this children.,morphology,determiner_noun_agreement,determiner_noun_agreement_irregular_2,True,False,True,True,96,-40.45100784301758,-43.50708770751953,1
The sketches were looking like those octopi.,The sketches were looking like that octopi.,morphology,determiner_noun_agreement,determiner_noun_agreement_irregular_2,True,False,True,True,97,-55.76960754394531,-53.856178283691406,0
These drawings couldn't look like those people.,These drawings couldn't look like that people.,morphology,determiner_noun_agreement,determiner_noun_agreement_irregular_2,True,False,True,True,98,-38.770347595214844,-41.07087707519531,1
All teachers weren't complaining about those phenomena.,All teachers weren't complaining about that phenomena.,morphology,determiner_noun_agreement,determiner_noun_agreement_irregular_2,True,False,True,True,99,-47.903114318847656,-47.72208786010742,0
Victoria would describe that synopsis.,Victoria would describe those synopsis.,morphology,determiner_noun_agreement,determiner_noun_agreement_irregular_2,True,False,True,True,100,-38.20830535888672,-39.610626220703125,1
Beth will clean this tooth.,Beth will clean these tooth.,morphology,determiner_noun_agreement,determiner_noun_agreement_irregular_2,True,False,True,True,101,-52.380462646484375,-54.827857971191406,1
Many libraries shock this person.,Many libraries shock these person.,morphology,determiner_noun_agreement,determiner_noun_agreement_irregular_2,True,False,True,True,102,-38.43914794921875,-42.248939514160156,1
Daniel complains about these phenomena.,Daniel complains about this phenomena.,morphology,determiner_noun_agreement,determiner_noun_agreement_irregular_2,True,False,True,True,103,-33.09048843383789,-33.53040313720703,1
Randolf would heal those lice.,Randolf would heal that lice.,morphology,determiner_noun_agreement,determiner_noun_agreement_irregular_2,True,False,True,True,104,-51.27859878540039,-48.10882568359375,0
Bruce won't appreciate this child.,Bruce won't appreciate these child.,morphology,determiner_noun_agreement,determiner_noun_agreement_irregular_2,True,False,True,True,105,-29.227977752685547,-32.712135314941406,1
Alicia bikes to that oasis.,Alicia bikes to those oasis.,morphology,determiner_noun_agreement,determiner_noun_agreement_irregular_2,True,False,True,True,106,-71.63548278808594,-71.71388244628906,1
Laura buys these axes.,Laura buys this axes.,morphology,determiner_noun_agreement,determiner_noun_agreement_irregular_2,True,False,True,True,107,-34.590843200683594,-33.452781677246094,0
Some girl is working with that woman.,Some girl is working with those woman.,morphology,determiner_noun_agreement,determiner_noun_agreement_irregular_2,True,False,True,True,108,-32.03254318237305,-35.500587463378906,1
Many books bore those women.,Many books bore that women.,morphology,determiner_noun_agreement,determiner_noun_agreement_irregular_2,True,False,True,True,109,-34.319854736328125,-34.79518508911133,1
Adam would dislike those people.,Adam would dislike that people.,morphology,determiner_noun_agreement,determiner_noun_agreement_irregular_2,True,False,True,True,110,-28.580808639526367,-28.598730087280273,1
Omar criticizes these men.,Omar criticizes this men.,morphology,determiner_noun_agreement,determiner_noun_agreement_irregular_2,True,False,True,True,111,-48.611473083496094,-50.38106918334961,1
The dancers ran around that oasis.,The dancers ran around those oasis.,morphology,determiner_noun_agreement,determiner_noun_agreement_irregular_2,True,False,True,True,112,-51.343162536621094,-52.82510757446289,1
Lawrence had broken those feet.,Lawrence had broken that feet.,morphology,determiner_noun_agreement,determiner_noun_agreement_irregular_2,True,False,True,True,113,-39.21656799316406,-39.18251419067383,0
The Impressionists boast about that medium.,The Impressionists boast about those medium.,morphology,determiner_noun_agreement,determiner_noun_agreement_irregular_2,True,False,True,True,114,-69.0845947265625,-71.2802734375,1
All teenagers clean those teeth.,All teenagers clean that teeth.,morphology,determiner_noun_agreement,determiner_noun_agreement_irregular_2,True,False,True,True,115,-36.32005310058594,-36.5615348815918,1
Colleen would exit these oases.,Colleen would exit this oases.,morphology,determiner_noun_agreement,determiner_noun_agreement_irregular_2,True,False,True,True,116,-55.75893020629883,-56.39557647705078,1
Many committees like this child.,Many committees like these child.,morphology,determiner_noun_agreement,determiner_noun_agreement_irregular_2,True,False,True,True,117,-29.939184188842773,-32.631866455078125,1
A lot of universities stunned these people.,A lot of universities stunned this people.,morphology,determiner_noun_agreement,determiner_noun_agreement_irregular_2,True,False,True,True,118,-52.80083465576172,-56.912837982177734,1
All cakes bother this person.,All cakes bother these person.,morphology,determiner_noun_agreement,determiner_noun_agreement_irregular_2,True,False,True,True,119,-37.910011291503906,-41.13604736328125,1
Some man broke this tooth.,Some man broke these tooth.,morphology,determiner_noun_agreement,determiner_noun_agreement_irregular_2,True,False,True,True,120,-34.13215255737305,-36.852256774902344,1
Jane cared for this person.,Jane cared for these person.,morphology,determiner_noun_agreement,determiner_noun_agreement_irregular_2,True,False,True,True,121,-24.688386917114258,-29.810504913330078,1
These girls hide this fungus.,These girls hide these fungus.,morphology,determiner_noun_agreement,determiner_noun_agreement_irregular_2,True,False,True,True,122,-36.37987518310547,-36.87593078613281,1
Rebecca hasn't worried these men.,Rebecca hasn't worried this men.,morphology,determiner_noun_agreement,determiner_noun_agreement_irregular_2,True,False,True,True,123,-42.598541259765625,-45.71482849121094,1
Ella hasn't investigated that man.,Ella hasn't investigated those man.,morphology,determiner_noun_agreement,determiner_noun_agreement_irregular_2,True,False,True,True,124,-42.4710807800293,-45.91831588745117,1
