sentence_good,sentence_bad,field,linguistics_term,UID,simple_LM_method,one_prefix_method,two_prefix_method,lexically_identical,pair_id,good_prob,bad_prob,correct
Derek can't care for this employed child.,Derek can't care for this employed children.,morphology,determiner_noun_agreement,determiner_noun_agreement_with_adj_irregular_1,True,True,False,True,671,-61.014678955078125,-60.927825927734375,0
Lissa wasn't driving to that white oasis.,Lissa wasn't driving to that white oases.,morphology,determiner_noun_agreement,determiner_noun_agreement_with_adj_irregular_1,True,True,False,True,672,-60.41025161743164,-63.10804748535156,1
The customers have exited this old oasis.,The customers have exited this old oases.,morphology,determiner_noun_agreement,determiner_noun_agreement_with_adj_irregular_1,True,True,False,True,673,-61.00531005859375,-63.349647521972656,1
Guy was leaving this confident child.,Guy was leaving this confident children.,morphology,determiner_noun_agreement,determiner_noun_agreement_with_adj_irregular_1,True,True,False,True,674,-37.019657135009766,-38.61602020263672,1
Keith goes to this rough oasis.,Keith goes to this rough oases.,morphology,determiner_noun_agreement,determiner_noun_agreement_with_adj_irregular_1,True,True,False,True,675,-45.970008850097656,-49.11442184448242,1
Most cashiers complain about those old men.,Most cashiers complain about those old man.,morphology,determiner_noun_agreement,determiner_noun_agreement_with_adj_irregular_1,True,True,False,True,676,-52.46966552734375,-53.474735260009766,1
Vincent shouldn't scare that busy person.,Vincent shouldn't scare that busy people.,morphology,determiner_noun_agreement,determiner_noun_agreement_with_adj_irregular_1,True,True,False,True,677,-55.10297393798828,-54.46515655517578,0
Beth hugged that nice child.,Beth hugged that nice children.,morphology,determiner_noun_agreement,determiner_noun_agreement_with_adj_irregular_1,True,True,False,True,678,-57.84205627441406,-58.83506774902344,1
Guy shouldn't praise these smart people.,Guy shouldn't praise these smart person.,morphology,determiner_noun_agreement,determiner_noun_agreement_with_adj_irregular_1,True,True,False,True,679,-44.012123107910156,-47.12565612792969,1
Florence sells these small feet.,Florence sells these small foot.,morphology,determiner_noun_agreement,determiner_noun_agreement_with_adj_irregular_1,True,True,False,True,680,-47.948997497558594,-49.75292205810547,1
Walter didn't know this out in the open woman.,Walter didn't know this out in the open women.,morphology,determiner_noun_agreement,determiner_noun_agreement_with_adj_irregular_1,True,True,False,True,681,-56.50022888183594,-55.95757293701172,0
Barbara has messed up those broken teeth.,Barbara has messed up those broken tooth.,morphology,determiner_noun_agreement,determiner_noun_agreement_with_adj_irregular_1,True,True,False,True,682,-44.627567291259766,-47.94795227050781,1
Carl will help these busy men.,Carl will help these busy man.,morphology,determiner_noun_agreement,determiner_noun_agreement_with_adj_irregular_1,True,True,False,True,683,-38.23616027832031,-41.43210220336914,1
This guest could hire these nice men.,This guest could hire these nice man.,morphology,determiner_noun_agreement,determiner_noun_agreement_with_adj_irregular_1,True,True,False,True,684,-51.436981201171875,-52.853485107421875,1
Rodney wasn't bothering this small alumnus.,Rodney wasn't bothering this small alumni.,morphology,determiner_noun_agreement,determiner_noun_agreement_with_adj_irregular_1,True,True,False,True,685,-68.58547973632812,-53.078826904296875,0
These students break these messy teeth.,These students break these messy tooth.,morphology,determiner_noun_agreement,determiner_noun_agreement_with_adj_irregular_1,True,True,False,True,686,-42.65843200683594,-44.92255401611328,1
April wasn't biking to those hard oases.,April wasn't biking to those hard oasis.,morphology,determiner_noun_agreement,determiner_noun_agreement_with_adj_irregular_1,True,True,False,True,687,-66.95380401611328,-64.3078384399414,0
Stephanie hated those fast alumni.,Stephanie hated those fast alumnus.,morphology,determiner_noun_agreement,determiner_noun_agreement_with_adj_irregular_1,True,True,False,True,688,-50.45344161987305,-64.66458129882812,1
Dawn has disturbed these ill men.,Dawn has disturbed these ill man.,morphology,determiner_noun_agreement,determiner_noun_agreement_with_adj_irregular_1,True,True,False,True,689,-62.285377502441406,-64.2776107788086,1
Chad questioned this unsure child.,Chad questioned this unsure children.,morphology,determiner_noun_agreement,determiner_noun_agreement_with_adj_irregular_1,True,True,False,True,690,-54.36163330078125,-55.03187561035156,1
That shirt disgusted this busy woman.,That shirt disgusted this busy women.,morphology,determiner_noun_agreement,determiner_noun_agreement_with_adj_irregular_1,True,True,False,True,691,-54.6650505065918,-55.95420455932617,1
Daniel has toured that red oasis.,Daniel has toured that red oases.,morphology,determiner_noun_agreement,determiner_noun_agreement_with_adj_irregular_1,True,True,False,True,692,-47.653865814208984,-49.87983322143555,1
Joel finds those hidden men.,Joel finds those hidden man.,morphology,determiner_noun_agreement,determiner_noun_agreement_with_adj_irregular_1,True,True,False,True,693,-40.822532653808594,-42.00566864013672,1
Some adult did arrive at that old oasis.,Some adult did arrive at that old oases.,morphology,determiner_noun_agreement,determiner_noun_agreement_with_adj_irregular_1,True,True,False,True,694,-60.16301727294922,-63.102325439453125,1
A lot of carriages weren't alarming that employed woman.,A lot of carriages weren't alarming that employed women.,morphology,determiner_noun_agreement,determiner_noun_agreement_with_adj_irregular_1,True,True,False,True,695,-87.3795166015625,-85.75448608398438,0
Tina wasn't observing these unemployed children.,Tina wasn't observing these unemployed child.,morphology,determiner_noun_agreement,determiner_noun_agreement_with_adj_irregular_1,True,True,False,True,696,-64.8710708618164,-66.80641174316406,1
All dresses aggravate these important men.,All dresses aggravate these important man.,morphology,determiner_noun_agreement,determiner_noun_agreement_with_adj_irregular_1,True,True,False,True,697,-51.3483772277832,-52.740684509277344,1
This car had disturbed those important men.,This car had disturbed those important man.,morphology,determiner_noun_agreement,determiner_noun_agreement_with_adj_irregular_1,True,True,False,True,698,-48.36763000488281,-50.37133026123047,1
Florence will return to that confident person.,Florence will return to that confident people.,morphology,determiner_noun_agreement,determiner_noun_agreement_with_adj_irregular_1,True,True,False,True,699,-56.92920684814453,-55.6004524230957,0
Some cashiers criticized those uncertain women.,Some cashiers criticized those uncertain woman.,morphology,determiner_noun_agreement,determiner_noun_agreement_with_adj_irregular_1,True,True,False,True,700,-61.24214172363281,-63.4500732421875,1
Meredith investigated this excited child.,Meredith investigated this excited children.,morphology,determiner_noun_agreement,determiner_noun_agreement_with_adj_irregular_1,True,True,False,True,701,-56.283992767333984,-58.5800895690918,1
Sarah is concealing that busy woman.,Sarah is concealing that busy women.,morphology,determiner_noun_agreement,determiner_noun_agreement_with_adj_irregular_1,True,True,False,True,702,-52.862884521484375,-52.77157974243164,0
Janice criticizes this good analysis.,Janice criticizes this good analyses.,morphology,determiner_noun_agreement,determiner_noun_agreement_with_adj_irregular_1,True,True,False,True,703,-54.79914474487305,-60.364990234375,1
Many guys weren't noticing this lost child.,Many guys weren't noticing this lost children.,morphology,determiner_noun_agreement,determiner_noun_agreement_with_adj_irregular_1,True,True,False,True,704,-52.21658706665039,-52.38573455810547,1
Homer can pass that concealed oasis.,Homer can pass that concealed oases.,morphology,determiner_noun_agreement,determiner_noun_agreement_with_adj_irregular_1,True,True,False,True,705,-66.18670654296875,-68.30198669433594,1
The drivers hide this concealed fungus.,The drivers hide this concealed fungi.,morphology,determiner_noun_agreement,determiner_noun_agreement_with_adj_irregular_1,True,True,False,True,706,-57.740631103515625,-56.427772521972656,0
Marla had investigated that content person.,Marla had investigated that content people.,morphology,determiner_noun_agreement,determiner_noun_agreement_with_adj_irregular_1,True,True,False,True,707,-51.86507797241211,-51.06203842163086,0
The Borgias explore this white oasis.,The Borgias explore this white oases.,morphology,determiner_noun_agreement,determiner_noun_agreement_with_adj_irregular_1,True,True,False,True,708,-69.76142883300781,-72.4010009765625,1
Heather brought this black tooth.,Heather brought this black teeth.,morphology,determiner_noun_agreement,determiner_noun_agreement_with_adj_irregular_1,True,True,False,True,709,-44.077232360839844,-43.72854995727539,0
Walter doesn't drop by those smooth oases.,Walter doesn't drop by those smooth oasis.,morphology,determiner_noun_agreement,determiner_noun_agreement_with_adj_irregular_1,True,True,False,True,710,-64.30250549316406,-62.258785247802734,0
Sharon knows this hopeful man.,Sharon knows this hopeful men.,morphology,determiner_noun_agreement,determiner_noun_agreement_with_adj_irregular_1,True,True,False,True,711,-44.46099853515625,-46.35240936279297,1
The companies irritate this ill child.,The companies irritate this ill children.,morphology,determiner_noun_agreement,determiner_noun_agreement_with_adj_irregular_1,True,True,False,True,712,-52.499385833740234,-53.95415115356445,1
Alice is noticing those orange mice.,Alice is noticing those orange mouse.,morphology,determiner_noun_agreement,determiner_noun_agreement_with_adj_irregular_1,True,True,False,True,713,-42.59628677368164,-43.228126525878906,1
Kimberley loves this nice woman.,Kimberley loves this nice women.,morphology,determiner_noun_agreement,determiner_noun_agreement_with_adj_irregular_1,True,True,False,True,714,-43.68910217285156,-45.35377502441406,1
The Borgias have examined this purple thesis.,The Borgias have examined this purple theses.,morphology,determiner_noun_agreement,determiner_noun_agreement_with_adj_irregular_1,True,True,False,True,715,-69.42561340332031,-77.89141082763672,1
Douglas went to this concealed oasis.,Douglas went to this concealed oases.,morphology,determiner_noun_agreement,determiner_noun_agreement_with_adj_irregular_1,True,True,False,True,716,-61.455650329589844,-64.59014892578125,1
Ladies scan these long synopses.,Ladies scan these long synopsis.,morphology,determiner_noun_agreement,determiner_noun_agreement_with_adj_irregular_1,True,True,False,True,717,-66.28404235839844,-57.70610809326172,0
Adam can question that lost woman.,Adam can question that lost women.,morphology,determiner_noun_agreement,determiner_noun_agreement_with_adj_irregular_1,True,True,False,True,718,-40.86723327636719,-39.81328582763672,0
George fixes those purple teeth.,George fixes those purple tooth.,morphology,determiner_noun_agreement,determiner_noun_agreement_with_adj_irregular_1,True,True,False,True,719,-42.893707275390625,-44.374305725097656,1
The Clintons praise these long analyses.,The Clintons praise these long analysis.,morphology,determiner_noun_agreement,determiner_noun_agreement_with_adj_irregular_1,True,True,False,True,720,-62.42693328857422,-59.545562744140625,0
Craig shouldn't bike to these yellow oases.,Craig shouldn't bike to these yellow oasis.,morphology,determiner_noun_agreement,determiner_noun_agreement_with_adj_irregular_1,True,True,False,True,721,-63.88847732543945,-61.49272537231445,0
The child hasn't loved these good synopses.,The child hasn't loved these good synopsis.,morphology,determiner_noun_agreement,determiner_noun_agreement_with_adj_irregular_1,True,True,False,True,722,-66.45469665527344,-56.979957580566406,0
These waitresses might reference this out in the open alumnus.,These waitresses might reference this out in the open alumni.,morphology,determiner_noun_agreement,determiner_noun_agreement_with_adj_irregular_1,True,True,False,True,723,-99.09051513671875,-86.74029541015625,0
Phillip questions this young child.,Phillip questions this young children.,morphology,determiner_noun_agreement,determiner_noun_agreement_with_adj_irregular_1,True,True,False,True,724,-40.461265563964844,-39.63657760620117,0
Jodi hadn't impressed that excited woman.,Jodi hadn't impressed that excited women.,morphology,determiner_noun_agreement,determiner_noun_agreement_with_adj_irregular_1,True,True,False,True,725,-64.20382690429688,-64.35709381103516,1
Guys break those out in the open teeth.,Guys break those out in the open tooth.,morphology,determiner_noun_agreement,determiner_noun_agreement_with_adj_irregular_1,True,True,False,True,726,-48.004730224609375,-51.3251838684082,1
Joel saw these lost mice.,Joel saw these lost mouse.,morphology,determiner_noun_agreement,determiner_noun_agreement_with_adj_irregular_1,True,True,False,True,727,-44.21002960205078,-45.14543914794922,1
The Impressionists were fixing those gray teeth.,The Impressionists were fixing those gray tooth.,morphology,determiner_noun_agreement,determiner_noun_agreement_with_adj_irregular_1,True,True,False,True,728,-63.8970947265625,-66.69778442382812,1
Kristen has discussed those good analyses.,Kristen has discussed those good analysis.,morphology,determiner_noun_agreement,determiner_noun_agreement_with_adj_irregular_1,True,True,False,True,729,-46.010108947753906,-41.40092086791992,0
The girls had described those upset people.,The girls had described those upset person.,morphology,determiner_noun_agreement,determiner_noun_agreement_with_adj_irregular_1,True,True,False,True,730,-47.219825744628906,-49.645713806152344,1
Veronica approaches those small women.,Veronica approaches those small woman.,morphology,determiner_noun_agreement,determiner_noun_agreement_with_adj_irregular_1,True,True,False,True,731,-41.330833435058594,-43.670257568359375,1
Robert hugs this scared person.,Robert hugs this scared people.,morphology,determiner_noun_agreement,determiner_noun_agreement_with_adj_irregular_1,True,True,False,True,732,-40.24781036376953,-41.463314056396484,1
Mitchell had bought this concealed cactus.,Mitchell had bought this concealed cacti.,morphology,determiner_noun_agreement,determiner_noun_agreement_with_adj_irregular_1,True,True,False,True,733,-65.66278076171875,-72.09852600097656,1
A pepper shocked these displeased alumni.,A pepper shocked these displeased alumnus.,morphology,determiner_noun_agreement,determiner_noun_agreement_with_adj_irregular_1,True,True,False,True,734,-81.89190673828125,-96.28640747070312,1
Timothy walked through these new oases.,Timothy walked through these new oasis.,morphology,determiner_noun_agreement,determiner_noun_agreement_with_adj_irregular_1,True,True,False,True,735,-54.088340759277344,-51.67449951171875,0
Janice did clean these smooth teeth.,Janice did clean these smooth tooth.,morphology,determiner_noun_agreement,determiner_noun_agreement_with_adj_irregular_1,True,True,False,True,736,-52.93583679199219,-55.333335876464844,1
Andrew had approached that small man.,Andrew had approached that small men.,morphology,determiner_noun_agreement,determiner_noun_agreement_with_adj_irregular_1,True,True,False,True,737,-39.27362060546875,-38.900978088378906,0
Wendy hides these red cacti.,Wendy hides these red cactus.,morphology,determiner_noun_agreement,determiner_noun_agreement_with_adj_irregular_1,True,True,False,True,738,-73.38035583496094,-66.84004211425781,0
Leslie visits that sick man.,Leslie visits that sick men.,morphology,determiner_noun_agreement,determiner_noun_agreement_with_adj_irregular_1,True,True,False,True,739,-51.16370391845703,-52.967674255371094,1
Those girls exit this brown oasis.,Those girls exit this brown oases.,morphology,determiner_noun_agreement,determiner_noun_agreement_with_adj_irregular_1,True,True,False,True,740,-53.07007598876953,-55.72303009033203,1
Christopher liked this red nucleus.,Christopher liked this red nuclei.,morphology,determiner_noun_agreement,determiner_noun_agreement_with_adj_irregular_1,True,True,False,True,741,-37.856101989746094,-45.74832534790039,1
Florence might forget this sick woman.,Florence might forget this sick women.,morphology,determiner_noun_agreement,determiner_noun_agreement_with_adj_irregular_1,True,True,False,True,742,-59.03974533081055,-61.3849983215332,1
These ladies sell that green cactus.,These ladies sell that green cacti.,morphology,determiner_noun_agreement,determiner_noun_agreement_with_adj_irregular_1,True,True,False,True,743,-45.73289489746094,-52.19902038574219,1
A lot of blouses disgust that uncertain alumnus.,A lot of blouses disgust that uncertain alumni.,morphology,determiner_noun_agreement,determiner_noun_agreement_with_adj_irregular_1,True,True,False,True,744,-102.22395324707031,-87.60599517822266,0
Patrick had exited those hidden oases.,Patrick had exited those hidden oasis.,morphology,determiner_noun_agreement,determiner_noun_agreement_with_adj_irregular_1,True,True,False,True,745,-58.97107696533203,-57.150169372558594,0
Gina was taking this big stimulus.,Gina was taking this big stimuli.,morphology,determiner_noun_agreement,determiner_noun_agreement_with_adj_irregular_1,True,True,False,True,746,-49.47190856933594,-49.83155822753906,1
A lot of pictures look like this uncertain child.,A lot of pictures look like this uncertain children.,morphology,determiner_noun_agreement,determiner_noun_agreement_with_adj_irregular_1,True,True,False,True,747,-64.17444610595703,-65.56229400634766,1
Adam passes this exposed oasis.,Adam passes this exposed oases.,morphology,determiner_noun_agreement,determiner_noun_agreement_with_adj_irregular_1,True,True,False,True,748,-52.782623291015625,-55.44891357421875,1
Some drawings shock that hidden woman.,Some drawings shock that hidden women.,morphology,determiner_noun_agreement,determiner_noun_agreement_with_adj_irregular_1,True,True,False,True,749,-50.76521301269531,-49.58865737915039,0
Nina has boycotted those small oases.,Nina has boycotted those small oasis.,morphology,determiner_noun_agreement,determiner_noun_agreement_with_adj_irregular_1,True,True,False,True,750,-86.04135131835938,-84.22462463378906,0
Bruce exits that white oasis.,Bruce exits that white oases.,morphology,determiner_noun_agreement,determiner_noun_agreement_with_adj_irregular_1,True,True,False,True,751,-44.995384216308594,-46.85331726074219,1
Mary investigated this unsure woman.,Mary investigated this unsure women.,morphology,determiner_noun_agreement,determiner_noun_agreement_with_adj_irregular_1,True,True,False,True,752,-43.081539154052734,-44.04962921142578,1
Diane criticized that bad synopsis.,Diane criticized that bad synopses.,morphology,determiner_noun_agreement,determiner_noun_agreement_with_adj_irregular_1,True,True,False,True,753,-61.84475326538086,-72.94781494140625,1
Those sketches stun this fast child.,Those sketches stun this fast children.,morphology,determiner_noun_agreement,determiner_noun_agreement_with_adj_irregular_1,True,True,False,True,754,-51.869293212890625,-53.21813201904297,1
Vanessa shouldn't observe these determined women.,Vanessa shouldn't observe these determined woman.,morphology,determiner_noun_agreement,determiner_noun_agreement_with_adj_irregular_1,True,True,False,True,755,-57.55748748779297,-60.43889236450195,1
Jill doesn't reference those clever children.,Jill doesn't reference those clever child.,morphology,determiner_noun_agreement,determiner_noun_agreement_with_adj_irregular_1,True,True,False,True,756,-61.12648391723633,-62.06892776489258,1
Every driver ran around that green oasis.,Every driver ran around that green oases.,morphology,determiner_noun_agreement,determiner_noun_agreement_with_adj_irregular_1,True,True,False,True,757,-55.86500549316406,-58.408714294433594,1
Many guys question this unlucky person.,Many guys question this unlucky people.,morphology,determiner_noun_agreement,determiner_noun_agreement_with_adj_irregular_1,True,True,False,True,758,-48.55508804321289,-47.58626937866211,0
Laura won't heal that concealed man.,Laura won't heal that concealed men.,morphology,determiner_noun_agreement,determiner_noun_agreement_with_adj_irregular_1,True,True,False,True,759,-43.78282928466797,-45.099876403808594,1
A lot of people care for that unemployed person.,A lot of people care for that unemployed people.,morphology,determiner_noun_agreement,determiner_noun_agreement_with_adj_irregular_1,True,True,False,True,760,-54.61780548095703,-52.48517990112305,0
Natalie liked those small lice.,Natalie liked those small louse.,morphology,determiner_noun_agreement,determiner_noun_agreement_with_adj_irregular_1,True,True,False,True,761,-52.698204040527344,-51.458255767822266,0
An eggplant bores those small women.,An eggplant bores those small woman.,morphology,determiner_noun_agreement,determiner_noun_agreement_with_adj_irregular_1,True,True,False,True,762,-62.41364669799805,-64.29209899902344,1
A lot of waiters admire this big louse.,A lot of waiters admire this big lice.,morphology,determiner_noun_agreement,determiner_noun_agreement_with_adj_irregular_1,True,True,False,True,763,-82.91300964355469,-83.90277099609375,1
These students conceal those standing children.,These students conceal those standing child.,morphology,determiner_noun_agreement,determiner_noun_agreement_with_adj_irregular_1,True,True,False,True,764,-47.611629486083984,-47.14582443237305,0
The customers appreciate those happy people.,The customers appreciate those happy person.,morphology,determiner_noun_agreement,determiner_noun_agreement_with_adj_irregular_1,True,True,False,True,765,-43.53068542480469,-45.23379898071289,1
Ronald has scared this popular child.,Ronald has scared this popular children.,morphology,determiner_noun_agreement,determiner_noun_agreement_with_adj_irregular_1,True,True,False,True,766,-49.308311462402344,-50.66474151611328,1
Matt hadn't walked through those hidden oases.,Matt hadn't walked through those hidden oasis.,morphology,determiner_noun_agreement,determiner_noun_agreement_with_adj_irregular_1,True,True,False,True,767,-61.315452575683594,-58.80742645263672,0
Barbara couldn't walk through those old oases.,Barbara couldn't walk through those old oasis.,morphology,determiner_noun_agreement,determiner_noun_agreement_with_adj_irregular_1,True,True,False,True,768,-58.37868118286133,-55.35110092163086,0
These actors messed up that messy foot.,These actors messed up that messy feet.,morphology,determiner_noun_agreement,determiner_noun_agreement_with_adj_irregular_1,True,True,False,True,769,-48.78664016723633,-47.984657287597656,0
Donald conceals those red cacti.,Donald conceals those red cactus.,morphology,determiner_noun_agreement,determiner_noun_agreement_with_adj_irregular_1,True,True,False,True,770,-63.02948760986328,-56.02254104614258,0
Many commentaries shock those happy men.,Many commentaries shock those happy man.,morphology,determiner_noun_agreement,determiner_noun_agreement_with_adj_irregular_1,True,True,False,True,771,-60.33688735961914,-62.14254379272461,1
Every guy hugged this lucky child.,Every guy hugged this lucky children.,morphology,determiner_noun_agreement,determiner_noun_agreement_with_adj_irregular_1,True,True,False,True,772,-44.360172271728516,-45.57609558105469,1
Janice should hire this unsure alumnus.,Janice should hire this unsure alumni.,morphology,determiner_noun_agreement,determiner_noun_agreement_with_adj_irregular_1,True,True,False,True,773,-77.08058166503906,-61.982765197753906,0
Many organizations haven't fired those big men.,Many organizations haven't fired those big man.,morphology,determiner_noun_agreement,determiner_noun_agreement_with_adj_irregular_1,True,True,False,True,774,-47.51126480102539,-48.816287994384766,1
Ice cream alarmed that unsure man.,Ice cream alarmed that unsure men.,morphology,determiner_noun_agreement,determiner_noun_agreement_with_adj_irregular_1,True,True,False,True,775,-49.87873840332031,-51.32524871826172,1
Carol wasn't returning to these displeased people.,Carol wasn't returning to these displeased person.,morphology,determiner_noun_agreement,determiner_noun_agreement_with_adj_irregular_1,True,True,False,True,776,-64.90589141845703,-69.89647674560547,1
Robert has thought about this unsure person.,Robert has thought about this unsure people.,morphology,determiner_noun_agreement,determiner_noun_agreement_with_adj_irregular_1,True,True,False,True,777,-41.75185012817383,-41.006256103515625,0
Karen explores those green oases.,Karen explores those green oasis.,morphology,determiner_noun_agreement,determiner_noun_agreement_with_adj_irregular_1,True,True,False,True,778,-62.56382751464844,-60.27713394165039,0
Every child hasn't scared this determined child.,Every child hasn't scared this determined children.,morphology,determiner_noun_agreement,determiner_noun_agreement_with_adj_irregular_1,True,True,False,True,779,-51.075599670410156,-51.31897735595703,1
Some couch aggravates this excited child.,Some couch aggravates this excited children.,morphology,determiner_noun_agreement,determiner_noun_agreement_with_adj_irregular_1,True,True,False,True,780,-57.711524963378906,-59.209190368652344,1
The Impressionists had hired these confident alumni.,The Impressionists had hired these confident alumnus.,morphology,determiner_noun_agreement,determiner_noun_agreement_with_adj_irregular_1,True,True,False,True,781,-77.4415054321289,-92.86502075195312,1
Melanie hasn't toured that black oasis.,Melanie hasn't toured that black oases.,morphology,determiner_noun_agreement,determiner_noun_agreement_with_adj_irregular_1,True,True,False,True,782,-60.924869537353516,-63.09897232055664,1
