sentence_good,sentence_bad,field,linguistics_term,UID,simple_LM_method,one_prefix_method,two_prefix_method,lexically_identical,pair_id,good_prob,bad_prob,correct
Some waiters broke this lost foot.,Some waiters broke this lost feet.,morphology,determiner_noun_agreement,determiner_noun_agreement_with_adj_irregular_1,True,True,False,True,0,-59.45905685424805,-59.601837158203125,1
The company talks about those big women.,The company talks about those big woman.,morphology,determiner_noun_agreement,determiner_noun_agreement_with_adj_irregular_1,True,True,False,True,1,-35.21286392211914,-37.94724655151367,1
This blouse astounds this lost woman.,This blouse astounds this lost women.,morphology,determiner_noun_agreement,determiner_noun_agreement_with_adj_irregular_1,True,True,False,True,2,-71.62438201904297,-71.27970886230469,0
David wasn't kissing these standing children.,David wasn't kissing these standing child.,morphology,determiner_noun_agreement,determiner_noun_agreement_with_adj_irregular_1,True,True,False,True,3,-49.785400390625,-49.93269729614258,1
This person shouldn't criticize this upset child.,This person shouldn't criticize this upset children.,morphology,determiner_noun_agreement,determiner_noun_agreement_with_adj_irregular_1,True,True,False,True,4,-53.55052947998047,-53.72855758666992,1
These tomatoes astound that concealed person.,These tomatoes astound that concealed people.,morphology,determiner_noun_agreement,determiner_noun_agreement_with_adj_irregular_1,True,True,False,True,5,-61.33510208129883,-58.4299201965332,0
Sally hasn't cleaned these white oxen.,Sally hasn't cleaned these white ox.,morphology,determiner_noun_agreement,determiner_noun_agreement_with_adj_irregular_1,True,True,False,True,6,-66.02163696289062,-63.12141418457031,0
These doors would astound those happy children.,These doors would astound those happy child.,morphology,determiner_noun_agreement,determiner_noun_agreement_with_adj_irregular_1,True,True,False,True,7,-57.64773178100586,-59.07093811035156,1
Katherine is biking to these red oases.,Katherine is biking to these red oasis.,morphology,determiner_noun_agreement,determiner_noun_agreement_with_adj_irregular_1,True,True,False,True,8,-75.21711730957031,-71.49800872802734,0
Katherine hadn't praised this lost man.,Katherine hadn't praised this lost men.,morphology,determiner_noun_agreement,determiner_noun_agreement_with_adj_irregular_1,True,True,False,True,9,-67.06301879882812,-66.97686767578125,0
The driver sees that unlucky person.,The driver sees that unlucky people.,morphology,determiner_noun_agreement,determiner_noun_agreement_with_adj_irregular_1,True,True,False,True,10,-40.90170669555664,-39.428646087646484,0
Edward hadn't described this nice woman.,Edward hadn't described this nice women.,morphology,determiner_noun_agreement,determiner_noun_agreement_with_adj_irregular_1,True,True,False,True,11,-40.76844787597656,-41.67144012451172,1
Heidi returns to that big woman.,Heidi returns to that big women.,morphology,determiner_noun_agreement,determiner_noun_agreement_with_adj_irregular_1,True,True,False,True,12,-43.117469787597656,-44.02996063232422,1
Sara listened to that unconvinced person.,Sara listened to that unconvinced people.,morphology,determiner_noun_agreement,determiner_noun_agreement_with_adj_irregular_1,True,True,False,True,13,-78.28500366210938,-76.81792449951172,0
Samuel had listened to these concealed people.,Samuel had listened to these concealed person.,morphology,determiner_noun_agreement,determiner_noun_agreement_with_adj_irregular_1,True,True,False,True,14,-46.59479904174805,-50.37776184082031,1
Richard flees from those unconvinced men.,Richard flees from those unconvinced man.,morphology,determiner_noun_agreement,determiner_noun_agreement_with_adj_irregular_1,True,True,False,True,15,-73.76715087890625,-73.46263122558594,0
Monica is cleaning that hidden axis.,Monica is cleaning that hidden axes.,morphology,determiner_noun_agreement,determiner_noun_agreement_with_adj_irregular_1,True,True,False,True,16,-49.79609680175781,-53.590476989746094,1
Veronica does break those hard teeth.,Veronica does break those hard tooth.,morphology,determiner_noun_agreement,determiner_noun_agreement_with_adj_irregular_1,True,True,False,True,17,-48.172882080078125,-50.08869552612305,1
Rachel drove to those blue oases.,Rachel drove to those blue oasis.,morphology,determiner_noun_agreement,determiner_noun_agreement_with_adj_irregular_1,True,True,False,True,18,-50.370384216308594,-46.9393424987793,0
These cashiers do break this whole tooth.,These cashiers do break this whole teeth.,morphology,determiner_noun_agreement,determiner_noun_agreement_with_adj_irregular_1,True,True,False,True,19,-56.52193069458008,-54.33229064941406,0
Rose dislikes this bad synopsis.,Rose dislikes this bad synopses.,morphology,determiner_noun_agreement,determiner_noun_agreement_with_adj_irregular_1,True,True,False,True,20,-61.321128845214844,-72.82658386230469,1
Becky had fixed this hard foot.,Becky had fixed this hard feet.,morphology,determiner_noun_agreement,determiner_noun_agreement_with_adj_irregular_1,True,True,False,True,21,-41.87440872192383,-41.46186065673828,0
Gerald questioned those unconvinced men.,Gerald questioned those unconvinced man.,morphology,determiner_noun_agreement,determiner_noun_agreement_with_adj_irregular_1,True,True,False,True,22,-81.98452758789062,-82.10301971435547,1
Stacy doesn't impress this determined person.,Stacy doesn't impress this determined people.,morphology,determiner_noun_agreement,determiner_noun_agreement_with_adj_irregular_1,True,True,False,True,23,-59.68603515625,-57.231781005859375,0
Nina won't run around this smooth oasis.,Nina won't run around this smooth oases.,morphology,determiner_noun_agreement,determiner_noun_agreement_with_adj_irregular_1,True,True,False,True,24,-67.94564056396484,-71.51143646240234,1
That committee works with those out in the open women.,That committee works with those out in the open woman.,morphology,determiner_noun_agreement,determiner_noun_agreement_with_adj_irregular_1,True,True,False,True,25,-59.108028411865234,-61.05546951293945,1
Most teenagers had complained about these scared men.,Most teenagers had complained about these scared man.,morphology,determiner_noun_agreement,determiner_noun_agreement_with_adj_irregular_1,True,True,False,True,26,-58.59654998779297,-59.97309112548828,1
Bill cures those unsure alumni.,Bill cures those unsure alumnus.,morphology,determiner_noun_agreement,determiner_noun_agreement_with_adj_irregular_1,True,True,False,True,27,-52.157371520996094,-68.23728942871094,1
Derek walked through this smooth oasis.,Derek walked through this smooth oases.,morphology,determiner_noun_agreement,determiner_noun_agreement_with_adj_irregular_1,True,True,False,True,28,-64.26187133789062,-68.01141357421875,1
Some waiters work with this hidden person.,Some waiters work with this hidden people.,morphology,determiner_noun_agreement,determiner_noun_agreement_with_adj_irregular_1,True,True,False,True,29,-55.69013595581055,-55.59398651123047,0
Dennis hasn't healed these unconvinced women.,Dennis hasn't healed these unconvinced woman.,morphology,determiner_noun_agreement,determiner_noun_agreement_with_adj_irregular_1,True,True,False,True,30,-94.9747543334961,-96.05966186523438,1
Kathleen has this exposed thesis.,Kathleen has this exposed theses.,morphology,determiner_noun_agreement,determiner_noun_agreement_with_adj_irregular_1,True,True,False,True,31,-63.72358322143555,-68.02428436279297,1
Sheila loved those determined people.,Sheila loved those determined person.,morphology,determiner_noun_agreement,determiner_noun_agreement_with_adj_irregular_1,True,True,False,True,32,-40.298973083496094,-44.42729949951172,1
Guy has toured this green oasis.,Guy has toured this green oases.,morphology,determiner_noun_agreement,determiner_noun_agreement_with_adj_irregular_1,True,True,False,True,33,-49.75902557373047,-53.18095016479492,1
Some senators go to that purple oasis.,Some senators go to that purple oases.,morphology,determiner_noun_agreement,determiner_noun_agreement_with_adj_irregular_1,True,True,False,True,34,-56.55380630493164,-59.8177604675293,1
Anna should scan that bad analysis.,Anna should scan that bad analyses.,morphology,determiner_noun_agreement,determiner_noun_agreement_with_adj_irregular_1,True,True,False,True,35,-39.28496551513672,-46.46944808959961,1
Most waitresses notice that red stimulus.,Most waitresses notice that red stimuli.,morphology,determiner_noun_agreement,determiner_noun_agreement_with_adj_irregular_1,True,True,False,True,36,-62.86821746826172,-63.355751037597656,1
Diana cured those standing alumni.,Diana cured those standing alumnus.,morphology,determiner_noun_agreement,determiner_noun_agreement_with_adj_irregular_1,True,True,False,True,37,-67.57888793945312,-80.93560791015625,1
Ronald discussed that nice man.,Ronald discussed that nice men.,morphology,determiner_noun_agreement,determiner_noun_agreement_with_adj_irregular_1,True,True,False,True,38,-43.062957763671875,-43.76575469970703,1
Tonya won't buy that brown oasis.,Tonya won't buy that brown oases.,morphology,determiner_noun_agreement,determiner_noun_agreement_with_adj_irregular_1,True,True,False,True,39,-52.503883361816406,-55.44873809814453,1
Marie argued about that good synopsis.,Marie argued about that good synopses.,morphology,determiner_noun_agreement,determiner_noun_agreement_with_adj_irregular_1,True,True,False,True,40,-45.482887268066406,-57.48910903930664,1
Bradley wasn't skated around that out in the open oasis.,Bradley wasn't skated around that out in the open oases.,morphology,determiner_noun_agreement,determiner_noun_agreement_with_adj_irregular_1,True,True,False,True,41,-76.327880859375,-80.50235748291016,1
Jacqueline wasn't finding that hidden man.,Jacqueline wasn't finding that hidden men.,morphology,determiner_noun_agreement,determiner_noun_agreement_with_adj_irregular_1,True,True,False,True,42,-53.50204086303711,-55.02901077270508,1
Most commentaries hadn't impressed those clever men.,Most commentaries hadn't impressed those clever man.,morphology,determiner_noun_agreement,determiner_noun_agreement_with_adj_irregular_1,True,True,False,True,43,-70.15077209472656,-71.00151062011719,1
Bruce has worked with this lost child.,Bruce has worked with this lost children.,morphology,determiner_noun_agreement,determiner_noun_agreement_with_adj_irregular_1,True,True,False,True,44,-38.777957916259766,-38.64742660522461,0
Karla exits these orange oases.,Karla exits these orange oasis.,morphology,determiner_noun_agreement,determiner_noun_agreement_with_adj_irregular_1,True,True,False,True,45,-60.344390869140625,-58.17908477783203,0
Joseph doesn't sound like these hard theses.,Joseph doesn't sound like these hard thesis.,morphology,determiner_noun_agreement,determiner_noun_agreement_with_adj_irregular_1,True,True,False,True,46,-52.76050567626953,-45.876258850097656,0
Martha had talked to that out in the open person.,Martha had talked to that out in the open people.,morphology,determiner_noun_agreement,determiner_noun_agreement_with_adj_irregular_1,True,True,False,True,47,-57.241668701171875,-57.880733489990234,1
The vase impresses that excited woman.,The vase impresses that excited women.,morphology,determiner_noun_agreement,determiner_noun_agreement_with_adj_irregular_1,True,True,False,True,48,-69.34217071533203,-69.109375,0
Kevin cleans this purple foot.,Kevin cleans this purple feet.,morphology,determiner_noun_agreement,determiner_noun_agreement_with_adj_irregular_1,True,True,False,True,49,-35.46781921386719,-35.88420104980469,1
Sheila could observe this big woman.,Sheila could observe this big women.,morphology,determiner_noun_agreement,determiner_noun_agreement_with_adj_irregular_1,True,True,False,True,50,-46.78526306152344,-49.23224639892578,1
Lisa hugs that young man.,Lisa hugs that young men.,morphology,determiner_noun_agreement,determiner_noun_agreement_with_adj_irregular_1,True,True,False,True,51,-32.897247314453125,-34.8903923034668,1
This waitress explores these black oases.,This waitress explores these black oasis.,morphology,determiner_noun_agreement,determiner_noun_agreement_with_adj_irregular_1,True,True,False,True,52,-63.08349609375,-60.72129440307617,0
Janet boasts about that fast person.,Janet boasts about that fast people.,morphology,determiner_noun_agreement,determiner_noun_agreement_with_adj_irregular_1,True,True,False,True,53,-53.246612548828125,-49.88845443725586,0
Scott won't confuse these big people.,Scott won't confuse these big person.,morphology,determiner_noun_agreement,determiner_noun_agreement_with_adj_irregular_1,True,True,False,True,54,-37.71498489379883,-41.83464813232422,1
The movie theater was impressing that sick woman.,The movie theater was impressing that sick women.,morphology,determiner_noun_agreement,determiner_noun_agreement_with_adj_irregular_1,True,True,False,True,55,-64.24801635742188,-65.12728118896484,1
Every carriage hadn't annoyed this sick alumnus.,Every carriage hadn't annoyed this sick alumni.,morphology,determiner_noun_agreement,determiner_noun_agreement_with_adj_irregular_1,True,True,False,True,56,-83.46063232421875,-68.32894897460938,0
Ronald hadn't discussed those scared people.,Ronald hadn't discussed those scared person.,morphology,determiner_noun_agreement,determiner_noun_agreement_with_adj_irregular_1,True,True,False,True,57,-52.70702362060547,-53.83636474609375,1
This hair upsets this determined alumnus.,This hair upsets this determined alumni.,morphology,determiner_noun_agreement,determiner_noun_agreement_with_adj_irregular_1,True,True,False,True,58,-78.24874877929688,-62.84050750732422,0
Some men have lifted those exposed lice.,Some men have lifted those exposed louse.,morphology,determiner_noun_agreement,determiner_noun_agreement_with_adj_irregular_1,True,True,False,True,59,-60.24863815307617,-59.96177291870117,0
Matt was criticizing that smart man.,Matt was criticizing that smart men.,morphology,determiner_noun_agreement,determiner_noun_agreement_with_adj_irregular_1,True,True,False,True,60,-39.2789306640625,-41.73579406738281,1
Karen didn't buy this blue nucleus.,Karen didn't buy this blue nuclei.,morphology,determiner_noun_agreement,determiner_noun_agreement_with_adj_irregular_1,True,True,False,True,61,-56.527099609375,-65.83219146728516,1
Deanna might dislike this good analysis.,Deanna might dislike this good analyses.,morphology,determiner_noun_agreement,determiner_noun_agreement_with_adj_irregular_1,True,True,False,True,62,-53.506317138671875,-60.33456039428711,1
Helen approached this busy woman.,Helen approached this busy women.,morphology,determiner_noun_agreement,determiner_noun_agreement_with_adj_irregular_1,True,True,False,True,63,-41.99460220336914,-44.221885681152344,1
Florence wasn't approaching this unconvinced woman.,Florence wasn't approaching this unconvinced women.,morphology,determiner_noun_agreement,determiner_noun_agreement_with_adj_irregular_1,True,True,False,True,64,-87.63268280029297,-87.97396850585938,1
Rachelle can't appreciate those good synopses.,Rachelle can't appreciate those good synopsis.,morphology,determiner_noun_agreement,determiner_noun_agreement_with_adj_irregular_1,True,True,False,True,65,-68.74853515625,-57.01841354370117,0
Jennifer hadn't thought about these out in the open octopi.,Jennifer hadn't thought about these out in the open octopus.,morphology,determiner_noun_agreement,determiner_noun_agreement_with_adj_irregular_1,True,True,False,True,66,-65.57125854492188,-60.2385368347168,0
Larry described these delighted children.,Larry described these delighted child.,morphology,determiner_noun_agreement,determiner_noun_agreement_with_adj_irregular_1,True,True,False,True,67,-37.8115348815918,-38.764129638671875,1
Many ladies arrive at that black oasis.,Many ladies arrive at that black oases.,morphology,determiner_noun_agreement,determiner_noun_agreement_with_adj_irregular_1,True,True,False,True,68,-53.848052978515625,-57.921897888183594,1
Sally admires those fast women.,Sally admires those fast woman.,morphology,determiner_noun_agreement,determiner_noun_agreement_with_adj_irregular_1,True,True,False,True,69,-68.50105285644531,-70.60580444335938,1
Leslie wouldn't investigate that sick woman.,Leslie wouldn't investigate that sick women.,morphology,determiner_noun_agreement,determiner_noun_agreement_with_adj_irregular_1,True,True,False,True,70,-52.29808044433594,-54.10940933227539,1
All essays did hurt that exposed person.,All essays did hurt that exposed people.,morphology,determiner_noun_agreement,determiner_noun_agreement_with_adj_irregular_1,True,True,False,True,71,-58.092166900634766,-55.12298583984375,0
Guy wouldn't sell that hard oasis.,Guy wouldn't sell that hard oases.,morphology,determiner_noun_agreement,determiner_noun_agreement_with_adj_irregular_1,True,True,False,True,72,-41.854957580566406,-45.241905212402344,1
Some woman hated that clever man.,Some woman hated that clever men.,morphology,determiner_noun_agreement,determiner_noun_agreement_with_adj_irregular_1,True,True,False,True,73,-41.966651916503906,-42.7611083984375,1
Amelia walks through this red oasis.,Amelia walks through this red oases.,morphology,determiner_noun_agreement,determiner_noun_agreement_with_adj_irregular_1,True,True,False,True,74,-56.019500732421875,-59.508689880371094,1
Susan did clean these yellow stimuli.,Susan did clean these yellow stimulus.,morphology,determiner_noun_agreement,determiner_noun_agreement_with_adj_irregular_1,True,True,False,True,75,-46.01194763183594,-46.225032806396484,1
Kristen observed that hopeful woman.,Kristen observed that hopeful women.,morphology,determiner_noun_agreement,determiner_noun_agreement_with_adj_irregular_1,True,True,False,True,76,-47.26131057739258,-48.67377471923828,1
Claire was messing up this small foot.,Claire was messing up this small feet.,morphology,determiner_noun_agreement,determiner_noun_agreement_with_adj_irregular_1,True,True,False,True,77,-52.46564483642578,-54.22704315185547,1
Some waiter hires that unemployed child.,Some waiter hires that unemployed children.,morphology,determiner_noun_agreement,determiner_noun_agreement_with_adj_irregular_1,True,True,False,True,78,-57.11365509033203,-56.85939025878906,0
Diana isn't running around that orange oasis.,Diana isn't running around that orange oases.,morphology,determiner_noun_agreement,determiner_noun_agreement_with_adj_irregular_1,True,True,False,True,79,-70.72975158691406,-74.37519836425781,1
This closet hasn't scared that lucky child.,This closet hasn't scared that lucky children.,morphology,determiner_noun_agreement,determiner_noun_agreement_with_adj_irregular_1,True,True,False,True,80,-54.73762130737305,-54.42491149902344,0
That doctor had hugged that confident woman.,That doctor had hugged that confident women.,morphology,determiner_noun_agreement,determiner_noun_agreement_with_adj_irregular_1,True,True,False,True,81,-57.62677001953125,-56.728179931640625,0
The waitresses research those red theses.,The waitresses research those red thesis.,morphology,determiner_noun_agreement,determiner_noun_agreement_with_adj_irregular_1,True,True,False,True,82,-72.51622009277344,-65.25973510742188,0
Many bananas confuse these displeased women.,Many bananas confuse these displeased woman.,morphology,determiner_noun_agreement,determiner_noun_agreement_with_adj_irregular_1,True,True,False,True,83,-62.358123779296875,-63.51243209838867,1
Committees loved this red thesis.,Committees loved this red theses.,morphology,determiner_noun_agreement,determiner_noun_agreement_with_adj_irregular_1,True,True,False,True,84,-54.81175994873047,-63.85724639892578,1
Deborah observes that lost alumnus.,Deborah observes that lost alumni.,morphology,determiner_noun_agreement,determiner_noun_agreement_with_adj_irregular_1,True,True,False,True,85,-68.48566436767578,-53.972496032714844,0
Marla could break those whole feet.,Marla could break those whole foot.,morphology,determiner_noun_agreement,determiner_noun_agreement_with_adj_irregular_1,True,True,False,True,86,-45.67609405517578,-45.6722526550293,0
Regina alarmed these standing alumni.,Regina alarmed these standing alumnus.,morphology,determiner_noun_agreement,determiner_noun_agreement_with_adj_irregular_1,True,True,False,True,87,-60.07703399658203,-73.27835083007812,1
Kristen cures this scared child.,Kristen cures this scared children.,morphology,determiner_noun_agreement,determiner_noun_agreement_with_adj_irregular_1,True,True,False,True,88,-51.34900665283203,-53.583778381347656,1
All screens astound these unlucky people.,All screens astound these unlucky person.,morphology,determiner_noun_agreement,determiner_noun_agreement_with_adj_irregular_1,True,True,False,True,89,-56.91425704956055,-60.77336502075195,1
Curtis knew these confident men.,Curtis knew these confident man.,morphology,determiner_noun_agreement,determiner_noun_agreement_with_adj_irregular_1,True,True,False,True,90,-62.77399444580078,-63.95806121826172,1
Some lakes confused this unlucky woman.,Some lakes confused this unlucky women.,morphology,determiner_noun_agreement,determiner_noun_agreement_with_adj_irregular_1,True,True,False,True,91,-52.403465270996094,-52.64293670654297,1
Most men lift these blue fungi.,Most men lift these blue fungus.,morphology,determiner_noun_agreement,determiner_noun_agreement_with_adj_irregular_1,True,True,False,True,92,-46.91450881958008,-48.01115417480469,1
Kendra kissed those happy alumni.,Kendra kissed those happy alumnus.,morphology,determiner_noun_agreement,determiner_noun_agreement_with_adj_irregular_1,True,True,False,True,93,-65.05776977539062,-81.48290252685547,1
Most cakes did distract this unsure child.,Most cakes did distract this unsure children.,morphology,determiner_noun_agreement,determiner_noun_agreement_with_adj_irregular_1,True,True,False,True,94,-63.035621643066406,-63.8714599609375,1
Katherine runs around that hard oasis.,Katherine runs around that hard oases.,morphology,determiner_noun_agreement,determiner_noun_agreement_with_adj_irregular_1,True,True,False,True,95,-60.51325988769531,-64.46229553222656,1
The Impressionists pass those black oases.,The Impressionists pass those black oasis.,morphology,determiner_noun_agreement,determiner_noun_agreement_with_adj_irregular_1,True,True,False,True,96,-73.09529876708984,-70.32310485839844,0
Andrea hadn't insulted this good woman.,Andrea hadn't insulted this good women.,morphology,determiner_noun_agreement,determiner_noun_agreement_with_adj_irregular_1,True,True,False,True,97,-53.881500244140625,-54.74616241455078,1
Beth will like these happy men.,Beth will like these happy man.,morphology,determiner_noun_agreement,determiner_noun_agreement_with_adj_irregular_1,True,True,False,True,98,-60.716575622558594,-61.78815460205078,1
Clyde broke that new foot.,Clyde broke that new feet.,morphology,determiner_noun_agreement,determiner_noun_agreement_with_adj_irregular_1,True,True,False,True,99,-59.93637466430664,-60.878665924072266,1
Bradley was watching these unsure men.,Bradley was watching these unsure man.,morphology,determiner_noun_agreement,determiner_noun_agreement_with_adj_irregular_1,True,True,False,True,100,-44.21967697143555,-45.60783767700195,1
The Clintons watch this confident man.,The Clintons watch this confident men.,morphology,determiner_noun_agreement,determiner_noun_agreement_with_adj_irregular_1,True,True,False,True,101,-58.16316223144531,-58.95761489868164,1
Debra had explored those gray oases.,Debra had explored those gray oasis.,morphology,determiner_noun_agreement,determiner_noun_agreement_with_adj_irregular_1,True,True,False,True,102,-62.05508804321289,-58.66226577758789,0
Homer was driving to this smooth oasis.,Homer was driving to this smooth oases.,morphology,determiner_noun_agreement,determiner_noun_agreement_with_adj_irregular_1,True,True,False,True,103,-64.37832641601562,-68.43098449707031,1
Some girl left that sick woman.,Some girl left that sick women.,morphology,determiner_noun_agreement,determiner_noun_agreement_with_adj_irregular_1,True,True,False,True,104,-39.75364685058594,-40.85517883300781,1
Those cafes confuse this old man.,Those cafes confuse this old men.,morphology,determiner_noun_agreement,determiner_noun_agreement_with_adj_irregular_1,True,True,False,True,105,-46.866878509521484,-47.7546501159668,1
Vanessa wasn't driving to that green oasis.,Vanessa wasn't driving to that green oases.,morphology,determiner_noun_agreement,determiner_noun_agreement_with_adj_irregular_1,True,True,False,True,106,-57.78691482543945,-61.65229415893555,1
Nicole has referenced these long analyses.,Nicole has referenced these long analysis.,morphology,determiner_noun_agreement,determiner_noun_agreement_with_adj_irregular_1,True,True,False,True,107,-55.82390594482422,-51.959266662597656,0
Irene doesn't bore those hopeful women.,Irene doesn't bore those hopeful woman.,morphology,determiner_noun_agreement,determiner_noun_agreement_with_adj_irregular_1,True,True,False,True,108,-58.95265197753906,-60.201568603515625,1
Colleen didn't scare this old woman.,Colleen didn't scare this old women.,morphology,determiner_noun_agreement,determiner_noun_agreement_with_adj_irregular_1,True,True,False,True,109,-44.07157897949219,-46.06918716430664,1
Most sketches have looked like this green louse.,Most sketches have looked like this green lice.,morphology,determiner_noun_agreement,determiner_noun_agreement_with_adj_irregular_1,True,True,False,True,110,-62.025970458984375,-62.363426208496094,1
Sonia can't hug those hopeful children.,Sonia can't hug those hopeful child.,morphology,determiner_noun_agreement,determiner_noun_agreement_with_adj_irregular_1,True,True,False,True,111,-61.28727340698242,-62.38052749633789,1
Helen had shocked these hopeful children.,Helen had shocked these hopeful child.,morphology,determiner_noun_agreement,determiner_noun_agreement_with_adj_irregular_1,True,True,False,True,112,-51.98414611816406,-53.974185943603516,1
