sentence_good,sentence_bad,field,linguistics_term,UID,simple_LM_method,one_prefix_method,two_prefix_method,lexically_identical,pair_id,good_prob,bad_prob,correct
Donald isn't about to manage to litter.,Donald isn't hard to manage to litter.,syntax_semantics,control_raising,tough_vs_raising_2,True,False,False,False,234,-43.87586975097656,-42.824119567871094,0
Sherry is likely to scan a story.,Sherry is enjoyable to scan a story.,syntax_semantics,control_raising,tough_vs_raising_2,True,False,False,False,235,-54.3582878112793,-60.38421630859375,1
Most friends of Laurie were certain to know Russell.,Most friends of Laurie were tough to know Russell.,syntax_semantics,control_raising,tough_vs_raising_2,True,False,False,False,236,-65.1146240234375,-63.81220245361328,0
Joseph wasn't likely to weep.,Joseph wasn't tough to weep.,syntax_semantics,control_raising,tough_vs_raising_2,True,False,False,False,237,-32.62173080444336,-32.538490295410156,0
Angela's contractors were about to disagree.,Angela's contractors were hard work to disagree.,syntax_semantics,control_raising,tough_vs_raising_2,True,False,False,False,238,-50.851417541503906,-60.09821319580078,1
This pedestrian wasn't about to continue to like those shoes.,This pedestrian wasn't boring to continue to like those shoes.,syntax_semantics,control_raising,tough_vs_raising_2,True,False,False,False,239,-63.398033142089844,-67.66598510742188,1
The teenager wasn't soon to conceal every teenager.,The teenager wasn't hard to conceal every teenager.,syntax_semantics,control_raising,tough_vs_raising_2,True,False,False,False,240,-64.33369445800781,-58.43324279785156,0
Becca wasn't likely to hide some box.,Becca wasn't boring to hide some box.,syntax_semantics,control_raising,tough_vs_raising_2,True,False,False,False,241,-50.36854553222656,-54.2037239074707,1
Chad's guests are apt to like many lakes.,Chad's guests are hard work to like many lakes.,syntax_semantics,control_raising,tough_vs_raising_2,True,False,False,False,242,-65.75086212158203,-71.15629577636719,1
Walter was likely to notice the plate.,Walter was interesting to notice the plate.,syntax_semantics,control_raising,tough_vs_raising_2,True,False,False,False,243,-42.621185302734375,-44.72105407714844,1
Julia was apt to discover the universities to chat.,Julia was enjoyable to discover the universities to chat.,syntax_semantics,control_raising,tough_vs_raising_2,True,False,False,False,244,-60.55986022949219,-64.1139144897461,1
Many commentaries are bound to irritate Rose.,Many commentaries are exciting to irritate Rose.,syntax_semantics,control_raising,tough_vs_raising_2,True,False,False,False,245,-60.92745590209961,-65.50823974609375,1
The Lutherans are unlikely to encourage Sonia to scan most commentaries.,The Lutherans are boring to encourage Sonia to scan most commentaries.,syntax_semantics,control_raising,tough_vs_raising_2,True,False,False,False,246,-110.28105163574219,-109.78678131103516,0
Every daughter of Rebecca was about to badger Sally's grandmother to smile.,Every daughter of Rebecca was tough to badger Sally's grandmother to smile.,syntax_semantics,control_raising,tough_vs_raising_2,True,False,False,False,247,-94.1216049194336,-97.83108520507812,1
Bill wasn't bound to explain Christina shouldn't distract Beth.,Bill wasn't tough to explain Christina shouldn't distract Beth.,syntax_semantics,control_raising,tough_vs_raising_2,True,False,False,False,248,-80.87934875488281,-79.18584442138672,0
Every grandson of this guy wasn't bound to discover all reports.,Every grandson of this guy wasn't enjoyable to discover all reports.,syntax_semantics,control_raising,tough_vs_raising_2,True,False,False,False,249,-70.77084350585938,-75.39527130126953,1
Sally's fathers were certain to compete.,Sally's fathers were tough to compete.,syntax_semantics,control_raising,tough_vs_raising_2,True,False,False,False,250,-62.16082000732422,-59.835906982421875,0
Richard isn't soon to intend to break most couches.,Richard isn't boring to intend to break most couches.,syntax_semantics,control_raising,tough_vs_raising_2,True,False,False,False,251,-68.22041320800781,-67.80175018310547,0
The student's father isn't soon to weep.,The student's father isn't hard work to weep.,syntax_semantics,control_raising,tough_vs_raising_2,True,False,False,False,252,-56.322181701660156,-58.35431671142578,1
Associations weren't certain to chat.,Associations weren't enjoyable to chat.,syntax_semantics,control_raising,tough_vs_raising_2,True,False,False,False,253,-51.890411376953125,-53.31867218017578,1
Catherine was soon to commission Omar to appear.,Catherine was unpleasant to commission Omar to appear.,syntax_semantics,control_raising,tough_vs_raising_2,True,False,False,False,254,-70.45626831054688,-76.80374908447266,1
Many boys' spouse isn't about to fall asleep.,Many boys' spouse isn't boring to fall asleep.,syntax_semantics,control_raising,tough_vs_raising_2,True,False,False,False,255,-58.32195281982422,-64.35136413574219,1
Naomi was certain to embarrass Jesus.,Naomi was enjoyable to embarrass Jesus.,syntax_semantics,control_raising,tough_vs_raising_2,True,False,False,False,256,-54.89862060546875,-56.30439758300781,1
Ann is soon to want this mushroom to ripen.,Ann is interesting to want this mushroom to ripen.,syntax_semantics,control_raising,tough_vs_raising_2,True,False,False,False,257,-74.02757263183594,-69.49168395996094,0
Some drawing isn't soon to shock Carmen.,Some drawing isn't hard work to shock Carmen.,syntax_semantics,control_raising,tough_vs_raising_2,True,False,False,False,258,-65.12162017822266,-65.28189086914062,1
The Lutherans were about to buy those carriages.,The Lutherans were interesting to buy those carriages.,syntax_semantics,control_raising,tough_vs_raising_2,True,False,False,False,259,-62.803077697753906,-66.62359619140625,1
Ruth wasn't apt to encourage Benjamin to argue.,Ruth wasn't irritating to encourage Benjamin to argue.,syntax_semantics,control_raising,tough_vs_raising_2,True,False,False,False,260,-75.86012268066406,-76.47840118408203,1
Stephen's French teachers were certain to reveal a lot of art galleries.,Stephen's French teachers were fun to reveal a lot of art galleries.,syntax_semantics,control_raising,tough_vs_raising_2,True,False,False,False,261,-77.022705078125,-74.26689910888672,0
Lori's mothers were sure to believe that lamp to brighten.,Lori's mothers were difficult to believe that lamp to brighten.,syntax_semantics,control_raising,tough_vs_raising_2,True,False,False,False,262,-90.82864379882812,-91.83943176269531,1
Derek isn't certain to cry.,Derek isn't hard work to cry.,syntax_semantics,control_raising,tough_vs_raising_2,True,False,False,False,263,-49.80818176269531,-51.707679748535156,1
George's fathers are unlikely to think about who complain.,George's fathers are hard to think about who complain.,syntax_semantics,control_raising,tough_vs_raising_2,True,False,False,False,264,-59.970458984375,-51.984012603759766,0
Kenneth's mother isn't apt to go fishing.,Kenneth's mother isn't easy to go fishing.,syntax_semantics,control_raising,tough_vs_raising_2,True,False,False,False,265,-51.05332565307617,-45.8509521484375,0
Alexander was likely to fall.,Alexander was difficult to fall.,syntax_semantics,control_raising,tough_vs_raising_2,True,False,False,False,266,-25.42731285095215,-25.233211517333984,0
Rhonda isn't unlikely to forget what hadn't brightened.,Rhonda isn't enjoyable to forget what hadn't brightened.,syntax_semantics,control_raising,tough_vs_raising_2,True,False,False,False,267,-78.7520751953125,-80.17507934570312,1
Keith wasn't about to attack Allison.,Keith wasn't difficult to attack Allison.,syntax_semantics,control_raising,tough_vs_raising_2,True,False,False,False,268,-39.82549285888672,-42.96399688720703,1
Chad is about to need that child to hire Mitchell.,Chad is fun to need that child to hire Mitchell.,syntax_semantics,control_raising,tough_vs_raising_2,True,False,False,False,269,-67.59516906738281,-68.60011291503906,1
Joel's contractor was soon to force Rhonda to boycott the committees.,Joel's contractor was tough to force Rhonda to boycott the committees.,syntax_semantics,control_raising,tough_vs_raising_2,True,False,False,False,270,-106.70733642578125,-104.42320251464844,0
Women's sisters aren't bound to forget about who was convincing Brenda to slump over.,Women's sisters aren't boring to forget about who was convincing Brenda to slump over.,syntax_semantics,control_raising,tough_vs_raising_2,True,False,False,False,271,-112.15953063964844,-117.1675033569336,1
Denise was soon to induce a lot of guests to fire Curtis.,Denise was irritating to induce a lot of guests to fire Curtis.,syntax_semantics,control_raising,tough_vs_raising_2,True,False,False,False,272,-76.51971435546875,-79.5669174194336,1
Jerry was sure to scare Amanda.,Jerry was hard to scare Amanda.,syntax_semantics,control_raising,tough_vs_raising_2,True,False,False,False,273,-36.37350845336914,-34.07073211669922,0
Patients weren't certain to pass many schools.,Patients weren't irritating to pass many schools.,syntax_semantics,control_raising,tough_vs_raising_2,True,False,False,False,274,-62.97981643676758,-64.30157470703125,1
The mother of Marla wasn't bound to implore Rose to confuse Peter.,The mother of Marla wasn't easy to implore Rose to confuse Peter.,syntax_semantics,control_raising,tough_vs_raising_2,True,False,False,False,275,-112.07530212402344,-110.17925262451172,0
Peter was about to propose to look like the sketches.,Peter was easy to propose to look like the sketches.,syntax_semantics,control_raising,tough_vs_raising_2,True,False,False,False,276,-47.61712646484375,-49.30815124511719,1
Those students aren't unlikely to find out who reveal those casseroles.,Those students aren't unpleasant to find out who reveal those casseroles.,syntax_semantics,control_raising,tough_vs_raising_2,True,False,False,False,277,-82.40283966064453,-81.58244323730469,0
The Borgias weren't bound to boast about Lissa.,The Borgias weren't fun to boast about Lissa.,syntax_semantics,control_raising,tough_vs_raising_2,True,False,False,False,278,-86.63134765625,-88.02250671386719,1
That offspring is certain to oblige Laura to see Linda.,That offspring is interesting to oblige Laura to see Linda.,syntax_semantics,control_raising,tough_vs_raising_2,True,False,False,False,279,-88.27406311035156,-83.07542419433594,0
That doctor was apt to die.,That doctor was fun to die.,syntax_semantics,control_raising,tough_vs_raising_2,True,False,False,False,280,-36.02007293701172,-33.29684829711914,0
The photographs of some ice are certain to alarm Leslie.,The photographs of some ice are pleasant to alarm Leslie.,syntax_semantics,control_raising,tough_vs_raising_2,True,False,False,False,281,-74.16093444824219,-75.1642837524414,1
Sheila was likely to bring that light.,Sheila was boring to bring that light.,syntax_semantics,control_raising,tough_vs_raising_2,True,False,False,False,282,-42.58753204345703,-47.82271194458008,1
A waiter isn't likely to examine some essay.,A waiter isn't easy to examine some essay.,syntax_semantics,control_raising,tough_vs_raising_2,True,False,False,False,283,-69.64500427246094,-67.08419799804688,0
Steve's dermatologists were sure to retaliate.,Steve's dermatologists were easy to retaliate.,syntax_semantics,control_raising,tough_vs_raising_2,True,False,False,False,284,-58.44715881347656,-55.87683868408203,0
Becca wasn't likely to investigate what stretches.,Becca wasn't hard to investigate what stretches.,syntax_semantics,control_raising,tough_vs_raising_2,True,False,False,False,285,-54.24341583251953,-51.040260314941406,0
Melissa isn't apt to appear to donate.,Melissa isn't tough to appear to donate.,syntax_semantics,control_raising,tough_vs_raising_2,True,False,False,False,286,-54.11417007446289,-50.504302978515625,0
These cousins of all pedestrians are apt to work hard.,These cousins of all pedestrians are exciting to work hard.,syntax_semantics,control_raising,tough_vs_raising_2,True,False,False,False,287,-66.31877899169922,-66.20068359375,0
Some oxen are unlikely to descend ladders.,Some oxen are enjoyable to descend ladders.,syntax_semantics,control_raising,tough_vs_raising_2,True,False,False,False,288,-65.5844955444336,-67.17063903808594,1
That grandson of Samuel is sure to skate around every bank.,That grandson of Samuel is fun to skate around every bank.,syntax_semantics,control_raising,tough_vs_raising_2,True,False,False,False,289,-74.43232727050781,-75.99691772460938,1
Stephen's podiatrists weren't bound to disagree with that newspaper article.,Stephen's podiatrists weren't difficult to disagree with that newspaper article.,syntax_semantics,control_raising,tough_vs_raising_2,True,False,False,False,290,-100.21168518066406,-100.92619323730469,1
Sharon was likely to skate around that bank.,Sharon was enjoyable to skate around that bank.,syntax_semantics,control_raising,tough_vs_raising_2,True,False,False,False,291,-54.26028823852539,-61.008296966552734,1
Veronica's boyfriend wasn't certain to consider many pedestrians to escape.,Veronica's boyfriend wasn't irritating to consider many pedestrians to escape.,syntax_semantics,control_raising,tough_vs_raising_2,True,False,False,False,292,-81.65777587890625,-82.62733459472656,1
That axis wasn't bound to embarrass Paul.,That axis wasn't annoying to embarrass Paul.,syntax_semantics,control_raising,tough_vs_raising_2,True,False,False,False,293,-61.1225471496582,-65.24021911621094,1
Kristin's oncologist wasn't apt to discover the teachers to embrace.,Kristin's oncologist wasn't hard work to discover the teachers to embrace.,syntax_semantics,control_raising,tough_vs_raising_2,True,False,False,False,294,-104.07937622070312,-107.09135437011719,1
Clyde wasn't sure to dare Pamela to fall asleep.,Clyde wasn't unpleasant to dare Pamela to fall asleep.,syntax_semantics,control_raising,tough_vs_raising_2,True,False,False,False,295,-91.31985473632812,-97.68392944335938,1
Some mothers of Brad aren't sure to chat.,Some mothers of Brad aren't fun to chat.,syntax_semantics,control_raising,tough_vs_raising_2,True,False,False,False,296,-56.41075897216797,-59.72011947631836,1
Jesus is sure to find Carl to leave this waitress.,Jesus is boring to find Carl to leave this waitress.,syntax_semantics,control_raising,tough_vs_raising_2,True,False,False,False,297,-64.86012268066406,-67.29376983642578,1
Rhonda isn't soon to observe Tammy.,Rhonda isn't fun to observe Tammy.,syntax_semantics,control_raising,tough_vs_raising_2,True,False,False,False,298,-59.981361389160156,-55.194236755371094,0
Guy's senators aren't about to explain Laura wasn't passing those museums.,Guy's senators aren't boring to explain Laura wasn't passing those museums.,syntax_semantics,control_raising,tough_vs_raising_2,True,False,False,False,299,-92.45466613769531,-98.59396362304688,1
Christopher was soon to long to approach all waitresses.,Christopher was hard to long to approach all waitresses.,syntax_semantics,control_raising,tough_vs_raising_2,True,False,False,False,300,-72.51177978515625,-69.97657775878906,0
Melissa was likely to learn who isn't requiring Harvard University to work with Sheila.,Melissa was tough to learn who isn't requiring Harvard University to work with Sheila.,syntax_semantics,control_raising,tough_vs_raising_2,True,False,False,False,301,-99.75970458984375,-99.21084594726562,0
Ladies weren't apt to disagree with Debra.,Ladies weren't hard work to disagree with Debra.,syntax_semantics,control_raising,tough_vs_raising_2,True,False,False,False,302,-64.39190673828125,-70.24968719482422,1
Lawrence is bound to look like many prints.,Lawrence is hard to look like many prints.,syntax_semantics,control_raising,tough_vs_raising_2,True,False,False,False,303,-53.52730178833008,-48.86454772949219,0
The actors' students are certain to entice Winston Churchill's niece to upset Diane.,The actors' students are irritating to entice Winston Churchill's niece to upset Diane.,syntax_semantics,control_raising,tough_vs_raising_2,True,False,False,False,304,-129.6400909423828,-131.11526489257812,1
Brad is apt to love Sabrina.,Brad is difficult to love Sabrina.,syntax_semantics,control_raising,tough_vs_raising_2,True,False,False,False,305,-50.79219055175781,-46.51213836669922,0
Gerald was about to sway Anna to bother Martha.,Gerald was annoying to sway Anna to bother Martha.,syntax_semantics,control_raising,tough_vs_raising_2,True,False,False,False,306,-79.61203002929688,-85.75215911865234,1
Some person was sure to litter.,Some person was unpleasant to litter.,syntax_semantics,control_raising,tough_vs_raising_2,True,False,False,False,307,-38.034942626953125,-43.726863861083984,1
Candice wasn't apt to leave Charles.,Candice wasn't annoying to leave Charles.,syntax_semantics,control_raising,tough_vs_raising_2,True,False,False,False,308,-49.87312316894531,-49.81208801269531,0
Anne's brothers are sure to cope.,Anne's brothers are hard to cope.,syntax_semantics,control_raising,tough_vs_raising_2,True,False,False,False,309,-35.81031036376953,-32.404518127441406,0
This grandson of Gina wasn't soon to wave.,This grandson of Gina wasn't irritating to wave.,syntax_semantics,control_raising,tough_vs_raising_2,True,False,False,False,310,-63.62447738647461,-62.78376388549805,0
Roger's hairdresser isn't likely to sway some guy to study.,Roger's hairdresser isn't pleasant to sway some guy to study.,syntax_semantics,control_raising,tough_vs_raising_2,True,False,False,False,311,-83.44186401367188,-87.39546203613281,1
Valerie wasn't certain to skate around these hills.,Valerie wasn't enjoyable to skate around these hills.,syntax_semantics,control_raising,tough_vs_raising_2,True,False,False,False,312,-71.69261169433594,-72.94633483886719,1
Eva's hairdressers weren't apt to work hard.,Eva's hairdressers weren't boring to work hard.,syntax_semantics,control_raising,tough_vs_raising_2,True,False,False,False,313,-67.44247436523438,-67.52809143066406,1
Cynthia was sure to see libraries.,Cynthia was exciting to see libraries.,syntax_semantics,control_raising,tough_vs_raising_2,True,False,False,False,314,-64.15495300292969,-66.50785064697266,1
Nieces of Craig are about to force all men to respect that library.,Nieces of Craig are irritating to force all men to respect that library.,syntax_semantics,control_raising,tough_vs_raising_2,True,False,False,False,315,-103.5399169921875,-110.80613708496094,1
Most nephews of the Clintons weren't about to explore that public park.,Most nephews of the Clintons weren't boring to explore that public park.,syntax_semantics,control_raising,tough_vs_raising_2,True,False,False,False,316,-94.00288391113281,-100.26431274414062,1
Paul was bound to praise Diana.,Paul was tough to praise Diana.,syntax_semantics,control_raising,tough_vs_raising_2,True,False,False,False,317,-38.63473129272461,-37.43931198120117,0
Julia was certain to oblige Bethany to bother Jeffrey.,Julia was pleasant to oblige Bethany to bother Jeffrey.,syntax_semantics,control_raising,tough_vs_raising_2,True,False,False,False,318,-99.93460083007812,-97.43409729003906,0
Every waiter isn't sure to murmur.,Every waiter isn't easy to murmur.,syntax_semantics,control_raising,tough_vs_raising_2,True,False,False,False,319,-61.60523986816406,-56.82099914550781,0
Bruce was apt to sound like many grocery stores.,Bruce was irritating to sound like many grocery stores.,syntax_semantics,control_raising,tough_vs_raising_2,True,False,False,False,320,-57.16914749145508,-58.973541259765625,1
Current events weren't likely to impress Carolyn.,Current events weren't hard work to impress Carolyn.,syntax_semantics,control_raising,tough_vs_raising_2,True,False,False,False,321,-51.060302734375,-59.39234924316406,1
Gerald wasn't sure to visit all public parks.,Gerald wasn't irritating to visit all public parks.,syntax_semantics,control_raising,tough_vs_raising_2,True,False,False,False,322,-64.46142578125,-70.80440521240234,1
A pedestrian wasn't about to have all computers.,A pedestrian wasn't tough to have all computers.,syntax_semantics,control_raising,tough_vs_raising_2,True,False,False,False,323,-60.87166213989258,-61.41441345214844,1
Margaret's tutors weren't soon to wish to hate Ruth.,Margaret's tutors weren't easy to wish to hate Ruth.,syntax_semantics,control_raising,tough_vs_raising_2,True,False,False,False,324,-90.63504028320312,-83.35550689697266,0
Galileo is bound to wonder who hasn't hired a lot of teenagers.,Galileo is annoying to wonder who hasn't hired a lot of teenagers.,syntax_semantics,control_raising,tough_vs_raising_2,True,False,False,False,325,-77.01174926757812,-81.041015625,1
Wendy's associate is certain to want the actresses to compete.,Wendy's associate is hard work to want the actresses to compete.,syntax_semantics,control_raising,tough_vs_raising_2,True,False,False,False,326,-84.94544982910156,-88.75041961669922,1
Rose wasn't certain to work with Laurie.,Rose wasn't interesting to work with Laurie.,syntax_semantics,control_raising,tough_vs_raising_2,True,False,False,False,327,-49.8022346496582,-43.9732666015625,0
Eva's partners were soon to wear all scarves.,Eva's partners were hard work to wear all scarves.,syntax_semantics,control_raising,tough_vs_raising_2,True,False,False,False,328,-61.78412628173828,-66.44261932373047,1
Helen isn't certain to force Scott to salute.,Helen isn't exciting to force Scott to salute.,syntax_semantics,control_raising,tough_vs_raising_2,True,False,False,False,329,-69.1472396850586,-67.03504943847656,0
Some granddaughter of Angela wasn't soon to investigate who returned to some person.,Some granddaughter of Angela wasn't hard work to investigate who returned to some person.,syntax_semantics,control_raising,tough_vs_raising_2,True,False,False,False,330,-86.47352600097656,-88.19766235351562,1
Most teachers' students aren't unlikely to expect the adult to eat.,Most teachers' students aren't hard work to expect the adult to eat.,syntax_semantics,control_raising,tough_vs_raising_2,True,False,False,False,331,-75.71951293945312,-78.98896026611328,1
Katherine isn't apt to return to every adult.,Katherine isn't tough to return to every adult.,syntax_semantics,control_raising,tough_vs_raising_2,True,False,False,False,332,-65.83435821533203,-61.369834899902344,0
Timothy's classmate was likely to clean a lot of peppers.,Timothy's classmate was difficult to clean a lot of peppers.,syntax_semantics,control_raising,tough_vs_raising_2,True,False,False,False,333,-64.86819458007812,-64.01165008544922,0
Those children were soon to want to disturb every organization.,Those children were hard to want to disturb every organization.,syntax_semantics,control_raising,tough_vs_raising_2,True,False,False,False,334,-57.68728256225586,-52.044708251953125,0
Some doctor's dermatologist is about to tour grocery stores.,Some doctor's dermatologist is pleasant to tour grocery stores.,syntax_semantics,control_raising,tough_vs_raising_2,True,False,False,False,335,-76.72761535644531,-83.09307861328125,1
Paul isn't apt to commission all children to shrug.,Paul isn't boring to commission all children to shrug.,syntax_semantics,control_raising,tough_vs_raising_2,True,False,False,False,336,-70.22535705566406,-71.80353546142578,1
An actor is likely to refuse to drink.,An actor is enjoyable to refuse to drink.,syntax_semantics,control_raising,tough_vs_raising_2,True,False,False,False,337,-40.925697326660156,-48.12810134887695,1
A lot of schools aren't certain to propose to come here.,A lot of schools aren't irritating to propose to come here.,syntax_semantics,control_raising,tough_vs_raising_2,True,False,False,False,338,-62.39741897583008,-64.54452514648438,1
Patricia's mother is soon to talk to Candice.,Patricia's mother is annoying to talk to Candice.,syntax_semantics,control_raising,tough_vs_raising_2,True,False,False,False,339,-62.24156188964844,-62.596702575683594,1
Regina is sure to listen to Douglas.,Regina is irritating to listen to Douglas.,syntax_semantics,control_raising,tough_vs_raising_2,True,False,False,False,340,-41.7515869140625,-46.52910232543945,1
Anne was sure to hide Richard.,Anne was easy to hide Richard.,syntax_semantics,control_raising,tough_vs_raising_2,True,False,False,False,341,-38.78526306152344,-36.901145935058594,0
These octopi are apt to bother Amy.,These octopi are interesting to bother Amy.,syntax_semantics,control_raising,tough_vs_raising_2,True,False,False,False,342,-53.94377517700195,-50.63716125488281,0
Every committee is bound to respond.,Every committee is hard to respond.,syntax_semantics,control_raising,tough_vs_raising_2,True,False,False,False,343,-34.68949890136719,-30.644420623779297,0
Thomas was certain to fire Amelia.,Thomas was unpleasant to fire Amelia.,syntax_semantics,control_raising,tough_vs_raising_2,True,False,False,False,344,-45.21031951904297,-45.9058723449707,1
All books are unlikely to embarrass Gerald.,All books are annoying to embarrass Gerald.,syntax_semantics,control_raising,tough_vs_raising_2,True,False,False,False,345,-50.761329650878906,-50.03913879394531,0
Debra isn't certain to need to donate.,Debra isn't annoying to need to donate.,syntax_semantics,control_raising,tough_vs_raising_2,True,False,False,False,346,-55.76203155517578,-54.6448974609375,0
Some hypotheses were soon to upset Bethany.,Some hypotheses were fun to upset Bethany.,syntax_semantics,control_raising,tough_vs_raising_2,True,False,False,False,347,-68.9022216796875,-67.72366333007812,0
Gerald's supervisor wasn't soon to disgust Nina.,Gerald's supervisor wasn't easy to disgust Nina.,syntax_semantics,control_raising,tough_vs_raising_2,True,False,False,False,348,-85.33958435058594,-78.1064453125,0
Carl's friends weren't soon to think about who hasn't taken a box.,Carl's friends weren't interesting to think about who hasn't taken a box.,syntax_semantics,control_raising,tough_vs_raising_2,True,False,False,False,349,-75.54676055908203,-73.74237060546875,0
