sentence_good,sentence_bad,field,linguistics_term,UID,simple_LM_method,one_prefix_method,two_prefix_method,lexically_identical,pair_id,good_prob,bad_prob,correct
Kristin insulted those dancers.,Kristin insulted those dancer.,morphology,determiner_noun_agreement,determiner_noun_agreement_1,True,True,False,True,512,-38.37879180908203,-39.17394256591797,1
Some sketches had looked like this girl.,Some sketches had looked like this girls.,morphology,determiner_noun_agreement,determiner_noun_agreement_1,True,True,False,True,513,-45.496986389160156,-46.938499450683594,1
Pamela hasn't biked to those libraries.,Pamela hasn't biked to those library.,morphology,determiner_noun_agreement,determiner_noun_agreement_1,True,True,False,True,514,-84.76451873779297,-81.86365509033203,0
Ellen can't exit these public parks.,Ellen can't exit these public park.,morphology,determiner_noun_agreement,determiner_noun_agreement_1,True,True,False,True,515,-46.64323425292969,-48.11212921142578,1
Ruth noticed those newspaper articles.,Ruth noticed those newspaper article.,morphology,determiner_noun_agreement,determiner_noun_agreement_1,True,True,False,True,516,-54.562599182128906,-53.883995056152344,0
Most doctors leave these doctors.,Most doctors leave these doctor.,morphology,determiner_noun_agreement,determiner_noun_agreement_1,True,True,False,True,517,-31.850820541381836,-34.672115325927734,1
Stacy has hurt this guest.,Stacy has hurt this guests.,morphology,determiner_noun_agreement,determiner_noun_agreement_1,True,True,False,True,518,-46.946754455566406,-47.03240203857422,1
Carol would admire those movie theaters.,Carol would admire those movie theater.,morphology,determiner_noun_agreement,determiner_noun_agreement_1,True,True,False,True,519,-59.505794525146484,-58.41170120239258,0
Kayla flees from these cafes.,Kayla flees from these cafe.,morphology,determiner_noun_agreement,determiner_noun_agreement_1,True,True,False,True,520,-52.63349151611328,-50.38103103637695,0
Most dancers haven't forgotten this essay.,Most dancers haven't forgotten this essays.,morphology,determiner_noun_agreement,determiner_noun_agreement_1,True,True,False,True,521,-48.52659225463867,-49.6270751953125,1
Customers shouldn't upset these waiters.,Customers shouldn't upset these waiter.,morphology,determiner_noun_agreement,determiner_noun_agreement_1,True,True,False,True,522,-52.975128173828125,-45.615421295166016,0
Wendy appreciates those pamphlets.,Wendy appreciates those pamphlet.,morphology,determiner_noun_agreement,determiner_noun_agreement_1,True,True,False,True,523,-66.68431091308594,-59.25482940673828,0
Victoria boasted about this play.,Victoria boasted about this plays.,morphology,determiner_noun_agreement,determiner_noun_agreement_1,True,True,False,True,524,-34.31935501098633,-36.3277473449707,1
Jacqueline can't scan these essays.,Jacqueline can't scan these essay.,morphology,determiner_noun_agreement,determiner_noun_agreement_1,True,True,False,True,525,-51.50482940673828,-53.488800048828125,1
The Impressionists explore this art gallery.,The Impressionists explore this art galleries.,morphology,determiner_noun_agreement,determiner_noun_agreement_1,True,True,False,True,526,-68.34996032714844,-67.54421997070312,0
Sarah messed up that cafe.,Sarah messed up that cafes.,morphology,determiner_noun_agreement,determiner_noun_agreement_1,True,True,False,True,527,-31.51415252685547,-33.60723876953125,1
Rodney hasn't remembered this art gallery.,Rodney hasn't remembered this art galleries.,morphology,determiner_noun_agreement,determiner_noun_agreement_1,True,True,False,True,528,-52.28950500488281,-52.337501525878906,1
Raymond kissed that guy.,Raymond kissed that guys.,morphology,determiner_noun_agreement,determiner_noun_agreement_1,True,True,False,True,529,-32.56333923339844,-34.39224624633789,1
Ladies hadn't fixed these couches.,Ladies hadn't fixed these couch.,morphology,determiner_noun_agreement,determiner_noun_agreement_1,True,True,False,True,530,-55.53196716308594,-47.72047424316406,0
Guy healed that patient.,Guy healed that patients.,morphology,determiner_noun_agreement,determiner_noun_agreement_1,True,True,False,True,531,-32.38596725463867,-32.16396713256836,0
The Borgias would criticize that story.,The Borgias would criticize that stories.,morphology,determiner_noun_agreement,determiner_noun_agreement_1,True,True,False,True,532,-55.63893127441406,-56.84636688232422,1
Carrie complains about this essay.,Carrie complains about this essays.,morphology,determiner_noun_agreement,determiner_noun_agreement_1,True,True,False,True,533,-44.61062240600586,-45.43825149536133,1
Steve should approach this customer.,Steve should approach this customers.,morphology,determiner_noun_agreement,determiner_noun_agreement_1,True,True,False,True,534,-36.00231170654297,-38.212562561035156,1
The patients didn't skate around those high schools.,The patients didn't skate around those high school.,morphology,determiner_noun_agreement,determiner_noun_agreement_1,True,True,False,True,535,-52.091697692871094,-50.40495300292969,0
Denise bought those prints.,Denise bought those print.,morphology,determiner_noun_agreement,determiner_noun_agreement_1,True,True,False,True,536,-33.1971435546875,-34.06242370605469,1
Susan hadn't hired these guys.,Susan hadn't hired these guy.,morphology,determiner_noun_agreement,determiner_noun_agreement_1,True,True,False,True,537,-33.10218048095703,-35.85211181640625,1
That mushroom is annoying these cashiers.,That mushroom is annoying these cashier.,morphology,determiner_noun_agreement,determiner_noun_agreement_1,True,True,False,True,538,-61.55562973022461,-61.27190399169922,0
Randolf did examine that pamphlet.,Randolf did examine that pamphlets.,morphology,determiner_noun_agreement,determiner_noun_agreement_1,True,True,False,True,539,-52.19277572631836,-58.51298522949219,1
Ellen cared for that teacher.,Ellen cared for that teachers.,morphology,determiner_noun_agreement,determiner_noun_agreement_1,True,True,False,True,540,-32.874080657958984,-33.58414077758789,1
Maria astounded this dancer.,Maria astounded this dancers.,morphology,determiner_noun_agreement,determiner_noun_agreement_1,True,True,False,True,541,-37.22938919067383,-40.435462951660156,1
Holly approaches that pedestrian.,Holly approaches that pedestrians.,morphology,determiner_noun_agreement,determiner_noun_agreement_1,True,True,False,True,542,-44.07929229736328,-43.438377380371094,0
Many waiters investigate these schools.,Many waiters investigate these school.,morphology,determiner_noun_agreement,determiner_noun_agreement_1,True,True,False,True,543,-47.37505340576172,-49.842220306396484,1
Most men explored that school.,Most men explored that schools.,morphology,determiner_noun_agreement,determiner_noun_agreement_1,True,True,False,True,544,-34.46381378173828,-36.73640441894531,1
Ellen wasn't observing these customers.,Ellen wasn't observing these customer.,morphology,determiner_noun_agreement,determiner_noun_agreement_1,True,True,False,True,545,-45.21577835083008,-47.53033447265625,1
Chad isn't concealing those adults.,Chad isn't concealing those adult.,morphology,determiner_noun_agreement,determiner_noun_agreement_1,True,True,False,True,546,-60.94087600708008,-63.54037857055664,1
Those guests bike to this school.,Those guests bike to this schools.,morphology,determiner_noun_agreement,determiner_noun_agreement_1,True,True,False,True,547,-40.552276611328125,-43.25965118408203,1
Most adults hurt these teachers.,Most adults hurt these teacher.,morphology,determiner_noun_agreement,determiner_noun_agreement_1,True,True,False,True,548,-34.51200485229492,-36.4600830078125,1
Paula was listening to those drivers.,Paula was listening to those driver.,morphology,determiner_noun_agreement,determiner_noun_agreement_1,True,True,False,True,549,-32.8490104675293,-33.27057647705078,1
Natalie wasn't researching these college campuses.,Natalie wasn't researching these college campus.,morphology,determiner_noun_agreement,determiner_noun_agreement_1,True,True,False,True,550,-61.544681549072266,-60.91423034667969,0
Gregory is attacking this doctor.,Gregory is attacking this doctors.,morphology,determiner_noun_agreement,determiner_noun_agreement_1,True,True,False,True,551,-34.40129089355469,-35.18875503540039,1
Stacy was watching these teachers.,Stacy was watching these teacher.,morphology,determiner_noun_agreement,determiner_noun_agreement_1,True,True,False,True,552,-42.16616439819336,-44.312103271484375,1
Holly wasn't exploring those art galleries.,Holly wasn't exploring those art gallery.,morphology,determiner_noun_agreement,determiner_noun_agreement_1,True,True,False,True,553,-55.3363037109375,-57.22768020629883,1
The Impressionists helped those teenagers.,The Impressionists helped those teenager.,morphology,determiner_noun_agreement,determiner_noun_agreement_1,True,True,False,True,554,-55.19084930419922,-60.634586334228516,1
These universities stunned this association.,These universities stunned this associations.,morphology,determiner_noun_agreement,determiner_noun_agreement_1,True,True,False,True,555,-40.69414138793945,-42.098114013671875,1
All actors know those waitresses.,All actors know those waitress.,morphology,determiner_noun_agreement,determiner_noun_agreement_1,True,True,False,True,556,-49.95842742919922,-41.61036682128906,0
Every woman boycotted those high schools.,Every woman boycotted those high school.,morphology,determiner_noun_agreement,determiner_noun_agreement_1,True,True,False,True,557,-57.51894760131836,-54.239810943603516,0
Nancy cleans this cup.,Nancy cleans this cups.,morphology,determiner_noun_agreement,determiner_noun_agreement_1,True,True,False,True,558,-40.10980987548828,-42.78239822387695,1
Julia is healing these snakes.,Julia is healing these snake.,morphology,determiner_noun_agreement,determiner_noun_agreement_1,True,True,False,True,559,-38.980411529541016,-41.38265609741211,1
Some guys are disagreeing with these essays.,Some guys are disagreeing with these essay.,morphology,determiner_noun_agreement,determiner_noun_agreement_1,True,True,False,True,560,-49.65374755859375,-51.81336212158203,1
These doctors scan this pamphlet.,These doctors scan this pamphlets.,morphology,determiner_noun_agreement,determiner_noun_agreement_1,True,True,False,True,561,-41.79055404663086,-50.18580627441406,1
Walter wasn't talking about those children.,Walter wasn't talking about those child.,morphology,determiner_noun_agreement,determiner_noun_agreement_1,True,True,False,True,562,-29.288631439208984,-32.880714416503906,1
Stephen knew that adult.,Stephen knew that adults.,morphology,determiner_noun_agreement,determiner_noun_agreement_1,True,True,False,True,563,-24.501327514648438,-24.89736557006836,1
This patient was concealing that senator.,This patient was concealing that senators.,morphology,determiner_noun_agreement,determiner_noun_agreement_1,True,True,False,True,564,-57.258113861083984,-59.45176315307617,1
That organization bores those pedestrians.,That organization bores those pedestrian.,morphology,determiner_noun_agreement,determiner_noun_agreement_1,True,True,False,True,565,-53.525901794433594,-54.003421783447266,1
Daniel tours this library.,Daniel tours this libraries.,morphology,determiner_noun_agreement,determiner_noun_agreement_1,True,True,False,True,566,-31.21364974975586,-35.167850494384766,1
Patricia runs around these movie theaters.,Patricia runs around these movie theater.,morphology,determiner_noun_agreement,determiner_noun_agreement_1,True,True,False,True,567,-49.041194915771484,-47.08978271484375,0
Dawn alarmed that driver.,Dawn alarmed that drivers.,morphology,determiner_noun_agreement,determiner_noun_agreement_1,True,True,False,True,568,-52.43693542480469,-52.152828216552734,0
All jackets embarrass this teacher.,All jackets embarrass this teachers.,morphology,determiner_noun_agreement,determiner_noun_agreement_1,True,True,False,True,569,-45.54196548461914,-45.68380355834961,1
Natalie will examine those reports.,Natalie will examine those report.,morphology,determiner_noun_agreement,determiner_noun_agreement_1,True,True,False,True,570,-41.004150390625,-43.83234786987305,1
James was lifting that cup.,James was lifting that cups.,morphology,determiner_noun_agreement,determiner_noun_agreement_1,True,True,False,True,571,-30.65259552001953,-33.12161636352539,1
Scott healed this driver.,Scott healed this drivers.,morphology,determiner_noun_agreement,determiner_noun_agreement_1,True,True,False,True,572,-34.34674835205078,-34.648353576660156,1
Suzanne has hugged that patient.,Suzanne has hugged that patients.,morphology,determiner_noun_agreement,determiner_noun_agreement_1,True,True,False,True,573,-48.19561004638672,-47.64412307739258,0
Erin wasn't listening to those teachers.,Erin wasn't listening to those teacher.,morphology,determiner_noun_agreement,determiner_noun_agreement_1,True,True,False,True,574,-37.921424865722656,-39.91429901123047,1
Jason should investigate these boys.,Jason should investigate these boy.,morphology,determiner_noun_agreement,determiner_noun_agreement_1,True,True,False,True,575,-35.12274932861328,-37.95374298095703,1
Jane could work with this guy.,Jane could work with this guys.,morphology,determiner_noun_agreement,determiner_noun_agreement_1,True,True,False,True,576,-29.017988204956055,-30.47487449645996,1
Omar toured that public park.,Omar toured that public parks.,morphology,determiner_noun_agreement,determiner_noun_agreement_1,True,True,False,True,577,-53.40602493286133,-52.3635368347168,0
Carts bothered these waitresses.,Carts bothered these waitress.,morphology,determiner_noun_agreement,determiner_noun_agreement_1,True,True,False,True,578,-60.69694519042969,-50.768550872802734,0
Becky hid that face.,Becky hid that faces.,morphology,determiner_noun_agreement,determiner_noun_agreement_1,True,True,False,True,579,-28.170501708984375,-30.04922866821289,1
Lori isn't running around these restaurants.,Lori isn't running around these restaurant.,morphology,determiner_noun_agreement,determiner_noun_agreement_1,True,True,False,True,580,-49.69647979736328,-52.284873962402344,1
Liam hasn't healed those cats.,Liam hasn't healed those cat.,morphology,determiner_noun_agreement,determiner_noun_agreement_1,True,True,False,True,581,-51.79930114746094,-52.57335662841797,1
Suzanne is embarrassing that actress.,Suzanne is embarrassing that actresses.,morphology,determiner_noun_agreement,determiner_noun_agreement_1,True,True,False,True,582,-42.27354431152344,-44.80892562866211,1
Ronald explored those schools.,Ronald explored those school.,morphology,determiner_noun_agreement,determiner_noun_agreement_1,True,True,False,True,583,-34.02940368652344,-36.73143768310547,1
A lot of cashiers buy those jackets.,A lot of cashiers buy those jacket.,morphology,determiner_noun_agreement,determiner_noun_agreement_1,True,True,False,True,584,-66.97195434570312,-65.26151275634766,0
The Clintons ran around this public park.,The Clintons ran around this public parks.,morphology,determiner_noun_agreement,determiner_noun_agreement_1,True,True,False,True,585,-57.356143951416016,-56.797122955322266,0
Kirsten stunned that actor.,Kirsten stunned that actors.,morphology,determiner_noun_agreement,determiner_noun_agreement_1,True,True,False,True,586,-52.023014068603516,-53.236446380615234,1
Melissa did wear this hat.,Melissa did wear this hats.,morphology,determiner_noun_agreement,determiner_noun_agreement_1,True,True,False,True,587,-36.30063247680664,-40.07550811767578,1
Peter was observing these girls.,Peter was observing these girl.,morphology,determiner_noun_agreement,determiner_noun_agreement_1,True,True,False,True,588,-34.67105484008789,-35.95558166503906,1
Frank hadn't researched these associations.,Frank hadn't researched these association.,morphology,determiner_noun_agreement,determiner_noun_agreement_1,True,True,False,True,589,-43.544681549072266,-43.992496490478516,1
Christine heals this girl.,Christine heals this girls.,morphology,determiner_noun_agreement,determiner_noun_agreement_1,True,True,False,True,590,-36.12867736816406,-39.090152740478516,1
The Lutherans astounds these pedestrians.,The Lutherans astounds these pedestrian.,morphology,determiner_noun_agreement,determiner_noun_agreement_1,True,True,False,True,591,-68.77581787109375,-70.03974151611328,1
Regina arrived at this art gallery.,Regina arrived at this art galleries.,morphology,determiner_noun_agreement,determiner_noun_agreement_1,True,True,False,True,592,-45.922603607177734,-45.871986389160156,0
All women see this patient.,All women see this patients.,morphology,determiner_noun_agreement,determiner_noun_agreement_1,True,True,False,True,593,-32.78501892089844,-33.305084228515625,1
Those guys hadn't disagreed with this commentary.,Those guys hadn't disagreed with this commentaries.,morphology,determiner_noun_agreement,determiner_noun_agreement_1,True,True,False,True,594,-52.199729919433594,-59.62259292602539,1
Allison didn't visit those museums.,Allison didn't visit those museum.,morphology,determiner_noun_agreement,determiner_noun_agreement_1,True,True,False,True,595,-44.20115280151367,-44.37411117553711,1
Kimberley worried this museum.,Kimberley worried this museums.,morphology,determiner_noun_agreement,determiner_noun_agreement_1,True,True,False,True,596,-44.78217315673828,-49.24153518676758,1
Those forks bother these pedestrians.,Those forks bother these pedestrian.,morphology,determiner_noun_agreement,determiner_noun_agreement_1,True,True,False,True,597,-44.07112503051758,-45.14967346191406,1
Some school isn't helping these pedestrians.,Some school isn't helping these pedestrian.,morphology,determiner_noun_agreement,determiner_noun_agreement_1,True,True,False,True,598,-45.18928146362305,-45.95662307739258,1
Many patients notice this dress.,Many patients notice this dresses.,morphology,determiner_noun_agreement,determiner_noun_agreement_1,True,True,False,True,599,-37.01611328125,-38.40613555908203,1
Most pedestrians attack this lady.,Most pedestrians attack this ladies.,morphology,determiner_noun_agreement,determiner_noun_agreement_1,True,True,False,True,600,-40.844566345214844,-44.6671142578125,1
Paula should visit those museums.,Paula should visit those museum.,morphology,determiner_noun_agreement,determiner_noun_agreement_1,True,True,False,True,601,-37.243690490722656,-37.33027648925781,1
All actresses visit this student.,All actresses visit this students.,morphology,determiner_noun_agreement,determiner_noun_agreement_1,True,True,False,True,602,-39.49409484863281,-39.80118179321289,1
Catherine drove to those banks.,Catherine drove to those bank.,morphology,determiner_noun_agreement,determiner_noun_agreement_1,True,True,False,True,603,-45.45249938964844,-44.76573181152344,0
Jessica helps these boys.,Jessica helps these boy.,morphology,determiner_noun_agreement,determiner_noun_agreement_1,True,True,False,True,604,-24.907413482666016,-28.822532653808594,1
Carrie doesn't annoy this patient.,Carrie doesn't annoy this patients.,morphology,determiner_noun_agreement,determiner_noun_agreement_1,True,True,False,True,605,-46.81966781616211,-47.62605285644531,1
James fired this patient.,James fired this patients.,morphology,determiner_noun_agreement,determiner_noun_agreement_1,True,True,False,True,606,-29.830785751342773,-31.431900024414062,1
Every movie theater aggravated those guys.,Every movie theater aggravated those guy.,morphology,determiner_noun_agreement,determiner_noun_agreement_1,True,True,False,True,607,-51.98639678955078,-54.568031311035156,1
Eric skated around that museum.,Eric skated around that museums.,morphology,determiner_noun_agreement,determiner_noun_agreement_1,True,True,False,True,608,-40.21405029296875,-44.14518737792969,1
Stacy conceals this turtle.,Stacy conceals this turtles.,morphology,determiner_noun_agreement,determiner_noun_agreement_1,True,True,False,True,609,-58.79982376098633,-59.58820724487305,1
A projector could confuse that guest.,A projector could confuse that guests.,morphology,determiner_noun_agreement,determiner_noun_agreement_1,True,True,False,True,610,-62.375694274902344,-61.76823425292969,0
Stacy doesn't leave this guy.,Stacy doesn't leave this guys.,morphology,determiner_noun_agreement,determiner_noun_agreement_1,True,True,False,True,611,-41.21689224243164,-43.48136901855469,1
Some mall wasn't disgusting those universities.,Some mall wasn't disgusting those university.,morphology,determiner_noun_agreement,determiner_noun_agreement_1,True,True,False,True,612,-53.118289947509766,-54.5298957824707,1
Julie might flee from these teachers.,Julie might flee from these teacher.,morphology,determiner_noun_agreement,determiner_noun_agreement_1,True,True,False,True,613,-44.54700469970703,-46.88632583618164,1
Jodi wasn't disgusting those girls.,Jodi wasn't disgusting those girl.,morphology,determiner_noun_agreement,determiner_noun_agreement_1,True,True,False,True,614,-56.40186309814453,-56.87139892578125,1
George isn't bringing this grocery store.,George isn't bringing this grocery stores.,morphology,determiner_noun_agreement,determiner_noun_agreement_1,True,True,False,True,615,-40.57599639892578,-41.19476318359375,1
A boy ran around this museum.,A boy ran around this museums.,morphology,determiner_noun_agreement,determiner_noun_agreement_1,True,True,False,True,616,-45.46669006347656,-49.81029510498047,1
Lori shouldn't break this dish.,Lori shouldn't break this dishs.,morphology,determiner_noun_agreement,determiner_noun_agreement_1,True,True,False,True,617,-45.43100357055664,-52.77589416503906,1
Some cakes embarrass those actresses.,Some cakes embarrass those actress.,morphology,determiner_noun_agreement,determiner_noun_agreement_1,True,True,False,True,618,-43.62504959106445,-45.7205924987793,1
Literature disturbs those universities.,Literature disturbs those university.,morphology,determiner_noun_agreement,determiner_noun_agreement_1,True,True,False,True,619,-49.55845260620117,-51.57398986816406,1
The teachers argue about those guys.,The teachers argue about those guy.,morphology,determiner_noun_agreement,determiner_noun_agreement_1,True,True,False,True,620,-31.07181167602539,-33.84760284423828,1
All pies aren't shocking these dancers.,All pies aren't shocking these dancer.,morphology,determiner_noun_agreement,determiner_noun_agreement_1,True,True,False,True,621,-51.491188049316406,-51.797298431396484,1
Some students weren't disagreeing with these adults.,Some students weren't disagreeing with these adult.,morphology,determiner_noun_agreement,determiner_noun_agreement_1,True,True,False,True,622,-52.89403533935547,-56.64897155761719,1
A woman is looking like those paintings.,A woman is looking like those painting.,morphology,determiner_noun_agreement,determiner_noun_agreement_1,True,True,False,True,623,-47.937095642089844,-47.84258270263672,0
A box alarms these actresses.,A box alarms these actress.,morphology,determiner_noun_agreement,determiner_noun_agreement_1,True,True,False,True,624,-52.62714385986328,-54.90403747558594,1
A lot of ladies can have that pamphlet.,A lot of ladies can have that pamphlets.,morphology,determiner_noun_agreement,determiner_noun_agreement_1,True,True,False,True,625,-52.44268035888672,-59.363616943359375,1
Meredith cured these guys.,Meredith cured these guy.,morphology,determiner_noun_agreement,determiner_noun_agreement_1,True,True,False,True,626,-43.83457946777344,-45.990028381347656,1
Phillip won't think about those students.,Phillip won't think about those student.,morphology,determiner_noun_agreement,determiner_noun_agreement_1,True,True,False,True,627,-38.81238555908203,-42.684783935546875,1
This hat disgusts that boy.,This hat disgusts that boys.,morphology,determiner_noun_agreement,determiner_noun_agreement_1,True,True,False,True,628,-43.15843200683594,-44.160240173339844,1
Raymond has forgotten that guy.,Raymond has forgotten that guys.,morphology,determiner_noun_agreement,determiner_noun_agreement_1,True,True,False,True,629,-35.49201202392578,-37.02261734008789,1
Erin hasn't toured these grocery stores.,Erin hasn't toured these grocery store.,morphology,determiner_noun_agreement,determiner_noun_agreement_1,True,True,False,True,630,-57.421607971191406,-59.61711883544922,1
The pies did alarm these students.,The pies did alarm these student.,morphology,determiner_noun_agreement,determiner_noun_agreement_1,True,True,False,True,631,-45.964534759521484,-48.95893859863281,1
Daniel does exit these public parks.,Daniel does exit these public park.,morphology,determiner_noun_agreement,determiner_noun_agreement_1,True,True,False,True,632,-43.4317626953125,-44.98884582519531,1
Theresa is arriving at that hospital.,Theresa is arriving at that hospitals.,morphology,determiner_noun_agreement,determiner_noun_agreement_1,True,True,False,True,633,-40.0510139465332,-45.49174118041992,1
Emily hasn't exited these grocery stores.,Emily hasn't exited these grocery store.,morphology,determiner_noun_agreement,determiner_noun_agreement_1,True,True,False,True,634,-49.61036682128906,-51.58307647705078,1
Sherry is concealing these brochures.,Sherry is concealing these brochure.,morphology,determiner_noun_agreement,determiner_noun_agreement_1,True,True,False,True,635,-73.64117431640625,-75.20805358886719,1
Jeffrey does complain about those reports.,Jeffrey does complain about those report.,morphology,determiner_noun_agreement,determiner_noun_agreement_1,True,True,False,True,636,-43.97428894042969,-46.44417190551758,1
All girls see that pedestrian.,All girls see that pedestrians.,morphology,determiner_noun_agreement,determiner_noun_agreement_1,True,True,False,True,637,-36.667110443115234,-36.41819763183594,0
Those actresses approach that student.,Those actresses approach that students.,morphology,determiner_noun_agreement,determiner_noun_agreement_1,True,True,False,True,638,-37.005821228027344,-36.12290954589844,0
