sentence_good,sentence_bad,field,linguistics_term,UID,simple_LM_method,one_prefix_method,two_prefix_method,lexically_identical,pair_id,good_prob,bad_prob,correct
A lot of patients who can sell some couch didn't investigate themselves.,A lot of patients who can sell some couch didn't investigate itself.,syntax_semantics,binding,principle_A_c_command,True,True,False,False,0,-84.10633087158203,-86.72438049316406,1
A lot of actresses that thought about Alice healed themselves.,A lot of actresses that thought about Alice healed herself.,syntax_semantics,binding,principle_A_c_command,True,True,False,False,1,-78.445556640625,-79.76087951660156,1
A guy that has seen the wheelbarrow notices himself.,A guy that has seen the wheelbarrow notices itself.,syntax_semantics,binding,principle_A_c_command,True,True,False,False,2,-87.45567321777344,-86.7589111328125,0
The children that were complaining about Gregory hated themselves.,The children that were complaining about Gregory hated himself.,syntax_semantics,binding,principle_A_c_command,True,True,False,False,3,-56.53485870361328,-57.637908935546875,1
Every boy that isn't selling the grocery stores isn't healing himself.,Every boy that isn't selling the grocery stores isn't healing themselves.,syntax_semantics,binding,principle_A_c_command,True,True,False,False,4,-81.25575256347656,-79.93097686767578,0
The hospitals that talk to Ann talked to themselves.,The hospitals that talk to Ann talked to herself.,syntax_semantics,binding,principle_A_c_command,True,True,False,False,5,-53.65943908691406,-55.39242172241211,1
Many skirts that stun some waitress are boring themselves.,Many skirts that stun some waitress are boring herself.,syntax_semantics,binding,principle_A_c_command,True,True,False,False,6,-72.67510223388672,-75.61205291748047,1
All men that might fire Tiffany have worked with themselves.,All men that might fire Tiffany have worked with herself.,syntax_semantics,binding,principle_A_c_command,True,True,False,False,7,-63.637454986572266,-66.45701599121094,1
That actress who admired the cup praises herself.,That actress who admired the cup praises itself.,syntax_semantics,binding,principle_A_c_command,True,True,False,False,8,-66.51580810546875,-65.20154571533203,0
This lady who is healing Charles wasn't hiding herself.,This lady who is healing Charles wasn't hiding himself.,syntax_semantics,binding,principle_A_c_command,True,True,False,False,9,-63.408912658691406,-62.089420318603516,0
Every woman that was hiring the Borgias argued about herself.,Every woman that was hiring the Borgias argued about themselves.,syntax_semantics,binding,principle_A_c_command,True,True,False,False,10,-80.69456481933594,-79.3564682006836,0
Every lady who does walk through a lot of movie theaters hadn't hugged herself.,Every lady who does walk through a lot of movie theaters hadn't hugged themselves.,syntax_semantics,binding,principle_A_c_command,True,True,False,False,11,-90.87203216552734,-88.65229797363281,0
These doctors who do leave Melissa fled from themselves.,These doctors who do leave Melissa fled from herself.,syntax_semantics,binding,principle_A_c_command,True,True,False,False,12,-59.771846771240234,-61.203304290771484,1
These ladies that hadn't forgotten Victoria fled from themselves.,These ladies that hadn't forgotten Victoria fled from herself.,syntax_semantics,binding,principle_A_c_command,True,True,False,False,13,-65.27642822265625,-67.73243713378906,1
The customers who embarrass Kevin are discussing themselves.,The customers who embarrass Kevin are discussing himself.,syntax_semantics,binding,principle_A_c_command,True,True,False,False,14,-65.26046752929688,-65.97883605957031,1
Some steak that scares Stacy doesn't shock itself.,Some steak that scares Stacy doesn't shock herself.,syntax_semantics,binding,principle_A_c_command,True,True,False,False,15,-70.82513427734375,-71.68488311767578,1
All ladies who were bothering Dan observed themselves.,All ladies who were bothering Dan observed himself.,syntax_semantics,binding,principle_A_c_command,True,True,False,False,16,-58.436161041259766,-58.80690383911133,1
The woman who hadn't taken a screen should respect herself.,The woman who hadn't taken a screen should respect itself.,syntax_semantics,binding,principle_A_c_command,True,True,False,False,17,-67.45562744140625,-68.03605651855469,1
Most women who were arriving at every hospital fired themselves.,Most women who were arriving at every hospital fired itself.,syntax_semantics,binding,principle_A_c_command,True,True,False,False,18,-60.74538040161133,-63.1185188293457,1
Some hill that could distract Barbara is alarming itself.,Some hill that could distract Barbara is alarming herself.,syntax_semantics,binding,principle_A_c_command,True,True,False,False,19,-75.7005386352539,-76.59181213378906,1
A lot of senators who climbed down the hill hired themselves.,A lot of senators who climbed down the hill hired itself.,syntax_semantics,binding,principle_A_c_command,True,True,False,False,20,-84.40242004394531,-87.39454650878906,1
The dancers who haven't shocked Candice aren't appreciating themselves.,The dancers who haven't shocked Candice aren't appreciating herself.,syntax_semantics,binding,principle_A_c_command,True,True,False,False,21,-93.59502410888672,-95.62540435791016,1
A legislature that wouldn't criticize Patrick hasn't helped itself.,A legislature that wouldn't criticize Patrick hasn't helped himself.,syntax_semantics,binding,principle_A_c_command,True,True,False,False,22,-87.85282897949219,-85.27287292480469,0
Most guests who were revealing Colleen weren't complaining about themselves.,Most guests who were revealing Colleen weren't complaining about herself.,syntax_semantics,binding,principle_A_c_command,True,True,False,False,23,-85.08453369140625,-87.62904357910156,1
A guy who hasn't annoyed Laura argued about himself.,A guy who hasn't annoyed Laura argued about herself.,syntax_semantics,binding,principle_A_c_command,True,True,False,False,24,-76.64749145507812,-77.89936828613281,1
That company that had known Sandra annoyed itself.,That company that had known Sandra annoyed herself.,syntax_semantics,binding,principle_A_c_command,True,True,False,False,25,-66.63529968261719,-66.36544799804688,0
Those senators who had a slope have cared for themselves.,Those senators who had a slope have cared for itself.,syntax_semantics,binding,principle_A_c_command,True,True,False,False,26,-66.80809783935547,-69.42557525634766,1
A cat that hasn't impressed Joseph couldn't distract itself.,A cat that hasn't impressed Joseph couldn't distract himself.,syntax_semantics,binding,principle_A_c_command,True,True,False,False,27,-88.9105224609375,-86.18997955322266,0
Some association that had forgotten Claire insults itself.,Some association that had forgotten Claire insults herself.,syntax_semantics,binding,principle_A_c_command,True,True,False,False,28,-65.10647583007812,-66.79295349121094,1
That plane that was scaring Wendy has disgusted itself.,That plane that was scaring Wendy has disgusted herself.,syntax_semantics,binding,principle_A_c_command,True,True,False,False,29,-80.72691345214844,-79.76295471191406,0
The dancer who has brought those fish could care for herself.,The dancer who has brought those fish could care for themselves.,syntax_semantics,binding,principle_A_c_command,True,True,False,False,30,-64.48289489746094,-62.089256286621094,0
Some boy that disturbed Jill could argue about himself.,Some boy that disturbed Jill could argue about herself.,syntax_semantics,binding,principle_A_c_command,True,True,False,False,31,-65.95732116699219,-67.25772094726562,1
Some woman that was exploring some hill can't think about herself.,Some woman that was exploring some hill can't think about itself.,syntax_semantics,binding,principle_A_c_command,True,True,False,False,32,-74.19892883300781,-74.111083984375,0
All actors that disgust Veronica escaped from themselves.,All actors that disgust Veronica escaped from herself.,syntax_semantics,binding,principle_A_c_command,True,True,False,False,33,-67.02824401855469,-68.8497543334961,1
Some museum that doesn't like a waitress was praising itself.,Some museum that doesn't like a waitress was praising herself.,syntax_semantics,binding,principle_A_c_command,True,True,False,False,34,-70.47852325439453,-72.05419921875,1
These pies that were embarrassing Jennifer are annoying themselves.,These pies that were embarrassing Jennifer are annoying herself.,syntax_semantics,binding,principle_A_c_command,True,True,False,False,35,-74.91317749023438,-77.00269317626953,1
The book that is disgusting dancers would irritate itself.,The book that is disgusting dancers would irritate themselves.,syntax_semantics,binding,principle_A_c_command,True,True,False,False,36,-69.53060150146484,-67.55380249023438,0
The drivers who attack Jodi haven't revealed themselves.,The drivers who attack Jodi haven't revealed herself.,syntax_semantics,binding,principle_A_c_command,True,True,False,False,37,-77.01812744140625,-80.0378189086914,1
A lot of adults that scared Stacey talked to themselves.,A lot of adults that scared Stacey talked to herself.,syntax_semantics,binding,principle_A_c_command,True,True,False,False,38,-81.45535278320312,-84.70016479492188,1
A girl that wouldn't watch Omar questions herself.,A girl that wouldn't watch Omar questions himself.,syntax_semantics,binding,principle_A_c_command,True,True,False,False,39,-73.86795043945312,-73.12954711914062,0
The men who weren't confusing Valerie were kissing themselves.,The men who weren't confusing Valerie were kissing herself.,syntax_semantics,binding,principle_A_c_command,True,True,False,False,40,-70.75541687011719,-71.70707702636719,1
Some guests who didn't discover Melissa were visiting themselves.,Some guests who didn't discover Melissa were visiting herself.,syntax_semantics,binding,principle_A_c_command,True,True,False,False,41,-67.33119201660156,-68.74750518798828,1
A lot of waiters who weren't boring Joseph would heal themselves.,A lot of waiters who weren't boring Joseph would heal himself.,syntax_semantics,binding,principle_A_c_command,True,True,False,False,42,-100.01716613769531,-100.79249572753906,1
Some organizations that haven't respected Nicole hadn't worked with themselves.,Some organizations that haven't respected Nicole hadn't worked with herself.,syntax_semantics,binding,principle_A_c_command,True,True,False,False,43,-71.85493469238281,-74.11526489257812,1
Some dancer who isn't admiring mushrooms thinks about herself.,Some dancer who isn't admiring mushrooms thinks about themselves.,syntax_semantics,binding,principle_A_c_command,True,True,False,False,44,-89.08524322509766,-86.57769012451172,0
These actors who think about Russell won't remember themselves.,These actors who think about Russell won't remember himself.,syntax_semantics,binding,principle_A_c_command,True,True,False,False,45,-61.44679260253906,-61.41546630859375,0
All cashiers who will respect Florence criticized themselves.,All cashiers who will respect Florence criticized herself.,syntax_semantics,binding,principle_A_c_command,True,True,False,False,46,-77.41847229003906,-79.72746276855469,1
This book that hurt Kirsten has disagreed with itself.,This book that hurt Kirsten has disagreed with herself.,syntax_semantics,binding,principle_A_c_command,True,True,False,False,47,-71.5049057006836,-71.46617126464844,0
These adults that won't listen to Janice impressed themselves.,These adults that won't listen to Janice impressed herself.,syntax_semantics,binding,principle_A_c_command,True,True,False,False,48,-63.862579345703125,-67.98074340820312,1
The actors that were escaping from Carrie had cured themselves.,The actors that were escaping from Carrie had cured herself.,syntax_semantics,binding,principle_A_c_command,True,True,False,False,49,-71.0179672241211,-73.24801635742188,1
Every government that boasted about Amanda wasn't embarrassing itself.,Every government that boasted about Amanda wasn't embarrassing herself.,syntax_semantics,binding,principle_A_c_command,True,True,False,False,50,-73.73078918457031,-73.8331298828125,1
Some cucumbers that can embarrass Amanda disgusted themselves.,Some cucumbers that can embarrass Amanda disgusted herself.,syntax_semantics,binding,principle_A_c_command,True,True,False,False,51,-75.07413482666016,-77.564697265625,1
Some association that would astound Gregory had scared itself.,Some association that would astound Gregory had scared himself.,syntax_semantics,binding,principle_A_c_command,True,True,False,False,52,-82.8787841796875,-82.56730651855469,0
The customers that descend every hill can praise themselves.,The customers that descend every hill can praise itself.,syntax_semantics,binding,principle_A_c_command,True,True,False,False,53,-69.22415161132812,-71.83998107910156,1
That woman who had noticed John fled from herself.,That woman who had noticed John fled from himself.,syntax_semantics,binding,principle_A_c_command,True,True,False,False,54,-57.43080139160156,-56.290138244628906,0
Some beef that had annoyed this dancer is stunning itself.,Some beef that had annoyed this dancer is stunning herself.,syntax_semantics,binding,principle_A_c_command,True,True,False,False,55,-78.57088470458984,-78.82398986816406,1
These guests that haven't discovered Caroline had seen themselves.,These guests that haven't discovered Caroline had seen herself.,syntax_semantics,binding,principle_A_c_command,True,True,False,False,56,-62.71465301513672,-66.13262939453125,1
A library that has stunned Samantha criticized itself.,A library that has stunned Samantha criticized herself.,syntax_semantics,binding,principle_A_c_command,True,True,False,False,57,-76.69287109375,-77.65333557128906,1
Every actress who observed Eric kissed herself.,Every actress who observed Eric kissed himself.,syntax_semantics,binding,principle_A_c_command,True,True,False,False,58,-54.98856735229492,-53.037841796875,0
Every girl that hadn't disgusted Travis can't approach herself.,Every girl that hadn't disgusted Travis can't approach himself.,syntax_semantics,binding,principle_A_c_command,True,True,False,False,59,-79.50691223144531,-77.84962463378906,0
Every woman that noticed some library respects herself.,Every woman that noticed some library respects itself.,syntax_semantics,binding,principle_A_c_command,True,True,False,False,60,-64.01774597167969,-61.99837875366211,0
Senators who disagree with Thomas can't heal themselves.,Senators who disagree with Thomas can't heal himself.,syntax_semantics,binding,principle_A_c_command,True,True,False,False,61,-63.398040771484375,-64.0838623046875,1
The dancers that argue about Beverly observed themselves.,The dancers that argue about Beverly observed herself.,syntax_semantics,binding,principle_A_c_command,True,True,False,False,62,-60.87632751464844,-63.27778244018555,1
The turtles that were boring Christine disgusted themselves.,The turtles that were boring Christine disgusted herself.,syntax_semantics,binding,principle_A_c_command,True,True,False,False,63,-64.9679183959961,-67.64911651611328,1
These doctors that didn't flee from Michael visited themselves.,These doctors that didn't flee from Michael visited himself.,syntax_semantics,binding,principle_A_c_command,True,True,False,False,64,-63.07670593261719,-64.40367126464844,1
Some guy who is visiting some lakes cares for himself.,Some guy who is visiting some lakes cares for themselves.,syntax_semantics,binding,principle_A_c_command,True,True,False,False,65,-61.75014877319336,-60.96980667114258,0
Those students that looked like this print fired themselves.,Those students that looked like this print fired itself.,syntax_semantics,binding,principle_A_c_command,True,True,False,False,66,-58.402618408203125,-60.342308044433594,1
Some girl who researches committees boasts about herself.,Some girl who researches committees boasts about themselves.,syntax_semantics,binding,principle_A_c_command,True,True,False,False,67,-81.38166809082031,-79.47193908691406,0
All customers who would drive to every river haven't returned to themselves.,All customers who would drive to every river haven't returned to itself.,syntax_semantics,binding,principle_A_c_command,True,True,False,False,68,-72.82506561279297,-75.26986694335938,1
That dog that wasn't boring Jason scared itself.,That dog that wasn't boring Jason scared himself.,syntax_semantics,binding,principle_A_c_command,True,True,False,False,69,-65.31224060058594,-64.0828628540039,0
That woman that hated Scott hadn't talked about herself.,That woman that hated Scott hadn't talked about himself.,syntax_semantics,binding,principle_A_c_command,True,True,False,False,70,-65.55773162841797,-64.06502532958984,0
Some women that would approach Pamela had cured themselves.,Some women that would approach Pamela had cured herself.,syntax_semantics,binding,principle_A_c_command,True,True,False,False,71,-65.9325180053711,-69.64106750488281,1
This committee that is referencing Gina works with itself.,This committee that is referencing Gina works with herself.,syntax_semantics,binding,principle_A_c_command,True,True,False,False,72,-69.21807861328125,-68.96232604980469,0
The rabbits that won't look like a painting disturbed themselves.,The rabbits that won't look like a painting disturbed itself.,syntax_semantics,binding,principle_A_c_command,True,True,False,False,73,-67.22789764404297,-66.50408172607422,0
A lot of boys who hadn't appreciated some river were working with themselves.,A lot of boys who hadn't appreciated some river were working with itself.,syntax_semantics,binding,principle_A_c_command,True,True,False,False,74,-92.73849487304688,-96.65251159667969,1
The river that impressed Cindy is impressing itself.,The river that impressed Cindy is impressing herself.,syntax_semantics,binding,principle_A_c_command,True,True,False,False,75,-69.16724395751953,-69.79463195800781,1
Most children who astounded Larry have seen themselves.,Most children who astounded Larry have seen himself.,syntax_semantics,binding,principle_A_c_command,True,True,False,False,76,-65.25688171386719,-66.40495300292969,1
Customers who love Russell had investigated themselves.,Customers who love Russell had investigated himself.,syntax_semantics,binding,principle_A_c_command,True,True,False,False,77,-54.141517639160156,-55.78887939453125,1
Some company that discussed James discusses itself.,Some company that discussed James discusses himself.,syntax_semantics,binding,principle_A_c_command,True,True,False,False,78,-56.43361282348633,-56.01611328125,0
That couch that shouldn't aggravate all women was annoying itself.,That couch that shouldn't aggravate all women was annoying themselves.,syntax_semantics,binding,principle_A_c_command,True,True,False,False,79,-86.80364227294922,-85.10231018066406,0
Wheelbarrows that shocked the company distracted themselves.,Wheelbarrows that shocked the company distracted itself.,syntax_semantics,binding,principle_A_c_command,True,True,False,False,80,-70.32044219970703,-71.0404052734375,1
These shoes that irritate Omar hurt themselves.,These shoes that irritate Omar hurt himself.,syntax_semantics,binding,principle_A_c_command,True,True,False,False,81,-63.45882034301758,-66.30638122558594,1
An association that conceals Laurie insulted itself.,An association that conceals Laurie insulted herself.,syntax_semantics,binding,principle_A_c_command,True,True,False,False,82,-77.62893676757812,-78.22781372070312,1
That fish that astounded this actress hadn't scared itself.,That fish that astounded this actress hadn't scared herself.,syntax_semantics,binding,principle_A_c_command,True,True,False,False,83,-85.70578002929688,-86.43474578857422,1
That lady that was examining the movies remembers herself.,That lady that was examining the movies remembers themselves.,syntax_semantics,binding,principle_A_c_command,True,True,False,False,84,-59.10565185546875,-57.61876678466797,0
Most waitresses that couldn't think about some vase had disliked themselves.,Most waitresses that couldn't think about some vase had disliked itself.,syntax_semantics,binding,principle_A_c_command,True,True,False,False,85,-98.91177368164062,-99.81916809082031,1
Most boys who have confused Kristin hadn't concealed themselves.,Most boys who have confused Kristin hadn't concealed herself.,syntax_semantics,binding,principle_A_c_command,True,True,False,False,86,-80.60354614257812,-83.9111328125,1
Most doctors that are running around this library did love themselves.,Most doctors that are running around this library did love itself.,syntax_semantics,binding,principle_A_c_command,True,True,False,False,87,-64.69970703125,-67.94841766357422,1
The adults that scared Mary are approaching themselves.,The adults that scared Mary are approaching herself.,syntax_semantics,binding,principle_A_c_command,True,True,False,False,88,-57.649803161621094,-60.59619903564453,1
The customers who distracts the guy would investigate themselves.,The customers who distracts the guy would investigate himself.,syntax_semantics,binding,principle_A_c_command,True,True,False,False,89,-70.31234741210938,-70.71583557128906,1
Most cars that astound Catherine irritated themselves.,Most cars that astound Catherine irritated herself.,syntax_semantics,binding,principle_A_c_command,True,True,False,False,90,-63.92906188964844,-67.95997619628906,1
The woman who loves Theodore notices herself.,The woman who loves Theodore notices himself.,syntax_semantics,binding,principle_A_c_command,True,True,False,False,91,-52.55879211425781,-51.62055969238281,0
Most women that passed the hill won't conceal themselves.,Most women that passed the hill won't conceal itself.,syntax_semantics,binding,principle_A_c_command,True,True,False,False,92,-62.40373229980469,-64.8388442993164,1
A girl that is fleeing from Derek wasn't discovering herself.,A girl that is fleeing from Derek wasn't discovering himself.,syntax_semantics,binding,principle_A_c_command,True,True,False,False,93,-88.90287017822266,-87.5129165649414,0
Some children who leave Erin are observing themselves.,Some children who leave Erin are observing herself.,syntax_semantics,binding,principle_A_c_command,True,True,False,False,94,-58.662025451660156,-61.66877365112305,1
Most waitresses that praised Ruth aren't appreciating themselves.,Most waitresses that praised Ruth aren't appreciating herself.,syntax_semantics,binding,principle_A_c_command,True,True,False,False,95,-91.6029052734375,-93.74434661865234,1
Some legislatures that haven't argued about Jeffrey worked with themselves.,Some legislatures that haven't argued about Jeffrey worked with himself.,syntax_semantics,binding,principle_A_c_command,True,True,False,False,96,-76.81256103515625,-78.51203918457031,1
The organization that has disliked many books insults itself.,The organization that has disliked many books insults themselves.,syntax_semantics,binding,principle_A_c_command,True,True,False,False,97,-70.61212921142578,-69.72880554199219,0
Those fish that are embarrassing Catherine aren't disgusting themselves.,Those fish that are embarrassing Catherine aren't disgusting herself.,syntax_semantics,binding,principle_A_c_command,True,True,False,False,98,-63.47939682006836,-66.78163146972656,1
This girl who boasted about some book could hate herself.,This girl who boasted about some book could hate itself.,syntax_semantics,binding,principle_A_c_command,True,True,False,False,99,-71.93888854980469,-73.03850555419922,1
A lot of banks that weren't talking to Kayla will forget themselves.,A lot of banks that weren't talking to Kayla will forget herself.,syntax_semantics,binding,principle_A_c_command,True,True,False,False,100,-93.3368148803711,-96.97550964355469,1
These committees that don't work with Frank will dislike themselves.,These committees that don't work with Frank will dislike himself.,syntax_semantics,binding,principle_A_c_command,True,True,False,False,101,-65.43084716796875,-67.57942199707031,1
An actress that wasn't boasting about Todd isn't discovering herself.,An actress that wasn't boasting about Todd isn't discovering himself.,syntax_semantics,binding,principle_A_c_command,True,True,False,False,102,-90.79678344726562,-89.46102905273438,0
Some companies that were hurting David don't criticize themselves.,Some companies that were hurting David don't criticize himself.,syntax_semantics,binding,principle_A_c_command,True,True,False,False,103,-58.15672302246094,-59.50152587890625,1
All dancers who passed the college campus can hate themselves.,All dancers who passed the college campus can hate itself.,syntax_semantics,binding,principle_A_c_command,True,True,False,False,104,-71.90547180175781,-73.75595092773438,1
All universities that aggravated Carmen shouldn't astound themselves.,All universities that aggravated Carmen shouldn't astound herself.,syntax_semantics,binding,principle_A_c_command,True,True,False,False,105,-84.3668212890625,-86.29386901855469,1
This unicycle that shouldn't hurt Suzanne will disturb itself.,This unicycle that shouldn't hurt Suzanne will disturb herself.,syntax_semantics,binding,principle_A_c_command,True,True,False,False,106,-82.57194519042969,-82.47917175292969,0
That waitress who talked about many malls observed herself.,That waitress who talked about many malls observed themselves.,syntax_semantics,binding,principle_A_c_command,True,True,False,False,107,-77.30572509765625,-75.14735412597656,0
That eggplant that astounded Douglas disturbs itself.,That eggplant that astounded Douglas disturbs himself.,syntax_semantics,binding,principle_A_c_command,True,True,False,False,108,-94.9334487915039,-95.15475463867188,1
Every girl that should bike to some hospitals had attacked herself.,Every girl that should bike to some hospitals had attacked themselves.,syntax_semantics,binding,principle_A_c_command,True,True,False,False,109,-76.1393051147461,-73.54037475585938,0
