sentence_good,sentence_bad,field,linguistics_term,UID,simple_LM_method,one_prefix_method,two_prefix_method,lexically_identical,pair_id,good_prob,bad_prob,correct
There isn't a river disappearing.,There isn't each river disappearing.,semantics,quantifiers,existential_there_quantifiers_1,True,False,False,False,735,-32.10038375854492,-40.638763427734375,1
There aren't few cups upsetting Stacey.,There aren't most cups upsetting Stacey.,semantics,quantifiers,existential_there_quantifiers_1,True,False,False,False,736,-61.832862854003906,-63.200111389160156,1
There was a pie aggravating Samuel.,There was each pie aggravating Samuel.,semantics,quantifiers,existential_there_quantifiers_1,True,False,False,False,737,-47.50934600830078,-57.38689422607422,1
There was a box distracting Tiffany.,There was each box distracting Tiffany.,semantics,quantifiers,existential_there_quantifiers_1,True,False,False,False,738,-41.409996032714844,-51.380516052246094,1
There wasn't a company looking to twist.,There wasn't every company looking to twist.,semantics,quantifiers,existential_there_quantifiers_1,True,False,False,False,739,-44.91132354736328,-52.505531311035156,1
There isn't a sweater disturbing Alexander.,There isn't every sweater disturbing Alexander.,semantics,quantifiers,existential_there_quantifiers_1,True,False,False,False,740,-45.381980895996094,-52.33580017089844,1
There is a hospital intending to argue about Nicole.,There is each hospital intending to argue about Nicole.,semantics,quantifiers,existential_there_quantifiers_1,True,False,False,False,741,-57.80064010620117,-67.49475860595703,1
There are few patients investigating who observed Meredith.,There are all patients investigating who observed Meredith.,semantics,quantifiers,existential_there_quantifiers_1,True,False,False,False,742,-65.71941375732422,-66.79574584960938,1
There are some schools annoying a doctor.,There are all schools annoying a doctor.,semantics,quantifiers,existential_there_quantifiers_1,True,False,False,False,743,-40.33012390136719,-43.5369873046875,1
There wasn't a popsicle evaporating.,There wasn't every popsicle evaporating.,semantics,quantifiers,existential_there_quantifiers_1,True,False,False,False,744,-52.381553649902344,-60.332130432128906,1
There isn't a door boring every actress.,There isn't each door boring every actress.,semantics,quantifiers,existential_there_quantifiers_1,True,False,False,False,745,-47.86003875732422,-53.5272216796875,1
There isn't a sketch aggravating Monica.,There isn't every sketch aggravating Monica.,semantics,quantifiers,existential_there_quantifiers_1,True,False,False,False,746,-52.00817108154297,-58.969356536865234,1
There was a library prompting that legislature to donate.,There was each library prompting that legislature to donate.,semantics,quantifiers,existential_there_quantifiers_1,True,False,False,False,747,-68.36376953125,-76.55864715576172,1
There isn't a screen stunning Brad.,There isn't every screen stunning Brad.,semantics,quantifiers,existential_there_quantifiers_1,True,False,False,False,748,-47.773475646972656,-54.97121810913086,1
There wasn't a legislature arguing.,There wasn't every legislature arguing.,semantics,quantifiers,existential_there_quantifiers_1,True,False,False,False,749,-35.13153076171875,-41.76110076904297,1
There were many icicles aggravating most doctors.,There were all icicles aggravating most doctors.,semantics,quantifiers,existential_there_quantifiers_1,True,False,False,False,750,-61.617469787597656,-64.53121948242188,1
There isn't a story about current events shocking cashiers.,There isn't every story about current events shocking cashiers.,semantics,quantifiers,existential_there_quantifiers_1,True,False,False,False,751,-70.67403411865234,-78.17408752441406,1
There were many cups disturbing Ella.,There were most cups disturbing Ella.,semantics,quantifiers,existential_there_quantifiers_1,True,False,False,False,752,-48.23311996459961,-51.13304138183594,1
There were no turtles looking like most paintings.,There were most turtles looking like most paintings.,semantics,quantifiers,existential_there_quantifiers_1,True,False,False,False,753,-52.473140716552734,-53.59291076660156,1
There were no teachers departing.,There were most teachers departing.,semantics,quantifiers,existential_there_quantifiers_1,True,False,False,False,754,-36.02159881591797,-38.19340515136719,1
There wasn't a child slumping over.,There wasn't each child slumping over.,semantics,quantifiers,existential_there_quantifiers_1,True,False,False,False,755,-44.292755126953125,-53.358909606933594,1
There isn't a banana going bad.,There isn't each banana going bad.,semantics,quantifiers,existential_there_quantifiers_1,True,False,False,False,756,-37.101051330566406,-46.086883544921875,1
There wasn't a print of the horses looking like many drawings.,There wasn't each print of the horses looking like many drawings.,semantics,quantifiers,existential_there_quantifiers_1,True,False,False,False,757,-69.84403228759766,-77.31564331054688,1
There are no commentaries about the Impressionists annoying every guy.,There are most commentaries about the Impressionists annoying every guy.,semantics,quantifiers,existential_there_quantifiers_1,True,False,False,False,758,-91.9920654296875,-97.38916778564453,1
There weren't many associations encouraging Pamela to love Chad.,There weren't all associations encouraging Pamela to love Chad.,semantics,quantifiers,existential_there_quantifiers_1,True,False,False,False,759,-78.43705749511719,-81.76390075683594,1
There were many skateboards disturbing Sonia.,There were all skateboards disturbing Sonia.,semantics,quantifiers,existential_there_quantifiers_1,True,False,False,False,760,-61.825721740722656,-62.45974349975586,1
There is a drawing of every rug astounding Larry.,There is every drawing of every rug astounding Larry.,semantics,quantifiers,existential_there_quantifiers_1,True,False,False,False,761,-70.1030044555664,-77.22726440429688,1
There is a picture alarming Brad.,There is each picture alarming Brad.,semantics,quantifiers,existential_there_quantifiers_1,True,False,False,False,762,-47.1954345703125,-57.617408752441406,1
There are few drawings impressing Laurie.,There are all drawings impressing Laurie.,semantics,quantifiers,existential_there_quantifiers_1,True,False,False,False,763,-53.927223205566406,-53.46672821044922,0
There isn't a patient neglecting to leave Caroline.,There isn't each patient neglecting to leave Caroline.,semantics,quantifiers,existential_there_quantifiers_1,True,False,False,False,764,-60.60057067871094,-67.45246887207031,1
There wasn't a hamster boring some waitress.,There wasn't every hamster boring some waitress.,semantics,quantifiers,existential_there_quantifiers_1,True,False,False,False,765,-60.59832000732422,-67.96212005615234,1
There were no reports about current events aggravating Christopher.,There were most reports about current events aggravating Christopher.,semantics,quantifiers,existential_there_quantifiers_1,True,False,False,False,766,-70.60147094726562,-72.53182983398438,1
There are some plates disappearing.,There are most plates disappearing.,semantics,quantifiers,existential_there_quantifiers_1,True,False,False,False,767,-30.597129821777344,-34.13053894042969,1
There were many convertibles aggravating that waiter.,There were most convertibles aggravating that waiter.,semantics,quantifiers,existential_there_quantifiers_1,True,False,False,False,768,-70.79010009765625,-72.42027282714844,1
There is a doctor yearning to like some muffin.,There is every doctor yearning to like some muffin.,semantics,quantifiers,existential_there_quantifiers_1,True,False,False,False,769,-68.0300064086914,-76.80772399902344,1
There weren't many bicycles upsetting the cashiers.,There weren't all bicycles upsetting the cashiers.,semantics,quantifiers,existential_there_quantifiers_1,True,False,False,False,770,-60.55727005004883,-62.647525787353516,1
There are no students getting a job.,There are most students getting a job.,semantics,quantifiers,existential_there_quantifiers_1,True,False,False,False,771,-31.051271438598633,-34.21843719482422,1
There was a plane worrying Martin.,There was each plane worrying Martin.,semantics,quantifiers,existential_there_quantifiers_1,True,False,False,False,772,-43.49964141845703,-54.68035888671875,1
There was a window wasting away.,There was each window wasting away.,semantics,quantifiers,existential_there_quantifiers_1,True,False,False,False,773,-36.38890838623047,-46.96977615356445,1
There isn't an art gallery impressing some customer.,There isn't each art gallery impressing some customer.,semantics,quantifiers,existential_there_quantifiers_1,True,False,False,False,774,-67.94541931152344,-76.81065368652344,1
There aren't few cakes bothering Victoria.,There aren't most cakes bothering Victoria.,semantics,quantifiers,existential_there_quantifiers_1,True,False,False,False,775,-48.88227844238281,-49.995765686035156,1
There were no teachers talking about newspaper articles.,There were all teachers talking about newspaper articles.,semantics,quantifiers,existential_there_quantifiers_1,True,False,False,False,776,-46.287410736083984,-46.69910430908203,1
There were no casseroles burning.,There were most casseroles burning.,semantics,quantifiers,existential_there_quantifiers_1,True,False,False,False,777,-49.41355514526367,-50.71165466308594,1
There are no stories about art winning.,There are all stories about art winning.,semantics,quantifiers,existential_there_quantifiers_1,True,False,False,False,778,-39.06703186035156,-40.55929946899414,1
There wasn't a mouth disturbing Omar.,There wasn't every mouth disturbing Omar.,semantics,quantifiers,existential_there_quantifiers_1,True,False,False,False,779,-49.610809326171875,-58.20412826538086,1
There is a child firing Leslie.,There is each child firing Leslie.,semantics,quantifiers,existential_there_quantifiers_1,True,False,False,False,780,-38.73209762573242,-48.186214447021484,1
There were some libraries admiring William.,There were all libraries admiring William.,semantics,quantifiers,existential_there_quantifiers_1,True,False,False,False,781,-58.6978645324707,-61.180145263671875,1
There isn't a government boasting about all doctors.,There isn't every government boasting about all doctors.,semantics,quantifiers,existential_there_quantifiers_1,True,False,False,False,782,-54.756004333496094,-61.84782028198242,1
There are few organizations changing.,There are most organizations changing.,semantics,quantifiers,existential_there_quantifiers_1,True,False,False,False,783,-28.64838409423828,-30.460521697998047,1
There is a couch cracking.,There is each couch cracking.,semantics,quantifiers,existential_there_quantifiers_1,True,False,False,False,784,-30.849821090698242,-39.98689651489258,1
There are no companies buying some paintings.,There are all companies buying some paintings.,semantics,quantifiers,existential_there_quantifiers_1,True,False,False,False,785,-40.63454055786133,-40.83536148071289,1
There wasn't a lamp appearing.,There wasn't every lamp appearing.,semantics,quantifiers,existential_there_quantifiers_1,True,False,False,False,786,-33.80867385864258,-41.74530792236328,1
There are no shirts stunning Chad.,There are all shirts stunning Chad.,semantics,quantifiers,existential_there_quantifiers_1,True,False,False,False,787,-45.92144012451172,-47.49236297607422,1
There isn't a story bothering Alexander.,There isn't each story bothering Alexander.,semantics,quantifiers,existential_there_quantifiers_1,True,False,False,False,788,-40.54558563232422,-49.339176177978516,1
There wasn't a rug upsetting Wayne.,There wasn't each rug upsetting Wayne.,semantics,quantifiers,existential_there_quantifiers_1,True,False,False,False,789,-47.204307556152344,-56.28840255737305,1
There wasn't a photograph irritating most actresses.,There wasn't every photograph irritating most actresses.,semantics,quantifiers,existential_there_quantifiers_1,True,False,False,False,790,-52.243892669677734,-59.02777862548828,1
There are no organizations figuring out who will find out who has laughed.,There are most organizations figuring out who will find out who has laughed.,semantics,quantifiers,existential_there_quantifiers_1,True,False,False,False,791,-73.67789459228516,-75.99458312988281,1
There isn't a book vanishing.,There isn't every book vanishing.,semantics,quantifiers,existential_there_quantifiers_1,True,False,False,False,792,-31.519329071044922,-39.13323211669922,1
There weren't few paintings upsetting Omar.,There weren't most paintings upsetting Omar.,semantics,quantifiers,existential_there_quantifiers_1,True,False,False,False,793,-54.7205924987793,-55.566322326660156,1
There isn't a river impressing Anna.,There isn't every river impressing Anna.,semantics,quantifiers,existential_there_quantifiers_1,True,False,False,False,794,-50.89253234863281,-58.73057556152344,1
There is a plate tipping over.,There is every plate tipping over.,semantics,quantifiers,existential_there_quantifiers_1,True,False,False,False,795,-38.41624450683594,-46.573089599609375,1
There were some mothers of Nicole wearing the blouse.,There were all mothers of Nicole wearing the blouse.,semantics,quantifiers,existential_there_quantifiers_1,True,False,False,False,796,-62.06671142578125,-65.8519058227539,1
There is a niece of Andrea leaving.,There is each niece of Andrea leaving.,semantics,quantifiers,existential_there_quantifiers_1,True,False,False,False,797,-45.113121032714844,-54.40022277832031,1
There are some doors upsetting Alice.,There are all doors upsetting Alice.,semantics,quantifiers,existential_there_quantifiers_1,True,False,False,False,798,-42.62310791015625,-45.16065979003906,1
There is a woman attacking Sabrina.,There is every woman attacking Sabrina.,semantics,quantifiers,existential_there_quantifiers_1,True,False,False,False,799,-48.39412307739258,-56.88215637207031,1
There aren't few couches irritating the libraries.,There aren't all couches irritating the libraries.,semantics,quantifiers,existential_there_quantifiers_1,True,False,False,False,800,-62.944007873535156,-61.72970962524414,0
There is a book stunning Theresa.,There is every book stunning Theresa.,semantics,quantifiers,existential_there_quantifiers_1,True,False,False,False,801,-39.48267364501953,-47.43136978149414,1
There were no grandsons of April appearing to scratch.,There were all grandsons of April appearing to scratch.,semantics,quantifiers,existential_there_quantifiers_1,True,False,False,False,802,-76.74000549316406,-78.04620361328125,1
There were no guys waving.,There were most guys waving.,semantics,quantifiers,existential_there_quantifiers_1,True,False,False,False,803,-34.03227233886719,-36.206878662109375,1
There wasn't a carriage falling apart.,There wasn't each carriage falling apart.,semantics,quantifiers,existential_there_quantifiers_1,True,False,False,False,804,-38.06806564331055,-47.22026824951172,1
There are some daughters of Lucille forgetting who has visited Samantha.,There are all daughters of Lucille forgetting who has visited Samantha.,semantics,quantifiers,existential_there_quantifiers_1,True,False,False,False,805,-83.81150817871094,-87.55426025390625,1
There wasn't a story disagreeing.,There wasn't each story disagreeing.,semantics,quantifiers,existential_there_quantifiers_1,True,False,False,False,806,-37.02234649658203,-44.6659049987793,1
There was a waiter walking through a mountain.,There was each waiter walking through a mountain.,semantics,quantifiers,existential_there_quantifiers_1,True,False,False,False,807,-41.32217025756836,-51.74713897705078,1
There is a shirt flattening.,There is every shirt flattening.,semantics,quantifiers,existential_there_quantifiers_1,True,False,False,False,808,-39.712547302246094,-48.903499603271484,1
There are many children managing to walk through a public park.,There are all children managing to walk through a public park.,semantics,quantifiers,existential_there_quantifiers_1,True,False,False,False,809,-59.300498962402344,-62.62109375,1
There are no computers cracking.,There are most computers cracking.,semantics,quantifiers,existential_there_quantifiers_1,True,False,False,False,810,-30.75234031677246,-32.46185302734375,1
There aren't many movie theaters boring Ruth.,There aren't all movie theaters boring Ruth.,semantics,quantifiers,existential_there_quantifiers_1,True,False,False,False,811,-57.71715545654297,-62.62128829956055,1
There were no mothers of Dennis scanning all documentaries.,There were all mothers of Dennis scanning all documentaries.,semantics,quantifiers,existential_there_quantifiers_1,True,False,False,False,812,-74.64730834960938,-75.08870697021484,1
There are many shawls scaring Gina.,There are most shawls scaring Gina.,semantics,quantifiers,existential_there_quantifiers_1,True,False,False,False,813,-60.44343566894531,-62.955055236816406,1
There is a scarf flattening.,There is every scarf flattening.,semantics,quantifiers,existential_there_quantifiers_1,True,False,False,False,814,-41.72279739379883,-50.06772232055664,1
There were no slopes impressing Kristen.,There were most slopes impressing Kristen.,semantics,quantifiers,existential_there_quantifiers_1,True,False,False,False,815,-60.09483337402344,-60.60742950439453,1
There were no drivers advising Harvard University to change.,There were all drivers advising Harvard University to change.,semantics,quantifiers,existential_there_quantifiers_1,True,False,False,False,816,-68.60076141357422,-69.5695571899414,1
There wasn't a dancer talking.,There wasn't each dancer talking.,semantics,quantifiers,existential_there_quantifiers_1,True,False,False,False,817,-28.826379776000977,-38.9317626953125,1
There are some cars disappearing.,There are all cars disappearing.,semantics,quantifiers,existential_there_quantifiers_1,True,False,False,False,818,-27.274919509887695,-30.828533172607422,1
There wasn't a mouth looking like the photograph.,There wasn't every mouth looking like the photograph.,semantics,quantifiers,existential_there_quantifiers_1,True,False,False,False,819,-47.539241790771484,-56.10529327392578,1
There were no scarves distracting Samantha.,There were most scarves distracting Samantha.,semantics,quantifiers,existential_there_quantifiers_1,True,False,False,False,820,-56.27869415283203,-57.99833297729492,1
There are many ladies washing.,There are most ladies washing.,semantics,quantifiers,existential_there_quantifiers_1,True,False,False,False,821,-31.066497802734375,-34.50579071044922,1
There are many malls existing.,There are all malls existing.,semantics,quantifiers,existential_there_quantifiers_1,True,False,False,False,822,-34.10442352294922,-38.38581848144531,1
There was a movie disagreeing.,There was each movie disagreeing.,semantics,quantifiers,existential_there_quantifiers_1,True,False,False,False,823,-30.852718353271484,-40.35778045654297,1
There were few sketches disgusting most guests.,There were most sketches disgusting most guests.,semantics,quantifiers,existential_there_quantifiers_1,True,False,False,False,824,-56.44021987915039,-57.00177764892578,1
There was a sock twirling.,There was every sock twirling.,semantics,quantifiers,existential_there_quantifiers_1,True,False,False,False,825,-37.41032791137695,-46.199005126953125,1
There are no sketches of Brian disturbing Samantha.,There are most sketches of Brian disturbing Samantha.,semantics,quantifiers,existential_there_quantifiers_1,True,False,False,False,826,-59.361900329589844,-63.281429290771484,1
There isn't a projector astounding guys.,There isn't every projector astounding guys.,semantics,quantifiers,existential_there_quantifiers_1,True,False,False,False,827,-48.97868347167969,-56.991355895996094,1
There weren't many eyes irritating Joel.,There weren't most eyes irritating Joel.,semantics,quantifiers,existential_there_quantifiers_1,True,False,False,False,828,-50.060604095458984,-54.096923828125,1
There are some sweaters impressing Elaine.,There are most sweaters impressing Elaine.,semantics,quantifiers,existential_there_quantifiers_1,True,False,False,False,829,-55.02287292480469,-58.59776306152344,1
There wasn't a movie confusing Nicole.,There wasn't every movie confusing Nicole.,semantics,quantifiers,existential_there_quantifiers_1,True,False,False,False,830,-42.74079132080078,-50.610374450683594,1
There are no hills appearing.,There are all hills appearing.,semantics,quantifiers,existential_there_quantifiers_1,True,False,False,False,831,-31.707294464111328,-30.95477867126465,0
There wasn't a girl researching associations.,There wasn't each girl researching associations.,semantics,quantifiers,existential_there_quantifiers_1,True,False,False,False,832,-44.803916931152344,-53.81562423706055,1
There were many fathers of Alice liking to divorce.,There were all fathers of Alice liking to divorce.,semantics,quantifiers,existential_there_quantifiers_1,True,False,False,False,833,-62.86455154418945,-64.65180206298828,1
There is a plate cracking.,There is every plate cracking.,semantics,quantifiers,existential_there_quantifiers_1,True,False,False,False,834,-28.087421417236328,-36.663536071777344,1
There are many movie theaters worrying a lot of students.,There are most movie theaters worrying a lot of students.,semantics,quantifiers,existential_there_quantifiers_1,True,False,False,False,835,-56.48353576660156,-60.624507904052734,1
There were some dogs coming here.,There were most dogs coming here.,semantics,quantifiers,existential_there_quantifiers_1,True,False,False,False,836,-28.225475311279297,-32.377376556396484,1
There were some adults boasting about Gina.,There were all adults boasting about Gina.,semantics,quantifiers,existential_there_quantifiers_1,True,False,False,False,837,-53.075279235839844,-56.64473342895508,1
There are few cars looking like the prints.,There are all cars looking like the prints.,semantics,quantifiers,existential_there_quantifiers_1,True,False,False,False,838,-42.930633544921875,-44.239864349365234,1
There were few commentaries alarming the Clintons.,There were all commentaries alarming the Clintons.,semantics,quantifiers,existential_there_quantifiers_1,True,False,False,False,839,-73.90009307861328,-74.20451354980469,1
There weren't many books scaring schools.,There weren't all books scaring schools.,semantics,quantifiers,existential_there_quantifiers_1,True,False,False,False,840,-42.71424102783203,-47.048301696777344,1
There is a skateboard bothering Timothy.,There is each skateboard bothering Timothy.,semantics,quantifiers,existential_there_quantifiers_1,True,False,False,False,841,-50.602386474609375,-60.08598327636719,1
There wasn't a computer worrying Carla.,There wasn't every computer worrying Carla.,semantics,quantifiers,existential_there_quantifiers_1,True,False,False,False,842,-48.11538314819336,-56.342437744140625,1
There was a popsicle distracting a lot of legislatures.,There was every popsicle distracting a lot of legislatures.,semantics,quantifiers,existential_there_quantifiers_1,True,False,False,False,843,-65.3705062866211,-76.19572448730469,1
There was a rug confusing the patients.,There was every rug confusing the patients.,semantics,quantifiers,existential_there_quantifiers_1,True,False,False,False,844,-47.446571350097656,-54.68722915649414,1
There is a shawl alarming Carlos.,There is each shawl alarming Carlos.,semantics,quantifiers,existential_there_quantifiers_1,True,False,False,False,845,-58.61925506591797,-69.76063537597656,1
There weren't few mushrooms ripening.,There weren't all mushrooms ripening.,semantics,quantifiers,existential_there_quantifiers_1,True,False,False,False,846,-53.09426498413086,-53.50084686279297,1
There wasn't a sock falling.,There wasn't every sock falling.,semantics,quantifiers,existential_there_quantifiers_1,True,False,False,False,847,-34.41529846191406,-42.79771423339844,1
There wasn't a turtle breaking some car.,There wasn't each turtle breaking some car.,semantics,quantifiers,existential_there_quantifiers_1,True,False,False,False,848,-46.738311767578125,-55.58990478515625,1
There aren't few tomatoes charring.,There aren't all tomatoes charring.,semantics,quantifiers,existential_there_quantifiers_1,True,False,False,False,849,-47.369911193847656,-48.179588317871094,1
There was a niece of Gary hiding away.,There was each niece of Gary hiding away.,semantics,quantifiers,existential_there_quantifiers_1,True,False,False,False,850,-50.304054260253906,-60.42217254638672,1
There aren't many hills annoying some child.,There aren't most hills annoying some child.,semantics,quantifiers,existential_there_quantifiers_1,True,False,False,False,851,-50.14344024658203,-54.071563720703125,1
There were no daughters of Wayne passing some college campus.,There were all daughters of Wayne passing some college campus.,semantics,quantifiers,existential_there_quantifiers_1,True,False,False,False,852,-66.63233947753906,-68.9251708984375,1
There was a snake leaving.,There was every snake leaving.,semantics,quantifiers,existential_there_quantifiers_1,True,False,False,False,853,-26.78105926513672,-36.863739013671875,1
There are few bicycles falling apart.,There are all bicycles falling apart.,semantics,quantifiers,existential_there_quantifiers_1,True,False,False,False,854,-38.787078857421875,-39.12480926513672,1
There wasn't a screen alarming Todd.,There wasn't every screen alarming Todd.,semantics,quantifiers,existential_there_quantifiers_1,True,False,False,False,855,-49.39945983886719,-57.34126281738281,1
There are many plays disagreeing with Nicole.,There are most plays disagreeing with Nicole.,semantics,quantifiers,existential_there_quantifiers_1,True,False,False,False,856,-53.12092971801758,-56.139137268066406,1
There isn't a movie hurting Lissa.,There isn't each movie hurting Lissa.,semantics,quantifiers,existential_there_quantifiers_1,True,False,False,False,857,-45.62561798095703,-55.23698425292969,1
