sentence_good,sentence_bad,field,linguistics_term,UID,simple_LM_method,one_prefix_method,two_prefix_method,lexically_identical,pair_id,good_prob,bad_prob,correct
Some women broke those cups.,Some women broke those cup.,morphology,determiner_noun_agreement,determiner_noun_agreement_1,True,True,False,True,511,-31.930828094482422,-32.644935607910156,1
Kristin insulted those dancers.,Kristin insulted those dancer.,morphology,determiner_noun_agreement,determiner_noun_agreement_1,True,True,False,True,512,-39.344200134277344,-39.96656036376953,1
Some sketches had looked like this girl.,Some sketches had looked like this girls.,morphology,determiner_noun_agreement,determiner_noun_agreement_1,True,True,False,True,513,-44.54022216796875,-47.44808578491211,1
Pamela hasn't biked to those libraries.,Pamela hasn't biked to those library.,morphology,determiner_noun_agreement,determiner_noun_agreement_1,True,True,False,True,514,-76.25505065917969,-73.26394653320312,0
Ellen can't exit these public parks.,Ellen can't exit these public park.,morphology,determiner_noun_agreement,determiner_noun_agreement_1,True,True,False,True,515,-48.16121292114258,-49.45238494873047,1
Ruth noticed those newspaper articles.,Ruth noticed those newspaper article.,morphology,determiner_noun_agreement,determiner_noun_agreement_1,True,True,False,True,516,-53.52307891845703,-53.53013610839844,1
Most doctors leave these doctors.,Most doctors leave these doctor.,morphology,determiner_noun_agreement,determiner_noun_agreement_1,True,True,False,True,517,-31.20699691772461,-34.7698860168457,1
Stacy has hurt this guest.,Stacy has hurt this guests.,morphology,determiner_noun_agreement,determiner_noun_agreement_1,True,True,False,True,518,-41.26571273803711,-42.02119064331055,1
Carol would admire those movie theaters.,Carol would admire those movie theater.,morphology,determiner_noun_agreement,determiner_noun_agreement_1,True,True,False,True,519,-54.730316162109375,-55.19099426269531,1
Kayla flees from these cafes.,Kayla flees from these cafe.,morphology,determiner_noun_agreement,determiner_noun_agreement_1,True,True,False,True,520,-50.11321258544922,-47.026588439941406,0
Most dancers haven't forgotten this essay.,Most dancers haven't forgotten this essays.,morphology,determiner_noun_agreement,determiner_noun_agreement_1,True,True,False,True,521,-47.842308044433594,-49.35284423828125,1
Customers shouldn't upset these waiters.,Customers shouldn't upset these waiter.,morphology,determiner_noun_agreement,determiner_noun_agreement_1,True,True,False,True,522,-53.447731018066406,-46.33948516845703,0
Wendy appreciates those pamphlets.,Wendy appreciates those pamphlet.,morphology,determiner_noun_agreement,determiner_noun_agreement_1,True,True,False,True,523,-66.767578125,-59.23731994628906,0
Victoria boasted about this play.,Victoria boasted about this plays.,morphology,determiner_noun_agreement,determiner_noun_agreement_1,True,True,False,True,524,-33.68976593017578,-37.225547790527344,1
Jacqueline can't scan these essays.,Jacqueline can't scan these essay.,morphology,determiner_noun_agreement,determiner_noun_agreement_1,True,True,False,True,525,-51.99605941772461,-53.22813415527344,1
The Impressionists explore this art gallery.,The Impressionists explore this art galleries.,morphology,determiner_noun_agreement,determiner_noun_agreement_1,True,True,False,True,526,-68.54005432128906,-68.03453063964844,0
Sarah messed up that cafe.,Sarah messed up that cafes.,morphology,determiner_noun_agreement,determiner_noun_agreement_1,True,True,False,True,527,-30.783588409423828,-32.46794128417969,1
Rodney hasn't remembered this art gallery.,Rodney hasn't remembered this art galleries.,morphology,determiner_noun_agreement,determiner_noun_agreement_1,True,True,False,True,528,-54.5323486328125,-54.446807861328125,0
Raymond kissed that guy.,Raymond kissed that guys.,morphology,determiner_noun_agreement,determiner_noun_agreement_1,True,True,False,True,529,-31.48435401916504,-34.820167541503906,1
Ladies hadn't fixed these couches.,Ladies hadn't fixed these couch.,morphology,determiner_noun_agreement,determiner_noun_agreement_1,True,True,False,True,530,-53.81458282470703,-45.71543884277344,0
Guy healed that patient.,Guy healed that patients.,morphology,determiner_noun_agreement,determiner_noun_agreement_1,True,True,False,True,531,-30.64623260498047,-31.331512451171875,1
The Borgias would criticize that story.,The Borgias would criticize that stories.,morphology,determiner_noun_agreement,determiner_noun_agreement_1,True,True,False,True,532,-55.03837966918945,-57.82106018066406,1
Carrie complains about this essay.,Carrie complains about this essays.,morphology,determiner_noun_agreement,determiner_noun_agreement_1,True,True,False,True,533,-44.77764892578125,-46.476806640625,1
Steve should approach this customer.,Steve should approach this customers.,morphology,determiner_noun_agreement,determiner_noun_agreement_1,True,True,False,True,534,-34.99524688720703,-37.181739807128906,1
The patients didn't skate around those high schools.,The patients didn't skate around those high school.,morphology,determiner_noun_agreement,determiner_noun_agreement_1,True,True,False,True,535,-53.59403991699219,-50.680931091308594,0
Denise bought those prints.,Denise bought those print.,morphology,determiner_noun_agreement,determiner_noun_agreement_1,True,True,False,True,536,-31.68254280090332,-33.573028564453125,1
Susan hadn't hired these guys.,Susan hadn't hired these guy.,morphology,determiner_noun_agreement,determiner_noun_agreement_1,True,True,False,True,537,-33.91412353515625,-37.29999542236328,1
That mushroom is annoying these cashiers.,That mushroom is annoying these cashier.,morphology,determiner_noun_agreement,determiner_noun_agreement_1,True,True,False,True,538,-56.88221740722656,-55.95642852783203,0
Randolf did examine that pamphlet.,Randolf did examine that pamphlets.,morphology,determiner_noun_agreement,determiner_noun_agreement_1,True,True,False,True,539,-49.920188903808594,-55.91067123413086,1
Ellen cared for that teacher.,Ellen cared for that teachers.,morphology,determiner_noun_agreement,determiner_noun_agreement_1,True,True,False,True,540,-34.827327728271484,-36.33681106567383,1
Maria astounded this dancer.,Maria astounded this dancers.,morphology,determiner_noun_agreement,determiner_noun_agreement_1,True,True,False,True,541,-36.95429229736328,-40.617332458496094,1
Holly approaches that pedestrian.,Holly approaches that pedestrians.,morphology,determiner_noun_agreement,determiner_noun_agreement_1,True,True,False,True,542,-43.177879333496094,-42.51478576660156,0
Many waiters investigate these schools.,Many waiters investigate these school.,morphology,determiner_noun_agreement,determiner_noun_agreement_1,True,True,False,True,543,-46.660186767578125,-49.94472122192383,1
Most men explored that school.,Most men explored that schools.,morphology,determiner_noun_agreement,determiner_noun_agreement_1,True,True,False,True,544,-37.269775390625,-38.40365219116211,1
Ellen wasn't observing these customers.,Ellen wasn't observing these customer.,morphology,determiner_noun_agreement,determiner_noun_agreement_1,True,True,False,True,545,-47.015830993652344,-49.66567611694336,1
Chad isn't concealing those adults.,Chad isn't concealing those adult.,morphology,determiner_noun_agreement,determiner_noun_agreement_1,True,True,False,True,546,-57.96691131591797,-61.589637756347656,1
Those guests bike to this school.,Those guests bike to this schools.,morphology,determiner_noun_agreement,determiner_noun_agreement_1,True,True,False,True,547,-40.666542053222656,-43.02586364746094,1
Most adults hurt these teachers.,Most adults hurt these teacher.,morphology,determiner_noun_agreement,determiner_noun_agreement_1,True,True,False,True,548,-35.11170959472656,-37.874755859375,1
Paula was listening to those drivers.,Paula was listening to those driver.,morphology,determiner_noun_agreement,determiner_noun_agreement_1,True,True,False,True,549,-37.02388000488281,-38.3969841003418,1
Natalie wasn't researching these college campuses.,Natalie wasn't researching these college campus.,morphology,determiner_noun_agreement,determiner_noun_agreement_1,True,True,False,True,550,-57.353614807128906,-57.877349853515625,1
Gregory is attacking this doctor.,Gregory is attacking this doctors.,morphology,determiner_noun_agreement,determiner_noun_agreement_1,True,True,False,True,551,-34.62767791748047,-36.41000747680664,1
Stacy was watching these teachers.,Stacy was watching these teacher.,morphology,determiner_noun_agreement,determiner_noun_agreement_1,True,True,False,True,552,-35.89104461669922,-38.3616828918457,1
Holly wasn't exploring those art galleries.,Holly wasn't exploring those art gallery.,morphology,determiner_noun_agreement,determiner_noun_agreement_1,True,True,False,True,553,-57.24549865722656,-58.51003646850586,1
The Impressionists helped those teenagers.,The Impressionists helped those teenager.,morphology,determiner_noun_agreement,determiner_noun_agreement_1,True,True,False,True,554,-53.327205657958984,-57.571434020996094,1
These universities stunned this association.,These universities stunned this associations.,morphology,determiner_noun_agreement,determiner_noun_agreement_1,True,True,False,True,555,-42.70616912841797,-44.52484893798828,1
All actors know those waitresses.,All actors know those waitress.,morphology,determiner_noun_agreement,determiner_noun_agreement_1,True,True,False,True,556,-47.48394775390625,-39.69615936279297,0
Every woman boycotted those high schools.,Every woman boycotted those high school.,morphology,determiner_noun_agreement,determiner_noun_agreement_1,True,True,False,True,557,-57.09166717529297,-54.06700897216797,0
Nancy cleans this cup.,Nancy cleans this cups.,morphology,determiner_noun_agreement,determiner_noun_agreement_1,True,True,False,True,558,-37.502098083496094,-39.303131103515625,1
Julia is healing these snakes.,Julia is healing these snake.,morphology,determiner_noun_agreement,determiner_noun_agreement_1,True,True,False,True,559,-40.93090057373047,-43.64875793457031,1
Some guys are disagreeing with these essays.,Some guys are disagreeing with these essay.,morphology,determiner_noun_agreement,determiner_noun_agreement_1,True,True,False,True,560,-50.245086669921875,-51.53417205810547,1
These doctors scan this pamphlet.,These doctors scan this pamphlets.,morphology,determiner_noun_agreement,determiner_noun_agreement_1,True,True,False,True,561,-42.52824783325195,-48.968040466308594,1
Walter wasn't talking about those children.,Walter wasn't talking about those child.,morphology,determiner_noun_agreement,determiner_noun_agreement_1,True,True,False,True,562,-30.428775787353516,-33.19197082519531,1
Stephen knew that adult.,Stephen knew that adults.,morphology,determiner_noun_agreement,determiner_noun_agreement_1,True,True,False,True,563,-26.47951889038086,-25.393945693969727,0
This patient was concealing that senator.,This patient was concealing that senators.,morphology,determiner_noun_agreement,determiner_noun_agreement_1,True,True,False,True,564,-56.9755973815918,-59.8941764831543,1
That organization bores those pedestrians.,That organization bores those pedestrian.,morphology,determiner_noun_agreement,determiner_noun_agreement_1,True,True,False,True,565,-57.30867004394531,-58.49365234375,1
Daniel tours this library.,Daniel tours this libraries.,morphology,determiner_noun_agreement,determiner_noun_agreement_1,True,True,False,True,566,-28.76127815246582,-33.556976318359375,1
Patricia runs around these movie theaters.,Patricia runs around these movie theater.,morphology,determiner_noun_agreement,determiner_noun_agreement_1,True,True,False,True,567,-49.88801956176758,-49.29572677612305,0
Dawn alarmed that driver.,Dawn alarmed that drivers.,morphology,determiner_noun_agreement,determiner_noun_agreement_1,True,True,False,True,568,-47.67494583129883,-47.663719177246094,0
All jackets embarrass this teacher.,All jackets embarrass this teachers.,morphology,determiner_noun_agreement,determiner_noun_agreement_1,True,True,False,True,569,-44.78842544555664,-44.437828063964844,0
Natalie will examine those reports.,Natalie will examine those report.,morphology,determiner_noun_agreement,determiner_noun_agreement_1,True,True,False,True,570,-38.455299377441406,-40.17415237426758,1
James was lifting that cup.,James was lifting that cups.,morphology,determiner_noun_agreement,determiner_noun_agreement_1,True,True,False,True,571,-32.30498123168945,-33.597877502441406,1
Scott healed this driver.,Scott healed this drivers.,morphology,determiner_noun_agreement,determiner_noun_agreement_1,True,True,False,True,572,-32.9300651550293,-32.67404556274414,0
Suzanne has hugged that patient.,Suzanne has hugged that patients.,morphology,determiner_noun_agreement,determiner_noun_agreement_1,True,True,False,True,573,-45.94119644165039,-46.85619354248047,1
Erin wasn't listening to those teachers.,Erin wasn't listening to those teacher.,morphology,determiner_noun_agreement,determiner_noun_agreement_1,True,True,False,True,574,-38.64091491699219,-40.482757568359375,1
Jason should investigate these boys.,Jason should investigate these boy.,morphology,determiner_noun_agreement,determiner_noun_agreement_1,True,True,False,True,575,-33.41807556152344,-37.40687561035156,1
Jane could work with this guy.,Jane could work with this guys.,morphology,determiner_noun_agreement,determiner_noun_agreement_1,True,True,False,True,576,-29.261423110961914,-30.5509033203125,1
Omar toured that public park.,Omar toured that public parks.,morphology,determiner_noun_agreement,determiner_noun_agreement_1,True,True,False,True,577,-46.393348693847656,-46.44816207885742,1
Carts bothered these waitresses.,Carts bothered these waitress.,morphology,determiner_noun_agreement,determiner_noun_agreement_1,True,True,False,True,578,-57.04350662231445,-47.86714172363281,0
Becky hid that face.,Becky hid that faces.,morphology,determiner_noun_agreement,determiner_noun_agreement_1,True,True,False,True,579,-28.550092697143555,-30.96147918701172,1
Lori isn't running around these restaurants.,Lori isn't running around these restaurant.,morphology,determiner_noun_agreement,determiner_noun_agreement_1,True,True,False,True,580,-50.045467376708984,-51.95118713378906,1
Liam hasn't healed those cats.,Liam hasn't healed those cat.,morphology,determiner_noun_agreement,determiner_noun_agreement_1,True,True,False,True,581,-49.16264724731445,-49.94540023803711,1
Suzanne is embarrassing that actress.,Suzanne is embarrassing that actresses.,morphology,determiner_noun_agreement,determiner_noun_agreement_1,True,True,False,True,582,-40.3226318359375,-41.72530746459961,1
Ronald explored those schools.,Ronald explored those school.,morphology,determiner_noun_agreement,determiner_noun_agreement_1,True,True,False,True,583,-35.015010833740234,-38.414459228515625,1
A lot of cashiers buy those jackets.,A lot of cashiers buy those jacket.,morphology,determiner_noun_agreement,determiner_noun_agreement_1,True,True,False,True,584,-62.42578125,-62.85858154296875,1
The Clintons ran around this public park.,The Clintons ran around this public parks.,morphology,determiner_noun_agreement,determiner_noun_agreement_1,True,True,False,True,585,-54.38873291015625,-55.009281158447266,1
Kirsten stunned that actor.,Kirsten stunned that actors.,morphology,determiner_noun_agreement,determiner_noun_agreement_1,True,True,False,True,586,-51.57901382446289,-53.56783676147461,1
Melissa did wear this hat.,Melissa did wear this hats.,morphology,determiner_noun_agreement,determiner_noun_agreement_1,True,True,False,True,587,-38.33312225341797,-42.73043441772461,1
Peter was observing these girls.,Peter was observing these girl.,morphology,determiner_noun_agreement,determiner_noun_agreement_1,True,True,False,True,588,-35.8026008605957,-38.727943420410156,1
Frank hadn't researched these associations.,Frank hadn't researched these association.,morphology,determiner_noun_agreement,determiner_noun_agreement_1,True,True,False,True,589,-41.837066650390625,-42.88877487182617,1
Christine heals this girl.,Christine heals this girls.,morphology,determiner_noun_agreement,determiner_noun_agreement_1,True,True,False,True,590,-38.68727493286133,-41.49863815307617,1
The Lutherans astounds these pedestrians.,The Lutherans astounds these pedestrian.,morphology,determiner_noun_agreement,determiner_noun_agreement_1,True,True,False,True,591,-69.35981750488281,-71.19229125976562,1
Regina arrived at this art gallery.,Regina arrived at this art galleries.,morphology,determiner_noun_agreement,determiner_noun_agreement_1,True,True,False,True,592,-49.72210693359375,-50.30358123779297,1
All women see this patient.,All women see this patients.,morphology,determiner_noun_agreement,determiner_noun_agreement_1,True,True,False,True,593,-31.11297607421875,-32.80235290527344,1
Those guys hadn't disagreed with this commentary.,Those guys hadn't disagreed with this commentaries.,morphology,determiner_noun_agreement,determiner_noun_agreement_1,True,True,False,True,594,-53.41119384765625,-60.5552978515625,1
Allison didn't visit those museums.,Allison didn't visit those museum.,morphology,determiner_noun_agreement,determiner_noun_agreement_1,True,True,False,True,595,-46.44342803955078,-47.19058609008789,1
Kimberley worried this museum.,Kimberley worried this museums.,morphology,determiner_noun_agreement,determiner_noun_agreement_1,True,True,False,True,596,-47.651126861572266,-51.140689849853516,1
Those forks bother these pedestrians.,Those forks bother these pedestrian.,morphology,determiner_noun_agreement,determiner_noun_agreement_1,True,True,False,True,597,-44.73529052734375,-46.38541030883789,1
Some school isn't helping these pedestrians.,Some school isn't helping these pedestrian.,morphology,determiner_noun_agreement,determiner_noun_agreement_1,True,True,False,True,598,-45.70770263671875,-47.450721740722656,1
Many patients notice this dress.,Many patients notice this dresses.,morphology,determiner_noun_agreement,determiner_noun_agreement_1,True,True,False,True,599,-38.7744026184082,-38.00873565673828,0
Most pedestrians attack this lady.,Most pedestrians attack this ladies.,morphology,determiner_noun_agreement,determiner_noun_agreement_1,True,True,False,True,600,-39.4656982421875,-42.622230529785156,1
Paula should visit those museums.,Paula should visit those museum.,morphology,determiner_noun_agreement,determiner_noun_agreement_1,True,True,False,True,601,-40.337608337402344,-40.32990264892578,0
All actresses visit this student.,All actresses visit this students.,morphology,determiner_noun_agreement,determiner_noun_agreement_1,True,True,False,True,602,-39.26540756225586,-40.70111083984375,1
Catherine drove to those banks.,Catherine drove to those bank.,morphology,determiner_noun_agreement,determiner_noun_agreement_1,True,True,False,True,603,-42.086483001708984,-41.374481201171875,0
Jessica helps these boys.,Jessica helps these boy.,morphology,determiner_noun_agreement,determiner_noun_agreement_1,True,True,False,True,604,-24.71974754333496,-28.58601951599121,1
Carrie doesn't annoy this patient.,Carrie doesn't annoy this patients.,morphology,determiner_noun_agreement,determiner_noun_agreement_1,True,True,False,True,605,-46.233062744140625,-48.00056838989258,1
James fired this patient.,James fired this patients.,morphology,determiner_noun_agreement,determiner_noun_agreement_1,True,True,False,True,606,-27.624610900878906,-28.784683227539062,1
Every movie theater aggravated those guys.,Every movie theater aggravated those guy.,morphology,determiner_noun_agreement,determiner_noun_agreement_1,True,True,False,True,607,-52.1929931640625,-55.13761520385742,1
Eric skated around that museum.,Eric skated around that museums.,morphology,determiner_noun_agreement,determiner_noun_agreement_1,True,True,False,True,608,-39.16875457763672,-43.18523406982422,1
Stacy conceals this turtle.,Stacy conceals this turtles.,morphology,determiner_noun_agreement,determiner_noun_agreement_1,True,True,False,True,609,-55.42633819580078,-55.31053924560547,0
A projector could confuse that guest.,A projector could confuse that guests.,morphology,determiner_noun_agreement,determiner_noun_agreement_1,True,True,False,True,610,-60.760860443115234,-61.256473541259766,1
Stacy doesn't leave this guy.,Stacy doesn't leave this guys.,morphology,determiner_noun_agreement,determiner_noun_agreement_1,True,True,False,True,611,-35.94234848022461,-38.05791091918945,1
Some mall wasn't disgusting those universities.,Some mall wasn't disgusting those university.,morphology,determiner_noun_agreement,determiner_noun_agreement_1,True,True,False,True,612,-53.2327766418457,-53.41876983642578,1
Julie might flee from these teachers.,Julie might flee from these teacher.,morphology,determiner_noun_agreement,determiner_noun_agreement_1,True,True,False,True,613,-46.860897064208984,-50.007362365722656,1
Jodi wasn't disgusting those girls.,Jodi wasn't disgusting those girl.,morphology,determiner_noun_agreement,determiner_noun_agreement_1,True,True,False,True,614,-51.06468200683594,-52.70742416381836,1
George isn't bringing this grocery store.,George isn't bringing this grocery stores.,morphology,determiner_noun_agreement,determiner_noun_agreement_1,True,True,False,True,615,-42.011940002441406,-43.47057342529297,1
A boy ran around this museum.,A boy ran around this museums.,morphology,determiner_noun_agreement,determiner_noun_agreement_1,True,True,False,True,616,-43.55717086791992,-49.3514518737793,1
Lori shouldn't break this dish.,Lori shouldn't break this dishs.,morphology,determiner_noun_agreement,determiner_noun_agreement_1,True,True,False,True,617,-43.38285827636719,-51.94615936279297,1
Some cakes embarrass those actresses.,Some cakes embarrass those actress.,morphology,determiner_noun_agreement,determiner_noun_agreement_1,True,True,False,True,618,-43.51496124267578,-46.07464599609375,1
Literature disturbs those universities.,Literature disturbs those university.,morphology,determiner_noun_agreement,determiner_noun_agreement_1,True,True,False,True,619,-49.44164276123047,-49.618560791015625,1
The teachers argue about those guys.,The teachers argue about those guy.,morphology,determiner_noun_agreement,determiner_noun_agreement_1,True,True,False,True,620,-31.01978302001953,-34.21896743774414,1
All pies aren't shocking these dancers.,All pies aren't shocking these dancer.,morphology,determiner_noun_agreement,determiner_noun_agreement_1,True,True,False,True,621,-50.409400939941406,-51.54566955566406,1
Some students weren't disagreeing with these adults.,Some students weren't disagreeing with these adult.,morphology,determiner_noun_agreement,determiner_noun_agreement_1,True,True,False,True,622,-51.947593688964844,-56.57587432861328,1
A woman is looking like those paintings.,A woman is looking like those painting.,morphology,determiner_noun_agreement,determiner_noun_agreement_1,True,True,False,True,623,-49.445396423339844,-49.54178237915039,1
A box alarms these actresses.,A box alarms these actress.,morphology,determiner_noun_agreement,determiner_noun_agreement_1,True,True,False,True,624,-52.47256851196289,-55.8957405090332,1
A lot of ladies can have that pamphlet.,A lot of ladies can have that pamphlets.,morphology,determiner_noun_agreement,determiner_noun_agreement_1,True,True,False,True,625,-51.91986846923828,-57.93231201171875,1
Meredith cured these guys.,Meredith cured these guy.,morphology,determiner_noun_agreement,determiner_noun_agreement_1,True,True,False,True,626,-44.181793212890625,-47.28097152709961,1
Phillip won't think about those students.,Phillip won't think about those student.,morphology,determiner_noun_agreement,determiner_noun_agreement_1,True,True,False,True,627,-38.04507827758789,-40.69021224975586,1
This hat disgusts that boy.,This hat disgusts that boys.,morphology,determiner_noun_agreement,determiner_noun_agreement_1,True,True,False,True,628,-44.532657623291016,-46.339115142822266,1
Raymond has forgotten that guy.,Raymond has forgotten that guys.,morphology,determiner_noun_agreement,determiner_noun_agreement_1,True,True,False,True,629,-34.9685173034668,-38.04685974121094,1
Erin hasn't toured these grocery stores.,Erin hasn't toured these grocery store.,morphology,determiner_noun_agreement,determiner_noun_agreement_1,True,True,False,True,630,-56.62504196166992,-58.29591751098633,1
The pies did alarm these students.,The pies did alarm these student.,morphology,determiner_noun_agreement,determiner_noun_agreement_1,True,True,False,True,631,-48.19676208496094,-50.55072021484375,1
Daniel does exit these public parks.,Daniel does exit these public park.,morphology,determiner_noun_agreement,determiner_noun_agreement_1,True,True,False,True,632,-44.79922866821289,-45.407596588134766,1
Theresa is arriving at that hospital.,Theresa is arriving at that hospitals.,morphology,determiner_noun_agreement,determiner_noun_agreement_1,True,True,False,True,633,-41.10206985473633,-43.17724609375,1
Emily hasn't exited these grocery stores.,Emily hasn't exited these grocery store.,morphology,determiner_noun_agreement,determiner_noun_agreement_1,True,True,False,True,634,-49.45125961303711,-50.945960998535156,1
Sherry is concealing these brochures.,Sherry is concealing these brochure.,morphology,determiner_noun_agreement,determiner_noun_agreement_1,True,True,False,True,635,-68.67848205566406,-71.72191619873047,1
Jeffrey does complain about those reports.,Jeffrey does complain about those report.,morphology,determiner_noun_agreement,determiner_noun_agreement_1,True,True,False,True,636,-44.6951904296875,-46.656044006347656,1
All girls see that pedestrian.,All girls see that pedestrians.,morphology,determiner_noun_agreement,determiner_noun_agreement_1,True,True,False,True,637,-35.1179313659668,-33.95229721069336,0
Those actresses approach that student.,Those actresses approach that students.,morphology,determiner_noun_agreement,determiner_noun_agreement_1,True,True,False,True,638,-37.47711944580078,-36.64518737792969,0
