sentence_good,sentence_bad,field,linguistics_term,UID,simple_LM_method,one_prefix_method,two_prefix_method,lexically_identical,pair_id,good_prob,bad_prob,correct
Some closets weren't fled from by some cashier.,Some closets weren't fled from by some face.,syntax,s-selection,animate_subject_passive,True,True,False,False,270,-75.97606658935547,-68.46395111083984,0
Some boy isn't revealed by some senators.,Some boy isn't revealed by some diagnosis.,syntax,s-selection,animate_subject_passive,True,True,False,False,271,-57.51630401611328,-53.75349426269531,0
This restaurant is driven to by some teachers.,This restaurant is driven to by some ellipses.,syntax,s-selection,animate_subject_passive,True,True,False,False,272,-47.66828155517578,-69.4632797241211,1
The cafes weren't gone to by some student.,The cafes weren't gone to by some horse.,syntax,s-selection,animate_subject_passive,True,True,False,False,273,-57.426910400390625,-59.24973678588867,1
Dana is observed by some student.,Dana is observed by some sketch.,syntax,s-selection,animate_subject_passive,True,True,False,False,274,-50.30439758300781,-54.03694152832031,1
Rhonda wasn't insulted by the guy.,Rhonda wasn't insulted by the movie.,syntax,s-selection,animate_subject_passive,True,True,False,False,275,-49.22222137451172,-46.77882766723633,0
Tiffany is attacked by the adult.,Tiffany is attacked by the fungus.,syntax,s-selection,animate_subject_passive,True,True,False,False,276,-55.77922058105469,-57.942787170410156,1
Many libraries are driven to by some adult.,Many libraries are driven to by some phenomena.,syntax,s-selection,animate_subject_passive,True,True,False,False,277,-52.92734909057617,-53.3571891784668,1
That college campus was explored by the teacher.,That college campus was explored by the media.,syntax,s-selection,animate_subject_passive,True,True,False,False,278,-57.384918212890625,-54.88775634765625,0
These casseroles were noticed by some patient.,These casseroles were noticed by some dish.,syntax,s-selection,animate_subject_passive,True,True,False,False,279,-62.89958190917969,-62.90568542480469,1
Every child wasn't remembered by some guy.,Every child wasn't remembered by some windows.,syntax,s-selection,animate_subject_passive,True,True,False,False,280,-45.00872802734375,-47.76683807373047,1
That eye was found by the teachers.,That eye was found by the commentaries.,syntax,s-selection,animate_subject_passive,True,True,False,False,281,-43.84430694580078,-54.741661071777344,1
Paula was described by the patient.,Paula was described by the bicycle.,syntax,s-selection,animate_subject_passive,True,True,False,False,282,-39.18865966796875,-40.80491638183594,1
All reports weren't scanned by the guys.,All reports weren't scanned by the photographs.,syntax,s-selection,animate_subject_passive,True,True,False,False,283,-48.229766845703125,-51.61796951293945,1
Ann wasn't worked with by some teenager.,Ann wasn't worked with by some hypotheses.,syntax,s-selection,animate_subject_passive,True,True,False,False,284,-49.128700256347656,-53.253910064697266,1
A doctor wasn't boasted about by some dancers.,A doctor wasn't boasted about by some cups.,syntax,s-selection,animate_subject_passive,True,True,False,False,285,-74.51383972167969,-73.95996856689453,0
Stories aren't scanned by some students.,Stories aren't scanned by some pie.,syntax,s-selection,animate_subject_passive,True,True,False,False,286,-55.23553466796875,-58.499122619628906,1
Some unicycles were broken by some waitresses.,Some unicycles were broken by some glass.,syntax,s-selection,animate_subject_passive,True,True,False,False,287,-85.46684265136719,-70.51364135742188,0
Rice isn't bought by some children.,Rice isn't bought by some mirrors.,syntax,s-selection,animate_subject_passive,True,True,False,False,288,-55.086055755615234,-61.692893981933594,1
Some guys weren't criticized by some person.,Some guys weren't criticized by some reports.,syntax,s-selection,animate_subject_passive,True,True,False,False,289,-43.45732116699219,-45.408775329589844,1
Those high schools aren't messed up by some doctor.,Those high schools aren't messed up by some synthesis.,syntax,s-selection,animate_subject_passive,True,True,False,False,290,-51.287925720214844,-55.42524719238281,1
The documentary wasn't examined by the adult.,The documentary wasn't examined by the association.,syntax,s-selection,animate_subject_passive,True,True,False,False,291,-51.2427978515625,-51.89198303222656,1
Naomi is loved by the dancers.,Naomi is loved by the fish.,syntax,s-selection,animate_subject_passive,True,True,False,False,292,-40.195709228515625,-38.03493881225586,0
Jodi isn't loved by the senators.,Jodi isn't loved by the brochures.,syntax,s-selection,animate_subject_passive,True,True,False,False,293,-60.786556243896484,-67.17737579345703,1
Jason isn't hired by some ladies.,Jason isn't hired by some projectors.,syntax,s-selection,animate_subject_passive,True,True,False,False,294,-40.84269332885742,-50.21525955200195,1
Every library wasn't explored by the students.,Every library wasn't explored by the plays.,syntax,s-selection,animate_subject_passive,True,True,False,False,295,-46.34065246582031,-50.34193420410156,1
Those schools aren't biked to by some senators.,Those schools aren't biked to by some box.,syntax,s-selection,animate_subject_passive,True,True,False,False,296,-67.25013732910156,-63.91598129272461,0
These rabbits are taken by some dancer.,These rabbits are taken by some birds.,syntax,s-selection,animate_subject_passive,True,True,False,False,297,-43.5249137878418,-39.63449478149414,0
James wasn't attacked by some man.,James wasn't attacked by some drawing.,syntax,s-selection,animate_subject_passive,True,True,False,False,298,-39.38328170776367,-45.6392822265625,1
Sheila is remembered by some actor.,Sheila is remembered by some plate.,syntax,s-selection,animate_subject_passive,True,True,False,False,299,-44.42561721801758,-46.499759674072266,1
These documentaries were argued about by some ladies.,These documentaries were argued about by some paralysis.,syntax,s-selection,animate_subject_passive,True,True,False,False,300,-58.18528747558594,-59.98265075683594,1
Brenda was listened to by the doctor.,Brenda was listened to by the radius.,syntax,s-selection,animate_subject_passive,True,True,False,False,301,-38.147377014160156,-40.834739685058594,1
Rivers weren't gone to by the teenagers.,Rivers weren't gone to by the print.,syntax,s-selection,animate_subject_passive,True,True,False,False,302,-58.18756103515625,-58.91241455078125,1
Peter isn't escaped from by the waitress.,Peter isn't escaped from by the axes.,syntax,s-selection,animate_subject_passive,True,True,False,False,303,-49.493125915527344,-51.89006042480469,1
Bread is cleaned by the men.,Bread is cleaned by the dogs.,syntax,s-selection,animate_subject_passive,True,True,False,False,304,-52.603153228759766,-52.95107650756836,1
Brad is forgotten by some actress.,Brad is forgotten by some skateboards.,syntax,s-selection,animate_subject_passive,True,True,False,False,305,-39.20305252075195,-49.229652404785156,1
All museums aren't driven to by the driver.,All museums aren't driven to by the couch.,syntax,s-selection,animate_subject_passive,True,True,False,False,306,-53.03911590576172,-51.16497039794922,0
Some cafe isn't messed up by some pedestrians.,Some cafe isn't messed up by some lamp.,syntax,s-selection,animate_subject_passive,True,True,False,False,307,-58.93444061279297,-57.44227981567383,0
Companies were researched by the patient.,Companies were researched by the casseroles.,syntax,s-selection,animate_subject_passive,True,True,False,False,308,-36.346336364746094,-52.61970520019531,1
Amelia wasn't watched by some people.,Amelia wasn't watched by some cars.,syntax,s-selection,animate_subject_passive,True,True,False,False,309,-48.16755294799805,-51.62880325317383,1
Denise was argued about by the senator.,Denise was argued about by the plane.,syntax,s-selection,animate_subject_passive,True,True,False,False,310,-49.07039260864258,-47.79785919189453,0
Most hills aren't ascended by some waitresses.,Most hills aren't ascended by some sheep.,syntax,s-selection,animate_subject_passive,True,True,False,False,311,-66.60525512695312,-54.217124938964844,0
Joseph is described by some adults.,Joseph is described by some glass.,syntax,s-selection,animate_subject_passive,True,True,False,False,312,-35.37150955200195,-37.072052001953125,1
The stairs are hidden by some doctor.,The stairs are hidden by some deer.,syntax,s-selection,animate_subject_passive,True,True,False,False,313,-44.94903564453125,-46.64466857910156,1
Jennifer isn't hated by the children.,Jennifer isn't hated by the documentary.,syntax,s-selection,animate_subject_passive,True,True,False,False,314,-34.09326171875,-40.614532470703125,1
The stairs were ascended by the alumnus.,The stairs were ascended by the axis.,syntax,s-selection,animate_subject_passive,True,True,False,False,315,-61.068912506103516,-45.68096160888672,0
Every truck wasn't bought by the waiter.,Every truck wasn't bought by the jackets.,syntax,s-selection,animate_subject_passive,True,True,False,False,316,-47.29259490966797,-48.57420349121094,1
The screen isn't fixed by some offspring.,The screen isn't fixed by some windows.,syntax,s-selection,animate_subject_passive,True,True,False,False,317,-51.36009216308594,-47.667049407958984,0
Most children are praised by some boys.,Most children are praised by some blouses.,syntax,s-selection,animate_subject_passive,True,True,False,False,318,-38.54100036621094,-49.56230545043945,1
Some newspaper article is scanned by the doctors.,Some newspaper article is scanned by the shirts.,syntax,s-selection,animate_subject_passive,True,True,False,False,319,-56.46142578125,-59.26290512084961,1
Many grocery stores are arrived at by some woman.,Many grocery stores are arrived at by some projectors.,syntax,s-selection,animate_subject_passive,True,True,False,False,320,-59.39055252075195,-70.96443176269531,1
Every hospital isn't admired by the boys.,Every hospital isn't admired by the glasses.,syntax,s-selection,animate_subject_passive,True,True,False,False,321,-48.84207534790039,-52.144588470458984,1
These boxes aren't brought by some man.,These boxes aren't brought by some media.,syntax,s-selection,animate_subject_passive,True,True,False,False,322,-45.186458587646484,-46.5709228515625,1
Rodney isn't hired by some teacher.,Rodney isn't hired by some hypotheses.,syntax,s-selection,animate_subject_passive,True,True,False,False,323,-46.98178482055664,-51.54644012451172,1
Most computers weren't broken by some men.,Most computers weren't broken by some drawings.,syntax,s-selection,animate_subject_passive,True,True,False,False,324,-46.91104507446289,-49.20743179321289,1
This play wasn't boasted about by some pedestrian.,This play wasn't boasted about by some species.,syntax,s-selection,animate_subject_passive,True,True,False,False,325,-67.44670104980469,-61.156044006347656,0
Sally is observed by some people.,Sally is observed by some rabbits.,syntax,s-selection,animate_subject_passive,True,True,False,False,326,-45.37029266357422,-54.494117736816406,1
Monica isn't fled from by the offspring.,Monica isn't fled from by the syntheses.,syntax,s-selection,animate_subject_passive,True,True,False,False,327,-55.654052734375,-64.34024047851562,1
Anne isn't insulted by the actress.,Anne isn't insulted by the cucumber.,syntax,s-selection,animate_subject_passive,True,True,False,False,328,-40.99217987060547,-47.116737365722656,1
Curtis is returned to by the adult.,Curtis is returned to by the vase.,syntax,s-selection,animate_subject_passive,True,True,False,False,329,-55.334442138671875,-62.59733963012695,1
Some people aren't argued about by some lady.,Some people aren't argued about by some glasses.,syntax,s-selection,animate_subject_passive,True,True,False,False,330,-50.81866455078125,-50.810707092285156,0
Carmen is healed by some lady.,Carmen is healed by some bike.,syntax,s-selection,animate_subject_passive,True,True,False,False,331,-57.684078216552734,-58.18872833251953,1
Those museums are messed up by the lady.,Those museums are messed up by the plate.,syntax,s-selection,animate_subject_passive,True,True,False,False,332,-40.713356018066406,-39.942649841308594,0
Many plates weren't broken by some adult.,Many plates weren't broken by some ice cream.,syntax,s-selection,animate_subject_passive,True,True,False,False,333,-51.89619827270508,-53.47765350341797,1
These forks aren't taken by some senators.,These forks aren't taken by some cup.,syntax,s-selection,animate_subject_passive,True,True,False,False,334,-53.402496337890625,-49.50202941894531,0
A lot of organizations were boycotted by the adult.,A lot of organizations were boycotted by the university.,syntax,s-selection,animate_subject_passive,True,True,False,False,335,-81.16799926757812,-78.726318359375,0
Brad wasn't forgotten by some teenager.,Brad wasn't forgotten by some shawls.,syntax,s-selection,animate_subject_passive,True,True,False,False,336,-43.769187927246094,-59.382408142089844,1
Meredith was hated by some guests.,Meredith was hated by some casserole.,syntax,s-selection,animate_subject_passive,True,True,False,False,337,-47.86602783203125,-68.37156677246094,1
Martin wasn't escaped from by some offspring.,Martin wasn't escaped from by some mouse.,syntax,s-selection,animate_subject_passive,True,True,False,False,338,-55.42559051513672,-53.54527282714844,0
This slope is climbed up by the pedestrian.,This slope is climbed up by the eyes.,syntax,s-selection,animate_subject_passive,True,True,False,False,339,-52.39521026611328,-47.81523895263672,0
Jacqueline isn't loved by the pedestrian.,Jacqueline isn't loved by the phenomena.,syntax,s-selection,animate_subject_passive,True,True,False,False,340,-56.665443420410156,-55.11537170410156,0
Gary is discussed by the alumnus.,Gary is discussed by the oxen.,syntax,s-selection,animate_subject_passive,True,True,False,False,341,-48.66398239135742,-39.732566833496094,0
The glacier isn't exited by the children.,The glacier isn't exited by the fish.,syntax,s-selection,animate_subject_passive,True,True,False,False,342,-50.73906326293945,-52.33536148071289,1
An association is researched by some child.,An association is researched by some paintings.,syntax,s-selection,animate_subject_passive,True,True,False,False,343,-42.244686126708984,-45.40522766113281,1
Leslie wasn't fired by the senator.,Leslie wasn't fired by the rabbits.,syntax,s-selection,animate_subject_passive,True,True,False,False,344,-49.61399841308594,-49.92729187011719,1
Those teachers were hidden by the child.,Those teachers were hidden by the computer.,syntax,s-selection,animate_subject_passive,True,True,False,False,345,-38.859771728515625,-40.07146453857422,1
The cashier was disliked by the ladies.,The cashier was disliked by the paralyses.,syntax,s-selection,animate_subject_passive,True,True,False,False,346,-52.617645263671875,-63.2916145324707,1
A museum isn't passed by the child.,A museum isn't passed by the casserole.,syntax,s-selection,animate_subject_passive,True,True,False,False,347,-52.860225677490234,-71.27931213378906,1
Charles is respected by the women.,Charles is respected by the synopsis.,syntax,s-selection,animate_subject_passive,True,True,False,False,348,-28.921367645263672,-39.291961669921875,1
Charles isn't kissed by some men.,Charles isn't kissed by some deer.,syntax,s-selection,animate_subject_passive,True,True,False,False,349,-42.47006607055664,-45.53020095825195,1
Janice wasn't referenced by some alumnus.,Janice wasn't referenced by some cars.,syntax,s-selection,animate_subject_passive,True,True,False,False,350,-73.14820861816406,-52.82416534423828,0
Vincent is talked about by some patients.,Vincent is talked about by some skateboards.,syntax,s-selection,animate_subject_passive,True,True,False,False,351,-55.71228790283203,-66.386474609375,1
Winston Churchill is loved by some lady.,Winston Churchill is loved by some newspaper article.,syntax,s-selection,animate_subject_passive,True,True,False,False,352,-55.463768005371094,-62.838321685791016,1
Guests were thought about by some guests.,Guests were thought about by some picture.,syntax,s-selection,animate_subject_passive,True,True,False,False,353,-50.053138732910156,-51.134132385253906,1
These doctors weren't escaped from by some actress.,These doctors weren't escaped from by some lamps.,syntax,s-selection,animate_subject_passive,True,True,False,False,354,-57.647098541259766,-58.05459213256836,1
William is worked with by the girl.,William is worked with by the window.,syntax,s-selection,animate_subject_passive,True,True,False,False,355,-40.010108947753906,-39.897701263427734,0
The steak is taken by some customers.,The steak is taken by some rugs.,syntax,s-selection,animate_subject_passive,True,True,False,False,356,-42.85140609741211,-50.17335891723633,1
Heather isn't questioned by the girls.,Heather isn't questioned by the sheep.,syntax,s-selection,animate_subject_passive,True,True,False,False,357,-48.96009826660156,-52.83832931518555,1
A lot of mountains are ascended by some driver.,A lot of mountains are ascended by some chair.,syntax,s-selection,animate_subject_passive,True,True,False,False,358,-65.44843292236328,-64.96041870117188,0
The glacier wasn't exited by the alumni.,The glacier wasn't exited by the association.,syntax,s-selection,animate_subject_passive,True,True,False,False,359,-58.260440826416016,-56.213714599609375,0
These movie theaters are hidden by the child.,These movie theaters are hidden by the octopi.,syntax,s-selection,animate_subject_passive,True,True,False,False,360,-50.342262268066406,-64.55115509033203,1
The mountain was boycotted by the man.,The mountain was boycotted by the nuclei.,syntax,s-selection,animate_subject_passive,True,True,False,False,361,-60.74647903442383,-73.51314544677734,1
A lot of actors aren't hired by some child.,A lot of actors aren't hired by some candle.,syntax,s-selection,animate_subject_passive,True,True,False,False,362,-62.55155944824219,-69.50237274169922,1
Christina isn't remembered by some girls.,Christina isn't remembered by some fish.,syntax,s-selection,animate_subject_passive,True,True,False,False,363,-49.01923370361328,-49.07546615600586,1
Kathleen was healed by the patient.,Kathleen was healed by the media.,syntax,s-selection,animate_subject_passive,True,True,False,False,364,-58.708187103271484,-56.500831604003906,0
Candice is healed by the patients.,Candice is healed by the carriage.,syntax,s-selection,animate_subject_passive,True,True,False,False,365,-40.283042907714844,-42.035194396972656,1
Tonya isn't complained about by the offspring.,Tonya isn't complained about by the plates.,syntax,s-selection,animate_subject_passive,True,True,False,False,366,-58.670780181884766,-58.605281829833984,0
A grocery store isn't skated around by some teenager.,A grocery store isn't skated around by some light.,syntax,s-selection,animate_subject_passive,True,True,False,False,367,-80.52809143066406,-77.29013061523438,0
Marie was admired by some guys.,Marie was admired by some spinach.,syntax,s-selection,animate_subject_passive,True,True,False,False,368,-36.06177520751953,-42.470985412597656,1
The glaciers aren't explored by some children.,The glaciers aren't explored by some horses.,syntax,s-selection,animate_subject_passive,True,True,False,False,369,-48.95547866821289,-53.90862274169922,1
Some high school isn't passed by some men.,Some high school isn't passed by some picture.,syntax,s-selection,animate_subject_passive,True,True,False,False,370,-49.10625457763672,-49.27021789550781,1
The Lutherans are sounded like by the alumnus.,The Lutherans are sounded like by the hair.,syntax,s-selection,animate_subject_passive,True,True,False,False,371,-74.99075317382812,-58.25555419921875,0
Carla isn't found by some pedestrian.,Carla isn't found by some shawls.,syntax,s-selection,animate_subject_passive,True,True,False,False,372,-50.600250244140625,-61.60908508300781,1
A high school is walked through by the senator.,A high school is walked through by the truck.,syntax,s-selection,animate_subject_passive,True,True,False,False,373,-62.49917984008789,-57.57889938354492,0
Patrick is referenced by some senator.,Patrick is referenced by some pie.,syntax,s-selection,animate_subject_passive,True,True,False,False,374,-40.42659378051758,-39.669315338134766,0
That closet was exited by the person.,That closet was exited by the pies.,syntax,s-selection,animate_subject_passive,True,True,False,False,375,-47.083580017089844,-50.678226470947266,1
A coat is worn by the boys.,A coat is worn by the government.,syntax,s-selection,animate_subject_passive,True,True,False,False,376,-48.58851623535156,-46.72703552246094,0
That chicken was lifted by the actors.,That chicken was lifted by the fungus.,syntax,s-selection,animate_subject_passive,True,True,False,False,377,-44.55036163330078,-46.13246154785156,1
Theresa wasn't referenced by some boys.,Theresa wasn't referenced by some thesis.,syntax,s-selection,animate_subject_passive,True,True,False,False,378,-53.001617431640625,-57.76063537597656,1
Most stairs aren't climbed up by the children.,Most stairs aren't climbed up by the commentary.,syntax,s-selection,animate_subject_passive,True,True,False,False,379,-48.12282943725586,-54.31019973754883,1
Every picture isn't brought by the drivers.,Every picture isn't brought by the nucleus.,syntax,s-selection,animate_subject_passive,True,True,False,False,380,-48.78362274169922,-47.909461975097656,0
Some malls are walked through by some child.,Some malls are walked through by some means.,syntax,s-selection,animate_subject_passive,True,True,False,False,381,-56.366825103759766,-59.046783447265625,1
The Clintons are concealed by the adult.,The Clintons are concealed by the bananas.,syntax,s-selection,animate_subject_passive,True,True,False,False,382,-52.0538330078125,-53.282920837402344,1
A lot of rivers are boycotted by some waitress.,A lot of rivers are boycotted by some university.,syntax,s-selection,animate_subject_passive,True,True,False,False,383,-86.2896957397461,-82.8187255859375,0
These grocery stores were driven to by some waiters.,These grocery stores were driven to by some car.,syntax,s-selection,animate_subject_passive,True,True,False,False,384,-68.37728881835938,-55.75068664550781,0
Most people were remembered by some man.,Most people were remembered by some couch.,syntax,s-selection,animate_subject_passive,True,True,False,False,385,-35.791961669921875,-40.11243438720703,1
Sherry was thought about by some girls.,Sherry was thought about by some hypothesis.,syntax,s-selection,animate_subject_passive,True,True,False,False,386,-52.436378479003906,-57.81505584716797,1
Rivers are insulted by some guy.,Rivers are insulted by some couches.,syntax,s-selection,animate_subject_passive,True,True,False,False,387,-51.87598419189453,-62.49684143066406,1
Tiffany wasn't cared for by the children.,Tiffany wasn't cared for by the hamsters.,syntax,s-selection,animate_subject_passive,True,True,False,False,388,-63.5030403137207,-75.96710205078125,1
Rose isn't attacked by the alumnus.,Rose isn't attacked by the pasta.,syntax,s-selection,animate_subject_passive,True,True,False,False,389,-54.90861511230469,-41.816162109375,0
Heidi isn't cared for by some actresses.,Heidi isn't cared for by some sheep.,syntax,s-selection,animate_subject_passive,True,True,False,False,390,-59.38262176513672,-60.49921417236328,1
Every dish was messed up by the man.,Every dish was messed up by the spotlights.,syntax,s-selection,animate_subject_passive,True,True,False,False,391,-39.9739990234375,-52.0478630065918,1
Gerald isn't cured by the person.,Gerald isn't cured by the commentary.,syntax,s-selection,animate_subject_passive,True,True,False,False,392,-51.217891693115234,-57.08318328857422,1
A lot of wheelbarrows aren't broken by some alumnus.,A lot of wheelbarrows aren't broken by some ox.,syntax,s-selection,animate_subject_passive,True,True,False,False,393,-109.38158416748047,-96.25881958007812,0
Most grocery stores weren't cleaned by some girls.,Most grocery stores weren't cleaned by some stimulus.,syntax,s-selection,animate_subject_passive,True,True,False,False,394,-58.828609466552734,-63.794921875,1
Most shoes weren't messed up by the guests.,Most shoes weren't messed up by the pictures.,syntax,s-selection,animate_subject_passive,True,True,False,False,395,-47.949798583984375,-46.932655334472656,0
A waiter wasn't listened to by some guys.,A waiter wasn't listened to by some glass.,syntax,s-selection,animate_subject_passive,True,True,False,False,396,-62.86357116699219,-65.85360717773438,1
Kristen wasn't loved by the women.,Kristen wasn't loved by the synopsis.,syntax,s-selection,animate_subject_passive,True,True,False,False,397,-42.288726806640625,-51.357582092285156,1
Rodney isn't described by some teacher.,Rodney isn't described by some movies.,syntax,s-selection,animate_subject_passive,True,True,False,False,398,-46.75731658935547,-40.20928955078125,0
The cilantro wasn't noticed by some senator.,The cilantro wasn't noticed by some stimulus.,syntax,s-selection,animate_subject_passive,True,True,False,False,399,-66.2953109741211,-67.62066650390625,1
A mountain was ascended by the child.,A mountain was ascended by the candle.,syntax,s-selection,animate_subject_passive,True,True,False,False,400,-54.51203155517578,-58.13459777832031,1
Deborah isn't visited by some offspring.,Deborah isn't visited by some lice.,syntax,s-selection,animate_subject_passive,True,True,False,False,401,-59.28398895263672,-65.6256332397461,1
The Great Lakes were walked through by the driver.,The Great Lakes were walked through by the ice cream.,syntax,s-selection,animate_subject_passive,True,True,False,False,402,-55.50691604614258,-56.8023796081543,1
Carlos wasn't fled from by some actors.,Carlos wasn't fled from by some glass.,syntax,s-selection,animate_subject_passive,True,True,False,False,403,-65.70492553710938,-64.94225311279297,0
