sentence_good,sentence_bad,field,linguistics_term,UID,simple_LM_method,one_prefix_method,two_prefix_method,lexically_identical,pair_id,good_prob,bad_prob,correct
It's herself who Donna does watch.,It's herself who does watch Donna.,syntax_semantics,binding,principle_A_reconstruction,True,False,False,True,518,-50.66266632080078,-46.44304275512695,0
It's themselves who these students hadn't escaped from.,It's themselves who hadn't escaped from these students.,syntax_semantics,binding,principle_A_reconstruction,True,False,False,True,519,-62.10271072387695,-57.115779876708984,0
It's herself that Claire was admiring.,It's herself that was admiring Claire.,syntax_semantics,binding,principle_A_reconstruction,True,False,False,True,520,-54.89164733886719,-54.06621551513672,0
It's himself that Brad won't listen to.,It's himself that won't listen to Brad.,syntax_semantics,binding,principle_A_reconstruction,True,False,False,True,521,-49.426719665527344,-45.70501708984375,0
It's herself that Becca isn't revealing.,It's herself that isn't revealing Becca.,syntax_semantics,binding,principle_A_reconstruction,True,False,False,True,522,-58.21040725708008,-55.192962646484375,0
It's themselves that legislatures wouldn't insult.,It's themselves that wouldn't insult legislatures.,syntax_semantics,binding,principle_A_reconstruction,True,False,False,True,523,-57.84284591674805,-54.09095001220703,0
It's himself who Bill discusses.,It's himself who discusses Bill.,syntax_semantics,binding,principle_A_reconstruction,True,False,False,True,524,-44.44688034057617,-46.08387756347656,1
It's himself that Andrew is returning to.,It's himself that is returning to Andrew.,syntax_semantics,binding,principle_A_reconstruction,True,False,False,True,525,-47.654727935791016,-45.083351135253906,0
It's herself who Lucille won't insult.,It's herself who won't insult Lucille.,syntax_semantics,binding,principle_A_reconstruction,True,False,False,True,526,-64.09329986572266,-59.68898010253906,0
It's herself that Irene argued about.,It's herself that argued about Irene.,syntax_semantics,binding,principle_A_reconstruction,True,False,False,True,527,-54.33736801147461,-54.19829559326172,0
It's himself who every senator healed.,It's himself who healed every senator.,syntax_semantics,binding,principle_A_reconstruction,True,False,False,True,528,-58.08491516113281,-51.920257568359375,0
It's herself who Jill discovers.,It's herself who discovers Jill.,syntax_semantics,binding,principle_A_reconstruction,True,False,False,True,529,-45.462249755859375,-46.99751663208008,1
It's themselves that many waiters won't love.,It's themselves that won't love many waiters.,syntax_semantics,binding,principle_A_reconstruction,True,False,False,True,530,-63.928802490234375,-60.007362365722656,0
It's herself who Monica wasn't fleeing from.,It's herself who wasn't fleeing from Monica.,syntax_semantics,binding,principle_A_reconstruction,True,False,False,True,531,-66.5896987915039,-58.41987991333008,0
It's herself that Martha disliked.,It's herself that disliked Martha.,syntax_semantics,binding,principle_A_reconstruction,True,False,False,True,532,-44.970123291015625,-49.541221618652344,1
It's themselves who senators aren't concealing.,It's themselves who aren't concealing senators.,syntax_semantics,binding,principle_A_reconstruction,True,False,False,True,533,-69.46311950683594,-66.52552795410156,0
It's himself that Martin has noticed.,It's himself that has noticed Martin.,syntax_semantics,binding,principle_A_reconstruction,True,False,False,True,534,-42.420257568359375,-44.64021301269531,1
It's themselves who the girls were embarrassing.,It's themselves who were embarrassing the girls.,syntax_semantics,binding,principle_A_reconstruction,True,False,False,True,535,-46.67041015625,-50.45534133911133,1
It's herself that Veronica helps.,It's herself that helps Veronica.,syntax_semantics,binding,principle_A_reconstruction,True,False,False,True,536,-41.41288757324219,-37.494659423828125,0
It's himself who Travis hired.,It's himself who hired Travis.,syntax_semantics,binding,principle_A_reconstruction,True,False,False,True,537,-42.28948211669922,-41.77598190307617,0
It's herself that Kimberley fires.,It's herself that fires Kimberley.,syntax_semantics,binding,principle_A_reconstruction,True,False,False,True,538,-56.79145812988281,-55.32514572143555,0
It's herself who Kristen sounds like.,It's herself who sounds like Kristen.,syntax_semantics,binding,principle_A_reconstruction,True,False,False,True,539,-51.414554595947266,-48.23744201660156,0
It's herself that Naomi has irritated.,It's herself that has irritated Naomi.,syntax_semantics,binding,principle_A_reconstruction,True,False,False,True,540,-50.883853912353516,-51.31654357910156,1
It's himself that Lawrence reveals.,It's himself that reveals Lawrence.,syntax_semantics,binding,principle_A_reconstruction,True,False,False,True,541,-39.6590461730957,-40.30564880371094,1
It's himself that Steven isn't finding.,It's himself that isn't finding Steven.,syntax_semantics,binding,principle_A_reconstruction,True,False,False,True,542,-47.529335021972656,-45.90312957763672,0
It's herself that Elaine complained about.,It's herself that complained about Elaine.,syntax_semantics,binding,principle_A_reconstruction,True,False,False,True,543,-45.19300079345703,-45.63620376586914,1
It's herself that April sounds like.,It's herself that sounds like April.,syntax_semantics,binding,principle_A_reconstruction,True,False,False,True,544,-46.53931427001953,-36.16506576538086,0
It's themselves that hospitals could admire.,It's themselves that could admire hospitals.,syntax_semantics,binding,principle_A_reconstruction,True,False,False,True,545,-46.57508850097656,-45.01441192626953,0
It's himself who Homer was arguing about.,It's himself who was arguing about Homer.,syntax_semantics,binding,principle_A_reconstruction,True,False,False,True,546,-54.2347412109375,-48.93992233276367,0
It's himself who a cashier insulted.,It's himself who insulted a cashier.,syntax_semantics,binding,principle_A_reconstruction,True,False,False,True,547,-64.14656066894531,-55.66930389404297,0
It's herself who Danielle loved.,It's herself who loved Danielle.,syntax_semantics,binding,principle_A_reconstruction,True,False,False,True,548,-46.13040542602539,-43.845001220703125,0
It's itself that that company talks about.,It's itself that talks about that company.,syntax_semantics,binding,principle_A_reconstruction,True,False,False,True,549,-44.24374008178711,-38.57862854003906,0
It's herself that a dancer visits.,It's herself that visits a dancer.,syntax_semantics,binding,principle_A_reconstruction,True,False,False,True,550,-47.785736083984375,-46.68733215332031,0
It's herself that Bethany has listened to.,It's herself that has listened to Bethany.,syntax_semantics,binding,principle_A_reconstruction,True,False,False,True,551,-56.003196716308594,-54.94111633300781,0
It's herself who Melinda hated.,It's herself who hated Melinda.,syntax_semantics,binding,principle_A_reconstruction,True,False,False,True,552,-53.46475601196289,-51.11228942871094,0
It's herself who Carla kisses.,It's herself who kisses Carla.,syntax_semantics,binding,principle_A_reconstruction,True,False,False,True,553,-52.76885223388672,-50.55607986450195,0
It's himself that Peter impressed.,It's himself that impressed Peter.,syntax_semantics,binding,principle_A_reconstruction,True,False,False,True,554,-38.999534606933594,-40.39036178588867,1
It's herself who Ruth is working with.,It's herself who is working with Ruth.,syntax_semantics,binding,principle_A_reconstruction,True,False,False,True,555,-48.53474426269531,-45.89186096191406,0
It's himself that Thomas wasn't curing.,It's himself that wasn't curing Thomas.,syntax_semantics,binding,principle_A_reconstruction,True,False,False,True,556,-48.723350524902344,-49.056495666503906,1
It's themselves that those girls weren't thinking about.,It's themselves that weren't thinking about those girls.,syntax_semantics,binding,principle_A_reconstruction,True,False,False,True,557,-49.66019821166992,-47.557945251464844,0
It's herself that Lucille was hugging.,It's herself that was hugging Lucille.,syntax_semantics,binding,principle_A_reconstruction,True,False,False,True,558,-54.24032211303711,-53.381317138671875,0
It's himself who that student hadn't worried.,It's himself who hadn't worried that student.,syntax_semantics,binding,principle_A_reconstruction,True,False,False,True,559,-59.64277648925781,-55.32728958129883,0
It's herself that some dancer hasn't approached.,It's herself that hasn't approached some dancer.,syntax_semantics,binding,principle_A_reconstruction,True,False,False,True,560,-57.04798126220703,-54.148040771484375,0
It's himself that Kenneth wasn't admiring.,It's himself that wasn't admiring Kenneth.,syntax_semantics,binding,principle_A_reconstruction,True,False,False,True,561,-60.86052703857422,-57.06230163574219,0
It's herself that Becky helps.,It's herself that helps Becky.,syntax_semantics,binding,principle_A_reconstruction,True,False,False,True,562,-39.52781295776367,-38.47532272338867,0
It's herself who Susan attacked.,It's herself who attacked Susan.,syntax_semantics,binding,principle_A_reconstruction,True,False,False,True,563,-44.66938018798828,-42.54694747924805,0
It's herself who the person disagrees with.,It's herself who disagrees with the person.,syntax_semantics,binding,principle_A_reconstruction,True,False,False,True,564,-54.1141242980957,-49.598548889160156,0
It's herself that Kristin hasn't visited.,It's herself that hasn't visited Kristin.,syntax_semantics,binding,principle_A_reconstruction,True,False,False,True,565,-61.142051696777344,-55.1171760559082,0
It's herself who Becky referenced.,It's herself who referenced Becky.,syntax_semantics,binding,principle_A_reconstruction,True,False,False,True,566,-47.69392013549805,-49.25164031982422,1
It's itself that the newspaper article might bother.,It's itself that might bother the newspaper article.,syntax_semantics,binding,principle_A_reconstruction,True,False,False,True,567,-56.5352668762207,-52.33728790283203,0
It's himself that Russell approaches.,It's himself that approaches Russell.,syntax_semantics,binding,principle_A_reconstruction,True,False,False,True,568,-43.11668395996094,-46.89402389526367,1
It's himself that Bruce appreciates.,It's himself that appreciates Bruce.,syntax_semantics,binding,principle_A_reconstruction,True,False,False,True,569,-43.20449447631836,-49.13152313232422,1
It's herself who Veronica was hurting.,It's herself who was hurting Veronica.,syntax_semantics,binding,principle_A_reconstruction,True,False,False,True,570,-51.43665313720703,-46.23038101196289,0
It's herself that Kayla was hugging.,It's herself that was hugging Kayla.,syntax_semantics,binding,principle_A_reconstruction,True,False,False,True,571,-55.82978820800781,-55.636070251464844,0
It's herself that Christina disagrees with.,It's herself that disagrees with Christina.,syntax_semantics,binding,principle_A_reconstruction,True,False,False,True,572,-54.01710510253906,-51.90589904785156,0
It's themselves that rabbits weren't upsetting.,It's themselves that weren't upsetting rabbits.,syntax_semantics,binding,principle_A_reconstruction,True,False,False,True,573,-49.55079650878906,-49.29447937011719,0
It's herself that Kayla escapes from.,It's herself that escapes from Kayla.,syntax_semantics,binding,principle_A_reconstruction,True,False,False,True,574,-58.349571228027344,-53.27726364135742,0
It's herself who Tamara is firing.,It's herself who is firing Tamara.,syntax_semantics,binding,principle_A_reconstruction,True,False,False,True,575,-56.659156799316406,-55.918426513671875,0
It's themselves who those teenagers did approach.,It's themselves who did approach those teenagers.,syntax_semantics,binding,principle_A_reconstruction,True,False,False,True,576,-56.01546859741211,-54.33777618408203,0
It's herself who Jessica approached.,It's herself who approached Jessica.,syntax_semantics,binding,principle_A_reconstruction,True,False,False,True,577,-45.63812255859375,-43.64897918701172,0
It's itself that a mirror was stunning.,It's itself that was stunning a mirror.,syntax_semantics,binding,principle_A_reconstruction,True,False,False,True,578,-50.86407470703125,-49.41352844238281,0
It's themselves that most people should flee from.,It's themselves that should flee from most people.,syntax_semantics,binding,principle_A_reconstruction,True,False,False,True,579,-50.626556396484375,-51.63092041015625,1
It's himself that Joel might boast about.,It's himself that might boast about Joel.,syntax_semantics,binding,principle_A_reconstruction,True,False,False,True,580,-59.72727966308594,-56.34889602661133,0
It's herself that Julia boasts about.,It's herself that boasts about Julia.,syntax_semantics,binding,principle_A_reconstruction,True,False,False,True,581,-51.72010803222656,-52.48640441894531,1
It's himself that Matt had argued about.,It's himself that had argued about Matt.,syntax_semantics,binding,principle_A_reconstruction,True,False,False,True,582,-52.73139190673828,-53.181861877441406,1
It's herself that Eva might sound like.,It's herself that might sound like Eva.,syntax_semantics,binding,principle_A_reconstruction,True,False,False,True,583,-52.39383316040039,-46.25812530517578,0
It's herself that Tamara had described.,It's herself that had described Tamara.,syntax_semantics,binding,principle_A_reconstruction,True,False,False,True,584,-56.218902587890625,-57.104061126708984,1
It's herself who a driver bored.,It's herself who bored a driver.,syntax_semantics,binding,principle_A_reconstruction,True,False,False,True,585,-51.091163635253906,-47.0673942565918,0
It's himself who Andrew does criticize.,It's himself who does criticize Andrew.,syntax_semantics,binding,principle_A_reconstruction,True,False,False,True,586,-52.31548309326172,-49.92314910888672,0
It's herself who Carmen hadn't appreciated.,It's herself who hadn't appreciated Carmen.,syntax_semantics,binding,principle_A_reconstruction,True,False,False,True,587,-61.120819091796875,-57.825557708740234,0
It's herself that Victoria helped.,It's herself that helped Victoria.,syntax_semantics,binding,principle_A_reconstruction,True,False,False,True,588,-41.87800216674805,-38.709686279296875,0
It's herself who Nancy escapes from.,It's herself who escapes from Nancy.,syntax_semantics,binding,principle_A_reconstruction,True,False,False,True,589,-52.96027755737305,-49.68354034423828,0
It's herself that Marie has talked to.,It's herself that has talked to Marie.,syntax_semantics,binding,principle_A_reconstruction,True,False,False,True,590,-46.74810791015625,-47.288814544677734,1
It's themselves that the waiters have disagreed with.,It's themselves that have disagreed with the waiters.,syntax_semantics,binding,principle_A_reconstruction,True,False,False,True,591,-65.48570251464844,-60.83573913574219,0
It's herself who Leslie healed.,It's herself who healed Leslie.,syntax_semantics,binding,principle_A_reconstruction,True,False,False,True,592,-48.69804000854492,-47.92559814453125,0
It's himself that some doctor hides.,It's himself that hides some doctor.,syntax_semantics,binding,principle_A_reconstruction,True,False,False,True,593,-45.380428314208984,-47.4407958984375,1
It's herself that this actress watches.,It's herself that watches this actress.,syntax_semantics,binding,principle_A_reconstruction,True,False,False,True,594,-46.3358154296875,-46.99852752685547,1
It's himself that Robert hasn't forgotten.,It's himself that hasn't forgotten Robert.,syntax_semantics,binding,principle_A_reconstruction,True,False,False,True,595,-44.89148712158203,-44.50251007080078,0
It's themselves who the Clintons attacked.,It's themselves who attacked the Clintons.,syntax_semantics,binding,principle_A_reconstruction,True,False,False,True,596,-53.549015045166016,-48.71587371826172,0
It's themselves that many cucumbers couldn't astound.,It's themselves that couldn't astound many cucumbers.,syntax_semantics,binding,principle_A_reconstruction,True,False,False,True,597,-78.23942565917969,-74.62548828125,0
It's himself that Gary questions.,It's himself that questions Gary.,syntax_semantics,binding,principle_A_reconstruction,True,False,False,True,598,-40.97365188598633,-44.49061584472656,1
It's themselves that those children aggravated.,It's themselves that aggravated those children.,syntax_semantics,binding,principle_A_reconstruction,True,False,False,True,599,-50.46675109863281,-49.77640914916992,0
It's himself who Peter hugs.,It's himself who hugs Peter.,syntax_semantics,binding,principle_A_reconstruction,True,False,False,True,600,-45.56709289550781,-47.85074234008789,1
It's herself who Natalie might cure.,It's herself who might cure Natalie.,syntax_semantics,binding,principle_A_reconstruction,True,False,False,True,601,-52.88589859008789,-49.87424850463867,0
It's herself who Amy won't listen to.,It's herself who won't listen to Amy.,syntax_semantics,binding,principle_A_reconstruction,True,False,False,True,602,-47.668907165527344,-44.1909294128418,0
It's herself that the lady wouldn't respect.,It's herself that wouldn't respect the lady.,syntax_semantics,binding,principle_A_reconstruction,True,False,False,True,603,-47.597679138183594,-47.152984619140625,0
It's himself that Guy kissed.,It's himself that kissed Guy.,syntax_semantics,binding,principle_A_reconstruction,True,False,False,True,604,-40.85763168334961,-41.348289489746094,1
It's herself that Tanya wasn't hiding.,It's herself that wasn't hiding Tanya.,syntax_semantics,binding,principle_A_reconstruction,True,False,False,True,605,-57.94942092895508,-53.898834228515625,0
It's herself who Patricia knew.,It's herself who knew Patricia.,syntax_semantics,binding,principle_A_reconstruction,True,False,False,True,606,-43.156829833984375,-42.693885803222656,0
It's themselves who the doctors aren't disagreeing with.,It's themselves who aren't disagreeing with the doctors.,syntax_semantics,binding,principle_A_reconstruction,True,False,False,True,607,-63.7154426574707,-61.691410064697266,0
It's himself who Russell noticed.,It's himself who noticed Russell.,syntax_semantics,binding,principle_A_reconstruction,True,False,False,True,608,-44.08159255981445,-42.73774719238281,0
It's themselves that skateboards stunned.,It's themselves that stunned skateboards.,syntax_semantics,binding,principle_A_reconstruction,True,False,False,True,609,-55.428260803222656,-53.868717193603516,0
It's herself who Renee didn't appreciate.,It's herself who didn't appreciate Renee.,syntax_semantics,binding,principle_A_reconstruction,True,False,False,True,610,-59.531700134277344,-56.42259979248047,0
It's herself that the doctor approaches.,It's herself that approaches the doctor.,syntax_semantics,binding,principle_A_reconstruction,True,False,False,True,611,-42.39584732055664,-45.45540237426758,1
It's herself who Angela isn't questioning.,It's herself who isn't questioning Angela.,syntax_semantics,binding,principle_A_reconstruction,True,False,False,True,612,-54.84050750732422,-52.99250030517578,0
It's herself that Janet has cared for.,It's herself that has cared for Janet.,syntax_semantics,binding,principle_A_reconstruction,True,False,False,True,613,-48.762245178222656,-48.11672592163086,0
It's herself who Donna loved.,It's herself who loved Donna.,syntax_semantics,binding,principle_A_reconstruction,True,False,False,True,614,-45.17991638183594,-41.14240264892578,0
It's themselves that these legislatures don't praise.,It's themselves that don't praise these legislatures.,syntax_semantics,binding,principle_A_reconstruction,True,False,False,True,615,-55.43138122558594,-55.09619140625,0
It's herself who Janet isn't hurting.,It's herself who isn't hurting Janet.,syntax_semantics,binding,principle_A_reconstruction,True,False,False,True,616,-53.556575775146484,-52.44626998901367,0
It's himself who Andrew didn't approach.,It's himself who didn't approach Andrew.,syntax_semantics,binding,principle_A_reconstruction,True,False,False,True,617,-50.30974578857422,-50.40373229980469,1
It's himself that Thomas could see.,It's himself that could see Thomas.,syntax_semantics,binding,principle_A_reconstruction,True,False,False,True,618,-39.890785217285156,-40.2817268371582,1
It's herself who Kendra loves.,It's herself who loves Kendra.,syntax_semantics,binding,principle_A_reconstruction,True,False,False,True,619,-53.08885192871094,-51.19505310058594,0
It's itself that every turtle alarmed.,It's itself that alarmed every turtle.,syntax_semantics,binding,principle_A_reconstruction,True,False,False,True,620,-53.71737289428711,-53.54631423950195,0
It's herself who Patricia embarrassed.,It's herself who embarrassed Patricia.,syntax_semantics,binding,principle_A_reconstruction,True,False,False,True,621,-46.305824279785156,-45.47256851196289,0
It's herself that Caroline shouldn't discuss.,It's herself that shouldn't discuss Caroline.,syntax_semantics,binding,principle_A_reconstruction,True,False,False,True,622,-52.01234817504883,-48.86701202392578,0
It's herself who Natalie wasn't talking about.,It's herself who wasn't talking about Natalie.,syntax_semantics,binding,principle_A_reconstruction,True,False,False,True,623,-49.68040466308594,-46.184104919433594,0
It's herself who Natalie shouldn't admire.,It's herself who shouldn't admire Natalie.,syntax_semantics,binding,principle_A_reconstruction,True,False,False,True,624,-56.98778533935547,-55.05758285522461,0
It's herself that Lisa has respected.,It's herself that has respected Lisa.,syntax_semantics,binding,principle_A_reconstruction,True,False,False,True,625,-45.926292419433594,-47.7021484375,1
It's herself that Kristin observed.,It's herself that observed Kristin.,syntax_semantics,binding,principle_A_reconstruction,True,False,False,True,626,-51.85016632080078,-53.26226043701172,1
It's herself who this actor works with.,It's herself who works with this actor.,syntax_semantics,binding,principle_A_reconstruction,True,False,False,True,627,-48.09348678588867,-40.33280944824219,0
It's herself who Meredith forgot.,It's herself who forgot Meredith.,syntax_semantics,binding,principle_A_reconstruction,True,False,False,True,628,-46.59925842285156,-46.043731689453125,0
It's herself who Kendra visited.,It's herself who visited Kendra.,syntax_semantics,binding,principle_A_reconstruction,True,False,False,True,629,-55.73259735107422,-54.373619079589844,0
It's themselves that a lot of committees aren't describing.,It's themselves that aren't describing a lot of committees.,syntax_semantics,binding,principle_A_reconstruction,True,False,False,True,630,-55.506282806396484,-51.88349914550781,0
It's himself who Marcus respects.,It's himself who respects Marcus.,syntax_semantics,binding,principle_A_reconstruction,True,False,False,True,631,-47.51313781738281,-47.188636779785156,0
It's herself that Kendra isn't talking to.,It's herself that isn't talking to Kendra.,syntax_semantics,binding,principle_A_reconstruction,True,False,False,True,632,-56.07696533203125,-56.850975036621094,1
It's herself that Sonia can reference.,It's herself that can reference Sonia.,syntax_semantics,binding,principle_A_reconstruction,True,False,False,True,633,-54.844085693359375,-54.56865692138672,0
It's himself that Donald hadn't concealed.,It's himself that hadn't concealed Donald.,syntax_semantics,binding,principle_A_reconstruction,True,False,False,True,634,-53.184444427490234,-54.55527877807617,1
It's himself that Paul was returning to.,It's himself that was returning to Paul.,syntax_semantics,binding,principle_A_reconstruction,True,False,False,True,635,-43.698829650878906,-42.04253387451172,0
It's themselves that the coats didn't upset.,It's themselves that didn't upset the coats.,syntax_semantics,binding,principle_A_reconstruction,True,False,False,True,636,-50.93299865722656,-48.95064926147461,0
It's itself that music upset.,It's itself that upset music.,syntax_semantics,binding,principle_A_reconstruction,True,False,False,True,637,-37.12702178955078,-34.59619903564453,0
It's themselves who most guests wouldn't disagree with.,It's themselves who wouldn't disagree with most guests.,syntax_semantics,binding,principle_A_reconstruction,True,False,False,True,638,-61.205440521240234,-58.599998474121094,0
It's himself who Samuel hugged.,It's himself who hugged Samuel.,syntax_semantics,binding,principle_A_reconstruction,True,False,False,True,639,-46.63188552856445,-44.50614547729492,0
It's herself that Irene had fired.,It's herself that had fired Irene.,syntax_semantics,binding,principle_A_reconstruction,True,False,False,True,640,-51.57060241699219,-53.798431396484375,1
It's herself that Rhonda observes.,It's herself that observes Rhonda.,syntax_semantics,binding,principle_A_reconstruction,True,False,False,True,641,-58.19586181640625,-58.798641204833984,1
It's herself who Heather was discussing.,It's herself who was discussing Heather.,syntax_semantics,binding,principle_A_reconstruction,True,False,False,True,642,-50.368438720703125,-48.36078643798828,0
It's herself who Sarah hasn't stunned.,It's herself who hasn't stunned Sarah.,syntax_semantics,binding,principle_A_reconstruction,True,False,False,True,643,-56.96744918823242,-55.73179626464844,0
It's herself that Tina hasn't attacked.,It's herself that hasn't attacked Tina.,syntax_semantics,binding,principle_A_reconstruction,True,False,False,True,644,-51.75038528442383,-47.26829147338867,0
It's herself who Suzanne has insulted.,It's herself who has insulted Suzanne.,syntax_semantics,binding,principle_A_reconstruction,True,False,False,True,645,-56.41773223876953,-50.55442810058594,0
It's itself that every association isn't worrying.,It's itself that isn't worrying every association.,syntax_semantics,binding,principle_A_reconstruction,True,False,False,True,646,-55.2296142578125,-54.577293395996094,0
