sentence_good,sentence_bad,field,linguistics_term,UID,simple_LM_method,one_prefix_method,two_prefix_method,lexically_identical,pair_id,good_prob,bad_prob,correct
Cashiers disagreed with these concealed people.,Cashiers disagreed with these concealed person.,morphology,determiner_noun_agreement,determiner_noun_agreement_with_adj_irregular_1,True,True,False,True,448,-54.988609313964844,-59.244171142578125,1
Denise noticed that red nucleus.,Denise noticed that red nuclei.,morphology,determiner_noun_agreement,determiner_noun_agreement_with_adj_irregular_1,True,True,False,True,449,-44.11505126953125,-53.073211669921875,1
Thomas was exploring those orange oases.,Thomas was exploring those orange oasis.,morphology,determiner_noun_agreement,determiner_noun_agreement_with_adj_irregular_1,True,True,False,True,450,-54.524051666259766,-51.73289489746094,0
Alexander could exit those smooth oases.,Alexander could exit those smooth oasis.,morphology,determiner_noun_agreement,determiner_noun_agreement_with_adj_irregular_1,True,True,False,True,451,-58.051177978515625,-55.39387893676758,0
Most schools are describing this long analysis.,Most schools are describing this long analyses.,morphology,determiner_noun_agreement,determiner_noun_agreement_with_adj_irregular_1,True,True,False,True,452,-43.127052307128906,-47.95020294189453,1
Martin described those bad analyses.,Martin described those bad analysis.,morphology,determiner_noun_agreement,determiner_noun_agreement_with_adj_irregular_1,True,True,False,True,453,-39.26481246948242,-34.019287109375,0
Joel has boycotted these smooth oases.,Joel has boycotted these smooth oasis.,morphology,determiner_noun_agreement,determiner_noun_agreement_with_adj_irregular_1,True,True,False,True,454,-77.07711791992188,-75.4415283203125,0
Jerry discovers these out in the open geese.,Jerry discovers these out in the open goose.,morphology,determiner_noun_agreement,determiner_noun_agreement_with_adj_irregular_1,True,True,False,True,455,-59.595157623291016,-56.073158264160156,0
Stacy drove to this white oasis.,Stacy drove to this white oases.,morphology,determiner_noun_agreement,determiner_noun_agreement_with_adj_irregular_1,True,True,False,True,456,-61.309356689453125,-64.29643249511719,1
Maria hadn't admired that gray goose.,Maria hadn't admired that gray geese.,morphology,determiner_noun_agreement,determiner_noun_agreement_with_adj_irregular_1,True,True,False,True,457,-51.62443542480469,-55.293758392333984,1
Gerald describes those good analyses.,Gerald describes those good analysis.,morphology,determiner_noun_agreement,determiner_noun_agreement_with_adj_irregular_1,True,True,False,True,458,-51.700618743896484,-47.402122497558594,0
Becky doesn't argue about those determined alumni.,Becky doesn't argue about those determined alumnus.,morphology,determiner_noun_agreement,determiner_noun_agreement_with_adj_irregular_1,True,True,False,True,459,-51.94416427612305,-66.86820983886719,1
Kayla isn't breaking those small teeth.,Kayla isn't breaking those small tooth.,morphology,determiner_noun_agreement,determiner_noun_agreement_with_adj_irregular_1,True,True,False,True,460,-48.33316421508789,-50.311378479003906,1
Wayne broke that purple tooth.,Wayne broke that purple teeth.,morphology,determiner_noun_agreement,determiner_noun_agreement_with_adj_irregular_1,True,True,False,True,461,-41.35615539550781,-40.13591003417969,0
Randolf had run around those blue oases.,Randolf had run around those blue oasis.,morphology,determiner_noun_agreement,determiner_noun_agreement_with_adj_irregular_1,True,True,False,True,462,-64.74004364013672,-62.59141159057617,0
Monet hadn't concealed that content alumnus.,Monet hadn't concealed that content alumni.,morphology,determiner_noun_agreement,determiner_noun_agreement_with_adj_irregular_1,True,True,False,True,463,-80.93559265136719,-65.23278045654297,0
Kirsten irritated those happy alumni.,Kirsten irritated those happy alumnus.,morphology,determiner_noun_agreement,determiner_noun_agreement_with_adj_irregular_1,True,True,False,True,464,-62.93585205078125,-78.99427795410156,1
The teenager approached that fast child.,The teenager approached that fast children.,morphology,determiner_noun_agreement,determiner_noun_agreement_with_adj_irregular_1,True,True,False,True,465,-39.96002197265625,-40.1152458190918,1
Tracy kissed this unconvinced woman.,Tracy kissed this unconvinced women.,morphology,determiner_noun_agreement,determiner_noun_agreement_with_adj_irregular_1,True,True,False,True,466,-77.66294860839844,-78.18658447265625,1
Most associations argued about those long analyses.,Most associations argued about those long analysis.,morphology,determiner_noun_agreement,determiner_noun_agreement_with_adj_irregular_1,True,True,False,True,467,-56.79193115234375,-52.79292297363281,0
The waiters discover that brown stimulus.,The waiters discover that brown stimuli.,morphology,determiner_noun_agreement,determiner_noun_agreement_with_adj_irregular_1,True,True,False,True,468,-62.30662536621094,-62.067726135253906,0
Brett talks to these young women.,Brett talks to these young woman.,morphology,determiner_noun_agreement,determiner_noun_agreement_with_adj_irregular_1,True,True,False,True,469,-52.52975082397461,-55.11347198486328,1
Some popsicle scares those content children.,Some popsicle scares those content child.,morphology,determiner_noun_agreement,determiner_noun_agreement_with_adj_irregular_1,True,True,False,True,470,-65.042724609375,-64.93315124511719,0
Women find that hidden mouse.,Women find that hidden mice.,morphology,determiner_noun_agreement,determiner_noun_agreement_with_adj_irregular_1,True,True,False,True,471,-34.71367645263672,-33.402034759521484,0
Those pedestrians return to these nice children.,Those pedestrians return to these nice child.,morphology,determiner_noun_agreement,determiner_noun_agreement_with_adj_irregular_1,True,True,False,True,472,-47.21420669555664,-49.043785095214844,1
Jodi scans those bad synopses.,Jodi scans those bad synopsis.,morphology,determiner_noun_agreement,determiner_noun_agreement_with_adj_irregular_1,True,True,False,True,473,-78.4007339477539,-66.83334350585938,0
Ellen is leaving that busy woman.,Ellen is leaving that busy women.,morphology,determiner_noun_agreement,determiner_noun_agreement_with_adj_irregular_1,True,True,False,True,474,-41.332542419433594,-40.95001220703125,0
Peter had known these big men.,Peter had known these big man.,morphology,determiner_noun_agreement,determiner_noun_agreement_with_adj_irregular_1,True,True,False,True,475,-36.70526885986328,-38.228515625,1
Brett is thinking about those gray cacti.,Brett is thinking about those gray cactus.,morphology,determiner_noun_agreement,determiner_noun_agreement_with_adj_irregular_1,True,True,False,True,476,-74.42218780517578,-68.52250671386719,0
The Lutherans heal these ill geese.,The Lutherans heal these ill goose.,morphology,determiner_noun_agreement,determiner_noun_agreement_with_adj_irregular_1,True,True,False,True,477,-70.7987060546875,-66.73950958251953,0
Lissa might sound like that good child.,Lissa might sound like that good children.,morphology,determiner_noun_agreement,determiner_noun_agreement_with_adj_irregular_1,True,True,False,True,478,-47.180870056152344,-47.52210998535156,1
Most mouths might stun those busy children.,Most mouths might stun those busy child.,morphology,determiner_noun_agreement,determiner_noun_agreement_with_adj_irregular_1,True,True,False,True,479,-56.796852111816406,-58.09967041015625,1
Kayla has that orange axis.,Kayla has that orange axes.,morphology,determiner_noun_agreement,determiner_noun_agreement_with_adj_irregular_1,True,True,False,True,480,-40.775474548339844,-45.05499267578125,1
Cynthia doesn't heal that clever man.,Cynthia doesn't heal that clever men.,morphology,determiner_noun_agreement,determiner_noun_agreement_with_adj_irregular_1,True,True,False,True,481,-70.90755462646484,-72.03845977783203,1
Homer returns to that exposed man.,Homer returns to that exposed men.,morphology,determiner_noun_agreement,determiner_noun_agreement_with_adj_irregular_1,True,True,False,True,482,-52.23970413208008,-52.49506378173828,1
People remember those uncertain people.,People remember those uncertain person.,morphology,determiner_noun_agreement,determiner_noun_agreement_with_adj_irregular_1,True,True,False,True,483,-33.905364990234375,-35.39598846435547,1
Theodore hasn't broken those concealed feet.,Theodore hasn't broken those concealed foot.,morphology,determiner_noun_agreement,determiner_noun_agreement_with_adj_irregular_1,True,True,False,True,484,-61.02839660644531,-62.76508331298828,1
Tonya had disturbed that popular man.,Tonya had disturbed that popular men.,morphology,determiner_noun_agreement,determiner_noun_agreement_with_adj_irregular_1,True,True,False,True,485,-49.113983154296875,-48.85789108276367,0
This customer couldn't pass that black oasis.,This customer couldn't pass that black oases.,morphology,determiner_noun_agreement,determiner_noun_agreement_with_adj_irregular_1,True,True,False,True,486,-58.181976318359375,-60.162391662597656,1
William hides that exposed stimulus.,William hides that exposed stimuli.,morphology,determiner_noun_agreement,determiner_noun_agreement_with_adj_irregular_1,True,True,False,True,487,-45.91033935546875,-44.34757995605469,0
Ruth exits that big oasis.,Ruth exits that big oases.,morphology,determiner_noun_agreement,determiner_noun_agreement_with_adj_irregular_1,True,True,False,True,488,-60.937538146972656,-62.790035247802734,1
Judy can discover that red mouse.,Judy can discover that red mice.,morphology,determiner_noun_agreement,determiner_noun_agreement_with_adj_irregular_1,True,True,False,True,489,-45.681907653808594,-44.92550277709961,0
Candice didn't stun that serious alumnus.,Candice didn't stun that serious alumni.,morphology,determiner_noun_agreement,determiner_noun_agreement_with_adj_irregular_1,True,True,False,True,490,-75.92881774902344,-59.74641799926758,0
Jodi hadn't visited these green oases.,Jodi hadn't visited these green oasis.,morphology,determiner_noun_agreement,determiner_noun_agreement_with_adj_irregular_1,True,True,False,True,491,-74.56104278564453,-72.2970962524414,0
Rose doesn't hate these bad analyses.,Rose doesn't hate these bad analysis.,morphology,determiner_noun_agreement,determiner_noun_agreement_with_adj_irregular_1,True,True,False,True,492,-44.141754150390625,-38.927703857421875,0
These men can help that lost alumnus.,These men can help that lost alumni.,morphology,determiner_noun_agreement,determiner_noun_agreement_with_adj_irregular_1,True,True,False,True,493,-62.12627410888672,-47.836238861083984,0
Thomas hadn't arrived at those red oases.,Thomas hadn't arrived at those red oasis.,morphology,determiner_noun_agreement,determiner_noun_agreement_with_adj_irregular_1,True,True,False,True,494,-59.17197036743164,-56.56645202636719,0
A lot of companies remembered this unlucky alumnus.,A lot of companies remembered this unlucky alumni.,morphology,determiner_noun_agreement,determiner_noun_agreement_with_adj_irregular_1,True,True,False,True,495,-84.86778259277344,-70.51652526855469,0
Women fire these content women.,Women fire these content woman.,morphology,determiner_noun_agreement,determiner_noun_agreement_with_adj_irregular_1,True,True,False,True,496,-39.23094177246094,-40.73212814331055,1
George will remember those good synopses.,George will remember those good synopsis.,morphology,determiner_noun_agreement,determiner_noun_agreement_with_adj_irregular_1,True,True,False,True,497,-57.83428192138672,-46.056541442871094,0
The glacier wasn't embarrassing those unlucky people.,The glacier wasn't embarrassing those unlucky person.,morphology,determiner_noun_agreement,determiner_noun_agreement_with_adj_irregular_1,True,True,False,True,498,-59.87786102294922,-62.835601806640625,1
Guy visits that happy woman.,Guy visits that happy women.,morphology,determiner_noun_agreement,determiner_noun_agreement_with_adj_irregular_1,True,True,False,True,499,-36.97601318359375,-37.53532409667969,1
Steven investigates this employed person.,Steven investigates this employed people.,morphology,determiner_noun_agreement,determiner_noun_agreement_with_adj_irregular_1,True,True,False,True,500,-46.03076171875,-44.679222106933594,0
John didn't conceal those young men.,John didn't conceal those young man.,morphology,determiner_noun_agreement,determiner_noun_agreement_with_adj_irregular_1,True,True,False,True,501,-38.975093841552734,-40.400142669677734,1
Martin hadn't gone to that gray oasis.,Martin hadn't gone to that gray oases.,morphology,determiner_noun_agreement,determiner_noun_agreement_with_adj_irregular_1,True,True,False,True,502,-53.39211654663086,-56.46484375,1
The cashiers weren't breaking these brown feet.,The cashiers weren't breaking these brown foot.,morphology,determiner_noun_agreement,determiner_noun_agreement_with_adj_irregular_1,True,True,False,True,503,-59.01833724975586,-61.80556106567383,1
The pedestrians might complain about this small oasis.,The pedestrians might complain about this small oases.,morphology,determiner_noun_agreement,determiner_noun_agreement_with_adj_irregular_1,True,True,False,True,504,-66.22647094726562,-68.93017578125,1
Tamara won't bike to those exposed oases.,Tamara won't bike to those exposed oasis.,morphology,determiner_noun_agreement,determiner_noun_agreement_with_adj_irregular_1,True,True,False,True,505,-74.36736297607422,-71.71478271484375,0
Jennifer does discuss those purple oases.,Jennifer does discuss those purple oasis.,morphology,determiner_noun_agreement,determiner_noun_agreement_with_adj_irregular_1,True,True,False,True,506,-55.248802185058594,-53.032569885253906,0
Naomi does investigate those clever people.,Naomi does investigate those clever person.,morphology,determiner_noun_agreement,determiner_noun_agreement_with_adj_irregular_1,True,True,False,True,507,-51.96577453613281,-54.684959411621094,1
Beverly wasn't hiding this blue mouse.,Beverly wasn't hiding this blue mice.,morphology,determiner_noun_agreement,determiner_noun_agreement_with_adj_irregular_1,True,True,False,True,508,-67.50369262695312,-67.33143615722656,0
Every sketch astounds that hidden child.,Every sketch astounds that hidden children.,morphology,determiner_noun_agreement,determiner_noun_agreement_with_adj_irregular_1,True,True,False,True,509,-59.61569595336914,-59.873268127441406,1
Christine talks to that determined child.,Christine talks to that determined children.,morphology,determiner_noun_agreement,determiner_noun_agreement_with_adj_irregular_1,True,True,False,True,510,-48.29010009765625,-47.59754180908203,0
Jesus can hire that smart man.,Jesus can hire that smart men.,morphology,determiner_noun_agreement,determiner_noun_agreement_with_adj_irregular_1,True,True,False,True,511,-40.00193405151367,-41.36272430419922,1
These drivers kiss this exposed alumnus.,These drivers kiss this exposed alumni.,morphology,determiner_noun_agreement,determiner_noun_agreement_with_adj_irregular_1,True,True,False,True,512,-68.82090759277344,-54.51715087890625,0
Diane respected those unemployed alumni.,Diane respected those unemployed alumnus.,morphology,determiner_noun_agreement,determiner_noun_agreement_with_adj_irregular_1,True,True,False,True,513,-61.23365020751953,-76.63478088378906,1
Theodore hasn't argued about these unsure people.,Theodore hasn't argued about these unsure person.,morphology,determiner_noun_agreement,determiner_noun_agreement_with_adj_irregular_1,True,True,False,True,514,-63.03102111816406,-65.99005889892578,1
Nina reveals these red theses.,Nina reveals these red thesis.,morphology,determiner_noun_agreement,determiner_noun_agreement_with_adj_irregular_1,True,True,False,True,515,-65.96978759765625,-58.28730010986328,0
Meredith complains about those popular women.,Meredith complains about those popular woman.,morphology,determiner_noun_agreement,determiner_noun_agreement_with_adj_irregular_1,True,True,False,True,516,-60.94529342651367,-62.62469482421875,1
That government hadn't discussed these good synopses.,That government hadn't discussed these good synopsis.,morphology,determiner_noun_agreement,determiner_noun_agreement_with_adj_irregular_1,True,True,False,True,517,-73.22003936767578,-63.058204650878906,0
Colleen had broken that big tooth.,Colleen had broken that big teeth.,morphology,determiner_noun_agreement,determiner_noun_agreement_with_adj_irregular_1,True,True,False,True,518,-45.58454132080078,-45.12367248535156,0
Catherine was revealing that exposed tooth.,Catherine was revealing that exposed teeth.,morphology,determiner_noun_agreement,determiner_noun_agreement_with_adj_irregular_1,True,True,False,True,519,-62.498924255371094,-61.30697250366211,0
A lot of actresses are skated around these purple oases.,A lot of actresses are skated around these purple oasis.,morphology,determiner_noun_agreement,determiner_noun_agreement_with_adj_irregular_1,True,True,False,True,520,-90.857421875,-88.25370788574219,0
Most pedestrians criticize these bad men.,Most pedestrians criticize these bad man.,morphology,determiner_noun_agreement,determiner_noun_agreement_with_adj_irregular_1,True,True,False,True,521,-48.64336013793945,-50.36800003051758,1
John hadn't scared that clever man.,John hadn't scared that clever men.,morphology,determiner_noun_agreement,determiner_noun_agreement_with_adj_irregular_1,True,True,False,True,522,-44.48238754272461,-45.771629333496094,1
Julia has astounded that nice child.,Julia has astounded that nice children.,morphology,determiner_noun_agreement,determiner_noun_agreement_with_adj_irregular_1,True,True,False,True,523,-48.84968566894531,-48.90705871582031,1
Laurie has dropped by those cheap oases.,Laurie has dropped by those cheap oasis.,morphology,determiner_noun_agreement,determiner_noun_agreement_with_adj_irregular_1,True,True,False,True,524,-70.85448455810547,-68.66343688964844,0
Rose wouldn't bike to those small oases.,Rose wouldn't bike to those small oasis.,morphology,determiner_noun_agreement,determiner_noun_agreement_with_adj_irregular_1,True,True,False,True,525,-61.63478088378906,-58.82009506225586,0
Holly did observe that unconvinced person.,Holly did observe that unconvinced people.,morphology,determiner_noun_agreement,determiner_noun_agreement_with_adj_irregular_1,True,True,False,True,526,-82.24072265625,-79.26905822753906,0
Stacy isn't healing this big child.,Stacy isn't healing this big children.,morphology,determiner_noun_agreement,determiner_noun_agreement_with_adj_irregular_1,True,True,False,True,527,-56.53285217285156,-58.65674591064453,1
Every actor complains about this small thesis.,Every actor complains about this small theses.,morphology,determiner_noun_agreement,determiner_noun_agreement_with_adj_irregular_1,True,True,False,True,528,-50.791351318359375,-59.62566375732422,1
Some teacher dislikes this determined alumnus.,Some teacher dislikes this determined alumni.,morphology,determiner_noun_agreement,determiner_noun_agreement_with_adj_irregular_1,True,True,False,True,529,-83.51734161376953,-69.21037292480469,0
This driver remembers that scared woman.,This driver remembers that scared women.,morphology,determiner_noun_agreement,determiner_noun_agreement_with_adj_irregular_1,True,True,False,True,530,-42.15819549560547,-42.71836853027344,1
Thomas hadn't aggravated that fast man.,Thomas hadn't aggravated that fast men.,morphology,determiner_noun_agreement,determiner_noun_agreement_with_adj_irregular_1,True,True,False,True,531,-46.43212890625,-47.05982971191406,1
Tracy messed up those orange feet.,Tracy messed up those orange foot.,morphology,determiner_noun_agreement,determiner_noun_agreement_with_adj_irregular_1,True,True,False,True,532,-45.990257263183594,-48.04219055175781,1
Matt hasn't bothered those employed men.,Matt hasn't bothered those employed man.,morphology,determiner_noun_agreement,determiner_noun_agreement_with_adj_irregular_1,True,True,False,True,533,-46.69740295410156,-47.93414306640625,1
Sharon isn't criticizing those standing children.,Sharon isn't criticizing those standing child.,morphology,determiner_noun_agreement,determiner_noun_agreement_with_adj_irregular_1,True,True,False,True,534,-55.99837112426758,-55.46580505371094,0
Noah admired this hard louse.,Noah admired this hard lice.,morphology,determiner_noun_agreement,determiner_noun_agreement_with_adj_irregular_1,True,True,False,True,535,-57.7073974609375,-58.44585418701172,1
The popsicle confuses this concealed child.,The popsicle confuses this concealed children.,morphology,determiner_noun_agreement,determiner_noun_agreement_with_adj_irregular_1,True,True,False,True,536,-75.8995590209961,-77.01779174804688,1
That apple worried those important people.,That apple worried those important person.,morphology,determiner_noun_agreement,determiner_noun_agreement_with_adj_irregular_1,True,True,False,True,537,-49.28443145751953,-51.26839065551758,1
Robert couldn't like those old feet.,Robert couldn't like those old foot.,morphology,determiner_noun_agreement,determiner_noun_agreement_with_adj_irregular_1,True,True,False,True,538,-35.386558532714844,-37.38629150390625,1
All legislatures help those lucky children.,All legislatures help those lucky child.,morphology,determiner_noun_agreement,determiner_noun_agreement_with_adj_irregular_1,True,True,False,True,539,-47.85140609741211,-48.4698600769043,1
This spinach wasn't scaring that exposed child.,This spinach wasn't scaring that exposed children.,morphology,determiner_noun_agreement,determiner_noun_agreement_with_adj_irregular_1,True,True,False,True,540,-63.95381546020508,-63.985496520996094,1
The teenager returned to those black oases.,The teenager returned to those black oasis.,morphology,determiner_noun_agreement,determiner_noun_agreement_with_adj_irregular_1,True,True,False,True,541,-54.791446685791016,-51.57965850830078,0
Jill is hiring this small man.,Jill is hiring this small men.,morphology,determiner_noun_agreement,determiner_noun_agreement_with_adj_irregular_1,True,True,False,True,542,-55.003196716308594,-56.72187042236328,1
Jeffrey hasn't watched those clever alumni.,Jeffrey hasn't watched those clever alumnus.,morphology,determiner_noun_agreement,determiner_noun_agreement_with_adj_irregular_1,True,True,False,True,543,-56.866844177246094,-72.6387939453125,1
Danielle helps that happy person.,Danielle helps that happy people.,morphology,determiner_noun_agreement,determiner_noun_agreement_with_adj_irregular_1,True,True,False,True,544,-41.253265380859375,-42.26011276245117,1
The Borgias escape from that troubled woman.,The Borgias escape from that troubled women.,morphology,determiner_noun_agreement,determiner_noun_agreement_with_adj_irregular_1,True,True,False,True,545,-71.84613037109375,-70.29954528808594,0
The Borgias wouldn't break that smooth tooth.,The Borgias wouldn't break that smooth teeth.,morphology,determiner_noun_agreement,determiner_noun_agreement_with_adj_irregular_1,True,True,False,True,546,-62.706634521484375,-60.75650405883789,0
Most waiters conceal those smart men.,Most waiters conceal those smart man.,morphology,determiner_noun_agreement,determiner_noun_agreement_with_adj_irregular_1,True,True,False,True,547,-59.62514114379883,-61.710670471191406,1
Kathleen couldn't talk about these good analyses.,Kathleen couldn't talk about these good analysis.,morphology,determiner_noun_agreement,determiner_noun_agreement_with_adj_irregular_1,True,True,False,True,548,-67.69525146484375,-62.84453201293945,0
Veronica hadn't noticed those lost lice.,Veronica hadn't noticed those lost louse.,morphology,determiner_noun_agreement,determiner_noun_agreement_with_adj_irregular_1,True,True,False,True,549,-57.035560607910156,-55.935630798339844,0
Rachel had found those hard cacti.,Rachel had found those hard cactus.,morphology,determiner_noun_agreement,determiner_noun_agreement_with_adj_irregular_1,True,True,False,True,550,-55.652557373046875,-47.88874816894531,0
Denise sounds like that confident person.,Denise sounds like that confident people.,morphology,determiner_noun_agreement,determiner_noun_agreement_with_adj_irregular_1,True,True,False,True,551,-41.61521530151367,-40.39513397216797,0
Many mouths stunned this nice person.,Many mouths stunned this nice people.,morphology,determiner_noun_agreement,determiner_noun_agreement_with_adj_irregular_1,True,True,False,True,552,-49.25205612182617,-49.814205169677734,1
Most adults love these content women.,Most adults love these content woman.,morphology,determiner_noun_agreement,determiner_noun_agreement_with_adj_irregular_1,True,True,False,True,553,-42.12348175048828,-44.25431823730469,1
Donald is hurting these unemployed people.,Donald is hurting these unemployed person.,morphology,determiner_noun_agreement,determiner_noun_agreement_with_adj_irregular_1,True,True,False,True,554,-37.494449615478516,-41.48863220214844,1
Those students reference those smart people.,Those students reference those smart person.,morphology,determiner_noun_agreement,determiner_noun_agreement_with_adj_irregular_1,True,True,False,True,555,-45.92303466796875,-47.427276611328125,1
Jerry shouldn't listen to those serious alumni.,Jerry shouldn't listen to those serious alumnus.,morphology,determiner_noun_agreement,determiner_noun_agreement_with_adj_irregular_1,True,True,False,True,556,-45.032711029052734,-60.56291961669922,1
Many dancers skate around these smooth oases.,Many dancers skate around these smooth oasis.,morphology,determiner_noun_agreement,determiner_noun_agreement_with_adj_irregular_1,True,True,False,True,557,-68.93313598632812,-66.52668762207031,0
Judy liked this determined man.,Judy liked this determined men.,morphology,determiner_noun_agreement,determiner_noun_agreement_with_adj_irregular_1,True,True,False,True,558,-42.041465759277344,-43.36570739746094,1
Dennis hadn't thought about those hidden mice.,Dennis hadn't thought about those hidden mouse.,morphology,determiner_noun_agreement,determiner_noun_agreement_with_adj_irregular_1,True,True,False,True,559,-60.9984016418457,-62.78759765625,1
