sentence_good,sentence_bad,field,linguistics_term,UID,simple_LM_method,one_prefix_method,two_prefix_method,lexically_identical,pair_id,good_prob,bad_prob,correct
All drivers were certain to cooperate.,All drivers were easy to cooperate.,syntax_semantics,control_raising,tough_vs_raising_2,True,False,False,False,709,-40.94640350341797,-35.38258361816406,0
Christina's oncologists were unlikely to hope to depart.,Christina's oncologists were enjoyable to hope to depart.,syntax_semantics,control_raising,tough_vs_raising_2,True,False,False,False,710,-89.4902572631836,-90.40907287597656,1
Wayne wasn't unlikely to like that ice.,Wayne wasn't pleasant to like that ice.,syntax_semantics,control_raising,tough_vs_raising_2,True,False,False,False,711,-58.700077056884766,-57.609169006347656,0
Derek's sister isn't about to complain about all customers.,Derek's sister isn't tough to complain about all customers.,syntax_semantics,control_raising,tough_vs_raising_2,True,False,False,False,712,-69.48470306396484,-70.47425842285156,1
A restaurant isn't bound to impress Lori.,A restaurant isn't exciting to impress Lori.,syntax_semantics,control_raising,tough_vs_raising_2,True,False,False,False,713,-63.339378356933594,-66.77372741699219,1
Many grandfathers of actresses are unlikely to reply.,Many grandfathers of actresses are irritating to reply.,syntax_semantics,control_raising,tough_vs_raising_2,True,False,False,False,714,-68.94956970214844,-69.97588348388672,1
A grandfather of Noah was bound to discover every shirt.,A grandfather of Noah was fun to discover every shirt.,syntax_semantics,control_raising,tough_vs_raising_2,True,False,False,False,715,-80.74713134765625,-83.10615539550781,1
Some man isn't certain to hug Edward.,Some man isn't boring to hug Edward.,syntax_semantics,control_raising,tough_vs_raising_2,True,False,False,False,716,-56.88496398925781,-55.73543167114258,0
Peter was certain to learn who shocks Susan.,Peter was fun to learn who shocks Susan.,syntax_semantics,control_raising,tough_vs_raising_2,True,False,False,False,717,-61.455230712890625,-56.517242431640625,0
The Lutherans are apt to care for Kimberley.,The Lutherans are annoying to care for Kimberley.,syntax_semantics,control_raising,tough_vs_raising_2,True,False,False,False,718,-72.96669006347656,-74.5254135131836,1
Debra was about to conceal Paul.,Debra was enjoyable to conceal Paul.,syntax_semantics,control_raising,tough_vs_raising_2,True,False,False,False,719,-46.2239990234375,-55.39406967163086,1
Rebecca is bound to sound like some senator.,Rebecca is hard to sound like some senator.,syntax_semantics,control_raising,tough_vs_raising_2,True,False,False,False,720,-51.247581481933594,-48.37038040161133,0
Most patients' electrician is certain to oblige Carolyn to drop by the cafes.,Most patients' electrician is easy to oblige Carolyn to drop by the cafes.,syntax_semantics,control_raising,tough_vs_raising_2,True,False,False,False,721,-127.16718292236328,-123.48639678955078,0
Some waiters weren't sure to disagree.,Some waiters weren't boring to disagree.,syntax_semantics,control_raising,tough_vs_raising_2,True,False,False,False,722,-52.28214645385742,-55.894256591796875,1
Ronald's ex-wives aren't unlikely to bother to react.,Ronald's ex-wives aren't fun to bother to react.,syntax_semantics,control_raising,tough_vs_raising_2,True,False,False,False,723,-78.3502426147461,-74.78557586669922,0
Marla is certain to hire Teresa.,Marla is easy to hire Teresa.,syntax_semantics,control_raising,tough_vs_raising_2,True,False,False,False,724,-52.37424850463867,-44.0245361328125,0
Elizabeth isn't unlikely to like to talk to Jennifer.,Elizabeth isn't unpleasant to like to talk to Jennifer.,syntax_semantics,control_raising,tough_vs_raising_2,True,False,False,False,725,-54.204933166503906,-55.069114685058594,1
Those drivers' hairdresser was apt to expect Tonya to wave.,Those drivers' hairdresser was irritating to expect Tonya to wave.,syntax_semantics,control_raising,tough_vs_raising_2,True,False,False,False,726,-107.65516662597656,-109.4424819946289,1
These grandfathers of Carolyn were sure to cry.,These grandfathers of Carolyn were boring to cry.,syntax_semantics,control_raising,tough_vs_raising_2,True,False,False,False,727,-63.74491882324219,-69.02497863769531,1
Lisa isn't unlikely to turn out to learn.,Lisa isn't irritating to turn out to learn.,syntax_semantics,control_raising,tough_vs_raising_2,True,False,False,False,728,-46.034751892089844,-46.711639404296875,1
Deanna isn't soon to know who concealed Stacy.,Deanna isn't boring to know who concealed Stacy.,syntax_semantics,control_raising,tough_vs_raising_2,True,False,False,False,729,-79.08858489990234,-77.90141296386719,0
Susan is soon to plan to escape.,Susan is boring to plan to escape.,syntax_semantics,control_raising,tough_vs_raising_2,True,False,False,False,730,-40.14284896850586,-39.387451171875,0
Todd is certain to dislike Renee.,Todd is annoying to dislike Renee.,syntax_semantics,control_raising,tough_vs_raising_2,True,False,False,False,731,-51.8769416809082,-50.101356506347656,0
Douglas's ex-wives were apt to predict those drivers to surrender.,Douglas's ex-wives were irritating to predict those drivers to surrender.,syntax_semantics,control_raising,tough_vs_raising_2,True,False,False,False,732,-91.82473754882812,-93.06108093261719,1
Most men were likely to explain Larry couldn't nod.,Most men were unpleasant to explain Larry couldn't nod.,syntax_semantics,control_raising,tough_vs_raising_2,True,False,False,False,733,-68.658447265625,-76.36184692382812,1
Many schools were certain to cope.,Many schools were enjoyable to cope.,syntax_semantics,control_raising,tough_vs_raising_2,True,False,False,False,734,-34.80392074584961,-36.827919006347656,1
Lucille was sure to need to respect Spain.,Lucille was irritating to need to respect Spain.,syntax_semantics,control_raising,tough_vs_raising_2,True,False,False,False,735,-53.56159210205078,-57.985252380371094,1
Donna was bound to escape from these dancers.,Donna was exciting to escape from these dancers.,syntax_semantics,control_raising,tough_vs_raising_2,True,False,False,False,736,-56.09532928466797,-59.04118347167969,1
Keith was apt to find out who is getting a job.,Keith was tough to find out who is getting a job.,syntax_semantics,control_raising,tough_vs_raising_2,True,False,False,False,737,-46.67109298706055,-43.301177978515625,0
Katherine isn't apt to try to scratch.,Katherine isn't annoying to try to scratch.,syntax_semantics,control_raising,tough_vs_raising_2,True,False,False,False,738,-54.69268035888672,-54.53929138183594,0
Sara's dentists weren't unlikely to negotiate.,Sara's dentists weren't easy to negotiate.,syntax_semantics,control_raising,tough_vs_raising_2,True,False,False,False,739,-78.04641723632812,-70.42903137207031,0
Christine's partner was bound to annoy the museum.,Christine's partner was pleasant to annoy the museum.,syntax_semantics,control_raising,tough_vs_raising_2,True,False,False,False,740,-59.04890441894531,-63.36178970336914,1
The people were likely to remember Anne.,The people were exciting to remember Anne.,syntax_semantics,control_raising,tough_vs_raising_2,True,False,False,False,741,-42.539520263671875,-46.95465850830078,1
Michael is about to worry Alice.,Michael is boring to worry Alice.,syntax_semantics,control_raising,tough_vs_raising_2,True,False,False,False,742,-36.48487854003906,-41.662567138671875,1
Michelle was likely to find universities to have eyes.,Michelle was boring to find universities to have eyes.,syntax_semantics,control_raising,tough_vs_raising_2,True,False,False,False,743,-51.84752655029297,-56.020023345947266,1
Noah was unlikely to find Linda.,Noah was tough to find Linda.,syntax_semantics,control_raising,tough_vs_raising_2,True,False,False,False,744,-54.74634552001953,-49.577476501464844,0
The people aren't likely to long to alarm some people.,The people aren't tough to long to alarm some people.,syntax_semantics,control_raising,tough_vs_raising_2,True,False,False,False,745,-61.16132354736328,-60.947261810302734,0
Those analyses weren't apt to irritate Catherine.,Those analyses weren't hard work to irritate Catherine.,syntax_semantics,control_raising,tough_vs_raising_2,True,False,False,False,746,-66.67353820800781,-70.19960021972656,1
Alice was about to pressure Kristin to astound most associations.,Alice was unpleasant to pressure Kristin to astound most associations.,syntax_semantics,control_raising,tough_vs_raising_2,True,False,False,False,747,-89.35035705566406,-99.07000732421875,1
That driver's piano teachers weren't about to figure out what confuses Janet.,That driver's piano teachers weren't fun to figure out what confuses Janet.,syntax_semantics,control_raising,tough_vs_raising_2,True,False,False,False,748,-101.794921875,-105.21194458007812,1
Daniel wasn't about to discover most skirts to distract Theresa.,Daniel wasn't fun to discover most skirts to distract Theresa.,syntax_semantics,control_raising,tough_vs_raising_2,True,False,False,False,749,-79.5550308227539,-82.2959976196289,1
Grace is soon to question Lissa.,Grace is fun to question Lissa.,syntax_semantics,control_raising,tough_vs_raising_2,True,False,False,False,750,-53.82841873168945,-50.60431671142578,0
Karla is bound to bring the cilantro.,Karla is exciting to bring the cilantro.,syntax_semantics,control_raising,tough_vs_raising_2,True,False,False,False,751,-54.026756286621094,-56.8157958984375,1
Daniel was likely to encourage Walter to work with most men.,Daniel was unpleasant to encourage Walter to work with most men.,syntax_semantics,control_raising,tough_vs_raising_2,True,False,False,False,752,-66.13152313232422,-73.66057586669922,1
That adult's nephew was unlikely to believe Richard to dislike Matt.,That adult's nephew was pleasant to believe Richard to dislike Matt.,syntax_semantics,control_raising,tough_vs_raising_2,True,False,False,False,753,-102.30975341796875,-100.77493286132812,0
Sherry is apt to encourage some patients to disagree.,Sherry is exciting to encourage some patients to disagree.,syntax_semantics,control_raising,tough_vs_raising_2,True,False,False,False,754,-74.06183624267578,-74.0093994140625,0
This driver wasn't soon to prompt an analysis to worry Heidi.,This driver wasn't easy to prompt an analysis to worry Heidi.,syntax_semantics,control_raising,tough_vs_raising_2,True,False,False,False,755,-87.12117767333984,-80.77749633789062,0
All ladies aren't unlikely to anticipate Brett to forfeit.,All ladies aren't pleasant to anticipate Brett to forfeit.,syntax_semantics,control_raising,tough_vs_raising_2,True,False,False,False,756,-79.43174743652344,-78.00394439697266,0
Naomi was certain to admire gates.,Naomi was hard work to admire gates.,syntax_semantics,control_raising,tough_vs_raising_2,True,False,False,False,757,-56.15704345703125,-58.19244384765625,1
Jane's senator is apt to know who hasn't concealed Lori.,Jane's senator is pleasant to know who hasn't concealed Lori.,syntax_semantics,control_raising,tough_vs_raising_2,True,False,False,False,758,-81.62332916259766,-81.96357727050781,1
That brochure about Jesus isn't apt to bother Noah.,That brochure about Jesus isn't irritating to bother Noah.,syntax_semantics,control_raising,tough_vs_raising_2,True,False,False,False,759,-90.09223937988281,-89.8907241821289,0
Ann's dermatologist was apt to buy those planes.,Ann's dermatologist was pleasant to buy those planes.,syntax_semantics,control_raising,tough_vs_raising_2,True,False,False,False,760,-69.54563903808594,-69.9261703491211,1
Some people weren't soon to chuckle.,Some people weren't exciting to chuckle.,syntax_semantics,control_raising,tough_vs_raising_2,True,False,False,False,761,-43.086551666259766,-41.70803451538086,0
Stephanie wasn't likely to mess up every cup.,Stephanie wasn't tough to mess up every cup.,syntax_semantics,control_raising,tough_vs_raising_2,True,False,False,False,762,-57.37635040283203,-58.92451858520508,1
Adam was likely to doubt Larry was commissioning Jill to exist.,Adam was enjoyable to doubt Larry was commissioning Jill to exist.,syntax_semantics,control_raising,tough_vs_raising_2,True,False,False,False,763,-89.98654174804688,-97.42120361328125,1
Melinda isn't likely to clean a hat.,Melinda isn't interesting to clean a hat.,syntax_semantics,control_raising,tough_vs_raising_2,True,False,False,False,764,-46.971923828125,-48.539615631103516,1
Eric was apt to threaten to see Andrea.,Eric was tough to threaten to see Andrea.,syntax_semantics,control_raising,tough_vs_raising_2,True,False,False,False,765,-55.34600830078125,-50.55259323120117,0
Some men are likely to prove to cry.,Some men are hard work to prove to cry.,syntax_semantics,control_raising,tough_vs_raising_2,True,False,False,False,766,-41.967735290527344,-51.23931121826172,1
A lot of offspring aren't about to sound like many students.,A lot of offspring aren't irritating to sound like many students.,syntax_semantics,control_raising,tough_vs_raising_2,True,False,False,False,767,-73.79651641845703,-77.86383056640625,1
Jill wasn't about to reference Pamela.,Jill wasn't enjoyable to reference Pamela.,syntax_semantics,control_raising,tough_vs_raising_2,True,False,False,False,768,-61.00640106201172,-67.66481018066406,1
Teresa wasn't apt to want to wake up.,Teresa wasn't pleasant to want to wake up.,syntax_semantics,control_raising,tough_vs_raising_2,True,False,False,False,769,-53.657230377197266,-52.9387092590332,0
Colleen's ex-boyfriends weren't apt to testify.,Colleen's ex-boyfriends weren't irritating to testify.,syntax_semantics,control_raising,tough_vs_raising_2,True,False,False,False,770,-83.24716186523438,-83.17901611328125,0
Nina isn't about to prod Brian's mentees to waste away.,Nina isn't pleasant to prod Brian's mentees to waste away.,syntax_semantics,control_raising,tough_vs_raising_2,True,False,False,False,771,-108.52117919921875,-114.69204711914062,1
Adam isn't bound to threaten to complain.,Adam isn't enjoyable to threaten to complain.,syntax_semantics,control_raising,tough_vs_raising_2,True,False,False,False,772,-44.395668029785156,-50.313697814941406,1
Carla isn't about to know Samuel.,Carla isn't enjoyable to know Samuel.,syntax_semantics,control_raising,tough_vs_raising_2,True,False,False,False,773,-47.07127380371094,-55.538902282714844,1
Most peppers were likely to rot.,Most peppers were unpleasant to rot.,syntax_semantics,control_raising,tough_vs_raising_2,True,False,False,False,774,-41.72795104980469,-47.38527297973633,1
Joel is likely to escape from Randolf.,Joel is hard to escape from Randolf.,syntax_semantics,control_raising,tough_vs_raising_2,True,False,False,False,775,-60.59343338012695,-57.0731201171875,0
All grandfathers of Kevin were bound to hide this bicycle.,All grandfathers of Kevin were annoying to hide this bicycle.,syntax_semantics,control_raising,tough_vs_raising_2,True,False,False,False,776,-79.81851959228516,-83.9131851196289,1
Some niece of Veronica isn't sure to watch Rodney.,Some niece of Veronica isn't hard work to watch Rodney.,syntax_semantics,control_raising,tough_vs_raising_2,True,False,False,False,777,-67.99236297607422,-75.07020568847656,1
Liam's dermatologist wasn't certain to threaten to tour some restaurants.,Liam's dermatologist wasn't pleasant to threaten to tour some restaurants.,syntax_semantics,control_raising,tough_vs_raising_2,True,False,False,False,778,-104.22210693359375,-103.43701171875,0
That drawing was soon to shock Judy.,That drawing was hard to shock Judy.,syntax_semantics,control_raising,tough_vs_raising_2,True,False,False,False,779,-59.628021240234375,-52.8422737121582,0
Marcus's ex-boyfriends are sure to smile.,Marcus's ex-boyfriends are irritating to smile.,syntax_semantics,control_raising,tough_vs_raising_2,True,False,False,False,780,-61.43125915527344,-64.85103607177734,1
Vincent's employees aren't soon to cope.,Vincent's employees aren't hard work to cope.,syntax_semantics,control_raising,tough_vs_raising_2,True,False,False,False,781,-67.63195037841797,-68.71563720703125,1
Tammy isn't about to talk to George.,Tammy isn't interesting to talk to George.,syntax_semantics,control_raising,tough_vs_raising_2,True,False,False,False,782,-45.41190719604492,-47.6861572265625,1
Some nuclei weren't unlikely to resemble most paintings.,Some nuclei weren't pleasant to resemble most paintings.,syntax_semantics,control_raising,tough_vs_raising_2,True,False,False,False,783,-79.69149780273438,-78.17889404296875,0
Brenda isn't about to try to argue.,Brenda isn't pleasant to try to argue.,syntax_semantics,control_raising,tough_vs_raising_2,True,False,False,False,784,-36.00358200073242,-40.72441864013672,1
Michelle's bosses were certain to clash.,Michelle's bosses were enjoyable to clash.,syntax_semantics,control_raising,tough_vs_raising_2,True,False,False,False,785,-47.284175872802734,-50.014495849609375,1
Steven isn't about to expect all men to complain about Melanie.,Steven isn't annoying to expect all men to complain about Melanie.,syntax_semantics,control_raising,tough_vs_raising_2,True,False,False,False,786,-69.62312316894531,-73.81031036376953,1
Tina was sure to work with Tracy.,Tina was pleasant to work with Tracy.,syntax_semantics,control_raising,tough_vs_raising_2,True,False,False,False,787,-54.58332061767578,-57.12042236328125,1
Victoria was soon to intend to dislike the waiters.,Victoria was easy to intend to dislike the waiters.,syntax_semantics,control_raising,tough_vs_raising_2,True,False,False,False,788,-64.19001770019531,-59.325618743896484,0
Becca is unlikely to go fishing.,Becca is fun to go fishing.,syntax_semantics,control_raising,tough_vs_raising_2,True,False,False,False,789,-35.507354736328125,-31.283369064331055,0
Daniel wasn't likely to wish to perform.,Daniel wasn't unpleasant to wish to perform.,syntax_semantics,control_raising,tough_vs_raising_2,True,False,False,False,790,-43.385459899902344,-50.216548919677734,1
Roger's students aren't apt to forget Carl.,Roger's students aren't tough to forget Carl.,syntax_semantics,control_raising,tough_vs_raising_2,True,False,False,False,791,-57.72952651977539,-55.155555725097656,0
The people aren't sure to investigate Paul.,The people aren't interesting to investigate Paul.,syntax_semantics,control_raising,tough_vs_raising_2,True,False,False,False,792,-43.9257698059082,-47.551002502441406,1
Florence was likely to drive to this closet.,Florence was annoying to drive to this closet.,syntax_semantics,control_raising,tough_vs_raising_2,True,False,False,False,793,-59.659820556640625,-64.70677947998047,1
A grandson of Dawn isn't bound to annoy Amelia.,A grandson of Dawn isn't boring to annoy Amelia.,syntax_semantics,control_raising,tough_vs_raising_2,True,False,False,False,794,-79.37718963623047,-82.89482116699219,1
Denise's fathers were soon to doubt the adult hasn't admired Barbara.,Denise's fathers were difficult to doubt the adult hasn't admired Barbara.,syntax_semantics,control_raising,tough_vs_raising_2,True,False,False,False,795,-100.61077117919922,-96.11904907226562,0
The library is about to confuse a lot of actors.,The library is exciting to confuse a lot of actors.,syntax_semantics,control_raising,tough_vs_raising_2,True,False,False,False,796,-47.43128967285156,-54.645294189453125,1
Jill's brothers aren't soon to litter.,Jill's brothers aren't hard work to litter.,syntax_semantics,control_raising,tough_vs_raising_2,True,False,False,False,797,-67.05523681640625,-69.3565902709961,1
Gregory's lawyers are apt to confer.,Gregory's lawyers are annoying to confer.,syntax_semantics,control_raising,tough_vs_raising_2,True,False,False,False,798,-54.13005828857422,-55.960609436035156,1
Carla was apt to kiss Eva.,Carla was fun to kiss Eva.,syntax_semantics,control_raising,tough_vs_raising_2,True,False,False,False,799,-49.316864013671875,-46.46875762939453,0
Stacy was likely to clean those grocery stores.,Stacy was exciting to clean those grocery stores.,syntax_semantics,control_raising,tough_vs_raising_2,True,False,False,False,800,-59.70718002319336,-62.41905975341797,1
Some boys weren't bound to go fishing.,Some boys weren't tough to go fishing.,syntax_semantics,control_raising,tough_vs_raising_2,True,False,False,False,801,-37.28659439086914,-39.17227554321289,1
Guy wasn't unlikely to run around a museum.,Guy wasn't unpleasant to run around a museum.,syntax_semantics,control_raising,tough_vs_raising_2,True,False,False,False,802,-48.69866180419922,-49.32577896118164,1
The bank wasn't soon to hope to investigate Emily.,The bank wasn't interesting to hope to investigate Emily.,syntax_semantics,control_raising,tough_vs_raising_2,True,False,False,False,803,-68.40199279785156,-64.76564025878906,0
Those children were likely to persuade Peter to scream.,Those children were boring to persuade Peter to scream.,syntax_semantics,control_raising,tough_vs_raising_2,True,False,False,False,804,-55.598392486572266,-59.931884765625,1
Curtis wasn't likely to grin.,Curtis wasn't interesting to grin.,syntax_semantics,control_raising,tough_vs_raising_2,True,False,False,False,805,-58.059425354003906,-58.058250427246094,0
Dennis's mothers are apt to boast.,Dennis's mothers are fun to boast.,syntax_semantics,control_raising,tough_vs_raising_2,True,False,False,False,806,-62.633872985839844,-62.35173416137695,0
The sister of these waiters isn't certain to shock some libraries.,The sister of these waiters isn't interesting to shock some libraries.,syntax_semantics,control_raising,tough_vs_raising_2,True,False,False,False,807,-95.25086212158203,-91.57827758789062,0
Deborah is bound to climb up that mountain.,Deborah is easy to climb up that mountain.,syntax_semantics,control_raising,tough_vs_raising_2,True,False,False,False,808,-49.00641632080078,-45.06005859375,0
Some pedestrian is sure to remember Joseph.,Some pedestrian is irritating to remember Joseph.,syntax_semantics,control_raising,tough_vs_raising_2,True,False,False,False,809,-50.910484313964844,-54.15058898925781,1
A lot of patients' contractors weren't bound to hurt Homer.,A lot of patients' contractors weren't boring to hurt Homer.,syntax_semantics,control_raising,tough_vs_raising_2,True,False,False,False,810,-89.36822509765625,-94.82345581054688,1
All teachers are unlikely to respond.,All teachers are difficult to respond.,syntax_semantics,control_raising,tough_vs_raising_2,True,False,False,False,811,-36.743896484375,-32.565643310546875,0
Maria was sure to prevent Janice from skated around all art galleries.,Maria was hard to prevent Janice from skated around all art galleries.,syntax_semantics,control_raising,tough_vs_raising_2,True,False,False,False,812,-99.783935546875,-97.22920227050781,0
Jeffrey wasn't certain to skate around that high school.,Jeffrey wasn't interesting to skate around that high school.,syntax_semantics,control_raising,tough_vs_raising_2,True,False,False,False,813,-64.68049621582031,-59.58727264404297,0
Emily isn't unlikely to remember Lissa.,Emily isn't interesting to remember Lissa.,syntax_semantics,control_raising,tough_vs_raising_2,True,False,False,False,814,-50.92273712158203,-47.71006774902344,0
Noah isn't bound to drive to most art galleries.,Noah isn't enjoyable to drive to most art galleries.,syntax_semantics,control_raising,tough_vs_raising_2,True,False,False,False,815,-74.74595642089844,-79.54215240478516,1
Some dancers weren't sure to flirt.,Some dancers weren't difficult to flirt.,syntax_semantics,control_raising,tough_vs_raising_2,True,False,False,False,816,-47.92596435546875,-46.780906677246094,0
Denise's podiatrists are likely to consider most guests to debate.,Denise's podiatrists are exciting to consider most guests to debate.,syntax_semantics,control_raising,tough_vs_raising_2,True,False,False,False,817,-105.35787963867188,-109.63421630859375,1
Kristin is apt to leave Naomi.,Kristin is boring to leave Naomi.,syntax_semantics,control_raising,tough_vs_raising_2,True,False,False,False,818,-46.25566101074219,-45.86830139160156,0
That waitress was apt to take that ice.,That waitress was unpleasant to take that ice.,syntax_semantics,control_raising,tough_vs_raising_2,True,False,False,False,819,-53.98771667480469,-55.93828201293945,1
Heather wasn't likely to obligate George's nephew to upset Eric.,Heather wasn't boring to obligate George's nephew to upset Eric.,syntax_semantics,control_raising,tough_vs_raising_2,True,False,False,False,820,-97.1325912475586,-102.77869415283203,1
Most sisters of every boy were unlikely to wonder who begs Joel to notice Janet.,Most sisters of every boy were hard work to wonder who begs Joel to notice Janet.,syntax_semantics,control_raising,tough_vs_raising_2,True,False,False,False,821,-124.06394958496094,-127.66481018066406,1
Lucille isn't certain to bring mushrooms.,Lucille isn't hard work to bring mushrooms.,syntax_semantics,control_raising,tough_vs_raising_2,True,False,False,False,822,-54.570804595947266,-56.59856033325195,1
Suzanne's podiatrist wasn't likely to fix this window.,Suzanne's podiatrist wasn't interesting to fix this window.,syntax_semantics,control_raising,tough_vs_raising_2,True,False,False,False,823,-89.7867431640625,-91.21907806396484,1
Elizabeth is bound to flee from Laurie.,Elizabeth is difficult to flee from Laurie.,syntax_semantics,control_raising,tough_vs_raising_2,True,False,False,False,824,-45.961669921875,-46.675601959228516,1
Beth isn't sure to push Deborah to question some child.,Beth isn't interesting to push Deborah to question some child.,syntax_semantics,control_raising,tough_vs_raising_2,True,False,False,False,825,-90.06892395019531,-91.4823989868164,1
Keith wasn't sure to sigh.,Keith wasn't pleasant to sigh.,syntax_semantics,control_raising,tough_vs_raising_2,True,False,False,False,826,-32.372047424316406,-36.6719856262207,1
A dish isn't likely to disturb every woman.,A dish isn't easy to disturb every woman.,syntax_semantics,control_raising,tough_vs_raising_2,True,False,False,False,827,-64.51754760742188,-60.5931510925293,0
